id,created_at,user,retweets,favorite_count,source,text
342313999729311744,2013-06-05 16:16:32,ChrisVanHollen,0,0,Twitter Web Client,"(2/2) ...Well, Officer Smith's dream is about to come true! #RavensAtTheWH http://t.co/bbFOJRP6c0"
342313864785973248,2013-06-05 16:15:59,ChrisVanHollen,0,0,Twitter Web Client,"I told Cap. Police Ofc. Aaron Smith that if the @Ravens won the Super Bowl, I'd bring him w/me to meet the #RavensAtTheWH. (1/2)"
342311420920201218,2013-06-05 16:06:17,ChrisVanHollen,7,3,Hootsuite,"Time for the House GOP to wake up from their fantasy where their budget is law. We need a REAL federal budget, not an imaginary one."
342295282341511170,2013-06-05 15:02:09,ChrisVanHollen,2,0,Hootsuite,What are you so afraid of? http://t.co/0iOaMUjmXe
342033759442440192,2013-06-04 21:42:57,ChrisVanHollen,14,3,Hootsuite,WH right to threaten to veto bills that fund defense but leave our kids behind. We can support our vets &amp; our kids. http://t.co/OOteGvPXsa
342032582659153920,2013-06-04 21:38:17,ChrisVanHollen,14,1,Hootsuite,House GOP cynically using Rule for veterans spending bill as Trojan Horse to slash kids' education budget by 20% below sequester. Shameful.
341971442214260736,2013-06-04 17:35:20,ChrisVanHollen,4,1,Hootsuite,"GOP attempting to pull wool over the eyes of the American ppl by ""deeming &amp; passing"" their budget.  Anything to avoid compromise."
341955673795461120,2013-06-04 16:32:40,ChrisVanHollen,3,0,Hootsuite,Just met South Carroll HS students on the steps of the Capitol. Beautiful day to visit the Hill. Go Cavaliers! http://t.co/aalU7U5t3K
341677114531119105,2013-06-03 22:05:46,ChrisVanHollen,15,5,Hootsuite,"Mr. Speaker, enough of these back room maneuvers. Let's debate the House/Senate budgets in a public, televised conference committee."
341669041699700736,2013-06-03 21:33:42,ChrisVanHollen,12,4,Hootsuite,"Rather than work together on a conference budget, GOP just going to pretend their austere budget plan is law. http://t.co/mLsqVstGhG"
339825148632903680,2013-05-29 19:26:43,ChrisVanHollen,11,2,Hootsuite,"GOP still protecting tax breaks for wealthy, even as kids of our svc men&amp;women lose 5 school days due to sequester. http://t.co/zCsWeWFJgO"
339821532132016128,2013-05-29 19:12:21,ChrisVanHollen,14,1,Hootsuite,CBO: the top 1% receive as much from tax expenditures in total dollars as the bottom 40%. http://t.co/290JHK2NbH
339807024055459841,2013-05-29 18:14:42,ChrisVanHollen,25,4,Hootsuite,Just-released CBO report shows tax breaks heavily skewed in favor of top 1% -- http://t.co/UWI4ErFxvW
339729184391831552,2013-05-29 13:05:24,ChrisVanHollen,16,3,Hootsuite,Outrageous that the GOP is sitting on their hands re:sequester/budget conf while kids of svc men&amp;women are forced to lose 5 days of school.
339503498796355585,2013-05-28 22:08:36,ChrisVanHollen,16,5,Hootsuite,GOP inaction on sequester/budget will cost children @ Ft. Bragg 5 days of school due to teacher furloughs. Unreal. http://t.co/p5bvGfNBnY
339469264044052480,2013-05-28 19:52:34,ChrisVanHollen,17,5,Twitter Web Client,".@SpeakerBoehner, #WheresTheBudget? http://t.co/r0FAfmWvhe"
338003559088017409,2013-05-24 18:48:22,ChrisVanHollen,3,0,Hootsuite,"IMO, #IRS shouldn't be in the business of deciding which groups are primarily political &amp; which aren't - http://t.co/1IJvC7gVP9"
337977871505166337,2013-05-24 17:06:18,ChrisVanHollen,12,1,Hootsuite,"Poll: majority of Americans still don't like the sequester - http://t.co/uo6dWzBmKH Unfortunately, House GOP still seems to be enamored."
337238838902661121,2013-05-22 16:09:39,ChrisVanHollen,48,10,Twitter Web Client,".@SpeakerBoehner, #WheresTheBudget? http://t.co/5YKb2PsUWV"
337222681374105600,2013-05-22 15:05:27,ChrisVanHollen,11,2,Hootsuite,Prominent GOPers join the growing chorus calling for an end to the hypocrisy &amp; to move fwd w/ budget conference - http://t.co/xDtLMq4qJD
336856449240158208,2013-05-21 14:50:10,ChrisVanHollen,9,4,Hootsuite,Just introduced another bill to #StopTheSequester (GOP still has yet to offer an alternative this Congress.)
336594344779870208,2013-05-20 21:28:40,ChrisVanHollen,3,0,Hootsuite,"Thinking about all those affected by the severe weather in the Midwest today — please, stay safe."
336561141432074241,2013-05-20 19:16:43,ChrisVanHollen,3,0,Hootsuite,DC should be able to walk &amp; chew gum. See my @cspan interview on the (still serious) fiscal issues facing us – http://t.co/B7hwZMjwWT
336173090293821440,2013-05-19 17:34:45,ChrisVanHollen,32,9,Twitter for iPhone,Why is Senator McConnell so afraid of transparency and disclosure?
336173011080192000,2013-05-19 17:34:26,ChrisVanHollen,61,9,Twitter for iPhone,"McConnell attacked DISCLOSE on @meetthepress, tried to manipulate IRS scandal to block voters from knowing who bankrolls political TV ads"
335403186842116096,2013-05-17 14:35:25,ChrisVanHollen,1,0,Hootsuite,RT @dnewhauser: I'll be interviewing Rep Chris Van Hollen for CSPAN newsmakers soon. What should I ask him?
335164078064558080,2013-05-16 22:45:17,ChrisVanHollen,28,5,Hootsuite,"Number of times GOP has ""repealed"" #Obamacare: 37. Number of Members @SpeakerBoehner has appointed to budget conference cmte: 0."
335146285390778368,2013-05-16 21:34:35,ChrisVanHollen,4,1,Hootsuite,IRS must enforce the law evenly. IG said they gave too much scrutiny to some 501(c)(4)s but not enough to others. http://t.co/ArRhs8c7Ry
335145103305883649,2013-05-16 21:29:53,ChrisVanHollen,23,7,Hootsuite,Quality. Affordability. Accountability. #ObamaCareInThreeWords
335091947159044097,2013-05-16 17:58:40,ChrisVanHollen,6,2,Twitter Web Client,House GOP voting today to throw their *own budget* out of balance. #whoops http://t.co/v396YGOHfO
335063387312648194,2013-05-16 16:05:11,ChrisVanHollen,7,0,Hootsuite,Sat down w/ @AlMonitor this wk to discuss the situation in #Syria and the broader implications of US involvement - http://t.co/0j8Hm1gVMv
335047630084255744,2013-05-16 15:02:34,ChrisVanHollen,31,3,Hootsuite,"30 days past deadline &amp; still no conference budget–voting instead on another ACA repeal. Clearly, jobs &amp; econ are not priorities for GOP"
332913220241215488,2013-05-10 17:41:11,ChrisVanHollen,12,1,Hootsuite,"As Congress grants sequester reprieves to powerful groups, prgms like Head Start are left to wither on the vine. http://t.co/TkN4EwLn4x"
332885331399569408,2013-05-10 15:50:22,ChrisVanHollen,3,0,Hootsuite,"Are you listening, GOP leadership? MT @politico: Some Republicans are antsy to start the budget conference: http://t.co/11ztlGkqZ7"
332877080696061952,2013-05-10 15:17:35,ChrisVanHollen,48,0,Hootsuite,"RT @morningmoneyben: Wow. McCain calls GOP blocking budget conference ""incomprehensible,"" via @GingerGibson http://t.co/GJ4wGtvJr7"
332861729736384512,2013-05-10 14:16:35,ChrisVanHollen,4,1,Hootsuite,What about dealing w/the huge jobs deficit? MT @GOPLeader: I am scheduling a vote for next week on the full repeal of #Obamacare
332557065929244673,2013-05-09 18:05:57,ChrisVanHollen,15,3,Hootsuite,What about my bill to #StopTheSequester? MT @GOPLeader: I am scheduling a vote for next week on the full repeal of #Obamacare
332530624017616896,2013-05-09 16:20:53,ChrisVanHollen,9,2,Hootsuite,"Yesterday @PattyMurray tried for the 4th time to move the budget process fwd and appoint conferees. GOP said ""no."""
332503442868281345,2013-05-09 14:32:53,ChrisVanHollen,5,1,Twitter Web Client,GOP plan wld default on our debt by paying some bills but not others– something no household could afford to do. http://t.co/4w7V8X3WOc
332489557142552576,2013-05-09 13:37:42,ChrisVanHollen,15,4,Hootsuite,Default is not a strategy MT @businessinsider: John Boehner Is Getting Slammed For His New Debt Ceiling Strategy http://t.co/ecl98Pl76J
332224773402804224,2013-05-08 20:05:33,ChrisVanHollen,57,9,Twitter Web Client,"Voting NO on the GOP's ""More Work, Less Pay"" Act -- here's how it will be #MakingLifeWorse for you: http://t.co/JKA4V8zZji"
332139486366531585,2013-05-08 14:26:39,ChrisVanHollen,16,2,Hootsuite,.@SpeakerBoehner admits to @PeterCCook: GOP plan is to #PayChinaFirst before paying our troops. http://t.co/FdfJyoxBGb
331793567481741313,2013-05-07 15:32:05,ChrisVanHollen,6,1,Hootsuite,I'll be speaking at Peterson Fdn's 2013 #FiscalSummit shortly -- catch the live stream here:  http://t.co/BZZFKmiNff
331770690254544896,2013-05-07 14:01:11,ChrisVanHollen,4,0,Hootsuite,"GOP's debt plan, in a nutshell: pay China first. http://t.co/bROiuJmxzE"
330342612508745728,2013-05-03 15:26:30,ChrisVanHollen,3,3,Hootsuite,Recorded a short msg to our troops in recognition of #MilitaryAppreciationMonth. Thank you for your service! http://t.co/MZWqD0lJd6
329747659466350593,2013-05-02 00:02:23,ChrisVanHollen,3,1,Hootsuite,"About to talk sequester, FAA fix and more with @chrislhayes on @allinwithchris -- tune in! #inners"
329696608465854465,2013-05-01 20:39:31,ChrisVanHollen,44,9,Hootsuite,We shld replace the entire sequester – not just the cuts that inconvenience powerful groups &amp; Members of Congress. http://t.co/ta6r5zYqrr
327862214906236928,2013-04-26 19:10:18,ChrisVanHollen,38,14,Hootsuite,I'm a NO vote on this band-aid flight delay patch. Congress should stay put til we have a budget &amp; #StopTheSequester. http://t.co/C1hJ25CaMr
327830585143881728,2013-04-26 17:04:36,ChrisVanHollen,86,20,Hootsuite,"Anyone else find it odd the House is voting to ease flight delays today, right before they head to the airport &amp; fly home for a week?"
327531392927936513,2013-04-25 21:15:43,ChrisVanHollen,8,0,Hootsuite,".@SpeakerBoehner, it's been 10 days since the conference report deadline passed.  #WheresTheBudget? http://t.co/Mc7p3u9PpD"
327512710705205248,2013-04-25 20:01:29,ChrisVanHollen,0,2,Twitter Web Client,"Meet Sachi, an 11yr old constituent who's shadowing me today. Always great to see young ppl interested in public svc! http://t.co/hN87NpCyoZ"
327489239921082368,2013-04-25 18:28:13,ChrisVanHollen,9,0,Hootsuite,"RT @JansingCo: ""I've tried four times to get a vote"" @ChrisVanHollen to replace sequester... let's treat disease, not just the probs that p…"
327484741202894848,2013-04-25 18:10:21,ChrisVanHollen,20,10,Hootsuite,I'm co-sponsoring the House version of Manchin-Toomey background checks bill. This fight isn't over -- it's only just begun.
327180748677324800,2013-04-24 22:02:23,ChrisVanHollen,3,0,Hootsuite,Headed over to @Gallaudet to co-coach @ussoccerfdn's Innaugural Capital Soccer Classic w/@LouiseSlaughter -- should be a good game!
327150667821092866,2013-04-24 20:02:52,ChrisVanHollen,2,0,Instagram,Spoke at event honoring @AnneFrankCenter today along w/Dutch Caucus co-chair @RepHuizenga http://t.co/kfpRs5f1za
326810751836753921,2013-04-23 21:32:09,ChrisVanHollen,11,2,Hootsuite,Just intro'd bill urging @SpeakerBoehner to move fwd w/ the budget process. America deserves a budget! http://t.co/C2y4wIAjhu
326783899940306945,2013-04-23 19:45:27,ChrisVanHollen,8,1,Hootsuite,ICYMI: my thoughts on the political cowardice displayed by the Senate last week re: background checks -- http://t.co/YRezG8eyXx
326421919324848128,2013-04-22 19:47:04,ChrisVanHollen,8,1,Hootsuite,"Happy Earth Day! Celebrate by visting one of MD's many Nat'l parks, which offer free admission thru Friday: http://t.co/WOSZB3lJko"
326396668721385472,2013-04-22 18:06:44,ChrisVanHollen,12,4,Hootsuite,"Disturbed to hear some in Senate are using events in Boston to oppose immig. reform that wld benefit so many Americans, current &amp; future"
325343505725665280,2013-04-19 20:21:51,ChrisVanHollen,9,3,Hootsuite,"Despite cries for ""regular order"" GOP has slow-walked the budget right past the statutory deadline of April 15. http://t.co/OsLFIEIaFJ"
324994728250732546,2013-04-18 21:15:55,ChrisVanHollen,8,0,Hootsuite,"If GOP believes their budget is best way fwd, why not go to conference cmte today? Make your case in public– not behind closed doors"
324907796388794370,2013-04-18 15:30:29,ChrisVanHollen,4,2,Hootsuite,"GOP has long called for gov openness/transparency–yet now that it's time for budget conference cmte, they prefer closed-door mtgs"
324649948350140416,2013-04-17 22:25:54,ChrisVanHollen,3,0,Hootsuite,"Sent letter to @SpeakerBoehner urging him to appoint budget conferees, despite having missed the statutory deadline http://t.co/OsLFIEIaFJ"
324613852132159488,2013-04-17 20:02:28,ChrisVanHollen,27,6,Hootsuite,Senate should pass bill req'ing universal bg check. It's a crucial 1st step twd reducing gun violence that &gt; 90% of Americans support.
324162008821948416,2013-04-16 14:07:00,ChrisVanHollen,1,0,Instagram,Getting ready to hear Jack Lew's testimony on FY14 budget @ Committee On The Budget http://t.co/5mNgt5C7BB
323891120297885696,2013-04-15 20:10:35,ChrisVanHollen,9,0,Hootsuite,Very saddened to hear about the tragedy in Boston. Praying for the victims and their families. #PrayForBoston
323848190937923584,2013-04-15 17:20:00,ChrisVanHollen,4,1,Hootsuite,Saw @DarrellIssa's rpt re: Tom Perez. I hope Senate has sense enough to ignore this latest political witch-hunt &amp; confirm Tom as Labor Sec
322852820715974656,2013-04-12 23:24:45,ChrisVanHollen,10,1,Twitter for iPhone,"#100DaysOfGOP-led House &amp; nothing to show for it. @SpeakerBoehner, name budget conferees ASAP so we can get our fiscal house in order."
322712233270444032,2013-04-12 14:06:06,ChrisVanHollen,11,3,Hootsuite,Proud cosponsor of @RepJoeCourtney’s bill keeping student loan int. rates @ 3.4%. Deficit reduction on backs of students = wrongheaded.
322415075719778305,2013-04-11 18:25:18,ChrisVanHollen,6,3,Hootsuite,"Senate Ds, House Ds &amp; POTUS have budgets out. Up to GOP whether they want to get serious &amp; join us @ negotiating table."
322395595698483201,2013-04-11 17:07:54,ChrisVanHollen,6,1,Hootsuite,Glad to hear of progress on universal bg checks in Senate. First of many common-sense steps we need to take to prevent gun violence.
322386972276555776,2013-04-11 16:33:38,ChrisVanHollen,2,1,Instagram,Lighting a candle in Rotunda to honor victims of the Holocaust http://t.co/35KXE6cpKL
322012240490409986,2013-04-10 15:44:35,ChrisVanHollen,12,1,Hootsuite,"All budgets are now public. Next step is conference cmte to hash out differences. We're ready when you are, GOP leadership."
321687256131846144,2013-04-09 18:13:13,ChrisVanHollen,3,1,Hootsuite,Just intro'd Innovative Tech Investment Incentive Act for 113th. Very important to make targeted investments that make us more competitive.
321645077040603136,2013-04-09 15:25:36,ChrisVanHollen,22,7,Hootsuite,It's 2013 &amp; a woman still earns $0.77 for every $1 a man earns doing the same work.  Time for Congress to stand up for #EqualPay.
321643636385259520,2013-04-09 15:19:53,ChrisVanHollen,9,0,Twitter for iPhone,RT @WhipHoyer: At 11:30 am I’ll unveil an updated #MakeItInAmerica plan to strengthen manufacturing &amp; create jobs at @capcongress. h ...
319919329690923008,2013-04-04 21:08:06,ChrisVanHollen,1,1,Twitter for iPhone,Congrats @mitchellreports on 5 great yrs! Here's to another 5. #AMR5years
319552395564679168,2013-04-03 20:50:02,ChrisVanHollen,7,5,Hootsuite,New @Morning_Joe / @MaristPoll: 87% support universal background checks; 59% support assault weapon ban - http://t.co/HosnlBruaX
319140915744735232,2013-04-02 17:34:58,ChrisVanHollen,15,3,Twitter Web Client,Millions have been lifted out of poverty thanks to safety net programs that the #GOPbudget would gut - http://t.co/n0FUDgVhQq
317327753592578049,2013-03-28 17:30:06,ChrisVanHollen,8,0,Hootsuite,The #GOPbudget wld con't to protect special tax breaks for big oil companies - tax breaks they don't need: http://t.co/YNVcl9ompx
316928871490535425,2013-03-27 15:05:05,ChrisVanHollen,9,0,Instagram,An inconvenient truth: the #gopbudget would not balance in 10 yrs w/o revs from Obamacare (which it… http://t.co/NF8ugg5biH
316622453906477056,2013-03-26 18:47:30,ChrisVanHollen,13,0,Twitter Web Client,Student loan debt is at an all time high.#GOPbudget would make it harder on students by doubling their interest rates http://t.co/xtgTQctOci
314777964619395072,2013-03-21 16:38:09,ChrisVanHollen,15,2,Twitter for iPhone,#GOPbudget would 1. Block grant Medicaid 2. Repeal Obamacare benefits 3. Replace Medicare with voucher program
314777453899960320,2013-03-21 16:36:07,ChrisVanHollen,6,1,Twitter for iPhone,"#GOPbudget's 3-pronged approach to addressing healthcare costs: 1. take
away health ins 2. take away health ins 3. take away health ins"
314777266192252928,2013-03-21 16:35:23,ChrisVanHollen,3,0,Twitter for iPhone,RT @ThirdWayTweet: Politics + budget + more: Rep @ChrisVanHollen joins TWs @BillSchneiderDC for Inside #Politics press brkfast 830a Fri  ...
314761397143752705,2013-03-21 15:32:19,ChrisVanHollen,10,3,Hootsuite,#GOPBudget will cost nearly $6 trillion and offers no plausible way to pay for it - http://t.co/42vwEPE8Le
314757815493341184,2013-03-21 15:18:05,ChrisVanHollen,6,0,Hootsuite,On 3/13 GOP voted down amdt preventing tax increases on middle class. See this list of all amdts &amp; vote tallies: http://t.co/gTeMQzM6y5
314396193088221184,2013-03-20 15:21:08,ChrisVanHollen,5,1,Hootsuite,How the #DemBudget stacks up against the #GOPbudget: http://t.co/3q917Xf5Rz
314060175206125568,2013-03-19 17:05:55,ChrisVanHollen,15,2,Hootsuite,FACT SHEET: Everything you need to know about the #DemBudget - http://t.co/b4KEQ7Kz8a
314026271162105857,2013-03-19 14:51:12,ChrisVanHollen,6,1,Hootsuite,"Analysis shows #GOPBudget blows~$6T hole in budget, financed in part by sticking middle class fams w/$3k tax bill. http://t.co/42vwEPE8Le"
313700551269433345,2013-03-18 17:16:54,ChrisVanHollen,27,4,Hootsuite,Pleased to introduce the House Dem budget today. Most important deficit we face is the jobs deficit. Read our plan: http://t.co/3bZ5q7gjYi
313669546101850113,2013-03-18 15:13:42,ChrisVanHollen,29,2,Hootsuite,It's even worse than we thought: revised analysis (http://t.co/42vwEPE8Le) shows #GOPBudget gives avg millionaire $245K in tax breaks.
313364637678718976,2013-03-17 19:02:06,ChrisVanHollen,38,6,Twitter Web Client,2/3rds of the cuts in #GOPBudget come from programs for those w/low or moderate incomes (via @CenterOnBudget) http://t.co/PynTGdsTLo
313302146890207233,2013-03-17 14:53:47,ChrisVanHollen,54,2,Hootsuite,"The #GOPbudget provides an avg tax cut of at least $200,000 for millionaires and could stick middle class families with a $2K bill."
312297957099728897,2013-03-14 20:23:29,ChrisVanHollen,5,1,Hootsuite,Promising news on the campaign finance front: http://t.co/1misN7Ugj1 -- Hopefully the Court will hold the FEC's feet to the fire.
312291567455059968,2013-03-14 19:58:06,ChrisVanHollen,14,2,Hootsuite,"#GOPBudget more than doubles sequester's cuts to nondefense discretionary. Kids ed., science research, etc will see drastic cuts."
311952693927227393,2013-03-13 21:31:32,ChrisVanHollen,9,1,Hootsuite,A #BalancedBudget is important–but doing so on the backs of seniors&amp;by slashing critical investments in near term is not how to do it
311894896501993474,2013-03-13 17:41:52,ChrisVanHollen,28,3,Hootsuite,"Budgets are statements of values &amp; priorities. GOP making theirs clear today: protect tax breaks for special interests, wealthy, big oil"
311545166890676225,2013-03-12 18:32:10,ChrisVanHollen,72,9,Hootsuite,"#GOPbudget assumes full repeal of ObamaCare, but uses its ~$2T in savings to get to balance in 10yrs. Can't have it both ways. #Hoax."
311522701628039169,2013-03-12 17:02:54,ChrisVanHollen,24,4,Hootsuite,"This year's #GOPbudget is a lot like last year's - bad news for seniors &amp; the economy, great news for millionaires and big oil."
311520948857757696,2013-03-12 16:55:56,ChrisVanHollen,2,0,Instagram,Briefing reporters on impact of #GOPbudget @ National Statuary Hall http://t.co/UjE7rsXvpO
309676837557137409,2013-03-07 14:48:06,ChrisVanHollen,6,2,Instagram,Thank you to @RepThompson for delivering on our Super Bowl wager! http://t.co/oFCHxUFc6I
309381846813261825,2013-03-06 19:15:54,ChrisVanHollen,63,7,Hootsuite,Yesterday I submitted--for the 4th time--my plan to #StopTheSequester. The GOP--for the 4th time--denied it a vote in the People's House.
307242120593428481,2013-02-28 21:33:24,ChrisVanHollen,3,1,Twitter Web Client,".@Carpe_Cervisia, We have proposed a balanced plan to dramatically cut annual deficits and to stabilize the debt to GDP ratio. #AskMDDems"
307241660209836032,2013-02-28 21:31:34,ChrisVanHollen,15,3,Twitter Web Client,.@jstrick10 House Dems have presented alternative budgets every year that Ryan has.  #AskMDDems
307241197246746624,2013-02-28 21:29:44,ChrisVanHollen,4,1,Twitter Web Client,"Noel, MoC's offices are subject to the same 5% sequester as other fed agencies. Same rules apply to us. #AskMDDems (2 of 2)"
307241116107956224,2013-02-28 21:29:25,ChrisVanHollen,3,1,Twitter Web Client,Q via email from Noel Shively: What is the personal impact of sequestration on members of Congress? Their staff? #AskMDDems (1 of 2)
307240520948805632,2013-02-28 21:27:03,ChrisVanHollen,6,0,Twitter Web Client,"Yes, Tom - federal pensions are exempt from sequestration. #AskMDDems (2 of 2)"
307240447493935106,2013-02-28 21:26:45,ChrisVanHollen,2,0,Twitter Web Client,Q via email from Tom Driver of Glen Burnie: Are federal pensions exempt from sequestration? #AskMDDems (1 of 2)
307240136431783936,2013-02-28 21:25:31,ChrisVanHollen,9,0,Twitter Web Client,"Ben, House Dems' balanced plan (denied a vote 3x): http://t.co/g2HdtjdbfM. Senate Dems' plan: http://t.co/akO3rDYmct. #AskMDDems (2 of 2)"
307240031712595969,2013-02-28 21:25:06,ChrisVanHollen,2,0,Twitter Web Client,Q via email from Ben Ness: What are proposals Democrats are offering to avoid sequestration? #AskMDDems (1 of 2)
307239802598748161,2013-02-28 21:24:11,ChrisVanHollen,6,0,Twitter Web Client,".@jcoopermartin, @SpeakerBoehner must find a way to rein in the extreme elements of his caucus and take a balanced approach. #AskMDDems"
307239409877651456,2013-02-28 21:22:38,ChrisVanHollen,2,0,Twitter Web Client,".@BettyButterly @AskMDDems  nonpartisan CBO says no matter how you cut it, sequester = 750K fewer jobs. #AskMDDems"
307235707045416962,2013-02-28 21:07:55,ChrisVanHollen,1,0,Twitter Web Client,.@Wayneg19 $1.5T in cuts from spending caps; ending direct pmts/ag subsidies + other savings in Dem budget #AskMDDems
307163514571726848,2013-02-28 16:21:03,ChrisVanHollen,6,0,Hootsuite,Twitter town hall TODAY at 4pm on impact of sequester in MD. Tag questions w/ #AskMDDems or email them to AskMDDems@gmail.com
307147504019972096,2013-02-28 15:17:26,ChrisVanHollen,14,2,Twitter Web Client,POLL: a majority of Americans want to reduce the deficit in a balanced way. http://t.co/Xe1L20ezu3
306909885667352578,2013-02-27 23:33:13,ChrisVanHollen,11,0,Twitter Web Client,"TOMORROW, 4pm: twitter town hall on sequester's impact on MD. Tweet Q's using #AskMDDems."
306792297075470338,2013-02-27 15:45:58,ChrisVanHollen,20,3,Hootsuite,"Non-partisan CBO says 750,000 jobs will be lost if sequester hits. Not a 'scare tactic' - just reality.  #StopTheSequester"
306568513731055616,2013-02-27 00:56:44,ChrisVanHollen,42,7,Hootsuite,"Spkr B., bills from last Congress cannot be taken up in this Congress. Leg. Process 101. Enough w/the posterior politics. #StopTheSequester"
306538654153711618,2013-02-26 22:58:05,ChrisVanHollen,54,5,Hootsuite,I have offered the Dem plan to #StopTheSequester 3x so far this Congress. GOP has offered nothing. T-3 days til sequester.
306424558490095616,2013-02-26 15:24:42,ChrisVanHollen,49,9,Hootsuite,Tweaking how sequester cuts are implemented is like rearranging deck chairs on the Titanic. 750K jobs will be lost either way (per CBO).
306211782853275648,2013-02-26 01:19:12,ChrisVanHollen,208,38,Twitter for iPhone,Just submitted (for 3rd time) Dem plan to #StopTheSequester. The American ppl want a balanced approach - they deserve a vote.
306165167387967488,2013-02-25 22:13:59,ChrisVanHollen,10,4,Twitter Web Client,"Q: What is the definition of ""#sequester""? A: http://t.co/qBsfmzeAow"
306137947000934400,2013-02-25 20:25:48,ChrisVanHollen,6,2,Hootsuite,4 days til sequester. Will GOP come to the table or will they continue fighting to protect tax loopholes?
304964008052658176,2013-02-22 14:41:00,ChrisVanHollen,7,0,Hootsuite,"If the sequester goes through, gun background checks may suffer - http://t.co/3vX0PSTet0"
304660260960993281,2013-02-21 18:34:01,ChrisVanHollen,11,5,Twitter for iPhone,FACT: Republicans haven't offered a plan to replace the sequester in this Congress. @HouseDemocrats have. http://t.co/ROHfr1Yo3t
302502716427624449,2013-02-15 19:40:42,ChrisVanHollen,40,7,Hootsuite,"Republicans want the sequester. Democrats want a solution. @SpeakerBoehner, keep the House in session so we can avert this crisis."
302457940386934784,2013-02-15 16:42:47,ChrisVanHollen,21,2,Twitter Web Client,"As POTUS said in his #SOTU address, the time is now for Congress to move #forwardonclimate. http://t.co/pWUR6LzU"
302437376486174720,2013-02-15 15:21:04,ChrisVanHollen,18,2,Measured Voice,Agree w/@RepJustinAmash - GOP should spend less time thinking up lame hashtags &amp; more time coming up with solutions. http://t.co/e4ue4BAE
302154105126801408,2013-02-14 20:35:27,ChrisVanHollen,20,4,Measured Voice,Just intro'd Dem plan to replace sequester w/mix of cuts + revenues from Buffett Rule &amp; by ending big oil/ag subsidies http://t.co/TrMjmi1e
302142645487161344,2013-02-14 19:49:54,ChrisVanHollen,28,1,Measured Voice,"If the automatic spending cuts hit on March 1, CBO est. 750K jobs will be lost this year. Americans deserve better - http://t.co/DTPnj9a0"
302123051452084224,2013-02-14 18:32:03,ChrisVanHollen,9,7,Measured Voice,GOP must stop scapegoating federal employees. They've already contributed more than their fair share to reducing the deficit.
