id,created_at,user,retweets,favorite_count,source,text
685254460176732160,2016-01-08 00:19:29,ChrisVanHollen,14,9,Twitter Web Client,"We have effective, lifesaving strategies at hand that the majority of Americans support. @SpeakerRyan, let us vote. https://t.co/kSrPrK6Z3N"
685219012977029120,2016-01-07 21:58:38,ChrisVanHollen,13,10,Twitter Web Client,Every Rep. should call for an end to this illegal threat of violence &amp; provocation of armed confrontation in Oregon https://t.co/cBqRDlIY1m
685182155098591232,2016-01-07 19:32:10,ChrisVanHollen,7,8,Twitter Web Client,"The death toll is rising every day, and Congress's inaction is a national disgrace. https://t.co/kSrPrK6Z3N #StopGunViolence"
685127156083605504,2016-01-07 15:53:37,ChrisVanHollen,13,6,Twitter Web Client,Republicans beholden to the @NRA have prevented us from even voting on gun safety measures. https://t.co/kSrPrK6Z3N #StopGunViolence
684913795286863872,2016-01-07 01:45:48,ChrisVanHollen,44,26,Twitter Web Client,Today the GOP made its 2016 priority clear: taking healthcare away from women and families. Disturbing and sad. https://t.co/Bb4GkczAI6
684751673147953152,2016-01-06 15:01:35,ChrisVanHollen,27,12,Twitter Web Client,"Today, the GOP achieves a shameful milestone when Tea Party ideology trumps women's health. #StandWithPP https://t.co/NINVs6SWHR"
684477262310301696,2016-01-05 20:51:10,ChrisVanHollen,48,75,Twitter Web Client,.@POTUS is right: permits &amp; b/g checks help #StopGunViolence. Sen. Chris Murphy &amp; I have a bill to help states act https://t.co/nAz9gXaCm1
684169890639523842,2016-01-05 00:29:47,ChrisVanHollen,141,132,Twitter Web Client,"Thank you @POTUS for taking action to #StopGunViolence. It's outrageous that Congress refuses to act, but we won't give up the fight."
684168651155582977,2016-01-05 00:24:52,ChrisVanHollen,714,0,Twitter Web Client,"RT @WhiteHouse: FACT: Each year, more than 30,000 American lives are cut short by guns.

It's time to #StopGunViolence. https://t.co/zcWmeN…"
684130191556370432,2016-01-04 21:52:02,ChrisVanHollen,7,7,Twitter Web Client,Thanks @RepJimMcDermott for your decades of service. Your commitment to equality &amp; helping all families get ahead will have a lasting impact
684075979988451328,2016-01-04 18:16:37,ChrisVanHollen,37,27,Twitter Web Client,"New year, same shameful effort to take affordable healthcare away from women &amp; millions of Americans. #StandWithPP https://t.co/nPnDOZGmnP"
683466099791392771,2016-01-03 01:53:11,ChrisVanHollen,10,12,Twitter Web Client,Sen. Dale Bumpers passionately pursued justice &amp; the common good by speaking truth to power &amp; fighting for working people &amp; civil rights.
679400094949593093,2015-12-22 20:36:19,ChrisVanHollen,16,13,Twitter Web Client,Sunlight is the best antidote to the corrosive effect that secret money in politics has on our democracy. (2/2) https://t.co/PC8msLvCPp
679399890095644672,2015-12-22 20:35:31,ChrisVanHollen,17,16,Twitter Web Client,Today I urged #SEC Chair Mary Jo White to work on rules requiring corporations to disclose political spending to their shareholders. (1/2)
678961371606736896,2015-12-21 15:33:00,ChrisVanHollen,15,13,TweetDeck,Our job &amp; our responsibility is not to be silent. We are going to work until these laws are changed. #NoMoreSilence https://t.co/neLCMvsIlo
678347429687771136,2015-12-19 22:53:24,ChrisVanHollen,10,14,Twitter Web Client,Affording #HigherEd just got a little bit easier. We must build on this progress by making college accessible to all https://t.co/mXhmvcqRFr
678280699707805696,2015-12-19 18:28:15,ChrisVanHollen,9,8,Twitter Web Client,HBD to the #ABLEAct! Glad that access to savings accounts for kids w/ disabilities is expanding across the country https://t.co/XXLHzvxzUr
677506140050227200,2015-12-17 15:10:25,ChrisVanHollen,4,5,Twitter Web Client,"One yr ago today, after a grueling 5 yrs, @AlanPGross was freed from Cuba and became a catalyst for freedom &amp; peace https://t.co/PZCKYwkevB"
677221986041503744,2015-12-16 20:21:18,ChrisVanHollen,85,75,Twitter Web Client,Military-style weapons are designed for mass shootings and have no place in our communities. #AssaultWeaponsBan
677203401818693634,2015-12-16 19:07:27,ChrisVanHollen,26,11,Twitter Web Client,"'Carpet bombing’ is not a strategy, @SenTedCruz. It is empty, dangerous rhetoric that makes America weaker. https://t.co/j43gaGVrVI"
676164680595972096,2015-12-13 22:19:57,ChrisVanHollen,43,34,Mobile Web (M5),"Daily gun violence &amp; frequent mass shootings are simply not normal for a civilized society. To honor #SandyHook victims, we need action."
675346343397892096,2015-12-11 16:08:10,ChrisVanHollen,7,12,Twitter Web Client,"With the Tea Party and @NRA blocking effort to close the terrorist gun loophole, I'm urging Governor Hogan to act. https://t.co/uJDwDbnjXC"
675051460707635200,2015-12-10 20:36:24,ChrisVanHollen,39,45,Twitter Web Client,"We have a duty to live up to our values &amp; speak out against hate to advance equal rights, freedom, &amp; respect for all people. #HumanRightsDay"
675014073365471232,2015-12-10 18:07:50,ChrisVanHollen,5,5,Twitter Web Client,Officer Noah Leotta's dedication to our community will never be forgotten. RIP to one of Montgomery County's bravest https://t.co/ZyKeIdKefQ
674666185510752257,2015-12-09 19:05:27,ChrisVanHollen,10,9,Twitter Web Client,"Today we will again try to close the insane @NRA loophole that
allows suspected terrorists to buy guns. #NoMoreSilence"
674365610613186561,2015-12-08 23:11:05,ChrisVanHollen,31,41,Twitter Web Client,Today I signed discharge petition to keep guns away from terrorists. We must end @NRA's dangerous grip on gun policy https://t.co/IDKa5AhMCD
674303986053357568,2015-12-08 19:06:12,ChrisVanHollen,0,1,Twitter Web Client,Don't miss out on health insurance in 2016! #GetCoveredMD by Dec. 15 deadline for coverage Jan. 1 at https://t.co/1YnMLdjIqs
674230839367045120,2015-12-08 14:15:33,ChrisVanHollen,14,13,Twitter Web Client,.@SenateMajLdr McConnell: money in politics is the PROBLEM. Unlimited money is certainly not the answer. https://t.co/9SUzrXi3RR
672249496928133120,2015-12-03 03:02:24,ChrisVanHollen,113,118,Twitter Web Client,To accept the violence in San Bernardino as normal is to admit defeat to terror. Cowardice is preventing Congress from fighting back.
671840559649173504,2015-12-01 23:57:26,ChrisVanHollen,1720,0,Mobile Web (M5),RT @WhiteHouse: RT if you agree: It's time for Republicans in Congress to prevent terror suspects from being able to buy a gun. https://t.c…
671830041978781700,2015-12-01 23:15:38,ChrisVanHollen,21,23,Twitter Web Client,We can’t sit back &amp; watch another sham investigation spread misinformation &amp; feed extreme ideology. #StandWithPP https://t.co/hVapeM0Geb
671760620577009664,2015-12-01 18:39:47,ChrisVanHollen,12,10,TweetDeck,.@POTUS is right. My plan: charge polluters &amp; return carbon dividend to every U.S. citizen https://t.co/qHa6j0XF4c  https://t.co/wEbHcCiIUZ
671753337101000704,2015-12-01 18:10:50,ChrisVanHollen,5,9,Twitter Web Client,Today is #WorldAIDSDay – a time to reflect on our progress &amp; raise awareness to move us closer to an AIDS-free generation.
669532430282412033,2015-11-25 15:05:45,ChrisVanHollen,32,20,Twitter Web Client,Hardworking families lose when companies like Pfizer renounce their U.S. citizenship to avoid paying taxes. https://t.co/VuViZHJzWp
669346376187166720,2015-11-25 02:46:26,ChrisVanHollen,32,40,TweetDeck,"A trailblazer, fighter, and Maryland’s biggest champion. This honor is well deserved - congratulations @SenatorBarb! https://t.co/csOjU8DddM"
668887418691547136,2015-11-23 20:22:42,ChrisVanHollen,231,0,Twitter for iPhone,RT @RepThompson: Congress must act to close loophole that allows those on terrorist watch list to walk in a store &amp; buy a gun. https://t.co…
668559305218609152,2015-11-22 22:38:54,ChrisVanHollen,5,4,Twitter Web Client,"When entrepreneurs are able to compete for federal government work, taxpayers and our local economies win. https://t.co/MLmGAPhdhT"
667815209529053184,2015-11-20 21:22:08,ChrisVanHollen,9,5,Twitter Web Client,"On #TransDayOfRemembrance, we remember Zella Ziona and all those we've lost to senseless hate. https://t.co/gbnCMhn3pJ"
667796984858853380,2015-11-20 20:09:42,ChrisVanHollen,42,56,Twitter Web Client,I voted NO bc this bill creates a false sense of security &amp; scrambles our moral compass. #RefugeesWelcome https://t.co/j2XJbapzyY
667404415830269952,2015-11-19 18:09:47,ChrisVanHollen,10,6,Twitter Web Client,"Today is the #GreatAmericanSmokeout, a chance to extinguish addiction to tobacco. Your health &amp; future depend on it! https://t.co/8I93kEGJgh"
667363143157489665,2015-11-19 15:25:46,ChrisVanHollen,14,15,Twitter Web Client,Thanks @USTreasury for taking steps to prevent companies from dodging U.S. taxes by changing their mailing address https://t.co/W2D2k0ZbjN
667121653130899456,2015-11-18 23:26:11,ChrisVanHollen,29,23,Twitter Web Client,"If we're serious about defeating Alzheimer’s, cancer, &amp; other complex diseases, we must increase @NIH funding https://t.co/LrojImoOyc"
667005655128010752,2015-11-18 15:45:15,ChrisVanHollen,4,9,TweetDeck,Secret campaign spending is substituting special interests for the public interest. Americans deserve disclosure! https://t.co/fINv9NjXE2
666989506541854720,2015-11-18 14:41:05,ChrisVanHollen,2,4,TweetDeck,Thanks to Union Baptist Head Start for stopping by to share their many success stories helping MD children! https://t.co/eMQlSrduMP
666750346128195584,2015-11-17 22:50:44,ChrisVanHollen,33,28,Twitter Web Client,"Leadership requires soberly confronting the facts, not a stampede toward demagoguery. 4/4"
666750288825556992,2015-11-17 22:50:31,ChrisVanHollen,35,33,Twitter Web Client,We can protect our security and uphold our values by carefully vetting refugees fleeing the horror of #ISIS. 3/4
666750205497384960,2015-11-17 22:50:11,ChrisVanHollen,54,58,Twitter Web Client,It is shameful that Gov. @LarryHogan &amp; others would seek to exploit peoples' justifiable safety concerns by further fueling their fears. 2/4
666750132138979329,2015-11-17 22:49:53,ChrisVanHollen,24,27,Twitter Web Client,"FDR reminded us that ""the only thing we have to fear is fear itself."" 1/4"
666357573935890439,2015-11-16 20:50:00,ChrisVanHollen,10,18,TweetDeck,"I walked for @autismspeaks to support the urgent need for research on intervention, prevention, and treatment https://t.co/pHFxfNEOrI"
665345663954255872,2015-11-14 01:49:02,ChrisVanHollen,68,80,Mobile Web (M5),"Standing with you tonight, Paris. No evil can darken the City of Light. #PrayForParis"
665302705972211712,2015-11-13 22:58:20,ChrisVanHollen,6,0,TweetDeck,RT @AFVhq: Many thanks to @ChrisVanHollen for calling on @POTUS to act https://t.co/TYczVqRMA1 #NoSecretMoney https://t.co/5G2pJWppmq
664954739017297920,2015-11-12 23:55:38,ChrisVanHollen,14,15,TweetDeck,The President has the authority to increase disclosure of campaign spending - I'm urging him to act. #NoSecretMoney https://t.co/o1yqu5GVsl
664896259812106242,2015-11-12 20:03:16,ChrisVanHollen,7,11,Twitter Web Client,Capt. Groberg demonstrates what bravery &amp; dedication to country really mean. He makes Maryland proud #MedalofHonor https://t.co/IHqSHqe2Ig
664557090762002433,2015-11-11 21:35:31,ChrisVanHollen,3,2,Twitter Web Client,WWII Vet Waverly Woodson acted heroically on D-Day. His sacrifice should be recognized w/ a Medal of Honor https://t.co/X4XrT3IMqR
664487146531766272,2015-11-11 16:57:35,ChrisVanHollen,7,5,Twitter Web Client,"We must do everything possible to provide the care, support, &amp; recognition #Veterans deserve, &amp; never stop short of fulfilling that promise."
664486992495976448,2015-11-11 16:56:59,ChrisVanHollen,0,5,Twitter Web Client,Their commitment to the causes of freedom and peace unites us in pride for our nation. #VeteransDay
664486903199174657,2015-11-11 16:56:37,ChrisVanHollen,0,5,Twitter Web Client,Today we honor the sacrifice and valor of our veterans and their families. #VeteransDay
664225747796627458,2015-11-10 23:38:53,ChrisVanHollen,4,14,Twitter Web Client,"Happy 240th birthday, @USMC! Thank you for keeping us safe and for your tireless dedication and service to your country. #SemperFi"
661735883687796736,2015-11-04 02:45:03,ChrisVanHollen,11,13,Twitter Web Client,Abusive towing companies cause real financial pain. I introduced an amendment today to help communities crack down: https://t.co/lOZznmfyVP
661645212020834304,2015-11-03 20:44:45,ChrisVanHollen,19,7,TweetDeck,.@SpeakerRyan's failure to take defunding women's health programs OFF the table is troubling. https://t.co/0ElfXixI6m #StandWithPP
661621965782937601,2015-11-03 19:12:23,ChrisVanHollen,13,9,TweetDeck,Taking a stand w/ @repjohnlewis &amp; @repsandylevin to prevent private debt collectors from harassing taxpayers — https://t.co/40zTjr96xL
661574826532864000,2015-11-03 16:05:04,ChrisVanHollen,15,16,TweetDeck,Congress should follow @POTUS action to #BanTheBox &amp; ensure those released from prison are given the possibility of a second chance.
660549921028767745,2015-10-31 20:12:28,ChrisVanHollen,8,9,TweetDeck,Proud to join @repduckworth on the #CC2CAct to prepare the students of today for the high-skill jobs of tomorrow — https://t.co/ECOcqqJX80
660149429777793024,2015-10-30 17:41:03,ChrisVanHollen,3,3,TweetDeck,Lead poisoning is 100% preventable. Is your home safe? Have your children been tested? #LPPW2015 #leadfreekids https://t.co/pkr4ep5l7h
659396987259781120,2015-10-28 15:51:07,ChrisVanHollen,7,9,TweetDeck,All Md. children should have access to healthy meals. Congress needs to act! Thx @MDFoodBank for your great work.  https://t.co/wFaiMDLL56
659352490782117888,2015-10-28 12:54:18,ChrisVanHollen,7,7,Twitter for iPhone,"After months of Republican inaction, glad to see the House work its will to reopen the #ExImBank. A win for Made in America exports &amp; jobs."
659050707941650432,2015-10-27 16:55:08,ChrisVanHollen,5,5,TweetDeck,"#WorkingFamilies need better pay, better work-life balance &amp; a work environment that bars discrimination. https://t.co/gjaMQhA6ZZ"
659045409973628928,2015-10-27 16:34:04,ChrisVanHollen,33,28,TweetDeck,Let's support #EqualPay for women by passing the Paycheck Fairness Act. #WorkingFamilies deserve a level playing field!
659037885211938816,2015-10-27 16:04:10,ChrisVanHollen,31,28,TweetDeck,Members of Congress who demand work-life balance ought to support universal paid family leave. #WorkingFamilies https://t.co/F2Pzwd1DCm
657626290061709313,2015-10-23 18:35:00,ChrisVanHollen,8,2,Twitter for iPhone,Completely agree! Shareholders deserve to know how their money is being spent. A little sunlight would go a long way https://t.co/p58LuLEIzL
657595619222028288,2015-10-23 16:33:07,ChrisVanHollen,51,28,TweetDeck,"After a ""busy"" week politicizing #Benghazi &amp; putting China before our troops @HouseGOP votes to take health care away from 16m ppl. Shameful"
657589331687686144,2015-10-23 16:08:08,ChrisVanHollen,9,6,TweetDeck,We cannot afford a #GOPdefault! https://t.co/5JsWsQEJK6
657586143698034689,2015-10-23 15:55:28,ChrisVanHollen,10,4,TweetDeck,Is the @HouseGOP #GameOfThrones more important than protecting the full faith and credit of the US? #GOPdefault https://t.co/CjdoUc3xkW
657579926321766400,2015-10-23 15:30:46,ChrisVanHollen,12,6,Twitter for iPhone,.@housegop vote on reconciliation bill shows obsession to cut healthcare for millions of women instead of acting to avert #GOPdefault
657534744633151488,2015-10-23 12:31:14,ChrisVanHollen,15,6,TweetDeck,.@thirdwayecon outlines the devastating impact a #GOPdefault would have on our economy: https://t.co/JCzmhvNzQn
657299045698969600,2015-10-22 20:54:39,ChrisVanHollen,1,4,Twitter for iPhone,Agree 100%– need to invest in the 21st CCLC program to give students more opportunities for out-of-school learning! https://t.co/2p5JltxK6P
657280345352617984,2015-10-22 19:40:20,ChrisVanHollen,5,7,Twitter for iPhone,An important milestone as we continue the march toward full equality! #LoveWins  https://t.co/hoc2VnHnia
657277998387871748,2015-10-22 19:31:01,ChrisVanHollen,6,6,Twitter for iPhone,"In a #GOPdefault, Chinese bondholders get paid before our own troops. https://t.co/zHEhBpnjWX"
657221463771095040,2015-10-22 15:46:22,ChrisVanHollen,6,14,Twitter for iPhone,Let's stop exploiting the #Benghazi tragedy &amp; respect the work of the men &amp; women putting their lives on the line in svc to their country.
657221270258470912,2015-10-22 15:45:36,ChrisVanHollen,7,11,Twitter for iPhone,"FSOs like Amb. Stevens put their lives on the line for the greater good. Theirs is a sacrifice that should be honored, not politicized."
657221129254367232,2015-10-22 15:45:02,ChrisVanHollen,1,9,Twitter for iPhone,"As the son of a foreign service officer, I know the great risks these unsung heroes take on a daily basis. #Benghazi"
656953627718774784,2015-10-21 22:02:05,ChrisVanHollen,5,6,TweetDeck,Thanks to @IWLA_org for coming by today to #ProtectCleanWater for the Chesapeake Bay and rivers &amp; streams across Maryland! #CleanWaterRules
656913360731017216,2015-10-21 19:22:04,ChrisVanHollen,14,10,TweetDeck,We cannot hold the full faith &amp; credit of the United States hostage to extreme right wing ideology. No #GOPdefault! https://t.co/WVhNgsHrgf
656907199755767808,2015-10-21 18:57:35,ChrisVanHollen,14,11,TweetDeck,Agree w/ @VP—we must stop the flow of secret money into our elections if we want the middle class to get ahead. https://t.co/u3saxPmOzP
656553344186515456,2015-10-20 19:31:30,ChrisVanHollen,7,12,TweetDeck,"Glad AG Frosh can soon begin recalling Md. plates bearing the Confederate flag, a racist symbol w/ no place in gov't https://t.co/mAt3u4P5wg"
656228882396266496,2015-10-19 22:02:12,ChrisVanHollen,4,3,TweetDeck,1-in-10 Maryland children have asthma—the Clean Power Plan will improve their health &amp; the health of all Marylanders https://t.co/M2h5Rjl6BW
656214754491432960,2015-10-19 21:06:04,ChrisVanHollen,1,5,TweetDeck,"Good move by Rockville Council. Residents deserve to live &amp; raise their family in a healthy, smoke-free environment—https://t.co/k3NYc0ZZsV"
656208226728284160,2015-10-19 20:40:07,ChrisVanHollen,1,5,TweetDeck,Maryland has reduced energy sector carbon pollution by 35%. @EPA's Clean Power Plan will build off that success: https://t.co/M2h5Rjl6BW
656199925827432448,2015-10-19 20:07:08,ChrisVanHollen,41,22,TweetDeck,"Benghazi Cmte report: After dozens of interviews, no evidence to support GOP allegations against Secretary Clinton—https://t.co/izca9XZrjq"
656192289182646272,2015-10-19 19:36:47,ChrisVanHollen,9,7,TweetDeck,Great news for voters in @MontgomeryCoMD &amp; all who value free and open access to the ballot box. https://t.co/55ATU2nk74
655164126273122304,2015-10-16 23:31:14,ChrisVanHollen,2,7,Twitter for iPhone,"Bringing the #FBI2MD is the right choice–Prince George's County is close to DC, higher ed &amp; research facilities &amp; many nat'l security orgs."
655147294833188868,2015-10-16 22:24:21,ChrisVanHollen,2,4,Twitter for iPhone,Re-locating FBI HQ to Prince George's County would be a boon to our local economy &amp; create thousands of good paying jobs. Bring the #FBI2MD!
652569759268126721,2015-10-09 19:42:09,ChrisVanHollen,31,11,TweetDeck,"Despite threats of shutdown, default &amp; chaos within their caucus, GOP finds time to repeal the ACA &amp; defund @PPFA—http://t.co/WQ5gt10z1o"
652227490715320320,2015-10-08 21:02:06,ChrisVanHollen,12,16,TweetDeck,Today I introduced a bill to fast track budget negotiations so we can end #sequester &amp; avoid a shutdown in December—http://t.co/aE2ePAHUjI
652222529394864128,2015-10-08 20:42:23,ChrisVanHollen,7,8,TweetDeck,No child should go hungry. Congress must protect child nutrition policies for our most vulnerable! #Voices4Nutrition
652197048381370370,2015-10-08 19:01:08,ChrisVanHollen,9,8,TweetDeck,"2 years ago, Republicans held our gov't &amp; economy hostage over the ACA. We can't let that happen again. http://t.co/aE2ePAHUjI"
652181871313428480,2015-10-08 18:00:49,ChrisVanHollen,9,6,TweetDeck,"With all the chaos in the GOP, we need to avoid a shutdown now more than ever. http://t.co/FBIOBjWnwk"
651866612908343296,2015-10-07 21:08:06,ChrisVanHollen,4,7,TweetDeck,w/ @NDDUnited @WhipHoyer and many others today to take a stand against job-killing sequester cuts. #RaisetheCaps http://t.co/sUBoRH0pey
651538599440175104,2015-10-06 23:24:41,ChrisVanHollen,13,8,TweetDeck,(2/2) Any trade deal must pass the test of boosting American jobs and wages. This deal fails that test. #TPP
651538497807994880,2015-10-06 23:24:17,ChrisVanHollen,14,8,TweetDeck,"The #TPP deal that is emerging is a fatally flawed pact that does not adequately protect Md. jobs, the environment, &amp; workers' rights. (1/2)"
651522548446961664,2015-10-06 22:20:54,ChrisVanHollen,7,9,TweetDeck,Thx @nationalcouncil for attacking the mental health crisis in our country and for fighting for parity and better access to care. #HillDay15
651430725892317184,2015-10-06 16:16:02,ChrisVanHollen,16,12,TweetDeck,.@HouseOversight owes @CecileRichards an apology for the unfair personal attacks she endured at last week's hearing. http://t.co/xfE4JrHAo6
650048195188424704,2015-10-02 20:42:21,ChrisVanHollen,19,16,TweetDeck,"Agree w/ @POTUS - short-term CRs are no way to govern, and the sequester is doing real damage to our economy
http://t.co/w8R4zeo98P"
649958365595082753,2015-10-02 14:45:24,ChrisVanHollen,78,0,Twitter for iPhone,RT @allinwithchris: Rep. @ChrisVanHollen calls on @SpeakerBoehner to bring “commonsense measures” on guns to a vote #inners http://t.co/BAp…
649696049443958785,2015-10-01 21:23:03,ChrisVanHollen,97,76,TweetDeck,Enough is enough. The time for talk has long past. We must act now to stop the carnage once and for all. #UCCShooting
649694260636348416,2015-10-01 21:15:57,ChrisVanHollen,5,11,TweetDeck,"Praying for the victims, their families and all those affected by the senseless #UCCShooting."
649648607126228992,2015-10-01 18:14:32,ChrisVanHollen,19,13,Twitter for iPhone,"Congress must #RestoreTheVRA, &amp; at the local level we must continue to fight to remove obstacles to voting. https://t.co/CwsDaTfX4i"
649620904440414212,2015-10-01 16:24:27,ChrisVanHollen,3,4,Twitter for iPhone,"If #Joaquin impacts Maryland, will you be ready? Now is the time to make sure you and your family are prepared. http://t.co/YzZHmt6PyS"
649336681347203072,2015-09-30 21:35:03,ChrisVanHollen,21,20,TweetDeck,Refreshing to hear truth from the GOP. We need to stop a similar partisan attack on women's health before it starts http://t.co/yEQLgwsOb4
649329151329959938,2015-09-30 21:05:08,ChrisVanHollen,3,5,TweetDeck,#WMATA safety &amp; service has been intolerable. The federal gov't has important role to play in oversight and funding. http://t.co/FTpDq7D5N2
649320386526638081,2015-09-30 20:30:18,ChrisVanHollen,4,8,TweetDeck,Thanks for being a great partner in this fight &amp; for doing #whateverittakes to end gun violence in our communities. https://t.co/TbhpK5ZwNu
649277057306750976,2015-09-30 17:38:08,ChrisVanHollen,1,4,TweetDeck,GOP efforts to defund gov't hamstring watchdogging by @epa &amp; could lead to more scandals like #dieselgate. http://t.co/hrUZaBWsQh via @nrdc
649266559408545792,2015-09-30 16:56:25,ChrisVanHollen,2,4,TweetDeck,Congrats @kescougars &amp; Our Lady of Lourdes on earning 2 of Maryland's 8 @NatlBlueRibbon School awards! http://t.co/5rbKk4CxZK
648940327588392960,2015-09-29 19:20:05,ChrisVanHollen,37,33,TweetDeck,The gov't shuts down tomorrow at midnight &amp; the GOP is wasting time attacking women's health. Shameful and reckless. #StandwithPP #PinkOut
648918335955030017,2015-09-29 17:52:42,ChrisVanHollen,88,93,TweetDeck,The American people have spoken—7 in 10 don't want a #GOPshutdown over women's health &amp; @PPFA. #StandwithPP #PinkOut http://t.co/UHgMEQLfjQ
648575762593771520,2015-09-28 19:11:26,ChrisVanHollen,29,21,TweetDeck,"Americans are divided on many issues, but not campaign finance reform. 78% think Citizens United should be overturned—http://t.co/r5t8bY1Huk"
647532598781177856,2015-09-25 22:06:16,ChrisVanHollen,4,0,TweetDeck,RT @BethesdaBeat: Van Hollen calls on state officials to reject replacement of two early voting sites http://t.co/k7XU7bSYVU http://t.co/B4…
647423237069086720,2015-09-25 14:51:42,ChrisVanHollen,2,6,TweetDeck,"For students to succeed, we must keep our pact on funding. Thx @AFT_Maryland &amp; @MSEAeducators for supporting my bill http://t.co/umBgzlTtDw"
647099456043679744,2015-09-24 17:25:07,ChrisVanHollen,11,13,TweetDeck,The tragedy in #Mecca is heartbreaking. My thoughts and prayers are with all who are making the pilgrimage.
647092318768615425,2015-09-24 16:56:45,ChrisVanHollen,37,0,TweetDeck,RT @sr_simone: Care of our common home requires change &amp; our care for our economic system. @Pontifex http://t.co/g6bzAsdw7W
646782244774785025,2015-09-23 20:24:38,ChrisVanHollen,22,17,TweetDeck,"If it was your kid battling cancer, you wouldn't want to be told @NIH is closed for treatment. http://t.co/GpfoIxmQMc"
646342414936903680,2015-09-22 15:16:54,ChrisVanHollen,25,10,TweetDeck,.@NIH today w/@NIHDirector Collins to learn the consequences of a #GOPshutdown. The shameful '13 shutdown led to this—http://t.co/40PB3zxFJM
644927830430744576,2015-09-18 17:35:51,ChrisVanHollen,52,0,Twitter for iPhone,"RT @PPact: .@ChrisVanHollen agrees w/ America: ""Our republican colleagues...should not shut down the gov't to try to impose their views on …"
644916530770235392,2015-09-18 16:50:57,ChrisVanHollen,0,2,TweetDeck,Great meeting with you @MonifaRMS. Ridgeview MS is lucky to have such a terrific leader! https://t.co/OaDHQ09oKf
