id,created_at,user,retweets,favorite_count,source,text
534431335658434560,2014-11-17 19:42:14,ChrisVanHollen,12,8,TweetDeck,"Despite endless political attacks, #ACAWorks: customers more satisfied w/cost of coverage than avg insured American. http://t.co/BBRIez6eN1"
534415897273057280,2014-11-17 18:40:53,ChrisVanHollen,3,5,Twitter for iPhone,Giving our newest Democratic members a sense of what awaits them budget-wise in the 114th Congress http://t.co/bXHlZsTrH1
534407528273432576,2014-11-17 18:07:38,ChrisVanHollen,11,12,TweetDeck,"I #StandWithNancy because no matter what, she will fight to put the #MiddleClassFirst! http://t.co/FHcC7dRqxU"
532694878757474307,2014-11-13 00:42:10,ChrisVanHollen,4,10,TweetDeck,"""Hats off"" to Alma Adams for being the 100th woman to serve in this Congress. I look forward to working with her!"
532676273835749376,2014-11-12 23:28:14,ChrisVanHollen,22,11,TweetDeck,Critics have long used a lack of partners as an excuse to not #ActOnClimate. Yesterday that changed. No more excuses http://t.co/5kbMiz4rzy
532644242154610689,2014-11-12 21:20:58,ChrisVanHollen,7,6,TweetDeck,We're already paying for climate change—critics shld stop burying their heads in the sand &amp; embrace US-China deal. http://t.co/U03xvOJzzQ
532230548392280064,2014-11-11 17:57:05,ChrisVanHollen,6,6,Twitter for iPhone,Our veterans have always been there for us. We need to be there for them -- in both word and deed.
530348932074078209,2014-11-06 13:20:13,ChrisVanHollen,188,106,Twitter for iPhone,"Corporations shouldn't get tax breaks for million+ dollar CEO bonuses unless their workers get a raise, too. http://t.co/UeR5snKKvP"
530057567452807168,2014-11-05 18:02:26,ChrisVanHollen,17,8,Twitter Web Client,O/S grps spent $554M this cycle-39% of which was by grps that don't fully disclose donors. Big loser last night=democracy. Need #DiscloseAct
529348293055500288,2014-11-03 19:04:02,ChrisVanHollen,71,40,Twitter Web Client,It's not the 1950s anymore. Time for pay checks to reflect that. #EqualPay http://t.co/haH2E7ZLtb
528182480101453824,2014-10-31 13:51:31,ChrisVanHollen,63,0,TweetDeck,"RT @RepJeffries: We can empower America’s families by raising the wage, creating jobs and investing in our future. Pass http://t.co/eWfVl9p…"
525685624800804864,2014-10-24 16:29:54,ChrisVanHollen,10,8,Twitter for iPhone,Glad to hear Ms. Pham is now Ebola-free! Thank you Dr. Fauci &amp; your team at @NIH for giving her such excellent care. http://t.co/a0siAh9GR2
525357309128871938,2014-10-23 18:45:17,ChrisVanHollen,29,12,TweetDeck,"More people than ever now have quality, affordable health care thanks to the #ACA.  #ACAWorks http://t.co/mIr42hzRkW"
523200023865999360,2014-10-17 19:53:00,ChrisVanHollen,10,11,TweetDeck,"Thank you Dr. Fauci and your team at NIH for the unmatched expertise and care you are providing to a courageous nurse, Ms. Nina Pham."
522790264256364544,2014-10-16 16:44:46,ChrisVanHollen,23,9,TweetDeck,Spoke w/NIH Dir. Collins—he told me NIH is specifically equipped to handle #ebola. Proud to have Dr. Collins &amp; his team in our community.
522494330003808257,2014-10-15 21:08:50,ChrisVanHollen,37,18,Twitter for iPhone,"55 months of private sector job growth + lowest deficit in 6 yrs. More to do, but make no mistake—we are making good progress."
522389372956835841,2014-10-15 14:11:46,ChrisVanHollen,146,0,TweetDeck,RT @RepJohnYarmuth: 1 in 5 workers has a low-wage job. No one shld work 40 hrs a week &amp; struggle to get by. Let's #RaiseTheWage! http://t.c…
520955797115637760,2014-10-11 15:15:15,ChrisVanHollen,30,15,TweetDeck,It's simple: no one who works full time should have to raise their family in poverty. http://t.co/vteYGvWPm3
520659871566667777,2014-10-10 19:39:21,ChrisVanHollen,21,10,Twitter for iPhone,A majority want Congress to #RaiseTheWage. @HouseDemocrats will do it in within 100 days: http://t.co/29F1DQqNSj http://t.co/ochcfIzn5b
520621397404823555,2014-10-10 17:06:28,ChrisVanHollen,12,9,Twitter for iPhone,It's simple: no one who works full time should have to raise their family in poverty. http://t.co/lLIRiSHkKi
520589089264119808,2014-10-10 14:58:05,ChrisVanHollen,19,8,TweetDeck,A well-deserved honor for Malala Yousafzai and Kailash Satyarthi. Thank you both for your courage and for giving a voice to the voiceless.
519612914630524928,2014-10-07 22:19:07,ChrisVanHollen,185,85,TweetDeck,".@VP, no apology necessary for telling truth re: Turkey &amp; #ISIS. Shame on Turkey for watching as ISIS wipes out Syrian Kurds in #Kobane."
519546249322958848,2014-10-07 17:54:13,ChrisVanHollen,41,21,TweetDeck,"ICYMI, @SpeakerBoehner unveiled his 5-point plan to create #jobs today: http://t.co/cQnN5Y8N7p"
519213829604257793,2014-10-06 19:53:18,ChrisVanHollen,105,40,TweetDeck,Remember sequestration? It's still in effect &amp; its cuts to health funding are hampering our response to #ebola. http://t.co/bDpTfbl6Ys
519200995675734016,2014-10-06 19:02:18,ChrisVanHollen,13,8,Twitter for iPhone,The science is in and the results are clear: we can't afford NOT to clean up the @ChesapeakeBay. http://t.co/vFt7klBBnv
519190470145363970,2014-10-06 18:20:28,ChrisVanHollen,15,9,Twitter for iPhone,"Glad SCOTUS agrees that states' bans on #marriageequality are indefensible. Much work remains, but today, progress marched on."
518162841291878401,2014-10-03 22:17:03,ChrisVanHollen,104,45,TweetDeck,"Syrian Kurds only ""boots on ground""  in NE Syria dominated by #ISIS. w/ #Kobani abt to fall, where is the Coalition? http://t.co/RCkJ0lTlnd"
518157764535656449,2014-10-03 21:56:52,ChrisVanHollen,36,13,TweetDeck,Turkey joins coalition and then watches as #Kobani about to fall to #ISIS. Which Coalition is Turkey in? http://t.co/RCkJ0lTlnd
517092163336024064,2014-09-30 23:22:33,ChrisVanHollen,27,18,Twitter for iPhone,"1 yr ago tonight, Rs shut down the govt. Let's hope they learned from their $24B mistake &amp; don't return to obstruction-as-usual come Nov"
515542515232305153,2014-09-26 16:44:48,ChrisVanHollen,43,25,Twitter for iPhone,Syrian Kurds in Kobani facing possible massacre by #ISIS. Turkey needs to step up. We need to act. http://t.co/U1HIokpmjb
514452899519143936,2014-09-23 16:35:03,ChrisVanHollen,6,3,TweetDeck,"Common questions about the tragedy in #Benghazi, answered: http://t.co/yL6wxyB89s"
514427102536679424,2014-09-23 14:52:33,ChrisVanHollen,46,15,TweetDeck,.@SpeakerBoehner shld bring Members back to debate/vote on AUMF that supports current mission but ensures no ground troops. No Iraq War 2.0
514426895761694721,2014-09-23 14:51:44,ChrisVanHollen,26,17,TweetDeck,"I support coalition strikes—and Turks shld join fight, starting w/letting Kurdish forces cross border to defend Syrian Kurds from #ISIS."
514189783556702209,2014-09-22 23:09:32,ChrisVanHollen,11,7,Twitter for iPhone,The need for tax reform is no excuse for legislative inaction on inversions. We can &amp; should stop them now as we work toward broader reform.
514173708773392384,2014-09-22 22:05:39,ChrisVanHollen,10,11,Twitter for iPhone,Corporate inversions shift more of the tax burden onto American families. Glad POTUS is looking out for taxpayers who don't desert the US.
514173210473279488,2014-09-22 22:03:40,ChrisVanHollen,8,3,Twitter for iPhone,I welcome @USTreasury's efforts to curb corporate tax inversions. Now it's up to Congress to stop them completely.
514111416890953729,2014-09-22 17:58:08,ChrisVanHollen,10,10,TweetDeck,"Worker productivity is at an all-time high, but only the CEOs are being rewarded. Time to fix that. http://t.co/ptIdyWDpBG"
514079963356483586,2014-09-22 15:53:09,ChrisVanHollen,24,7,TweetDeck,Worker productivity is up; CEO pay is up. But your pay is flat. You deserve a raise: http://t.co/ptIdyWDpBG http://t.co/OGI6b6W2kB
514061584063537152,2014-09-22 14:40:07,ChrisVanHollen,51,21,TweetDeck,".@SpeakerBoehner, giving tax refunds to corporations leaving America is not a “#jobs” plan. http://t.co/KGC3qvBtCK"
512693958804111361,2014-09-18 20:05:39,ChrisVanHollen,6,5,TweetDeck,Glad to see @MontgomeryCoMD join @WhiteHouse's solar push by installing 6 megawatts of solar arrays! http://t.co/ykK88mMIRQ #ActOnClimate
512691086209216512,2014-09-18 19:54:14,ChrisVanHollen,6,9,TweetDeck,.@schecktastic Dems will pass the #BankOnStudents Act to refi loans @ lower rates &amp; also expand access to Pell Grants. #AskDems
512653593304780800,2014-09-18 17:25:15,ChrisVanHollen,13,10,TweetDeck,Companies shouldn't get tax breaks for $1m+ CEO bonuses unless they give their regular employees a raise. http://t.co/zxFKKSKga6
512647359969230848,2014-09-18 17:00:29,ChrisVanHollen,10,2,Twitter Web Client,TODAY @ 2—town hall to contrast http://t.co/koXkdwgLl9 plan w/@HouseGOP's record of inaction. Tweet Qs using #AskDems http://t.co/zM0LGMIoPV
512639524220829696,2014-09-18 16:29:21,ChrisVanHollen,13,8,Twitter Web Client,"While @HouseGOP pushes bills that cater to wealthy special interests, Dems are working to jumpstart the middle class⟶http://t.co/koXkdwgLl9"
512630256499720193,2014-09-18 15:52:32,ChrisVanHollen,3,6,TweetDeck,"The wage gap won't go away on its own. Dems have a plan to address it (http://t.co/Smj9GHgP1A). @SpeakerBoehner, where's yours?"
512592403036131328,2014-09-18 13:22:07,ChrisVanHollen,7,8,Twitter for iPhone,"Signing the petition to force a vote on #ENDA b/c it's simply wrong that in 2014, someone can still be fired for being #LGBT."
512293272812007425,2014-09-17 17:33:28,ChrisVanHollen,12,6,TweetDeck,Common refrain from GOP re: pay gap is that it simply doesn't exist. But facts are stubborn things: http://t.co/LUIF9g2DcI
512282420897656833,2014-09-17 16:50:21,ChrisVanHollen,10,3,Twitter for iPhone,GOP's so-called #jobs pckg stacks the deck for special interests &amp; leaves the middle class to play 52 card pickup. http://t.co/29F1DQqNSj
510844929044922368,2014-09-13 17:38:16,ChrisVanHollen,53,17,Twitter for iPhone,Freedom from violence is a human right. Recent events and hard facts show we still have a long way to go. #VAWA http://t.co/UbTDRusg3H
510530494900215810,2014-09-12 20:48:49,ChrisVanHollen,9,4,TweetDeck,Marylander marching to serve: I stand with those who believe the deaf can bravely serve their country http://t.co/2QCDdWJdyj via @KelsiFNP
510506536826060801,2014-09-12 19:13:37,ChrisVanHollen,14,9,Twitter for iPhone,Thank you to @americorps and its volunteers for 20 years of service and dedication to bettering our communities and our country.
510161441010503680,2014-09-11 20:22:20,ChrisVanHollen,8,5,TweetDeck,Disappointed Senate Rs have decided to stand up for monied special interests in lieu of defending the voices of ALL Americans.
510152860810895360,2014-09-11 19:48:14,ChrisVanHollen,4,2,Twitter for iPhone,Thinking of those we lost 13 yrs ago &amp; the heroes who gave their lives to protect their fellow citizens &amp; defend our nation. #NeverForget.
509874244202037248,2014-09-11 01:21:07,ChrisVanHollen,456,275,Twitter for iPhone,Glad we have a President who thinks and aims before he shoots. Otherwise we get more Iraq Wars – which created ISIS in the first place.
509797901493874689,2014-09-10 20:17:45,ChrisVanHollen,14,11,TweetDeck,We need to address climate change. We also need to ensure a thriving middle class. We can do both. http://t.co/mL788jfPAH
509392865001476096,2014-09-09 17:28:17,ChrisVanHollen,17,11,Twitter for iPhone,"As more and more corporations exploit the tax inversion loophole, Republicans continue to sit on their hands. Why? http://t.co/Wu95yCOw9s"
509146255369703424,2014-09-09 01:08:21,ChrisVanHollen,25,13,TweetDeck,"Glad to see Senate stand up to secret money in our elections. House shld join in keeping this a democracy of the many, not of the money."
506565159297773568,2014-09-01 22:12:00,ChrisVanHollen,34,23,Twitter for iPhone,"This #LaborDay, let's end the scandal that in America you can work full time and still have to raise your family in poverty."
505044805903454209,2014-08-28 17:30:39,ChrisVanHollen,27,13,TweetDeck,Student debt is skyrocketing. Congress must act to ensure all students have a #fairshot at success &amp; #DegreesNotDebt http://t.co/Zd80SqAsdS
505040688883703808,2014-08-28 17:14:18,ChrisVanHollen,14,4,TweetDeck,WaPo on a simple plan to reduce climate change threats to our communities &amp; put $ in pockets of 80% of households — http://t.co/Ulr9tuK5SO
505015738403287040,2014-08-28 15:35:09,ChrisVanHollen,24,8,TweetDeck,"Instead of protecting tax breaks for special interests, Congress should expand access to #HigherEd &amp; ensure graduates have #DegreesNotDebt."
504674787369553923,2014-08-27 17:00:20,ChrisVanHollen,14,3,TweetDeck,Refusing to sleep in a bed till everyone in the U.S. has one makes @AWiderCircle's @MarkBergel a #HeroToMe http://t.co/vlmPGsndoc @CNNHeroes
504357913117200384,2014-08-26 20:01:11,ChrisVanHollen,12,6,TweetDeck,.@HouseGOP voted to reduce child care access. Dems want to expand it. http://t.co/s1j0Ifgh7j #WEmatter
504320870605930496,2014-08-26 17:34:00,ChrisVanHollen,19,8,TweetDeck,Dems' #MiddleClassFirst agenda guarantees #EqualPay for equal work. http://t.co/S6JUQ7OxRI #WEmatter http://t.co/xQrdLb6nHb
504296736978771968,2014-08-26 15:58:06,ChrisVanHollen,11,9,TweetDeck,Where's the beef? Deserted to Canada? Time for Congress to stop these unpatriotic inversions - http://t.co/EDU0uQck4R
504275444620091392,2014-08-26 14:33:29,ChrisVanHollen,53,26,TweetDeck,.@BurgerKing wants your money. Now they want you to pay their taxes too. Time to ditch the Whopper? http://t.co/BYwXsEuVQs
504034747861848064,2014-08-25 22:37:03,ChrisVanHollen,38,10,Twitter for iPhone,Your tax dollars at work: @SpeakerBoehner to pay DC law firm $500/hr to help him sue POTUS. http://t.co/keywimeCbl
502144332569145345,2014-08-20 17:25:12,ChrisVanHollen,32,13,TweetDeck,Here's an idea: corporations shouldn't be able to write off $1million+ in CEO pay unless regular workers get a raise. http://t.co/FiyReBuszf
502108858869751808,2014-08-20 15:04:15,ChrisVanHollen,20,8,TweetDeck,.@HouseGOP won't #RaiseTheWage but gave huge tax giveaways to corporate special interests. Dems have a better plan: http://t.co/FiyReBuszf
500316252456235008,2014-08-15 16:21:04,ChrisVanHollen,11,7,TweetDeck,GOP refuses to #RaiseTheWage &amp; supports huge tax giveaways to corporate special interests. Dems have a better plan: http://t.co/FiyReBuszf
499968251514736640,2014-08-14 17:18:14,ChrisVanHollen,12,5,TweetDeck,"Agree w/ @Disney CEO: inversion is the wrong thing to do, for companies and for the country. http://t.co/xAFLi68VMc"
499538397652721666,2014-08-13 12:50:09,ChrisVanHollen,64,27,Twitter for iPhone,Let's help businesses succeed &amp; add jobs to the economy. Read @HouseDemocrats' plan to put the #MiddleClassFirst: http://t.co/s1xo48TcRL
499538009243811840,2014-08-13 12:48:37,ChrisVanHollen,7,3,Twitter for iPhone,Let's help businesses succeed &amp; add jobs to the economy. Read @HouseDemocrats' plan to put the #MiddleClassFirst: http://t.co/gg4LzuR5D1
499288428560015360,2014-08-12 20:16:52,ChrisVanHollen,24,16,TweetDeck,"While @HouseGOP wastes time &amp; dime on POTUS lawsuit, Dems lay out a plan to put the #MiddleClassFirst: http://t.co/S6JUQ7xuPI"
497510466600853505,2014-08-07 22:31:53,ChrisVanHollen,15,9,Twitter for iPhone,I applaud @Walgreens for doing the right thing and sticking with America: http://t.co/OGSH2IdkAy
497029320620396544,2014-08-06 14:39:59,ChrisVanHollen,27,20,TweetDeck,"We need solutions, not shutdowns. House Dems have a plan to put the #MiddleClassFirst: http://t.co/S6JUQ7xuPI"
496683687451570177,2014-08-05 15:46:33,ChrisVanHollen,20,3,TweetDeck,We can cut carbon &amp; boost the middle class at the same time.  Share your thoughts on my #capanddividend plan here: http://t.co/LcFIfz238a
496327675188084736,2014-08-04 16:11:53,ChrisVanHollen,203,138,Twitter for iPhone,I stand w/ my constituents in calling for common sense laws to reduce gun violence. #NotOneMore. http://t.co/Aggc4UC0Wx
495308805853691904,2014-08-01 20:43:16,ChrisVanHollen,116,29,Twitter for iPhone,"Under Cruz Control, GOP bill would deport DREAMers—including those who served honorably in our Armed Forces. https://t.co/p0MC7B5hIS"
495000529832255488,2014-08-01 00:18:17,ChrisVanHollen,85,31,Twitter for iPhone,.@SpeakerBoehner is of two minds when it comes to executive action on the #BorderCrisis: http://t.co/OiTMG1FSsj
494961322933878784,2014-07-31 21:42:29,ChrisVanHollen,57,24,TweetDeck,The House seems to be stuck on Cruz Control—Speaker Cruz still calling the shots. http://t.co/nATbRFSvpT
494908022238760960,2014-07-31 18:10:42,ChrisVanHollen,53,21,TweetDeck,The Speaker is not the king. #DemocracySuspended http://t.co/t1UJxiphRw
494622268811530240,2014-07-30 23:15:13,ChrisVanHollen,45,14,Twitter for iPhone,"Can add one more to this list tomorrow:
☑ Go on 5 week vacation. 

#DoYourJobHouseGOP http://t.co/0sX4QpNfjS"
494608065942278144,2014-07-30 22:18:46,ChrisVanHollen,99,43,TweetDeck,"Dems are focused on getting the middle class into good-paying jobs; Rs are focused on getting out of doing theirs.

#DoYourJobHouseGOP"
494601669590929408,2014-07-30 21:53:21,ChrisVanHollen,120,49,TweetDeck,"Less than 24h before taking 5wks vacation, @HouseGOP wasting time &amp; taxpayer $ suing POTUS. 
#DoYourJobHouseGOP http://t.co/AfSDiv9zww"
494596495820476416,2014-07-30 21:32:48,ChrisVanHollen,182,66,TweetDeck,"No time for votes on immigration, #equalpay or #raisethewage—but suing POTUS? Sure! http://t.co/H74KYcuCnd"
494554883521904640,2014-07-30 18:47:27,ChrisVanHollen,33,10,Twitter for iPhone,We need to strengthen the middle class. We also need to #ActOnClimate. Here's a solution that does both: http://t.co/NJWDJ3WiFS
494529371936260096,2014-07-30 17:06:04,ChrisVanHollen,116,39,TweetDeck,.@SpeakerBoehner says he doesn't plan on impeaching POTUS. He said the same thing about shutting down the gov't.
494518415370227712,2014-07-30 16:22:32,ChrisVanHollen,6,7,TweetDeck,We can slow the effects of climate change while boosting the middle class. This one's a no-brainer: http://t.co/82Cf9SppDC
494506727610810368,2014-07-30 15:36:06,ChrisVanHollen,13,9,TweetDeck,"Announcing a simple, fair, effective way to combat climate change while putting money in Americans' pockets - http://t.co/f4xoiMe6OG"
494158928494596097,2014-07-29 16:34:04,ChrisVanHollen,6,0,TweetDeck,GOP leader refuses to rule out impeachment - http://t.co/cTmsjYX8be
494134711984611328,2014-07-29 14:57:50,ChrisVanHollen,77,35,TweetDeck,"If Republicans want to stand up for tax-dodging corporations, they should be willing to go on record. http://t.co/GwOiLvVzY6"
494119322231775232,2014-07-29 13:56:41,ChrisVanHollen,32,11,TweetDeck,.@USATODAY calls Boehner's lawsuit for what it is: a sideshow. http://t.co/YvSpSaOFlx
493886245869608960,2014-07-28 22:30:31,ChrisVanHollen,168,65,Twitter for iPhone,"GOP holding a vote to sue POTUS—not infrastructure, jobs, #RaiseTheWage, immigration, #bordercrisis, #RenewUI http://t.co/R5whp1NHIx"
493875949319245824,2014-07-28 21:49:36,ChrisVanHollen,91,33,TweetDeck,"57% oppose the GOP's bogus lawsuit; even more oppose impeaching the President. @SpeakerBoehner, are you listening? http://t.co/3W9gh15BUt"
492711478555070464,2014-07-25 16:42:25,ChrisVanHollen,170,57,TweetDeck,"The day after Paul Ryan releases his poverty plan, @HouseGOP votes to push 6 million kids deeper into poverty. Shameful. #talkpoverty"
492703914824040448,2014-07-25 16:12:21,ChrisVanHollen,47,0,TweetDeck,RT @HarrySteinDC: The ACA fixes the worst benefit cliffs that @RepPaulRyan calls a poverty trap. His own chart proves it. #TalkPoverty http…
492391406175264768,2014-07-24 19:30:34,ChrisVanHollen,26,10,TweetDeck,"In his poverty plan, Ryan proposes ""deficit neutral"" reform to 11 programs. His budget cuts those same 11 programs by 20%. Which is it?"
492382967939883010,2014-07-24 18:57:02,ChrisVanHollen,51,15,TweetDeck,Today Ryan releases poverty plan; tomorrow GOP voting to push 12 million ppl into poverty or deeper into poverty. Votes &gt; words.
492372942240899072,2014-07-24 18:17:11,ChrisVanHollen,30,12,TweetDeck,"As @sr_simone testified at 1st budget cmte poverty hearing, best way to support families = #RaiseTheWage. Not included in Ryan plan."
492322266940596225,2014-07-24 14:55:50,ChrisVanHollen,107,34,Twitter for iPhone,Reminder that over 2/3rds of the cuts in Ryan's budget come from progs for ppl w/ low/moderate incomes. #TalkPoverty http://t.co/dzycdYjDxY
492315589025996801,2014-07-24 14:29:17,ChrisVanHollen,74,40,TweetDeck,"Problem w/ @RepPaulRyan's plan is that he wants to ""reform"" the very programs his budget guts. Can't have it both ways. #TalkPoverty"
492011825203261440,2014-07-23 18:22:14,ChrisVanHollen,24,13,TweetDeck,Some states have a history of under-supporting their poor; block grants would give them flexibility to do even less. http://t.co/UQJvBCtgzA
491996489481482242,2014-07-23 17:21:18,ChrisVanHollen,19,12,TweetDeck,"A credible anti-poverty plan shld invest in education, from early childhood thru college &amp; job training. http://t.co/o8BJsPMbyQ #TalkPoverty"
491975558352601088,2014-07-23 15:58:08,ChrisVanHollen,11,6,TweetDeck,How will @RepPaulRyan be able to reconcile his poverty proposals w/ the stark realities of his Republican budget? http://t.co/wZBXDKQP8E
491957900227911680,2014-07-23 14:47:58,ChrisVanHollen,48,20,Twitter for iPhone,FACT: Vast majority of SNAP (food stamp) participants either work or aren't expected to work. http://t.co/Vm5T47e6E7 http://t.co/Bius8Fydgt
491936356927811584,2014-07-23 13:22:21,ChrisVanHollen,28,16,TweetDeck,"We cannot and should not allow ""reform"" to be a Trojan horse for slashing the safety net. http://t.co/Vm5T47e6E7"
491691318289371136,2014-07-22 21:08:40,ChrisVanHollen,42,0,TweetDeck,"RT @civilrightsorg: One reason we need to #renewUI: In 2012, unemployment insurance kept 2.5 million people, including 600,000 children, ou…"
491686628793257984,2014-07-22 20:50:02,ChrisVanHollen,37,20,TweetDeck,We must end the scandal that in America you can work 40hrs/wk all year &amp; still have to raise your family in poverty. http://t.co/S6JUQ7xuPI
491324339590275072,2014-07-21 20:50:25,ChrisVanHollen,24,8,Twitter for iPhone,"Democrats are committed to putting the #MiddleClassFirst – not special interests. 

http://t.co/MJf7k8i8bV http://t.co/aLkA156ffj"
491284202399498241,2014-07-21 18:10:56,ChrisVanHollen,27,10,TweetDeck,The Congressional Dutch Caucus sends our deepest condolences to the Dutch people and all those affected by #MH17. http://t.co/MOEccqTBm6
491274322410242049,2014-07-21 17:31:40,ChrisVanHollen,155,67,TweetDeck,"Your taxes go up when corporations move offshore to dodge theirs. Let's end these costly, unpatriotic tax inversions. http://t.co/RDBTiobI17"
491261656975290369,2014-07-21 16:41:20,ChrisVanHollen,22,18,Twitter for iPhone,Applaud POTUS for his commitment to #WorkplaceEquality for LGBT Americans. House shld follow suit by strengthening &amp; passing #ENDA.
491233144259895296,2014-07-21 14:48:03,ChrisVanHollen,160,0,TweetDeck,"RT @repjoecrowley: While GOP wastes time &amp; taxpayer $ suing POTUS, Dems have a plan to jumpstart our economy &amp; put  #MiddleClassFirst http:…"
490222110921744386,2014-07-18 19:50:33,ChrisVanHollen,89,42,TweetDeck,Fact checked @WSJ op-ed to spread truth re: inversion. Stop these unpatriotic tax dodges while we work on tax reform. http://t.co/53HbDpqV1M
490177471849824256,2014-07-18 16:53:11,ChrisVanHollen,185,82,TweetDeck,More and more U.S. companies are reincorporating overseas to dodge taxes. Time to close this loophole. http://t.co/ckJgJ7dlBy
490162220861751296,2014-07-18 15:52:34,ChrisVanHollen,68,43,TweetDeck,"RT @rosadelauro: Equal pay 4 equal work, child care, paid sick leave put #middleclassfirst. B/c when #womensucceed the middle class succeeds"
489803823117238272,2014-07-17 16:08:26,ChrisVanHollen,73,34,TweetDeck,Corporations shldn't be able to deduct CEO pay &gt;$1million from their taxes unless their employees get a raise too⟶http://t.co/JSAOf5KDaj
489477820733988864,2014-07-16 18:33:01,ChrisVanHollen,59,35,TweetDeck,Agree w/Sec. Lew— companies shouldn't be able to effectively renounce their US citizenship to lower their taxes. Inversion is unpatriotic.
489413483327676416,2014-07-16 14:17:21,ChrisVanHollen,156,73,TweetDeck,"As Republicans waste time &amp; money suing the President, Democrats remain committed to putting the #MiddleClassFirst: http://t.co/VeY74TBWiV"
489388100297031680,2014-07-16 12:36:30,ChrisVanHollen,76,28,Twitter for iPhone,"We need good-paying jobs, not lawsuits and shutdowns. Read @HouseDemocrats' plan to put the #MiddleClassFirst: http://t.co/qyYAY1UhMm"
489132395078377472,2014-07-15 19:40:25,ChrisVanHollen,13,4,Twitter Web Client,.@_AngelaMorabito POTUS request incl &gt;$1.5 billion emergency $ for ICE/@CustomsBorder -- but need #CIR for long term http://t.co/1kYWS3Yz8U
489130980033458176,2014-07-15 19:34:47,ChrisVanHollen,37,16,Twitter Web Client,Comprehensive immigration reform would be a boon to the economy. #AskDems http://t.co/nPNL42N7JE
489128048944762880,2014-07-15 19:23:09,ChrisVanHollen,73,41,Twitter Web Client,".@jasonenright If @SpeakerBoehner allowed a vote, #CIR would pass today. #AskDems http://t.co/Xt1sNwLfKx"
488745022393966593,2014-07-14 18:01:08,ChrisVanHollen,32,16,TweetDeck,Bosses belong in the board room -- not the bedroom.  The #NotMyBossBusiness Act will make sure they stay there. http://t.co/drnCuG0X5v
488006017582505985,2014-07-12 17:04:35,ChrisVanHollen,49,21,Twitter for iPhone,"If Rs want to increase border security, why are they blocking the immigration reform bill that would do just that? http://t.co/YO28etOOjY"
487726832544788480,2014-07-11 22:35:13,ChrisVanHollen,68,36,Twitter for iPhone,The uninsured rate is dropping like a rock thanks to the Affordable Care Act. http://t.co/T18eDLRQLV #ACAworks http://t.co/98Y0RqvsPG
