id,created_at,user,retweets,favorite_count,source,text
849028262399549445,2017-04-03 22:38:06,ChrisVanHollen,115,235,Twitter Web Client,"Let’s get this straight, @POTUS: Donating your salary won’t help the National Parks Service if your budget cuts the @Interior by $2 billion."
848932731203485700,2017-04-03 16:18:30,ChrisVanHollen,34,95,Twitter Web Client,Here's why @CoryBooker and I wrote to AG Sessions about rescinding an Obama-era policy to stop contracting with pri… https://t.co/HRvH3cCYC8
848623911520669700,2017-04-02 19:51:21,ChrisVanHollen,39,166,Twitter for iPhone,He needs to be sworn in by his own Intel Committee to testify about his source and White House participation. Tell the truth!
848623819367391232,2017-04-02 19:50:59,ChrisVanHollen,122,327,Twitter for iPhone,Rep. Nunes is either complicit or being duped in the White House ploy to distract from the Russia investigation. He's now part of the story.
848567190580285442,2017-04-02 16:05:58,ChrisVanHollen,35,106,Twitter Web Client,"On #WorldAutismAwarenessDay, let us all reaffirm our commitment to building a more inclusive society where all Amer… https://t.co/iicZEtMisR"
848343445156622336,2017-04-02 01:16:53,ChrisVanHollen,94,218,Twitter for iPhone,"This week, I stood with @SenateDems to call out President Trump for breaking yet another campaign promise: https://t.co/rvCQBImxAb"
847888407481266181,2017-03-31 19:08:44,ChrisVanHollen,12,100,Twitter Web Client,"Thanks for your Qs. I’ve got to run, but let’s do this again soon. We must keep putting pressure on @POTUS to save the #ChesBay. #BayChat"
847888121220018176,2017-03-31 19:07:35,ChrisVanHollen,53,161,Twitter Web Client,Today MD Senate passed SJ8 -- opposing Trump cuts to Bay program and calling on Gov. Hogan to join the opposition.… https://t.co/G4H68cqXSq
847887542129184769,2017-03-31 19:05:17,ChrisVanHollen,38,39,Twitter Web Client,Trump's budget also eliminates @USDA’s water &amp; wastewater loan &amp; grant program. This prgm invested $14.5M in MD’s rural communities #BayChat
847887057854881792,2017-03-31 19:03:22,ChrisVanHollen,39,146,Twitter Web Client,"Definitely broiled, no filler, no sauce, and that backfin better come from the Bay. Tell Trump to protect our crab… https://t.co/wpP3xVbUai"
847886483415597060,2017-03-31 19:01:05,ChrisVanHollen,1,5,Twitter Web Client,@MDLCV @MDLCV Thank you to LCV and all the advocates who are with us in this fight. #BayChat
847886209678442497,2017-03-31 19:00:00,ChrisVanHollen,41,138,Twitter Web Client,We're fighting tooth and nail to stop Trump's Bay cuts. Teaming up with Great Lake states and others who understand… https://t.co/CdCSrRGzNt
847885783398789120,2017-03-31 18:58:18,ChrisVanHollen,18,28,Twitter Web Client,"Cities and farming communities have the tools they need for cleanup, but also need @EPA funding support to get it d… https://t.co/s6B2GdaKUZ"
847884818092359685,2017-03-31 18:54:28,ChrisVanHollen,22,47,Twitter Web Client,"That's a great point, we've seen disease from pollution. News flash to Trump: Fish need clean water to live. Dirty… https://t.co/JA7s2Bf2Sn"
847883836369379328,2017-03-31 18:50:34,ChrisVanHollen,25,30,Twitter Web Client,"Alert: Trump's budget also eliminates federal funding for @MDSeaGrant, which gives research and best practices to Bay partners. #BayChat"
847883511835095042,2017-03-31 18:49:16,ChrisVanHollen,4,20,Twitter Web Client,Love @MrTrashWheel and @ProfTrashWheel! That's the kind of innovative project we need to stop trashing the Bay.… https://t.co/nuAEMeZ0mj
847882786262351872,2017-03-31 18:46:23,ChrisVanHollen,26,30,Twitter Web Client,"Zeros out the entire program, $73M/year to 6 states and DC. This results in steady poisoning of the Bay and gives g… https://t.co/mIuelu68eN"
847882039470813185,2017-03-31 18:43:25,ChrisVanHollen,12,27,Twitter Web Client,"Part of the @EPA #ChesBay Program. States do a lot of work but Feds provide $$, coordination, research and assistan… https://t.co/19YAwJYpSH"
847881317358469120,2017-03-31 18:40:33,ChrisVanHollen,14,53,Twitter Web Client,Keep the #EndangeredSpeciesAct strong and support @USFWS state and tribal wildlife grants. #BayChat https://t.co/64sZnSu8v8
847880155217506304,2017-03-31 18:35:56,ChrisVanHollen,28,39,Twitter Web Client,CBF says Bay Program will bring $130 billion in economic benefits to MD. Trump cuts would destroy Bay and these ben… https://t.co/H2FYQGo6aE
847879397738721281,2017-03-31 18:32:55,ChrisVanHollen,29,44,Twitter Web Client,Contact Republican Senators and Reps. from all Bay Watershed states -- say no to cuts! #BayChat https://t.co/SgTGaOIOvj
847878989876211712,2017-03-31 18:31:18,ChrisVanHollen,34,114,Twitter Web Client,"Hi folks, I’m here ready to answer your questions on Trump’s budget and its impact on the #ChesBay. Let’s do this.… https://t.co/zxohVcn2Hl"
847861028679557122,2017-03-31 17:19:56,ChrisVanHollen,49,145,Twitter for iPhone,Tens of millions of Americans leave prescription drugs unfilled b/c of high costs—that puts lives at risk. Let's pu… https://t.co/dvZXsVknIH
847848737552642048,2017-03-31 16:31:05,ChrisVanHollen,28,34,Twitter Web Client,Trump's budget cuts vital environmental funding in MD. What questions do you have for me? Ask w/ #BayChat and I'll… https://t.co/XQyZVkyr5h
847832561497890816,2017-03-31 15:26:49,ChrisVanHollen,11,0,Twitter Web Client,RT @BlueWaterBmore: Today! Senator @ChrisVanHollen will answer your questions about how Trump’s budget will impact the Chesapeake Bay. Twee…
847623073087995905,2017-03-31 01:34:23,ChrisVanHollen,33,0,Twitter for iPhone,"RT @sierraclubmd: This Friday, @ChrisVanHollen will answer your questions about how Trump’s budget will impact the Chesapeake Bay. https://…"
847559940101287936,2017-03-30 21:23:31,ChrisVanHollen,287,297,Twitter Web Client,"Mike Pence, a man who has implemented draconian laws to restrict women’s rights, has happily done it again. This ti… https://t.co/6YpRp7zxQB"
847556657341222913,2017-03-30 21:10:28,ChrisVanHollen,8,0,Twitter Web Client,RT @chesapeakebay: Tune in tomorrow for a #BayChat with Senator @ChrisVanHollen! #SaveTheBay! https://t.co/sPtR1mQ4Fu
847544352561913856,2017-03-30 20:21:34,ChrisVanHollen,6,0,Twitter Web Client,RT @MDLCV: Join Senator @ChrisVanHollen tomorrow to talk #ChesBay funding with #BayChat! https://t.co/PEZ6UaOVjC
847522637890891779,2017-03-30 18:55:17,ChrisVanHollen,129,297,Twitter Web Client,"Who do you work for again, @DevinNunes? There's a reason we have separation of powers. Recuse yourself from this in… https://t.co/IWOjoC8jkr"
847517297145204736,2017-03-30 18:34:04,ChrisVanHollen,27,44,Twitter Web Client,"To kick off #ChatsWithChris, tomorrow I'll take your questions on how Trump's budget will affect the Chesapeake Bay… https://t.co/LQ6lgsB5Qz"
847487950581489665,2017-03-30 16:37:27,ChrisVanHollen,49,87,Twitter Web Client,This is an attack on health care services for millions of women and families across Maryland and our country. #TitleX
847487782247292928,2017-03-30 16:36:47,ChrisVanHollen,116,132,Twitter Web Client,"This isn’t a joke: VP Pence, who has led efforts to restrict women’s right to reproductive health care, is breaking the tie on #TitleX."
847467753053106179,2017-03-30 15:17:12,ChrisVanHollen,227,342,Twitter Web Client,Let's not forget: This trip is costing taxpayers about 3 million dollars. There's no reason why Trump can't meet at… https://t.co/nF3BeEfwJu
847193008630063108,2017-03-29 21:05:27,ChrisVanHollen,15,0,Twitter Web Client,"RT @RoamtheDomes: #WorkandSave  ""Why in the world is it somehow a priority for this Senate to take away this State innovation to save?"" @Ch…"
847171319649226753,2017-03-29 19:39:16,ChrisVanHollen,77,239,Twitter Web Client,I applaud MD General Assembly for taking action to protect Planned Parenthood services that so many rely on #PinkOut https://t.co/sHBqkN7EFd
847152322216181763,2017-03-29 18:23:47,ChrisVanHollen,130,301,Twitter Web Client,I strongly oppose President Trump’s efforts to block states like Maryland from helping people save for their retire… https://t.co/ZOrZpRMMHG
847127989687128064,2017-03-29 16:47:06,ChrisVanHollen,124,250,Twitter Web Client,Judge Gorsuch doesn’t fit the bill of a Supreme Court Justice. Here’s why ↓ https://t.co/wDbmYq9ZWb
846882392900079616,2017-03-29 00:31:11,ChrisVanHollen,362,555,Twitter Web Client,This is sleeper issue that will haunt all who voted for it. Protecting privacy is an American value and shouldn't b… https://t.co/3nNeBD9Chp
846853372212924416,2017-03-28 22:35:52,ChrisVanHollen,2796,0,Twitter Web Client,RT @BraddJaffy: NBC News: GOP Rep. Walter Jones becomes the first House Republican to publicly call for Nunes to recuse himself from Russia…
846796034076479488,2017-03-28 18:48:01,ChrisVanHollen,275,982,Twitter Web Client,"With so much at stake, we need a nominee who will be impartial. Gorsuch is not that nominee. https://t.co/W0IejB304I"
846768179405828096,2017-03-28 16:57:20,ChrisVanHollen,48,130,Twitter Web Client,Supporting @NIH funding is vital to our future and working towards a goal to end Alzheimer’s should remain a bipart… https://t.co/ZFqB3wrRc6
846730888427831297,2017-03-28 14:29:09,ChrisVanHollen,29,118,Twitter Web Client,The Chesapeake Bay is vital to Maryland's economy. I made sure Trump’s pick to lead the @USDA heard my concerns. https://t.co/QEcDoFq2mX
846713904629735424,2017-03-28 13:21:40,ChrisVanHollen,18,0,Twitter for iPhone,"RT @AANCAC: ""A strong country requires investment in a vibrant research program to move us forward."" - @ChrisVanHollen #ALZForum #ENDALZ ht…"
846502989728768000,2017-03-27 23:23:34,ChrisVanHollen,435,870,Twitter Web Client,"Chairman Nunes has disqualified himself from any further involvement in the investigation. He is a Trump partisan,… https://t.co/xH0Pp4vAkc"
846497215560470528,2017-03-27 23:00:38,ChrisVanHollen,376,653,Twitter Web Client,Dear AG Sessions: Were any investigations of @DeutscheBank a factor when Trump decided to fire @PreetBharara? https://t.co/zdmXwwxCD5
846484751426949120,2017-03-27 22:11:06,ChrisVanHollen,35,116,Twitter Web Client,"Thanks for making your voice heard, Amy. I'll do everything I can to ensure @POTUS doesn't take our country down th… https://t.co/jjkO4SBfIb"
846407859428638720,2017-03-27 17:05:33,ChrisVanHollen,7,39,Twitter Web Client,Had a great workshop @bmoreccc over the weekend to discuss how we can empower women &amp; families to control their fin… https://t.co/h3BJ0jci4J
846382383318355969,2017-03-27 15:24:19,ChrisVanHollen,145,326,Twitter Web Client,Kushner’s mtg w/ the head of a Russian bank is one more reason to demand an investigation into the Trump Admin's co… https://t.co/sk8OLOHPEf
846076738438402052,2017-03-26 19:09:48,ChrisVanHollen,28,141,Twitter for iPhone,Proud to introduce a bill with @SenatorCardin that supports Maryland's small businesses in distressed communities.… https://t.co/AygkF0hNiu
845682145301610496,2017-03-25 17:01:50,ChrisVanHollen,136,354,Twitter for iPhone,"On #MarylandDay, we celebrate the great geographic and demographic diversity of our state: America in Miniature! https://t.co/r0KYM0Zv9z"
845647748129009665,2017-03-25 14:45:09,ChrisVanHollen,58,139,Twitter for iPhone,"This week, I met with a 6-year-old whose life was saved by @NIH &amp; @CDCgov research. Read her letter and story:… https://t.co/L6m77SM0E1"
845378330400579584,2017-03-24 20:54:34,ChrisVanHollen,127,562,Twitter Web Client,This is a win for the 24 million Americans who would have lost their health care. What happened to the king of 'The Art of the Deal'?
845377359243083778,2017-03-24 20:50:43,ChrisVanHollen,105,387,Twitter Web Client,For 7 years the @GOP has been committed to ‘repeal and replace’—they just forgot to think about ‘replace with what’.
845348547721662465,2017-03-24 18:56:14,ChrisVanHollen,122,231,Twitter Web Client,.@POTUS said just this week the Keystone XL would be “made with American steel.” Not True! Another broken promise to working Americans.
845299571207090176,2017-03-24 15:41:37,ChrisVanHollen,26,0,Twitter for iPhone,RT @CAPAction: .@ChrisVanHollen: About 30 members of the House are considering opposing Trumpcare. Here's the list: https://t.co/JoS9yJ7AyK
845299428605022208,2017-03-24 15:41:03,ChrisVanHollen,13,0,Twitter for iPhone,"RT @AngelaHanks: .@ChrisVanHollen: Freedom Caucus has spent lot of time bargaining for things (Medicaid work req, essential services cut) t…"
845298295509602306,2017-03-24 15:36:33,ChrisVanHollen,70,198,Twitter Web Client,"The new @QuinnipiacPoll:

Trump’s approval rating: 37%
Disapproval rating: 56%

Folks are finally catching on to Trump's conman tactics."
845297347542368257,2017-03-24 15:32:47,ChrisVanHollen,85,94,Twitter Web Client,The ‘terrific’ budget plan will slash @NIHFunding by 20%—that means ending research on cures and treatment for diseases that impact so many.
845294999055011840,2017-03-24 15:23:27,ChrisVanHollen,56,86,Twitter Web Client,"Most #Medicaid dollars go to provide care to the elderly &amp; people with disabilities. These aren’t nameless, faceles… https://t.co/IXBveDUSjE"
845294002991742977,2017-03-24 15:19:29,ChrisVanHollen,113,72,Twitter Web Client,"Under the GOP health care plan, millions of Americans will lose their care, while the richest 400 families get an a… https://t.co/xi4eGm3MlN"
845293451449131009,2017-03-24 15:17:18,ChrisVanHollen,83,74,Twitter Web Client,"#Wealthcare:

24 million will lose insurance ✅
Slashes Medicaid ✅
Leaves older Americans with high costs ✅
Gives ta… https://t.co/0SA8RqaxS9"
845293039425933312,2017-03-24 15:15:40,ChrisVanHollen,33,0,Twitter Web Client,"RT @CAPAction: .@ChrisVanHollen reminds us that Trump was ""first &amp; only potential GOP candidate"" to promise not to cut Medicare &amp; Medicaid.…"
845292361982849026,2017-03-24 15:12:58,ChrisVanHollen,62,66,Twitter Web Client,"Back in 2015, @realDonaldTrump tweeted this. But, in the last few weeks, the rubber has hit the road with his new… https://t.co/lLGKq1kvzc"
845288598329069568,2017-03-24 14:58:01,ChrisVanHollen,19,21,Twitter Web Client,Tune in as I speak at @CAPAction about the winners and losers of Trump’s health care and budget plan: https://t.co/ENshg6VBL0
845276217431539712,2017-03-24 14:08:49,ChrisVanHollen,10,0,TweetDeck,RT @CAPAction: Tune in this morning as we talk winners and losers of #Trumpcare with @ChrisVanHollen:  https://t.co/FITLXrSfkl #ProtectOurC…
845093939896107010,2017-03-24 02:04:31,ChrisVanHollen,9,65,Twitter for iPhone,My heart goes out to the Cochran family and all those in London. We will not rest until we defeat ISIS. https://t.co/N3jTrxhU48
845072154966343682,2017-03-24 00:37:57,ChrisVanHollen,15,0,Twitter Web Client,RT @CAPAction: Join us tomorrow at 11AM to talk winners and losers of #Trumpcare and Trump's budget with @ChrisVanHollen. https://t.co/Gdzi…
845052824476102656,2017-03-23 23:21:08,ChrisVanHollen,53,70,Twitter Web Client,Independent Medicare actuary confirms GOP plan will increase #Medicare premiums for millions to give big Pharma tax cuts. #ProtectOurCare
845052333549670400,2017-03-23 23:19:11,ChrisVanHollen,71,162,Twitter Web Client,Republicans will vote to increase #Medicare premiums to give big Pharma tax cuts. This is unacceptable. #ProtectOurCare
845028714245185537,2017-03-23 21:45:20,ChrisVanHollen,174,0,Twitter Web Client,"RT @SenatorCardin: The nonpartisan @USCBO reports 24 million Americans will lose their health coverage if #Trumpcare passes.

Here's what t…"
845002786823655424,2017-03-23 20:02:18,ChrisVanHollen,28,104,Twitter for iPhone,"Looks like the @freedomcaucus hasn't fallen for @POTUS's con quite yet, let's wait and see what happens... https://t.co/OBoLTqDphK"
844990927940792321,2017-03-23 19:15:11,ChrisVanHollen,37,72,Twitter Web Client,Reliable &amp; affordable health care is a basic human right. Stop playing partisan politics with the health of America… https://t.co/1YsldQi71Z
844990257774940160,2017-03-23 19:12:31,ChrisVanHollen,44,51,Twitter Web Client,GOP's plan gives a $590B windfall tax break to the ultra-wealthy &amp; insurance companies while making huge cuts to Medicaid.
844990142884536321,2017-03-23 19:12:03,ChrisVanHollen,34,53,Twitter Web Client,"The ACA isn’t perfect, but GOP's plan doesn’t fix anything. #WealthCare doesn’t reduce costs or help protect more ppl. So, what’s the point?"
844989987586215936,2017-03-23 19:11:26,ChrisVanHollen,87,152,Twitter Web Client,"7 yrs ago today, @BarackObama signed the ACA into law. Today, more than 20M Americans have access to safe and relia… https://t.co/Dda4FGg3ju"
844968489416830976,2017-03-23 17:46:01,ChrisVanHollen,15,40,Twitter Web Client,"Neither is likely to survive the Byrd Bath in the Senate. Lousy Negotiators, @freedomcaucus!"
844968390926176256,2017-03-23 17:45:37,ChrisVanHollen,21,28,Twitter Web Client,"In exchange, @FreedomCaucus is getting the removal of Essential Benefits and inclusion of Medicaid work requirements."
844968183245279233,2017-03-23 17:44:48,ChrisVanHollen,33,50,Twitter Web Client,Important: The @FreedomCaucus is being conned into voting for the disastrous @HouseGOP health care bill.
844953648824307713,2017-03-23 16:47:03,ChrisVanHollen,17,56,Twitter Web Client,Caring for all Americans shouldn’t be a partisan issue. Thanks to Alec for sharing his story to fight to… https://t.co/FDazNaf78E
844952504857231360,2017-03-23 16:42:30,ChrisVanHollen,0,2,Twitter Web Client,@EricaSante @BenCardinforMD Thank you Erica. We are fighting right there with you. #ProtectOurCare #SaveACA
844905919733485573,2017-03-23 13:37:23,ChrisVanHollen,177,167,Twitter Web Client,Trump's #budget cuts would seriously damage Maryland’s efforts to clean up the Chesapeake Bay. Get the facts:… https://t.co/dIv7eoRjo1
844731852627750912,2017-03-23 02:05:42,ChrisVanHollen,85,252,Twitter for iPhone,"Our country's democratic values have been sacrificed for far too long, @GOP. Isn't it finally time to put our count… https://t.co/zgn5xOYPWB"
844731600671854592,2017-03-23 02:04:42,ChrisVanHollen,107,387,Twitter for iPhone,New info suggests Trump associates may have coordinated with Russians. A real investigation is past due.
844717176053530625,2017-03-23 01:07:23,ChrisVanHollen,19,157,Twitter for iPhone,My thoughts and prayers are with our friends in London after today’s tragic attack.
844686984421527552,2017-03-22 23:07:25,ChrisVanHollen,128,247,Twitter Web Client,Dear @POTUS: The disability community and I will fight every day to stop Trumpcare. Here’s why: https://t.co/z72oXk8dAM
844611246926315521,2017-03-22 18:06:28,ChrisVanHollen,69,80,Twitter Web Client,It’s clear: #Trumpcare tax savings would go directly in the pockets of the ultra-rich. #Wealthcare https://t.co/7NbwjWYITI
844605427312738314,2017-03-22 17:43:20,ChrisVanHollen,168,315,Twitter Web Client,Two thumbs up for the Supreme Court decision that recognizes every child deserves the opportunity for a quality edu… https://t.co/7ulAIdspw5
844585368628400131,2017-03-22 16:23:38,ChrisVanHollen,29,0,Twitter Web Client,RT @TheNWHN: @ChrisVanHollen - Everybody counts. Nobody should be left behind. At the #SaveMedicaid press conference. #ProtectOurCare. http…
844569664474767360,2017-03-22 15:21:14,ChrisVanHollen,337,0,TweetDeck,RT @SenBobCasey: #Trumpcare’s draconian cuts to Medicaid will rollback rhe rights of persons with disabilities. Watch Live https://t.co/RKP…
844569106825252865,2017-03-22 15:19:01,ChrisVanHollen,29,42,Twitter Web Client,@MaxineJones18 @SenBobCasey It looks like there were some technical difficulties. You can watch it here: https://t.co/HQskeLaT10
844567131320700931,2017-03-22 15:11:10,ChrisVanHollen,104,229,Twitter Web Client,Tune in as I join @SenBobCasey and others to highlight how #Trumpcare will harm people with disabilities: https://t.co/OYiwm3JzZa
844549772711280641,2017-03-22 14:02:11,ChrisVanHollen,55,160,Twitter Web Client,CEOs out-earn their typical employees an avg. 335:1. Unjustifiable!  We must fight to ensure hardworking Americans get a fair shake.
844319653195321344,2017-03-21 22:47:46,ChrisVanHollen,45,78,Twitter Web Client,Employers must be held accountable for workers' safety. Rolling back this #OSHA rule would be harmful to millions. https://t.co/uuFQrG3qBW
844314461913710592,2017-03-21 22:27:08,ChrisVanHollen,569,0,Twitter for iPhone,RT @SenJeffMerkley: Led 37 fellow Senators to call for a reversal to dangerous #TrumpCuts to @EPA that would devastate Americans’ clean air…
844301663699714049,2017-03-21 21:36:17,ChrisVanHollen,16,67,Twitter Web Client,This is an important investment that will help Maryland’s young people get ahead. https://t.co/DQTLDlsA2u
844292900422868994,2017-03-21 21:01:28,ChrisVanHollen,5,21,Twitter for iPhone,Congrats to the @HarfordCC women’s basketball team—proud of your historic victory. That’s what I’d call a slam dunk!🏀https://t.co/z3vct0M3H4
844276161114988545,2017-03-21 19:54:57,ChrisVanHollen,25,99,Twitter Web Client,It is a scandalous tax windfall for the rich &amp; powerful and a raw deal for everyone else.
844276012326240256,2017-03-21 19:54:21,ChrisVanHollen,65,244,Twitter Web Client,I will do everything possible to stop @SenateMajLdr and @POTUS from ramming this monstrosity through the Senate. https://t.co/nhWyNIePwv
844268539708104704,2017-03-21 19:24:40,ChrisVanHollen,99,171,Twitter Web Client,"I oppose #SJRes18. It’s cruel, inhumane, and wrong. I urge my fellow @SenateGOP members to do the same. https://t.co/7ba7VDOqB0"
844268331117006848,2017-03-21 19:23:50,ChrisVanHollen,38,131,Twitter Web Client,"Instead of the GOP talking about jobs, they’re debating inhumane hunting practices that are needlessly cruel to our wildlife."
844260860973465604,2017-03-21 18:54:09,ChrisVanHollen,94,0,Twitter Web Client,RT @NAACP_LDF: .@SenFeinstein asking #Gorsuch about his record on employment discrimination cases. Learn more. Read our report: https://t.c…
844257531929247749,2017-03-21 18:40:55,ChrisVanHollen,42,137,Twitter Web Client,"Thanks for standing up against special interests and making sure our DISCLOSE Act is done justice, @SenWhitehouse. https://t.co/mVJWp1sQ6S"
844249619911598084,2017-03-21 18:09:29,ChrisVanHollen,16,91,Twitter Web Client,"On #NationalAgDay, I pledge to fight for MD's farmers as the first Marylander in almost 100 years to be a member of… https://t.co/IPXRJUlPgu"
844235014464294913,2017-03-21 17:11:27,ChrisVanHollen,11,0,TweetDeck,"RT @kojoshow: ""We need transparency."" @ChrisVanHollen responds to state-kept data about dangerous intersections: https://t.co/5M8BgDNiJi"
844215857547018244,2017-03-21 15:55:19,ChrisVanHollen,56,0,TweetDeck,"RT @ChrisVanHollen: Our next Supreme Court Justice must follow the tradition of the Constitution, and ensure equal rights, justice, and opp…"
844013900492427265,2017-03-21 02:32:49,ChrisVanHollen,56,172,Twitter for iPhone,"Our next Supreme Court Justice must follow the tradition of the Constitution, and ensure equal rights, justice, and… https://t.co/9Vmvk6bDAa"
843968365114900480,2017-03-20 23:31:53,ChrisVanHollen,42,211,Twitter Web Client,I will continue to fight day and night to #ProtectOurCare. https://t.co/Owdq8lNCkD
843968133656432642,2017-03-20 23:30:57,ChrisVanHollen,48,116,Twitter Web Client,It was an eye-opening discussion that confirmed my steadfast conviction: Trumpcare is a disaster for Marylanders.
843967930165596164,2017-03-20 23:30:09,ChrisVanHollen,31,96,Twitter Web Client,"Today, I joined @SenatorCardin, health experts &amp; advocates at @HopkinsHowardC to discuss what repealing the #ACA wo… https://t.co/RjPKjXhXM0"
843894621063331841,2017-03-20 18:38:51,ChrisVanHollen,83,137,Twitter Web Client,America’s doctors are ringing the alarm bell on Trumpcare. Elected officials should listen! https://t.co/uyCO2ZY4JF
843880046045683712,2017-03-20 17:40:56,ChrisVanHollen,60,139,Twitter Web Client,DOJ &amp; the White House must allow FBI Director Comey’s investigation to continue without any interference or political pressure #ComeyHearing
843879123101634562,2017-03-20 17:37:16,ChrisVanHollen,57,199,Twitter Web Client,"We must continue to investigate Russia’s ties to Trump campaign, and Russia’s attempt to sabotage democratic elections."
843877143419535360,2017-03-20 17:29:24,ChrisVanHollen,47,110,Twitter Web Client,This episode has damaged our national security. @POTUS must let Americans know that he recognizes the difference between fact and fiction.
843876920613900289,2017-03-20 17:28:31,ChrisVanHollen,128,242,Twitter Web Client,There’s no evidence to back up @POTUS’s wiretapping claims. Trump owes @BarackObama and the American people an apol… https://t.co/Gs7mUpBY27
843484743899529216,2017-03-19 15:30:08,ChrisVanHollen,169,363,Twitter for iPhone,We have entered a dangerous new world when we are not able to trust what our President says when it matters most. https://t.co/Ruzmeo4XMT
842860321127763969,2017-03-17 22:08:54,ChrisVanHollen,454,799,Twitter Web Client,"For Marylanders, Trumpcare would be a disaster for our citizens. You’re not fooling anyone, @POTUS: https://t.co/bIUfOdnali"
842849934575452161,2017-03-17 21:27:38,ChrisVanHollen,21,0,Twitter Web Client,"RT @MeetThePress: .@ChrisVanHollen on SCOTUS nominee Gorsuch: ""What I think is important to the country is that we thoroughly vet his recor…"
842844533536804864,2017-03-17 21:06:10,ChrisVanHollen,10,0,Twitter Web Client,RT @MeetThePress: Tonight on #MTPDaily: @ChrisVanHollen joins @chucktodd
842776408195809284,2017-03-17 16:35:28,ChrisVanHollen,177,0,Twitter Web Client,"RT @ArmstrongDrew: Four GOP governors just came out against the Republican health bill: Ohio, Arkansas,Michigan, Nevada https://t.co/rZcWWc…"
