id,created_at,user,retweets,favorite_count,source,text
565999747795005440,2015-02-12 22:23:50,CongMikeSimpson,4,0,Twitter Web Client,RT @IdahoRuralWater: Thank you to our Idaho representatives that took the time to visit with IRWA during the annual Water Rally visit! http…
565912102549069825,2015-02-12 16:35:34,CongMikeSimpson,6,0,Twitter Web Client,"RT @HouseAppropsGOP: .@CongMikeSimpson, @KenCalvert &amp; Energy Sbcmte are now holding a hearing on the Bureau of Reclamation budget. http://t…"
565888877559562240,2015-02-12 15:03:16,CongMikeSimpson,3,5,Twitter Web Client,Today we celebrate the birthday of President Abraham Lincoln-The 16th President of the US created the Idaho Territory http://t.co/Z5YR2YlTzs
565671245166161926,2015-02-12 00:38:29,CongMikeSimpson,3,2,Twitter Web Client,House passes Senate Keystone pipeline bill with bipartisan support - moves to President for approval  http://t.co/FohIwyIRI8
565543370832220160,2015-02-11 16:10:21,CongMikeSimpson,3,0,Twitter Web Client,RT @HouseAppropsGOP: #EnergyWater Chairman @CongMikeSimpson convenes the 1st Subcommittee hearing for FY16 with @USACEHQ. http://t.co/dmFqW…
565543067919593473,2015-02-11 16:09:09,CongMikeSimpson,5,0,Twitter Web Client,"RT @HouseAppropsGOP: #Interior Chair @KenCalvert, alongside @CongMikeSimpson &amp; @TomColeOK04, convenes the first Approps hearing for FY16. h…"
562979751108038658,2015-02-04 14:23:26,CongMikeSimpson,5,0,Twitter Web Client,Read Congressman Simpson's op-ed on the national debt &amp; what Congress must do to address this issue. http://t.co/8OKTYrBOsR
562664827685187585,2015-02-03 17:32:03,CongMikeSimpson,3,2,Twitter Web Client,"Recent @theIOM report recommends that the USDA allow fresh, white potatoes to be eligible in the WIC program http://t.co/bszsK5vrlM"
562366334315823104,2015-02-02 21:45:57,CongMikeSimpson,4,0,Twitter Web Client,"RT @DOE_SC_NSB: Exciting News! Treasure Valley Math and Science Center (Boise, ID) advances to the National Finals! @BSDEducation http://t.…"
562249301272039424,2015-02-02 14:00:54,CongMikeSimpson,1,0,Twitter Web Client,Simpson &amp; Kelly introduce dental health bill to encourage early care and reduce health care system costs. READ MORE: http://t.co/QdzvK89MhP
557901761416298496,2015-01-21 14:05:19,CongMikeSimpson,4,0,Twitter Web Client,"Simpson responds to the #SOTU with GOP vision - simplify taxes, energy independence, reduce deficit http://t.co/g1gohtQSl4"
555448248807456768,2015-01-14 19:35:56,CongMikeSimpson,6,2,Twitter Web Client,Congressman Simpson supports bill to reform regulatory process and reduce uncertainty that harms the economy. http://t.co/3B06je0Rsn
555108754472333312,2015-01-13 21:06:55,CongMikeSimpson,3,0,Twitter Web Client,Simpson introduces truck weight increase legislation to put Idaho on level playing field with neighboring states. http://t.co/ac0bskQx8t
553585612859932672,2015-01-09 16:14:29,CongMikeSimpson,3,1,Twitter Web Client,Simpson and Schrader Reintroduce Legislation to Fix Wildfire Budget http://t.co/knUZjFQMe0
547084648350617601,2014-12-22 17:41:59,CongMikeSimpson,1,2,Twitter Web Client,2-Our thoughts are with their families and loved ones and we pray for the safety of those who serve and protect.
547084593950515201,2014-12-22 17:41:46,CongMikeSimpson,1,2,Twitter Web Client,1-Kathy and I mourn the loss of the NYPD officers who were lost this weekend protecting their community.
542849494849945600,2014-12-11 01:12:59,CongMikeSimpson,4,1,Twitter Web Client,Simpson Touts Vital Idaho Priorities Included in Cromnibus http://t.co/lVJ1OkJPkU
542849349240496131,2014-12-11 01:12:25,CongMikeSimpson,10,0,Twitter Web Client,RT @MODAdvocacy: #Marchofdimes sends profound thanks to @CongMikeSimpson for his leadership &amp; efforts in the final passage of #newbornscree…
540651217030897664,2014-12-04 23:37:49,CongMikeSimpson,2,2,Twitter Web Client,"Simpson Opposes Unilateral Action By POTUS- Insists that Congress debate, and vote on long-term Middle East strategy http://t.co/XHYKj36Lel"
537976611665358849,2014-11-27 14:29:54,CongMikeSimpson,1,1,Twitter Web Client,Kathy &amp; I would like to extend our wishes for happy &amp; safe Thanksgiving. Thankful for the opportunity to rep. &amp; work w/ many great Idahoans.
537681711849820160,2014-11-26 18:58:04,CongMikeSimpson,2,1,Twitter Web Client,Simpson to Forest Service: Observe First Amendment in Wilderness http://t.co/wT8Wog4haU
535109519471550465,2014-11-19 16:37:05,CongMikeSimpson,4,0,Twitter Web Client,The @DeptVetAffairs will conduct a town hall in Mt. Home Nov. 20th from 5 -7 PM at American Legion Post 26 http://t.co/9759CLiB6C
534822235077623808,2014-11-18 21:35:32,CongMikeSimpson,0,0,Twitter Web Client,Congrats to Shannon Bragg-Sitton from ID for receiving Mary Jane Oestmann Professional Women’s Achievement Award from American Nuclear Soc.
533323632697954305,2014-11-14 18:20:37,CongMikeSimpson,1,4,Twitter Web Client,"Simpson supports Keystone XL Pipeline, calls on the White House to stop delaying project http://t.co/5CDkJ2AUPv"
532176943295504384,2014-11-11 14:24:05,CongMikeSimpson,1,1,Twitter Web Client,Please join Kathy and I in our prayers for their family and the entire Idaho National Guard community.
532176850404265985,2014-11-11 14:23:43,CongMikeSimpson,2,1,Twitter Web Client,Idahoans should take a special moment to honor Chief Warrant Officer Stien P. Gearhart &amp; Chief Warrant Officer Jon L. Hartway who passed Thu
532176769873620992,2014-11-11 14:23:23,CongMikeSimpson,2,3,Twitter Web Client,Take time on this November day to pause and honor the brave men and women who served our country and continue to serve.
530737339417776128,2014-11-07 15:03:37,CongMikeSimpson,2,2,Twitter Web Client,Please keep the men and women of the ID @NationalGuard in your thoughts today following last night's tragic crash.
525726293967781888,2014-10-24 19:11:30,CongMikeSimpson,1,0,Twitter Web Client,RT @LuckyLeilani: Listening to @CongMikeSimpson speak about the importance of #Nuclear #Energy for #NuclearScienceWeek at #IANS http://t.co…
524619370677673984,2014-10-21 17:52:59,CongMikeSimpson,0,1,Twitter Web Client,Congressman Simpson was honored to receive the Friend of the Farm Bureau award from @FarmBureau http://t.co/SMfoOYdwWQ
523188652357459968,2014-10-17 19:07:49,CongMikeSimpson,0,2,Twitter Web Client,".@INL continues to be a driving force in ID's economy and the lab should be proud of the important work.
 http://t.co/HaWnJnMfDF"
519138471441870848,2014-10-06 14:53:51,CongMikeSimpson,2,1,Twitter Web Client,Simpson sends letter to EPA/USDA/Corps expressing concerns about the impacts of the proposed clean water act rule http://t.co/1msWAkT6UZ
512326031353864192,2014-09-17 19:43:39,CongMikeSimpson,2,2,Twitter Web Client,Simpson supported the Federal Reserve Transparency Act which will provide important oversight for US monetary policy http://t.co/Ih43WQ3RTN
511557102545162240,2014-09-15 16:48:12,CongMikeSimpson,3,1,Twitter Web Client,"Yesterday marked the 200th anniversary of the birth of the ""Star-Spangled Banner"". http://t.co/rtTWYA1IAl"
510088421499764736,2014-09-11 15:32:11,CongMikeSimpson,4,3,Twitter Web Client,2)  and members of the Armed Forces that so bravely served our country and continue to serve in the name of freedom.
510088374460616704,2014-09-11 15:32:00,CongMikeSimpson,3,1,Twitter Web Client,"1) Today we pause to remember and honor the victims of September 11, 2001, the first responders, law enforcement personnel…"
502161668546498560,2014-08-20 18:34:06,CongMikeSimpson,2,0,Twitter Web Client,RT @EnergyLeif: @CongMikeSimpson introducing @ErnestMoniz http://t.co/q53LkGePbc
494859192490942464,2014-07-31 14:56:40,CongMikeSimpson,3,1,Twitter Web Client,Simpson was honored to support HR 3230 to improve access and accountability at the VA.  http://t.co/qOErFy4CFI
493811180549722113,2014-07-28 17:32:14,CongMikeSimpson,2,1,Twitter Web Client,Simpson's wilderness water bill to authorize water diversions that pre-date Idaho wilderness laws signed into law http://t.co/Gac7AXaY63
492424143552647168,2014-07-24 21:40:39,CongMikeSimpson,0,0,Twitter Web Client,(2/2)...through demonstrating knowledge and skills in a subject opposed to  credit hours that often create costs and time constraints
492424046903312384,2014-07-24 21:40:16,CongMikeSimpson,2,0,Twitter Web Client,(1/2) Simpson supports bipartisan HR 3136 to direct @usedgov to create education projects to allow students to earn their degree...
490174848296321024,2014-07-18 16:42:45,CongMikeSimpson,1,0,Twitter Web Client,VIDEO: Simpson opposes amendment which would eliminate 1 /yr delay language in House Interior Appropriations bill https://t.co/eQhaBK29Nv
489798404235878400,2014-07-17 15:46:54,CongMikeSimpson,0,0,Twitter Web Client,"Simpson applauds @HouseAppropsGOP AG Subcommittee decision to block US Sheep Experimental Station in Dubois, Idaho http://t.co/c5ReBrsajT"
489146958209359872,2014-07-15 20:38:17,CongMikeSimpson,1,1,Twitter Web Client,Simpson defends western priorities in @HouseAppropsGOP Interior bill for FY15. http://t.co/7UmOTkZ4EO
488751369999106048,2014-07-14 18:26:21,CongMikeSimpson,1,0,Twitter Web Client,Simpson speaks during consideration of the E&amp;W bill about the @HouseAppropsGOP commitment to fiscal responsibility http://t.co/u6HlH5xwDX
487689297366368256,2014-07-11 20:06:03,CongMikeSimpson,3,0,Twitter Web Client,House Passes Chairman Simpson's Energy &amp; Water Appropriations bill that includes critical funding for @INL programs http://t.co/mBeocLzL7t
487275326352146432,2014-07-10 16:41:05,CongMikeSimpson,1,1,Twitter Web Client,Simpson champions ID priorities in Interior @HouseAppropsGOP bill- includes PILT &amp; wildfire funding &amp; limits EPA regs http://t.co/8T5hop7VAk
486925204342734849,2014-07-09 17:29:50,CongMikeSimpson,3,0,Twitter Web Client,Follow Chairman Simpson as he offers the Energy &amp; Water @HouseAppropsGOP bill http://t.co/fbOEEjARRj
484704170101178370,2014-07-03 14:24:14,CongMikeSimpson,8,0,Twitter Web Client,"RT @INL: Govts, @INL, industry to discuss energy solutions. Keynotes: @EnergySec @ErnestMoniz, @CongMikeSimpson, @pwrhungry http://t.co/HO3…"
482633711041929216,2014-06-27 21:16:58,CongMikeSimpson,0,0,Twitter Web Client,Simpson and @repgregwalden Move to Stop Closure of Idaho Sheep Research Station http://t.co/Y21HSdR2MZ
482223744497508352,2014-06-26 18:07:54,CongMikeSimpson,3,0,Twitter Web Client,Simpson supports House @NatResources and @HouseCommerce bills to increase energy independence and create jobs. http://t.co/09e2lQujrL
481881740840271872,2014-06-25 19:28:54,CongMikeSimpson,1,0,Twitter Web Client,Simpson's Newborn Screening reauthorization updates and builds upon landmark 2008 Newborn Screening Saves Lives Act. http://t.co/q3vgI1pTGs
480081790653452288,2014-06-20 20:16:33,CongMikeSimpson,2,1,Twitter Web Client,Simpson supports A-10 amendment to @DeptofDefense appropriations bill that passed the House. http://t.co/bRdykbeHXY
479378010085552128,2014-06-18 21:39:58,CongMikeSimpson,2,2,Twitter Web Client,Simpson boosts @INL funding in E&amp;W @HouseAppropsGOP passed bill. Reverses Obama Administration’s nuclear cuts. http://t.co/6IrOftyB7r
479294809967194112,2014-06-18 16:09:22,CongMikeSimpson,2,0,Twitter Web Client,RT @HouseAppropsGOP: .@CongMikeSimpson presenting $34B Energy and Water Appropriations bill before the full committee. http://t.co/koGq2gvU…
479294782037307392,2014-06-18 16:09:15,CongMikeSimpson,3,0,Twitter Web Client,"RT @HouseAppropsGOP: .@CongMikeSimpson: Bill takes strong stand vs. gvmt overreach by prohibiting changes to definitions of ""waters of the …"
479265360995430400,2014-06-18 14:12:21,CongMikeSimpson,4,3,Twitter Web Client,Recent @thumbtack survey finds Boise is #2 city in US for small business friendliness. Great for Idaho economy. http://t.co/VYLKGP2TAu
477131867599409152,2014-06-12 16:54:36,CongMikeSimpson,6,0,Twitter Web Client,"RT @NEI: READ: House Panel Boosts Federal Nuclear Funding, Provides Funds to Continue #Yucca Review http://t.co/94GOEBi4Fi @CongMikeSimpson"
476834437716783104,2014-06-11 21:12:43,CongMikeSimpson,2,1,Twitter Web Client,Congressman Mike Simpson had the opportunity to meet with TRIO students from Idaho on Tuesday. http://t.co/g41rX0RE34
476779659909406720,2014-06-11 17:35:03,CongMikeSimpson,1,2,Twitter Web Client,T-HUD @HouseAppropsGOP bill passes House with Simpson’s truck weight language intact which strengthens ID's economy http://t.co/XD3he0h9Go
476459138713919489,2014-06-10 20:21:25,CongMikeSimpson,2,1,Twitter Web Client,Simpson supports House passed Veterans Access to Care Act-Another step @HouseGOP has taken to address problems at VA http://t.co/HtL0ZTPzA7
476394723750731776,2014-06-10 16:05:27,CongMikeSimpson,2,0,Twitter Web Client,RT @HouseAppropsGOP: Chairman @CongMikeSimpson presents the FY15 Energy and Water Appropriations bill at this morning's markup. http://t.co…
476018071417925632,2014-06-09 15:08:46,CongMikeSimpson,7,2,Twitter Web Client,.@HouseAppropsGOP FY15 E&amp;W bill prioritizes energy security &amp; infrastructure projects to boost US competitiveness http://t.co/hLBWL2Fkv8
474904280533835776,2014-06-06 13:22:58,CongMikeSimpson,2,2,Twitter Web Client,Today we pay tribute to the brave soldiers who stormed Normandy in 1944. Let us never forget their efforts. http://t.co/vwC354h7oI
474259121542553600,2014-06-04 18:39:20,CongMikeSimpson,4,0,Twitter Web Client,"RT @HouseAppropsGOP: After passing the Commerce, Justice &amp; Science bill last Friday, the House has now passed 3 FY15 funding bills - all on…"
473567395534368768,2014-06-02 20:50:40,CongMikeSimpson,0,0,Twitter Web Client,ICYMI: Simpson defends fresh white potatoes nutritional value and their need to be included in WIC program  https://t.co/RF7BUUXFiP
472790539415613440,2014-05-31 17:23:43,CongMikeSimpson,2,3,Twitter Web Client,Kathy and I are overjoyed that Sgt. Bowe Bergdahl is coming home to his family. http://t.co/umiU34YANL
472135473058828288,2014-05-29 22:00:43,CongMikeSimpson,0,1,Twitter Web Client,Simpson's potato language included in committee passed @HouseAppropsGOP bill that would allow fresh potatoes in WIC http://t.co/vKJ93Gxmor
472093733396414464,2014-05-29 19:14:51,CongMikeSimpson,0,0,Twitter Web Client,Simpson stands up for US sugar farmers &amp; defends sugar program that is designed to operate at no-cost to taxpayers https://t.co/OyDBPWZn3s
471781379139579904,2014-05-28 22:33:40,CongMikeSimpson,0,0,Twitter Web Client,"Congressman Simpson recognized with ""Fiscal Heroes"" award from @FixtheDebt for his commitment to addressing long-term fiscal challenges"
470959539580588033,2014-05-26 16:07:58,CongMikeSimpson,0,0,Twitter Web Client,Please join Kathy and I in sending our thoughts &amp; prayers to those we have lost &amp; those who served &amp; continue to serve in US Armed Forces
468483188923584513,2014-05-19 20:07:50,CongMikeSimpson,1,1,Twitter Web Client,Gallup Poll shows jobs &amp; economy are #1 priority for Americans. @HouseGOP are listening &amp; have passed 40 jobs bills http://t.co/p4D2kUO2DJ
467363442098057216,2014-05-16 17:58:22,CongMikeSimpson,1,0,Twitter Web Client,Idaho agriculture leading the way as agriculture exports increased 24% in the Q1 of 2014 according to ID Ag Dep http://t.co/UUvgZWmQ38
467127662578638848,2014-05-16 02:21:28,CongMikeSimpson,4,3,Twitter Web Client,Congressman Simpson recognized as a Hero of Main Street by @NRFnews for pro-growth economic policies https://t.co/0BHDwvw3ur
466969335576416256,2014-05-15 15:52:20,CongMikeSimpson,1,0,Twitter Web Client,Check out what House GOP are doing to help small businesses succeed &amp; hire more employees during small business week http://t.co/k87yVyuFuA
466230065597284352,2014-05-13 14:54:44,CongMikeSimpson,1,1,Twitter Web Client,Simpson secures language that would allow 129K lb trucks on ID interstates leveling playing field for ID commerce http://t.co/JNS5VkT5hi
464753283702468608,2014-05-09 13:06:32,CongMikeSimpson,2,0,Twitter Web Client,Rep. Simpson speaks in opposition to Democrat amendment creating new duplicative inventory law for gun dealers https://t.co/YSlfZ1kxZw
464501489642536961,2014-05-08 20:25:59,CongMikeSimpson,2,0,Twitter Web Client,Congressman Simpson had the opportunity to meet with @IFDA and received their 2014 Thomas Jefferson Award. http://t.co/4xUVa7prbu
464391700455383040,2014-05-08 13:09:44,CongMikeSimpson,1,0,Twitter Web Client,Simpson supports legislation calling for a special counsel to investigate IRS targeting conservative groups http://t.co/UmEQAPcro4
464061253183627264,2014-05-07 15:16:39,CongMikeSimpson,0,0,Twitter Web Client,Simpson secures language increasing truck weight limits in Idaho in FY15 THUD Bill. http://t.co/N9p9mDDd4y
463819287958794240,2014-05-06 23:15:10,CongMikeSimpson,1,1,Twitter Web Client,"""Proud to support House Resolution recognizing and honoring America's teachers."" Congressman Simpson #ThankATeacher"
463776405944160257,2014-05-06 20:24:46,CongMikeSimpson,2,0,Twitter Web Client,Simpson condemns fed water grab-joins a majority of Congress calling for withdrawal of EPA’s new Clean Water Act rule http://t.co/FQj97Iyhrt
463668613011243008,2014-05-06 13:16:26,CongMikeSimpson,2,0,Twitter Web Client,ICYMI: FS and DOI report shows need for Simpson/@MikeCrapo wildfire legislation that will improve fire budget  http://t.co/n5MLxHlkQX
461631960838701058,2014-04-30 22:23:31,CongMikeSimpson,0,0,Twitter Web Client,Congressman Simpson introduced Idaho representatives at this afternoon's Congressional Nuclear Cleanup Caucus. http://t.co/qrMmDS2tF2
461513437122928640,2014-04-30 14:32:32,CongMikeSimpson,1,0,Twitter Web Client,Make sure to check out Idaho Gives tomorrow to find the causes you are interested in giving back to. http://t.co/vgVRsZ96kL
461494353069101057,2014-04-30 13:16:42,CongMikeSimpson,7,6,Twitter Web Client,Congrats to Blackfoot HS for winning award at the We the People: The Citizen and the Constitution National Finals. http://t.co/AKD0ZLbXi7
461202153562836994,2014-04-29 17:55:36,CongMikeSimpson,8,6,Twitter Web Client,"Congressman Simpson had a great time meeting with students from his alma mater, Blackfoot High School. Go Broncos! http://t.co/oKfFr27T7O"
460902014705090560,2014-04-28 22:02:58,CongMikeSimpson,1,1,Twitter Web Client,Congressman Simpson had the opportunity to visit with TRIO students from Idaho Falls today. http://t.co/lQNnWoqOQE
460868967218036737,2014-04-28 19:51:38,CongMikeSimpson,2,0,Twitter Web Client,Check out 5 facts about @INL's new Energy Innovation Laboratory on the Idaho Falls Research and Education Campus. http://t.co/8nmvyhljwl
459755754522935296,2014-04-25 18:08:08,CongMikeSimpson,2,1,Twitter Web Client,Good luck to all the Idaho teams competing in this year’s @DOE_SC_NSB. ID02 was the only district to qualify 4 teams. http://t.co/Qx62krxeMZ
458681798906478592,2014-04-22 19:00:37,CongMikeSimpson,7,0,Twitter Web Client,Simpson helps dedicate @INL's new Energy Innovation Laboratory on the Idaho Falls Research and Education Campus. http://t.co/OYB3gZsMvQ
458665792301973504,2014-04-22 17:57:01,CongMikeSimpson,4,0,Twitter Web Client,"RT @INL: Thx @ButchOtter @CongMikeSimpson @ENERGY's Lyons &amp; Danielson, @Battelle's Townsend for helping dedicate new @INL lab. http://t.co/…"
458396434354958336,2014-04-22 00:06:41,CongMikeSimpson,4,0,Twitter Web Client,Tax Freedom Day-Read Simpson’s views on tax reform and actions he has taken to replace our burdensome tax code. http://t.co/gPipoVHpS5
457248549948764161,2014-04-18 20:05:24,CongMikeSimpson,0,1,Twitter Web Client,Simpson receives award from the Idaho Chapter of the American Nuclear Society recognizing his work on nuclear energy http://t.co/vhIyolzTST
456447702117531649,2014-04-16 15:03:07,CongMikeSimpson,1,0,Twitter Web Client,Simpson urges federal government to meet PILT obligations to states and counties http://t.co/8NcqqRS4lG
454356978123702272,2014-04-10 20:35:19,CongMikeSimpson,2,1,Twitter Web Client,Simpson joins House GOP to pass budget that addresses debt by cutting spending &amp; setting path to a balanced budget http://t.co/PGJHSq5bq2
454251657057296385,2014-04-10 13:36:49,CongMikeSimpson,2,0,Twitter Web Client,RT @USMCLife: Great meeting @CongMikeSimpson today with @MilitaryOfficer #storming2014  Rallying America to #KeepYourPromise http://t.co/qg…
453940009578823683,2014-04-09 16:58:26,CongMikeSimpson,1,0,Twitter Web Client,RT @HouseAppropsGOP: .@RepHalRogers: Leg Branch bill continues 14% in reductions for the House of Representatives since Republicans gained …
453173266367406080,2014-04-07 14:11:40,CongMikeSimpson,0,0,Twitter Web Client,ICYMI: Rep. Simpson defended the delisting of wolves in response to criticisms from Dems during DOI budget hearing https://t.co/o0lhnkE2O6
452160917263114240,2014-04-04 19:08:58,CongMikeSimpson,3,1,Twitter Web Client,Congressman Simpson defended wolf delisting and discussed sage-grouse during Department of Interior budget hearings. http://t.co/shUNXzAGL3
452087353046474752,2014-04-04 14:16:39,CongMikeSimpson,3,1,Twitter Web Client,Simpson supports bill to eliminate language in Obamacare defining a full-time worker as 30-hours per week http://t.co/hqVWUwSgrq
451881683768578048,2014-04-04 00:39:23,CongMikeSimpson,1,0,Twitter Web Client,ICYMI: Congressman Simpson pushes for better wildfire budgeting during hearing with Forest Service Chief Tidwell http://t.co/ioZDwPZ4Tk
451512894296178688,2014-04-03 00:13:57,CongMikeSimpson,1,0,Twitter Web Client,Kathy and I send our prayers and safe wishes to everyone at Fort Hood.
451040258231382016,2014-04-01 16:55:52,CongMikeSimpson,0,1,Twitter Web Client,More website problems for Obamacare-House GOP will offer more solutions this week to replace these failed policies. http://t.co/t8M8oVAiK1
450695910977470464,2014-03-31 18:07:33,CongMikeSimpson,1,0,Twitter Web Client,ICYMI: Simpson blasts EPA proposed rule that expands Obama Admins jurisdiction under the Clean Water Act https://t.co/SYWKEIHwy3
449683167927361536,2014-03-28 23:03:16,CongMikeSimpson,5,4,Twitter Web Client,"“Kathy and I send our thoughts and prayers to Sgt. Bowe Bergdahl, his family, and Army colleagues on his birthday."" -Congressman Simpson"
449283226037923842,2014-03-27 20:34:03,CongMikeSimpson,0,0,Twitter Web Client,Congressman Simpson demands to know why EPA releases rule prior to receiving conclusion of scientific results http://t.co/NavvaMTAgG
449182909669601280,2014-03-27 13:55:25,CongMikeSimpson,2,0,Twitter Web Client,RT @HouseAppropsGOP: .@KenCalvert: Interior Sbcmte will take whatever actions necessary to inject some common sense into EPA's rule making …
448935777582723072,2014-03-26 21:33:24,CongMikeSimpson,36,0,Twitter Web Client,"RT @SpeakerBoehner: RE: latest #ObamaCare delay, is this a joke? http://t.co/iC1mthBLmo #trainwreck"
448930827469340672,2014-03-26 21:13:44,CongMikeSimpson,0,1,Twitter Web Client,@IDMethProject is seeking Idaho teens entering grades 9-12 this fall to join the 2014-15 Teen Advisory Council http://t.co/XNrEUY7TFK
448899565878779904,2014-03-26 19:09:31,CongMikeSimpson,0,0,Twitter Web Client,Simpson examines budget for energy programs during first 2 hearings as Chairman of Energy &amp; Water @HouseAppropsGOP    http://t.co/81NG4zjN3B
448807854125096960,2014-03-26 13:05:05,CongMikeSimpson,2,0,Twitter Web Client,Simpson opposes EPA water rule that would expand agency jurisdiction regarding the Clean Water Act http://t.co/0Hgi0JQ6Xv
448605184714100736,2014-03-25 23:39:45,CongMikeSimpson,2,1,Twitter Web Client,"Idaho’s 2nd CD to Send Four Teams to @DOE_SC_NSB, the Most of Any Congressional District in the United States http://t.co/PuM5dGqRn7"
448462606198902784,2014-03-25 14:13:12,CongMikeSimpson,1,0,Twitter Web Client,RT @HouseAppropsGOP: At 9:30AM: @CongMikeSimpson holds his 1st hearing as the new Chairman of the Energy &amp; Water Subcom. Watch live: http:/…
446790067408109568,2014-03-20 23:27:07,CongMikeSimpson,2,1,Twitter Web Client,Health industry officials estimate that Obamacare related premiums will double in some parts of the country. http://t.co/pKyRE7wJow
446396990998728704,2014-03-19 21:25:10,CongMikeSimpson,1,0,Twitter Web Client,"Rep Simpson toured Diversified Metals, Inc this AM in Idaho Falls to discuss their important role in Idaho’s economy https://t.co/k3fBsuqTJG"
446291295917457408,2014-03-19 14:25:11,CongMikeSimpson,7,0,Twitter Web Client,Rep. Simpson joined the ID delegation and local law enforcement yesterday at @NSSF event to discuss Project ChildSafe http://t.co/UBzvVyEGhR
444573972857114624,2014-03-14 20:41:09,CongMikeSimpson,1,0,Twitter Web Client,"RT @TheIdahoReport: Rep. Mike Simpson, others send USDA letter of disapproval over WIC potato exclusion http://t.co/r4pieMcrSM"
444568378687356928,2014-03-14 20:18:55,CongMikeSimpson,1,0,Twitter Web Client,Congressman Simpson leads bipartisan letter to USDA requesting reconsideration of potato exclusion from WIC program. http://t.co/cagtesLzHE
444503202315395072,2014-03-14 15:59:56,CongMikeSimpson,0,0,Twitter Web Client,Read Congressman Simpson’s Republican solutions for healthcare that was featured in the Idaho Mountain Express http://t.co/9asdANhUnq
444251344967593984,2014-03-13 23:19:09,CongMikeSimpson,0,1,Twitter Web Client,Simpson supports House-passed bill preventing federal gov. from hijacking water rights through land use permitting http://t.co/i8D4Hnmmv8
444145550271979520,2014-03-13 16:18:45,CongMikeSimpson,1,0,Twitter Web Client,Simpson Supports Legislation to Curb Obama’s Executive Overreach and Restore Constitutional Balance of Powers   http://t.co/m4qYuG4dhL
443852911291142144,2014-03-12 20:55:55,CongMikeSimpson,0,0,Twitter Web Client,Simpson Protects Farmers from EPA Privacy Violations http://t.co/qeNr4RdrRq
