id,created_at,user,retweets,favorite_count,source,text
829775005009530881,2017-02-09 19:32:32,congressmanraja,5,6,Twitter Web Client,Shutting down @EPA’s enforcement division would weaken the Clean Air Act &amp; Clean Water Act while leaving families t… https://t.co/LzNrpgnKxD
829742681349816321,2017-02-09 17:24:05,congressmanraja,3,17,Twitter Web Client,Proud to work with @RepGallagher in founding the #MiddleClassJobs Caucus to work on key issues facing America's wor… https://t.co/xGSjXBp3SR
829686876160274433,2017-02-09 13:42:20,congressmanraja,508,0,Twitter Web Client,"RT @WhipHoyer: Democrats are standing up, speaking out &amp; taking action. We will not stop #FightingForAll Americans."
829685687616143361,2017-02-09 13:37:37,congressmanraja,79,0,Twitter Web Client,RT @RepPerlmutter: .@POTUS’ executive order on financial regulation puts #WallStreetFirst. So much for 'draining the swamp' #HoldBackTheRol…
829428810030448652,2017-02-08 20:36:53,congressmanraja,11,26,Twitter Web Client,#ACA repeal threatens Medicare solvency for 57 million seniors &amp; disabled Americans. I oppose repeal &amp; will keep… https://t.co/PbVBEJyq6e
829327419744083968,2017-02-08 13:53:59,congressmanraja,230,0,Twitter Web Client,"RT @repjoecrowley: Whether it's healthcare, jobs, security, or equality, @HouseDemocrats are #FightingForAll Americans at our policy confer…"
829049427851624449,2017-02-07 19:29:21,congressmanraja,1,13,Twitter Web Client,I spoke earlier on the Middle Class Jobs Caucus I've founded with @RepGallagher to help working families by creatin… https://t.co/Jug4hl07QM
828961304337592320,2017-02-07 13:39:10,congressmanraja,820,0,Twitter Web Client,RT @BobbyScott: .@HouseGOP’s #ACA repeal would leave 4 million children without coverage – doubling the child uninsured rate by 2019. #Prot…
828667045109706752,2017-02-06 18:09:54,congressmanraja,7,15,Twitter Web Client,Repealing #ACA without replacing it would destroy millions of jobs &amp; prevent entrepreneurs from creating new ones https://t.co/LzQOn0fmUG
828662266363052034,2017-02-06 17:50:54,congressmanraja,5,9,Twitter Web Client,"It was an honor to address Quark Matter 17 this morning. As we discussed, #ScienceIsGlobal! #qm17 https://t.co/OMVPoDC64y"
828631610840985600,2017-02-06 15:49:05,congressmanraja,3,0,Twitter for iPhone,"RT @LeonieMueck: In welcome address at Quark Matter 17, @congressmanraja emphasizes that #ScienceIsGlobal -- thanks for standing up for sci…"
828608409431920641,2017-02-06 14:16:54,congressmanraja,372,0,Twitter Web Client,RT @RepBarragan: The American people continue to speak out against @HouseGOP’s #MakeAmericaSickAgain agenda. How long will it take them to…
828456853440978944,2017-02-06 04:14:40,congressmanraja,782,0,Twitter Web Client,RT @CecileRichards: America is at a 30-year low in unintended pregnancy &amp; a historic low in teen pregnancy. We should be working hard to bu…
827674638876553216,2017-02-04 00:26:26,congressmanraja,14,51,Twitter Web Client,"I'll continue to defend the #ACA, oppose @POTUS ’s #travelban, &amp; fight for the working families of the 8th District https://t.co/SdbzbTH1dG"
827592820282314753,2017-02-03 19:01:18,congressmanraja,7,25,Twitter Web Client,Renewable energy &amp; green technology are essential to our economy &amp; survival. That's why I've called on @Potus to st… https://t.co/H0iryyj7uK
827580016959569920,2017-02-03 18:10:26,congressmanraja,9,0,Twitter Web Client,"RT @ChadPergram: Intel Cmte mbr Swawell on enhanced interrogation methods: When John McCain says it is torture, I think we can all rest ass…"
827567443010793472,2017-02-03 17:20:28,congressmanraja,7,14,Twitter Web Client,"In the era of fake news, #alternativefacts &amp; the #BowlingGreenMasacre , we need accurate jobs numbers we can depend… https://t.co/uwOH4rpUbg"
827503417111220225,2017-02-03 13:06:03,congressmanraja,839,2054,Twitter Web Client,We don't have to choose between being safe and living our values. A compassionate America *is* a safe America. #RefugeesWelcome
827156916921057280,2017-02-02 14:09:11,congressmanraja,0,2,Twitter Web Client,Thanks to the representatives of the @NFB_voice  who came to meet with me yesterday #NFBWS17 https://t.co/SsbxUJNLiP
827156388975669248,2017-02-02 14:07:05,congressmanraja,2,0,Twitter Web Client,RT @meyer412: #NFBWS17 https://t.co/IDnOqjQOm0
826934742046146561,2017-02-01 23:26:20,congressmanraja,1,8,Twitter Web Client,It was great meeting with representatives of @DuPageHabitat in the Capitol today https://t.co/cmhyGhYzX8
826855187549667330,2017-02-01 18:10:13,congressmanraja,7,17,Twitter Web Client,Independent research continues to show repealing the Affordable Care Act would destroy jobs and devastate our econo… https://t.co/iUgqXV2SDd
826620555872829442,2017-02-01 02:37:53,congressmanraja,1,0,Twitter for iPhone,"RT @ilbanker: IBA &amp; ILFI thank @CongressmanRaja, @RepSchneider, @SenDuckworth, @RepHultgren &amp; @RepBillFoster for meeting with us today! htt…"
826568678569308163,2017-01-31 23:11:44,congressmanraja,7,21,Twitter Web Client,"I'm going to keep fighting for the #ACA, but no matter what happens in Congress, if you enroll tonight, you can kee… https://t.co/SrIKeWCWZh"
826547723478380545,2017-01-31 21:48:28,congressmanraja,15,0,Twitter for iPhone,"RT @OversightDems: .@CongressmanRaja: Removing protections of #ACA will hurt businesses, workers and families in my district and across the…"
826482178750025733,2017-01-31 17:28:01,congressmanraja,12,43,Twitter Web Client,Watch my speech against President Trump's immigration order from our rally last night in front of the Supreme Court… https://t.co/fOg4iEkVqe
826460702344933376,2017-01-31 16:02:40,congressmanraja,2,2,Twitter Web Client,@POTUS' executive order is an assault on the Constitution that harms working families and divides the country. https://t.co/IhH7mrC5YH
826140638383108096,2017-01-30 18:50:51,congressmanraja,3,6,Twitter Web Client,Good to talk to @dailyherald about my business experience &amp; fighting for working &amp; middle-class families in Congress https://t.co/dymvQgk9QD
825877783633068033,2017-01-30 01:26:22,congressmanraja,8,16,Twitter Web Client,@POTUS's order against legal immigration violates American values &amp; threatens our economy. #noban #immigrationban https://t.co/V0goWMCKfX
825565669030785024,2017-01-29 04:46:08,congressmanraja,23,89,Twitter Web Client,At @fly2ohare Airport to denounce President @realDonaldTrump's executive order. #NoBan https://t.co/1hmTXXVZxv
825425658914418688,2017-01-28 19:29:47,congressmanraja,3,25,Twitter Web Client,"Thanks again to @SenatorDurbin for coming to my office open house yesterday. I'll always value his wisdom, his good… https://t.co/aSaNgxT4hm"
825391798902255616,2017-01-28 17:15:14,congressmanraja,1,5,Hootsuite,Had a great morning meeting with Hanover Park Mayor Rod Craig the other day. Hanover Park’s a wonderful community w… https://t.co/WXhoNOz5Xd
825082798730047494,2017-01-27 20:47:23,congressmanraja,6,0,Twitter Web Client,RT @AlzILAdvocacy: 2day r IL D8 advocates had the chance 2 c @CongressmanRaja sworn in w a special appearance by @SenatorDurbin @NJMcCaffre…
825036249429848065,2017-01-27 17:42:24,congressmanraja,2,7,Twitter Web Client,Join me for my office open house in Schaumburg this afternoon as we welcome @SenatorDurbin and Cook County Board Pr… https://t.co/PYvJSAl5qX
824719077902090241,2017-01-26 20:42:05,congressmanraja,5,15,Twitter Web Client,Honored to have @SenatorDurbin join us tomorrow for my office open house in Schaumburg. Find out more here:… https://t.co/3gqqS6JC6O
824694487238799360,2017-01-26 19:04:22,congressmanraja,0,3,Instagram,Glad to attend my first committee meeting with @EdworkforceDems to fight for #workingfamilies… https://t.co/rdQk1XonM5
824388964551421954,2017-01-25 22:50:20,congressmanraja,7,6,Twitter Web Client,Listen to my conversation with @PaulLisnek on #BehindTheCurtain. I talked about the need to #defendACA https://t.co/1I3gftbk8L via @wgnradio
824315078157725696,2017-01-25 17:56:44,congressmanraja,3,19,Twitter Web Client,"I'm fighting for working families. I'll work across the aisle, but I won't hesitate to stand up to @realDonaldTrump https://t.co/UmK5fBPiMo"
823999606254084100,2017-01-24 21:03:09,congressmanraja,10,20,Twitter Web Client,Watch my speech against the @RealDonaldTrump's plan to make mortgages more expensive for working families.… https://t.co/yvIMTjXp1G
823961548204941312,2017-01-24 18:31:56,congressmanraja,3,24,Twitter Web Client,"On the Subcommittee on Health Care, Benefits, &amp; Administrative Rules, I’ll #defendtheACA so we don't… https://t.co/WdHORvLNLm"
823929672689979392,2017-01-24 16:25:16,congressmanraja,2,4,Twitter Web Client,Come visit me and my staff on Friday afternoon at our Schaumburg office! https://t.co/YYfp5D1CCu
823694302496878592,2017-01-24 00:49:59,congressmanraja,2,10,Twitter Web Client,"As both a Congressman and a resident of Schaumburg, it was great to meet with Schaumburg Mayor Al Larson. https://t.co/0kXJuU4p4o"
823595220377944064,2017-01-23 18:16:16,congressmanraja,1,17,Twitter Web Client,"Glad I was able to join so many at #WomensMarch in Chicago, including @RepCheri @RepBillFoster @ToniPreckwinkle and… https://t.co/Z6t5rGvZix"
823500593880825857,2017-01-23 12:00:16,congressmanraja,3,1,Twitter Web Client,"We should be helping working families. On his first day, @realDonaldTrump made it harder for them to buy a home.… https://t.co/PrZGo3145g"
823157056194678788,2017-01-22 13:15:10,congressmanraja,1,5,Hootsuite,I'm glad @SenatorLaura was able to come by the office to discuss some of the challenges facing our community. https://t.co/V6SpICsW5r
822921547954405377,2017-01-21 21:39:20,congressmanraja,4,18,Twitter Web Client,I’m proud to join people from every walk of life in defending the rights of women and all Americans… https://t.co/6UjKp5p7cN
822900367096680450,2017-01-21 20:15:10,congressmanraja,13,0,Twitter Web Client,RT @FutureDocs: . @CongressmanRaja at #womensMarchOnChicago - women's rights are human rights!! Are you ready to fight? YES! #WomensMarch h…
822588914024280064,2017-01-20 23:37:34,congressmanraja,5,0,Twitter Web Client,"RT @BensenvilleIL: Village Manager Evan Summers welcomes Congressman Raja Krishnamoorthi, representing Illinois' 8th Congressional District…"
822526658808684545,2017-01-20 19:30:11,congressmanraja,5,13,Twitter Web Client,Join me tomorrow at Chicago's #WomensMarch to support the rights of all Americans because our country is stronger t… https://t.co/13Wv29E4D9
822483344172744704,2017-01-20 16:38:04,congressmanraja,4,23,Twitter Web Client,"Thank you for your leadership and your inspiration, Mr. President. #ThanksObamas #InaugurationDay2017 @BarackObama… https://t.co/BmtlaZGffr"
822328697906565121,2017-01-20 06:23:34,congressmanraja,374918,0,Twitter Web Client,"RT @FLOTUS: Being your First Lady has been the honor of a lifetime. From the bottom of my heart, thank you. -mo https://t.co/pahEydkZ5Z"
822298135292772355,2017-01-20 04:22:07,congressmanraja,323,0,Twitter Web Client,"RT @HouseDemocrats: You taught us to hope, to organize, &amp; never give up on what's right for the American people: https://t.co/A68qbbtoLP #T…"
822055096515252224,2017-01-19 12:16:22,congressmanraja,1,0,Twitter for Android,RT @SenTomCullerton: Great meeting w/ @CongressmanRaja to discuss what issues we can work on together. I look forward to working w/ him! ht…
822054836673900544,2017-01-19 12:15:20,congressmanraja,0,1,Hootsuite,"On Tuesday I met with @MayorKaptain , Villa Park Village President Deb Bullwinkel, and Wheeling Village President D… https://t.co/syXqksJ4IW"
821881986709127168,2017-01-19 00:48:30,congressmanraja,2,18,Twitter Web Client,Every child has a right to a quality public education. I have serious concerns about Devos' nomination for Educatio… https://t.co/NUfK1sZxwR
821775637383938048,2017-01-18 17:45:54,congressmanraja,17,16,Twitter Web Client,HHS-Nom Price admitted there's no ACA replacement that maintains coverage for those on the ACA. We need to fix and… https://t.co/nIu9tua3qS
821109303239176192,2017-01-16 21:38:08,congressmanraja,4,0,Twitter for Android,RT @MaryAnnAhernNBC: New Cong Raja brings son to #CubsWhiteHouse @RajaForCongress https://t.co/ZsUjErUXcr
821108976439951362,2017-01-16 21:36:50,congressmanraja,10,0,Twitter for Android,RT @ChrisKaergard: Former #Peoria resident (and current U.S. House member) @CongressmanRaja and son Vijay during @Cubs visit to @WhiteHouse…
821082740263096320,2017-01-16 19:52:34,congressmanraja,4,39,Twitter Web Client,What an honor for my son Vijay and me to visit the @WhiteHouse today with MLB Champion @Cubs. #CubsinDC https://t.co/342vlpGWDk
820993739069997057,2017-01-16 13:58:55,congressmanraja,1,3,Twitter Web Client,I joined an MLK tribute in Elgin and declaration of commitment to Dr. King's dream. May we all make that dream a re… https://t.co/xZMsFdPlxB
820428544299958278,2017-01-15 00:33:02,congressmanraja,5,32,Twitter Web Client,"I’m  proud to serve with @RepJohnLewis, an American hero, who by word and  action stands as a role model for every… https://t.co/MiaMr9aDWG"
820004471275143169,2017-01-13 20:27:55,congressmanraja,12,0,Twitter Web Client,RT @LGBTEqCaucus: Welcome .@CongressmanRaja (IL-08) to the LGBT Equality Caucus! We look forward to working with you. #EqualityforAll https…
819880195909976064,2017-01-13 12:14:05,congressmanraja,3,5,Twitter Web Client,Yesterday I spoke on the dangers of repealing #ACA without replacing it. @CNBC reported on the same economic risks: https://t.co/13ljjZ5wPC
819711155144970241,2017-01-13 01:02:23,congressmanraja,2,8,Twitter Web Client,Watch my speech on the economic threat posed to working families by repealing the ACA without replacing it#ACARepeal https://t.co/Lkd0zHAxBw
819640452081209345,2017-01-12 20:21:26,congressmanraja,4,4,Twitter Web Client,Proud to join @edworkforcedems. Fighting hard to strengthen wages for working and middle class families https://t.co/MEXpXZkHIp
819632130745651200,2017-01-12 19:48:22,congressmanraja,1,0,Twitter Web Client,I'm glad to have @ToniPreckwinkle attending my open house on the 27th and I hope you'll be able to make it too. https://t.co/b3hhT2yyXU
819306112725958656,2017-01-11 22:12:53,congressmanraja,8,16,Twitter Web Client,"I'm proud to stand up for the right to choose, defend the #ACA , and protect funding for @PPFA with my colleagues in @ProChoiceCaucus"
818892997236551680,2017-01-10 18:51:19,congressmanraja,0,5,Twitter Web Client,I'm proud to cosponsor the #ProtectOurDemocracy Act to combat cyber attacks by working with my colleagues… https://t.co/DdysJkuYbb
818476412839620608,2017-01-09 15:15:58,congressmanraja,1,9,Twitter Web Client,"Reaching across the aisle to Republican @RepJackBergman - he's a good man, and I'm hoping to find common ground wit… https://t.co/1DsTO5rPJm"
818165112011898881,2017-01-08 18:38:58,congressmanraja,2,6,Twitter Web Client,"Thanks to @rap30 and @SundaySpin for having me on the show. If you missed our conversation, you can listen here https://t.co/qN59DjKF5m"
817956815199735808,2017-01-08 04:51:16,congressmanraja,3,3,Twitter Web Client,Tune in to @SundaySpin at 8:30 on Sunday morning to hear my conversation with @rap30
817859893688406016,2017-01-07 22:26:08,congressmanraja,4,7,Twitter Web Client,"Please join me for my Office Open House and Ceremonial Swearing-In on Friday, January 27th in Schaumburg. I look fo… https://t.co/6nqFzMfGZZ"
817399158873194496,2017-01-06 15:55:20,congressmanraja,8,0,Twitter Web Client,RT @BobbyScott: I had a great time last night celebrating the start of the 115th Congress with new and returning @CAPAC members and AAPI co…
817069183238291456,2017-01-05 18:04:08,congressmanraja,1,3,Twitter Web Client,I enjoyed discussing the work ahead in Congress with @MaryAnnAhernNBC and the @nbcchicago team earlier this week https://t.co/kOtuKzqMzX
816781581457166337,2017-01-04 23:01:18,congressmanraja,3,5,Twitter Web Client,"Today, in my first speech in Congress, I talked about the need to fight for middle class families. Watch it here:  https://t.co/E6PBziB2FD"
816724999151161344,2017-01-04 19:16:28,congressmanraja,6,28,Twitter Web Client,I’m honored to have been sworn in as the Congressman for Illinois’ 8th  District and to represent Chicago's west an… https://t.co/ecBGwYoROz
