id,created_at,user,retweets,favorite_count,source,text
851543473408942080,2017-04-10 21:12:39,congressmanraja,0,9,Twitter Web Client,"On today's #AskRaja, I discuss my work with the @OversightDems and the @edworkforcedems https://t.co/a7MWB7cp9J"
851463699944673281,2017-04-10 15:55:40,congressmanraja,1,12,Twitter Web Client,It's wonderful to be back home and on Friday I met with Jemma Cabral and Maggie Osborne of the @AmericanCancer Acti… https://t.co/OCBoZbZPvW
850760644915847169,2017-04-08 17:21:58,congressmanraja,1,9,Twitter for iPhone,It was great meeting with the  Illinois Association of Nurse Anesthetists this week! https://t.co/13d71trvas
850476193207996416,2017-04-07 22:31:40,congressmanraja,4,20,Twitter Web Client,Guess we'll never hear from that guy ever again... [crosses fingers and looks up at picture of Walter Payton]… https://t.co/s8VVQrC9B9
850393757224718336,2017-04-07 17:04:05,congressmanraja,2,0,Twitter Web Client,"RT @ILschoolboards: Board members Barbara Somogyi &amp; Kathleen Burley, &amp; IASB’s Susan Hilton discuss education issues &amp; school funding with @…"
850391680545157120,2017-04-07 16:55:50,congressmanraja,1,11,Twitter Web Client,Read my statement on #syriastrikes below https://t.co/m3bktsUlLD
850387580357136384,2017-04-07 16:39:33,congressmanraja,2,0,Twitter Web Client,RT @pprada84: Thank you @CongressmanRaja for taking the time to listen to our concerns on @OpenFairSkies for @WeAreALPA @SpiritMEC_ALPA htt…
850378506466992131,2017-04-07 16:03:29,congressmanraja,9,0,Twitter Web Client,"RT @NFB_voice: We thank the original HR 1772 cosponsors: @CongressmanGT, @RepKinzinger, @RepDavidEPrice, @CongressmanRaja, @RepDanKildee &amp;…"
850352996030525440,2017-04-07 14:22:07,congressmanraja,6,23,Twitter Web Client,It's also why I'm on a first-name basis with most of Congress https://t.co/r5TMSL5GXb
850147011559030784,2017-04-07 00:43:37,congressmanraja,0,7,Twitter Web Client,It was an honor to meet Ambassador @Martin_Dahinden of @SwissEmbassyUSA &amp; to discuss the potential for Swiss-style… https://t.co/0p6vAWwXmq
850131562821767172,2017-04-06 23:42:13,congressmanraja,7,17,Twitter Web Client,"If you guessed this means they're calling it ""global warming"" I've got bad news #climatechange #ClimateChangeIsReal  https://t.co/QmasR6MaFV"
850096881053073408,2017-04-06 21:24:25,congressmanraja,0,1,Twitter for Android,@windycityamar Absolutely! My staff just emailed you and look forward to working with you on all the arrangements
850065347126472706,2017-04-06 19:19:06,congressmanraja,1,5,Twitter Web Client,My office will be participating in the 2017 Congressional Art Competition https://t.co/XTmBopfbmz #2017CAC… https://t.co/9RRFXgxT83
849994809905471488,2017-04-06 14:38:49,congressmanraja,4,0,Twitter Web Client,RT @Katie_Vannucci: Thanks so much @CongressmanRaja for meeting with us this AM to discuss important immigration issues! #ailanda #ailastan…
849993644383903744,2017-04-06 14:34:11,congressmanraja,201,355,Twitter Web Client,"Chairman Nunes' stepping aside isn't enough, we need an independent commission  #FollowtheFacts #TrumpRussia https://t.co/xFllZAGWg2"
849737873633026048,2017-04-05 21:37:51,congressmanraja,1,10,Twitter Web Client,Great meeting with Illinois members of the American Osteopathic Association! https://t.co/ugnj1nN87S
849732004421791745,2017-04-05 21:14:31,congressmanraja,1,0,Twitter for iPhone,RT @NASSspine: @CongressmanRaja talks #accesstospecialtycare with NASS spine specialists as a part of the 2017 #NASSAdvocacyConference. htt…
849706301559107585,2017-04-05 19:32:23,congressmanraja,864,0,Twitter Web Client,RT @Cubs: #NationalWalkingDay 😁 https://t.co/H22QE4AULM
849652642397728769,2017-04-05 15:59:10,congressmanraja,3,41,Twitter Web Client,"I called for Bannon's removal because national security should be in the hands of experts, not political consultants https://t.co/dcH20U2Y7t"
849618240787681282,2017-04-05 13:42:28,congressmanraja,0,6,Twitter Web Client,So glad I was able to meet with the @LungAssociation today https://t.co/V5OCGL2Vvr
849386566871117826,2017-04-04 22:21:53,congressmanraja,6,22,Twitter Web Client,#Equalitymeans not only addressing inequality in our society but confronting the forces behind it &amp; the silence it… https://t.co/nr1iHT3G8J
849343420057305088,2017-04-04 19:30:26,congressmanraja,23,13,Twitter Web Client,It's #EqualPayDay &amp; @HouseGOP are back with an updated #AHCA that would let insurance companies make women pay more https://t.co/6XdWyfqrIN
849306247153299459,2017-04-04 17:02:43,congressmanraja,4,0,Twitter Web Client,RT @RepLaHood: S/o to freshman @CongressmanRaja for signing onto the #CongressOfTomorrow Project @RepLipinski and I introduced to #FixCongr…
849298348381270016,2017-04-04 16:31:20,congressmanraja,3,0,Twitter Web Client,RT @SchoolLunch: Great Pic Illinois SNA with @CongressmanRaja!  Hope the meeting went well! #LAC17 https://t.co/YkKtUjJ3Uw
849288108197728256,2017-04-04 15:50:38,congressmanraja,6,40,Twitter Web Client,Women in our country earn a fraction of what men do for the same work &amp; that's why I've cosponsored the Paycheck Fa… https://t.co/SZv1z3eJ3a
849246378752696320,2017-04-04 13:04:49,congressmanraja,547,0,Twitter Web Client,RT @RepLawrence: 94 days. That’s how far into 2017 the average woman must work to close the gap with what men earned the year before. We ne…
849054270653706241,2017-04-04 00:21:27,congressmanraja,234,285,Twitter for iPhone,Yet another reason for an independent commission into the administration's Kremlin ties #Trumprussia #followthefacts https://t.co/T5SDwdf7OT
849034570901204992,2017-04-03 23:03:10,congressmanraja,0,4,Twitter Web Client,@POTUS should veto this bill because it would let ISPs sell your information to the highest bidder w/o permission https://t.co/m0ph0YUE41
848964210491084801,2017-04-03 18:23:35,congressmanraja,10,16,Twitter Web Client,Here's my op-ed for the @chicagotribune on improving the #ACA through addressing the high cost of prescription drugs https://t.co/Qz5q4dD728
848615029352124416,2017-04-02 19:16:04,congressmanraja,196,313,Twitter Web Client,The basis for concern and justification for an independent commission only grows. #FollowtheFacts #Trumprussia https://t.co/ii0umOAr5n
847954614985031681,2017-03-31 23:31:49,congressmanraja,4,22,Twitter Web Client,To paraphrase a movie I've quoted here before: I really don't think that means what you think it means.… https://t.co/eXtU2C74e5
847834868641918977,2017-03-31 15:35:59,congressmanraja,120,167,Twitter Web Client,"An investigation of how the Kremlin interfered in our democracy is not a ""witch hunt"" #FollowtheFacts #TrumpRussia https://t.co/0StFFJndf8"
847625621911908355,2017-03-31 01:44:31,congressmanraja,181,376,Twitter for iPhone,We now have a former National Security Advisor shopping for immunity...this is surreal #followthefacts #trumprussia https://t.co/F1OdVimieb
847548655037022208,2017-03-30 20:38:40,congressmanraja,216,373,Twitter Web Client,I agree with @RepWalterJones on need for an independent commission &amp; hope more of our colleagues come around… https://t.co/kkUzxGE652
847508340255055872,2017-03-30 17:58:28,congressmanraja,96,150,Twitter for iPhone,"Read my @thehill op-ed on need for an independent commission on Russian interference
#FollowtheFacts #TrumpRussia https://t.co/xn3DIwVR8t"
847486663903150080,2017-03-30 16:32:20,congressmanraja,6,18,Twitter Web Client,I hope my GOP colleagues will come around to working with us to strengthen the #ACA. #ProtectOurCare https://t.co/hkfkjEPKgS
847201561449259009,2017-03-29 21:39:27,congressmanraja,2,0,Twitter for iPhone,RT @natalieziemba: @CongressmanRaja 💜 Your staff was lovely &amp; gracious today. This #alzforum is spreading the #endAlz message. Thank you. 💜…
847181004594958336,2017-03-29 20:17:46,congressmanraja,21,25,Twitter Web Client,Voting against bill blocking @EPA from using best science available for public health &amp; environmental protections https://t.co/f4lOZMPMoO
847131675423375362,2017-03-29 17:01:45,congressmanraja,135,202,Twitter Web Client,Efforts to block any Russia investigation show the need for an independent commission  #FollowtheFacts #Trumprussia https://t.co/qiSuLzFObL
847114784541696001,2017-03-29 15:54:37,congressmanraja,16,47,Twitter Web Client,Glad to celebrate #Pinkoutday &amp; to #StandWithPP as we recognize the vital role it plays through providing health ca… https://t.co/aGoj6Aci89
847089175967006720,2017-03-29 14:12:52,congressmanraja,1292,0,Twitter for iPhone,"RT @RepKarenBass: Nunes last week, Kushner this week... If there's smoke, there's fire. Congress must create an independent commission to #…"
846914996726648833,2017-03-29 02:40:44,congressmanraja,418,498,Twitter for iPhone,The administration's Kremlin ties mount but still no independent commission #followthefacts #Trumprussia #Manafort https://t.co/NJ60AnXo5k
846885907613569024,2017-03-29 00:45:09,congressmanraja,14,73,Twitter Web Client,"I voted against it &amp; even though it passed, I'm going to keep fighting against it. Your personal browsing informati… https://t.co/blxzVsnvIB"
846885227444289536,2017-03-29 00:42:27,congressmanraja,2,0,Twitter Web Client,"RT @HFHLakeCounty: @CongressmanRaja
#AmeriCorpsWorks in Lake County, IL @AmeriCorps members have served more than 26,000 families with @Hab…"
846885171790041089,2017-03-29 00:42:13,congressmanraja,1,5,Twitter Web Client,"@SteveStapley @countable I absolutely did. Even though it passed, I haven't given up the fight to keep personal online data private"
846871249703878656,2017-03-28 23:46:54,congressmanraja,5,24,Twitter Web Client,"Maybe they're bluffing but we can't risk it. I'll keep fighting to improve the #ACA &amp; opposing any attempt at repeal
https://t.co/kV41WvBiyH"
846847372269404160,2017-03-28 22:12:01,congressmanraja,8,48,Twitter Web Client,I voted against this bill because internet providers shouldn't be able to sell ad firms info on the sites you visit https://t.co/XwffsEZKBN
846752005964095488,2017-03-28 15:53:04,congressmanraja,115,145,Twitter Web Client,Gen Flynn resigned over Kremlin ties &amp; hasn't testified. Next @WhiteHouse tried to block Sally Yates' testimony… https://t.co/2DAj7DlNVx
846743804233310208,2017-03-28 15:20:29,congressmanraja,0,1,Twitter Web Client,"@Katiescribe Thanks, Katie. I think it's absolutely the right choice"
846737110178709504,2017-03-28 14:53:53,congressmanraja,0,4,Twitter Web Client,"@TwoSeventyThree I do, I oppose it and the Senate version which is SJRes 34"
846728086829846528,2017-03-28 14:18:02,congressmanraja,402,678,Twitter Web Client,Last night I called for an independent commission to investigate Russian interference #TrumpRussia #FollowtheFacts… https://t.co/cYZ2XdC6oZ
846579941957390336,2017-03-28 04:29:21,congressmanraja,1500,0,Twitter for iPhone,RT @SenatorDurbin: Nope. https://t.co/eQ4D378icI
846565029751218182,2017-03-28 03:30:06,congressmanraja,1,1,Twitter for iPhone,@Catinker I think Congress is too politicized to investigate the way we need right now so I support an independent commission
846563928738070528,2017-03-28 03:25:43,congressmanraja,311,0,Twitter for iPhone,"RT @CongressmanRaja: @RepAdamSchiff is right, Chairman Nunes should recuse himself from the Russia probe #followthefacts #trumprussia https…"
846562332411072512,2017-03-28 03:19:23,congressmanraja,311,490,Twitter for iPhone,"@RepAdamSchiff is right, Chairman Nunes should recuse himself from the Russia probe #followthefacts #trumprussia https://t.co/DXQB5EUY1g"
846462905679839233,2017-03-27 20:44:17,congressmanraja,7,20,Twitter Web Client,"Last week, I took this #AskRaja question over whether constituent calls make a difference. As you can tell by the d… https://t.co/RmyClDMjx2"
846399529259880449,2017-03-27 16:32:27,congressmanraja,310,397,Twitter Web Client,"We need answers, we need information, and to be sure we have both, we need a full investigation. #Trumprussia https://t.co/QNVEbEtNQI"
845715314864205824,2017-03-25 19:13:38,congressmanraja,13,61,Twitter for iPhone,Yesterday's defeat of #AHCA was a victory for our country &amp; I was glad to join so many in speaking out against it.… https://t.co/MmCQDT5m2V
845670461736472576,2017-03-25 16:15:24,congressmanraja,31250,0,Twitter for iPhone,RT @RepAdamSchiff: The American people demand – and deserve – the truth. Congress must create an independent commission to #FollowTheFacts…
845363076950102016,2017-03-24 19:53:58,congressmanraja,11,61,Twitter Web Client,"If you just put on a rally cap or pulled out a 4-leaf clover, please keep doing that, just in case. I'll keep fighting against #AHCA"
845354005337427969,2017-03-24 19:17:55,congressmanraja,3,17,Twitter Web Client,I'll be speaking out against #AHCA from the House floor soon but I went on Facebook Live to check in first: https://t.co/pCLExbWRmr
845323684197810177,2017-03-24 17:17:26,congressmanraja,7,30,Twitter Web Client,I was on Facebook Live this morning to talk about why I'm voting against #AHCA and I'll be back on around 2:20EST.… https://t.co/SjxSvOTqaK
845302406263033856,2017-03-24 15:52:53,congressmanraja,31,40,Twitter Web Client,"Hearing that at hospitals back home, people are watching the #AHCA vote on pins &amp; needles, worrying about vulnerable patients #killthebill"
845299731635077120,2017-03-24 15:42:15,congressmanraja,1,1,Twitter Web Client,@caiterbits Thank you for the encouragement!
845288761709772802,2017-03-24 14:58:40,congressmanraja,782,1437,Twitter Web Client,"For those keeping score: my office has received more than 1,900 calls opposing #AHCA, 23 calls for it, and 648 supporting #ACA. #KILLTHEBILL"
845283383697661952,2017-03-24 14:37:17,congressmanraja,0,2,Twitter Web Client,@ANGULOYma I just took a vote against #AHCA and it won't be the last time today!
845282936681353216,2017-03-24 14:35:31,congressmanraja,13,34,Twitter Web Client,"First vote allows #AHCA to proceed without Democratic ideas or full cost projections. I'm voting against it, won't be the last time today."
845099929118937088,2017-03-24 02:28:18,congressmanraja,0,2,Twitter Web Client,"@newspapercrane Normally they don't let us get that emphatic in voting no, but if I can, I will!"
845093653425065985,2017-03-24 02:03:22,congressmanraja,0,0,Twitter Web Client,"@onekonfusedkat I will, Kat. Thanks for your encouragement!"
845093301669769217,2017-03-24 02:01:58,congressmanraja,2,6,Twitter Web Client,@Millicent8 @PrincessBravato I absolutely support an independent commission https://t.co/YywE3qWHP6
845038421466894336,2017-03-23 22:23:54,congressmanraja,807,1205,Twitter Web Client,We need a full &amp; transparent investigation into the Trump administration's Kremlin ties #FollowtheFacts #Trumprussia https://t.co/YywE3qWHP6
844989425805393922,2017-03-23 19:09:12,congressmanraja,9,6,Twitter Web Client,#AHCA could get even worse https://t.co/gFzBONDecr
844979168748154883,2017-03-23 18:28:27,congressmanraja,19,0,Twitter Web Client,RT @CongressmanRaja: @SpeakerRyan So about that... #AHCA #readthebill #ProtectOurCare https://t.co/TczuZRie4I
844978140002881536,2017-03-23 18:24:22,congressmanraja,19,26,Twitter Web Client,@SpeakerRyan So about that... #AHCA #readthebill #ProtectOurCare https://t.co/TczuZRie4I
844921364528218114,2017-03-23 14:38:45,congressmanraja,7,0,Twitter for iPhone,"RT @SAALTweets: ""As we confront hate it's heartening to see so many Americans coming together to stand up for the values of our country.” @…"
844720647850921985,2017-03-23 01:21:11,congressmanraja,8,23,Twitter Web Client,The only thing bipartisan about #AHCA is the opposition. https://t.co/2SlV7xWkNY
844701479390842882,2017-03-23 00:05:01,congressmanraja,0,1,Twitter Web Client,@ingve_robert I absolutely will. #AHCA would kill 2 million jobs and strip more than 24 million Americans of their health care.
844701066981724162,2017-03-23 00:03:22,congressmanraja,0,1,Twitter Web Client,@BenGiovanelliSr And I will. I'm fighting to stop #AHCA and I will absolutely vote against it.
844690094766391296,2017-03-22 23:19:46,congressmanraja,23,44,Twitter Web Client,We need answers. We need an independent commission into the Trump administration's Russia ties. #Trumprussia https://t.co/zWEfpcwdnI
844689561318047744,2017-03-22 23:17:39,congressmanraja,0,0,Twitter Web Client,"@DavidP4AD @Jim_Jordan Thank you for coming, David! We were glad to have you."
844683539585122304,2017-03-22 22:53:43,congressmanraja,2,6,Twitter Web Client,@RepAdamSchiff &amp; others continue to do exemplary work but we need an independent commission on the #Trump admin's K… https://t.co/1dThrK9CBJ
844645091948027904,2017-03-22 20:20:57,congressmanraja,2,18,Twitter Web Client,Older Americans shouldn't have to bear the burden for the economically devastating #AHCA https://t.co/kFO798WgaD
844637649642160129,2017-03-22 19:51:22,congressmanraja,5,9,Twitter Web Client,#AHCA would also be devastating for the many members of the #LGBT community who rely on #Medicaid and @PPFA for safe &amp; welcoming care
844635842664710146,2017-03-22 19:44:12,congressmanraja,2,8,Twitter Web Client,"By defunding @PPFA, #AHCA would eliminate access to cancer screenings for many left without alternative clinics
https://t.co/TaMGeXufHo"
844633281836601344,2017-03-22 19:34:01,congressmanraja,1,8,Twitter Web Client,#AHCA would defund Planned Parenthood despite the vital care @PPFA provides millions of Americans #ProtectOurCare https://t.co/NCHHzfCMhQ
844587586370899969,2017-03-22 16:32:26,congressmanraja,7,10,Twitter Web Client,"#AHCA would be devastating for Cook, DuPage &amp; Kane Counties. Here's a look at its damage using Cook County as a cas… https://t.co/jkj7aOIUNI"
844564228229021698,2017-03-22 14:59:37,congressmanraja,2,5,Twitter Web Client,Thanks to J. Noah Brown &amp; Jee Hang Lee of @CCTrustees &amp; my Co-Chair @RepGallagher for making our Middle Class Jobs… https://t.co/FbDtcJuQyG
844528719343570945,2017-03-22 12:38:31,congressmanraja,1002,0,Twitter Web Client,RT @repjoecrowley: 7 years. 20+ million insured. That's progress worth fighting for. #ACA7 https://t.co/HgdSHww8So
844375335873527808,2017-03-22 02:29:02,congressmanraja,8,23,Twitter for iPhone,We need to defend and strengthen the #ACA but instead the House GOP took the economically devastating #AHCA and mad… https://t.co/QEaPLYz4tX
844314437079175168,2017-03-21 22:27:03,congressmanraja,2,12,Twitter for iPhone,"The public may be at 75% but I'm with you 100%, Daryl! https://t.co/Mos1mV1CLx"
844313830645731334,2017-03-21 22:24:38,congressmanraja,2,0,Twitter for iPhone,RT @Desis4Progress: Doors are open! Come join the #WeAreDFP Congressional Roundtable tonight w/@RepBera @RepJayapal @CongressmanRaja @RepRo…
844304058433327106,2017-03-21 21:45:48,congressmanraja,18,30,Twitter Web Client,#AHCA would devastate Medicaid &amp; mental health care funding. We must not abandon these families #ProtectOurCare https://t.co/ER2TQNy7Ht
844290003261964289,2017-03-21 20:49:57,congressmanraja,0,1,Twitter Web Client,"@TessCastell And I will, Tess. I'll keep fighting against #AHCA and for the #ACA. #ResistRepeal #ProtectOurCare"
844272528705159168,2017-03-21 19:40:31,congressmanraja,1,9,Twitter for iPhone,"For the sake of our planet &amp; economy, I hope my colleagues will see the light, or listen to their constituents, and… https://t.co/0eS60eF3MF"
844251418462699524,2017-03-21 18:16:38,congressmanraja,16,25,Twitter Web Client,Still think #ACHA is #ABetterWay? https://t.co/GHQ2TzVaIu
844233852801486848,2017-03-21 17:06:50,congressmanraja,3,17,Twitter Web Client,"Last night I spoke out against #AHCA which would kill millions of jobs, strip millions more of care &amp; drive local g… https://t.co/8YMrmiSTdZ"
844211313974956035,2017-03-21 15:37:16,congressmanraja,5,13,Twitter for iPhone,At least it gives us a chance to agree on something? #AHCA #bipartisanship #abetterway? https://t.co/3gA7kUoQlS
844201146487070720,2017-03-21 14:56:52,congressmanraja,1,4,Twitter Web Client,"Thank you for coming by, @MyForefront! https://t.co/BAcUNwOR8w"
844200917167693825,2017-03-21 14:55:57,congressmanraja,3,19,Twitter Web Client,"Absolutely. we have to prevent those damaging cuts to essential programs that support our economy, protect our envi… https://t.co/uIH9rHjSKY"
844188719599013888,2017-03-21 14:07:29,congressmanraja,4,13,Twitter Web Client,Glad @ElginCommColl has built such a great program that prepares students for good jobs that need to be filled https://t.co/JtVhc8E11n
844188262675763202,2017-03-21 14:05:40,congressmanraja,5,18,Twitter Web Client,Absolutely! I opposed #AHCA and I'll keep fighting to improve the #ACA while supporting @PPFA and all the good work… https://t.co/XeAOOkbKMN
843971010449825792,2017-03-20 23:42:23,congressmanraja,4,33,Twitter Web Client,"I'm still pretty new around here, but I'm going to have to agree, Congressman @justinamash. #AHCA #Bipartisanship https://t.co/eCc2XB2kCw"
843906861862719489,2017-03-20 19:27:29,congressmanraja,0,3,Twitter Web Client,"It was my pleasure to attend, Tom! https://t.co/pKltNQ7bAj"
843894344386076675,2017-03-20 18:37:45,congressmanraja,3,0,Twitter Web Client,RT @Vkarlovsky: Grateful to @CongressmanRaja and @Schneider4IL10 for the dialogue on ACA and AHCA with concerned constituents yesterday. #S…
843876205141114881,2017-03-20 17:25:40,congressmanraja,12,44,Twitter Web Client,Today's #RussiaHearings reaffirm need for a full investigation into Russian interference &amp; the administration's Kremlin ties #ComeyHearing
843850912577835008,2017-03-20 15:45:10,congressmanraja,2,13,Hootsuite,"Every student needs to graduate not just with a diploma, but with an offer letter. I'm proud to be working on this issue with my colleagues."
843845750727610370,2017-03-20 15:24:39,congressmanraja,1,2,Twitter Web Client,Join my staff for a college savings education event on Wednesday at Schaumburg High School from 7-8:30pm https://t.co/GLdqT3tgpV
843835586414809088,2017-03-20 14:44:16,congressmanraja,1,8,Twitter Web Client,"Glad I was able to join @ACAConsumer yesterday in #BuffaloGrove for a conversation on #AHCA, #ACARepeal, and other… https://t.co/sGJoCuSl7d"
843834679014948865,2017-03-20 14:40:39,congressmanraja,2,18,Twitter Web Client,"Don't worry, Karen. I won't and I'm going to do everything I can to prevent #AHCA from being signed into law. https://t.co/h4uI4wFn6D"
843639424831438849,2017-03-20 01:44:47,congressmanraja,6,0,Twitter for iPhone,RT @vrk004: Along with the elderly poor and disabled. @CongressmanRaja @Drsforamerica https://t.co/oIFUF1KGHa
843615853555924993,2017-03-20 00:11:07,congressmanraja,11,16,Twitter Web Client,"#AHCA won't simply fail to provide ""insurance for everybody,"" it will rob more than 24 million Americans of the cov… https://t.co/4ivcTI5ab5"
843566359581736960,2017-03-19 20:54:27,congressmanraja,7,20,Twitter for iPhone,#AHCA would be a disaster for hardworking families. We have to join together to stop it. #resistrepeal https://t.co/uMoFhJXIfV
843550913151324165,2017-03-19 19:53:04,congressmanraja,2,26,Twitter for iPhone,"""The Wall"" looks awful from every side. We need homeland security policies that make us safer throughout the world;… https://t.co/Lgq9qWTdAG"
843264306552737792,2017-03-19 00:54:12,congressmanraja,3,25,Twitter Web Client,Here's to a man who could play a guitar just like a-ringing a bell. RIP #ChuckBerry
843221569182863362,2017-03-18 22:04:23,congressmanraja,15,30,Twitter for iPhone,The House GOP could not be more clear in showing they want to turn back the clock to before the #ACA. We must stop… https://t.co/IkiytM4Yor
842928512306761728,2017-03-18 02:39:52,congressmanraja,3,5,Twitter Web Client,Thanks for joining us for a wonderful discussion of the skills gap and the best approaches to addressing it through… https://t.co/ucweBWzs8U
842834379500142593,2017-03-17 20:25:49,congressmanraja,48,139,Twitter Web Client,The House GOP wouldn't hold full hearings on #ACHA so I worked with other @HouseDemocrats and we held our own yeste… https://t.co/V0eRt3Mlpv
842817277926019073,2017-03-17 19:17:52,congressmanraja,0,1,Twitter Web Client,"@SusieKline I'm proud to support @PPFA and all the good work it does. I'm glad you called, Susie!"
842816351932768256,2017-03-17 19:14:11,congressmanraja,22,83,Twitter Web Client,Happy #StPatricksDay to everyone #NoBanNoWall https://t.co/1G7W5mx322
842539108127797248,2017-03-17 00:52:31,congressmanraja,87,135,Twitter Web Client,"""You keep using that word. I do not think it means what you think it means."" #Budget2017  https://t.co/2E9QhTZ60L"
842444575658635264,2017-03-16 18:36:53,congressmanraja,13,48,Twitter Web Client,Today I took to the House floor to call for Oversight Committee hearings to address the wave of hate crimes that ha… https://t.co/pbIEwleUww
842410555105267714,2017-03-16 16:21:42,congressmanraja,6,31,Twitter Web Client,I'll continue to oppose the GOP health plan and defend #ACA. Thanks to everyone who called or wrote. #Resistrepeal https://t.co/QHFM5tj6fc
842398070994276352,2017-03-16 15:32:05,congressmanraja,1,0,Twitter Web Client,@curtisharris318 I absolutely will. This plan would devastate our economy &amp; local governments while stripping millions of care
842391345121632258,2017-03-16 15:05:22,congressmanraja,4,0,Twitter Web Client,RT @KatherineSkiba: Illinois Dems incl @CongressmanRaja bombarded with calls against GOP health care proposal. Some GOP'ers undecided. http…
842390606508916740,2017-03-16 15:02:26,congressmanraja,1,11,Twitter Web Client,We need to combat the wave of hate crimes facing our nation. These attacks on our people and our values must end. https://t.co/pbQWVgZeiK
