id,created_at,user,retweets,favorite_count,source,text
133250313107939328,2011-11-06 18:32:04,CongMikeSimpson,1,0,Twitter Web Client,"RT @afinland: After explaining my theory on how UGA can make BCS to #HeathShuler, @CongMikeSimpson brings up Boise St beatdown. @FoxNews ..."
132557431187308544,2011-11-04 20:38:49,CongMikeSimpson,1,0,Twitter Web Client,Check out my latest @msnbctv interview with Rep. Heath Shuler http://t.co/ws4dnGCU
132524015628730368,2011-11-04 18:26:02,CongMikeSimpson,3,0,Twitter Web Client,RT @FoxNewsSunday: Also on #FoxNewsSunday this week with @RonPaul is @CongMikeSimpson (R-ID) and Rep. Heath Shuler (D-NC) #ChrisWallace
126697857444098048,2011-10-19 16:34:57,CongMikeSimpson,0,0,Facebook,Speaking at Idaho Environmental Forum http://t.co/aHoJz235
116962047941554176,2011-09-22 19:48:19,CongMikeSimpson,1,0,Facebook,"Topping the list is Senate Majority Leader Harry Reid, D-Nev., who is noted for having blocked bills backed by... http://t.co/dQL03IPq"
115156132661690368,2011-09-17 20:12:16,CongMikeSimpson,0,0,Facebook,"Today, September 17, is Constitution Day. More than 200 years ago our forefathers signed this incredible document... http://t.co/BBQPRECd"
112888404311687169,2011-09-11 14:01:07,CongMikeSimpson,0,0,Facebook,"Today we pay respect and remember those who gave their lives on 9/11, their memory will be forever in our hearts.... http://t.co/zrKhmvw"
108947448243814400,2011-08-31 17:01:10,CongMikeSimpson,0,0,Facebook,"I will host a one hour telephone town hall on Wednesday, September 7, at 7:00 p.m. MST. Telephone town halls are... http://t.co/I9ufbZW"
106085432130932736,2011-08-23 19:28:32,CongMikeSimpson,2,0,Facebook,Members of my staff are all okay and our DC phones have been transferred to the District in order to serve constituents..
99159785378816000,2011-08-04 16:48:29,CongMikeSimpson,1,0,Facebook,"Simpson statement on Judge Molloy's recent decision concerning wolf management: ""While I am not surprised by... http://fb.me/13d1C1iUX"
96242128715382785,2011-07-27 15:34:46,CongMikeSimpson,2,0,Facebook,"Simpson defends ESA provision in FY12 Interior Bill

http://www.youtube.com/CongMikeSimpson http://fb.me/1cPixRCuj"
96015013470404608,2011-07-27 00:32:17,CongMikeSimpson,0,0,Facebook,We are currently debating the Interior Appropriations Bill for FY2012 http://fb.me/U9twDW6h
95601684822233088,2011-07-25 21:09:52,CongMikeSimpson,0,0,Facebook,"Simpson defends EPA spending cuts on the floor of the House

http://www.youtube.com/CongMikeSimpson http://fb.me/11UvmBzqq"
90533428881129472,2011-07-11 21:30:26,CongMikeSimpson,0,0,Facebook,"Chairing the House Appropriations Committee Mark-up Tuesday, July 12 at 10:30/8:30 MST. You can watch here: http://appropriations.house.gov/"
88300177517056000,2011-07-05 17:36:17,CongMikeSimpson,0,0,Facebook,Telephone town halls are virtual community meetings that provide Idahoans the opportunity to share their concerns... http://fb.me/z5jHeobL
86788909341736961,2011-07-01 13:31:03,CongMikeSimpson,0,0,Facebook,Independence Day http://fb.me/NnuScuRa
85804250034221056,2011-06-28 20:18:22,CongMikeSimpson,0,0,Facebook,School Lunch Programs Need Potatoes http://fb.me/KFHXFyI6
80737842904576001,2011-06-14 20:46:16,CongMikeSimpson,0,0,Facebook,Today is Flag Day. Read my editorial on Honoring the Birth of the American Flag and fly your flag this week! http://fb.me/OYdTzX4G
80737792107356160,2011-06-14 20:46:04,CongMikeSimpson,0,0,Facebook,Today is Flag Day. Read my editorial on Honoring the Birth of the American Flag and fly your flag this week! http://fb.me/D3LACeGh
80737706711318528,2011-06-14 20:45:43,CongMikeSimpson,0,0,Facebook,Today is Flag Day. Read my editorial on Honoring the Birth of the American Flag and fly your flag this week! http://fb.me/CJsVGE3P
75998072584409088,2011-06-01 18:52:07,CongMikeSimpson,0,0,Facebook,Simpson Blasts NRC Handling of Yucca Mountain http://fb.me/11dmvymCU
60076629690548224,2011-04-18 20:25:59,CongMikeSimpson,1,0,Facebook,"Check out my latest op-ed about the budget.
http://1.usa.gov/g5REqJ"
60076478322319360,2011-04-18 20:25:23,CongMikeSimpson,0,0,Facebook,"Check out my latest op-ed about the budget

http://1.usa.gov/g5REqJ"
60076279705251840,2011-04-18 20:24:35,CongMikeSimpson,0,0,Facebook,"Check out my latest op-ed about the budget.

http://1.usa.gov/g5REqJ http://fb.me/IsKE8gV2"
58285179097198592,2011-04-13 21:47:24,CongMikeSimpson,0,0,Facebook,"After seeing House Republicans plan to get spending under control, President Obama has come late to the game with... http://fb.me/WhT4A1xD"
57836132834095105,2011-04-12 16:03:03,CongMikeSimpson,0,0,Facebook,"Simpson Cuts Billions from EPA, Department of Interior in Final CR | U.S. Congressman Mike Simpson - http://fb.me/HZfWT2dj"
57827507369549824,2011-04-12 15:28:46,CongMikeSimpson,0,0,Facebook,Here is a story about my provision to defund the Wild Land initiative. http://fb.me/EcZE1rQs
53545561428725760,2011-03-31 19:53:51,CongMikeSimpson,0,0,Facebook,Simpson Addresses Reactor Safety and Yucca Mountain | U.S. Congressman Mike Simpson - 2nd District o http://fb.me/WantVPy4
48126411587862528,2011-03-16 21:00:05,CongMikeSimpson,0,0,Facebook,http://fb.me/VkdkuGb3
45264874615480320,2011-03-08 23:29:21,CongMikeSimpson,0,0,Facebook,http://fb.me/wR0zM2Mz
38973155590668288,2011-02-19 14:48:19,CongMikeSimpson,0,0,Facebook,http://fb.me/Llq2ciDe
37910011803996160,2011-02-16 16:23:45,CongMikeSimpson,0,0,Facebook,"Responding to claims that Obama’s budget included serious cuts and amounted to a “tough love” budget, Simpson... http://fb.me/HnjOQXWC"
37184848716107776,2011-02-14 16:22:13,CongMikeSimpson,0,0,Facebook,http://fb.me/SXi7JF76
36171221854855168,2011-02-11 21:14:25,CongMikeSimpson,0,0,Facebook,http://fb.me/VfiwIbVl
35361098295291904,2011-02-09 15:35:17,CongMikeSimpson,0,0,Facebook,Check out this story in The Hill about the new policy from the Interior Department concerning Wildlands. http://fb.me/TaJ617BX
23852013573898240,2011-01-08 21:22:17,CongMikeSimpson,0,0,Facebook,"I am deeply saddened to learn of the tragic attack on Congresswoman Giffords, her staff, and the citizens... http://fb.me/RZkgsl99"
23466951468650496,2011-01-07 19:52:11,CongMikeSimpson,0,0,Facebook,Congressman Mike Simpson Lands Chairman of Interior Appropriations http://fb.me/RXEjH0kg
22754183966887936,2011-01-05 20:39:54,CongMikeSimpson,0,0,Facebook,“It is extremely humbling to preside over the U.S. House and I often think about the members throughout our... http://fb.me/LFkk9sPm
15826585198264320,2010-12-17 17:52:06,CongMikeSimpson,0,0,Facebook,"As I talk to farmers, ranchers, and businesses throughout Idaho about the economic challenges they face, the... http://fb.me/wLJvRcAJ"
12266006772715521,2010-12-07 22:03:38,CongMikeSimpson,0,0,Facebook,Here is more from today's Nuclear Summit.  . . http://fb.me/Dc9ogACo
12204238755074049,2010-12-07 17:58:11,CongMikeSimpson,0,0,Facebook,Enjoyed participating in the summit on the future of nuclear energy today. Looking forward to hearing the... http://fb.me/vWcl7yyE
5714942200127489,2010-11-19 20:12:03,CongMikeSimpson,0,0,Facebook,Simpson Urges Forest Service to Support Recreation http://fb.me/C7ulBJ68
2792162391490560,2010-11-11 18:37:58,CongMikeSimpson,0,0,Facebook,"Today is Veterans Day, a day to honor American’s Veterans. Thank you for your service, for your patriotism, and... http://fb.me/LP6jfWGV"
25991374646,2010-09-30 15:46:00,CongMikeSimpson,0,0,Facebook,Simpson Opposes Government Spending Bill http://fb.me/KLecJ5Yg
19444007820,2010-07-24 20:08:44,CongMikeSimpson,0,0,Facebook,"The Idaho Falls Air show featuring the Blue Angels is amazing, absolutely fantastic!"
19266417571,2010-07-22 16:17:39,CongMikeSimpson,0,0,Facebook,Here is the last of my 4-part series on CIEDRA. I hope they answer questions you may have about what we are... http://fb.me/C5FKCOtU
19089022531,2010-07-21 16:31:16,CongMikeSimpson,0,0,Facebook,Most areas affected by CIEDRA are existing federal lands that are currently designated as wilderness study areas.... http://fb.me/EfU6R1uk
19003734969,2010-07-20 15:54:09,CongMikeSimpson,0,0,Facebook,One of the most contentious issues in the wilderness debate is access.  As I have worked with Idaho stakeholders... http://fb.me/BU7Wd2ER
19003614152,2010-07-20 15:52:26,CongMikeSimpson,0,0,Facebook,"For nearly a decade I have worked with Idahoans to solve land management issues in central Idaho.  In ten years,... http://fb.me/B6fCyQO3"
19003352451,2010-07-20 15:48:42,CongMikeSimpson,0,0,Facebook,I began this process ten years ago after a meeting with ranchers.  They were under the constant threat of losing... http://fb.me/EfjPxmV4
16934177494,2010-06-24 14:44:15,CongMikeSimpson,0,0,Facebook,"To my sweetheart of 40 years today, Happy Anniversary Kathy! http://fb.me/BySf9eYv"
14172842628,2010-05-17 17:10:43,CongMikeSimpson,0,0,Facebook,"Every year the House Budget Committee starts the budget process by creating the federal budget resolution, which... http://bit.ly/cm2cOM"
13445390210,2010-05-05 20:21:09,CongMikeSimpson,0,0,Facebook,"“Teachers play a critical role in shaping our future. They touch the lives of children every day.  They inspire,... http://bit.ly/d7D6Pe"
13026820182,2010-04-28 20:34:32,CongMikeSimpson,0,0,Facebook,"""This massive health care takeover will not save money nor create a better health care system,"" said Simpson. ""I... http://bit.ly/da0fpI"
12965136454,2010-04-27 21:07:21,CongMikeSimpson,0,0,Facebook,"“With job numbers at historic lows and the national debt at record highs, it would simply be unacceptable for... http://bit.ly/bg8Gfy"
12897047372,2010-04-26 18:16:31,CongMikeSimpson,0,0,Facebook,Idaho Delegation Reacts to Idaho Guard Deployment http://bit.ly/axcNbQ
12597027227,2010-04-21 20:48:28,CongMikeSimpson,0,0,Facebook,"Congressman Mike Simpson today came out in strong opposition to H.R. 5088, America’s Commitment to Clean Water Act.... http://bit.ly/dd7h0V"
12234395945,2010-04-15 17:18:44,CongMikeSimpson,0,0,Facebook,"On Tax Day this year, many Americans are struggling to make ends meet and facing difficult economic realities that... http://bit.ly/cgma3Y"
10854679382,2010-03-22 03:43:00,CongMikeSimpson,0,0,Facebook,Simpson Votes Against National Health Care Takeover http://bit.ly/alr1oI
10641168921,2010-03-17 22:12:38,CongMikeSimpson,0,0,Facebook,We intend to use every tool the Constitution provides us to stop the ‘Slaughter Solution’ that Speaker Pelosi is... http://bit.ly/c4mldK
10290519692,2010-03-10 21:51:29,CongMikeSimpson,0,0,Facebook,Simpson Reintroduces Bill to Empower Rural Communities Against EPA’s Enormous Grip: “We’re not talking here about... http://bit.ly/bTlhDZ
8569618013,2010-02-03 02:18:58,CongMikeSimpson,0,0,Facebook,Simpson Questions White House Budget Director on the Budget and National Debt http://bit.ly/dxCybT
8307566885,2010-01-28 03:28:25,CongMikeSimpson,0,0,Facebook,Congressman Mike Simpson Responds to State of the Union http://bit.ly/98BMlc
8080909633,2010-01-22 19:16:06,CongMikeSimpson,0,0,Facebook,The Message Voters Really Sent http://bit.ly/4vqw6p
7972126788,2010-01-20 03:15:37,CongMikeSimpson,0,0,Facebook,"“The election of Scott Brown, a republican in a state that is among the most liberal states in the nation,... http://bit.ly/70aY5T"
6476960910,2009-12-08 22:24:50,CongMikeSimpson,0,0,Facebook,"“Republicans insisted that TARP include a number of taxpayer protections, including a requirement that any repaid... http://bit.ly/51M52P"
6443059601,2009-12-07 21:54:56,CongMikeSimpson,0,0,Facebook,"We all know teachers who buy extra supplies to use in their classroom, supplies that enhance learning and aid in... http://bit.ly/8foyP7"
5862381194,2009-11-19 16:57:14,CongMikeSimpson,0,0,Facebook,Mammogram Screenings:  I believe that decisions as personal as a person’s health should be between patients and... http://bit.ly/21tzeD
5431144272,2009-11-04 21:39:55,CongMikeSimpson,1,1,Facebook,REAL Health Care Reform - Options Better Than Pelosi’s Bill http://bit.ly/3MHjT1
5403804113,2009-11-03 22:37:07,CongMikeSimpson,1,0,Facebook,Health Bill Costs Just Don’t Add Up http://bit.ly/25rzbG
4719234114,2009-10-08 22:48:18,CongMikeSimpson,1,0,Twitter Web Client,"Voted against hate crime provision. When ANY heinous crime is committed, perpetrators should be prosecuted to the fullest extent of the law."
4503650761,2009-09-30 18:29:03,CongMikeSimpson,0,0,Twitter Web Client,"Idaho Congressman Mike Simpson was appointed to House and Senate negotiations on a final Fiscal Year 2010 Subcommittee funding bill, today."
