id,created_at,user,retweets,favorite_count,source,text
443769755695321088,2014-03-12 15:25:29,CongMikeSimpson,0,0,Twitter Web Client,Last night Congressman Simpson supported legislation which would provide relief to businesses to hire more veterans http://t.co/cqRUhrTN2O
443083913049956353,2014-03-10 18:00:11,CongMikeSimpson,1,0,Twitter Web Client,ICYMI: Rep. Simpson will continue to challenge the USDA to reverse the ban on fresh white potatoes. http://t.co/Ah4BgSXpnr
441700051971481600,2014-03-06 22:21:13,CongMikeSimpson,4,1,Twitter Web Client,Congressman Simpson protects Americans from individual mandate penalty tax for 2014. http://t.co/SQQj7nkh9U
441648661127499777,2014-03-06 18:57:00,CongMikeSimpson,1,0,Twitter Web Client,Congressman Simpson supported House-passed bill preventing EPA from issuing GHG regulations http://t.co/aqktSROp1F
440969223003598849,2014-03-04 21:57:10,CongMikeSimpson,2,0,Twitter Web Client,Simpson on President’s FY2015 Budget Request: “Dead on Arrival” http://t.co/Ma15YnjdKS
440963322368647169,2014-03-04 21:33:43,CongMikeSimpson,5,0,Twitter Web Client,"RT @DOE_SC_NSB: Boise High School (Boise, Idaho) won Monday &amp; is advancing to the National Science Bowl finals in DC!  Nice job! @BSDEducat…"
439558218898231296,2014-03-01 00:30:20,CongMikeSimpson,3,3,Twitter Web Client,Congressman Simpson introduces legislation to prevent AG Holder from arbitrarily blocking commonly owned firearms. http://t.co/xvERmhfsYJ
439509781293039618,2014-02-28 21:17:52,CongMikeSimpson,4,1,Twitter Web Client,"Simpson: ""Disappointed in USDA’s decision to ignore legislation directing agency to include fresh potatoes in WIC."" http://t.co/OkAN7i07WH"
439139295262040064,2014-02-27 20:45:41,CongMikeSimpson,1,1,Twitter Web Client,"On Wednesday, Rep. Simpson met with the Idaho Sugarbeet Growers Association to discuss U.S. sugar policy. http://t.co/efaJQFPmdb"
439081832353914880,2014-02-27 16:57:21,CongMikeSimpson,1,1,Twitter Web Client,Simpson Votes to Stop IRS Targeting Conservative Groups http://t.co/lCUDEGfXJn
438793476055265280,2014-02-26 21:51:31,CongMikeSimpson,4,0,Twitter Web Client,RT @BabcockWilcox: Honored to present @N_E_I #Nuclear #Energy R&amp;D Policymaker of the 113th Congress Award to @CongMikeSimpson http://t.co/c…
438793391443148800,2014-02-26 21:51:11,CongMikeSimpson,2,1,Twitter Web Client,Nuclear Energy Institute Names Simpson Policy Maker of the Year http://t.co/5S3M4YUJXV http://t.co/ZEthLcEPhP
438734906424688640,2014-02-26 17:58:47,CongMikeSimpson,1,1,Twitter Web Client,Rep. Simpson with Potato Industry Leadership Program participants from Idaho. http://t.co/6wpU6da3Fh
438728276270280704,2014-02-26 17:32:27,CongMikeSimpson,1,1,Twitter Web Client,Rep. Simpson meets with Idaho Potato Growers attending the National Potato Council DC Fly-In. http://t.co/MvmU8qtFH6
438479196374204416,2014-02-26 01:02:41,CongMikeSimpson,3,1,Twitter Web Client,"Rep. Simpson supported Protecting Taxpayers from Intrusive IRS Requests Act-protects taxpayers from IRS questions on rel, pol, social belief"
438416902818660352,2014-02-25 20:55:09,CongMikeSimpson,4,0,Twitter Web Client,"RT @MikeCrapo: .@SenatorRisch, @CongMikeSimpson, @Raul_Labrador and I announced that support is growing for our fire bill. #idpol http://t.…"
438385150620348416,2014-02-25 18:48:59,CongMikeSimpson,2,1,Twitter Web Client,Rep Simpson had the opportunity to meet with ID reps from the Disabled American Veterans organization this afternoon https://t.co/LM7Gg0UDWT
436571208172048384,2014-02-20 18:41:01,CongMikeSimpson,2,2,Twitter Web Client,Simpson joined ID delegation &amp; @fschief in Boise to discuss wildfire funding &amp; solutions to prevent future wildfires http://t.co/9ZRTpVUOHt
436286609965596672,2014-02-19 23:50:08,CongMikeSimpson,2,1,Twitter Web Client,Congressman Simpson had a great time meeting with the Idaho Food Producers Association in Boise this morning. http://t.co/HvDg0slXct
436212309112160258,2014-02-19 18:54:53,CongMikeSimpson,3,0,Twitter Web Client,ICYMI: Congressman Simpson’s op-ed on the broken promises of Obamacare was featured in the Idaho Mountain Express. http://t.co/3vsHzt2teU
434419576646815744,2014-02-14 20:11:12,CongMikeSimpson,1,0,Twitter Web Client,ICYMI-I joined Kevin Miller’s radio show this am in the 6 o'clock hour to discuss solutions to US debt and more. http://t.co/zExvZn5HYd
433634452703440896,2014-02-12 16:11:24,CongMikeSimpson,3,1,Twitter Web Client,Today we celebrate the birthday of Pres. Lincoln who signed the congressional act which created the ID Territory. http://t.co/GwoZhJ4U8c
432979188556255232,2014-02-10 20:47:37,CongMikeSimpson,1,0,Twitter Web Client,"RT @DOE_SC_NSB: Congrats to the Treasure Valley Math and Science Center in Boise, ID for advancing to the National Finals of the NSB! http:…"
431897855645581312,2014-02-07 21:10:47,CongMikeSimpson,0,0,Twitter Web Client,"ICYMI-Simpson introduced bill to reform wildfire funding-Supports firefighters and land managers, saves taxpayers http://t.co/lZbnsESf0O"
431832552626585600,2014-02-07 16:51:18,CongMikeSimpson,2,0,Twitter Web Client,Good luck to our local Idahoans who will be representing the United States at this year’s Olympics! http://t.co/z4ovVtmDwz
431526163928731648,2014-02-06 20:33:49,CongMikeSimpson,1,0,Twitter Web Client,CBO estimates of ACA are troubling for US workers-House GOP will continue to delay/defund/repeal to protect Americans http://t.co/QZ9j3dQX0X
428650540390547457,2014-01-29 22:07:07,CongMikeSimpson,3,1,Twitter Web Client,Simpson supports Farm Bill which reduces/reforms farm policy spending and food stamp expenditures - saves $23 billion http://t.co/gse6aOqR5W
428562311217819648,2014-01-29 16:16:31,CongMikeSimpson,2,0,Twitter Web Client,Disappointed POTUS didn't address O-Care failures in #SOTU - Check out GOP solution I cosponsored to replace O-Care http://t.co/JMnli5ntQd
423602808391098368,2014-01-15 23:49:14,CongMikeSimpson,2,0,Twitter Web Client,House Passes Bill to Reduce Federal Spending While Prioritizing Important Programs http://t.co/K085iZGyop
423547439878905856,2014-01-15 20:09:13,CongMikeSimpson,4,0,Twitter Web Client,RT @HouseAppropsGOP: .@RepHalRogers: Omnibus provides no new funding for #ObamaCare - cuts existing Ocare funds by +$1 billion.
423198429620105216,2014-01-14 21:02:22,CongMikeSimpson,1,1,Twitter Web Client,"Congressman Mike Simpson’s first Energy &amp; Water bill reverses Obama Administration’s nuclear cuts, moves @INL forward http://t.co/L93kfCxJFp"
423131319200018432,2014-01-14 16:35:42,CongMikeSimpson,1,1,Twitter Web Client,Simpson meets with reps. from @WyakinWarrior Foundation. A nonprofit which helps wounded and injured veterans. http://t.co/bB08TxENSK
421327267323584512,2014-01-09 17:07:03,CongMikeSimpson,2,0,Twitter Web Client,Simpson Cosponsors Bill to Curb EPA Water Regulation http://t.co/s23BMcsrnJ
420242668233314304,2014-01-06 17:17:14,CongMikeSimpson,0,1,Twitter Web Client,Stay informed about the House of Representatives and my work on behalf of Idaho by signing up for my e-newsletter. https://t.co/E5FqPHyMpz
413784567439298570,2013-12-19 21:35:03,CongMikeSimpson,4,0,Twitter Web Client,"Here is a list of House bills passed in 2013. Unfortunately, many of these bills are stuck in the Senate. http://t.co/EMbyWU9Bkv"
411551060101066753,2013-12-13 17:39:53,CongMikeSimpson,0,1,Twitter Web Client,"Simpson Votes to Reduce Deficit, Protect INL and PILT http://t.co/gwBiukHpiv"
410507712892399616,2013-12-10 20:34:00,CongMikeSimpson,4,0,Twitter Web Client,Sec. Sebelius will testify before E&amp;C tomorrow-Visit link to add your questions &amp; concerns about Obamacare http://t.co/6DkdVueFVk
409001516268126208,2013-12-06 16:48:55,CongMikeSimpson,1,2,Twitter Web Client,4 days until staff signup deadline my staff are trying to enroll in Obamacare-site is down other staff on hold 45 min http://t.co/udLzWEPElg
408689147935592449,2013-12-05 20:07:40,CongMikeSimpson,2,2,Twitter Web Client,Kathy and I send our thoughts and prayers to the children and families involved in the bus crash today in Canyon County.
407552593192169472,2013-12-02 16:51:24,CongMikeSimpson,0,1,Twitter Web Client,Today marks the 150th anniversary of the completion of the Capitol Dome w/ the final touches on the Statue of Freedom http://t.co/Tzm4MV3kVz
406113510913880064,2013-11-28 17:33:00,CongMikeSimpson,4,3,Twitter Web Client,Kathy and I would like to wish a happy and safe Thanksgiving to all. Thankful for the opportunity to represent and work alongside Idahoans.
405069449645944832,2013-11-25 20:24:17,CongMikeSimpson,1,1,Twitter Web Client,Simpson to FDA: Listen to Farmers on Food Safety -http://t.co/5wDN0A8Fek
403595901282684929,2013-11-21 18:48:55,CongMikeSimpson,1,0,Twitter Web Client,Simpson supports bill to improve US energy security by reversing decline in US oil &amp; nat gas production on fed land http://t.co/UAgHwM2DWt
403274879341830144,2013-11-20 21:33:18,CongMikeSimpson,2,1,Twitter Web Client,Simpson introduces bill to provide ID a 3rd dist. judge to address court case overload and improve court efficiency http://t.co/XFh9qka2mi
402513454411812864,2013-11-18 19:07:40,CongMikeSimpson,10,0,Twitter Web Client,"RT @INL: New technology efficiently purifies industrial waste water, earning awards for @INL research team. http://t.co/08FCEynmE2 #EnergyE…"
401455354019864576,2013-11-15 21:03:09,CongMikeSimpson,5,0,Twitter Web Client,RT @MikeCrapo: Congrats to @CongMikeSimpson on his new chairmanship of the Appropriations Subcommittee on Energy &amp; Water Development.Great …
401455267272863744,2013-11-15 21:02:49,CongMikeSimpson,1,1,Twitter Web Client,@MikeCrapo Thank you Senator
401079479071555584,2013-11-14 20:09:34,CongMikeSimpson,1,1,Twitter Web Client,Simpson joins colleagues in supporting rule proposed by USFWS to remove the gray wolf from the ESA nationwide. http://t.co/2Tg7GUJgCO
400677892893327360,2013-11-13 17:33:48,CongMikeSimpson,2,0,Twitter Web Client,"Simpson secures Energy &amp; Water chairmanship which funds DOE, including the INL’s research &amp; cleanup operations. http://t.co/aoprNsXNry"
400655284873740288,2013-11-13 16:03:58,CongMikeSimpson,4,0,Twitter Web Client,"RT @HouseAppropsGOP: ""Very few who know more about the nation's energy and water needs"" than new Sbcmte Chairman @CongMikeSimpson, says @Re…"
400655228581994496,2013-11-13 16:03:44,CongMikeSimpson,8,0,Twitter Web Client,RT @HouseAppropsGOP: New chairs of @HouseAppropsGOP Sbcmtes: @USRepRodney - Defense; @CongMikeSimpson - Energy/Water; @KenCalvert - Interio…
400381758878650368,2013-11-12 21:57:04,CongMikeSimpson,2,0,Twitter Web Client,Read Congressman Simpson’s op-ed on health care reform that improves access to care and keeps costs down. http://t.co/ZReWFfGyiN
400299205207392256,2013-11-12 16:29:02,CongMikeSimpson,0,0,Twitter Web Client,ICYMI: Rep. Simpson on Viewpoint discussing solutions to our nation’s budget deficit and efforts to repeal Obamacare http://t.co/rA2jTCjTZ8
399949686678634496,2013-11-11 17:20:10,CongMikeSimpson,1,0,Twitter Web Client,Thanks to all of our nation’s veterans and their families for their service and sacrifices made on behalf of our great country.
398482412302114816,2013-11-07 16:09:45,CongMikeSimpson,1,2,Twitter Web Client,Congressman Simpson meets with Idaho representatives from the Juvenile Diabetes Research Foundation in Boise. http://t.co/ch1SpiDMrO
395993626041257985,2013-10-31 19:20:12,CongMikeSimpson,3,2,Twitter Web Client,Simpson cosponsors Delay Until Fully Functional Act to address the inherent problems with gov. run helathcare. http://t.co/BNKvjdahQd
395657503100641281,2013-10-30 21:04:34,CongMikeSimpson,13,0,Twitter Web Client,RT @NRA: Thanks to all signers includ. @CongMikeSimpson MT: Simpson signs letter to POTUS expressing opposition to the #UNATT http://t.co/R…
395568924441317376,2013-10-30 15:12:35,CongMikeSimpson,1,2,Twitter Web Client,ICYMI: Simpson signs letter to POTUS expressing opposition to the UN Arms Trade Treaty. http://t.co/UXzSiXr0Fy
392660407581560832,2013-10-22 14:35:11,CongMikeSimpson,4,0,Twitter Web Client,The Shut Down Strategy and Obamacare – Idahoans Deserve the Truth: http://t.co/uexFYy0giL
391362951770173440,2013-10-19 00:39:33,CongMikeSimpson,5,2,Twitter Web Client,"Rep. Bill Young's passing is a great loss. A true statesman, great mentor &amp; wonderful friend. We send our prayers to his wife &amp; family."
387256811599826944,2013-10-07 16:43:13,CongMikeSimpson,14,0,Twitter Web Client,ICYMI: House passed 2 bills over the weekend to fund the government while the Senate refuses to come to the table. http://t.co/X308lTlGFO
386183100658495488,2013-10-04 17:36:40,CongMikeSimpson,4,2,Twitter Web Client,"House GOP continues to pass bills to fund the government, while Senate refuses to negotiate. http://t.co/LGHlYmZBmu"
385831798350958592,2013-10-03 18:20:43,CongMikeSimpson,3,3,Twitter Web Client,"""I'm disgusted that the gentleman from California would actually use the word jihad on the house floor"" -Rep. Simpson http://t.co/RQfCP6zjfB"
385782677346865153,2013-10-03 15:05:32,CongMikeSimpson,2,1,Twitter Web Client,Watch Congressman Simpson’s opening statement on House passed bill to reopen Nataional Parks and museums. http://t.co/1J9NM2rFUN
385505463501987840,2013-10-02 20:43:59,CongMikeSimpson,1,0,Twitter Web Client,Shutdown Update: http://t.co/XOWxzNNsbq
383686434424508417,2013-09-27 20:15:49,CongMikeSimpson,0,0,Twitter Web Client,"HRes354 passes Congress, removes gov’t from helium business allowing companies like Micron to obtain helium for needs http://t.co/YhDy4A36w3"
383599490118078464,2013-09-27 14:30:20,CongMikeSimpson,1,0,Twitter Web Client,Congressman Simpson stresses the importance of the A-10 Thunderbolt which is currently operated at Gowen Field. http://t.co/x6xykSA7am
380451472120348672,2013-09-18 22:01:14,CongMikeSimpson,0,0,Twitter Web Client,Simpson Votes to Ensure Domestic Mineral Supply - bill passes the House today by a vote of 246-178.
363406730144657408,2013-08-02 21:11:30,CongMikeSimpson,10,0,Twitter Web Client,Congress exempt from Obamacare??? http://t.co/binBRYr7qk
354739284776976385,2013-07-09 23:10:10,CongMikeSimpson,5,0,Twitter Web Client,Simpson Helps Defeat Amendment Regulating Navigable Waters http://t.co/5hteJT3uDu
354341930123001856,2013-07-08 20:51:14,CongMikeSimpson,3,0,Twitter Web Client,"Watch the University of Idaho McClure Symposium highlights on how federal gov't impacts on local gov’t
http://t.co/Q0VLPRSxeF"
351763576001802240,2013-07-01 18:05:46,CongMikeSimpson,2,2,Twitter Web Client,Kathy’s and my thoughts and prayers are with the families of the heroic firefighters in AZ who gave their lives protecting their communities
350262938310938624,2013-06-27 14:42:46,CongMikeSimpson,5,0,Twitter Web Client,Simpson Vows Action to Limit Reach of Obama Regs  http://t.co/fap9OwHoRQ
349190993876250625,2013-06-24 15:43:15,CongMikeSimpson,0,1,Twitter Web Client,Happy Anniversary Kathy – 43 and still counting!
346767825081360384,2013-06-17 23:14:26,CongMikeSimpson,3,1,Twitter Web Client,Simpson’s Bill Addressing Idaho Wilderness Water Diversions Passes House http://t.co/PiZpk49dK5
345298325685301248,2013-06-13 21:55:10,CongMikeSimpson,1,0,Twitter Web Client,"My amendment allows fresh potatoes to be included in WIC
  http://t.co/pU8Mgmx9hz"
339024394028478465,2013-05-27 14:24:48,CongMikeSimpson,7,3,Twitter Web Client,Remembering those who gave all to protect our freedom.
337614909590339587,2013-05-23 17:04:01,CongMikeSimpson,2,0,Twitter Web Client,House Passes Smarter Solutions for Students Act http://t.co/i3l6NUyKN7
336617889815752704,2013-05-20 23:02:13,CongMikeSimpson,2,0,Twitter Web Client,Proud to support the Stolen Valor Act of 2013 http://t.co/sx7bdkj5gF
335166056572284928,2013-05-16 22:53:09,CongMikeSimpson,1,2,Twitter Web Client,"House repeals ACA - I believe it is a reflection of how deeply unpopular the law remains, not just in the House, but across the country."
331887286641897473,2013-05-07 21:44:29,CongMikeSimpson,3,0,Twitter Web Client,Today is National Teacher Appreciation Day. Thank you Mr. Hager for first making me interested in politics! http://t.co/kiqX8coO2Y
323930208602312705,2013-04-15 22:45:54,CongMikeSimpson,1,0,Twitter Web Client,Kathy and my thoughts and prayers are with families impacted by this terrible act that occurred today in Boston.
309396759371714561,2013-03-06 20:15:10,CongMikeSimpson,1,0,Twitter Web Client,"Can't visit the White House? The Capitol continues welcoming visitors. Idahoans who want a Capitol tour, visit http://t.co/XTZ9SQ6eqs"
308661571410878464,2013-03-04 19:33:47,CongMikeSimpson,2,1,Twitter Web Client,Congressman Simpson Recognizes Idaho’s Sesquicentennial http://t.co/fNhnyYMF9H
306518105906102274,2013-02-26 21:36:26,CongMikeSimpson,3,2,Twitter Web Client,Cong. Simpson speaks about the budget deficit during the National Potato Council Fly-In. http://t.co/rjmvIXvW0r
305090587835637761,2013-02-22 23:03:59,CongMikeSimpson,1,0,Twitter Web Client,Tune in to IDPTV for great discussion on the national deficit tonight at 9:00 p.m. MST  http://t.co/3lvl43riqx
302473472829976577,2013-02-15 17:44:30,CongMikeSimpson,2,0,Twitter Web Client,"Crapo, Alan Simpson, Mike Simpson, Virginia senator to speak at Boise budget symposium    http://t.co/XDQOfMeA"
299977701127757826,2013-02-08 20:27:11,CongMikeSimpson,0,0,Twitter Web Client,"Send a Veteran a Valentine! Simply address cards and letters to “Dear Veteran” and mail to 500 West Fort Street, Boise, Idaho, 83702."
299225064958734336,2013-02-06 18:36:29,CongMikeSimpson,0,0,Twitter Web Client,Way to go Boise Cascade’s CEO Thomas Carlile who rang the Opening Bell today at the NYSE. http://t.co/jGR8SbBe
279733660519919616,2012-12-14 23:44:36,CongMikeSimpson,1,0,Twitter Web Client,My prayers are with all of those who were touched by the tragedy in Connecticut.
278917776138203136,2012-12-12 17:42:34,CongMikeSimpson,2,0,Twitter Web Client,Recent post in the Hill: http://t.co/cEiwPfHW
273921984931454976,2012-11-28 22:51:06,CongMikeSimpson,5,2,Twitter Web Client,Congressional Go Big Coalition met with Senator Alan Simpson and Erskine Bowles to encourage Congress to fix the debt. http://t.co/Bd4HnKbI
273560608673243137,2012-11-27 22:55:06,CongMikeSimpson,1,0,Twitter Web Client,More good news about Chobani. http://t.co/jmfbvmIZ
230793008151400448,2012-08-01 22:31:55,CongMikeSimpson,1,0,Twitter Web Client,Simpson Says No to Higher Taxes http://t.co/jHhErqRP
218766765134577664,2012-06-29 18:03:55,CongMikeSimpson,0,0,Twitter Web Client,"To the people of Southeast Idaho tragically impacted by wildfire, I'm ready to help in any way. You're in my thoughts and prayers."
218463649780609024,2012-06-28 21:59:27,CongMikeSimpson,2,0,Twitter Web Client,RT @KevinRichert: Mike Simpson on Eric Holder contempt vote: Oversight role of Congress must not be 'ignored and thwarted.' My blog: htt ...
218459462510456833,2012-06-28 21:42:49,CongMikeSimpson,4,0,Twitter Web Client,Simpson's Statement on Attorney General Eric Holder in Criminal Contempt: http://t.co/mRzw9HYi
218359006132047873,2012-06-28 15:03:38,CongMikeSimpson,0,0,Twitter Web Client,Simpson Says ACA Fight Isn’t Over http://t.co/PsKLW7IT
215857010992885762,2012-06-21 17:21:36,CongMikeSimpson,0,0,Twitter Web Client,House Passes Bill to Reduce Gas Prices http://t.co/K4u4QAaK
215503171852828672,2012-06-20 17:55:34,CongMikeSimpson,0,0,Twitter Web Client,Interior Appropriations Bill Passes Subcommittee @http://1.usa.gov/LBLiYf
215201070937419776,2012-06-19 21:55:08,CongMikeSimpson,0,0,Twitter Web Client,My amendment allowing for fresh potatoes in WIC program is successful http://t.co/5rJMF2Jm
213358600238804992,2012-06-14 19:53:48,CongMikeSimpson,1,0,Twitter Web Client,Happy 237th birthday @USarmy. Thank you for many years of sacrifice on behalf of this great country.
195967016094535682,2012-04-27 20:05:52,CongMikeSimpson,1,0,Twitter Web Client,Sponsored bill passed by the House; would authorize and permit existing water diversions in ID wilderness areas.#HR2050 http://t.co/ajUSM8pi
185475825989197825,2012-03-29 21:17:37,CongMikeSimpson,0,0,Twitter Web Client,Want to make sure today’s youth have the same opportunities I had by being able to work on the family farm. #HR4157 http://t.co/7GSuZp0x
185114898848690176,2012-03-28 21:23:25,CongMikeSimpson,0,0,Twitter Web Client,"Check out my op-ed on budgets, debt, and health care http://t.co/E2RXBV6O"
178215035628294144,2012-03-09 20:25:50,CongMikeSimpson,1,0,Twitter Web Client,"RT @HouseAppropsGOP: Members are back in their districts next week, but FY13 budget hearings pick up March 19. Upcoming schedule: http:/ ..."
177830256592437248,2012-03-08 18:56:51,CongMikeSimpson,1,0,Twitter Web Client,Grilled BLM about proposed cuts to grazing programs in FY13 budget. Concerned Obama isn't taking the issue seriously. http://t.co/qMuyXRS5
177137020018233344,2012-03-06 21:02:12,CongMikeSimpson,1,0,Twitter Web Client,Beautiful painting honoring women donated by the Shoshone-Bannock tribes displayed in the Interior hearing room. http://t.co/RvAL3ley
177045600125198338,2012-03-06 14:58:55,CongMikeSimpson,1,0,Twitter Web Client,RT @HouseAppropsGOP: The Interior and #Environment Sub and Chair @CongMikeSimpson are now going over @BLMNational's FY13 #budget with @B ...
175331833981059072,2012-03-01 21:29:02,CongMikeSimpson,0,0,Twitter Web Client,Questioned Fish and Wildlife Director about wolves and invasive species during budget hearing. http://t.co/YJdexgnw http://t.co/vlJAdo8P
170279098684424193,2012-02-16 22:51:16,CongMikeSimpson,0,0,Twitter Web Client,Today I questioned Secretary Salazar on the Department of Interior budget proposal. http://t.co/v8735wFo http://t.co/N2Yv1ZPA
167735626626637825,2012-02-09 22:24:24,CongMikeSimpson,0,0,Twitter Web Client,Here's my joint statement on the first new nuclear power plant permit approved in 30 years. http://t.co/cDbJsnvv
167302437819006976,2012-02-08 17:43:05,CongMikeSimpson,0,0,Twitter Web Client,It's always a privilege for me to meet with @specialolympics athletes. http://t.co/9wG00QB5
166550956203446272,2012-02-06 15:56:56,CongMikeSimpson,0,0,Twitter Web Client,Field reps from my office will be at Jerome City Hall today from 9 – 11 am to answer questions about specific problems with fed agencies.
165534203075760128,2012-02-03 20:36:44,CongMikeSimpson,0,0,Twitter Web Client,Kathy and I are saddened to learn of the tragic death of Steve Appleton.He was to Idaho what Steve Jobs was to America. http://t.co/fc1mbfDJ
165457049277313025,2012-02-03 15:30:09,CongMikeSimpson,1,1,Twitter Web Client,Video of me questioning Fed Chairman Bernanke on what the size and scope of a debt reduction package should look like. http://t.co/i2ngVhHJ
160458241099313152,2012-01-20 20:26:40,CongMikeSimpson,0,0,Twitter Web Client,Once again I appreciate all the feedback on #SOPA. Here are my thoughts. http://t.co/wSJgRrsl
159772586107076608,2012-01-18 23:02:07,CongMikeSimpson,1,0,Twitter Web Client,I appreciate all the thoughts from Idahoans on #SOPA and #PIPA
157168831624785920,2012-01-11 18:35:44,CongMikeSimpson,1,0,Twitter Web Client,RT @KevinRichert: Simpson: Obama recess appointments 'fly in the face of the Constitution.' Details on my blog: http://t.co/Lg47DAQA
143789394321604608,2011-12-05 20:30:37,CongMikeSimpson,2,0,Twitter Web Client,"RT @IDS_Politics: In case you missed it: Popkey column on the historic, gutsy role being played by Idaho's Crapo and Simpson on deficits ..."
142711820317241344,2011-12-02 21:08:44,CongMikeSimpson,1,0,Twitter Web Client,Proud of INL for their role in the development of the car-sized #Marsrover named #Curiosity http://t.co/WaRFc2Gv
137650142332465153,2011-11-18 21:55:26,CongMikeSimpson,1,0,Twitter Web Client,#GoBig http://t.co/ws4dnGCU
137250527410012160,2011-11-17 19:27:30,CongMikeSimpson,0,0,Twitter Web Client,Good @KPVI story by @toddblackinton on social media http://t.co/ESvPeA48
136928874054418434,2011-11-16 22:09:22,CongMikeSimpson,5,0,Twitter Web Client,The American people no longer have the stomach for partisan finger pointing http://t.co/Ks5XBjly #GoBig #Compromise
136874062424182784,2011-11-16 18:31:34,CongMikeSimpson,0,0,Twitter Web Client,Thanks to all those who participated in last night’s #teletownhall. I always enjoy hearing from my constituents. #idaho
136550500266016768,2011-11-15 21:05:50,CongMikeSimpson,2,0,Twitter Web Client,In case you missed my interview with @foxnews this morning. http://t.co/i2ngVhHJ #compromise
136478384170602496,2011-11-15 16:19:17,CongMikeSimpson,0,0,Twitter Web Client,Talking about bipartisan House letter to Super Committee on @foxnews in a few min.
136200110341238785,2011-11-14 21:53:31,CongMikeSimpson,0,0,Twitter Web Client,Don’t forget to sign up for my #teletownhall tomorrow night at 7 p.m. MST. http://t.co/5qDhaXqP
134992654734860288,2011-11-11 13:55:31,CongMikeSimpson,1,0,Twitter Web Client,The American people are indebted to the men and women who have courageously served our country http://t.co/IXZEhcic #Thankyou
134730188335497217,2011-11-10 20:32:34,CongMikeSimpson,0,0,Twitter Web Client,I’ll be hosting a #teletownhall on Tues. Nov. 15 at 7 pm MST. Sign up now to participate http://t.co/5qDhaXqP
133626621121937408,2011-11-07 19:27:23,CongMikeSimpson,2,0,Facebook,Don't miss my op-ed with Rep. Heath Shuler (D-NC) in today's Idaho Statesman http://t.co/zx7KyY72 http://t.co/pVUmp1Xm
133624178833227776,2011-11-07 19:17:41,CongMikeSimpson,2,0,Twitter Web Client,Don't miss my op-ed with #HeathShuler in today's @IdahoStatesman http://t.co/zx7KyY72 #GOBIG
133251533658800129,2011-11-06 18:36:55,CongMikeSimpson,2,0,Twitter Web Client,"RT @FoxNewsSunday: @CongMikeSimpson says $1.2 trillion in cuts ""kicking can down road"""
