id,created_at,user,retweets,favorite_count,source,text
844690540276858880,2017-03-22 23:21:33,CongMikeSimpson,8,28,Twitter Web Client,Thanks to @IdahoFFA State Secretary Jenny B. for visiting my D.C. office. Great discussion about important Ag indus… https://t.co/TLsoBczhxT
841701551756447747,2017-03-14 17:24:22,CongMikeSimpson,6,14,Twitter Web Client,Thanks to @SecretaryZinke and @Interior for highlighting Idaho’s Jim McClure-Jerry Peak Wilderness as a hidden gem! https://t.co/IK3MHco00u
837703166703648773,2017-03-03 16:36:13,CongMikeSimpson,4,11,Twitter Web Client,"Congratulations to Secretary of Energy, Rick Perry on his confirmation. https://t.co/YVPRhk4jTQ

CC: @ENERGY"
836978439223660544,2017-03-01 16:36:24,CongMikeSimpson,0,3,Twitter Web Client,"Nice pick @POTUS! 

CC: @realdonaldtrump"
836978240212381697,2017-03-01 16:35:37,CongMikeSimpson,4,13,Twitter Web Client,"Congratulations to @RyanZinke on your confirmation. Excited
to have you up to the Interior @HouseAppropsGOP Subcommittee soon, Mr. Secretary"
834864585106665473,2017-02-23 20:36:42,CongMikeSimpson,0,1,Twitter Web Client,Idaho’s Congressional Delegation announces dates for students to learn about the nation’s military academies. https://t.co/EVKbYiMHdf
834092582229667840,2017-02-21 17:29:02,CongMikeSimpson,3,12,Twitter Web Client,"ICYMI: Congressman Simpson cosponsors legislation that protects patients with pre-existing conditions. 
https://t.co/koA5wMJpJn"
831523862319857665,2017-02-14 15:21:52,CongMikeSimpson,4,6,Twitter Web Client,"Enjoyed touring @ENERGY sites last week, including Salt Waste Processing Facility in Aiken, SC as part of my work o… https://t.co/o4hKTkQ8SB"
826446041075560448,2017-01-31 15:04:25,CongMikeSimpson,7,12,Twitter Web Client,"Looking forward to working with @POTUS nominee
@GovernorPerry on important energy research issues like #nuclearpower @INL"
826440939510050817,2017-01-31 14:44:09,CongMikeSimpson,6,12,Twitter Web Client,"I’m thrilled w/ @POTUS nomination of @RepRyanZinke for
Interior Secretary. Congratulations on being approved by @EnergyGOP"
822134239122649089,2017-01-19 17:30:51,CongMikeSimpson,1,8,Twitter Web Client,"We’re marching through South Dakota’s Badlands National Park, home to rich sedimentary rock and millions of fossils. #hikewithMike"
806590754168721408,2016-12-07 20:06:36,CongMikeSimpson,5,10,Twitter Web Client,"With solemn gratitude, we remember all those who bravely defended our nation at Naval Station Pearl Harbor.… https://t.co/JN7E1ADhAH"
804387008462389248,2016-12-01 18:09:42,CongMikeSimpson,1,5,Twitter Web Client,"South Dakota is on the horizon. At 1,320 miles, the #hikewithMike STEP Challenge is rolling through the “land of infinite variety.”"
798278043261423617,2016-11-14 21:34:51,CongMikeSimpson,3,11,Twitter Web Client,"As a member of the Congressional Diabetes Caucus, Rep. Simpson has been an advocate for the Special Diabetes Program. #WorldDiabetesDay"
796800895816187904,2016-11-10 19:45:12,CongMikeSimpson,2,7,Twitter Web Client,Happy 241st Birthday to the @USMC. Thank you to all who have and continue to serve this great nation. #SemperFi
796465016279011329,2016-11-09 21:30:32,CongMikeSimpson,0,1,Twitter Web Client,"The #hikewithMike STEP Challenge is in Minneapolis! This budding metropolis of 400,000 residents ranks as America’s second most fit city."
791726276222607364,2016-10-27 19:40:28,CongMikeSimpson,1,0,Twitter Web Client,RT @HealthInFocus: HLC President Mary R. Grealy is in Boise honoring @CongMikeSimpson's Idaho STEP Challenge with the #Wellness Frontiers A…
791722941604036608,2016-10-27 19:27:13,CongMikeSimpson,2,4,Twitter Web Client,Rep Simpson receives Wellness Frontiers Award from the Health Leadership Council for creating and promoting ID STEP… https://t.co/3U17VQlQZi
791300594594156545,2016-10-26 15:28:58,CongMikeSimpson,2,3,Twitter Web Client,The #hikewithMIke STEP Challenge is one-third of the way between D.C. &amp; Boise. Check out the new mile tracker board. https://t.co/i0PVjIhP7y
789518276300836864,2016-10-21 17:26:40,CongMikeSimpson,2,6,Twitter Web Client,Idaho National Lab employees and congressional staff jogged 4.5 miles through the rain for the #hikewithMike challe… https://t.co/FZiJk6LrIE
784405794997534720,2016-10-07 14:51:29,CongMikeSimpson,4,0,Twitter Web Client,RT @ButchOtter: .@CongMikeSimpson and I joined #WalkToSchool Day with students from Longfellow Elementary School in Boise. Great event! #id…
784405659718656001,2016-10-07 14:50:57,CongMikeSimpson,1,7,Twitter Web Client,VIDEO: Simpson joins @ButchOtter at Longfellow Elementary for International #WalkToSchool day. #HikewithMike https://t.co/1yClVq6hdc
784064219104837632,2016-10-06 16:14:11,CongMikeSimpson,5,12,Twitter Web Client,"A great honor to speak at the Idaho Cancer &amp; Research
Policy Breakfast this morning about importance of Congress in… https://t.co/KM5BXVwXQU"
783780594320715776,2016-10-05 21:27:10,CongMikeSimpson,6,5,Twitter Web Client,#WalktoSchoolDay #LongfellowElementary #hikewithMike https://t.co/GaHwyHj5y7
783336623480172548,2016-10-04 16:02:59,CongMikeSimpson,0,2,Twitter Web Client,@ButchOtter and I will walk with students from Boise’s Longfellow Elementary tomorrow morning #hikewithMike #WalktoSchoolDay
780896239093186560,2016-09-27 22:25:46,CongMikeSimpson,4,3,Twitter Web Client,A new #hikewithMike mile tracker board has been published on my website. https://t.co/i0PVjIhP7y
779714653656010753,2016-09-24 16:10:34,CongMikeSimpson,6,6,Twitter Web Client,Today is National Public Lands Day! Here's a great opportunity to volunteer to keep our public lands pristine. #hikewithMike. #NPLD #FallFun
779353688255102976,2016-09-23 16:16:13,CongMikeSimpson,1,1,Twitter Web Client,"Check out some of the cool facts about Madison, WI, as the #hikewithMike STEP Challenge rolls through the Midwest. https://t.co/rg6299e4MX"
778325209829040128,2016-09-20 20:09:25,CongMikeSimpson,1,3,Twitter Web Client,"If you’re a U.S. veteran serviced by the Boise VA Medical Center, no-cost flu vaccinations are now available. https://t.co/ReDZuaoJnW"
777557729934086144,2016-09-18 17:19:43,CongMikeSimpson,4,3,Twitter Web Client,#HappyBirthday @usairforce! For 69 years you’ve protected us from above. Proud to represent Mountain Home AFB and Gowen Field Air Guard!
776857396991909888,2016-09-16 18:56:51,CongMikeSimpson,0,2,Twitter Web Client,"The #hikewithMike STEP challenge is in Janesville, Wis., hometown of @SpeakerRyan. Do you think the Speaker can keep pace with us?"
775765328915726336,2016-09-13 18:37:22,CongMikeSimpson,3,9,Twitter Web Client,We've all been affected by cancer in one way or another. Happy to support @AmericanCancer's efforts to find a cure. https://t.co/5MTSGaaHTg
774982845878063104,2016-09-11 14:48:03,CongMikeSimpson,1,4,Twitter Web Client,"#NeverForget, #Honor911
 
https://t.co/gYRoGPjNLs"
771387992481103872,2016-09-01 16:43:23,CongMikeSimpson,1,2,Twitter Web Client,Sign up your 4th grader for a free one-year pass to our National Parks! #everykidinapark #hikewithMike https://t.co/mTG6y9fJ7W
768877457420193792,2016-08-25 18:27:25,CongMikeSimpson,4,14,Twitter Web Client,Celebrating 100 years of the National Park Service with free admission to all national parks this weekend! #FindYourPark #HikewithMike
763467221192572928,2016-08-10 20:09:04,CongMikeSimpson,1,1,Twitter Web Client,Thanks to @PostRegister and @CasperforMayor for allowing me to speak about nuclear funding at the 3rd annual Intermountain Energy Summit.
761655119347933184,2016-08-05 20:08:25,CongMikeSimpson,2,2,Twitter Web Client,"Sending my congratulations and best wishes to all the Team USA athletes competing in Rio! #rio2016, #goforgold, #teamIdaho, #hikewithMike"
761282981721931776,2016-08-04 19:29:41,CongMikeSimpson,4,4,Twitter Web Client,"On this day in 1790, the U.S. established the Coast Guard to protect and defend our nation’s maritime interests. Happy 226th birthday #USCG"
760263774024577024,2016-08-01 23:59:43,CongMikeSimpson,2,2,Twitter Web Client,"At the two month mark, the #hikewithMike Step Challenge is one-sixth of the way to the finish line! Keep moving. #Boiseorbust."
758763712056528896,2016-07-28 20:39:00,CongMikeSimpson,0,2,Twitter Web Client,"On the shores of Lake Erie, the #hikewithMike STEP Challenge is taking in the views of the 13th largest lake in the world."
755888386121068544,2016-07-20 22:13:29,CongMikeSimpson,0,1,Twitter Web Client,The Idaho STEP Challenge has arrived in Ohio. Check out your progress on the new Mile Tracker Board. #hikewithMike https://t.co/i0PVjIhP7y
753295942489604096,2016-07-13 18:32:02,CongMikeSimpson,2,4,Twitter Web Client,"Mark your calendars! Rep. Mike Simpson will be speaking at the @ECA’s National Cleanup Workshop, Sept. 14-15 in VA. #CleanupWorkshop16"
749975904953126912,2016-07-04 14:39:24,CongMikeSimpson,1,1,Twitter Web Client,Celebrating independence with thankful hearts https://t.co/dunagGTsXw
748175194829750272,2016-06-29 15:24:01,CongMikeSimpson,1,1,Twitter Web Client,Check out the latest Mile Tracker Board and Congressman Simpson’s progress. #HikewithMike https://t.co/Ewra4F04bp
745674562319294464,2016-06-22 17:47:24,CongMikeSimpson,0,0,Twitter Web Client,Thanks @NATCA &amp; Mark Harris for this write up in the Statesman on the importance of HR 5292 to Idaho. https://t.co/rjkBwvdIZL
743882881668366336,2016-06-17 19:07:54,CongMikeSimpson,2,2,Twitter Web Client,"It isn’t too late to sign up for the Idaho STEP Challenge, so feel free to log
your miles any time #HikewithMike https://t.co/h29K5IuZI9"
743882748079783936,2016-06-17 19:07:22,CongMikeSimpson,0,2,Twitter Web Client,Check out first Team Mile Tracker Board to see where your team &amp; others stand along the journey #HikewithMike https://t.co/i0PVjIhP7y
743806438582132736,2016-06-17 14:04:08,CongMikeSimpson,0,2,Twitter Web Client,Thank you @IdahoWalkBike for encouraging your members to participate in the Idaho STEP Challenge. #HikewithMike https://t.co/gqslm5Nu6a
743471001220984832,2016-06-16 15:51:14,CongMikeSimpson,1,1,Twitter Web Client,Check out the first Mile Tracker Board. Follow your progress alongside Rep. Simpson's journey to Boise #HikewithMike https://t.co/wgGzagviph
742450776790990848,2016-06-13 20:17:13,CongMikeSimpson,1,2,Twitter Web Client,"Reminder: Enter your total miles walked since 6/1 by the end
of the day. Tomorrow we will post the first Mile Tracker Board. #HikewithMike"
741294612216709121,2016-06-10 15:43:02,CongMikeSimpson,3,0,Twitter Web Client,RT @AARPIdaho: Thank you @MikeSimpson4ID for joining the ACT Caucus and supporting family caregivers! #iheartcaregivers #ACTCaucus @AARPadv…
740242849485164545,2016-06-07 18:03:43,CongMikeSimpson,2,3,Twitter Web Client,STEP Challenge Update-1st Mile Tracker Board will be posted June 14. Enter miles no later than June 13 https://t.co/UQmWtAXoVb #hikewithMike
738753227449999360,2016-06-03 15:24:29,CongMikeSimpson,6,4,Twitter Web Client,Tomorrow is National Trails Day! Visit the American Hiking Society’s website and get your steps in on the mountains. #hikewithMike.
738105664359268352,2016-06-01 20:31:18,CongMikeSimpson,2,5,Twitter Web Client,"Welcome to the Idaho STEP Challenge! Today is June 1
which means it is the first day to start tracking your miles. https://t.co/h29K5IuZI9"
737645913208938496,2016-05-31 14:04:25,CongMikeSimpson,4,3,Twitter Web Client,Check out this Op-Ed by Congressman Simpson on why it is important to challenge yourself to exercise more. https://t.co/NltA8s1J2Z
737338514027782144,2016-05-30 17:42:55,CongMikeSimpson,2,4,Twitter Web Client,2 - we honor and remember our fallen heroes this Memorial Day.
737338461439594496,2016-05-30 17:42:42,CongMikeSimpson,2,4,Twitter Web Client,1 - With great appreciation and reverence for the brave men and women who have made the ultimate sacrifice to protect our freedom...
734875890132340737,2016-05-23 22:37:20,CongMikeSimpson,5,3,Twitter Web Client,"Simpson launches STEP Challenge - Congressman will virtually walk from D.C. to
Boise to promote health and fitness https://t.co/CWPQrwdbQf"
732230848498544640,2016-05-16 15:26:53,CongMikeSimpson,1,2,Twitter Web Client,Simpson supports banking regulatory reform to provide small community banks &amp; credit unions with regulatory relief https://t.co/fDxB0OfoQ7
723506382100697088,2016-04-22 13:38:58,CongMikeSimpson,3,2,Twitter Web Client,"Simpson Protects @INL in Energy Bill - House Energy &amp; Water
Chairman reverses cuts to Nuclear Energy &amp; development https://t.co/NSvEY8CrwQ"
723228562774495232,2016-04-21 19:15:00,CongMikeSimpson,3,3,Twitter Web Client,"Rep.Simpson receives the 2016 Port Persons of the
Year award from the American Association of Port Authorities. https://t.co/vyPwyLmaq7"
722530449063571456,2016-04-19 21:00:57,CongMikeSimpson,5,0,Twitter Web Client,RT @HouseAppropsGOP: The Committee is now considering the FY17 Energy &amp; Water bill. @CongMikeSimpson is now presenting the bill. https://t.…
720343793111707649,2016-04-13 20:11:58,CongMikeSimpson,2,0,Twitter Web Client,RT @HouseAppropsGOP: .@CongMikeSimpson: Bill provides strong support for @ENERGY national defense programs.
706549383345537025,2016-03-06 18:37:54,CongMikeSimpson,8,12,Twitter Web Client,...Her service to our country is an example all Americans can follow and may she rest in peace with President Reagan.
706549338508435456,2016-03-06 18:37:44,CongMikeSimpson,10,14,Twitter Web Client,Kathy and I are saddened to learn of the passing of Nancy Reagan and send our thoughts and prayers to the Reagan family...
705828513174196224,2016-03-04 18:53:25,CongMikeSimpson,4,6,Twitter Web Client,"Happy Idaho Day! On this day, Abraham Lincoln signed into
law an Act which created the Territory of Idaho. https://t.co/eySThhwQXp"
704693543240130560,2016-03-01 15:43:27,CongMikeSimpson,2,0,Twitter Web Client,RT @HouseAppropsGOP: Sec @ErnestMoniz testifies before @CongMikeSimpson &amp; Energy Subcom on @ENERGY budget. Watch: https://t.co/XIF5MJhMfk h…
703250470438051840,2016-02-26 16:09:12,CongMikeSimpson,4,0,Twitter Web Client,RT @HouseAppropsGOP: .@CongMikeSimpson @RepHalRogers @USRepRodney @KenCalvert prepare to question @USACEHQ witnesses at this am's hearing h…
699763974703681536,2016-02-17 01:15:07,CongMikeSimpson,4,0,Twitter Web Client,RT @boisestatelive: Today @CongMikeSimpson will receive first-ever Commitment to Idaho Award at #BoiseState. Watch on #periscope at 4pm. ht…
699763449958510593,2016-02-17 01:13:02,CongMikeSimpson,4,3,Twitter Web Client,...for his work on legislation that provides an Idaho solution to protecting the Boulder White Clouds. https://t.co/821RPbIWT2
699763315124236288,2016-02-17 01:12:29,CongMikeSimpson,3,4,Twitter Web Client,Rep. Simpson receives first ever Commitment to Idaho award from @boisestatelive School of Public Service https://t.co/Rf8WusfCeg
699289223141044224,2016-02-15 17:48:37,CongMikeSimpson,2,3,Twitter Web Client,Congressman Mike Simpson speaks at the Academy Nomination reception at Gowen Field. https://t.co/pLCQKhxA5i https://t.co/zkTOUmf4Xi
697463451606781953,2016-02-10 16:53:39,CongMikeSimpson,2,0,Twitter Web Client,RT @HouseAppropsGOP: .@CongMikeSimpson kicks off FY17 #budget hearings this morning. Watch live on https://t.co/Q1o6xOmOnk as @NRCgov testi…
687691253887184897,2016-01-14 17:42:26,CongMikeSimpson,2,3,Twitter Web Client,Simpson Supports Congressional Review of EPA Water Grab https://t.co/Z1n7geFFBe
685161979682631681,2016-01-07 18:12:00,CongMikeSimpson,2,2,Twitter Web Client,Congress Sends First Ever Obamacare Repeal Bill to President’s Desk https://t.co/nSMo9zSFdC
684475563931791360,2016-01-05 20:44:26,CongMikeSimpson,5,4,Twitter Web Client,Simpson Statement on Executive Gun Order https://t.co/EglfWRez7M
677881790271393792,2015-12-18 16:03:07,CongMikeSimpson,5,6,Twitter Web Client,House Overwhelmingly Passes FY2016 Omnibus Appropriations – Big Wins for Idaho https://t.co/kPvwwvG6dD
672529901719785473,2015-12-03 21:36:38,CongMikeSimpson,4,1,Twitter Web Client,"Simpson Supports Long-Term Overhaul of Education, Transportation Programs
https://t.co/qDehHrJTgu"
672170345714081792,2015-12-02 21:47:53,CongMikeSimpson,3,2,Twitter Web Client,Simpson Votes to Block EPA Cap and Trade Rules https://t.co/9ajr8IitkM
667413967170633728,2015-11-19 18:47:44,CongMikeSimpson,2,4,Twitter Web Client,Simpson opposes Obama's cap &amp; trade rules-cosponsors res. disapproving EPA’s rules for new &amp; existing power plants https://t.co/3HUKE783EE
666624294210809856,2015-11-17 14:29:51,CongMikeSimpson,2,0,Twitter Web Client,RT @IdahoStateU: ISU receives three prominent national accolades by @Mil_Friendly for outstanding veteran services. https://t.co/xnS2C3tm2s
664569699334807552,2015-11-11 22:25:38,CongMikeSimpson,2,2,Twitter Web Client,"Please pause today to thank, remember, &amp; honor our veterans &amp; the sacrifices they have made to keep our country safe https://t.co/ylNv9ouODX"
662746539153096704,2015-11-06 21:41:02,CongMikeSimpson,7,4,Twitter Web Client,Excited about @ENERGY initiative Gateway for Accelerated Nuclear Innovation - will facilitate use of lab capabilities like @INL #GAINnuclear
662721764414238721,2015-11-06 20:02:36,CongMikeSimpson,9,5,Twitter Web Client,Tune in now to watch @INL Director participate in WH event pushing accelerated innovation in nuclear energy (GAIN) https://t.co/nWtrN0VC9k
659472983048781824,2015-10-28 20:53:06,CongMikeSimpson,0,0,Twitter Web Client,Simpson Works to Prevent Implementation of EPA Water Rule https://t.co/L1bbf8mcqY
657280869237968896,2015-10-22 19:42:25,CongMikeSimpson,0,0,Twitter Web Client,"Simpson Pushes Better Fed Land Management - cosponsors bill to improve sage-grouse habitat, reduce wildfire threat https://t.co/d6Q9ZJd6yB"
646771019378765824,2015-09-23 19:40:02,CongMikeSimpson,2,3,Twitter Web Client,Wildfires are National Disasters http://t.co/1IYI2RKjYw
644860342435225600,2015-09-18 13:07:41,CongMikeSimpson,0,1,Twitter Web Client,Happy 68th birthday to the @usairforce! Idaho is very proud of Mountain Home and Gowen Field.
644245552280965120,2015-09-16 20:24:43,CongMikeSimpson,2,0,Twitter Web Client,Flu shots are free for veterans enrolled for care at the VA-Follow link for more details on where to get yours in ID https://t.co/ldIgz6BQrS
642337747211034624,2015-09-11 14:03:47,CongMikeSimpson,1,1,Twitter Web Client,"Today we pause to remember and honor the victims of September 11, 2001 https://t.co/oznvPbfBEo"
634097015698378752,2015-08-19 20:18:04,CongMikeSimpson,0,1,Twitter Web Client,which would treat wildfires like other natural disasters. http://t.co/XOrXqOMJjm
634096913810370560,2015-08-19 20:17:39,CongMikeSimpson,3,4,Twitter Web Client,"Soda Fire nears containment, but wildfires continue to burn throughout Idaho, underscoring the need for the Wildfire Disaster Funding Act..."
629651510687834112,2015-08-07 13:53:13,CongMikeSimpson,2,2,Twitter Web Client,Congressman Simpson thanking a local BLM Fire crew. http://t.co/3rB9G8sAqu
621047430084198400,2015-07-14 20:03:40,CongMikeSimpson,2,3,Twitter Web Client,Congrats to @INL technology on board the @NewHorizons2015 mission to Pluto. https://t.co/RPGHeHf08v
619210972847316992,2015-07-09 18:26:14,CongMikeSimpson,3,5,Twitter Web Client,Simpson’s Boulder White Clouds Bill Surges Ahead http://t.co/HBlVhzRbea
613754855170154496,2015-06-24 17:05:35,CongMikeSimpson,2,9,Twitter Web Client,"Happy 45th Anniversary to my amazing wife, Kathy!"
610075557284458496,2015-06-14 13:25:22,CongMikeSimpson,9,23,Twitter Web Client,Happy 240th birthday to the @USArmy. Thank you to all those who served and are currently serving in the U.S. Army.
609361863902658560,2015-06-12 14:09:24,CongMikeSimpson,2,2,Twitter Web Client,Simpson supports House passed Defense @HouseAppropsGOP FY16 bill which funds A-10s and supports our troops. http://t.co/zYiOuyTOOc
608667258991333377,2015-06-10 16:09:17,CongMikeSimpson,2,1,Twitter Web Client,Simpson’s ID truck weight language advances-Provides common sense reform allowing ID on equal footing w/ neighbors http://t.co/REduyIsLEM
602818064372080640,2015-05-25 12:46:41,CongMikeSimpson,5,5,Twitter Web Client,Please join Kathy and I today in sending our thoughts and prayers to those we have lost and their families.
601444653225746432,2015-05-21 17:49:14,CongMikeSimpson,2,5,Twitter Web Client,"Congressman Simpson met with veteran caregiver advocate and Elizabeth Dole Fellow, Jeanette McKinney of Idaho Falls. http://t.co/rol3BWBQL5"
600390729437937665,2015-05-18 20:01:19,CongMikeSimpson,2,1,Twitter Web Client,House Passes Legislation Delaying Sage-Grouse Listing http://t.co/6KKfsB50F4
598504028797009920,2015-05-13 15:04:14,CongMikeSimpson,3,4,Twitter Web Client,Congressman Simpson’s view from the @HouseAppropsGOP markup of the Transportation Housing and Urban Development bill. http://t.co/LCJKzmD1eC
598479233426595841,2015-05-13 13:25:43,CongMikeSimpson,3,2,Twitter Web Client,Simpson Supports Legislation to Limit EPA’s Reach on Water http://t.co/WuLGXDTjGy
596019295878041601,2015-05-06 18:30:48,CongMikeSimpson,4,3,Twitter Web Client,Make sure to check out @IdahoGives tomorrow to find the causes you are interested in giving back to. http://t.co/xUMFuPOjM0
594228729699762176,2015-05-01 19:55:44,CongMikeSimpson,5,4,Twitter Web Client,"House passes Simpson’s Energy and Water bill that reverses Obama Administration’s nuclear cuts, increases INL funding http://t.co/qIjwANg61C"
594155308886433793,2015-05-01 15:03:59,CongMikeSimpson,16,0,Twitter Web Client,RT @SpeakerBoehner: This House-passed energy &amp; water bill puts jobs &amp; economic growth first http://t.co/sgXqpoZJDU
594153314939478018,2015-05-01 14:56:03,CongMikeSimpson,7,0,Twitter Web Client,RT @HouseAppropsGOP: House Passes Fiscal Year 2016 Energy and Water Appropriations Bill http://t.co/klC5wEH8MP
594152275062423552,2015-05-01 14:51:55,CongMikeSimpson,3,3,Twitter Web Client,Simpson protects states’ water rights-Defeats amendment that would allow expansion of fed jurisdiction over water https://t.co/L3n7w7Jziv
593470542772056066,2015-04-29 17:42:58,CongMikeSimpson,4,2,Twitter Web Client,Simpson secures ID truck weight language-creates a level playing field with neighbor states to boost to ID's economy http://t.co/U40PuHLpj1
593081217127456768,2015-04-28 15:55:55,CongMikeSimpson,5,4,Twitter Web Client,Good luck to all the Idaho teams competing in this year’s @DOE_SC_NSB that is being contested April 30-May 4. http://t.co/3at7bRQ4ay
590938471226863617,2015-04-22 18:01:25,CongMikeSimpson,4,0,Twitter Web Client,RT @HouseAppropsGOP: .@CongMikeSimpson: FY16 Energy &amp; Water bill is strong bill that will advance national security interests &amp; economy htt…
588790126169436160,2015-04-16 19:44:39,CongMikeSimpson,2,1,Twitter Web Client,Simpson Cosponsors Legislation to Protect Local Water from EPA http://t.co/TtFAs4BHei
588417431145689088,2015-04-15 19:03:42,CongMikeSimpson,2,3,Twitter Web Client,Rep Simpson meets w/ Roger Fogleman of the Snake River Valley Chapter @MilitaryOfficer and Leanne Murray also of MOAA http://t.co/No6D09nnPJ
588084926291046402,2015-04-14 21:02:27,CongMikeSimpson,2,1,Twitter Web Client,Congressman Simpson speaks to the American Association for Dental Research and American Dental Education Association. http://t.co/eIyyGaQh5j
588014522675388416,2015-04-14 16:22:41,CongMikeSimpson,2,0,Twitter Web Client,"RT @ADEAAGR: We'd like to thank @CongMikeSimpson, DMD for speaking to our #DentalAdvocacy group! http://t.co/BpgdpMFLRf"
583289339288924160,2015-04-01 15:26:30,CongMikeSimpson,3,0,Twitter Web Client,Simpson Introduces Bipartisan Bill to Expand Geothermal Energy Production http://t.co/QBKDbBf4GZ
581217420976746496,2015-03-26 22:13:26,CongMikeSimpson,5,1,Twitter Web Client,Simpson Supports Bipartisan Medicare Reform and Secure Rural Schools Package http://t.co/ZK7xuyzF2r
578233438437773312,2015-03-18 16:36:09,CongMikeSimpson,4,1,Twitter Web Client,Maintaining a Vibrant INL http://t.co/Y3z5gt7dbj
577957386654216192,2015-03-17 22:19:13,CongMikeSimpson,2,2,Twitter Web Client,Congressman Simpson thanks VA Salt Lake City Health Care System for their efforts providing care for veterans in ID http://t.co/J17KnxaGWV
577511821403373568,2015-03-16 16:48:42,CongMikeSimpson,3,0,Twitter Web Client,"ICYMI: Enough nonsense, it's time for Republicans to govern. http://t.co/fY1XgvtEQQ"
576758615740059648,2015-03-14 14:55:44,CongMikeSimpson,11,2,Twitter Web Client,"Enough nonsense, it's time for Republicans to govern. http://t.co/eoWgaHBuj7"
576011077655347201,2015-03-12 13:25:17,CongMikeSimpson,3,1,Twitter Web Client,Idaho Delegation is hosting a series of Academy Days to inform students about opportunities at US Service Academies http://t.co/VCAlTFlCoo
570995337126674432,2015-02-26 17:14:31,CongMikeSimpson,4,0,Twitter Web Client,RT @HouseAppropsGOP: .@CongMikeSimpson to @ErnestMoniz: We cannot realistically use the President's budget request as a true measure of nee…
570995309339406336,2015-02-26 17:14:24,CongMikeSimpson,2,0,Twitter Web Client,RT @HouseAppropsGOP: .@CongMikeSimpson: @Energy budget request funds Admin priorities at expense of nuclear and fossil energy which help ou…
570356471889678337,2015-02-24 22:55:54,CongMikeSimpson,5,1,Twitter Web Client,Congressman Simpson spoke to potato growers from Idaho and across the country at the Potato D.C. Fly-In this morning. http://t.co/WwvuOmELFs
568117481467985920,2015-02-18 18:38:57,CongMikeSimpson,4,0,Twitter Web Client,"The @DeptVetAffairs will host VA town hall event tomorrow (2/19), 5 PM-7 PM at American Legion Post 7 in Twin Falls https://t.co/qYFF3Euurf"
566271756152111104,2015-02-13 16:24:42,CongMikeSimpson,6,2,Twitter Web Client,"Last time we updated #EmailPrivacy laws, moustaches were popular in the ID Leg. Let’s pass @RepKevinYoder's #ECPA http://t.co/zMIBBXVLPZ"
