id,created_at,coordinates,retweets,favorite_count,source,text
634089578425618432,2015-08-19 19:48:30,,17,21,Twitter Web Client,"In recognition of #Startup Day Across America, I stopped by Pizza Port Brewing Company. Great visit! #StartupDay http://t.co/MCIQA2V8b2"
634068953317404673,2015-08-19 18:26:33,,16,31,Twitter Web Client,#Startups are creating jobs every day in your own backyards! Join me in celebrating their innovation with #StartupDay.
634028540422418432,2015-08-19 15:45:58,,24,21,Twitter Web Client,"There’s gold in them thar hills! On this day in 1848, N.Y. Herald first reported the discovery of gold in California. http://t.co/wam8Ts5BOi"
633377609120919552,2015-08-17 20:39:24,,150,81,Twitter Web Client,Now more than 300 Clinton emails flagged for potentially classified info... http://t.co/8wyjuVpV6c #tcot
632326751595577344,2015-08-14 23:03:40,,19,57,Twitter Web Client,Tried out an Explosive Ordinance Disposal (EOD) suit while visiting with U.S. Army troops in Sinai. How does it look? http://t.co/wR7wKheoJC
632284136171024384,2015-08-14 20:14:19,,16,16,Twitter Web Client,"This week's #FridayPuppy, Rugby, the baby bulldog, doesn't quite know what to make of ice. https://t.co/1dqLZ4MTWF"
631941000391364609,2015-08-13 21:30:50,,265,140,Twitter Web Client,Today is National #lefthandersday. I count myself among the privileged few. Retweet if you're one of us! http://t.co/OdNuT2E5gf
631283138900164608,2015-08-12 01:56:43,,123,100,Twitter for Android,This should have happened months ago. http://t.co/4deB2ieEJn #tcot
631205522545451009,2015-08-11 20:48:18,,24,22,Twitter Web Client,"A moment of levity from President Ronald Reagan, which occurred 31 years ago, today. https://t.co/6k7hpScBA8 #tcot"
629329198797209600,2015-08-06 16:32:28,,182,103,Twitter Web Client,The DOJ and FBI should seize Hillary Clinton’s private e-mail server for a thorough forensic investigation. http://t.co/rHQpHM8C6M #tcot
629322744665108480,2015-08-06 16:06:49,,55,0,Twitter Web Client,RT @USEmbassyCairo: #AmbBeecroft &amp; US Congressman Darrell Issa are celebrating Egypt's latest achievement at the #NewSuezCanal مصر_بتفرح# h…
629145564597362688,2015-08-06 04:22:46,,58,0,Twitter for Android,RT @GOPLeader: DOJ continues to fight the House’s lawful subpoena &amp; protect officials responsible for deadly gun running operations. http:/…
628657067738406912,2015-08-04 20:01:39,,51,31,Twitter Web Client,"A Fast and Furious connection to the attempted terrorist attack in Garland, Texas? http://t.co/VuAjlo0qYc #tcot"
626862707266985985,2015-07-30 21:11:30,,176,133,Twitter Web Client,Tom Brady has been punished more harshly for deflating footballs than John Koskinen has for misleading Congress: https://t.co/Dv8MuPXYdW
626845438994448384,2015-07-30 20:02:53,,58,44,Twitter Web Client,The suggestion that publishing a state’s laws online is comparable to terrorism is ludicrous. http://t.co/7mHTy6Rfii
626462460887887872,2015-07-29 18:41:04,,50,0,Twitter Web Client,RT @RosLehtinen: #Obama's #IranDeal narrative alarmingly similar to past Presidents on nuclear #NorthKorea. Let's not be fooled again https…
626405958353309696,2015-07-29 14:56:33,,14,20,Twitter Web Client,Chairing an #InternetofThings hearing this morning. #tcot http://t.co/BNFkFlyvD6
626073054754553856,2015-07-28 16:53:42,,400,352,Twitter Web Client,The remains of 36 Marines were returned this week from a WWII battlefield in Japan. They are finally home. #tcot http://t.co/JBUOQlBBQf
625781424952623104,2015-07-27 21:34:52,,56,0,Twitter Web Client,RT @GOPoversight: Letter to President Obama Calling Him to Remove IRS Commissioner John Koskinen → https://t.co/YGkHRkyFqG #IRSFail
625780565963354112,2015-07-27 21:31:28,,86,0,Twitter Web Client,RT @GOPoversight: There Must Be Accountability. https://t.co/5uao3LyhWM #IRSfail
624687797027389440,2015-07-24 21:09:11,,77,45,Twitter Web Client,Reason 11: Iran foreign minister interprets deal VERY differently than the Obama Administration does. #21ReasonsIranDealIsABadDeal #tcot
624660597515362304,2015-07-24 19:21:06,,58,28,Twitter Web Client,Reason 10: Iran doesn’t have to come clean on past nuclear activity. #21ReasonsIranDealIsABadDeal #tcot
624654728648093696,2015-07-24 18:57:47,,59,36,Twitter Web Client,"Reason 9: Confirming whether Iran violated the deal could take weeks, giving Iran time to hide activities. #21ReasonsIranDealIsABadDeal"
624616996487823362,2015-07-24 16:27:51,,56,29,Twitter Web Client,Reason 8: Iranian Supreme Leader Khamenei specifically said Iran will not change its anti-American policies. #21ReasonsIranDealIsABadDeal
624614338028896257,2015-07-24 16:17:17,,89,46,Twitter Web Client,"Reason 7: The money Iran receives will also further Iran’s terrorist proxies, like Hamas and Hezbollah. #21ReasonsIranDealIsABadDeal #tcot"
624567383139688448,2015-07-24 13:10:42,,68,28,Twitter Web Client,Reason 6: The relief money Iran will receive will further the regime’s destabilizing influence in the region. #21ReasonsIranDealIsABadDeal
624337357265879040,2015-07-23 21:56:40,,121,56,Twitter Web Client,"Reason 5: The hundreds of billions Iran will receive can’t be taken back, even if Iran defies the deal. #21ReasonsIranDealIsABadDeal #tcot"
624328419707191296,2015-07-23 21:21:09,,59,37,Twitter Web Client,Reason 4: Sanctions relief isn’t tied to Iran’s compliance with the deal. #21ReasonsIranDealIsABadDeal #tcot
624320363153862656,2015-07-23 20:49:08,,81,45,Twitter Web Client,"Reason 3: As PM Netanyahu noted, deal gives Iran “100s of billions of $ to fuel terror and military regime.” #21ReasonsIranDealIsABadDeal"
624316945702084608,2015-07-23 20:35:33,,55,29,Twitter Web Client,Reason 2: The deal will accelerate regional nuclear proliferation. #21ReasonsIranDealIsABadDeal #tcot @GOPLeader
624309518734790656,2015-07-23 20:06:03,,73,36,Twitter Web Client,"Reason 1: the deal sunsets after 10-15 years, leaving open a path to a nuclear weapon down the road. #21ReasonsIranDealIsABadDeal #tcot"
624309423960256513,2015-07-23 20:05:40,,65,35,Twitter Web Client,"Appreciated the list of ""21 Reasons Iran Deal is a Bad Deal"" assembled by @GOPLeader: http://t.co/VMoDhyTAFv #21ReasonsIranDealIsABadDeal"
623922578609033216,2015-07-22 18:28:29,,13,13,Twitter Web Client,"""The 'Hanoi Hilton' is no Trump Hotel"" -- Excellent perspective from my colleague @SamsPressShop http://t.co/MdxKx2vGJO"
623613864463204352,2015-07-21 22:01:46,,128,123,Twitter Web Client,"No matter how much Pres. Obama references “international community's” opinions, I remain committed to opposing what remains a very bad deal."
623613157739728896,2015-07-21 21:58:57,,66,41,Twitter Web Client,"President seems to believe that taking his bad Iran deal to the U.N. before Congress will cause ""international peer pressure"" on Congress."
623539396067893249,2015-07-21 17:05:51,,77,103,Twitter Web Client,"Remembering a great American actor and comedian, Robin Williams, who would have been 64 today. http://t.co/VXAl7ifFvH"
623201538920595457,2015-07-20 18:43:20,,13,24,Twitter Web Client,Drill instructors from San Diego participated in an event to prepare Marine recruits for boot camp. #MilitaryMonday http://t.co/miZFpLHLuy
621414941866754049,2015-07-15 20:24:02,,11,11,Twitter Web Client,You can follow me on instagram at http://t.co/vnDUfOQdD7
621380320294739972,2015-07-15 18:06:27,,26,32,Twitter Web Client,Competing in GOP #Instagram Challenge. I've heard these kinds of things do well there. Did I miss any important ones? http://t.co/lUDeGuVye2
621315546634657792,2015-07-15 13:49:04,,23,30,Twitter Web Client,Happy 9th birthday @twitter! http://t.co/WdQGdiEQRx
621285514159783936,2015-07-15 11:49:44,,9,11,Twitter for Android,On C-SPAN's Washington Journal right now. Tune in!  @cspanwj @cspan http://t.co/rTPxqo2QMc
621017789738917889,2015-07-14 18:05:53,,59,77,Twitter Web Client,Clearest ever photo of Pluto taken this morning. Bottom-right: photo from 1930. How far we've come. #tcot #PlutoFlyby http://t.co/u3aqeHBwlm
620996306971066368,2015-07-14 16:40:31,,54,46,Twitter Web Client,"The #IranDeal will be to President Obama what ""A Peace for Our Time"" was to Neville Chamberlain. #tcot"
620996081883709440,2015-07-14 16:39:38,,112,71,Twitter Web Client,"The #IranDeal is a ‘junior varsity’ foreign policy grounded in childlike optimism, rather than clear-eyed realism. #tcot #baddeal"
620995918339416064,2015-07-14 16:38:59,,66,34,Twitter Web Client,"#IranDeal assumes, despite all evidence, that Iran wants diplomacy, which it has opposed, more than it wants nukes, which it has pursued."
620995444408250368,2015-07-14 16:37:06,,97,67,Twitter Web Client,No nation has ever abandoned its nuclear ambitions without first agreeing to actually abandon its nuclear ambitions. #IranDeal #baddeal
620678325787299840,2015-07-13 19:36:59,,48,59,Twitter Web Client,95-year-old WWII veteran Milton Merklin being welcomed to D.C. this past week during an Honor Flight event. #tcot http://t.co/O0bD3BI8ij
619599422058532864,2015-07-10 20:09:48,,25,38,Twitter Web Client,Sat down with Talking Heads frontman David Byrne to discuss copyright issues and how artists are compensated. http://t.co/4SLagFpEF3
619581353307316224,2015-07-10 18:58:00,,917,551,Twitter Web Client,"Picture of the subpoena Hillary Clinton claims she never received, including Proof of Service. #tcot http://t.co/tW8KHCOHjG"
618840910483357697,2015-07-08 17:55:45,,43,55,Twitter Web Client,"Noah Coughlan completing 3rd 3,100 mile run across America. Marines from Camp Pendleton greeted him at finish line. http://t.co/n1B5rl4ecq"
618151808834367488,2015-07-06 20:17:30,,60,91,Twitter Web Client,"Happy birthday to the wonderful Nancy Reagan, always a picture of elegance and grace. #tcot http://t.co/LkkwoenuPj"
618072609301884928,2015-07-06 15:02:47,,39,50,Twitter Web Client,"Jim Millin, a WWII veteran and former POW, receives a Quilt of Honor at a ceremony yesterday. #MilitaryMonday #tcot http://t.co/1MD4lMCJJw"
617474829617360896,2015-07-04 23:27:26,,287,0,Twitter for Android,RT @FoxNews: .@USArmy Chief of Staff Gen. Ray Odierno tells us why he’s a #ProudAmerican this #FourthofJuly. http://t.co/18qxuSKR5t
616668803716546561,2015-07-02 18:04:34,,37,53,Twitter Web Client,"#ThrowbackThursday to 2001, flying aboard the last flight of Ronald Reagan’s Air Force One. #tbt http://t.co/P8CrN7ybqE"
616662583291060224,2015-07-02 17:39:51,,31,39,Twitter Web Client,Took part in a naturalization ceremony aboard the U.S.S. Midway. 52 servicemembers were granted American citizenship. http://t.co/UDg9iiDxcP
614137207977287680,2015-06-25 18:24:55,,48,51,Twitter Web Client,#SCOTUS #KingvBurwell #SCOTUSCare #Scalia http://t.co/VDg8rmrar1
614135696606003201,2015-06-25 18:18:54,,249,163,Twitter Web Client,A portion of Justice Scalia's blistering dissent from King v Burwell. #SCOTUSCare #SCOTUS #KingvBurwell #tcot http://t.co/jgJAYKnRQB
614093515329568768,2015-06-25 15:31:18,,191,125,Twitter Web Client,"Justice Scalia: ""Words no longer have meaning."" #SCOTUSCare #SCOTUS #KingvBurwell #tcot"
614086689984745472,2015-06-25 15:04:10,,33,35,Twitter Web Client,Scalia: Normal rules of interpretation always seem to yield to the overriding principle of the present Court: Obamacare must be saved #tcot
614085255914487808,2015-06-25 14:58:28,,101,88,Twitter Web Client,Justice Scalia is right: “We should start calling this law SCOTUSCare.” #SCOTUSCare #KingvBurwell
614083759206473728,2015-06-25 14:52:31,,75,61,Twitter Web Client,Today's decision in King v Burwell is a loss for the U.S. Constitution and amounts to an egregious expansion of executive power. #tcot
613441114918526976,2015-06-23 20:18:53,,67,47,Twitter Web Client,"After 13 rounds of negotiations, when will Administration finally realize that Iran is just buying more time? http://t.co/juSXlh0a5w #tcot"
613435671236227073,2015-06-23 19:57:15,,14,14,Twitter Web Client,One step closer to Marty McFly's hoverboard? The U.S. military is working on a hoverbike: http://t.co/4EViIRMC0x
611995170079395840,2015-06-19 20:33:13,,64,32,Twitter Web Client,"The Obama Administration's big-government policies, summed up in apicture. On pace for nearly 250 regulations. #tcot http://t.co/62f4aDNNKy"
611935990140272640,2015-06-19 16:38:03,,8,9,Twitter Web Client,"After a week that saw temperatures approaching triple digits, #FridayPuppy is cooling down and ready for the weekend. http://t.co/w59rDiOTC6"
611628049763840000,2015-06-18 20:14:25,,166,183,Twitter Web Client,"Matthew 5:4 – “Blessed are those who mourn, for they shall be comforted.” #CharlestonShooting http://t.co/ZMkKFT2TPl"
611255072941559808,2015-06-17 19:32:20,,91,38,Twitter Web Client,The Obama Administration can't explain nearly $3 BILLION in #Obamacare payments: http://t.co/hUsth6PvSo #tcot
611251517421711360,2015-06-17 19:18:12,,170,90,Twitter Web Client,"The Treasury Deputy IG has confirmed what most suspect re: Lois Lerner: ""There is potential criminal activity."" #tcot http://t.co/z6T65065DZ"
610478150624116737,2015-06-15 16:05:07,,29,37,Twitter Web Client,"#OTD in 1864, Edwin M. Stanton signed an order establishing Arlington National Cemetery. #MilitaryMonday #tcot http://t.co/84APrYFJsu"
610455865162924032,2015-06-15 14:36:34,,14,0,Twitter Web Client,RT @HouseJudiciary: #OTD: Charles Goodyear received a #patent for a process to strengthen rubber. http://t.co/JBZCQsuCHh
610243595602382848,2015-06-15 00:33:05,,10,0,Twitter for Android,RT @SteveScalise: Truly appreciate the service of @RepLouieGohmert @RepGuthrie @RepJoeHeck @DarrellIssa @SteveKnight25 @BillPascrell in the…
610238750296285184,2015-06-15 00:13:50,,60,90,Twitter Web Client,"""Oh! say, does that star-spangled banner yet wave, o'er the land of the free and the home of the brave?"" #FlagDay http://t.co/I7Eq1Ts2aq"
609466181343383552,2015-06-12 21:03:55,,102,119,Twitter Web Client,"Capitan the German Shepherd, who has guarded his deceased owner's grave for nearly a decade, is today's #FridayPuppy. http://t.co/b8lMftdml7"
609414707905196032,2015-06-12 17:39:23,,77,50,Twitter Web Client,#NetNeutrality -- i.e. handing over the reins of the internet to the federal government -- is NOT the answer: https://t.co/4j8Gll0gGv #tcot
609375851491274752,2015-06-12 15:04:59,,89,29,Twitter Web Client,The FCC's #NetNeutrality rules officially go into effect today. R.I.P. internet as we knew you. You'll be missed. https://t.co/52dappBWHJ
609037605234221056,2015-06-11 16:40:55,,15,25,Twitter Web Client,Pleased my amendment passed by voice vote. It ensures patent trolls can't exploit system to unfairly ensure case is in more favorable court.
609006701925273600,2015-06-11 14:38:07,,20,23,Twitter Web Client,We must restore promise that hard work and ingenuity lead not to crippling frivolous lawsuits but to well-deserved success. #InnovationAct
609006039971848192,2015-06-11 14:35:29,,30,17,Twitter Web Client,"Patent trolls see patent system not as a tool to spur inventiveness, but as a club with which to bludgeon true innovators. #InnovationAct"
609004481737560064,2015-06-11 14:29:17,,8,0,Twitter Web Client,"RT @RepGoodlatte: Consideration of #HR9, the #InnovationAct, is underway @HouseJudiciary. Tune in: http://t.co/FaA191AXkG #patentreform"
608743844876824576,2015-06-10 21:13:37,,29,28,Twitter Web Client,The Obama Administration isn't entirely sure whether it has a strategy to fight ISIS or not: https://t.co/J6Fa5wRDVU http://t.co/FyafUHphef
608325496611479553,2015-06-09 17:31:15,,54,36,Twitter Web Client,...Sgt. Peralta died in 2004 in Fallujah after pulling a grenade under his own body to protect his comrades.
608325363282944001,2015-06-09 17:30:43,,38,36,Twitter Web Client,I was honored this week to be part of the ceremony presenting the Navy Cross to Marine Sgt. Rafael Peralta. Cont'd... http://t.co/jKmm9hK6n8
608291125166804993,2015-06-09 15:14:40,,56,34,Twitter Web Client,"A year and a half ago Pres. Obama said ISIS was ""junior varsity."" He still seems unconvinced they're a threat worthy of our full attention."
608290636668801024,2015-06-09 15:12:43,,37,17,Twitter Web Client,"""We don't yet have a complete strategy."" President Obama's words speak for themselves this time. #tcot http://t.co/gQ5hNWiIoC"
608016887147053056,2015-06-08 21:04:56,,7,0,Twitter Web Client,"RT @ClotureClub: All your base are belong to @DarrellIssa. An interview via fax. Brilliant.

http://t.co/ZxyHEnELnf http://t.co/03OjYhTNUo"
608016564949024770,2015-06-08 21:03:40,,9,0,Twitter Web Client,RT @RepJaredPolis: Happy to make cameo in landmark 1st fax interview of modern age w/ @DarrellIssa. Thx @ijreview! http://t.co/leW2AAT8Rz #…
608010595485515776,2015-06-08 20:39:56,,32,49,Twitter Web Client,Have trendy interviews gone too far? My first-ever fax interview complete w/hand-drawn selfie. http://t.co/QpX3Z2ASoC http://t.co/5FifY0W9rA
607978007526023168,2015-06-08 18:30:27,,367,249,Twitter Web Client,"This weekend, artists etched 9,000 silhouettes onto the beaches of #Normandy in honor of the fallen. #tcot http://t.co/FdjRkrNMgR"
607315365769670656,2015-06-06 22:37:21,,149,133,Twitter Web Client,"Another shot showing the incredible scale of the #Normandy operation, which started 71 years ago on June 6th, 1944. http://t.co/aOChxkAzM0"
607288236885614593,2015-06-06 20:49:33,,220,208,Twitter for Android,71 years ago today marked the beginning of Americans storming the beaches of #Normandy. http://t.co/c8nHkTZdUB
606917669732941824,2015-06-05 20:17:03,,43,27,Twitter for Android,"After the OPM breach, I wonder if the federal government will hold itself to the same onerous standards it applies to private companies."
606876218143703040,2015-06-05 17:32:20,,74,41,Twitter Web Client,"""The backlog of unfulfilled requests for documents has doubled since President Obama took office."" Most transparent Admin ever? #tcot"
606574638030811137,2015-06-04 21:33:57,,17,35,Twitter Web Client,Met today with a couple of San Diego-area brewers about the need for tax reform to fuel business growth. http://t.co/SFOxyyuCz8
606561593766182914,2015-06-04 20:42:07,,27,11,Twitter Web Client,The President's policy in Iraq and Syria is not working. ISIS has grown stronger and Assad is still killing civilians http://t.co/pSAzvItBC5
606542708337876994,2015-06-04 19:27:05,,4,35,Twitter Web Client,"The Issa sisters on Halloween, circa 1965, in honor of #ThrowbackThursday. #tbt #tcot http://t.co/dJcO3rJzYx"
606539571174604800,2015-06-04 19:14:37,,27,28,Twitter Web Client,"I'm pleased my amendment to end the secret ""Stingray"" spying program was adopted by the House without opposition. https://t.co/QYWXqHBDf2"
606213000140193792,2015-06-03 21:36:56,,24,17,Twitter Web Client,All three branches of gov't must be open. Event today examined transparency in judiciary financial disclosures. http://t.co/lQdbOKF1UM
606198794603139072,2015-06-03 20:40:29,,36,36,Twitter Web Client,Camp Pendleton held a memorial today for the six Marines who died performing heroic relief work in Nepal: http://t.co/h6gMtoVORk
606184769563594752,2015-06-03 19:44:46,,3,0,Twitter Web Client,RT @RepCloakroom: The Rep. Issa (R-CA) {@DarrellIssa} Amendment was adopted by voice
606150195198443521,2015-06-03 17:27:22,,28,12,Twitter Web Client,When a government spies on its citizens: lessons from Chile -- http://t.co/FWnlMZGrQH #tcot
605750978214801410,2015-06-02 15:01:02,,188,70,Twitter Web Client,Actual picture of a report provided by State Dept. to Benghazi Select Committee. All 15 pages were redacted. #tcot http://t.co/82Lqxn98BW
605739361422995456,2015-06-02 14:14:52,,24,15,Twitter Web Client,Those in the Senate who want to end bulk collection have a chance to do so easily today by passing the USA Freedom Act without amendment.
605487560484364290,2015-06-01 21:34:18,,38,23,Twitter Web Client,"""Using Metadata to Find Paul Revere."" How much can be learned about you using just the ""merest sliver"" of metadata? http://t.co/386bUfs1Bk"
605414553158078464,2015-06-01 16:44:12,,17,26,Twitter Web Client,"Sunday, in San Diego, a 92-year-old cancer survivor became the oldest woman to finish a marathon. http://t.co/fEqAtpNpg7 #MondayMotivation"
605409405673316352,2015-06-01 16:23:44,,27,41,Twitter Web Client,My thoughts and prayers are with @VP Joe Biden and his family during this unimaginably difficult time. http://t.co/zfPFLYx3RD
604392464468811777,2015-05-29 21:02:47,,14,35,Twitter Web Client,#FridayPuppy is all dressed up and ready for the #weekend. Are you? #tcot http://t.co/62mOdn1fsl
604374125956743168,2015-05-29 19:49:55,,67,65,Twitter Web Client,Americans should be able to speak freely online -- including through negative consumer reviews -- without facing legal intimidation.
604373288190623747,2015-05-29 19:46:35,,43,33,Twitter Web Client,Couple faces $66k in legal fees. Were sued for negative Yelp review. We need anti-SLAPP legislation (SPEAK FREE Act). http://t.co/QxbJUUhIKj
604010619482828802,2015-05-28 19:45:28,,17,29,Twitter Web Client,#tbt to 1996 with Bob Dole. Years ahead of the recent beard trend! #ThrowbackThursday #tcot http://t.co/jHs4ypnb4i
603969863015469056,2015-05-28 17:03:31,,129,60,Twitter Web Client,Where do your tax dollars go? A simple breakdown. #tcot http://t.co/VqT3fiZwk1
603672791121014784,2015-05-27 21:23:03,,15,0,Twitter Web Client,"RT @AjitPaiFCC: Evidence: https://t.co/KywZdH7cIt MT @akoronakis ""The Internet is the greatest example of free-market innovation in history…"
603664145708384257,2015-05-27 20:48:42,,70,0,Twitter Web Client,RT @thehill: Obama suffers stinging defeat on immigration in federal court http://t.co/Yy3ZGjAeKI http://t.co/HKVtzBL5CF
603403864826601473,2015-05-27 03:34:26,,26,49,Twitter for Android,"Speaking at a Memorial Day event yesterday, standing alongside 97-year-old USMC Sergeant Major Jay Parker. http://t.co/BdreQtaKa4"
602922654362894336,2015-05-25 19:42:17,,85,70,Twitter for Android,Remembering those who made the ultimate sacrifice. Thank you to all those who serve. #MemorialDay #tcot http://t.co/E1STiaoaT0
601194313226256384,2015-05-21 01:14:28,,104,87,Twitter for Android,Happy 25th birthday to the #Hubble Space Telescope. A quarter century of shots like this one. #hubble25 http://t.co/R8bKdA8QCd
600759433728131074,2015-05-19 20:26:25,,20,26,Twitter Web Client,"The @FisherHouseFdtn houses the families of service members receiving medical treatment, providing them a ""home away from home."""
600759121806131201,2015-05-19 20:25:10,,10,19,Twitter Web Client,"Bill Christiansen, Director of my Vista Office, presents a flag at opening of the Fisher House at @CampPendletonCA http://t.co/6jGEkdf3w8"
600688186034098176,2015-05-19 15:43:18,,9,9,Twitter Web Client,"Amtrak derailment demonstrates potential value of ""Internet of Things:"" http://t.co/wMkznhXMoh #InternetOfThings #internetofthingscaucus"
600686937205284864,2015-05-19 15:38:20,,53,0,Twitter Web Client,RT @CuteAnimalsBaby: nom nom nom http://t.co/zjbsSL6xaS
599285249055596545,2015-05-15 18:48:32,,18,52,Twitter Web Client,Sam the Dog is enjoying the warmer weather. #FridayPuppy http://t.co/bCmYjg846P
599264210208563200,2015-05-15 17:24:56,,101,89,Twitter Web Client,My deepest condolences to the families of the Camp Pendleton Marines lost in Nepal. They truly represent the best America has to offer.
598973709144166401,2015-05-14 22:10:35,,14,18,Twitter Web Client,"#ThrowbackThursday with the ""Governator"" @Schwarzenegger more than a decade ago. #tbt #tcot http://t.co/ZLOuNFcuHk"
598195063781470210,2015-05-12 18:36:31,,19,0,Twitter Web Client,RT @FoundOpenGov: .@DarrellIssa and @SusanWBrooks lead our panel of Congressional experts at #Hack4Congress final presentations http://t.co…
598194947473420288,2015-05-12 18:36:04,,18,0,Twitter Web Client,"RT @MelissaAAMedina: ""It's critical to build easy access to government data... We need to be transparent"" - @DarrellIssa #Hack4Congress"
598177429086154752,2015-05-12 17:26:27,,349,173,Twitter Web Client,What if the typical American family spent like the federal government? #tcot http://t.co/BuKEG7L36j
597891673721561088,2015-05-11 22:30:57,,36,43,Twitter Web Client,A special #MothersDay #MilitaryMonday in recognition of the sacrifices made by military parents and their children. http://t.co/yPOXXlA72q
596426533692186624,2015-05-07 21:29:01,,10,39,Twitter Web Client,"With warm weather upon us, #tbt to nearly ten years ago. Ice cream party and a seersucker suit! #ThrowbackThursday http://t.co/0fA6EFOxWB"
596039211159007232,2015-05-06 19:49:56,,16,18,Twitter Web Client,"With breakthroughs like 3D printers, are factories ""the next fertile ground for the #internetofthings?"" @FastCompany http://t.co/OCzDXMiA62"
594198778468540416,2015-05-01 17:56:43,,20,36,Twitter Web Client,"Today's #FridayPuppy, Raxy, is a certified search and rescue dog and belongs to Stacy, I.T. guru in my D.C. office. http://t.co/H6ifBAKBhP"
593826038574120960,2015-04-30 17:15:35,,14,50,Twitter Web Client,"I hear the #MayweatherPacquiao fight is supposed to be big, but my money’s still on this guy. #tbt #FightOfTheCentury http://t.co/pQtz5p5m7W"
593517966685143041,2015-04-29 20:51:24,,204,101,Twitter Web Client,"A tale of two ""recoveries,"" summed up in one picture. #tcot http://t.co/rhZ8p8jYMx"
593160911621349376,2015-04-28 21:12:36,,70,41,Twitter Web Client,If IRS' priorities were straight the IRS' $11 billion budget &amp; workforce would no doubt stretch a lot further. #tcot http://t.co/nQfxtd9vIi
593120516443086848,2015-04-28 18:32:05,,129,81,Twitter Web Client,If the IRS' spending priorities were straight the IRS' $11 billion budget would no doubt stretch a lot further. #tcot http://t.co/pj5RrH032N
593105099716722689,2015-04-28 17:30:49,,269,122,Twitter Web Client,"Somehow, IRS Commissioner Koskinen's recent complaints just don't quite add up... #tcot http://t.co/juxquG9SHI"
