id,created_at,coordinates,retweets,favorite_count,source,text
509885443505393664,2014-09-11 02:05:37,,11,5,Twitter for iPhone,#HJRes123 also replaces the old 2002 Authorization for Use of Military Force against Iraq. #ISIS #ISIL
509885272801435648,2014-09-11 02:04:56,,36,29,Twitter for iPhone,"Several colleagues and I intro'ed #HJRes123, which would require POTUS to present strategic plan to Congress. #ISIS #ISIL"
509884914171666432,2014-09-11 02:03:31,,59,62,Twitter for iPhone,"If President Obama is finally ready to drop the wobbly rhetoric and lead a coalition, I am prepared to offer the support he needs. #ISIS"
509884679148019712,2014-09-11 02:02:35,,50,51,Twitter for iPhone,"We face a real threat, and our nation needs to show leadership. #ISIS #ISIL"
509884491645865985,2014-09-11 02:01:50,,62,46,Twitter for iPhone,"Now that our enemies have gained strength after we showed weakness, POTUS has concluded we must put our armed forces in harm's way."
509884192017367040,2014-09-11 02:00:39,,88,41,Twitter for iPhone,"#ISIS / #ISIL flourished after this admin rushed away our assistance to Iraq, lost credibility not backing up 'red line' in Syria."
509881226925445120,2014-09-11 01:48:52,,14,0,Twitter for iPhone,RT @KUSI_News: Rep. @DarrellIssa  is on the phone with KUSI now discussing President Obama's address on ISIS. Tune in now.
509846968278208512,2014-09-10 23:32:44,,454,164,TweetDeck,RT @SpeakerBoehner: Please join in a moment of silence for our #FallenHeroes of #September11 tomorrow at 8:46am ET. http://t.co/AgJfpC5oQY
509832018046504960,2014-09-10 22:33:20,,8,0,Twitter Web Client,"RT @RepScottPeters: This AM @DarrellIssa &amp; I spoke to @sdchamber re: San Ysidro, growing SD economy, &amp; working together for #SDinDC http://…"
509828331538116609,2014-09-10 22:18:41,,19,19,TweetDeck,Tired of getting phony texts trying to trick you out of personal info? Voted to expand spoofing protection yesterday https://t.co/3LS8qDVE5h
509805434459660288,2014-09-10 20:47:41,,55,16,TweetDeck,MT @TomCoburn: #WasteWednesday Social Security Admin paid over $1B to more than 250K deceased individuals since 2000 http://t.co/hQw4k77Tp3
509800309598994432,2014-09-10 20:27:20,,67,67,Twitter Web Client,"Voted for #HRes644, condemning Obama Admin for release of Taliban 5 without proper notice to Congress. http://t.co/WELhtNOm6h"
509798573161340928,2014-09-10 20:20:26,,39,9,Twitter for iPhone,"POTUS plan to fix #IRS. RT @RepKevinBrady: IRS Commissioner John Koskinen - ""“Wherever we can, we follow the law.” http://t.co/zrjVFs1MpY"
509770002938224640,2014-09-10 18:26:54,,52,30,TweetDeck,Breaking the Silence on the IRS Outrage: http://t.co/bX27ADwu2O via @NewYorkObserver #IRStargeting
509752126231552001,2014-09-10 17:15:52,,36,38,Twitter for iPhone,Speaking at the #IDCSummit about protecting Christians in the birthplace of Christianity. http://t.co/p64exODceE
509739519369699328,2014-09-10 16:25:46,,31,30,Instagram,Getting ready to speak at the In Defense of Christians inaugural summit. #IDCsummit http://t.co/vZNisKgsgw
509732392232550400,2014-09-10 15:57:27,,18,25,Twitter for iPhone,Making care packs for @the_USO today. #SupportOurTroops http://t.co/zSLWTl893O
509732251748536321,2014-09-10 15:56:53,,4,6,Twitter Web Client,"Sry for the typo, hang tight for a do-over."
509695716651175936,2014-09-10 13:31:43,,42,17,TweetDeck,"Starting momentarily, @GOPoversight will hear concerns from Gov't Watchdogs about Obama Admin obstruction. Watch --&gt; http://t.co/ATMHb6vm5T"
509469461494001664,2014-09-09 22:32:39,,24,11,Twitter Web Client,"Congressmen pressing for #ISIS plan, refugee aid http://t.co/1FPUkg4ncB via @UTsandiego"
509409025910652929,2014-09-09 18:32:30,,23,7,Twitter Web Client,Read full text of #HJRes123 here ---&gt; https://t.co/xFW6tKU8vM
509380211281235969,2014-09-09 16:38:00,,32,17,Twitter Web Client,The full press release about #HJRes123 regarding combating #ISIS can be found here ---&gt; http://t.co/SaTE3tmV7B
509380012303450112,2014-09-09 16:37:13,,10,9,Twitter Web Client,"Big thx to original cosponsors of #HJRes123 @RepDennisRoss, @RepRWilliams, @RepKerryB, @USRepDavidJolly &amp; @RepByrne. 2/2"
509379914009968640,2014-09-09 16:36:49,,9,13,Twitter Web Client,"Big thx to original cosponsors of #HJRes123: @TGowdySC, @SamsPressShop, @USRepLong, @RepLaMalfa ... 1/2"
509378676065320960,2014-09-09 16:31:54,,11,11,Twitter Web Client,...the national security of the U.S. against the continuing threat posed by #ISIS.
509378618292969472,2014-09-09 16:31:41,,15,8,Twitter Web Client,The President is authorized to use the U.S. Armed Forces as he determines to be necessary and appropriate in order to defend...
509378461073686528,2014-09-09 16:31:03,,11,6,Twitter Web Client,...must receive a strategic outlook on the role of the U.S. Armed Forces in combating #ISIS;
509378376315195392,2014-09-09 16:30:43,,14,9,Twitter Web Client,"Whereas Congress, in order to determine the actions necessary and appropriate to protect the national security interests of the U.S. ..."
509378269880524800,2014-09-09 16:30:17,,10,9,Twitter Web Client,...after the limitations specified in section 5(b) of such Resolution have been met;
509378204675887104,2014-09-09 16:30:02,,16,11,Twitter Web Client,Whereas the War Powers Resolution requires the President to obtain congressional authorization for the continued use of U.S. Armed Forces...
509378075805896704,2014-09-09 16:29:31,,25,15,Twitter Web Client,Whereas #ISIS jihadists have directly threatened the United States and its allies;
509377940350861312,2014-09-09 16:28:59,,13,10,Twitter Web Client,Whereas it is in the national security interest of the United States to restore international peace and security to the Middle East region…
509377702064054272,2014-09-09 16:28:02,,3,7,Twitter Web Client,Standby for key passages from #HJRes123.
509376717786345472,2014-09-09 16:24:07,,30,14,Twitter Web Client,#HJRes123 authorizes the use of force against #ISIS for a definite period &amp; requires POTUS to develop and share his strategy with Congress.
509376580641386496,2014-09-09 16:23:35,,33,20,Twitter Web Client,We need a strategic plan to stop the spread of #ISIS's hateful ideology and violence. #HJRes123 #ISIS
509376484214341632,2014-09-09 16:23:12,,18,10,Twitter Web Client,The brutal murder of two American journalists was a shocking wake up call for the American public. #HJRes123 #ISIS
509376393181151232,2014-09-09 16:22:50,,19,11,Twitter Web Client,It's past time for President Obama to define a course of action. #HJRes123 #ISIS
509376240076488704,2014-09-09 16:22:14,,25,16,Twitter Web Client,"Yesterday I intro'ed H.J. Res 123, which focuses on the authorized use of military force against #ISIS."
509113304749715456,2014-09-08 22:57:25,,3,1,Twitter Web Client,@publicola05 strategic plan is required within 60 days of the force authorization under the joint resolution http://t.co/y8gxuAV4m7
509112951522217984,2014-09-08 22:56:01,,6,4,Twitter Web Client,@publicola05 twitter limits to 140 characters. best to read the full press release for details --&gt; http://t.co/y8gxuAV4m7
509103276311474176,2014-09-08 22:17:34,,7,4,Twitter Web Client,"@publicola05 Under the War Powers Resolution of 1973, POTUS only has the authorization to use military force for 60 days. Expires 10/2."
509099285355692032,2014-09-08 22:01:42,,34,21,Twitter Web Client,Tmrw @GOPoversight hearing examining admin's treatment of whistleblowers at 2 PM EDT. http://t.co/1BDDJ40sAT
509097703146799106,2014-09-08 21:55:25,,166,110,Twitter Web Client,I’m introducing a joint resolution that will require POTUS to present a strategic plan to defeat #ISIS to Congress. http://t.co/p57qpMRVmA
509091354845396992,2014-09-08 21:30:12,,94,38,Twitter Web Client,I spoke to @SharylAttkisson about IRS developments ---&gt; http://t.co/xEtvEf6mpt #IRStargeting
509090842741854208,2014-09-08 21:28:10,,31,14,Twitter Web Client,Koskinen's own legal advisor informed Treasury Dept months before Congress about missing IRS emails: http://t.co/xEtvEf6mpt #IRStargeting
509021001737601024,2014-09-08 16:50:38,,92,34,Twitter Web Client,Emails show IRS attempts at damage control http://t.co/ApL1MOq0Cu #IRStargeting
509020243839422464,2014-09-08 16:47:37,,0,1,Twitter Web Client,"@ButchStew1 thx for the support, Butch"
509020198457053184,2014-09-08 16:47:27,,2,0,Twitter Web Client,@DC_Villanus DOJ must appoint special prosecutor. House approved H.Res. 565 on bipartisan basis calling for just that http://t.co/dhUghn0ieY
509018264249581568,2014-09-08 16:39:45,,47,17,Twitter Web Client,"ICYMI, Friday I addressed the changing number of IRS officials experiencing ""email loss."" This pattern must stop ---&gt; http://t.co/3djN97XE0g"
509018031146958848,2014-09-08 16:38:50,,107,31,Twitter Web Client,"#IRS loses emails of 5 more key employees, including Lerner aide: http://t.co/o97GOuRA0T #IRStargeting"
509017912825626624,2014-09-08 16:38:22,,36,0,Twitter Web Client,RT @GOPoversight: Emails Show #IRS Attempts at Damage Control http://t.co/pAD6e9VhRO
509009601225039872,2014-09-08 16:05:20,,47,31,Twitter Web Client,Soldiers fire the M777A1 howitzer at Camp Grayling. #MilitaryMonday http://t.co/fy3sCudJMi
508014177227907073,2014-09-05 22:09:52,,48,65,Twitter for iPhone,"That said, hope you have a relaxing weekend!!! #FridayPuppy http://t.co/yBB4yqR8E9"
508013270570369024,2014-09-05 22:06:16,,61,44,Twitter Web Client,This pattern of 'email loss' must stop ---&gt; http://t.co/3djN97XE0g #IRStargeting
508007770206253056,2014-09-05 21:44:25,,52,0,Twitter Web Client,"RT @GOPoversight: RELEASE: @DarrellIssa on Changing Number of #IRS Officials Experiencing ""Email Loss"": This Pattern Must Stop http://t.co/…"
508007132344901632,2014-09-05 21:41:53,,79,67,Twitter Web Client,Americans deserve better. #IRStargeting
508007077441445888,2014-09-05 21:41:40,,61,30,Twitter Web Client,This pattern must stop. AG Holder must appoint a special prosecutor to sort the truth from the fiction at the IRS. #IRStargeting
508006908230643712,2014-09-05 21:40:59,,136,62,Twitter Web Client,"The IRS's ever-changing story is practically impossible to follow at this point, as they modify it to accommodate new facts. #IRStargeting"
508006683298525184,2014-09-05 21:40:06,,110,32,Twitter Web Client,"Initially, IRS said it confirmed that email back-up tapes were recycled. Now TIGTA tells us there are 760 unsearched exchange server drives."
508006513647300609,2014-09-05 21:39:25,,32,9,Twitter Web Client,"Another source, TIGTA, tells Congress there are at least 8 individuals who may have lost emails. #IRStargeting"
508006408374460418,2014-09-05 21:39:00,,61,22,Twitter Web Client,"Now we learn that five other IRS employees have experienced email loss, several months after the Admin supposedly came clean. #IRStargeting"
508006206531973120,2014-09-05 21:38:12,,29,16,Twitter Web Client,"First, it was only Lois Lerner who experienced email loss. #IRStargeting"
508006121572159488,2014-09-05 21:37:52,,32,14,Twitter Web Client,"This time, it's the number of IRS employees who experienced email losses. #IRStargeting"
508006035786047488,2014-09-05 21:37:31,,35,14,Twitter Web Client,"Today, months into the #IRStargeting investigation, we're still getting conflicting information."
508005893947293696,2014-09-05 21:36:58,,26,10,Twitter Web Client,Then 'rogue agents' in a field office were blamed for the #IRStargeting misconduct.
508005828679720960,2014-09-05 21:36:42,,33,15,Twitter Web Client,"First, the Administration denied #IRStargeting was even occurring."
508005724463853568,2014-09-05 21:36:17,,23,17,Twitter Web Client,Let's walk back through the #IRStargeting scandal for a moment.
507659633796730881,2014-09-04 22:41:03,,28,0,Twitter Web Client,RT @GOPoversight: RELEASE: @DarrellIssa: CMS Head Tavenner to Testify on Healthcare-dot-gov Woes http://t.co/krKhakHw8y
507657182952054785,2014-09-04 22:31:18,,52,19,TweetDeck,Here's the full statement and info on the @GOPoversight hearing regarding HealthCare dot gov woes ---&gt; http://t.co/bUpDHce7fg
507657006485110784,2014-09-04 22:30:36,,106,26,TweetDeck,"#HHS admitted that Tavenner's emails related to flawed HealthCare dot gov launch, subpoenaed by @GOPoversight 11 mos ago, were destroyed."
507656698346373121,2014-09-04 22:29:23,,27,18,TweetDeck,"Just last month, this Admin admitted that Tavenner, the senior official responsible for rollout, experienced email 'loss' similar."
507656538555953152,2014-09-04 22:28:45,,24,19,TweetDeck,"Marilyn Tavenner must testify on subject of transparency, accountability, &amp; info security alongside GAO at @GOPoversight hearing on 9/18."
507656104537784321,2014-09-04 22:27:01,,26,15,TweetDeck,.@GOPoversight will continue to push for answers from this Admin about HealthCare dot gov.
507655833141129216,2014-09-04 22:25:57,,67,20,TweetDeck,"For nearly a year, the Obama Admin has dismissed concerns about the security of HealthCare dot gov."
507655741285867520,2014-09-04 22:25:35,,56,20,TweetDeck,"Considering this Admin launched HealthCare dot gov over the objections of CMS, it's unsurprising the site suffered a 'malicious attack.'"
507655534728994816,2014-09-04 22:24:45,,43,21,TweetDeck,News reporting a hacker breached HealthCare dot gov site: http://t.co/Ntww1mLetO
507637135612973056,2014-09-04 21:11:39,,81,41,TweetDeck,My full statement demanding a strategic plan from POTUS regarding defeat of #ISIL is here: http://t.co/lctAGDB78J
507636245040988160,2014-09-04 21:08:06,,50,46,TweetDeck,The defeat of #ISIL must be a top priority.
507636185096024064,2014-09-04 21:07:52,,81,40,TweetDeck,"It's time for President @BarackObama to choose action over inaction, to execute a plan over rhetoric, and to protect American interests."
507635962403651584,2014-09-04 21:06:59,,41,27,TweetDeck,"Within 60 days of passage, POTUS will have to present to Congress a comprehensive strategy to stabilize region and defeat #ISIL threat."
507635865708158976,2014-09-04 21:06:36,,23,20,TweetDeck,This force would be used to protect American interests and prevent further #ISIL expansion.
507635722270953472,2014-09-04 21:06:02,,29,16,TweetDeck,"Consistent with the War Powers Resolution of 1973, this resolution would give POTUS a 120 day authorization to use force against #ISIL."
507635484647247872,2014-09-04 21:05:05,,54,32,TweetDeck,The responsibility and power to declare war and authorize commitment of US forces lies with Congress.
507635328447164416,2014-09-04 21:04:28,,82,42,TweetDeck,Monday I will introduce a joint resolution to require that POTUS presents a strategic plan to defeat #ISIL to Congress.
507635086687080448,2014-09-04 21:03:30,,74,35,TweetDeck,We cannot sit idly by as #ISIL continues to target and brutally murder Americans while threatening US interests and those of our Allies.
507634967111692288,2014-09-04 21:03:02,,31,12,TweetDeck,This POTUS has clearly stated he does not have a plan to deal with growing terrorist threat from #ISIL.
507568491512487936,2014-09-04 16:38:53,,3,2,Twitter Web Client,@LFS7 DOJ must appoint a special prosecutor. @Jim_Jordan
507567631126507520,2014-09-04 16:35:28,,43,0,Twitter Web Client,RT @Jim_Jordan: Here's my letter with @DarrellIssa to the IRS requesting an interview with IRS lawyer facing disbarment - http://t.co/aIjXq…
507566272012615680,2014-09-04 16:30:04,,0,0,Twitter Web Client,"@SethFelman thx for the support, Seth!"
507565022898581504,2014-09-04 16:25:06,,1,1,Twitter Web Client,@GCGATOR24 thx for the support
507564112357101568,2014-09-04 16:21:29,,3,3,Twitter Web Client,@GCGATOR24 Be sure to check out @GOPoversight work on #ChokePoint here: http://t.co/Y0zvt2UAbG @SpeakerBoehner
507563784563462145,2014-09-04 16:20:10,,14,42,Twitter Web Client,My son's dog has attitude. http://t.co/VhZsfuBuuq
507236147945541632,2014-09-03 18:38:16,,51,0,TweetDeck,RT @GOPoversight: .@DarrellIssa: House will 'Vigorously Oppose' New #DOJ Motion to Stay Judge's Operation #FastAndFurious Order http://t.co…
507235047074963456,2014-09-03 18:33:53,,73,31,TweetDeck,Read my full statement on the new #DOJ motion to stay a judge’s Operation #FastAndFurious order: http://t.co/z6QPtn5fwu
507234887439777793,2014-09-03 18:33:15,,48,28,TweetDeck,The House of Representatives will vigorously oppose this new effort by the #DOJ to stay a judge’s #FastAndFurious order.
507234747693928448,2014-09-03 18:32:42,,47,26,TweetDeck,"This Admin continues to fight making a full account of what it knew &amp; when, &amp; why it made false statements to Congress about its conduct"
507234610028503040,2014-09-03 18:32:09,,60,22,TweetDeck,Reckless conduct in a #DOJ operation contributed to the deaths of a Border Patrol agent &amp; countless Mexican citizens. #FastAndFurious
507234433062424576,2014-09-03 18:31:27,,50,30,TweetDeck,This Administration continues to delay &amp; obstruct constitutionally mandated oversight &amp; the principle of transparency. #FastAndFurious
506912953980174336,2014-09-02 21:14:00,,125,95,TweetDeck,"Thoughts &amp; prayers are with the loved ones of Steven Sotloff, James Foley, &amp; the innocent people who have suffered at the hands of ISIS."
505427553436598272,2014-08-29 18:51:33,,191,0,TweetDeck,"RT @WSJPolitics: Chesty XIV is the Marine Corps' newest corporal. Give us a caption for this photo! 
(Credit: Marine Barracks 8th &amp; I) http…"
505418599981674497,2014-08-29 18:15:59,,22,20,Twitter for iPhone,"Football season is back, and #FridayPuppy wants to play! Who are you cheering for this week? http://t.co/TbpkFCHaAV"
505118934354657280,2014-08-28 22:25:13,,1,1,Twitter for iPhone,@RepMarkMeadows thx Mark!
505105317068546048,2014-08-28 21:31:06,,41,46,Twitter for iPhone,Stars and stripes in this #tbt. 'Merica. http://t.co/FEPQGm06m2
505008080124674048,2014-08-28 15:04:43,,39,13,Twitter Web Client,"Santhood, Book Clubs, and Posters: How the Department of Labor Wastes Your Money This Labor Day http://t.co/SOQURmSn8D #DOL"
504704090501566464,2014-08-27 18:56:46,,38,21,TweetDeck,Invited fmr HHS Secretary Kathleen Sebelius and fmr Dept of Labor Secretary Hilda Solis to testify @GOPoversight: http://t.co/clKYYwN3Wp
504655301896056832,2014-08-27 15:42:54,,39,38,Twitter Web Client,The Western Wall and the Dome of the Rock http://t.co/BoXjntaMo5
504655004452798464,2014-08-27 15:41:43,,48,57,Twitter Web Client,Visiting an Iron Dome site in Israel. Behind me in the center is a launch site for interceptors. http://t.co/grvYHVGxjk
504654190787182593,2014-08-27 15:38:29,,14,15,Twitter Web Client,One more from Egypt with the Defense Minister and his staff. http://t.co/7ABGfv6OKj
504653345697841152,2014-08-27 15:35:08,,18,19,Twitter Web Client,Beirut. http://t.co/RMwATB0Kcm
504653159911149568,2014-08-27 15:34:23,,12,16,Twitter Web Client,With current Lebanese Prime Ministor Tamman Salam and US Ambassador Hale. http://t.co/9G1xRqfHip
504651654986485760,2014-08-27 15:28:25,,12,19,Twitter Web Client,"In Egypt with General Sedki Sobhi Sayyid Ahmed, Minister of Defence. http://t.co/nAHcRph80l"
504651246700359681,2014-08-27 15:26:47,,10,16,Twitter Web Client,Discussing US embassy security in Amman with Ambassador Alice Wells. http://t.co/xgp6aIdqLB
504650394140938240,2014-08-27 15:23:24,,12,10,Twitter Web Client,"With Father Nabil, Director of the Jordanian Interfaith Coexistence Research Center (JICRC) and Sheikh Hamdi Murad. http://t.co/Sy9TuRWTBB"
504649711048204288,2014-08-27 15:20:41,,4,12,Twitter Web Client,"Final few from Zaatri Camp, Jordan. http://t.co/2zGe2gvGk6"
504649390913761280,2014-08-27 15:19:25,,5,16,Twitter Web Client,Siphoning electricity at the camp. http://t.co/t3qdUtx1Fv
504648914289827840,2014-08-27 15:17:31,,1,10,Twitter Web Client,Briefing at Zaatri Camp with Killian Kleinschmidt of UNHCR @Refugees. http://t.co/o7xCT98TUU
504648379415400448,2014-08-27 15:15:24,,3,9,Twitter Web Client,More from Zaatri Camp in Jordan. http://t.co/3VX2taGdVy
504647592979202049,2014-08-27 15:12:16,,1,3,Twitter Web Client,@iadoreem thx. I'm back home now.
504647283523473408,2014-08-27 15:11:02,,8,15,Twitter Web Client,"Meeting with Syrian refugees at Zaatri Camp, Jordan. The man on the right and I spoke about his shop at the camp. http://t.co/ppSPJJ4X4w"
504645590316515328,2014-08-27 15:04:19,,3,14,Twitter Web Client,"In Lebanon speaking with Fouad Siniora, fmr Prime Minister, Michel Sleiman, fmr President, and US Ambassador Hale. http://t.co/6fjXKAYoRy"
504644676272783362,2014-08-27 15:00:41,,8,6,Twitter Web Client,Pics from my trip to the Middle East coming up.
504351118449979392,2014-08-26 19:34:11,,39,26,Twitter Web Client,"If you live nearby, consider adopting from Camp Pendleton’s Animal Shelter: http://t.co/PhdqZMepar #NationalDogDay"
504350927655276544,2014-08-26 19:33:26,,29,29,Twitter Web Client,#FridayPuppy came early this week to wish you a happy #NationalDogDay! http://t.co/cJmf1cxw1C
504344839102935040,2014-08-26 19:09:14,,43,7,TweetDeck,"The Dept of Labor spent $100,000 promoting a book club. #DOL http://t.co/lB6LTjZ1oE"
504333341005742080,2014-08-26 18:23:33,,34,23,Twitter Web Client,"Welcome home from Helmand, Marines! Big thanks to you and your loved ones for your sacrifices. cc: @PendletonScout http://t.co/N50FBnhK78"
504317285168078848,2014-08-26 17:19:45,,22,10,Twitter Web Client,I have serious questions about frivolous spending at the Department of Labor: http://t.co/EnDFVntdZY
504310433294348290,2014-08-26 16:52:31,,1,0,Twitter Web Client,@bstevewhite Special Prosecutor must be appointed by DOJ. @Jim_Jordan @GOPoversight
504306715891093505,2014-08-26 16:37:45,,61,0,Twitter Web Client,RT @Jim_Jordan: Here's yet another reason we need a special prosecutor in the #IRSscandal http://t.co/I5ekSGZRlV via @GOPoversight w/ @Darr…
504306353796829184,2014-08-26 16:36:18,,0,1,Twitter Web Client,@Elisa_Lo_ @nickyrobertso from the 1913 women's suffrage parade in DC.
504301726510632960,2014-08-26 16:17:55,,82,49,Twitter Web Client,"Ninety-four years ago today, women's right to vote was finally recognized with the adoption of the 19th Amendment. http://t.co/GII3U42gde"
504270201597480960,2014-08-26 14:12:39,,24,0,TweetDeck,RT @GOPoversight: RELEASE: Oversight Committee Seeks Answers from Labor Department on Wasteful Spending http://t.co/BTPFE25b0p
504022816862515200,2014-08-25 21:49:38,,17,7,TweetDeck,@jhf5 DOJ atty who represented IRS in targeting litigation is former IRS employee involved in IRS targeting scheme
504022092975964160,2014-08-25 21:46:45,,0,1,Twitter Web Client,@triton368 thx for the support!
504021929767223297,2014-08-25 21:46:06,,98,39,Twitter Web Client,Read more about our latest info on conflict of interest in #DOJ investigation of #IRStargeting here: http://t.co/e3PqAIkAEZ
504021781213380610,2014-08-25 21:45:31,,102,27,Twitter Web Client,"New info indicates additional conflicts of interest at #DOJ, incl. one attorney who represented #IRS and was also involved in #IRStargeting."
504021450295361537,2014-08-25 21:44:12,,46,31,Twitter Web Client,Concerned about conflicts of interest within #DOJ regarding #IRStargeting investigation.
504021301091389440,2014-08-25 21:43:37,,91,0,Twitter Web Client,RT @GOPoversight: RELEASE: New docs: #DOJ's #IRS Representation Conducted by Fmr IRS Atty Involved in Targeting Conservatives Himself http:…
504019841016426499,2014-08-25 21:37:48,,16,11,TweetDeck,Spoke with Israeli PM Netanyahu last week. I discussed that and more with @SundayFutures yesterday: https://t.co/PPPflRiDFA
503944477107822594,2014-08-25 16:38:20,,15,0,Twitter Web Client,"RT @SundayFutures: #ICYMI: @DarrellIssa on #ISIS, #IronDome, &amp; Lois Lerner #irsscandal http://t.co/WtCntnq0Ip"
503944257586343936,2014-08-25 16:37:28,,3,2,TweetDeck,@bobray7425 this article from @UTsandiego has more info: http://t.co/mP8HXWmPz3
503943467899559936,2014-08-25 16:34:20,,48,38,Twitter Web Client,Two San Diego-based helicopter squadrons are accompanying them. Godspeed to these fine fighting men and women. #MilitaryMonday
503943418507448320,2014-08-25 16:34:08,,31,17,Twitter Web Client,"Four other warships — Bunker Hill, Gridley, Sterett, and Dewey — departed as well."
503943225330384896,2014-08-25 16:33:22,,135,89,Twitter Web Client,The USS Carl Vinson departed San Diego Friday for a 9.5 mo deployment. #MilitaryMonday http://t.co/IoBVaVlaGh
503932390260350977,2014-08-25 15:50:19,,20,19,TweetDeck,"Talked Israel, the Iron Dome, and more from my Mid East trip yesterday on @SundayFutures with @MariaBartiromo: http://t.co/8XHOh09RIj"
502936075510480896,2014-08-22 21:51:19,,38,55,Twitter for iPhone,Did somebody say weekend?! Pixel the puppy hopes you have a good one!! #FridayPuppy http://t.co/SCpYHpEhG2
502871653245018112,2014-08-22 17:35:19,,28,0,Twitter Web Client,"RT @GOPoversight: RELEASE: @DarrellIssa, @Jim_Jordan Urge Recovery, Oversight of NY's Mismanaged Medicaid Funds http://t.co/lGwQT4IZgx"
502869895064080384,2014-08-22 17:28:20,,174,40,TweetDeck,"Exec Dir of CA #Obamacare Exchange awarded a $53,000 bonus while Californians' insurance rates are up 22-88% in 2014. http://t.co/RdsU5Qj2jF"
502839346744266752,2014-08-22 15:26:57,,79,50,Twitter Web Client,"BTW, did you see that a judge ordered the #DOJ to turn over a list of #FastandFurious docs? http://t.co/uxB9e2qubC"
502836948927799296,2014-08-22 15:17:25,,11,11,TweetDeck,Good to be back in the US. Will share more about the CoDel soon.
502541312256913412,2014-08-21 19:42:40,,78,52,TweetDeck,Judge: #DOJ must provide list of #FastandFurious documents http://t.co/H91N6Q9p2R
502508734569259009,2014-08-21 17:33:13,,45,17,TweetDeck,Most ‘transparent' admin ever RT @GOPLeader: Is @HealthCareGov safe? The Administration won't say → http://t.co/K8pwtpSqSa
