id,created_at,coordinates,retweets,favorite_count,source,text
820057617095659520,2017-01-13 23:59:06,,5,0,Twitter for iPhone,RT @HouseJudiciary: #ff @SteveKingIA @DarrellIssa @TGowdySC @JimPressOffice @RepTomMarino 👏 https://t.co/WXuHbz3NQ9
819968965585813507,2017-01-13 18:06:50,,35,111,Twitter Web Client,Outside the Capitol and about to introduce a few of my first pieces of legislation for the new year. Take a look!… https://t.co/v7KOWPU9p3
819943652495687680,2017-01-13 16:26:15,,15,0,TweetDeck,RT @HouseJudiciary: #BREAKING: @RepGoodlatte &amp; @DarrellIssa Statement on Proposed Reforms to the #InvestorVisa Program https://t.co/PEaU41h…
819924930397663232,2017-01-13 15:11:51,,31,0,TweetDeck,RT @MariaBartiromo: Rep. Issa on health care reform: Put Affordable in Affordable Care Act https://t.co/J85LkNrPv3 @MorningsMaria @FoxBusin…
819720458069278720,2017-01-13 01:39:21,,14,49,TweetDeck,"Congrats to Ally, Sophi, Raquel and Jillia from San Clemente High School! What an accomplishment! 🏆https://t.co/N49gWmImO3"
819702363070038016,2017-01-13 00:27:27,,1,0,TweetDeck,@ChloeBogle Definitely. I’d love to get your thoughts on the bill.
819674641249792004,2017-01-12 22:37:17,,25,59,TweetDeck,Just introduced a bill that could have the nuclear waste from San Onofre begin removal in as little as 5 years.… https://t.co/SozztAzxHe
819607504124604417,2017-01-12 18:10:31,,5,5,TweetDeck,@rachrise16 My plan would have given everyone same healthcare as members of Congress. Read more here -&gt; https://t.co/icK4H6kNKt
819368583235072000,2017-01-12 02:21:08,,535,0,Twitter Web Client,"RT @SpeakerRyan: $1,000,000,000,000 = The total cost of regulations issued by the Obama administration. https://t.co/HhIWS5l77x"
819302417921622019,2017-01-11 21:58:12,,64,128,TweetDeck,Americans deserve better than Obamacare. https://t.co/elONhwFua4
819204643905486848,2017-01-11 15:29:41,,5,0,TweetDeck,"RT @allymutnick: #CA49's @DarrellIssa, who had closest race of 2016, introduces bipartisan law to reform skilled workers visa program https…"
819189479697215488,2017-01-11 14:29:26,,38,107,TweetDeck,ICYMI: My thoughts on why Rex Tillerson can reorganize &amp; reassert the State Dept's vital role on the world stage -&gt; https://t.co/e76opiRyKR
818991660650655744,2017-01-11 01:23:22,,9,0,TweetDeck,"RT @cathymcmorris: Heard @boblatta, @DarrellIssa and @HurdOnTheHill had a packed house for their @CES #CES2017 panel over the weekend. Cong…"
818946540526071811,2017-01-10 22:24:05,,12,0,TweetDeck,RT @HurdOnTheHill: If we want a 21st Century government innovation is key @teammoulton @uber @lyft https://t.co/FfC6Pmqz4h…/hurd-moulton-de…
818945469363666944,2017-01-10 22:19:49,,32,74,TweetDeck,"Just passed @RepComstock’s INSPIRE Women Act! A great bill to support women pursuing careers in science, technology… https://t.co/eyNfIJExvy"
818888678730825728,2017-01-10 18:34:09,,1,3,TweetDeck,@budswdrbobbillw Sounds a lot like a bill I introduced https://t.co/icK4H6kNKt
818887994434273281,2017-01-10 18:31:26,,17,34,TweetDeck,What should be done with Obamacare? Repeal it? Replace it? Fix it? Tell me what YOU think in our poll —&gt; https://t.co/kTA0K588TK
818870965472022529,2017-01-10 17:23:46,,11,29,Twitter for iPhone,"Sitting down and mic-ing up for a bipartisan chat about privacy, encryption and future of tech with @RepDelBene for… https://t.co/JxVlDO98FX"
818583560969977856,2017-01-09 22:21:44,,84,290,Twitter for iPhone,A big thank you goes out to the men and women who put their lives on the line for us each and every day.… https://t.co/EOvePqC5gM
818543509896630273,2017-01-09 19:42:35,,61,202,TweetDeck,"By the end of this week, we’ll have passed 6 new bills to help undo job killing regulations &amp; increase transparency https://t.co/5XCrPP4i0e"
818474683431522307,2017-01-09 15:09:05,,76,167,TweetDeck,Copy of the letter I sent to the San Diego VA Director seeking answers for its ‘large decline’ in healthcare scores… https://t.co/rrmx9ZkFI8
817800134901764098,2017-01-07 18:28:40,,17,44,Twitter for iPhone,"Kicking off a bipartisan chat about the future of tech with @RepSwalwell, @HurdOnTheHill and @boblatta at #CES2017 https://t.co/9dsD4gMlgU"
817796571744104448,2017-01-07 18:14:31,,16,0,Twitter for iPhone,RT @RepSwalwell: I'm at #CES2017 w/ @DarrellIssa @HurdOnTheHill for a @CES bipartisan chat about future of tech
817795083173040128,2017-01-07 18:08:36,,7,43,Twitter Web Client,"Always great catching up with constituent innovators, like Scott, from Sound United in Vista at @CES! https://t.co/XyLjeRYX56"
817794537234034688,2017-01-07 18:06:26,,6,17,Twitter for iPhone,Be sure to tune in! https://t.co/LggXq2aJx0
817791209355837440,2017-01-07 17:53:12,,34,83,TweetDeck,"My bill, the Protect and Grow American Jobs Act, helps close this loophole. https://t.co/u5ypQaaws2"
817524723374559233,2017-01-07 00:14:17,,43,115,TweetDeck,Our veterans deserve world-class care. They earned it. https://t.co/IdtVqymvWs
817524474488700929,2017-01-07 00:13:18,,18,0,Twitter Web Client,"RT @UnionTrib: Issa, Hunter ask for answers on 'large decline' in San Diego VA health care scores: Two San Diego County… https://t.co/6Xx1c…"
817524120342695942,2017-01-07 00:11:53,,3,0,TweetDeck,RT @QuorumAnalytics: Congressman @DarrellIssa applauds @uspto's work to improve the quality of patents at #CES2017 #IPS2017
817490515910344705,2017-01-06 21:58:21,,19,0,Twitter for iPhone,RT @RiponAdvance: Bipartisan @DarrellIssa bill would reform high-skilled immigration program and prevent outsourcing of American jobs  http…
817488783620849665,2017-01-06 21:51:28,,10,0,Twitter for iPhone,RT @mpetricone: Special guest at our #patent panel = @DarrellIssa #fixpatents #CES2017 #IPS2017 https://t.co/JSIURENfIw
817488710866522114,2017-01-06 21:51:11,,13,0,Twitter for iPhone,RT @QuorumAnalytics: Congressman @DarrellIssa delivers closing remarks at Trolls &amp; Tech: How to fix Patents #IPS2017 #CES2017 https://t.co/…
817173251105366020,2017-01-06 00:57:40,,48,0,TweetDeck,RT @cathymcmorris: Our first business this year was reining in President Obama’s executive overreach with the Midnight Rules Relief Act htt…
817168593347547136,2017-01-06 00:39:09,,125,473,TweetDeck,"Proud to join my colleagues and stand in support of our ally, Israel, casting my vote tonight to reject the anti-Israel UN resolution"
817055346544013312,2017-01-05 17:09:09,,242,0,Twitter for iPhone,RT @foxandfriends: .@DarrellIssa: California hiring Holder to defend against Trump is a waste of taxpayer dollars https://t.co/fqpOWvFwCb
817055088288075776,2017-01-05 17:08:07,,58,0,Twitter for iPhone,"RT @thehill: CA GOP Lawmaker: Hiring Obama's former AG to fight Trump a waste of tax dollars
https://t.co/83BLwuccUr https://t.co/NVoBxXtOI0"
817051761529786368,2017-01-05 16:54:54,,0,1,TweetDeck,"@JonDyer47 Contact my office, we’ll see how we can help https://t.co/9gALOiXpmv"
817045098533941248,2017-01-05 16:28:26,,91,256,Twitter Web Client,"""If we can work together we can fix a lot of the problems"" more from my interview with @foxandfriends on stopping o… https://t.co/zHPhX0trXK"
817034874657927168,2017-01-05 15:47:48,,6,18,TweetDeck,San Diego companies are making a real show of force at this years @CES show. Can’t wait to see them this weekend! https://t.co/5GUsX5Ohd3
816859742341660672,2017-01-05 04:11:53,,72,0,Twitter for iPhone,"RT @cathymcmorris: Thank you for your leadership, @DarrellIssa. This bill holds President Obama’s executive overreach and overregulation ac…"
816801704494714881,2017-01-05 00:21:16,,168,314,TweetDeck,"My bill, which passed the House today, helps us repeal Obama’s “midnight regulation express” https://t.co/PGYb8WAy7J https://t.co/DNje6DBxBx"
816790865561747456,2017-01-04 23:38:12,,75,371,TweetDeck,Freshly signed my Oath of Office to support and defend the Constitution this morning. It’s truly an honor to serve… https://t.co/Ca0bX8Byfx
816780652364316672,2017-01-04 22:57:37,,29,90,Twitter Web Client,Veterans are making San Diego one of the nation's largest hubs for startups and new businesses https://t.co/HUYcXTGh5b
816769992989560832,2017-01-04 22:15:15,,125,238,TweetDeck,✅ The House just passed by bill to stop last-minute Obama admin regulations from killing jobs. My statement:… https://t.co/tuvKIOYvQ5
816736273075412992,2017-01-04 20:01:16,,14,0,TweetDeck,RT @sarahdwire: California's .@DarrellIssa is taking another shot at changing the rules for the skilled worker visa program https://t.co/hZ…
816692329553784833,2017-01-04 17:06:39,,5,0,TweetDeck,RT @BIOCOMCA: @DarrellIssa Thank you for cosponsoring legislation to repeal the #meddevicetax and support jobs and innovation.
816680392568737792,2017-01-04 16:19:13,,44,0,TweetDeck,"RT @HouseJudiciary: Today, House is voting on Midnight Rules Relief Act to stop last-minute regs from crushing the economy. https://t.co/FX…"
816678340346216449,2017-01-04 16:11:04,,43,147,TweetDeck,Just introduced my bill to stop the outsourcing of American jobs and fix our high skilled visa system. https://t.co/AYCj7zduLH
816670250657837056,2017-01-04 15:38:55,,2,2,TweetDeck,"@MACHTink Yes. We added language to the NDAA that will ensure those who repaid, will be made whole"
816668847507996672,2017-01-04 15:33:20,,22,64,TweetDeck,Pentagon will waive bonus repayments for for the vast majority of California National Guard soldiers https://t.co/F37bAQMp7n
816434433737846788,2017-01-04 00:01:52,,26,103,TweetDeck,"Reforms to the Congressional ethics process should be done in an open, transparent &amp; bipartisan fashion. More here → https://t.co/gecjJnNqDs"
816425414381998080,2017-01-03 23:26:01,,52,349,Twitter Web Client,Thrilled and honored to be sworn in today as a member of the 115th Congress by @SpeakerRyan. Ready to get back to w… https://t.co/eP6sE9eMkI
816421001156317184,2017-01-03 23:08:29,,50,158,TweetDeck,Just introduced my bill to stop last-minute regulations from killing jobs and hiking costs on families. Statement -&gt; https://t.co/x8hzCKSkQ0
816116191349633024,2017-01-03 02:57:17,,137,388,TweetDeck,First up tomorrow? Stopping excessive regulations that are costing jobs and hampering economic growth https://t.co/mVUykjyE8u
816079767057432576,2017-01-03 00:32:33,,29,85,TweetDeck,Tomorrow is the first day of the new Congress. What should our highest priority be? Tell me what you think here 👉https://t.co/NrTD7vDbAT
816055437019795456,2017-01-02 22:55:52,,12,74,TweetDeck,On the set with @wolfblitzer talking Obamacare repeal and priorities for the new Congress! https://t.co/YpGjF1vG7K
811694636704079873,2016-12-21 22:07:36,,31,47,Twitter Web Client,Contact my office if you're facing skyrocketing electric costs at Pendleton housing and we'll see how we can help… https://t.co/kxI2HzgpIn
811664676262150144,2016-12-21 20:08:33,,22,37,TweetDeck,Whats the single most important thing Congress needs to get done in the new year? Tell me here —&gt; https://t.co/qWMDpIe9JN
811328935501922305,2016-12-20 21:54:26,,122,0,Twitter Web Client,"RT @SpeakerRyan: As part of a #BetterWay, @HouseGOP proposed a plan to repeal #Obamacare—and in 2017, we’ll keep our word. https://t.co/3cX…"
811326127075708933,2016-12-20 21:43:17,,25,215,Twitter Web Client,"Truman is in the office today, all dressed up and ready for the holidays! 🎅 https://t.co/ugKO5deIN3"
811323525432754176,2016-12-20 21:32:56,,1,8,TweetDeck,@TucsonTrumpGirl @SACPAC1 Yes. We plan on repealing and replacing Obamacare to fix the problems it has created in our healthcare system
811323320259985408,2016-12-20 21:32:07,,1,3,TweetDeck,@thatbjenkins Thats exactly the bill I proposed in 2009. Read about my bill here https://t.co/G9gpyfXc4i
811312325106036740,2016-12-20 20:48:26,,116,390,Twitter Web Client,"America can do better than Obamacare. Next year, we're going to fix it with reforms that put patients and our choic… https://t.co/1b5Ckgmh34"
809891815319044097,2016-12-16 22:43:50,,18,26,TweetDeck,Hearing reports about much higher than normal electric bills at Camp Pendleton. Contact my office for help —&gt; https://t.co/9gALOiXpmv
809498451843149825,2016-12-15 20:40:45,,9,0,TweetDeck,"RT @coastnewsgroup: Federal funding for the 50-year sand project in @CitySolanaBeach, @EncinitasGov approved: https://t.co/OuqCtnMA2d @Darr…"
809488401443459072,2016-12-15 20:00:49,,21,50,TweetDeck,Fantastic read on how veterans are making San Diego one of America’s biggest startup hubs. Check it out! https://t.co/fDbjNpwmNd
809476993616138240,2016-12-15 19:15:29,,40,87,TweetDeck,Good news! The President just signed into law a bill I co-sponsored to protect freedom of speech online. https://t.co/Ww6SPb1LX0
809426947063349249,2016-12-15 15:56:37,,22,76,TweetDeck,We need to return power from federal gov to the cities so they can implement sensible reforms to sober living homes https://t.co/9xndu84zwb
808802609108815874,2016-12-13 22:35:43,,66,416,Twitter Web Client,"As a fmr Army Captain, I've been waiting 14 years for a win at the #ArmyNavyGame. Adding a new flag to my office re… https://t.co/L8E7i37blq"
808763961206247424,2016-12-13 20:02:09,,37,0,TweetDeck,RT @cspan: President Obama &amp; @VP Biden at signing ceremony of 21st Century #CuresNow Act – LIVE on C-SPAN https://t.co/wBQGOQHFUJ https://t…
808448470092804097,2016-12-12 23:08:30,,4,0,TweetDeck,RT @CALifeSciences: Thanks @DarrellIssa for supporting #CuresNow + helping spur #medical #innovation! Full Release: https://t.co/340Tav1SFD…
808448291918802945,2016-12-12 23:07:47,,5,0,TweetDeck,RT @CALifeSciences: ICYMI: CLSA Applauds Congressional Passage of #CuresAct. Full Statement 👉https://t.co/cfihECF9Fc #CuresNow
807343716239372288,2016-12-09 21:58:36,,25,0,TweetDeck,"RT @RiponAdvance: House approves 6 veterans' bills including measures led by @DarrellIssa, @RepJeffMiller, and @RepBillShuster https://t.co…"
807342498184044544,2016-12-09 21:53:45,,15,34,TweetDeck,The Navy is testing new ways of delivering medical care to our heroes. What do you think? https://t.co/vTi0ppolEs
807305536811069440,2016-12-09 19:26:53,,16,24,TweetDeck,What topics are most important to you right now? Take our latest survey and let me know what you think https://t.co/TtJEclMupu
806979423652249601,2016-12-08 21:51:02,,5,16,TweetDeck,Bill also funds erosion prevention for Solana Beach and Encinitas https://t.co/QXLwlw7pNB
806978944188764161,2016-12-08 21:49:07,,20,81,TweetDeck,Just passed crucial investments in our nation's water infrastructure and drought relief for California. https://t.co/QXLwlw7pNB
806625615583518720,2016-12-07 22:25:07,,12,20,TweetDeck,What issues should Congress make a priority next year? Tell me in our new constituent survey 👉 https://t.co/0RPV0vnWxr
806613661762617344,2016-12-07 21:37:37,,33,145,TweetDeck,Today we give pause to honor the the lives we lost at Pearl Harbor 75 years ago today. We salute all those who serv… https://t.co/9gHSx7QNu8
806578524098297856,2016-12-07 19:18:00,,7,11,TweetDeck,"Pranav, our district’s winner, created a game to teach children about the importance of cybersecurity https://t.co/okhD7e997C"
806578091204182016,2016-12-07 19:16:17,,16,47,TweetDeck,"Congrats to Pranav Patil from Del Norte High School, winner of the 2016 Congressional App Challenge in our district… https://t.co/sgE6GZPWn6"
806575007203786753,2016-12-07 19:04:01,,26,27,TweetDeck,"Last year, Califonia police used federal loopholes to pocket $410.9 from citizens without ever having to prove guilt https://t.co/3QvZwwqA4q"
806538906388877312,2016-12-07 16:40:34,,17,25,TweetDeck,Great read in the @ocregister today on pressing need to pass civil forfeiture reform https://t.co/3QvZwwqA4q
806527253509181441,2016-12-07 15:54:16,,12,12,TweetDeck,How can I best help you? Take our new issue survey today so I can hear your thoughts. https://t.co/0RPV0vnWxr
806329379404005376,2016-12-07 02:47:59,,68,225,TweetDeck,"Today, the House passed 3 bills I co-sponsored to improve service, care and benefits for veterans &amp; their families. https://t.co/iYi1oOQjTA"
806246000029483008,2016-12-06 21:16:40,,8,74,Twitter Web Client,"David Zito, the mayor of Solana Beach, and I after meeting to discuss sand replenishment and projects in the water… https://t.co/RvVQUeeVXV"
805235101655306240,2016-12-04 02:19:43,,661,0,Twitter for iPhone,"RT @JudgeJeanine: ""General Mattis is a decorated war hero and can make a difference"" @DarrellIssa on #Justice"
804793276331151360,2016-12-02 21:04:04,,413,714,TweetDeck,The House just passed a bill to fix the National Guard Bonus Scandal. Refunds soldiers every penny they paid back. https://t.co/Um5FlgBCNt
804769630682226688,2016-12-02 19:30:06,,183,278,TweetDeck,"James Mattis is one of the finest choices for Secretary of Defense that our nation has to offer.

My full statement… https://t.co/CMgfxxU9Vh"
804765700132892676,2016-12-02 19:14:29,,148,290,TweetDeck,Just passed the largest troop pay raise in 6 years. Our heroes deserve it. https://t.co/VGvOGIl1up
804437323811201024,2016-12-01 21:29:38,,54,271,Twitter Web Client,Drawing names for tickets to the inauguration of @realDonaldTrump! Thanks to all who reached out! We'll announce re… https://t.co/NX8BgeeoK6
803986253133844481,2016-11-30 15:37:14,,27,51,TweetDeck,"An important fix that ultimately does the right thing.

https://t.co/XqRc3BBlDY"
803715429227184136,2016-11-29 21:41:05,,16,34,TweetDeck,Want to keep in touch? Sign up for my e-newsletter! You’ll get the latest on how I’m working for you in Washington. https://t.co/DnarAzgSIW
803650736257122304,2016-11-29 17:24:01,,22,39,TweetDeck,I’m looking for highly qualified interns to join us for the Spring Semester. Apply on our website! https://t.co/2n6AAvUUuh
803606330099515392,2016-11-29 14:27:34,,15,65,TweetDeck,My office recently redesigned our website to help serve you better. Check out the new look! —&gt;… https://t.co/5dcfWHJhT3
803401239530795008,2016-11-29 00:52:36,,53,86,TweetDeck,"The Consumer Review Fairness Act, which now heads to the President, ensures online reviews can’t be censored https://t.co/mT0dNcABBJ"
803400943761031168,2016-11-29 00:51:26,,177,313,TweetDeck,Good news! The senate just passed and sent to the President's desk a bill to protect the Freedom of Speech online https://t.co/mT0dNcABBJ
802645865215168512,2016-11-26 22:51:01,,110,263,TweetDeck,"It’s my hope that Castro’s death will mark the beginning of a new era of hope, freedom, and peace for Cuba. https://t.co/bMK0itudtA"
802631842058805248,2016-11-26 21:55:17,,74,107,Twitter for iPhone,"While the dictator has died, the repressive regime he created endures. https://t.co/lgwL5GTCIZ"
802627744915857408,2016-11-26 21:39:01,,863,1619,TweetDeck,The irony of Fidel Castro's death on Black Friday- the most capitalist day of the year - should serve as a reminder that freedom always wins
802614656347045888,2016-11-26 20:47:00,,156,334,TweetDeck,Fidel Castro’s death does not deserve to be mourned. https://t.co/dp6U0jy4Ki
802592350899798016,2016-11-26 19:18:22,,517,740,TweetDeck,"Fidel Castro was a tyrant, murderer, liar, and evil despot. History will remember him as nothing more. 

My full st… https://t.co/SNbjhjmV9F"
801206798640254976,2016-11-22 23:32:41,,194,0,Twitter for iPhone,RT @RiponAdvance: House approves @DarrellIssa &amp; @RepTomMarino bill to counter any attempted “midnight regulations” by the Obama Admin https…
801085387183706116,2016-11-22 15:30:14,,38,48,TweetDeck,Last chance! Today’s the final day to request tickets to the inauguration of @realDonaldTrump! Get yours today —&gt;… https://t.co/KqnDOUDRpT
800896311960727552,2016-11-22 02:58:55,,26,51,TweetDeck,TOMORROW is the last day to put your name on our list for tickets to inauguration! Get yours on our website —&gt; https://t.co/apM6H9hs6p
800711563619500032,2016-11-21 14:44:47,,8,0,TweetDeck,"RT @goldenstatemade: @DarrellIssa  This week's #MadeInCA #Manufacturer, Ramtech Mfg Inc., is in your district:  https://t.co/28cI0N1ZWD htt…"
800711396421996544,2016-11-21 14:44:08,,18,26,TweetDeck,Want to keep up with the latest on how I’m fighting for you in Washington? Sign up for our e-newletter! 📧 https://t.co/DnarAzgSIW
799677822365265920,2016-11-18 18:17:04,,16,38,TweetDeck,Have you signed up for my e-newletter yet? Stay in the know about how I’m fighting for you! Sign up here —&gt; https://t.co/DnarAzgSIW
799636228522082309,2016-11-18 15:31:48,,211,382,TweetDeck,Just signed on to the VET Bonus Act which will return every penny to veterans forced to repay their bonuses https://t.co/CLKxvYfP85
799296197055942656,2016-11-17 17:00:38,,131,229,TweetDeck,"The House of Representatives just passed my bill to stop last-minute, unaccountable regulations. Statement here —&gt;… https://t.co/7yMg3vdM3a"
799295145157898241,2016-11-17 16:56:27,,109,0,TweetDeck,"RT @SteveScalise: Unaccountable, last-minute regulations from the Obama Admin don't serve the will of the people. @DarrellIssa's bill stops…"
799294636170711040,2016-11-17 16:54:26,,78,0,TweetDeck,"RT @HouseJudiciary: ✅ #MidnightRules Relief Act, sponsored by @DarrellIssa, passes the House! Helps relieve regulatory burden from outgoing…"
799290241223901188,2016-11-17 16:36:58,,32,45,TweetDeck,Want to attend the inauguration of our 45th president? We have tickets! Request on our website. Space is limited! —… https://t.co/qXUWP0ym6h
799263375150694400,2016-11-17 14:50:12,,26,0,TweetDeck,"RT @cspan: U.S. House: Midnight Rules Relief Act, sponsored by @darrellissa – LIVE on C-SPAN https://t.co/93jqSK7gtM https://t.co/MI6pTsdClD"
798947539357749248,2016-11-16 17:55:11,,4,0,Twitter for iPhone,RT @CTATech: .@DarrellIssa @MOhlhausenFTC @abdavidson &amp; more joined us at #CTAInnovationHouse to talk IoT under Trump Admin. https://t.co/W…
798910818339332100,2016-11-16 15:29:16,,6,0,TweetDeck,"RT @GaryShapiro: After the election, so glad to see bipartisan agreement on tech and IoT. #CTAInnovationHouse @RepDelBene and @DarrellIssa…"
798910262593994752,2016-11-16 15:27:04,,34,55,TweetDeck,Want tickets to the inauguration of @realDonaldTrump? We have a limited number of tickets! Info on my website -&gt;… https://t.co/qGXAZZFir7
798889467364970497,2016-11-16 14:04:26,,5,0,TweetDeck,"RT @CTATech: ""The best and the brightest can collaborate, but we need to bring them into the U.S. to innovate. Our system is broken."" - @Da…"
798889440945041408,2016-11-16 14:04:20,,7,0,TweetDeck,RT @CTATech: A great discussion with @GaryShapiro @RepDelBene @DarrellIssa about IoT at the #CTAInnovationHouse https://t.co/ed8ThzH10A
798627889683963904,2016-11-15 20:45:01,,80,155,TweetDeck,"Regulating should be done open, right and early, not last-minute by Presidents on the way out. My bill will fix it 👉https://t.co/ifU7ELxGPb"
798599915718877184,2016-11-15 18:53:51,,125,232,TweetDeck,Regulations shouldn’t be rammed through last-minute by outgoing Presidents. My bill this week will help stop it —&gt; https://t.co/kcMGoBy3Mb
798536906476818432,2016-11-15 14:43:29,,72,0,TweetDeck,RT @HouseJudiciary: Bill to overturn last Obama regulations heads to House floor #midnightrules #BetterWay cc: @DarrellIssa https://t.co/X7…
798267066763669504,2016-11-14 20:51:14,,134,0,TweetDeck,"RT @HouseGOP: With a unified government, we can get to work and tackle the issues that matter most to the American people. #BetterWay"
798191056999354368,2016-11-14 15:49:12,,18,32,TweetDeck,Concerned about the growth of sober living homes? Check out my op-ed in the @ocregister for our solution https://t.co/9xndu84zwb
797170645025095680,2016-11-11 20:14:27,,93,296,TweetDeck,Happy Veterans Day to all our brave heroes who've selflessly served and continue to serve our great nation. Thank y… https://t.co/v4ydWWuIOi
794615198749429760,2016-11-04 19:00:01,,27,89,TweetDeck,"Coordinated a meeting with Solana Beach, Encinitas, and Army Corp to discuss local projects and how we can help exp… https://t.co/KwJVQumPCX"
794575200914313218,2016-11-04 16:21:05,,14,54,TweetDeck,From the opening of the new FedEx facility in Oceanside! #jobs #theworldontime https://t.co/JDZ9OrJX7C
794380740297453569,2016-11-04 03:28:22,,47,210,TweetDeck,Humbled with the honor of presenting Srgt. Scott Wolf with the Oceanside Veteran of the Year Award this week! Thank… https://t.co/WOIzpZiMzU
793896139409985536,2016-11-02 19:22:44,,300,405,TweetDeck,"Take the bonuses from VA execs and return to our national guard.

https://t.co/Gd4csT4x2C"
793887321112403968,2016-11-02 18:47:41,,119,202,TweetDeck,Great write up from @thehill on my efforts to get our soldiers who unfairly paid back their bonuses repaid in-full https://t.co/aRqTwJo9T2
793849832855048192,2016-11-02 16:18:43,,33,93,TweetDeck,Here’s the letter I received from @cityofsjc endorsing my bill for Sober Homes Reform. Glad to advance a solution t… https://t.co/wBozrtwKeR
793653927254323200,2016-11-02 03:20:16,,31,128,TweetDeck,Glad to have the endorsement of the City of San Juan Capistrano for my bill to reform sober living homes —&gt; https://t.co/RFhoD8t0GB
793551781993254912,2016-11-01 20:34:22,,84,145,TweetDeck,Received a firm commitment from the San Diego VA director to fix the issues you all submitted! More here —&gt; https://t.co/AcA4iGXnfZ
793519478185291776,2016-11-01 18:26:01,,50,99,TweetDeck,"Working with Army Corp and City of Ocenaside to ensure the process is improved in 2017

https://t.co/Tvhcg5m6Di"
793492621708713984,2016-11-01 16:39:18,,1276,1825,TweetDeck,Copy of the letter I sent today demanding DoD repay the bonuses our soldiers unfairly paid back 👇 https://t.co/1HQ1CnBxIo
793488746742251521,2016-11-01 16:23:54,,391,562,TweetDeck,I’m calling on @DeptofDefense to return monies to the soldiers who were forced to repay their bonuses —&gt; https://t.co/80TMKmGR8G
