id,created_at,coordinates,retweets,favorite_count,source,text
713437056500965382,2016-03-25 18:47:03,,6,0,Twitter for iPhone,"RT @ReThinkRights: “#NSA’s mission has never been, and should never be, domestic policing or domestic spying.” @tedlieu &amp; @farenthold https…"
713186622322434049,2016-03-25 02:11:55,,1,0,Twitter for iPhone,RT @dennis_merritt: @AJCRadio @farenthold thanks for you for the interview. Very informative and thought provoking. https://t.co/oZ1rdqd0Ht
713157959736373248,2016-03-25 00:18:02,,1,2,TweetDeck,The bill would ensure Cuban immigrants are held to the same immigration standards as nationals of other countries https://t.co/YXLGyUR231
712750032852680704,2016-03-23 21:17:04,,1,2,TweetDeck,Second Patent Troll Bill Introduced in as Many Weeks @MorningConsult https://t.co/6ETISGUoHk
712732935229546498,2016-03-23 20:09:08,,3,0,TweetDeck,Lawmakers say NSA plan to expand sharing data ‘unconstitutional’ @PeninsulaQatar https://t.co/YwW9OEGBY2
712717309207400448,2016-03-23 19:07:02,,1,1,TweetDeck,Antitrust Regulation Is Getting A Bit Smarter @Forbes https://t.co/mLRFZ7penq
712700549947342849,2016-03-23 18:00:27,,0,1,TweetDeck,The state of Texas is already seeing a 60 percent increase in migrants attempting to enter the state from Cuba https://t.co/YXLGyUzrbt
712677183542706176,2016-03-23 16:27:36,,1,1,TweetDeck,"PRESS RELEASE: Farenthold, Cuellar Introduce the CUBA Act https://t.co/YXLGyUzrbt"
712673719773184001,2016-03-23 16:13:50,,2,0,TweetDeck,Another reason we need to pass my YODA bill https://t.co/hfGoRaZ5C6
712657441352204289,2016-03-23 15:09:09,,5,0,TweetDeck,"RT @HouseJudiciary: BREAKING: #SMARTERact passes House, 235-171.

@RepGoodlatte, @RepTomMarino, @farenthold praise passage: https://t.co/CD…"
712642323470016512,2016-03-23 14:09:04,,3,2,TweetDeck,SMARTER Act is strongly supported by @johncornyn @chuckgrassley @senmikelee @senorrinhatch @sencaptio who’ve introduced it in the Senate.
712641431660281857,2016-03-23 14:05:32,,1,0,TweetDeck,This bill requires FTC to litigate the merits of contested merger cases in federal court under the Clayton Act—just as DOJ does.
712641306938511360,2016-03-23 14:05:02,,0,1,TweetDeck,This bill requires the FTC to satisfy the same standards that DOJ must meet in order to obtain a preliminary injunction to block a merger.
712639777087037441,2016-03-23 13:58:57,,1,1,TweetDeck,The SMARTER Act prevents the FTC from using costly administrative proceedings to prevent a merger once it’s been approved in a federal court
712639548103245824,2016-03-23 13:58:03,,1,1,TweetDeck,The SMARTER Act requires the FTC and DOJ to use the same standards when blocking a merger.
712636415029411840,2016-03-23 13:45:36,,0,1,TweetDeck,"My bill, the SMARTER Act, is coming to a House vote today. I encourage my colleagues to vote for this commonsense bill."
712389166114299904,2016-03-22 21:23:07,,0,0,TweetDeck,Abusive patent litigation is a drag on our economy and it stifles innovation https://t.co/wSwL8WUIFR
712382314374946817,2016-03-22 20:55:53,,3,0,TweetDeck,RT @RepCardenas: Rep. @Farenthold and I are protecting American businesses &amp; bringing balance back to ITC by fixing an outdated law https:/…
712373933647986688,2016-03-22 20:22:35,,3,1,TweetDeck,Patent trolls who do not make or sell any products buy patents and then sue American employers for products already being manufactured.
712373445053587459,2016-03-22 20:20:39,,7,4,TweetDeck,Today @RepCardenas and I introduced a bill to stop patent trolls from exploiting an outdated law https://t.co/wSwL8WD7Oj
712362793710837761,2016-03-22 19:38:19,,1,1,TweetDeck,I urge my colleagues in the Senate to do the right thing and pass the WASP AIR Act https://t.co/4xH7OCpQR6
712327747138232320,2016-03-22 17:19:03,,0,2,TweetDeck,Today I spoke on the House floor to honor the 75th anniversary of the NASCC https://t.co/xpufry6fZ7
712310361215492096,2016-03-22 16:09:58,,0,1,TweetDeck,"As officials complete a thorough investigation, I extend my prayers to those affected by these awful events https://t.co/VM4mmkEzfC"
712309444542111745,2016-03-22 16:06:20,,7,0,TweetDeck,RT @USHousefeeds: Farenthold Statement on Terrorist Attack in Brussels https://t.co/FItFGbNFpv
712270038816972800,2016-03-22 13:29:45,,2,4,TweetDeck,"The Indy 500 trophy was in the Capitol today. Based on driving, it should be my wife in this picture not me. https://t.co/xo1cVLyF1h"
712004966953689090,2016-03-21 19:56:27,,0,1,TweetDeck,"OTD in 1928, Lindbergh was presented Medal of Honor for 1st trans-Atlantic flight. Probably better service than some of today's flights!"
711972256201777152,2016-03-21 17:46:28,,2,4,TweetDeck,It’s American Chocolate Week. What’s your favorite? I'm Tootsie Roll man myself.
711971785412112384,2016-03-21 17:44:36,,1,0,TweetDeck,RT @UHVictoria: @UHVPresident receives a Certificate of Congressional Recognition from @farenthold. https://t.co/hzyhZOGfB6 https://t.co/WE…
711903611618521088,2016-03-21 13:13:42,,2,2,TweetDeck,On air: Caller: call a spade a spade. Political correctness is hurting our country.
711895048389001217,2016-03-21 12:39:40,,2,1,TweetDeck,"On air: discussing the $$$ that went ""missing"" at the State Dept under Sec. Hillary Clinton"
711891427173797888,2016-03-21 12:25:17,,5,3,TweetDeck,"If you're a veteran having issues with the VA, call my Red Tape Cutters for help. (361) 884-2222 in Corpus or (361) 894-6446 in Victoria"
711887821695483904,2016-03-21 12:10:57,,2,1,TweetDeck,On air talking about this story: Justice Department warns local courts about unlawful fines and fees &amp; states rights https://t.co/p6oPzZaIKX
711877204284723200,2016-03-21 11:28:46,,2,0,TweetDeck,On air with @seatonmotley discussing less government = better government. Agencies like FCC don't like free market where things work better
711875750224404480,2016-03-21 11:22:59,,2,0,TweetDeck,"On air: We're discussing my bill, the SMARTER Act, coming to the House floor this week, that fixes merger issues with FTC &amp; DOJ"
711874124457578496,2016-03-21 11:16:31,,3,2,TweetDeck,On air: 1/3 of Tea Party members came to Congress and realized they aren't getting Congress fixed as quickly as they wanted #stillfighting
711873255917940737,2016-03-21 11:13:04,,3,4,TweetDeck,"I'm not giving up yet: I'm here to cut spending in Congress. If the Tea Party gave up, our country would be worse off today."
711872320164515841,2016-03-21 11:09:21,,1,0,TweetDeck,I'm in for Jim Lago on Lago in the Morning. You can also listen online https://t.co/qkD9BdCMur  @1360KKTX
711422985798864897,2016-03-20 05:23:52,,2,2,Twitter for Android,They rock.   Power just came back on.   Thanks @AEPTexas folks.  https://t.co/AYzpcLcKOk
711388560335708163,2016-03-20 03:07:04,,6,3,Twitter for Android,Fingers crossed. I'm reminded most things I like to do require require power #computergeek https://t.co/nAWHJuRRzt
711385573840265217,2016-03-20 02:55:12,,0,4,Twitter for Android,. @AEPTexas says I won't have power until noon Monday after a thunderstorm last night. REALLY?  #GridVulnerability symptom?
710944878440681474,2016-03-18 21:44:02,,3,1,TweetDeck,Congratulations to Lt. General Marc Cisneros for receiving the Daughters of the American Revolution Medal of Honor https://t.co/YS84R2f5pY
710851897155063808,2016-03-18 15:34:33,,0,1,TweetDeck,South Texas veteran to be honored with award @KRIS6News https://t.co/8SamT6WgYu
710807996347985921,2016-03-18 12:40:07,,1,0,TweetDeck,H. Res 639 will lend an important voice to those who have fought against the institution https://t.co/sfXpkV0sLo
710550787991035904,2016-03-17 19:38:03,,1,1,TweetDeck,".@POTUS has consistently pushed his open borders, pro-amnesty policy, disregarding Article II of the Constitution https://t.co/sfXpkV0sLo"
710535931053285376,2016-03-17 18:39:01,,1,1,TweetDeck,"Just as @POTUS must uphold his duties under Article II, Congress must also defend its duties under Article I https://t.co/sfXpkV0sLo"
710520313365319682,2016-03-17 17:36:58,,1,2,TweetDeck,US v. Texas will establish case precedent for future presidents &amp; their authority to issue executive actions https://t.co/sfXpkVi49Y
710499352465297408,2016-03-17 16:13:40,,1,5,TweetDeck,Playing it safe today and wearing green #HappyStPatricksDay https://t.co/9ZXXo4ef8i
710488826465153024,2016-03-17 15:31:51,,0,0,TweetDeck,"@AParra210 If we're disc. the cross being built by a church on private land, I fully support religious freedom and attended groundbreaking."
710438297852489730,2016-03-17 12:11:04,,2,3,TweetDeck,H.R. 4731 will allow screeners to check refugees' social media postings before being approved to come in the US https://t.co/EndvsNNG3C
710241759071068161,2016-03-16 23:10:05,,1,3,TweetDeck,Local officials should decide if refugee resettelement is in best interest of their communities. This bill does that https://t.co/EndvsNNG3C
710223957442600960,2016-03-16 21:59:21,,3,3,TweetDeck,Today I questioned the VA about outdated systems and veteran calls going to voicemail https://t.co/uuCCj8Gk7f
710186518095106049,2016-03-16 19:30:35,,5,3,TweetDeck,I hope the Senate takes a strong stand against a nominee that has shown he is no friend to the 2nd Amendment https://t.co/YF77Nt9YeX
710161006203412481,2016-03-16 17:49:12,,1,0,TweetDeck,Last time Supreme Court nominee was confirmed in a presidential election year (w/ diff parties in control) was 1880 https://t.co/YF77NtrzDx
710159159728214016,2016-03-16 17:41:52,,0,0,TweetDeck,"@MikeWolfe1240 This was in Ft. Meade, Maryland."
710061282444107776,2016-03-16 11:12:56,,5,3,TweetDeck,"Check out this homework a mom sent us 4 6th grader in MD calling GOP bullies while ""Democrats don't insult e/other"" https://t.co/soZaz0ljq3"
709532212631248896,2016-03-15 00:10:36,,1,0,Twitter for iPhone,RT @GaryShapiro: Excited to honor Rep Blake @Farenthold and Sen @CoryBooker at @CTATech’s #DigitalPatriots dinner on 4/20 https://t.co/txtf…
709349499563544576,2016-03-14 12:04:34,,0,0,Twitter for iPhone,"I'm on Lago in the Morning. Tune in now @1360KKTX Give me a call, let's talk about what's on your mind. Listen live: https://t.co/VbfxNh3XR7"
709158904546992129,2016-03-13 23:27:13,,3,0,Twitter for Android,RT @ZacharyGraves: .@farenthold counsel @ilusasha addressing cybersecurity and autonomous vehicles. https://t.co/GaeM7FEWLt
709124798455136256,2016-03-13 21:11:41,,0,1,Twitter for iPhone,"My Policy Counsel, Sasha, will be talking about autonomous vehicle regulation to at 5p #sxsw2016"
709030648770498560,2016-03-13 14:57:34,"{u'type': u'Point', u'coordinates': [-95.34138889, 29.98444444]}",3,3,Instagram,Debbie and I just welcomed President Ma Ying-jeou of Taiwan to Texas at IAH. @ George Bush… https://t.co/ncEESru3o5
708806336063131654,2016-03-13 00:06:14,,1,1,Twitter for iPhone,Talking encryption at @CenDemTech @RSI w/ @DarrellIssa @sfmnemonic
708803674391318529,2016-03-12 23:55:39,,7,0,Twitter for iPhone,"RT @DW_Grant: ""There is no middle ground in crypto."" @farenthold at @CenDemTech #SXSW2016 https://t.co/mXGMj81Qr3"
708803542270808064,2016-03-12 23:55:08,,3,0,Twitter for iPhone,"RT @CTATech: For more videos of @farenthold talking #encryption add ""CTAOfficial"" on Snapchat https://t.co/ti8pPgrdQl"
708749347530235904,2016-03-12 20:19:47,,3,2,Twitter for Android,At #sxsw panel on How to Disrupt Government with @RepBillFlores  Ron @DataFoundry Chris T @Dell and @TrumbullUAS CEO/Founder
708713983021338626,2016-03-12 17:59:15,,1,1,Twitter for iPhone,"My daughter, Morgan, and I met with Uber today to discuss the banning in Corpus Christie https://t.co/FkGdfC3743"
708513348850089985,2016-03-12 04:42:00,,27,0,Twitter for Android,RT @_gracelizabeth: My notes from @Infosecjen @amatwyshyn @panjwaniPK @farenthold #sxsw talk on The Internet of Things #iot https://t.co/FH…
708448325020868609,2016-03-12 00:23:37,,2,2,Twitter for iPhone,#SXSW2016 @Infosecjen @amatwyshyn @panjwaniPK https://t.co/EUD53WVYfI
708431141208985600,2016-03-11 23:15:20,,2,1,Twitter for iPhone,Speaking on the Internet of Things and copyright #SXSW2016 https://t.co/mrewCvvK3x
708424735692959744,2016-03-11 22:49:53,,3,0,Twitter for Android,RT @amatwyshyn: At @sxsw? Join us for our IoT security panel in JWM Salon 5. We have a creepy monkey. https://t.co/aLVxF3JVXr
708424006475513856,2016-03-11 22:46:59,,0,2,Twitter for Android,Speaking soon (5p) at #sxsw  on the Internet of things (#YODAact) in JW Marriott Salón 5 https://t.co/sQObFUwZnk
708418849486426113,2016-03-11 22:26:30,,0,0,Twitter for Android,Met @united social media team at #sxsw.  So nice.  Feel bad about snarkey tweets like https://t.co/mymMYxXbOI https://t.co/6kPg1gzXP4
708414638736560128,2016-03-11 22:09:46,,2,1,Twitter for Android,#sxsw Panel on ICANN with @mrcjdawson @RepDelBene &amp; former @farenthold staffer @rachelwolbers https://t.co/62YJHdfLct
708390062036164608,2016-03-11 20:32:06,,3,4,TweetDeck,"Rest in Peace, Nancy Reagan. You were a true light and inspiration. https://t.co/72xQtq5Lkw"
708389485625499648,2016-03-11 20:29:49,,2,0,Twitter for Android,RT @AustinChamber: Business roundtable discussion today w/ Congressman Blake @farenthold! https://t.co/rL2PVyUtXD
708387201244073985,2016-03-11 20:20:44,,0,2,TweetDeck,Talking Internet of Things #SXSW2016  at 5p about how tech and mobile/wearable devices shape our lives &amp; the data being generated about us
708374971429613568,2016-03-11 19:32:08,,3,0,Twitter for iPhone,"Talking encryption, patent reform and national security at #SXSW2016 https://t.co/LVJYb8iASA"
708314417344200704,2016-03-11 15:31:31,,1,0,TweetDeck,RT @reporterbianca: Youth ask congressman what he's doing now to protect their futures https://t.co/9aBrA2wzpK @Vicadvocate @Elect_Blake #t…
708091764649885696,2016-03-11 00:46:47,,0,0,Twitter for iPhone,"There's a large turn out at the Victoria town hall. If you're on your way, we've moved to room 203 at the Emerging Technologies Center."
708091407060246528,2016-03-11 00:45:21,,0,0,TweetDeck,Donated another box of books today from the Surplus Book Program. This time to FW Gross Elementary. https://t.co/ZWNIMfuUFg
708080302497931264,2016-03-11 00:01:14,,0,3,TweetDeck,I met some great 5th graders at FW Gross Elementary today to talk about my role in Congress https://t.co/QpietVl0xq
708036795347378176,2016-03-10 21:08:21,,4,3,TweetDeck,One year later: fact checking Hillary Clinton’s claims regarding her private email server https://t.co/3Rp6wIJEPI
707994855092461569,2016-03-10 18:21:42,,0,1,TweetDeck,Donated a box of books to Wharton High School today as part of the Surplus Book program at the Library of Congress. https://t.co/L9JoW2j1MM
707980124440940544,2016-03-10 17:23:09,,1,0,TweetDeck,Great questions from high schoolers at Wharton Senior today for “Congress in the Classroom.” Thanks for having me! https://t.co/Hvl7xLpOBi
707970790533283841,2016-03-10 16:46:04,,0,1,TweetDeck,Join me at my town hall in El Campo in 45 minutes https://t.co/inyTUdjbmF
707719701946826752,2016-03-10 00:08:20,,0,3,TweetDeck,My town hall in Corpus Christi starts in 25 minutes. See you there. https://t.co/inyTUdjbmF
707719497264852992,2016-03-10 00:07:31,,1,0,TweetDeck,RT @WhartonTxCOC: Crongressman Blake Farenthold - Town Hall Meeting https://t.co/vRrS3DCsaI
707653198929002496,2016-03-09 19:44:04,,4,7,TweetDeck,"""Patent system overrun w/ trolls” is why I intro. bill to combat frivolous suits needlessly costing Americans $$$$ https://t.co/tNt37XnkHy"
707633056346038272,2016-03-09 18:24:02,,2,3,TweetDeck,Previously deported immigrant arrested in Missouri after manhunt following 5 killings https://t.co/6vrDj2Ieay
707602623176646658,2016-03-09 16:23:06,,0,0,TweetDeck,"OTD in 1936, REA set up electricity to rural Texas for the first time."
707587073725698049,2016-03-09 15:21:19,,1,0,Twitter for Windows,RT @GaryShapiro: Save the date: Sen. @CoryBooker &amp; Rep. Blake @farenthold will be honored as @CTATech #DigitalPatriots on 4/20! https://t.c…
707323819963371520,2016-03-08 21:55:14,,0,2,TweetDeck,"OTD in 1798, Matthew Caldwell, “Paul Revere of the TX Revolution,” was born. He rode from Gonzales to Bastrop to call men to arms."
707282204024545280,2016-03-08 19:09:52,,1,0,TweetDeck,RT @HouseScience: Proud #NucleaR&amp;D #HR4084 cosponsors: @RepJohnCarter @ConawayTX11 @RepKenMarchant @farenthold @SteveKnight25 @congbillposey
707220932268564480,2016-03-08 15:06:24,,12,0,TweetDeck,RT @GaryShapiro: Just announced: Sen. @CoryBooker &amp; Rep. Blake @Farenthold to be honored as @CTATech #DigitalPatriots on 4.20. More to come!
706878356571074561,2016-03-07 16:25:08,,0,0,TweetDeck,"Join me for one of my upcoming town halls! 
https://t.co/9jYkl85F1X…/march-2016-town-halls.htm https://t.co/OSdTQgCB8t"
706852017080295425,2016-03-07 14:40:28,,4,2,TweetDeck,"Sad to learn of passing of tech pioneer Ray Tomlinson, email inventor and selector of @ symbol. https://t.co/7vfY1UosP7"
706528071806009344,2016-03-06 17:13:13,,4,4,TweetDeck,Nancy Reagan will be remembered for her devotion to the country and her efforts to help those in need.  She was a true inspiration.
706139614831091712,2016-03-05 15:29:38,,6,4,TweetDeck,"The evidence is there. It's time to appoint special counsel to investigate Clinton.
https://t.co/BbLrQL2pdu"
705730287246794754,2016-03-04 12:23:06,,1,1,TweetDeck,ICYMI: the FDA is creating a defacto monopoly w/ lengthy generic approval process https://t.co/g6u8R6aH1O
705467907438993410,2016-03-03 19:00:30,,0,0,TweetDeck,"Good job, Ace! 11-year-old from Bishop, TX, beats Tiger Woods on Woods-designed golf course https://t.co/v6W0FArIMj"
705117421674299392,2016-03-02 19:47:48,,1,2,TweetDeck,Helping Calhoun Port Authority with the Corps of Engineers Work Plan for needed channel dredging and other issues. https://t.co/6t2DO9cGCU
705101374267092992,2016-03-02 18:44:02,,8,3,TweetDeck,You wouldn’t let a doc who lost license (2x) perform a biopsy. Why allow him to perform abortions? Uphold Texas law. https://t.co/6Xx8YFcC3R
705070340163166208,2016-03-02 16:40:43,,7,11,TweetDeck,"OTD in 1836, Texas was proudly proclaimed a republic indep. from Mexico. You're either born here or wish you were. https://t.co/MSlIMAHSAD"
704797387093446656,2016-03-01 22:36:06,,0,1,TweetDeck,Lets honor the accomplishments of women throughout history and those making history for the next generation. #WomensHistoryMonth
704763170670247937,2016-03-01 20:20:08,,1,1,TweetDeck,The Midnight Rule was marked up today. I look forward to it coming to the House floor so I can vote on it.
704740018774892544,2016-03-01 18:48:08,,2,1,TweetDeck,"Need to work on cures, not push abortion for Zika virus. Some children of affected mothers born healthy @CSNewsroom https://t.co/I1uHOUJcXf"
704715071746871296,2016-03-01 17:09:00,,0,2,TweetDeck,"ICYMI: Widening and deepening of Port of Corpus Christi on track, prime candidate for funding in next budget cycle https://t.co/qsFzFTcrsp"
704431120415326208,2016-02-29 22:20:41,,2,0,Twitter for Android,RT @tperkins: Live: We're talking w/@farenthold about the letter he sent to the UN about the #ZikaVirus -&gt; https://t.co/5dhxgyk1ux https://…
704372321805606918,2016-02-29 18:27:02,,4,0,TweetDeck,RT @NAIFAAdvocacy: .@NAIFAAdvocacy in action!  Rolando Barrera meets w/ @farenthold on getting the @USDOL #fiduciary rule right! https://t.…
703985330223841280,2016-02-28 16:49:16,,0,1,TweetDeck,FYI @chessmanatx I was last in Bastrop Jan 19 https://t.co/u1yy88JXNA and will be back tomorrow.
703331272714616832,2016-02-26 21:30:17,,4,0,TweetDeck,RT @MikeKellyPA: Very proud to co-sign letter to #UN Human Rights Commissioner stating that abortion is NOT the answer to #ZikaVirus: https…
703331238556393475,2016-02-26 21:30:09,,1,0,TweetDeck,RT @virginiafoxx: House Members to UN Official: ‘Abortion is Not the Answer to Zika Virus’ - https://t.co/PMM9WdLRBO
703314860046573568,2016-02-26 20:25:04,,1,1,TweetDeck,ICCPR prohibits death penalty for pregnant women. Unborn children have life interest independent from  the mother. https://t.co/ZfKqENULuB
703283772326866944,2016-02-26 18:21:32,,1,1,TweetDeck,We are urging the UN High Commissioner to immediately clarify his statement https://t.co/ZfKqEOcmTb
703283551337320449,2016-02-26 18:20:39,,0,1,TweetDeck,UN taking pro-abortion stance rather than encouraging thoughtful deliberation on how to best curb the spread of Zika https://t.co/ZfKqEOcmTb
703252966438899712,2016-02-26 16:19:07,,1,2,TweetDeck,I’m a cosponsor of @RepChrisSmith H.R. 3515 Dismemberment Abortion Ban Act. I want those performing mutilation abortions punished. #prolife
703229750014255104,2016-02-26 14:46:52,,3,7,TweetDeck,"I, along with 50 House members, sent a letter to the UN telling them abortion is not the answer to the Zika virus. https://t.co/ZfKqEOcmTb"
703192307332308992,2016-02-26 12:18:05,,4,2,TweetDeck,"I'm a cosponsor of H.R. 3515, the Dismemberment Abortion Ban Act. I’m continuing to fight against violence to unborn children."
702961555810332672,2016-02-25 21:01:09,,1,5,TweetDeck,I’m cosponsoring the Midnight Rule Relief Act to stop the spending spree of lame duck presidents #CostControl https://t.co/2PXV4Oj3MD
702950219156041728,2016-02-25 20:16:07,,4,3,TweetDeck,I cosponsored and voted for the Muslim Brotherhood Terrorist Designation Act of 2015. Need to keep Americans safe and extremists out.
702939147002998784,2016-02-25 19:32:07,,3,2,TweetDeck,"OTD in 1976, U.S. Supreme Court rules that states may ban the hiring of illegal aliens."
702931583037259777,2016-02-25 19:02:03,,1,1,TweetDeck,"180 years ago today, Samuel Colt patented the first multi-shot revolving cylinder firearm. https://t.co/lelOfgklvh https://t.co/PnynmZl06V"
702881391499943937,2016-02-25 15:42:37,,242,0,Twitter Web Client,RT @HouseBenghazi: It’s time for the administration to turn over the records this committee requested nearly a year ago: https://t.co/SIwX6…
702641361774899200,2016-02-24 23:48:49,,0,1,TweetDeck,"Farming on my mind, I met with Scott Frazier, Bob Reed &amp; other Farm Bureau reps to discuss Ag issues, trade, and EPA’s horrible regulations."
702627333392302080,2016-02-24 22:53:05,,0,0,TweetDeck,Today I met with the USACE to discuss red tape holding back funding for the CC Port widening &amp; deepening  https://t.co/aZVFSca7F4
702627109970251777,2016-02-24 22:52:11,,1,0,Twitter for Android,RT @IslandCampus: ROTC Islander Battalion Leadership Forum Features U.S. Rep. @farenthold https://t.co/tQ8GhlaFkn https://t.co/0ILUmeT4Td
702610105410445314,2016-02-24 21:44:37,,2,1,TweetDeck,PRESS RELEASE: Rep. Farenthold Meets with US Army Corps of Engineers https://t.co/aZVFScrJ3E https://t.co/q8hkgeIOkg
702580057794023424,2016-02-24 19:45:13,,1,0,TweetDeck,RT @tddunne: Thank you Congressman  Farenthold for sponsoring the MLTS bill HR4163 #911GTW https://t.co/lLBMs0Ku05
702187508357009408,2016-02-23 17:45:22,,4,1,TweetDeck,".@POTUS signed the NDAA for the last 5 years, which contains language making it illegal to close Guantanamo Bay. https://t.co/Rn8w4DYOJz"
701860506483748864,2016-02-22 20:05:59,,2,3,TweetDeck,We’re getting more local doctors and hospitals signed up for VA Choice so veterans have more options for healthcare https://t.co/ntNuEL4SHZ
701851969791459328,2016-02-22 19:32:04,,0,0,TweetDeck,"OTD in 1980, the U.S. Olympic hockey team made a miracle on ice by defeating the Soviet hockey team."
701821529332396032,2016-02-22 17:31:06,,1,2,TweetDeck,"92 years ago today, President Coolidge delivered the first Presidential radio broadcast from the White House."
701814390715191296,2016-02-22 17:02:44,,0,1,TweetDeck,"If you’re struggling with the VA, PLEASE call my office. Here is just one veteran my staff and I were able to help https://t.co/H4mdKNzlyL"
701791290204229632,2016-02-22 15:30:56,,1,1,TweetDeck,"OTD in 1885, the Washington Monument was dedicated in Washington D.C."
700769086318333952,2016-02-19 19:49:04,,1,4,TweetDeck,"OTD in 1846, the first Legislature of the state of Texas is convened in Austin, after agreeing to join the U.S. Marking 170 yrs of statehood"
700753470014488577,2016-02-19 18:47:01,,0,4,TweetDeck,Incredibly saddened by Harper Lee’s death. She inspired many with “To Kill a Mockingbird.” I’ll always remember the lessons of justice.
700352398196412416,2016-02-18 16:13:18,,3,4,Twitter for iPhone,".@whitehouse If you're golfing during Scalia’s funeral, then the Senate should take a mulligan on your SCOTUS pick https://t.co/lvvVTgOono"
700334918132441088,2016-02-18 15:03:50,,0,2,Twitter for iPhone,"71 years ago today, U.S. Marines stormed ashore the island of Iwo Jima to free the Pacific island from Japanese occupation."
699995568861548546,2016-02-17 16:35:23,,3,2,TweetDeck,"OTD in 1801, electoral tie between Thomas Jefferson &amp; Aaron Burr was resolved when Jefferson was elected President by the U.S. House of Rep."
699814559897513984,2016-02-17 04:36:07,,5,1,Twitter for iPhone,This is unacceptable and we will be working in Congress to put an end to this! https://t.co/2Cyttv44Ft
699729042493337600,2016-02-16 22:56:18,,2,5,TweetDeck,Today I spoke to ROTC cadets about leadership. Thank you for inviting me. https://t.co/DrKIf9l9XL
699714961786798080,2016-02-16 22:00:21,,0,1,TweetDeck,Join me at 5:30 CST for a VA healthcare town hall at TAMUCC. We'll discuss VA benefits and make suggestions to the new VA interim director.
699699905468583936,2016-02-16 21:00:31,,0,0,TweetDeck,"At 4:30 CST I'll be attending the Military Veteran Peer Network at TAMUCC, providing info &amp; services to veterans."
699627638869123072,2016-02-16 16:13:22,,1,1,TweetDeck,"OTD in 1968, the first 9-1-1 emergency telephone system went into service, creating easy access between the public and authorities."
699566469739257857,2016-02-16 12:10:18,,2,0,TweetDeck,Since yesterday was a holiday I'm on @1360KKTX with Lago today.  Listen live at https://t.co/CzYgSGTXEs
