id,created_at,coordinates,retweets,favorite_count,source,text
471296442741837824,2014-05-27 14:26:42,,2,0,TweetDeck,RT @OnPointRadio: 'The current formula for funding USPS retirement plans is not actuarially sound.' @farenthold http://t.co/eoR2ymlMrT
471295826137194497,2014-05-27 14:24:15,,1,0,TweetDeck,RT @OnPointRadio: 'We don't see privatization of the Post Office in our future.' @farenthold http://t.co/eoR2ymlMrT
471294278363537408,2014-05-27 14:18:06,,1,0,TweetDeck,RT @OnPointRadio: 'Cluster boxes give you a place to secure packages at your home.' @farenthold http://t.co/eoR2ymlMrT
471291325137305600,2014-05-27 14:06:22,,3,2,Twitter Web Client,About to appear on @NPR @OnPointRadio to talk commonsense reforms to restore #USPS to fiscal solvency. Listen LIVE: http://t.co/m5UnxybmRc
471251999246147584,2014-05-27 11:30:06,,3,0,Twitter for iPhone,"RT @OnPointRadio: Today, guest host @JohnDonvan asks @farenthold and @RepStephenLynch what they’re doing to fix the USPS: http://t.co/eoR2y…"
471142431056863232,2014-05-27 04:14:43,,3,0,Twitter for iPhone,"RT @CrossroadsToday: The rain didn't stop veterans, residents &amp; @farenthold from coming to downtown Victoria to honor our fallen heroes: ht…"
471056287858294785,2014-05-26 22:32:25,,11,12,Twitter for iPhone,"Today on #MemorialDay, we gather to remember the reason we are here, is because they are not. http://t.co/Y0sY6fnNXK"
471040596623110144,2014-05-26 21:30:04,,2,0,Twitter for iPhone,"Today, we join Americans all over to pay tribute to our military heroes. We honor those who bravely fought for the freedoms we enjoy today."
471025492343402496,2014-05-26 20:30:03,,3,1,Twitter for iPhone,"Without those willing to sacrifice everything for freedom, America would not have survived. Nor would it be the nation we call home today."
471012789008748544,2014-05-26 19:39:34,"{u'type': u'Point', u'coordinates': [-97.4269273, 27.801186]}",1,2,Twitter for Android,"Duty, Honor, Country.   Great speech by Nueces County Judge Loyd Neal recalling MacArthur's words this Memorial Day. http://t.co/LuMJxYrVS4"
471011342606819329,2014-05-26 19:33:49,"{u'type': u'Point', u'coordinates': [-97.5302255, 27.8251239]}",1,2,Twitter for Android,Placing wreath at Coastal Bend state Veterans Cemetery. http://t.co/Bxp33z3YJY
471003087599984641,2014-05-26 19:01:01,,2,1,Twitter Web Client,"That tradition continues today. On #MemorialDay, we come together to remember those who sacrificed their lives in defense of our freedoms."
471003003114520576,2014-05-26 19:00:41,,1,1,Twitter Web Client,"#MemorialDay was enacted 3 years after the Civil War. On ""Decoration Day,"" Americans decorated graves of the fallen with US flags &amp; flowers"
470981642362707969,2014-05-26 17:35:48,"{u'type': u'Point', u'coordinates': [-97.0435319, 28.5512315]}",2,0,Twitter for Android,Just finished lunch at American Legion Post 166 in Victoria. Heading to next event in Corpus Christi http://t.co/AX9DrLWqly
470953977484697600,2014-05-26 15:45:52,,4,5,Twitter for iPhone,Thank You to all the men and women in uniform who have sacrificed their lives for our freedom. http://t.co/fQVUN6IghS
470294575886921728,2014-05-24 20:05:39,,1,0,Twitter for iPhone,Getting ready to give the commencement speech for the School of Science and Technology in Corpus Christi. http://t.co/1YTEBBGeeG
469906564657479680,2014-05-23 18:23:50,,6,10,Twitter for iPhone,Corpus Christi should help promote #innovation by fostering ridesharing services like @lyft @Uber
469691209720815618,2014-05-23 04:08:05,,2,1,Twitter for iPhone,"#WRRDA will cut red tape, create jobs and improve Texas ports &amp; waterways. And it's headed to the President's desk: http://t.co/5lJ068I32l"
469643923380391936,2014-05-23 01:00:11,,2,1,Twitter Ads,Now is the time for #USPS to embrace private sector innovation &amp; new products to bring revenue. From today's hearing: http://t.co/b9woXgIbTh
469571035218853888,2014-05-22 20:10:33,,4,1,Twitter Web Client,"Good news for CCAD, NASCC: We voted to reject base closures proposed by WH - reaffirming another round of BRAC is a dead issue in the House"
469515337428647937,2014-05-22 16:29:14,,2,1,Twitter Web Client,Just voted to prohibit furloughs of @CCADPAO employees. Proud to help ensure that hardworking folks at home no longer face unfair furloughs.
469482410653282304,2014-05-22 14:18:23,,3,2,Twitter Web Client,I'm chairing Oversight Postal subcmte hearing to hear from #USPS &amp; private sector on efforts to develop new postal products for 21st century
469480881007394816,2014-05-22 14:12:19,,2,0,Twitter Web Client,RT @GOPoversight: LIVE NOW: Examining Innovative Postal Products for the 21st Century with @farenthold http://t.co/Euo4Mf1Yr0
469272430520074241,2014-05-22 00:24:00,"{u'type': u'Point', u'coordinates': [-77.0219093, 38.899275]}",3,1,Twitter for Android,"Agreed RT @randomrid2: .@farenthold Next order of business #COMBATSTATUS for #FORTHOOD"""
469264410650083328,2014-05-21 23:52:08,,3,3,Twitter for iPhone,The men &amp; women who serve our country deserve the best possible treatment in a timely manner upon their return home: http://t.co/MP9b4G6kgW
469264320355110912,2014-05-21 23:51:47,,4,3,Twitter for iPhone,The House just passed the VA Management Accountability Act to give the VA authority to fire those responsible for the recent abuses reported
469242099561680897,2014-05-21 22:23:29,,2,2,Twitter for iPhone,Do you think VA needs new leadership? Let me know by taking my survey: http://t.co/PWfiFICwxr
469241936331952128,2014-05-21 22:22:50,,2,1,Twitter for iPhone,"The men and women who have served our country defended our freedom, and while we can never repay them we must always respect their service."
469241536056930304,2014-05-21 22:21:14,,2,2,Twitter for iPhone,"Too often veterans have suffered, and even died, because of delays and mismanagement in the VA. Our veterans deserve better."
469241276777639936,2014-05-21 22:20:13,,1,1,Twitter for iPhone,Especially the officials who ordered employees to falsify records to hide long treatment delays.
469240482032549889,2014-05-21 22:17:03,,1,0,Twitter for iPhone,The VA Management Accountability Act cuts red tape to allow the VA to quickly remove ineffective senior officials.
469240178264244224,2014-05-21 22:15:51,,4,1,Twitter for iPhone,The House just acted to hold the VA accountable for its actions by passing H.R. 4031.
469205566938546177,2014-05-21 19:58:19,,0,2,Twitter for iPhone,The VA must be held responsible. Do you think VA needs new leadership? Let me know by taking my survey: http://t.co/uU68dyYx9M
469173107878793216,2014-05-21 17:49:20,,13,3,Twitter Web Client,RT if you agree http://t.co/FZP2tKb4IH
469172118312452096,2014-05-21 17:45:24,,4,2,Twitter Web Client,The mismanagement of the VA has led to the needless suffering of veterans. Our veterans deserve better. RT if you agree.
469171667957469185,2014-05-21 17:43:37,,2,1,Twitter Web Client,"Reportedly, VA senior officials received bonuses and glowing performance reviews for VA management, but we now know of the mismanagement."
469169466988048386,2014-05-21 17:34:52,,2,0,Twitter Web Client,"The bill, H.R. 4031 will cut red tape to allow removal of ineffective VA senior officials quickly."
469168913058889728,2014-05-21 17:32:40,,0,0,Twitter Web Client,"NOW:The House debates the VA Management Accountability Act, a bill I cosponsor to increase #VA accountability."
469138138125049857,2014-05-21 15:30:22,,2,0,Twitter Web Client,#VAScandal reports show employees were encouraged to hide mistreatment of veterans. How do we hold #VA accountable? http://t.co/PWfiFICwxr
469126912934440960,2014-05-21 14:45:46,,0,1,Twitter Web Client,Our bill is a commonsense solution to move us towards a financially sound 21st century Postal Service that meets America's needs.
469126829857845248,2014-05-21 14:45:26,,0,0,Twitter Web Client,"By granting @USPS clusterbox/curbside delivery,our bill allows secure package delivery without affecting those who need door-to-door service"
469119991741435904,2014-05-21 14:18:16,,1,0,Twitter Web Client,"Today in @GOPOversight, we'll consider my bill w/@DarrellIssa to modernize
@USPS mail delivery &amp; increase efficiency http://t.co/pR7I1j10ce"
469108369463050240,2014-05-21 13:32:05,,4,2,Twitter for iPhone,"Today in @GOPOversight, we're considering my bill w/ @DarrellIssa to modernize @USPS delivery &amp; increase efficiency: http://t.co/AuzAgrnaJD"
468973220134395904,2014-05-21 04:35:03,,3,3,Twitter for iPhone,"Tonight, the House passed several anti-trafficking bills in a bipartisan effort to #EndTrafficking. Counting on the Senate to join our fight"
468888341300391936,2014-05-20 22:57:46,,1,0,Twitter Web Client,"Given troubling claims involving the #VA &amp; mistreatment of veterans, how should we hold the VA accountable? SIGN OFF: http://t.co/PWfiFICwxr"
468868204849532928,2014-05-20 21:37:45,,0,0,Twitter Web Client,Efforts have been led in other regions but this is an injustice here at home. We have a moral obligation to work together to #EndTrafficking
468866578243932160,2014-05-20 21:31:18,,3,1,Twitter Web Client,"No child should ever be subjected to this horrifying violence. Sadly, it’s occurring in US every day https://t.co/WnoV6N792M #EndTrafficking"
468866087011250178,2014-05-20 21:29:20,,1,2,Twitter Web Client,An estimated 100000 children are sold in the sex trade in the US each yr: disturbing to grasp not just for our country but our communities
468865486953136129,2014-05-20 21:26:57,,3,2,Twitter Web Client,"Human trafficking robs victims of their basic rights, and it occurs right in our own backyard. We cannot ignore this reality #EndTrafficking"
468864485961515008,2014-05-20 21:22:59,,1,1,Twitter Web Client,We'll also vote to strengthen U.S. laws to ensure those in the sex trade industry are held accountable for their crimes #EndTrafficking
468863657909432320,2014-05-20 21:19:41,,3,0,Twitter Web Client,Our bipartisan efforts will boost victims protections &amp; give law enforcement much-needed resources to help catch traffickers #EndTrafficking
468860024564236289,2014-05-20 21:05:15,,1,2,Twitter Web Client,"Tonight, the House will vote on several measures in a united effort to combat the growing problem of human trafficking #EndTrafficking"
468791098262163456,2014-05-20 16:31:22,,3,0,Twitter Web Client,"Today, the house will vote on first bipartisan water resources reform bill since 2007. Learn more on WRRDA here:  http://t.co/dYgQ45jTk7"
468430124111917057,2014-05-19 16:36:59,,1,1,Twitter Web Client,House Republicans have a plan #4Jobs - see how it helps you: http://t.co/iPrtDqLdQ2
468091370419535872,2014-05-18 18:10:54,,2,1,Twitter for iPhone,Honored to join #NAACP appreciation event for our veterans today in CC &amp; offer our gratitude as a community to those who have served
468078815286407168,2014-05-18 17:21:00,,8,2,Twitter for iPhone,"Happy Birthday to the King of Country - and part time #TX27 resident, @GeorgeStrait!"
467844714734309376,2014-05-18 01:50:46,,3,1,Twitter for iPhone,Honored to greet our veterans arriving for Warriors Weekend. #ICYMI @CrossroadsToday was there to capture the moment: http://t.co/bW5T6xj2SL
467736473962565632,2014-05-17 18:40:40,,5,2,Twitter for iPhone,"Today on Armed Forces Day, we honor the brave heroes who have fought to keep America free and protect and defend us at home and abroad."
467468353679142913,2014-05-17 00:55:15,,3,2,Twitter Web Client,Proud to join today's Warrior's Weekend kickoff to welcome our brave heroes &amp; thank each in person for their service: http://t.co/4kenPXaInW
467069505710333953,2014-05-15 22:30:22,,0,1,Twitter for iPhone,Thank You to our officers in uniform for bravely protecting our country. #peaceofficersmemorialday
466968617977126912,2014-05-15 15:49:29,,0,0,Twitter for iPhone,"NOW: #GYBO w/ @google Today! 
http://t.co/wUEwiXonWr"
466968339500109824,2014-05-15 15:48:22,,0,0,Twitter for iPhone,@google supports small business. RT if you do too. http://t.co/NWfZr55ph3
466637192509411328,2014-05-14 17:52:31,,23,0,Twitter for Android,RT @VisitCCTexas: Great news in the SEA District. LOI signed with Alamo Draft House. Great plans to develop the area. Good news for tourism…
466309420008620032,2014-05-13 20:10:04,,2,2,Twitter for iPhone,"Keep small business growing by going online. May 15, Google will be in Corpus Christi to help you. Sign up today: http://t.co/wUEwiXonWr"
466250593309564929,2014-05-13 16:16:18,,2,0,Twitter Web Client,"Today, I joined several Texas colleagues in calling for IG investigation into mismanagement of Central TX VA clinics: http://t.co/LhTT4s5q2X"
465903349557387265,2014-05-12 17:16:29,,0,0,Twitter Web Client,ICYMI: I appeared on @FoxNews @ANHQDC and discussed the Select Committee on #Benghazi with @ShannonBream: https://t.co/6NLKwMEQ8P
465869520759181312,2014-05-12 15:02:03,,6,1,Twitter Web Client,"In honor of Military Appreciation month, God Bless America and God Bless the men and women who serve to protect it. We Salute You."
465536587816660993,2014-05-11 16:59:06,,0,0,Twitter for iPhone,"COMING UP: I'm on @FoxNews @ANHQDC to discuss the House vote to establish a select committee on #Benghazi. 12 pm CT, tune in!"
465514242347896832,2014-05-11 15:30:18,,3,2,Twitter for iPhone,12 pm CT: I'm on @ANHQDC w/ @ShannonBream to discuss the latest on the select committee to investigate #Benghazi attack. Watch on @foxnews
465508369113956353,2014-05-11 15:06:58,,4,0,Twitter for Android,RT @ShannonBream: #Benghazi - 1pm @FoxNews Rep @Farenthold of House Oversight joins us to talk about Select Committee - Dems in or out?  Wh…
464913936824143872,2014-05-09 23:44:54,,4,1,Twitter for iPhone,http://t.co/pxCsiPailV
464913523001552896,2014-05-09 23:43:16,,3,1,Twitter for iPhone,My Republican colleagues and I are working to ensure students get the best education through the creative teaching charter schools offer.
464829463495057408,2014-05-09 18:09:14,,4,0,Twitter for iPhone,"The House voted and passed H.R. 10, the “Success and Opportunity through Charter Schools Act” to improve the charter school system."
464553822669770752,2014-05-08 23:53:56,,3,2,Twitter for iPhone,"Today, I questioned the proposed @Comcast @TWC merger's potential abuse of programmers competing in the marketplace: http://t.co/yUi5jwQyf1"
464477301108142080,2014-05-08 18:49:52,,0,0,Twitter Web Client,Earlier I participated in a @housejudiciary hearing on proposed @Comcast @timewarner merger under review by FCC &amp; DOJ http://t.co/cAyIRt0JKh
464443082013163520,2014-05-08 16:33:54,,4,3,Twitter for iPhone,"Dude, this week @Dell celebrates their 30th anniversary #Dell30more"
464141912350666752,2014-05-07 20:37:09,,7,1,Twitter Web Client,"I'm a cosponsor of USA Freedom Act bc it will protect our privacy rights, rein in #NSA bulk data collection &amp; increase #FISA transparency"
464138565971374080,2014-05-07 20:23:52,,3,1,Twitter Web Client,"Now in @HouseJudiciary, we're considering H.R. 3361, the ""USA Freedom Act"" : http://t.co/CxZsAr4q3F"
464120853601742848,2014-05-07 19:13:29,,0,0,Twitter Web Client,"Veterans deserve the best care in a timely manner. If #VA Sec. Shinseki can't get this done, we need someone who can: http://t.co/uv0XqwrT6o"
464120841908019200,2014-05-07 19:13:26,,0,0,Twitter Web Client,"After new reports of VA negligence &amp; learning VA delays were involved in the death of a TX27 veteran, I called for action today in the House"
463867969525661696,2014-05-07 02:28:36,,0,0,Twitter Web Client,This week the House will vote to create a select committee on Benghazi. I want to hear what you think. https://t.co/UpVuE51h3x
463844138257895425,2014-05-07 00:53:55,,2,5,Twitter Web Client,"This week, we honor educators across the country during National Teacher Appreciation Week.To all of our teachers: Thank You."
463728371542024192,2014-05-06 17:13:54,,4,2,Twitter Web Client,Obama Admin continues to delay XL Keystone Pipeline thus delaying the creation of thousands of jobs. #TimeToBuild #4jobs
463449722611458048,2014-05-05 22:46:39,,0,2,Twitter for iPhone,Sam’s drawing will be displayed in the US Capitol for the next yr with artwork from all over the US. H/T @kiii3news: https://t.co/P0qPFc3JkX
463449641241944064,2014-05-05 22:46:19,,1,3,Twitter for iPhone,"Friday, I announced the 27th District winner of the 2014 Congressional Art Competition: Samuel Lathrop, a senior at Incarnate Word Academy."
463411630534299648,2014-05-05 20:15:17,,6,0,Twitter for iPhone,RT @RepCuellar: Pleasure to join the #Mission and #RGV community to discuss transportation projects @farenthold @RepRWilliams http://t.co/K…
463361369664786433,2014-05-05 16:55:34,,5,0,Twitter for Android,"RT @ameadetx: Congressmen Williams, Farenthold,  &amp; Cuellar @MissionCOC having a Transportation &amp; Infrastructure meeting http://t.co/KxUIsJ5…"
463360465498693632,2014-05-05 16:51:58,,1,0,Twitter for Android,RT @CasandraLGarcia: Attending Transportation Fact Finding Meeting with @RepCuellar @farenthold @RogerWilliamsTX at @MissionCOC #Transporta…
463333942616027138,2014-05-05 15:06:34,,5,2,Twitter for iPhone,Happy Cinco de Mayo!
462310124254932993,2014-05-02 19:18:17,,2,0,Twitter Web Client,During the month of April employers in the U.S. have hired new employees at their fastest rate in 2 + yrs. http://t.co/urooe7PoiN  #4Jobs
462007111988576257,2014-05-01 23:14:13,,4,4,Twitter for iPhone,NOW I'm on @loudobbsnews to discuss my exchange w/ Gen Lovell during today's Oversight hearing &amp; latest on our Benghazi attack investigation
462005586658603010,2014-05-01 23:08:10,,4,0,Twitter for iPhone,"RT @loudobbsnews: Joining #LouDobbsTonight are @CynthiaLummis, @farenthold, @MettaWorldPeace, @MonicaCrowley, @JMfreespeech, @BlakemanB &amp; m…"
461916847168712704,2014-05-01 17:15:33,,0,1,Twitter for iPhone,Met with a group of exceptional students from London I.S.D. in Washington D.C. before their tour of the Capitol. http://t.co/mC779Cg8YH
461908130277130240,2014-05-01 16:40:54,"{u'type': u'Point', u'coordinates': [-77.010821, 38.885889]}",9,8,Twitter for Android,"At @GOPoversight hearing on Benghazi @TGowdySC questions Brig. Gen. Lovell, USAF (Ret) http://t.co/ehFTazGzOu"
461887671108120576,2014-05-01 15:19:36,,22,0,Twitter Web Client,RT @GOPLeader: Even House Democrats want Senate Democrats to pass the #StacksOfBills stuck in the Senate: http://t.co/haC2kxjfsd
461867539061280768,2014-05-01 13:59:37,,14,4,Twitter Web Client,"@GopOversight is continuing its #Benghazi investigation, the American people deserve the truth. WATCH: http://t.co/LwQ9MrpEPJ"
461864554180673536,2014-05-01 13:47:45,,2,2,Twitter Web Client,"Today, in honor of The National Day of Prayer, I ask you to please join me in praying for our great nation. #NationalDayofPrayer"
461855903743221760,2014-05-01 13:13:22,,4,0,Twitter Web Client,"Today, we observe the #NationalDayofPrayer by inviting people of all faiths to pray for our nation."
461640154483294208,2014-04-30 22:56:04,,2,0,Twitter for iPhone,Contempt Act appropriations amendment shot down on point of order.
461636025128071168,2014-04-30 22:39:39,,14,4,Twitter for iPhone,We shouldn't reward bad behavior by paying gov't officials who don't abide by the law. RT if you agree Congress should pass the Contempt Act
461631839976038400,2014-04-30 22:23:02,,8,3,Twitter Web Client,TONIGHT: the House is voting on my #ContemptAct amendment to prohibit gov't officials found in contempt of Congress from receiving a salary
461579523801481216,2014-04-30 18:55:08,,0,0,Twitter Web Client,These measures will boost support and protection for domestic human trafficking victims- strenghthening laws &amp; holding criminals accountable
461576921726586880,2014-04-30 18:44:48,,1,0,Twitter Web Client,"In the House Judiciary Committee, we’re considering legislation to address Human Trafficking as part of our effort to combat this issue."
461574281991036928,2014-04-30 18:34:19,,1,0,Twitter Web Client,We must fight for the victims and end #Humantrafficking #notforsale
461574077392891904,2014-04-30 18:33:30,,2,1,Twitter Web Client,FBI: #sextrafficking is fastest-growing business of organized crime &amp; third-largest criminal enterprise in the world. #notforsale
461573752451391488,2014-04-30 18:32:13,,6,4,Twitter Web Client,Via @sharedhope: #Humantrafficking is the U.S. is a $9.8B industry! We must end the demand. #notforsale http://t.co/Gn0djK6G1f
461520583713644544,2014-04-30 15:00:56,,1,0,Twitter Web Client,"LNG exports will create thousands of jobs, narrow trade deficit by billions &amp; help our allies in need, like Japan: why we need to act now."
461519944229068800,2014-04-30 14:58:23,,0,0,Twitter Web Client,NOW: Our @GOPoversight hearing to discuss how #LNG exports can help strengthen our economy &amp; national security.  http://t.co/pA95rTMYuS
461506797279645697,2014-04-30 14:06:09,,0,0,Twitter Web Client,Goods moving through our ports &amp; supporting the Eagle Ford shale boom need a more direct freight network: what our I-69 caucus is advocating
461506785753718784,2014-04-30 14:06:06,,1,0,Twitter Web Client,I helped launch the bipartisan I-69 caucus to promote development of I-69 &amp; address its importance as a transportative freight corridor.
461503844397359104,2014-04-30 13:54:25,,1,0,Twitter Web Client,NOW I’m chairing our I-69 caucus mtg to talk moving freight transport via I-69. As TX grows so does the need for modern transport of freight
461243652220928000,2014-04-29 20:40:30,,2,2,Twitter Web Client,Lifting our thoughts and prayers to all who were impacted by the tornados that struck the heartland this week. https://t.co/iJKRlJRBCn
461239491668508672,2014-04-29 20:23:58,,3,1,Twitter Web Client,It’s time for Washington to get out of the way and stop hindering efforts to build an #AmericaThatWorks #4jobs
461239337674608643,2014-04-29 20:23:22,,2,1,Twitter Web Client,"My Republican colleagues and I continue to work hard to create jobs,grow the economy,and expand opportunities for the American people #4jobs"
461196423762305024,2014-04-29 17:32:50,,2,0,Twitter Web Client,NOW:@HouseJudiciary hearing on burdens employees face in regard to income tax return http://t.co/OUkQ4vpMDm
461187957161218048,2014-04-29 16:59:12,,0,1,Twitter Web Client,Regulatory Reform subcommittee hearing WATCH LIVE: http://t.co/OUkQ4vpMDm
461187669838790656,2014-04-29 16:58:03,,0,0,Twitter Web Client,COMING UP 12pm CT: @HouseJudiciary Regulatory Reform subcommittee hearing on Mobile Workforce State Income Tax Simplification Act of 2013.
461187143365566464,2014-04-29 16:55:58,,3,0,Twitter Web Client,RT @Transport: Congressman @Farenthold just hopped in @Google's Driverless Car to explore the road with this exciting technology. http://t.…
461184222695550976,2014-04-29 16:44:21,,1,0,Twitter Web Client,"Last night, @Kris6News aired investigative story feat. my reaction to reports of #SSA withholding tax refunds: http://t.co/SWwyFqVCJD"
461152177562845185,2014-04-29 14:37:01,"{u'type': u'Point', u'coordinates': [-77.0114032, 38.8866478]}",2,2,Twitter for Android,About to question Gen Peabody in @Transport on moving goal posts on Port of Brownsville. @USACEhq @USACEGalveston http://t.co/D0aVIIxzo9
461131815156453376,2014-04-29 13:16:06,,5,4,Twitter Web Client,(Met w/ @DerekKhanna &amp; @evanbaehr at #sxsw) Check out this story to see why the gov't needs to embrace #innovation: http://t.co/kHzSC8cMnT
459406753214775296,2014-04-24 19:01:19,,1,0,Twitter Web Client,"""We're gonna see this region grow &amp; prosper in our lifetime, children's lifetime &amp; grandchildren's..."" HT @KRIS6News: http://t.co/h11ub8XKCN"
459406741768531968,2014-04-24 19:01:17,,4,3,Twitter Web Client,"Yesterday, we welcomed a new industry to our area: @Voestalpine's new @PoccaPort plant will create hundreds of new jobs in the Coastal Bend"
458724677183995904,2014-04-22 21:51:00,,4,1,Twitter Web Client,Happy #EarthDay! It's time to stop delays &amp; #TimeToBuild #KXL to ensure a more secure energy future. RT if you agree: http://t.co/n9DBhRIQQl
458361705912107009,2014-04-21 21:48:41,,2,2,Twitter Web Client,"Good News: Unemployment rates in Texas, including 11 of 12 Coastal Bend counties, dropped last month. READ STATS: http://t.co/T5IuFrkunv"
458356222471962624,2014-04-21 21:26:53,,0,0,Twitter Web Client,I regret to inform you that it is in fact National Karaoke Week. http://t.co/Dw2pL1dFyM
458309109176365057,2014-04-21 18:19:41,,2,0,Twitter Web Client,NOW: Discussing my “Contempt Act” Bill with Dennis Miller on @DennisDMZ  http://t.co/cd1gcQDtcB
458308927198068737,2014-04-21 18:18:57,,4,2,Twitter Web Client,My bill will prevent federal employees who are held in contempt of Congress from receiving their taxpayer-funded paycheck.
458308271733219328,2014-04-21 18:16:21,,4,0,Twitter Web Client,TUNE IN: @DennisDMZ to hear me talk about my bill the Contempt Act  http://t.co/cd1gcQDtcB
457020850089107456,2014-04-18 05:00:36,,4,2,Twitter for iPhone,On @FoxNews @ANHQDC I discussed new info @GOPoversight uncovered on WH role in failed #Obamacare launch&amp; #IRS scandal http://t.co/BxpfCYrqrs
456942678144720896,2014-04-17 23:49:58,,8,7,Twitter for iPhone,NOW: I'm on @FoxNews @gretawire to talk about my bill the #Contempt Act to ensure high-ranking officials are treated just like everyone else
456499047461707777,2014-04-16 18:27:08,,1,0,Twitter Web Client,.@OlsonPressShop Glad you're with me on this! Appreciate your support
456498758029565952,2014-04-16 18:25:59,,22,0,Twitter Web Client,"RT @OlsonPressShop: .@farenthold is right, while I'm working to #ImpeachHolder - he's in contempt of Congress &amp; shouldn't receive salary ht…"
456495311809040384,2014-04-16 18:12:18,,6,0,Twitter for iPhone,"RT @RepJoeBarton: New Report: ""US energy boom is occurring in spite of president’s policies not because of them."" (H/T @HouseCommerce) http…"
