id,created_at,coordinates,retweets,favorite_count,source,text
613413161753026560,2015-06-23 18:27:49,,1,0,Twitter for iPhone,"65 years and still serving great burgers! #TDiH in 1950, TX Sec of State granted Harmon Dobson the trademark for @Whataburger!"
612076599668641792,2015-06-20 01:56:47,,2,1,Twitter for Android,Welcomed the #evahellokitty 777 to Houston this evening.  Nonstop service IAH-TPE is a win for both cities http://t.co/cr69Jf8PfJ
612055426406973440,2015-06-20 00:32:39,,1,0,TweetDeck,Met with officials in Matagorda Co who will be requesting a Disaster Declaration from Gov. Abbott after recent floods http://t.co/5ZXE8zXTN5
612054455572393984,2015-06-20 00:28:48,,0,0,TweetDeck,Met with Wharton Co. officials. Officials are working quickly to repair damaged infrastructure. http://t.co/NJnJKVMoU8
611937245801484288,2015-06-19 16:43:03,,0,1,TweetDeck,The Juneteenth Freedom Project honors 150 years after the abolishment of slavery with an exhibition by Ted Ellis. http://t.co/fxuC6qjGiI
611920132705812480,2015-06-19 15:35:03,,19,8,TweetDeck,This is an epic #fail by OPM. It is time for the director to be held accountable and resign her post. http://t.co/nJm2m3AYhc
611919919630970880,2015-06-19 15:34:12,,2,3,TweetDeck,"@FoundOpenGov Yes, I see no reason CRS reports shouldn’t be made public"
611369627952775169,2015-06-18 03:07:32,,7,2,Twitter for iPhone,How do you lose $3 billion in Obamacare payments? Apparently ask the government. http://t.co/QWo0d8n2Of
611190366499266561,2015-06-17 15:15:13,,1,1,TweetDeck,130 Years ago Lady Liberty arrived on our shores. It would take a year to complete. #TDiH http://t.co/uvjyGds7vW
611182783453499393,2015-06-17 14:45:05,,2,1,TweetDeck,Crazy view of Tropical Storm Bill from Astronaut @StationCDRKelly who is spending a year on the @Space_Station. http://t.co/ta3D0kaQNS
611181535769853952,2015-06-17 14:40:07,,5,0,TweetDeck,RT @SherwinPK: We're supporting the SPEAK FREE Act—a bill that makes it harder to shut down critical speech w/ bogus lawsuits: http://t.co/…
611181513200246784,2015-06-17 14:40:02,,1,0,TweetDeck,RT @castrotech: 34 organizations come together to sign letter supporting federal anti-SLAPP legislation http://t.co/ebKWDRyT0O
610873001291022336,2015-06-16 18:14:07,,0,0,TweetDeck,"District, Bi-district, and Area champs, way to go Ricebirds! Congrats to the El Campo High School baseball team on great season!"
610842027476037632,2015-06-16 16:11:02,,3,1,TweetDeck,"Secretary Clinton said she turned over all her emails, yet the Benghazi Ctm just received new unreleased ones… http://t.co/v1mdQLl7pC"
610118248235929600,2015-06-14 16:15:00,,2,2,Twitter for iPhone,Army Strong for over 240 years.  Here’s to the next 240. Happy Birthday to the @USArmy! http://t.co/modWse80o3
610097485080563712,2015-06-14 14:52:30,,4,4,Twitter for iPhone,Happy Birthday Stars and Stripes! Today is the 238th Birthday of our Nation’s Flag. http://t.co/zkKNLuvP3l
609496677150359552,2015-06-12 23:05:06,,1,2,TweetDeck,I met with real-life heroes today. WWII and Korean War veterans from Texas came to the Word War II Memorial. #Honor http://t.co/Xu4aefGDO3
609453127461310464,2015-06-12 20:12:03,,4,2,TweetDeck,"Just in case y’all were wondering, I was a No vote on TPA. Here’s why... http://t.co/vAxaUsWyl2"
609419971681124352,2015-06-12 18:00:18,,2,0,TweetDeck,"Happy Birthday to a great American who fought and served for his country, President @GeorgeHWBush! http://t.co/xTpDifZS30"
609102883443777537,2015-06-11 21:00:18,,0,0,TweetDeck,"Tough loss today Badgers, but congrats on a great season. Keep fighting and you’ll be back in the championship game next year!"
609029854181216256,2015-06-11 16:10:07,,1,0,TweetDeck,Let’s go Badgers. Bring home the title Bishop High School! Bishop plays in the Baseball 3A State Finals today at noon.
608750854930337792,2015-06-10 21:41:28,,1,2,TweetDeck,A great group from Wharton High School came to the Capitol today to discuss policy and legislation. http://t.co/UkE2xZJk5j
608692840147902464,2015-06-10 17:50:56,,0,2,TweetDeck,Yesterday I voted for an amendment that prohibits funds to buy cameras that store and collect your license plate numbers. #PrivacyMatters
608353423357018112,2015-06-09 19:22:13,,0,2,TweetDeck,"Last week, shots were fired at a CBP helicopter in Laredo. Talking about it on @Newsmax_Media at 2:30pm CT tune in: http://t.co/0uD7siPmAw"
608309540728283136,2015-06-09 16:27:51,,2,1,Twitter for Android,Texas winning art from the Congressional Art Competition await being hung in the Cannon Tunnel. http://t.co/atWYhx3l49
608301788475760640,2015-06-09 15:57:02,,1,2,TweetDeck,Security needs to be a priority especially with the recent CBP helicopter shooting at Laredo &amp; TSA failures. http://t.co/EIIKNT0IC6
608264081439629313,2015-06-09 13:27:12,,0,1,TweetDeck,About to go live on @MSNBC to talk border security @jdbalart http://t.co/bT5SK1MbJq
608261110001745920,2015-06-09 13:15:24,,0,0,TweetDeck,Going on the Rundown @MSNBC to discuss border security and the shooting on border patrol agents in Laredo. Tune in at 8:30 CT @jdbalart
607886819238146050,2015-06-08 12:28:06,,1,2,TweetDeck,The Caller Times did an article on my trip to Laredo. Here’s an update to what I’m looking into. http://t.co/62upfrKfxh
607704716257038336,2015-06-08 00:24:29,,35,0,Twitter for Android,RT @jasoninthehouse: With @farenthold where the CBP helicopter was shot. https://t.co/8HhPTemKn8
607685368121597952,2015-06-07 23:07:36,,8,7,Twitter for iPhone,Observing patrol operations w/ @jasoninthehouse on the river before heading to headquarters in Laredo for a briefing http://t.co/XKUZDErdXN
607641807124590592,2015-06-07 20:14:30,,3,3,Twitter Web Client,I am in Laredo to make a firsthand assessment of what our border patrol needs to remain safe after news of the attack http://t.co/6grFdg4XzO
607396019228299264,2015-06-07 03:57:50,,2,1,Twitter Web Client,Congratulations to these future military leaders who are a great example of why we have hope for our country https://t.co/wyzbxMmA68
607288055268012032,2015-06-06 20:48:49,,2,2,Twitter Web Client,Today we remember D-Day and those who fought so courageously to protect liberty around the globe. http://t.co/nkuOFUr3Cw
607271341633507329,2015-06-06 19:42:25,,2,3,Twitter Web Client,Today I spoke at the ribbon cutting of the Maxine Flournoy 3rd Coast Squadron Hangar and Museum of Military History. http://t.co/zMGc2TKWHM
606215072709378048,2015-06-03 21:45:10,,5,4,TweetDeck,The House just passed three of my amendments aimed at restoring privacy and liberty. Watch my floor speech --&gt; https://t.co/CAJmwHeTEX
606176979784765440,2015-06-03 19:13:48,,1,0,Twitter for iPhone,"RT @RSI: After #USAFreedom, surveillance reform isn't over! Encouraged to see amendment from @darrellissa @farenthold to roll back #stingra…"
606146598763008002,2015-06-03 17:13:05,,1,2,TweetDeck,Thank you to all those who volunteered over the past two weeks in and around the affected flood areas. http://t.co/o4hWkVxgUG
606082059648532480,2015-06-03 12:56:38,,2,0,Twitter for Android,"RT @1440WROK: This morning w/ Riley &amp; Scot - @farenthold #trade #tpa at 8:07a, @davidfrom @afpillinois #reform at 8:35a. Tune in 5-9a @1440…"
605834535410892800,2015-06-02 20:33:03,,0,1,TweetDeck,Despite ABC News report of TSA #Fail missing 67 of 70 prohibited items in undercover test they have cool Instagram https://t.co/K8eQGNhowZ
605826314474385408,2015-06-02 20:00:23,,7,3,TweetDeck,Does TSA Now Stand for Terrible Security Agency? Administrator forced out after TSA fails 67 out of 70 security tests http://t.co/kYAHSsbPkA
605812891221041152,2015-06-02 19:07:03,,1,4,TweetDeck,Outrageous! FBI spying on you and your cell phones w/o a warrant. Working w/ my colleagues to put a stop to this. http://t.co/CU7G2VyDio
603936527203364866,2015-05-28 14:51:03,,4,0,TweetDeck,"There will be a press conference today at 11 CDT at the community center in Wimberely, TX, on the search and recovery and relief efforts."
603631381621649409,2015-05-27 18:38:30,,2,1,TweetDeck,"Going over border security, the economy and shrinking the government during my round table  in Bay City today. http://t.co/gukSizA72Y"
603597311520874496,2015-05-27 16:23:08,,0,0,TweetDeck,Large turnout in El Campo to discuss the recovery effort in Central TX. Also discussed border security &amp; Obamacare. http://t.co/UaBxOgRYdM
603575918989213698,2015-05-27 14:58:07,,0,1,TweetDeck,"Discussed Obamacare, Patriot Act and Waters of the US at a round table in Edna this morning. http://t.co/6cCOQMNafR"
603333564306989057,2015-05-26 22:55:05,,1,1,Twitter Web Client,"Spoke with residents today in Hallettsville, TX, on Obamacare, border security and stopping a nuclear-armed Iran. http://t.co/uxwbGKjMoB"
603309668677517312,2015-05-26 21:20:08,,8,0,TweetDeck,Another failure by the IRS. This time they couldn't stop hackers from accessing taxpayer info -  http://t.co/apKOGyraRG
603287009394708480,2015-05-26 19:50:06,,2,5,TweetDeck,"US Constitution 2, illegal executive amnesty 0.  5th Circuit denies President Obama’s DACA appeal. http://t.co/QNzsP5DLDi"
603287009386364928,2015-05-26 19:50:06,,0,1,TweetDeck,"Met with residents of Gonzales to talk about using technology to assist border patrol, tax reform and Iran relations. http://t.co/LcroQ0Rf83"
603263129250697216,2015-05-26 18:15:12,,2,1,TweetDeck,"Met with some great folks in Lulling, TX, today to discuss VA reform and border security. http://t.co/m876Mz77ND"
603195110944350208,2015-05-26 13:44:55,,1,1,Twitter for iPhone,Just toured the Bastrop County Emergency Operations Center with Judge Pape and Commissioner Piña http://t.co/dgSP2dZdqc
602998745773441026,2015-05-26 00:44:38,,60,0,Twitter for Android,"RT @NWSSanAntonio: Civil Emergency Message
Please read if you live in the Bastrop area.
https://t.co/6aKsZQeXAG"
602908016959049729,2015-05-25 18:44:07,,1,3,TweetDeck,Thank you to the men and women who gave their all to defend our freedom. http://t.co/510mMSlfZG
602581304576606208,2015-05-24 21:05:53,,0,0,Twitter for Android,@Dell_Alann The Carey family (Michelle tutored my kids ) &amp; the McCombs (former County Commissioner's son and his wife &amp; 2 young children)
602577847417344000,2015-05-24 20:52:08,,2,0,Twitter Web Client,More on the floods.  Lots of folks need our prayers. http://t.co/1n1lXu9ehq
602576174846324736,2015-05-24 20:45:30,,1,4,Twitter Web Client,Some of my friends are missing in the Texas floods. Please join me in praying for them. https://t.co/RA32mChSFz
601865585224482816,2015-05-22 21:41:52,,4,0,TweetDeck,"RT @gavlik711: @TEXASCEtweets reps present ""Engineering a Better Texas"" to Rep @farenthold
#TEXASCE #Transportation #centennial http://t.co…"
601109491980054531,2015-05-20 19:37:25,,10,0,TweetDeck,"RT @xeni: 150 orgs, experts and companies unite to tell @BarackObama: hands off crypto! http://t.co/Mf9EkoxhBx #savethecrypto http://t.co/H…"
601036161994227713,2015-05-20 14:46:02,,1,0,TweetDeck,Voting yes on America COMPETES. It’s time to set priorities that will benefit STEM education while more appropriately using taxpayer money.
600755580983115776,2015-05-19 20:11:06,,1,0,TweetDeck,"In America, we have a right to privacy and that right should be upheld. http://t.co/gtwGEg7un9"
600737462709682176,2015-05-19 18:59:06,,2,2,TweetDeck,Speaking today at @ITIFdc on “smart” transportation and using technology to make commuting safer and less congested. http://t.co/imkCS3lPNi
600669395053056000,2015-05-19 14:28:38,,2,0,TweetDeck,"RT @ITIFdc: #ITIFdc will release a new report on the future of transportation on Capitol Hill with @farenthold at 12 pm today, http://t.co/…"
599657830761758720,2015-05-16 19:29:02,,3,1,Twitter for iPhone,Thank you to our brave men and women who sacrifice so much to keep America safe. http://t.co/uSm0UjIst9
599306269271334912,2015-05-15 20:12:03,,6,1,TweetDeck,I cosponsored the End Warrantless Surveillance of Americans Act b/c we must #restorethe4th. RT if you agree:  http://t.co/4JXN0kTsNk
599221476479275012,2015-05-15 14:35:07,,1,0,TweetDeck,New report states the VA misspent $6 billion dollars. This is ridiculous. What do you think?   http://t.co/wMVz2a9oAC
599001064969510912,2015-05-14 23:59:17,,6,9,Twitter for iPhone,Great to stop by @1776 #1776Challenge Transportation and Smart Cities Gala. @BGPollak @eburfield http://t.co/sMrMHfZ4k5
598944698137321472,2015-05-14 20:15:18,,2,0,TweetDeck,My FACT Act which helps preserve asbestos trust funds for victims passed out of @HouseJudiciary w/ Vet support -      http://t.co/ShBHo6TFmF
598912752040677376,2015-05-14 18:08:22,,5,0,TweetDeck,RT @GaryShapiro: .@farenthold @RepAnnaEshoo @DarrellIssa @RepJaredPolis @RepTrentFranks standing up 4 free speech w/new #antiSLAPP leg http…
598872655358492673,2015-05-14 15:29:02,,5,0,TweetDeck,RT @LCrenshaw: Bravo @farenthold + @RepAnnaEshoo for the #SpeakFreeAct. The #Internet community + #1stAmendment advocates thank u! https://…
598866135186939905,2015-05-14 15:03:07,,0,0,TweetDeck,Here’s a great commentary on my FACT Act from Vet and Texas County Judge John Brieden. http://t.co/ocJMPLBu4b
598634540509310976,2015-05-13 23:42:51,,7,3,Twitter for iPhone,"Today I introduced the SPEAK FREE Act, a bill to enhance free speech protections on the Internet. Read more.
https://t.co/i74CVmKQZT"
598589948221005826,2015-05-13 20:45:39,,3,4,TweetDeck,"Some of Corpus Christi's finest, Scott Leeton and Gregory Shipley, swung by the Capitol today for #PoliceWeek. http://t.co/B5a355jsKa"
598584580099219456,2015-05-13 20:24:19,,1,0,TweetDeck,"RT @InternetAssn: Thank you, @farenthold, for your efforts to create a national standard for online freedom of speech. #AntiSLAPP http://t.…"
598582398742372354,2015-05-13 20:15:39,,1,1,Twitter for iPhone,"Just met with Dr. Mark Stevens from Victoria, on the value of primary care and the future of the physician workforce. http://t.co/uY0500QxKM"
598488228807647232,2015-05-13 14:01:27,,1,5,TweetDeck,"This #PoliceWeek, tell the women and men in blue 'Thank you' http://t.co/LY8Rux5Mj4"
598238770387750912,2015-05-12 21:30:12,,1,0,TweetDeck,Congrats to Cheniere Energy for receiving final DOE approval of their LNG export terminal in Corpus Christi!
597838709937938432,2015-05-11 19:00:30,,1,1,TweetDeck,This is insane. The DOD pays NFL teams to have the Colors presented by an Honor Guard at football games. http://t.co/J0gSIgoCCX
597441653603962880,2015-05-10 16:42:44,,6,5,Twitter for iPhone,Considering how to vote on TPA.  Watched @HouseGOP video with conservative leader @RepMcClintock  https://t.co/WeMvHHABUA Your Thoughts?
597413058655420417,2015-05-10 14:49:07,,1,2,Twitter for iPhone,Happy Mother’s Day Y’all. Have a great day celebrating with the loved ones in your life. http://t.co/eZukKR6RFd
596730685517332480,2015-05-08 17:37:36,,2,2,TweetDeck,Check out these photos from the Arsenal of Democracy flyover. #VEDay70 http://t.co/yRPlVyZCBY
596716956293541888,2015-05-08 16:43:03,,0,1,TweetDeck,"The House Armed Services Committee put together a fact sheet on Jade Helm, thought I’d share it with y’all - http://t.co/hoDMfSDkkB"
596684325111869442,2015-05-08 14:33:23,,3,2,TweetDeck,"Happy VE day! Today, the Arsenal of Democracy will be buzzing the US Capitol to celebrate. Watch it live http://t.co/9V9ZvPwe5Y"
596479638890766337,2015-05-08 01:00:02,,3,0,Twitter for Android,RT @USACEGALVESTON: Congressman @farenthold's aide presents Lockmaster @TxSi &amp; his grandson w/ Certificates of Congressional Recognition ht…
596363638065090560,2015-05-07 17:19:05,,5,4,TweetDeck,"Its #NationalDayofPrayer, what are you praying for today?"
596351354689355777,2015-05-07 16:30:17,,0,0,TweetDeck,This am I had taquitos w the Thursday Morning grp I listened &amp; answered their questions regarding I-69 &amp; other issues http://t.co/aHxQDoC9OA
596109135222976513,2015-05-07 00:27:47,,7,0,Twitter for Android,RT @JesHamL10: Had a great time with the @calallenisd journalism group today! @farenthold even stopped by. http://t.co/C3W4CO9NPT
595686989627838465,2015-05-05 20:30:20,,1,0,TweetDeck,Thanks to @RepJeffMiller Chair of @HouseVetAffairs for sending Eric down from the committee to answer Vets’ questions!
595638845917401088,2015-05-05 17:19:01,,1,1,TweetDeck,If the White House was hacked American’s deserve to know. What do you think?  http://t.co/wx1jbadxc8
595615195713536000,2015-05-05 15:45:03,,1,1,TweetDeck,Feliz Cinco de Mayo everyone! http://t.co/dMFd4f2iru
595609204402089984,2015-05-05 15:21:14,,6,3,TweetDeck,"If you buy you own, it's not on loan. Read @sfmnemonic’s article on the future of ownership rights &amp; my YODA Act. http://t.co/Ug31KnrL9L"
595339658537488384,2015-05-04 21:30:10,,5,1,TweetDeck,Leaving flowers at the impromptu Memorial for Chief Simpson at police hdq. Praying for his family. http://t.co/dkoYy8RJ6U
595260365476274177,2015-05-04 16:15:05,,3,1,TweetDeck,May the Fourth be with you today. Be sure to check out my YODA bill! - https://t.co/adgiuwUKMb
595014293793288195,2015-05-03 23:57:17,,17,4,Twitter for Android,Lago @1360KKTX reports CC police chief Floyd Simpson killed in motorcycle accident in Port A.   Praying for him and his Family.
594363368007315456,2015-05-02 04:50:44,,0,0,Twitter for Android,@JeffSmithMO think you meant @Fahrenthold the WaPo writer not @farenthold  the Texas Congressman.
593888212814307329,2015-04-30 21:22:38,,4,5,Twitter for iPhone,Loved stopping by #Hack4Congress to talk about how tech can make Congress work better. Kudos to @FoundOpenGov http://t.co/MrUzIdSv7z
593887829815644160,2015-04-30 21:21:07,,0,0,TweetDeck,The Texas Transportation Commn just approved a design team for the new Harbor Bridge! Can't wait to see the designs. http://t.co/5UZ6IaTxry
593829724830347264,2015-04-30 17:30:13,,0,1,TweetDeck,"Talked to the @TexasFarmBureau today about Texas agriculture, immigration issues and more. Keep an ear out for it. http://t.co/13twNVklU4"
593768186291556352,2015-04-30 13:25:41,,1,0,TweetDeck,.@mmasnick you've got fans here... currently on: https://t.co/Ht5PhtzPbF
593517572810649601,2015-04-29 20:49:51,,3,0,TweetDeck,RT @FoundOpenGov: @farenthold thanks for attending tomorrow’s #Hack4Congress! Please RT and help spread the word: http://t.co/mhiV6AUb6l
593517186137739264,2015-04-29 20:48:18,,4,0,TweetDeck,RT @GaryShapiro: Kudos! @DarrellIssa @RepSwalwell @farenthold @BradSherman intro. Consumer Review Freedom Act outlawing penalties for negat…
593500897667219458,2015-04-29 19:43:35,,1,0,Twitter for Android,RT @lorenzoFB: .@farenthold: does anyone believe u can build a secure system that also has a law enforcement backdoor. No one (including FB…
593484920049111041,2015-04-29 18:40:06,,2,2,TweetDeck,"Sat down with @ConcernedVets from Corpus Christi today, to see how I can help! http://t.co/GgPl0caheH"
593428794062577664,2015-04-29 14:57:04,,1,1,Twitter for iPhone,"Congrats to #CongressionalArtCompetition winner, Krysten Maier of Corpus Christi, for her drawing “Katelyn” http://t.co/D7tIfKvOZ4"
593404279899234304,2015-04-29 13:19:39,,1,1,Twitter for iPhone,"As a member of @GOPoversight,I look forward to reviewing the contents of Lerner's ""missing"" emails. #IRSabuse http://t.co/OzoW0QzD5c"
593143441963536384,2015-04-28 20:03:11,,2,0,Twitter for iPhone,I will be holding a Veterans Town Hall on May 5th in Corpus Christi. Check out my most recent e-newsletter for more: http://t.co/pBss9jUJb5
592050403207819265,2015-04-25 19:39:50,,4,1,Twitter for Android,Praying for #NepalQuake victims.
591677021857648640,2015-04-24 18:56:09,,8,0,Twitter for Android,RT @ijreview: We made @farenthold into a hologram. Prepare to be amazed. http://t.co/g4AWo2mbHY
591001143754551296,2015-04-22 22:10:27,,1,2,Twitter Web Client,.@HouseAppropsGOP subcommittee just approved $85 million in funds for @CCADPAO. Read my release - http://t.co/vIwRWbow0T
590930990488498177,2015-04-22 17:31:41,,1,2,Twitter for iPhone,Happy #EarthDay! Anyone volunteering for a community project today? http://t.co/eerYDh0Zi0
590894701605158912,2015-04-22 15:07:29,,2,0,Twitter for iPhone,Corpus Christian Scott Melbye testifies to @gopoversight with DOE and GAO officials on gvmt sale of excess uranium http://t.co/3zR3wtUyFs
590881810684497920,2015-04-22 14:16:16,,1,8,TweetDeck,"#IDontDance, but my office enjoyed the preview of @NSAIofficial's Rob Hatch &amp; Lance Miller ahead of  tonight's event http://t.co/dLoFv6x126"
590874609295163392,2015-04-22 13:47:39,,1,2,Twitter for iPhone,Working to complete I-69 for jobs and less congestion. Thanks to the Alliance for I-69 for your help. http://t.co/htDGahkyDF
590616349447217152,2015-04-21 20:41:25,,5,1,Twitter for iPhone,Not just the nerds does my YODA bill protect - but farmers too. http://t.co/lahZcUDrdS @kwiens @iFixit
590587399949811712,2015-04-21 18:46:23,,1,1,TweetDeck,Ever wonder how much information your google search habits reveal about yourself? See for yourself - http://t.co/PWvDxq4dEa
590550355512983552,2015-04-21 16:19:11,,4,4,TweetDeck,"Today in 1836, Sam Houston and his forces led the charge defeating the Mexican Army and winning Texas Independence. http://t.co/sZJlBM5PmA"
590213437353025536,2015-04-20 18:00:23,,3,1,Twitter for iPhone,Congress passed &amp; the President signed into law the first entitlement reforms in nearly two decades. Via @AP http://t.co/NpVvGRnN1J
589900293187350529,2015-04-19 21:16:04,,3,4,Twitter Web Client,Blue Angels fly by my house as part of Air Show Corpus Christi.  I headed out yesterday but the show was rained out. http://t.co/tcAJMjk6Ty
589523170631163905,2015-04-18 20:17:31,,2,1,Twitter for Android,Was just about to enter NASCC for airshow when JD from my office texted the rest of the show today was cancelled. http://t.co/BGd3Vme3CZ
588817937756073988,2015-04-16 21:35:10,,3,3,TweetDeck,"Chairman @TGowdySC says he doesn’t have the power, but the House should give it to him. #ClintonEmails http://t.co/SnQNvH5dBM"
588809158264107009,2015-04-16 21:00:17,,1,0,TweetDeck,"Happy Birthday to the Queen of Tejano Music, Selena. Fiesta De La Flor in CC Tonight! #TDiH"
588471089661145088,2015-04-15 22:36:55,,7,2,Twitter for iPhone,"#innovationscorecard, great idea from startup @CEA member, @Phone2Action- and glad TX is an innovation champ #CESOTH http://t.co/UFkqOKYJUd"
588464039220633600,2015-04-15 22:08:54,,7,8,Twitter for iPhone,I'm working on some legislation to ensure you #dontgetslapped by frivolous lawsuits aiming to keep you quiet #CESOTH http://t.co/vpYhbtdJQd
588446957296717825,2015-04-15 21:01:02,,1,4,TweetDeck,"We need a fairer, simpler tax code to rein in the #IRSabuse."
588434387567382528,2015-04-15 20:11:05,,27,5,TweetDeck,"Executive Branch Employees owe over 660,000,000 in back taxes. #IRSabuse"
588419030848933891,2015-04-15 19:10:03,,8,3,TweetDeck,Government agencies should not be allowed to target specific groups based on their beliefs. #IRSabuse
588402459845885952,2015-04-15 18:04:13,,7,3,TweetDeck,"The IRS is supposed to serve, not hang up on their callers. 5 million “courtesy disconnects” this year to be exact. #IRSabuse"
588387062501376001,2015-04-15 17:03:02,,8,2,TweetDeck,"VA Employees owe $161,975,675 in back taxes. #IRSabuse"
588371495904129025,2015-04-15 16:01:10,,10,7,TweetDeck,The tax code shouldn't be so complex that the average citizen can’t comprehend it. #IRSabuse
588356437140705280,2015-04-15 15:01:20,,18,6,Twitter for iPhone,Retweet: if you think it’s time to stop the #IRSabuse http://t.co/alrTCXOgtR
588047569055518720,2015-04-14 18:34:00,,2,0,Twitter for Android,RT @JalilJilani: Useful interaction with Rep. Blake Farenthold (R-TX).Exchanged views on issues of mutual interest. http://t.co/QYoDVqUxrf
588012658290376704,2015-04-14 16:15:17,,0,0,TweetDeck,"The House passed a budget last month, now the Senate needs to come to the table. http://t.co/r7sG19MwBw"
588009107573055488,2015-04-14 16:01:10,,0,0,Twitter for Android,"Corpus Christi native Sara Salena, ICE Director, testifying today to @HouseJudiciary oversight hearing. http://t.co/9pDvAK3oMp"
587760776347123712,2015-04-13 23:34:23,,5,6,Twitter for iPhone,"Happy birthday to one of our Founding Fathers and author of the Declaration of Independence, Thomas Jefferson. http://t.co/rCaRMJWWCl"
587751842030956544,2015-04-13 22:58:53,,5,8,Twitter for Android,River approach to DCA (Washington Reagan National)  is always impressive. Add cherry blossoms this week! http://t.co/JcTWD2jMvV
586682938030325760,2015-04-11 00:11:27,,2,0,Twitter for Android,At Ronald McDonald House Men who cook event. Do I try @1360KKTX Lago's gumbo? http://t.co/UQeK19KZtP
586308153844707328,2015-04-09 23:22:11,,0,3,Mobile Web (M5),Tonight the community celebrates the advancement of the Corpus Christi Liquefaction project developed by Cheniere http://t.co/NQDu4SJ1Nk
585868918666891264,2015-04-08 18:16:49,,2,2,Twitter for iPhone,Talked long-term surface transportation needs at the PA State Capitol this morning. #PAroadshow http://t.co/Lq0cds2H9h
585828739713404930,2015-04-08 15:37:10,,1,0,Twitter for iPhone,Into art? Are you a High School student? Well Friday is the deadline to enter the 2015 Congressional Art Comp. http://t.co/nHS1IE36AQ
585467833699667968,2015-04-07 15:43:03,,9,5,Twitter for iPhone,"On the road today, with the Transportation Committee. Join in on the ride, follow #PAroadshow. http://t.co/T4GjFOJtXb"
585447522287489024,2015-04-07 14:22:21,,9,3,Twitter for iPhone,Traveling w/ @Transport's @RepBillShuster looking for ways to maintain &amp; improve our infrastructure. http://t.co/0lqmgVNftn
585441510461677569,2015-04-07 13:58:27,,4,0,Twitter for Android,RT @Transport: First stop Greenfield #Bridge with @RepLouBarletta; @RepScottPerry; @RepScottPerry; @farenthold; #PAroadshow http://t.co/OCF…
