id,created_at,user,retweets,favorite_count,source,text
849025019405627392,2017-04-03 22:25:13,JerryMoran,4,8,Twitter Web Client,Happy birthday to @wibw's @RalphHipp — Topeka wouldn't be the same without you &amp; I hope you have a great day!
849009829058424832,2017-04-03 21:24:51,JerryMoran,4,7,Twitter Web Client,"Senate passage of my bill w/ @SenatorIsakson, @SenJohnMcCain &amp; @SenatorTester makes strides to preserve the #Veterans Choice Program."
849009347048996864,2017-04-03 21:22:56,JerryMoran,4,16,Media Studio,Our nation’s veterans deserve access to quality healthcare wherever they call home. https://t.co/wF7w5ImIM4
849006485447290880,2017-04-03 21:11:34,JerryMoran,2,0,Twitter Web Client,RT @VAChair: Grateful to work with @SenatorTester @SenJohnMcCain @JerryMoran to improve care for our veterans: https://t.co/jBHlVG70Dr
848964025497026565,2017-04-03 18:22:51,JerryMoran,8,51,TweetDeck,"Today’s the day the Boys in Blue are back! Let’s go, @Royals. #OpeningDay #RaisedRoyal https://t.co/5B6IHMa9de"
847905232726241282,2017-03-31 20:15:35,JerryMoran,2,5,Twitter Web Client,"Discussed importance of international food assistance, which promotes global stability &amp; reduces suffering w/ @WFP’… https://t.co/p2XpsrM7yr"
847528217019895809,2017-03-30 19:17:27,JerryMoran,3,7,Twitter Web Client,".@ArlingtonNatl has challenges ahead, but I welcome the great responsibility to help preserve &amp; protect this sacred… https://t.co/g86gdmZDHv"
847476653819416576,2017-03-30 15:52:34,JerryMoran,3,0,Twitter for iPhone,RT @jbillinson: .@JerryMoran and @BrianSchatz visited Arlington yesterday to take a look at plans to help honor America's fallen https://t.…
847459273042935808,2017-03-30 14:43:30,JerryMoran,3,0,Twitter Web Client,RT @SenThadCochran: Now posted: @JerryMoran hearing '@ArlingtonNatl Cemetery: Current Operations &amp; Future Plans to Honor the Fallen' https:…
847450377113030656,2017-03-30 14:08:09,JerryMoran,2,0,Twitter Web Client,RT @ttaaggooee: It is important for us as Americans to find solutions to hunger around the globe - @JerryMoran #GlobalAg
847450305360990208,2017-03-30 14:07:52,JerryMoran,7,0,Twitter Web Client,"RT @C_A_Bertini: 3 cheers @JerryMoran  commited to ""fully engage US Senate to up the game ... to find hunger solutions to around the globe""…"
847450226126278657,2017-03-30 14:07:33,JerryMoran,2,0,Twitter Web Client,"RT @ChaseSova: ""What a great opportunity it is when our interests as a nation align with what is right morally"" @JerryMoran @GlobalAgDev #G…"
847226392940957697,2017-03-29 23:18:07,JerryMoran,9,48,TweetDeck,"Despite severe weather in parts of Kansas tonight, after a dry spell and devastating fires out west, we’re grateful for the rain. #kswx"
847183056029061121,2017-03-29 20:25:55,JerryMoran,11,32,Twitter for iPhone,"Gone but not forgotten. Paid my respects to Army Spc. Thomas Moffitt. Native son of Wichita, paid the ultimate sacr… https://t.co/Ge1ARkQTAb"
847133190607294464,2017-03-29 17:07:46,JerryMoran,6,14,Media Studio,.@marineband &amp; @theusarmyband were truly inspiring at the @whitehouse last night. 🇺🇸 https://t.co/MVxeZQljrP
847132627605827585,2017-03-29 17:05:32,JerryMoran,3,17,Twitter Web Client,I look forward to supporting Judge Gorsuch’s confirmation as an Associate Justice in the days to come. #SCOTUS https://t.co/Y1d98bKqGE
847132511025217538,2017-03-29 17:05:04,JerryMoran,8,22,Twitter Web Client,"Prior to our meeting, I knew Neil Gorsuch is an undeniably qualified nominee. I now know he is fully prepared to se… https://t.co/oHnWW9nJnE"
846845347762786305,2017-03-28 22:03:59,JerryMoran,22,48,TweetDeck,"If we’re committed to putting America first, we must lift the trade embargo with #Cuba. https://t.co/dxKPh8NFn2"
846840441232379904,2017-03-28 21:44:29,JerryMoran,1,3,TweetDeck,Proud to honor Fort Scott-native Gary Deloney's memory &amp; will work to declassify records proving exposure to toxic substances.
846838091931435009,2017-03-28 21:35:09,JerryMoran,1,8,TweetDeck,Joined @jontester to intro leg inspired by KS (Gary Deloney) &amp; MT (John Olsen) vets to improve acces to VA benefits. https://t.co/HM9ddHoUFs
846452912704442373,2017-03-27 20:04:35,JerryMoran,5,14,Twitter Web Client,Not your typical spring break – impressed to see young Kansans helping to build fences burned out by the wildfires. https://t.co/4pp187VKZn
845375965345857537,2017-03-24 20:45:11,JerryMoran,20,70,Twitter Web Client,"The House bill was not the answer, but Obamacare is still failing too many. We must keep our promise &amp; continue working to provide relief."
845017287849578497,2017-03-23 20:59:55,JerryMoran,8,42,Media Studio,Special moment in the @uscapitol Rotunda today with the Great Bend High School A Capella Choir singing “God Bless t… https://t.co/Aow45FLZw1
845014704074428418,2017-03-23 20:49:39,JerryMoran,0,1,TweetDeck,"@RachelsPinkHous Glad you're my friend too, Rachel! Or maybe I come work for you? Any openings for a ""senior advisor""?"
844610955376050190,2017-03-22 18:05:18,JerryMoran,14,41,Twitter Web Client,Honored to have @SenatorDole in the office today to speak with my staff. What a Kansas inspiration for us all! https://t.co/uFtNGtoDZl
844607705377640448,2017-03-22 17:52:23,JerryMoran,8,10,Twitter Web Client,"Appreciated meeting students and hearing Eugene, one of my office’s interns who is a veteran &amp; a TRIO participant,… https://t.co/Ny93qfc9Ii"
844575933382230020,2017-03-22 15:46:08,JerryMoran,2,6,TweetDeck,Hearing now from @DeptofDefense Sec. Mattis &amp; Joint Chiefs Chairman @GenDunford about defense funding &amp; readiness. https://t.co/qSYLt1QqLT
844324337440227329,2017-03-21 23:06:23,JerryMoran,4,9,Media Studio,"My hearing today examined consumer scams &amp; how to fight back―featured testimony by @FTC Commisioners, @KWCHMichael,… https://t.co/cSrRPTB642"
844260937049821190,2017-03-21 18:54:27,JerryMoran,2,7,Twitter Web Client,Tune in—@KWCH12’s Mike Schwanke is testifying before my @SenateCommerce Subcommittee about fighting back against sc… https://t.co/O3pKfXpeiM
844257525180653569,2017-03-21 18:40:54,JerryMoran,1,0,Twitter Web Client,RT @SenateCommerce: WATCH LIVE: @JerryMoran convenes subcommittee hearing on fighting back against #scams used to defraud Americans https:/…
844235989388353536,2017-03-21 17:15:19,JerryMoran,4,19,Twitter Web Client,.@USDA is making funds available to those devastated by the recent wildfires—I’ll continue to push for assistance. https://t.co/Ikydzw24hz
844192622533140480,2017-03-21 14:23:00,JerryMoran,10,9,Twitter Web Client,Happy #NationalAgDay―I'm partnering w/ @SenJoniErnst &amp; @RepMcCaul to encourage America’s next ag generation. https://t.co/GN9Pkj3sWr
844192463711625216,2017-03-21 14:22:22,JerryMoran,21,38,Twitter Web Client,The average age of our nation's farmers is 58 and trending upward. Our future depends on engagement of young American farmers &amp; ranchers.
844183651990552576,2017-03-21 13:47:21,JerryMoran,8,33,TweetDeck,"Proud to co-chair the Senate Down Syndrome Caucus on @WorldDSDay &amp; every day to promote awareness, education, resea… https://t.co/gcJ7MXFXde"
843894218741440514,2017-03-20 18:37:15,JerryMoran,3,7,TweetDeck,Well-deserved recognition for Allen County residents' decades of work to drive change &amp; focus on health in their co… https://t.co/QtpCIvZJvn
842833586646585344,2017-03-17 20:22:40,JerryMoran,2,5,TweetDeck,"Glad to see VSOs being brought into the fold to help restore veterans’ trust in the VA.
https://t.co/0gun79VhCs"
842479051558309888,2017-03-16 20:53:53,JerryMoran,171,0,TweetDeck,"RT @USSArizona: Happy 105th Birthday to Ray Chavez, the oldest living Pearl Harbor survivor. God bless you Ray. Thank you for your service…"
842458670927601664,2017-03-16 19:32:53,JerryMoran,5,0,TweetDeck,RT @knssradio: Colorado ranchers aid Kansas ranchers with hay https://t.co/8Fs35Bxp0J https://t.co/UIf5pgLej9
842452378129453056,2017-03-16 19:07:53,JerryMoran,3,15,Twitter Web Client,Met w/ @USDA Acting Secretary Young &amp; asked about eligible federal assistance programs for farmers rebuilding after… https://t.co/vzSoVkczUR
842044815328067584,2017-03-15 16:08:23,JerryMoran,10,35,TweetDeck,Congrats to @AmericanLegion on 98 years of #veterans serving veterans. Kansans have the utmost gratitude &amp; respect for their hard work.
841426017772326916,2017-03-13 23:09:30,JerryMoran,9,18,Media Studio,Witnessed firsthand the devastation left in the wake of the recent #wildfires. Watch the video below to hear my tho… https://t.co/uXNBXKjFjE
841368070820134912,2017-03-13 19:19:14,JerryMoran,14,35,Media Studio,"At a time when our farmers and ranchers need new markets, it’s time we change course &amp; lift the Cuban embargo.… https://t.co/3yi1xMosmp"
841352535457878017,2017-03-13 18:17:30,JerryMoran,2,8,Twitter Web Client,What a good update on @WichitaPolice Officer Arterburn. Prayers are being heard. https://t.co/Ja61HtBNba
841335933043642368,2017-03-13 17:11:32,JerryMoran,4,12,TweetDeck,I'm following up to make certain eligible resources are in place to help those whose livelihoods were damaged or de… https://t.co/qnLy2HJzfE
840258044764278785,2017-03-10 17:48:23,JerryMoran,12,31,TweetDeck,"Congrats, Tel Wittmer of @WeAreHolton &amp; Jack Campbell of Mill Valley HS―Kansas’ delegates to @SenateYouth… https://t.co/vkoNMhvdhp"
839936839469445120,2017-03-09 20:32:02,JerryMoran,43,70,Media Studio,"Although it’s not a big, national news story, Kansas is ablaze. I shared one Clark Co. family's story today.… https://t.co/fgAMjouqX3"
839581609527504903,2017-03-08 21:00:29,JerryMoran,2,3,Twitter Web Client,We can streamline the VA Choice Program &amp; support community providers. How? Learn more: https://t.co/1foAKDCecm https://t.co/FZH5rTWYKn
838903891580289024,2017-03-07 00:07:28,JerryMoran,3,3,TweetDeck,Follow @NWSDodgeCity for updates as winds continue to shift &amp; affect the fires moving quickly across portions of Kansas.
838848357258964992,2017-03-06 20:26:48,JerryMoran,2,0,Twitter Web Client,"RT @SenateCommerce: After @SenateCommerce letter on sex abuse, @TeamUSA launches operations of SafeSport initiative to protect athletes htt…"
837764028432855040,2017-03-03 20:38:03,JerryMoran,5,0,Twitter Web Client,RT @SenateCommerce: .@SenJohnThune and @JerryMoran press @TeamUSA on protecting athletes after allegations of sex abuse https://t.co/r4b5L7…
837390777823133698,2017-03-02 19:54:54,JerryMoran,15,31,Twitter Web Client,One of many Kansas women worth recognizing as we kickoff #WomensHistoryMonth https://t.co/SKPOCfubpW
837039455328428033,2017-03-01 20:38:52,JerryMoran,10,15,Twitter Web Client,Proud to see a Kansan recognized for his incredible drone film capturing wheat harvest. https://t.co/27tNEhLQ3Y https://t.co/mV1ASqV4rE
836998928264544257,2017-03-01 17:57:49,JerryMoran,7,16,Twitter Web Client,"Appreciated hearing from Kansas veterans (@VFWHQ &amp; @AmericanLegion), @ksbroadcasters, @KsMedSoc, postmasters &amp; co.… https://t.co/S8auuZztbC"
836781119152480257,2017-03-01 03:32:20,JerryMoran,4,9,Twitter Web Client,My full statement in reaction to @POTUS’s #jointaddress: https://t.co/KF0mEPoKMC
836778548912345089,2017-03-01 03:22:07,JerryMoran,30,101,Twitter Web Client,"Appreciated hearing @POTUS acknowledge attack in #Olathe. This senseless act, motivated by prejudice, will not be tolerated #jointaddress"
836745601756901376,2017-03-01 01:11:12,JerryMoran,6,11,Twitter Web Client,Proud to welcome @VFWHQ Kansas State Commander Gerald Marvin of La Crosse to the @uscapitol for the #JointAddress t… https://t.co/FWRCE70j0h
836687448931467266,2017-02-28 21:20:07,JerryMoran,6,14,TweetDeck,#WOTUS badly missed its mark. Rolling it back is a victory for rural America. https://t.co/WfJHAXfGMV
836328749671002112,2017-02-27 21:34:46,JerryMoran,12,40,TweetDeck,"I reiterated a sentiment best expressed by Alok Madasani: This tragedy doesn't reflect the true spirit of Kansas, t… https://t.co/WHDxKuHQDO"
836025761027002368,2017-02-27 01:30:48,JerryMoran,118,0,Twitter for iPhone,"RT @CityofOlatheKS: We stand together in our grief; in our support of the victims, their family &amp; friends. And always, we stand together. #…"
835202650052440064,2017-02-24 19:00:03,JerryMoran,2,0,Twitter for iPhone,RT @SenateCommerce: Read @Yahoo's response (https://t.co/1qwgY2hZ9N) to the committee's inquiry letter (https://t.co/vdEkZRZFCu) on data se…
835172258012348416,2017-02-24 16:59:17,JerryMoran,4,14,Twitter Web Client,"Met w/ German, French, British officials this week &amp; reiterated US commitment to alliance against threats worldwide… https://t.co/NHKcOjD2Ns"
834922016830554112,2017-02-24 00:24:55,JerryMoran,30,71,TweetDeck,"I strongly condemn violence of any kind, especially if it is motivated by prejudice &amp; xenophobia―my statement on th… https://t.co/06wPAXEFV1"
834797056904589314,2017-02-23 16:08:22,JerryMoran,1,14,TweetDeck,Thanks to DefSec Fallon &amp; his staff in London. Cooperation w/ our allies is critical to keeping us safe against the… https://t.co/eAZCWp9j48
834794217926979584,2017-02-23 15:57:05,JerryMoran,3,6,TweetDeck,A reminder of what we already know: the release of #GITMO terrorist detainees makes the world less safe. https://t.co/IUYIl6g7xD
834450444831305728,2017-02-22 17:11:04,JerryMoran,6,12,TweetDeck,"Awesome ― every veteran should have the opportunity to see the memorials dedicated in their honor.
https://t.co/lj76yNufOQ"
833791791769976833,2017-02-20 21:33:48,JerryMoran,2183,0,Twitter for iPhone,RT @TheEllenShow: I hope your #PresidentsDay is as adorable as Macey. https://t.co/AxfmMDCVnk
832714614467022849,2017-02-17 22:13:29,JerryMoran,4,21,Twitter Web Client,I'm hopeful the new admin. will recognize &amp; keep in mind the unique challenges facing rural healthcare providers. https://t.co/Pi4AsheIiI
832323107817922560,2017-02-16 20:17:47,JerryMoran,18,41,Twitter Web Client,"As we celebrate #BlackHistoryMonth, I encourage Kansans to learn more about Nicodemus. https://t.co/IeEeRePA0M https://t.co/kklzE3kt6X"
831994591700217862,2017-02-15 22:32:23,JerryMoran,12,27,Twitter Web Client,"Joining the Blue Valley community in praying for Coach Driskell, his family, and his students. https://t.co/ELxSPRcJ5b"
831904430274576385,2017-02-15 16:34:06,JerryMoran,1,3,TweetDeck,"#KansasCommonSense—update on @FortLeavenworth, ongoing recovery efforts from last year's Anderson Creek fire + more. https://t.co/PtoeILTiz2"
831634564619567104,2017-02-14 22:41:45,JerryMoran,4,13,Twitter Web Client,Our next #farmbill must address the crisis in the High Plains impacting wheat &amp; sorghum farmers. My full op-ed:… https://t.co/ZMQYyAaBny
831546010962948096,2017-02-14 16:49:53,JerryMoran,11,7,TweetDeck,".@washburnlaw is offering a free clinic next Saturday for veterans with legal questions. Feb. 25, 10 a.m.-Noon.
https://t.co/CismC4Ke1e"
831316390548271104,2017-02-14 01:37:27,JerryMoran,3,22,TweetDeck,Just joined all 99 of my colleagues to confirm Dr. David Shulkin as our 9th @DeptVetAffairs Secretary. My statement… https://t.co/s77PHB71GG
831288368914919429,2017-02-13 23:46:06,JerryMoran,10,17,Twitter Web Client,Kansas producers know these challenges all too well. Look forward to working w/ Gov. Perdue to defend rural America. https://t.co/f6HGHneeTS
831283999909801984,2017-02-13 23:28:44,JerryMoran,7,28,Twitter Web Client,"Wishing @CoachBillSnyder a swift, speedy recovery – see you on the sidelines soon! #SnyderStrong #EMAW https://t.co/wOoyZEgWc4"
831279521592700928,2017-02-13 23:10:57,JerryMoran,3,18,Twitter Web Client,Wrote the president to request an immediate hold on #GITMO detainee transfers—safety of Americans must come first. https://t.co/EknD0eQTrp
831248125511794688,2017-02-13 21:06:11,JerryMoran,2,7,TweetDeck,Good song with an even better message. https://t.co/7zsqYWNK8n
830178865624526848,2017-02-10 22:17:20,JerryMoran,2,8,Twitter Web Client,Joint-service exercises are critical to keeping Kansans &amp; Americans safe—great to have @FlyKSLN involved in this im… https://t.co/6jyiY0xYMj
830175421845082112,2017-02-10 22:03:39,JerryMoran,3,13,TweetDeck,I appreciated hearing from Commanding General LTG Lundy about @FortLeavenworth's integral contributions to the miss… https://t.co/gPKIQKfwYV
829433433302634496,2017-02-08 20:55:15,JerryMoran,9,34,Twitter Web Client,"Praying for @WichitaPolice’s Officer Brian Arterburn, and joined @kfdinews in wishing him a full and speedy recover… https://t.co/cgv0Fe9PSM"
827570490311065600,2017-02-03 17:32:35,JerryMoran,6,21,Twitter Web Client,Pushed @DeptVetAffairs nominee Dr. Shulkin this week to end VA habit of narrowing Congress' laws &amp; work with #VSOs.… https://t.co/eus9R3tglx
827148891934117888,2017-02-02 13:37:18,JerryMoran,6,31,Twitter for iPhone,#NationalPrayerBreakfast—a time to put politics aside &amp; pray. Proud two Kansans had a part in its founding. https://t.co/megoXBHKjz
826932980455182337,2017-02-01 23:19:20,JerryMoran,2,24,Twitter Web Client,Met with Sonny Perdue today to hear more about how he would lead the @USDA. Believe he understands challenges facin… https://t.co/qSbGLecz1Z
826875591857143808,2017-02-01 19:31:18,JerryMoran,217,206,Twitter Web Client,"Due to high call volumes, if you're attempting to contact me &amp; are unable to get through, please email me via: https://t.co/zCMn9eXQG1"
826619142916669440,2017-02-01 02:32:16,JerryMoran,5,16,Twitter Web Client,I look forward to examining his legal writing &amp; meeting with him to discuss his views on the judicial branch and the Constitution.
826619062692302848,2017-02-01 02:31:57,JerryMoran,12,38,Twitter Web Client,Judge Gorsuch is an impressive &amp; well-qualified #SCOTUS nominee who has already received bipartisan support in the Senate.
826538813560385536,2017-01-31 21:13:04,JerryMoran,1,5,Twitter Web Client,"#KansasCommonSense—my new role on the MilCon + VA Appropriations Subcommittee, joining @EPWMaj &amp; visiting @Airbus. https://t.co/LirrMGTzKn"
826511809108664323,2017-01-31 19:25:45,JerryMoran,3,16,Twitter Web Client,"Enjoyed this profile of Independence. A good illustration of the daily routines, struggles &amp; rewards of life in sma… https://t.co/9QP8IwhnHS"
826057356026986496,2017-01-30 13:19:55,JerryMoran,33,93,Twitter Web Client,Far-reaching national security policy should have input from Congress. Full statement: https://t.co/yw089rqYyo
825756661302362114,2017-01-29 17:25:04,JerryMoran,15,65,Media Studio,"Happy #KansasDay! 🌻
https://t.co/ZnVFQVptzT https://t.co/S7uBnn6OZc"
825124136175403012,2017-01-27 23:31:38,JerryMoran,7,28,TweetDeck,"The Holocaust revealed to us humankind's darkest elements, yet also bravery, unexpected kindness &amp; self-sacrifice.
https://t.co/zhmn6EwRmc"
825120038675963904,2017-01-27 23:15:21,JerryMoran,4,25,Twitter Web Client,Wonderful to have so many Kansans in DC for #MarchForLife—I will continue working in Congress to defend the fundame… https://t.co/ilGS0zz1lH
824744840109883392,2017-01-26 22:24:27,JerryMoran,4,13,Twitter Web Client,"Without the hard work/advocacy of Rachel &amp; her mom, this day might not have come. Looking forward to seeing Kansans benefit from ABLE accts!"
824744718177300480,2017-01-26 22:23:58,JerryMoran,5,25,Twitter Web Client,"Well, a yr after we passed the #ABLE Act, Rachel officially opened the 1st ABLE account in Kansas this morning w/ h… https://t.co/g0HSbDw3s6"
824744401167585280,2017-01-26 22:22:42,JerryMoran,3,9,Twitter Web Client,I was impressed by Rachel’s desire for something so central to the American Dream – to be able to save and make her own way through life.
824744326039220224,2017-01-26 22:22:24,JerryMoran,7,32,Twitter Web Client,"When I met @RachelsPinkHous in 2012, she told me I needed to get the ABLE Act passed so she could live in a pink ho… https://t.co/jSx0HFhaTE"
824382315799449600,2017-01-25 22:23:55,JerryMoran,6,13,Twitter Web Client,Overregulation is among the greatest threats to rural America. My seats on #EPW &amp; #Ag Approps enable me to advocate… https://t.co/eIepykC6Z8
824381421213089792,2017-01-25 22:20:21,JerryMoran,1,8,TweetDeck,"#KansasCommonSense – A peaceful transfer of power, confirming qualified Defense &amp; Homeland Security noms and more:… https://t.co/brdxn5Ah7Y"
824352488333647872,2017-01-25 20:25:23,JerryMoran,3,17,TweetDeck,".@RepLynnJenkins is the consummate Kansan &amp; an exceptional congresswoman—whatever's next, our state is better off b… https://t.co/teGePM6FIb"
824340099634778122,2017-01-25 19:36:09,JerryMoran,2,26,Twitter Web Client,Welcomed a group of middle school students from St. John Catholic School in Lawrence to the Capitol yesterday. https://t.co/eb7E7PFhd4
824300479794573314,2017-01-25 16:58:43,JerryMoran,2,8,TweetDeck,The memorial is the only one of its kind &amp; deserves the national attention a designation would bring to… https://t.co/LwHJlhWYdI
824043920837505024,2017-01-24 23:59:15,JerryMoran,1,3,Twitter Web Client,Called on @USFWS today to request an extension to latest #LPC status review comment period. Letter here: https://t.co/qb3F5NIXYp
823977153322684420,2017-01-24 19:33:56,JerryMoran,3,4,Twitter Web Client,Interested in a summer internship in Kansas or DC? The application deadline for our intern program is February 17. https://t.co/X7rgqqzN8o
823920388497440769,2017-01-24 15:48:22,JerryMoran,3,6,Twitter Web Client,New CBO report makes clear Congress must confront difficult decisions needed to regain grip on fiscal responsibility https://t.co/brCXjdIKrk
823657007722954752,2017-01-23 22:21:48,JerryMoran,4,24,Twitter Web Client,"Parsons native @AjitPaiFCC is an excellent choice to lead @FCC. Capable, talented leader uniquely qualified to advocate for rural America."
823587599772024832,2017-01-23 17:45:59,JerryMoran,9,54,Twitter Web Client,Early morning sunrise from I-70 in Wabaunsee County on my way back to work in Washington. https://t.co/rZzMfwjERE
822809224157634560,2017-01-21 14:13:00,JerryMoran,5,12,TweetDeck,I’ve fought against #WOTUS b/c it’s unnecessary &amp; stifles job creation in Kansas. Encouraged to see this on the new… https://t.co/xdO6rJxRQg
822584626157850626,2017-01-20 23:20:32,JerryMoran,7,22,Twitter Web Client,Swiftly confirming the secretaries in charge of our national security is critical to keeping us safe as we face threats at home and abroad.
822584398503702530,2017-01-20 23:19:38,JerryMoran,17,56,TweetDeck,Foreign adversaries looking to challenge America will be rethinking their plans with Gens. Mattis &amp; Kelly at the helm.
822530914332839938,2017-01-20 19:47:06,JerryMoran,27,115,TweetDeck,The peaceful transition of power further reminds us of the strength of our democracy—honored to be there to represe… https://t.co/2GJK3CMOuc
822154390597500930,2017-01-19 18:50:56,JerryMoran,1,10,Twitter Web Client,"What an opportunity for Sophie Schneider, young Kansan from Olathe, to serve as @GMA's “kid correspondent.” Somethi… https://t.co/gdJkrlWICb"
822061761167769600,2017-01-19 12:42:51,JerryMoran,2,5,Twitter Web Client,I joined @MorningEdition's @nprgreene to discuss @SenateCommerce's hearing on the Commerce Secretary nominee. Listen—https://t.co/MdZHtG0rig
821908610653503488,2017-01-19 02:34:17,JerryMoran,0,6,TweetDeck,The Ag Secretary serves as an important voice for rural Americans. My statement on Gov. Perdue's nomination here: https://t.co/4iMTQgr4XU
821877617431289856,2017-01-19 00:31:08,JerryMoran,8,17,TweetDeck,Great to welcome the @FightingFirst Mounted Color Guard to the @uscapitol—they'll represent Kansans with distinctio… https://t.co/AWeelDcLWZ
821868381150318593,2017-01-18 23:54:26,JerryMoran,10,17,Twitter Web Client,.@MilitaryVetera's @MelissaJarboe is an incredible advocate for #veterans—glad she could make the trip to DC. https://t.co/0NRQy7Yjy3
821731103979479040,2017-01-18 14:48:56,JerryMoran,1,4,Twitter Web Client,This week’s #KansasCommonSense – voting to set up a critical step in repairing damage of #Obamacare &amp; more.… https://t.co/1BR2MKfEDE
821451241637212162,2017-01-17 20:16:52,JerryMoran,0,4,TweetDeck,Great to be at @KansasINBRE #KINBRESymposium this weekend. More about my vision for STEM research in Kansas: https://t.co/BZ1g9DLHCm
820037169565863937,2017-01-13 22:37:51,JerryMoran,2,11,Twitter Web Client,"With icy weather due to hit Kansas this weekend, stay safe, stay aware and stay off the roads if possible. #kswx https://t.co/5hsOSfqEDq"
819662613449687040,2017-01-12 21:49:30,JerryMoran,7,18,Twitter Web Client,Kicked off the morning talking jobs and American competitiveness on @SquawkCNBC with @JoeSquawk and @BeckyQuick. https://t.co/aMovnIAwte
819573803860787204,2017-01-12 15:56:36,JerryMoran,1,3,Twitter Web Client,Look forward to building on consumer protection successes &amp; continuing to chair the @SenateCommerce Subcommittee. https://t.co/8vN5pVMkkR
819572584853422080,2017-01-12 15:51:45,JerryMoran,1,3,Twitter Web Client,.@jsiebenmark—They're right. It will remove unnecessary hurdles while preserving safety standards in our skies.
819430475441831936,2017-01-12 06:27:04,JerryMoran,5,15,TweetDeck,The Senate’s vote tonight gives us the opportunity to begin repairing #Obamacare’s damage. My full statement here: https://t.co/4ek0MVDZkO
819267931104301062,2017-01-11 19:41:10,JerryMoran,5,5,Twitter Web Client,Our next Secretary of #Agriculture will have a huge job to do. I spoke with @KansasAgland about my expectations. https://t.co/U7lKf4hSwu
818965403892326401,2017-01-10 23:39:02,JerryMoran,3,3,TweetDeck,"Latest #KansasCommonSense – healthcare reform priorities, reintroducing VA accountability legislation + more. https://t.co/5UXgTom2Fr"
