id,created_at,user,retweets,favorite_count,source,text
333631176801648640,2013-05-12 17:14:05,JerryMoran,3,3,Twitter Web Client,"Wishing all moms — especially my wife, Robba — a happy mother's day today."
333612823861145600,2013-05-12 16:01:10,JerryMoran,11,0,Twitter Web Client,RT @ShannonBream: IRS admits targeting Tea Party groups - Sen @JerryMoran is demanding answers - joins us live NOW on @FoxNews
333351357534846976,2013-05-11 22:42:11,JerryMoran,9,3,Twitter Web Client,"Tomorrow morning @ 11 a.m. CT, I'll be on @FoxNews with @ShannonBream discussing #IRS targeting and #FAA Control Towers—hope you'll tune in."
332993697077669888,2013-05-10 23:00:58,JerryMoran,11,2,Twitter Web Client,"Less than 48 hours after I questioned Treasury Secretary Lew on tax record leaks, the #IRS apologized. http://t.co/cZjyqdYW5y"
332985213686788096,2013-05-10 22:27:16,JerryMoran,3,0,Twitter Web Client,RT @AP_Joan_Lowy: AP: 149 contract airport towers to stay open for now but it's a temporary reprieve http://t.co/o2wFV3AazZ
332936859456008192,2013-05-10 19:15:07,JerryMoran,0,4,Twitter Web Client,Today aviation safety was preserved &amp; common sense prevailed over politics: 149 FAA control towers will remain open http://t.co/me93sEoIwG
332933597268955136,2013-05-10 19:02:09,JerryMoran,4,2,Twitter Web Client,Victory for common sense today—FAA is canceling the planned closure of 149 airport control towers. Read my statement: http://t.co/me93sEoIwG
332889430689984512,2013-05-10 16:06:39,JerryMoran,2,1,Twitter Web Client,Congressional Research Service report backs my argument that #FAA should reverse decision to shutter control towers http://t.co/qrLLBHj5E2
332612065875333120,2013-05-09 21:44:30,JerryMoran,19,0,Twitter Web Client,"RT @Senate_RPC: [New from RPC and @SenJohnBarrasso] What Obama won’t tell women about his health care law. Marriage penalty, more:  http://…"
332260807217913856,2013-05-08 22:28:44,JerryMoran,3,1,Twitter Web Client,California's State Senate passes resolution calling on Washington to turn bipartisan #StartupAct 3.0 into law. http://t.co/uhOWvb6UTa
332257012966629377,2013-05-08 22:13:39,JerryMoran,0,0,Twitter Web Client,"I previously sought to improve trade relations w/ Cuba, but their unjust imprisonment of an American is unacceptable. http://t.co/j2IgDi6UMm"
332254029730156545,2013-05-08 22:01:48,JerryMoran,1,0,Twitter Web Client,Are you on @instagram? You can stay up-to-date on my work in the United States Senate &amp; my travels across Kansas at http://t.co/Ys2YUUdAxo.
330395613420191744,2013-05-03 18:57:07,JerryMoran,3,0,Twitter Web Client,RT @WIBWNews: Kansas Officers Who Died In Line Of Duty Honored - WIBW News Now! http://t.co/eZrJaMlXOT
330394307255226368,2013-05-03 18:51:55,JerryMoran,7,2,Twitter Web Client,I sponsored 'Never Contract with the Enemy Act' because the US must prevent government contracts from being used to fund enemy forces.
330140775436394498,2013-05-03 02:04:29,JerryMoran,2,1,Twitter Web Client,I hope you'll tune in tomorrow morning at 6 a.m. CT to #580WIBW. I'll be discussing agriculture on @WIBWNews' Kansas Ag Network.
330082515534614529,2013-05-02 22:12:58,JerryMoran,3,2,Twitter Web Client,40 of my colleagues joined me today in calling on the #FAA to immediately end the closure of 149 #controltowers   http://t.co/9GjzRhv2fP
330034540758306816,2013-05-02 19:02:20,JerryMoran,11,2,Twitter Web Client,The #NationalDayofPrayer is a good reminder for Americans to set aside time to pray for our country and reflect on the importance of prayer.
329336273137446913,2013-04-30 20:47:40,JerryMoran,3,0,Twitter Web Client,Glad to be attending @MilkenInstitute Global Conference. Many great thinkers engaging in important dialogue for a better future. #2013GC
329330163840073728,2013-04-30 20:23:24,JerryMoran,6,3,Twitter Web Client,Over 2/3 of the Senate is calling on Pres. Obama to address the backlog in veterans claims. Our vets deserve better. http://t.co/XdJJF9czv0
327892605327253505,2013-04-26 21:11:03,JerryMoran,4,0,Twitter Web Client,Today I visited with @GovMikeHuckabee about my work on the bipartisan #FAA cuts fix #Obamaflightdelays Please listen: http://t.co/paFxjk9bJY
327826760349671424,2013-04-26 16:49:25,JerryMoran,2,1,Twitter Web Client,The additional funding flexibility is more than enough to protect both air traffic controllers &amp; control towers #FAA http://t.co/OETaQQAH9b
327825730618654720,2013-04-26 16:45:19,JerryMoran,2,2,Twitter Web Client,Through smarter cuts—not tax hikes or smoke &amp; mirrors—the #FAA bill provides additional funding flexibility http://t.co/OETaQQAH9b
327818122012811265,2013-04-26 16:15:05,JerryMoran,24,4,Twitter Web Client,"The House joined the Senate to send a clear, bipartisan message to the WH—use your flexibility to put safety first &amp; solve the problem #FAA"
327594384612810752,2013-04-26 01:26:02,JerryMoran,9,1,Twitter Web Client,Senate bill provides enough funding flexibility to cover 149 #FAA control towers slated for closure http://t.co/mxo1EUotXV
327584578728517632,2013-04-26 00:47:04,JerryMoran,4,1,Twitter Web Client,The Senate bill should also provide the #FAA with enough funding flexibility to protect the 149 control towers slated for closure as well.
327583230784073728,2013-04-26 00:41:43,JerryMoran,11,1,Twitter Web Client,Something rare happened in Washington—the Senate came together &amp; put common sense before politics #FAA http://t.co/tqUqYOHisq
327581409134907392,2013-04-26 00:34:28,JerryMoran,0,0,Twitter Web Client,Here's my interview with @larry_kudlow on @CNBC about the progress on air traffic controllers &amp; control towers http://t.co/I4tBN50hsa
327564989240066049,2013-04-25 23:29:13,JerryMoran,3,1,Twitter Web Client,Joining @Larry_Kudlow on @CNBC in a few minutes to talk air traffic controllers &amp; control towers—hope you'll tune in. #ObamaFlightDelays
327458662966767616,2013-04-25 16:26:43,JerryMoran,7,3,Twitter Web Client,Congrats to President George W. Bush &amp; @LauraWBush on the dedication of the @GWBLibrary. It will serve as a resource for history &amp; learning.
327433166321221632,2013-04-25 14:45:24,JerryMoran,1,0,Twitter Web Client,Looking forward to talking #FAA cuts and furloughs with @JonScottFNC on Fox News Channel's @HappeningNow at 11:00 ET - Please tune in!
327145774838337537,2013-04-24 19:43:25,JerryMoran,6,5,Twitter Web Client,No business person would choose to first cut the things that affect customers the most – why is the White House? #FAA http://t.co/tGk0NuyAaW
327121789148868610,2013-04-24 18:08:06,JerryMoran,4,1,Twitter Web Client,"To keep Kansans updated on my work in the Senate, I write a weekly newsletter called Kansas Common Sense. Subscribe:  http://t.co/kgy8CRErTy"
326833870169321472,2013-04-23 23:04:01,JerryMoran,1,0,Twitter Web Client,Tune in to @FoxBusiness during the 7 o'clock hour (CT). I'll be discussing the politics of the #FAA’s sequestration cuts with @TeamCavuto.
326807604053561345,2013-04-23 21:19:39,JerryMoran,8,2,Twitter Web Client,There is clearly something wrong at the #FAA #ObamaFlightDelays http://t.co/wJ8WDoW3ul
326798797185355777,2013-04-23 20:44:39,JerryMoran,2,0,Twitter Web Client,RT @alyvandyke: .@JerryMoran says public safety shouldn't be held hostage for political statement he says emanates from White House over se…
326756119622057984,2013-04-23 17:55:04,JerryMoran,7,1,Twitter Web Client,"Trying to sort out what's going on with FAA tower closures, furloughs, &amp; flight delays? This infographic may help: http://t.co/SQwFi3FkNR"
326505196459012096,2013-04-23 01:17:59,JerryMoran,42,0,Twitter Web Client,RT @AP: AP VIDEO: Flight delays increase after budget cuts force air traffic controllers off job: http://t.co/CNQGOcAj7e -RJJ
326450514541834240,2013-04-22 21:40:42,JerryMoran,0,0,Twitter Web Client,"ICYMI: @SquawkCNBC discuss FAA &amp; @WSJ piece about ""The White House's Operation Wreak Havoc response to the sequester"" http://t.co/69pSUlROrw"
326354332561833985,2013-04-22 15:18:30,JerryMoran,11,4,Twitter Web Client,I am traveling today &amp; witnessing flight delays caused by FAA furloughs. @WhiteHouse putting politics before commonsense. #ObamaFlightDelays
326352822058762242,2013-04-22 15:12:30,JerryMoran,40,8,Twitter Web Client,"FAA furloughs are causing flight delays nationwide. All avoidable, but @WhiteHouse insists on inconveniencing folks. #ObamaFlightDelays"
325441285353775106,2013-04-20 02:50:23,JerryMoran,3,4,Twitter Web Client,"Grateful for the bravery, persistence &amp; expertise that made certain justice will be served in #boston. The victims remain in my prayers."
325292432147247105,2013-04-19 16:58:54,JerryMoran,6,4,Twitter Web Client,"Passed 10,000 @twitter followers today. Thanks to all who interact w/ me via social media. It's become a vital medium for ideas &amp; dialogue."
325032675897376768,2013-04-18 23:46:43,JerryMoran,2,0,Twitter Web Client,Glad to hear about the success of @STEMKC’s Senior Showcase this morning—It highlighted area students who study #STEM http://t.co/OrheCLevrH
325026517165940737,2013-04-18 23:22:15,JerryMoran,3,1,TweetDeck,.@whitehouse puts politics before common sense w/ #FAA furloughs &amp; delays—They have flexibility to make smarter cuts http://t.co/abdoLbsV3g
324967900450545664,2013-04-18 19:29:19,JerryMoran,6,1,TweetDeck,"#FAA Admin says he doesn't have authority to stop #controltower closures, opposed my efforts to give him authority http://t.co/hIl31zXrWu"
324912400040075265,2013-04-18 15:48:47,JerryMoran,9,0,Twitter Web Client,RT @1776dc: Senators @JerryMoran @SenatorBurr @SenSanders discuss boosting Vet entrepreneurship. @Blake_Hall @tak_lo @techstars http://t.co…
324730646662631424,2013-04-18 03:46:34,JerryMoran,9,3,Twitter Web Client,Reading the dreadful news out of Texas. My prayers are with all affected and with those working into the night to respond and provide aid.
324687149259702273,2013-04-18 00:53:43,JerryMoran,2,0,Twitter for iPhone,"RT @ximenahartsock: ""There is optimism in this room because there are innovators in this room! @JerryMoran #digitalpatriots cc @CEA http://…"
324629092077023232,2013-04-17 21:03:01,JerryMoran,3,1,TweetDeck,"RT @SteveCase: The #Immigration Windfall http://t.co/bnHRALotCY ""New study shows potential economic benefits of reform"" #Startupact 3.0"
324620483985301504,2013-04-17 20:28:49,JerryMoran,1,2,Twitter Web Client,We must not forget about the other 11 million – the 11.7 million unemployed Americans #immigration #jobs #startupact http://t.co/iDOBaPhyhK
324597712844619776,2013-04-17 18:58:20,JerryMoran,0,0,Twitter Web Client,"@mcclain_bill Thank you for your service to our country. You can email me your messages, comments or concerns via http://t.co/KALk8IRdFq."
324591214475235329,2013-04-17 18:32:30,JerryMoran,1,0,Twitter Web Client,RT @CEA: Learn more about our Digital Patriot Honoree @JerryMoran! http://t.co/Y3Cf6yBOue
324278546690347009,2013-04-16 21:50:04,JerryMoran,7,2,Twitter Web Client,“The proudest thing I can claim is that I am from Abilene.” -President Dwight D. Eisenhower. http://t.co/Gn7siEq7hP
324277574857527296,2013-04-16 21:46:13,JerryMoran,8,4,Twitter Web Client,"Abilene, Kansas named one of the 20 best small towns to visit in 2013. http://t.co/Gn7siEq7hP"
324244788327096321,2013-04-16 19:35:56,JerryMoran,10,4,Twitter Web Client,"As Israel marks 65 years of independence, I congratulate its people for building a strong &amp; vibrant democracy in the face of great obstacles"
323947368863121408,2013-04-15 23:54:06,JerryMoran,82,37,Twitter Web Client,Our flag flies at half mast tonight over the @USCapitol in honor of the victims of the #BostonMarathon attack. http://t.co/yex0auvwdD
323943843110211584,2013-04-15 23:40:05,JerryMoran,4,3,Twitter Web Client,We must identify those responsible for the #BostonMarathon attack and hold them fully accountable for their crimes http://t.co/PgTxMo7NRV
323888767637282816,2013-04-15 20:01:14,JerryMoran,8,1,Twitter Web Client,My prayers are with all those affected by the explosions in Boston. Grateful for emergency responders &amp; bystanders acting quickly to help.
322816885244706816,2013-04-12 21:01:57,JerryMoran,23,0,Twitter Web Client,"RT @USArmy: Today, #MOHKapaun was inducted into the Pentagon’s Hall of Heroes http://t.co/p15NWoctEK http://t.co/RswPqqpL3U"
322799725764030464,2013-04-12 19:53:46,JerryMoran,6,3,Twitter Web Client,Heard the bipartisan buzz about #StartupAct 3.0? See what folks are saying about this pro-growth legislation: http://t.co/FRTHRM7Oao
322796544686424064,2013-04-12 19:41:08,JerryMoran,14,4,Twitter Web Client,"""We must not let our rulers load us with perpetual debt."" -Thomas Jefferson. http://t.co/cOmnph33qM"
322795329651085312,2013-04-12 19:36:18,JerryMoran,6,2,Twitter Web Client,"From 1980-2005, companies less than 5 years old accounted for nearly all net new job creation in America.#StartupAct http://t.co/TNX8PYui"
322719901091524608,2013-04-12 14:36:34,JerryMoran,3,1,Twitter Web Client,"Today at 1 p.m. CT, Fr. Kapaun will be posthumously inducted into the Hall of Heroes @ the Pentagon. Watch live here: http://t.co/pu4aRGlTPa"
322442526403469312,2013-04-11 20:14:23,JerryMoran,2,0,Twitter Web Client,RT @SenPatRoberts: With senjerrymoran and @repmikepompeo at Father Kapaun's Medal of Honor Ceremony @ White House East Wing http://t.co/ ...
322434810381471744,2013-04-11 19:43:44,JerryMoran,6,4,Twitter Web Client,Fr. Kapaun inspired many with his courage &amp; unshakable faith. His posthumous Medal of Honor Ceremony was very moving. http://t.co/FWnUpwH426
322425124039041025,2013-04-11 19:05:14,JerryMoran,1,2,Twitter Web Client,"Here's a picture of Fr. Kapaun's nephew, Ray Kapaun, before receiving the Medal of Honor on his uncle's behalf. http://t.co/WK6StSwgHS"
322412098359537664,2013-04-11 18:13:29,JerryMoran,3,1,Twitter Web Client,Just arrived at Father Kapaun's Medal of Honor Ceremony. Watch it live here: http://t.co/DfYfud7N7j http://t.co/lbrsBZdj77
322397919611326464,2013-04-11 17:17:08,JerryMoran,8,1,Twitter Web Client,En route to the @whitehouse for Fr. Kapaun's Medal of Honor Ceremony—proud to honor his legacy with @SenPatRoberts http://t.co/DINCqHYrhV
322383002200068098,2013-04-11 16:17:51,JerryMoran,0,2,Twitter Web Client,Are you using @instagram? Follow my work in the United States Senate and my travels across Kansas at http://t.co/Ys2YUUdAxo.
322371451380457472,2013-04-11 15:31:58,JerryMoran,1,1,Twitter Web Client,I look forward to attending Fr. Kapaun’s Congressional Medal of Honor Ceremony at 1:10 p.m. CT. Watch live via http://t.co/jqIFbS8Tyg.
322183006511042562,2013-04-11 03:03:09,JerryMoran,16,6,Twitter Web Client,USA has dropped 9 places in startup-friendliness rankings. It should be the #1 place to start a business. #StartupAct http://t.co/ynFFZKuN
322180692807135232,2013-04-11 02:53:57,JerryMoran,5,4,Twitter Web Client,#StartupAct 3.0 INFOGRAPHIC: 75k new entrepreneurs could create 1.6 million US jobs &amp; boost GDP by 1.6% over 10 years http://t.co/QP60tbkujK
322136929862823936,2013-04-11 00:00:03,JerryMoran,5,3,Twitter Web Client,It was good to see @KState_Pres in DC today. We visited about NBAF and the exciting things happening at @KState. http://t.co/qmMzIsI4f4
322078305127907328,2013-04-10 20:07:06,JerryMoran,4,0,Twitter Web Client,5 Ways U.S. Entrepreneurs Can Support Tech Innovation: http://t.co/8UvHDBxPlC #StartupAct
322077797189304321,2013-04-10 20:05:05,JerryMoran,4,0,Twitter Web Client,The JOBS Act passed over a year ago but has yet to be fully implemented. Finalizing rules should be a priority for new SEC Chairman White.
322050683677327360,2013-04-10 18:17:21,JerryMoran,1,1,Twitter Web Client,I had a great time at @WestPoint_USMA &amp; enjoyed visiting with some of the outstanding West Point cadets from Kansas. http://t.co/ltTmWkFrdn
322045966284910592,2013-04-10 17:58:36,JerryMoran,8,1,Twitter Web Client,"Good news for Kansas, agriculture and the economy today: President Obama's budget commits $714 million to NBAF construction."
321734992336130049,2013-04-09 21:22:54,JerryMoran,7,1,Twitter Web Client,My thoughts and prayers are with the families of the two Manhattan residents killed in a plane crash Sunday. http://t.co/Ed957Dxjl3
321702062603767809,2013-04-09 19:12:03,JerryMoran,5,3,Twitter Web Client,Visited @WestPoint_USMA yesterday &amp; spoke to a political-science class. Expect great things from these future leaders http://t.co/ZMR1Bw8ryk
321346343975137280,2013-04-08 19:38:33,JerryMoran,7,2,Twitter Web Client,Today—Holocaust Remembrance Day—I am taking time to reflect on the millions of innocent lives taken during WWII. #YomHashoah #NeverForget
321256968566239233,2013-04-08 13:43:24,JerryMoran,7,3,Twitter Web Client,The world can learn much from the life of Margaret Thatcher. She was a remarkable leader and a powerful force for freedom in the world.
320931793475887104,2013-04-07 16:11:16,JerryMoran,0,1,Twitter Web Client,Congratulations to @EmporiaUni debaters Elijah Smith &amp; Ryan Wash who won two national debate titles this week.  http://t.co/mLcTETTAvI
320698915366260736,2013-04-07 00:45:54,JerryMoran,20,7,Twitter for iPhone,An outstanding season &amp; tournament performance by Wichita State. Proud to see WSU basketball represent Kansas on the national stage.
320687144505061377,2013-04-06 23:59:08,JerryMoran,6,2,Twitter for iPhone,Great to be in the middle of a huge contingent of Kansans &amp; Shocker fans at the #FinalFour. Let's go Wichita State! http://t.co/tSS2h6SPXZ
320666845415870464,2013-04-06 22:38:28,JerryMoran,2,6,Twitter Web Client,Midway through the first half and the WSU Shockers are looking strong. Proud to be here supporting Wichita State in the #FinalFour.
320558709703057408,2013-04-06 15:28:46,JerryMoran,4,1,Twitter Web Client,Are going to watch the @WichitaState Shockers today? I'm looking forward to cheering them on in person. http://t.co/fnXrfg8UUa #FinalFour
320270201964883968,2013-04-05 20:22:21,JerryMoran,2,1,Twitter Web Client,"DOT's decision to delay closing control towers is not a solution. I will intro bill w @SenBlumenthal to stop closures
http://t.co/sZL8gW9H44"
320262921424871424,2013-04-05 19:53:25,JerryMoran,12,2,Twitter Web Client,"The JOBS Act passed 1 year ago today. Smart, pro-growth policy but still not fully implemented. Finalizing rules should be priority for SEC."
320248199648526336,2013-04-05 18:54:55,JerryMoran,3,2,Twitter Web Client,FAA to delay tower closures until June. Good news but underlying issue remains. Introducing bill next wk to stop closures &amp; protect US skies
320242416839954432,2013-04-05 18:31:56,JerryMoran,7,1,Twitter Web Client,FAA to delay tower closures until June. Good news but underlying issue remains. Introducing bill nxt wk to stop closures &amp; protect our skies
320213123577544704,2013-04-05 16:35:32,JerryMoran,2,0,Twitter Web Client,.@Forbes highlights ways U.S. entrepreneurs can foster tech innovation—one of those is by supporting #StartupAct 3.0 http://t.co/y9QN1zZ5p8
319920168702705664,2013-04-04 21:11:27,JerryMoran,3,5,Twitter Web Client,While driving through Greenwood County today I paid tribute to my mom &amp; stopped at her stone marker at old Lamont HS http://t.co/QpxVGrURYM
319903184632049664,2013-04-04 20:03:57,JerryMoran,2,0,Twitter Web Client,"The myths, the facts, and the economic importance of startup companies in America. #StartupAct http://t.co/Bu3C8bU7Au"
319894608656076800,2013-04-04 19:29:52,JerryMoran,4,0,Twitter Web Client,"Congratulations to Anthony Schmeideler &amp; Jennifer Thornton, recipients of the 1st-ever KU Wounded Warrior Scholarship http://t.co/gXdqqj2Z27"
319880929856331776,2013-04-04 18:35:31,JerryMoran,7,1,Twitter Web Client,"Kansas earns an ""A"" grade in the new @KauffmanFDN study of small business friendliness. http://t.co/lTm9KMJxMt"
319880615417749504,2013-04-04 18:34:16,JerryMoran,2,0,Twitter Web Client,5 Ways U.S. Entrepreneurs Can Support Tech Innovation: http://t.co/8UvHDBxPlC #StartupAct
319820802985971712,2013-04-04 14:36:36,JerryMoran,3,3,Twitter for iPhone,"""5 Ways U.S. Entrepreneurs Can Support Tech Innovation."" See why #StartupAct 3.0 is on the list: http://t.co/8UvHDBxPlC (via @Forbes)"
319564345820454912,2013-04-03 21:37:31,JerryMoran,1,0,Twitter Web Client,Two KU technologies featured today at 2013 University Research &amp; Entrepreneurship Symposium. http://t.co/DX70j1O9Nx
319564102643105794,2013-04-03 21:36:33,JerryMoran,17,3,Twitter Web Client,“The no-brainer immigrant-entrepreneur visa” #StartupAct 3.0 http://t.co/HgoWSqqRcd
319561995328311297,2013-04-03 21:28:11,JerryMoran,4,0,Twitter Web Client,"RT @SiliconPrairie: .@KCPT to debut “Startups, Made in Kansas City” Thursday http://t.co/iqCrCGupds"
319555283313643520,2013-04-03 21:01:31,JerryMoran,5,7,Twitter Web Client,"The myths, the facts, and the economic importance of startup companies in America. #StartupAct http://t.co/Bu3C8bU7Au"
319530550182432769,2013-04-03 19:23:14,JerryMoran,4,1,Twitter Web Client,"Kansas City earns an ""A-"" grade in the new @KauffmanFDN study of small business friendliness. http://t.co/uPkVGgtgqT"
319529389127774208,2013-04-03 19:18:37,JerryMoran,1,0,Twitter Web Client,"The fascinating story of Peter Vermes, @SportingKC's manager, who was just elected to National Soccer Hall of Fame. http://t.co/pHlvAfLcYD"
319526356201398272,2013-04-03 19:06:34,JerryMoran,3,1,Twitter Web Client,Congratulations to @SportingKC manager Peter Vermes who was just voted into the National Soccer Hall of Fame. http://t.co/nAIfdg9QNe
319510945951002624,2013-04-03 18:05:20,JerryMoran,10,0,Twitter Web Client,RT @RepLynnJenkins: Live Twitter Q&amp;A today on #tax reform at 1:30pm CST/2:30pm EST. Follow the convo at http://t.co/8PiogYRWlp. Ask  ...
319505382722641921,2013-04-03 17:43:14,JerryMoran,4,1,Twitter Web Client,"Kansas earns an ""A"" grade in the new @KauffmanFDN study on small business friendliness. http://t.co/lTm9KMJxMt"
319502629728313344,2013-04-03 17:32:17,JerryMoran,1,1,Twitter Web Client,Two KU technologies featured today at 2013 University Research &amp; Entrepreneurship Symposium. http://t.co/DX70j1O9Nx (via @KUNews)
319501804549332992,2013-04-03 17:29:00,JerryMoran,2,0,Twitter Web Client,“The no-brainer immigrant-entrepreneur visa”    #StartupAct 3.0 http://t.co/HgoWSqqRcd
319189696775327745,2013-04-02 20:48:48,JerryMoran,54,6,Twitter Web Client,"The President promised his health care law would reduce costs, but new report suggests claims costs will rise by 32%. http://t.co/Ez6vCscrO6"
319156103948677120,2013-04-02 18:35:19,JerryMoran,0,0,Twitter Web Client,@KauffmanFDN study: #StartupAct 3.0 could create 1.6 milion US jobs in the next 10 years. Full Report: http://t.co/m9jAKgFIjj
319151399789277184,2013-04-02 18:16:37,JerryMoran,2,1,Twitter Web Client,#StartupAct INFOGRAPHIC: 75k new entrepreneurs could create 1.6 million US jobs &amp; boost GDP by 1.6% over 10 years. http://t.co/QP60tbkujK
319151224236699648,2013-04-02 18:15:56,JerryMoran,1,0,Twitter Web Client,I've long worked to open Cuba's mkts to US agriculture but Cuba's imprisonment of Alan Gross quells US will to trade. http://t.co/j2IgDi6UMm
318863768438333441,2013-04-01 23:13:41,JerryMoran,7,0,Twitter Web Client,RT @Kylemccaskey: Kansas Senator Jerry Moran is sporting a Wichita State scarf at a press conference. #watchus http://t.co/VgL7Sux4yR
318840462859444224,2013-04-01 21:41:05,JerryMoran,3,1,Twitter Web Client,Congrats to the new @ChildrensMercy Specialty Clinics in Wichita—their 1st permanent clinic outside the KC Metroplex. http://t.co/XVIJWqAXQE
318531716593618944,2013-04-01 01:14:13,JerryMoran,1,0,Twitter for iPhone,RT @ICTBizJournal: Alive in our VIP Final Four: @JerryMoran and three others. http://t.co/6uiXucXH82
318179496660434945,2013-03-31 01:54:38,JerryMoran,16,13,Twitter for iPhone,Another exciting win tonight by the Wichita State @GoShockers. They're headed to their first Final Four since 1965. #WatchUs #GoShox
317820671705112576,2013-03-30 02:08:47,JerryMoran,4,6,Twitter for iPhone,Proud of @KUAthletics' Men's Basketball Team on a great season. #rockchalk #marchmadness
317615759683616771,2013-03-29 12:34:32,JerryMoran,1,0,Twitter Web Client,"@GoShockers! For the first time in 32 years, @WichitaState is heading to the #Elite8. #MarchMadness #NCAATournament"
317428427907031042,2013-03-29 00:10:09,JerryMoran,5,4,Twitter Web Client,Good luck to Coach Marshall and the #Shox tonight. Time for #Sweet16 win against LaSalle. @WichitaState is making Kansas proud #WATCHUSWIN
317375116201836544,2013-03-28 20:38:18,JerryMoran,1,0,Twitter Web Client,I've long worked to open Cuba's mkts to US agriculture but Cuba's imprisonment of Alan Gross quells US will to trade. http://t.co/rZIpMnVKh5
317362909925748736,2013-03-28 19:49:48,JerryMoran,3,0,Twitter Web Client,RT @ICTBizJournal: Sen @JerryMoran is in much better shape than @Clevpup of @CommerceBank in #ICTBizBC. Can Clevenger still pull it off? ...
317350758037200896,2013-03-28 19:01:31,JerryMoran,2,0,Twitter Web Client,"RT @WSJstartup: Live now: Ask your #startup Qs for WSJ's The #Accelerators @naval, @bfeld and @shafqatislam http://t.co/0p7Up8Zafq   via ..."
317350645017477120,2013-03-28 19:01:04,JerryMoran,5,0,Twitter Web Client,"RT @WSJstartup: Live in 10min:Video chat on #startups with WSJ's The #Accelerators @naval, @bfeld and @shafqatislam http://t.co/0p7Up8Za ..."
317014931511836672,2013-03-27 20:47:04,JerryMoran,5,1,Twitter Web Client,"The President promised his health care law would reduce costs, but new report suggests claims costs will rise by 32%. http://t.co/Ez6vCscrO6"
317004863949119489,2013-03-27 20:07:03,JerryMoran,6,1,Twitter Web Client,"The President promised his health care law would make care more affordable, but a study suggests claims costs will rise by 18.9% for Kansans"
