id,created_at,user,retweets,favorite_count,source,text
461137835257769984,2014-04-29 13:40:02,JerryMoran,2,0,Twitter Web Client,"RT @erikbergrud: Sen. @JerryMoran envisions a future STEM-based economy in KS, wants to keep aspiring scientists in the state. #kc2dc"
460939077303271425,2014-04-29 00:30:14,JerryMoran,4,3,Twitter Ads,April is #FinancialLiteracy month. Taking control of personal finances now can help families prepare for future &amp; reduce economic risk.
460893742019670019,2014-04-28 21:30:05,JerryMoran,2,0,Twitter Web Client,"Sending out my weekly newsletter today. Signup: http://t.co/DGBRZHitlT 
Topics this week: Tornadoes, tankers@McConnellAFB, @FCC rural rates"
460891048865443840,2014-04-28 21:19:23,JerryMoran,1,0,Twitter Web Client,April is #FinancialLiteracyMonth. Prize Linked Savings accounts offer savers chance to win $ while saving for future: http://t.co/9ucStGJeWc
460871767171809281,2014-04-28 20:02:46,JerryMoran,4,0,Twitter Web Client,Spent today with Kansans beginning the long process of recovery after a devastating tornado. Amazed by their strength &amp; eagerness to rebuild
460854297916239873,2014-04-28 18:53:21,JerryMoran,2,5,Twitter Web Client,Glad to be recognized by @congressfdn for using Reddit as a tool for enhanced civic engagement http://t.co/HaRR6sQclT http://t.co/gUWeWbe2g9
460849115476553728,2014-04-28 18:32:45,JerryMoran,5,1,Twitter Web Client,#StartupAct 3.0 would help USA compete in the global battle for talent. More entrepreneurs starting-up in the US =&gt; http://t.co/fdKXY3h9i0
460847929843277824,2014-04-28 18:28:03,JerryMoran,6,3,Twitter Web Client,"Netherlands &amp; Italy approve entrepreneur visas-joining UK, Canada, SKorea &amp; others in attracting talent USA continues to bleed. #StartupAct"
460805597425057792,2014-04-28 15:39:50,JerryMoran,4,3,Twitter Web Client,And not surprisingly—less than 24 hours after the tornado—Kansans were reaching out to help Cherokee Co. individuals and businesses in need.
460805278011641856,2014-04-28 15:38:34,JerryMoran,7,3,Twitter Web Client,I traveled to Baxter Springs this morning to tour of some of the hardest hit areas following last night's tornado. http://t.co/anto9yQAPM
460588216077529088,2014-04-28 01:16:02,JerryMoran,17,5,Twitter Web Client,"My thoughts &amp; prayers go out to all who suffered devastation from the tornadoes striking the Midwest—including folks in Baxter Springs, KS."
459512123081510912,2014-04-25 02:00:02,JerryMoran,6,4,Twitter Ads,The decision to delay the #KeystoneXL is yet another example of this administration prioritizing politics over what’s best for our country.
459481938663714816,2014-04-25 00:00:05,JerryMoran,3,1,Twitter Ads,".@KState launches @kstatelab startup accelerator: 5-week program + $50,000 for 1st-time founders launching in Kansas: http://t.co/J9X2F0aQtn"
459449014489206784,2014-04-24 21:49:15,JerryMoran,1,0,Twitter Web Client,Here's a write-up from the @macsentinel about my remarks at McPherson Rotary Club this week. http://t.co/LnF4RamUYV
459406472820953088,2014-04-24 19:00:13,JerryMoran,13,14,Twitter Ads,"Young adults moving to Kansas City http://t.co/pHF63PBCkj music scene, job growth, GoogleFiber, BBQ, @KCSV, food-trucks &amp; low cost of living"
459398935233036289,2014-04-24 18:30:16,JerryMoran,1,0,Twitter Ads,We must do everything possible to return Alan Gross home to the USA &amp; bring his family’s terrible nightmare to an end http://t.co/uQHW04hWxI
459394330957185024,2014-04-24 18:11:58,JerryMoran,3,1,Twitter Web Client,Great to see Bob Dole sharing his wisdom &amp; experience across Kansas. A hero and one of our state's greatest leaders. http://t.co/st2HFcipGN
459057540291366913,2014-04-23 19:53:41,JerryMoran,1,1,Twitter Web Client,IRS workers were awarded bonuses despite being disciplined for infractions such as fraud &amp; failure to pay taxes. http://t.co/5xGkvX6xyn
458764597512912896,2014-04-23 00:29:38,JerryMoran,5,2,Twitter Web Client,After lengthy enviro. impact review there is no longer any question – @McConnell22ARW is &amp; will continue to be nation’s super tanker base.
458693067659542528,2014-04-22 19:45:24,JerryMoran,7,5,Twitter Web Client,".@KState launches @KStateLAB startup accelerator: 5-week program + $50,000 for 1st-time founders launching in Kansas: http://t.co/fNj5pwu0XB"
458690216833064960,2014-04-22 19:34:04,JerryMoran,2,3,Twitter Web Client,"Kansas City a top 'hipster' city http://t.co/57n4OOLkjP complete w/ music, tech, @SportingKC, food trucks, GoogleFiber &amp; low cost of living."
458684830193303552,2014-04-22 19:12:40,JerryMoran,0,1,Twitter Web Client,April is #FinancialLiteracyMonth. Prize Linked Savings accounts offer savers chance to win $ while saving for future: http://t.co/9ucStGJeWc
458683532106547200,2014-04-22 19:07:30,JerryMoran,1,1,Twitter Ads,April is #FinancialLiteracy month. Taking control of personal finances now can help families prepare for future &amp; reduce economic risk.
458666589160603648,2014-04-22 18:00:11,JerryMoran,1,0,Twitter Ads,"Call them hipsters, millennials, young professionals; more &amp; more young adults are finding KC a friendly place to be: http://t.co/pHF63PBCkj"
458630290898817024,2014-04-22 15:35:56,JerryMoran,4,6,Twitter Ads,"Kansas City a top 'hipster' city http://t.co/pHF63PBCkj music, tech, restaurants, @SportingKC, food trucks, GoogleFiber &amp; low cost of living"
458628416812883968,2014-04-22 15:28:30,JerryMoran,2,2,Twitter Web Client,"From 2009 to 2012, Kansas City had a greater annual net gain of people ages 25-34 than Atlanta, NYC, Boston &amp; LA: http://t.co/57n4OOLkjP"
458341856200634368,2014-04-21 20:29:48,JerryMoran,0,0,Twitter Web Client,Saving &amp; investing are vital to financial health. @mint has 5 tips to consider for better #FinancialLiteracy http://t.co/mDHHGjCWCn
458302499523272704,2014-04-21 17:53:25,JerryMoran,1,0,Twitter Ads,"Sending out my weekly newsletter later today. Signup: http://t.co/dpTTS2FYAA 
Today's topics: FederalReserve, KC shooting, NIH@KU, town hall"
458301072063209472,2014-04-21 17:47:45,JerryMoran,2,1,Twitter Ads,"April is Financial Literacy month. By taking charge of our personal finances now, we can better protect ourselves from future economic risk."
458283112779112448,2014-04-21 16:36:23,JerryMoran,2,0,Twitter Ads,"Sending out my #KansasCommonSense newsletter. Signup: http://t.co/dpTTS2FYAA
Today's topics: OP violence, NIH@KU, veterans &amp; Federal Reserve"
457931603600502784,2014-04-20 17:19:36,JerryMoran,9,18,Twitter Web Client,Happy Easter
457248467552059392,2014-04-18 20:05:04,JerryMoran,23,14,Twitter Web Client,The decision to delay the #KeystoneXL is yet another example of this administration prioritizing politics over what’s best for our country.
457165830581919744,2014-04-18 14:36:42,JerryMoran,4,4,Twitter Web Client,I encourage you to read this @TheNewtonKansan story about my town hall meeting in Halstead this week. http://t.co/vtpS9qlIQp
456811798952296449,2014-04-17 15:09:54,JerryMoran,3,4,Twitter Web Client,Kicked off my morning in Halstead for another Kansas Listening Tour stop. http://t.co/KQ2YlqZkC9
456590412954628096,2014-04-17 00:30:12,JerryMoran,4,2,Twitter Ads,We must do everything possible to return Alan Gross home to the USA &amp; bring his family’s terrible nightmare to an end http://t.co/uQHW04hWxI
456520184119820288,2014-04-16 19:51:08,JerryMoran,2,2,Twitter Ads,Kansas City teens have planned a vigil &amp; candlelit walk from JCC to Village Shalom Friday evening to honor &amp; remember http://t.co/n3IrXxOQVz
456477536348688384,2014-04-16 17:01:40,JerryMoran,20,0,Twitter Web Client,"RT @NIHDirector: Honored to give remarks at @scicoalition ""Champion of Science"" award presentation at KU to Sen @JerryMoran http://t.co/OmX…"
456450882335285249,2014-04-16 15:15:45,JerryMoran,1,7,Twitter Web Client,I'm kicking off the morning in Wichita at a roundtable with my military and veterans advisory committee. http://t.co/sHwikBmAkK
456398914233462784,2014-04-16 11:49:15,JerryMoran,3,0,Twitter Web Client,I encourage you to tune in to @knssradio in the 7 a.m. CT hour — I'll be visiting with Steve and Ted. http://t.co/t7uibvOUWG
456173111118143488,2014-04-15 20:51:59,JerryMoran,4,0,Twitter Web Client,"RT @ICTBizEmily: If you weren't able to make the @WSUCFE #DevlinForum, we're pulling together tweets from @ICTBiz_JHeck &amp; others:  http://t…"
456172987595882496,2014-04-15 20:51:30,JerryMoran,3,0,Twitter Web Client,RT @ICTBiz_jheck: Moran: Future of state depends on the ability to create educational opportunities. #DevlinForum
456171737558708224,2014-04-15 20:46:32,JerryMoran,2,5,Twitter Ads,KC area teens are taking the lead in honoring victims killed in Sunday's tragic shootings http://t.co/IKGE1wJaUO
456168911009247233,2014-04-15 20:35:18,JerryMoran,5,0,Twitter Web Client,"RT @wsucfe: ""Entrepreneurship and innovation are necessary to grow our country's economy."" - @JerryMoran at #DevlinForum http://t.co/sI0rN5…"
456168543781126145,2014-04-15 20:33:50,JerryMoran,2904,0,Twitter Web Client,RT @RumsfeldOffice: That I &amp; most Americans have no idea whether our taxes are accurate tells us something. My annual letter to the #IRS: h…
456160052294848514,2014-04-15 20:00:06,JerryMoran,6,13,Twitter Ads,Kansas City teens have planned a vigil &amp; candlelit walk from JCC to Village Shalom Friday evening to honor &amp; remember http://t.co/n3IrXxOQVz
456160052273889280,2014-04-15 20:00:06,JerryMoran,17,16,Twitter Ads,Kansas City teens have planned a vigil &amp; candlelit walk from JCC to Village Shalom Friday evening to honor &amp; remember http://t.co/n3IrXxOQVz
456138911291809792,2014-04-15 18:36:05,JerryMoran,4,0,Twitter Web Client,RT @Sikh24: Sikh Community Stands in Solidarity with Jewish Community in Kansas - Sikh Leaders in Kansas City Send M... http://t.co/rAdEIym…
456138712326623233,2014-04-15 18:35:18,JerryMoran,208,0,Twitter Web Client,RT @RockhurstHS: Students wear white today to honor those affected by tragic shootings at Jewish Comm. Center &amp; Village Shalom. AMDG http:/…
456129897367224320,2014-04-15 18:00:16,JerryMoran,1,4,Twitter Ads,"One year after the Boston Marathon bombing, we remember the lives lost &amp; the everyday heroes who acted to help others &amp; apprehend suspects."
456125356584341504,2014-04-15 17:42:14,JerryMoran,8,6,Twitter Ads,KC area teens are taking the lead in honoring victims killed in Kansas shootings http://t.co/IKGE1wJaUO
456122209216786433,2014-04-15 17:29:43,JerryMoran,1,3,Twitter Web Client,Happy Passover to all of the Jewish families in Kansas and around the world.
456120472665882624,2014-04-15 17:22:49,JerryMoran,3,0,Twitter Web Client,Sign ups for @USDA livestock disaster programs start today. Contact your local @usdafsa office for more information. http://t.co/csyMynL7gV
455843375586234368,2014-04-14 23:01:44,JerryMoran,2,0,Twitter for iPhone,RT @annwilson_news: @JerryMoran was recognized with the Champion of Science Award at the @DoleInstitute this morning. Coverage on @6NewsLaw…
455811511261609984,2014-04-14 20:55:07,JerryMoran,2,2,Twitter Web Client,Good to see you both! MT @JonathanDMast: @Sassysutherngal &amp; @JerryMoran @ National Institutes of Health KS discussion http://t.co/4DBBuv6KhH
455810270225371136,2014-04-14 20:50:11,JerryMoran,6,8,Twitter Web Client,"Today, @NIHDirector &amp; I took questions at the @DoleInstitute about the importance and impact of biomedical research http://t.co/HdI6mz18WE"
455808305902800896,2014-04-14 20:42:23,JerryMoran,6,3,Twitter Web Client,Happy Birthday to @NIHDirector! We enjoyed hosting you in Kansas today. http://t.co/TnK2ooGJFo
455739136369254400,2014-04-14 16:07:32,JerryMoran,8,0,Twitter for iPhone,RT @JackRCline: @JerryMoran accepting @scicoalition Champion of Science award @DoleInstitute @KUnews. #innovationdeficit http://t.co/oRZ43q…
455424682976894976,2014-04-13 19:18:00,JerryMoran,16,9,Twitter for iPhone,Hearing horrible news of shootings at KC Jewish Community Center and Village Shalom. Praying for safety of everyone there.
454703398453919744,2014-04-11 19:31:53,JerryMoran,3,3,Twitter Web Client,I continued the statewide listening tour in LaCrosse at Rush Cty. Courthouse today. Great conversation with Kansans. http://t.co/QcBCOh1zTD
454696728176775168,2014-04-11 19:05:22,JerryMoran,2,1,Twitter Web Client,Good to see Ned Brack from Great Bend today – a U.S. Navy Veteran who served during the Vietnam War. http://t.co/3rQAs7mE2E
454666610477789184,2014-04-11 17:05:42,JerryMoran,3,0,Twitter Web Client,Good to kick off my weekend in KS at the @GreatBendKS Farm and Ranch Expo w/ 700 exhibitors highlighting farming tech http://t.co/lasSrxdHm5
454362662428606464,2014-04-10 20:57:55,JerryMoran,1,0,Twitter Web Client,Thanks to KLA for taking the time to stand up for producers in Kansas and across the country. Good to have you in DC http://t.co/wSGdHrVDcr
454320238306533376,2014-04-10 18:09:20,JerryMoran,13,0,Twitter Web Client,"RT @homesforhackers: After launching the hacker house 18 months ago, 20 hackers &amp; 36 @airbnb Fiber Tourists have come to KC thru the #H4H p…"
454294742290165761,2014-04-10 16:28:01,JerryMoran,3,0,Twitter Web Client,Good to see @WhiteHouse meeting with entrepreneurs today. USA must fix its laws to better reflect understanding of challenges startups face.
454292489894375424,2014-04-10 16:19:04,JerryMoran,9,0,Twitter Web Client,RT @SiliconPrairie: Jayhawks explore Seattle tech scene during two-day networking trip http://t.co/xOGZVYw7x4 http://t.co/NR55hMznJ7
453980578636132353,2014-04-09 19:39:39,JerryMoran,0,0,Twitter Web Client,We must do everything possible to return #AlanGross to the U.S. and bring his family’s terrible nightmare to an end. http://t.co/qgz1CG1rL1
453977292860325889,2014-04-09 19:26:35,JerryMoran,1,0,Twitter Web Client,"“We will lift each other up with our compassion, strength &amp; resilience—because that is who we are."" @GENRayOdierno #fthood Memorial Service"
453915276380483584,2014-04-09 15:20:09,JerryMoran,3,7,Twitter Web Client,My prayers go out to the victims and students at Franklin Regional High School.
453607266047250432,2014-04-08 18:56:14,JerryMoran,3,0,Twitter Web Client,RT @SiliconPrairie: Silicon Prairie startups on avg. raised $859K in seed &amp; Series A funding. Read more: http://t.co/cdZ7Sk1i2z http://t.co…
453584770795311105,2014-04-08 17:26:51,JerryMoran,5,1,Twitter Web Client,Billions of tax-$ spent to implement &amp; promote Obamacare. HHS evading Qs. Americans deserve to know the real costs. http://t.co/knfNXNnmLt
453261592746934273,2014-04-07 20:02:39,JerryMoran,5,5,Twitter Web Client,"Congrats to Mitch Richmond! K-Stater, 6x NBA all-star &amp; Olympic gold winner to be inducted to Basketball Hall of Fame http://t.co/aAgpEER7Ea"
453182067816558592,2014-04-07 14:46:39,JerryMoran,1592,0,Twitter Web Client,"RT @KU_Hoops: April 7th, 2008---6 years ago to the day. http://t.co/icLb17A5Wf"
453166426787160064,2014-04-07 13:44:30,JerryMoran,2,1,Twitter Web Client,"Sending out my #KansasCommonSense newsletter later today. Signup: http://t.co/DGBRZHitlT Today's topics: FDA, Iran, internet governance, NIH"
452158608851996672,2014-04-04 18:59:47,JerryMoran,4,3,Twitter Web Client,.@HeroDogsInc trainee Mitch visited my office yesterday—He’s going to do a great job serving injured &amp; disabled vets. http://t.co/7SJZplkUiX
452147573986320384,2014-04-04 18:15:56,JerryMoran,3,3,Twitter Web Client,.@StartupWeekend Hays begins tonight 6:30PM @ FHSU. for anyone with an idea for a new business http://t.co/arRNi0iUYj http://t.co/6dbytkESeu
452145772784402432,2014-04-04 18:08:47,JerryMoran,3,1,Twitter Web Client,Calling all aspiring rocket scientists! NASA @SpaceApps Challenge is returning to Kansas City http://t.co/wLbzsedyTg http://t.co/qv7a2vSvpf
452141171612352513,2014-04-04 17:50:30,JerryMoran,2,0,Twitter Web Client,"RT @thelaborparty: ""...companies less than 5 years old account for nearly all net new job creation in the US."" from @JerryMoran http://t.co…"
452140164064616449,2014-04-04 17:46:30,JerryMoran,3,1,Twitter Web Client,.@KState researchers: cancer fighting radiation can be securely stored in nontoxic molecule. http://t.co/tHRPHUfJpx http://t.co/apzJj7l3VX
452099318229762048,2014-04-04 15:04:11,JerryMoran,0,0,Twitter Web Client,"""Silly &amp; counterproductive for Koskinen to...deny the phrase 'targeting' had been used""  #3Pinocchios #IRStargeting http://t.co/45W8JA8HnW"
452095502805630976,2014-04-04 14:49:02,JerryMoran,13,0,Twitter Web Client,RT @politico: It looks like Dems' dream for an economy that breaks out of the doldrums is fading fast http://t.co/ZVg5rx5ZuG via @morningmo…
451886886030565376,2014-04-04 01:00:03,JerryMoran,2,2,Twitter Ads,.@KState research finds cancer fighting radiation can be securely stored in nontoxic molecule http://t.co/tHRPHUfJpx http://t.co/hztgiVYzPy
451840324059418624,2014-04-03 21:55:02,JerryMoran,5,4,Twitter Web Client,It was an honor to pay tribute to a great Kansan on the @SenateFloor today—Alvin Brensing http://t.co/7IfyuLxgJw http://t.co/VmpCWph1Ue
451828826528808960,2014-04-03 21:09:21,JerryMoran,1,0,Twitter Web Client,Finance Comm recognizes #StartupAct R&amp;D credit can be valuable tool for new companies not yet profitable. Learn more: http://t.co/GP4kP0RZJZ
451822724730466304,2014-04-03 20:45:06,JerryMoran,2,3,Twitter Web Client,Calling all aspiring rocket scientists! NASA @SpaceApps Challenge is returning to Kansas City http://t.co/wLbzsedyTg http://t.co/vD5iwe4P4h
451822588415991808,2014-04-03 20:44:34,JerryMoran,2,1,Twitter Web Client,"Soon I'll be honoring a Kansas businessman, volunteer, husband &amp; father—Hudson's Alvin Brensing—on the @SenateFloor. http://t.co/5AlQC4kCW2"
451485601725177856,2014-04-02 22:25:30,JerryMoran,5,7,Twitter Web Client,Please join me in praying for Fort Hood.
451413871845441537,2014-04-02 17:40:28,JerryMoran,9,6,Twitter Web Client,"As Senate debates extending unemployment benefits, I offered amendment to address the underlying causes of unemployment. Dems objected. Why?"
451400045128982528,2014-04-02 16:45:32,JerryMoran,4,4,Twitter Web Client,Here’s my view from the @SenateApprops Health Subcommittee Hearing this morning with @NIH Director Francis Collins. http://t.co/Y2ST7Ehk5a
451215001684946944,2014-04-02 04:30:14,JerryMoran,6,3,Twitter Ads,How Kansas City scored the biggest technological coup of the century http://t.co/rFtlDbHfCM @SiliconPrairie #GoogleFiber
451169699112316929,2014-04-02 01:30:13,JerryMoran,8,4,Twitter Ads,".@SiliconPrairie series on @GoogleFiber, Part-1: How Kansas City scored the biggest technological coup of the century http://t.co/rFtlDbHfCM"
451132094006460417,2014-04-01 23:00:47,JerryMoran,2,0,Twitter Web Client,"UI &amp; Minimum Wage are symptoms of larger problem: Americans want &amp; need #jobs—Good ideas exist, Senate Dems won't act http://t.co/fbNwNoTc6d"
451118365562925056,2014-04-01 22:06:14,JerryMoran,3,0,Twitter Web Client,"RT @GarretteSilv: #StartupAct introduced as an Amdt to UI bill by @JerryMoran—To date, Senate denied opportunity to have vote on this job-c…"
451117574634622977,2014-04-01 22:03:05,JerryMoran,2,0,Twitter Web Client,"RT @GarretteSilv: .@JerryMoran ""This President and this Senate have done nothing to increase Americans' chances of finding a better #job."" …"
451053419265290240,2014-04-01 17:48:09,JerryMoran,3,0,Twitter Web Client,"Do you have a ""pre-existing zip code""? Under Obamacare, rural Americans confront higher health care costs: http://t.co/J1w9EgLqRM (@AP)"
451045102077501440,2014-04-01 17:15:07,JerryMoran,8,6,Twitter Web Client,"""How Kansas City scored the biggest technological coup of the century"" http://t.co/rFtlDbHfCM @SiliconPrairie http://t.co/Ta56Qe14uz"
451040833039794176,2014-04-01 16:58:09,JerryMoran,4,1,Twitter Web Client,"Last night on the Senate Floor, I honored the Mull Family—Kansans who tragically perished in a plane crash last month http://t.co/1PQjvKHRHt"
451021394424635392,2014-04-01 15:40:54,JerryMoran,2,0,Twitter Web Client,I look forward to speaking w/ @KBUF 1030 AM's Lory Williams during the 11 o'clock CT hour — tune in or listen live. http://t.co/hnVBuwG5T2
450759094698516481,2014-03-31 22:18:37,JerryMoran,4,0,Twitter Web Client,"Following tonight's votes, I will pay tribute to a Kansas family who tragically perished in a plane crash last month http://t.co/5AlQC4kCW2"
450668951102824449,2014-03-31 16:20:25,JerryMoran,0,1,Twitter Web Client,.@AP: Rural residents confront higher health care costs http://t.co/J1w9EgLqRM
449610527115718656,2014-03-28 18:14:37,JerryMoran,11,7,Twitter Ads,Great news—India is #polio free. Thx @rotary @CDCgov &amp; @gatesfoundation for leadership. W/ 99% of work complete we can put an end to polio.
449549760748601344,2014-03-28 14:13:09,JerryMoran,4,3,Twitter Web Client,Are you on @instagram? I encourage you to find and follow me — SenJerryMoran.
449296927214297088,2014-03-27 21:28:29,JerryMoran,6,2,Twitter Web Client,Great news—India is #polio free. Thx @Rotary @CDCGov &amp; @gatesfoundation for leadership. W/ 99% of work complete we can put an end to polio.
449282090903674880,2014-03-27 20:29:32,JerryMoran,0,0,Twitter Ads,Concerned about the federal govt? Click to recieve updates on what Congress is up to &amp; how it affects rural America: http://t.co/dpTTS2FYAA
449268310384050176,2014-03-27 19:34:46,JerryMoran,2,1,Twitter Web Client,"Here's my statement on the @USFWSHQ listing of the lesser prairie chicken as a threatened species
http://t.co/CantQqreYc"
449251076718346241,2014-03-27 18:26:18,JerryMoran,1,1,Twitter Ads,"If our goal is more opportunity+bigger paychecks+better products @ lower prices, we must ease path for entrepreneurs: http://t.co/bCK7PCRyO7"
449228027940319232,2014-03-27 16:54:42,JerryMoran,1,0,Twitter Web Client,RT @GregAkagi: Thurs #580WIBW Ag Issues Podcast w/@JerryMoran | Kansas Ag Network http://t.co/VWgqyiAweS #EPA #LesserPrairieChicken #KsAg
449138051613478912,2014-03-27 10:57:10,JerryMoran,4,1,Twitter Web Client,Good morning—I'm about to join Kelly Lenz on @WIBWNews' Kansas Ag Network. Tune in or listen live. http://t.co/cRmBtcYkHW
448995339215708160,2014-03-27 01:30:05,JerryMoran,9,7,Twitter Ads,.@KState grad &amp; EyeVerify CEO Toby Rush’s journey from farmhand to founder http://t.co/49r91FtBSY via @SiliconPrairie http://t.co/l71cMkVotD
448921466810425344,2014-03-26 20:36:32,JerryMoran,0,1,Twitter Web Client,"Good reminder. MT @TrooperGary It is raining as I leave Hutchinson. Friendly reminder — Wipers On, Headlights On! http://t.co/dLps4yKU98"
448886315267137537,2014-03-26 18:16:52,JerryMoran,3,0,Twitter Web Client,Highlights need for increased emphasis on mental health &amp; making sure those serving US abroad get care &amp; support needed after returning home
448885268456542208,2014-03-26 18:12:42,JerryMoran,6,3,Twitter Ads,"Iraq &amp; Afghanistan Veterans Of America planting 1,892 US flags today. Each represents a 2014 veteran/svc mbr suicide http://t.co/Lg72KQKcDB"
448883698583470080,2014-03-26 18:06:28,JerryMoran,4,3,Twitter Web Client,"Tune in: @NASA is announcing Exploration Design Challenge finalists —congrats to Team Erion of Erie, Kansas http://t.co/FbV9j175MC"
448879197012770816,2014-03-26 17:48:35,JerryMoran,0,2,Twitter Ads,EyeVerify CEO Toby Rush’s journey from farmhand to founder http://t.co/49r91FtBSY via @SiliconPrairie http://t.co/Y4Wzom2Si0
448876174681190400,2014-03-26 17:36:34,JerryMoran,2,0,Twitter Ads,Trust mainstream media to always tell the truth? Get direct updates on how actions by federal gov't may affect you: https://t.co/j3EUSgE5uM
448823851947147264,2014-03-26 14:08:39,JerryMoran,4,5,Twitter Web Client,Last night’s enrollment extension is latest unilateral change to #Obamacare designed to hide massive policy flaws &amp; admin. incompetence.
448655641456832512,2014-03-26 03:00:15,JerryMoran,3,1,Twitter Ads,"Smarter allocation of federal $ would reduce deficit, increase innovation &amp; facilitate econ growth http://t.co/8aknYLLbyy #InnovationDeficit"
448625406497652736,2014-03-26 01:00:06,JerryMoran,4,0,Twitter Ads,Every week I send Kansans an honest update about what Congress is working on and how it will affect KS. Sign up here: http://t.co/dpTTS2FYAA
448551816566177793,2014-03-25 20:07:41,JerryMoran,2,0,Twitter Web Client,"Hit the nail on the head w/ Hays, Kansas MT @TheAtlantic How we say hello around the country http://t.co/Tf1A7Pifuj"
448534708549214208,2014-03-25 18:59:42,JerryMoran,0,1,Twitter Web Client,My pleasure. MT @ubmsmama Thanks to @JerryMoran &amp; his team for their support of Kansas programs! #TRIOWorks http://t.co/NOTypjhsVB
448528449486196736,2014-03-25 18:34:50,JerryMoran,8,7,Twitter Web Client,The threat to religious liberty by government overreach should be of concern to all Americans – regardless of faith. #HobbyLobby #Obamacare
448492993033433088,2014-03-25 16:13:56,JerryMoran,7,10,Twitter Web Client,Happy National #AgDay to all who contribute to #Ag in Kansas &amp; America— Great visiting w/ @KStateAg students in DC http://t.co/XADq3W15P8
448263044049555456,2014-03-25 01:00:12,JerryMoran,12,10,Twitter Ads,More buzz about @kcsv @1millioncupskc &amp; KC's rise as midwest tech-hub http://t.co/WyYYySAgED @NYTimes @Techcrunch @FT http://t.co/DbXZ7AiPMC
448206506282852353,2014-03-24 21:15:33,JerryMoran,3,12,Twitter Web Client,Congrats to Gregg Marshall on his well-deserved Coach of the Year award &amp; historic 35-1 season http://t.co/im2zlzzueg http://t.co/KSQXl5UlBz
448187568069562368,2014-03-24 20:00:17,JerryMoran,6,0,Twitter Web Client,".@AAF report: ""Affordable Care Act"" has imposed 2.5x more costs than it has produced in benefits. http://t.co/mhf00fqbPl"
