id,created_at,coordinates,retweets,favorite_count,source,text
820290107026509824,2017-01-14 15:22:56,,3,7,Twitter Web Client,The Climate Intelligence Agency  https://t.co/MugP1m84hM via @WSJ
820289367562473472,2017-01-14 15:20:00,,4,12,Twitter for iPad,First sign of enhanced U.S.-Russia relations under Trump: An invite to Syria talks https://t.co/X75C1pzaJJ
820287878232231940,2017-01-14 15:14:05,,14,42,Twitter for iPad,Best of luck to the @DallasCowboys and the @HoustonTexans in their divisional playoff games this weekend.  #TexasProud
820078802638348288,2017-01-14 01:23:17,,5,24,Twitter for iPhone,"Cornyn and Cruz on ACA repeal, Trump's cabinet picks  https://t.co/xwFTB222fb"
820061930366914560,2017-01-14 00:16:14,,12,34,Twitter for iPad,Rarely applied https://t.co/yuUqmFtU5Q
820058682310455297,2017-01-14 00:03:20,,78,0,Twitter for iPad,"RT @DBrandewie: CBS Austin: @JohnCornyn and @SenTedCruz on ACA repeal, Trump's cabinet picks  https://t.co/BEvCgSoLiO"
820052407526768640,2017-01-13 23:38:24,,200,216,Twitter for iPad,#BREAKING: Intelligence Committee will investigate possible Russia-Trump links–Senate Intellig… via @POLITICO https://t.co/OkwO0lfcsp
820051595945709568,2017-01-13 23:35:10,,4,0,Twitter for iPhone,"RT @VanceGinn: Great to see you today at #TXPO2017, @JohnCornyn! It's been a while since I interned for you in the Lubbock office in 2004.…"
820051404752617472,2017-01-13 23:34:25,,9,0,Twitter for iPhone,RT @ISAACforTexas: About to listen to our US Senators @JohnCornyn &amp; @tedcruz at @TPPF Policy Orientation. Great to catch up w/ Sen. Cornyn.…
820047658303819776,2017-01-13 23:19:32,,9,34,Twitter for iPhone,Much enthusiasm for America's future at @TPPF's #TXPO2017.  Great things on the horizon! https://t.co/8uai9llMfX
820047039258050560,2017-01-13 23:17:04,,8,18,Twitter for iPhone,Lots of yucks with @BrookeRollinsTX and @SenTedCruz at @TPPF's #TXPO2017 in Austin today https://t.co/6FcxvVKVCf
820029923897311232,2017-01-13 22:09:03,,14,34,Twitter Web Client,Law change allowing Mattis to serve as defense secretary heads to the White House https://t.co/jmFqVzSXm0 via @DCExaminer
819938887866916867,2017-01-13 16:07:19,,55,99,Twitter Web Client,"Good advice: ""Let the laws be clear, uniform and precise;
to interpret laws is almost always to corrupt them.""
-- Voltaire (1694-1778)"
819922684461064192,2017-01-13 15:02:56,,8,0,Twitter Web Client,RT @hotairblog: Q-poll: 65% want some or all of ObamaCare repealed https://t.co/J1Nea1rPrA
819921412467081216,2017-01-13 14:57:52,,30,0,Twitter Web Client,RT @SenTedCruz: Joining @TPPF #TXPO2017 with @JohnCornyn today! Watch LIVE at 12:30pmCT --&gt; https://t.co/oi9nC2aAWa
819918906747973632,2017-01-13 14:47:55,,11,31,Twitter Web Client,A good choice; someone we can work with: Mexico to name new ambassador to the United States https://t.co/ouubZRFDFF
819750548278824961,2017-01-13 03:38:55,,8,0,Twitter for iPhone,"RT @dwayne_bohac: Washington, DC, to be close to 60 degrees on Inauguration Day on Friday the 20th.  Sounds great!  #txlege https://t.co/ZY…"
819744144117657602,2017-01-13 03:13:28,,1513,0,Twitter for iPhone,"RT @transition2017: ""It would be the highest honor, if I am confirmed, to lead those who volunteer to defend our country"" - Gen. James Matt…"
819702118286168068,2017-01-13 00:26:28,,5,0,Twitter for iPad,"RT @hughhewitt: Audio/transcript intv w/ @JohnCornyn re ""unpacking"" DC Circuit using #TheReidRule on #TheByrdRule in Reconciliation: https:…"
819695935718465536,2017-01-13 00:01:54,,19,65,Twitter for iPad,Manufactured in Fort Worth &amp; soon to be stationed there:  Air Force picks @NASFortWorthJRB for F-35 squadron https://t.co/tj3r7jxoSR
819669826490744832,2017-01-12 22:18:10,,2,10,Twitter for iPhone,"US to end 'wet foot, dry foot' policy for Cubans - CNN https://t.co/6loU3b8wXY"
819608308864708612,2017-01-12 18:13:43,,140,0,Twitter for iPhone,"RT @SenateGOP: ""Obamacare should be repealed and replaced with health care choices ... at a price you can afford."" – @JohnCornyn #RepealOba…"
819574424072491008,2017-01-12 15:59:04,,8,48,Twitter for iPhone,Who really controls auto-correct on Twitter anyway?
819572977025056768,2017-01-12 15:53:19,,4,14,Twitter for iPhone,Auto-correct got me: Pompeo
819570316020248576,2017-01-12 15:42:44,,22,51,Twitter for iPhone,"Lights suspiciously went off in hearing room for new CIA director, Mike Pompey. Hmmm... ."
819534230640332803,2017-01-12 13:19:21,,5,5,Twitter for iPad,I'll be on with @hughhewitt at 8:30 ET / 7:30 CT. Be sure to tune in here: https://t.co/ea2oRa08Xa
819356088889962496,2017-01-12 01:31:29,,6,0,Twitter for iPhone,RT @JohnCornyn: Top GOP senator wants 'rescue teams' for customers as Obamacare is killed https://t.co/7ERJAOESiK via @DCExaminer
819310268169785346,2017-01-11 22:29:24,,15,33,Twitter for iPad,"Today I met with Robert Lighthizer, whom President-Elect Trump has announced he will nominate to serve as U.S. Trad… https://t.co/Bmfrjkf2YH"
819205433680396288,2017-01-11 15:32:50,,23,37,Twitter Web Client,Former Sen. Nunn: Tillerson can lower risk of nuclear war with Russia https://t.co/7oHbfBFRfz via @DCExaminer
819203647020081154,2017-01-11 15:25:44,,7,15,Twitter for iPad,Ukrainian efforts to sabotage Trump backfire via @POLITICO for iOS https://t.co/sig4U4uFIo https://t.co/kRCO0gwYN0
819194648539303938,2017-01-11 14:49:58,,13,16,Twitter for iPhone,Byron York: Sessions showdown fizzles https://t.co/8sWRsT9dgi via @DCExaminer
819192218258960384,2017-01-11 14:40:19,,5,0,Twitter for iPhone,"RT @tombenning: .@JohnCornyn touts Tillerson's business experience. But adds: ""He’s been recognized for his humility and his altruism."""
819192096838090752,2017-01-11 14:39:50,,5,0,Twitter for iPhone,"RT @tombenning: .@JohnCornyn says Tillerson ""knows how to separate friendships from business. He knows who he works for."""
819191816759152640,2017-01-11 14:38:43,,10,0,Twitter for iPhone,"RT @jaketapper: Introducing Sec'y of State nominee Rex Tillerson: @JohnCornyn, @tedcruz, former Sen Sam Nunn, former Defense Sec'y Bob Gates"
819148544137428992,2017-01-11 11:46:46,,11,9,Twitter Web Client,U.S. seeks 2 year prison term for former vice chair of Joint Chiefs of Staff in leak case https://t.co/2SM1uGfoss
819008698580344832,2017-01-11 02:31:04,,35,0,Twitter for iPhone,"RT @SenJohnMcCain: Great mtg w/ my friend @GovernorPerry today, a great choice for @ENERGY Sec - look fwd to supporting his nomination http…"
819008660143833089,2017-01-11 02:30:55,,41,0,Twitter for iPhone,"RT @SenJohnMcCain: North #Texas is lucky to have been served by @SamJohnsonTX03 - my friend, comrade &amp; American hero https://t.co/ODex1eKsW…"
819008617139605505,2017-01-11 02:30:45,,90,0,Twitter for iPhone,RT @SenJohnMcCain: My friend Dan Coats is tremendous public servant &amp; patriot - glad he will have opportunity to serve nation as Director o…
819008527947694080,2017-01-11 02:30:24,,54,0,Twitter for iPhone,RT @SenJohnMcCain: Appreciate @senrobportman &amp; @clairecmc's impt work exposing backpage dot com's facilitation of child sex trafficking htt…
818999492452163585,2017-01-11 01:54:29,,164,0,Twitter for iPhone,"RT @Heritage: ""If the best evidence the Left can concoct against Sessions relies on discredited allegations ... they will fail."" https://t.…"
818999258611351552,2017-01-11 01:53:34,,11,0,Twitter for iPhone,"RT @TheRepLawyer: GOP Senators asking great questions about federalism, separation of powers, and rule of law; Sessions giving great answer…"
818992612396896257,2017-01-11 01:27:09,,21,0,Twitter for iPhone,"RT @SherylNYT: Predictable DC theater. Crazy ladies in pink screaming, set back opposition. Sessions reasoned &amp; calm. Collins gives cover.…"
818989083926102017,2017-01-11 01:13:08,,9,6,Twitter for iPad,The Hill: GOP senator warns of 'jam' if ObamaCare repeal is delayed https://t.co/sYQ0ftiicJ
818988818070208512,2017-01-11 01:12:04,,7,16,Twitter for iPad,The Hill: Senate poised to confirm Trump's DHS pick after friendly hearing https://t.co/JjeNmRyhIT
818987394380820480,2017-01-11 01:06:25,,41,0,Twitter for iPad,"RT @seungminkim: .@SenTomCotton: ""I’m very disappointed that Sen Booker has chosen to start his 2020 presidential campaign by testifying ag…"
818987285173641217,2017-01-11 01:05:59,,4,0,Twitter for iPad,RT @seungminkim: I see @JohnCornyn tweeting during this hearing.
818985788113383426,2017-01-11 01:00:02,,6,9,Twitter Web Client,Top GOP senator wants 'rescue teams' for customers as Obamacare is killed https://t.co/7ERJAOESiK via @DCExaminer
818985463742689284,2017-01-11 00:58:45,,4,14,Twitter Web Client,Byron York: Sessions showdown fizzles https://t.co/N8ryhCJhIe via @DCExaminer
818974409511866368,2017-01-11 00:14:49,,20,32,Twitter for iPhone,"Intelligence leaders say Russians, and other nations, have been hacking US networks for decades https://t.co/sgAwgoMhEG"
818969321649111043,2017-01-10 23:54:36,,40,147,Twitter for iPhone,My friend Senator Jeff Sessions will be refreshing improvement as Attorney General https://t.co/rJgPjGBW2D
818960613011554304,2017-01-10 23:20:00,,21,54,Twitter for iPhone,"Good to meet with Scott Pruitt, whom President-Elect Trump has chosen for Administrator of the U.S. Environmental P… https://t.co/Fz9EvyodCP"
818939012685688833,2017-01-10 21:54:10,,4,0,Twitter for iPhone,"RT @TxFOIFT: Questioning AG nominee Sessions, @JohnCornyn asks him to protect the public's right to know if he's confirmed. #opengov"
818938906834063360,2017-01-10 21:53:45,,4,11,Twitter for iPhone,Hearing Highlights: Democrats Do Little to Undermine Jeff Sessions - The New York Times https://t.co/W6uozFdfhK
818918425980530690,2017-01-10 20:32:22,,5678,0,Twitter for iPhone,"RT @DanScavino: ""I feel blessed &amp; honored to have partnered w/ Senator Sessions in being the senate sponsors in this important award.""
Sena…"
818904223228293121,2017-01-10 19:35:55,,2539,0,Twitter for iPhone,RT @Varneyco: William Smith: I worked for Senator Jeff Sessions​ for years and he's never been racist... the smear campaign must end https:…
818903849683468289,2017-01-10 19:34:26,,2,0,Twitter for iPhone,"RT @benvoelkel: @gadget_83 @JohnCornyn Hi, our team is working to clear the voicemail + note concerns. You can also contact us here: https:…"
818903392483475456,2017-01-10 19:32:37,,20,0,Twitter for iPhone,"RT @JonScottFNC: Sen. @JohnCornyn to @SenatorSessions: “We know your heart. We know what kind of person you are."" https://t.co/azwgYX6edb"
818815742263128065,2017-01-10 13:44:20,,17,20,Twitter Web Client,Millions of Obamacare enrollees already had health insurance https://t.co/kaHKBUzYVN via @DCExaminer
818815561270525952,2017-01-10 13:43:37,,10,13,Twitter Web Client,Schumer accidentally tweets 'Don't Make America Great Again' https://t.co/Sbdn9XZnhu via @DCExaminer
818785953632419840,2017-01-10 11:45:58,,41,67,Twitter Web Client,Seal of approval: John Cornyn will introduce Rex Tillerson at Senate hearing https://t.co/iT630XAGEv via @dallasnews
818784484732665856,2017-01-10 11:40:08,,13,41,Twitter Web Client,Tim Scott endorses Sessions https://t.co/bp0lmdmH3A
818614667421552640,2017-01-10 00:25:20,,56,155,Twitter for iPhone,Thanks. No Senate vote on nominees until ethics vetting completed https://t.co/GVHM80JPXI
818517217411301376,2017-01-09 17:58:06,,10,30,Twitter for iPhone,Enjoyed catching up with Cong. Mike Pompeo whom President-Elect Trump has chosen to head the Central Intelligence A… https://t.co/aUjdyw8x8C
818506863876669441,2017-01-09 17:16:58,,19,23,Twitter Web Client,Incurable Obamacare https://t.co/8slE0hloGP via @WeeklyStandard
818500978064445440,2017-01-09 16:53:34,,16,25,Twitter Web Client,Congress should not delay confirmation of the new Cabinet https://t.co/6tbPKwgL6Q via @dallasnews
818490073192759296,2017-01-09 16:10:14,,20,0,Twitter Web Client,"RT @rossramsey: @Glenn_Hegar says #txlege will start this budget with a $1.53 billion fund balance. 2 years ago, that was $7.29 billion."
818489324043956224,2017-01-09 16:07:16,,43,0,Twitter for iPhone,RT @fxnopinion: Senate Majority Leader McConnell: ObamaCare failed Americans. Now it's time for relief | via @SenateMajLdr https://t.co/bQl…
818422269995315200,2017-01-09 11:40:49,,80,237,Twitter Web Client,Entertainment figures have the right to use their fame to express political opinions; we have the right not to patronize them
818103925362532357,2017-01-08 14:35:50,,14,45,Twitter Web Client,"Have you wondered why post-high school education dollars follow the student, while K-12 dollars go to the school an… https://t.co/Mg3B3aIx1G"
818102498875637761,2017-01-08 14:30:09,,479,0,Twitter Web Client,"RT @Heritage: Many Americans face fewer insurer options, higher insurance deductibles, and higher premiums than before Obamacare. https://t…"
818101506733916163,2017-01-08 14:26:13,,6,24,Twitter Web Client,Mitt Romney: Trump has made a smart choice for education secretary https://t.co/huB57yrFsX
818099519988658178,2017-01-08 14:18:19,,3,18,OS X,Look for more grants to fund mental health initiative like this due this new law: https://t.co/d3EXduINEZ https://t.co/gkR9Xd6TC7
818096839375331328,2017-01-08 14:07:40,,414,0,Twitter Web Client,"RT @seanspicer: Current @StateDept spox ""when u r a political appointee in this or any other Admin u have no expectation of staying on. Tha…"
818096719565099008,2017-01-08 14:07:12,,7,11,Twitter Web Client,"Thousands of Marines fought in southern Afghanistan. Now, the service is going back. https://t.co/we4O3qZJZo"
818080464242143233,2017-01-08 13:02:36,,1,5,Twitter Web Client,"After abandoning its One-Child Policy, Outrage at China’s Offer to Remove IUDs https://t.co/eM1AKWmIqH"
817908528627253248,2017-01-08 01:39:23,,23,0,Twitter for iPhone,RT @DallasBizNews: Study: This DFW city is the second best in the country for jobs: https://t.co/ya2ikRYmAu
817893837515452416,2017-01-08 00:41:01,,831,0,Twitter for iPhone,"RT @AnnCoulter: Inasmuch as today is Day 14 on the Obama Countdown Clock, I tweeted “14.” https://t.co/ArR3JMApGV"
817893290611773441,2017-01-08 00:38:50,,44,265,Twitter for iPhone,Go Texans!
817866842744193024,2017-01-07 22:53:45,,9,60,Twitter for iPhone,"No, the wife and I made them :-) https://t.co/q3gEu02rub"
817866462308274176,2017-01-07 22:52:14,,246,0,Twitter for iPhone,RT @spurs: Game Day at Our House. #GoSpursGo https://t.co/74EI0pwLyh
817866128043245570,2017-01-07 22:50:54,,18,47,Twitter for iPhone,I assure they will all be thoroughly vetted before confirmation https://t.co/ebzz5UxCVC
817865084408070144,2017-01-07 22:46:45,,15,163,Twitter for iPhone,Nothing like enchiladas on a cold winter's night https://t.co/kEdZASs1I5
817740144891531264,2017-01-07 14:30:18,,5,28,OS X,Will (4): Obama’s foreign policy presumed the existence of “the community of nations.” But that phrase … that is oxymoronic
817739699527806976,2017-01-07 14:28:31,,1,10,OS X,"Will (3): History, which, in progressives’ lexicon, is a proper noun, an autonomous thing with a mind, or at least a logic, of its own."
817738380377198592,2017-01-07 14:23:17,,4,19,Twitter Web Client,"Will (2): and China, which is shredding international law by turning the world’s most important waterway into militarized Chinese territory."
817738243269660672,2017-01-07 14:22:44,,1,11,Twitter Web Client,"Will (2): Two seemingly unimpressed nations are Russia, which is dismembering a European nation (Ukraine),"
817736452016603136,2017-01-07 14:15:37,,30,58,Twitter Web Client,Will: Obama’s foreign policy was error after error https://t.co/1ejraNGI7i
817726920121085952,2017-01-07 13:37:45,,12,13,OS X,The Russian hacking: Subversion of Western democracies is old news | Foreign and Defense Policy Blog » AEIdeas https://t.co/8l5MgKo1vd
817723248993533952,2017-01-07 13:23:09,,71,84,Twitter Web Client,Russian Intervention in American Election Was No One-Off https://t.co/fUjF6a3jeC
817720602761039872,2017-01-07 13:12:38,,6,29,Twitter Web Client,Trump Says He’ll Appoint Team to Recommend Cyber Defense Methods
817720401572859904,2017-01-07 13:11:50,,8,40,Twitter Web Client,Good news: Dan Coats Nominated by Trump to Be Director of Natl Intelligence
817716716847431682,2017-01-07 12:57:12,,2,6,Twitter Web Client,Phil Gramm and Michael Solon: Preserve the filibuster—then overcome it https://t.co/L2wREfUqfM via @WSJ
817518198698508288,2017-01-06 23:48:21,,30,0,Twitter for iPhone,RT @KenGardner11: Obama was as bad on cybersecurity as he was on health care policy. Maybe even worse. And that’s saying something.
817517838462316544,2017-01-06 23:46:56,,46,0,Twitter for iPhone,RT @JohnCornyn: WSJ: Mr. Putin is an authoritarian who came of age as a Soviet spy and wants to damage U.S. interests around the world.
817508226992402433,2017-01-06 23:08:44,,26,94,Twitter for iPhone,Happy Aniversary: George H.W. and Barbara Bush celebrate 72 years of marriage @GeorgeHWBush
817496439723085824,2017-01-06 22:21:54,,5,13,Twitter for iPhone,Why Pence is crucial for Trump's agenda https://t.co/vIyyJepx2b
817469705246175232,2017-01-06 20:35:40,,25,42,Twitter for iPhone,The Electoral College presidential ballots being carried by Senate pages through the @uscapitol rotunda.… https://t.co/LZr9FV6bEo
817451682636374017,2017-01-06 19:24:03,,368,0,Twitter for iPhone,"RT @RandPaul: I introduced legislation to #AuditTheFed, tune in tonight to @FoxNews at 7pm as I join @TuckerCarlson to discuss this bill!"
817451346920177665,2017-01-06 19:22:43,,205,0,Twitter for iPhone,"RT @FoxNews: .@JohnCornyn: ""ObamaCare is failing the American people right now today."" https://t.co/Gnxy1tJY4Q"
817451254611841026,2017-01-06 19:22:21,,7,0,Twitter for iPhone,"RT @jslovegrove: Sen. @JohnCornyn on news of Rep. Sam Johnson's retirement, calls him ""an American hero in every sense of the word"" https:/…"
817336409472331776,2017-01-06 11:46:00,,9,20,Twitter Web Client,Senate Democrats complain about their workload in new Congress: https://t.co/cvSb6ed0G8
817335079521361920,2017-01-06 11:40:42,,2,9,Twitter Web Client,"Cold War relic, present-day threat https://t.co/2RFD605FKz"
817330547852800000,2017-01-06 11:22:42,,3,6,Twitter Web Client,"The Bone Cave harvestman, a blind arachnid, roils a big Texas ranch https://t.co/8r1Rtli7P0 via @WSJ"
817167792466198529,2017-01-06 00:35:58,,24,0,Twitter for iPhone,"RT @RichardRubinDC: What happens to Mexican beer if there's an import tax? 
Make Corona More American! 
Really. #DBCFT 
https://t.co/X1LC6n…"
817155807913590784,2017-01-05 23:48:21,,7,0,Twitter for iPhone,"RT @toddgillman: Energy Secretary-designate @GovernorPerry ""has the right experience and skills,"" says @SenJohnMcCain https://t.co/UTU2Cr7z…"
817155731187232769,2017-01-05 23:48:02,,13,0,Twitter for iPhone,RT @MilitaryTimes: Trump selects former Sen. Coats for top intelligence post https://t.co/gKDx3Ski8o
817155011356528642,2017-01-05 23:45:11,,16,0,Twitter for iPhone,RT @hillhulse: Interesting that @JohnCornyn went on Intel Committee. Gives leadership a seat on panel at center of inquiry into Russian hac…
817069655906979842,2017-01-05 18:06:01,,5,0,Twitter for iPhone,"RT @jendeben: .@JohnCornyn to Dems: “Holding up confirmations just for delay's sake is irresponsible, and it's dangerous.”"
817056067549065216,2017-01-05 17:12:01,,222,586,Twitter for iPhone,"Enjoyed talking with Treasury Sec nominee Steve Mnuchin about relief for community banks, taxes, trade, economic gr… https://t.co/kIMgmtlTvR"
817054750340448256,2017-01-05 17:06:47,,11,30,Twitter for iPad,Ds on Obamacare:  We sold you a lemon - and you have to keep it!
817054085488709632,2017-01-05 17:04:08,,12,35,Twitter for iPad,Good news! https://t.co/46BdPf22Sm
817016316938899462,2017-01-05 14:34:04,,30,87,Twitter for iPad,I am for repeal of Obamacare and reforming health care so Americans can get coverage they want at a price they can… https://t.co/Dxns6d9eCE
817008833658843136,2017-01-05 14:04:19,,20,34,Twitter for iPad,"In a small town in Texas, a rural hospital thrives against all odds https://t.co/GL8T9R0ir6 via @statnews"
816979069359312897,2017-01-05 12:06:03,,5,15,Twitter for iPhone,Two US Senate Committees to Hold Hearings on Suspected Russian Hacking https://t.co/c7QZn3JZY7
816815182236135424,2017-01-05 01:14:49,,13,0,Twitter for iPhone,"RT @Matwork21: None have yet been nominated but Dems are already opposed to them...nice to be  ""tolerant, open-minded liberal"" https://t.co…"
816810017034792960,2017-01-05 00:54:18,,20,0,Twitter for iPhone,"RT @RestoreHonor: My premium went up by 69%, and the deductible went up from $6000 to $6500. I'm jobless, live in TX, and no subsidy. https…"
816805436930359297,2017-01-05 00:36:06,,21,41,Twitter for iPhone,36X: Obama said of Obamacare if you like what you have you can keep it.  Undeniably false
816803737989685250,2017-01-05 00:29:21,,22,47,Twitter for iPhone,The worst AG ever https://t.co/s4dZZzvH92
816789837760122880,2017-01-04 23:34:07,,6,6,Twitter for iPhone,Russia’s new favorite jihadis: The Taliban | FDD's Long War Journal https://t.co/cper4CS70a
816782531773267968,2017-01-04 23:05:05,,12,0,Twitter for iPhone,RT @SenDeanHeller: Had a productive meeting with AG nom. @SenatorSessions today. We discussed important issues facing #NV and the nation’s…
816782000094937088,2017-01-04 23:02:58,,6,10,Twitter for iPhone,Senators plan to revive sentencing reform push https://t.co/qoEc5YL5lW
816781129919426560,2017-01-04 22:59:31,,26,0,Twitter for iPhone,"RT @sahilkapur: “If we can't do better than Obamacare we might as well look for another line of work,” says @JohnCornyn."
816780982472671233,2017-01-04 22:58:55,,22,82,Twitter for iPhone,"Good to see former Texas Governor Rick Perry, whom President-Elect Trump  chosen to serve as U.S. Secretary of Ener… https://t.co/Yjc6r2jXTk"
816730172821045248,2017-01-04 19:37:01,,57,68,Twitter for iPad,"Apparently believing Obamacare is perfect, Senate Democrats vow to block health care reform even though many of them have called for changes"
816729427421908993,2017-01-04 19:34:04,,7,0,Twitter for iPad,"RT @jslovegrove: ""I'm frankly disappointed,"" says @JohnCornyn, that @chuckschumer is talking about obstructing healthcare reforms after Oba…"
816729166586507265,2017-01-04 19:33:02,,8,14,Twitter for iPad,Jeff Sessions pushed JASTA and real accountability https://t.co/vwfIwG8spx
816689603667259392,2017-01-04 16:55:49,,14,16,Twitter Web Client,Son of civil rights activist tried by Sessions: He's not racist https://t.co/OQv5LSKWO5 via @DCExaminer
816605042107097088,2017-01-04 11:19:48,,32,69,Twitter for iPhone,GOP plans to crush Democratic opposition to Trump Cabinet https://t.co/ITWczc2nau
816459317893332992,2017-01-04 01:40:45,,37,0,Twitter for iPhone,"RT @burgessev: .@JohnCornyn: “The Senate can stay in session around the clock, we can stay through the weekend"" https://t.co/pCHuo91JMG"
816434856028676096,2017-01-04 00:03:32,,8,7,Twitter for iPhone,"DOD: US has 28,000 troops in South Korea"
816422269576761344,2017-01-03 23:13:32,,10,28,Twitter for iPhone,"Congrats to @SenRonJohnson
@senrobportman
@ChuckGrassley on their swearing in for #115thCongress https://t.co/aQOLcx3YWR"
816405829922525184,2017-01-03 22:08:12,,18,34,Twitter Web Client,Trump calls for 'no further' Gitmo releases https://t.co/2bkUW7HTFW via @DCExaminer
816404809200836609,2017-01-03 22:04:09,,5,16,Twitter for iPad,The Hill: Schumer regrets Dems triggering 'nuclear option' https://t.co/D8ruZMl1XL
816403384509009928,2017-01-03 21:58:29,,6,17,Twitter for iPad,Senate to vote on Obamacare repeal budget next week via @POLITICO for iOS https://t.co/FQHMY1jjUU https://t.co/Ywvj41cXq0
816399049008021504,2017-01-03 21:41:15,,6,9,Twitter for iPad,New Senate Judiciary Committee https://t.co/QIQteSv2Gn
816381912314834945,2017-01-03 20:33:10,,102,0,Twitter Web Client,"RT @ABCPolitics: JUST IN: Hillary and Bill Clinton to attend inauguration of Donald Trump, aides confirm to @joshbhaskell."
816381795885137925,2017-01-03 20:32:42,,287,0,Twitter Web Client,"RT @ABCPolitics: NEW: Pres. George W. Bush, Laura Bush to attend inauguration of Donald Trump. https://t.co/elauL7JPG4 https://t.co/JEOAbvT…"
816372349368930309,2017-01-03 19:55:10,,16,0,Twitter Web Client,RT @katieleslienews: Sen. @JohnCornyn appointed to select committee on Intelligence. Will continue to serve on Finance and Judiciary commit…
816360393065005057,2017-01-03 19:07:39,,14,23,Twitter for iPhone,"Look out for at least 3 TX groups in @TrumpInaugural parade in DC: Ft. Hood’s @1stCavalryDiv, BCS' Lil’ Wranglers, &amp; @TXST Strutters."
816350554851069954,2017-01-03 18:28:33,,7,0,Twitter for iPhone,RT @Sarah_K_Brooks: Majority Whip @JohnCornyn on the Senate floor - says the GOP 'takes the responsiblity of being the majority seriously'…
816350492246900736,2017-01-03 18:28:19,,7,0,Twitter for iPhone,RT @Sarah_K_Brooks: Texas Sen. @JohnCornyn on #Obamacare: It's one of the big reasons democrats find themselves in the minority #115thcongr…
816350360717721600,2017-01-03 18:27:47,,3,0,Twitter for iPhone,"RT @kelmej: .@JohnCornyn jabs @SenSchumer: ""he already declared the Trump presidency over, &amp; he's not even going to be sworn in [til] 17 da…"
816307585892708352,2017-01-03 15:37:49,,1,2,Twitter Web Client,"@washingtonpost: ""The liberal world order faces existential threats in the year ahead... ."""
816305314916159488,2017-01-03 15:28:47,,8,16,Twitter Web Client,"WSJ: [D]emonization of cops has contributed to Chicago’s surge of violence, with the principal victims being young minorities... """
816305117351870466,2017-01-03 15:28:00,,6,8,Twitter Web Client,Murder and Policing in Chicago https://t.co/0i4i1OyBHQ via @WSJ
816243318141124608,2017-01-03 11:22:26,,2,2,Twitter Web Client,The Health Data Conundrum https://t.co/K3BYel4nog
