id,created_at,user,retweets,favorite_count,source,text
576032526734635008,2015-03-12 14:50:31,john_dingell,0,0,Twitter for Android,и раскрывала пуховый платок
575701029821550592,2015-03-11 16:53:16,john_dingell,0,0,Twitter for Android,"В Украине опять выборы? Хорош над страной изголяться, делите её на троих – Ющенке, Тимошенке и Януковичу!"
574964508709511168,2015-03-09 16:06:35,john_dingell,0,0,Twitter for Android,Очень часто ожидание и страх боли больнее самой боли.
574191838954979328,2015-03-07 12:56:17,john_dingell,0,0,Twitter for Android,который и был ему предоставлен. Содоклад ровно ничего не изменил. За
573223465446203393,2015-03-04 20:48:18,john_dingell,0,0,Twitter for Android,когда теряет способность и желание учиться.
572382284495642625,2015-03-02 13:05:45,john_dingell,0,0,Twitter for Android,вновь отражаюсь...
556330204889874432,2015-01-17 06:00:31,john_dingell,0,0,Twitter for Android,Самые высокие мысли подсказывает нам сердце.
