id,created_at,coordinates,retweets,favorite_count,source,text
750353845553815553,2016-07-05 15:41:12,,65,53,Twitter for iPhone,"Section 793 of Espionage act uses ""gross negligence"" vs ""extremely careless"" standard in treatment of classified information as found by FBI"
750334996460638208,2016-07-05 14:26:18,,343,0,Twitter for iPhone,RT @JoeNBC: Secretary of Obvious: Clintons arrange a private meeting with AG Lynch &amp; publicly dangle a job offer all in a week. https://t.c…
750334632101441536,2016-07-05 14:24:51,,10,2,Twitter for iPhone,Hillary Clinton’s Negatives Complicate Ties Down the Ballot - WSJ https://t.co/vVi5GRPmVU
750333646372872193,2016-07-05 14:20:56,,13,5,Twitter for iPhone,NY Times: Clinton may keep Lynch as attorney general https://t.co/wjhM5vB3RO via @DCExaminer
750333045446569988,2016-07-05 14:18:33,,20,21,Twitter for iPhone,"Hillary can't seem generate excitement for her campaign so she has to rely on Obama, Warren, et al"
750332493409062912,2016-07-05 14:16:21,,8,14,Twitter for iPhone,And your viable alternative is ... Hillary?  Not.  https://t.co/DD870TT3t4
750331875189616640,2016-07-05 14:13:54,,19,15,Twitter for iPhone,Getting harder and harder for Hilllary to deny she isn't running for Obama's third term
750305384028442624,2016-07-05 12:28:38,,21,12,Twitter for iPhone,"Under investigation by his Justice Dept., THE PRESIDENT and Secretary Clinton depart Joint Base Andrews en route Charlotte, North Carolina"
750304109702504448,2016-07-05 12:23:34,,2,4,Twitter for iPhone,Great evening with @cchooks https://t.co/dK9mN0vneS
750163029967269888,2016-07-05 03:02:58,,125,0,Twitter for iPhone,RT @SharylAttkisson: Benghazi explained simply &amp; concisely w/help from Special Ops and CIA experts https://t.co/AZpRYd0NNH
750125515135004672,2016-07-05 00:33:54,,8,18,Twitter for iPhone,Got to meet a few of the @cchooks players tonight at the game #ImHooked https://t.co/tj4w6IU1eg
750087999816294400,2016-07-04 22:04:49,,15,47,Twitter for iPhone,Great to meet some men &amp; women serving our nation in the military. Thank you for defending our freedom. https://t.co/xUhp7SeLM7
750087770039660544,2016-07-04 22:03:54,,14,33,Twitter for iPhone,Sandy &amp; I had a great time riding in @CityofCC's Big Bang Parade this morning. Happy Independence Day! #BigBangCC https://t.co/8hKSIQaQES
750084208551292929,2016-07-04 21:49:45,,7,0,Twitter for iPad,RT @Dist32StateRep: Participated in today's Big Bang Parade. Great seeing @JohnCornyn #CorpusChristi https://t.co/ukQJLAkk6w
749981631922921472,2016-07-04 15:02:09,,22,0,Twitter for iPhone,RT @JohnBoozman: #HappyIndependenceDay. Thank you to the men &amp; women who serve &amp; sacrifice to defend our freedoms #happy4thofjuly https://t…
749981188274532352,2016-07-04 15:00:23,,10,5,Mobile Web,"House committee to highlight EPA's 76,000 pages of regs under Obama https://t.co/3esmZ12pah via @DCExaminer"
749934998048956416,2016-07-04 11:56:51,,13,9,Twitter Web Client,The Iran deal at one year: Reality vs. the promises https://t.co/nx1qhaHQZN via @nypost
749934115206692865,2016-07-04 11:53:20,,22,14,Twitter Web Client,Loretta Lynch’s Clinton Mess https://t.co/rB9sGxMWFx via @WSJ
749933232922189824,2016-07-04 11:49:50,,4,0,Twitter Web Client,RT @KRIS6News: #Texas Senator @JohnCornyn will be in #CorpusChristi today celebrating #4thofJuly https://t.co/d0Gajx3PCF https://t.co/FP8zO…
749931389051633664,2016-07-04 11:42:30,,6,20,Twitter Web Client,"Pride of Spring, Texas: Meet Simone Biles,  who is about to turn Olympic gymnastics upside down https://t.co/kVbrRlCwHt"
749929198828085252,2016-07-04 11:33:48,,6,3,Twitter Web Client,"Near Russia’s border with the Baltics, soldiers on both sides are practicing for war https://t.co/0mvFHySdt6"
749927753349201920,2016-07-04 11:28:04,,3,1,Twitter Web Client,Can Hillary Clinton overcome her trust problem? https://t.co/TdEkrxZQz0
749926990132707328,2016-07-04 11:25:02,,10,21,Twitter Web Client,"Happy 240th birthday, America!"
749925817510137858,2016-07-04 11:20:22,,3,3,Twitter Web Client,"As ISIS Loses Land, It Gains Ground in Overseas Terror https://t.co/9BlHePnXZG"
749925109973053440,2016-07-04 11:17:33,,1,5,Twitter Web Client,Cornyn to ride in Big Bang Parade https://t.co/yyk48Md0xf
749782184567857152,2016-07-04 01:49:37,,2,4,Twitter for iPhone,Look forward to celebrating Independence Day in ​​@CityofCC w/@CCTexasMayor #BigBangCC
749780943259340800,2016-07-04 01:44:41,,7,0,Twitter for iPhone,RT @EdgardoCorreaa: Thank you for the lovely letter U.S. Senator @JohnCornyn ! https://t.co/9J53u71wac
749739680489312258,2016-07-03 23:00:43,,145,0,Twitter for iPad,RT @SenateGOP: .@SenWarren said she'd support #Zika funding b/c this is a health emergency. Then opposed it? Politics at its worst. https:/…
749667052491726848,2016-07-03 18:12:08,,4,10,Twitter for iPad,"Please vote for and encourage other Senate Ds to vote for funding this week, Heidi  https://t.co/YWEnysDAwC"
749665260429144065,2016-07-03 18:05:00,,20,10,Twitter for iPad,FBI Flagged This Congressman as a Terrorist. Here's Why He Opposes a New Gun Ban. - The Daily Signal https://t.co/ZCw25teb4I
749612245324328960,2016-07-03 14:34:21,,425,0,Twitter Web Client,"RT @JonahNRO: Love how Hillary says that her husband and Lynch ""wouldn't do it again.""

Of course they wouldn't. They only needed the one m…"
749593532579577856,2016-07-03 13:19:59,,9,8,Twitter Web Client,Coons Rips Lynch for Private Huddle With Bill Clinton: ‘This Meeting Sends the Wrong Signal’ https://t.co/yIiQ0ZDOku
749593006228008960,2016-07-03 13:17:54,,34,14,Twitter Web Client,CIA Director Brennan Says Istanbul Bombings Should Serve as Warning to U.S. https://t.co/3eTBUfz5OD
749587152015679488,2016-07-03 12:54:38,,10,8,Twitter Web Client,"11,431 Rape Kits Were Collected and Forgotten in Detroit. This Is the Story of One of Them. - A https://t.co/CKqocucrGm via @ElleMagazine"
749586348219179008,2016-07-03 12:51:26,,20,11,Twitter Web Client,49% Say Clinton Lied To Victims’ Families About Benghazi Attack https://t.co/tksk4NFlU5 via @sharethis
749585271889489920,2016-07-03 12:47:10,,7,7,Twitter Web Client,True https://t.co/tyI4tDJ671
749581658685370368,2016-07-03 12:32:48,,3,4,Twitter Web Client,The Myth of Cosmopolitanism https://t.co/408aQaadkH
749578196648095744,2016-07-03 12:19:03,,8,2,Twitter Web Client,Bangladesh Attack Is New Evidence That ISIS Has Shifted Its Focus Beyond the Mideast https://t.co/OMWWsPRsBa
749417587675574273,2016-07-03 01:40:51,,27,0,Twitter for iPhone,RT @dcexaminer: These were the nine biggest #Benghazi discoveries from Trey Gowdy's committee report https://t.co/gef5zpfh2X https://t.co/r…
749417479726723072,2016-07-03 01:40:25,,44,0,Twitter for iPhone,"RT @weeklystandard: ""She has no right ... to tell me it's time to move on. They're not in my shoes."" —Widow of Navy SEAL Tyrone Woods https…"
749368290766573568,2016-07-02 22:24:57,,119,0,Twitter for iPad,"RT @SenateGOP: 45 @SenateDems voted no on funding an anti-Zika bill that would protect women and babies. #FightZikaNow #Zika 
https://t.co/…"
749300986305400832,2016-07-02 17:57:31,,67,0,Twitter for iPhone,"RT @SenatorTimScott: And now Hillary meets with FBI for 3.5 hours today. As @JohnCornyn has said over and over, special prosecutor needed h…"
749297278620307456,2016-07-02 17:42:47,,57,51,Twitter for iPhone,"When Bill ""coincidentally"" bumped into AG Lynch did he know Hillary was scheduled to be interviewed by FBI?"
749280904632086532,2016-07-02 16:37:43,,8,6,Twitter for iPhone,Clinton campaign says she was interviewed by FBI about emails https://t.co/zJ5Q6IfDAb
749279220820348928,2016-07-02 16:31:01,,3,4,OS X,What an inspiration: Alan Graham and the good folks with Mobile Loaves &amp; Fishes — Mobile Loaves &amp; Fishes https://t.co/udReym4tlP
749264527221481472,2016-07-02 15:32:38,,8,3,Twitter Web Client,The imploding cabal to criminalize climate dissent https://t.co/VMjNT1qLDe via @nypost
749259080280203264,2016-07-02 15:10:59,,25,28,OS X,WP: POTUS is actively campaigning for Clinton while Justice Department is still in the process of deciding whether she should be prosecuted
749258621444317184,2016-07-02 15:09:10,,19,16,Twitter Web Client,How everyone looks bad because Bill Clinton met with Loretta Lynch https://t.co/TvSyz99Vml
749257660508303360,2016-07-02 15:05:21,,6,6,Twitter Web Client,State Nearing Goal of 250 New Border Troopers https://t.co/jq4QkVraoH via @TexasTribune
749254016157253633,2016-07-02 14:50:52,,11,17,Twitter Web Client,Sen. Ayotte calls on AG Lynch to recuse herself from email case - Hot Air https://t.co/5jLzt3pGEJ
749223855223345152,2016-07-02 12:51:01,,11,30,OS X,Pres. Reveley of Longwood University: “the role of college is not purely jobs. It’s democracy. It’s to produce citizens.”
749010816188375040,2016-07-01 22:44:29,,9,25,Twitter for iPad,Honored to join @MayorAdler to present  @Austin_Police Sgt. Johnson the Congressional Badge of Bravery https://t.co/0dwLF6Lj7g
749009222197604352,2016-07-01 22:38:09,,19,18,Twitter for iPad,Senate Ds blocking Zika funding over demands for more Planned Parenthood funding. #sad
749001380518457344,2016-07-01 22:06:59,,6,7,Twitter for iPad,Lax gun laws or terrorism? ISIS takes claim for shooting attack in Bangladesh's capital #Bangladesh. https://t.co/FFC1qyPBMX
748998752187191297,2016-07-01 21:56:32,,17,29,Twitter for iPad,Here's my challenge to National Spelling Bee Co-Champion Nihar Janga to spell sesquipedalian. https://t.co/Zu1jcdcrae
748994094270062593,2016-07-01 21:38:02,,3,0,Twitter for iPad,RT @KWRutter: FOIA is Improved - Thanks @JohnCornyn https://t.co/pHMhlztfOp via @POGOBlog
748987999157751808,2016-07-01 21:13:49,,6,3,Twitter for iPad,Zika in Texas https://t.co/yho3ElBCO4
748986736680636416,2016-07-01 21:08:48,,4,12,Twitter for iPad,APD Sgt. receives Congressional Badge of Bravery https://t.co/oM0bI1pXPK
748986078099496960,2016-07-01 21:06:11,,8,0,Twitter for iPad,RT @KirkPWatson: @DellMedSchool orientation week complete! @ClayDellMed introduced a  visit by Sen @JohnCornyn. https://t.co/iXshMxRsLM
748955097657282560,2016-07-01 19:03:04,,6,6,Twitter for iPad,Democrats have a bad habit of giving away Senate seats - The Washington Post https://t.co/jz0EmmvOyU
748954136759021568,2016-07-01 18:59:15,,4,2,Twitter for iPad,Great Bexar County model for national mental health reform: https://t.co/HiQU5iWjcA
748946852884590592,2016-07-01 18:30:19,,14,0,Twitter for iPhone,"RT @UTAustin: Welcome to campus, Sen. @JohnCornyn! Our @DellMedSchool team is ready to change the world! #WhatStartsHere 🌎 https://t.co/ht6…"
748933663291617280,2016-07-01 17:37:54,,8,28,Twitter for iPhone,I met with Va Sec Robert McDonald to discuss how the VA plans to fix wait times problem in Houston and elsewhere. https://t.co/1Gta1Y77tn
748908748756819969,2016-07-01 15:58:54,,6,7,Mobile Web,It would help if he could get Senate Ds to stop filibuster: Obama: Zika mosquitoes already in U.S. https://t.co/I3ZW8f0HAX via @DCExaminer
748908118533218305,2016-07-01 15:56:24,,23,0,Twitter for iPhone,RT @nranews: House GOP plans vote next week on @JohnCornyn gun measure - https://t.co/FgbE82Rg2M #NRA #2A (via @politico)
748871753141714946,2016-07-01 13:31:53,,9,3,Twitter Web Client,.@KimStrassel: Hillary’s strange security adviser https://t.co/lbkSSLNysA via @WSJ
748868407840342017,2016-07-01 13:18:36,,3,2,Twitter Web Client,Poll: Russ Feingold and Ron Johnson in tight race https://t.co/JLGfOyJK06
748868247651573760,2016-07-01 13:17:58,,3,1,OS X,Ds filibustered Zika funding to these public health clinics Mapa de los Centros 330 https://t.co/odkdqna3q5
748864622862761984,2016-07-01 13:03:33,,59,37,Twitter Web Client,Cornyn: Clintons 'Acting Like the Rules that Apply to...Everybody Else Don't Apply to Them' https://t.co/ObsukLUbcQ
748863980995837953,2016-07-01 13:01:00,,1,2,Twitter Web Client,Worried women in America are inundating doctors with questions about Zika https://t.co/BZoklsFc98 via @WSJ
748862773740838912,2016-07-01 12:56:13,,8,11,Twitter Web Client,Donald Trump Warns of a Liberal Supreme Court if Hillary Clinton Wins https://t.co/8wnIQShgyx
748860911302152192,2016-07-01 12:48:49,,4,0,Twitter Web Client,RT @DBrandewie: Fox Austin: APD officer receives Congressional Badge of Bravery Today from @JohnCornyn https://t.co/MqUqWkbvik
748856328886611968,2016-07-01 12:30:36,,5,6,Twitter Web Client,"Lynch to Accept F.B.I. Recommendations in Clinton Email Inquiry, Official Says https://t.co/U5iQzus4gh"
748698179672035328,2016-07-01 02:02:10,,1,0,Twitter for iPhone,RT @ToadonaWire: @senbillnelson RT @JohnCornyn: Lara was born with microcephaly due to Zika virus.  How many more (cont) https://t.co/nVu3x…
748660671080894464,2016-06-30 23:33:08,,27,17,Twitter for iPad,Of course they did https://t.co/izhbx5SuRB
748656537220984832,2016-06-30 23:16:42,,6,7,Twitter for iPad,Texas lawmakers keep pressing for Zika funding https://t.co/MH6TYNpNrs
748653732057931784,2016-06-30 23:05:33,,212,0,Twitter for iPad,RT @greta: .@JohnCornyn: Unfortunately AG @LorettaLynch has just thrown another log on the fire -OTR #greta @FoxNews
748653309142003713,2016-06-30 23:03:52,,215,0,Twitter for iPad,RT @greta: .@JohnCornyn: It plays into the narrative that @billclinton &amp; @HillaryClinton act like the rules don't apply to them -OTR #greta…
748652832190930945,2016-06-30 23:01:59,,164,0,Twitter for iPad,RT @greta: Outrage growing over the talks on the tarmac between @billclinton &amp; AG @LorettaLynch -- @JohnCornyn is here -OTR #greta @FoxNews
748622149989052416,2016-06-30 21:00:03,,7,0,Twitter for iPhone,"RT @DBrandewie: The President has signed the @JohnCornyn, @SenatorLeahy FOIA reform bill into law."
748594199352705024,2016-06-30 19:08:59,,69,57,Twitter for iPhone,"After Bill Clinton Met With Attorney General Loretta Lynch, Republicans And Democrats Disapproved : NPR https://t.co/RTzMkcynch"
748593314056798208,2016-06-30 19:05:28,,4,7,Mobile Web,For President of France? French President Francois Hollande endorses Hillary Clinton https://t.co/xOp1DaD6g9 via @DCExaminer
748521323060695040,2016-06-30 14:19:24,,22,0,Twitter for iPhone,RT @MissingKidsCEO: Met w/ Senator @JohnCornyn. He is a strong #childsafety advocate and pledged his full support of the #NCMEC mission. ht…
748519454863163392,2016-06-30 14:11:59,,3,7,Twitter for iPhone,Judiciary hearing with Department of Homeland Security Jeh Johnson now
748463133774200833,2016-06-30 10:28:11,,55,25,Twitter Web Client,Attorney General Loretta Lynch met privately with Bill Clinton     https://t.co/Vwx79Rr7nJ via @WSJ
748460819592126464,2016-06-30 10:18:59,,155,164,OS X,"Lynch &amp; Clinton: Conflict of interest? An attorney,cannot represent two parties in a dispute and must avoid even the appearance of conflict."
748305384159444992,2016-06-30 00:01:21,,2,0,Twitter for iPhone,RT @QuorumCall: #Senate Cornyn presses VA Secretary to address long wait times at Houston VA https://t.co/RkKRR93n3h @JohnCornyn
748294336576651265,2016-06-29 23:17:27,,11,10,Twitter for iPhone,Cornyn blames Democrats for delay in Zika funding https://t.co/9mb7FIH3wB via @houstonchron
748289790290857988,2016-06-29 22:59:23,,781,0,Twitter for iPhone,RT @astros: #Astros win 10-4 and sweep the Angels! https://t.co/drrK2o9iIi
748289465404239873,2016-06-29 22:58:05,,115,0,Twitter for iPhone,"RT @SenateGOP: .@SenWarren said she'd support #Zika funding b/c this is a health emergency. Then opposed it? Politics at its worst.
https:/…"
748275070582272001,2016-06-29 22:00:53,,4,3,Twitter for iPhone,107 Nobel laureates sign letter blasting Greenpeace over GMOs - The Washington Post - https://t.co/Q7qhhghFDg https://t.co/pV6dvoRJQu
748272747130793984,2016-06-29 21:51:39,,4,9,Twitter for iPhone,Inaugural class unveiled for @UTRGV's School of Medicine: https://t.co/u4gQTm1QEO via @RioGGuardian
748200397911789569,2016-06-29 17:04:10,,67,53,Twitter for iPhone,Lara was born with microcephaly due to Zika virus.  How many more will suffer before Senate Ds and WH allow funding? https://t.co/jMSYEeIuZj
748192517011742720,2016-06-29 16:32:51,,9,4,Mobile Web,Ds blocked $$; should reconsider: NIH has 'no money' to fight Zika https://t.co/geAmYqzKra via @DCExaminer
748159932822863872,2016-06-29 14:23:22,,2,2,Twitter for iPad,"Why don't Senate Ds care? In Puerto Rico, One Expectant Mother's Zika 'Nightmare' https://t.co/V1dn3n674P"
748101022829142016,2016-06-29 10:29:17,,8,10,OS X,Mr. Reid’s in May: “Every day we wait [to fund Zika] is a bad day for America and the country—I’m sorry—for America and the world.”
748100687062499328,2016-06-29 10:27:57,,7,10,OS X,"WSJ: Inventing pretexts that happen to overlap with their campaign themes, Democrats blocked the Zika money, 48-42."
748100470028255233,2016-06-29 10:27:05,,13,4,Twitter Web Client,The Zika Democrats https://t.co/3ISD5a56kb via @WSJ
747947200802480129,2016-06-29 00:18:03,,13,0,Twitter for iPhone,"RT @stuartpstevens: Really good guy who has, as coaches used to say, his head screwed on right. Hard worker &amp; humble. @VincentHarris  https…"
747914425475141632,2016-06-28 22:07:49,,5,2,Twitter for iPad,"A Year Later, Authorities Struggle to Help Victims of Human Trafficking | US News https://t.co/Im5Xl53GgY"
747913310343995392,2016-06-28 22:03:23,,767,0,Twitter for iPad,"RT @TGowdySC: Read the report for yourself, reach your own conclusions #BenghaziReport 
https://t.co/Plpa71Eteh"
747907686491131907,2016-06-28 21:41:02,,6,0,Twitter for iPad,The Hill: Senate Democrats block Zika agreement ahead of recess  https://t.co/2KCoz47E8l
747906705149861888,2016-06-28 21:37:08,,18,18,Twitter for iPad,Hillary Clinton's email story continues to get harder and harder to believe https://t.co/KPRiucIMT6
747896755035975680,2016-06-28 20:57:36,,11,7,Twitter for iPad,#Fight Zika Now https://t.co/CSy9MsEIkQ
747888742682271744,2016-06-28 20:25:46,,3,4,Twitter for iPad,Rubio: Helping Puerto Rico without a bailout https://t.co/Q7C8PwvVWH via @Florida_Today
747849088427655168,2016-06-28 17:48:11,,5,8,Twitter for iPhone,"Gowdy: Clinton, State Department stonewalled Benghazi panel via @POLITICO for iOS https://t.co/xhVcvgssQS https://t.co/CCGw7NrmHM"
747843543880900608,2016-06-28 17:26:09,,45,0,Twitter for iPhone,RT @SenateMajLdr: .@AP - #Senate Democrats block GOP #Zika funding bill → https://t.co/srkjuYE9af https://t.co/BiStLCXW7d
747804500388360192,2016-06-28 14:51:01,,9,0,Twitter for iPhone,RT @yvafa: Thanks Sen @JohnCornyn for reminding us &amp; DOJ that a chief goal of #JVTA was to provide services to domestic trafficking victims
747793823930155008,2016-06-28 14:08:35,,1589,0,Twitter for iPhone,RT @SenatorDole: I'm proof that it's never too late to join Twitter. #myfirstTweet
747793172412116992,2016-06-28 14:06:00,,10,4,Twitter for iPhone,"More Clinton emails released, including some she deleted https://t.co/UhwSowHjHZ"
747792434743099393,2016-06-28 14:03:04,,3,0,Twitter for iPhone,RT @penguinponders: .@JohnCornyn requested a meeting with V.A. Sec.McDonald to discuss how he intends to fix the problems in Houston of lon…
747744474885926912,2016-06-28 10:52:29,,51,36,Twitter Web Client,Senate Ds plan to block Zika funding today after repeatedly insisting Congress fund it w/o delay. Hypocrisy and cynicism of epic proportions
747595920838008832,2016-06-28 01:02:11,,24,0,Twitter for iPhone,"RT @SenateGOP: Happy birthday, Sen. @KellyAyotte! https://t.co/lGMqQXvlv4"
747558838212005888,2016-06-27 22:34:50,,8,2,Twitter for iPhone,Cornyn: Puerto Rico bill 'an anti-taxpayer bailout bill' https://t.co/EMaPvgRS1X via @DCExaminer
747483433681719296,2016-06-27 17:35:12,,4,14,Twitter Web Client,"Pride of Spring, Texas https://t.co/DGsYZrXZYG"
747467618429313024,2016-06-27 16:32:22,,8,15,Twitter for iPhone,"Fewer than half of Bernie Sanders backers in Texas say they'll vote for Clinton, poll shows | Dallas Morning News https://t.co/5djduDrRlX"
747459285211283456,2016-06-27 15:59:15,,0,4,Twitter for iPad,Congrats to @Simone_Biles on an outstanding performance to win title number four https://t.co/oWPKhjcGc8 via @TeamUSA
747455265855836161,2016-06-27 15:43:17,,1,1,Twitter Web Client,"Tim Kaine: ""Nobody Should Ever Say They're Ready"" to be President | NBC ... https://t.co/V9Z01zSJ43 via @YouTube"
747454972787232768,2016-06-27 15:42:07,,2,2,Twitter Web Client,The DNC platform will demand that the Justice Department investigate… &lt;i&gt;oil companies&lt;/i&gt; - Hot Air https://t.co/MMA9qsvoqQ
747453805889916928,2016-06-27 15:37:29,,4,2,Twitter Web Client,Supreme Court Throws Out Corruption Conviction of Ex-Virginia Gov. Bob McDonnell https://t.co/cxRZZJBs8I via @WSJ
747448792350220294,2016-06-27 15:17:33,,15,8,Twitter Web Client,Kermit Gosnell? Clinton: Abortion decision 'victory for women' https://t.co/G05i2JvGWN via @usatoday
747376231302180864,2016-06-27 10:29:13,,4,5,Twitter Web Client,Panama inaugurates expanded canal https://t.co/904oHsKzoi via @WSJ
747219518800334848,2016-06-27 00:06:30,,16,27,Twitter for iPhone,"Counting down
https://t.co/Z2xqPgOw3f https://t.co/WLHb6QTJzB"
747185102099259392,2016-06-26 21:49:45,,7,0,Twitter for iPhone,"RT @TPPF: TPPF’s Mark Levin and US Senator @JohnCornyn tell how Texas got tough &amp; smart on crime

READ: https://t.co/Mkj8ae1kKG"
747184798876176384,2016-06-26 21:48:32,,21,0,Twitter for iPhone,RT @amyklobuchar: . @JohnCornyn &amp; I called on @TheJusticeDept to strengthen efforts to implement our bipartisan Justice for Victims of Traf…
747106208692113411,2016-06-26 16:36:15,,5,4,Mobile Web,"Corruption 'rife' in New York politics, top prosecutor warns https://t.co/kAXqMNIGxH via @DCExaminer"
747102001180205056,2016-06-26 16:19:32,,10,0,Twitter for iPhone,"RT @weeklystandard: ""I don't know what the @JohnCornyn amendment is."" —Democratic congressman https://t.co/pMVpBPmInU https://t.co/047WeT14…"
747091336356986881,2016-06-26 15:37:09,,17,6,Twitter for iPad,More Obamacare fallout via @nprnews: Minnesota's Largest Health Insurer Will Drop Individual Plans https://t.co/mQLeziC8Vo
747089692076630016,2016-06-26 15:30:37,,2,4,Twitter for iPad,"Life after prison
https://t.co/FoKa5PdELE"
747059032125431808,2016-06-26 13:28:47,,2,2,Twitter for iPad,Obama declares disaster as U.S. flood death toll climbs to 24. https://t.co/weSmhe2ltE
747057347961335808,2016-06-26 13:22:06,,11,10,Twitter for iPad,A brutal week for Obama and his liberal vision of an interconnected world - The Washington Post https://t.co/FPGAF2xB0j
746862628081831936,2016-06-26 00:28:21,,3,0,Twitter for iPad,RT @jaketapper: @michaelcrowley @jamespmanley still eagerly awaiting someone to answer Gen. Mattis's questions: what is the strategy? What…
746784575536275456,2016-06-25 19:18:12,,7,5,Mobile Web,TransCanada sues U.S. for $15B over Keystone XL https://t.co/7bkW1xFPak via @DCExaminer
746751512383107072,2016-06-25 17:06:49,,13,38,Twitter for iPhone,"I kind of like this : ""The glory of the young is their strength; the gray hair of experience is the splendor of the old."" Proverbs 20:29"
746739749520478208,2016-06-25 16:20:04,,4,0,Twitter for iPad,RT @JCyrier: Luling Watermelon #Thump Parade 2016.   Next year we will celebrate my ride's 100th b-day. https://t.co/8M2528oyPc
746718600275255297,2016-06-25 14:56:02,,21,7,Twitter for iPad,Clinton’s State Dept. calendar missing scores of entries via @washingtonpost https://t.co/OfYwPS8udc
746715789323972610,2016-06-25 14:44:52,,42,0,Twitter for iPad,"RT @asymmetricinfo: So this is actually huge, bad news for Obamacare: A Blue Cross (Minnesota) is pulling out. https://t.co/tmF31S2RDm"
746698200145240064,2016-06-25 13:34:58,,26,27,Twitter for iPad,POTUS refused to work with Congress unless he got 100% of what he wanted.  Such tactics yield zero% https://t.co/Q4udmkUnav
746695806548226050,2016-06-25 13:25:27,,6,9,Twitter for iPad,Violent Felons Are Trying to Get Their Gun Rights Back in Virginia https://t.co/cgqsvgZCA8
746695037879095298,2016-06-25 13:22:24,,6,12,Mobile Web,Brexit: Britain’s welcome revival of nationhood https://t.co/Fi8dW1r50t
746693617180246016,2016-06-25 13:16:45,,2,2,Mobile Web,Brexit and the real crocodile in the room https://t.co/TVhvx26XEx
746387663574302721,2016-06-24 17:01:00,,66,107,Twitter for iPad,"Opponents of my #NoFlyNoBuy #butyouhavetotellajudgewhy bill made for unlikely bedfellows, NRA and ACLU, both w/ Due Process of law concerns."
746375238498213888,2016-06-24 16:11:38,,10,12,Twitter for iPad,Congrats to @ABC13Houston's Dave Ward on setting a Guinness world record https://t.co/KYI74CQiID
746315350107688960,2016-06-24 12:13:39,,13,12,Mobile Web,The dirty two dozen: Clinton's top controversies https://t.co/aGqu99EyqN via @DCExaminer
746314435220889600,2016-06-24 12:10:01,,9,15,Twitter for iPhone,State Dept.: Hillary Clinton failed to hand over key email #clinton #emails. https://t.co/dbjgyuN1lk
746314064041746433,2016-06-24 12:08:33,,1921,0,Twitter for iPhone,"RT @nytimes: The front page of The New York Times for Friday, June 24 https://t.co/byKJDgV9xl"
746293466515312640,2016-06-24 10:46:42,,13,14,Twitter Web Client,#Brexit will produce a lot of punditry on what its implications are for the Presidential election
746291774805671937,2016-06-24 10:39:59,,14,13,Twitter Web Client,"After Orlando, Obama continues to be in denial about terrorism https://t.co/kMTtSNePmN"
746290799512551424,2016-06-24 10:36:06,,15,26,Twitter Web Client,Brexit another in a long line of recent embarrassments for pollsters
746288357089615872,2016-06-24 10:26:24,,3,2,Twitter Web Client,"Gun control: Security, rights can coexist https://t.co/91IDIEcHhI via @DispatchAlerts"
746285674077126656,2016-06-24 10:15:44,,5,6,Twitter for iPhone,Here’s how to confront the terrorist threat. (It’s not how we’re doing it.) https://t.co/iaT5KtvejK
