id,created_at,user,retweets,favorite_count,source,text
851525737110802432,2017-04-10 20:02:10,NormaJTorres,3,10,TweetDeck,"My heart breaks for those killed, injured &amp; for the students who have had their innocence shattered. Full stmnt:… https://t.co/6MuVwXkSNO"
851499631024287745,2017-04-10 18:18:26,NormaJTorres,51,45,Twitter for iPhone,Pick up your student at El Cajon HS or Cal State San Bernardino https://t.co/pf2xlkYjkh
851498511564759040,2017-04-10 18:13:59,NormaJTorres,7,11,TweetDeck,"Following the situation at North Park Elementary. Keeping the victims, students &amp; first responders in my thoughts: https://t.co/N1IfpZpcqJ"
851475476698861568,2017-04-10 16:42:27,NormaJTorres,1,1,TweetDeck,DEADLINE EXTENDED! CA35 High schl students now have til 4/14 to submit artwork for the #CongressionalArtCompetition… https://t.co/Ow5kXqFIQh
851299377402454016,2017-04-10 05:02:42,NormaJTorres,1,6,Twitter for iPhone,"Tragic accident, prayers for the families involved https://t.co/NlhuQsS4xM"
850334758563446786,2017-04-07 13:09:39,NormaJTorres,2,1,TweetDeck,Impacted by the #Westech closure?  Visit https://t.co/dhd2U8HJ5A or call my Ontario office at 909-481-6474 for help. https://t.co/uXrMNiPags
850116682559266816,2017-04-06 22:43:06,NormaJTorres,143,0,Twitter for iPad,RT @thehill: Secret Service cuts back on criminal investigations to protect Trump family: report https://t.co/R0CEW6CKOB https://t.co/Z3DfT…
850103124610224128,2017-04-06 21:49:13,NormaJTorres,1,3,TweetDeck,Don't forget to send in your submissions for this year's #CongressionalArtCompetition. More info here:… https://t.co/dRndC3yLHG
850068542900883456,2017-04-06 19:31:48,NormaJTorres,41,0,Twitter for iPad,RT @SenatorCarper: It's unacceptable for a federal agency to ignore requests for information from Members of Congress because of partisan p…
849990174729752576,2017-04-06 14:20:24,NormaJTorres,67,105,TweetDeck,Nunes out. I expect @TGowdySC to investigate #TrumpRussia just as hard as he did #Benghazi. #FollowtheFacts  https://t.co/Ie8cb79tCU
849807599830781952,2017-04-06 02:14:55,NormaJTorres,454,0,Twitter for iPhone,"RT @mlastyle: Need to cite a legal work? Avoid plagiarism w/ MLA guidelines, suitable for all writers, including SCOTUS nominees: https://t…"
849755667032420354,2017-04-05 22:48:33,NormaJTorres,11,21,TweetDeck,Just signed onto @RepEliotEngel’s HR 1677  to bring those who commit war crimes &amp; human rights violations in #Syria to justice
849721332153683968,2017-04-05 20:32:07,NormaJTorres,2,4,TweetDeck,"Calling all young artists in CA-35!  Deadline to enter this year’s Congressional Art Competition is Fri., April 7th… https://t.co/7Jmusa40F1"
849687722134581259,2017-04-05 18:18:34,NormaJTorres,2,0,Twitter for iPhone,RT @CityofOntario: The #Spring 2017 issue of the Ontario Living Magazine is now available! 🌷🌼💐 #CityofOntario https://t.co/UmD0Er8GDW https…
849682917538377730,2017-04-05 17:59:28,NormaJTorres,6,28,TweetDeck,"Student leaders from @calpolypomona were in DC to talk financial aid, immigration &amp; other important issues impactin… https://t.co/WHwh3yzoP4"
849643487922450433,2017-04-05 15:22:47,NormaJTorres,1,3,TweetDeck,Democratic Women’s Working Group is livestreaming a hearing on the #MarinesUnited scandal.  Watch here: https://t.co/lnAPl77ckG
849371393737228288,2017-04-04 21:21:35,NormaJTorres,1,5,Twitter for iPhone,Head to @DolceBistro from 2-3pm to meet w/ Marc from my staff &amp; talk about the importance of #EqualPay.… https://t.co/BdVEaSpsXM
849371011044847616,2017-04-04 21:20:04,NormaJTorres,1,0,Twitter for iPhone,Sol is at Jugos Islas del Campo in #Ontario to highlight why #equalpay matters for CA families. #EqualPayDay… https://t.co/Moe9bTX0pC
849367485753298946,2017-04-04 21:06:03,NormaJTorres,1,3,Twitter for iPhone,Sol is at Jugos Islas del Campo in #Ontario to highlight why #equalpay matters for CA families. #EqualPayDay #20PercentCounts
849366200559837185,2017-04-04 21:00:57,NormaJTorres,6,11,Twitter for iPhone,Mario will be at Mi Cafecito in #Pomona 2-3pm to highlight the impact of the wage gap on CA families #EqualPayDay… https://t.co/4gquTnm4pw
849365037391241216,2017-04-04 20:56:20,NormaJTorres,1,4,Twitter for iPhone,Today Janette from my team is @coffeenutzz marking #EqualPayDay &amp; showing why #20PercentCounts https://t.co/Zec2Hkwdk7
849356443627257861,2017-04-04 20:22:11,NormaJTorres,0,6,Twitter for iPhone,The Flinderstreet Cafe in #Chino is marking #EqualPayDay w/ Sol from my team and showing that #20PercentCounts https://t.co/QeUxl18oAg
849322077077327874,2017-04-04 18:05:37,NormaJTorres,16,35,TweetDeck,On #EqualPayDay @HouseDemocrats are demanding a vote on #PaycheckFairnessAct to give women tools to make sure we get #equalpayforequalwork
849301288747646976,2017-04-04 16:43:01,NormaJTorres,4,4,TweetDeck,Autism impacts 1 in 68 kids in the US. Let’s work to ensure they're welcomed &amp; supported in our communities &amp; schools #AutismAwarenessMonth
849269459420422144,2017-04-04 14:36:32,NormaJTorres,3,5,TweetDeck,My staff will be at coffee shops throughout CA35 from 2-3pm TODAY highlighting #EqualPayDay &amp; why #20PercentCounts @coffeenutzz @DolceBistro
849078825132716032,2017-04-04 01:59:01,NormaJTorres,0,8,Twitter for iPhone,Tmrw from 2-3pm my staff will be at coffee shops thruout CA35 highlighting #EqualPayDay &amp; why #20PercentCounts w/ @coffeenutzz @DolceBistro
848919492650553346,2017-04-03 15:25:53,NormaJTorres,4,8,Twitter for iPhone,So proud of all the volunteers from @calpolypomona @azusapacific &amp; @WesternUNews who helped feed the homeless this… https://t.co/GkShr39LWK
847907670346670080,2017-03-31 20:25:16,NormaJTorres,4,10,TweetDeck,#CesarChavez showed us that even the most powerful are no match for a committed &amp; organized resistance… https://t.co/dvt6NH90Ak
847809598937604096,2017-03-31 13:55:34,NormaJTorres,1,4,TweetDeck,Great mtg w/ @Caltrux on issues facing trucking industry &amp; how they're impacting the IE economy https://t.co/iDC00h94Qi
847589293619122177,2017-03-30 23:20:09,NormaJTorres,4,0,Twitter for iPhone,RT @OntarioPD: April is Distracted Driving Enforcement month - Go hands free of your devices and have a safe day. More info@ https://t.co/U…
847585006796947456,2017-03-30 23:03:07,NormaJTorres,1,3,Twitter for iPhone,California's traffic ticket amnesty program to expire April 3 https://t.co/PF8nTJV7HS
847574238450110464,2017-03-30 22:20:20,NormaJTorres,3,0,Twitter for iPhone,RT @CityofOntario: Happy National Take a Walk in a Park Day! Check out all of the parks the City of Ontario has to offer at https://t.co/Vx…
847571912041652228,2017-03-30 22:11:05,NormaJTorres,84,124,TweetDeck,New concerns from @RepAdamSchiff on handling of #Russia investigation. This is why we need an INDEPENDENT investigation to #FollowTheFacts
847526494251470848,2017-03-30 19:10:37,NormaJTorres,102,0,Twitter for iPhone,"RT @PattyMurray: Once again, millions of families are watching Congress—wondering why there isn’t one more Republican who will stand up for…"
847485415602835457,2017-03-30 16:27:23,NormaJTorres,31,0,TweetDeck,RT @usembassyguate: .@RepJeffDuncan @RosLehtinen @RepSires @RepEliotEngel @NormaJTorres muestran apoyo bipartidista a esfuerzos anticorrupc…
847481654062989313,2017-03-30 16:12:26,NormaJTorres,0,0,TweetDeck,@_JohnNeutron Contact your State Assembly Member or State Sen. for more info &amp; to share your views. Find them here: https://t.co/huqy2LD4D8
847481026054049792,2017-03-30 16:09:56,NormaJTorres,0,0,TweetDeck,"@_JohnNeutron This is proposed by @JerryBrownGov &amp; state legislators, not in Congress.  More details here: https://t.co/x3iKrf31RR"
847202457310470144,2017-03-29 21:43:00,NormaJTorres,4,8,TweetDeck,Great mtg. w/ @CityofChinoGov on local projects to improve roads &amp; water infrastructure throughout the city https://t.co/b63ghF1sfC
847187379798659072,2017-03-29 20:43:05,NormaJTorres,0,3,TweetDeck,"Thank you @CapitolPolice for working so hard to protect Members, staff &amp; millions of visitors https://t.co/9LT9ZMpMEM"
847167513846796289,2017-03-29 19:24:09,NormaJTorres,3,0,TweetDeck,RT @RepWilson: We and so many of our colleagues are keeping up the fight to #BringBackOurGirls @NormaJTorres @JacksonLeeTX18 @OfficialCBC
847156281928564738,2017-03-29 18:39:31,NormaJTorres,7,10,TweetDeck,Today @HouseForeign unanimously passed my &amp; @RepMoolenaar resolution to fight corruption in Central America… https://t.co/pNoO34RJAp
847141150813306891,2017-03-29 17:39:24,NormaJTorres,0,0,Twitter for iPhone,This Saturday go to the Grace Vargas Senior Center to learn about efficient irrigation https://t.co/KONEePxtY6
847132607481565184,2017-03-29 17:05:27,NormaJTorres,4,3,TweetDeck,"Sad that still today accomplished women like @AprilDRyan &amp; @MaxineWaters get criticized for their hair, facial expression. #sexismatwork"
847125540284837889,2017-03-29 16:37:22,NormaJTorres,4,9,TweetDeck,"HRes145, which I intro’d to reaffirm US commitment to help fight corruption in Central America, just approved unanimously by @HouseForeign"
847125358797303810,2017-03-29 16:36:39,NormaJTorres,1,0,TweetDeck,"Thank you @RepEliotEngel &amp; @RepSires for your support of HRes 145 in @HouseForeign, my resolution on corruption in Central America"
846896195184214017,2017-03-29 01:26:02,NormaJTorres,10,0,Twitter for iPhone,RT @VictorvilleCM: Albuquerque saved $5M (31.6%) by housing 600 homeless rather than leaving them on the streets. - Mayor Richard Berry #WW…
846851865186897920,2017-03-28 22:29:53,NormaJTorres,7,9,Twitter for iPhone,"En donde están las mujeres?
Trump desecha medidas para combatir cambio climático https://t.co/FafGRsLi8P"
846842368989052928,2017-03-28 21:52:08,NormaJTorres,11,35,TweetDeck,I’m voting NO on SJRes 34 b/c I believe Americans have a right to protect their private information.  #BroadbandPrivacy
846815409177186304,2017-03-28 20:05:01,NormaJTorres,15,27,TweetDeck,"Congress should be working to protect your privacy, not allowing companies to sell your private info w/o consent  #BroadbandPrivacy"
846809582059974656,2017-03-28 19:41:51,NormaJTorres,19,36,Twitter for iPhone,When you're too #dumb to debate the smart &amp; articulate @MaxineWaters so you resort to namecalling https://t.co/0GwAGClv1f
846779685350584320,2017-03-28 17:43:04,NormaJTorres,2,4,TweetDeck,"“key part of US power in the world is stability in Central America, North America” – @RNicholasBurns @HouseForeign hrng on State budget cuts"
846769672989147136,2017-03-28 17:03:16,NormaJTorres,3,9,TweetDeck,Couldn’t agree more w/ @RNicholasBurns: “We cannot afford a strained relationship w/ Mexico” @HouseForeign hrng on Foreign Affairs budget
846701880583606274,2017-03-28 12:33:53,NormaJTorres,3,3,Twitter for iPhone,Taxpayers pick up the tab for Trump’s pricey golf excursions https://t.co/ksA5FFMfvP
846500000569942016,2017-03-27 23:11:42,NormaJTorres,2,8,TweetDeck,Big thanks to everyone who came to our #TownHall on Saturday! Check out the photos at: https://t.co/YPviOzCTWG
845686978544742400,2017-03-25 17:21:02,NormaJTorres,8,36,Twitter for iPhone,My #TownHall is LIVE on Facebook. Watch it at: https://t.co/PS0eQ6hCZx #TorresTownHall
845685377243398147,2017-03-25 17:14:40,NormaJTorres,3,7,Twitter for iPhone,@suzi_q2 @HispanicCaucus https://t.co/1Igtu7r9JL
845678221907574784,2017-03-25 16:46:14,NormaJTorres,2,15,Twitter for iPhone,My Town Hall is getting started! To ask a question tweet using #TorresTownHall
845668914746961921,2017-03-25 16:09:15,NormaJTorres,5,11,Twitter for iPhone,Great crowd! Head over to @CJUHSD in #Ontario for my Town Hall. We're starting at 9:30am! Also streaming LIVE at… https://t.co/bNfodbKomw
845659530063048704,2017-03-25 15:31:58,NormaJTorres,1,6,Twitter for iPhone,Excited to kick off this morning's town hall in Ontario! Be sure to tweet me your questions using #TorresTownHall
845451289412689920,2017-03-25 01:44:29,NormaJTorres,13,43,TweetDeck,Today was a victory for the American people.  Read my full statement #GOP failure to repeal #Obamacare:… https://t.co/vvedK18Vua
845394802824921088,2017-03-24 22:00:02,NormaJTorres,0,3,TweetDeck,Leaving a few slots open during Q&amp;A at my Town Hall Saturday for questions from Twitter.  Tweet #TorresTownTall w/ your questions!
845362766319960066,2017-03-24 19:52:44,NormaJTorres,9,27,Twitter for iPhone,They couldn't get the votes! #Trump Zero community 1 #Resist
845347605848698880,2017-03-24 18:52:29,NormaJTorres,80,0,Twitter for iPhone,"RT @CenterOnBudget: Don't be fooled: #AHCA supports millionaires and corporations, not people who need health insurance:  
https://t.co/6AI…"
845319304966918144,2017-03-24 17:00:02,NormaJTorres,2,5,TweetDeck,Looking fwd to answering questions from Twitter followers during my Town Hall Saturday.  Just tweet them using #TorresTownHall
845274003434557440,2017-03-24 14:00:01,NormaJTorres,5,8,TweetDeck,Can’t wait til the Town Hall Saturday? Tweet me your questions w/ #TorresTownHall today!
845111458434306048,2017-03-24 03:14:07,NormaJTorres,24,48,Twitter for iPhone,What's Missing From This Photo of Politicians Deciding the Future of Women's Health? https://t.co/uegFuaD0BT via @motherjones
845052228763189249,2017-03-23 23:18:46,NormaJTorres,13,30,Twitter for iPhone,I answered calls tonight in my DC office while waiting for vote on #Trumpcare. Heard from IE residents worried about losing their coverage
845033592568762368,2017-03-23 22:04:43,NormaJTorres,76,174,Twitter for iPhone,Call my DC office @ 202-225-6161 with comments/questions on #Trumpcare. I’ll be answering constituent calls for the… https://t.co/Xv6wPw2R76
845022413741944832,2017-03-23 21:20:17,NormaJTorres,1146,1932,Twitter for iPhone,"My constituents are calling and emailing, asking me to vote against #Trumpcare. Calls/emails so far:

Support: 15
Oppose: 554"
844981823989960705,2017-03-23 18:39:00,NormaJTorres,1,0,TweetDeck,Tweet me your questions for my Town Hall this Saturday.  Just use #TorresTownHall
844977400505094146,2017-03-23 18:21:25,NormaJTorres,1,4,TweetDeck,I’ll be taking several questions via Twitter during my Town Hall @CJUHSD this wknd. Tweet me your questions using #TorresTownHall
844948457194504192,2017-03-23 16:26:25,NormaJTorres,144923,0,Twitter for iPhone,RT @BarackObama: My heart goes out to the victims and their families in London. No act of terror can shake the strength and resilience of o…
844943072161153024,2017-03-23 16:05:01,NormaJTorres,23,20,TweetDeck,"House #GOP is rushing to pass a #healthcare bill that will cause 2,600 elderly Medi-Cal recipients in my district to lose coverage."
844685730450456576,2017-03-22 23:02:26,NormaJTorres,160,0,Twitter for iPhone,RT @thehill: JUST IN: Senate repeals Obama-era workplace safety regulation https://t.co/igDiqgGESe https://t.co/wxcDaI8zAT
844622439124537349,2017-03-22 18:50:56,NormaJTorres,28,28,TweetDeck,"Tomorrow Congress will vote to kick 11,600 kids in the 35th district off Med-Cal. So how exactly will #TrumpCare make America great? #ACA7"
844606338453950464,2017-03-22 17:46:57,NormaJTorres,2,3,TweetDeck,"With information still coming in, my thoughts are with the victims of the London attack &amp; the many brave first responders."
844605768716500996,2017-03-22 17:44:41,NormaJTorres,0,4,Twitter for iPhone,Very sad! Prayers for his family https://t.co/VPkn7rfHzm
844595146800992257,2017-03-22 17:02:29,NormaJTorres,3,0,TweetDeck,RT @RialtoCS: Stop by the Rialto Resource Center EVERY 2nd and 4th Wednesday and Meet the representatives for the office of @NormaJTorres a…
844572178549002242,2017-03-22 15:31:13,NormaJTorres,78,92,TweetDeck,"Under the latest version of #TrumpCare 14,200 residents of CA35 would lose their employer-sponsored insurance. Unacceptable. #ProtectOurCare"
844541046260449286,2017-03-22 13:27:30,NormaJTorres,14,23,TweetDeck,"Tragic reminder of how creating fear in immigrant communities = crimes going unreported, impacting all our safety: https://t.co/5zi3JQgS3c"
844358075767230465,2017-03-22 01:20:27,NormaJTorres,3,11,TweetDeck,Constructive talks today w/ @JuanOrlandoH &amp; @JuaJimenezMayor re efforts to counter corruption &amp; impunity &amp; seek jus… https://t.co/4HUtT0Pxhy
844337033065779201,2017-03-21 23:56:50,NormaJTorres,2,5,Twitter for iPhone,Great mtg w/ Inland Action &amp; @RepPeteAguilar &amp; @RepCardenas on working together to move the #InlandEmpire forward https://t.co/cSKyLVHR0N
844273742872285184,2017-03-21 19:45:20,NormaJTorres,7,17,TweetDeck,Thanks @RepJaredPolis for highlighting my amendment to improve #smallbiz health bill. Too bad #GOP refuse to debate or vote on it.
844144164652695552,2017-03-21 11:10:26,NormaJTorres,1,0,Twitter for iPhone,RT @pomonajournal: How NASCAR fans can ride the Metrolink for free to Auto Club Speedway: FONTANA &gt;&gt; For those attending Sunday's… https://…
843930708716457987,2017-03-20 21:02:15,NormaJTorres,3,8,TweetDeck,Last week I re-intro’d the CLEAR SBA Act to make it easier for #smallbiz to get the capital needed to grow &amp; succee… https://t.co/oPp0Rqhk4e
843883437303980034,2017-03-20 17:54:24,NormaJTorres,17,28,TweetDeck,#ComeyHearing confirms @RealDonaldTrump wiretapping claims bogus.  Time for @POTUS to apologize to the American ppl. https://t.co/h26w7pQ7Hi
843877771650711552,2017-03-20 17:31:53,NormaJTorres,2,8,TweetDeck,#ComeyHearing is just the start. @SpeakerRyan must create independent commission to #FollowTheFacts! https://t.co/YSTgfPlU5Q
843129872809517057,2017-03-18 16:00:00,NormaJTorres,10,21,TweetDeck,One week til my Town Hall at the Hill Auditorium @CJUHSD in #Ontario! Hope to see you there! Be sure to RSVP at: https://t.co/pDz3VYO4Np
842813157953470465,2017-03-17 19:01:30,NormaJTorres,3,5,TweetDeck,"I think #OMB Director Mick Mulvaney could learn a thing or two about compassion:
https://t.co/IJhIl51o4L"
842812121171804160,2017-03-17 18:57:23,NormaJTorres,1,0,Twitter for iPhone,RT @GRO_APCO: Honored to announce Rep @NormaJTorres as @APCOIntl's recipient of Leadership in Legislative Service Award on May 17: https://…
842792626973741056,2017-03-17 17:39:55,NormaJTorres,54,60,TweetDeck,"#DHS Sec. Kelly just told @HouseDemocrats he’s best thing to happen to #Dreamers. Stories like this say otherwise:
https://t.co/m52vZ3Nx5S"
842486100635648001,2017-03-16 21:21:53,NormaJTorres,1,7,TweetDeck,Can't make America great if you cut transit &amp; develoment $$$ communities rely on. Read my full statement on #budget: https://t.co/pGoFPXhL36
842429429783633924,2017-03-16 17:36:42,NormaJTorres,1,6,TweetDeck,Great mtg w/ @MayorDRobertson to talk about how federal investment can help cities like #Rialto grow &amp; thrive https://t.co/U23uS0DlYp
842401856160694272,2017-03-16 15:47:08,NormaJTorres,11,12,TweetDeck,#HAPPENINGNOW Watch @HouseDemocrats hearing on impact of the @HouseGOP #ACA repeal bill  https://t.co/U9LSnuzWs7
842386181027422213,2017-03-16 14:44:50,NormaJTorres,2,6,TweetDeck,"$2.4 BILLION in cuts to @USDOT including no new transit projects. Hey @RealDonaldTrump, a useless wall doesn’t count as infrastructure!"
842163920878108672,2017-03-16 00:01:40,NormaJTorres,6,18,TweetDeck,"Court blocks #travelban 2.0.  It’s time for @realDonaldTrump to move on from this pointless, discriminatory, harmfu… https://t.co/QmCELprjjg"
842135958770327554,2017-03-15 22:10:33,NormaJTorres,5,9,Twitter for iPhone,Thank you @usmcdrumcorps for stopping by @ChaffeyHSTigers and inspiring our students w/ your amazing performance! https://t.co/aZHagNb8pZ
842113704527310848,2017-03-15 20:42:07,NormaJTorres,2,0,Twitter for iPhone,RT @JulioCOrtiz34: Hablamos en Exclusiva con Rómulo Avelica quien fue detenido por ICE cerca de escuela de su hija @NU34LA Hoy a las 6 http…
842102467533893632,2017-03-15 19:57:28,NormaJTorres,3,8,TweetDeck,What happened to @RealDonaldTrump promises to protect Medicare? GOP #PayMoreForLess plan shortens Medicare Trust Fu… https://t.co/3fX6IogSIr
842082932017770496,2017-03-15 18:39:50,NormaJTorres,18,19,TweetDeck,"As expected, no evidence to back @RealDonaldTrump wiretapping claims. Shameful @POTUS is spreading blatant lies for… https://t.co/uWjpOFWs19"
841789693352153088,2017-03-14 23:14:37,NormaJTorres,2,6,Twitter Web Client,"The #ACA gave Guillermo control of his life
after his diabetes diagnosis. Hear his story. #ProtectOurCare w/… https://t.co/AZFjrfPaKn"
841715208569683969,2017-03-14 18:18:38,NormaJTorres,2,7,TweetDeck,I'll be hosting a Town Hall mtg in #Ontario for residents of CA-35.  Visit https://t.co/pDz3VYwtVR for more info &amp;… https://t.co/w34e3v9PN8
841523907580456961,2017-03-14 05:38:28,NormaJTorres,28,162,Twitter for iPhone,May I suggest giving it to the @ACLU https://t.co/jqDB4jH0Dc
841451199844966400,2017-03-14 00:49:34,NormaJTorres,64,0,Twitter for iPhone,RT @Newsweek: British intelligence warns political parties of Russian hacking threat https://t.co/uACRA0H6oD https://t.co/c6CGAlPyOw
841428034229960704,2017-03-13 23:17:30,NormaJTorres,0,1,Twitter for iPhone,I couldn't agree more! https://t.co/nyQmZSY9Fg
841417220039270400,2017-03-13 22:34:32,NormaJTorres,2,1,TweetDeck,.@USCBO agrees that age-based tax credits mean substantial increase in premiums for older adults. GOP #healthcare plan = #PayMoreForLess
841412951613550592,2017-03-13 22:17:35,NormaJTorres,4,6,TweetDeck,"I'm ready to work w/ GOP to lower costs, expand access, but @HouseGOP #healthcare plan does neither. Full stmnt:… https://t.co/yGRGmWeUfz"
841409877645774848,2017-03-13 22:05:22,NormaJTorres,2,3,TweetDeck,"Acc'd to @USCBO under @HouseGOP #ACA repeal plan 14 million will lose #health insurance next yr, 24 million by 2026"
841407613422190592,2017-03-13 21:56:22,NormaJTorres,0,2,TweetDeck,"327,000 ppl in CA-35 rely on Medi-Cal. Their healthcare is now in jeopardy thanks to @HouseGOP #healthcare plan"
841367152359813121,2017-03-13 19:15:35,NormaJTorres,3,14,Twitter for iPhone,"Snowstorm means I can’t get back to DC, so I’ll be working out of our Ontario office today! https://t.co/xWwxhjDRIs"
841355778254606336,2017-03-13 18:30:23,NormaJTorres,16,32,TweetDeck,"As an immigrant &amp; his colleague, I find @SteveKingIA xenophobic comments demeaning &amp; shameful. @SpeakerRyan must denounce!"
841084683920195584,2017-03-13 00:33:09,NormaJTorres,7,10,Twitter for iPhone,https://t.co/Kc8tYw9160
841049410746249216,2017-03-12 22:13:00,NormaJTorres,8,0,Twitter for iPhone,"RT @cvifd: You changed you clocks an hour ahead, but did you change the battery in your smoke alarm? #changeyourclockchangeyourbattery #day…"
840726474294419456,2017-03-12 00:49:46,NormaJTorres,1634,0,Twitter for iPhone,RT @NPR: The panel found that Republicans had used race as a motivating factor in gerrymandering the districts. https://t.co/FFOCkFcQwY
840657417671069696,2017-03-11 20:15:21,NormaJTorres,1,5,Twitter for iPhone,I can't wait! https://t.co/wPvmk72Sh3
840578252355723264,2017-03-11 15:00:47,NormaJTorres,50,0,Twitter for iPhone,RT @GlblCtzn: Women used to do WHAT for birth control?! https://t.co/EqrphggN9d
840321560489652224,2017-03-10 22:00:47,NormaJTorres,193,0,TweetDeck,RT @HispanicCaucus: .@ICEgov should use its limited resources to target violent criminals not to harass #DREAMers. Full statement-&gt;https://…
840314813536440321,2017-03-10 21:33:58,NormaJTorres,0,3,TweetDeck,Thx for stopping by my DC office @KomenIE. @SusanGKomen IE chapter is fighting for better screening &amp; coverage for… https://t.co/jMmd1yUI4G
840222904361078785,2017-03-10 15:28:45,NormaJTorres,1,9,TweetDeck,Met w/ an inspiring group of young people advocating for the #ACA &amp; funding for medical research on behalf of… https://t.co/P4H0fasQ7a
840202316473126912,2017-03-10 14:06:57,NormaJTorres,6,0,Twitter for iPhone,"RT @CityofOntario: Teens, don't miss the 12th Annual Teen College &amp; Career Fair, now on 4/12! For more information, please call (909) 395-2…"
840200469029015553,2017-03-10 13:59:36,NormaJTorres,0,3,Twitter for iPhone,A GOP Congressman Spent 6 Minutes Defending Vladimir Putin https://t.co/1FZiOQMRyz via @motherjones
840042542225903616,2017-03-10 03:32:03,NormaJTorres,19,0,Twitter for iPhone,RT @WOLA_org: .@NormaJTorres @RepBetoORourke introduce bill to protect DACA recipients from new executive orders: https://t.co/ktmxl6CFdn #…
840042485955076096,2017-03-10 03:31:50,NormaJTorres,15,0,Twitter for iPhone,"RT @HFACDemocrats: Today, @NormaJTorres pushed for an independent commission to investigate #Russian interference #FollowTheFacts https://t…"
840010873519427585,2017-03-10 01:26:13,NormaJTorres,4,11,TweetDeck,Deeply saddened by the tragic fire that killed at least 21 in #Guatemala. We must do more to protect children https://t.co/p4kzKWicri
839984432526290944,2017-03-09 23:41:09,NormaJTorres,16,26,TweetDeck,Joined @HFACDemocrats in call for INDEPENDENT commission to study Russian interference in US elections. Voters dese… https://t.co/56EvrNTSS9
839944916356694016,2017-03-09 21:04:08,NormaJTorres,8,0,Twitter for iPhone,"RT @HFACDemocrats: Rep. @NormaJTorres: ""Our voters need to know what happened... How did Russian agents interfere in our election?"" #Follow…"
839944806612799488,2017-03-09 21:03:41,NormaJTorres,2,1,TweetDeck,Last chance to sign up for my #ACA #Healthcare #Obamacare Telephone Town Hall.  Register here: https://t.co/bp7rm6Poe9
839681056928317440,2017-03-09 03:35:39,NormaJTorres,149,0,Twitter for iPhone,RT @washingtonpost: Agencies reporting 911 outage for AT&amp;T customers across U.S. https://t.co/PdIKzgMkP4
839672841134092289,2017-03-09 03:03:00,NormaJTorres,0,2,Twitter for iPhone,REMINDER! I'm hosting a #healthcare  #ACA Telephone Town Hall to answer your questions. Sign up here: https://t.co/bp7rm6Poe9
