id,created_at,coordinates,retweets,favorite_count,source,text
50587064382656512,2011-03-23 15:57:50,,0,1,Twitter Web Client,today is the 1yr anniversary of the #AffordableCareAct! Click to see the damage to PA if it is repealed- http://bit.ly/dWLRkU @FamiliesUSA
49864309664264192,2011-03-21 16:05:52,,0,0,Twitter Web Client,"Reps. Carney, Runyan, Meehan and I had a great bipartisan meeting this morning w/ UAW & then toured Boeing facility in Ridley Park"
48798137556545536,2011-03-18 17:29:17,,0,0,Twitter Web Client,Info on the crisis in Japan - http://bit.ly/icbnFr
48399437046874112,2011-03-17 15:04:59,,0,0,Twitter Web Client,@HouseAdm_Dems hearing on Election Assistance & '12 Budget Request is happening now. Click here to watch live http://bit.ly/kKRXb
48383592849612800,2011-03-17 14:02:02,,1,0,Twitter Web Client,RT @HouseAdm_Dems: Check our live stream of the #EAC #Budget Hearing 10:30 today http://tinyurl.com/EACbudgLStrm #elections #congress
48118277251137536,2011-03-16 20:27:45,,0,0,Twitter Web Client,"Today, members of my staff participated in @Rep_Giffords #SaveALife training. Click here for classes near you http://ow.ly/4fTpv"
46228711586009088,2011-03-11 15:19:18,,0,0,Facebook,My thoughts and prayers are with the people of Japan and those affected by the earthquake and tsunami. If you have... http://fb.me/TlBlz6hF
46220463424286720,2011-03-11 14:46:31,,94,0,Twitter Web Client,RT @USArmy: Soldiers and Army Families stationed in Hawaii can follow @USAGHI & @25ID for latest local updates on impending tsunami.
45886566329094145,2011-03-10 16:39:44,,0,0,Facebook,Entries for the 2011 White House Easter Egg Roll lottery are being accepted NOW -... http://fb.me/XaQBDx7S
45536734129307648,2011-03-09 17:29:38,,0,0,Twitter Web Client,At 1pm I will help oversee a Markup of Omnibus Cmt #Funding. More info - http://go.usa.gov/48z @HouseAdm_Dems for live updates
45203038260035584,2011-03-08 19:23:38,,0,0,Twitter Web Client,"Invite your friends to join to the debate, under the new ""Invite"" tab on our Facebook Page. http://on.fb.me/dmI28K"
45152823893164032,2011-03-08 16:04:06,,2,0,Twitter Web Client,"RT @USGPO: Congressman Robert Brady's remarks about GPO's 150th:
http://www.gpo.gov/fdsys/pkg/CREC-2011-03-03/html/CREC-2011-03-03-pt1-P ..."
44829005899239425,2011-03-07 18:37:22,,1,0,Twitter Web Client,RT @HouseAdm_Dems: @RepBrady in action -3/9 at 1pm  CMT #Markup -Omnibus Cmt #Funding &Cmt Jurisdiction Resolutions #contracting http:// ...
43784786594115584,2011-03-04 21:28:01,,0,0,Twitter Web Client,March is Women's History Month. Here are some of the ways I am working to ensure progress and equality for women - http://bit.ly/hQ1buF
43753198883844096,2011-03-04 19:22:30,,1,0,Twitter Web Client,"Headed in the right direction. RT @nytimes U.S. Economy Added 192,000 Jobs in February; Unemployment Rate at 8.9% http://nyti.ms/gqMtp0"
43425753303490560,2011-03-03 21:41:21,,1,0,Twitter Web Client,RT @NPF: Thanks @repbrady (D-PA-1) for meeting w/ our advocates yesterday on Capitol Hill for #psoriasis research!
40812993126076416,2011-02-24 16:39:10,,1,0,Twitter Web Client,RT @LCVoters: @RepBrady Congrats on scoring 100% on LCV’s new #scorecard. Thanks for your leadership! http://bit.ly/bK04tb
38701199171649536,2011-02-18 20:47:39,,2,1,Facebook,Today I took to the House floor to stand up for the little guy. Watch the video here: http://fb.me/RyQJNKhK
37990724670590976,2011-02-16 21:44:29,,0,0,Twitter Web Client,I am proud to be the Ranking Member of the Committee on House Administration. Follow the work that goes on there - http://on.fb.me/fdFTGi
33618144517955584,2011-02-04 20:09:24,,2,0,Twitter Web Client,"RT @RepBecerra: Unemployment dropping, continues comeback @HouseDemocrats began in '09. Where's your #jobs plan @SpeakerBoehner? http:// ..."
33174321211908096,2011-02-03 14:45:49,,140,0,Twitter Web Client,RT @StateDept: U.S. citizens who wish to depart #Egypt via USG-chartered transportation: call 1-202-501-4444 | email EgyptEmergencyUSC@s ...
32915071759818752,2011-02-02 21:35:39,,1,0,Facebook,"I have been closely monitoring the situation in Egypt, and I wanted to bring you the most up to date information... http://fb.me/Onxz1tb9"
31501392669573120,2011-01-29 23:58:11,,3,1,Facebook,The State Dept has established a task force regarding the situation in Egypt.  For inquiries regarding American... http://fb.me/U50ilGbm
31099447781883904,2011-01-28 21:21:00,,0,0,Facebook,"America must maintain its leadership so our economy remains competitive. Last Congress, the House of... http://fb.me/QUZh097a"
28541486660329472,2011-01-21 19:56:35,,1,0,Facebook,This week I voted to protect patients' rights and fought against putting insurance companies back in charge of our... http://fb.me/TfRwQhIz
27840929784135680,2011-01-19 21:32:49,,4,0,Facebook,"Help reach 5 million views and UnitedHealthcare of PA will donate $50,000 to Susan G. Komen for the Cure! http://fb.me/T7VU7WmR"
27054960474591232,2011-01-17 17:29:39,,4,0,Facebook,"""Darkness cannot drive out darkness. Only light can do that. Hate cannot drive out hate. Only love can do that.""  - Martin Luther King, Jr."
24218049980665856,2011-01-09 21:36:47,,3,0,Facebook,"My thoughts and prayers go out to Congresswoman Giffords, her family, and staff in this horrible time.  Please... http://fb.me/Ni6FUnY6"
16241410416054274,2010-12-18 21:20:28,,4,0,Facebook,"I proudly voted twice to repeal the military's Don't Ask, Don't Tell policy, and today my colleagues in the Senate... http://fb.me/PN9sEKHS"
13323398029512704,2010-12-10 20:05:20,,1,0,Twitter Web Client,"honored my district gets to host fantastic army-navy game this year.  In honor of our USN Mil. Fellow, GO Navy- Beat Army! #armynavy"
4965757280583680,2010-11-17 18:35:03,,1,0,Twitter Web Client,"A statement on my resolution honoring Philly airport, Southwest Airlines, and Einstein Healthcare Network http://bit.ly/d5bKeP"
2730033990864898,2010-11-11 14:31:05,,1,0,Twitter Web Client,take some time today to thank a veteran for his or her service.  #veteransday
2729800099700736,2010-11-11 14:30:09,,1,0,Twitter Web Client,Thank you to all of our veterans for your service at home and abroad.   #veteransday
2433128803082240,2010-11-10 18:51:17,,7,0,Twitter Web Client,@USMC Happy birthday United States Marine Corps! Thank you for keeping our country safe and free
604926170370048,2010-11-05 17:46:40,,1,0,Twitter Web Client,"want to attend the National Christmas Tree Lighting? Enter the lottery here:
http://bit.ly/booox2"
29688692037,2010-11-04 18:05:02,,1,0,Twitter Web Client,RT @PHLSportsDaily: Bill Clement will become a U.S. citizen tonight at Flyers game - cool story about teammates taking journey... http:/ ...
29096219360,2010-10-29 15:05:57,,1,0,Twitter Web Client,http://tinyurl.com/37f4hda Congressman Robert A. Brady: The Brady Brief - Pell Grant Award Information
29000525444,2010-10-28 15:42:27,,1,0,Twitter Web Client,I want to congratulate the 4 amazing individuals from the 1st district that received Fulbright awards for the '10-'11 year.
28705437364,2010-10-25 16:17:41,,0,0,Twitter Web Client,look for me on @mitchellreports at 1 pm ET today.
28705046387,2010-10-25 16:12:51,,1,0,Twitter Web Client,thanks @HRC for the 100% score on my voting record.
28704432218,2010-10-25 16:05:32,,0,0,Facebook,"Recently, I received a 100% score from the Human Rights Campaign for my voting record this Congress.  I am proud... http://fb.me/JVjMgSej"
28416328723,2010-10-22 15:44:05,,2,0,Twitter Web Client,have not done a #FF in a while.  Today's #followfriday is for the Mayor- @Michael_Nutter
28415623036,2010-10-22 15:35:58,,0,0,Twitter Web Client,http://tinyurl.com/2amymu2 Congressman Robert A. Brady: The Brady Brief - Retroactive Stop Loss Payments
28054065243,2010-10-21 19:30:02,,2,0,Twitter for BlackBerry®,RT @brookebrower: #Pennsylvania Gov. Ed Rendell (D) & @RepBrady (D-PA) play #Hardball Thursday at @TempleUniv on #PASen & the battle for ...
27954457143,2010-10-20 18:28:48,,1,0,Twitter Web Client,@IAVA thank you for an A rating on your yearly report card. I will continue to fight for our veterans http://bit.ly/9VJwi2
27944938248,2010-10-20 16:13:50,,0,0,Facebook,"I was honored to receive an ""A"" rating today from the Iraq and Afghanistan Veterans of America Action Fund.  I... http://fb.me/Kyvo9JU0"
27745490825,2010-10-18 15:34:48,,1,0,Twitter Web Client,$1 billion  for clean energy investments in PA.  Check out my new Brady Brief http://tinyurl.com/2653ujo
27593354058,2010-10-17 01:32:57,,0,0,Twitter for BlackBerry®,"Have a veterans question? Don't hesitate to contact one of my offices or check out my website and ""ask Bob"""
27593273996,2010-10-17 01:31:53,,10,0,Twitter for BlackBerry®,"RT @HouseDemocrats: RT @LeaderHoyer: American Legion gives @HouseDemocrats high marks on veterans issues, highlighting “real successes”  ..."
27045544093,2010-10-11 15:47:14,,1,0,Twitter for BlackBerry®,Way to go #phillies.
26995833721,2010-10-11 02:47:55,,1,0,Twitter for BlackBerry®,RT @OFA_PA: @RepBrady is getting the crowd #firedup to give a big Philly welcome to @BarackObama and Vice Pres. Biden. #vote2010 #OFA
26602911524,2010-10-07 00:46:38,,2,1,Twitter for iPhone,2nd no-hitter in postseason history. Way to go #phillies and #Halladay.
26577404214,2010-10-06 19:11:32,,0,0,Twitter Web Client,"(cont) this money helped 22,678 students to continue their education in college. #education"
26577374018,2010-10-06 19:11:04,,0,0,Twitter Web Client,"did you know that our district received almost 68 million dollars in Pell Grants from 08-09, helping our children to afford college..."
26491193643,2010-10-05 21:19:26,,2,0,Twitter for BlackBerry®,RT @KimmelCenter: Even @RepBrady came out to rock!! @KimmelCenter #JerseyBoys  http://twitpic.com/2uy27k
25911011503,2010-09-29 19:33:19,,0,0,Twitter Web Client,"Rocky, move over. here comes a ""Democracy Champ"" for Philly http://bit.ly/9h6Bee"
25908653611,2010-09-29 18:57:40,,0,0,Facebook,Congressman Bob Brady is presented commemorative boxing gloves for his work as a “Democracy Champ” by the Campaign... http://fb.me/yF5rAapM
25796359941,2010-09-28 15:45:56,,12,0,Twitter Web Client,RT @HouseDemocrats: Consumer Reports' easy-to-understand guide to your newest health reform benefits: http://bit.ly/bQhuqw (PDF)
25720053357,2010-09-27 20:51:38,,2,0,Twitter Web Client,RT @FairElections: Great pics of our #FairElections rally today with @RepBrady. Check out those boxing gloves--he's a democracy champ!   ...
25718370328,2010-09-27 20:26:56,,1,0,Twitter Web Client,Tony Danza was just on Oprah to talk about his experience teaching for a yr. at Northeast HS in Philly. #education
25692521787,2010-09-27 14:43:22,,0,0,TwitRank,My Twitter Rank is &#34;Overlord&#34;. What&#39;s your Rank? http://twit-rank.com #TwitRank
25437084136,2010-09-24 20:41:22,,1,0,Facebook,"This week, the House passed a strong Small Business Jobs Bill, providing millions of small businesses with the tax... http://fb.me/IE1lQ9L0"
25425706868,2010-09-24 17:50:58,,1,0,Twitter Web Client,"yesterday the House passed Small Business Jobs Act 237-187. Helping to create 500,000 jobs and $12 billion in tax cuts"
25318401034,2010-09-23 15:44:49,,1,0,Twitter Web Client,several important provisions kick in today from the #HCR.  including pre-existing coverage protection for children http://bit.ly/9SjaUJ
25318318367,2010-09-23 15:43:51,,0,0,Facebook,"Congressman Bob Brady joins Albert Littlepage, DA Seth Williams and NAACP President Jerry Mondesire in support of... http://fb.me/KiHQ965A"
25130976624,2010-09-21 16:02:45,,1,0,Twitter Web Client,RT @PhillyDailyNews: Two stimulus awards in Phila. http://dlvr.it/5fN4x
25053807693,2010-09-20 20:04:24,,0,0,Twitter Web Client,(Cont)..helping to provide these young people with info. on the opportunities these great schools can provide to them
25053712064,2010-09-20 20:02:49,,0,0,Twitter Web Client,this past weekend I hosted Philly area 7th to 9th grade students interested in Military Service Academies at Naval Air Base Willow Grove..
24784161279,2010-09-17 19:03:20,,1,0,Facebook,"This week, the House voted to boost the American manufacturing industry and create jobs by requiring the Congress... http://fb.me/xIfva9gq"
24767863377,2010-09-17 15:30:23,,0,0,Twitter Web Client,congratulations to the former broad st bullies who will now be US citizens. http://bit.ly/cqy4rX  #flyers #philly
24766554951,2010-09-17 15:15:34,,1,0,Hootsuite,Happy constitution day. Today we celebrate the signing of the US constitution in 1787.
24598028315,2010-09-15 19:41:12,,0,0,Twitter Web Client,spoke on floor earlier today b4 passing HR 2039- Congressional Made in America Promise Act- helps Congress to support small biz
24486518913,2010-09-14 15:45:21,,0,0,Twitter Web Client,excited to be greeting @BarackObama in Philly soon and attend his back to school speech. #education
24414156309,2010-09-13 20:51:51,,0,0,Facebook,Philly Trivia Time!  Walnut Street Theatre is America's oldest theatre. When was it founded?  Answer here - http://brady.house.gov/
24216919063,2010-09-11 18:35:31,,1,0,Twitter for BlackBerry®,Today we remember the countless lives lost on 9-11 and take time to honor those who defend our great nation
24135589881,2010-09-10 20:35:12,,1,0,Facebook,"Over the last few months, the House has taken unprecedented action to better the lives of all Americans. From... http://fb.me/IqOqjWAA"
23938355586,2010-09-08 18:43:00,,1,0,Twitter Web Client,the Jewish holiday Rosh Hashanah starts at sundown.  I would like to wish my Jewish constituents a happy new year
21691132038,2010-08-20 20:03:16,,4,0,Twitter for BlackBerry®,This congress has enacted 8 separate tax cuts for small biz. Continuing to fight for the middle class #dem #p2
21338348156,2010-08-16 19:15:54,,2,0,Twitter Web Client,last week we celebrated 75 yrs of #socialsecurity.  #Dems fighting to protect this program for our nations seniors
20502754691,2010-08-06 22:17:48,,0,0,Facebook,"Make It In America - a new manufacturing strategy based on the idea that when more products are made in America,... http://fb.me/DRkYxpi3"
20393771116,2010-08-05 14:57:58,,1,0,Twitter Web Client,going back into session nxt week to pass assistance for education and Medicaid.  #FMAP
20323715735,2010-08-04 18:24:27,,4,0,Twitter Web Client,"RT @RepGaramendi: In a car & in politics, it’s D to go forward & R for reverse. Job creation bills passed by #Democrats http://bit.ly/De ..."
20231508772,2010-08-03 15:53:40,,1,0,Twitter for BlackBerry®,President Obama signed the Fair Sentencing Act into law earlier. Great step in crack-cocaine disparity
19929141645,2010-07-30 18:12:19,,0,0,Twitter Web Client,celebrating 45 years since LBJ Signed Medicare into law. Watch that historic moment: http://bit.ly/aWaZM8
19928819329,2010-07-30 18:07:06,,0,0,Twitter Web Client,@HealthCareGov Celebrating 45 years of Medicare http://bit.ly/dwU3Wa
19852798922,2010-07-29 20:27:40,,0,0,Twitter Web Client,2mrw is last day to b included for #2010Census! call 866-872-6868 if you didnt get a form or visit. Be counted!
19744076116,2010-07-28 14:19:48,,0,0,Twitter Web Client,saw South Philly Vikings from our very own #Mummers parade perform lst nite on #AGT(america's got talent). Good luck!
19686459986,2010-07-27 21:13:45,,2,0,Facebook,There are new health care benefits that are available to you!  Click here for more information - http://go.usa.gov/OF7
19675134511,2010-07-27 17:57:13,,1,0,Twitter Web Client,correction- *just spoke on House floor about my committee BILLS to improve operations for House and Library of Congress*
19674869147,2010-07-27 17:52:49,,0,0,Twitter Web Client,just spoke on House floor about my committee bill to improve operations for House and Library of Congress
19672925282,2010-07-27 17:21:44,,0,0,Twitter Web Client,hoping the Senate does the right thing and allows the DISCLOSE Act to be debated. and passed. #corporateaccountability
19661905323,2010-07-27 14:44:12,,0,0,Twitter Web Client,@technicallyphl sad i didn't make list for influential twitterers in Philly. mayb next yr http://bit.ly/dwygbZ
19601698496,2010-07-26 20:58:01,,0,0,Facebook,"Think you know your Eagles?  Due to the war effort during the 1940s, the Eagles and the Steelers found that they... http://fb.me/D63ZAS4B"
19343417318,2010-07-23 14:28:52,,0,0,Twitter Web Client,"and i will continue to vote for legislation that creates jobs and manufacturing as part of the #Dem ""make it in America"" agenda"
19343406222,2010-07-23 14:28:43,,0,0,Twitter Web Client,#Dems for more manufacturing made in America by Americans. That's why i voted for US Manu. Enhancement Act this week
19277191856,2010-07-22 19:10:54,,0,0,Facebook,Today I voted again to extend unemployment benefits.  I encourage the President to sign this bill into law as soon as possible.
19274274881,2010-07-22 18:20:56,,0,0,Twitter Web Client,gavel has hit. unemployment benefits extension passed. off to signature by the Prez.
19264479634,2010-07-22 15:49:55,,2,0,Twitter Web Client,soon House will pass Unemployment extension after Senate passage last night. long overdue and much needed
19098946003,2010-07-21 19:12:06,,0,0,Twitter Web Client,what wall street reform means to you (video): http://bit.ly/bzOqZs
19092005727,2010-07-21 17:16:43,,0,0,Facebook,"This morning, President Obama signed into law a sweeping reform of Wall St. which will protect Americans from... http://fb.me/vSkr7702"
19024049515,2010-07-20 21:34:56,,1,0,Facebook,Glad to see the Senate finally ended the filibuster stopping an unemployment extension.  This will provide help... http://fb.me/C55m5BK4
19023850848,2010-07-20 21:31:31,,0,0,Facebook,Looking forward to the Senate passing unemployment extension so we can help those who need it most. http://fb.me/DIYJF5zm
19015284390,2010-07-20 18:57:27,,0,0,Twitter Web Client,check out my interactive map of 1st district #recovery act projects: http://bit.ly/9tMtAq
18943440069,2010-07-19 21:06:52,,0,0,Facebook,Did you know the first computer was built by scientists at the University of Pennsylvania?  Take a guess at what... http://fb.me/DgVDH408
18728738294,2010-07-17 01:00:03,,0,0,Facebook,"I am committed to helping our vets, and recently the government has taken steps to honor those who have served - http://go.usa.gov/OUA"
18710241527,2010-07-16 19:26:59,,0,0,Twitter Web Client,check out my latest newsletter about our amazing #veterans: http://bit.ly/a2t086
18625793673,2010-07-15 19:29:22,,0,0,Twitter Web Client,glad to see Wall St. Reform pass the Senate
18549208177,2010-07-14 21:19:22,,0,0,Facebook,New resource to help deal with the BP oil spill in the Gulf http://fb.me/AEbD6ecg
18465057652,2010-07-13 20:45:34,,0,0,Twitter Web Client,thanks for helping me hit 400 followers! glad to see my constituents are listening
18381922119,2010-07-12 21:02:12,,0,0,Facebook,"Benjamin Franklin, William Penn, Betsy Ross, and George Washington all attended religious services at this... http://fb.me/Bp7p6ssj"
18148204801,2010-07-09 21:20:36,,0,0,Facebook,Last week I voted to extend unemployment benefits. I will continue to fight to help those hardest hit by this... http://fb.me/Bih1roYn
18078342328,2010-07-09 01:23:23,,0,0,Facebook,"The Obama Administration launched a new website, RestoreTheGulf.gov,
to be a central location for news and... http://fb.me/sFvDkGQD"
18045802805,2010-07-08 16:18:23,,0,0,Twitter Web Client,check out restorethegulf.gov the all in one source for info and updates on the #bp oil spill
17974403056,2010-07-07 19:39:07,,0,0,Twitter Web Client,my prayers and thoughts are with those on the Duck Boat and their families.
17894996994,2010-07-06 20:39:48,,0,0,Facebook,Philadelphia is home to the nation's first hospital. What is the name of this important landmark?  Take a shot at... http://fb.me/CsSkM9lU
17873373305,2010-07-06 15:03:54,,0,0,Twitter Web Client,hope that everyone had a happy #independenceday
17521641525,2010-07-01 21:26:50,,0,0,Twitter Web Client,the House's bipartisan passage 2nite of extension of emergency unemployment is critical to my district. look to Senate now to follow through
17517893452,2010-07-01 20:14:16,,0,0,Twitter Web Client,my statement on new healthcare.gov website: http://bit.ly/d8DEUk
17515566961,2010-07-01 19:30:17,,0,0,Twitter Web Client,"video tour of the healthcare.gov website: http://bit.ly/ctFGXf
#hcr"
17515521784,2010-07-01 19:29:30,,0,0,Twitter Web Client,"@whitehouse http://HealthCare.gov brings h/c coverage options into 1 place, explains new benefits & asks 4 your feedback #gov20"
17496119728,2010-07-01 14:30:04,,38,0,Twitter Web Client,RT @HealthCareGov: Ready to take health care into your own hands? Get started at the new HealthCare.gov!
17450264043,2010-06-30 23:44:16,,1,0,Twitter for BlackBerry®,Tonight we passed #wallstreetreform. Toughest reform in decades #wsr #finreg
17443910910,2010-06-30 21:50:16,,0,0,Twitter Web Client,finished 20th! thanks to all my fans/followers.  Will continue to post regularly. http://bit.ly/b9OkgG #allstar
17414582574,2010-06-30 13:38:36,,0,0,Twitter Web Client,congrats to the #Dems on their #cbg2010 victory over the GOP
17360737932,2010-06-29 20:25:41,,0,0,Facebook,How much does the Liberty Bell weigh?  Take a guess and answer my weekly Philadelphia trivia question!... http://fb.me/wRQJZRPb
17272531518,2010-06-28 19:05:19,,0,0,Facebook,Looking to the Senate to pass the DISCLOSE Act to protect our elections http://fb.me/C6OyYEBZ
17272433103,2010-06-28 19:04:21,,0,0,Facebook,Looking to the Senate to pass the Disclose Act to protect our elections http://fb.me/BFcq9kWd
17264899377,2010-06-28 16:58:26,,594,0,Twitter Web Client,"RT @BarackObama: With Robert Byrd's passing, West Virginia has lost a true champion, and America has lost a voice of principle and reason."
17042965728,2010-06-25 20:51:49,,0,0,Twitter Web Client,"weekly wrap-up: passed DISCLOSE, '76ers draft @thekidet, #USA wins to advance, big steps in financial reg. 
#p2 #ff"
17034862416,2010-06-25 18:32:23,,0,0,Twitter Web Client,#FF #followfriday NBA Draft edition: welcome @thekidet (Evan Turner) our newest #Phila 76'er
17032165258,2010-06-25 17:48:51,,0,0,Facebook,Taking action on the BP Oil Spill - http://go.usa.gov/3SG http://fb.me/Dmusf8jI
17027513954,2010-06-25 16:37:54,,273,0,Twitter Web Client,RT @BarackObama: Last night's House-Senate agreement on Wall Street reform represents the toughest financial reform since the Great Depr ...
16963304362,2010-06-24 21:38:45,,0,0,Facebook,"I introduced the DISCLOSE Act in April, and today it was passed by the House.  Proud to protect our campaigns from... http://fb.me/xF7D2JSF"
16959213285,2010-06-24 20:29:52,,1,0,TweetDeck,#DISCLOSE passes.  Big step for fair elections!
16958584909,2010-06-24 20:22:37,,0,0,TweetDeck,just voted yes on #DISCLOSE Act.
16956729085,2010-06-24 19:59:45,,0,0,TweetDeck,who's saying it? and who's paying it? Thats what #DISCLOSE comes down to! the #American people deserve to know!
16956603080,2010-06-24 19:57:50,,0,0,TweetDeck,"like I just said on house floor: ""this motion to recommit is a needless distraction.""  No more obstruction, time to pass #DISCLOSE"
16954774959,2010-06-24 19:30:29,,0,0,TweetDeck,Great remarks! RT @AsstToTheSpkr: You can watch Rep. Van Hollen's floor speech in support of the #DISCLOSE Act here:  http://bit.ly/auL4MW
16950629098,2010-06-24 18:34:59,,0,0,TweetDeck,@leaderhoyer speaking in favor of #DISCLOSE right now.  Thanks for all the hard work Dem Leadership
16950479331,2010-06-24 18:32:45,,0,0,TweetDeck,my opening remarks on the #DISCLOSE Act: http://bit.ly/b9zQwn
16947446131,2010-06-24 17:46:27,,0,0,TweetDeck,#DISCLOSEmyth: infringes on first amendment rights. Not True!
16947007128,2010-06-24 17:39:35,,0,0,Facebook,live updates about my House floor action on the DISCLOSE Act -http://twitter.com/repbrady http://fb.me/BTmhI50H
16946931046,2010-06-24 17:38:23,,1,0,Facebook,live updates about my House floor action on the DISCLOSE Act -http://twitter.com/repbrady http://fb.me/AZqkNDEs
16943146269,2010-06-24 16:42:10,,1,0,TweetDeck,"just spoke on the floor  about  #DISCLOSE Act.  ""without Disclose...public would be left in dark about campaign finance"""
16939252425,2010-06-24 15:51:10,,1,0,TweetDeck,casting my yes vote for rules on #DISLCOSE to move forward with debate.
16938689780,2010-06-24 15:45:31,,0,0,Twitter Web Client,toughest reform on Cmpgn Finance since Cmpgn Rfm Act of '02. @whitehouse backs the bill. #DISCLOSE
16934473148,2010-06-24 14:48:29,,0,0,Twitter Web Client,thanks @speakerpelosi for the kind words.  lets pass #DISCLOSE today
16932315914,2010-06-24 14:17:21,,0,0,TweetDeck,Voters are in favor of campaign finance reform. #DISCLOSE Act will accomplish this. http://bit.ly/clOLjh
16929850561,2010-06-24 13:40:49,,0,0,Twitter Web Client,voting on my committee bill the #DISCLOSE Act today.  Fighting for #GovTransparency
16876990968,2010-06-23 21:01:57,,0,0,Facebook,The fight goes on to defend campaign honesty. http://fb.me/vteAkpUA
16862683658,2010-06-23 16:59:46,,1,0,Twitter Web Client,great win #USA soccer!
16798399145,2010-06-22 21:02:11,,0,0,Facebook,Think you know your Mummers?  Answer my weekly trivia question! http://brady.house.gov/ http://fb.me/BHaUIZx3
16796618544,2010-06-22 20:29:52,,0,0,Twitter Web Client,hot off the press! Join my network. http://bit.ly/92UGM9
16794822001,2010-06-22 20:00:09,,5,0,Twitter Web Client,RT @HouseDemocrats: New rules start today to reduce 400k smoking deaths & prevent kids from getting hooked on smoking: http://bit.ly/b6QpIj
16788468969,2010-06-22 18:08:28,,0,0,Twitter Web Client,Today marks #90 days since Prez signed historic #HCR into law.  watch the signing here: http://bit.ly/deiYtK
