id,created_at,coordinates,retweets,favorite_count,source,text
819219262275518465,2017-01-11 16:27:47,,4,0,Twitter for iPhone,RT @HouseAdm_Dems: .@RepBrady: Fundamental to our gov is the admin of free &amp; fair elections. Eliminating the @EACgov is something CHA Dems…
819007158775926784,2017-01-11 02:24:57,,2,19,Twitter for Android,Thank you President Obama. #ObamaFarewell https://t.co/ryb0An4Wql
818591027745304577,2017-01-09 22:51:24,,3,4,Twitter for Android,"Thank you to the officers at @DRPA_PAandNJ, where my father served as a police officer. #taketheLEAD2017"
818588982665768963,2017-01-09 22:43:16,,4,9,Twitter for Android,"Thank you @PhillyPolice, @UDPolice, @ChesterPolice, @NetherProvPD, @PAStatePolice, @CapitolPolice #taketheLEAD2017"
818586313012158464,2017-01-09 22:32:40,,3,9,Twitter for Android,"On this #LawEnforcementAppreciationDay, thank you to all our public servants who risk their lives for us each and every day #taketheLEAD2017"
813129014009360384,2016-12-25 21:07:18,,1,12,Twitter for Android,Happy Holidays from my family to yours. Merry Christmas! Happy Hanukkah!
809789873439830016,2016-12-16 15:58:45,,3,10,Twitter for iPhone,Happy to celebrate the opening of a new @Wawa in Upper Darby. Great to see new jobs for local residents. https://t.co/8akwhr2OTA
809466190217314304,2016-12-15 18:32:33,,1,3,Twitter for iPhone,#TaxSecurity: Don’t buy security software offered as a pop-up or by email. It’s likely a scam. https://t.co/TaFG7S031b #IRS
808334541974802434,2016-12-12 15:35:47,,122,280,Twitter for iPhone,I am deeply concerned by the report of Russian interference in the US election. I am calling for an immediate bipartisan probe.
806581599563292673,2016-12-07 19:30:13,,0,6,Twitter for iPhone,Remembering those we lost 75 years ago today. #PearlHarborRemembranceDay https://t.co/63IHG0y9Nj
804379443091406848,2016-12-01 17:39:38,,33,0,Twitter for Android,"RT @NancyPelosi: Proud to announce @louiseslaughter &amp; @RepBrady as Ranking Members of Rules &amp; Administration Committees, respectively https…"
804353792355553280,2016-12-01 15:57:42,,7,29,Twitter for iPhone,Today I was reelected Democratic leader of the @HouseAdm_Dems. Gratified by support of my colleagues and honored by @NancyPelosi nomination.
803685690655571974,2016-11-29 19:42:55,,15,25,Twitter for Android,It’s time for a raise for America’s working families. I stand with workers across our nation. #fightfor15 https://t.co/saT6Pnt94u
803631744888946688,2016-11-29 16:08:33,,33,36,Twitter for iPhone,Fair wages &amp; union rights are the bedrock of the middle class. #povertydoesntfly #fightfor15 https://t.co/w6gKtdoJMQ
803279202137047040,2016-11-28 16:47:40,,11,14,Twitter for iPhone,"We need proven, strong leadership now more than ever. That's why I #StandWithNancy! https://t.co/qQukmmhJIf"
799284772967251968,2016-11-17 16:15:14,,2,0,Twitter for iPhone,RT @DelRivCoalition: TY @RepBrady for your support in including the #DRBCA in #WRDA #DelRiverWatershed #philadelphia https://t.co/GiUsDIqDY…
799043437051965445,2016-11-17 00:16:15,,0,4,Twitter for iPhone,@DemocraticStarr I'm on page 9. https://t.co/Hplv8vJi2X
799013935890493442,2016-11-16 22:19:01,,19,68,Twitter for Android,No one with well-documented ties to white nationalism like Steve Bannon should be working in the White House. #NoHateinWhiteHouse
798170960666968064,2016-11-14 14:29:20,,4,0,Twitter for iPhone,RT @MatthewGiacobb2: @RepBrady @Eagles for POW/MIA chair dedication #GoneButNeverForgotten https://t.co/b5Dgite6eO
798170653610442752,2016-11-14 14:28:07,,2,0,Twitter for iPhone,"RT @HouseAdm_Dems: At #OneEmptySeat dedication, .@RepBrady proudly announces @HouseAdm_Dems bill to bring a chair to the Capitol https://t.…"
797197924006502401,2016-11-11 22:02:50,,1,3,Twitter for Android,Happy Veterans Day. Thank you to all those who have served our country!
795293289675194368,2016-11-06 15:54:30,,3,9,Twitter for Android,"Join me in honoring those who served our country today at the Philadelphia Veterans
Parade. It kicks off at 12pm fr… https://t.co/4HhNTDb4c8"
793552309674442752,2016-11-01 20:36:28,,4,8,Twitter for iPhone,Proud to support a celebration of @USNavy @aircraftcarrier &amp; the men and women who serve aboard them in November! https://t.co/QyGA4gxMPl
792028315804700673,2016-10-28 15:40:40,,4,11,Twitter for iPhone,I am calling for an immediate DOT investigation of PTC status in wake of today's CXS crash. Hearing that PTC was installed but not active.
788773324537159684,2016-10-19 16:06:29,,3,0,Twitter for Android,"RT @HouseAdm_Dems: .@RepBrady: “There will be a fair and honest election…”
https://t.co/6LnG8kk8yr"
788408902354399232,2016-10-18 15:58:24,,4,14,Twitter for iPhone,I will be on @MSNBC Live speaking with @kwelkernbc about the false charge of rigged elections.
788101306141577216,2016-10-17 19:36:08,,0,3,Twitter for iPhone,Honored to receive 93% on @FPAction's Food Policy Scorecard! See more scores here: https://t.co/8pvA1JLAMr #votefood https://t.co/3kxLJlDEaj
787375869081812992,2016-10-15 19:33:30,,3,0,Twitter for Android,"RT @muralarts: @RepBrady, your voice such familiar tunes 👏. Thank you for coming and showing support! #MuralArtsMonth https://t.co/Z9iavaB3…"
786259859964432384,2016-10-12 17:38:53,,3,9,Twitter for iPhone,Proud to have received a 100% perfect score on @HRC's Congressional Scorecard for supporting #LGBTQ equality.
785944690818289664,2016-10-11 20:46:31,,1,3,Twitter for iPhone,Today is the #DayoftheGirl. A reminder that we must work EVERYDAY for girls' equality and justice!
785871540692848640,2016-10-11 15:55:50,,3,3,Twitter for Android,Thank you @DeeleyforPhilly https://t.co/mIbydkEv1A
784799098599768064,2016-10-08 16:54:20,,10,20,Twitter for iPhone,"Proud to honor #MurthaLPD26, commissioned today in Philly, and named in honor of my friend and mentor Rep John Murt… https://t.co/63yuL9OQAO"
783392227259195393,2016-10-04 19:43:56,,17,0,Twitter for Android,"RT @Jim_Gardner: Voter registration deadline in Penna is October 11th. 
#Election2016"
775014459458936832,2016-09-11 16:53:40,,5,1,Twitter for Android,"Today, and everyday, we remember those we lost on 9/11. Our nation moves forward but we #neverforget."
773971951224254466,2016-09-08 19:51:07,,3,8,Twitter for iPhone,"Today is Hunger Action Day - in the year 2016, absolutely no child should go hungry #EndHunger #HungerActionMonth"
773539538111123456,2016-09-07 15:12:52,,3,0,Twitter for Android,RT @phillyvetparade: Know a Veteran that deserves to be recognized? Share their story with us at phillyvetsparade@gmail.com https://t.co/m7…
772890985261137920,2016-09-05 20:15:45,,1,7,Twitter for Android,Happy #LaborDay to all and a special thanks to the union men and women who give so much to our great nation!
755041148788477952,2016-07-18 14:06:52,,2,0,Twitter for Android,RT @Philabundance: .@RepBrady shares with @phillyrecord harmful effects #CNR2016 House version will have if remains unchanged: https://t.co…
750131062949474304,2016-07-05 00:55:56,,3,6,Twitter for Android,"Happy 4th of July!  I hope today was filled with family, friends, and good memories. Happy Birthday America."
748171311499845632,2016-06-29 15:08:35,,9,0,Twitter for Android,RT @CeaseFirePA: One of our own got shot down and we still did nothing! - @RepBrady reflecting on inaction after shooting of @GabbyGiffords…
747476892303892481,2016-06-27 17:09:13,,10,27,Twitter for iPhone,I applaud #SCOTUS decision to deny guns to domestic abusers. It's time Republicans stop blocking @HouseDemocrats efforts to end gun violence
746353380465999872,2016-06-24 14:44:47,,17,22,Twitter for Android,Please keep the police officer shot in Folcroft in your thoughts and prayers.
745667802657329152,2016-06-22 17:20:32,,149,122,Twitter for iPhone,@HouseGOP is blocking the public from entering the House Gallery to keep them from seeing this protest. Disgraceful.  #NoBillNoBreak
745651623440060417,2016-06-22 16:16:15,,57,143,Twitter for iPhone,Currently protesting on the House floor-our nation deserves a vote on gun control legislation including my bill supporting local gun laws.
742053375257284608,2016-06-12 17:58:06,,10,21,Twitter for Android,Deeply appalled &amp; saddened by the innocent murders in #Orlando. My prayers are with the victims of this hate crime and act of terrorism.
740230765011709954,2016-06-07 17:15:41,,3,12,Twitter for iPhone,Ramadan Kareem. Wishing Muslims throughout Philadelphia and Delaware County a blessed Holy month of #Ramadan.
733369403136446464,2016-05-19 18:51:05,,3,11,Twitter for iPhone,Very concerned that Verizon’s highly skilled union workforce is declining. I joined 87 colleagues against outsourcing good middle class jobs
730861955028819968,2016-05-12 20:47:23,,16,0,Twitter for iPhone,"RT @PPD24Dist: AMTRAK Train #188 Sunset Memorial Ceremony &amp; Candlelight Vigil, tonight, 7pm, 2045 Wheatsheaf Lane @PhillyPolice"
730786735534280704,2016-05-12 15:48:29,,1,3,Twitter for Android,"Thinking of the #AMTRAK crash one year later. My thoughts are with the families of those lost, the injured, and our brave first responders."
728288395336757248,2016-05-05 18:20:59,,12,15,Twitter for iPhone,Child care is a necessity for most families with preschoolers bc households need 2 incomes to get by. Let's expand access to #ChildCareNow!
720707390186909696,2016-04-14 20:16:46,,2,5,Twitter for Android,Thank you to the brave men and women aboard the @USSHARRYSTRUMAN.  Our nation is grateful for your service. @aircraftcarrier
720334974034055168,2016-04-13 19:36:55,,3,4,Twitter for Android,Congratulations to Shemar Coombs of Philadelphia as he participates in the @WhiteHouse #WHScienceFair today!  https://t.co/ziHnIWMUNu
718521778314854402,2016-04-08 19:31:56,,2,2,Twitter for iPhone,Congratulations to @SEPTA on the upcoming launch of Positive Train Control. More about SEPTA's commitment to safety: https://t.co/3Q9Mqroqin
716689637805318144,2016-04-03 18:11:39,,4,6,Twitter for iPhone,My thoughts and prayers are with those affected by today's tragic #Amtrak crash in Chester.
715207006794215426,2016-03-30 16:00:12,,4,0,Twitter for Android,RT @HouseAdm_Dems: @RepBrady &amp; @PhillyMayor met the CapitolPolice to discuss congressional security plans for the DemConvention #Philly htt…
714631131442847744,2016-03-29 01:51:53,,4,6,Twitter for iPhone,"My heartfelt thanks to the Capitol Police. Thank you for protecting me and my fellow members, our staff, and our visitors - everyday."
712244981667393536,2016-03-22 11:50:11,,5,3,Twitter for iPhone,Devastating news out of #Brussels. My thoughts and prayers are with the victims of this horrendous attack.
710500396754534400,2016-03-17 16:17:49,,3,3,Twitter for iPhone,Wishing everyone the luck of the Irish today. Happy St. Patrick's Day!
707274768781844481,2016-03-08 18:40:20,,2,3,Twitter for iPhone,Thanks to @RepDriscoll for his support of Nazareth Academy High School. @NAZ_Pandas: keep up the great work!
697619671906791425,2016-02-11 03:14:25,,2,0,Twitter for iPhone,"RT @LibertyUSO: @RepBrady @LibertyUSO Needs Your Help. Check Out The #HugAHero Program
https://t.co/jgmcEQMeEI https://t.co/5k55ZsIrFB"
697180467699834880,2016-02-09 22:09:11,,0,4,Twitter for iPhone,Proud to have passed bipartisan Female Veteran Suicide Prevention Act to address rise in women vet suicide rates  #PreventVetSuicide
685489831393259520,2016-01-08 15:54:46,,4,8,Twitter for Android,My thoughts and prayers are with @PhillyPolice Officer Jesse Hartnett.
684085740205125638,2016-01-04 18:55:24,,1,4,Twitter for Android,Congratulations to my friend @PhillyMayor @JimFKenney. Looking forward to working together for our city! #PHL2016
678994994410188802,2015-12-21 17:46:36,,1,1,Twitter for Android,Congratulations @Amtrak for completion of Positive Train Control on Northeast Corridor - a step to make sure the past doesn't repeat itself.
672116744484487168,2015-12-02 18:14:53,,2,4,Twitter for Android,Planned Parenthood plays a critical role in meeting the health care needs of low-income &amp; underserved men &amp; women across Philly #StandWithPP
669972191988051968,2015-11-26 20:13:12,,1,2,Twitter for Android,Wishing you and your family a very Happy Thanksgiving!
667462269966622720,2015-11-19 21:59:40,,3,4,Twitter for Android,Joining @SEIU members in support of a $15 minimum wage. The time is now to end the injustice of poverty wages. https://t.co/9WJD9pq2gr
665711674733805568,2015-11-15 02:03:26,,28,0,Twitter for Android,RT @visitthecapitol: Flags at the US Capitol have been lowered to half-staff until further notice to honor those who died in the tragedy in…
664497200232271872,2015-11-11 17:37:32,,0,2,Twitter for Android,Thank you to our veterans - today and everyday. It was an honor to be with so many of you during the Veterans Parade https://t.co/WlOQoGPD4C
663466963675557888,2015-11-08 21:23:45,,2,0,Twitter for Android,"RT @PHLCouncil: .@RepBrady: At last, philly has a parade to honor its #veterans https://t.co/DsRAnB75PR"
663381009287749632,2015-11-08 15:42:12,,4,4,Twitter for Android,A great day for a parade. Join us for a fantastic salute to our Veterans. https://t.co/h3J0RjWsUW https://t.co/I6u8hpCdXh
642355401187586048,2015-09-11 15:13:56,,4,4,Twitter for Android,Taking time today to remember those we lost and to thank those who serve.  Our nation and our lives move forward but we never forget.
641733934791958529,2015-09-09 22:04:27,,2,4,Twitter for Android,Welcome to Philadelphia @axalta. I am excited for your Global Innovation Center and the promise it brings! #AxaltaAtTheYard
641055803735166976,2015-09-08 01:09:48,,8,1,Twitter for Android,"Hoping today was one full of family , friends, and enjoyment while celebrating the workers that make this nation so great. Happy Labor Day"
639821969349844992,2015-09-04 15:26:59,,0,2,Twitter for Android,"Proud to have supported the OSHA grant for the Finishing Trades Institute of the Mid-Atlantic, which will be addressing workplace hazards."
634461207349563393,2015-08-20 20:25:14,,2,4,Twitter for Android,Wishing #JimmyCarter well as he starts treatment. He is a tireless advocate for all things good. A true fighter who will keep fighting.
630726903490592768,2015-08-10 13:06:26,,51,0,Twitter for Android,RT @RepBetoORourke: . @realDonaldTrump The Border Makes America Great #usmxs International 10k http://t.co/nLuCft2XxX
629386339595632640,2015-08-06 20:19:31,,0,0,Twitter for Android,From literacy tests to cutting early voting. From poll taxes to unnecessary voter IDs. Our county has more to do. #RestoreTheVRA #VRA50
621076509453885440,2015-07-14 21:59:13,,4,0,Twitter for Android,"RT @JonathanTamari: .@RepBrady -Obama call for criminal justice reform ""resonates"" in Philly. ""Too many young ppl caught in poverty, crimin…"
619509586492571648,2015-07-10 14:12:50,,2,4,Twitter for Android,Remove the display of any state flag that contains all or any portion of the Confederate flag from the US House. http://t.co/z4JK9Hob9L
617379019152035841,2015-07-04 17:06:43,,2,4,Twitter for Android,Wishing all a happy and safe 4th of July.
615690851273060352,2015-06-30 01:18:32,,4,2,Twitter for Android,I applaud President Obama's soon to be announced overtime rule that will raise wages and protect our middle-class workers.
614455313794789376,2015-06-26 15:28:57,,3,8,Twitter for Android,Today's decision is a victory for equality and love. http://t.co/YIZBcqN22v
614114259874775040,2015-06-25 16:53:43,,1,1,Twitter for Android,"#KingvBurwell decision means hard-working American families will continue to enjoy the benefits of dependable, affordable health coverage!"
613864999061188608,2015-06-25 00:23:15,,1,0,Twitter for Android,RT @HouseAdm_Dems: @RepBrady.Cosponsored vital legislation that restores key protections of Voting Rights Act. Read more here: http://t.co/…
611950195732054016,2015-06-19 17:34:30,,0,0,Twitter for Android,My thoughts and prayers are with the Roberts family and all those who knew Ralph. He lived an incredible life and gave so much to our city.
606143314941853696,2015-06-03 17:00:02,,1,0,Twitter for Android,"RT @HouseAdm_Dems: Join us at 1pm for an oversight hearing of the House Officers. Topics: campus/cyber security, voting, etc. Watch now: ht…"
604837881056768000,2015-05-31 02:32:42,,6,5,Twitter for Android,I am deeply saddened by the passing of Beau Biden. My thoughts and prayers are with the Vice President and the entire Biden family.
601133992490999808,2015-05-20 21:14:46,,0,1,Twitter for Android,"Today, I was proud to lead the House in honoring #Amtrak Train 188 victims and first responders. http://t.co/Swi5gVsGiM"
600402535648731138,2015-05-18 20:48:14,,0,0,Twitter for Android,Exactly 50 years after the launch of Head Start let's ensure the window of opportunity stays open for our nation's at-risk kids #HeadStart50
598329535994720256,2015-05-13 03:30:52,,6,6,Twitter for Android,Thoughts and prayers are with those affected by tonight's train derailment in Port Richmond. Thanks to our hospitals and first responders.
590620301433696257,2015-04-21 20:57:07,,2,1,Twitter for Android,The Senate has been playing political games w/ Pres. Obama's Attorney General nomination. Time to #ConfirmLynch now! http://t.co/fS5L1Tw3yz
578653034789629952,2015-03-19 20:23:29,,12,7,Twitter for Android,We need to modernize voter registration and ensure that state and local election officials are fully equipped to administer their elections.
578652788533653504,2015-03-19 20:22:30,,4,0,Twitter for Android,RT @HouseAdm_Dems: #VotingRights #VoterEmpowermentAct @RepBrady &amp; Dem Leaders reintroduce the Voter Empowerment Act. Read about it here: ht…
573648876890030080,2015-03-06 00:58:44,,10,3,Twitter for Android,Devastating news. Police Officer Wilson gave his life protecting our city. My thoughts and prayers are with his family and friends.
570343191100067841,2015-02-24 22:03:07,,11,6,Twitter for Android,I support repeal of the SGR. #FixMedicareNow
565892627242156032,2015-02-12 15:18:10,,23,18,Twitter Web Client,I am excited to announce that Philadelphia will host the 2016 Democratic National Convention!
542406320146509826,2014-12-09 19:51:58,,6,2,Hootsuite,Very excited by news of DOL’s final rule barring fed. contractors from discriminating in employment on a person's LGBT status #equality
537991924985364480,2014-11-27 15:30:44,,0,2,Hootsuite,Happy Thanksgiving! I am grateful for my family &amp; the 1st District of #PA. Remember to take a moment to think of those less fortunate today.
537619590680158209,2014-11-26 14:51:13,,2,1,Hootsuite,Join me in welcoming Day&amp;Zimmerman to @citychesterpa and thanking Mayor Linder &amp; Thaddeus Kirkland for advancing city http://t.co/L9fTINZXbJ
536970073630867456,2014-11-24 19:50:16,,6,0,Hootsuite,RT @HouseAdm_Dems: .@RepBrady Issues Letter on Latest #RepublicanLawsuit Effort http://t.co/Pq9eSgnvyJ
533343188111884288,2014-11-14 19:38:19,,4,0,Hootsuite,RT @HRC: @PhiladelphiaGov  Congratulations on Philadelphia scoring a 100 on @HRC's #2014MEI! http://t.co/rKeljuVEBQ #LGBT http://t.co/5mhzp…
533323695063064576,2014-11-14 18:20:52,,10,8,Hootsuite,"Moments ago, I introduced a bill on the floor of #Congress to expand federal hate crime laws to better protect #LGBT individuals"
532178670623141888,2014-11-11 14:30:57,,0,2,Hootsuite,Today we must think of all of the brave men &amp; women who risked their lives to protect our country - thank you for your service &amp; sacrifice
520641398228652034,2014-10-10 18:25:57,,3,1,Hootsuite,Proud to receive 100% from @HRC - we must continue the fight for #LGBT equality http://t.co/oKQEpnJVvj
514778981137403904,2014-09-24 14:10:47,,2,3,Hootsuite,L'Shana Tova to all of those celebrating Rosh Hashanah this week! My family and I wish everyone a happy and healthy 5775.
514494716776570880,2014-09-23 19:21:14,,43,0,Hootsuite,"RT @6abc: #BREAKING: 3 charged in attack on gay couple in Center City
http://t.co/SMpBUZQWnF"
514491743430266880,2014-09-23 19:09:25,,8,0,Hootsuite,"RT @phillygaynews: Congratulations to @SenatorJimFerlo, who became PA's first out state senator today #lgbt #harrisburg"
514453738095120384,2014-09-23 16:38:23,,1,0,Hootsuite,Don't forget that today is National Voter Registration Day! It's not too late. Learn more: http://t.co/9YYnZ9effr #CelebrateNRVD
514060516457984000,2014-09-22 14:35:52,,8,6,Hootsuite,I've written bill to strengthen hate crime laws to better protect those in #LGBT community - hate crimes have no place in #Philly or U.S.
513036016501129216,2014-09-19 18:44:52,,3,3,Hootsuite,@SFnicko @jfagone Alan. Mother like Alan Ladd. http://t.co/3azBfY118K. Game over. Have a great weekend guys.
512604867018645504,2014-09-18 14:11:38,,1,2,Hootsuite,Please take moment today to think of slain PA state trooper Cpl. Bryon Dickson. My deepest condolences to his family &amp; fellow troopers
512304983422042112,2014-09-17 18:20:00,,1,0,Hootsuite,@SFnicko @jfagone You were so close - thought you'd get there on your own. Last hint: It isn't a laddy's name.
511865861251297280,2014-09-16 13:15:05,,1,1,Hootsuite,@SFnicko @jfagone I'll give you A hint
511640574211145729,2014-09-15 22:19:53,,3,3,Hootsuite,@SFnicko @jfagone E as in Cheesesteak is incorrect
511633054188982272,2014-09-15 21:50:00,,3,6,Hootsuite,@SFnicko @jfagone Do you guys want to buy a vowel?
510063737026641920,2014-09-11 13:54:06,,0,1,Hootsuite,"On this anniversary of #911, let us #neverforget those we lost 13 years ago on this tragic day in American history"
507988294471544832,2014-09-05 20:27:02,,1,2,Hootsuite,Met w/ Sec of #VA Robert A. McDonald to discuss how to best serve our #veterans and their families http://t.co/kFF4PrR2TO
507890509785104384,2014-09-05 13:58:28,,126,0,Hootsuite,RT @RepJeffries: States w/ higher minimum wages are creating more jobs. Will fact-based evidence convince @HouseGOP to hold a vote to #Rais…
502100922320060416,2014-08-20 14:32:43,,2,5,Hootsuite,I'm sure this won't be the last time this all-star athlete will be on the cover of Sports Illustrated - Go #Mo'ne! http://t.co/ULiivgJFik
500020091019620353,2014-08-14 20:44:14,,29,24,Hootsuite,Extremely concerned &amp; saddened w/ situation in #Ferguson &amp; death of Michael Brown. I call for immediate demilitarization and investigation
495201577238822912,2014-08-01 13:37:11,,183,0,Hootsuite,"RT @HouseDemocrats: .@SpeakerBoehner, it's time to stop catering to most radical voices of the GOP &amp; address #BorderCrisis in thoughtful &amp; …"
494577991209725952,2014-07-30 20:19:16,,44,21,Hootsuite,"Instead of wasting taxpayer dollars on this lawsuit against the President, the GOP should pass the Fair Minimum Wage Act! #DoYourJobHouseGOP"
494566074638413826,2014-07-30 19:31:55,,1,1,Hootsuite,1 in 5 Americans and 1 in 3 children get health care through #Medicaid.  Happy 49th anniversary!
494127822081126400,2014-07-29 14:30:27,,154,0,Hootsuite,"RT @repsandylevin: Instead of wasting taxpayer $ on frivolous #GOPLawsuit, @SpeakerBoehner should join Dems to put #middleclassfirst! http:…"
492329837265440768,2014-07-24 15:25:54,,237,0,Hootsuite,RT @JuliaBrownley26: 5 years ago was the last time the minimum wage was raised. RT if you support Dem plan to put #MiddleClassFirst &amp; #Rais…
492309327504756736,2014-07-24 14:04:25,,10,9,Hootsuite,"Now THAT is a real throwback RT @chakafattah: #TBThursday / @RepBrady &amp; @chakafattah, years ago.  http://t.co/353y8xIgdz"
491941922496577536,2014-07-23 13:44:28,,78,0,Hootsuite,RT @RepJohnYarmuth: The Dem #MiddleClassFirst agenda includes 21st Century Make It In America Act to create good-paying jobs here at home h…
491218407585370112,2014-07-21 13:49:29,,162,0,Hootsuite,"RT @repjoecrowley: While GOP wastes time &amp; taxpayer $ suing POTUS, Dems have a plan to jumpstart our economy &amp; put  #MiddleClassFirst http:…"
491216636393701376,2014-07-21 13:42:27,,3,0,Hootsuite,RIP to my friend &amp; #Philadelphia legend Hank Salvatore - may his tireless commitment to our city never be forgotten
489772502886141952,2014-07-17 14:03:58,,86,0,Hootsuite,"RT @RepTierney: While GOP piles more debt on students, Dems will #BankOnStudents to help students refinance loans: http://t.co/GsfjjtpDyV #…"
489428264331804673,2014-07-16 15:16:06,,1,1,Hootsuite,"Instead of wasting America's $ on a ridiculous lawsuit, Dems have a plan to put the #MiddleClassFirst. Learn more: http://t.co/8rg72xSBI8"
489046942727831553,2014-07-15 14:00:51,,278,0,Hootsuite,"RT @RepJohnLarson: Today, House Dems will intro a constitutional amdt to overturn Citizens United b/c a govt #bythepeople is a govt of the …"
488783690609483776,2014-07-14 20:34:47,,4,0,Hootsuite,RT @RiegerReport: .@RepBrady asks Boehner for accountability on Obama lawsuit via @MEPFuller: http://t.co/JTkcexJHBX
488783529107787776,2014-07-14 20:34:09,,4,0,Hootsuite,"RT @HouseAdm_Dems: .@SpeakerBoehner I expect you will honor regular order through my committee, even with this highly irregular lawsuit.htt…"
487654187107622912,2014-07-11 17:46:33,,2,0,Hootsuite,RT @JFedinPhilly: Thank you @RepBrady for your unwavering support for Israel in helping to pass the Resolution supporting #Israel and conde…
486867616280371200,2014-07-09 13:40:59,,150,0,Hootsuite,RT @RepBarbaraLee: Failure to #RenewUI hurts all Americans - esp. communities of color: Af Am &amp; Latino unemployment rates up to twice count…
486546773717291008,2014-07-08 16:26:05,,2,1,Hootsuite,Mazel Tov to my friend and #Philly community leader Mark Segal on getting married to Jason Villemez this weekend! http://t.co/4F3xHgAYWp
486515751336308736,2014-07-08 14:22:48,,152,0,Hootsuite,RT @RepJerryNadler: Things better than @SpeakerBoehner's silly lawsuit: #ImmigrationReform #RaiseTheWage #RebuildAmerica #RenewUI
