id,created_at,coordinates,retweets,favorite_count,source,text
644632724268011520,2015-09-17 22:03:12,,2,4,TweetDeck,Recognizing 228 years of signing &amp; never ending fight to defend the liberties &amp; freedoms we cherish #ConstitutionDay http://t.co/1xUpAZCyhp
644279568958820353,2015-09-16 22:39:54,,3,1,TweetDeck,House passes S.230 to transfer 23 acres of fed land to @YKHC. Proud to introduce companion to @lisamurkowski 's bill. http://t.co/6tsiXIr3Og
644233814982688768,2015-09-16 19:38:05,,1,0,TweetDeck,"I'll be on the House floor @ approx. 4pm (ET) to speak on @lisamurkowski's S. 230, bill 2 transfer land to @YKHC 
http://t.co/39ghSSySg6"
642016735831396352,2015-09-10 16:48:12,,1,2,TweetDeck,Proud to support our troops @the_USO Care Package Service Project in DC. 2K + care packages will be produced today http://t.co/Wb1M8eICjP
641719490791776256,2015-09-09 21:07:03,,3,1,TweetDeck,"Obama Admin sends clear message to people of King Cove: they value wildlife over human life
http://t.co/R9FVR8wVyD http://t.co/tHoXdIorzC"
639317362827767808,2015-09-03 06:01:51,,7,6,TweetDeck,I hope the kindness and generosity of our people was not mistaken for the acceptance of #POTUS policies http://t.co/Alu2VLUvDV
639317064851791872,2015-09-03 06:00:40,,6,3,TweetDeck,"#POTUS fails 2 understand major barrier in AK– roadblocks in fed permitting. Read my thoughts:
http://t.co/Alu2VLUvDV http://t.co/8B66tCbLNF"
639216213357404161,2015-09-02 23:19:55,,2,0,TweetDeck,#POTUS must listen &amp; not lecture. The residents of Kotzebue have a message to share in advance of today's visit: http://t.co/kn01FPhhen
638897607230758912,2015-09-02 02:13:54,,12,16,TweetDeck,My thoughts on yesterday's #POTUS speech and Arctic infrastructure announcement http://t.co/bi0JxfCopM http://t.co/ccesB1gL9h
638893535807279104,2015-09-02 01:57:43,,12,6,TweetDeck,"#POTUS speech could have been opportunity 2 highlight broad Arctic needs,  instead filled w/ sky falling rhetoric
http://t.co/bi0JxfCopM"
638157428681367552,2015-08-31 01:12:42,,78,79,Twitter for iPhone,"Today, the nation recognizes what AK'ns have known for generations #Denali is rightful name 4 NAmerica's tallest mtn http://t.co/WodYOkEl7D"
637742260386332676,2015-08-29 21:42:58,,9,0,Twitter for iPhone,"RT @AESymposium: The AES going international! Arctic Encounter Paris will take place on December 11-12, 2015 during COP21! http://t.co/lh9K…"
637377882847883265,2015-08-28 21:35:03,,1,4,TweetDeck,"Temp injunction on EPA’s #WOTUS rule is a positive step in our fight to overturn this massive overreach by Fed gov't
http://t.co/h1UeXU0TY1"
637027937120821253,2015-08-27 22:24:30,,1,1,TweetDeck,"Help me share info on closures to AK airspace w/ aviators who may be traveling to ANC or Southcentral from 8/31-9/2
http://t.co/M8fx5mQIKt"
636752904192331778,2015-08-27 04:11:37,,13,16,TweetDeck,"My thoughts in @adndotcom on the President's upcoming visit -""empower our people &amp; state, not the federal gov't"" http://t.co/avCgoRvHns"
634611211292639232,2015-08-21 06:21:17,,9,10,Twitter for iPhone,Incredible view this evening #midnightsun http://t.co/OHVSfs89ta
634589264811040768,2015-08-21 04:54:05,,3,4,TweetDeck,"The nation's icebreaker fleet is dwindling. See my letter to @POTUS in advance to his visit to AK &amp; U.S. Arctic
http://t.co/h98DSKrCzU"
634168252701261824,2015-08-20 01:01:08,,3,3,TweetDeck,AK State Lands Advisory Group 2 discuss fed's failures as land managers &amp; steps 2 move more lands into AK ownership. http://t.co/P3Mjf7RsqK
634141284232470528,2015-08-19 23:13:58,,3,1,TweetDeck,"Thoughts are w/ people of Sitka, families of missing, &amp; responders awaiting improved conditions. AK stands with you @ this difficult time"
632334214881538048,2015-08-14 23:33:19,,3,2,TweetDeck,Thank you to the 477th Fighter Group at JBER for all the work you do to protect Alaska and the nation. http://t.co/IyAsDGd7uu
631995041716662273,2015-08-14 01:05:34,,3,1,Twitter for iPhone,Not too late to call into the veterans' town hall being held by VA Sec. McDonald. 1.800.767.1750; access code 79132 http://t.co/fHAYgGfZpX
631925694117883904,2015-08-13 20:30:00,,1,2,TweetDeck,#VA Secretary hosting veteran’s town hall @ Menard Center in Wasilla from 5-6pm. Listen @ 1.800.767.1750 - #79132 http://t.co/LW0TqeYY66
631919412849823744,2015-08-13 20:05:03,,4,3,TweetDeck,"My thoughts in response to President Obama’s video highlighting his Alaska trip 
http://t.co/dpQl7V5Umq http://t.co/UAJCk4IEr7"
628988183888461824,2015-08-05 17:57:23,,5,3,TweetDeck,".@lisamurkowski @SenDanSullivan &amp; I are seeking answers on reductions in  @USArmy AK troop #s 
http://t.co/AkpkiwFI5z http://t.co/tUrRIfY9Lu"
628638591196000257,2015-08-04 18:48:14,,14,21,TweetDeck,Happy 225th birthday @uscoastguard. Thank you for always being there in our time of need. Semper Paratus http://t.co/hFqXwoZxNd
627243531216797696,2015-07-31 22:24:46,,3,4,TweetDeck,"Sitting down with my summer interns to discuss their time in Washington, D.C. Thanks for all your hard work! http://t.co/2mS6s8HP9i"
627204057095139329,2015-07-31 19:47:54,,3,1,TweetDeck,"21 reasons the Iran deal is a bad deal
http://t.co/GwbtsSgDWs http://t.co/ulDv6wxMTw"
626559474220838912,2015-07-30 01:06:34,,2,5,TweetDeck,US House will not stop until every veteran is treated with the respect and dignity they deserve. #VAaccountability http://t.co/wfCMGB5yGZ
626493288619581440,2015-07-29 20:43:34,,3,5,TweetDeck,Chris Kyle knew and helped w/ the challenges facing our vets. It's fitting that his legacy be honored this way. http://t.co/HVtHZ4gxaX
626168406308462592,2015-07-28 23:12:36,,4,4,TweetDeck,"Bill to Rein in Excessive Government Regulation Passes House #REINS Act
http://t.co/l4y7tqGOg6"
625811205077250048,2015-07-27 23:33:12,,1,0,TweetDeck,"As a staunch supporter of our oceans &amp;  fishing industry, I proudly support efforts to combat &amp; defeat #IUU fishing
http://t.co/TBRJq0xAhH"
625765835093749760,2015-07-27 20:32:55,,2,0,TweetDeck,"ADA gave those w/ disabilities equal chance 2 live independent, self-sufficient lives. #ADA25
http://t.co/8J9I5oPnhD"
624983697217990656,2015-07-25 16:44:59,,2,1,TweetDeck,"Happy #TedStevensDay, AK! Let's celebrate as Ted would've wished, by getting out &amp; enjoying the great outdoors.
https://t.co/wEdB3TY9Nk"
624359081525047296,2015-07-23 23:22:59,,3,0,TweetDeck,The House will not accept the ‘innocent bystander’ defense from #SanctuaryCities http://t.co/dEqIQ1nMFR http://t.co/xLKRkoYnX8
623633847830376448,2015-07-21 23:21:10,,1,1,TweetDeck,"I will oppose POTUS &amp; @JohnKerry on Iran deal, but agree that Ayatolla's ""arrogant U.S"" statement is very disturbing.
http://t.co/55LvkmrbmJ"
623573921095393280,2015-07-21 19:23:02,,2,1,TweetDeck,"Flags @uscapitol are at half-staff in honor of the 4 Marines &amp; Navy sailor tragically murdered in Chattanooga, TN http://t.co/KL7G9PzVYc"
622187060942753792,2015-07-17 23:32:09,,2,0,TweetDeck,"RT @ktva: “After all the ‘legacy building’ he’s done in Alaska, I guess we’re owed more than a refueling stop.” - Don Young http://t.co/jjC…"
621807822154649600,2015-07-16 22:25:12,,7,2,TweetDeck,Saddened &amp; sickened by tragic #ChattanoogaShooting. My deepest condolences to families of the 4 U.S. Marines killed in this repulsive attack
621801041286295552,2015-07-16 21:58:15,,2,2,TweetDeck,Wishing my friend &amp; former colleague President George H.W. Bush all the best in recovery #TBT http://t.co/lctKf4ljwv
621476151039557632,2015-07-16 00:27:15,,0,2,TweetDeck,"Reminding Arctic Symposium participants how important it is to remember the residents of the Arctic #thisisouralaska
https://t.co/v9ZkghxiZN"
621028025786859520,2015-07-14 18:46:34,,6,2,TweetDeck,Iran negotiations have fallen far short from what Congress &amp; American people demanded. Read why I oppose the deal: http://t.co/4p9pj4zcpT
620736702076727296,2015-07-13 23:28:57,,2,2,TweetDeck,"Proud to support House efforts to encourage small business, the engine that drives US economy
http://t.co/aWaDG0a0sY http://t.co/NuBwjGGSjv"
620703179118776320,2015-07-13 21:15:44,,4,3,TweetDeck,Presenting Nicole Eldred of Anchorage with the Congressional @theaward Silver Medal 4 achievements in public service http://t.co/HICkqTmvvi
619617246592258049,2015-07-10 21:20:38,,1,1,TweetDeck,"Sable Scotton, Galena, stopped by during her visit to DC as AK's winner of the #HealthyLunchtimeChallenge. http://t.co/OBh8A4tPL8"
619259657060806656,2015-07-09 21:39:42,,1,1,TweetDeck,#TBT to me speaking on the House floor  7 years ago in support of ANWR and American energy resource development  https://t.co/8weff1VT9x
619230658586615811,2015-07-09 19:44:28,,1,3,TweetDeck,"On #AlaskaFlagDay, I joined @lisamurkowski 's and my interns to celebrate Benny Benson’s contributions to our state. http://t.co/1ABjizZqX7"
618933571999375360,2015-07-09 00:03:57,,4,3,TweetDeck,"The Army's announcement to cut 2,675 troops from AK is deeply concerning &amp; will have major impact on our mission. https://t.co/51TTPPwiU6"
618918325117153280,2015-07-08 23:03:22,,2,4,TweetDeck,"During times of growing global threats, the Army should not be cutting its presence in AK.
http://t.co/efjaikdt7t http://t.co/a41Q8hspu0"
618883973209571329,2015-07-08 20:46:52,,2,0,TweetDeck,RT @lruskin: Young Amendment Blocks ANWR Wilderness Plan@alaskapublic - http://t.co/twopI8W1AS
618569956934950912,2015-07-07 23:59:04,,6,2,TweetDeck,House passed my amend't 2 restrict funds from implementing Admin's revised conservation plan for ANWR coastal plain http://t.co/2fynVjODdl
618523992987672578,2015-07-07 20:56:26,,1,0,TweetDeck,RT @RepCloakroom: Rep. Young (R-AK) {@repdonyoung} Amendment was adopted by voice.
618523375548428289,2015-07-07 20:53:58,,5,0,TweetDeck,RT @Gardner_LM: .@repdonyoung on the floor w/amdmt to withhold $ for Obama plan to put #ANWR acres off-limits to oil/gas activity @CQnow
618523260947427328,2015-07-07 20:53:31,,2,0,TweetDeck,RT @RepCloakroom: We have begun 10 minutes of debate on the Rep. Young (R-AK) {@repdonyoung} Amendment.
618519257714925568,2015-07-07 20:37:37,,3,0,TweetDeck,About to offer amendment to restrict funding for Obama's ANWR designation. Tune in LIVE! http://t.co/39ghSSySg6 http://t.co/DJVdGzi32v
617400774407114752,2015-07-04 18:33:10,,6,8,TweetDeck,"I wish everyone a safe and wonderful #IndependenceDay , one filled with the love of family, friends, and country. http://t.co/3nAC9crEAO"
616305369418178561,2015-07-01 18:00:25,,1,1,TweetDeck,"Yesterday, I met with @NeighborWorksAK to discuss housing and community development across the state. http://t.co/RkcCnD5La7"
614974960327622656,2015-06-28 01:53:50,,7,4,Twitter for iPhone,Thanks #Sealaska for the special recognition you shared with me @ your 2015 annual meeting. Great day to be in Juneau http://t.co/J7HcfrN43d
614594174311100416,2015-06-27 00:40:44,,4,1,TweetDeck,ICYMI: BLM demands Burning Man provide 24-hour access to ice cream.  #appalling http://t.co/EEa0cQv54L
614529939061239809,2015-06-26 20:25:29,,2,1,TweetDeck,AK mourns the loss of those aboard yesterday's tragic plane crash. I share my deepest condolences &amp; sympathy
614187146367340544,2015-06-25 21:43:21,,2,0,TweetDeck,Ruling doesn’t change fact that #Obamacare is fundamentally broken. My thoughts on #SCOTUScare http://t.co/mDLz5uyCP3 http://t.co/MPOFvEKbH9
613838038636978176,2015-06-24 22:36:07,,0,2,TweetDeck,"Congratulations to East Anchorage H.S. student Laura Horton, the 2015 #CongressionalArtCompetition winner for AK. http://t.co/zR9DeP717g"
613798024108638208,2015-06-24 19:57:07,,0,1,TweetDeck,It’s always great meeting with Alaskans &amp; friends. Thanks @SeanParnellAK for stopping by during your visit to DC. http://t.co/Xb94zKcJqt
613793747722055680,2015-06-24 19:40:07,,3,0,TweetDeck,".@MJVInteractive House Natural Resources Subcommittee on Indian, Insular and Alaska Native Affairs http://t.co/37HAO95kXU"
613516277496287232,2015-06-24 01:17:33,,5,3,TweetDeck,House voted today to protect seniors’ access to care by eliminating Independent Payment Advisory Board (IPAB) http://t.co/xUNVywzVfT
612646583117721601,2015-06-21 15:41:42,,2,2,TweetDeck,"Happy Father's Day &amp; #SummerSolstice  Alaska. Gifting our father's the longest day of the year. #midnightsun
https://t.co/pKR1p7rcR3"
611629044782620673,2015-06-18 20:18:22,,5,8,TweetDeck,"Today, I  voted to repeal one of the many egregious parts of the #Obamacare - the medical device tax http://t.co/6usubY9xYR"
611312722098176000,2015-06-17 23:21:25,,2,1,TweetDeck,"Today I asked the Admin: Is there any good reason 2 deny the aboriginal land claims of these 5 native communities? 
http://t.co/r9sL8lpw9d"
611192401420513280,2015-06-17 15:23:18,,1,0,TweetDeck,"Watch Live, Subcommittee on Indian, Insular &amp; AK Native Affairs http://t.co/oIlibwxXlx"
610954971807383552,2015-06-16 23:39:50,,3,0,TweetDeck,"Today, I wrote the VA Sec for answers on the crisis currently facing the AK VA health system. http://t.co/sZ0JatD9yi http://t.co/BmnALAuXrW"
610939148216729600,2015-06-16 22:36:58,,2,0,TweetDeck,"A panel of Alaskans testified today on future of Arctic offshore energy development.
http://t.co/gMlRadSBqO http://t.co/6ygj8GmG1E"
609485356635979777,2015-06-12 22:20:07,,3,9,TweetDeck,Anne &amp; I wanted to share a special thank you for all the well wishes &amp; congratulations this week! #blessedandhumble http://t.co/1aOoqubPmJ
609452305155510273,2015-06-12 20:08:47,,3,3,TweetDeck,Read my statement to why I voted against Trade Promotion Authority http://t.co/VwH3iD0Nh0 http://t.co/7o5WM9m1gs
609138322515066882,2015-06-11 23:21:07,,1,1,TweetDeck,"@NatResources “These veterans deserve that land, that’s the whole intent of this bill"" 
https://t.co/5HWpMtQk6R http://t.co/X6X3DSbLtd"
608770310268178432,2015-06-10 22:58:47,,4,6,TweetDeck,I cosponsored legislation to expand NOAA’s efforts to study the impacts of ocean acidification http://t.co/CUOiqG2lXf http://t.co/IZa7f5F4hV
608763149328740352,2015-06-10 22:30:19,,1,0,TweetDeck,"Proud to defend UAA CTI graduates harmed by recent FAA hiring changes
http://t.co/rCkMxIXfDA http://t.co/gpzTheonku"
608658985382719488,2015-06-10 15:36:25,,1,0,TweetDeck,"Watch: Indian, Insular &amp; AK Native Affairs Sub Hearing on H.R. 2387, the AK Native Vets Land Allotment Equity Act. http://t.co/wWVQPV3p5R"
608345851187109888,2015-06-09 18:52:08,,26,37,TweetDeck,"On my 82nd birthday, Anne has given me the best gift anyone could ask for – her hand in marriage. http://t.co/srqwotL0Mp"
606915843033833472,2015-06-05 20:09:47,,6,7,TweetDeck,Tomorrow marks the 71st anniversary of D-Day. Join me in honoring the service &amp; sacrifice of our greatest generation. http://t.co/ihT4Tadaza
606245874549817344,2015-06-03 23:47:34,,1,1,TweetDeck,"CSJ Appropriations bill passes House, funds programs 4 economic dev't, public safety, fisheries &amp; national security.

http://t.co/QAzjaBMoYX"
606242431902859264,2015-06-03 23:33:53,,2,1,TweetDeck,Join me in honoring those killed @ Dutch Harbor and those who defended AK during WWII #DutchHarborRemembranceDay http://t.co/2A0cHzyOrN
606188976257515520,2015-06-03 20:01:29,,0,0,TweetDeck,"Army’s decision to release openings early underscores relationship b/t military &amp; AK residents
http://t.co/L1aKjnP3VC http://t.co/27fDremfJA"
605879538359238660,2015-06-02 23:31:53,,2,2,TweetDeck,#USAFreedomAct works to protect  Constitutional rights of citizens by reining in dragnet collection of data by gov't http://t.co/Vmaqv1hzGL
605544910339457024,2015-06-02 01:22:11,,2,2,TweetDeck,"More good news today! House just passed bill I introduced to renew, amend &amp; strengthen the MSA http://t.co/9yYDHlQEa4 http://t.co/AesRfqm5cK"
605536537263009792,2015-06-02 00:48:55,,0,3,TweetDeck,House just passed my bill to allow sale of 9 acres of unused federal property to city of ANC http://t.co/9X1CxnElLH http://t.co/r1KjO3w5Xv
605487297862041600,2015-06-01 21:33:15,,4,2,TweetDeck,Speaking on House Floor in support of my bill to update and reauthorize MSA -  H.R. 1335. https://t.co/k5WratCW9x http://t.co/7cLL8MSzuD
605465951136399360,2015-06-01 20:08:26,,3,0,TweetDeck,U.S. House is preparing to vote on my bill to strengthen and reauthorize the Magnuson-Stevens Act. Watch live debate! http://t.co/39ghSSQt7E
604427718101303296,2015-05-29 23:22:52,,0,0,TweetDeck,"Honored to receive the Charles Dick Medal of Merit from the AK National Guard Association

http://t.co/ndfnUoNKXA http://t.co/pJI15VerSI"
603684769780649986,2015-05-27 22:10:39,,0,0,TweetDeck,"USCG Captain Charles Cashin &amp; I discussing many issues facing USCG, including summer Search &amp; Rescue efforts in AK http://t.co/uYlMsFwYv8"
603650346620231681,2015-05-27 19:53:52,,3,1,TweetDeck,Gov't big enough 2 give you everything you want is big enough 2 take away everything you have WOTUS rule = dead wrong http://t.co/GKJCBjBM0z
602857712452554752,2015-05-25 15:24:13,,1,2,TweetDeck,Thank you 2 those who made the ultimate sacrifice 2 protect our nation &amp; preserve our freedom http://t.co/ivZdWA6hel
601936535521513472,2015-05-23 02:23:48,,1,1,TweetDeck,Check out my newest E-Newsletter http://t.co/7PqewJOMWC http://t.co/EjAZMC8nFj
601870491968757760,2015-05-22 22:01:22,,0,1,TweetDeck,Missile Defense Agency names Clear Air Force Station site for Long Range Discrimination Radar http://t.co/C66xDe94td http://t.co/CgZnFhurQA
601518888434737153,2015-05-21 22:44:13,,3,1,TweetDeck,"We are accepting applications for the 2015 Veterans Fellowship. Please share!
http://t.co/POrI0nFRZn http://t.co/5qRbdIYbJ2"
601474735931785217,2015-05-21 19:48:46,,0,1,TweetDeck,"AKs Congress Art Competition winner,  East Anc HS's Laura Horton ""Celebrating the Generations""
http://t.co/s7p2SA4bjW http://t.co/fLQq92o7N7"
601149105965047808,2015-05-20 22:14:50,,1,0,TweetDeck,ANTHC broke ground on a new patient housing facility in ANC. Proud to pass land transfer to make this a reality. http://t.co/yK05uLX3Yl
600807735479894016,2015-05-19 23:38:21,,1,1,TweetDeck,"I shared my thoughts following House passage of a short-term highway transportation funding bill. 
http://t.co/ATbmNiiOn9"
600789123130068993,2015-05-19 22:24:23,,0,0,TweetDeck,"Congress must lead by example. Today, the House passed bill to freeze Member pay  for the seventh consecutive year. http://t.co/InFKMXsYfm"
600463018594594817,2015-05-19 00:48:34,,5,4,TweetDeck,Bipartisan Coast Guard Bill with AK provisions passed the House this evening http://t.co/YQEyaOZAJE http://t.co/c7zk07COkF
600456041776685056,2015-05-19 00:20:50,,2,1,TweetDeck,"Proud to support passage of 6 commonsense solutions in the House to protect America's vets.

http://t.co/4taQUFfLvF http://t.co/qKEUtUIxMN"
599343171554963456,2015-05-15 22:38:42,,0,1,TweetDeck,"Key AK items included in FY16 NDAA: F-35 Basing Requirements, Galena Land Transfer, and SBA 8(a) Procurement Reforms http://t.co/7OrWZcBnop"
599309829933539328,2015-05-15 20:26:12,,0,1,TweetDeck,"ICYMI: @lisamurkowski and I proposed bicameral legislation to spur future development of Point Spencer, AK https://t.co/8YnxsYe2VT"
599014055014051841,2015-05-15 00:50:54,,2,1,TweetDeck,"My thoughts are with the Cuddy family
http://t.co/g0OYHAJc1P http://t.co/Tczc6vczyv"
599010279679131648,2015-05-15 00:35:54,,0,0,TweetDeck,"We set sanctions, we must play role in removing them. My thoughts on Iran Nuke review bill
http://t.co/UJKMM0l4i1 http://t.co/3HxZnrJDVf"
598916874085257217,2015-05-14 18:24:44,,3,0,TweetDeck,"RT @NatResources: Watch Live: @RepDonYoung chairs Indian, Insular &amp; Alaska Native Affairs Oversight Hearing http://t.co/1dmi7Vaors http://t…"
598564824956674049,2015-05-13 19:05:49,,3,3,TweetDeck,".@lisamurkowski &amp; I introduced bicameral bill 2 spur future development of Point Spencer, AK
http://t.co/Ux5jJ3RF0f http://t.co/yny4RIfH45"
598289044875976704,2015-05-13 00:49:58,,3,1,TweetDeck,"House passes bill 2 halt EPA expansion of WOTUS, which has dire consequences for AK activity http://t.co/UHz3GXtF3a http://t.co/Zs54200ymu"
597880676696875008,2015-05-11 21:47:16,,3,0,TweetDeck,Today's conditional approval of Shell’s Exploration Plan (EP) is a positive step in the right direction http://t.co/X4sz5IIuAy
594254220645261313,2015-05-01 21:37:01,,3,1,TweetDeck,"House passed the Energy &amp; Water Development Approps t, critical for AK ports and harbors. http://t.co/ithXd2uu2C http://t.co/icEzKAt6IH"
594247577404596225,2015-05-01 21:10:37,,1,1,TweetDeck,"AK Delegation will hold the 2015 Federal Grants Symposium on  May 27, 2015. For more info http://t.co/qnsmAKqFZW http://t.co/69HUlws2Fu"
593960798487224320,2015-05-01 02:11:04,,2,3,TweetDeck,"Today, we passed the 2015 Coast Guard Reauth in Committee, includes my Tok land transfer bill. http://t.co/LTtiydIaxe http://t.co/4vZudbhY6W"
593942042583105536,2015-05-01 00:56:32,,1,1,TweetDeck,3 AK military construction projects and improvements to VA healthcare passed in House approps http://t.co/pU4yB3EIrI http://t.co/w5prBqzwTl
593941678609817600,2015-05-01 00:55:05,,1,0,TweetDeck,"House passes FY16 MilCon/VA Approps Act, includes vital services for vets &amp; 3 milcon projects @ Eielson &amp; Ft Greely  
http://t.co/pU4yB3EIrI"
593894875717832705,2015-04-30 21:49:07,,0,1,TweetDeck,Autocare industry event w/ NASCARs Michael Waltrip. @mw55 how about a visit to the @PalmerMotorsportsPark? https://t.co/OThNWyIQq6
593873073780224000,2015-04-30 20:22:29,,4,1,TweetDeck,.@NatResources passed legislation to strengthen &amp;reauthorize Magnuson-Stevens Act today. Video from before hearing https://t.co/hlixLLbh4g
593788789371310080,2015-04-30 14:47:34,,2,0,TweetDeck,"House Natural Resources markup on H.R. 1335, legislation to reauthorize MSA. Watch Now!
http://t.co/SN5nJxrt0g http://t.co/YIUdFmXVOf"
593504252812660737,2015-04-29 19:56:55,,2,0,TweetDeck,"Welcome home Air Force Tech Sergeant Steven Wulf! Check out this great homecoming story by KTVA Alaska.

http://t.co/4ms3eEsqoJ"
593195650755534850,2015-04-28 23:30:38,,1,2,TweetDeck,I'm pushing for @USCG property transfer in Tok to find a permanent home 2 the regions only behavioral health clinic. http://t.co/syUJNdN7cU
593130757767483393,2015-04-28 19:12:47,,4,2,TweetDeck,"When the spring bear hunt &amp; prom coincide, why not do both? Check out this story about 15yo Cassidy Kramer of Kotz. http://t.co/QuMa2N1Tv3"
592830833347731457,2015-04-27 23:20:59,,1,0,TweetDeck,"Proud 2 see positive steps being made to implement “traditional foods amendment” I included in the 2014 Farm Bill 

http://t.co/rwh8R3qzLr"
591735030159814656,2015-04-24 22:46:39,,2,0,TweetDeck,My thoughts as the United States assumes its two year Chairmanship of the @ArcticCouncil https://t.co/rc85nergSq
591724617603162112,2015-04-24 22:05:17,,3,2,TweetDeck,Honored to join 23 WWII &amp; Korean War vets for the Changing of the Guard @ Arlington National Cemetery #HonorFlight https://t.co/6bzRUinfjo
591653785472229376,2015-04-24 17:23:49,,2,1,TweetDeck,The US begins it's 2 year Chairmanship of the @ArcticCouncil. Tune in @ 10am (AK) to watch http://t.co/f05wpADouj http://t.co/LaMlJV0Iml
591326863110197248,2015-04-23 19:44:45,,3,0,TweetDeck,ICYMI: I recently proposed language to  transfer unused Air Force property to the city of Galena http://t.co/asUwAeiIyj
591009317601599488,2015-04-22 22:42:56,,2,2,TweetDeck,"As a former teacher, I always enjoy meeting with AK's future leaders. #closeup http://t.co/H5E01JwryQ"
590977987702616064,2015-04-22 20:38:26,,6,5,TweetDeck,"Meanwhile back in the office @KristinDavis &amp; I talked wildlife conservation in Africa. No Carrie, Samantha or Miranda http://t.co/U6E6QUgzrW"
590977284443611137,2015-04-22 20:35:39,,1,0,TweetDeck,"Chairing a Subcommittee on Indian, Insular &amp; Alaska Native Affairs 2 discuss Obama Admin's tribal recognition process http://t.co/mK3t1bDUmf"
590926749149585408,2015-04-22 17:14:50,,0,0,TweetDeck,Forever indebted to our vets. Proud of groups like @HonorFlight for showing our vets the appreciation they deserve https://t.co/RygTjWQpIo
590291687169134592,2015-04-20 23:11:19,,6,2,TweetDeck,"Congrats 2 those representing AK @bostonmarathon, incl. fellow Young (Jeff) who won age group in 2:46 #BostonStrong http://t.co/Lt2KGoORJM"
590276300528431105,2015-04-20 22:10:11,,1,0,TweetDeck,"Disappointed 2 hear Gen. Dempsey’s 'not symbolic' remarks on advances made 2 Ramadi, Iraq by IS forces #RamadiMatters http://t.co/dIJOhy2WA1"
588836920991571968,2015-04-16 22:50:36,,2,2,TweetDeck,"On the 100th day of the 114th Congress, I shared this message with Alaskans. https://t.co/m0uRGhrcbB #First100Days"
588802231673102336,2015-04-16 20:32:46,,3,0,TweetDeck,RT @RealMissSCusa: What a treasure!! @repdonyoung is absolutely captivating! It was such a pleasure speaking with him today! http://t.co/TU…
588795860353331201,2015-04-16 20:07:27,,1,2,TweetDeck,"My bill 2 transfer NARA lands 2 #MOA passed committee. Win-win 4 AK Reduce fed holdings, increase dev't &amp; MOA tax rev http://t.co/fCrxi7qzQV"
588476870972149761,2015-04-15 22:59:54,,1,3,TweetDeck,House 2day tackled a # of commonsense tax reforms to improve transparency &amp; operations of IRS http://t.co/Gkq7bU32BZ http://t.co/E7VPlqcgHk
588440259324575744,2015-04-15 20:34:25,,3,6,TweetDeck,"On this day in 1865, the world mourned the death of a remarkable leader, President #AbrahamLincoln #150thAnniversary http://t.co/lIaNAMeQJC"
588436562582503425,2015-04-15 20:19:43,,1,1,TweetDeck,"Americans deserve a gov't that’s efficient, effective &amp; accountable, 3 things the IRS has failed to deliver #TaxDay http://t.co/eYcdllnYCr"
588147106696814592,2015-04-15 01:09:32,,3,2,TweetDeck,"Testified before HASC on AK priorities in NDAA, including proposal to transfer unused Air Force land to Galena,AK http://t.co/ogeXiYfg7p"
