id,created_at,user,retweets,favorite_count,source,text
431212888825397248,2014-02-05 23:48:58,RepDavidValadao,30,12,Twitter Web Client,I m proud the House came together to pass this common-sense bill. It is now up to the Senate to act |  http://t.co/lRrrDjgEsA #CA21
431195755718508544,2014-02-05 22:40:54,RepDavidValadao,18,8,Twitter Web Client,Debate has concluded on HR 3964. As we wait for the House to vote watch this clip from today: http://t.co/6WQE4J0U9e #CA21 #Water
431180639564353536,2014-02-05 21:40:50,RepDavidValadao,20,12,Twitter Web Client,"Families in the Central Valley need #water, food, and jobs #CA21 #PeopleOverFish  #California #4jobs"
431169404110262273,2014-02-05 20:56:11,RepDavidValadao,35,11,Twitter Web Client,"#DidYouKnow: It takes 1,799 gallons of #water to produce 1lb of beef #CA21 #CentralValley #California #PeopleOverFish"
431149261099511808,2014-02-05 19:36:08,RepDavidValadao,30,12,Twitter Web Client,"""As California does well, so does the United States.” - John F Kennedy, 1962 #California #Water Speech | WATCH: http://t.co/C2f2bsQJ3k #JFK"
431132639651586048,2014-02-05 18:30:06,RepDavidValadao,19,8,Twitter Web Client,How are you affected by the man-made #California drought? Respond with #PeopleOverFish in your tweet. @CA21 #CentralValley #Water
431123530076270592,2014-02-05 17:53:54,RepDavidValadao,24,5,Twitter Web Client,Watch the House Floor Live today as I fight for #water for our #Valley | http://t.co/6n8gSD71vf #CA21 #California #CentralValley
431103844265631744,2014-02-05 16:35:40,RepDavidValadao,20,9,Twitter Web Client,At 9 AM PT my bill will be debated on the Floor. It will provide a long term solution for our #water crisis.   http://t.co/5M0aD1Zjzd #CA21
430806031892226048,2014-02-04 20:52:16,RepDavidValadao,9,0,Twitter Web Client,RT @RulesReps: @RepJimCosta @RepScottPeters @RepMcClintock @RepDavidValadao now speaking before the Committee on Rules on HR 3964
430749938775883776,2014-02-04 17:09:23,RepDavidValadao,23,10,Twitter Web Client,#IWontStandFor bullying. Watch my @CharactersUnite video and take a stand of your own: http://t.co/dxh4LfLtWw #CA21
430739244894519296,2014-02-04 16:26:53,RepDavidValadao,18,7,Twitter Web Client,The Working Group &amp; I released a report regarding improvements that can be made to the ESA to better serve Americans. http://t.co/H9UYcxEecu
429341768430018562,2014-01-31 19:53:49,RepDavidValadao,23,8,Twitter Web Client,The Emergency Water Delivery Act will be on the Floor next week. I'm confident we'll pass this bill. http://t.co/5M0aD1Zjzd #Water #Drought
428608317867294720,2014-01-29 19:19:20,RepDavidValadao,27,7,Twitter Web Client,"Today, @DevinNunes @GOPWhip &amp; I introduced comprehensive legislation to resolve the Valley’s water crisis. Lean more: http://t.co/eEn2uhEgkA"
428533316443447296,2014-01-29 14:21:19,RepDavidValadao,24,13,Twitter for iPhone,Just discussed the importance of #bipartisanship and groups like @NoLabelsOrg w/ @realrobfinnerty on @bakersfieldnow http://t.co/2FPgJpjRCe
428526664713125888,2014-01-29 13:54:53,RepDavidValadao,18,7,Twitter Web Client,"At 6:10 AM PT, I will be LIVE on @bakersfieldnow discussing the State of the Union with @realrobfinnerty from Washington #SOTU #CA21"
428520078150500352,2014-01-29 13:28:42,RepDavidValadao,8,0,Twitter Web Client,RT @realrobfinnerty: @RepDavidValadao @dgvaladao Congressman David Valadao joins us this morning live - w/ reaction to last nights #stateof…
428337568649068544,2014-01-29 01:23:29,RepDavidValadao,34,19,Twitter for iPhone,"Tonight, I will be sitting w/ my colleague from across the aisle, @RepSinema.  #SOTU #HowWeFixIt @NoLabelsOrg http://t.co/xzMlk5Lvjn"
428197674811416576,2014-01-28 16:07:35,RepDavidValadao,20,6,Twitter for iPhone,What do you hope the President will say at the State of the Union Address tonight? #SOTU #CA21
428187281891938304,2014-01-28 15:26:17,RepDavidValadao,25,6,Twitter Web Client,"Despite the Senate's refusal to incl. our leg.water fix, I will keep working to provide drought relief for our Valley http://t.co/q5jZMmt2UC"
428185241660837888,2014-01-28 15:18:11,RepDavidValadao,22,6,Twitter Web Client,I'm extremely disappointed that the Senate rejected our temporary solution to bring water to the South Valley. http://t.co/q5jZMmt2UC
427844986558627840,2014-01-27 16:46:08,RepDavidValadao,23,7,Twitter Web Client,"At our request, @RepFrankLucas presented CA Water Reforms at Farm Bill Conf. Comm. It's time for the Senate to act.  http://t.co/TdBPeYub4Y"
427831604283576320,2014-01-27 15:52:57,RepDavidValadao,19,7,Twitter Web Client,I am excited to announce Military Service Academy Nominations! I'm honored to nominate our strongest leaders http://t.co/SPRgg45FRh
426126568520302592,2014-01-22 22:57:45,RepDavidValadao,23,13,Twitter for iPhone,@GOPWhip @Rep_DevinNunes &amp; @SpeakerBoehner joined me in Bakersfield 2 announce legislation to provide drought relief http://t.co/sE0NfxH50X
425720904874594304,2014-01-21 20:05:47,RepDavidValadao,10,0,Twitter for iPhone,RT @KMJNOW: Coming up at Noon on the #RayAppletonShow...@DevinNunes @RepDavidValadao @GOPWhip make a BIG announcement - listen: http://t.co…
425718666504593409,2014-01-21 19:56:54,RepDavidValadao,17,5,Twitter for iPhone,Tune into @KMJNOW 580 at noon PST w/ #RayAppleton. I'll be joined w/ @Rep_DevinNunes and @GOPWhip. Listen here: http://t.co/GbM1otNVOp.
425260118864060416,2014-01-20 13:34:47,RepDavidValadao,9,0,Twitter for iPhone,"RT @realrobfinnerty: @RepDavidValadao @dgvaladao Congressman Valadao joining us in studio this morning talking #highspeedrail, tweet me w/ …"
423220704838840321,2014-01-14 22:30:53,RepDavidValadao,21,5,Twitter Web Client,"Today, @HouseAppropsGOP announced they would fulfil my request to provide $20 million to fight citrus greening | http://t.co/bgjsgxch2R"
423195208235225088,2014-01-14 20:49:34,RepDavidValadao,19,7,Twitter Web Client,Thank you to everyone who participated in today's High Speed Rail Twitter Town Hall! #CAHSR #HighSpeedFail @RepJeffDenham
423193953983139840,2014-01-14 20:44:35,RepDavidValadao,20,7,Twitter Web Client,.@mwstafford @TulareVeteran @RepJeffDenham What CA voters supported is not what is being proposed today. #CAHSR #HighSpeedFail
423193423005245441,2014-01-14 20:42:29,RepDavidValadao,16,5,Twitter Web Client,".@tsheehan @RepJeffDenham any plan should be looked as a whole, taking into account profitability and honest demand #CAHSR #HighSpeedFail"
423192194124484608,2014-01-14 20:37:36,RepDavidValadao,17,6,Twitter Web Client,.@TulareVeteran I hear from hundreds of my constituents who are against the High Speed Rail project #CAHSR @RepJeffDenham
423188885284192256,2014-01-14 20:24:27,RepDavidValadao,20,10,Twitter Web Client,".@CCHSRA If CA cannot permit and fund the complete project, they should not be able to build any of it. #CAHSR #HighSpeedFail"
423188000252502016,2014-01-14 20:20:56,RepDavidValadao,17,6,Twitter Web Client,. @lenojames @RepJeffDenham Going forward with #CAHSR will actually hurt local transportation infrastructure in many Valley communities
423187912654467072,2014-01-14 20:20:35,RepDavidValadao,17,5,Twitter Web Client,".@MichaelDoyle10 I am always happy to consider a realistic plan. But facts are facts, and the business model doesn't add up #HighSpeedFail"
423187841963655168,2014-01-14 20:20:18,RepDavidValadao,17,6,Twitter Web Client,.@mwstafford CA is rapidly outgrowing its existing transportation &amp; water infrastructure. Must invest in our existing infrastructure #CAHSR
423187730135150592,2014-01-14 20:19:51,RepDavidValadao,18,7,Twitter Web Client,.@rail_LA jobs can be created by investing in existing infrastructure w/out wasting taxpayer $ on bloated projects #CAHSR #HighSpeedFail
423183213893517312,2014-01-14 20:01:55,RepDavidValadao,13,0,Twitter Web Client,"RT @RepJeffDenham: My friend and colleague @repdavidvaladao is joining us, so you can use #CAHSR to reach both of us."
423183039745650688,2014-01-14 20:01:13,RepDavidValadao,18,8,Twitter Web Client,Our High Speed Rail Twitter Town Hall is starting now! Send your questions to @RepDavidValadao and use #CAHSR! http://t.co/P283RvoaQA
423178309904519168,2014-01-14 19:42:26,RepDavidValadao,16,6,Twitter Web Client,Our High Speed Rail Twitter Town Hall starts in less than 30 minutes! Use #CAHSR and @RepDavidValadao so I can answer your questions!
422874028102021120,2014-01-13 23:33:19,RepDavidValadao,29,7,Twitter Web Client,Excited to join @RepJeffDenham for a #TwitterTownHall tomorrow at 12:00 PT. Tweet me your questions about CA High Speed Rail w/ #CAHSR.
422865394458574848,2014-01-13 22:59:01,RepDavidValadao,18,5,Twitter Web Client,Questions about CA High-Speed Rail? Send them to @RepDavidValadao w/ #CAHSR and tune in tomorrow at 12PT/3ET! http://t.co/poSVo9FaPn
420586817709043712,2014-01-07 16:04:46,RepDavidValadao,18,6,Twitter Web Client,"Yesterday, I was honored to present the Korean War Medal to Melza Chaney for his service to our country. #Veterans http://t.co/gFnRaRo9xU"
415868450100105216,2013-12-25 15:35:39,RepDavidValadao,18,10,Twitter for iPhone,Merry Christmas from my family to yours! http://t.co/mPzCiJohlO
413759019887509504,2013-12-19 19:53:32,RepDavidValadao,17,8,Twitter Web Client,Excited to join my neighbors in welcoming In-N-Out Burger to #Hanford! #CentralValley #CA #InNOut #LocalBusiness http://t.co/bb9VWgr4YP
412787245847183360,2013-12-17 03:32:03,RepDavidValadao,7,5,Twitter for iPhone,@CBS47 let the whole family tag along for tonight's interview! http://t.co/DzKiXfBNXH
412649357557526529,2013-12-16 18:24:08,RepDavidValadao,17,6,Twitter Web Client,Having a great time answering questions from 5th graders at Akers Elementary on base at #NASLemoore! #CA21 http://t.co/UENe9W1W0h
411509357260853249,2013-12-13 14:54:10,RepDavidValadao,19,5,Twitter for iPhone,"RT: @AmericaFerrera: ""Thanks @RepDavidValadao for a reasonable, practical and compassionate conversation on immigration reform.”"
411172669258596353,2013-12-12 16:36:18,RepDavidValadao,19,13,Twitter Web Client,Enjoyed discussing solutions to fix our immigration system w/@MariaTeesa1 &amp; @AmericaFerrera from the show Ugly Betty. http://t.co/I2EPm2ohi7
409062551251456000,2013-12-06 20:51:27,RepDavidValadao,16,5,Twitter Web Client,Thanks to the Valley Veterans pictured for serving on California's 21st Congressional District Service Academy Board! http://t.co/ZTyVOcV6GK
407993274881028097,2013-12-03 22:02:31,RepDavidValadao,7,0,Twitter for iPhone,RT @helenaguirrefer: Dos congresistas hoy en #ZonaPolitica en @Unvamerica:@RosLehtinen y @RepDavidValadao
402476088699285504,2013-11-18 16:39:12,RepDavidValadao,16,6,Twitter Web Client,Thank you to everyone who volunteered or donated to our food drive locations in #Hanford or #Delano this weekend! http://t.co/aXGXsyAo0G
400298242824343552,2013-11-12 16:25:12,RepDavidValadao,19,9,Twitter Web Client,Vea mi entrevista con @JorgeRamosNews de @UniNoticias en @alpunto sobre la reforma migratoria: http://t.co/EOCWnKjjeZ #CIR #TimeIsNow
399940537798516736,2013-11-11 16:43:49,RepDavidValadao,16,7,Twitter for iPhone,"Recently, I welcomed vets from the Valley to Washington. Thank you for your service and sacrifice! @HappyVeteransDay http://t.co/jpao9icfUq"
399551878981111809,2013-11-10 14:59:25,RepDavidValadao,42,0,Twitter for iPhone,RT @UniNoticias: .@RepDavidValadao rompió con su partido para apoyar la #ReformaMigratoria. AHORA EN @AlPunto http://t.co/xNCCjwUNTZ
398143065052819456,2013-11-06 17:41:18,RepDavidValadao,16,6,Twitter Web Client,Need help with a federal agency? Stop by one of my Mobile Office locations this month! Info: http://t.co/DmFGcAEuLE or call (559) 582-5526.
397390545607065600,2013-11-04 15:51:03,RepDavidValadao,16,7,Twitter Web Client,Tune in NOW to @KMJNOW for more information on my cosponsorship of H.R.15.
397379905584775168,2013-11-04 15:08:47,RepDavidValadao,16,6,Twitter Web Client,Thanks for having me on @CBS47 this morning @JennyToste and @ZaraTV! http://t.co/HKTGX280tB
397370287651835904,2013-11-04 14:30:34,RepDavidValadao,7,0,Twitter Web Client,RT @JennyToste: I spy @RepDavidValadao in the studio. We'll talk with him on @cbs47 coming up!
397086063594053632,2013-11-03 19:41:09,RepDavidValadao,17,7,Twitter for iPhone,"My son Connor, and I got to watch my wife, Terra complete her first half-marathon today. Very proud of her! http://t.co/NW85vaxhWR"
396109541706059776,2013-11-01 03:00:48,RepDavidValadao,18,6,Twitter for iPhone,Spent tonight taking two of the three kids trick-or-treating! Hope you &amp; your family had a fun and safe Halloween! http://t.co/hgoU8YmjME
395703675391602688,2013-10-31 00:08:02,RepDavidValadao,29,0,Twitter for iPhone,RT @RepJoeGarcia: BREAKING: .@RepDavidValadao joins as the 3rd Republican cosponsor in favor of #CIR. Thank you my friend!
395653867292987392,2013-10-30 20:50:07,RepDavidValadao,112,41,Twitter Web Client,In order to strengthen my message to Leadership I have cosponsored HR15. We must fix our broken immigration system: http://t.co/7hHEPak7xm
395597626311454721,2013-10-30 17:06:38,RepDavidValadao,10,0,Twitter Web Client,RT @john_dingell: Blessed to spend lunch with fellow WWII vets at @librarycongress. Thank u @RepJimCosta @DevinNunes @RepDavidValadao http:…
395595060093267968,2013-10-30 16:56:27,RepDavidValadao,13,7,Twitter Web Client,It’s not often you get to visit a Memorial w/ those the Memorial honors. I am incredibly grateful for their service. http://t.co/i88d6hdnZI
395329192671186944,2013-10-29 23:19:59,RepDavidValadao,22,7,Twitter Web Client,Thank you to those who joined today's telephone press conference to discuss immigration reform in the Valley! http://t.co/MUQJotQx6R
395297424731688960,2013-10-29 21:13:44,RepDavidValadao,13,5,Twitter Web Client,I’m excited to welcome Central Valley WWII Veterans to Washington this week as they visit DC and their monuments! http://t.co/0LIbcumavr
393100660277010433,2013-10-23 19:44:35,RepDavidValadao,18,0,Twitter for iPhone,RT @LuisGutierrez: Joining @RepSinema  @RepMikeCoffman &amp; @RepDavidValadao on allowing #Dreamers to serve in #Military http://t.co/4bDckEcnpM
390944463268237312,2013-10-17 20:56:38,RepDavidValadao,14,5,Twitter Web Client,Interested in attending a US Service Academy? Stop by West Hanford High School for an informational event at 5:30. More info: 559-582-5526
388704143289753600,2013-10-11 16:34:24,RepDavidValadao,15,6,Twitter Web Client,I was proud to host Maria Gutierrez from @aguaesdetodos at yesterday’s ESA forum in DC. INFO | http://t.co/xwrzXynWwZ #Water @CentralValley
388287188007649280,2013-10-10 12:57:34,RepDavidValadao,20,8,Twitter for iPhone,W/ my colleagues of @NoLabelsOrg to say #FixNotFight. Let's stop fighting &amp; start talking to end this shutdown now. http://t.co/ftcUTrflxc
387259077870383104,2013-10-07 16:52:13,RepDavidValadao,20,5,Twitter Web Client,"So far, House has passed 14 efforts to fund critical parts of gov. I will vote to fund the FDA today. Senate must act http://t.co/rzBnWjJpMn"
386516183513444352,2013-10-05 15:40:13,RepDavidValadao,15,5,Twitter Web Client,"Today, I voted to ensure furloughed federal workers, like those at Naval Air Station Lemoore, receive compensation http://t.co/cu1mvy0CKc"
385839122377879553,2013-10-03 18:49:49,RepDavidValadao,20,9,Twitter for iPhone,My staff and I are safe and accounted for. Thank you for your messages of concern. Details are not yet confirmed.
385785924879409152,2013-10-03 15:18:26,RepDavidValadao,15,6,Twitter for iPhone,Listen LIVE now as I join Ray Appleton on @KMJNOW to discuss the government shutdown.
385493053097521152,2013-10-02 19:54:40,RepDavidValadao,14,7,Twitter Web Client,"Yesterday, I hosted a bipartisan group of my freshmen colleagues. We are working together to end this gov't shutdown. http://t.co/nVqt03ZCpp"
385446167749746688,2013-10-02 16:48:22,RepDavidValadao,28,10,Twitter Web Client,"Until a compromise is reached to end the gov't shutdown, I am refusing to accept my pay. INFO:http://t.co/F2gRzmHHuM http://t.co/kgPiv1aPjx"
385438326020272129,2013-10-02 16:17:12,RepDavidValadao,17,6,Twitter Web Client,Our veterans should be able to access their memorials when they visit DC. It's unacceptable that WH will not allow it http://t.co/BHfaXwOtz0
385135555970752512,2013-10-01 20:14:06,RepDavidValadao,16,6,Twitter Web Client,I took constituents on a Capitol tour despite gov't shutdown. I will keep working for my CV constituents in DC http://t.co/aDQbYFoMfz
385121175552421888,2013-10-01 19:16:58,RepDavidValadao,18,6,Twitter for iPhone,RT: @RepScottPeters: Great questions about possibilities for #ImmigrationReform during this @NoLabelsOrg roundtable w/ @RepDavidValadao.
385118532339777536,2013-10-01 19:06:27,RepDavidValadao,21,6,Twitter for iPhone,Participated in @NoLabelsOrg discussion w/@RepScottPeters. GOP &amp; Dems must work together to tackle nations problems http://t.co/IteWcs6oUn
383267230965698561,2013-09-26 16:30:03,RepDavidValadao,17,5,Twitter Web Client,Participated in the Valley Fever Symposium w/ @kevinomccarthy&amp; @RepDavid Schweikert. We must cont. to raise awareness http://t.co/Ipa3xJupMb
382599018133471232,2013-09-24 20:14:48,RepDavidValadao,15,6,Twitter Web Client,Interested in attending a US Military Academy? Attend my US Service Academy Night on 10/17 for more info! | http://t.co/9icFGVUcr2
382563232709218304,2013-09-24 17:52:37,RepDavidValadao,15,5,Twitter Web Client,I cosponsored the Gov't Shutdown Fairness Act to prevent Congress from receiving a pay check if they can't compromise http://t.co/bj7ygAV5fo
382546159098540032,2013-09-24 16:44:46,RepDavidValadao,18,5,Twitter Web Client,"If Congress cannot compromise on a budget, I don’t believe Members should receive a pay check during that time. INFO: http://t.co/bj7ygAV5fo"
380744697041272832,2013-09-19 17:26:24,RepDavidValadao,15,9,Twitter Web Client,Enjoyed participating in today’s #GOPMeetup to discuss the important contributions made by #HispanicAmericans! http://t.co/8MBGayiXYC
380442754918014977,2013-09-18 21:26:35,RepDavidValadao,17,9,Twitter Web Client,Millones de hispanos contribuyen a fortalecer el sueño Americano #MesDelAHerenciaHispana http://t.co/5hfTORUYkV
380440588044087296,2013-09-18 21:17:59,RepDavidValadao,18,5,Twitter Web Client,Millions of Hispanic contribute to the strength of the American Dream #HispanicHeritageMonth | http://t.co/vlS1xL5lBj http://t.co/cmn2yvA5PH
380415197367644160,2013-09-18 19:37:05,RepDavidValadao,17,6,Twitter Web Client,In honor of #Hispanic American Heritage Month; what #HispanicAmerican do you look up to? Share your story - http://t.co/vlS1xL5lBj
380027352836624384,2013-09-17 17:55:56,RepDavidValadao,18,5,Twitter Web Client,"Happy #Constitution Day! On this day 226 years ago, 39 men signed the Constitution marking our nation’s dedication to democracy and freedom."
379618314567168000,2013-09-16 14:50:33,RepDavidValadao,16,4,Twitter Web Client,Interested in joining my team as an Intern? Contact my Hanford office @ 559.582.5526 for more information &amp; to apply! http://t.co/RGgKm23rey
378592372008812544,2013-09-13 18:53:50,RepDavidValadao,18,5,Twitter Web Client,My niece Delaney &amp; I with my sister-in-law Tegan celebrating her promotion to Chief Petty Officer in the US Navy. http://t.co/ew20jBPojW
378550024117825536,2013-09-13 16:05:33,RepDavidValadao,19,7,Twitter Web Client,84% of constituent survey responses are against military action in Syria. Take the survey &amp; let me know your stance http://t.co/TdfMgC99SC
378242553432121344,2013-09-12 19:43:47,RepDavidValadao,21,4,Twitter Web Client,At today's @TheCHLI press conference working to pass immigration reform w/ @RepCuellar @RosLehtinen @RepSires. #CIR http://t.co/HRZLFrwvW6
378235357545779201,2013-09-12 19:15:11,RepDavidValadao,15,3,Twitter Web Client,Know a 5th grade class that would like to participate in #ConstitutionDay this year? Visit http://t.co/rO61blkGLJ for more info! #CA21
378228214125953024,2013-09-12 18:46:48,RepDavidValadao,6,0,Twitter Web Client,RT @TheCHLI: The Congressional Hispanic Leadership Institute holds a press conference to urge Congress to Pass Immigration Reform http://t.…
378226768164823040,2013-09-12 18:41:03,RepDavidValadao,14,3,Twitter Web Client,2 meeting @ the @WhiteHouse on #Syria today w/ Chief of Staff McDonough. Do you support US military action in Syria? http://t.co/TdfMgC99SC
377858857462018048,2013-09-11 18:19:06,RepDavidValadao,15,3,Twitter Web Client,Tune in as I join Ray Appleton on @KMJNOW to discuss the upcoming Central Valley Honor Flight to Washington for our local veterans!
377774405369098241,2013-09-11 12:43:32,RepDavidValadao,15,3,Twitter Web Client,"We will never forget the tragedy that changed our nation forever. Today, remember the unity displayed by Americans. http://t.co/HDYbj2IdQE"
377530888046641152,2013-09-10 20:35:52,RepDavidValadao,18,4,Twitter Web Client,Met w/ VP @JoeBiden @ the @WhiteHosue today. I remain unconvinced that US should implement military force in #Syria | http://t.co/NMUtimNFFD
377416481421553665,2013-09-10 13:01:16,RepDavidValadao,16,4,Twitter Web Client,Had a great time @ the Hoops for Hope charity basketball game w/ Central Valley colleagues @GOPWhip &amp; @RepJeffDenham http://t.co/jUiUmZiuHF
377156220081037312,2013-09-09 19:47:04,RepDavidValadao,15,3,Twitter Web Client,I encourage you to read this @NYTimes article on where immigration reform stands with CA House Republicans | http://t.co/MD96wkyitG #CIR
375642873800032258,2013-09-05 15:33:34,RepDavidValadao,14,5,Twitter Web Client,Una reforma migratoria integral se puede lograr en la Cámara Baja. Lee mi artículo de opinión en el @FresnoBee | http://t.co/7H9Z2To3KT
375632889930465282,2013-09-05 14:53:54,RepDavidValadao,22,4,Twitter Web Client,I believe R's &amp; D's can achieve comp. immigration reform &amp; that we are closer to accomplishing this than some think- http://t.co/7H9Z2To3KT
375280514338275328,2013-09-04 15:33:41,RepDavidValadao,15,3,Twitter Web Client,I appreciated learning more about Kidney Disease while visiting with staff &amp; patients at @DaVita Dialysis in #Delano. http://t.co/eppGdeWOIv
375278534962315264,2013-09-04 15:25:49,RepDavidValadao,15,3,Twitter Web Client,I got to tour International Fruit Genetics near Delano. They let me try their newest creation: Cotton Candy Grapes! http://t.co/8vRehc49ou
374898089825284096,2013-09-03 14:14:04,RepDavidValadao,16,3,Twitter Web Client,Be sure to stop by my Bakersfield Open House tomorrow from 5:30-7 PM at my office located at 2700 M St. Hope to see you there! #CA21
374516816611397632,2013-09-02 12:59:01,RepDavidValadao,16,5,Twitter for iPhone,The CV is blessed w/extremely hardworking men &amp; women. Without you America would not be the great nation it is today http://t.co/GobSBr5W6v
374284428442632192,2013-09-01 21:35:36,RepDavidValadao,26,5,Twitter for iPhone,"After attending Intelligence briefings in DC today, I believe we need a precisely defined strategy before we consider taking action in Syria"
373535336330059776,2013-08-30 19:58:59,RepDavidValadao,18,3,Twitter Web Client,Awesome turnout at last night’s Open House event in #Hanford. Thanks to everyone who came out to participate!  #CA21 http://t.co/pEYRPFPy2b
373517088855298048,2013-08-30 18:46:28,RepDavidValadao,16,4,Twitter Web Client,"I had the honor of presenting Mr. Gome Ruiz, a WW II Army Vet from Tulare w/ a US Flag in honor of his service! #CA21 http://t.co/VfcMENc5ak"
372728138586800128,2013-08-28 14:31:28,RepDavidValadao,22,2,Twitter Web Client,"On this day in 1963 thousands marched on Washington for justice &amp; equality regardless of race, skin color or religion http://t.co/ULtVUvzxGj"
370639746592026624,2013-08-22 20:12:56,RepDavidValadao,16,3,Twitter Web Client,I had a great time with @ZaraTV on @CBS47 this morning. Be sure to tune in to @KMJNOW as I join Chris Daniel at 3 PM! http://t.co/hdkKzQdwh7
370639255061553153,2013-08-22 20:10:59,RepDavidValadao,18,4,Twitter Web Client,"Thank you to Kim Stephens, @kopigreatday, and the entire team at @KMPHFOX26 for having me on the show this morning! http://t.co/6oZtbWANTo"
370623395408265216,2013-08-22 19:07:58,RepDavidValadao,18,5,Twitter Web Client,It was an honor to watch these new citizens take their oath &amp; say the Pledge of Allegiance for the first time today. http://t.co/ax1AUAZaVP
370273227051765760,2013-08-21 19:56:31,RepDavidValadao,17,2,Twitter Web Client,Great turnout at this morning’s Community Coffee in #Selma. Thanks to everyone who came out to participate! #CA21 http://t.co/zSNBynLVBi
368371792693325824,2013-08-16 14:00:54,RepDavidValadao,17,3,Twitter Web Client,Visita mi nueva página web Congresional en http://t.co/Tv8Pd6JbfM para obtener información sobre mi trabajo en Washington en Español!
368069040834482176,2013-08-15 17:57:52,RepDavidValadao,21,4,Twitter Web Client,Check out my new website http://t.co/jm4qgObCbR  to learn more about my work in Congress &amp; share your concerns and opinions with me
367685623680733184,2013-08-14 16:34:18,RepDavidValadao,14,2,Twitter Web Client,"Need help with a federal agency? Stop by my Mobile Office program TODAY in Selma, Shafter, &amp; Kingsburg. More info: http://t.co/LzGemtmx2n"
364761228003913730,2013-08-06 14:53:48,RepDavidValadao,20,2,Twitter Web Client,"Discussed the need for a clean, reliable water supply at Delta Water Summit this weekend at CSU, Fresno. http://t.co/wGVo812LAZ"
361910001637416960,2013-07-29 18:04:04,RepDavidValadao,22,7,Twitter Web Client,Congressman @LuisGutierrez &amp; I at our immigration town hall meeting last week in #Bakersfield. #CIR #Bipartisan #CA21 http://t.co/RQN6IDPXkS
361909143126278144,2013-07-29 18:00:38,RepDavidValadao,18,3,Twitter Web Client,Check out this @Bakersfieldcali article - http://t.co/7AX9tDHbzw. I will keep working w/ R's &amp; D's towards comprehensive immigration reform
