id,created_at,user,retweets,favorite_count,source,text
644182138829565952,2015-09-16 16:12:44,RepDavidValadao,3,4,Twitter Web Client,"9/15/15 marked the beginning of #HispanicHeritageMonth. Let us celebrate the great
contributions Latinos have made! http://t.co/PAIErjmWCv"
642340513249669120,2015-09-11 14:14:47,RepDavidValadao,8,11,Twitter Web Client,14 yrs have passed since 9/11/01. We will never forget the bravery of first responders nor those who lost their lives. #NeverForget
642038606517956608,2015-09-10 18:15:06,RepDavidValadao,5,5,Twitter Web Client,It takes courage to be a police officer. Thank you Valley law enforcement for protecting our communities. http://t.co/mYRhdvPNuV
641713818054344704,2015-09-09 20:44:31,RepDavidValadao,5,7,Twitter Web Client,Dep. of @Interior is giving 4th graders &amp; their families free admission into all National Parks! Get your pass at http://t.co/ZRzVsi8pJ7!
641633835285938177,2015-09-09 15:26:41,RepDavidValadao,4,4,Twitter Web Client,The current #IranDeal fails to ensure the safety of Americans &amp; our allies.  Read my op-ed in the @FresnoBee: http://t.co/OHqvNVaCbE
633730696775892992,2015-08-18 20:02:26,RepDavidValadao,1,0,Twitter Web Client,Interested in attending a U.S. Service Academy? RSVP for Academy Night in Sept. by visiting http://t.co/fwVCdPFa65. http://t.co/CYZd2m6wvs
631930265099747328,2015-08-13 20:48:10,RepDavidValadao,0,4,Twitter for iPhone,Luca started kindergarten today. Where does the time go!? http://t.co/1FHlBMTN6l
631838228761419776,2015-08-13 14:42:27,RepDavidValadao,1,0,Twitter Web Client,Be sure to stop by my Small Business Workshop in Coalinga this month! INFO: http://t.co/5AsCJ3UY2m http://t.co/jcqlfh5C8R
624610495820005376,2015-07-24 16:02:01,RepDavidValadao,2,2,Twitter Web Client,Help me #NameThatCalf by posting your idea on Instagram! He was just born on Thurs! LINK: http://t.co/1hABIGlteN http://t.co/WeHKTchhKc
624243143874117632,2015-07-23 15:42:18,RepDavidValadao,3,7,Twitter Web Client,Congrats to Julie who completed her internship w/ my office through the GMU program for indv. w/ disabilities. #CA21 http://t.co/3BOZFRJwCM
623903547839651840,2015-07-22 17:12:52,RepDavidValadao,3,3,Twitter Web Client,What are your thoughts on @POTUS's proposed nuclear agreement with Iran? Take my survey to share your opinion: http://t.co/Cfy9QxOZsr
623592515350994944,2015-07-21 20:36:56,RepDavidValadao,7,9,Twitter Web Client,All #Capitol flags are at half-staff today in remembrance of those who lost their lives in #Chattanooga. #SemperFi http://t.co/LM0hcZzk07
623187194602258432,2015-07-20 17:46:20,RepDavidValadao,2,5,Twitter Web Client,For more info. about my work in Washington &amp; the Central Valley be sure to follow me on Instagram @RepDavidValadao! http://t.co/C1OwkLmDwp
621744655961620480,2015-07-16 18:14:12,RepDavidValadao,15,0,Twitter for iPhone,RT @KMPHFOX26: House passes bill to bring more water to California farms http://t.co/xK272GYA5r #CADrought #LiveOnFox26 http://t.co/DYpGd0G…
621744621048233984,2015-07-16 18:14:03,RepDavidValadao,3,6,Twitter for iPhone,Behind the scenes as @RepJimCosta and I discuss the passage of #HR2898 with Rich Rodriguez from @KMPHFOX26. http://t.co/IE15s38i5I
621743749329256448,2015-07-16 18:10:35,RepDavidValadao,6,8,Twitter for iPhone,Excited to announce that H.R. 2898; the Western Water and American Food Security Act passed in the House of Representatives today. #CA21
621696172214865920,2015-07-16 15:01:32,RepDavidValadao,8,10,Twitter Web Client,"Instead wasting billions on #HighSpeedRail, this Administration should be focusing on drought solutions. #CA21 http://t.co/z2gibrIdPF"
621680705177788416,2015-07-16 14:00:05,RepDavidValadao,17,12,Twitter Web Client,My drought relief bill will be voted on in the House today. The #CADrought affects the entire nation. VIDEO: http://t.co/wvn8yXRqjC
621414142197538816,2015-07-15 20:20:51,RepDavidValadao,2,6,Twitter Web Client,Signed my Instagram handle on the @GOPConference chalkboard for the #DigitalChallenge. Follow @RepDavidValadao! http://t.co/K1MgXC0WAV
621025666406989825,2015-07-14 18:37:11,RepDavidValadao,6,7,Twitter for iPhone,"Behind the scenes as I discuss the California drought and my legislation, H.R. 2898 with @mollyhooper from @thehill. http://t.co/JD40HmLh82"
621006356972220416,2015-07-14 17:20:27,RepDavidValadao,4,6,Twitter Web Client,"Watch remarks from today's Press Conference about my drought relief bill, H.R. 2898. VIDEO: http://t.co/tlmk5lKo7E http://t.co/VV3EAyxkLX"
620977656633364480,2015-07-14 15:26:25,RepDavidValadao,10,15,Twitter Web Client,Delta Smelt cupcakes courtesy of #TeamValadao - A reminder that we cant prioritize the needs of fish over families http://t.co/LFsNx83lqE
620960225051475970,2015-07-14 14:17:09,RepDavidValadao,10,0,Twitter for iPhone,"RT @HouseGOP: ""California produces more than half the fruits, vegetables in the U.S. If we don't act, food prices could rise."" @RepDavidVal…"
620954011370455040,2015-07-14 13:52:27,RepDavidValadao,4,5,Twitter for iPhone,Watch LIVE @ 7 AM PT on http://t.co/TshsAJohe6: Press conference w/ @SpeakerBoehner @SteveScalise @RepLynnJenkins @CathyMcMorris @GOPLeader
620953423031181314,2015-07-14 13:50:07,RepDavidValadao,4,0,Twitter for iPhone,RT @GOPLeader: LIVE @ 10 AM ET on http://t.co/ZbCzklhtDL: Press conference w/ @SpeakerBoehner @SteveScalise @RepLynnJenkins @CathyMcMorris …
620687352579629056,2015-07-13 20:12:51,RepDavidValadao,2,3,Twitter Web Client,Low precipitation coupled w/ the existing manmade drought means the entire nation will pay more for groceries. http://t.co/8qgWf9ir01
620631327830867969,2015-07-13 16:30:13,RepDavidValadao,3,6,Twitter Web Client,#CA21 Interns got to visit the @WhiteHouse! Interested in an Internship? Apply before 7/21!  http://t.co/JmQSAphovj http://t.co/tYYGMgI3ib
619534255828418561,2015-07-10 15:50:51,RepDavidValadao,2,5,Twitter Web Client,The 21st Century Cures Act is the healthcare solution our country needs. #Cures2015 INFO: http://t.co/k9WAxws2ob http://t.co/4jZtZSMQmz
619248131943759872,2015-07-09 20:53:54,RepDavidValadao,5,4,Twitter Web Client,#HR6 will change the lives of so many Americans. How has innovative healthcare impacted your family? http://t.co/vyT3BZ4eYE #Cures2015
619225930444242945,2015-07-09 19:25:41,RepDavidValadao,4,1,Twitter Web Client,@NatResources Comte passed my bill #HR2898 today. Next up - vote on the House Floor. CA needs #water now. #CA21 http://t.co/K7B2ulgQbg
619225368441057281,2015-07-09 19:23:27,RepDavidValadao,3,0,Twitter Web Client,"RT @NatResources: .@cates_julie @RepDavidValadao Learn about H.R. 2898, the Western Water and American Food Security Act of 2015, here: htt…"
618892377911001088,2015-07-08 21:20:16,RepDavidValadao,3,6,Twitter Web Client,"Today, @HouseAppropsGOP passed a bill that will help Central Valley agriculture and our rural communities. http://t.co/5PvTugLXTZ #CA21"
617361013462171648,2015-07-04 15:55:10,RepDavidValadao,5,7,Twitter for iPhone,"Have a fun, safe, &amp; patriotic holiday w/ family, friends, &amp; neighbors! Happy #Independence Day! #CA21 #4thOfJuly http://t.co/6VgmU4mhHQ"
616313598114201604,2015-07-01 18:33:07,RepDavidValadao,1,1,Twitter Web Client,"On Sat, I got to tour the @Gipper_76 &amp; meet w/ Sailors of Carrier Air Wing Two from #NASLemoore. Thanks for serving! http://t.co/D2SHVL7eEG"
615926561875865601,2015-06-30 16:55:10,RepDavidValadao,1,6,Twitter Web Client,Had an absolute blast hanging out with kids from #Shafter Youth Center yesterday and can't wait to go back! #CA21 http://t.co/j7lxYtTxMv
615923618594295809,2015-06-30 16:43:28,RepDavidValadao,0,2,Twitter Web Client,"Today, on the last day of #NationalDairyMonth, watch my remarks about #CA dairy &amp; RT to show your support for #Ag! http://t.co/ig90eKZmq3"
614609326276108289,2015-06-27 01:40:56,RepDavidValadao,6,11,Twitter for iPhone,"Happy Anniversary to the love of my life. Terra, you are the best wife and friend a guy could ask for! http://t.co/5SzGzE4Ew5"
614133281265741824,2015-06-25 18:09:18,RepDavidValadao,29,12,Twitter Web Client,Just introduced the Western Water &amp; American Food Security Act in the House. RT to tell Washington we need water now. http://t.co/txTA3znkKb
613784867130744832,2015-06-24 19:04:50,RepDavidValadao,0,3,Twitter for iPhone,@RepDavidValadao: Watch @bakersfieldnow LIVE now to catch my interview discussing the #CA #drought with @OfficialTMurphy. #CA21
612052431015428096,2015-06-20 00:20:45,RepDavidValadao,8,0,Twitter for iPhone,RT @RepSwalwell: Bipartisan balcony party w/ CA delegation. Caught up with pal @RepDavidValadao -- &amp; served @Wente wine to the group. http:…
609495399674609664,2015-06-12 23:00:01,RepDavidValadao,6,6,Twitter for iPhone,"Have you served in our Armed Forces? If so, I hope you will join me tmw in Lemoore for a Veterans' Workshop! INFO: http://t.co/MeR9aAS5MY"
609493737010515968,2015-06-12 22:53:25,RepDavidValadao,1,2,Twitter for iPhone,Thanks! RT: “@RepMimiWalters: Pleased to sign on as a cosponsor to @RepDavidValadao's bill to improve water shortage capabilities in #CA”
609425537166110720,2015-06-12 18:22:25,RepDavidValadao,4,7,Twitter Web Client,"Just introduced my bill, the DAMS Act to improve #CA #water storage facilities. INFO: http://t.co/KjdegSPZSu  #CA21 http://t.co/bjRanMdorc"
608482155732328448,2015-06-10 03:53:45,RepDavidValadao,3,2,Twitter for iPhone,"Tonight, I got to give recent graduates from Tranquility High School a night tour of the Capitol. Congrats! http://t.co/exuMFjLdTd"
606226783139201026,2015-06-03 22:31:42,RepDavidValadao,3,7,Twitter Web Client,"Tonight, I spoke in favor of an Amendment to prioritize people over fish - We can't keep diverting H20 to the ocean. http://t.co/5p4BycKOmj"
605497057990844417,2015-06-01 22:12:02,RepDavidValadao,7,12,Twitter Web Client,Thanks to the CA Air National Guard 144th Fighter Wing for an unforgettable experience -  a flight in a F-15 Eagle http://t.co/sdKAllKEaa
602873222791593985,2015-05-25 16:25:51,RepDavidValadao,5,10,Twitter for iPhone,"While we enjoy the holiday, remember those who made the ultimate sacrifice. To them &amp; their families we are forever grateful. #MemorialDay"
601464763609059328,2015-05-21 19:09:08,RepDavidValadao,1,5,Twitter Web Client,Thanks to everyone who came out to our Kids' Safety Event in Kerman this weekend! #CA21 http://t.co/IBOMXM1GDX
600778273686220800,2015-05-19 21:41:17,RepDavidValadao,1,6,Twitter Web Client,I'm excited to award top graduates from Wasco Union HS w/ Congressional Certificates this week. Good work seniors! http://t.co/dBFDERPaem
599217233622147072,2015-05-15 14:18:16,RepDavidValadao,0,4,Twitter Web Client,Don't forget to stop by my Kids' Safety Event in Kerman tomorrow @ 9 AM. Hope to see you there! http://t.co/gV6kx4mL18 @CA21
598876851017244672,2015-05-14 15:45:42,RepDavidValadao,0,7,Twitter Web Client,"Congrats to Alyssa Garza (South High School, #Bakersfield) who is the winner of the Congressional #Art Competition! http://t.co/YLfBvS96Jz"
595407011459764224,2015-05-05 01:57:48,RepDavidValadao,11,14,Twitter for iPhone,Enjoyed spending time with interns from my #Hanford office. Thanks for all your hard work! #CA21 http://t.co/K7HjOQMeT2
593471107866431488,2015-04-29 17:45:12,RepDavidValadao,4,2,Twitter Web Client,"Next month, I will be hosting a Kids Safety Event in #Kerman. For more info. call my office at (559) 582-5526! http://t.co/isL9xs3BVn #CA21"
591215547850874880,2015-04-23 12:22:25,RepDavidValadao,2,5,Twitter for iPhone,Joining @KNXDickHelton on @KNX1070 NOW to discuss the #California #drought &amp; my amendment to to increase water storage. #CA21
590178891614048256,2015-04-20 15:43:07,RepDavidValadao,4,6,Twitter Web Client,Congrats to Chris Guerrero of @FresnoSheriff for being named Dispatcher of the Year! Thanks to all law enforcement for everything you do.
589474821009965057,2015-04-18 17:05:23,RepDavidValadao,5,2,Twitter for iPhone,Great turnout @ my Financial Literacy Workshop in Shafter this AM! How important is managing your finances to you? http://t.co/9tWsxp1Sxi
588424585814630401,2015-04-15 19:32:08,RepDavidValadao,3,4,Twitter Web Client,"In 1913, the #Tax Code was 400 pages. Today, it is over 73,000 pages. Our tax code should be fairer &amp; simpler. #CA21 http://t.co/UsnpIYBD59"
588018700864909312,2015-04-14 16:39:17,RepDavidValadao,9,16,Twitter Web Client,Awesome story &amp; great message for girls like my own daughter. Congrats Capt. Katie Higgins! http://t.co/plaOWxbs8k http://t.co/ywnLE4GAdt
586208773632614400,2015-04-09 16:47:17,RepDavidValadao,9,5,Twitter Web Client,"As Vice Chair of the Ag SC, I look fwd to setting spending priorities that benefit our region: http://t.co/D4sBsmvpNx http://t.co/Mt6O24koRl"
585869688762044416,2015-04-08 18:19:53,RepDavidValadao,8,5,Twitter Web Client,My office had a great time showing students from Mary Immaculate Queen School around the U.S. Capitol this morning! http://t.co/cmR0VZXJKN
583617970586447872,2015-04-02 13:12:21,RepDavidValadao,3,1,Twitter Web Client,Tune in to @KGETnews at 6:30 AM as I give an update on my work in Washington. #CA21
581151967482892288,2015-03-26 17:53:20,RepDavidValadao,6,5,Twitter Web Client,"Danielle, Sarah, &amp; Virginia from #KingsCounty got to see a great view of #DC today from the Speaker's Balcony. #CA21 http://t.co/JAgrRmMCrn"
578572837675466752,2015-03-19 15:04:48,RepDavidValadao,6,9,Twitter Web Client,Great roundtable w/ @calhealthcare this AM in DC. We discussed FDA Approps. requests &amp; the medical device tax. http://t.co/HqCNEjc7wI
578261448599678976,2015-03-18 18:27:27,RepDavidValadao,18,18,Twitter Web Client,"Happy National #AgDay to all our farmers, especially those in the Central Valley! #CA21 #Agriculture http://t.co/2jHOTFBphb"
578218156466020353,2015-03-18 15:35:25,RepDavidValadao,37,30,Twitter Web Client,"Today, my colleagues &amp; I introduced the #ArmenianGenocide Truth &amp; Justice Resolution | http://t.co/zO6YA4d881 http://t.co/JmckTRDRdD"
578188694995218432,2015-03-18 13:38:21,RepDavidValadao,4,4,Twitter Web Client,Congrats to @COSHanford for their approved “center” status which will improve access to edu. in the #Valley | http://t.co/cQEOg2iwRh
576493527565234176,2015-03-13 21:22:22,RepDavidValadao,2,2,Twitter Web Client,Enjoyed talking to the Central California Association of Health Underwriters about the Appropriations process! http://t.co/lm0szKDVLm
576428145622024192,2015-03-13 17:02:34,RepDavidValadao,3,7,Twitter Web Client,"TDA, @LandOLakesInc donated 40k lbs of Mac N Cheese to @FoodLinkTC. We're lucky to have them in our community. http://t.co/jLL0vgtnFk"
576384980894511105,2015-03-13 14:11:02,RepDavidValadao,7,8,Twitter Web Client,"The Valley is my home &amp; always will be. Please, watch my segment w/ @RealRobFinnerty on @BakersfieldNow: http://t.co/80g4gS4cNW"
575343151285694465,2015-03-10 17:11:11,RepDavidValadao,3,4,Twitter Web Client,"YD's roundtable w/ Valley Ag leaders was very informative. We discussed specialty crop insurance, e-verify, &amp; water. http://t.co/q1jBk6JHv6"
574955860545441792,2015-03-09 15:32:13,RepDavidValadao,4,3,Twitter Web Client,"Enjoyed reading ""House Mouse, Senate Mouse"" to third graders at Monroe Elementary for #ReadAcrossAmerica week! #CA21 http://t.co/lUM6BiGFcO"
573894560801226753,2015-03-06 17:15:00,RepDavidValadao,4,1,Twitter Web Client,#CA21 Business Owners: Be sure to stop by my Small Business Workshop later this month! More info: (559) 582-5526. http://t.co/8SOGXze8NH
568575367675400192,2015-02-20 00:58:25,RepDavidValadao,5,3,Twitter for iPhone,Discussed the West Coast #Ports dispute with @23ABCNews this afternoon. Be sure to tune in tonight.  #CA21 http://t.co/KFYuQL9stV
568449074027823105,2015-02-19 16:36:35,RepDavidValadao,6,5,Twitter for iPhone,Participated in a great roundtable on immigration &amp; water and how it impacts tech industries in California. http://t.co/niAK8jQ023
568223691827499009,2015-02-19 01:40:59,RepDavidValadao,4,0,Twitter for iPhone,RT @chambermv: Thanks @RepDavidValadao and @FWD_us for a great lunchtime conversation on issues that matter to businesses and the economy!
568223648747814912,2015-02-19 01:40:49,RepDavidValadao,1,0,Twitter for iPhone,"RT @K_A_Goldberg: Very pleased to meet @RepDavidValadao visiting The Berkeley Lab, talking abt Dept. of Energy Labs' role in US industry fo…"
568112705363714048,2015-02-18 18:19:58,RepDavidValadao,4,6,Twitter Web Client,Enjoyed an educational visit to the @advlightsource at @BerkeleyLab today.  #innovation #california #science http://t.co/7u29u7oMqI
565972136079425537,2015-02-12 20:34:07,RepDavidValadao,6,5,Twitter Web Client,A swift resolution to the West Coast ports shutdown is imperative to our Valley communities. http://t.co/x5uFZnbqiG http://t.co/kwWA2iLhXZ
565640955156766721,2015-02-11 22:38:07,RepDavidValadao,4,4,Twitter Web Client,Just voted to approve #KeystoneXL - project creates 42k jobs &amp; reduces energy costs for families in the Valley | http://t.co/0jaXEZjVys
563767157184819202,2015-02-06 18:32:19,RepDavidValadao,6,2,Twitter Web Client,Behind the scenes look at today's shoot showing @realrobfinnerty &amp; the @bakersfieldnow crew around the farm. http://t.co/6kMjEHyCVI
563068593009856515,2015-02-04 20:16:28,RepDavidValadao,5,0,Twitter Web Client,"RT @SmarterFuels: ""All of the farmland that is being used to grow fuel is taking up farmland that could be used to grow food."" - @RepDavidV…"
559819080702894081,2015-01-26 21:04:04,RepDavidValadao,10,2,Twitter Web Client,"This weekend, I had the opportunity to visit our southern border. Imm. reform must be a priority of this Congress. http://t.co/U9jYnjdKF3"
557941341045657600,2015-01-21 16:42:36,RepDavidValadao,3,1,Twitter Web Client,"Each State of the Union provides an opportunity for POTUS to present bold, new ideas for America. Do you think he accomplished this?"
557923539492544512,2015-01-21 15:31:52,RepDavidValadao,0,2,Twitter Web Client,"Behind the scenes look at my morning interviews discussing @NoLabelsOrg &amp; the #SOTU. cc: @KGETnews, @BakersfieldNow http://t.co/wDTzrii9cs"
557910027458347008,2015-01-21 14:38:10,RepDavidValadao,2,0,Twitter Web Client,RT @johnellis24: .@RepJimCosta @RepDavidValadao will wear lapel pins supporting bipartisan group during #SOTU. http://t.co/nZ4hZZjAVG #559v…
557909969283325954,2015-01-21 14:37:56,RepDavidValadao,14,0,Twitter Web Client,RT @RodneyDavis: Check out our @NoLabelsOrg #problemsolver pins w/ @aaronschock @RepLipinski &amp; @RepDavidValadao #SOTU http://t.co/kD7H9ex5WH
557909681046573056,2015-01-21 14:36:48,RepDavidValadao,1,0,Twitter Web Client,RT @realrobfinnerty: @RepDavidValadao LIVE on #EyewitnessNews tomorrow w/ reaction to @BarackObama 6th State of the Union address #STOU  #S…
557625249546924033,2015-01-20 19:46:34,RepDavidValadao,3,3,Twitter Web Client,Congratulations to the #Coalinga High #Chess Team on their 15th State Championship win! http://t.co/HgzXGslxOm #CA21 #CentralValley
552604427908313088,2015-01-06 23:15:37,RepDavidValadao,8,7,Twitter Web Client,I am humbled to begin a second term representing my Central Valley constituents in Washington. #CA21 #114thCongress http://t.co/2QLyVIqKlv
552533650257219585,2015-01-06 18:34:22,RepDavidValadao,0,3,Twitter Web Client,Fighting for #water &amp; ensuring opportunity are my top priorities for #2015. Looking forward to the #114thCongress. http://t.co/xrDcVmcgcZ
547731183199879168,2014-12-24 12:31:05,RepDavidValadao,4,3,Twitter for iPhone,"From our family to yours, we wish you a safe, happy holiday with your family, friends, &amp; neighbors. #MerryChristmas http://t.co/nve3wwjS4o"
545975895442612224,2014-12-19 16:16:11,RepDavidValadao,3,0,Twitter Web Client,RT @lizziegonzalez: Such a pleasure seeing @RepDavidValadao who brought along his Father to the @KMPHFOX26 Immigration forum. http://t.co/0…
545604554369552384,2014-12-18 15:40:37,RepDavidValadao,1,4,Twitter Web Client,Tweet your questions for tonight’s immigration debate hosted by @KMPHFOX26 using #YourVoiceYourFuture. I want to hear from you!
545281085882777601,2014-12-17 18:15:16,RepDavidValadao,1,1,Twitter Web Client,"At 7 PM tomorrow, I will participate in an imm. town hall meeting hosted by @KMPHFOX26. Tune in LIVE! INFO: http://t.co/BrdW0IHg8E #CA21"
545252118962372608,2014-12-17 16:20:10,RepDavidValadao,2,2,Twitter Web Client,"I hope the coming weeks are full of time w/ family, friends, &amp; loved ones as we celebrate Xmas &amp; the New Year! http://t.co/x3h6e9HNhI #CA21"
544574807095132160,2014-12-15 19:28:46,RepDavidValadao,0,6,Twitter Web Client,"Congrats to my daughter’s soccer team, the Earthquakes, who came in 1st @ the East Fresno Winter Classic! #CA21 http://t.co/jg76tJc8pE"
542410029547003905,2014-12-09 20:06:43,RepDavidValadao,20,0,Twitter Web Client,RT @HouseGOP: Today the House passed @RepDavidValadao's bill to provide emergency drought relief to California. http://t.co/tlUBRrJmT0
542394330623643648,2014-12-09 19:04:20,RepDavidValadao,14,8,Twitter Web Client,"My drought bill was passed in the House. If the Senate doesn't act, CA will cont. to suffer http://t.co/iHO6nyOvIT http://t.co/effECKjvp4"
541296949702713344,2014-12-06 18:23:44,RepDavidValadao,1,2,Twitter for iPhone,"Congrats to both #Corcoran &amp; my own Alma Mater, #Hanford High football for winning their division championships! http://t.co/TB2b5TmFRM"
540198141077635072,2014-12-03 17:37:27,RepDavidValadao,8,7,Twitter Web Client,"If passed, my bill will provide our suffering communities immediate drought relief. INFO: http://t.co/DUp9H80OU7 http://t.co/9vcvETfaGw"
539982859285852160,2014-12-03 03:22:00,RepDavidValadao,9,14,Twitter for iPhone,"Today, I introduced legislation to provide drought relief for our Valley. Stay tuned for more details tomorrow! http://t.co/0gegUHRb54"
534819468472745984,2014-11-18 21:24:32,RepDavidValadao,19,10,Twitter Web Client,Honored to join @ARAMAC_DC &amp; @ANCA_DC to celebrate the #Armenian Orphan Rug which goes on display today. #CA21 http://t.co/95cwI7PLdh
534463082631016448,2014-11-17 21:48:23,RepDavidValadao,0,1,Twitter Web Client,Our Hanford/Delano food drives went great this past weekend. Thanks to @KingsCommunity &amp; @CAPKFoodBank for the help! http://t.co/gpmGeVTKhs
533069801737183232,2014-11-14 01:31:59,RepDavidValadao,3,4,Twitter for iPhone,"On #PancreaticCancerDay, I join my colleagues in recognizing this disease &amp; building awareness #PurpleForAPurpose http://t.co/un4wdMPa6P"
532193696679469056,2014-11-11 15:30:39,RepDavidValadao,3,3,Twitter for iPhone,"Thank you to those who have served defending our freedom. This Veterans Day, let us remember their sacrifice. http://t.co/YG4paB1Poj"
530825547501551617,2014-11-07 20:54:07,RepDavidValadao,4,2,Twitter Web Client,Be sure to watch my interview w/ the @MaddyInstitute. It will air tonight at 7:00 PM on @ValleyPBS (KVPT) &amp; on Sunday at 5:00 AM on @KSEE24!
530813520053821440,2014-11-07 20:06:19,RepDavidValadao,1,0,Twitter Web Client,"RT @TBCliving: KVPT (Valley PBS) will discuss the election's impact on the valley at 7pm tonight. Guests: @RepJimCosta, @RepDavidValadao"
530807445283958784,2014-11-07 19:42:11,RepDavidValadao,11,13,Twitter for iPhone,November is #Sikh Awareness &amp; Appreciation Month in #California! Take time this month to learn about our Sikh neighbors. #CASikhs #CA21
527156161204977664,2014-10-28 17:53:17,RepDavidValadao,3,4,Twitter for iPhone,"Thanks to Mrs. Cunha for inviting me to read House Mouse, Senate Mouse to 1st graders at Washington Elementary. #CA21 http://t.co/QG87cbFeIs"
525373559238299648,2014-10-23 19:49:52,RepDavidValadao,5,3,Twitter for iPhone,Enjoyed speaking w/students of Mira Monte High School. Its crucial young Americans take an active role in democracy! http://t.co/UWtFUCvy7i
525342757192482817,2014-10-23 17:47:28,RepDavidValadao,6,5,Twitter for iPhone,Honored to present Richard Vega of Bakersfield w/ military medals he earned during his service in the Army 61 yrs ago http://t.co/vrUh7iYQNB
522815033911558144,2014-10-16 18:23:12,RepDavidValadao,1,3,Twitter Web Client,Special thanks to @JosephICastro for hosting &amp; all those who participated in this morning's @CHLInstitute conference! http://t.co/OFvrGRVObX
522800604192985088,2014-10-16 17:25:51,RepDavidValadao,9,7,Twitter Web Client,Had a great time at the @TheCHLI Leadership Conference this AM @Fresno_State. Thanks for hosting @JosephICastro! http://t.co/oQYxdX0jap
522800199144833024,2014-10-16 17:24:15,RepDavidValadao,11,0,Twitter Web Client,RT @Fresno_State: .@RepDavidValadao &amp; Pres @JosephICastro at Congressional Hispanic Leadership Institute at #FresnoState. #CHLIFresno http:…
519531224675934209,2014-10-07 16:54:31,RepDavidValadao,6,8,Twitter Web Client,"Last month, I invited the @VP to tour areas hit hardest by this drought. My invitation was ignored. What do you think about the VP's visit?"
517689251354656769,2014-10-02 14:55:10,RepDavidValadao,4,3,Twitter Web Client,Excited to announce the @USNavy will homebase F-35C aircraft at NAS #Lemoore. I applaud their decision. http://t.co/pzbsl84L9Q
515886124263559168,2014-09-27 15:30:11,RepDavidValadao,5,9,Twitter for iPhone,Today is National Hunting &amp; Fishing Day. Let's continue to protect these pastimes many Americans enjoy! #NHFD #CA21 http://t.co/bdPVBRT1Nx
515576590580080641,2014-09-26 19:00:12,RepDavidValadao,1,2,Twitter Web Client,Enjoyed discussing #smallbiz w/students @ @bcrenegades this AM. Thanks to @CalChamber &amp; @bakchamber for hosting! http://t.co/RcglKN4VOi
514849155244896256,2014-09-24 18:49:38,RepDavidValadao,5,3,Twitter Web Client,I hope @VP Biden will accept my invitation to view the effects of this drought. The Central Valley needs a solution. http://t.co/IYHEtplrXg
