id,created_at,coordinates,retweets,favorite_count,source,text
820063917451907073,2017-01-14 00:24:08,,6,7,TweetDeck,ConocoPhillips annc –  discovery w/300 million barrels of oil – living proof AK's energy future in alive and well https://t.co/f7rBMYBiu9
820063280257527808,2017-01-14 00:21:36,,3,7,TweetDeck,"I voted to move forward with a process to repeal and replace Obamacare. See my statement here:
https://t.co/Yylg9dw95z"
819339943558479873,2017-01-12 00:27:19,,3,12,TweetDeck,".@lisamurkowski @SenDanSullivan &amp; I met w/ nominee for Secretary of Interior. Positive meeting, discussed many AK p… https://t.co/lsg7jLjFYf"
819339175640047616,2017-01-12 00:24:16,,0,6,TweetDeck,"Today, the House continued its efforts to reform overreaching and costly federal regulations https://t.co/p3U22J80vV https://t.co/tXPdgzqGVD"
817523090750132226,2017-01-07 00:07:48,,2,3,TweetDeck,"#POTUS BLM MGMT Plan for Eastern AK is truly disturbing,he's putting glue in the locks before returning the keys. 
https://t.co/nXA9xKP0oY"
817204085564866560,2017-01-06 03:00:11,,4,7,TweetDeck,"House just took a major step to REIN in excessive federal regulations and gov't overrreach.
https://t.co/cDlDyPn1qE"
816793954784018436,2017-01-04 23:50:28,,1,9,TweetDeck,My signed Oath of Office of Representative in the Congress of the United States. https://t.co/vNeeK1NggJ
816791828037062656,2017-01-04 23:42:01,,2,9,TweetDeck,It’s an honor to serve the AK people. Check out a video recap of my first day in the 115th Congress.… https://t.co/YHS2XZndTu
811355173058527232,2016-12-20 23:38:42,,7,10,TweetDeck,#POTUS Obama is one step closer to solidifying his place next to Carter as AK's worst nightmare. My thoughts https://t.co/0EiAnVhTbc
809526265367711748,2016-12-15 22:31:16,,1,1,TweetDeck,My thoughts on nomination of Rep. Zinke (R-MT) as Interior Secretary https://t.co/xctYL2e2RM https://t.co/cG15dFVTQs
807418035527176192,2016-12-10 02:53:55,,6,7,TweetDeck,Thank God the Obama Administration only has 42 days left in office. See my thoughts on recent #POTUS Executive Order https://t.co/elVWwxykeo
807013478833733632,2016-12-09 00:06:21,,1,4,TweetDeck,"My native workfroce development bill made its way through House, setting up  passage in Senate &amp; #POTUS signature
https://t.co/X9zS9cIHQg"
803724550487805952,2016-11-29 22:17:19,,2,4,TweetDeck,Proud to introduce resolution recognizing #GivingTuesday -- important for our many service orgs &amp; non-profits… https://t.co/HIQYi7aHE9
799706485320257536,2016-11-18 20:10:58,,3,9,TweetDeck,"On DOI decision: ""Make no mistake, this blatant disregard for AK's social and economic future will be overturned.""… https://t.co/5aaSUpQjME"
799384748791504896,2016-11-17 22:52:30,,2,5,TweetDeck,House passes effort to address the potential onslaught of end-of-term regulations released by outgoing admin.… https://t.co/rffs8UgDsR
799033332344430592,2016-11-16 23:36:06,,0,5,TweetDeck,"@ktva's @HeatherHintze stopped by my office to discuss a variety of important issues and topics, including newly el… https://t.co/YQJHpoaK9L"
799023997337948164,2016-11-16 22:59:00,,6,0,TweetDeck,RT @AK_CNCS: .@RepDonYoung #DYK that Alaskans #volunteer an average of 129 hrs per year? See how #ServiceUnites at https://t.co/eANjN6Kj7K.…
798655410378940417,2016-11-15 22:34:22,,2,8,TweetDeck,Thank you to the Nelson family from Anchorage for visiting me in Washington. D.C. https://t.co/lEhyBnXqXP
792237788330467328,2016-10-29 05:33:02,,0,9,TweetDeck,Hats off to the Tok School for the warm welcome and the tour of your bio mass boiler project. I'm extremely impress… https://t.co/5bj1wwKA2Y
784561120665333760,2016-10-08 01:08:42,,6,9,TweetDeck,Just wrapped up a successful visit to Maine for the Arctic Council’s Senior Officials Meeting. Read about my visit… https://t.co/BoPCoxAqC9
776826133866250240,2016-09-16 16:52:37,,5,8,TweetDeck,Travel well Father Elliot. I will always cherish our time together &amp; never forget your thoughtful guidance &amp; wisdom. https://t.co/5PQe0rnHyr
774022364501794816,2016-09-08 23:11:26,,3,6,TweetDeck,I stand committed w/@FoodBankofAK to fighting for a hunger free Alaska #HungerActionMonth https://t.co/qLk0XSOrIb
763795208769196032,2016-08-11 17:52:23,,1,9,TweetDeck,Coast Guard Foundation AK Awards Dinner to celebrate &amp; recognize remarkable members of the USCGC. https://t.co/jqd5NTvzqJ
763546907536789505,2016-08-11 01:25:43,,1,1,TweetDeck,@AlaskaChamber meet &amp; greet to discuss my efforts in Congress to protect AK small biz &amp; our state' economic future. https://t.co/cQzQkLdZsW
763534841354657793,2016-08-11 00:37:46,,2,2,TweetDeck,At the AK Native Health Board Mega Meeting today in Anchorage to discuss a number of important issues. https://t.co/TRFyNYaRUy
763219013363118081,2016-08-10 03:42:47,,4,8,TweetDeck,Meeting w/ volunteers from the @AmDiabetesAssn to discuss a debilitating disease afflicting  29 million Americans https://t.co/LSLBULPR7d
761414059812020224,2016-08-05 04:10:32,,6,5,TweetDeck,Thank you Port Graham for hosting me today to discuss a number of important issues affecting your community. https://t.co/80qzODVH7x
761274373877538817,2016-08-04 18:55:29,,0,3,TweetDeck,"Touring the Dena’ina Wellness Center in Kenai, a fully integrated medical facility serving the community. https://t.co/TapdgZ5i8B"
761092069154705408,2016-08-04 06:51:04,,3,5,TweetDeck,TY U.S. Chamber of Commerce for the Spirit of Enterprise Award &amp; the Kenai/Soldotna Joint Chamber for hosting me! https://t.co/WBU5YvC2MC
760749409470513156,2016-08-03 08:09:27,,4,3,TweetDeck,Meeting with members of the Kenai Peninsula Builders Association earlier today https://t.co/hb66v7FVEK
760014242229555200,2016-08-01 07:28:10,,7,6,TweetDeck,"Arctic Thunder 2016. Alaska loves, supports and appreciates our military men and women. https://t.co/CbHDsX5cMe"
758916303323172864,2016-07-29 06:45:21,,6,12,TweetDeck,Honoring some of our newest &amp; greatest sports legends at the 10-year-anniversary of the Alaska Sports Hall of Fame. https://t.co/dSwvHnVAZI
758558385289572352,2016-07-28 07:03:07,,6,5,TweetDeck,"Honored to speak @ the Wasilla Area Seniors, Inc (WASI). https://t.co/TF02lZumNb"
757784759988686848,2016-07-26 03:49:00,,5,6,TweetDeck,.@AnchChamber Make it Monday forum with @@SenDanSullivan and @lisamurkowski. https://t.co/Hf4Va8HEQW
756322335586738176,2016-07-22 02:57:51,,2,2,TweetDeck,"Just met w/  Sitka Sportsman's Association: discussed 2nd Amendment rights, efforts to protect hunting &amp; fishing https://t.co/B2mMNijbzN"
756238288898363392,2016-07-21 21:23:52,,2,4,TweetDeck,"As a veteran &amp; stronge proponent of our military, I was honored to meet w/ this fine group of veterans in Sitka https://t.co/4X8WwVzvZS"
754078828423684096,2016-07-15 22:22:57,,3,6,TweetDeck,"Martin Sensmeier, an actor from Yakutat,  recently stopped by to discuss his role as a @BGCA_Clubs Ambassador https://t.co/rFqyOXlg7T"
753729226449227776,2016-07-14 23:13:45,,1,3,TweetDeck,"My 5 AK-focused Amdnts included in Interior bill, focused on defending AK statehood &amp; future https://t.co/RKF5kXj0Iv https://t.co/r4p5tRRe4U"
753692781890170880,2016-07-14 20:48:56,,1,4,TweetDeck,@lisamurkowski @SenDanSullivan &amp; I introduced a stand alone bill to build the King Cove road https://t.co/RbBSMmmK5E https://t.co/zrNY45iVgR
753436263420665856,2016-07-14 03:49:38,,5,9,TweetDeck,All 5 amendments accepted; including stopping 1002 wilderness designation &amp; recent FWS/NPS rulemaking. https://t.co/DjD1MY2N4K
753391236086726661,2016-07-14 00:50:42,,3,7,TweetDeck,Congress sends #POTUS FAA Bill with relief for general aviation pilots. Read more: https://t.co/FixZagNz4S https://t.co/pBqjJ2jySe
753380423615516672,2016-07-14 00:07:44,,2,4,TweetDeck,I'm on the House floor defending 5 AK-focused amendments I offered. Watch here - https://t.co/39ghSSySg6 https://t.co/QuxV1dTUKc
752975722990436352,2016-07-12 21:19:36,,1,2,TweetDeck,"House bill improves IRS oversight, consumer services &amp; small biz; prevents wasteful spending https://t.co/sUDVvr0KTj https://t.co/vQSXp9xMpF"
751549379111100416,2016-07-08 22:51:49,,7,16,TweetDeck,"With a heavy heart, I mourn the 5 brave officers who were so tragically killed in the line of duty. AK stands w/ TX https://t.co/bHYhbay2Cf"
751547329673437186,2016-07-08 22:43:41,,3,1,TweetDeck,"Admin's Arctic rule diminishes opportunity, &amp; creates insurmountable hurdles for future development. Read my thoughts @http://bit.ly/29vfVnm"
751503862897385472,2016-07-08 19:50:57,,1,4,TweetDeck,Happy 90th Birthday to my dear friend from the Great Lake State @JohnDingell https://t.co/hdNodwcq8D
751499183446642688,2016-07-08 19:32:22,,5,1,TweetDeck,"My bill would authorize a small, but important addition to 2nd Division Memorial in D.C. //bit.ly/29HndFx https://t.co/K96q99owsV"
750044631899967489,2016-07-04 19:12:30,,5,9,TweetDeck,Join me in celebrating our nation’s birth and independence. Happy #4thOfJuly https://t.co/ITn2tQt1va
749368841998888960,2016-07-02 22:27:09,,5,4,Twitter for iPhone,Discussing a number of important AK issues @ this week’s Resource Development Council meeting in Anchorage. https://t.co/6LoK9FveWp
748636526322548736,2016-06-30 21:57:11,,9,4,TweetDeck,"#MissileDefense Agency announcement is good news 4: nation's security, Kodiak &amp; AK Aerospace
https://t.co/1YwbYRawsA https://t.co/V4TOy3S7WH"
748630826699591680,2016-06-30 21:34:32,,4,0,TweetDeck,RT @alaskardc: .@repdonyoung speaking to the audience now speaking about the importance of reach youth about resource development. https://…
746455070108155904,2016-06-24 21:28:51,,1,4,Twitter for iPhone,Proud to continue Alaska's fight in Congress. It is an honor to serve! https://t.co/EueEm8bG1J
746118573773434880,2016-06-23 23:11:44,,2,4,TweetDeck,I introduced a bill to reauthorize vital transportation grant program created to expand healthcare access 2 our vets https://t.co/122YOFELDm
745805817614598144,2016-06-23 02:28:57,,30,35,TweetDeck,"""No Fly, No Buy"" is absent of one major pillar of our Constitution, DUE PROCESS.  You too can mistakenly get on the no fly list, I was."
745011515154173952,2016-06-20 21:52:41,,2,5,TweetDeck,Happy Summer Solstice to the land of the midnight sun! https://t.co/34IAE6ljYA
744690100982976512,2016-06-20 00:35:30,,1,6,TweetDeck,Fatherhood has been one of the greatest joys of my life. Here's to all the great fathers our there #HappyFathersDay https://t.co/b30VdaWkml
743926056713916417,2016-06-17 21:59:28,,4,7,TweetDeck,House passed DOD approps provides our brave men &amp; women the support they deserve. https://t.co/KdDRPdeWU3 https://t.co/8blOzsqv53
742883831825436672,2016-06-15 00:58:02,,2,0,TweetDeck,RT @lilaleut: Thank you @repdonyoung for meeting with us and supporting local governance and public education.  #NSBAAI16 https://t.co/1XUD…
742866408883793920,2016-06-14 23:48:48,,6,9,TweetDeck,"As an Army Veteran and a strong supporter of our military, I am proud to wish the U.S. Army a Happy 241st Birthday! https://t.co/4B26GkkYR5"
742814751487602688,2016-06-14 20:23:32,,4,2,TweetDeck,"Not a silver bullet to the VA’s shortcomings, but the AK-specific solutions  announced are an important step forward https://t.co/eJf4POsDPd"
741024904473157632,2016-06-09 21:51:19,,2,0,TweetDeck,RT @CalebJSmith: .@repdonyoung A beautiful bride! #TBT https://t.co/gGcAAvPI06
741021590792601600,2016-06-09 21:38:09,,1,15,TweetDeck,"To my darling wife Anne, thank you for a year of wedding bliss &amp; for giving me the best birthday I could ask for. https://t.co/JDtNXjUgky"
740698505442910208,2016-06-09 00:14:19,,5,3,TweetDeck,House-passed bill is committed to making positive improvements &amp; reforms to pipeline safety https://t.co/8Uf2VVgUmg https://t.co/PGKIntKRyu
740682354386210816,2016-06-08 23:10:09,,8,0,TweetDeck,RT @AARPAlaska: Thank you @RepDonYoung for a great conversation with @AARPAlaska #AARP2016 #TakeAStand #IHeartCaregivers https://t.co/TJB8i…
739959927758807040,2016-06-06 23:19:29,,3,4,TweetDeck,"Remembering the service and sacrifice of the greatest generation.
#dday72 https://t.co/YDtdnszJP1"
738787583250075652,2016-06-03 17:41:00,,2,1,TweetDeck,This year’s WRDA bill's optimize the needs of local communities &amp; streamlines development of critical infrastructure https://t.co/5EEtJt5Q61
737776481523404801,2016-05-31 22:43:15,,3,2,TweetDeck,It's an honor to be named to the Energy Conference Committee. w/ @lisamurkowski it gives us a double whammy for AK/ https://t.co/neMmZYx4FW
736332907770458112,2016-05-27 23:07:00,,0,4,TweetDeck,"God bless our military men &amp; women that made the ultimate sacrifice to protect our nation and preserve our freedoms.
https://t.co/pXCiheA26O"
735951470663766016,2016-05-26 21:51:18,,1,4,TweetDeck,"Honored to serve on Conference Committee charged w/ negotiating energy bill w/House &amp; Senate
https://t.co/QVyj7YTERm https://t.co/UvTMz2nzrU"
734901496450568192,2016-05-24 00:19:05,,5,4,Twitter for iPhone,"VA wait times = lines @Disney???This is life &amp; death matter for our nation’s veterans, not day @ an amusement park https://t.co/hRJ3FlMp3S"
733366546760896515,2016-05-19 18:39:44,,0,0,TweetDeck,"House-passed MilconVA bill lays groundwork for important basing decisions in AK - Approx $500mil for AK in FY17

 https://t.co/Bmqlb4GhdT"
733120049666482176,2016-05-19 02:20:15,,3,3,TweetDeck,"House passed NDAA emphasizes strength, agility &amp;readiness; contains numerous AK provisions + 2.1% troop pay increase https://t.co/XX0WvyjlJa"
732695644176056321,2016-05-17 22:13:49,,4,5,TweetDeck,Proud to support our troops @the_USO Care Package Service Project. #MilitaryAppreciationMonth https://t.co/7xQQpCT1D4
732362776048439296,2016-05-17 00:11:07,,0,4,TweetDeck,House sends bill to #POTUS authorizing transfer of unused fed property to Anchorage https://t.co/P9WhqUx3kw https://t.co/YQXTjBkp5j
732297875942723584,2016-05-16 19:53:13,,0,4,TweetDeck,Last week’s fed district court ruling is a major victory for the separations of power &amp; protecting the Constitution. https://t.co/qV8l3TRloR
731258333047472128,2016-05-13 23:02:27,,0,1,TweetDeck,The House is working to combat the nation’s growing opioid &amp; heroin epidemic https://t.co/VOWNyg6qex
730807708341944322,2016-05-12 17:11:50,,0,1,TweetDeck,Happy Nurses Appreciation Week. May all the care&amp;kindness our nurses give to others come back to them 1K times over https://t.co/NXFbLs4vGp
730535351173910528,2016-05-11 23:09:35,,0,1,TweetDeck,Discussing my legislation - Rural Guard and Reserve Act - w/ Alaska Adjutant General Brigadier General Laurie Hummel https://t.co/2vcIrkKw4X
730145876862238721,2016-05-10 21:21:57,,1,1,TweetDeck,"Check out my e-newsletter, a great way to stay connected on the many issues before Congress https://t.co/Q5xe8mER5V https://t.co/GSj1McBYAI"
729330846931558401,2016-05-08 15:23:18,,0,6,Twitter Web Client,Happy Mother's Day to the many moms in my life. Thank you for everything you do! https://t.co/2EHpYT5pAL
728314691185999872,2016-05-05 20:05:28,,0,1,TweetDeck,DOL's rule imposes costly new mandates &amp; restricts access to quality investment advice for middle class Americans https://t.co/FTpVg8ZOfn
728029783129493505,2016-05-05 01:13:21,,3,5,Twitter Web Client,Happy Teachers Appreciation Week. Special recognition to 8th graders &amp; teachers @ Birchtree Charter School in Palmer https://t.co/87JOeHKlaE
727252432523239425,2016-05-02 21:44:26,,2,2,TweetDeck,"Moda’s departure makes AK 2nd w/1 carrier on indiv market, raises major competitonconcerns  
https://t.co/E8YhkPKmUJ https://t.co/Ls6pcTvXy2"
726166141064847360,2016-04-29 21:47:54,,3,4,TweetDeck,Meeting w/ the Commander and Senior Enlisted Advisor for JBER’s 477th Fighter Group. Thanks for all you do! https://t.co/GfiIHPunQx
725798968614068224,2016-04-28 21:28:53,,2,1,TweetDeck,Always a pleasure to have Alaskans in the office. Thanks for the visit! https://t.co/uq8MKbHNkp
725798841262460929,2016-04-28 21:28:23,,0,1,TweetDeck,Pleased to announce a # of AK interests &amp; priorities included in the House NDAA https://t.co/VittXBPkIN https://t.co/cVRLmoYWdU
725434401199366144,2016-04-27 21:20:13,,1,1,TweetDeck,"I'm not much for email, but I'm huge on 4th AMDNT. House works to update 30 year old email privacy laws. https://t.co/k1vz5FnRv1"
725117152680927233,2016-04-27 00:19:35,,1,3,TweetDeck,House just passed 3 bills aimed @ assessing foreign security threats &amp; thwarting ISIS https://t.co/t8h20KtP1u https://t.co/PWqQVryXYW
725111754586476544,2016-04-26 23:58:08,,0,2,TweetDeck,"House passes bill to update laws governing oil spill response, protection and liability https://t.co/hu7XTBbk6s https://t.co/lzHQyMvjqw"
725011678463680514,2016-04-26 17:20:28,,2,2,TweetDeck,Recently passed House bills work to hold IRS accountable. Pleased to see Senate action &gt;&gt;&gt; https://t.co/aSUEsQWn6p https://t.co/DnhLvUI8Pd
723582408939986944,2016-04-22 18:41:04,,5,4,TweetDeck,Big Missile Defense announcement for AK Aerospace Corp &amp; Pacific Spaceport Complex in Kodiak https://t.co/q8Z2RZaJgI https://t.co/tEMdEfhPCn
723275249488420864,2016-04-21 22:20:31,,0,1,TweetDeck,"@lisamurkowski &amp; I hosted a briefing to raise awareness on potential risks of GE salmon
https://t.co/WgoB4LHx5D https://t.co/Dn3Yycu0Ln"
722930451145486337,2016-04-20 23:30:25,,1,2,TweetDeck,@SenDanSullivan @lisamurkowski and I met with bright group of AK'n students visiting for @CloseUp_DC https://t.co/TV1GrL7Yl2
722929695990263808,2016-04-20 23:27:25,,4,3,TweetDeck,"Because of MSA, AK is considered gold standard of fisheries mgmt – proud 2 play a role in such important legislation https://t.co/qJ403iyq9I"
720752361371779072,2016-04-14 23:15:28,,2,7,TweetDeck,Press conference to discuss King Cove road &amp; options for dealing with lack of reliable emergency transportation https://t.co/rm4pNHZtxj
720747975161614336,2016-04-14 22:58:02,,5,5,TweetDeck,"It's a sad thing what this administration has done to the Alaskan people, especially the people of King Cove. https://t.co/tUVBno6927"
720747224255356929,2016-04-14 22:55:03,,0,3,TweetDeck,Honored to nominate Nicole Eldred as AK's 2016 Cherry Blossom Princess. Read more about her: https://t.co/djKSZ9pO2N https://t.co/jWlqAL5fnW
720370142916403200,2016-04-13 21:56:40,,4,6,TweetDeck,"Happy 40th anniversary of the Magnuson-Stevens Act, law that “Americanized” our fisheries 
https://t.co/KmcGDp8w2M https://t.co/9ZSEqPjj6x"
720294753452093440,2016-04-13 16:57:06,,1,2,TweetDeck,House passes bill to hold those that prey upon our veterans responsible for their deplorable actions and crimes. https://t.co/7AH8JsInWU
717950019496587264,2016-04-07 05:39:58,,2,6,Twitter Web Client,"Atsuo Tsunoda, longtime resident of Sitka, who helped foster Sitka's relationship w/ sister city Nemuro, Japan https://t.co/cgMth8cWVH"
717945280759332864,2016-04-07 05:21:08,,2,6,Twitter for iPhone,"Thad Poulson greeted me with a ""hot off the press"" copy of the Sitka Sentinel, a family run operation for 47 years. https://t.co/XEp94miUfe"
717531812008824832,2016-04-06 01:58:09,,2,3,Twitter for iPhone,Discussing economic opportunity w/ members of Juneau Chamber of Commerce &amp; SE Conference Transpo &amp; Timber Cmmtes https://t.co/Es4hkj5lgH
717530804822212608,2016-04-06 01:54:09,,1,0,Twitter for iPhone,Touring Marine Exchange of AK Operations Center to see their efforts to provide for safe &amp; secure maritime activity https://t.co/OMNESjvlOW
717109519227092992,2016-04-04 22:00:07,,0,3,Twitter Web Client,"AK’s strategic location &amp; military value are far too important to be overlooked &gt; my thought on F-35 basing @Eielson
https://t.co/MWV1FshWIH"
717078011435061248,2016-04-04 19:54:55,,3,3,Twitter Web Client,It's official AK. F-35's coming to Interior. Good day for Alaska and the nation. https://t.co/5j0QpQWn1y https://t.co/gjxVABpSY8
716100804587880448,2016-04-02 03:11:50,,3,3,Twitter for iPhone,Speaking @AlaskaChamber meet&amp;greet on essential role AK industries &amp; businesses play in growing our state &amp; economy https://t.co/x3ySnIV8WL
715792892380520448,2016-04-01 06:48:18,,3,2,Twitter for iPhone,Meeting w/ Anchorage Board of Realtors today to discuss wide range of issues on home ownership &amp; housing markets. https://t.co/8IvVPCP3Th
715353480941191168,2016-03-31 01:42:15,,6,8,Twitter Web Client,VA should appropriately recognized AK Territorial Guard members w/ true permanent headstones https://t.co/WiDgHOmDi1 https://t.co/m1fr8yS4Js
715346919929810944,2016-03-31 01:16:10,,1,8,Twitter Web Client,Wreath laying ceremony @ Fort Richardson National Cemetery in honor of ncredible service &amp; sacrifice of Vietnam Vets https://t.co/EUIT7GQaw5
715307627555651585,2016-03-30 22:40:02,,1,5,Twitter for iPhone,In the studio for the @DaveStierenShow. Tune in to 750AM KFQD or listen live @ https://t.co/A091EHCKTc https://t.co/htB4NH4qWw
714711179306868736,2016-03-29 07:09:58,,3,2,Twitter for iPhone,Speaking before the Big Lake Chamber of Commerce on a variety of issues facing AK families &amp; small businesses. https://t.co/xsFLGrgN1O
714539961219817472,2016-03-28 19:49:36,,1,12,Twitter for iPhone,Thank you to the Capitol Police for your service &amp; quick actions in today's shooting. My staff is safe and very thankful for all that you do
714537128940572672,2016-03-28 19:38:21,,7,15,Twitter for iPhone,"Happy Seward's Day, marking one of the greatest investment in U.S. history - purchase of AK from Russia for $7.2M. https://t.co/d4xBIkXQXX"
712725775989022720,2016-03-23 19:40:41,,2,10,TweetDeck,"#RedTieChallenge w/ my wife Anne, a registered nurse, to raise awareness for hemophilia &amp; other bleeding disorders https://t.co/jVOGIO51sT"
712455884471799810,2016-03-23 01:48:14,,4,0,Twitter for iPhone,RT @CongressmanRuiz: TY @repdonyoung for allowing my daughter Sage be part of today’s hearing on the Administration’s budget request https:…
712377180752367616,2016-03-22 20:35:29,,3,3,TweetDeck,Praying for the people of Brussels. We stand united against this act of terrorism. https://t.co/mPHUMg9XFz
712376177793568770,2016-03-22 20:31:30,,1,2,TweetDeck,NPS overstepped its boundaries w/ a wholesale neglect of ANILCA. My view on #SCOTUS ruling https://t.co/KvAXQQLMXb https://t.co/5Lfc8UTVv1
712056687188905984,2016-03-21 23:21:58,,4,3,TweetDeck,Great news for AK! Army officially delays decision to cut 4-25 Brigade @JBER. https://t.co/wIiPdI3qLW https://t.co/1t4tNl2Kln
712056076045258752,2016-03-21 23:19:32,,2,5,TweetDeck,I even married one! https://t.co/hA3x5IXXDQ
710581326085230593,2016-03-17 21:39:24,,4,9,TweetDeck,"A few selfies with Alaskan students visiting Washington, D.C. w/ the  Southcentral Foundation @SCFinsider https://t.co/9sB0WT2T9Z"
710570379337719808,2016-03-17 20:55:54,,0,3,TweetDeck,"Meeting w/ Maire Nakada, a remarkable young Alaskan who was named the '15 Distinguished Young Woman of America https://t.co/RefzKz9V8y"
710562509065998336,2016-03-17 20:24:38,,0,3,TweetDeck,Happy St. Patrick's Day! https://t.co/30ZXy4KkLY
709857516218421249,2016-03-15 21:43:15,,0,2,TweetDeck,My thoughts on DOI Offshore Oil and Gas Lease Program Announcement &gt;&gt;//1.usa.gov/1UemAT7 https://t.co/XTcYtjDun9
709803433100972032,2016-03-15 18:08:20,,4,3,TweetDeck,"Damn Dallas, back at it again &gt;&gt; https://t.co/mQLWgIL18L #Iditarod2016 https://t.co/2yhX9f04HK"
709535520058163200,2016-03-15 00:23:45,,3,2,TweetDeck,"Humbled &amp; honored to work everyday &amp; fight on behalf of Alaskans. My thoughts on anniversary of my swearing-in
https://t.co/JJoIJWY3GT"
709533668000182272,2016-03-15 00:16:23,,2,1,TweetDeck,It's truly been an honor! I've had the great fortune of working alongside strong AKns and a strong delegation https://t.co/4aZi2lPV5S
709522037908348929,2016-03-14 23:30:10,,3,7,TweetDeck,Being sworn into office 43 years ago. I thank AKns 4 their support &amp; commitment 2 solve our challenges #Honored https://t.co/a6UYGwEfQl
709514313896218624,2016-03-14 22:59:29,,5,0,TweetDeck,"RT @SenDanSullivan: .@repdonyoung and I took questions from astute young students visiting DC from Colony, Mears and Houston Jr. High. http…"
709475936102694912,2016-03-14 20:26:59,,1,0,TweetDeck,Speaking w/ @TodaysDAR State Convention in FBX on efforts to uphold commitment to vets &amp; protect the Constitution. https://t.co/E1soLBR4LC
708388912130101249,2016-03-11 20:27:32,,17,40,TweetDeck,“Nancy is where she has always wanted to be with her Ronnie…now she is at peace.” - Michael Reagan https://t.co/Y5J9VAgoQm
705480708198944768,2016-03-03 19:51:22,,0,0,TweetDeck,"Safe trails to all our mushers. Ahead of the 2016 Iditarod, I shared my thoughts as a former dog musher in Ft. Yukon https://t.co/8qml4lft4q"
705469472212180992,2016-03-03 19:06:43,,3,0,TweetDeck,Check out my newest e-newsletter to stay up to date on the many AK items before the House https://t.co/UHvSoTGOBv https://t.co/KMv23tXwMF
705178198624092160,2016-03-02 23:49:18,,5,2,TweetDeck,"Secretary Jewell, why is the Fish and Wildlife Service doing this? Do you want us to go to court?

https://t.co/MkHP0Vml8f"
705170957791596544,2016-03-02 23:20:32,,3,3,TweetDeck,"Honored to meet w/ AK members of the VFW to discuss 2016 priorities, including national security &amp; veteran care https://t.co/GEuDDy2vrx"
705160215155634181,2016-03-02 22:37:51,,1,0,TweetDeck,"Proud to participate in Meals for Wheels letter signing initiative, to share a positive message to AK seniors. https://t.co/RmIgBJcXDl"
704690046906060800,2016-03-01 15:29:34,,1,0,TweetDeck,WATCH LIVE: Oversight Hearing on #POTUS 2017 Budget Proposal w/ DOI Secretary Sally Jewell https://t.co/IRVTX3EqjH https://t.co/fLo1VEeUZ8
704479618925989890,2016-03-01 01:33:24,,4,1,TweetDeck,Questioning Sec. Sally Jewell tomorrow on Admin's actions that take away rights of AK 2 access lands &amp; resources. https://t.co/zybE7dgqhq
