id,created_at,user,retweets,favorite_count,source,text
851574035079192576,2017-04-10 23:14:06,RepDavidValadao,4,0,Twitter for iPhone,"RT @Fresno_State: Thanks to @RepDavidValadao for supporting @Fresno_State, #StudentSuccess, and affordable, accessible #HigherEd for all! #…"
847487787221647361,2017-03-30 16:36:48,RepDavidValadao,3,13,Twitter Web Client,It's an honor to receive the 2017 Health Champion Award from @CVHNclinics. I am so proud of our community health ce… https://t.co/mYNjEa7Kj2
844576447343874050,2017-03-22 15:48:11,RepDavidValadao,4,21,Twitter Web Client,Enjoyed meeting Portuguese Minister Augusto Santos Silva and discussing the importance of the relationship between… https://t.co/coNfEWXe6G
844250396168257536,2017-03-21 18:12:34,RepDavidValadao,3,29,Twitter Web Client,"The Valley leads the nation in ag production because of the hard work of our farmers, ranchers, &amp; workers. Thanks f… https://t.co/ZbaBLe95gO"
843142679479418881,2017-03-18 16:50:54,RepDavidValadao,3,13,Twitter for iPhone,Great event in #Bakersfield this morning! Thank you to @CAP_Kern for discussing the great programs available in our… https://t.co/3wDRkKLunk
842429757119709185,2017-03-16 17:38:00,RepDavidValadao,0,7,Twitter Web Client,Disaster Declaration from @POTUS will help ensure those impacted have resources to clean up &amp; rebuild. INFO: https://t.co/m16v8eeC22
841713687912157186,2017-03-14 18:12:36,RepDavidValadao,4,13,Twitter Web Client,Speaking w/constituents is the best part of my job. Check out my @FoxNews debut discussing my #HometownHuddle event! https://t.co/Q7ZeggFmWK
840026541325201408,2017-03-10 02:28:29,RepDavidValadao,5,0,Twitter for iPhone,"RT @bakersfieldnow: Congressman David Valadao to host a Community Resource Fair for Kern County families. 
MORE: https://t.co/nPoQNutNiz ht…"
840025803878465536,2017-03-10 02:25:33,RepDavidValadao,1,0,Twitter for iPhone,RT @BAWPVA: Thank you to @RepDavidValadao for meeting with Pres. Patton &amp; GRD Tucker while they are in DC this week for PVA's Advocacy/Legi…
838796351567691776,2017-03-06 17:00:08,RepDavidValadao,6,0,Twitter Web Client,RT @shs_hilights: Congressman David Valadao visited Sanger High on Friday and answered questions for AP Government and Economics students h…
838104526439727104,2017-03-04 19:11:04,RepDavidValadao,2,10,Twitter Web Client,Thank you @KingsUnitedWay for taking time to meet with me yesterday. #KingsCounty appreciates every thing you do fo… https://t.co/S8NHjfuwjC
837801354647244800,2017-03-03 23:06:23,RepDavidValadao,3,19,Twitter for iPhone,"March is #NationalReadingMonth! Enjoyed reading ""House Mouse, Senate Mouse"" to third graders at Lee Richmond Elemen… https://t.co/rZ2GvHRH4N"
837755326971641857,2017-03-03 20:03:29,RepDavidValadao,6,14,Twitter Web Client,Excited to announce a new way for you and I to communicate! Join me Monday for our #HometownHuddle in Hanford! Info… https://t.co/REh5HYnEA2
836962692955000832,2017-03-01 15:33:50,RepDavidValadao,4,0,Twitter for iPhone,"RT @farmcredit: We agree, @RepDavidValadao! It's helpful when lenders have employees who know &amp; understand #ag. That's what #FarmCredit str…"
836782519169187840,2017-03-01 03:37:53,RepDavidValadao,11,26,Twitter for iPhone,"While @POTUS and I do not agree on every issue, we share in the belief that our country succeeds when we come toget… https://t.co/b4SY7YqVX1"
836671189087096832,2017-02-28 20:15:30,RepDavidValadao,2,0,Twitter for iPhone,RT @KMJNOW: @RepDavidValadao joins @RayAppletonKMJ live from DC now ahead of @POTUS speech to congress. #KMJonCapitolHill
836298852630163457,2017-02-27 19:35:58,RepDavidValadao,4,9,Twitter Web Client,"Next month, I'll be hosting a Community Resource Fair in #Bako to provide information about no-cost programs availa… https://t.co/aU0FFpodcd"
834840339873677312,2017-02-23 19:00:22,RepDavidValadao,6,0,Twitter for iPhone,RT @FWD_us: Thank you @RepDavidValadao for your leadership + for discussing #immigration reform with us today! https://t.co/s0UhjbZpTs
834803793036505089,2017-02-23 16:35:08,RepDavidValadao,16,34,Twitter Web Client,Enjoyed discussing immigration reform w/ constituents at today's event hosted by the Fresno Area Hispanic Foundatio… https://t.co/MTEVxVCx8G
831944986329546757,2017-02-15 19:15:16,RepDavidValadao,9,0,Twitter for iPhone,RT @HouseAppropsGOP: Members of the #Agriculture Subcommittee kick off the first Appropriations hearing of the 115th Congress. https://t.co…
831944574553751553,2017-02-15 19:13:38,RepDavidValadao,1,4,Twitter for iPhone,In the recording studio for a satellite interview with @KyleHarvey_KBAK for @bakersfieldnow! https://t.co/NFvAdDSbC0
831665723722313728,2017-02-15 00:45:34,RepDavidValadao,2,26,Twitter for iPhone,My #Valentine today and every day! https://t.co/t5qwRTYnNG
831591639294603264,2017-02-14 19:51:11,RepDavidValadao,2,7,Twitter for iPhone,Thanks for joining us @VP! https://t.co/uK9HK68bPT
831333803763314688,2017-02-14 02:46:38,RepDavidValadao,3,0,Twitter for iPhone,RT @CityofKingsburg: @RepDavidValadao Please help spread the word for @CityofKingsburg. Vote everyday until Thursday! https://t.co/5ZtZaZjw…
831294153426362368,2017-02-14 00:09:05,RepDavidValadao,16,50,Twitter Web Client,The just House passed the #HIREVetsAct to encourage businesses to employ our #veterans. Proud to be an original cosponsor of the bill!
830192874209812480,2017-02-10 23:13:00,RepDavidValadao,3,20,Twitter for iPhone,"Enjoyed discussing education, immigration, and water with AP Government students from @SangerHigh_ this afternoon! https://t.co/ACtN2M7U5H"
830106818642862080,2017-02-10 17:31:02,RepDavidValadao,0,6,Twitter for iPhone,"Live on @KMJNOW discussing water, immigration, and recent executive orders from POTUS. https://t.co/ohdYoHnO9A"
830080629073182720,2017-02-10 15:46:58,RepDavidValadao,2,7,Twitter for iPhone,Tune in now as I join @KimKMPH and @kopigreatday on @KMPHFOX26! https://t.co/WpoI4vSMtJ
829850051052703744,2017-02-10 00:30:44,RepDavidValadao,10,14,Twitter for iPhone,14k towns applied but #CA21 made the final 5! Vote to help #Kingsburg win a @smlbizrevolution main street revival!… https://t.co/I21IIovtrQ
829510800561860608,2017-02-09 02:02:41,RepDavidValadao,3,18,Twitter for iPhone,Enjoyed meeting with @KingsCommunity Action Organization and discussing early childhood education in the Valley! https://t.co/Vgdeik3w2N
826173612184985600,2017-01-30 21:01:53,RepDavidValadao,28,50,Twitter Web Client,I support strengthening screening procedures but these issues are complex and should not be addressed through hasty… https://t.co/CfBGLpAp5Q
825120844011671553,2017-01-27 23:18:33,RepDavidValadao,6,14,Twitter Web Client,Looking forward to working with the DoD to reaffirm the need for the F-35. This aircraft will be the first stealth… https://t.co/8M5wyyfJEo
824439778355609600,2017-01-26 02:12:15,RepDavidValadao,10,29,Twitter for iPhone,The first F-35's arrived at NAS Lemoore today. Excited to have the next generation of stealth fighter right here in… https://t.co/sVXGuWmNUA
822273231520313344,2017-01-20 02:43:10,RepDavidValadao,1,0,Twitter for iPhone,RT @KVPR: SPECIAL PROGRAMMING: California inauguration special from @KQED featuring @RepDavidValadao tonight at 6:30 PM on FM89
822175177417039873,2017-01-19 20:13:32,RepDavidValadao,1,11,Twitter Web Client,#Inauguration tickets waiting to be picked up by #CA21 constituents! https://t.co/9XxRPwVwx5
822173597871521793,2017-01-19 20:07:15,RepDavidValadao,0,3,Twitter Web Client,Thanks for having me! @scottshafer @KQED
822115858222817281,2017-01-19 16:17:49,RepDavidValadao,6,6,Twitter for iPhone,"Behind the scenes with @scottshafer of @KQED talking water, immigration, and inauguration. #CA21 https://t.co/TXzDXxM2iZ"
822104125823418369,2017-01-19 15:31:12,RepDavidValadao,1,10,Twitter for iPhone,Getting ready for #inauguration with @DaleYurongABC30 and @ABC30 right outside the Capitol! https://t.co/1FgpA2uI22
821881115350798336,2017-01-19 00:45:02,RepDavidValadao,6,22,Twitter for iPhone,"It's inauguration week in DC! Regardless of political beliefs, witnessing the peaceful transition of power is incre… https://t.co/NOSUAAKaUy"
821059980031823873,2017-01-16 18:22:08,RepDavidValadao,3,10,Twitter for iPhone,"Cynthia Pollard w/Aera Energy, @SenAndyVidak, &amp; @vfong at the Annual Dr. Martin Luther King, Jr. Community Awards B… https://t.co/DDGHzgLNj6"
819567722606555136,2017-01-12 15:32:26,RepDavidValadao,3,15,Twitter Web Client,It's always an honor to preside over the House as Speaker pro tempore. Catch me on @CSPAN! https://t.co/xN3nDZWGRF
819330036213891073,2017-01-11 23:47:57,RepDavidValadao,2,12,Twitter Web Client,"Excited to again serve on @HouseAppropsGOP on the Ag, MilCon &amp; Veteran Affairs, &amp; THUD Subcommittees. INFO: https://t.co/ug9mfUKn1a"
818862748151017472,2017-01-10 16:51:07,RepDavidValadao,4,5,Twitter Web Client,Take a moment to complete this quick survey to share your priorities for the 115th Congress! SURVEY: https://t.co/ak7HBheKbs #CA21
818609871344070657,2017-01-10 00:06:17,RepDavidValadao,5,12,Twitter Web Client,Grateful for the brave men and women who risk their lives to keep us safe. Thank you to all those who serve!… https://t.co/6d4B6XUqqa
817092809840848897,2017-01-05 19:38:01,RepDavidValadao,2,14,Twitter Web Client,Proud to introduce H.R. 299 to expand benefits to Blue Water Vietnam veterans who were exposed to Agent Orange.… https://t.co/nKSl2YGrvV
816486034494128128,2017-01-04 03:26:54,RepDavidValadao,10,21,Twitter for iPhone,"New Congress, new water legislation.  It's time to grow our communities, grow our food, and grow our families.… https://t.co/IHSFP98GAV"
816424970771451904,2017-01-03 23:24:16,RepDavidValadao,5,33,Twitter Web Client,Honored to be sworn in to the 115th Congress and grateful for the opportunity to serve. https://t.co/XGOORBQoIa
815972867607236612,2017-01-02 17:27:46,RepDavidValadao,4,8,Twitter Web Client,Excited to again serve as co-chair of the Armenian Congressional Caucus and look forward to continuing our work! https://t.co/dHtug6DPhY
815580021159002112,2017-01-01 15:26:44,RepDavidValadao,1,11,Twitter for iPhone,Happy New Year! https://t.co/RIGhnLSLzg
814255362136309760,2016-12-28 23:43:01,RepDavidValadao,2,14,Twitter for iPhone,Grateful for the opportunity to thank service members stationed abroad this holiday season as I travel on a CODEL t… https://t.co/8krA8yKkB7
814151286182514688,2016-12-28 16:49:27,RepDavidValadao,32,0,Twitter for iPhone,"RT @ResoluteSupport: Congressmen from CA, RI, NY and CO visited RS for briefings and constituent meetings @Embassy_of_AFG https://t.co/1nWa…"
813058336912539648,2016-12-25 16:26:28,RepDavidValadao,1,4,Twitter for iPhone,Merry Christmas! 🎄 🎁 https://t.co/BcvfqCQGCi
811727386286796800,2016-12-22 00:17:44,RepDavidValadao,1,4,Twitter for iPhone,Behind the scenes discussing water with @EvanOnstot. Be sure watch the segment on @KSEE24 this Sunday morning!… https://t.co/Q1QCzIkEKp
809883563525083136,2016-12-16 22:11:03,RepDavidValadao,2,5,Twitter for iPhone,@POTUS just signed the #WIIN Act into law. The bill will provide interim drought relief for struggling Californians… https://t.co/oPQMRWc1tn
809880723847020544,2016-12-16 21:59:46,RepDavidValadao,17,0,Twitter for iPhone,RT @KSEE24: BREAKING: @POTUS signs a massive water bill @RepDavidValadao &amp; @RepJimCosta say will bring more water to valley farmers and com…
809858159657553921,2016-12-16 20:30:06,RepDavidValadao,3,14,Twitter for iPhone,"Our DC office has moved! If you're planning a trip to DC, visit 
https://t.co/5heZZtGlar to request a tour and visi… https://t.co/AIdhkifvxn"
806908106781392897,2016-12-08 17:07:38,RepDavidValadao,2,0,Twitter Web Client,RT @NatResources: WATCH LIVE as the House discusses the #WIIN Act → https://t.co/rKrOdUCKN3
806534968428134400,2016-12-07 16:24:55,RepDavidValadao,4,11,Twitter Web Client,"Today, we remember the 2,403 Americans who lost their lives at #PearlHarbor and honor all who answered the call to… https://t.co/QK62R8r5Cg"
806213674142732288,2016-12-06 19:08:13,RepDavidValadao,0,7,Twitter Web Client,Congrats to local Hanford couple Kevin &amp; Liza Robertson who were recently recognized by @CAFarmBureau for their wor… https://t.co/LFBDjP5gyB
805078309566554113,2016-12-03 15:56:41,RepDavidValadao,6,8,Twitter for iPhone,"House passed #NDAA to give our troops, including @NAS_Lemoore, the resources needed to complete their mission. https://t.co/iGmsLCrTzc"
802543374590877697,2016-11-26 16:03:45,RepDavidValadao,1,4,Twitter for iPhone,It's Small Business Saturday! Which of your favorite local businesses will you be supporting today? ShopSmall #CA21… https://t.co/FhFHEwf41R
801800993218457600,2016-11-24 14:53:48,RepDavidValadao,0,8,Twitter for iPhone,Wishing you and your family a Happy #Thanksgiving. What are you grateful for this year? https://t.co/7pgHNp6bc9
797146802101383168,2016-11-11 18:39:42,RepDavidValadao,5,23,Twitter for iPhone,Incredibly thankful for every man and woman who has worn America's uniform. Thank you for your sacrifice and braver… https://t.co/GrjTtvXPOH
793883308312539136,2016-11-02 18:31:44,RepDavidValadao,9,27,Twitter for iPhone,Joining The Wonderful Company to kick off the start of mandarin season! No better way to celebrate than their new b… https://t.co/RWRhf6f8CK
792159335602282496,2016-10-29 00:21:17,RepDavidValadao,17,27,Twitter for iPhone,What a #wonderful group of kids! Excited to join the Resnicks for the Wonderful College Prep Academy ribbon cutting… https://t.co/8HZGonsliL
791337166156734464,2016-10-26 17:54:17,RepDavidValadao,0,10,Twitter Web Client,"Excited to participate in @KingsCommunity Action Organization's Annual Food Drive on Saturday, November 12, 2016 fr… https://t.co/wewN0H5qfJ"
791088555351085056,2016-10-26 01:26:23,RepDavidValadao,4,0,Twitter for iPhone,"RT @bakersfieldnow: .@RepDavidValadao ""disgusted"" by call for repayments of California National Guard enlistment bonuses. https://t.co/EPDf…"
791068246115921921,2016-10-26 00:05:41,RepDavidValadao,4,6,Twitter for iPhone,LIVE w/ @bakersfieldnow to discuss recent DoD efforts to collect enlistment bonuses paid to California National Gua… https://t.co/VMwJky7Ppx
790989066812715009,2016-10-25 18:51:04,RepDavidValadao,6,8,Twitter Web Client,Do you know a student who is interested in attending a U.S. Military Service Academy? Nomination applications must… https://t.co/MP1q6GRTJJ
790744887960281088,2016-10-25 02:40:47,RepDavidValadao,0,8,Twitter Web Client,"October is #BreastCancerAwarenessMonth. 1 in every 8 women will be diagnosed during their lifetime. Together, we ca… https://t.co/IbQcTzn60a"
787388622391554048,2016-10-15 20:24:11,RepDavidValadao,3,10,Twitter for iPhone,"Thanks Mayor Pro Tem Parra, Councilmen Hammer, City Manager Elias, &amp; Minister Mays for making today's Fowler Commun… https://t.co/j4bjCYH38J"
786678729493938176,2016-10-13 21:23:19,RepDavidValadao,4,5,Twitter for iPhone,Happy 241st Birthday to the United States Navy! https://t.co/xnWY36AAGO
786207285915758593,2016-10-12 14:09:58,RepDavidValadao,4,9,Twitter Web Client,October is Ntl. Book Month &amp; I couldn’t think of a better way to celebrate than to read to students @ George Washin… https://t.co/iT2UcGDZcv
785953377792303104,2016-10-11 21:21:02,RepDavidValadao,3,9,Twitter Web Client,Honored to receive Association of Homebuilders Defender of Housing Award from the Building Industry Association (BI… https://t.co/6E4eCDX7We
785939917792686080,2016-10-11 20:27:33,RepDavidValadao,8,17,Twitter Web Client,#Visalia did a wonderful job raising awareness and funds to battle Alzheimer's at this year's Walk to End Alzheimer… https://t.co/IivfPkFMhQ
783739377000312833,2016-10-05 18:43:23,RepDavidValadao,1,5,Twitter for iPhone,#Sanger leaders meet to address local challenges. I was able to participate in this week's Community Task Force mee… https://t.co/U9gqzNLkk0
783020030862778368,2016-10-03 19:04:57,RepDavidValadao,2,2,Twitter Web Client,Attention #CA21 Students: The 2017-18 #FAFSA is now available! Learn how to get started here:… https://t.co/kJ16LkZmF7
781245691922411520,2016-09-28 21:34:22,RepDavidValadao,5,6,Twitter Web Client,"I just introduced legislation, #ACTIVATE, to help the VA schedule timely medical appointments for our heroes.… https://t.co/lscQWW78jB"
781151881804513280,2016-09-28 15:21:36,RepDavidValadao,2,13,Twitter Web Client,Fortunate enough to have met Shimon Peres a few years ago. The world has lost a determined leader &amp; courageous advo… https://t.co/mF1ce6c1N5
780862957660016640,2016-09-27 20:13:31,RepDavidValadao,2,12,Twitter for iPhone,"Thanks @SteveScalise for the celebratory cookie cake in honor of passage of my bill HR 3779, the Social Security Fr… https://t.co/jVDCFMx8D1"
780543886267654144,2016-09-26 23:05:38,RepDavidValadao,8,7,Twitter for iPhone,The House just passed my bill to protect Americans from becoming victims of identity theft. INFO:… https://t.co/y3TGL8ISRM
779020710236852224,2016-09-22 18:13:05,RepDavidValadao,1,5,Twitter Web Client,"Next month, I will be hosting a Community Coffee event in #Fowler and hope you will attend! RSVP here:… https://t.co/xBab7iNs7K"
778710079927300096,2016-09-21 21:38:45,RepDavidValadao,6,17,Twitter Web Client,Racing through the Capitol with @Nascar champion @JimmieJohnson. #48 https://t.co/LO960pjatz
776874524440686592,2016-09-16 20:04:54,RepDavidValadao,0,1,Twitter Web Client,@CVHonorFlight touched down in Fresno last night! Honored to welcome them to the WWII Memorial in DC this week. https://t.co/D8DcDBmtp8
776870509132800000,2016-09-16 19:48:57,RepDavidValadao,1,2,Twitter Web Client,"@CVHonorFlight touched down in #Fresno last night! As always, I was honored to meet them in our Nation's Capital! https://t.co/Gw8WHE8ZBB"
776803168168607744,2016-09-16 15:21:22,RepDavidValadao,10,14,Twitter Web Client,Let us remember our brave soldiers who were captured or never returned home &amp; pray for their loved ones. #POWMIA https://t.co/3YAKRlcFKQ
776799498282696704,2016-09-16 15:06:47,RepDavidValadao,1,5,Twitter Web Client,Small businesses are the backbone of the Central Valley &amp; I'm proud to stand up for them in Washington. https://t.co/EA7guOTLoR #CA21
776082188089618432,2016-09-14 15:36:27,RepDavidValadao,3,10,Twitter Web Client,"Check out my piece in @thehill discussing education in the U.S., especially here in the Central Valley.  https://t.co/0J1g6CeaNP #CA21"
776053455626629121,2016-09-14 13:42:16,RepDavidValadao,2,10,Twitter for iPhone,Gearing up to go live with @KMPHFOX26 from the Russell Rotunda. #CA21 https://t.co/aVnlKNIIGR
774970767373139968,2016-09-11 14:00:03,RepDavidValadao,13,15,Twitter for iPhone,"15 yrs ago, the fate of our Nation changed forever. We will #NeverForget that day or those taken too soon. https://t.co/ioUUtQv23p"
774264788624998400,2016-09-09 15:14:45,RepDavidValadao,2,9,Twitter Web Client,Joined members of the House on the Capitol steps this morning for 9/11 remembrance ceremony. #NeverForget https://t.co/f5XcvZ5VRF
772847171490185216,2016-09-05 17:21:39,RepDavidValadao,1,10,Twitter Web Client,Meeting w/ hard workers in the Central Valley is one of the best parts of my job. Thanks for all you do! #LaborDay https://t.co/CtbZcv248X
770990784271245312,2016-08-31 14:25:01,RepDavidValadao,3,12,Twitter Web Client,Congratulations to Nicolay Nelson from Troop 480 for achieving the rank of Eagle Scout! #CA21 https://t.co/KFbxzNo0og
770676025177022465,2016-08-30 17:34:17,RepDavidValadao,6,8,Twitter Web Client,Students interested in attending a Military Service Academy should attend my info. night on Thursday! #CA21 https://t.co/dfNBDCL8H9
768949923102547968,2016-08-25 23:15:22,RepDavidValadao,6,15,Twitter for iPhone,"Happy Centennial to the @NatlParkService! Which #NationalPark is YOUR favorite? 
#FindYourPark #NPS100 https://t.co/eV2qX3kn5Q"
768485708554129408,2016-08-24 16:30:45,RepDavidValadao,1,2,Twitter Web Client,Enjoyed learning more about how important Hospice is! https://t.co/FHl2THyLmc
768460206086946816,2016-08-24 14:49:25,RepDavidValadao,6,10,Twitter Web Client,"YTD, I visited the #CedarFire Camp 9 Command Post. Very thankful for the brave firefighters who protect us. #CA21 https://t.co/9JHzMrdQ6f"
765912942864834561,2016-08-17 14:07:30,RepDavidValadao,0,13,Twitter for iPhone,Who did it better!? @vfong &amp; I at the @KernCountyFB Paint Night. Paintings will be auctioned to help plant gardens. https://t.co/0F7qEVm1lQ
763333003489796096,2016-08-10 11:15:44,RepDavidValadao,2,0,Twitter for iPhone,"RT @agripulse: Agri-Pulse Meet the Lawmaker: David Valadao, California's 21st District https://t.co/zpAJaFdEOU #CaliforniaAg https://t.co/z…"
763332823243714560,2016-08-10 11:15:01,RepDavidValadao,1,3,Twitter for iPhone,Thanks for the letter! https://t.co/NnqOlzrXzY
761320027697979392,2016-08-04 21:56:53,RepDavidValadao,1,6,Twitter for iPhone,Happy birthday to the @USCG and thank you to all who have served. #SemperParatus https://t.co/pZtR8zgQbT
759426971642236928,2016-07-30 16:34:34,RepDavidValadao,1,0,Twitter for iPhone,RT @KernCntyLibrary: We had a very special guest at Family Storytime at McFarland Branch ~ @RepDavidValadao https://t.co/Q969NE5kpj
759145137536507905,2016-07-29 21:54:39,RepDavidValadao,1,5,Twitter for iPhone,Started the weekend right - cantaloupes at the #Firebaugh Roundup Festival! #CA21 #Agriculture https://t.co/Ru0u5me7y6
758968020714696704,2016-07-29 10:10:51,RepDavidValadao,5,3,Twitter for iPhone,Thoughts and prayers are with @SanDiegoPD this morning.  https://t.co/SVasAjCavy
758828395631222784,2016-07-29 00:56:02,RepDavidValadao,5,20,Twitter for iPhone,CA21 is home to many awesome businesses like @RosaBrosMilk. Thanks to Noel &amp; all Fresno Food Expo participants! https://t.co/NN7jGhFpLp
756929203975487488,2016-07-23 19:09:19,RepDavidValadao,1,5,Twitter for iPhone,Got to meet with a great group of kids yesterday at @BGCCAN in #Bakersfield! #CA21 https://t.co/nkcQt6C9QV
755900002535288832,2016-07-20 22:59:39,RepDavidValadao,1,9,Twitter for iPhone,Excited for the Wonderful College Prep Academy to open its new facility in Delano. Thanks for the tour! #CA21 https://t.co/lsNelEcW14
755899667402006529,2016-07-20 22:58:19,RepDavidValadao,2,0,Twitter for iPhone,"RT @pparx: If you missed the event w/@RepDavidValadao, visit https://t.co/VCbToWwxGi. You could get help in just 4 easy steps. https://t.co…"
755507994306211840,2016-07-19 21:01:57,RepDavidValadao,2,13,Twitter Web Client,"Today, I met with staff &amp; volunteers from @CFBFresno in Earlimart. Thank you for all you do for our community! https://t.co/lC2702qmBX"
755157512488259588,2016-07-18 21:49:15,RepDavidValadao,1,6,Twitter for iPhone,"Enjoyed meeting kids, staff, &amp; volunteers at the Boys &amp; Girls Club (@BGCCAN) this afternoon in #Selma. #CA21 https://t.co/770HFp9Ppx"
755120628030705664,2016-07-18 19:22:41,RepDavidValadao,1,7,Twitter Web Client,Thank you to staff at the #Kerman United Health Centers for showing me around today! #CA21 https://t.co/VsilN1NNEg
754417164833083393,2016-07-16 20:47:23,RepDavidValadao,1,0,Twitter for iPhone,Free or nearly free #RxHelp is available if you qualify. Stop by #Bako Friendship House *9 AM to get #RxHelp. INFO: https://t.co/VtBUfdYNSX
754364830325190656,2016-07-16 17:19:25,RepDavidValadao,1,0,Twitter for iPhone,RT @CAHepatitisC: Proud to team up w/ .@pparx and .@RepDavidValadao to connect families in Kern Co to Rx assistance programs https://t.co/t…
754358714434408448,2016-07-16 16:55:07,RepDavidValadao,3,0,Twitter for iPhone,RT @CAChronicCare: Honored to sponsor #pparx assistance workshop with .@RepDavidValadao today in #Bakersfield helping kern co residents htt…
754354039991726084,2016-07-16 16:36:33,RepDavidValadao,2,2,Twitter Web Client,Vengan hoy sabado a la Friendship House en #Bako para ver si califican para resivir assistencia con sus medicamentos https://t.co/VtBUfdHd1p
754350102299500544,2016-07-16 16:20:54,RepDavidValadao,0,2,Twitter Web Client,Do you struggle w/ affordable access to medicine? Stop by #Bako event @ 9 AM to see if you qualify for assistance. #CA21RxHelp
754342394007523328,2016-07-16 15:50:16,RepDavidValadao,0,1,Twitter for iPhone,@pparx &amp; local orgs are at the #Bako Friendship House. Stop by to see if you qualify for Rx assistance! #CA21RxHelp https://t.co/6JtXtoOnLp
754332653294419969,2016-07-16 15:11:34,RepDavidValadao,2,2,Twitter for iPhone,I've teamed w/ @pparx to connect uninsured/underinsured to Rx assistance programs in #Bako @ 9 AM. https://t.co/VtBUfdHd1p #CA21RxHelp
754321627471605764,2016-07-16 14:27:45,RepDavidValadao,1,3,Twitter Web Client,"Excited for today’s Rx event w/ CA Health Collaborative, CA Senior Advocates League, Clinica Sierra Vista, &amp;Kern Co. Aging &amp; Adult Services"
754321585121718274,2016-07-16 14:27:35,RepDavidValadao,1,3,Twitter Web Client,@mssociety @LiverUSA @ArthritisFdn @CAHepatitisC @CAChronicCare will be on site to answer questions. https://t.co/thHgdwd4AB #CA21RxHelp
754319602335805440,2016-07-16 14:19:42,RepDavidValadao,0,3,Twitter Web Client,Join @pparx &amp; local orgs. TODAY @ 9 AM for Prescription Assistance Workshop in #Bako. INFO: https://t.co/thHgdwd4AB #CA21RxHelp
754313483232145408,2016-07-16 13:55:23,RepDavidValadao,1,0,Twitter Web Client,RT @MOASC_Office: Teaming up w/ .@pparx and .@RepDavidValadao to connect families to Rx assistance programs. https://t.co/PithdwQnwX
754313460503154688,2016-07-16 13:55:18,RepDavidValadao,1,0,Twitter Web Client,RT @MOASC_Office: Our volunteers will be at @ Friendship House Comm. Ctr Saturday 7/16 passing out information and helping families... http…
