id,created_at,user,retweets,favorite_count,source,text
512593455798038528,2014-09-18 13:26:18,RepDavidValadao,5,7,Twitter Web Client,Honored to have received the @NFIB Guardian of #SmallBiz Award. Small businesses are truly the backbone of #CA21! http://t.co/49PpXAfgho
512308488648028161,2014-09-17 18:33:56,RepDavidValadao,2,1,Twitter Web Client,Spoke w/ Principal Deputy Assistant Secretary Natsuhara of @USNavy to again express support for basing @theF35 @ NAS #Lemoore.
512271022385811456,2014-09-17 16:05:03,RepDavidValadao,2,0,Twitter for iPhone,RT @CVHonorFlight: @RepDavidValadao Amazing picture!  Thank you for joining us again. We always appreciate your company on our trips. :)
512246122770087936,2014-09-17 14:26:07,RepDavidValadao,2,5,Twitter Web Client,Met up w/ a real American hero; Pres Thompson of #Firebaugh. Great to have @CVHonorFlight in Washington. #CA21 http://t.co/R3UgnVevSE
510535326809718785,2014-09-12 21:08:01,RepDavidValadao,6,3,Twitter Web Client,"Our thoughts &amp; prayers go out to the men &amp; women of VFA-94 and VFA-113, their families, and the entire NAS Lemoore community."
510087620014391296,2014-09-11 15:29:00,RepDavidValadao,3,1,Twitter Web Client,"As we remember 9/11, let us also remember the Americans who lost their lives in Benghazi. We will continue to pursue justice in their name."
510054121182085120,2014-09-11 13:15:53,RepDavidValadao,3,3,Twitter Web Client,Let us remember those lives lost 13 years ago. 9/11 shook our country but also brought our nation tgthr. #NeverForget http://t.co/wrC7gf9QkK
509720215463415808,2014-09-10 15:09:04,RepDavidValadao,3,3,Twitter Web Client,Congressional Gold Medal ceremony honoring the Fallen Heroes of #Sept11 happening now. Watch online at http://t.co/TshsAJohe6
509718069972066304,2014-09-10 15:00:32,RepDavidValadao,2,1,Twitter Web Client,CNN reports ObamaCare has cost CA 43k jobs. Has your family/business experienced financial burden as a result? http://t.co/dXUiO3hMZU #CA21
507945910043963392,2014-09-05 17:38:36,RepDavidValadao,0,1,Twitter Web Client,Had a great time discussing the role of gov. w/ Mrs. Montgomery’s &amp; Mrs. Nagatani’s classes @ Kings River – Hardwick. http://t.co/bh013pApI2
504993711345115136,2014-08-28 14:07:37,RepDavidValadao,0,1,Twitter Web Client,Tune in to @KERN1180 from 7:00 &amp; 7:30 AM as I join Scott Cox. You can also watch live here: http://t.co/r7onKlhwPn http://t.co/v2Jt6yG6za
504699978615640064,2014-08-27 18:40:26,RepDavidValadao,0,2,Twitter Web Client,Met with the Guardian Industries team in #Kingsburg. Thanks for the invite! #CA21 http://t.co/pMGYJIpQTP
504664397034582016,2014-08-27 16:19:03,RepDavidValadao,1,4,Twitter Web Client,"Enjoyed seeing @kopigreatday, @peacekim, and @justinwillistv on @GreatDayKMPH this morning! #CA21 @KMPHFOX26 http://t.co/1aHqfESoXo"
504627652914061312,2014-08-27 13:53:02,RepDavidValadao,0,3,Twitter for iPhone,Thanks for having me! RT: “@JoeyHorta: @RepDavidValadao @KSEE24 @CBS47 thanks for stopping by!”
504616895203790848,2014-08-27 13:10:17,RepDavidValadao,5,4,Twitter Web Client,"This morning, be sure to watch @KSEE24 and @CBS47 as I discuss today's biggest news stories. #CA21 http://t.co/dp1vJoKtK4"
502118409157763072,2014-08-20 15:42:12,RepDavidValadao,1,2,Twitter Web Client,"Had the chance to meet w/ New York Life agents from #CA21, thanks for letting me spend some time w/ you yesterday. http://t.co/Ks4PAOSkvI"
501383612911341568,2014-08-18 15:02:23,RepDavidValadao,7,4,Twitter Web Client,"W/ out relief, drought means crisis for the nation. Check out @WashingtonPost's front page: http://t.co/fabUMca4PH http://t.co/ntFUM6TAK0"
499211150891188224,2014-08-12 15:09:47,RepDavidValadao,2,4,Twitter Web Client,"Great discussion @ my Shafter Community Coffee on Sat. For info. on upcoming events, visit: http://t.co/04AeSgIn1X http://t.co/tVWuYEJo6X"
495054515704709122,2014-08-01 03:52:48,RepDavidValadao,6,0,Twitter for iPhone,RT @RepSinema: Introduced bipartisan bill w/@RepDavidValadao encouraging immigrant entrepreneurs to invest in the US &amp; create jobs. http://…
494514801956380672,2014-07-30 16:08:11,RepDavidValadao,7,8,Twitter Web Client,"Today, we introduced legislation to reform our laws so they reflect the critical role of women in the workforce. http://t.co/K1l8U7aYeE"
494234857414066178,2014-07-29 21:35:47,RepDavidValadao,4,2,Twitter Web Client,Watch me discuss the importance of making improvements to the ESA so the Valley can get the water they need: http://t.co/xpLF9nZ2QH #CA21
493525552075010049,2014-07-27 22:37:15,RepDavidValadao,12,12,Twitter for iPhone,"Welcome Alexander, one of the newest members of Team Valadao! http://t.co/3EmyESo8X7"
493525290161672193,2014-07-27 22:36:13,RepDavidValadao,10,7,Twitter for iPhone,"Welcome Alexander, one of the newest members of Team Valadao! http://t.co/9lJG7id6vm"
493155569084006400,2014-07-26 22:07:04,RepDavidValadao,15,11,Twitter for iPhone,Enjoyed participating in the opening ceremonies for #Philippines weekend in #Delano! Who's celebrating this weekend? http://t.co/G99DZkv2zf
492721820140060673,2014-07-25 17:23:30,RepDavidValadao,16,9,Twitter Web Client,"Had a great time with the Flood family, who made the trip from Kingsburg to DC this week! Thanks for stopping by! http://t.co/YVME6CKyFs"
492374547929526272,2014-07-24 18:23:34,RepDavidValadao,24,16,Twitter Web Client,DC team &amp; I took a pic to support David Marcus &amp; the #ThumbsUpCancerDown effort to encourage those battling cancer! http://t.co/SPd3iuLmr7
492066970519732227,2014-07-23 22:01:22,RepDavidValadao,26,10,Twitter Web Client,Awesome to see my colleague @HerreraBeutler &amp; her daughter on the Floor today. Check out their remarkable story here: http://t.co/db3wnyO9ru
492011761152065537,2014-07-23 18:21:59,RepDavidValadao,31,14,Twitter Web Client,Heading up the Capitol steps to vote. It is an honor to represent you in Congress. #CA21 http://t.co/j4mFBJOcn4
491975607329501184,2014-07-23 15:58:19,RepDavidValadao,27,9,Twitter Web Client,Check out my interview w/ @jdbalart on @MSNBC discussing the crisis @ the border &amp; how the House will act | http://t.co/E6sq1K34Fm #CA21
491939785087660032,2014-07-23 13:35:59,RepDavidValadao,23,10,Twitter Web Client,Be sure to watch @MSNBC at 10:15 AM ET as I join @JDBmsnbc to discuss #immigration and the #California #drought. #CA21
491672636595142657,2014-07-22 19:54:26,RepDavidValadao,25,12,Twitter Web Client,Happy birthday to Pastor Vivas from World Harvest Church in Delano! Thank you for your dedication to our community. http://t.co/Gwr2bMkTIP
491644932940382208,2014-07-22 18:04:20,RepDavidValadao,27,12,Twitter Web Client,Got to visit Herbert Jackson in his new house on Fri. Thanks to those who helped - What an awesome community! http://t.co/E81umWKtCq
491643183378755584,2014-07-22 17:57:23,RepDavidValadao,29,11,Twitter Web Client,Looking for a new team member in Kern Co. Applicants must be professional &amp; passionate about CA21. Email: CongressmanValadao@mail.house.gov
491324177333628928,2014-07-21 20:49:46,RepDavidValadao,23,0,Twitter Web Client,RT @SHRebels: US Congressmen David Valadao speaking to the public at South High. He represents the 21st District in CA. http://t.co/n8InZrU…
491319509761163264,2014-07-21 20:31:14,RepDavidValadao,26,14,Twitter Web Client,"After tallying votes &amp; consulting with my kids, the heifer will be named “Liberty”.   Thank you to those who participated! #NameACalf #CA21"
490684689389064192,2014-07-20 02:28:41,RepDavidValadao,34,14,Twitter for iPhone,Congrats to the Fresno Latino Rotary &amp; President Leon on a great event! Thanks for everything you do. #CA21 http://t.co/V5Di2WCg8H
490589232784998400,2014-07-19 20:09:22,RepDavidValadao,32,12,Twitter for iPhone,Thanks to those who joined me in Delano this AM! Want to attend an event? - call my office @ (559) 582-5526! #CA21 http://t.co/KaUneGcV0j
490143917137223680,2014-07-18 14:39:50,RepDavidValadao,26,12,Twitter Web Client,Tune in to @KMJNow at 7:45 AM PT as I join @RyanHarrisKMJ to discuss Malaysian Airlines flight #MH17 and #Israel’s #Gaza offensive
489408795580579840,2014-07-16 13:58:44,RepDavidValadao,32,17,Twitter Web Client,Signed lots of letters to constituents last night. Your opinion is so important. Can't wait to hear from you too! http://t.co/oi2QAvWbAB
489076961395097600,2014-07-15 16:00:08,RepDavidValadao,38,25,Twitter Web Client,This calf was born on my dairy on Fri. In honor of #CowAppreciationDay help me give this heifer a name! #NameACalf http://t.co/rXEm2oQFbT
487286063816515584,2014-07-10 17:23:45,RepDavidValadao,33,20,Twitter Web Client,Here is a photo from last week’s telephone town hall! Sign up here to participate next time: http://t.co/fAecCOC0K7 http://t.co/JDcDLNoqiV
487265479179141120,2014-07-10 16:01:57,RepDavidValadao,37,23,Twitter Web Client,Just a few of the great interns we have working for #CA21! Interested in interning? Call my office at (559) 582-5526! http://t.co/o8HTwqgLp5
486549159227707392,2014-07-08 16:35:33,RepDavidValadao,39,27,Twitter Web Client,"Great turnout at my #BAKO Open House last night! For info on future events, message me @ http://t.co/u6EH91zHNb! http://t.co/AmC2m2ElEU"
486260151222284288,2014-07-07 21:27:08,RepDavidValadao,36,19,Twitter Web Client,Happy 94th Birthday to John Wagenhalls who served over 80 missions between WWII &amp; Korea. Thank you for your service! http://t.co/BYY1VifwRA
486224099329728514,2014-07-07 19:03:53,RepDavidValadao,30,13,Twitter Web Client,"Be sure to stop by my Open House Event tonight in Bakersfield at 2700 M Street, Suite 250B. Call (559) 582-5526 for more info! #CA21"
485087089097056258,2014-07-04 15:45:49,RepDavidValadao,36,20,Twitter for iPhone,"While we celebrate Independence Day, take a moment to remember the sacrifices made so that we may have freedom today. http://t.co/yUCK1YzkJy"
482199837929406464,2014-06-26 16:32:54,RepDavidValadao,28,18,Twitter Web Client,"Thank you for saying ""yes"" 15 years ago. Happy Anniversary Terra! http://t.co/itKh2btW65"
481860964531580928,2014-06-25 18:06:21,RepDavidValadao,24,0,Twitter Web Client,RT @JosephICastro: Met today @uscapitol with @RepDavidValadao and @taleslick to discuss advancing higher education in the Valley and throug…
481081338670612480,2014-06-23 14:28:23,RepDavidValadao,30,14,Twitter Web Client,Thanks to those who stopped by my Community Coffee in #Bakersfield! I'll be hosting another event in #Selma this Sat! http://t.co/G7A0iO9qCB
480049662280605698,2014-06-20 18:08:53,RepDavidValadao,27,13,Twitter Web Client,"My only daughter, Madeline turns 8 years-old-today! Happy Birthday Princess! http://t.co/vcM59YyF7E"
479032746434899968,2014-06-17 22:48:01,RepDavidValadao,35,18,Twitter Web Client,On #ThisDayInHistory the Statue of Liberty came to NY becoming a sign of freedom for immigrants arriving in the US http://t.co/ppzmseduhc
478596519827099648,2014-06-16 17:54:36,RepDavidValadao,33,15,Twitter Web Client,Congratulations to the Foster Farms family on their 75th Anniversary! #CA21 #CentralValley http://t.co/EYXeZk3okM
473508393291096064,2014-06-02 16:56:12,RepDavidValadao,29,14,Twitter for iPhone,"Helped out w/drought relief food distributions in San Jouquin today. For info. or to volunteer, call (559) 273-3663. http://t.co/2YUqZrbl0Q"
473468761215758336,2014-06-02 14:18:43,RepDavidValadao,14,0,Twitter for iPhone,RT @KMJNOW: Coming up on #KMJNOW...We'll talk exclusively with @RepDavidValadao
471828924402388992,2014-05-29 01:42:36,RepDavidValadao,25,13,Twitter for iPhone,Our thoughts and prayers go out to all those affected by the UCSB tragedy. http://t.co/DZwvKuXxAR
469498067621003264,2014-05-22 15:20:36,RepDavidValadao,29,13,Twitter Web Client,The Washington Monument has finally reopened! Call my office for assistance booking tours for your visit to DC #CA21 http://t.co/2qMcTlAGdm
467346682389483520,2014-05-16 16:51:46,RepDavidValadao,29,15,Twitter Web Client,"Let us pray for all #firefighters, especially our family, friends, &amp; neighbors, who are fighting the #wildfires throughout the state. #CA21"
467336624964399104,2014-05-16 16:11:48,RepDavidValadao,29,15,Twitter Web Client,I fully support the Navy's decision to bring the F-35’s to NAS #Lemoore &amp; look forward to moving forward. INFO: http://t.co/KW0DX9b9uY #CA21
467325610201993216,2014-05-16 15:28:02,RepDavidValadao,25,13,Twitter Web Client,Thanks to all those who came to my #Sanger Community Coffee event last night to ask questions &amp; share opinions. #CA21 http://t.co/IY7d7B790y
466947656590565376,2014-05-15 14:26:11,RepDavidValadao,28,15,Twitter Web Client,Had a great time @ John Muir Middle School's Career Day. Students asked ?'s about my work in DC &amp; on my dairy. #CA21 http://t.co/Q9JePN7RSH
466945194446041088,2014-05-15 14:16:24,RepDavidValadao,27,13,Twitter Web Client,Join me TONIGHT in #SANGER for Coffee and Conversation. Event starts at 6:00 PM @ the Sanger Community Center. Hope to see you there! #CA21
465842703482105858,2014-05-12 13:15:30,RepDavidValadao,26,13,Twitter for iPhone,"RT: @realrobfinnerty: ""looking forward to speaking w/ Congressman Valadao in-studio this am LIVE on #EyewitnessNews #Drought #Gop”"
465495525119107072,2014-05-11 14:15:56,RepDavidValadao,27,17,Twitter for iPhone,Happy #Mothers Day to my wife &amp; my mom! Im lucky &amp; grateful my kids have such amazing role models.  #CA21 http://t.co/V0zhxuI3A8
465487767024041984,2014-05-11 13:45:06,RepDavidValadao,17,0,Twitter for iPhone,RT @calhealthcare: Thank you @RepDavidValadao for supporting a permanent R&amp;D Tax Credit! It's critical incentive for sustaining #CA biomedi…
464415818886184961,2014-05-08 14:45:34,RepDavidValadao,34,17,Twitter Web Client,"This morning, I had the honor of welcoming #Kern County vets to the Capitol. Their sacrifice will never be forgotten. http://t.co/d464WObRMf"
463690482661339136,2014-05-06 14:43:20,RepDavidValadao,28,13,Twitter Web Client,"Congrats to Tanya Fuentes from South High, the #CA21 District winner of the 2014 #CongressionalArtCompetition! http://t.co/3GeLZiaegt"
461219820370132992,2014-04-29 19:05:48,RepDavidValadao,25,0,Twitter Web Client,"RT @COA_Vision: COA doctors and students had a great meeting with @RepDavidValadao in Washington, DC. #AOACAC http://t.co/Lglm45kWrX"
461141959369691136,2014-04-29 13:56:25,RepDavidValadao,30,15,Twitter Web Client,Central Valley Honor Flight Veterans didn’t let rain stop them from visiting their WWII memorial this morning! #CA21 http://t.co/9L7i7iUvEu
459839707871195136,2014-04-25 23:41:44,RepDavidValadao,38,14,Twitter for iPhone,"For the first time in history, the entire state of California has been listed as a D1 – D4 category drought. http://t.co/C0LX1d2XG7"
459811080047296512,2014-04-25 21:47:59,RepDavidValadao,29,15,Twitter Web Client,Great to see a real American hero getting the attention he deserves. #CA21 #Service #Veteran http://t.co/ivcNWwaZVe
459810839441047552,2014-04-25 21:47:02,RepDavidValadao,29,15,Twitter Web Client,I had the honor of presenting Harry Topoozian w/ his military medals he earned serving our country during WWII. #CA21 http://t.co/RXqmKzSVNo
459728052826542080,2014-04-25 16:18:04,RepDavidValadao,28,14,Twitter Web Client,Check out pics from yesterdays Flag Raising Ceremony recognizing the #Armenian Genocide: http://t.co/NA45ElDabd #CA21 http://t.co/h0wjFxVJcS
459402952084451328,2014-04-24 18:46:13,RepDavidValadao,31,15,Twitter Web Client,"Today, we remember the victims of the Armenian Genocide, which began on this day in 1915. #ArmenianGenocide #CA21 http://t.co/oA5Le0YKID"
458688416884858881,2014-04-22 19:26:55,RepDavidValadao,25,11,Twitter Web Client,Enjoyed touring @VAFresno facilities last week. Thanks to all the staff &amp; volunteers for all the work you do! #CA21 http://t.co/t1lFtVthIc
456432448130138113,2014-04-16 14:02:30,RepDavidValadao,25,13,Twitter Web Client,I got to congratulate Christina Louie of Selma High on her acceptance to the US Naval Academy. Good luck Christina! http://t.co/QTpXROGcvo
456132182504140800,2014-04-15 18:09:21,RepDavidValadao,26,13,Twitter Web Client,DYK? Our tax code contains almost 4M words &amp; takes the average taxpayer 13 hours to file their form. We need a simpler system. #TaxDay #CA21
455836620483465216,2014-04-14 22:34:54,RepDavidValadao,24,14,Twitter for iPhone,Thank you for all the birthday wishes! Looking forward to another year working for the Central Valley! #CA21 http://t.co/spJ5yTCpa5
455795182328623104,2014-04-14 19:50:14,RepDavidValadao,24,11,Twitter Web Client,"In honor of National Park Week, entry to all Parks is FREE Sat. &amp; Sun.! Discover all CA has to offer! INFO: http://t.co/5zGCKvVL4q @CA21"
455790716896419840,2014-04-14 19:32:29,RepDavidValadao,16,0,Twitter Web Client,RT @KMJNOW: #KMJNOW: @RepDavidValadao is live in studio with @RayAppletonKMJ - Questions? Call 490-5858
455789420227342336,2014-04-14 19:27:20,RepDavidValadao,27,9,Twitter Web Client,Tune in to @KMJNow @ 12:30 PT as I join Ray Appleton &amp; discuss the drought &amp; CA Agriculture. Listen LIVE here: http://t.co/tbHWtl00zi #CA21
454252160570494976,2014-04-10 13:38:49,RepDavidValadao,26,12,Twitter Web Client,Hon'd to receive @calhealthcare's Visionary Award for supporting policy that develops tech &amp; meds families depend on http://t.co/gMdTzeiKJ9
453619007166230528,2014-04-08 19:42:53,RepDavidValadao,22,11,Twitter Web Client,Don't forget to participate in the '14 Congressional Art Competition. This is last years winner. INFO: (559) 582-5526 http://t.co/VaSfz62Qr4
453546777048674304,2014-04-08 14:55:52,RepDavidValadao,24,12,Twitter Web Client,"Man or woman, every single person has the right to equal pay for equal work. No exceptions. #EqualPayDay #CA21 http://t.co/XblYwzfc7x"
451438561321971715,2014-04-02 19:18:35,RepDavidValadao,35,15,Twitter Web Client,"Instead of wasting #water, we could be using it to grow #food &amp; help our communities. #CA21 #CentralValley #Drought http://t.co/xdXmnyB8Yg"
451380599832719361,2014-04-02 15:28:15,RepDavidValadao,20,11,Twitter Web Client,"Don't forget April 17 is the deadline for Congressional Art Competition submissions! For more info, call my Office at (559) 582-5526!"
451360200428376064,2014-04-02 14:07:12,RepDavidValadao,28,14,Twitter Web Client,It's unacceptable that farmers &amp; families continue to suffer while recent rainfall flows into the ocean. INFO: http://t.co/XA4Ep3ikLS #CA21
449502960935239681,2014-03-28 11:07:11,RepDavidValadao,17,0,Twitter for iPhone,RT @warmstrongabc30: #CAdrought @SenFeinstein @RepJimCosta @DevinNunes @RepDavidValadao @GOPWhip push to capture max storm water http://t.c…
448541988581699584,2014-03-25 19:28:38,RepDavidValadao,24,10,Twitter Web Client,Know a student interested in participating in our Congressional Art Competition? Call (559) 582-5526 for more info! http://t.co/ybUCd1FPLU
446746232442994689,2014-03-20 20:32:56,RepDavidValadao,25,12,Twitter Web Client,Spent some time with 5th graders at Pioneer Elementary School in #Hanford this afternoon! #CA21 http://t.co/0XzBZFkVl6
446662266319306753,2014-03-20 14:59:17,RepDavidValadao,23,9,Twitter Web Client,Check out photos from yesterday's #water rally in #Fresno! Thanks to those who participated! #CA21 #NoWaterNoJobs http://t.co/FTSFvdswPN
446347680864686080,2014-03-19 18:09:14,RepDavidValadao,31,12,Twitter Web Client,Great turn out at today's #water rally in #Fresno! Watch the @NatResources hearing NOW at http://t.co/YFYOr0RGqw http://t.co/hBHAwpvNMO
446344306060578816,2014-03-19 17:55:49,RepDavidValadao,27,7,Twitter Web Client,“We are literally at 0% water allocation &amp; still we have water being wasted for no good reason.” #CA21 @NatResources #CentralValley
446341508963119104,2014-03-19 17:44:43,RepDavidValadao,18,0,Twitter Web Client,"RT @NatResources: Watch the @NatResources field hearing in Fresno, CA on the CA Drought live online and let us know what you think http://t…"
446321065749266432,2014-03-19 16:23:29,RepDavidValadao,24,11,Twitter Web Client,Enjoyed discussing expectations for today’s @NatResources #drought Field Hearing w/ @ABC30 &amp; @KMPHFOX26 yesterday. http://t.co/JI71IQxztW
446005654793490432,2014-03-18 19:30:09,RepDavidValadao,13,0,Twitter Web Client,RT @KMJNOW: NOW: @DevinNunes @RepDavidValadao @DocHastings @CynthiaLummis in studio with #RayAppleton - http://t.co/X2q8piIRgL
445993591555768320,2014-03-18 18:42:13,RepDavidValadao,12,0,Twitter for iPhone,RT @GreenwoodKSEE24: @Nunes4Congress &amp; @RepDavidValadao talk #water ahead of Wednesday's big rally and hearing at #Fresno city hall. http:/…
445993002184761344,2014-03-18 18:39:52,RepDavidValadao,22,9,Twitter Web Client,"Tune into @KMJNOW at 12:30 PM as @Rep_DevinNunes, @DocHastings, @CynthiaLummis &amp; I join Ray Appleton to discuss the #drought. #CA21"
445988020982784000,2014-03-18 18:20:05,RepDavidValadao,21,12,Twitter Web Client,Had a great time speaking w/ the #Tulare Co. @FarmBureau Youth Leadership Organization yesterday! @CAFarmBureau #CA21 http://t.co/cn1CQGkK2f
445983111315087360,2014-03-18 18:00:34,RepDavidValadao,30,12,Twitter Web Client,Speaking to @KSEE24 &amp; @CBS47 about the #drought w/ @DocHastings @DevinNunes @CynthiaLummis of @NatResources Cmte. http://t.co/u48z4tVLBm
444476445159469056,2014-03-14 14:13:37,RepDavidValadao,23,10,Twitter Web Client,"Yesterday, the Juarez Family from #Lemoore visited my DC office for a tour of the US Capitol! #CA21 #Constituents http://t.co/mwm58Go3EW"
444121539949387776,2014-03-13 14:43:21,RepDavidValadao,16,0,Twitter Web Client,"RT @mikeswaney: Thank you, @RepDavidValadao for a great #RailDay conversation!  We appreciate your support in showing how well #freightrail…"
443785726828634113,2014-03-12 16:28:57,RepDavidValadao,74,26,Twitter Web Client,"Today, I was the 1st Member of Congress to participate in #Selfies4Reform, @FWD_us' new app to support #CIR. #CA21 http://t.co/3a8aJFNsAt"
443779103548641280,2014-03-12 16:02:38,RepDavidValadao,21,11,Twitter Web Client,It's been 2k days since the Keystone XL application was submitted. #Why2K #TimeToBuild #CA21 http://t.co/3eBOdim0QP
443750231075590146,2014-03-12 14:07:54,RepDavidValadao,22,12,Twitter Web Client,Honored to receive the Spirit of Enterprise Award from the @USChamber. #CA21 #4Jobs #SOE14 http://t.co/KrLRUQcz3G http://t.co/2BSoZkOncX
443460853652680704,2014-03-11 18:58:01,RepDavidValadao,20,9,Twitter Web Client,Details for the @NatResources hearing on #CA #water crisis in #Fresno are out. Info: http://t.co/b0ov3v6QzY. #CA21 http://t.co/PQQ0Jy5P9p
439432689943609344,2014-02-28 16:11:32,RepDavidValadao,12,0,Twitter Web Client,"RT @NRO: Don't miss NR in DC this Friday for our #CAWaterCrisis debate featuring @KevinNRO, @RepDavidValadao &amp; RepJimCosta. Watch online @N…"
439408594334019585,2014-02-28 14:35:47,RepDavidValadao,25,8,Twitter Web Client,"Today, CA lawmakers &amp; I announced a Congressional Drought Field Hearing in the Central Valley. INFO: http://t.co/AA1fxVMnKJ #CA21 #Water"
439081660634918912,2014-02-27 16:56:40,RepDavidValadao,14,0,Twitter Web Client,RT @rollcall: Reforming Immigration to Protect America's Breadbasket | Commentary via @RepDavidValadao: http://t.co/2vDYRbMNw3 #immigration
439075950463315968,2014-02-27 16:33:58,RepDavidValadao,22,9,Twitter Web Client,Check out my @RollCall op-ed. W/out immigration reform &amp; a strong CV Ag industry our economy will suffer | http://t.co/h4eQcLCYmR #CA21
438786385361653760,2014-02-26 21:23:21,RepDavidValadao,24,10,Twitter Web Client,"Great speaking to @ACWAWater today! The House passed a bill to address drought conditions, now the Senate must act! http://t.co/x8Nu4Z6gAu"
438437725658562560,2014-02-25 22:17:54,RepDavidValadao,21,10,Twitter Web Client,It was an honor to meet w/ Navy Master Chief Petty Officer Mike Stevens to discuss ways to help the troops #CA21 http://t.co/zAkjMFcD3w
438101349558153216,2014-02-25 00:01:15,RepDavidValadao,15,0,Twitter for iPhone,"RT @NRO: Don't miss NR in DC this Friday for our #CAWaterCrisis debate featuring @KevinNR, @RepDavidValadao &amp; @RepJimCosta. Watch online @N…"
436647077222023168,2014-02-20 23:42:30,RepDavidValadao,10,0,Twitter for iPhone,RT @23ABCNews: Mobile offices set up for Congressman David Valadao in Kern County | http://t.co/HraDknBOkH
436647034003943424,2014-02-20 23:42:20,RepDavidValadao,11,0,Twitter for iPhone,RT @ardon_diaz: Great morning of learning at Fremont! Congressman David Valadao visited our campus to speak with our 5th graders :) http://…
436646703446650880,2014-02-20 23:41:01,RepDavidValadao,13,0,Twitter for iPhone,RT @Monfort_Mgmt_NS: Big thanks to @GOPWhip and @RepDavidValadao taking the time to visit the annual Carrot Symposium http://t.co/oZWpecBQgM
436530338114703360,2014-02-20 15:58:37,RepDavidValadao,22,11,Twitter Web Client,"This week, I enjoyed discussing government &amp; the importance of civic duty w/ 5th graders at Fremont Elementary. #CA21 http://t.co/cGlEYt1hRY"
436528629715988480,2014-02-20 15:51:50,RepDavidValadao,22,10,Twitter Web Client,Got to tour Kern Steel in Bako. I appreciate the work they do for our national defense while providing local jobs http://t.co/4Ct7urjxLX
435466267173343232,2014-02-17 17:30:23,RepDavidValadao,18,13,Twitter for iPhone,Congrats Mendota High! RT: @ESPNNFL: Hard work. Determination. Mendota HS is following the American dream. http://t.co/5xDLi8ixab”
434526707265986560,2014-02-15 03:16:54,RepDavidValadao,35,14,Twitter for iPhone,"Years ago Pres. Kennedy inspired the Valley &amp; celebrated Ag, today President Obama offered some handouts &amp; scolded us about Climate Change"
431533879082491904,2014-02-06 21:04:28,RepDavidValadao,19,9,Twitter Web Client,Watch more from yesterday's Floor Debate on the Sacramento - San Joaquin Valley Emergency Act | http://t.co/WdwvjWDeYE #CA21 #water #CA21
