id,created_at,user,retweets,favorite_count,source,text
542815784444375040,2014-12-10 22:59:02,RepEdWhitfield,0,1,Twitter Web Client,Whitfield Meets with State Legislators: http://t.co/XmNf2eubG3 http://t.co/vlS8EQ1Hwm
542805253473968128,2014-12-10 22:17:11,RepEdWhitfield,1,1,Twitter Web Client,#Christmas is a wonderful time of year! Here is the tree that we just put up in the #Hopkinsville office. http://t.co/WIRbTOBb4S
542797903400820736,2014-12-10 21:47:59,RepEdWhitfield,1,1,Twitter Web Client,"On this day in #history, December 10, 1901, the first #Nobel Prizes were awarded. http://t.co/TZie5iIbuL"
542797611783454720,2014-12-10 21:46:49,RepEdWhitfield,3,1,Twitter Web Client,December is Made in the USA Month -- a stamp we couldn't be prouder of! http://t.co/IFt1I6mcD5
542796573147951104,2014-12-10 21:42:42,RepEdWhitfield,1,0,Twitter Web Client,Next up on our wish list? Save American Workers Act. http://t.co/vz64RRsi2P
542075353775493120,2014-12-08 21:56:50,RepEdWhitfield,5,3,Twitter Web Client,Obama’s #EPA is Destroying #Jobs at Home: http://t.co/CgyQYcsyIp
541970132793585664,2014-12-08 14:58:43,RepEdWhitfield,0,0,Twitter Web Client,The American Labor Force participation rate remains at a 36-year low: http://t.co/0nWUwH9BtR
541969209433927680,2014-12-08 14:55:03,RepEdWhitfield,0,0,Twitter Web Client,We're making our list and checking it twice. First up? #KeystoneXL Time to build! http://t.co/FNcGcUjm7X
540932472658472960,2014-12-05 18:15:26,RepEdWhitfield,0,0,Twitter Web Client,#FBF #FlashbackFriday to Fox News in 2013: https://t.co/K5LTnukuQe @HouseCommerce @HouseGOP
540926989230931968,2014-12-05 17:53:38,RepEdWhitfield,4,3,Twitter Web Client,"Let's give the president the power to bypass Congress and do whatever he wants--Said no Founding Father, ever! http://t.co/4jmdLtLBHk"
540633927665586176,2014-12-04 22:29:07,RepEdWhitfield,0,0,Twitter Web Client,"Whitfield Votes in Support of #Troops, National Security, and Champions EEOICPA Amendment: http://t.co/wmNROGtkgk"
540633808429940737,2014-12-04 22:28:39,RepEdWhitfield,2,1,Twitter Web Client,Whitfield Fights Against President Obama’s Executive Amnesty:http://t.co/BvUksBcS8F
540611630292549632,2014-12-04 21:00:31,RepEdWhitfield,2,0,Twitter Web Client,#TBT #ThrowbackThursday to several years ago when @boderek came to visit me and Campbell in my old office! http://t.co/OgxRWU61YE
540578245725679616,2014-12-04 18:47:51,RepEdWhitfield,5,2,Twitter Web Client,My colleagues and I on @HouseCommerce remain ever-focused on jobs + the economy http://t.co/jf9Qigls67 #4jobs
540518612499705856,2014-12-04 14:50:54,RepEdWhitfield,0,1,Twitter Web Client,#ICYMI A record-number of millennials are still living with mom &amp; dad. http://t.co/D7EW16iwrw
540281042373189632,2014-12-03 23:06:53,RepEdWhitfield,0,0,Twitter Web Client,"Whitfield Works to Provide a Better Life for Kentuckians with Disabilities:
  http://t.co/XCdI1uQLsO"
540266613313142784,2014-12-03 22:09:32,RepEdWhitfield,0,0,Twitter Web Client,Whitfield Meets with UK: Officialshttp://whitfield.house.gov/media-center/press-releases/capitol-hill-christmas-tree-lighting-ceremony-held
540266411487424512,2014-12-03 22:08:44,RepEdWhitfield,2,1,Twitter Web Client,Capitol Hill Christmas Tree Lighting Ceremony Held: http://t.co/hsfTwdnnGQ
540266279446540288,2014-12-03 22:08:13,RepEdWhitfield,1,0,Twitter Web Client,"Whitfield Targets Obama’s Green Payoffs for 2015:
  http://t.co/52KI3fUdaq"
539870757896355840,2014-12-02 19:56:33,RepEdWhitfield,2,0,Twitter Web Client,"Today is #GivingTuesday. Give of your time, talents, and finances to help someone in need. Everyone can do something! http://t.co/jRlggLI701"
539843036973662209,2014-12-02 18:06:24,RepEdWhitfield,8,3,Twitter Web Client,"It’s been 2,265 days since backers of the #KeystoneXL pipeline first submitted an application to the U.S. State Department. #TimeToBuild"
539800440402370560,2014-12-02 15:17:08,RepEdWhitfield,0,1,Twitter Web Client,"@HouseCommerce Chmn @RepFredUpton: Over Thanksgiving, our bipartisan #RecordOfSuccess grew stronger with 3 more bills becoming law."
539547246971613185,2014-12-01 22:31:02,RepEdWhitfield,1,2,Twitter Web Client,"Last week, the #Sunscreen #Innovation Act was signed into law. It is good for America when we #worktogether!"
539534538050121728,2014-12-01 21:40:32,RepEdWhitfield,0,0,Twitter Web Client,This month we remember our manufacturers and their hard work! #MadeIntheUSA http://t.co/ak3fw2TIvd
539533977912999936,2014-12-01 21:38:19,RepEdWhitfield,1,0,Twitter Web Client,The fight against HIV is not over. #WAD2014 http://t.co/mYfESghFkK
537007295969132545,2014-11-24 22:18:11,RepEdWhitfield,4,0,Twitter Web Client,RT @HouseCommerce: House &amp; Senate cmte leaders seek info regarding consultation btwn @FERC &amp; @EPA in the development of Clean Power Plan ht…
536968394021810176,2014-11-24 19:43:36,RepEdWhitfield,0,0,Twitter Web Client,Whitfield Weighs in on Hagel Stepping Down: http://t.co/aKF9oKIhhH
535897674231582721,2014-11-21 20:48:56,RepEdWhitfield,0,0,Twitter Web Client,#GetCovered &amp; #StayCovered @BarackObama ? http://t.co/bFXygc8hDD
535822686484971520,2014-11-21 15:50:58,RepEdWhitfield,0,0,Twitter Web Client,#FBF #FlashbackFriday to the day I was sworn in as a Member of the Kentucky House of Representatives. http://t.co/5FdNK7yeXI
535609896885305345,2014-11-21 01:45:25,RepEdWhitfield,5,0,Twitter Web Client,Executive #Amnesty is #unconstitutional! @BarackObama @HouseCommerce
535554598950686720,2014-11-20 22:05:41,RepEdWhitfield,0,2,Twitter Web Client,#TBT #ThrowbackThursday to a great meeting on Air Force One with President George W. Bush. http://t.co/rbt4oncoGx
535549292644417537,2014-11-20 21:44:36,RepEdWhitfield,1,0,Twitter Web Client,http://t.co/pdgRIZPNsG
535518275531444224,2014-11-20 19:41:20,RepEdWhitfield,2,0,Twitter Web Client,Government works when we work together to find #solutions! http://t.co/sBRDZidLKF
535516529371414528,2014-11-20 19:34:24,RepEdWhitfield,2,1,Twitter Web Client,One thing the White House can't lie about? The visitor log: http://t.co/gyO8590uiW
535495068166418433,2014-11-20 18:09:07,RepEdWhitfield,1,2,Twitter Web Client,I'll keep working to put you back to #work. One #job at a time! #4jobs http://t.co/aLrECe96lW
535488827625062400,2014-11-20 17:44:20,RepEdWhitfield,0,1,Twitter Web Client,http://t.co/4id9dUyEL9 @McConnellPress @SenRandPaul
535167707952730112,2014-11-19 20:28:19,RepEdWhitfield,40,0,Twitter Web Client,RT @HouseCommerce: Senate Democrats tried to kill #KeystoneXL last night…but the #TimeToBuild will come in 2015! #KXL15 http://t.co/9ai2bck…
535075480819736577,2014-11-19 14:21:50,RepEdWhitfield,47,0,Twitter Web Client,RT @GOPLeader: The 2015 calendar for the U.S. House of Representatives is now available: http://t.co/A9s03NyTiF
535071757397659648,2014-11-19 14:07:02,RepEdWhitfield,4,0,Twitter Web Client,"@RepFredUpton
 Like the bleacher bums at Wrigley have been saying for over 100 years -- wait till next year! #KeystoneXL #TimeToBuild"
534828246538678272,2014-11-18 21:59:25,RepEdWhitfield,0,0,Twitter Web Client,"A special thank you to Preston Lashley who served in our Washington, D.C. office this fall. http://t.co/MRfTGpepLX http://t.co/TNQJcG3KRv"
534778368001343489,2014-11-18 18:41:13,RepEdWhitfield,1,2,Twitter Web Client,"Bad #Obamacare Headlines: ""Cost of Coverage Under Affordable Care Act to Increase in 2015"" http://t.co/N3EAU9WBRT"
534417002761551873,2014-11-17 18:45:17,RepEdWhitfield,2,0,Twitter Web Client,RT @HouseCommerce: Ways we're working #4jobs - Using our newfound energy abundance to say #Yes2Energy to create jobs &amp; lower costs for fami…
534415004641288194,2014-11-17 18:37:20,RepEdWhitfield,0,1,Twitter Web Client,"Lowered expectations, ""unpleasant surprises"", a lack of transparency, &amp; more #BrokenPromises http://t.co/Uo1EomToAq  #Obamacare"
534376282981933056,2014-11-17 16:03:28,RepEdWhitfield,2,2,Twitter Web Client,"#Obamacare passed because a ""lack of transparency"" and ""the stupidity of the American voter."" Sorry, what? http://t.co/m9VM2mPEXl"
534376160667664384,2014-11-17 16:02:59,RepEdWhitfield,0,1,Twitter Web Client,Rebuilding the #economy -- one #manufacturing job at a time! http://t.co/fpsC7Mym1X
534376004668891136,2014-11-17 16:02:22,RepEdWhitfield,4,1,Twitter Web Client,Then vs. Now -- Pelosi edition. #Gruber http://t.co/eNI1ZIaYhM
533027425601748992,2014-11-13 22:43:36,RepEdWhitfield,0,1,Twitter Web Client,More on the disaster of #Obamacare @BarackObama  http://t.co/tBDVKnqKgA @HouseCommerce
532969445720084481,2014-11-13 18:53:12,RepEdWhitfield,0,0,Twitter Web Client,Open Enrollment? Let's hope it doesn't #BreakTheInternet http://t.co/rmk1PT1jnb
532968280152363008,2014-11-13 18:48:34,RepEdWhitfield,1,0,Twitter Web Client,Americans are getting trapped in red tape: #Obamacare http://t.co/vTUnp4uhzK
532961656620740608,2014-11-13 18:22:15,RepEdWhitfield,2,1,Twitter Web Client,It's time to build. #KeystoneXL http://t.co/s6H49ujPwG
532958115114012673,2014-11-13 18:08:11,RepEdWhitfield,0,1,Twitter Web Client,"Thanks to the Shale Boom, Gas Prices Are Dropping Across the Nation! #YES2ENERGY @HouseCommerce http://t.co/JTngEa2cHx"
532954788858982401,2014-11-13 17:54:58,RepEdWhitfield,1,3,Twitter Web Client,"#Congrats to Sen. McConnell, who was just elected Majority Leader in the Senate. He is the 2nd Senate Majority Leader in #History from #KY!"
532612906505220096,2014-11-12 19:16:27,RepEdWhitfield,3,1,Twitter Web Client,I enjoyed speaking and visiting with everyone at the Marion County High School #VeteransDay Program yesterday! http://t.co/EqVciODshZ
532231900765904898,2014-11-11 18:02:28,RepEdWhitfield,0,3,Twitter Web Client,Happy #VeteransDay! http://t.co/VvqFwz1QN9
531903095270572033,2014-11-10 20:15:54,RepEdWhitfield,0,2,Twitter Web Client,Happy Birthday #Marines! http://t.co/tUWylm0qb3
530451983644524544,2014-11-06 20:09:42,RepEdWhitfield,2,1,Twitter Web Client,Congrats to Brother Bob Hardison for his 35 years of service in #Ministry at the Sebree 1st Baptist Church! #HappyRetirement
523349422798016514,2014-10-18 05:46:40,RepEdWhitfield,2,2,Twitter Web Client,It was so great to visit the @HoptownYMCA  to see all of the wonderful progress that has been made! #YMCA http://t.co/r2fAdvrdzl
522473596346966017,2014-10-15 19:46:27,RepEdWhitfield,2,1,Twitter Web Client,"Congratulations to the City of Scottsville, #Kentucky on receiving a $125,000 grant from the Department of Justice to increase security!"
522411299528269824,2014-10-15 15:38:54,RepEdWhitfield,1,0,Twitter Web Client,Did you know Ebonite #bowling balls and equipment are manufactured in Hopkinsville? #4Jobs #Manufacturing http://t.co/lxOoCvlvhn
522124704212353024,2014-10-14 20:40:04,RepEdWhitfield,2,1,Twitter Web Client,"Thank you to the National Assoc. of Manufacturers for the NAM Award for Manufacturing Legislative Excellence #4Jobs! 
http://t.co/tgy4B7Si4a"
522099457878659074,2014-10-14 18:59:45,RepEdWhitfield,1,1,Twitter Web Client,Today's photo of #EdsCapitolTour is of the Henry Clay statue in Statuary Hall on Capitol Hill! http://t.co/YUxzozxu0D
520635095783591937,2014-10-10 18:00:54,RepEdWhitfield,0,1,Twitter Web Client,Today's photo of #EdsCapitolTour is of the Capitol Dome restoration project that recently began! http://t.co/v8OGhHgith
520630714698829825,2014-10-10 17:43:29,RepEdWhitfield,0,0,Twitter Web Client,Forkland Festival is today and tomorrow! http://t.co/6Eovucst4u http://t.co/ESjJCQkpLH
520629581171400706,2014-10-10 17:38:59,RepEdWhitfield,0,7,Twitter Web Client,Murray State University Homecoming is this weekend! Go Racers! #RacerHomecoming http://t.co/ow7yWskhfc
520254848114376704,2014-10-09 16:49:56,RepEdWhitfield,1,2,Twitter Web Client,October is #BreastCancer Awareness Month. We must spread awareness and invest in preventative care. #ThinkPink http://t.co/rEo6OEfrsw
520236508780179456,2014-10-09 15:37:03,RepEdWhitfield,0,1,Twitter Web Client,"Today's photo of #EdsCapitolTour is of the ""Old Senate Chamber"" which was home to the Senate from 1819-1859! http://t.co/qiNpR0W6TX"
519880503890300928,2014-10-08 16:02:25,RepEdWhitfield,1,1,Twitter Web Client,Today is the launch of #EdsCapitolTour on #Facebook and #Twitter. Today's photo is of #Emancipation Hall! http://t.co/Bi9EvRZzFS
519221783585914880,2014-10-06 20:24:54,RepEdWhitfield,0,2,Twitter Web Client,"On this day in #history, October 6, 1889 – #American inventor Thomas Edison showed his first #motionpicture. http://t.co/4Yy2RNtCC8"
517336056060850177,2014-10-01 15:31:42,RepEdWhitfield,5,1,Twitter Web Client,#BrokenPromises @BarackObama @HouseCommerce http://t.co/ca8XnWIBdO
516959603859660800,2014-09-30 14:35:48,RepEdWhitfield,0,1,Twitter Web Client,Congratulations to Tompkinsville Elementary School on being recognized as a National Blue Ribbon School for 2014! http://t.co/TTexmxNJpK
516959546192171011,2014-09-30 14:35:35,RepEdWhitfield,0,1,Twitter Web Client,Congratulations to Central Elementary School in Benton on being recognized as a National Blue Ribbon School for 2014! http://t.co/9hLKY3PONf
516703026489593856,2014-09-29 21:36:16,RepEdWhitfield,0,0,Twitter Web Client,"Congrats to the Lindsey Wilson College PT Program in Columbia, #KY on receiving a grant from the ARC today in the amount of $350,000.00!"
516602006988148737,2014-09-29 14:54:51,RepEdWhitfield,0,0,Twitter Web Client,"On this day in #history, September 29, 1789– The 1st United States Congress adjourned! @HouseGOP @HouseCommerce http://t.co/kYFe7heEb6"
516577227019137024,2014-09-29 13:16:23,RepEdWhitfield,4,0,Twitter Web Client,"@HouseCommerce
  TickTock: #KeystoneXL clock strikes 2200 days. Its time 4 @BarackObama to say it's #TimeToBuild http://t.co/1Vp1BRz1Ad"
516576879646887937,2014-09-29 13:15:00,RepEdWhitfield,4,0,Twitter Web Client,It was such an honor to meet the Veteran's #Honor Guard at the Marion County Country #Ham Days this weekend! http://t.co/PcGCClKpkW
516576549198659584,2014-09-29 13:13:41,RepEdWhitfield,3,0,Twitter Web Client,"It was so great to visit with everyone at the Marion County Country Ham Days in Lebanon, #Kentucky this weekend! http://t.co/eV9C1XkH6I"
515562740942127105,2014-09-26 18:05:10,RepEdWhitfield,0,1,Twitter Web Client,I would like to thank the Scottsville #Rotary Club for allowing me to speak with them today. What a great group! http://t.co/Oh3PumMV3y
515547457737228288,2014-09-26 17:04:26,RepEdWhitfield,1,0,Twitter Web Client,Thank you to Habitat For #Humanity in Allen County for inviting me to come discuss the issues with you today! http://t.co/FMmg14ccBY
515546772996124673,2014-09-26 17:01:43,RepEdWhitfield,0,1,Twitter Web Client,It was great to speak with the Chandler Elementary 5th graders in Logan County about the #Constitution this morning!
514799657181274112,2014-09-24 15:32:57,RepEdWhitfield,5,0,Twitter Web Client,"On this day 1789, #Congress passed the Judiciary Act which  and orders the composition of the @USSupremeCourt ! http://t.co/YQkt3h5OBW"
514503634038837249,2014-09-23 19:56:40,RepEdWhitfield,0,0,Twitter Web Client,http://t.co/CLEunUYbab #FightForFreedom @GENRayOdierno @HouseGOP
514475958846619648,2014-09-23 18:06:41,RepEdWhitfield,1,2,Twitter Web Client,"I hope everyone enjoys this first day of the #Fall season, and that your #harvest is #plentiful! http://t.co/BhkIS2l1SR"
514422263203246080,2014-09-23 14:33:19,RepEdWhitfield,0,1,Twitter Web Client,"This day in #history, 9/23/1779, John Paul Jones won the #Battle of Flamborough Head during the #American Revolution! http://t.co/b6z9504jyx"
514103884844134400,2014-09-22 17:28:12,RepEdWhitfield,0,2,Twitter Web Client,"Happy 24th #Anniversary to my wonderful #wife, Connie! http://t.co/hBy5XiVK0g"
514099487141527552,2014-09-22 17:10:43,RepEdWhitfield,2,0,Twitter Web Client,"Congrats to the Cumberland Co. Economic Dev. Project on receiving a $200,000.00 grant from the Appalachian Regional Commission! #Jobs"
513092033159118848,2014-09-19 22:27:28,RepEdWhitfield,30,0,Twitter Web Client,RT @HouseCommerce: #POTUSchat Obama crowdsources on #KXL decision after 6 yrs. See what your fmr US Presidents (&amp; Joe Biden) think here: ht…
512999818839752705,2014-09-19 16:21:02,RepEdWhitfield,0,0,Twitter Web Client,As of today @BarackObama has let the Keystone Pipeline application sit on his desk for 6 YEARS! It's past #TimeToBuild  and say #Yes2Energy!
512972578886287360,2014-09-19 14:32:48,RepEdWhitfield,2,0,Twitter Web Client,RT @TeddyRuffsevelt: I fell asleep on @RepEdWhitfield today. Whoops. Welcome to the #pugcaucus friend! #repuglicans #naps #GOPug http://t.c…
512741755846811648,2014-09-18 23:15:35,RepEdWhitfield,0,0,Twitter Web Client,http://t.co/MvzAfA5Zjb
512741679376265216,2014-09-18 23:15:17,RepEdWhitfield,1,0,Twitter Web Client,http://t.co/libMMK51DZ
512726775688753152,2014-09-18 22:16:03,RepEdWhitfield,2,0,Twitter Web Client,I enjoyed speaking on Skype today with the students at Crittenden Co. Elementary in Marion about #Constitution Week! http://t.co/L93t7PJRHC
512713021269872640,2014-09-18 21:21:24,RepEdWhitfield,0,1,Twitter Web Client,I just spoke on the House floor about the Energy package coming up for a vote: https://t.co/Am8ey6wf4L #Yes2Energy @HouseCommerce @HouseGOP
512694292528123904,2014-09-18 20:06:59,RepEdWhitfield,1,1,Twitter Web Client,It was so great to talk today on #Skype with the students at Heath Elementary in #Paducah about #Constitution Week! http://t.co/rwwVseA3PQ
512642255979819008,2014-09-18 16:40:12,RepEdWhitfield,2,1,Twitter Web Client,"#TBT @BarackObama, I stand firm in my stance for #AffordableElectricity. @HouseCommerce  @HouseGOP #Yes2Energy https://t.co/GfNWasWYcH"
512623855312318464,2014-09-18 15:27:05,RepEdWhitfield,2,1,Twitter Web Client,"I just met with the Postmaster General, Sen. McConnell, and @RepAndyBarr to discuss  #postal issues! @McConnellPress http://t.co/Bqgr0nQn0k"
512620057068068864,2014-09-18 15:12:00,RepEdWhitfield,0,0,Twitter Web Client,@UPSjobs is hiring in our district!  Go to http://t.co/wyoSeBZndP to learn more. #UPSjobs #jobs
512604115382591489,2014-09-18 14:08:39,RepEdWhitfield,1,1,Twitter Web Client,Happy birthday to the United States Air Force! http://t.co/FLr5jokqXh
512601592861036544,2014-09-18 13:58:38,RepEdWhitfield,0,0,Twitter Web Client,It was a pleasure meeting with Dale Adams and others from the Kentucky Credit Union League! http://t.co/ignk4dMp4z
512601082011602944,2014-09-18 13:56:36,RepEdWhitfield,2,1,Twitter Web Client,Yesterday I held a hearing to examine more ways to create energy jobs #Yes2Energy http://t.co/TLHTCRR9D6
512600207591473152,2014-09-18 13:53:07,RepEdWhitfield,0,1,Twitter Web Client,I enjoyed meeting with the American Cancer Society’s Cancer Action Network this week! http://t.co/9RTyjpJ8LM
512302549068963841,2014-09-17 18:10:20,RepEdWhitfield,0,0,Twitter Web Client,@racewithinsulin @novonordiskus I am honored to serve as the Co-Chair of the Diabetes Caucus and thank you for your dedication &amp; hard work!
512298763151761409,2014-09-17 17:55:17,RepEdWhitfield,0,0,Twitter Web Client,Congrats to the Henderson Co. Board of #Education on receiving a $100K grant from the Dept. of Health for Youth Mental Health 1st Aid!
512240316934795264,2014-09-17 14:03:03,RepEdWhitfield,1,1,Twitter Web Client,The U.S. House of Reps will soon be voting on a package of energy bills the Senate needs to pass to say #yes2energy! http://t.co/YBFLb1jvfi
512235162697203712,2014-09-17 13:42:34,RepEdWhitfield,1,1,Twitter Web Client,Congrats to the United Launch Alliance on their 60th  launch from Cape Canaveral last night! #ULAMissionSuccess http://t.co/JFsuYTUQVT
512229690644643840,2014-09-17 13:20:49,RepEdWhitfield,1,1,Twitter Web Client,"I would like to thank the #National Federation of Independent #Business for naming me a “Guardian of Small Business!"""
512228191684263936,2014-09-17 13:14:52,RepEdWhitfield,1,2,Twitter Web Client,"Today, we celebrate #ConstitutionDay to commemorate the Framers signing our Nation’s charter on 9/17/1787! @HouseGOP http://t.co/HobbOMvc5s"
511993146709135360,2014-09-16 21:40:53,RepEdWhitfield,4,5,Twitter Web Client,What a pleasure it was to discuss #Constitution Week with the Farley Elementary School Fifth Graders on Skype! http://t.co/JbS9UAsFYI
511948134432661504,2014-09-16 18:42:01,RepEdWhitfield,0,0,Twitter Web Client,It was so #great to talk with the Jones Park Elementary School Fifth Graders on Skype about #Constitution Week! http://t.co/AtiM7Xh2nT
511947979138543616,2014-09-16 18:41:24,RepEdWhitfield,0,1,Twitter Web Client,"Today, I enjoyed speaking with the Jonathan Elementary 5th Graders in Benton, #KY on Skype about #Constitution Week! http://t.co/4dZD5bIBGd"
511943654467190784,2014-09-16 18:24:13,RepEdWhitfield,4,0,Twitter Web Client,GAO report backs #prolife groups &amp; REP's who warned #Obamacare would subsidize abortions. http://t.co/WYFjzeERCN @politico @HouseCommerce
511880578124496896,2014-09-16 14:13:34,RepEdWhitfield,3,3,Twitter Web Client,"On this day in history, Sept. 16, 1620, the Pilgrims set sail from England on the Mayflower to #America! @HouseGOP http://t.co/ygxvHf51je"
510144419849580544,2014-09-11 19:14:42,RepEdWhitfield,0,0,Twitter Web Client,Yesterday I discussed the issues with participants of the KY Women’s Roundtable. It was great to meet with them! http://t.co/UREHvcZBZz
510143835532718080,2014-09-11 19:12:23,RepEdWhitfield,0,1,Twitter Web Client,I enjoyed speaking to members of the #Paducah #Chamber of #Commerce yesterday on Capitol Hill! @PaducahChamber http://t.co/ayIK5uNo6z
510143228889534464,2014-09-11 19:09:58,RepEdWhitfield,2,0,Twitter Web Client,Today we passed the #Employee #Health Care Protection Act because of @BarackObama's #BrokenPromises!  http://t.co/ryle0WpMEB @HouseCommerce
510121999268855808,2014-09-11 17:45:36,RepEdWhitfield,1,3,Twitter Web Client,"Congrats to Miss KY, Ramsey Carpenter from the 1st District. She won the talent portion of the Miss America Pageant! @Miss_KY_Pageant"
510121681881673728,2014-09-11 17:44:21,RepEdWhitfield,0,1,Twitter Web Client,"Congrats to Miss KY, Ramsey Carpenter from the 1st District. She won the talent portion of the Miss America Pageant last night! @HouseGOP"
510084729723695105,2014-09-11 15:17:31,RepEdWhitfield,0,0,Twitter Web Client,"Congrats to the Russell County Airport on receiving a federal grant from the Department of Transportation in the amount of $65,000.00!"
510084642591227904,2014-09-11 15:17:10,RepEdWhitfield,2,0,Twitter Web Client,"Congrats to the Barkley Regional Airport on receiving a federal grant from the Department of Transportation in the amount of $225,616!"
510084536903172096,2014-09-11 15:16:45,RepEdWhitfield,0,0,Twitter Web Client,"Congratulations to the Hopkinsville Airport on receiving a federal grant from the Department of Transportation in the amount of $113,400.00!"
510084465830670336,2014-09-11 15:16:28,RepEdWhitfield,2,2,Twitter Web Client,The heroes lost on 9/11 and those lost defending our nation since  will stay in our memory and prayers always. http://t.co/WCjlWjWlYd
509751264075583488,2014-09-10 17:12:26,RepEdWhitfield,1,0,Twitter Web Client,Whitfield Holds Hearing on State Perspectives of EPA's Overreaching Power Play: http://t.co/Be43vjVRh7
509750806858698752,2014-09-10 17:10:37,RepEdWhitfield,2,2,Twitter Web Client,Whitfield Stands with House of Representatives against @BarackObama's violation of Federal Law: http://t.co/QAKPcUv46Q
509750509142818817,2014-09-10 17:09:26,RepEdWhitfield,1,1,Twitter Web Client,Whitfield Fights for Protection from Federal Overreach: http://t.co/je5dStVVuZ
509415158620639234,2014-09-09 18:56:52,RepEdWhitfield,2,3,Twitter Web Client,"I am happy to stand w/ our farmers by cosponsoring the Fairness for Farmers Act, which will protect farmers from Obamacare's harmful impact!"
508993373395755008,2014-09-08 15:00:51,RepEdWhitfield,3,1,Twitter Web Client,We need a strategy Mr. President! @BarackObama http://t.co/uNYRSkaFBl
507627784374464512,2014-09-04 20:34:29,RepEdWhitfield,4,2,Twitter Web Client,I appreciate all the community leaders who joined me today in Marion County. http://t.co/BkZyEwGLOd
505112486224216064,2014-08-28 21:59:35,RepEdWhitfield,1,0,Twitter Web Client,I had a great meeting today and discussed the issues with #Emergency Room doctors at Lourdes Hospital in Paducah! http://t.co/rv2JoTZLAz
505111737301889025,2014-08-28 21:56:37,RepEdWhitfield,0,1,Twitter Web Client,It was so great to spend time today with #employees of the Logan County #Community #Health Center in Russellville! http://t.co/MN62RPZqCT
505110251926847488,2014-08-28 21:50:43,RepEdWhitfield,2,1,Twitter Web Client,"Today, I was fortunate to meet with the Pancreatic #Cancer Association of Western Kentucky at Lourdes Hospital! http://t.co/r9lwhqbjFd"
505060104308551680,2014-08-28 18:31:27,RepEdWhitfield,1,3,Twitter Web Client,I enjoyed touring the University of Louisville this week with Chairman Bob Hughes and President Jim Ramsey! @uofl http://t.co/28EIhDdy4E
505059100276060160,2014-08-28 18:27:27,RepEdWhitfield,1,2,Twitter Web Client,"This week we presented a FEMA Federal Grant check in the amount of $1,000,000 to the Madisonville Fire Dept.! http://t.co/jJfGWJRFGl"
505056322837307392,2014-08-28 18:16:25,RepEdWhitfield,0,1,Twitter Web Client,I enjoyed a roundtable discussion on with members of the #Kentucky Broadcasters Assoc. this week! http://t.co/VGjzHlhjri
505055693112893441,2014-08-28 18:13:55,RepEdWhitfield,0,0,Twitter Web Client,It was such an honor to meet Scott Moseley in Henderson! The community helped build him an accessible new bedroom! http://t.co/Wl3PC4dBIh
505054995830804481,2014-08-28 18:11:09,RepEdWhitfield,0,0,Twitter Web Client,It was so great seeing John Peters this week in Madisonville! Congrats on your retirement! @madisonvillecc http://t.co/tRSQmFFq38
