id,created_at,user,retweets,favorite_count,source,text
773243168636755969,2016-09-06 19:35:12,RepEdWhitfield,3,3,Twitter Web Client,Christian Named County of the Month for September: https://t.co/p76VJuZ824 https://t.co/tzs4nVI7vw
773242885626003456,2016-09-06 19:34:04,RepEdWhitfield,1,2,Twitter Web Client,"Whitfield Announces Federal Grants to Marshall, Metcalfe, and Christian County Fire Departments: https://t.co/6aSR9Nw3Ky"
765952330776866816,2016-08-17 16:44:01,RepEdWhitfield,3,6,Twitter Web Client,Whitfield Announces Federal Grant to Marshall County Fire Department: https://t.co/g2gEy4ylkw
762698032492216320,2016-08-08 17:12:35,RepEdWhitfield,3,2,Twitter Web Client,Whitfield Announces Federal Grant to Graves County Fire Department: https://t.co/txniCNJgF6
760518771991871488,2016-08-02 16:52:59,RepEdWhitfield,3,7,Twitter Web Client,Whitfield Hosts Summer Fellow from Paducah: https://t.co/iFAlC4fjEo https://t.co/45aZkneDOA
760518519826046977,2016-08-02 16:51:59,RepEdWhitfield,3,5,Twitter Web Client,Whitfield Hosts New York Cadet through Joint Internship Program: https://t.co/MtxOgZmBVM https://t.co/evSiFuy5yE
760518217005662208,2016-08-02 16:50:47,RepEdWhitfield,2,5,Twitter Web Client,Whitfield Hosts New Jersey Cadet through Joint Internship Program: https://t.co/XMKDO0puKf https://t.co/CzB9haRWrZ
758039457195065344,2016-07-26 20:41:04,RepEdWhitfield,4,8,Twitter Web Client,Whitfield Praises USDA Decision to Combat Horse Soring: https://t.co/4VBaMJUdmT
756188564950491136,2016-07-21 18:06:17,RepEdWhitfield,4,3,Twitter Web Client,"Whitfield Announces Federal Grants to Hopkins, Christian, and Marshall County Fire Departments: https://t.co/V3FhwfnXOy"
756150125672669184,2016-07-21 15:33:33,RepEdWhitfield,2,1,Twitter Web Client,Whitfield Announces Grants for Monroe &amp; Logan County Airports: https://t.co/nq3KwLdS68
755506244459331586,2016-07-19 20:54:59,RepEdWhitfield,2,0,Twitter Web Client,Whitfield Highlights Efforts in Reviewing Aggressive Regulations:  https://t.co/i0T1KLrP4x
754053713480867840,2016-07-15 20:43:09,RepEdWhitfield,2,4,Twitter Web Client,Whitfield Supports 3 Bills Countering Iranian Aggression: https://t.co/fGYJvwAHed
754023898627338240,2016-07-15 18:44:41,RepEdWhitfield,2,12,Twitter Web Client,"My heart is heavy for those killed and injured in Nice, France.  May we never allow fear to overcome our freedom. https://t.co/axonF2zSYH"
754022245882793986,2016-07-15 18:38:07,RepEdWhitfield,3,2,Twitter Web Client,Whitfield Supports Commonsense Approach to Food Labeling: https://t.co/0zwAtD1zRB
753710080256774144,2016-07-14 21:57:41,RepEdWhitfield,2,4,Twitter Web Client,Whitfield Statement on Interior Appropriations Bill: https://t.co/iSm8ASgq2Z
753364218318028800,2016-07-13 23:03:21,RepEdWhitfield,4,0,Twitter Web Client,Whitfield Votes to Protect Conscience Rights of Health Care Providers: https://t.co/CChvYZTCJn
753341295083544577,2016-07-13 21:32:15,RepEdWhitfield,4,6,Twitter Web Client,Thank you to the Kentucky Soybean Association for the thoughtful keepsake they presented during our meeting today. https://t.co/hOj9NGzl1s
752991059567927296,2016-07-12 22:20:33,RepEdWhitfield,1,0,Twitter Web Client,Whitfield Announces Nearly $2 Million for Calloway County Airport: https://t.co/2v534VVNDs
752976315951747073,2016-07-12 21:21:58,RepEdWhitfield,3,3,Twitter Web Client,"Whitfield Acts to Restore Separation of Powers, Stop Executive Overreach: https://t.co/wUH6n2wlkp"
751501484039299075,2016-07-08 19:41:30,RepEdWhitfield,1,1,Twitter Web Client,"Whitfield Supports Opioid Package, Praises Inclusion of NASPER Program: https://t.co/wTJyO8metc"
751092186356252673,2016-07-07 16:35:06,RepEdWhitfield,0,1,Twitter Web Client,Whitfield Announces Federal Grant to Adair County Fire Department: https://t.co/hfeZoa5m3Q
750820116846243840,2016-07-06 22:34:00,RepEdWhitfield,1,1,Twitter Web Client,Whitfield Supports Historic Mental Health Reform Bill: https://t.co/GnVUDfSLo0
750817663983771648,2016-07-06 22:24:15,RepEdWhitfield,5,16,Twitter Web Client,Happy Birthday today to President George W Bush. Here I am along with my father and President Bush in Hopkinsville. https://t.co/sPkfz5UFhs
750807325678657536,2016-07-06 21:43:10,RepEdWhitfield,1,1,Twitter Web Client,Whitfield Examines Major EPA Rules Affecting the Energy and Industrial Sectors: https://t.co/gVrTD2eL3c
750415033461538818,2016-07-05 19:44:20,RepEdWhitfield,0,0,Twitter Web Client,Carlisle Named County of the Month for July: https://t.co/rPvN5NLWhO
746416046798700548,2016-06-24 18:53:47,RepEdWhitfield,1,9,Twitter Web Client,Haidyn Greenwell of Hopkinsville is pictured with her winning artwork while in DC this week for 2016 CAC reception. https://t.co/v7mFAVSCQH
746056083677024256,2016-06-23 19:03:26,RepEdWhitfield,0,3,Twitter Web Client,Whitfield Applauds Supreme Court’s Decision in United States v. Texas: https://t.co/6GacyxMNoW
745728386933325825,2016-06-22 21:21:17,RepEdWhitfield,0,1,Twitter Web Client,Whitfield Examines Implementation of Renewable Fuel Standard: https://t.co/g4GkaU6OxT
745725525692420096,2016-06-22 21:09:54,RepEdWhitfield,0,0,Twitter Web Client,In Case You Missed It: Upton and Whitfield Applaud Ruling on Hydraulic Fracturing: https://t.co/UlgudB9hFP
745720997421154305,2016-06-22 20:51:55,RepEdWhitfield,1,0,Twitter Web Client,In Case You Missed It: President Signs Bipartisan Pipeline Safety Bill Into Law: https://t.co/5Zf6x8iAWA
745373084476125188,2016-06-21 21:49:26,RepEdWhitfield,7,15,Twitter Web Client,Thanks to the advocates from the Pancreatic Cancer Action Network for sharing your stories and for helping #WageHope https://t.co/yNaomhepsN
745001707311079424,2016-06-20 21:13:43,RepEdWhitfield,0,0,Twitter Web Client,Whitfield Announces Federal Grant to Henderson County Fire Department: https://t.co/Zp4s51vBui
743549498081820673,2016-06-16 21:03:09,RepEdWhitfield,1,1,Twitter Web Client,"Whitfield Votes to Support Troops, Responsibly Fund the DOD: https://t.co/qhDb5zZ4NZ"
743213772769214465,2016-06-15 22:49:06,RepEdWhitfield,3,6,Twitter Web Client,I enjoyed my visit yesterday with Davonna Page (Russellville) and Mike Armstrong with the KY School Board Assoc. https://t.co/682XyVo53I
742838110086692864,2016-06-14 21:56:21,RepEdWhitfield,0,2,Twitter Web Client,"Happy 241st Birthday to the U.S. Army, founded June 14, 1775. I am honored to represent the Fort Campbell Army Base. https://t.co/1XkvFUFZ01"
742837496497774592,2016-06-14 21:53:55,RepEdWhitfield,2,7,Twitter Web Client,"Today we celebrate the American flag, a universal symbol of freedom and democracy, adopted on this day in 1777. https://t.co/riBbqlwwH3"
742835591054827520,2016-06-14 21:46:20,RepEdWhitfield,0,0,Twitter Web Client,Whitfield Votes to Prevent Abuse by the IRS: https://t.co/Sk1rZCOSD9
741345612948492288,2016-06-10 19:05:42,RepEdWhitfield,0,4,Twitter Web Client,Whitfield Receives Distinguished Service Award: https://t.co/aUegxmLuPc https://t.co/NDWW17ISPf
741337639702437888,2016-06-10 18:34:01,RepEdWhitfield,0,1,Twitter Web Client,Whitfield Votes to Oppose Obama’s Extreme Energy Policies: https://t.co/OWHriu0xty
740664617827962880,2016-06-08 21:59:40,RepEdWhitfield,1,0,Twitter Web Client,Whitfield Shepherds Bill to Provide States Regulatory Relief: https://t.co/IkpuGy1l9u
740274461132263425,2016-06-07 20:09:19,RepEdWhitfield,6,2,Twitter Web Client,Congrats to US Army Garrison @FortCampbell on being one of the 2016 Commander in Chief’s Annual Award for Installation Excellence recipients
739894811906473984,2016-06-06 19:00:44,RepEdWhitfield,0,1,Twitter Web Client,Casey Named County of the Month for June: https://t.co/hPKsu1jWdd https://t.co/QrZ9cXv88U
735924432074592257,2016-05-26 20:03:52,RepEdWhitfield,2,2,Twitter Web Client,Thank you to the Kentucky Medical Equipment Suppliers Association for honoring me with the Homecare Champion Award. https://t.co/k7iI2P7dIC
735907406497058817,2016-05-26 18:56:12,RepEdWhitfield,3,1,Twitter Web Client,Whitfield Selected to Help Lead House Effort to Finalize Comprehensive Energy Bill with Senate: https://t.co/7ljJwaEump
735615173399056384,2016-05-25 23:34:59,RepEdWhitfield,2,1,Twitter Web Client,Whitfield Helps Usher Major Energy Legislation: https://t.co/vLsUixQJyj
735253849024434176,2016-05-24 23:39:12,RepEdWhitfield,2,1,Twitter Web Client,Whitfield Votes to Modernize 40 Year Old Process for Managing Hazardous Chemicals in Commerce: https://t.co/djtUhX31zK
735239841118621696,2016-05-24 22:43:32,RepEdWhitfield,1,1,Twitter Web Client,Whitfield Supports Reducing Regulatory Burden to Combat Zika: https://t.co/JRUAe7HkQN
735235478392307714,2016-05-24 22:26:12,RepEdWhitfield,3,7,Twitter Web Client,Congrats Ft. Campbell on being recognized as a Gold Winner during Army Communities of Excellence Awards Ceremony. https://t.co/em1jqUj23U
733729825144311808,2016-05-20 18:43:17,RepEdWhitfield,3,2,Twitter Web Client,I honor the men &amp; women who risk their lives daily and also remember those who made the ultimate sacrifice. #NPW2016 https://t.co/MN9w8Vkhed
733392195957493760,2016-05-19 20:21:39,RepEdWhitfield,2,1,Twitter Web Client,Whitfield Announces Federal Grants for Two Area Fire Departments: https://t.co/eTzKU5pKEA
733366254191415296,2016-05-19 18:38:34,RepEdWhitfield,1,2,Twitter Web Client,Whitfield Statement on the Passing of Mrs. T.C. Freeman: https://t.co/6OrfmlkrOn
733118465540771841,2016-05-19 02:13:57,RepEdWhitfield,2,3,Twitter Web Client,Whitfield Supports Legislation to Ensure Troop Readiness and Promote National Security: https://t.co/oEcnkl293M
733073603126775809,2016-05-18 23:15:41,RepEdWhitfield,3,1,Twitter Web Client,Whitfield Promotes Two Bills to Address Ozone and Spur Advanced Nuclear: https://t.co/uuR9FTxp0o
733054008626143233,2016-05-18 21:57:49,RepEdWhitfield,1,3,Twitter Web Client,Thanks to the Kentuckians for Better Transportation and BridgeLink for stopping by today to discuss ongoing projects https://t.co/ORwyZxyWFg
733052878940704768,2016-05-18 21:53:20,RepEdWhitfield,2,1,Twitter Web Client,I enjoyed my visit with the Kentucky Ambulance Providers Association earlier today. https://t.co/Yx724N7y6G
732608641119981568,2016-05-17 16:28:05,RepEdWhitfield,0,0,Twitter Web Client,Whitfield Announces Congressional Art Contest Winners: https://t.co/cR6zA95Kvk
731187505651961860,2016-05-13 18:21:00,RepEdWhitfield,3,0,Twitter Web Client,Proud to stand with fellow committee leaders in pressing the EPA on their defiance of the recent Supreme Court Stay: https://t.co/F5Tzx4mni8
730866797059178496,2016-05-12 21:06:37,RepEdWhitfield,0,0,Twitter Web Client,"VOTING ENDS TOMORROW: Make sure you cast your vote for the 2016 ""People's Choice"" Award by ""Liking"" Your Favorite: https://t.co/lfs0MUjcWx"
730427580239761408,2016-05-11 16:01:20,RepEdWhitfield,0,2,Twitter Web Client,Whitfield Offers Support for Areas Damaged in Yesterday’s Storms: https://t.co/rYlQByCczY
729786834927112192,2016-05-09 21:35:14,RepEdWhitfield,1,0,Twitter Web Client,Whitfield Seeks “People’s Choice” Winner for 2016 Congressional Art Competition on Facebook: https://t.co/YarpFy7A7C
728688165196795904,2016-05-06 20:49:31,RepEdWhitfield,5,2,Twitter Web Client,Don’t forget to #ShopSmall during #SmallBizWeek2016 and support the 28 million small businesses that fuel the U.S. https://t.co/5EApI8uH4Z
728324935471501315,2016-05-05 20:46:10,RepEdWhitfield,5,12,Twitter Web Client,"I join in observing #NationalDayofPrayer and ask everyone to pray for this country, not just today, but every day. https://t.co/SRaps9XSL0"
726164776712331264,2016-04-29 21:42:28,RepEdWhitfield,0,0,Twitter Web Client,Whitfield Examines Two Bills to Improve Nuclear Power Landscape: https://t.co/93PeN8HcxJ
726132897883783170,2016-04-29 19:35:48,RepEdWhitfield,2,2,Twitter Web Client,Good luck this weekend to Calloway County Middle School coaches and students participating in the National Science Bowl here in D.C.
725798141044338689,2016-04-28 21:25:36,RepEdWhitfield,0,0,Twitter Web Client,Whitfield Votes to Simplify Americans Ability to Save for Retirement: https://t.co/5oMnXFLHFY
725449292996055040,2016-04-27 22:19:24,RepEdWhitfield,0,0,Twitter Web Client,Whitfield Applauds Advancement of Energy &amp; Commerce Bills: https://t.co/4bc6xXy20H
724663870359523329,2016-04-25 18:18:24,RepEdWhitfield,1,0,Twitter Web Client,REMINDER: Today is the last day for high school artists to submit artwork for 2016 Congressional Art Competition: https://t.co/8oKx6MGYvP
724628110440828928,2016-04-25 15:56:19,RepEdWhitfield,1,2,Twitter Web Client,It was my honor to serve as Speaker Pro Tempore today for the U.S. House of Representatives.  Here is the video: https://t.co/V5XelnuIh7
723517177140228096,2016-04-22 14:21:51,RepEdWhitfield,1,0,Twitter Web Client,"Plans this weekend? As part of #NationalParksWeek, enjoy FREE Entry thru 4/24 to ALL parks.  #FindYourPark in KY at https://t.co/GSUVJxZOSx"
723224907069296641,2016-04-21 19:00:29,RepEdWhitfield,0,1,Twitter Web Client,Whitfield Votes In Support of Four Bills to Reform the IRS: https://t.co/chk401pDpn
721064151188180993,2016-04-15 19:54:25,RepEdWhitfield,0,1,Twitter Web Client,Whitfield Votes to Support Pro-Consumer Broadband Service: https://t.co/jTu37F5Pus
721063165522522112,2016-04-15 19:50:30,RepEdWhitfield,0,1,Twitter Web Client,"IN CASE YOU MISSED IT: Europe’s Green Mega-Flop: Hundreds Of Windmills Operating At A Loss, Facing Demolition: https://t.co/PTFn1dh1UJ"
720991624533303296,2016-04-15 15:06:13,RepEdWhitfield,0,0,Twitter Web Client,Whitfield Supports Two Bills Aimed at “Main Street” Regulatory Relief: https://t.co/Rm0B8CPnVN
720705483733131268,2016-04-14 20:09:12,RepEdWhitfield,0,0,Twitter Web Client,Whitfield Examines Bipartisan Ozone Bill: https://t.co/5Uzfbj21VB
719989445123051521,2016-04-12 20:43:55,RepEdWhitfield,0,0,Twitter Web Client,Attention High School Artists: LESS THAN 2 WEEKS LEFT to submit artwork for the 2016 Congressional Art Competition: https://t.co/8oKx6MGYvP
719620808910442496,2016-04-11 20:19:05,RepEdWhitfield,0,4,Twitter Web Client,Calloway Named County of the Month for April: https://t.co/ZSIPxJW5vG https://t.co/JX469fKM5A
716020299444125696,2016-04-01 21:51:57,RepEdWhitfield,0,0,Twitter Web Client,Whitfield Statement on Appointment of Board Members to Oversee Part E of EEOICPA: https://t.co/lHH0dJj1wt
712764453570396160,2016-03-23 22:14:22,RepEdWhitfield,4,3,Twitter Web Client,I am pleased to announce a $20k grant to Murray State University from the National Science Foundation: https://t.co/j03dVk3J51
712717022577180672,2016-03-23 19:05:54,RepEdWhitfield,5,15,Twitter Web Client,"In honor of #NationalPuppyDay, here’s a photo of Henry hard at work in my Washington, D.C., office! https://t.co/CzP2HlZQmr"
712703079787982848,2016-03-23 18:10:30,RepEdWhitfield,0,0,Twitter Web Client,Whitfield Votes to Modernize Mergers &amp; Acquisitions Process: https://t.co/HrEQ5jvVYt
712414625418092544,2016-03-22 23:04:17,RepEdWhitfield,2,2,Twitter Web Client,Whitfield Reviews EPA’s Budget; Presses EPA on Its Prioritizing of Regulations Over Jobs: https://t.co/sUeMTeSECW
712356375918190592,2016-03-22 19:12:49,RepEdWhitfield,1,3,Twitter Web Client,My thoughts and prayers are with the people of Brussels following this morning's terror attacks.
711978507388198912,2016-03-21 18:11:18,RepEdWhitfield,1,2,Twitter Web Client,Please join me today in commemorating World Down Syndrome Day.  #WDSD16 https://t.co/cpHczqRgH1
710565137028136960,2016-03-17 20:35:04,RepEdWhitfield,1,2,Twitter Web Client,Whitfield Stands with House in Challenging President Obama’s Executive Action on Immigration: https://t.co/AdcKoThkoJ
710213881394819072,2016-03-16 21:19:19,RepEdWhitfield,0,1,Twitter Web Client,Whitfield Votes to Ease Burden on Small-Business Broadband Providers: https://t.co/DXwNZIpdXr
710193780989763584,2016-03-16 19:59:26,RepEdWhitfield,0,0,Twitter Web Client,Whitfield’s Subcommittee Advances Pipeline Safety Bill to Full Committee: https://t.co/kOtuQDno7Y
709866951401668609,2016-03-15 22:20:44,RepEdWhitfield,2,3,Twitter Web Client,Whitfield Ushers Common-SENSE Solution to Coal Refuse: https://t.co/eukpkCxGAd
709522352783106048,2016-03-14 23:31:25,RepEdWhitfield,0,1,Twitter Web Client,I was pleased to learn that Murray State University will receive nearly $250k from the National Science Foundation: https://t.co/2GX9K22dza
709518732662542336,2016-03-14 23:17:02,RepEdWhitfield,0,1,Twitter Web Client,Whitfield Shepherds Six Pro-Energy Bills Through the House: https://t.co/bbAWwHcG7h
707631273959886849,2016-03-09 18:16:57,RepEdWhitfield,3,2,Twitter Web Client,"Congratulations to Madisonville North Hopkins senior, Archie Jungblom, of Hanson, on his appointment to WestPoint. I wish him great success!"
705849726273523716,2016-03-04 20:17:43,RepEdWhitfield,0,1,Twitter Web Client,Whitfield Receives Lifetime Achievement Award for Diabetes Advocacy: https://t.co/f5dcsMqVU6
705502149325750276,2016-03-03 21:16:34,RepEdWhitfield,0,2,Twitter Web Client,Whitfield Leads Charge in Protecting Brick Industry from Costly Regulations: https://t.co/VbD3Y3xSap
705164095587270657,2016-03-02 22:53:16,RepEdWhitfield,0,0,Twitter Web Client,Whitfield Votes to Strengthen Medicaid Program: https://t.co/6Aa88ziEbK
705157895617388545,2016-03-02 22:28:38,RepEdWhitfield,0,0,Twitter Web Client,Whitfield Questions Moniz on DOE Budget and Paducah Plant: https://t.co/VItrccZkeW
704816172173230081,2016-03-01 23:50:44,RepEdWhitfield,0,1,Twitter Web Client,Whitfield Examines Pipeline Safety Reauthorization: https://t.co/My8Gc9N78n
704764994324402176,2016-03-01 20:27:23,RepEdWhitfield,1,3,Twitter Web Client,Whitfield Meets with Child Nutrition Advocates: https://t.co/TEXLq9zgDo
704764111561826304,2016-03-01 20:23:52,RepEdWhitfield,0,1,Twitter Web Client,Caldwell Named County of the Month for March: https://t.co/LfAemeSI4W
704459339587784704,2016-03-01 00:12:49,RepEdWhitfield,0,2,Twitter Web Client,Whitfield Ushers Three Bipartisan Bills to Update Nation’s Energy Laws for the 21st Century: https://t.co/SAmZZ2vPjl
703000556349038593,2016-02-25 23:36:08,RepEdWhitfield,0,0,Twitter Web Client,Whitfield Votes to Advance American Energy: https://t.co/QErbpB2fqU
702610850926993410,2016-02-24 21:47:35,RepEdWhitfield,1,2,Twitter Web Client,Whitfield Recognized By Kentucky Broadcasters Association: https://t.co/FjwHHZbF0T
702237279461498881,2016-02-23 21:03:09,RepEdWhitfield,0,1,Twitter Web Client,Whitfield Reflects on Service to Agriculture Community During Kentucky Farm Bureau Breakfast: https://t.co/eCvzCoEVqe
702210387136090112,2016-02-23 19:16:17,RepEdWhitfield,0,0,Twitter Web Client,"Whitfield Leads 34 Senators, 171 Representatives in Filing Amicus Brief: https://t.co/c3YgPf0Lq5"
701885047729692672,2016-02-22 21:43:30,RepEdWhitfield,1,1,Twitter Web Client,Whitfield Statement In Tribute of Judge Hugh McCormick: https://t.co/JjDwz3F5Hf
699726820309127169,2016-02-16 22:47:28,RepEdWhitfield,1,2,Twitter Web Client,Whitfield: We Should Not Succumb to President’s Extreme Climate-Driven Policies: https://t.co/hgcAfQ2sfE
698232936383016961,2016-02-12 19:51:19,RepEdWhitfield,0,0,Twitter Web Client,Whitfield Votes for Common Sense Approach to Menu Labeling: https://t.co/X7LF8tnzrS
697919890359975937,2016-02-11 23:07:23,RepEdWhitfield,0,4,Twitter Web Client,Whitfield Votes to Strengthen Accountability &amp; Transparency in the Debt Limit Process: https://t.co/hH7oywtVXr
697915574198915073,2016-02-11 22:50:14,RepEdWhitfield,0,0,Twitter Web Client,Whitfield Advances 12 Bills to Full Committee: https://t.co/rjRW8pGfXj
697482241522429952,2016-02-10 18:08:19,RepEdWhitfield,1,1,Twitter Web Client,Whitfield Praises Supreme Court’s Stay of Clean Power Plan: https://t.co/3xGDkJZmp1
697474739711950848,2016-02-10 17:38:31,RepEdWhitfield,1,1,Twitter Web Client,"#SCOTUS stays Clean Power Plan, a victory for jobs and affordable energy! #WarOnCoal #CoalPowersKY"
697205667434774530,2016-02-09 23:49:19,RepEdWhitfield,0,0,Twitter Web Client,Whitfield Responds to President Obama’s Final Budget to Congress: https://t.co/ikBJDbOn5V
697187673702846470,2016-02-09 22:37:49,RepEdWhitfield,0,0,Twitter Web Client,Whitfield Announces 2016 Congressional Art Competition: https://t.co/8oKx6MGYvP
697093991095996416,2016-02-09 16:25:33,RepEdWhitfield,2,2,Twitter Web Client,I was delighted to hear Calloway County Middle School in Murray has advanced to the National Finals of the 2016 National Science Bowl!
696831088484814849,2016-02-08 23:00:52,RepEdWhitfield,0,1,Twitter Web Client,I was pleased to call and congratulate Melissa Ramkissoon earlier on her fully qualified offer of appointment by the U.S. Naval Academy.
695370769421901825,2016-02-04 22:18:05,RepEdWhitfield,0,0,Twitter Web Client,Whitfield Votes to Protect Law Abiding Businesses from Unfair Federal Scrutiny: https://t.co/iXKXVAOF09
695012621884465153,2016-02-03 22:34:56,RepEdWhitfield,0,0,Twitter Web Client,Whitfield Examines Two Bills to Counter EPA Overreach: https://t.co/ZM7jRITkzE
694665831771406336,2016-02-02 23:36:55,RepEdWhitfield,0,0,Twitter Web Client,Whitfield Votes for Greater Transparency in Iran Deal: https://t.co/2lDrSAd1uO
694665382871830532,2016-02-02 23:35:08,RepEdWhitfield,0,1,Twitter Web Client,Whitfield Continues the Fight to Repeal Obamacare: https://t.co/RxlmsubWPK
694656075698667520,2016-02-02 22:58:09,RepEdWhitfield,0,0,Twitter Web Client,Whitfield Examines Eight Energy Infrastructure Bills: https://t.co/ngoEjKPInv
694258171519602688,2016-02-01 20:37:01,RepEdWhitfield,0,0,Twitter Web Client,Whitfield Statement on the Passing of Mrs. Cecil Ferrell: https://t.co/718Tz6XeWl
694238561651027969,2016-02-01 19:19:06,RepEdWhitfield,2,1,Twitter Web Client,Please join me in honoring the accomplishments &amp; contributions of African Americans during Black History Month! https://t.co/AsdzdUUYnM
688039184058159105,2016-01-15 16:44:59,RepEdWhitfield,0,1,Twitter Web Client,Whitfield Responds to Administration’s Coal Plan: https://t.co/HyjOGfLehh
687723503949340674,2016-01-14 19:50:35,RepEdWhitfield,3,8,Twitter Web Client,#TBT #ThrowbackThursday to a marvelous afternoon at the Audubon State Park. A great place to make new friends! https://t.co/mTHq0dzu1m
687665023964065793,2016-01-14 15:58:12,RepEdWhitfield,1,1,Twitter Web Client,"#Obamacare is not working and continues to be defined by rising costs, fewer choices, lost coverage, and countless #brokenpromises."
687664853402664961,2016-01-14 15:57:31,RepEdWhitfield,1,1,Twitter Web Client,".@EPA's #ozone regs: bad #4jobs, manufacturing, &amp; economic growth. #WorstEver"
687664683319431168,2016-01-14 15:56:51,RepEdWhitfield,0,1,Twitter Web Client,.@EPA's onerous #ozone regs = the #worstever.
687664596031782913,2016-01-14 15:56:30,RepEdWhitfield,0,1,Twitter Web Client,.@POTUS' #CapAndTrade scheme hurts consumers while doing little to improve the environment.
687377974535057409,2016-01-13 20:57:34,RepEdWhitfield,0,3,Twitter Web Client,Whitfield Fights to Protect Kentucky Farmers from Federal Overreach: https://t.co/cl4VK3RB0X
687032508811206656,2016-01-12 22:04:49,RepEdWhitfield,0,0,Twitter Web Client,Whitfield Votes in Support of STREAM Act: https://t.co/EkNPhS9UPS
685227340725661696,2016-01-07 22:31:43,RepEdWhitfield,0,0,Twitter Web Client,Whitfield Votes to Shine Light on President Obama’s Burdensome Regulatory Overreach: https://t.co/S52P2Niaf5
684871519802122244,2016-01-06 22:57:49,RepEdWhitfield,1,2,Twitter Web Client,Whitfield Votes to Send Obamacare Repeal Bill to the President’s Desk: https://t.co/8orULGafnV
684434901995765760,2016-01-05 18:02:51,RepEdWhitfield,3,1,Twitter Web Client,Whitfield Statement on @POTUS' Violation of Second Amendment Rights: https://t.co/SlDmMjkJ2e
677571930531241985,2015-12-17 19:31:51,RepEdWhitfield,1,2,Twitter Web Client,Whitfield Votes to Protect Americans from Tax Increases: https://t.co/19k845GWE6
677569499508420608,2015-12-17 19:22:11,RepEdWhitfield,0,1,Twitter Web Client,"Whitfield Congratulates @USAirForce Academy Appointee, Irish Manalang: https://t.co/5WIOJ9z3Ny"
676801183068135425,2015-12-15 16:29:11,RepEdWhitfield,5,5,Twitter Web Client,Today we celebrate the Bill of Rights as we remember the freedoms which this country was founded upon. https://t.co/ob6H9RqCMO
675403373018030080,2015-12-11 19:54:47,RepEdWhitfield,1,1,Twitter Web Client,Whitfield Votes in Support of Trade and Economic Security: https://t.co/huh6jPrHRN
674611164777721856,2015-12-09 15:26:50,RepEdWhitfield,1,0,Twitter Web Client,"Whitfield and @RepDianaDeGette Announce
  @RepTomReed as new Co-Chair of Diabetes Caucus: 
  https://t.co/aenutflYM2"
673888438857375744,2015-12-07 15:34:58,RepEdWhitfield,11,15,Twitter Web Client,"Today, we remember the attack on #PearlHarbor, 74 years ago, and all who were lost on the day that lives in infamy. https://t.co/Q2dGnjWD7y"
672527232229855232,2015-12-03 21:26:01,RepEdWhitfield,2,2,Twitter Web Client,Whitfield Votes in Support of Long-Term Highway Authorization: https://t.co/RBixa8o5Jb
672460272536297472,2015-12-03 16:59:57,RepEdWhitfield,2,2,Twitter Web Client,.@uscapitol Christmas Tree Lighting Ceremony Held: https://t.co/x54N7LOUVg https://t.co/a1fTQjhAxr
671828290236190720,2015-12-01 23:08:41,RepEdWhitfield,1,1,Twitter Web Client,Whitfield Examines Energy Regulator’s Role in Evolving Markets: https://t.co/kmWc0U5AG9
671819033407262721,2015-12-01 22:31:54,RepEdWhitfield,4,3,Twitter Web Client,Whitfield Applauds Passage of Resolutions to Keep Electricity Affordable and Reliable: https://t.co/YZcoiPJ51F
671741589136539648,2015-12-01 17:24:09,RepEdWhitfield,7,6,Twitter Web Client,We need to update energy laws that are stuck in the 70s. RT if you think it's time to maximize our energy potential! https://t.co/Ar5FZxXasE
671741153532858368,2015-12-01 17:22:26,RepEdWhitfield,2,1,Twitter Web Client,.@EPA's #capandtrade = fewer jobs in the First District of Kentucky!
