id,created_at,user,retweets,favorite_count,source,text
611635863991283712,2015-06-18 20:45:28,RepEdWhitfield,2,3,Twitter Web Client,Whitfield Welcomes Hopkinsville Resident for Summer Internship: http://t.co/XnkMu9JGez
611635504086405120,2015-06-18 20:44:02,RepEdWhitfield,0,0,Twitter Web Client,Whitfield Welcomes Hampden-Sydney Student for Summer Internship: http://t.co/NtNeDo5X90
611620206297919488,2015-06-18 19:43:15,RepEdWhitfield,0,0,Twitter Web Client,"Whitfield Votes to Promote Free Trade, Increase Transparency and Accountability During Negotiations: http://t.co/eDnTomHAPR"
611619757075374080,2015-06-18 19:41:28,RepEdWhitfield,0,0,Twitter Web Client,Whitfield Votes to Provide Relief from Obamacare: http://t.co/bcCN1DKmRo
611619206870777857,2015-06-18 19:39:16,RepEdWhitfield,0,0,Twitter Web Client,Whitfield Speaks to Kentucky Electric Cooperative Student Assembly: http://t.co/IBIrUauZ61
611242199737606146,2015-06-17 18:41:11,RepEdWhitfield,0,0,Twitter Web Client,Whitfield Continues Oversight of EPA’s Controversial Ozone Rule and its Effect on Jobs &amp; Manufacturing: http://t.co/zmtzPTRd1v
611176519558373376,2015-06-17 14:20:12,RepEdWhitfield,1,2,Twitter Web Client,I will continue working to bring to light the very real economic consequences @EPA regs could have on families across America.
610880185538322437,2015-06-16 18:42:40,RepEdWhitfield,0,1,Twitter Web Client,@EPA's #Ozone Rule could be the most expensive in history. Our fragile economic recovery shouldn’t be jeopardized by a new regulation.
610827354844307457,2015-06-16 15:12:44,RepEdWhitfield,0,0,Twitter Web Client,"@EPA’s own data shows ozone concentrations have declined over 30% since 1980, but new regulations could be more burdensome for families."
610827267820888064,2015-06-16 15:12:23,RepEdWhitfield,3,1,Twitter Web Client,What could @EPA's new #Ozone rule cost our families &amp; businesses in Kentucky? Click to find out. http://t.co/NAskAKFMRb
610476539378053121,2015-06-15 15:58:43,RepEdWhitfield,2,0,Twitter Web Client,House Republicans' health care plan puts patients first. @HouseCommerce http://t.co/Cbnx238xGm
609466650769903618,2015-06-12 21:05:47,RepEdWhitfield,2,1,Twitter Web Client,Whitfield Examines What Could Be EPA’s Costliest Regulation On The American People Yet: http://t.co/EMQhcGLLSE
609374236315123712,2015-06-12 14:58:34,RepEdWhitfield,0,0,Twitter Web Client,Whitfield Votes to Support Our Troops and “Provide for the Common Defense”: http://t.co/S1fTMHXZHi
609370868880408578,2015-06-12 14:45:11,RepEdWhitfield,2,0,Twitter Web Client,RT @HouseCommerce: ALERT: We will be featuring #SubEnergyPower Chairman @RepEdWhitfield's opening statement via #Periscope we'll be underwa…
608990048898400256,2015-06-11 13:31:56,RepEdWhitfield,0,0,Twitter Web Client,Whitfield Votes to Provide Regulatory Relief and Prevent Retaliation Against American Exporters: http://t.co/lCMonaR4Gu
608702578818453505,2015-06-10 18:29:38,RepEdWhitfield,0,1,Twitter Web Client,Whitfield Supports Responsible Federal Funding for Transportation and Housing: http://t.co/mBrJDQvMAW
608340962214068226,2015-06-09 18:32:42,RepEdWhitfield,0,0,Twitter Web Client,"Congrats to @MurayStateUniv on receiving a federal HHS grant for Nurse Anesthetist Traineeships in the amount of $28,467!"
608025748864180224,2015-06-08 21:40:09,RepEdWhitfield,2,1,Twitter Web Client,Happy 90th Birthday Barbara Bush! http://t.co/mmpeZWPDnK
607964173067264000,2015-06-08 17:35:28,RepEdWhitfield,0,0,Twitter Web Client,Whitfield Meets with American Heroes: http://t.co/I66jfRHVxQ http://t.co/qSqTd8bybT
606551409190801408,2015-06-04 20:01:39,RepEdWhitfield,0,0,Twitter Web Client,Whitfield Congratulates Muhlenberg Job Corps Center on Gold Star Award: http://t.co/OFke2SaWaL
606549199258161153,2015-06-04 19:52:52,RepEdWhitfield,7,4,Twitter Web Client,"@SenateMajLdr, @RandPaul and @RepEdWhitfield Press Energy Secretary Moniz on Paducah DOE Site: http://t.co/e8ggd7TFhG http://t.co/r3js3Vcs92"
606530669674696705,2015-06-04 18:39:15,RepEdWhitfield,7,0,Twitter Web Client,"RT @McConnellPress: .@SenateMajLdr McConnell, @RandPaul &amp; @RepEdWhitfield  meeting w/ DOE Secretary @ErnestMoniz now to discuss future of P…"
606479603113324544,2015-06-04 15:16:19,RepEdWhitfield,1,0,Twitter Web Client,Congrats to @AuburnKentucky on receiving a $300K @USDARD grant and $700K loan toward the new $85 million Champion Pet Foods plant!
606162906783334401,2015-06-03 18:17:53,RepEdWhitfield,1,1,Twitter Web Client,Whitfield Holds Hearing to Discuss QER with Secretary of Energy @ErnestMoniz: http://t.co/id45DuF5xg
606132137117523968,2015-06-03 16:15:37,RepEdWhitfield,0,0,Twitter Web Client,Whitfield Announces More than $2 Million in Grants for Area Airports:  http://t.co/jCYDUSgDR4
605489438613995520,2015-06-01 21:41:46,RepEdWhitfield,0,1,Twitter Web Client,Webster County Named County of the Month for June:  http://t.co/wqjGfkoYSY
605418337103945729,2015-06-01 16:59:14,RepEdWhitfield,2,4,Twitter Web Client,"Happy 223rd Birthday to the great Commonwealth of Kentucky!  On this day in 1792, Kentucky became the 15th state to join the Union."
604393743446380544,2015-05-29 21:07:52,RepEdWhitfield,0,0,Twitter Web Client,Whitfield Announces Congressional Art Contest Winners: http://t.co/DadnjWwHxt
601835253456580608,2015-05-22 19:41:20,RepEdWhitfield,0,0,Twitter Web Client,Whitfield Advances 21st Century Cures Initiative: http://t.co/AB8ILc46n3 http://t.co/lS71dnt0hn
601829772168134656,2015-05-22 19:19:33,RepEdWhitfield,0,0,Twitter Web Client,Whitfield Statement on Memorial Day: http://t.co/db9Ahpi981
601491959518232579,2015-05-21 20:57:12,RepEdWhitfield,1,0,Twitter Web Client,Whitfield Meets with Home Health Advocates: http://t.co/iL6D7Fbbut http://t.co/NwtZpJ725C
601441564888408065,2015-05-21 17:36:57,RepEdWhitfield,0,1,Twitter Web Client,"Congratulations to the Kentucky Transportation Cabinet on receiving a Federal grant in the amount of $3,000,000 from the @USDOT !"
601421957591085058,2015-05-21 16:19:03,RepEdWhitfield,0,0,Twitter Web Client,Whitfield Votes to Support America’s Entrepreneurs &amp; Rein in Obama’s Wasteful Climate Change &amp; Green Energy Programs: http://t.co/NCEmnR1kOK
601141203665612800,2015-05-20 21:43:26,RepEdWhitfield,1,2,Twitter Web Client,Whitfield Takes Part in @the_USO Service Project: http://t.co/qhNOsjk2t8 http://t.co/MqvA7UvpAn
601110908249776128,2015-05-20 19:43:03,RepEdWhitfield,0,0,Twitter Web Client,Whitfield Meets with Kentucky Ambulance Providers: http://t.co/sMgl6DxTLo http://t.co/8bRByGXPCW
601110735121457152,2015-05-20 19:42:22,RepEdWhitfield,0,0,Twitter Web Client,Whitfield Meets with Mental Health Advocates from Kentucky: http://t.co/3dBd5fQkCD http://t.co/Rg4IxJNITp
601090962228641795,2015-05-20 18:23:47,RepEdWhitfield,18,13,Twitter Web Client,Connect with #veterans this #MemorialDay &amp; collect histories for @LibraryCongress. http://t.co/OxBQqPBRsa http://t.co/6Abtl97OtP
600772584247025664,2015-05-19 21:18:40,RepEdWhitfield,0,0,Twitter Web Client,Whitfield Continues Work to Keep Electricity Reliable and Affordable: http://t.co/2yKbOBwEZi
600724188182257666,2015-05-19 18:06:22,RepEdWhitfield,1,4,Twitter Web Client,Help @LibraryCongress honor #veterans this #MemorialDay by contributing histories to http://t.co/OxBQqPBRsa. http://t.co/bkK3fFNCfU
600700998118694912,2015-05-19 16:34:13,RepEdWhitfield,2,0,Twitter Web Client,"RT @HouseCommerce: ""This commonsense legislation takes important steps toward a brighter and more secure global energy future.”- @RepFredUp…"
600694006520098816,2015-05-19 16:06:26,RepEdWhitfield,15,15,Twitter Web Client,Honor #veterans on #MemorialDay by saving histories with @LibraryCongress &amp; #LOCVets. http://t.co/OxBQqPBRsa http://t.co/ozopISUywW
600303436362547200,2015-05-18 14:14:26,RepEdWhitfield,3,1,Twitter Web Client,Today we celebrate 50 Years of Opportunity and renew our commitment to our children! Happy Anniversary Head Start! #HeadStart50
599268654681825280,2015-05-15 17:42:35,RepEdWhitfield,0,1,Twitter Web Client,Whitfield Casts Votes to Strengthen National Security and Military Readiness: http://t.co/h28nw0nrXM
599268543125987329,2015-05-15 17:42:09,RepEdWhitfield,0,0,Twitter Web Client,Whitfield Meets with Delta Regional Authority: http://t.co/eEZcmK7A8R http://t.co/MD9HIAy7jU
598609217864491008,2015-05-13 22:02:13,RepEdWhitfield,0,0,Twitter Web Client,Whitfield Votes to Protect Our Unborn Children: http://t.co/7ElPolXQot
598590079431483394,2015-05-13 20:46:10,RepEdWhitfield,0,0,Twitter Web Client,Whitfield Meets with American Pharmacy Services Corporation: http://t.co/Q1bWqFikKp
598578577202880512,2015-05-13 20:00:28,RepEdWhitfield,0,0,Twitter Web Client,Whitfield Addresses @kyrealtors : http://t.co/KV4rq1TFLC
598576429643735041,2015-05-13 19:51:56,RepEdWhitfield,0,0,Twitter Web Client,Whitfield Continues to Promote Energy Abundance: http://t.co/WiQUf61rH5
598272219270217728,2015-05-12 23:43:07,RepEdWhitfield,1,1,Twitter Web Client,Whitfield Votes to Protect U.S. Waters Whitfield Votes from Federal Overreach: http://t.co/F4nOHb21kK
598246676126629888,2015-05-12 22:01:37,RepEdWhitfield,2,0,Twitter Web Client,"Congrats to the Princeton-Caldwell Co. Airport Board on receiving a federal grant from the @USDOT in the amount of $612,792.00!"
598246459193044992,2015-05-12 22:00:45,RepEdWhitfield,1,1,Twitter Web Client,"Congrats to the Union Co. Airport Board in Sturgis on receiving a federal grant from the @USDOT in the amount of $115,200.00!"
598212298688323584,2015-05-12 19:45:00,RepEdWhitfield,0,0,Twitter Web Client,#Spring has sprung! Contact my office at 202-225-3115 to schedule a Capitol tour. http://t.co/3oXmWSHCVq
597877797118443520,2015-05-11 21:35:49,RepEdWhitfield,4,3,Twitter Web Client,"Obama has become so divisive and ineffective, that he is not respected or taken seriously on the world stage: http://t.co/zJAHybv8RL"
596368577458008065,2015-05-07 17:38:43,RepEdWhitfield,7,2,Twitter Web Client,This week is National Teacher Appreciation Week. I hope everyone will call and #thankateacher! http://t.co/7GlhXE8tO8
596322320270131202,2015-05-07 14:34:54,RepEdWhitfield,8,0,Twitter Web Client,Take a moment today to #sayaprayer for our country on #NationalPrayerDay! http://t.co/fzQjjJoyaa
596040679404478464,2015-05-06 19:55:46,RepEdWhitfield,5,5,Twitter Web Client,Happy National #NursesDay and #NursesWeek! http://t.co/hYcIXOOd4D
595603278475468800,2015-05-05 14:57:42,RepEdWhitfield,0,0,Twitter Web Client,Whitfield Displays 2015 Congressional Art Competition Entries on Facebook: http://t.co/Eba8yW0kDV
594221150592434176,2015-05-01 19:25:37,RepEdWhitfield,0,1,Twitter Web Client,5 things you need to know about our Military and Veteran Appropriations bill: http://t.co/gXN2QXgouY
594220497988132865,2015-05-01 19:23:01,RepEdWhitfield,1,3,Twitter Web Client,We've passed a #BalancedBudget http://t.co/ayOxT1HC9A
594220055208042496,2015-05-01 19:21:15,RepEdWhitfield,0,0,Twitter Web Client,Driving toward energy independence: http://t.co/BG6PUw4Z4i
594169513349898240,2015-05-01 16:00:25,RepEdWhitfield,0,0,Twitter Web Client,@PaducahSunNews @RepEdWhitfield Secures Over $257 Million for Cont'd Cleanup of Paducah DOE Site in House Approps: http://t.co/GzaA1e12Z4
594168960674865153,2015-05-01 15:58:14,RepEdWhitfield,0,0,Twitter Web Client,Whitfield Secures Over $257 Million for Continued Cleanup of #Paducah DOE Site in House #Appropriations Bill: http://t.co/GzaA1e12Z4
594163596466245632,2015-05-01 15:36:55,RepEdWhitfield,0,1,Twitter Web Client,@RepEdWhitfield Congratulates Master Dinh on Sit-Up Accomplishment: http://t.co/1yJySGiqNz http://t.co/vJTZgZBbj7
593902648522309632,2015-04-30 22:20:00,RepEdWhitfield,2,1,Twitter Web Client,Whitfield Reaffirms Commitment for a Balanced Federal Budget: http://t.co/qUMp6BzO6H
593824000599527424,2015-04-30 17:07:29,RepEdWhitfield,3,7,Twitter Web Client,#ThisDayInHistory George Washington was sworn in as the first President of the United States. http://t.co/4Y5vi8G8LY
593548560664256512,2015-04-29 22:52:59,RepEdWhitfield,0,1,Twitter Web Client,Whitfield Meets with Independent Community Bankers of America: http://t.co/bGyL4WIlsG
593532353537921024,2015-04-29 21:48:35,RepEdWhitfield,0,0,Twitter Web Client,Whitfield’s Ratepayer Protection Act Advances through Committee: http://t.co/xj3nCTHX4z
591628794496188417,2015-04-24 15:44:31,RepEdWhitfield,0,1,Twitter Web Client,Whitfield Meets with Job Corps Officials and Attends Golden Anniversary Gala in Washington: http://t.co/L5Mu7rGa7w
591344717041967104,2015-04-23 20:55:41,RepEdWhitfield,0,0,Twitter Web Client,Whitfield Works to Bridge the Gap for Jobs: http://t.co/8aceWwGuJc
591318271095365633,2015-04-23 19:10:36,RepEdWhitfield,0,1,Twitter Web Client,Whitfield Votes to Protect Kentuckians from Cyber Threats: http://t.co/PTf3IYsHld
591273204754345985,2015-04-23 16:11:31,RepEdWhitfield,5,9,Twitter Web Client,Happy 107th birthday to the @USArmyReserve today! #ArmyReserve107
591233488772268032,2015-04-23 13:33:42,RepEdWhitfield,2,0,Twitter Web Client,#MyElectricBill https://t.co/Znk8oNALew
590955749574082560,2015-04-22 19:10:04,RepEdWhitfield,2,0,Twitter Web Client,"Whitfield Advances Legislation to Protect Ratepayers, Keep the Lights On: http://t.co/8lXYJ3gqh9"
590946433777463297,2015-04-22 18:33:03,RepEdWhitfield,0,0,Twitter Web Client,"Congrats to the Christian Co Water District on receiving a federal water and waste disposal grant in the amount of $700,000 from the USDA!"
590946095724949504,2015-04-22 18:31:43,RepEdWhitfield,1,0,Twitter Web Client,"Whitfield Announces Nearly $263,000 Grant for Murray Fire Department: http://t.co/zd5xdWrPRz"
590617115213885443,2015-04-21 20:44:28,RepEdWhitfield,0,1,Twitter Web Client,Whitfield Leads Charge in the House of Representatives to send Bipartisan Energy Efficiency Bill to the President: http://t.co/Wns3qtGvOs
590609704952422400,2015-04-21 20:15:01,RepEdWhitfield,0,0,Twitter Web Client,"Following QER’s Findings, Committee Leaders Want to Work Together to Modernize U.S. #Energy Policy: http://t.co/iC0PcuGgG2"
588778241827151872,2015-04-16 18:57:26,RepEdWhitfield,0,1,Twitter Web Client,#Spring has sprung! http://t.co/PT1VvPlOYD
588771820117094400,2015-04-16 18:31:55,RepEdWhitfield,1,1,Twitter Web Client,Court Challenges Signal Need for Whitfield’s Ratepayer Protection Act: http://t.co/twxgvevfnL
588453853315477504,2015-04-15 21:28:26,RepEdWhitfield,3,0,Twitter Web Client,Whitfield Meets with Kentucky Beverage Association: http://t.co/g2zDxh5Jb8
588451689755086849,2015-04-15 21:19:50,RepEdWhitfield,0,0,Twitter Web Client,Whitfield Meets with Developmental Disabilities Advocates: http://t.co/D37TxrYgrW
588449695506108416,2015-04-15 21:11:54,RepEdWhitfield,0,2,Twitter Web Client,Whitfield Meets with Christian County Chamber: http://t.co/4DlnubKN9U http://t.co/VUqrJvIlUr
588437203535048706,2015-04-15 20:22:16,RepEdWhitfield,4,3,Twitter Web Client,"150 years ago today, the world lost a great man. #AbrahamLincoln. http://t.co/lzpClg03Vd"
588435826595401728,2015-04-15 20:16:48,RepEdWhitfield,0,0,Twitter Web Client,Whitfield’s Legislation to Improve Energy Efficiency and Provide Regulatory Relief Clears Committee: http://t.co/u24VvlAYZF
588382845514612736,2015-04-15 16:46:16,RepEdWhitfield,0,2,Twitter Web Client,Nothing is certain in life but death and #taxes. We're making one of those better (taxes): http://t.co/LMVHzZvhhc
588343061895340032,2015-04-15 14:08:11,RepEdWhitfield,1,1,Twitter Web Client,Whitfield Meets with Kentucky Bar Association: http://t.co/AMai3JwcT7
588110795298463746,2015-04-14 22:45:14,RepEdWhitfield,0,0,Twitter Web Client,Whitfield Works to Secure Home Ownership for Kentuckians: http://t.co/TGwDu9XLbJ
588104699070566402,2015-04-14 22:21:01,RepEdWhitfield,0,0,Twitter Web Client,Whitfield’s Subcommittee Reviews Legislation to Protect Ratepayers from EPA’s Overreach: http://t.co/GyEJwqHJv3
588085347713703936,2015-04-14 21:04:07,RepEdWhitfield,1,0,Twitter Web Client,Whitfield Meets with American Optometric Association: http://t.co/YfWo1e5CxI
587671207622930432,2015-04-13 17:38:28,RepEdWhitfield,2,3,Twitter Web Client,"Today we celebrate one of America's founding fathers. Happy Birthday, TJ! http://t.co/E7NB8YysBN"
583726507215978497,2015-04-02 20:23:39,RepEdWhitfield,1,1,Twitter Web Client,"Congressman Ed Whitfield’s Public Schedule for Monday, April 6th: http://t.co/eoklZdTB4Z"
583377396432314369,2015-04-01 21:16:24,RepEdWhitfield,8,0,Twitter Web Client,"RT @HouseCommerce: .@RepEdWhitfield questions @EPA on new regs that could hurt manufacturers, restaurants, &amp; small businesses --&gt;  http://t…"
583367181552852992,2015-04-01 20:35:49,RepEdWhitfield,1,1,Twitter Web Client,"Whitfield Questions @EPA Over Costly, Counterproductive Refrigerant Rule: http://t.co/ZYkGSAGj5u"
583336209566601216,2015-04-01 18:32:44,RepEdWhitfield,0,0,Twitter Web Client,Whitfield Meets with Fort Campbell Students: http://t.co/bLJz4FXT4W http://t.co/PP1rb1Nb0F
583329136481083392,2015-04-01 18:04:38,RepEdWhitfield,2,9,Twitter Web Client,Congratulations to all of those in Kentucky who work to further college and career readiness in our state! @ACT #actreadiness
583329068151640064,2015-04-01 18:04:22,RepEdWhitfield,1,2,Twitter Web Client,Proud to recognize Kendra Gayle Silvano and Madisonville Community College for winning @ACT College and Career Readiness awards today!
583266603070046208,2015-04-01 13:56:09,RepEdWhitfield,2,1,Twitter Web Client,Union County Named County of the Month for April: http://t.co/HJ2lUq79o9 http://t.co/ZImioxZQ0r
582983403009646594,2015-03-31 19:10:49,RepEdWhitfield,0,1,Twitter Web Client,"On this day in #history, March 31, 1918, the first daylight savings time in the U.S. went into effect. http://t.co/CavnmaazEg"
582980364139937793,2015-03-31 18:58:44,RepEdWhitfield,3,0,Twitter Web Client,Whitfield and @RepDianaDeGette Introduce Legislation to Improve the Lives of Diabetics http://t.co/wXfiV914Kx
582904012296572929,2015-03-31 13:55:21,RepEdWhitfield,5,0,Twitter Web Client,RT @HouseCommerce: .@RepEdWhitfield last week unveiled the Ratepayer Protection Act to help keep the lights on &amp; prices affordable. http://…
581172672635224064,2015-03-26 19:15:37,RepEdWhitfield,3,2,Twitter Web Client,Whitfield Works to Secure Quality Medical Care for Western Kentucky: http://t.co/gvZyH0HDoW
581109567498678272,2015-03-26 15:04:52,RepEdWhitfield,1,0,Twitter Web Client,"Whitfield, Kennedy, Bucshon, and Pallone Introduce Legislation to Combat Prescription Drug Abuse: http://t.co/1Bn1Cv8ikb"
581108970150105088,2015-03-26 15:02:29,RepEdWhitfield,2,1,Twitter Web Client,Whitfield Joins in Introducing Safe and Accurate Food Labeling Act: http://t.co/GfQftAdRck
581108781507088385,2015-03-26 15:01:44,RepEdWhitfield,2,0,Twitter Web Client,Whitfield Votes for Balanced Budget to Build a Stable and Secure Economic Future: http://t.co/teDCS6dmvl
580739988796641280,2015-03-25 14:36:17,RepEdWhitfield,7,5,Twitter Web Client,Save #Grandma. Save #Medicare. http://t.co/6T6Dl78wLK
580735717367816192,2015-03-25 14:19:19,RepEdWhitfield,0,0,Twitter Web Client,Whitfield Meets with Lincoln Trail Area Development District: http://t.co/4Os47vEjwe
580734867274612737,2015-03-25 14:15:56,RepEdWhitfield,1,0,Twitter Web Client,Whitfield Meets with Lake Cumberland Area Development District: http://t.co/H3gpWzrvs0
580734181459800065,2015-03-25 14:13:13,RepEdWhitfield,1,0,Twitter Web Client,Whitfield Meets with Pennyrile Area Development District: http://t.co/vRcEhFXHEY
580730578116468736,2015-03-25 13:58:53,RepEdWhitfield,0,0,Twitter Web Client,"Remember Amelia Earhart,""1st Lady of the Air,"" who paved the way 4 women aviators-see her handprint @LibraryCongress http://t.co/t2kj0uTVrp"
580730247613669376,2015-03-25 13:57:35,RepEdWhitfield,0,0,Twitter Web Client,Every month is #WomensHistoryMonth when you explore @LibraryCongress collections at http://t.co/DPTv4ZLz5z!
580478457601253376,2015-03-24 21:17:03,RepEdWhitfield,8,6,Twitter Web Client,"On this day in #history, March 24, 1958, #Elvis Presley was drafted in the U.S. Army. @Cilla_Presley http://t.co/GdfFqLUNL3"
580471393856446464,2015-03-24 20:48:59,RepEdWhitfield,1,1,Twitter Web Client,Great article in @thehill on the Ratepayer Protection Act I unveiled to address @BarackObama's Overreaching PP Rule : http://t.co/lxlfvH68uo
580450938529386496,2015-03-24 19:27:42,RepEdWhitfield,1,1,Twitter Web Client,"#BrokenPromises, @BarackObama, BrokenPromises http://t.co/mTlQX6s8YW"
580443622501453825,2015-03-24 18:58:38,RepEdWhitfield,0,0,Twitter Web Client,Whitfield Meets with Kentucky Association for Gifted Education: http://t.co/LRUPPc2vvb http://t.co/vDupsQHPsU
580442728871391232,2015-03-24 18:55:05,RepEdWhitfield,0,0,Twitter Web Client,Whitfield Meets with Health Information Advocate: http://t.co/iv9CBDJUPl http://t.co/9nh3wsRjFU
580383242534141952,2015-03-24 14:58:42,RepEdWhitfield,12,0,Twitter Web Client,RT @HouseCommerce: Bipartisan Committee leaders post #SGR package that strengthens Medicare for seniors. House to vote this week: http://t.…
580363196554473472,2015-03-24 13:39:03,RepEdWhitfield,0,0,Twitter Web Client,Whitfield Meets with YMCA College Student Advocates: http://t.co/lrD4aqMBk6
580362470495223808,2015-03-24 13:36:10,RepEdWhitfield,0,0,Twitter Web Client,Whitfield Meets with Kentucky Rehabilitation Association: http://t.co/lrD4aqMBk6
580112344216416257,2015-03-23 21:02:15,RepEdWhitfield,1,0,Twitter Web Client,"RT @HouseCommerce: ""My commonsense legislation will protect states &amp; their citizens from @EPA's damaging overreach"" - #SubEnergyPower Chmn …"
580109985528565760,2015-03-23 20:52:53,RepEdWhitfield,0,0,Twitter Web Client,Whitfield Unveils Ratepayer Protection Act to Address EPA’s Overreaching Power Plant Rule: http://t.co/IjRAVGF9Rv
580065012674347009,2015-03-23 17:54:10,RepEdWhitfield,1,0,Twitter Web Client,"""Failure is impossible."" - Susan B. Anthony http://t.co/F91QlEmu7z"
580011885887623168,2015-03-23 14:23:04,RepEdWhitfield,16,0,Twitter Web Client,"RT @HouseCommerce: .@LATimes: #SGR package ""rare example of a truly bipartisan effort to improve Medicare…can't afford to pass it up” http:…"
580004236169244672,2015-03-23 13:52:40,RepEdWhitfield,1,1,Twitter Web Client,"A new season, a new drive. What issue do you want to see us tackle next? http://t.co/zmBOfCGEzJ"
579995488432349184,2015-03-23 13:17:54,RepEdWhitfield,0,2,Twitter Web Client,"On this day in #history, March 23, 1775, Patrick Henry delivered his speech – ""Give me Liberty, or give me Death!"" http://t.co/9Lfy84OAtu"
578584118344183808,2015-03-19 15:49:38,RepEdWhitfield,1,2,Twitter Web Client,Congrats to @universityofky on receiving a $2.5 million grant from the USDA to establish a National Rural Child Poverty Nutrition Center!
578287797779456002,2015-03-18 20:12:09,RepEdWhitfield,43,0,Twitter Web Client,"RT @HouseGOP: Most transparent administration in history?

Obama administration sets record for withholding gov't files. http://t.co/GfNcCR…"
578287770046767106,2015-03-18 20:12:03,RepEdWhitfield,30,0,Twitter Web Client,"RT @HouseGOP: Our budget proposal...

✓ Balances in less than 10 years
✓ Repeals ObamaCare 
✓ Prioritizes defense spending

http://t.co/Hh5…"
578287633824108545,2015-03-18 20:11:30,RepEdWhitfield,0,0,Twitter Web Client,Whitfield Meets with TRIO Advocates:http://t.co/LQzrhobA0O
578260585617440768,2015-03-18 18:24:01,RepEdWhitfield,0,1,Twitter Web Client,"Our budget calls for a fairer, simpler tax code. #BetterBudget http://t.co/de0U3DxiXl"
578235038929723392,2015-03-18 16:42:31,RepEdWhitfield,2,3,Twitter Web Client,Happy #AgDay to our farmers! Thanks for filling our plates with American goodness. http://t.co/0mo8hOEBPk
577951382910697472,2015-03-17 21:55:22,RepEdWhitfield,0,1,Twitter Web Client,Whitfield Meets with Kentucky Soybean Association: http://t.co/s0iErtSVG9
577946677656580097,2015-03-17 21:36:40,RepEdWhitfield,2,0,Twitter Web Client,Whitfield Continues Oversight of EPA’s “Power Grab” with Review of Legal and Cost Issues: http://t.co/Q8qZL23HTr
577937888744206336,2015-03-17 21:01:44,RepEdWhitfield,1,0,Twitter Web Client,"RT @HouseCommerce: ""Whether or not the Clean Power Plan is bad law, it certainly is bad policy,"" - @RepEdWhitfield"
577928103714021377,2015-03-17 20:22:51,RepEdWhitfield,0,1,Twitter Web Client,Today I joined @RepReneeEllmers in introducing The Fairness for Farmers Act of 2015: http://t.co/SNX6ah7Jmd
577868851372650496,2015-03-17 16:27:25,RepEdWhitfield,9,0,Twitter Web Client,"RT @HouseCommerce: ""Burning the Constitution of the United States… cannot be part of our national energy policy"" - Laurence Tribe"
577868796305670144,2015-03-17 16:27:11,RepEdWhitfield,79,0,Twitter Web Client,RT @HouseCommerce: VIDEO: Obama’s Harvard Law prof likens @EPA’s clean power plan to “Burning the Constitution” http://t.co/oSC1CvyNi1 http…
577819303564677121,2015-03-17 13:10:31,RepEdWhitfield,2,4,Twitter Web Client,Happy St. Patrick's Day everyone! http://t.co/Eg2XzzPZ7g
577567229602107393,2015-03-16 20:28:52,RepEdWhitfield,0,1,Twitter Web Client,"Whitfield Congratulates U.S. Air Force Academy Appointee, Andrew Burman: http://t.co/wCRANQH86V"
577567129379160064,2015-03-16 20:28:28,RepEdWhitfield,0,1,Twitter Web Client,"Whitfield Congratulates U.S. Air Force Academy Appointee, Stephen Daniel Steiner: http://t.co/N0j3qiMOYu"
577567028736843776,2015-03-16 20:28:04,RepEdWhitfield,0,1,Twitter Web Client,"Whitfield Congratulates U.S. Air Force Academy Appointee, Cassandra Bell: http://t.co/j6ZgtpI6B9"
576395578491449344,2015-03-13 14:53:09,RepEdWhitfield,0,0,Twitter Web Client,"MEDIA ADVISORY: Congressman Ed Whitfield’s Public Schedule for Saturday, March 14th: http://t.co/8unlxtCQYb"
