id,created_at,user,retweets,favorite_count,source,text
505054328676446208,2014-08-28 18:08:30,RepEdWhitfield,0,0,Twitter Web Client,I had a great dinner discussing emergency responder and fire dept. issues this week @ Brother's BBQ in Madisonville! http://t.co/P23MjImKXR
505053467787145216,2014-08-28 18:05:04,RepEdWhitfield,1,3,Twitter Web Client,It was such an honor to meet WWII Hero Ivan Russell this week  who survived 27 months in a concentration camp! http://t.co/5zvBKmIKzL
505052891393327105,2014-08-28 18:02:47,RepEdWhitfield,2,2,Twitter Web Client,"I enjoyed making a new #friend at Audubon State Park in Henderson, KY this week! @JJAudubon @HouseGOP http://t.co/N05rm38k61"
505052443651342336,2014-08-28 18:01:00,RepEdWhitfield,0,0,Twitter Web Client,I enjoyed lunch with the Elkton Rotary Club yesterday. What a fine group of dedicated people! http://t.co/yV5O5XumPF
505052120497004544,2014-08-28 17:59:43,RepEdWhitfield,1,0,Twitter Web Client,I had a great meeting yesterday with several Municipal Electric Utility managers from the district to discuss energy! http://t.co/K6HHMKoN5r
505051796247953408,2014-08-28 17:58:26,RepEdWhitfield,0,0,Twitter Web Client,"Yesterday, I had a tour of Custom Coolers in Elkton! A special thanks to all of those who helped coordinate this! http://t.co/2e8AJRS8hB"
505051149687586816,2014-08-28 17:55:52,RepEdWhitfield,0,0,Twitter Web Client,The #Gospel #Music #Festival in Muhlenberg County was such a wonderful event. I had a great time yesterday! http://t.co/OWAiCpN5Ne
504106933427924993,2014-08-26 03:23:53,RepEdWhitfield,5,0,Twitter Web Client,A very informative tour of @firstbuild seeing their innovative ideas being brought into reality! http://t.co/dgQW5Q70sY
504106382392852480,2014-08-26 03:21:42,RepEdWhitfield,2,2,Twitter Web Client,It was a pleasure spending time today w/ Dean Neville Pinto of the UL J.B. Speed School of Engineering @UofLSpeedEng http://t.co/KKg5o4GAbX
504103457490739200,2014-08-26 03:10:04,RepEdWhitfield,1,2,Twitter Web Client,"I enjoyed meeting Katy Ashby today, from Madisonville in the 1st District, who is attending the Univ. of Louisville! http://t.co/sBKfnOb2vG"
502883191292964865,2014-08-22 18:21:10,RepEdWhitfield,1,2,Twitter Web Client,"It was a pleasure meeting Miss Kentucky, Ramsey Carpenter yesterday who is from Ohio County in the First District! http://t.co/ScsaDxpXqj"
502544964245790720,2014-08-21 19:57:10,RepEdWhitfield,0,0,Twitter Web Client,I enjoyed the Farm Bureau's 49th Annual Ham Breakfast and visiting county booths from the First District at the Kentucky State Fair today!
502101652531609600,2014-08-20 14:35:37,RepEdWhitfield,0,0,Twitter Web Client,http://t.co/yaBMvRKCWz
501803173942534144,2014-08-19 18:49:34,RepEdWhitfield,0,0,Twitter for Websites,UK Paducah welcomes large class - Local News - Paducah Sun http://t.co/x1jTlE4Ew7
501480410342518784,2014-08-18 21:27:01,RepEdWhitfield,1,3,Twitter Web Client,"I enjoyed meeting Dr. Bob Davies, the new Murray State University President on Friday. @murraystateuniv http://t.co/B2NV33Ar9p"
500367600518709248,2014-08-15 19:45:07,RepEdWhitfield,2,1,Twitter Web Client,"It was a pleasure seeing Mrs. Harper, the Matriarch of Harper Hams in Hickman County a few minutes ago @HarpersHams http://t.co/eHTolFXnud"
500349610653937664,2014-08-15 18:33:37,RepEdWhitfield,1,2,Twitter Web Client,"Today, I enjoyed addressing the Purchase Area Development District in Mayfield. http://t.co/xkhKBmQKCN"
500332156359438336,2014-08-15 17:24:16,RepEdWhitfield,1,0,Twitter Web Client,"Congrats to Miles Butler from Paducah who won the NIAAA scholarship, and will play football at the University of KY! http://t.co/f4KALqBve4"
500329407199055872,2014-08-15 17:13:21,RepEdWhitfield,2,1,Twitter Web Client,"Congrats to the Murray-Calloway County Airport on receiving a grant in the amount of $196,295.00 from the Federal Aviation Administration!"
499953017417105408,2014-08-14 16:17:42,RepEdWhitfield,2,0,Twitter Web Client,Congratulations to the #JobCorps on their Golden Anniversary! http://t.co/w2cdT3XN71 #4Jobs
499572579758530561,2014-08-13 15:05:59,RepEdWhitfield,4,0,Twitter Web Client,"Obamacare is less popular than a sunburn, which is why the Senate needs 2 act and pass the #Sunscreen Innovation Act! http://t.co/SjLfo5mylO"
499230639577919489,2014-08-12 16:27:14,RepEdWhitfield,1,0,Twitter Web Client,We are fast approaching the Youth Olympic Games! Good luck to all the young athletes that will be competing in Nanjing #GoTeamUSA  #YOG
499193426295140353,2014-08-12 13:59:22,RepEdWhitfield,5,2,Twitter Web Client,#4Jobs http://t.co/MxoWwAZdd3
497372182117638144,2014-08-07 13:22:23,RepEdWhitfield,10,8,Twitter Web Client,"#TBT, The Senate needs to act and pass The #Sunscreen Innovation Act to help fight skin cancer. @HouseCommerce http://t.co/tW1W55ZkBj"
497039577530789890,2014-08-06 15:20:44,RepEdWhitfield,1,2,Twitter Web Client,http://t.co/2jSBYl8ej6
496289300368347137,2014-08-04 13:39:24,RepEdWhitfield,5,0,Twitter Web Client,"Take a moment and read my Op-ed in USA Today: ""America's Pain is China's Gain http://t.co/3C0gj5lNDt  #Yes2Energy #4Jobs @HouseCommerce"
493733586366115840,2014-07-28 12:23:54,RepEdWhitfield,8,7,Twitter Web Client,"Looking forward to The Sunscreen Innovation Act, coming to a vote on the House floor today! Hope everyone has a great week! @HouseCommerce"
492774881629851648,2014-07-25 20:54:21,RepEdWhitfield,1,1,Twitter Web Client,#FlashBackFriday from a few years ago with my friend's dog! I hope everyone has a great weekend. http://t.co/c2WuOXGQ5N
492328103872843776,2014-07-24 15:19:01,RepEdWhitfield,0,0,Twitter Web Client,"Congrats to the North Metcalfe Volunteer Fire Department on receiving a FEMA grant in the amount of $24,989.00, under Operations and Safety!"
491631185907691520,2014-07-22 17:09:43,RepEdWhitfield,1,1,Twitter Web Client,"Congrats to the Henderson County Airport on receiving a grant from the Federal Aviation Administration in the amount of $1,173,000.00!"
491577820733530113,2014-07-22 13:37:40,RepEdWhitfield,1,1,Twitter Web Client,@BarackObama have you found Lois Lerner's emails? Will the @EPA be providing the documents the @HouseCommerce Committee has requested?
489763238804873216,2014-07-17 13:27:10,RepEdWhitfield,0,2,Twitter Web Client,"Congratulations to the Highland Volunteer Fire Department in Hopkinsville on receiving a FEMA grant in the amount of $69,825.00!"
489750255139708928,2014-07-17 12:35:34,RepEdWhitfield,1,0,Twitter Web Client,Yesterday I discussed the Sunscreen Innovation Act with @AthenaCNN This important legislation will help combat skin cancer! @HouseCommerce
489164729144078338,2014-07-15 21:48:54,RepEdWhitfield,1,0,Twitter Web Client,Yesterday I addressed the Waterways Council to discuss the Water Reform and Development Act that recently became law: http://t.co/qmfNRm8XaO
489117268534906880,2014-07-15 18:40:18,RepEdWhitfield,7,6,Twitter Web Client,Today the bipartisan  #Sunscreen Innovation Act moved forward through the full @HouseCommerce Committee @john_dingell http://t.co/AiC21nohBj
488795535252680706,2014-07-14 21:21:51,RepEdWhitfield,2,0,Twitter Web Client,Today I joined on as a cosponsor of The Illegal Entry Accountability Act of 2014: http://t.co/v6DMwnPSSs @TXRandy14
488708928105369600,2014-07-14 15:37:42,RepEdWhitfield,1,1,Twitter Web Client,"Congrats to Hartford native, Ramsey Carpenter on being named Miss Kentucky! @MissAmericaOrg @Miss_KY_Pageant @SenRandPaul @McConnellPress"
487345108925575170,2014-07-10 21:18:23,RepEdWhitfield,0,0,Twitter Web Client,There are better alternatives to securing our border than spending billions: http://t.co/YetpsRoxCy @HouseGOP @RepGoodlatte
487285685125394432,2014-07-10 17:22:15,RepEdWhitfield,1,1,Twitter Web Client,I will continue working to create good-paying #jobs and help hardworking Americans take home more of their paychecks. http://t.co/Hm63fPEyP3
487282863424155648,2014-07-10 17:11:02,RepEdWhitfield,1,1,Twitter Web Client,Good-paying #jobs and more opportunities are the foundations to help build better lives for all Americans! http://t.co/FCqYXQdW7X
487280521400307712,2014-07-10 17:01:44,RepEdWhitfield,0,1,Twitter Web Client,"We’ve been working hard at @HouseCommerce to create more #jobs, modernize government, &amp; protect families. http://t.co/h5nJFOrmpZ"
487276084380311552,2014-07-10 16:44:06,RepEdWhitfield,1,1,Twitter Web Client,#TBT #ThrowBackThursday Filling in for the Speaker of the House of Representatives during the 112th Congress. http://t.co/0RiBV0CpeP
487234415018651648,2014-07-10 13:58:31,RepEdWhitfield,1,0,Twitter Web Client,"Congratulations to the Robards Community Fire Department in Henderson County on receiving a FEMA grant in the amount of $22,230.00!"
485042823000260608,2014-07-04 12:49:55,RepEdWhitfield,5,2,Twitter Web Client,Happy Independence Day! #July4th #Freedom #Celebrate #IndependenceDay #Fireworks http://t.co/6CjpkZkJVU
484420796124000256,2014-07-02 19:38:12,RepEdWhitfield,0,1,Twitter Web Client,"""The second day of July ought to be solemnized with pomp and parade."" -John Adams http://t.co/qja71sUVWx"
484396622743633920,2014-07-02 18:02:09,RepEdWhitfield,1,0,Twitter Web Client,"RT @JRCarrollCJ: Federal loan guarantee to MA #wind energy project off Cape Cod is ""reckless,"" @RepEdWhitfield charges.
http://t.co/ykrq2I9…"
484396119053844480,2014-07-02 18:00:09,RepEdWhitfield,0,0,Twitter Web Client,@BarackObama’s federal loan to the Cape #Wind project is #AllPainNoGain @HouseCommerce. http://t.co/Jc46JlWCNQ
484064553693896704,2014-07-01 20:02:37,RepEdWhitfield,1,2,Twitter Web Client,Let's go #TeamUSA #OneNationOneTeam #USAvBEL #USMNT #AreYouReady #IBelieveThatWeCanWin ! Bring it home! @HouseGOP http://t.co/otOzdfgcFQ
484000735781470208,2014-07-01 15:49:02,RepEdWhitfield,3,0,Twitter Web Client,Go #TeamUSA #OneNationOneTeam #USAvBEL #USMNT #AreYouReady #IBelieveThatWeCanWin ! http://t.co/zqNZE99B47
483710599004975104,2014-06-30 20:36:08,RepEdWhitfield,0,0,Twitter Web Client,"@BarackObama's unilateral #immigration announcement suggests again he believes he's above the law! This is a democracy, not a dictatorship."
483695647254929408,2014-06-30 19:36:43,RepEdWhitfield,1,0,Twitter Web Client,"Congratulations to Lake Cumberland Community Services Org. in Jamestown on receiving a federal grant in the amount of $5,483,451.00!"
483687205110808576,2014-06-30 19:03:10,RepEdWhitfield,2,2,Twitter Web Client,Congrats to @HobbyLobby on the @USSupremeCourt ‘s ruling! @BarackObama‘s failed health care policy continues downward spiral!
481913014070030336,2014-06-25 21:33:10,RepEdWhitfield,1,0,Twitter Web Client,"We just passed the Domestic Prosperity and Global Freedom Act @BarackObama , its time for you to say #yes2energy @HouseCommerce @thehill"
481871243072008192,2014-06-25 18:47:11,RepEdWhitfield,3,0,Twitter Web Client,The American people are suffering the consequences of @BarackObama 's failed energy policies. #AllPainNoGain #GreenNightmare @HouseCommerce
481824795919912960,2014-06-25 15:42:37,RepEdWhitfield,7,2,Twitter Web Client,@BarackObama 's climate action plan is #AllPainNoGain @HouseCommerce http://t.co/oVp7WLkiEr
481824173426479104,2014-06-25 15:40:09,RepEdWhitfield,1,2,Twitter Web Client,@BarackObama 's Climate Action Plan is President Obama's Climate Action plan is #AllPainNoGain ! http://t.co/CO1EOdbYnR
481547528618659840,2014-06-24 21:20:52,RepEdWhitfield,2,1,Twitter Web Client,This week is energy week. It’s time for our country to move forward with energy infrastructure @BarackObama  &amp; end this #GreenNightmare
481172932329484288,2014-06-23 20:32:21,RepEdWhitfield,0,1,Twitter Web Client,Whitfield/@RepFredUpton on the SCOTUS' decision on Greenhouse Gasses: http://t.co/xa8ZIgtV3w @HouseCommerce @thehill
481111192195575808,2014-06-23 16:27:01,RepEdWhitfield,1,1,Twitter Web Client,The House will vote this week on a series of solutions to help deliver benefits of our newfound #energy abundance. #Yes2Energy @thehill
481111044728049665,2014-06-23 16:26:26,RepEdWhitfield,1,1,Twitter Web Client,"#Energy affects our daily lives, and Republicans are working to make it more affordable, reliable, and beneficial. #Yes2Energy @thehill"
481110881053732865,2014-06-23 16:25:47,RepEdWhitfield,1,1,Twitter Web Client,"FACT CHECK: POTUS claims ""all of the above"" energy strategy but refuses to approve shovel-ready #KeystoneXL #Yes2Energy @TheHill"
480068576343506944,2014-06-20 19:24:02,RepEdWhitfield,1,0,Twitter Web Client,2100 Days on the Clock #TimeToBuild #KeystoneXL #GreenNightmare @HouseCommerce @thehill @BarackObama
479628320838283264,2014-06-19 14:14:37,RepEdWhitfield,0,2,Twitter Web Client,Thanks @thehill @thehilltweets for publishing my op-ed about Obama's assault on the future of energy! @HouseCommerce #GreenNightmare
479626315742867457,2014-06-19 14:06:39,RepEdWhitfield,0,0,Twitter Web Client,@thehill @thehilltweets http://t.co/hy8eYCcZac
479626143348563968,2014-06-19 14:05:58,RepEdWhitfield,0,0,Twitter Web Client,@thehill @thehilltweets http://t.co/kYMCpHj3Yv
479625805409304576,2014-06-19 14:04:37,RepEdWhitfield,0,0,Twitter Web Client,WATCH #SubEnergyPower hearing on EPA power plant regulations LIVE on CSPAN here: http://t.co/A6mYxOHAgf
479625775684276224,2014-06-19 14:04:30,RepEdWhitfield,2,0,Twitter Web Client,WATCH #SubEnergyPower hearing on EPA power plant regulations LIVE on CSPAN here: http://t.co/A6mYxOHAgf @thehill @thehilltweets
479625557773410305,2014-06-19 14:03:38,RepEdWhitfield,0,0,Twitter Web Client,@thehill @thehilltweets http://t.co/YJ0iKVLwBj
479625421554991104,2014-06-19 14:03:06,RepEdWhitfield,0,0,Twitter Web Client,@thehill @thehilltweets http://t.co/Mpq3Y3UPLm
479625245268000768,2014-06-19 14:02:24,RepEdWhitfield,1,2,Twitter Web Client,http://t.co/ac3Igy1Eoq
479624995254321152,2014-06-19 14:01:24,RepEdWhitfield,0,1,Twitter Web Client,Thanks @TheHill for wanting my Twitter to make ripples in your feed!
479007314490310656,2014-06-17 21:06:57,RepEdWhitfield,3,0,Twitter for Websites,The truth about Obama’s green dreams | Fox News http://t.co/Ey1DXAuPFf via @fxnopinion
478643350762180608,2014-06-16 21:00:42,RepEdWhitfield,1,2,Twitter Web Client,I am glad to welcome interns Aliah Fueller from Muhlenberg Co. and Grant Grissom from Fulton Co. to my D.C. office! http://t.co/HNNkeQK3VJ
477108740966330369,2014-06-12 15:22:42,RepEdWhitfield,5,3,Twitter Web Client,I will continue to keep fighting against @BarackObama’s reckless and radical assault on affordable electricity! http://t.co/sgtY9rOKBa
477086978694189056,2014-06-12 13:56:14,RepEdWhitfield,0,0,Twitter Web Client,"Congratulations to Grapevine Community Volunteer Fire Department on receiving a FEMA grant in the amount of $24,935.00!"
477086774783922176,2014-06-12 13:55:25,RepEdWhitfield,0,0,Twitter Web Client,"Congratulations to Smithland Fire and Rescue on receiving a FEMA grant in the amount of $26,502.00!"
476732628566278144,2014-06-11 14:28:10,RepEdWhitfield,1,4,Twitter Web Client,Congrats to Chairman Emeritus Bill Samuels of @MakersMark on receiving the receiving ABL Top Shelf Award! http://t.co/rqVaVf4mvN
473829339763855360,2014-06-03 14:11:32,RepEdWhitfield,4,2,Twitter Web Client,"In 1792, KY became the 15th state admitted to the Union. Wishing a Happy Bday to the Great State of KY, who turned 222 years old this week!"
473570171563806720,2014-06-02 21:01:42,RepEdWhitfield,1,0,Twitter Web Client,EPA scurries to brief @BarackObama AFTER their reckless rule was released leaving 100 House staff waiting to be briefed. #WhitfieldProtests
473490717747449856,2014-06-02 15:45:58,RepEdWhitfield,2,1,Twitter Web Client,@BarackObama 's EPA regulations will prevent #AffordableElectricity #Whitfieldprotests @EPA @HouseCommerce http://t.co/JYpaUT314z
473444467836735488,2014-06-02 12:42:11,RepEdWhitfield,7,2,Twitter Web Client,Obama's EPA to Cost Billions of $ and Hundreds of Thousands of Jobs....join in the conversation today http://t.co/k7mqwUGbBt @HouseCommerce
472467840050921472,2014-05-30 20:01:25,RepEdWhitfield,0,1,Twitter Web Client,Today I called for further investigations of facilities as the VA Secretary resigned! http://t.co/5NpxuiCnJv
472126538453106688,2014-05-29 21:25:13,RepEdWhitfield,1,0,Twitter Web Client,"We need to create jobs, and one way to do this is by promoting manufacturing! @BarackObama @HouseCommerce http://t.co/icw3HxlGYf"
472086101424103424,2014-05-29 18:44:32,RepEdWhitfield,0,0,Twitter Web Client,#TBT I will continue to fight for those who serve in our military and for our veterans! http://t.co/q8AQdYMQRw
472034994261868545,2014-05-29 15:21:27,RepEdWhitfield,3,0,Twitter Web Client,"Obama’s EPA to Cost Americans “Billions of Dollars and Hundreds of Thousands of Jobs” 

http://t.co/MewtugwpMq @HouseCommerce"
472012690852818944,2014-05-29 13:52:49,RepEdWhitfield,2,0,Twitter for Websites,Obama Is Bypassing Congress Again. This Time It's Going to Cost You. http://t.co/39CjScIFBp via @Heritage
472010832835264513,2014-05-29 13:45:26,RepEdWhitfield,0,3,Twitter Web Client,"Time to walk the walk, Mr. President #TBT #VAAccountability http://t.co/IqLY2UxuMs"
469899301297328128,2014-05-23 17:54:58,RepEdWhitfield,3,1,Twitter Web Client,"Yesterday I interviewed with @ASwoyer w/ The Washington Times about #KeystoneXL  and #AffordableElectricity.
http://t.co/lzDCinvB0f"
469898952767471616,2014-05-23 17:53:35,RepEdWhitfield,2,0,Twitter Web Client,I appreciate @RepFredUpton coming over for my birthday celebration yesterday! @HouseCommerce http://t.co/epwO0fmVFK
469585368896253952,2014-05-22 21:07:31,RepEdWhitfield,0,1,Twitter Web Client,I enjoyed addressing Kentuckians for Better Transportation on Capitol Hill today!
469526774406447105,2014-05-22 17:14:41,RepEdWhitfield,2,1,Twitter Web Client,Today is #NationalMaritimeDay! I am so thankful Kentucky was recently ranked in the top 5 states in America for #MaritimeJobs!
469501794587262978,2014-05-22 15:35:25,RepEdWhitfield,1,2,Twitter Web Client,I just interviewed with the Washington Times to discuss #AffordableElectricity and the #KeystoneXL pipeline. @HouseCommerce
469203337515376641,2014-05-21 19:49:27,RepEdWhitfield,2,0,Twitter Web Client,RT @HouseCommerce: . @RepEdWhitfield: EPA's cooling water rule will threaten our nation’s power grid &amp; the affordability of #energy http://…
469201995749158912,2014-05-21 19:44:07,RepEdWhitfield,6,3,Twitter Web Client,"I just had a great meeting with @AARPADVOCATES KY Director Ron Bridges, and KY President Jim Kimbrough.” #AARP2014 http://t.co/857BnyaYMe"
468867646310871040,2014-05-20 21:35:32,RepEdWhitfield,1,0,Twitter Web Client,Obama’s Radical EPA Assaults Affordable Electricity Again http://t.co/B7BRMXqGQh @HouseCommerce @BarackObama
468791171930914816,2014-05-20 16:31:39,RepEdWhitfield,3,0,Twitter Web Client,"I will be voting for the passage of the final agreement on  #WRRDA , the Water Resources Reform and Development Act today!"
467334370349813760,2014-05-16 16:02:51,RepEdWhitfield,1,1,Twitter Web Client,Congratulations to the North Marshall Middle “Everyday Ninja’s” Robotics Team for their top-five finish in the State Robotics Competition!
467326578343833601,2014-05-16 15:31:53,RepEdWhitfield,3,2,Twitter Web Client,I am pleased to see Kentucky ranked in the top 5 in the nation for maritime jobs According to the American Maritime Partnership!
467326368112721920,2014-05-16 15:31:03,RepEdWhitfield,3,2,Twitter Web Client,"I am proud to feature Metcalfe County as County of the Month for May in my Washington, D.C. office!"
466655857422249984,2014-05-14 19:06:41,RepEdWhitfield,2,0,Twitter Web Client,Obama is a day late and a $ short on his proposal to meet the infrastructure needs of America! http://t.co/z9qoqtkS61 @HouseCommerce
465877718383755264,2014-05-12 15:34:38,RepEdWhitfield,1,0,Twitter Web Client,REMINDER: “LIKE” CONGRESSIONAL ART ENTRIES ON FACEBOOK https://t.co/XkKSXDjy9b
465317434228871169,2014-05-11 02:28:16,RepEdWhitfield,4,0,Twitter Web Client,Tomorrow is Mother's Day. I wish all of the wonderful and caring Mothers in America a #HappyMothersDay !
463782783609884672,2014-05-06 20:50:06,RepEdWhitfield,2,1,Twitter Web Client,"Congrats to Morgan Guess from Paducah, KY on being named one of America’s top ten youth volunteers  yesterday in Washington, D.C.!"
463704476785053696,2014-05-06 15:38:57,RepEdWhitfield,2,2,Twitter Web Client,I am thankful for all of the great teachers across America today! #ThankATeacher #NationalTeachersDay
463326311424225280,2014-05-05 14:36:15,RepEdWhitfield,1,1,Twitter Web Client,"@BarakObama If you are serious about a #YearofAction, you’ll #UseThePen to approve the #KeystoneXL pipeline. @HouseCommerce"
461893203004645377,2014-05-01 15:41:36,RepEdWhitfield,5,6,Twitter Web Client,"Congrats to Calloway County High School for finishing in the Top 16 at the National Science Bowl in Washington, D.C.! http://t.co/FJlscu3mvw"
461869979517071360,2014-05-01 14:09:18,RepEdWhitfield,2,1,Twitter Web Client,Today we pray for the Nation and the citizens of Kentucky #NationalPrayerDay!
461617207886495745,2014-04-30 21:24:53,RepEdWhitfield,0,0,Twitter Web Client,Today I introduced the 21st Century Energy Workforce Development Jobs Initiative Act w/ Reps Bobby Rush and Bill Johnson @HouseCommerce
461554374775668737,2014-04-30 17:15:12,RepEdWhitfield,4,0,Twitter Web Client,The Keystone XL pipeline has become a symbol of the president’s failed leadership on job creation. http://t.co/nR4dlHNYIV @HouseCommerce
461142012394475520,2014-04-29 13:56:38,RepEdWhitfield,2,3,Twitter Web Client,My thoughts and prayers are with those affected by the recent storms in the U.S.!
459717356106051584,2014-04-25 15:35:33,RepEdWhitfield,2,0,Twitter Web Client,Today is the deadline for submitting your artwork for the Congressional Art Competition. Please submit to Andrea.P'Pool@mail.house.gov.
458682466182922240,2014-04-22 19:03:16,RepEdWhitfield,0,0,Twitter Web Client,"Remember Fri, April 25th is the deadline for submitting your artwork for the  Art Competition. Send to Andrea.P'Pool@mail.house.gov."
458598300820996096,2014-04-22 13:28:49,RepEdWhitfield,2,5,Twitter Web Client,I believe we need to use our God-given resources as efficiently as possible. #HappyEarthDay!
456840812815347712,2014-04-17 17:05:12,RepEdWhitfield,1,1,Twitter Web Client,"Congrats to the Nt'l Quilt Museum in Paducah, Ky on being the #1 best place to see amazing quilts by @USATODAY !
http://t.co/qZ7qbxyk3X"
456840387764551681,2014-04-17 17:03:30,RepEdWhitfield,1,0,Twitter Web Client,Read about my views on oil featured in the Washington Times today: http://t.co/iVXWEqtrnZ @HouseCommerce
456451058399588352,2014-04-16 15:16:27,RepEdWhitfield,1,0,Twitter Web Client,"Today in history: 4/16/1972 was the launch of Apollo 16 from Cape Canaveral, FL! I salute these brave astronauts! http://t.co/ol9SHJGeht"
456137663775780864,2014-04-15 18:31:08,RepEdWhitfield,0,1,Twitter Web Client,"Check out the new muscle car, Z06 Corvette, being built at the home of Corvettes in @RepGuthrie's  District in Kentucky!"
455778987672109056,2014-04-14 18:45:53,RepEdWhitfield,1,0,Twitter Web Client,http://t.co/NpSI3kGT9Z watch my interview with Dean Scott @BloombergBNA
454335612406231040,2014-04-10 19:10:25,RepEdWhitfield,1,0,Twitter Web Client,This afternoon I discussed my bill The Electricity Security and Affordability Act with Dean Scott from Bloomberg! @HouseCommerce
454335434483826688,2014-04-10 19:09:43,RepEdWhitfield,0,0,Twitter Web Client,Today I discussed energy policy issues and liquid natural gas exports with Molly Hooper from The Hill! @repcorygardner @HouseCommerce
454309681503436801,2014-04-10 17:27:23,RepEdWhitfield,2,1,Twitter Web Client,Today I supported the budget that passed the House of Representatives!
453939247855464448,2014-04-09 16:55:25,RepEdWhitfield,5,4,Twitter Web Client,I am pleased to have joined in introducing the Safe and Accurate Food Labeling Act today! @mikepompeo @GKButterfield
453544479187038208,2014-04-08 14:46:44,RepEdWhitfield,1,1,Twitter Web Client,"We passed the Save American Workers Act in the House, please tell the Senate to pass this much needed legislation!"
453292190593069056,2014-04-07 22:04:14,RepEdWhitfield,3,1,Twitter Web Client,Good luck to the University of Kentucky tonight! Go Cats! http://t.co/7w3tbqwlRz
453289418275966977,2014-04-07 21:53:13,RepEdWhitfield,0,1,Twitter Web Client,"“Today I enjoyed visiting with and answering questions from the students from North Middle School in Henderson, KY!"
452173365579878400,2014-04-04 19:58:25,RepEdWhitfield,1,0,Twitter Web Client,I am grateful for the National Job Corps award and recognition this week!
452112462608072705,2014-04-04 15:56:25,RepEdWhitfield,9,4,Twitter Web Client,Congratulations to the Murray State University Racers Men’s Basketball team on their over Yale in the last night!
452112248157118464,2014-04-04 15:55:34,RepEdWhitfield,1,1,Twitter Web Client,Go Cats! http://t.co/h3f03xch1P
451459325450416128,2014-04-02 20:41:05,RepEdWhitfield,1,0,Twitter Web Client,Congratulations to Murray State University on receiving a grant from the National Endowment for the Arts (NEA)! http://t.co/iX5DGR9KCZ
451458192690909185,2014-04-02 20:36:35,RepEdWhitfield,0,0,Twitter Web Client,Yesterday I was fortunate to meet with the Monroe County 4-H Youth Development Group on the front steps of the Capitol!
449208585202171904,2014-03-27 15:37:27,RepEdWhitfield,6,5,Twitter Web Client,"To celebrate Women's History Month I salute Kassie DePaiva, a native of the 1st Congressional District of Kentucky!  @KassieDePaiva"
448908972162969600,2014-03-26 19:46:54,RepEdWhitfield,0,0,Twitter Web Client,"To celebrate Women's History Month I salute Rosemary Clooney, a singer and actress born in Maysville, KY! http://t.co/LKietxWWIZ"
