id,created_at,user,retweets,favorite_count,source,text
780860845756735489,2016-09-27 20:05:07,RepHastingsFL,6,2,Twitter Web Client,"In 2 days, @FCC will vote on #SetTopBox. Join me asking @TomWheelerFCC to #UnlockThePlan https://t.co/5eb56FEDlY"
780820398808129536,2016-09-27 17:24:24,RepHastingsFL,58,50,Twitter Web Client,"Here’s my op-ed on why Congress should pass H.Res.752, my resolution condemning the #Yulin Dog Meat Festival. https://t.co/WkmdJ113YB"
780750928425156608,2016-09-27 12:48:21,RepHastingsFL,389,0,Twitter Web Client,RT @GKButterfield: $24 billion. That's what the last #GOPshutdown cost our economy. Republicans are 3 days away from letting it happen agai…
780455406497923072,2016-09-26 17:14:03,RepHastingsFL,32,19,Twitter Web Client,I am very concerned that assistance for #Flint is not included in the GOP funding bill. #DontForgetFlint https://t.co/TyWwCeQpzH
775812664173793281,2016-09-13 21:45:27,RepHastingsFL,2,9,Twitter Web Client,My thoughts and prayers are with @PresidentPeres. A true statesman and a dear friend. https://t.co/iTLcSyJHSq
774961658447949824,2016-09-11 13:23:52,RepHastingsFL,15,20,Twitter Web Client,Pausing today to memorialize the victims of the horrific 9/11 attacks and to honor those who gave their lives rescuing the injured.
770697238502895616,2016-08-30 18:58:35,RepHastingsFL,63,34,Twitter Web Client,"The #Yulin briefing will take place on Wednesday, September 14th at 8:30 AM in room CVC-200, the Congressional Auditorium. (2/2)"
770697154302271488,2016-08-30 18:58:15,RepHastingsFL,62,29,Twitter Web Client,"If you plan to attend my briefing on #Yulin and haven’t RSVP’d, please call my office at (202) 225-1313 &amp; let me know you are coming. (1/2)"
770270209760460800,2016-08-29 14:41:43,RepHastingsFL,143,0,Twitter Web Client,"RT @WhipHoyer: .@HouseGOP's #RecklessRecess coming to a close in 8 days. Shameful that they haven’t addressed #Zika, #Flint, #Opioids, and…"
769194970045616129,2016-08-26 15:29:06,RepHastingsFL,123,76,Twitter Web Client,I'm hosting a public briefing on 9/14 at @USCapitol on #Yulin and the #Dogmeat trade. https://t.co/I6sbhjfCxk https://t.co/xKeFbvW42k
769169116079030272,2016-08-26 13:46:22,RepHastingsFL,243,0,Twitter Web Client,"RT @louiseslaughter: This #WomensEqualityDay, let's celebrate the progress we've won knowing there's more work to do for full equality. htt…"
769162474608324608,2016-08-26 13:19:58,RepHastingsFL,7,7,Twitter Web Client,"Working women need paid sick days, paid family leave, and affordable, quality child care. #womensucceed https://t.co/C5aebSGIpn"
768812501362442240,2016-08-25 14:09:18,RepHastingsFL,5,6,Twitter for iPhone,@NatlParkService turns 100 today! Americans of all types should #FindYourPark and celebrate our Diversity - https://t.co/GHVQiTSYB7
768549881669640200,2016-08-24 20:45:45,RepHastingsFL,11,8,Twitter Web Client,@LisaVanderpump @HSIGlobal @DDAWP @AHWFoundation Important update to our #Yulin briefing on Capitol Hill: https://t.co/I6sbhjfCxk
768548164362178560,2016-08-24 20:38:55,RepHastingsFL,15,13,Twitter Web Client,Important update to our #Yulin briefing on September 14th: https://t.co/I6sbhjfCxk. Please RSVP to my D.C. office if you plan to attend.
767769687098884096,2016-08-22 17:05:32,RepHastingsFL,12,10,Twitter Web Client,"Congress should return to Washington immediately to address the #Zika crisis, before it turns into an epidemic. https://t.co/9E1Ti58JIL"
765912161159962624,2016-08-17 14:04:23,RepHastingsFL,155,0,Twitter Web Client,"RT @RepAndreCarson: .@HouseGOP: #DoYourJob. We need to end the #RecklessRecess and address #Zika, #GunViolence and #FlintWaterCrisis."
764833980910743554,2016-08-14 14:40:05,RepHastingsFL,6,8,TweetDeck,"For 81 years, #SocialSecurity Income (SSI) has offered financial security and peace of mind to millions of Americans."
764160289432440832,2016-08-12 18:03:05,RepHastingsFL,9,17,TweetDeck,Enough is enough. LGBTQ leaders &amp; gun violence prevention advocates agree: It's time to act. #DisarmHateRally https://t.co/6Nozigek7o
763351750786977792,2016-08-10 12:30:14,RepHastingsFL,173,172,TweetDeck,"#FL and the rest of the U.S. are under threat of #Zika. But @HouseGOP won't come back to work. What will it take for you to #DoYourJob, GOP?"
763113370157449216,2016-08-09 20:43:00,RepHastingsFL,65,54,Twitter Web Client,The date has been set for our #Yulin briefing on Capitol Hill: https://t.co/I6sbhjfCxk  #StopYulin #StopYulinForever
761579700405895168,2016-08-05 15:08:44,RepHastingsFL,118,0,Twitter for iPhone,"RT @RepLoisFrankel: #Zika is a public health crisis approaching dangerous levels, @HouseGOP still won't
come back from summer break: https:…"
760886339533438976,2016-08-03 17:13:34,RepHastingsFL,297,0,Twitter for iPhone,"RT @RepTedDeutch: .@HouseGOP priorities:
✗ Fund Zika research
✗ Prioritize Americans' health
✗ Address public health crises
✓ Take 7 week r…"
760139730910584833,2016-08-01 15:46:49,RepHastingsFL,2,4,Twitter Web Client,Great news for Broward County: @SpeakUp_Broward awarded a $11.4 million grant for the Complete Streets Initiative. https://t.co/ko5sGwZKVU
758667199297052674,2016-07-28 14:15:30,RepHastingsFL,160,0,Twitter Web Client,RT @RepSarbanes: House Democrats are fighting for a #StrongerAmerica by returning us to a gov't #ByThePeople: https://t.co/7l8P0GJnci https…
758362542196555780,2016-07-27 18:04:54,RepHastingsFL,10,13,Twitter Web Client,"I sent this letter to Governor Scott today, urging him to lead on commonsense gun control legislation in Florida. https://t.co/Z3TekLsadi"
756133225924362240,2016-07-21 14:26:23,RepHastingsFL,6,10,Twitter Web Client,My deepest sympathies to the Takai Family. We have lost an honorable public servant. #MahaloMark https://t.co/9Keq1j3lJf
755033894173417472,2016-07-18 13:38:02,RepHastingsFL,544,0,Twitter Web Client,"RT @NancyPelosi: .@HouseGOP, what will it take for you to #DoYourJob? #Gunviolence, #Zika, and more and you left for summer break. https://…"
754831086979547136,2016-07-18 00:12:09,RepHastingsFL,4,6,Twitter Web Client,I stand united in prayer with the people of #BatonRouge.
753756309112127489,2016-07-15 01:01:22,RepHastingsFL,5,4,Twitter Web Client,"My statement on the terrorist attack in Nice, France: https://t.co/DJG1yviqAF  #PrayForNice"
753590170184773633,2016-07-14 14:01:12,RepHastingsFL,6,23,Twitter Web Client,Introduced a bipartisan resolution today with @RepJeffDenham recognizing the important role of pollinators. https://t.co/i0UrC8mTCQ
752975275483336704,2016-07-12 21:17:49,RepHastingsFL,3,2,Twitter Web Client,Homeowners: you may be eligible for refinancing your home through the @FHFA #HARPNow program. Learn more at https://t.co/0TM7JziTrp
752868559353708544,2016-07-12 14:13:46,RepHastingsFL,1,0,Twitter Web Client,@RepDWStweets and I created this task force last year and are eminently proud of the conversations it has fostered.
752868385562787840,2016-07-12 14:13:05,RepHastingsFL,2,2,Twitter Web Client,"Important op-ed by Mayor Mike Ryan of Sunrise, FL on the Strengthening Police Community Relations Task Force. https://t.co/M4sFhd76SA"
752867450149015552,2016-07-12 14:09:22,RepHastingsFL,6,2,Twitter Web Client,My statement on the one-month anniversary of the Pulse Nightclub Shooting: https://t.co/AzNdy8JF0W  #OrlandoStrong #DisarmHate
751419829232558080,2016-07-08 14:17:02,RepHastingsFL,4,5,Twitter Web Client,"Communities in #BatonRouge #Louisiana, #FalconHeights #Minnesota, &amp; #Dallas #Texas have seen tragedy this week. My prayers are with them."
751417177241182208,2016-07-08 14:06:30,RepHastingsFL,5,1,Twitter Web Client,My statement on the #Dallas shootings last night: https://t.co/StkzYlXO1l
751411759865618436,2016-07-08 13:44:58,RepHastingsFL,2,1,Twitter Web Client,My statement on the deaths of #AltonSterling and #PhilandoCastile: https://t.co/3k32e6jVdS
751115751663276032,2016-07-07 18:08:44,RepHastingsFL,155,0,Twitter Web Client,RT @rosadelauro: RT if you agree: Americans demand a vote on legislation to #EndGunViolence and Congress must act. #DisarmHate https://t.co…
751115460117159936,2016-07-07 18:07:35,RepHastingsFL,7,6,Twitter Web Client,Join House Dems today from 3-4PM for a Twitter Town Hall on gun violence. #AskDems #DisarmHate #EndGunViolence https://t.co/KLc6IwPwP9
751056010803081216,2016-07-07 14:11:21,RepHastingsFL,596,0,Twitter Web Client,RT @YvetteClarke: FACT: 91 people per day die from gun violence. RT to say it's far past time we #disarmhate. https://t.co/i2FiFALmyd
750354429157801984,2016-07-05 15:43:31,RepHastingsFL,654,0,Twitter Web Client,"RT @NancyPelosi: .@SpeakerRyan: Americans want us to #DisarmHate with commonsense gun reform, not an @NRA-written bill. https://t.co/dy4Rdn…"
749973583338758144,2016-07-04 14:30:10,RepHastingsFL,2,4,TweetDeck,"240 years ago, the Declaration of Independence was signed &amp; birthed a nation that would become a cornerstone of freedom &amp; democracy #July4th"
749248798472282114,2016-07-02 14:30:08,RepHastingsFL,6,11,TweetDeck,"It is only fitting that, just two days before we celebrate the birth of the U.S., the 1964 Civil Rights Act was signed into law #NeverForget"
749248521383981057,2016-07-02 14:29:02,RepHastingsFL,3,6,TweetDeck,"On July 2, 1964, legislation passed that prohibited discrimination based on race, ethnicity, sex or religion, &amp; Jim Crow laws were banned."
748924157149188096,2016-07-01 17:00:08,RepHastingsFL,25,20,Twitter Web Client,House resumes session on Tuesday. Let’s urge @SpeakerRyan to put H. Res. 752 condemning the Yulin Dog Meat Festival on the floor #EndYulin
748889504832978944,2016-07-01 14:42:26,RepHastingsFL,5,7,Twitter Web Client,"Despite efforts from Republicans &amp; individual states, including Fla., to repeal #ACA &amp; weaken these programs, we must push for expansion"
748889299022647296,2016-07-01 14:41:37,RepHastingsFL,4,3,Twitter Web Client,"#OTD 51 years ago, Medicaid and Medicare were signed into law, providing a safety net for affordable healthcare for millions of Americans."
748881857824055296,2016-07-01 14:12:03,RepHastingsFL,246,0,Twitter Web Client,"RT @RepLoisFrankel: .@SpeakerRyan, no more moments of silence without action. Americans want commonsense gun legislation to #DisarmHate. ht…"
748195793903947776,2016-06-29 16:45:52,RepHastingsFL,12,11,Twitter Web Client,"It’s long past time for @HouseGOP to allow a vote on commonsense
bills to help keep guns out of dangerous hands. #DisarmHate"
747881450003894272,2016-06-28 19:56:47,RepHastingsFL,108,140,Twitter Web Client,"Docs, veterans, ~100 MoCs &amp; 80% of Americans want DOD to swap deadly animal labs for simulation. So does @nytimes https://t.co/VAQyOe12Ej"
747791471319867392,2016-06-28 13:59:14,RepHastingsFL,387,0,Twitter Web Client,"RT @RepJohnLarson: We won't tolerate silence, @SpeakerRyan. We have a responsibility to keep guns out of the wrong hands. #DisarmHate https…"
747421758697857025,2016-06-27 13:30:08,RepHastingsFL,3,6,TweetDeck,"Today we can help break the cycle of fear, shame and silence around HIV/AIDS. Five minutes can save a life. Get tested. #KnowYourStatus"
747066936186462208,2016-06-26 14:00:12,RepHastingsFL,3,8,TweetDeck,"This #LGBTEquality day, and every day, we commemorate #SCOTUS victories that declared once and for all #LoveIsLove https://t.co/LGP6fq2ajF"
746734788552208385,2016-06-25 16:00:21,RepHastingsFL,3,4,TweetDeck,3 yrs of #votingrights discrimination disproportionately affects minority &amp; elderly voters. Enough is enough. It is time to #RestoreTheVRA
746704598648250368,2016-06-25 14:00:24,RepHastingsFL,5,8,TweetDeck,"Full voter protection should be extended to every American, yet voting restrictions in 17 states could limit voter turnout #RestoretheVRA"
746366287673171968,2016-06-24 15:36:04,RepHastingsFL,452,0,Twitter Web Client,RT @RepBobbyRush: .@SpeakerRyan failed Americans–he &amp; @HouseGOP left town w/o protecting them from suspected terrorists #NoBillNoBreak http…
746070458605371392,2016-06-23 20:00:33,RepHastingsFL,4,9,Twitter Web Client,Proud to stand with the Florida Democratic delegation. https://t.co/6rOjPE9Kq4
745962200825729024,2016-06-23 12:50:22,RepHastingsFL,8741,0,Twitter Web Client,"RT @repjohnlewis: .@SpeakerRyan, we will not leave without acting for the victims &amp; families of reckless gun violence. #NoBillNoBreak https…"
745730624917495808,2016-06-22 21:30:10,RepHastingsFL,16,42,Twitter Web Client,Proud to join today's Dem. sit-in #NoBillNoBreak #NoMoreSilence. Watch my full statement: https://t.co/LjV2xgTfxY https://t.co/ldUuor3jJG
745681336950734848,2016-06-22 18:14:19,RepHastingsFL,24,46,Twitter Web Client,At the sit-in on the House Floor. #NoBillNoBreak #EndGunViolence #NoMoreSilence Glad to be with you @RepGwenMoore https://t.co/fY7r3HhQvk
745663431756386304,2016-06-22 17:03:10,RepHastingsFL,15,47,Twitter Web Client,Joined the sit-in on the House floor to demand a vote on gun violence. #StopGunViolence #NoMoreSilence #DisarmHate https://t.co/wANZmKJC8M
745031662883463168,2016-06-20 23:12:45,RepHastingsFL,59,57,Twitter Web Client,The #Yulin Dog Meat Festival will begin in just a few hours. Read my statement: https://t.co/mT1TxwFTuV This fight is not over. #StopYulin
744998575369781248,2016-06-20 21:01:16,RepHastingsFL,21,12,Twitter Web Client,@VanderpumpDogs and @LeonaLewis put together this powerful PSA to #StopYulin. https://t.co/DV13Hd9NFq
744981262331412481,2016-06-20 19:52:28,RepHastingsFL,30,21,Twitter Web Client,Please read my joint op-ed with @LisaVanderpump on the effort to #StopYulin. This fight isn’t over. https://t.co/WevNTlvEeN
744969101089644544,2016-06-20 19:04:09,RepHastingsFL,5,4,Twitter Web Client,I've visited a number of refugee camps around the world. 65.3M people currently forcibly displaced. #WorldRefugeeDay https://t.co/ky68OyIfPT
744968456181792768,2016-06-20 19:01:35,RepHastingsFL,4,2,Twitter Web Client,Pleased to join with @RepTedLieu to introduce a bill marking #WorldRefugeeDay. The # of refugees &amp; displaced people has surpassed 65 million
744907159348051968,2016-06-20 14:58:01,RepHastingsFL,251,0,Twitter Web Client,RT @HouseDemocrats: Americans demand leadership. That's why we are fighting to #DisarmHate &amp; close the dangerous #NoFlyNoBuy loophole. http…
743849535089278977,2016-06-17 16:55:23,RepHastingsFL,11,18,Twitter Web Client,My statement on the one-year anniversary of the shooting at Emanuel AME Church: https://t.co/YuYuVBlUwR
743559970663337984,2016-06-16 21:44:46,RepHastingsFL,301,287,Twitter Web Client,Another letter sent today to #StopYulin. This one went to China’s President Xi urging him to end the dog meat trade. https://t.co/4tJuiHlP7D
743529009628209153,2016-06-16 19:41:44,RepHastingsFL,166,161,Twitter Web Client,Thank you @HumaneSociety for helping to get the word out. Urge your Rep. to Co-Sponsor H. Res. 752 to #StopYulin. https://t.co/b4w0gJD4Xo
743501315041533952,2016-06-16 17:51:41,RepHastingsFL,5,10,Twitter Web Client,"Sending my heartfelt condolences to the family, friends, and colleagues of #JoCox."
743500932432945152,2016-06-16 17:50:10,RepHastingsFL,45,44,Twitter Web Client,Sent another letter to Customs &amp; Border Patrol urging them to prevent dog-leather products from entering the U.S. https://t.co/iBYOD50H09
743500039520157696,2016-06-16 17:46:37,RepHastingsFL,85,67,Twitter Web Client,Change will have to come from within. Glad to see growing support in China to #StopYulin. https://t.co/G6Tcm5UoYT
743065017508081664,2016-06-15 12:58:00,RepHastingsFL,11,18,Twitter for iPhone,The FL Delegation meeting on the #Zika virus is underway. Congress needs to fully fund our response. https://t.co/VDFmXOW58J
742792112593371136,2016-06-14 18:53:34,RepHastingsFL,8,15,Twitter for iPhone,It is time the FDA end the outdated blood donation policy for gay and bisexual men. #WorldBloodDay #BloodIsBlood https://t.co/J5VkuOvJcD
742711956348493824,2016-06-14 13:35:03,RepHastingsFL,81,72,Twitter Web Client,Lots of groups working to #EndYulin. Thank you &amp; keep it up! @PETA @HSIGlobal @AWIOnline @DDAWP @Care2 @Avaaz @RaiseUrPaw
742445194704998404,2016-06-13 19:55:03,RepHastingsFL,234,267,Twitter Web Client,Sending a letter to China’s President urging him to #EndYulin. RT to your Rep. &amp; encourage him/her to sign on! @LisaVanderpump @DDAWP
742441473086525440,2016-06-13 19:40:15,RepHastingsFL,94,70,Twitter Web Client,Sending a letter to China’s President urging him to #EndYulin. RT to your Rep. &amp; encourage him/her to sign on! @PETA @HSIGlobal @AWIOnline
742413790650765312,2016-06-13 17:50:15,RepHastingsFL,10,22,Twitter Web Client,"To the victims and families, and to #LGBT communities everywhere: I stand with you. #OrlandoUnited https://t.co/ys8wobkWBs"
740910139704782850,2016-06-09 14:15:17,RepHastingsFL,131,0,Twitter Web Client,RT @RepMcGovern: .@SpeakerRyan's #WrongWay poverty plan is not only a distraction but it's built on false statements → https://t.co/lguxHL1…
740689610913767424,2016-06-08 23:38:59,RepHastingsFL,23,40,Twitter Web Client,Sad to hear of the terror attack against innocent civilians in #TelAviv #Israel. My thoughts &amp; prayers are with the victims &amp; their families
740556740396253184,2016-06-08 14:51:00,RepHastingsFL,166,0,Twitter Web Client,RT @WhipHoyer: .@SpeakerRyan's #BetterWay agenda is the #WrongWay to address poverty-it's nothing more than new spin on a bad deal. https:/…
740280581213261824,2016-06-07 20:33:38,RepHastingsFL,144,106,Twitter Web Client,Read my legislation to #StopYulin here: https://t.co/VfbDjnnTjI  @HSIGlobal @carrieffisher @RaiseUrPaw @DDAWP @Care2 @Avaaz
740280011031207936,2016-06-07 20:31:23,RepHastingsFL,67,47,Twitter Web Client,Nice work @HSIGlobal! ICYMI they just gathered and delivered 11M+ signatures to #StopYulin #EndYulinFestival https://t.co/rZa7RdHuKm
739927664899805184,2016-06-06 21:11:17,RepHastingsFL,69,47,Twitter Web Client,Wrote @SpeakerRyan and @GOPLeader urging them to allow a vote to #EndYulin. Join me in calling for a vote! https://t.co/SvIJYiYV1Y
739881524657545217,2016-06-06 18:07:56,RepHastingsFL,277,251,Twitter Web Client,@PETA &amp; I exposed the Chinese dog leather biz (https://t.co/P8DMoFzQsF). Now working to #EndYulin. https://t.co/VfbDjnnTjI
736196057848250368,2016-05-27 14:03:12,RepHastingsFL,4,6,Twitter Web Client,"Joining 68 of my colleagues today in calling for 21st century population data, including #LGBTdata https://t.co/9YPng5A0ui"
735589747960205312,2016-05-25 21:53:57,RepHastingsFL,143,111,Twitter Web Client,Pleased to work with @HSIGlobal to #EndYulinFestival  https://t.co/47NKbEfPqS
735587427281145857,2016-05-25 21:44:43,RepHastingsFL,269,314,Twitter Web Client,Read my legislation condemning the #YulinDogMeatFestival. #StopYulin2016 @LisaVanderpump https://t.co/VfbDjnnTjI https://t.co/aD16LjhMyY
735586952464961539,2016-05-25 21:42:50,RepHastingsFL,64,58,Twitter Web Client,Thank you @BJLaflin for working to #EndYulin. #StopYulin2016 https://t.co/VfbDjnnTjI https://t.co/sQuKCCcNng
735586679533273092,2016-05-25 21:41:45,RepHastingsFL,146,123,Twitter Web Client,"Little Ricky, a #Yulin rescue, joined me in my office when I announced my legislation to #EndYulin. @rickygervais https://t.co/dvEVN2NeXZ"
735586415568924676,2016-05-25 21:40:42,RepHastingsFL,100,68,Twitter Web Client,Thank you @rickygervais &amp; @HSIGlobal for your work to #EndYulin. Proud to join you and many others in this fight. https://t.co/VfbDjnnTjI
735542737106305025,2016-05-25 18:47:08,RepHastingsFL,55,45,Twitter for iPhone,Thank you @BJLaflin for your support and work to #EndYulin #StopYulin2016  https://t.co/Bf2SbhmmPg
735103229848113152,2016-05-24 13:40:42,RepHastingsFL,205,0,Twitter Web Client,RT @louiseslaughter: .@SpeakerRyan: Panel to Attack Women's Health is a dangerous witch hunt. Let's #disbandit! https://t.co/Tzk3Wx3ftQ htt…
734747667914469380,2016-05-23 14:07:49,RepHastingsFL,160,0,Twitter Web Client,RT @RepTedDeutch: .@SpeakerRyan we can and we must address #Zika now - let's fully fund @POTUS' emergency funding request #DoYourJob https:…
733643558343839744,2016-05-20 13:00:29,RepHastingsFL,443,0,Twitter Web Client,"RT @NancyPelosi: Americans won't forget @HouseGOP is so committed to discriminating against LGBT people, they broke regular order to suppor…"
733370780030009349,2016-05-19 18:56:33,RepHastingsFL,3,3,Twitter Web Client,I just introduced legislation designating September as Nonprofit Organization Recognition Month. https://t.co/MxE6uS5jg4
733310858579828736,2016-05-19 14:58:27,RepHastingsFL,5,6,Twitter Web Client,My #NDAA amendment protecting #veterans pensions passed in the House of Representatives. https://t.co/O1dbgalFrd https://t.co/VEUbJ7iSKQ
732568700591738880,2016-05-17 13:49:23,RepHastingsFL,2,5,Twitter for iPhone,Pleased to welcome the ADL to Capitol Hill today. https://t.co/PoY37fjQ3Y
731119408773496832,2016-05-13 13:50:25,RepHastingsFL,114,0,Twitter Web Client,RT @repbenraylujan: The #OpioidEpidemic touches every community. Time for @houseGOP to stop blocking funding to combat this crisis and save…
730745751656103937,2016-05-12 13:05:38,RepHastingsFL,114,0,Twitter Web Client,RT @DorisMatsui: FACT: 78 Americans die from an opioid overdose every day. Congress must propose new funding to address this accelerating e…
729698282985947136,2016-05-09 15:43:22,RepHastingsFL,449,0,Twitter Web Client,RT @RepCummings: 2 yrs &amp; nearly $7 million in taxpayer funds wasted on @HouseGOP's Select Committee to Attack Clinton. Enough is enough. #P…
727858785486815234,2016-05-04 13:53:52,RepHastingsFL,48,0,Twitter Web Client,"RT @chelliepingree: Dems agree: Time to act, @SpeakerRyan! // HuffPo: Most Americans Think Gov Could Do More To Stop Opioid Epidemic → http…"
727503667172139008,2016-05-03 14:22:45,RepHastingsFL,100,0,Twitter Web Client,"RT @RepMarciaFudge: Budget debacle, #Zika virus, opioid epidemic &amp; #FlintWaterCrisis have gone unaddressed thanks to @HouseGOP who recessed…"
727194681168257025,2016-05-02 17:54:57,RepHastingsFL,6,5,Twitter Web Client,"Disturbing video. My bill, #HR2268, will end corporal punishment. RT if you agree. Will you stand with me? https://t.co/kYR9qxKewe"
727124551272923136,2016-05-02 13:16:17,RepHastingsFL,196,0,Twitter Web Client,"RT @RepDebDingell: Unacceptable House recessed w/o #budget vote, action on #Zika, opioid epidemic, OR #FlintWaterCrisis. Time to work toget…"
726033527360380929,2016-04-29 13:00:56,RepHastingsFL,135,0,Twitter Web Client,"RT @RepRoybalAllard: The threat of #Zika continues to threaten the health of Americans, yet Republicans have decided to leave town. @Speake…"
725686649527611393,2016-04-28 14:02:34,RepHastingsFL,178,0,Twitter Web Client,"RT @repjoecrowley: .@SpeakerRyan, reckless to recess this House w/out acting to protect Americans from the threat of #Zika. #DoYourJob http…"
725308509701693440,2016-04-27 12:59:58,RepHastingsFL,121,0,Twitter Web Client,RT @RepJoeKennedy: .@HouseDemocrats have a clear message for Republicans who've failed to pass a #budget or address urgent health crises: T…
724953092626763776,2016-04-26 13:27:40,RepHastingsFL,99,0,Twitter Web Client,"RT @RepDWStweets: While Republicans sit on their hands, @HouseDemocrats have introduced a bill to protect American communities against the…"
723566945526751232,2016-04-22 17:39:37,RepHastingsFL,50,0,Twitter for iPhone,RT @WhipHoyer: .@GOPLeader doesn’t have much to say when asked if @HouseGOP has plans to bring a #budget to the Floor: https://t.co/o3mKr5a…
722773029332189190,2016-04-20 13:04:53,RepHastingsFL,141,0,Twitter Web Client,RT @RepLoisFrankel: Former #Budget Committee Chair @SpeakerRyan has blown past the statutory deadline for Congress to enact a budget. https…
722468489781518336,2016-04-19 16:54:45,RepHastingsFL,150,0,Twitter Web Client,"RT @HouseDemocrats: Instead of coming together w/Dems to pass #budget that will grow paychecks of Americans, @HouseGOP has decided not to p…"
722468139578040321,2016-04-19 16:53:21,RepHastingsFL,3,1,Twitter Web Client,"This morning, I again introduced the #veterans Pensions Protection Act. My statement: https://t.co/I8Myn5o4FQ https://t.co/W6onoG83sh"
722410902704758786,2016-04-19 13:05:55,RepHastingsFL,2,0,Twitter Web Client,Pleased to join @RepRaulGrijalva in writing @NatlParkService to encourage diversity &amp; inclusion in National Parks https://t.co/V8nPMSEd4P
722143567083413505,2016-04-18 19:23:37,RepHastingsFL,6,10,Twitter Web Client,I proudly stand with the many immigrant families across the country &amp; Florida as we #FightForFamilies.
722103778443440128,2016-04-18 16:45:31,RepHastingsFL,4,2,Twitter Web Client,"1,000 workplace homicides occur each year. Learn the early warning signs and make the workplace safer for us all. https://t.co/xg2aK1FsWj"
722102848671113216,2016-04-18 16:41:49,RepHastingsFL,5,4,Twitter Web Client,"Ever year, thousands of dogs are treated inhumanely at the Dog Meat Festival in Yulin, China. This must stop! https://t.co/EWQjRJPpD9"
722052339121668096,2016-04-18 13:21:07,RepHastingsFL,171,0,Twitter Web Client,"RT @RepGutierrez: Today, @HouseDemocrats stand united in #FightForFamilies for #immigration actions that benefit our communities and all Am…"
720689466730549248,2016-04-14 19:05:33,RepHastingsFL,3,6,Twitter Web Client,My thoughts &amp; prayers are with the #ChibokGirls two years after their abduction. We continue to stand against extremism. #BringBackOurGirls
719949422809989120,2016-04-12 18:04:53,RepHastingsFL,6,4,Twitter Web Client,Thank you @RideOnTeam26 for your tireless work to end gun violence. #LoveRunsThrough #HonorWithAction
719949254580707334,2016-04-12 18:04:12,RepHastingsFL,3,1,Twitter Web Client,"Since the tragedy at Sandy Hook, there have been more than 100,000 gun deaths in the US."
