id,created_at,user,retweets,favorite_count,source,text
850362193526784002,2017-04-07 14:58:40,RepHastingsFL,6,21,Fireside Publishing,My statement on the U.S. Airstrikes in Syria: https://t.co/zvGAOmnU1T
850088529271169024,2017-04-06 20:51:13,RepHastingsFL,68,175,Twitter Web Client,Who’s running this damn place? The Rules Committee held an “emergency” hearing today on #TrumpCare. Congress works… https://t.co/pdjuVN0XxI
849345330931957760,2017-04-04 19:38:01,RepHastingsFL,16,23,TweetDeck,"On #EqualPayDay, let us recommit ourselves to closing the gender wage gap. #EqualPayForEqualWork https://t.co/jbckzGtfwC"
848891314766848000,2017-04-03 13:33:55,RepHastingsFL,885,0,Twitter Web Client,RT @GregoryMeeks: How many more days will it take for @SpeakerRyan to admit that @DevinNunes has lost all credibility on Russia investigati…
847105207859339265,2017-03-29 15:16:34,RepHastingsFL,3,26,Twitter Web Client,I introduced a Res. marking the 15th anniversary of the Arab Peace Initiative and commending those working for peace https://t.co/Yj9gpGBdZw
846101825199783937,2017-03-26 20:49:29,RepHastingsFL,4,37,Twitter for iPhone,Thanks @AIPAC for inviting me to speak on recent developments in the Middle East. https://t.co/SbD7DjNvZh
845383696316334085,2017-03-24 21:15:54,RepHastingsFL,97,396,Fireside Publishing,Read my Statement on the Defeat of TrumpCare: https://t.co/sYH7oUeyKw #PayMoreForLess #ProtectOurCare
845365930813247488,2017-03-24 20:05:18,RepHastingsFL,9576,0,Twitter Web Client,"RT @RepSeanMaloney: .@realDonaldTrump, @SpeakerRyan: we're not tired of winning yet. Ready when you are to talk real solutions to fix ACA f…"
845312382230564866,2017-03-24 16:32:31,RepHastingsFL,42,231,Fireside Publishing,The United States should extent Temporary Protected Status (TPS) to Haitian Nationals https://t.co/dIGYr3sDlj
845308937113079816,2017-03-24 16:18:50,RepHastingsFL,1464,3423,Twitter Web Client,#TrumpCare steals billions from Medicaid and cuts taxes for the richest Americans. This is shameful.… https://t.co/ysJ6AIKVaT
844559892006490113,2017-03-22 14:42:24,RepHastingsFL,17,68,Twitter Web Client,The @RulesReps hearing on #TrumpCare has begun. Watch live here: https://t.co/xdsBRv1SCN #PayMoreForLess
842446602996486145,2017-03-16 18:44:56,RepHastingsFL,51,62,Twitter Web Client,@POTUS I urge you to raise the issue of the inhumane slaughter of dogs in #Yulin during your meeting w/ President Xi https://t.co/EgXJskCQlI
842389935734812672,2017-03-16 14:59:46,RepHastingsFL,72,405,Twitter Web Client,I condemn @POTUS' disgraceful budget proposal: https://t.co/cWiLJUhd9S #TrumpCuts
842114395635351552,2017-03-15 20:44:52,RepHastingsFL,79,83,Twitter Web Client,"Please join me on March 21st at 10:00 AM for a briefing on H.R.1406, the Dog and Cat Meat Trade Prohibition Act. https://t.co/veH7NmHnJC"
841388999830839298,2017-03-13 20:42:24,RepHastingsFL,22,64,Twitter Web Client,Fourteen million people will lose healthcare coverage under #TrumpCare. You can read the full CBO report here: https://t.co/up5Pz4H1zg
840261286063677440,2017-03-10 18:01:16,RepHastingsFL,143,151,Twitter Web Client,Secretary Tillerson: @StateDept needs to speak up to stop the inhumane slaughter of dogs in #Yulin and throughout A… https://t.co/44WiJs5C2q
839504044884389893,2017-03-08 15:52:16,RepHastingsFL,17,82,Twitter Web Client,"On #InternationalWomensDay, let us recommit to making America a better place for our mothers, daughters, and granddaughters."
839489546433806337,2017-03-08 14:54:39,RepHastingsFL,22,30,Twitter Web Client,"""Millions Risk Losing Health Insurance in Republican Plan"" The title says it all. https://t.co/6B6kLCsOrt #ACA #PayMoreForLess"
839233207056887809,2017-03-07 21:56:03,RepHastingsFL,45,72,Twitter Web Client,7 years of undermining the #ACA and the best the GOP could come up with is forcing Americans to #PayMoreForLess? https://t.co/9XHIhBXiRg
839178950261747717,2017-03-07 18:20:27,RepHastingsFL,83,68,Twitter Web Client,...unifying animal cruelty laws by banning the slaughter of dogs and cats for human consumption in the U.S. https://t.co/pOL0yGj8Qr (2/2)
839178717201068032,2017-03-07 18:19:32,RepHastingsFL,59,42,Twitter Web Client,"@RepBrendanBoyle, @VernBuchanan, @RepDaveTrott, &amp; I just introduced the Dog and Cat Meat Trade Prohibition Act… (1/2)"
838882225772974080,2017-03-06 22:41:22,RepHastingsFL,7,10,Twitter Web Client,"@SecretaryCarson: No, slaves were not immigrants coming to America to pursue their dreams. History matters. @POTUS #BenCarson"
838860630752903172,2017-03-06 21:15:34,RepHastingsFL,5,9,Twitter Web Client,@POTUS: two wrongs don’t make a right. The immoral #MuslimBan is still immoral. https://t.co/bGOlP3DsA7
837341678356819969,2017-03-02 16:39:47,RepHastingsFL,23,40,Twitter Web Client,"AG #Sessions must resign, or @POTUS must fire him, and the FBI must launch an investigation into his actions. https://t.co/EzrM3hcRze"
836785318011498496,2017-03-01 03:49:01,RepHastingsFL,7,11,TweetDeck,"My response to President Trump’s 
first address to a joint session of Congress: https://t.co/I6sbhjfCxk #JointAddress"
836267519719718912,2017-02-27 17:31:28,RepHastingsFL,3,8,Twitter Web Client,Looking forward to hosting this week’s Congressional #Everglades Caucus meeting with @MarioDB https://t.co/t653akUb1m
836256469947408385,2017-02-27 16:47:33,RepHastingsFL,2,7,Twitter Web Client,"Joined important meetings last week in Israel, Jordan, Italy, and during the 17th @OSCEPA Winter Meeting in Austria. https://t.co/AUJnVbxnOq"
835123667969445888,2017-02-24 13:46:12,RepHastingsFL,11,11,Twitter Web Client,"In rescinding guidance issued by President Obama, President Trump has abandoned transgender students. https://t.co/l3ZzxXVxQY"
832240787605901312,2017-02-16 14:50:40,RepHastingsFL,1080,0,Twitter Web Client,RT @RepTerriSewell: Our best bet to stop Russian meddling is to #FollowTheFacts. But we can't do that if @HouseGOP keeps blocking independe…
831621274375962624,2017-02-14 21:48:57,RepHastingsFL,125,95,Twitter Web Client,Thank you to everyone working to build support for #HRes30! Our resolution to #StopYulinForever now has 93 cosponsors. #EndDogMeatTrade
831610338047057922,2017-02-14 21:05:29,RepHastingsFL,23,38,Twitter Web Client,The @FBI must move expeditiously to investigate the @POTUS / Russia connection. #FlynnResignation My statement: https://t.co/sLJMwJRH4p
831243251168460800,2017-02-13 20:46:49,RepHastingsFL,1,0,Twitter Web Client,@VernBuchanan &amp; I will host the 1st FL Delegation Mtg of the 115th Congress on water issues in coastal communities https://t.co/BPXrgLQlNO
831240772351565824,2017-02-13 20:36:58,RepHastingsFL,18,24,Twitter Web Client,Hundreds of my constituents have been denied tours of the WH or left in limbo. What’s taking so long @WhiteHouse? https://t.co/zpqhS2vzwa
830080267054411776,2017-02-10 15:45:32,RepHastingsFL,5,26,Twitter Web Client,The 9th Circuit’s ruling was a major victory for America. @POTUS’ illegal refugee ban goes against our values &amp; must be completely withdrawn
829703770070192128,2017-02-09 14:49:28,RepHastingsFL,508,0,Twitter Web Client,"RT @WhipHoyer: Democrats are standing up, speaking out &amp; taking action. We will not stop #FightingForAll Americans."
829436307231367170,2017-02-08 21:06:40,RepHastingsFL,1,2,Twitter Web Client,@CarloslCurbelo and I have reintroduced our bipartisan FILET Act to combat Invasive Lionfish https://t.co/jhuyRjttHM
829055376494587904,2017-02-07 19:52:59,RepHastingsFL,6,8,Twitter Web Client,"Today is National Black HIV/AIDS Awareness Day. #GetEducated, #GetInvolved,  #GetTested, #GetTreated  #NBHAAD2017 https://t.co/rZewb1qSE6"
829027709040861184,2017-02-07 18:03:03,RepHastingsFL,4,1,Twitter Web Client,@BetsyDeVos’s family gave nearly $1M to 20 senators who just voted to confirm her.  https://t.co/i3Ma3FryoG Congress needs to do better.
828973184309456896,2017-02-07 14:26:23,RepHastingsFL,820,0,Twitter Web Client,RT @BobbyScott: .@HouseGOP’s #ACA repeal would leave 4 million children without coverage – doubling the child uninsured rate by 2019. #Prot…
826918964798320649,2017-02-01 22:23:39,RepHastingsFL,19,39,Twitter Web Client,Irony [i·ro·ny]: The act of calling for a speedy #SCOTUS confirmation after holding the seat hostage for a year https://t.co/N8oS7ZsYCL
826839159406997504,2017-02-01 17:06:32,RepHastingsFL,3,11,Twitter Web Client,Very proud to mark #BlackHistoryMonth https://t.co/MurdbWTrCq
826428315489665024,2017-01-31 13:53:59,RepHastingsFL,628,0,Twitter Web Client,RT @JoaquinCastrotx: There’s still time for you &amp; your loved ones to #GetCovered. Sign up before tonight’s deadline hits at midnight ET! ht…
826161823288274946,2017-01-30 20:15:02,RepHastingsFL,7,9,TweetDeck,"$4,500 for an epinephrine injector is unconscionable. More proof that Congress needs to rein in big-pharma. https://t.co/aqeCqwKhoD"
826118133446483968,2017-01-30 17:21:26,RepHastingsFL,3,5,Twitter Web Client,@RealDonaldTrump downgraded top #NSC professionals &amp; elevated a fringe political advisor in their place. Dangerous and very concerning.
825406095057358851,2017-01-28 18:12:03,RepHastingsFL,49,102,Twitter Web Client,I am outraged by @RealDonaldTrump’s #MuslimBan. It is illegal &amp; a stain on America. History will judge us for this failure.
824995269322366977,2017-01-27 14:59:34,RepHastingsFL,11,22,Twitter Web Client,"On #HolocaustMemorialDay, we honor the victims of the Holocaust &amp; rededicate ourselves to standing against hate. https://t.co/ViziWArkDO"
824711925544128512,2017-01-26 20:13:40,RepHastingsFL,251,0,Twitter Web Client,RT @HFACDemocrats: 1. Millions voted illegally: FALSE 2. Evidence that #Russia involved w/hacking: TRUE Which one does @POTUS think we shou…
824325804054216704,2017-01-25 18:39:21,RepHastingsFL,4,11,Twitter Web Client,"minorities, elderly, young, and poor Americans to vote is not just wrong, it is un-American. (4/4)"
824325727504003072,2017-01-25 18:39:03,RepHastingsFL,3,11,Twitter Web Client,the President is not on their side. Using conjured allegations of #voterfraud to make it harder for… (3/4)
824325618309464064,2017-01-25 18:38:37,RepHastingsFL,4,13,Twitter Web Client,under the guise of #alternativeFacts in order to distract the American people from the fact that… (2/4)
824325524495499265,2017-01-25 18:38:14,RepHastingsFL,5,16,Twitter Web Client,"There is zero evidence of widespread #voterfraud, yet this administration continues to spread vicious lies … (1/4)"
824322490466009088,2017-01-25 18:26:11,RepHastingsFL,1,5,Twitter Web Client,@RepRobWoodall &amp; I just introduced a resolution condemning Palestinian incitement &amp; terrorism. https://t.co/GCLNrbtW2E #Israel
824316379692204033,2017-01-25 18:01:54,RepHastingsFL,8,8,Twitter Web Client,https://t.co/uUBMXRiRBO - President Trump is putting the oil industry ahead of the American people. #NoDAPL #NoKXL
823625817108480002,2017-01-23 20:17:51,RepHastingsFL,13,25,Twitter Web Client,Why are Republicans so obsessed with controlling women’s reproductive rights? #TrumpGlobalGag #Roe44 My statement: https://t.co/gcs7VuBEJ6
823209286159527937,2017-01-22 16:42:42,RepHastingsFL,37,113,Twitter Web Client,Women have the right to make their own decisions about their bodies and healthcare #7in10forRoe #Roe44 My statement: https://t.co/7ABb2Yk4qB
822662514299338756,2017-01-21 04:30:02,RepHastingsFL,4,6,Twitter Web Client,"I will appear on To the Point with Michael Williams this Sunday, January 22nd. https://t.co/tm7HR7Su2b"
822522242257059842,2017-01-20 19:12:38,RepHastingsFL,4,10,Fireside Publishing,Here is my statement on the Inauguration of President Donald Trump: https://t.co/8fl1Y5bQI9
822125650366656513,2017-01-19 16:56:44,RepHastingsFL,11,6,Twitter Web Client,30 bomb-threats made to American Jewish institutions yesterday alone. Deeply concerned by this wave of hate. https://t.co/IQnSdpytfg
821463437263982592,2017-01-17 21:05:20,RepHastingsFL,11,5,Twitter Web Client,Nonpartisan CBO Report says GOP #ACA plan will lead to 32M without healthcare &amp; 50% increase in premiums by 2026. https://t.co/LhWpYG8mW1
821433442848174080,2017-01-17 19:06:08,RepHastingsFL,151,386,Fireside Publishing,I will be boycotting the inauguration of President-elect Donald Trump. See my full statement here: https://t.co/p9F5dqoDl4
821382988374167557,2017-01-17 15:45:39,RepHastingsFL,591,0,Twitter Web Client,RT @RepRoybalAllard: .@HouseGOP actions to start #ACA repeal could devastate millions who have ACA-covered mental health care. https://t.co…
821021635784429569,2017-01-16 15:49:46,RepHastingsFL,7,11,Twitter Web Client,"My statement in commemoration of Rev. Dr. Martin Luther King, Jr. Day: https://t.co/jflkhi9EcH #MLK"
820784141771870214,2017-01-16 00:06:03,RepHastingsFL,18,15,Twitter Web Client,"Today I joined @RepTedDeutch, @DWStweets and other supporters in the fight to protect the #ACA. https://t.co/3IIM463U7Y"
820375774020718592,2017-01-14 21:03:21,RepHastingsFL,18,22,Twitter Web Client,"@RealDonaldTrump: successful Presidents don’t tear people down, they build them up. Put down the phone and show us you’re ready to lead."
820375624829300736,2017-01-14 21:02:45,RepHastingsFL,10,11,Twitter Web Client,"@RealDonaldTrump: the “talk,” actions, and sacrifices of #MLK, @RepJohnLewis, &amp; others altered the course of our nation."
819553722636402689,2017-01-12 14:36:48,RepHastingsFL,874,0,Twitter Web Client,RT @RepCummings: #RussianHacking was an attack on our nation. #ProtectOurDemocracy Act will create independent commission to help prevent i…
818954441193902080,2017-01-10 22:55:28,RepHastingsFL,7,7,Fireside Publishing,The Senate has begun confirmation hearings but many of the nominees have not completed their ethics reviews. https://t.co/pmIIu8QFPO
818560260185198592,2017-01-09 20:49:08,RepHastingsFL,3,2,Fireside Publishing,My statement on yesterday's terror attack in Jerusalem: https://t.co/OuRGwkq7Gu
818550901506011136,2017-01-09 20:11:57,RepHastingsFL,13,10,Fireside Publishing,"I just introduced the Justice for Yazidis Act, legislation to aid religious minorities persecuted by ISIS. https://t.co/DhWpLIpDqy"
818478700278779904,2017-01-09 15:25:03,RepHastingsFL,187,128,Fireside Publishing,I have reintroduced my resolution condemning the #Yulin Dog Meat Festival and urging China to end the dog meat trade https://t.co/yTeOjDezGU
817447774459490304,2017-01-06 19:08:31,RepHastingsFL,5,2,Fireside Publishing,My Statement on the Fort Lauderdale Airport Shooting: https://t.co/uhQwfkjaI8
817437136098050048,2017-01-06 18:26:15,RepHastingsFL,9,2,Twitter Web Client,Active shooter/casualties reported at Fort Lauderdale Airport. Information still coming in. Praying for the victims. https://t.co/ZEuphx46w0
817080735077056512,2017-01-05 18:50:02,RepHastingsFL,10,4,TweetDeck,Republicans want to pull the rug out from seniors benefiting from the #ACA and put insurance companies back in char… https://t.co/gCbLTLlgnU
817079471589113856,2017-01-05 18:45:01,RepHastingsFL,7,4,TweetDeck,The GOP plan to repeal the #ACA is shortsighted. Still waiting for Republicans to present their alternative plan fo… https://t.co/yGEnpOBWIZ
817075705905180672,2017-01-05 18:30:03,RepHastingsFL,5,10,TweetDeck,#ACAWorks: 1.6 million Floridians have gained insurance since 2010. 5.6 million no longer have annual &amp; lifetime li… https://t.co/fO9IK6w7Wq
817025321308475393,2017-01-05 15:09:50,RepHastingsFL,796,0,Twitter Web Client,RT @RepDianaDeGette: #ACA means ~85 million women now have access to preventive care like mammograms and flu shots. That's worth protecting…
816760729546145797,2017-01-04 21:38:27,RepHastingsFL,6,10,Twitter Web Client,Proud to continue my efforts to help Haiti become a strong and vibrant democracy https://t.co/ahi1KDSmDo
816396616437473280,2017-01-03 21:31:35,RepHastingsFL,4,4,Fireside Publishing,Hastings Introduces 15 Measures on the First Day of the 115th Congress https://t.co/iRmLfjrU2I
812436916239011840,2016-12-23 23:17:09,RepHastingsFL,10,4,Fireside Publishing,My Statement on tonight's UN Vote on Israel: https://t.co/SOrM7sqXDD
809070449682358276,2016-12-14 16:20:01,RepHastingsFL,25,30,TweetDeck,Today we remember the 26 children &amp; educators murdered at Sandy Hook Elem. Congress has failed to act to… https://t.co/iqEfuEZj7d
808388634525270016,2016-12-12 19:10:44,RepHastingsFL,16,14,Twitter Web Client,My statement on President-Elect Trumps rejection of the CIA assessment that Russia interfered with the U.S. election https://t.co/A8PBuw8Ksx
806989467890384896,2016-12-08 22:30:56,RepHastingsFL,5,11,Fireside Publishing,My Statement on the Passing of Former Senator John Glenn: https://t.co/hOEYZT3zSg
806571792366178304,2016-12-07 18:51:15,RepHastingsFL,6,6,Twitter Web Client,I join with all Americans in pausing to honor those lost during the attack on Pearl Harbor. #PearlHarbor75… https://t.co/5jmhwvimuq
805892893537947652,2016-12-05 21:53:33,RepHastingsFL,81,36,Twitter Web Client,@SpeakerRyan @GOPLeader let’s vote on #HRes752 before Congress adjourns. Animal welfare shouldn’t be a partisan issue. RT if you agree!
804392384339542016,2016-12-01 18:31:03,RepHastingsFL,9,6,Fireside Publishing,#HIVPrevention saves lives. We must continue to support testing and prevention around the world. #WorldAIDSDay https://t.co/rMq9C2EC14
803606191251292161,2016-11-29 14:27:00,RepHastingsFL,37,37,TweetDeck,"America’s working families deserve a raise. Today, I stand with workers across our nation in the #fightfor15.… https://t.co/lk2qyQSE1d"
803280042130214912,2016-11-28 16:51:00,RepHastingsFL,97,57,TweetDeck,@SpeakerRyan &amp; @GOPLeader: Give us a vote! Please help us pass #HRes752 #Yulin #YulinDogMeatFestival
803274764429078529,2016-11-28 16:30:02,RepHastingsFL,99,56,TweetDeck,@SpeakerRyan &amp; @GOPLeader: #HRes752 has 155+ bipartisan cosponsors and thousands of supporters. #Yulin #YulinDogMeatFestival #HRes752
803271234616225792,2016-11-28 16:16:01,RepHastingsFL,100,59,TweetDeck,@SpeakerRyan &amp; @GOPLeader: This would be the first time the House speaks out on global animal welfare #Yulin #YulinDogMeatFestival #HRes752
803269725140742144,2016-11-28 16:10:01,RepHastingsFL,119,54,TweetDeck,@SpeakerRyan &amp; @GOPLeader: Dogs are boiled alive and skinned alive during these festivals. #Yulin #YulinDogMeatFestival #HRes752
803267964548030464,2016-11-28 16:03:01,RepHastingsFL,76,44,TweetDeck,@SpeakerRyan &amp; @GOPLeader Schedule #HRes752 for a vote before Congress adjourns. #EndYulinForever #Yulin RT now if you agree!
803267460187230209,2016-11-28 16:01:01,RepHastingsFL,55,35,TweetDeck,@LisaVanderpump @AHWFoundation @DDAWP @HSIGlobal @PETA Twitterstorm happening now! #EndYulinForever #Yulin #HRes752
803267222806417408,2016-11-28 16:00:04,RepHastingsFL,109,55,TweetDeck,Twitterstorm – Happening Now! Urge House Republican leadership to vote on #HRes752. #EndYulinForever #Yulin (1/2)
802652277785956352,2016-11-26 23:16:30,RepHastingsFL,9,9,Fireside Publishing,My statement on the death of Fidel Castro: https://t.co/JwL8baUE6s
801843237262594048,2016-11-24 17:41:39,RepHastingsFL,6,6,Twitter for iPhone,Happy Thanksgiving! Wishing you and your family a very joyous day.
801091574654504960,2016-11-22 15:54:49,RepHastingsFL,134,76,Twitter Web Client,"@LisaVanderpump @AHWFoundation @DDAWP @HSIGlobal @PETA Twitterstorm from 11AM-12PM (EST) on 11/28/16, calling for a vote on #HRes752 (2/2)"
801091093114847232,2016-11-22 15:52:54,RepHastingsFL,190,161,Twitter Web Client,Twitterstorm alert: Join me from 11:00 AM to Noon (EST) on 11/28/16 to call for a vote on #HRes752. #EndYulinForever #Yulin (1/2)
798952530059218944,2016-11-16 18:15:01,RepHastingsFL,23,24,TweetDeck,1 in 4 renters are paying more than HALF their paycheck for rent. Affordable housing should be prioritized in the… https://t.co/yZDuitFFc8
798285725661859851,2016-11-14 22:05:23,RepHastingsFL,133,67,Fireside Publishing,Congress should vote on H.Res.752. @SpeakerRyan and @kevinomccarthy: will you schedule this resolution for a vote? https://t.co/SnbBJTI3ji
798249902971224065,2016-11-14 19:43:02,RepHastingsFL,10,14,Twitter Web Client,My thoughts and prayers are with Gwen Ifill’s family during this terribly sad time. She was an inspiring figure and will be greatly missed.
797085976711438337,2016-11-11 14:38:00,RepHastingsFL,10,13,TweetDeck,I join with millions of Americans in pausing today to honor the brave men and women who have fought and died for our country. #VeteransDay
795726451085606912,2016-11-07 20:35:44,RepHastingsFL,9,13,Fireside Publishing,I join with so many around the nation in mourning the loss of Janet Reno https://t.co/DsVcibUrAj
795699043385143296,2016-11-07 18:46:49,RepHastingsFL,512,0,Twitter Web Client,RT @keithellison: Remember this history: Not until 1964 with the passage of the 24th amendment were poll taxes banned. Don't let that work…
795444067119276032,2016-11-07 01:53:38,RepHastingsFL,14,10,Fireside Publishing,Hastings’ Statement on Second FBI Director Comey Letter https://t.co/j9fx6u7tzi
794288049295425536,2016-11-03 21:20:02,RepHastingsFL,53370,0,Twitter for iPhone,"RT @repjohnlewis: I’ve marched, protested, been beaten and arrested--all for the right to vote. Friends of mine gave their lives. Honor the…"
793876317435559936,2016-11-02 18:03:58,RepHastingsFL,252,0,Twitter for iPhone,"RT @RepAdams: Casting your ballot and making your voice heard: that's what empowers voters, that's what makes a #StrongerAmerica. https://t…"
793179289877446656,2016-10-31 19:54:13,RepHastingsFL,155,129,Fireside Publishing,I wrote China’s Ambassador today regarding Chinese police officers aiding in the trafficking of dogs. #Fightdogmeat https://t.co/S2Rxj0Kp1B
791689331656228864,2016-10-27 17:13:40,RepHastingsFL,120,0,Twitter Web Client,RT @RepBrendanBoyle: How many people have already voted in the #2016election? 5.9 million. Check out how and where you can #voteearly: http…
791264367602008064,2016-10-26 13:05:00,RepHastingsFL,56,48,TweetDeck,Congress should provide adequate funding for the HBCU Historic Preservation Program. #PreserveHBCUs https://t.co/h18fnrSVnD
788451776831885312,2016-10-18 18:48:46,RepHastingsFL,8,5,Twitter Web Client,My thoughts and prayers are with Corey’s family and friends on this solemn occasion.
788451756674060288,2016-10-18 18:48:42,RepHastingsFL,7,3,Twitter Web Client,Today marks the one year anniversary of the tragic shooting death of Corey Jones by an undercover Palm Beach Gardens police officer.
788436630503841797,2016-10-18 17:48:35,RepHastingsFL,12,11,Twitter Web Client,I was pleased to speak at the OIC South Florida Summit this morning. It is imperative that we protect and grow the… https://t.co/NZpvA6d7Na
788379178978664448,2016-10-18 14:00:18,RepHastingsFL,192,0,Twitter Web Client,RT @RepJimCosta: During #DomesticViolenceAwarenessMonth we stand with the 1/3 women &amp; 1/4 men who are victims &amp; survivors of domestic viole…
786924535421501441,2016-10-14 13:40:04,RepHastingsFL,236,0,Twitter Web Client,"RT @RepRubenGallego: #HispanicHeritageMonth isn't just about celebrating our culture, but fighting for policies that will ensure a better f…"
785877111428886528,2016-10-11 16:17:58,RepHastingsFL,304,0,Twitter Web Client,"RT @repmarkpocan: Today we celebrate #NationalComingOutDay. Everyone needs support, no matter where they are in their journey. We're here f…"
784461687554539520,2016-10-07 18:33:35,RepHastingsFL,9,15,Twitter Web Client,"I agree, the Florida voter registration deadline should be extended due to Hurricane Matthew. https://t.co/4p8IR557xX"
784374707210579969,2016-10-07 12:47:57,RepHastingsFL,73,0,Twitter Web Client,"RT @NWSMiami: Matthew will move north today with winds decreasing across South Florida. However, unsettled seas and strong rip currents rem…"
784099883540213760,2016-10-06 18:35:54,RepHastingsFL,4,5,Twitter Web Client,President Obama has issued an emergency declaration for Florida for Hurricane Matthew. https://t.co/rmuhrrD65m
784098282926727168,2016-10-06 18:29:33,RepHastingsFL,6,3,Twitter Web Client,"Two Hendry County shelters are open, at Clewiston MS and LaBelle MS. Hendry County Emergency Management can be reached at (863) 674-5400."
783775035747999744,2016-10-05 21:05:05,RepHastingsFL,5,6,Twitter Web Client,Residents not currently registered for a Special Needs Shelter but require assistance should call 311 or 954-831-4000.
783774972149891072,2016-10-05 21:04:49,RepHastingsFL,5,5,Twitter Web Client,"The other 6 are: New Renaissance MS, Falcon Cove MS, Fox Trail ES, Lyons Creek MS, and Millennium MS (Pet-friendly) (2/3)"
783774833872105472,2016-10-05 21:04:16,RepHastingsFL,5,6,Twitter Web Client,"Ten Broward County Emergency Shelters opening at 9:00 PM: Arthur Ashe MS/Rock Island ES, Coral Glades HS, Everglades HS (1/3)"
783747562218086400,2016-10-05 19:15:54,RepHastingsFL,5,6,Twitter Web Client,"The other four Palm Beach County shelters opening are: Pahokee MS, Palm Beach Central HS, Palm Beach Gardens HS, and Park Vista HS (2/2)"
783747408572416000,2016-10-05 19:15:18,RepHastingsFL,5,6,Twitter Web Client,"Eight Palm Beach County shelters opening at 4:00 PM: Atlantic HS, Boynton Beach HS, Lakeshore HS, Forest Hill HS (1/2)"
783747066854051840,2016-10-05 19:13:56,RepHastingsFL,1,1,Twitter Web Client,@pbcgov has opened its special needs &amp; pet-friendly shelters. Eight other shelters will open at 4PM. County hotline: 561-712-6400
783305868016312320,2016-10-04 14:00:46,RepHastingsFL,245,0,Twitter for iPhone,RT @RepTerriSewell: #VotingRights are under attack. @HouseGOP left for a 46 day recess without working to protect our most basic rights. #D…
781500266080337921,2016-09-29 14:25:57,RepHastingsFL,3,9,Twitter Web Client,My thoughts are with all those affected this AM by the @NJTransit accident. Praying for a speedy recovery for the injured.
