id,created_at,user,retweets,favorite_count,source,text
851543146748137472,2017-04-10 21:11:21,RepJeffries,6,41,Twitter for iPhone,Chag Semeach &amp; Shabbat Shalom to all who are celebrating Passover this evening!
851485353190064129,2017-04-10 17:21:42,RepJeffries,20,70,Twitter Web Client,Helped @iamjohnoliver break down how gangsta Brooklyn politics can be #Gerrymandering https://t.co/fXq4Ccn69k
851442020124172288,2017-04-10 14:29:31,RepJeffries,325,0,Twitter Web Client,"RT @RepBera: We cannot move forward in #Syria haphazardly. @SpeakerRyan, the House must return to Washington to debate next steps."
851176695843434497,2017-04-09 20:55:13,RepJeffries,50,149,Twitter for iPhone,Trump must seek House/Senate approval b/f marching us into another War. No man is above the law
850745183973109760,2017-04-08 16:20:32,RepJeffries,1042,2221,Media Studio,"We all expect the President to have our best interests at heart. If @POTUS wants to prove that's the case, he shoul… https://t.co/tF1EluHbly"
850364624985882624,2017-04-07 15:08:20,RepJeffries,23,36,Twitter Web Client,Very disappointing jobs report. Expectation &gt; 200K. Result &lt; 100K. Not good https://t.co/Y1Fn2ukW6P
849988146683138048,2017-04-06 14:12:20,RepJeffries,58,117,Twitter Web Client,"Yes, we did it again. Can't stop, won't stop #TrumpTaxes https://t.co/AIRBCC1yQy"
849797308275458049,2017-04-06 01:34:01,RepJeffries,72,114,Twitter for iPhone,Deeply troubled by possibility that young police reform activists were spied on by NYPD https://t.co/FLFlzR1Xi7
849447374799896576,2017-04-05 02:23:30,RepJeffries,497,1321,Twitter for iPhone,BREAKING: US Court of Appeals just ruled that 1964 Civil Rights Act also protects LGBT community. The Rule of Law strikes again! #Progress
849340816707506176,2017-04-04 19:20:05,RepJeffries,35308,0,Twitter for iPhone,"RT @RepAdamSchiff: When McConnell  deprived President Obama of a vote on Garland, it was a nuclear option. The rest is fallout."
849262640530587648,2017-04-04 14:09:26,RepJeffries,25,42,Twitter Web Client,.@USAGSessions wants to turn back clock on police reform. We will #Resist. All day. Everyday https://t.co/8soOo7CcXV
849041114984271872,2017-04-03 23:29:10,RepJeffries,1004,1626,Twitter Web Client,"Just made clear on House Floor: Produce your taxes Mr. President, or NO tax reform legislation. Period. Full Stop. https://t.co/lW7PnO0G4R"
849027121074896896,2017-04-03 22:33:34,RepJeffries,42,140,Twitter for iPhone,Heading to House Floor w/ Resolution compelling Trump to produce Taxes immediately. Watch live https://t.co/9M92HsAahU
848905749640208384,2017-04-03 14:31:17,RepJeffries,55,166,Twitter Web Client,Did so-called President ever apologize for lying to America about @BarackObama's place of birth? What a fraud! https://t.co/gXmlg14nV0
848679354859220993,2017-04-02 23:31:40,RepJeffries,18,42,Twitter for iPhone,Enough already. Time the Donald focus on creating good-paying American jobs. And pray the FBI finds nothing https://t.co/aJq4qIWilg
848355287962718208,2017-04-02 02:03:56,RepJeffries,32,77,Twitter for iPhone,House GOP should abandon 7 yr obsession with repealing ACA. Once and for all. Then. We can talk #ProtectOurCare https://t.co/blw8jaST3w
847938928825040896,2017-03-31 22:29:29,RepJeffries,7,72,Twitter for iPhone,"Back home in NYC, headed to an event honoring the late/great Brooklyn DA Ken Thompson https://t.co/NzeMrWvVDI"
847616967729070081,2017-03-31 01:10:07,RepJeffries,42,152,Twitter for iPhone,Is this the beginning of the end for Team Trump?  https://t.co/1sWSkHU7rs
847545619262701569,2017-03-30 20:26:36,RepJeffries,114,262,Twitter for iPhone,Here's a thought: Before Congress addresses tax reform @POTUS must show American people his taxes
847206660988944384,2017-03-29 21:59:42,RepJeffries,347,507,Twitter Web Client,Why does GOP continue to stonewall our effort to investigate Trump/Russia hacking scandal? #Shameful https://t.co/TPJe2ePTEh
847114054766399488,2017-03-29 15:51:43,RepJeffries,55,78,Twitter for iPhone,Happening Now: @HouseJudiciary debating Trump/Russia election interference resolution. Watch https://t.co/omKd0KBxlH #FollowTheFacts
846784989933047810,2017-03-28 18:04:08,RepJeffries,387,507,Twitter Web Client,.@HouseJudiciary Republicans must put country b/f party &amp; support Resolution w/ @RepTedLieu on Trump/RussiaHacking… https://t.co/R4dTlxFetg
846418506371485697,2017-03-27 17:47:52,RepJeffries,24,92,Twitter for iPhone,House back in session. Next up? Our fight to defeat proposed @POTUS budget #StopTrump
846090416374140928,2017-03-26 20:04:09,RepJeffries,10,35,Twitter for iPhone,Wonderful community celebration for Hon. Annette Robinson. Thankful for her tremendous service #BedStuy https://t.co/VdYjVk4N4g
845724745349914625,2017-03-25 19:51:06,RepJeffries,143,478,Twitter for iPhone,"Flynn? Gone. Travel Ban? Unconstitutional. TrumpCare? Defeated. Welcome to D.C., Mr. President #Resist"
845361373261582340,2017-03-24 19:47:12,RepJeffries,169,488,Twitter for iPhone,BREAKING: Trump &amp; House Republicans cave in and cancel vote. They LOSE. America WINS. Mission Accomplished #KillTheBill
845338060577484800,2017-03-24 18:14:33,RepJeffries,13,74,Twitter Web Client,"Facing uniform @HouseDemocrats opposition to TrumpCare, bill may be on verge of COLLAPSE. Keep the Pressure On! https://t.co/6KkQhh3pjl"
845305592491200512,2017-03-24 16:05:32,RepJeffries,46,183,Twitter Web Client,"Just left House Floor, made clear #TrumpCare will be DISASTER for hardworking Americans. Vote it down. NOW https://t.co/lw0Lv5cHdE"
845299434011459589,2017-03-24 15:41:04,RepJeffries,22,41,Twitter for iPhone,"Debate on #TrumpCare (pay more, get less) has begun on the House Floor #Resist #ProtectOurCare https://t.co/9M92HsAahU"
845269495384084480,2017-03-24 13:42:06,RepJeffries,19,95,Twitter for iPhone,"After embarrassment @POTUS orders GOP to vote on #TrumpCare (pay more, get less) today. @HouseDemocrats will FIGHT to finish #ProtectOurCare"
845053190689226757,2017-03-23 23:22:35,RepJeffries,17,52,Twitter for iPhone,"Here's what we learned, @SpeakerRyan &amp; @POTUS don't run DC. Hard right #FreedomCaucus does. Total Chaos

 https://t.co/XvZ2xEmeeU"
844998068441419779,2017-03-23 19:43:33,RepJeffries,146,445,Twitter for iPhone,BREAKING: TrumpCare vote in House just delayed due to lack of support. So much for Trump's Art of the Deal. He's a FAILURE already #Resist
844941696890753024,2017-03-23 15:59:33,RepJeffries,18,45,Twitter for iPhone,"TrumpCare (pay more, get less) will Repeal &amp; DISPLACE 24 million hardworking Americans who will lose health coverage #ProtectOurCare #Resist"
844887261758066692,2017-03-23 12:23:15,RepJeffries,29,57,Twitter Web Client,Mere incompetence by @DevinNunes or early stage cover-up?https://t.co/zsg6XqXYMa via @HuffPostPol
844626216015532032,2017-03-22 19:05:56,RepJeffries,56,151,Twitter Web Client,"With legitimacy of Trump's presidential election in doubt, his lifetime appt to Supreme Court can wait #FilibusterGorsuch #StopGorsuch"
844595297997242368,2017-03-22 17:03:05,RepJeffries,19,48,Twitter Web Client,"Joined @HouseDemocrats on House Flr to BLAST #TrumpCare (pay more, get less) reckless plan that will bring Disease… https://t.co/tZxOa4lECX"
844582400009097216,2017-03-22 16:11:50,RepJeffries,12,39,Twitter Web Client,"Happening now, @HouseDemocrats blasting #TrumpCare on the House Floor https://t.co/9M92HsAahU"
844545718153031680,2017-03-22 13:46:04,RepJeffries,32,80,Twitter Web Client,More evidence emerges that Russia/Trump campaign colluded to elect #FakePresident. What a DISGRACE https://t.co/rtb1dDF8ps
844223635330125827,2017-03-21 16:26:14,RepJeffries,121,194,Twitter Web Client,"On House Floor, made clear #TrumpCare (pay more, get less) will be death sentence 💀 for thousands of Americans https://t.co/WBwo8fB6rp"
844175420744486912,2017-03-21 13:14:38,RepJeffries,14,30,Twitter for iPhone,"Telephone Town Hall Mtg tonight. If you live in 8th CD &amp; want to participate, call district office at 718-237-2211 #Democracy"
843993813744082944,2017-03-21 01:13:00,RepJeffries,58,215,Twitter for iPhone,Liar-in-Chief maliciously slandered President Obama. Again. APOLOGIZE. Now. Have u no decency?
843921310245949441,2017-03-20 20:24:54,RepJeffries,244,0,Twitter for iPhone,"RT @OfficialCBC: Yes, we are meeting w/ @realDonaldTrump on March 22 @ 3 PM. We will answer his campaign question to Black America: What do…"
843897667830894596,2017-03-20 18:50:57,RepJeffries,21,67,Twitter for iPhone,Will @FBI #RussianHacking criminal investigation reveal we have FAKE Prez in @whitehouse? Stay tuned #FollowTheFacts
843855411094667265,2017-03-20 16:03:02,RepJeffries,60,165,Twitter for iPhone,FBI director makes clear Trump LIED about Obama ordering wiretap. How can anyone ever believe anything 45 has to say. Sad!
843841947391459328,2017-03-20 15:09:32,RepJeffries,7,60,Twitter for iPhone,Heading back to DC where @HouseDemocrats will fight to #SaveTheACA &amp; STOP #TrumpCare https://t.co/kt30QxIjmh
843469741394186240,2017-03-19 14:30:31,RepJeffries,25,79,Twitter for iPhone,Republican budget would devastate Meals-on-Wheels program. How cruel is that? #Resist
843235212221923330,2017-03-18 22:58:35,RepJeffries,27,86,Twitter Web Client,"Trump attacks close allies like Britain 🇬🇧, but can't say negative word about Russia/Putin. Why? #FollowTheFacts https://t.co/weJyRaRVcV"
842857324339482625,2017-03-17 21:57:00,RepJeffries,78,164,Twitter Web Client,"Let's be clear: We Need Special Prosecutor to Investigate Trump, Flynn &amp; All of the President's Men #RussianHacking https://t.co/RKGDz1WV9Y"
842784739429924865,2017-03-17 17:08:34,RepJeffries,1,12,Twitter for iPhone,"It's time for @nyknicks to let #PhilJackson go. Nice thought, didn't work out. Let's move on https://t.co/ujUV7cPGGo"
842753872632397828,2017-03-17 15:05:55,RepJeffries,18,28,Twitter for iPhone,Trump budget takes dead aim at Rural America (among others). What a loyal guy #BrokenPromises https://t.co/VhFFO7kv9v
842728810009255937,2017-03-17 13:26:20,RepJeffries,771,0,Twitter for iPhone,"RT @JuliaBrownley26: From vet homelessness to healthcare, the President's budget makes it harder and provides less than needed to serve our…"
842472260741005312,2017-03-16 20:26:53,RepJeffries,41,102,Twitter Web Client,Made clear at Budget Cmte mtg that #TrumpCare is nothing more than a sham masquerading as a healthcare bill https://t.co/HHRe5xvB4O
842376673135849472,2017-03-16 14:07:04,RepJeffries,30,113,Twitter for iPhone,Heading to Budget Committee where @HouseDemocrats will fight to kill #TrumpCare. Need 4 courageous Republicans to join us
842351890146971650,2017-03-16 12:28:35,RepJeffries,318,0,Twitter for iPhone,RT @RepGeneGreen: Make no mistake – the GOP’s #PayMoreForLess bill will hit working families in the pocketbook &amp; make them #PayMoreForLess…
842154363254628353,2017-03-15 23:23:41,RepJeffries,49,147,Twitter for iPhone,Fed Judge just halted Trump Travel ban. Again. We will resist unconstitutional overreach from electoral college Pre… https://t.co/NsqtsolVfe
842045950654873604,2017-03-15 16:12:53,RepJeffries,46,119,Twitter for iPhone,"Repub Intelligence Cmte Chair just refuted Trump LIE that Obama ordered wiretap. Once again, so-called President exposed as a fraud"
842023193741262848,2017-03-15 14:42:28,RepJeffries,826,0,Twitter for iPhone,RT @RepMarkTakano: Americans need health care – not a #PayMoreForLess bill that gives tax breaks to rich at expense of 24 million Americans…
841829591274655744,2017-03-15 01:53:09,RepJeffries,65,161,Twitter for iPhone,"America deserves to know more. If there is nothing to hide, release ALL your tax returns. NOW #TrumpTaxes"
841813104409382912,2017-03-15 00:47:38,RepJeffries,21,66,Twitter for iPhone,"Breaking news, @maddow plans to reveal @potus tax returns at 9 pm. Trump can run but he can no longer hide… https://t.co/6qfPqcXb8m"
841775328079015937,2017-03-14 22:17:32,RepJeffries,24,90,Twitter for iPhone,.@WhiteHouse wants bill called #RyanCare. @HouseGOP wants bill called #TrumpCare. Who knew healthcare was so complicated? #SaveTheACA
841638699175673856,2017-03-14 13:14:37,RepJeffries,65,225,Twitter for iPhone,House cancels votes due to storm. America should rejoice. No misery today https://t.co/1VUmeDw6iL
841410013600071680,2017-03-13 22:05:54,RepJeffries,30,62,Twitter for iPhone,"#TrumpCare = Higher costs/Less coverage for millions of Americans. For yrs Trump screwed his workers, now it's America's turn #Resist"
841385887913111554,2017-03-13 20:30:02,RepJeffries,18,46,Twitter for iPhone,"Breaking, 14 million LESS Americans insured under #TrumpCare according to Congressional Budget Office. Time to #SaveTheACA &amp; STOP repeal"
841365241778851843,2017-03-13 19:08:00,RepJeffries,38,112,Twitter for iPhone,"Trump advisor who uses ""alt facts"" says ""I'm not in the job of having evidence."" Yeah, we figured that out months a… https://t.co/ZijesWKl1l"
841026844824592384,2017-03-12 20:43:19,RepJeffries,274,644,Twitter for iPhone,Trump has produced zero evidence that Obama wiretapped his phone. Kinda like the birth certificate charade. Will the lies ever stop?
840675932029501447,2017-03-11 21:28:55,RepJeffries,104,198,Twitter for iPhone,Trump just fired prosecutor renowned for public corruption cases. So much for the rule of law. Sad! https://t.co/Gf3sCQzGFC
840627916912369665,2017-03-11 18:18:08,RepJeffries,82,166,Twitter Web Client,Interviewed by @WolfBlitzer on @CNN. Asked about Trump. Russia. Taxes. HealthCare. And Biggie. Never thought Hip Ho… https://t.co/llMXLCscML
840562171016810496,2017-03-11 13:56:53,RepJeffries,156,218,Twitter Web Client,Trump has spent his entire life cheating others to enrich himself. Period. Full stop. Why would anything change now? https://t.co/Vd7RZI47gt
840335625098264576,2017-03-10 22:56:40,RepJeffries,42,77,Twitter for iPhone,Are Trump/Kremlin hacking connections coincidence or collusion? We plan to find out https://t.co/fa1H10C2dC https://t.co/Bs5eDjdEcg
840267719509438464,2017-03-10 18:26:50,RepJeffries,21,67,Twitter for iPhone,Proud to stand w/ @NYGovCuomo in support of $1.4 Billion effort tackling poverty/suffering in central Brooklyn  https://t.co/hT4T6RUezF
840003718166794242,2017-03-10 00:57:47,RepJeffries,2502,3995,Twitter Web Client,Just paid tribute to late/great #BiggieSmalls on House flr. Gone but never forgotten. #WhereBrooklynAt… https://t.co/q1liNJ2gtz
839983645691637760,2017-03-09 23:38:01,RepJeffries,83,129,Twitter Web Client,Sickened and outraged by bomb threat directed at Jewish Children's Museum in Brooklyn early today. This must STOP  https://t.co/6Rc2NNPg4q
839938865397968896,2017-03-09 20:40:05,RepJeffries,27,94,Twitter Web Client,"Blasted #TrumpCare on House Floor, bill will increase costs and gut coverage! DISASTER for America https://t.co/QchHfyk2J1"
839897862154645504,2017-03-09 17:57:09,RepJeffries,158,248,Twitter Web Client,"Just introduced Resolution of Inquiry w/ @RepTedLieu &amp; @HouseDemocrats demanding Trump come clean, re:… https://t.co/QrxS7fzWCP"
839852311283367937,2017-03-09 14:56:09,RepJeffries,83,223,Twitter for iPhone,"Proud to rep the neighborhood that gave the world Brooklyn's Finest. May 21, 1972 - March 9, 1997 #BiggieSmalls https://t.co/4iPzyJdgBZ"
839483186019188736,2017-03-08 14:29:23,RepJeffries,739,0,Twitter for iPhone,RT @RepDelBene: The Ways &amp; Means Committee is marking up GOP's #PayMoreForLess bill today without a CBO score. This is not how this is supp…
839212809481306112,2017-03-07 20:35:00,RepJeffries,27,43,Twitter for iPhone,The GOP civil war has begun #Trumpcare #SaveTheACA https://t.co/6EkNEidZax
839193237734699012,2017-03-07 19:17:13,RepJeffries,20,29,Twitter Web Client,"TrumpCare will drive up costs and gut coverage. If they break it, they own it! https://t.co/GjNJD8izdd"
839118301544448001,2017-03-07 14:19:27,RepJeffries,2439,0,Twitter for iPhone,"RT @NancyPelosi: Just when you think you've seen it all, Republicans go more extreme. Their #MakeAmericaSickAgain bill will do massive harm…"
838800958519922690,2017-03-06 17:18:27,RepJeffries,30,93,Twitter for iPhone,"New travel ban from Trump, same old Xenophobia  #NoBanNoWall"
838770751847206912,2017-03-06 15:18:25,RepJeffries,53,167,Twitter for iPhone,Nobody held it down like Harriet Tubman #WomensHistoryMonth https://t.co/aAvdq1KfTg
838419603088891904,2017-03-05 16:03:05,RepJeffries,82,208,Twitter for iPhone,"Let's be clear Donald, only bad (or sick) guy connected to White House is YOU #FakePresident https://t.co/IfEwlK5Pya"
838394336274432000,2017-03-05 14:22:41,RepJeffries,45,146,Twitter for iPhone,"Trump lashes out, acknowledges serious investigation. He's in BIG trouble, may have run criminal enterprise. SHAME!"
838070233554374656,2017-03-04 16:54:48,RepJeffries,39,66,Twitter Web Client,"Republicans seek to destroy ACA, but refuse to produce so-called replacement plan. What are they hiding? https://t.co/vA23k5Mztw"
837773635595223042,2017-03-03 21:16:14,RepJeffries,6,31,Twitter for iPhone,Enjoyed spending time with the brilliant MS 207 Robotics team in Howard Beach today. Our future is bright! https://t.co/PpY7H86SbB
837665008947429376,2017-03-03 14:04:35,RepJeffries,19,45,Twitter Web Client,Waste $20 billion on a wall that doesn't work? NYET! https://t.co/ElHqb2G9vI
837431418443685888,2017-03-02 22:36:23,RepJeffries,8,12,Twitter for iPhone,Join me in Canarsie for mtg this evening w/ Army Corp of Engineers to discuss Storm Resiliency https://t.co/0L4NIBSrbm
837419406632304641,2017-03-02 21:48:39,RepJeffries,28,76,Twitter Web Client,"Just in, Sessions recuses himself from Trump/Russia investigation. Now he should hire a criminal defense attorney https://t.co/cGMKu2NZkv"
837381036971524098,2017-03-02 19:16:11,RepJeffries,47,96,Twitter Web Client,FBI director unloaded on Hillary but clams up re Trump &amp; #RussianHacking scandal. Double standard is NOT acceptable. https://t.co/nfA3dVsG25
837347009350807552,2017-03-02 17:00:58,RepJeffries,47,106,Twitter Web Client,Watergate began as simple break-in. Nixon denied involvement. 2 yrs later resigned in disgrace. Where will the #RussianHacking scandal lead?
837312951380029440,2017-03-02 14:45:38,RepJeffries,40,108,Twitter for iPhone,The @FBI must investigate Jeff Sessions for lying to Congress under oath #Perjury
837145631831506945,2017-03-02 03:40:46,RepJeffries,37,96,Twitter Web Client,BREAKING NEWS: Sessions hid mtgs w/ Russian Ambassador. AG must step aside from #RussianHacking investigation https://t.co/Z01FvoaS9a
836988947083444224,2017-03-01 17:18:10,RepJeffries,47,130,Twitter Web Client,"Just left House Floor, made clear American people deserve to know whether the President is a crook #Nixon #StayWoke… https://t.co/4GLDJueXLy"
836776395376324608,2017-03-01 03:13:33,RepJeffries,316,772,Twitter for iPhone,"Next time you come to the House, bring your tax returns with you #FollowTheFacts https://t.co/4sjGIOcIfb"
836760970982731776,2017-03-01 02:12:16,RepJeffries,44,109,Twitter for iPhone,Question for @RepJoeWilson: When are you planning to blurt out YOU LIE during this speech? https://t.co/QoOWd0xMkA
836670371600429060,2017-02-28 20:12:15,RepJeffries,56,63,Twitter for iPhone,Sessions withdraws DOJ objection in TX voting rights case and lifts up private prisons. They have no shame #ProtectOurDemocracy
836644050686083072,2017-02-28 18:27:40,RepJeffries,667,0,Twitter Web Client,RT @RepBRochester: .@realDonaldTrump did nothing to create jobs during his first 40 days. Tonight he’ll use #AlternativeFacts to say otherw…
836594534406586368,2017-02-28 15:10:54,RepJeffries,34,76,Twitter Web Client,Trump &amp; his legions prepare to storm Capitol tonight. House Democrats ready to #resist https://t.co/cBuGmyeLGp
836370262555779072,2017-02-28 00:19:44,RepJeffries,129,148,Twitter for iPhone,"Just in, @HouseGOP votes to keep Trump tax returns hidden from America people. SHAME!"
836312387791777793,2017-02-27 20:29:45,RepJeffries,29,93,Twitter for iPhone,House back in session today. Still waiting for Trump &amp; House Republicans to produce health care plan. Likely to happen? NYET!
836016529426776064,2017-02-27 00:54:07,RepJeffries,43,161,Twitter for iPhone,We will NOT allow so-called president to target hardworking Muslim-Americans in our community based on religion. No… https://t.co/4I2byGQ4fS
835875562883284992,2017-02-26 15:33:58,RepJeffries,43,98,Twitter for iPhone,Join me today for town hall mtg to discuss Trump attacks on religious freedom &amp; immigrant families #Resist https://t.co/MMwyu3r96u
835492604053712897,2017-02-25 14:12:14,RepJeffries,78,148,Twitter for iPhone,Hidden tax returns. Illegal contact w/ Russia. Election interference. Obstruction of Justice. Lock HIM up?  https://t.co/S6wYwKNHVY
835278287047905280,2017-02-25 00:00:37,RepJeffries,37,0,Twitter for iPhone,RT @RepRichardNeal: In South Texas today w @RepFilemonVela &amp; @RepJeffries touring US/Mexico border. We must remember the humane side of imm…
835223099377389568,2017-02-24 20:21:19,RepJeffries,35,102,Twitter for iPhone,Touring Texas/Mexican border fence in Brownsville. Trump claims it's the Wild West down here. Wrong! https://t.co/jD0a4Kb47g
835168766568894464,2017-02-24 16:45:25,RepJeffries,11,53,Twitter for iPhone,Heading to Texas/Mexican border in Rio Grande Valley w/ @RepFilemonVela   @RepRichardNeal &amp; Immigration advocates #NoBanNoWall
834768201183612928,2017-02-23 14:13:43,RepJeffries,45,112,Twitter for iPhone,Paid Protestor Claim = Fake News. GOP 🏃 scared. Real question: Does Putin have paid asset in White House? #FollowTheFacts
834399585544056833,2017-02-22 13:48:58,RepJeffries,173,372,Twitter Web Client,Rising tide of Anti-Semitic hate crimes unacceptable. Anytime. Anywhere. DOJ must vigorously investigate https://t.co/kVG6ffCUJW
834173872798834688,2017-02-21 22:52:04,RepJeffries,69,170,Twitter Web Client,Trump is correct. Country is divided. He has made problems worse by fanning flames of hatred &amp; division https://t.co/PFQQAeAUue
834142269645135874,2017-02-21 20:46:29,RepJeffries,15,42,Twitter Web Client,Focused on Trump. No final decision about City Hall until the Spring. #resist
834070451282391044,2017-02-21 16:01:06,RepJeffries,656,0,Twitter for iPhone,"RT @RepRaskin: We swear to defend the Constitution against enemies, foreign &amp; domestic. Urging all members, D &amp; R, not just to say the oath…"
833832274957332481,2017-02-21 00:14:40,RepJeffries,28,100,Twitter for iPhone,"What a tough guy this President of ours, attacking Sweden w/ #FakeNews. Pick on someone your own size. Sad!"
833768730123440130,2017-02-20 20:02:10,RepJeffries,51,189,Twitter for iPhone,If America &amp; the world is such a mess why is @POTUS always on vacation? #DoYourJob
833393455191748609,2017-02-19 19:10:58,RepJeffries,43,113,Twitter for iPhone,"Trump says news media the enemy of the American people. No 45, your best friend Putin is the real enemy #FollowTheFacts"
833114248331010048,2017-02-19 00:41:29,RepJeffries,53,127,Twitter Web Client,Who's in charge Trump or Bannon? #Resist https://t.co/8KHi3cGjct
833089718971686913,2017-02-18 23:04:01,RepJeffries,61,107,Twitter Web Client,Straight Talk from @RepJerryNadler (and the NY congressional delegation). Repeal of the ACA will be a death sentence https://t.co/fxyBlUSkys
833031427658760195,2017-02-18 19:12:23,RepJeffries,31,83,Twitter for iPhone,Joined with @NydiaVelazquez @repjoecrowley &amp; @RepJerryNadler to #ProtectOurCare. We will defend the ACA with everyt… https://t.co/zI2n0cxOy5
832953300215554048,2017-02-18 14:01:56,RepJeffries,45,105,Twitter Web Client,Trump tells reporter set up mtg w/ Congressional Black Caucus. @OfficialCBC Strikes Back https://t.co/dwBXKHpR9b
832790337777045504,2017-02-18 03:14:23,RepJeffries,82,141,Twitter Web Client,Partnered w/ @RepJohnConyers &amp; Dems to ask DOJ Inspector General to look into Trump/Sessions conflicts of interest https://t.co/7eEaFkovzM
832692496765292544,2017-02-17 20:45:36,RepJeffries,156,421,Twitter for iPhone,#Facts https://t.co/RI8fPsXPQN
832643503146426370,2017-02-17 17:30:55,RepJeffries,154,300,Twitter Web Client,Demanded @HouseJudiciary Committee put country over party and investigate Trump #FollowTheFacts… https://t.co/61fuf7Syfc
832587184762937344,2017-02-17 13:47:08,RepJeffries,916,0,Twitter for iPhone,RT @RepSpeier: Flynn lied to VP and FBI. @POTUS fires him and then blames the press. Sad! #FollowTheFacts
832305874265919488,2017-02-16 19:09:18,RepJeffries,308,528,Twitter for iPhone,"Trump just claimed he inherited a mess. Actually, you didn't.  President Obama inherited a mess, and turned the sit… https://t.co/xbXpXA8WUH"
832265826623447041,2017-02-16 16:30:10,RepJeffries,31,121,Twitter for iPhone,Where was the outrage at law enforcement leaks designed to hurt Hillary Clinton? #Phonies
832242304542978048,2017-02-16 14:56:42,RepJeffries,1080,0,Twitter for iPhone,RT @RepTerriSewell: Our best bet to stop Russian meddling is to #FollowTheFacts. But we can't do that if @HouseGOP keeps blocking independe…
832013132625240064,2017-02-15 23:46:03,RepJeffries,95,175,Twitter Web Client,Blasted so-called president during @HouseJudiciary hearing. How dare Trump question legitimacy of others #Fraud… https://t.co/MGZdnmtbEa
831978222187401216,2017-02-15 21:27:20,RepJeffries,39,234,Twitter for iPhone,"It's official, Trump's proposed labor secretary is OUT. Two down (Flynn + Puzder) &amp; several more to go. Resistance movement is alive &amp; well"
831953499139276810,2017-02-15 19:49:05,RepJeffries,30,104,Twitter for iPhone,"Just in, Trump's Labor Secretary nominee about to go down. Keep the pressure on, they are caving #Resist"
831920099766439936,2017-02-15 17:36:22,RepJeffries,55,114,Twitter Web Client,Trump poses greatest threat to our democracy since Nixon #InvestigateTheWhiteHouse https://t.co/8tY9mz4Gc4
