id,created_at,user,retweets,favorite_count,source,text
496728779625357312,2014-08-05 18:45:44,RepJeffries,2,2,Twitter Web Client,We should all care about #incomeinequality if we care about our nation's well-being http://t.co/14mWZGxCNr
496653642217578496,2014-08-05 13:47:10,RepJeffries,2,6,Twitter Web Client,Looking forward to spending some time with the @makerbot team this morning #Brooklyn #3DPrinting #Tech
496636036102254592,2014-08-05 12:37:12,RepJeffries,99,0,Twitter Web Client,RT @RepHorsford: Time to end #GOP tax favors for corporations that ship jobs overseas! More on the Dem #middleclassfirst agenda here: http:…
496319391869698048,2014-08-04 15:38:58,RepJeffries,127,0,Twitter Web Client,RT @RepJoeKennedy: .@HouseDemocrats have put forward an agenda that jumpstarts the economy &amp; puts the #middleclassfirst. Read more at http:…
496019063865626624,2014-08-03 19:45:35,RepJeffries,3,3,Twitter for BlackBerry®,House Republican march toward #impeachment exposed during #FoxNewsSunday debate https://t.co/ZgwD0NRmKk
495931945210355712,2014-08-03 13:59:24,RepJeffries,12,2,Twitter for BlackBerry®,"Will debate House GOP #lawsuit and march toward #impeachment on #FoxNewsSunday at 10:30 am, tune in for morning fireworks"
495691798590025728,2014-08-02 22:05:08,RepJeffries,4,0,Twitter for BlackBerry®,Spent morning with Bedford Stuyvesant residents talking quality of life issues at Congress on Your Corner http://t.co/NF3YoK0YJb
495348632724709376,2014-08-01 23:21:31,RepJeffries,3,2,Twitter Web Client,Why is Lady Liberty crying right now? http://t.co/oxvUibZNFl http://t.co/CL4YdWJ6Y1
495294352500207617,2014-08-01 19:45:50,RepJeffries,70,0,Twitter Web Client,RT @NY1: Breaking: The medical examiner rules Eric Garner's death a homicide due to neck and chest compressions.
495264818937745408,2014-08-01 17:48:29,RepJeffries,0,1,Twitter Web Client,"Voted NO on House Repub. #MartialLaw rule, designed to jam an egregious border bill down the throats of the people http://t.co/arjoUjNPts"
495197100532330496,2014-08-01 13:19:23,RepJeffries,17,8,Twitter Web Client,Can anybody tell me what's wrong with this screenshot of @SpeakerBoehner's website? #hypocrisy #lawsuit http://t.co/qkyI2kavK5
494940574546264066,2014-07-31 20:20:03,RepJeffries,5,4,Twitter for BlackBerry®,"America deserves action. But as the nation waits, House GOP procrastinates #DoNothingCongress"
494843974948233218,2014-07-31 13:56:12,RepJeffries,109,0,Twitter Web Client,"RT @RepDerekKilmer: 21st Century Make It in America Act, #RaiseTheWage, Healthy Families Act, #EqualPay - better uses of time than lawsuit.…"
494616664990687232,2014-07-30 22:52:57,RepJeffries,10,8,Twitter for BlackBerry®,Just voted no on authorizing dangerous House GOP lawsuit against the President http://t.co/bTHp3HCU8v
494581060433231872,2014-07-30 20:31:28,RepJeffries,0,0,Twitter Web Client,Debunking the myth of a @WhiteHouse #IRS targeting scandal: http://t.co/9ByiMH7o7P
494548564421660672,2014-07-30 18:22:20,RepJeffries,2,0,Twitter Web Client,"Reckless Republican lawsuit against @BarackObama is a down payment on #impeachment, paid for by the American taxpayer http://t.co/0nmkg9G4hs"
494519045954502656,2014-07-30 16:25:02,RepJeffries,2,1,Twitter Web Client,"About to confront Republicans on the House floor, re: Lawsuit &amp; the GOP march toward impeachment against @BarackObama http://t.co/lfcISPSVVf"
494469725767094272,2014-07-30 13:09:04,RepJeffries,3,0,Twitter Web Client,Making the case for a #minimumwage increase  http://t.co/dluPhPyHNh  #MiddleClassFirst
494159278081843200,2014-07-29 16:35:27,RepJeffries,3,2,Twitter Web Client,It's time for the @NatlParkService to fix the Canarsie Pier. Further delay is unacceptable http://t.co/RCqfteeN0J
493922959635910656,2014-07-29 00:56:24,RepJeffries,5,3,Twitter for BlackBerry®,We should not allow @SpeakerBoehner &amp; the #BlameBarackObamaCaucus to get away with suing the President http://t.co/khegpiiEnC
493922633755291649,2014-07-29 00:55:07,RepJeffries,4,4,Twitter for BlackBerry®,Went to bat for @BarackObama on the House floor tonight
493882214556651520,2014-07-28 22:14:30,RepJeffries,5,7,Twitter Web Client,"Traveling down to DC, after speaking @JCRC and @UJAfedNY #StandWithIsrael rally http://t.co/UtYtedJ1cC"
493755003136659456,2014-07-28 13:49:00,RepJeffries,0,4,Twitter Web Client,Spent time yesterday w/ Brighton Beach residents at #CongressOnYourCorner discussing #Israel #SandyRecovery #Housing http://t.co/Uj5HqiWulz
493200974517764099,2014-07-27 01:07:30,RepJeffries,2,4,Twitter Web Client,House GOP lawsuit against #BarackObama nothing more than a frivolous impeachment trial balloon
492734785249619971,2014-07-25 18:15:02,RepJeffries,3,1,Twitter Web Client,"In the aftermath of tragedy, need to re-examine policing strategy becomes more urgent http://t.co/0djRnH1DLB"
492686740315176960,2014-07-25 15:04:07,RepJeffries,2,0,Twitter Web Client,"GOP ""anti-poverty"" effort may actually expand inequality in America #RyanPlan http://t.co/ypOHwdlNhK"
492325210054737920,2014-07-24 15:07:31,RepJeffries,4,1,Twitter Web Client,For some New Yorkers @NYPDnews excessive force is an all too common occurrence http://t.co/l4EQvjMAR7
492058347261399041,2014-07-23 21:27:06,RepJeffries,5,8,Twitter Web Client,Iron Dome saves lives.  Congress should act swiftly on the supplemental funding request supported by @DeptofDefense
491996374855348224,2014-07-23 17:20:51,RepJeffries,4,1,Twitter Web Client,The case for humane treatment of unaccompanied minors: http://t.co/rQUPTRhaVY
491938399981674496,2014-07-23 13:30:28,RepJeffries,0,0,Twitter Web Client,"Will address unaccompanied minor crisis and criticism leveled @barackobama on the House floor at 10 am, tune in http://t.co/6MQIOxVgLh"
491665650814058497,2014-07-22 19:26:40,RepJeffries,2,2,Twitter for Android,Perhaps it's time the civilian complaint review board be given authority to discipline wayward police officers http://t.co/EaIlwwDg7M
490998570518990848,2014-07-20 23:15:56,RepJeffries,3,4,Twitter for Android,Is this depraved indifference to human life? You decide: http://t.co/Lm88OWt4WD
490619596572229632,2014-07-19 22:10:01,RepJeffries,10,5,Twitter for Android,"The more things change at the #NYPD,  the more they remain the same. #Justice4EricGarner"
489850171904499712,2014-07-17 19:12:36,RepJeffries,2,1,Twitter Web Client,Debunking the myth of executive lawlessness https://t.co/qbbWNP1ZUi
489441271535386624,2014-07-16 16:07:47,RepJeffries,1,0,Twitter Web Client,Traditionally conservative federal appeals court upholds racial diversity as an important factor in college admission http://t.co/SE5qLdEQdP
489113946365124608,2014-07-15 18:27:06,RepJeffries,0,2,Twitter Web Client,Nashville #songwriters take their creative brilliance to the Hill. Thanks for your advocacy. #SongwriterEquity http://t.co/EBxRFuWIB2
489079462349520896,2014-07-15 16:10:05,RepJeffries,4,1,Twitter Web Client,Expediting removal proceedings for unaccompanied minors in the absence of counsel would be a grave error. #DueProcessMatters
488719424837668865,2014-07-14 16:19:25,RepJeffries,4,2,Twitter Web Client,Stop and Frisk apologists try to revive a flawed program. We can't let it happen:    http://t.co/AXiIMFDZKN
488110248633171968,2014-07-12 23:58:46,RepJeffries,2,3,Twitter for BlackBerry®,Spent the morning at Congress on Your Corner in Bed-Stuy. Thanks to @TishJames &amp; @KarimCamara for stopping by http://t.co/IiGCxtk1zj
487667994298826753,2014-07-11 18:41:24,RepJeffries,28,11,Twitter for Android,The only entity that should be sued are House Republicans for legislative malpractice. #RenewUI
487366396733849600,2014-07-10 22:42:58,RepJeffries,3,2,Twitter Web Client,House GOP takes its obsession with the #AffordableCareAct to another level with its frivolous lawsuit against @BarackObama
487228468481236992,2014-07-10 13:34:53,RepJeffries,3,2,Twitter Web Client,Shameful assault on rent-stabilized #NYC residents continues by any and all means  http://t.co/fe7peE2HRO
486909438150721538,2014-07-09 16:27:11,RepJeffries,1,1,Twitter for BlackBerry®,It is time to make work pay in America #RaisetheMimimumWage https://t.co/sWnjEvxRio
486552361717211137,2014-07-08 16:48:17,RepJeffries,3,1,Twitter Web Client,Pressing the case for the Vulnerable Immigrant Voice Act. #UnaccompaniedMinors #VIVA      https://t.co/lkyHJnHOe6
486144148009791488,2014-07-07 13:46:11,RepJeffries,2,6,Twitter for BlackBerry®,"The 1964 Civil Rights Act turned 50 last week, but the road to equality is still under construction."
485471946696429569,2014-07-05 17:15:06,RepJeffries,4,7,Twitter for Android,"Gentrification continues to ravage central BK,threatening to eradicate working families in its way #KeepNYCaffordable http://t.co/wOsMsE1cge"
485047771448107008,2014-07-04 13:09:35,RepJeffries,7,5,Twitter for BlackBerry®,Happy Birthday #America!
484808465810878465,2014-07-03 21:18:40,RepJeffries,1,0,Twitter for BlackBerry®,Economy continues its upward trajectory as job growth in June exceeds expectations #AmericaRising
484409680790188032,2014-07-02 18:54:02,RepJeffries,0,2,Twitter for BlackBerry®,"Justice for Bed-Stuy slay victim Channel Petro-Nixon has not been swift, but her memory lives on in the community http://t.co/3tZWmpDQhF"
484330665086058496,2014-07-02 13:40:03,RepJeffries,4,4,Twitter for Android,"Why has the repair of crumbling bridges, roads and tunnels become such a partisan issue? http://t.co/hYgL5D7MKm"
484049255720812544,2014-07-01 19:01:50,RepJeffries,3,2,Twitter for Android,May prayers of comfort grace the families of the West Bank kidnap victims who were tragically slain in cold blood.
483802106886119424,2014-07-01 02:39:45,RepJeffries,2,1,Twitter for Android,"Supreme Court appears to decide that closely-held corporations are people, extending rights heretofore unrecognized  http://t.co/y2AKdl2e5H"
483431138867019776,2014-06-30 02:05:39,RepJeffries,8,7,Twitter for Android,"Governor Cuomo steps up effort to address #HIV infection in NY, a welcome initiative in central #Brooklyn  http://t.co/NmzgQ88ZC8"
483019356335771648,2014-06-28 22:49:23,RepJeffries,4,2,Twitter for Android,"Spike Lee back in #Bedford-Stuyvesant to commemorate 25th anniversary of urban classic ""Do the Right Thing""  http://t.co/6PGGS391pc"
482637981505699840,2014-06-27 21:33:56,RepJeffries,1,0,Twitter for BlackBerry®,Will affordable housing at Atlantic Yards finally become a reality?  http://t.co/ze9USO8lCT
482536320968179713,2014-06-27 14:49:58,RepJeffries,2,0,Twitter Web Client,It's time to move forward with comprehensive immigration reform. #CIR @cspanwj     http://t.co/3umG1Eb8nq
481927018104516609,2014-06-25 22:28:49,RepJeffries,7,0,Twitter Web Client,Supreme Court steps forward to protect cell phone privacy. A victory for civil liberties.  http://t.co/mbcNOXCzJX
481857815171305473,2014-06-25 17:53:50,RepJeffries,2,3,Twitter Web Client,All artists who share their sound recordings with the world should be fairly compensated #RespectAllMusic  https://t.co/EQUIhXF8Jt
481622005469675520,2014-06-25 02:16:48,RepJeffries,7,4,Twitter Web Client,#Unaccompanied minors fleeing extreme violence deserve legal counsel even in a foreign land #VIVA https://t.co/N5EBK6D0Wm
481512403474325506,2014-06-24 19:01:17,RepJeffries,68,0,Twitter Web Client,RT @OfficialCBC: WATCH LIVE: House and Senate Leaders Mark the 50th anniversary of the Civil Rights Act today at 3pm ET http://t.co/8PPTsEt…
481456171279458304,2014-06-24 15:17:50,RepJeffries,2,2,Twitter Web Client,Tenants remain under intense pressure as Rent Guidelines Board once again approves rent hike http://t.co/rOnp2SLoX0
481253820853682176,2014-06-24 01:53:46,RepJeffries,11,7,Twitter for Android,Introduced legislation to provide unaccompanied minors w/access to legal counsel during immigration proceedings #VIVA http://t.co/rolW3of7P0
481176857615028224,2014-06-23 20:47:57,RepJeffries,19,9,Twitter Web Client,House back in session today: will obstruction of the #unemployment insurance extension continue? #RenewUI
480816080035012608,2014-06-22 20:54:21,RepJeffries,5,1,Twitter Web Client,Children fleeing the Central American Northern Triangle need their home countries to step up: https://t.co/CgiVsw7Ev0
480501682493587456,2014-06-22 00:05:03,RepJeffries,3,0,Twitter for BlackBerry®,"Started off the day in #HowardBeach, during the 2nd installment of our #Congress on Your Corner series this month http://t.co/jyy9iz0GuE"
480032515399618560,2014-06-20 17:00:44,RepJeffries,0,2,Twitter Web Client,Fair and balanced at its best. #BushCheneyWar  http://t.co/uUAQ0Hi7md
480000345557725184,2014-06-20 14:52:55,RepJeffries,4,1,Twitter Web Client,"Justice for the #CentralParkFive was not swift, but appears to have finally arrived: http://t.co/6jtaCjCxV2"
479760440046919680,2014-06-19 22:59:37,RepJeffries,3,6,Twitter Web Client,Can someone tell Dick #Cheny to pipe down? http://t.co/I0ZnEpf46b
479677919284187136,2014-06-19 17:31:42,RepJeffries,3,1,Twitter Web Client,Is your rent too high? You may be able to keep it from climbing further. http://t.co/leKjlybnWR
479639508439539713,2014-06-19 14:59:04,RepJeffries,2,0,Twitter Web Client,Happy Freedom day this #Juneteenth 2014 http://t.co/lkE7Q5GEVB
479301303777366016,2014-06-18 16:35:10,RepJeffries,10,6,Twitter Web Client,"Instead of extending a helping hand, House Republicans continue to slap unemployed Americans in the face. #RenewUI https://t.co/lXurCHsTAR"
478983957795848193,2014-06-17 19:34:09,RepJeffries,5,8,Twitter Web Client,"War hawks lied our way into #Iraq, and now blame others for the mess they created. #Hypocrisy http://t.co/3WGPXWNMpa"
478934372469735425,2014-06-17 16:17:07,RepJeffries,15,7,Twitter Web Client,"Pray for the safe return of Naftali, Eyal and Gilad from their captors in the West Bank http://t.co/KoAYtHnIzV"
478600597134782466,2014-06-16 18:10:48,RepJeffries,4,3,Twitter for BlackBerry®,Senior day @NewYorkAquarium in #ConeyIsland http://t.co/0wxIjzm5yY
478538342238134272,2014-06-16 14:03:26,RepJeffries,4,2,Twitter for BlackBerry®,Humanitarian crisis at the border requires a compassionate response
478225403434123264,2014-06-15 17:19:55,RepJeffries,2,1,Twitter for BlackBerry®,Happy Father's Day! http://t.co/zxGUiOpswG
477562411919368192,2014-06-13 21:25:26,RepJeffries,1,1,Twitter Web Client,#Fatherhood matters.This weekend let's celebrate dads who are doing the right thing&amp;help others who want to do better http://t.co/qrYt51uoz6
477191899741032448,2014-06-12 20:53:09,RepJeffries,3,7,Twitter for BlackBerry®,"May God bless the memory of #RubyDee, a legendary actress and pioneer."
476839046308974592,2014-06-11 21:31:02,RepJeffries,7,3,Twitter Web Client,America needs to step up and deal with the gun violence problem ripping us apart from the seams. #EnoughIsEnough https://t.co/j7S3jvo1PV
476733830041468928,2014-06-11 14:32:57,RepJeffries,3,0,Twitter Web Client,"Real men cook #healthy food, just ask @RSherman_25 and @MichelleObama: https://t.co/DocNqIEopk"
476404972251545600,2014-06-10 16:46:11,RepJeffries,7,3,Twitter Web Client,Without #songwriters the entire music ecosystem as we presently know it ceases to exist: http://t.co/Q35bmgscRS
476363992462794752,2014-06-10 14:03:20,RepJeffries,1,1,Twitter for BlackBerry®,"Heading into House Budget Committee on the #WaronPoverty , 50 years after President Johnson challenged us to create a great society."
476123389354987520,2014-06-09 22:07:16,RepJeffries,4,2,Twitter for BlackBerry®,A new Fire Department Commissioner was sworn-in today. Let's hope he works to diversify a department long known for its racial exclusivity.
475790809967890432,2014-06-09 00:05:43,RepJeffries,56,24,Twitter for Android,"House GOP practice the politics of distraction, while leaving unemployed #Americans behind on the great recession's battlefield. #RenewUI"
475472352265142272,2014-06-08 03:00:17,RepJeffries,4,2,Twitter for BlackBerry®,Spent the morning with constituents in #Canarsie at Congress on Your Corner. The recovery continues. http://t.co/Qk63Hveur4
475033249975398400,2014-06-06 21:55:27,RepJeffries,4,0,Twitter for BlackBerry®,70 yrs ago brave Americans stormed the beaches of Normandy &amp; changed world history for the good. Let's never forget the #GreatestGeneration
475000810976198656,2014-06-06 19:46:33,RepJeffries,3,0,Twitter Web Client,The #economy continues to improve for the good of the #American people. Will House GOP obstructionism finally end? http://t.co/OCHonXg7cK
474956332442062849,2014-06-06 16:49:48,RepJeffries,3,0,Twitter for BlackBerry®,May God continue to bless and keep the memory and spirit of P.J. Avitto alive in our community.
474360993116852226,2014-06-05 01:24:08,RepJeffries,8,2,Twitter Web Client,Thanks @NYPDnews for your apprehension of the murder suspect. Please continue to pray for Mikayla and the families of those we lost.
474221432306929665,2014-06-04 16:09:34,RepJeffries,14,2,Twitter Web Client,We need all hands on deck in the effort to catch the psychopath who is on the loose in #Brooklyn:  http://t.co/eFhI6knV0b
473894496661692417,2014-06-03 18:30:27,RepJeffries,8,2,Twitter Web Client,The precious #EastNewYork stabbing victims deserve justice that is swift and comprehensive: http://t.co/o1kNqqS5AS
473157907711008770,2014-06-01 17:43:30,RepJeffries,2,0,Twitter for Android,"Judge Baer was a great man, who lived a great life and left a great legacy. May God continue to bless his family:
http://t.co/3AFHDOj1tt"
472552501343158273,2014-05-31 01:37:50,RepJeffries,3,0,Twitter for BlackBerry®,Shout out to the #innovators and inventors of the Breukelen Girl Scout Troop who learned about #patents this evening http://t.co/8SxgXcj5EP
472397396543299584,2014-05-30 15:21:30,RepJeffries,10,2,Twitter Web Client,Repealing mandatory minimum sentencing for drug abuse offenses will not unleash a crime wave on the American people http://t.co/ui5N0umVCJ
472062495327539200,2014-05-29 17:10:44,RepJeffries,4,0,Twitter for BlackBerry®,Discussing #marijuana arrest reform in NYC on HuffPost Live at 1:15pm. Join the conversation: http://t.co/VRw5f7VY3B
472022955267198976,2014-05-29 14:33:36,RepJeffries,9,9,Twitter Web Client,Thanks to @DrugPolicyNews and @VOCALNewYork for your strong advocacy on #marijuana arrest reform. A change will come. http://t.co/IZ3YVCNJU8
471756490169020416,2014-05-28 20:54:46,RepJeffries,11,2,Twitter for BlackBerry®,Healthy food is a successful recipe for a hearty #education. We should all support @MichelleObama on nutritional standards for our children.
471723080947990528,2014-05-28 18:42:01,RepJeffries,9,3,Twitter for BlackBerry®,"#MayaAngelou has departed for heaven, but her eloquence &amp; poetic genius will never be forgotten. May God bless her family &amp; all she touched."
471491596257468416,2014-05-28 03:22:11,RepJeffries,15,8,Twitter Web Client,It is time #NewYorkCity stopped being the #marijuana arrest capitol of the country: http://t.co/6tt9IyBtwa
470985230174531585,2014-05-26 17:50:04,RepJeffries,3,4,Twitter for Android,Let us never forget our brave soldiers who died so that America could remain free. #MemorialDay
470691425894797312,2014-05-25 22:22:35,RepJeffries,6,1,Twitter for Android,Prison Industrial Complex rears its ugly head at detention centers throughout the land: http://t.co/fqcoQWXtAg
470565471817719809,2014-05-25 14:02:05,RepJeffries,6,3,Twitter for Android,The Administration's move toward a more compassionate #immigration system is a welcome step in the right direction: http://t.co/9Fv2zVTMdM
469464544503689218,2014-05-22 13:07:24,RepJeffries,3,0,Twitter for BlackBerry®,"House #GOP refuses to allow vote on winding down the war in Afghanistan, but continues to politicize #Benghazi  #MoreofTheSame"
469118973762891776,2014-05-21 14:14:13,RepJeffries,0,1,Twitter for BlackBerry®,"Why would D. Cheney, who is looking for WMDs in Iraq 11 yrs later, think he has the credibility to question @barackobama on the #RuleofLaw?"
468886135528517633,2014-05-20 22:49:00,RepJeffries,0,1,Twitter Web Client,Trey Whitfield School in the House (of Representatives)! http://t.co/a5E0KUDwqq
468757686268755968,2014-05-20 14:18:36,RepJeffries,7,0,Twitter Web Client,March toward educational equality continues sixty years after historic Brown v. Board of Education decision: http://t.co/eZ2Wq4vs77
468567370089631745,2014-05-20 01:42:21,RepJeffries,5,3,Twitter for BlackBerry®,Good riddance to NH police commissioner who picked up baton from #DonaldSterling for latest display of hateful ignorance in 2014.
468534317883609088,2014-05-19 23:31:00,RepJeffries,7,3,Twitter for Android,Happening now: @OfficialCBC discussing the 60th anniversary of Brown v. Board of Education decision live on C-SPAN: http://t.co/6MQIOxVgLh
467806641686323200,2014-05-17 23:19:29,RepJeffries,4,0,Twitter Web Client,West Africa must crush the rise of extremism in their land. #BringBackOurGirls http://t.co/g5qO3I5RyA
467377540194402305,2014-05-16 18:54:23,RepJeffries,1,0,Twitter Web Client,A conversation with the Fourth Estate: http://t.co/lylxMocNya
467327593415704576,2014-05-16 15:35:55,RepJeffries,1,1,Twitter Web Client,FCC effort to scale back #NetNeutrality could stifle innovation: http://t.co/EscNMzyN6C
466401611724898304,2014-05-14 02:16:24,RepJeffries,4,2,Twitter for BlackBerry®,Prison Ship Martyrs Monument bill continues to gain support: http://t.co/5v2hWNnXrJ
466023179148742656,2014-05-13 01:12:38,RepJeffries,5,1,Twitter for BlackBerry®,Thanks to all of the Bedford Stuyvesant residents who stopped by Congress on Your Corner this evening in Fulton Park http://t.co/NSNa47S407
465542712213909505,2014-05-11 17:23:26,RepJeffries,3,5,Twitter for Android,Happy #MothersDay to all of the amazing and hard-working moms who make our community great.
465317788500774914,2014-05-11 02:29:40,RepJeffries,3,4,Twitter Web Client,Spent the evening with the mothers of #ConeyIsland  who have done so much for so many over the years. http://t.co/wpRIR0kOba
464838170644058112,2014-05-09 18:43:50,RepJeffries,3,1,Twitter for BlackBerry®,"House GOP talks fiscal responsibility, then votes to blow a $156B hole in our nation's deficit. Apparently, hypocrisy is not a constraint."
464766162673602560,2014-05-09 13:57:42,RepJeffries,2,3,Twitter for BlackBerry®,How will the proposed merger between Comcast and Time Warner Cable impact the people of #Brooklyn and #Queens? https://t.co/fac6UMWOVp
464197616058646528,2014-05-08 00:18:30,RepJeffries,25,14,Twitter for BlackBerry®,"House GOP votes to hold Lois Lerner in contempt, while continuing to leave millions of unemployed Americans in the cold. Shameful. #RenewUI"
464089683883200512,2014-05-07 17:09:37,RepJeffries,19,4,Twitter Web Client,The world should not rest until the kidnapped #NigerianSchoolgirls are resting safely and back with their families. #BringBackOurGirls
463707579269791744,2014-05-06 15:51:16,RepJeffries,3,2,Twitter Web Client,"Glad @BrooklynNets advanced to the next round, but delivering long-delayed affordable housing would be a better win for the ppl of #Brooklyn"
463471412825849856,2014-05-06 00:12:50,RepJeffries,13,4,Twitter Web Client,We should all firmly support Mayor @BilldeBlasio's plan to keep NYC affordable for working families&amp;the middle class http://t.co/3tOTFwaJve
463125232669040642,2014-05-05 01:17:14,RepJeffries,3,1,Twitter for BlackBerry®,Swift police action needed to catch perpetrators who callously defaced Manhattan Beach property w/ anti-Semitic words &amp; hateful swastikas
462727115205799936,2014-05-03 22:55:15,RepJeffries,3,3,Twitter Web Client,Excellent event hosted by @DrugPolicyNews yesterday with @DickGottfried &amp; CM @Vanessalgibson on marijuana policy reform.
462397551246049280,2014-05-03 01:05:41,RepJeffries,3,1,Twitter Web Client,"#Economy shows clear signs of improvement, now let's help our President finish the job. http://t.co/mLKPOVGBW5"
462286244718735360,2014-05-02 17:43:24,RepJeffries,0,0,Twitter Web Client,Spent the morning with Brother Nature and the brilliant students at the Trey Whitfield School in #EastNewYork http://t.co/wXsRlTnTS4
461944782097768448,2014-05-01 19:06:33,RepJeffries,5,1,Twitter Web Client,"House #Republicans pursue contempt vote against Lois Lerner, while ignoring millions of #Americans whose #unemployment insurance has run out"
461891762252836864,2014-05-01 15:35:52,RepJeffries,2,3,Twitter Web Client,Thanks to the Vulcan Society of Firefighters for your bravery in keeping #America safe. http://t.co/wewzJsFSYY
461605501474988032,2014-04-30 20:38:22,RepJeffries,0,0,Twitter for Android,The #Empire (State) strikes back: http://t.co/oLRW2ETJ5G #TaxFairness
461574129683300352,2014-04-30 18:33:42,RepJeffries,4,7,Twitter Web Client,"The best anti-poverty program is a great education and gainful employment: http://t.co/myBrAqzjzc
#povertyreduction"
461264558611787776,2014-04-29 22:03:35,RepJeffries,0,0,Twitter Web Client,"New @PolicySolutions report makes clear that for communities of color,the road 2 equality is still under construction http://t.co/txXtcAiq1T"
461223217521524736,2014-04-29 19:19:18,RepJeffries,2,2,Twitter Web Client,"#AdamSilver stepped up with #SterlingBan. But over the last 33 years,what did @NBA know &amp; when did they know it about Sterling's world view?"
461179595543568384,2014-04-29 16:25:58,RepJeffries,7,2,Twitter Web Client,"Thanks to my House colleagues who supported my first bill, the Prison Ship Martyrs' Monument Preservation Act: http://t.co/aNJNx0fk6X"
461130793457582080,2014-04-29 13:12:03,RepJeffries,4,0,Twitter Web Client,Thanks to Center for Global @PolicySolutions for helping @OfficialCBC address growing wealth disparity in #America https://t.co/ejf5KRzj6x
460936779009650689,2014-04-29 00:21:06,RepJeffries,18,6,Twitter Web Client,"Happening Now - The Congressional Black Caucus is discussing #racialwealthgap in America, live on C-SPAN:http://t.co/6MQIOxVgLh   #cbctalks"
