id,created_at,user,retweets,favorite_count,source,text
588337311869435904,2015-04-15 13:45:20,RepJeffries,158,0,Twitter Web Client,"RT @StaceyPlaskett: Today marks 100 days of the new Republican Congress: 100 days of dysfunction, obstruction &amp; distraction. Americans dese…"
588108595180503040,2015-04-14 22:36:30,RepJeffries,3,6,Twitter Web Client,Heading to House Floor with Rep. @Clyburn to discuss #WalterScott tragedy and #PoliceViolence in America http://t.co/9G1VhfezYw
588032410064912386,2015-04-14 17:33:46,RepJeffries,4,1,Twitter Web Client,Study exposes myth that #welfare recipients don't want to work #WorkingPoor →  http://t.co/CDGujxOGwt
587683749439135744,2015-04-13 18:28:19,RepJeffries,0,0,Twitter Web Client,Statement on the legacy of the Rev. Dr. Gardner C. Taylor http://t.co/IQ1uM6dSx8
587606753266774018,2015-04-13 13:22:21,RepJeffries,157,0,Twitter for iPhone,RT @RepAndreCarson: Proud to introduce a resolution this week making it clear that discrimination against LGBT Americans in Indiana &amp; elsew…
587331827414740993,2015-04-12 19:09:54,RepJeffries,6,7,Twitter for iPhone,Turmoil in the Capital City. Anxiety throughout the land. A dynamic woman rises to lead. #WinterIsComing
587006806335041536,2015-04-11 21:38:23,RepJeffries,8,7,Twitter for iPhone,Rest in Peace #WalterScott
586567027025977344,2015-04-10 16:30:51,RepJeffries,7,1,Twitter Web Client,Thanks to all of the Howard Beach residents who attended last evening's Superstorm Sandy Town Hall #FloodInsurance http://t.co/OaXKIFs0bw
586542096812744705,2015-04-10 14:51:47,RepJeffries,3,1,iOS,The consequences of the failed war on drugs are wide ranging →   #BanTheBox #SecondChance http://t.co/DpJJiNxHqH
586227223339917313,2015-04-09 18:00:36,RepJeffries,2,1,iOS,"Unpacking the #policeviolence phenomenon in America →
 http://t.co/XAJ4386aGc"
585822047776985088,2015-04-08 15:10:34,RepJeffries,139,0,Twitter Web Client,"RT @RepSusanDavis: Since last yr, nearly 1 mil borrowers fell behind on student loan payments. Let's pass #BankOnStudents bill so folks can…"
585637160084185090,2015-04-08 02:55:54,RepJeffries,10,2,Twitter for iPhone,Chilling video exposes what really happened to #WalterScott http://t.co/qSmFhZfB2S #PoliceViolence #ICantBreathe
585200793726386177,2015-04-06 22:01:56,RepJeffries,4,1,Twitter for iPhone,"POTUS has clear authority to take #ImmigrationAction under our Constitution. Read @HouseDemocrats' amicus brief → http://t.co/t4jb46Wz3G"""
585071610656358400,2015-04-06 13:28:36,RepJeffries,1,1,iOS,Legendary preacher Rev. Dr. Gardner C. Taylor has passed away.  May he Rest in Peace  http://t.co/Gin64i5GiK
584723209691467776,2015-04-05 14:24:11,RepJeffries,2,1,Twitter for iPhone,Happy Easter!!!
584501044236972034,2015-04-04 23:41:23,RepJeffries,9,3,iOS,Another senseless death resulting from #BrokenWindows? → http://t.co/qU7fhabVxK
584389060388597761,2015-04-04 16:16:24,RepJeffries,2,2,Twitter Web Client,"Wishing all those celebrating, a happy and safe Passover. #ChagSameach"
583700413972664321,2015-04-02 18:39:57,RepJeffries,8,3,iOS,"McDonald's Corp. decides to provide a McRaise, but we now need the franchisees to step up  http://t.co/NUrmdb7n09"
583438208869990400,2015-04-02 01:18:03,RepJeffries,5,2,Twitter Web Client,POTUS signs Slain Officer Family Support Act into law #DetectiveRamos #DetectiveLiu http://t.co/MIxwYhmjbm
583287814898483200,2015-04-01 15:20:26,RepJeffries,5,0,iOS,"Foot fraud, who knew? Thanks @BrooklynDA for your unyielding pursuit of justice → http://t.co/BOBUraD5dY"
583261880157896704,2015-04-01 13:37:23,RepJeffries,96,0,Twitter for iPhone,RT @PeterWelch: .@HouseDemocrats are fighting for bigger paychecks &amp; better infrastructure for hardworking families -- the true engine of e…
582945571331244032,2015-03-31 16:40:29,RepJeffries,3,1,iOS,"No #MinimumWageIncrease in #AlbanyBudget, but tax breaks for luxury yachts? → http://t.co/LyiuvRn3zK"
582661756411121664,2015-03-30 21:52:42,RepJeffries,2,0,iOS,Discussed adverse impact of #gentrification on Fox's @FBNStossel where we agreed to disagree → https://t.co/wP63MNuUx8
582543837157040128,2015-03-30 14:04:08,RepJeffries,3,2,Twitter Web Client,"Republicans scatter throughout the country for two weeks, leaving #LorettaLynch to twist in the wind. My thoughts: https://t.co/OkQ4Om4wo4"
581812630509191168,2015-03-28 13:38:35,RepJeffries,9,2,iOS,"Slain Officer Family Support Act of 2015 takes another step forward, on its way to @BarackObama's desk →
 http://t.co/Rlv8SrnN9y"
581492168000438272,2015-03-27 16:25:11,RepJeffries,4,0,iOS,Brooklyn House members demand Sandy Insurance Fraud Probe → http://t.co/ob3PaYpl24
581118097551200257,2015-03-26 15:38:45,RepJeffries,4,1,Twitter Web Client,"House takes bipartisan step to strengthen Health Care for children and seniors. In an era of dysfunction, it's a good day for democracy."
581086714434883584,2015-03-26 13:34:03,RepJeffries,2,0,Twitter Web Client,"RT @NYCMayorsOffice: Thanks @repjeffries, House of Representatives for honoring the legacy of Officers Liu and Ramos with the Slain Officer…"
581080040013697025,2015-03-26 13:07:32,RepJeffries,167,0,Twitter Web Client,RT @RepMarciaFudge: No hiding the radical and destructive values in the #GOPbudget. We should #InvestInKids. They’re our future. http://t.c…
580905621492502528,2015-03-26 01:34:27,RepJeffries,5,3,iOS,"House passes Slain Officer Family Support Act of 2015 #DetectiveRamos #DetectiveLiu →
 https://t.co/uMDDnAH4M1"
580739614685536256,2015-03-25 14:34:48,RepJeffries,4,1,Twitter for iPhone,"Shutdown Government, to stop millions benefiting from the ACA. When you need coverage, embrace the ACA #TedCruz=Hypocrisy"
580416481395081219,2015-03-24 17:10:47,RepJeffries,3,2,iOS,Inspector General should investigate FEMA flood insurance fraud debacle → http://t.co/8wTjEEVtHU
580361691424264192,2015-03-24 13:33:04,RepJeffries,492,0,Twitter Web Client,"RT @NancyPelosi: Thanks to the Affordable Care Act, being a woman is no longer a pre-existing condition. #ACAisworking http://t.co/XoRFwRAa…"
580361528945303552,2015-03-24 13:32:25,RepJeffries,5,5,Twitter Web Client,Memo to House Obstructionists: The #AffordableCareAct is a smashing success. Get over it!
580064991862194176,2015-03-23 17:54:05,RepJeffries,1,1,iOS,House Republican Budget = Bad news for working Americans and the economy #MiddleClassFirst http://t.co/LUU8FL1fWh
579777937269981184,2015-03-22 22:53:26,RepJeffries,25,22,iOS,Stood with @NydiaVelazquez and @YvetteClarke today to demand Senate confirmation of #LorettaLynch http://t.co/fLQlnN91iq
579722838799695874,2015-03-22 19:14:30,RepJeffries,3,2,Twitter for iPhone,"Another year, another MTA fare hike.  Has subway and bus service gotten any better?"
579457014495084545,2015-03-22 01:38:12,RepJeffries,22,12,iOS,"Tragedy strikes in Brooklyn, may God bless the family and community as it mourns  http://t.co/XwuutGqhNV"
579059835901202432,2015-03-20 23:19:57,RepJeffries,2,3,iOS,Shameful injustice in the #EricGarner case continues with decision to shield Grand Jury proceedings from the public → http://t.co/W7unKMbZgV
578652838668161024,2015-03-19 20:22:42,RepJeffries,20,13,Twitter for iPhone,Why is #LorettaLynch being treated differently? http://t.co/WpaD73vK2m
578617838845452288,2015-03-19 18:03:37,RepJeffries,1,0,Twitter Web Client,"With POTUS on this, let's fight for working families http://t.co/Vh4nDjTODM"
578556512911691778,2015-03-19 13:59:56,RepJeffries,1,0,iOS,"House GOP introduces reckless and extreme budget, that even the extremists can't pass #MarchMadness  http://t.co/gPewJOW6O8"
578272538092027904,2015-03-18 19:11:31,RepJeffries,4,1,Twitter Web Client,Secretary Perez explains the importance of a minimum wage increase to America https://t.co/JbIN7TLc1M
578242929250185216,2015-03-18 17:13:52,RepJeffries,6,2,Twitter Web Client,Loretta Lynch is exquisitely qualified to be America’s next AG. Can anyone explain the holdup?
578202245168291840,2015-03-18 14:32:12,RepJeffries,1,0,Twitter Web Client,House GOP unveils another slash and burn #budget targeting hardworking Americans → http://t.co/rXmhGhPrAh
577819965614510080,2015-03-17 13:13:09,RepJeffries,1,0,Twitter for iPhone,"@Senate_GOPs delay #Lynch confirmation, halt #sextrafficking bill. Is this what governing looks like?"
577537026272149505,2015-03-16 18:28:51,RepJeffries,11,0,Twitter for iPhone,RT @RepAdamSchiff: Loretta Lynch is an extremely qualified nominee for Attorney General who will do a superb job. End the holdup -- confirm…
577457057768566785,2015-03-16 13:11:05,RepJeffries,13,15,Twitter Web Client,This country's School to Prison Pipeline should shock the conscious of every American #criminaljusticereform http://t.co/cTHiTmUWPG
576825624863641601,2015-03-14 19:22:00,RepJeffries,3,1,iOS,"The #InnovationEconomy is a wonderful thing, let's make it work for everyone → http://t.co/TxzKq56B0q"
576555991514365952,2015-03-14 01:30:34,RepJeffries,9,6,Twitter Web Client,Has Rudy #Giuliani completely lost it? My thoughts on @allinwithchris → http://t.co/qMyY6tP2sC
576434645786591232,2015-03-13 17:28:23,RepJeffries,3,1,Twitter Web Client,Something is really rotten with a #SecretService culture gone wild → http://t.co/zDl8okJ18P
576395286513332224,2015-03-13 14:51:59,RepJeffries,99,0,Twitter for iPhone,RT @DorisMatsui: It's time for the @HouseGOP to work with Dems to put the #MiddleClassFirst. Bigger paychecks &amp; better infrastructure for w…
576029653388947456,2015-03-12 14:39:06,RepJeffries,112,0,Twitter Web Client,RT @RepHuffman: Bigger paychecks &amp; better infrastructure. We must put the #MiddleClassFirst. Working families are the engine of America's e…
576022885288054784,2015-03-12 14:12:12,RepJeffries,7,7,Twitter for iPhone,Pray for swift recovery for officers shot in #Ferguson. Memo: Selma succeeded because it was rooted in non-violent civil disobedience.
575780358454648832,2015-03-11 22:08:29,RepJeffries,11,12,Twitter for iPhone,#Ferguson Police Chief resigns in disgrace.  Good riddance.
575660715861803008,2015-03-11 14:13:04,RepJeffries,3,0,Twitter Web Client,Clinical Anti-Obama obsession reaches new low with open letter to Iranian extremists → http://t.co/CLdsO1LoOB
575469391262801921,2015-03-11 01:32:49,RepJeffries,5,5,Twitter for iPhone,"50 years after #Selma, @sae1856 frat boys make clear that racial hatred is alive and well #SAEHatesMe"
575308289044516864,2015-03-10 14:52:39,RepJeffries,552,0,Twitter Web Client,RT @repjohnlewis: We commemorated the 50th annv of Bloody Sunday. Now it's our responsibility to fix SCOTUS decision that put a dagger in t…
574967334668013569,2015-03-09 16:17:49,RepJeffries,4,0,Twitter Web Client,"After #Ferguson, the #HandsUpDontShoot rallying cry lives on → http://t.co/j81iQUC9Pv"
574948820385144832,2015-03-09 15:04:15,RepJeffries,157,0,Twitter Web Client,RT @RepTerriSewell: Selma is now! The fight for voting equality must continue so long as there are barriers that limit access to the ballot…
574566191659905024,2015-03-08 13:43:49,RepJeffries,8,7,iOS,Heading home inspired by @RepJohnLewis &amp; #SelmaFootSoldiers to continue our march toward a more perfect union #Selma http://t.co/DRvPz8Xbo2
574368612808454144,2015-03-08 00:38:43,RepJeffries,17,9,iOS,They faced down adversity on this bridge and swung open a gateway of opportunity for us all #BloodySunday http://t.co/YTkM97lBU1
574316729226108931,2015-03-07 21:12:33,RepJeffries,7,9,Twitter for iPhone,"POTUS rises to the occasion.  Moving address signed, sealed and delivered. http://t.co/SbSTyYYbTB"
574268441001066496,2015-03-07 18:00:40,RepJeffries,2,4,iOS,On the way to the #EdmundPettusBridge where patriotic good met segregationist evil 50 years ago today http://t.co/Pj3V9adU2Z
574262137251610624,2015-03-07 17:35:37,RepJeffries,0,1,iOS,Thank you #AmeliaBoynton #ViolaLiuzzo #ReverendF.D.Reese &amp; #SelmaFootSoldiers for helping make America more American http://t.co/E2hwhzZYV9
574241704032780288,2015-03-07 16:14:25,RepJeffries,5,4,iOS,Here in #Selma being deeply touched by testimony of panelists who lived through #BloodySunday http://t.co/QgUgagqlgL
573917600666771456,2015-03-06 18:46:33,RepJeffries,19,4,iOS,In route to commemorate #SelmaMarch #BloodySunday with civil rights hero @RepJohnLewis and @FaithNPolitics http://t.co/K6FQHY04n2
573854781585948672,2015-03-06 14:36:56,RepJeffries,3,1,iOS,Congratulations to @Etsy on its IPO. The Brooklyn #InnovationEconomy continues to charge forward  http://t.co/7SaXIZg9Tg
573620427773337600,2015-03-05 23:05:41,RepJeffries,3,5,Twitter for iPhone,"Another day, another snow storm in New York City. When will it end?"
573497998111543296,2015-03-05 14:59:12,RepJeffries,1,0,Twitter Web Client,March toward #SongwriterEquity takes another positive step forward  → http://t.co/41VULz06cb
573273165180362753,2015-03-05 00:05:48,RepJeffries,5,4,Twitter for iPhone,SCOTUS must put #PatientsOverPolitics in deciding legality of #AffordableCareAct
573231534423056384,2015-03-04 21:20:22,RepJeffries,2,4,iOS,Important step taken by @BillDeBlasio in recognizing two Muslim Holy Days in @NYCSchools  http://t.co/KmWM5LJVuD
573121225368715266,2015-03-04 14:02:02,RepJeffries,163,0,Twitter for iPhone,RT @RepSteveIsrael: Strong unity of @HouseDemocrats pushed full funding of @DHSgov across finish line. Time for @HouseGOP to stop the manuf…
572900826211074048,2015-03-03 23:26:15,RepJeffries,7,1,iOS,Racism within the #FergusonPoliceDepartment exposed by the Department of Justice  http://t.co/wYNsXH3OhE
572854871080103937,2015-03-03 20:23:39,RepJeffries,0,2,Twitter for iPhone,"Voted to fully fund @DHSgov, completing the collapse of the reckless Republican shutdown strategy"
572780883364724736,2015-03-03 15:29:39,RepJeffries,1,0,Twitter Web Client,Joined @OfficialCBC last evening in calling for #LorettaLynch to be confirmed immediately → https://t.co/fJylPR1VRK
572761147109208064,2015-03-03 14:11:13,RepJeffries,568,0,Twitter for iPhone,"RT @NancyPelosi: RT if you agree: @SpeakerBoehner must bring up clean, long-term, Senate-passed DHS bill. #DontShutDownOurSecurity http://t…"
572465541102870531,2015-03-02 18:36:35,RepJeffries,3,1,Twitter Web Client,Rep. Peter King (R-NY) on his own party's dangerous Homeland Security politics. MUST WATCH → http://t.co/b81uVyiyNk #DontShutDownOurSecurity
572436374823051266,2015-03-02 16:40:41,RepJeffries,3,3,Twitter Web Client,Can an otherwise dysfunctional Congress get something done on #CriminalJusticeReform?  http://t.co/KEqGvyWZbm
572400556905500672,2015-03-02 14:18:22,RepJeffries,116,0,Twitter Web Client,"RT @RepMarkTakai: @SpeakerBoehner, let us vote on clean long-term bill to fund DHS. Every House Dem supports! #DontShutDownOurSecurity http…"
571686196641984513,2015-02-28 14:59:45,RepJeffries,8,1,Twitter for iPhone,"Rest in Peace #LeonardNimoy, Rest in Peace #AnthonyMason"
571442361445822465,2015-02-27 22:50:50,RepJeffries,3,2,Twitter Web Client,When will the Republican recklessness end? Fully fund @DHSgov now.
571349943929180160,2015-02-27 16:43:36,RepJeffries,231,0,Twitter Web Client,"RT @HouseDemocrats: Stop the games, Mr. Speaker. #DontShutDownOurSecurity http://t.co/warYtQZ9Pk"
571335012789981184,2015-02-27 15:44:16,RepJeffries,2,1,Twitter Web Client,Legislative malpractice in full swing on the @HouseFloor  https://t.co/6pduYPl0Zr  #DontShutDownOurSecurity
571307864293318657,2015-02-27 13:56:23,RepJeffries,150,0,Twitter Web Client,"RT @BettyMcCollum04: GOP shutdown of DHS would make places like @mallofamerica more vulnerable. @SpeakerBoehner, #DontShutDownOurSecurity! …"
571069501019590658,2015-02-26 22:09:13,RepJeffries,6,2,Twitter Web Client,Are you tired of legislative temper tantrums that risk our safety and security? So am I https://t.co/GEBpnNfcfa #DontShutDownOurSecurity
570966036088029184,2015-02-26 15:18:05,RepJeffries,1,1,Twitter Web Client,Alleged terrorist plot to bomb parts of #ConeyIsland strikes close to home https://t.co/HaLQ8RJMHS @NewDay
570942887246102528,2015-02-26 13:46:06,RepJeffries,138,0,Twitter for iPhone,RT @RepJoeKennedy: .@HouseGOP shutdown of @DHSgov would have real impact on MA &amp; jeopardize the federal $ we need for snow recovery. http:/…
570747709554085888,2015-02-26 00:50:32,RepJeffries,10,4,iOS,Questioned Nevada Attorney General about his lawsuit challenging the President's immigration executive action  https://t.co/DwYD1qfdii
570676144523124736,2015-02-25 20:06:10,RepJeffries,2,0,Twitter Web Client,Statement on the arrest of three #Brooklyn #terror suspects http://t.co/Yl9BWOfB09
570666234150326272,2015-02-25 19:26:47,RepJeffries,5,5,Twitter Web Client,Thank you @FBI for stopping the terrorist plot to attack #Brooklyn. Memo to @HouseGOP: Fund @DHSgov now http://t.co/aMWCqWyiGJ
570650957224267779,2015-02-25 18:26:05,RepJeffries,0,1,Twitter Web Client,Here is why #NetNeutrality and a Free and Open Internet is critical for #Brooklyn and the Nation http://t.co/4hwQBeUCrZ
570594711934771201,2015-02-25 14:42:35,RepJeffries,282,0,Twitter Web Client,"RT @RepVeasey: The clock is ticking. I urge my GOP colleagues, stop holding our national security hostage. #DontShutDownOurSecurity http://…"
570371205498155008,2015-02-24 23:54:27,RepJeffries,1,0,iOS,Irresponsible shutdown of @DHSgov heading toward the American people like a runaway freight train  http://t.co/KWcpN40PEk
570329330439430144,2015-02-24 21:08:03,RepJeffries,8,4,Twitter for iPhone,Heading into @WhiteHouse meeting to discuss #criminaljusticereform with POTUS and congressional leaders
570295376349175808,2015-02-24 18:53:07,RepJeffries,12,10,Twitter for iPhone,It's time for the #Senate to swiftly confirm #LorettaLynch as our next Attorney General
570219243603689472,2015-02-24 13:50:36,RepJeffries,149,0,Twitter for iPhone,RT @RepDeSaulnier: RT if you agree: @HouseGOP needs to wake up! America's security is not a political hostage. #DontShutDownOurSecurity htt…
569865212200931328,2015-02-23 14:23:48,RepJeffries,141,0,Twitter for iPhone,RT @RepDuckworth: Alarming that GOP is playing games w/ national  security funding during such dangerous times.#DontShutDownOurSecurity htt…
569259724153225216,2015-02-21 22:17:49,RepJeffries,5,5,iOS,Thanks to everyone who came out to this morning's Black History Month event co-hosted with @StevenCarterNY http://t.co/A11MECNFNe
568901165250965504,2015-02-20 22:33:02,RepJeffries,14,13,Twitter for iPhone,How long will it take #RudyGiuliani to apologize for his unpatriotic verbal assault on POTUS? http://t.co/mAG1OaZYT7
568785509541138432,2015-02-20 14:53:27,RepJeffries,141,0,Twitter for iPhone,"RT @RepTedLieu: The first duty of Congress is to protect &amp; defend the American people. @HouseGOP, please #DontShutDownOurSecurity! http://t…"
568558934132441088,2015-02-19 23:53:07,RepJeffries,6,4,iOS,Defended @BarackObama against the #RepublicanAttackMachine on @PoliticsNation with Rev. Sharpton  https://t.co/Q7i9FddcfS
568449020382851072,2015-02-19 16:36:22,RepJeffries,3,2,Twitter Web Client,Even #Walmart has decided to raise employee wages. When will @HouseGOP do the same for every American? http://t.co/kmawDKgm19
568419242338615297,2015-02-19 14:38:02,RepJeffries,141,0,Twitter for iPhone,RT @RepPeteAguilar: The clock is ticking. @HouseGOP must end the political games &amp; fund DHS #DontShutDownOurSecurity http://t.co/3OfAGhGSP7
568136111551348737,2015-02-18 19:52:59,RepJeffries,4,2,Twitter Web Client,My take on GOP #TrickleDownEconomics http://t.co/BvwTY07kbs
567694691102363648,2015-02-17 14:38:56,RepJeffries,100,0,Twitter for iPhone,"RT @RepRichmond: I urge my @HouseGOP colleagues, please don't put your politics over the safety of Americans. #DontShutDownOurSecurity http…"
567373236837834754,2015-02-16 17:21:35,RepJeffries,4,2,iOS,Technology and Innovation economy help fuel jobs recovery in NYC #InternetPower  http://t.co/xgmvf92MJp
567063122981453825,2015-02-15 20:49:18,RepJeffries,5,0,iOS,Speaker Boehner makes clear GOP lacks plan to prevent Department of Homeland Security #Shutdown  http://t.co/IvB6TB0FbF
566712553720799234,2015-02-14 21:36:16,RepJeffries,7,10,Twitter Web Client,Spent the morning on a Coney Island/Sea Gate beach with @SenSchumer &amp; @RepJerryNadler http://t.co/jcbwKQaLYI #Sandy http://t.co/Wc3fwIPavY
566404627869220866,2015-02-14 01:12:41,RepJeffries,167,0,Twitter for iPhone,RT @RepCuellar: .@HouseGOP needs to stop playing politics &amp; pass a clean bill to fund @DHSgov! #DontShutDownOurSecurity http://t.co/j0Mh21R…
566330242558877696,2015-02-13 20:17:06,RepJeffries,3,1,iOS,Justice Department program to help homeowners impacted by foreclosure crisis wrongly attacked by @HouseGOP  https://t.co/XqA0ApGv9y
566250800402690048,2015-02-13 15:01:25,RepJeffries,2,2,Twitter Web Client,The effort to get #SuperstormSandy victims back on their feet continues http://t.co/4lI1WhbInU
566228231716864000,2015-02-13 13:31:45,RepJeffries,11,4,Twitter for iPhone,Hate crime investigation into murder of 3 NC Muslim students appropriately opened by @FBI. #AllLivesMatter
565955861508812802,2015-02-12 19:29:26,RepJeffries,6,0,Twitter Web Client,House Republicans prepare to recklessly shutdown Dept. of Homeland Security in 16 days #Really? http://t.co/l6foJey8qx
565661884062658564,2015-02-12 00:01:17,RepJeffries,5,6,iOS,Preparing to vote against House GOP education bill that fails America's children http://t.co/p19e00Varr
565516402317332480,2015-02-11 14:23:11,RepJeffries,18,12,iOS,Perpetrator of heinous attack on 3 Muslim students in NC must be prosecuted to the full extent of the law #Shameful http://t.co/goTuhF83uR
565312809085706240,2015-02-11 00:54:11,RepJeffries,4,6,Twitter Web Client,#Brooklyn takes a step toward equal protection under the law for everyone #AllLivesMatter http://t.co/WgzIBJToad
565294286594641921,2015-02-10 23:40:35,RepJeffries,2,1,Twitter for iPhone,Very productive @officialCBC meeting today with @BarackObama #Jobs #Education #CriminalJusticeReform
565150022883618816,2015-02-10 14:07:20,RepJeffries,4,1,iOS,NYPD rhetoric about diversity falls short of reality as it relates to recruitment &amp; retention of black male officers http://t.co/rn1PKyR58O
564949198060412928,2015-02-10 00:49:19,RepJeffries,4,4,Twitter Web Client,"In the aftermath of the #GRAMMYs, Congress prepares to tackle challenges facing the industry http://t.co/M38ladQBpi http://t.co/6fapTO1bIg"
564792682317643776,2015-02-09 14:27:23,RepJeffries,76,0,Twitter Web Client,"RT @RepKathleenRice: Funding of @DHSgov during these dangerous times is essential. I urge my GOP colleagues, #DontShutDownOurSecurity! http…"
564205350715662338,2015-02-07 23:33:32,RepJeffries,11,2,iOS,The fight to make New York City affordable requires all hands on deck http://t.co/MMwNPb3bfl
563335308566355968,2015-02-05 13:56:18,RepJeffries,81,0,Twitter for iPhone,"RT @jimlangevin: #DontShutDownOurSecurity! If GOP fails to pass a clean bill, more than 50,000 TSA aviation security screeners will have to…"
563048159463874561,2015-02-04 18:55:16,RepJeffries,3,0,Twitter Web Client,Education and the Workforce panel tackles #ImmigrationReform #CollegeAffordability #RaisetheWage http://t.co/tSVuj1SByT
563000435527913473,2015-02-04 15:45:38,RepJeffries,0,0,Twitter Web Client,How do we continue to grow our economy? #MiddleClassEconomics http://t.co/QO2E1J5i0i
562976184313860096,2015-02-04 14:09:16,RepJeffries,165,0,Twitter for iPhone,RT @RepRoybalAllard: We're living in too dangerous a time for political games that involve our national security. #DontShutDownOurSecurity …
562616137553555458,2015-02-03 14:18:34,RepJeffries,3,2,Twitter for iPhone,President's budget seeks to move our country forward. Others try to turn back the clock #MiddleClassEconomics
562253889618333696,2015-02-02 14:19:08,RepJeffries,127,0,Twitter for iPhone,"RT @RepTimRyan: The President's budget invests in an economy that rewards hard work, grows wages &amp; allows everyone to share in the American…"
561973511670202369,2015-02-01 19:45:00,RepJeffries,6,5,iOS,"For many working families in #Brooklyn, this is not a Super Sunday #AffordableHousingNow  http://t.co/Sk8x4wBhEe"
560818875726823424,2015-01-29 15:16:54,RepJeffries,61,0,Twitter for iPhone,RT @Clyburn: .@HouseDemocrats are using this 2015 Issues Conference to discuss ways to grow America's economy &amp; American paychecks! #HouseD…
560536247727554560,2015-01-28 20:33:50,RepJeffries,8,0,Twitter Web Client,"House GOP plans to sue @BarackObama again. Americans need #MiddleClass legislation, not more baseless litigation http://t.co/mjUI5m1KQN"
560163048829489152,2015-01-27 19:50:52,RepJeffries,5,5,iOS,Pleased that several dozen talented @nyuniversity students were in the House(of Reps)! with @cbrangel this afternoon http://t.co/Y00d7cyPNs
560075261702864897,2015-01-27 14:02:02,RepJeffries,187,0,Twitter for iPhone,RT @repdonnaedwards: Week 4 of GOP Congress: still no jobs bills. @SpeakerBoehner said it himself--#MiddleClassFirst priorities are “dead” …
559889636068454400,2015-01-27 01:44:26,RepJeffries,7,0,Twitter for iPhone,"Blizzard-like conditions expected in NYC.  Stay safe, stay warm and stay informed: http://t.co/3kFAVEr3TH"
559719699253313536,2015-01-26 14:29:10,RepJeffries,144,0,Twitter for iPhone,"RT @RepDebDingell: I urge my @HouseGOP colleagues, please - let's vote to give Americans bigger paychecks &amp; jobs building roads &amp; bridges o…"
559492769329074176,2015-01-25 23:27:25,RepJeffries,9,3,iOS,President Rivlin of Israel makes historic visit to @cccinfoorg in Brooklyn  http://t.co/GAWJRMJa3p
559168021034717185,2015-01-25 01:56:59,RepJeffries,8,2,iOS,"In the aftermath of tragedy, let us never forget #EricGarner #DetectiveRamos #DetectiveLiu  http://t.co/2DklQcG8rS"
