id,created_at,coordinates,retweets,favorite_count,source,text
710936798176944128,2016-03-18 21:11:55,,23,40,TweetDeck,Law enforcement officers hold the fabric of American communities together. #BlueLivesMatterAct protects them. https://t.co/419VZkEXzf
710468270604705792,2016-03-17 14:10:10,,40,63,TweetDeck,"Police officers have our backs. Let's have theirs. #BlueLivesMatterAct 
https://t.co/16wrqQu5F8"
710467606365511680,2016-03-17 14:07:31,,34,47,TweetDeck,#BlueLivesMatterAct adds police officers to the federal hate crime statute. #SupportOurOfficers https://t.co/eM8475laQS
710159599442268160,2016-03-16 17:43:37,,140,0,TweetDeck,"RT @SpeakerRyan: This week, we’ll vote on my 1st resolution as speaker to defend Congress's Article I powers under the #Constitution. https…"
709768636064407552,2016-03-15 15:50:04,,7,12,TweetDeck,Farmers contribute more than just food to our communities. They contribute a way of life. #NationalAgDay https://t.co/fZA3To6pMP
709409145099784192,2016-03-14 16:01:35,,11,0,Twitter Web Client,RT @sallymamdooh: The blue line flag that @BFTFAurora will be giving to fallen officer Nate Carrigan's family @DenverChannel https://t.co/w…
708686512682979329,2016-03-12 16:10:06,,8,9,TweetDeck,I’m committed to protecting private property for Colorado ranchers and farmers: https://t.co/2GzjddGVwz
708444866007711744,2016-03-12 00:09:52,,4,2,TweetDeck,Ranchers in SE Colorado are concerned about government overreach: https://t.co/2GzjddYwV9
707678267432673281,2016-03-09 21:23:41,,3,3,TweetDeck,Iran again proves it’s still a bully and provocateur: https://t.co/GqYL7N3qRX
707570935294009344,2016-03-09 14:17:11,,2,4,TweetDeck,Got to hear from a lot of folks last night on my tele-town hall: https://t.co/90w7nWJK4X
707333881033310208,2016-03-08 22:35:13,,6,10,Twitter Web Client,"Peyton holds 21 major NFL records. Heading into retirement, maybe he wants to tackle the national debt next #Peyton https://t.co/vpYEHNdAbM"
707314634123038721,2016-03-08 21:18:44,,2,3,TweetDeck,"Non unsurprisingly, the Iran nuclear deal appears on the verge of collapse: https://t.co/WhyV9KMMo5"
707022784635899906,2016-03-08 01:59:02,,3,1,TweetDeck,I’m starting a live tele-town hall right now! Listen here: https://t.co/WUBBGcmifv
706864515636301824,2016-03-07 15:30:08,,0,0,TweetDeck,I’d like to get your input on issues facing Congress. Join me today at 7 for a live tele-town hall: https://t.co/Sw6pzMOzxt
706628497104576512,2016-03-06 23:52:16,,1,2,TweetDeck,Join me for a live tele-town hall tomorrow night! https://t.co/Sw6pzMwYFV
706537615143473152,2016-03-06 17:51:08,,5,6,Twitter for iPhone,"Nancy Reagan was the last of an amazing couple who fought the Soviets, the socialists, and the idea that America's best days were behind it"
706537277464293376,2016-03-06 17:49:48,,1,2,Twitter for iPhone,Sad to see the passing of Nancy Reagan. https://t.co/KVbHR9g5lY
705113184114331648,2016-03-02 19:30:58,,1,2,TweetDeck,Wishing well to the officers and their families who have lost their lives and loved ones in the line the duty. https://t.co/eVNZfXtidH
705106177286209538,2016-03-02 19:03:07,,0,5,TweetDeck,Colorado #LawEnforcement: Thank you for your service.
705098028248494081,2016-03-02 18:30:44,,0,0,TweetDeck,We had the 1st meeting of our Executive Overreach Task Force today. Eager to reassert Congressional power. #Article I
705091601563975680,2016-03-02 18:05:12,,6,8,TweetDeck,Pres. Obama has issued dozens of exec. orders. Executive Overreach Task Force will look at those. #ArticleI
705079644513554432,2016-03-02 17:17:41,,7,7,TweetDeck,Executive Overreach Task Force will help us find ways ways to return power back to Congress. #ArticleI
705075491108052992,2016-03-02 17:01:11,,3,6,TweetDeck,I want to thank our #LawEnforcement for their service. They put their lives on the line every day to protect and keep our communities safe.
704680723387686912,2016-03-01 14:52:31,,3,2,TweetDeck,Watch the first hearing of the Executive Overreach task force: https://t.co/858dcTu5Qk
704444019984703488,2016-02-29 23:11:56,,7,7,TweetDeck,Let me be clear: I will lead the charge against terrorists being transferred to Colorado or anywhere in the U.S. https://t.co/cgzdbbLOwH
704343532358782977,2016-02-29 16:32:38,,3,3,TweetDeck,"We must fight to rein in executive overreach, however long it takes
https://t.co/onvEkau6jd"
702984018703175680,2016-02-25 22:30:25,,2,2,TweetDeck,"Too many innocent small businesses are pulled into expensive, frivolous lawsuits. #HR3624 protects local business from these lawsuits"
702980196895358978,2016-02-25 22:15:14,,3,8,TweetDeck,"I introduced #HR3624 to protect small businesses from frivolous lawsuits, and am thankful it passed the House today."
702978424659386369,2016-02-25 22:08:11,,4,9,TweetDeck,"I spoke on the House Floor today about #HR3624, a bill to protect small businesses from meritless lawsuits. https://t.co/vzZyJK1Yvl"
702958776425566208,2016-02-25 20:50:07,,1,2,TweetDeck,"On the House Floor to vote for #HR3624, a bill I introduced to protect small businesses from frivolous lawsuits."
702923967921840129,2016-02-25 18:31:48,,4,0,TweetDeck,RT @RepGoodlatte: .@RepKenBuck's Fraudulent Joinder Prevention Act will help reduce the litigation abuse that regularly drags small busines…
702540555717361664,2016-02-24 17:08:15,,0,1,TweetDeck,The death rate from heart disease fell about 38% from 2003 to 2013. Let’s get that even lower. #HeartMonth
702234006780145664,2016-02-23 20:50:08,,6,6,TweetDeck,#Gitmo detainees are truly dangerous. Now they’re fighting for ISIS. Let’s keep them out of Colorado https://t.co/qg9MtvB5gK
702209401956999168,2016-02-23 19:12:22,,4,6,TweetDeck,Former #Gitmo detainee arrested today in Spain for ISIS ties: https://t.co/qg9Mtvjupc
702203790296895488,2016-02-23 18:50:04,,6,8,TweetDeck,Public Safety should never take a back seat to political point-scoring. #Gitmo
702197244947075072,2016-02-23 18:24:04,,9,17,TweetDeck,I don’t want terrorists in my neighborhood. Keep the terrorists in #Gitmo
702194473489465344,2016-02-23 18:13:03,,4,8,TweetDeck,I will fight to the very end to keep #Gitmo terrorists off of American soil.
702191366068006912,2016-02-23 18:00:42,,9,10,TweetDeck,Congress has already told the President he cannot legally transfer terrorists from #Gitmo to American soil.
702175932430344192,2016-02-23 16:59:22,,15,7,Twitter Web Client,Should Guantanamo terrorists be transferred to Colorado prisons? #Gitmo #copolitics
700414713671393282,2016-02-18 20:20:55,,1,3,Twitter Web Client,Another failure at the VA https://t.co/SedodZKpkx
700339223346487298,2016-02-18 15:20:57,,9,14,TweetDeck,"Congrats to @Brad_Cooley, the winner of the Congressional App Challenge in the 4th CD!"
699309168168148992,2016-02-15 19:07:52,,2,3,TweetDeck,President's Day is also a reminder that executive branch power is limited by Congress. #ArticleI
699309013255778304,2016-02-15 19:07:15,,7,7,TweetDeck,President's Day is a chance to honor those Americans who led our country in times of prosperity and hardship. #PresidentsDay
698641435625680898,2016-02-13 22:54:33,,3,6,Twitter for iPhone,I'm saddened at the loss of Supreme Court Justice Antonin Scalia. He was an advocate of justice and a true defender of the Constitution.
697874516391755777,2016-02-11 20:07:05,,0,2,TweetDeck,"Thankful SCOTUS issued a stay on the President’s controversial, job-killing carbon rule https://t.co/hmsdvx9L6a"
697868347971608576,2016-02-11 19:42:34,,2,1,TweetDeck,"The President’s job-killing and controversial carbon rule means fewer jobs and higher energy bills. 
https://t.co/hmsdvwSaeC"
697790626323107841,2016-02-11 14:33:44,,2,1,TweetDeck,North Korea’s reckless behavior is a threat to peace and security: https://t.co/E8CLfOEcMx
697523955582660608,2016-02-10 20:54:05,,1,0,TweetDeck,Thankful SCOTUS has paused Clean Power Plan. High energy prices hurt everyone in the 4th CD https://t.co/hmsdvx9L6a
697514404414230528,2016-02-10 20:16:07,,1,0,TweetDeck,Let’s pass #HR3442 so we’re not raising the debt limit with bills cobbled-together at the 11th hour: https://t.co/evGYcX3ATj
697508894118125568,2016-02-10 19:54:14,,0,1,TweetDeck,Let’s figure out how to solve our debt crisis BEFORE we reach the point of no return: https://t.co/evGYcWM01L
697432259469643776,2016-02-10 14:49:42,,0,3,TweetDeck,I’m saddened by this story but thankful for the sacrifice our law enforcement make every day to keep CO safe https://t.co/2jFaL27seb
697229266803519488,2016-02-10 01:23:05,,1,2,TweetDeck,#HR3016 gets #veterans back on their feet.
697208879180959744,2016-02-10 00:02:04,,2,1,TweetDeck,"Our vets deserve so much more than long wait times. The Veterans Employment, Education, and Healthcare Improvement Act is a start. #veterans"
697205610916392960,2016-02-09 23:49:05,,0,4,TweetDeck,Long wait times for vets are bad enough. Covering them up is even worse. #veterans https://t.co/zHYVf0pfxh
697199565150121985,2016-02-09 23:25:04,,2,0,TweetDeck,"For a family filling their 20 gal tank 4 times a month, new oil tax adds $200+ to annual transportation cost. #TaxHike #Budget"
697191939465158656,2016-02-09 22:54:46,,0,1,TweetDeck,How will the President’s oil tax hike affect your family in the 4th CD? Check this map to find out: https://t.co/TG8kv8VcNm
697191702218567680,2016-02-09 22:53:49,,9,4,TweetDeck,"The President’s budget includes a $10.25/barrel oil tax that I believe especially hurts parents, farmers and small business owners #TaxHike"
697191215880605698,2016-02-09 22:51:53,,2,2,TweetDeck,Hardworking Americans should not be forced to support an outlandish climate agenda with their tax dollars. #Budget
696782658777563136,2016-02-08 19:48:26,,0,2,TweetDeck,.@RepMarkMeadows Good game last night. I’m looking forward to some Carolina BBQ. #sb50
696694132111179776,2016-02-08 13:56:39,,1,3,TweetDeck,I took a stand for Small Business by supporting #HR1675. The bill lifts unnecessary regulations to create more opportunities for growth.
696693901365792768,2016-02-08 13:55:44,,3,2,TweetDeck,"Economic growth comes from Main Street, not Washington. Too much regulation hinders growth and opportunity. #HR1675"
695720660950216704,2016-02-05 21:28:26,,3,4,TweetDeck,"A radical climate agenda should not be borne on the backs of the American people 
https://t.co/02ydgUjOIq"
695720593379979265,2016-02-05 21:28:09,,5,3,TweetDeck,"$10 tax hike on barrels of oil hits parents, farmers, and small business owners the hardest #NoTaxHike"
695692747257282560,2016-02-05 19:37:30,,5,0,TweetDeck,RT @RepDaveBrat: Proud to cosponsor #HR4371 by @RepKenBuck to show the American people’s priorities that were left out of #Omnibus - https:…
695620155766771713,2016-02-05 14:49:03,,0,1,TweetDeck,The latest example of the administration’s end-run around Congress is Operation Choke Point. I voted for #HR766 to rein in executive power.
695606569485017088,2016-02-05 13:55:04,,4,1,TweetDeck,Operation Choke Point is another example of unconstitutional executive overreach. #HR766 will stop it.
695605104112701440,2016-02-05 13:49:15,,6,2,TweetDeck,"Legitimate businesses, like gun stores, are being forced out of the banking industry by the Justice Dept’s Operation Choke Point"
694948304220725249,2016-02-03 18:19:21,,2,6,Twitter for iPhone,Proud to be part of this effort #ArticleI  https://t.co/G9kDwJxcfg
694642974697857026,2016-02-02 22:06:05,,6,9,TweetDeck,I'm voting to #override so we can provide an alternative approach to healthcare that prioritizes patient choice #OverridetheVeto
694642692614176768,2016-02-02 22:04:58,,41,146,TweetDeck,"We have opportunity today to override the President’s veto of the #ACA repeal bill, getting rid of Obamacare once and for all #Override"
694604229579784192,2016-02-02 19:32:08,,3,2,TweetDeck,Thanks @SenMikeLee for pushing this amendment in the Senate. Proud to sponsor the House version.  https://t.co/Vhoyt9Sf7G
694551863518081024,2016-02-02 16:04:03,,1,0,TweetDeck,The American people deserve the truth from their executive branch officials: https://t.co/yTlNXByLAq
694544574048526336,2016-02-02 15:35:05,,0,0,TweetDeck,Administration officials misled Congress and the American people during the debt limit debate: https://t.co/yTlNXBhaIS
694313052368338944,2016-02-02 00:15:06,,2,2,TweetDeck,We must honor those who stood strong and shaped this nation into what it is today. #NationalFreedomDay
694310372032016385,2016-02-02 00:04:27,,2,0,TweetDeck,This day should serve as a reminder to appreciate the freedom and liberties for which so many have fought. #NationalFreedomDay
694310253006053376,2016-02-02 00:03:58,,1,2,TweetDeck,"On Feb 1, 1865, President Lincoln signed a resolution that proposed the 13th amendment, to outlaw slavery #NationalFreedomDay"
693274670355849216,2016-01-30 03:28:56,,2,0,Twitter for iPhone,Happy Birthday @SpeakerRyan! Hope you had a great one.
693094006973005824,2016-01-29 15:31:02,,0,0,TweetDeck,"My bill reins in executive overreach, reasserting Congress’ power of the purse
https://t.co/HwZyowX2Lu"
693082943653163008,2016-01-29 14:47:05,,0,0,TweetDeck,"Taking back Congressional power starts here
https://t.co/HwZyowX2Lu"
693078894543572992,2016-01-29 14:30:59,,1,0,TweetDeck,"I published an op-ed today about the bill I recently introduced
https://t.co/HwZyowFrTW"
692764080986165249,2016-01-28 17:40:02,,0,0,TweetDeck,"Parents know what’s best for their kids, not #UncleSam #SchoolChoiceWeek"
692735168537194496,2016-01-28 15:45:09,,2,2,TweetDeck,Give the decision-making power back to the parents #SchoolChoiceWeek
692485222881988608,2016-01-27 23:11:57,,0,1,TweetDeck,Let’s honor both those who perished and those who survived the #Holocaust. We can never let something like this happen again.
692485140640088065,2016-01-27 23:11:37,,0,1,TweetDeck,"On International Holocaust Remembrance Day, I want to take time to reflect on the many lives tragically lost during the Holocaust."
690682511765213184,2016-01-22 23:48:37,,3,2,TweetDeck,Every human life should be valued and protected. #LifeIsPrecious #ProLife
690682382177980416,2016-01-22 23:48:06,,3,2,TweetDeck,"Roe v. Wade anniversary. Let’s remember on this day that children are a blessing—to families, our communities, and the world. #Life"
690309167504994304,2016-01-21 23:05:05,,4,3,TweetDeck,Can we get a do-over on that Iran nuclear deal vote? Have a feeling there will be more “no” votes this time  https://t.co/YugR2q5ono
690300111390318592,2016-01-21 22:29:06,,3,3,TweetDeck,I opposed the Iran nuclear deal for this reason:  https://t.co/YugR2q5ono
690296406926561280,2016-01-21 22:14:23,,1,0,TweetDeck,For months I’ve been warning that the #Iran nuclear deal would free up money for terrorism https://t.co/YugR2qmZLY
689929654119960576,2016-01-20 21:57:02,,1,2,TweetDeck,"#ArticleI = Congress makes the law. Hopefully #SCOTUS can clarify
https://t.co/hbEQ4yBa46"
689924008238813185,2016-01-20 21:34:36,,0,1,TweetDeck,#SCOTUS case on immigration-related executive actions is perfect chance to clarify the meaning of #ArticleI
689491182242557954,2016-01-19 16:54:42,,2,3,TweetDeck,Last week I introduced a bill with several provisions to rein in the Executive Branch #ArticleI https://t.co/zPaEtrGFLQ
689154801792348161,2016-01-18 18:38:03,,4,4,TweetDeck,I hope we can fight the injustices of our era with a courage that matches the courage of #MLK
689154578542149632,2016-01-18 18:37:10,,2,2,TweetDeck,"Today, we remember Martin Luther King, Jr. and the freedom for which he fought. #MLKDay #MLK"
688028782217834496,2016-01-15 16:03:39,,0,1,TweetDeck,"Passing 12 appropriations bills this year should be a top priority. #ArticleI 
https://t.co/rIb79jE17q"
687680743661793280,2016-01-14 17:00:40,,5,2,Twitter Web Client,Exactly why I formed the Article I Caucus https://t.co/bDfZ0MuL0K
687393125971681280,2016-01-13 21:57:47,,7,5,TweetDeck,Iran's provocative actions prove they haven't changed: still a bully that will receive billions when sanctions are lifted this week
687392855040618496,2016-01-13 21:56:42,,6,7,TweetDeck,Americans should never have to apologize to #Iran https://t.co/Xxk7OVCgRO
687110124096372736,2016-01-13 03:13:14,,2,4,TweetDeck,Terrorists are stopped when we fight back and stop them from coming to the United States. #LastSOTU
687109971625009152,2016-01-13 03:12:37,,2,3,TweetDeck,"Lives are saved by defending Constitutional rights, including the Second. #LastSOTU"
687109923822538753,2016-01-13 03:12:26,,2,3,TweetDeck,Jobs are created by reducing government regulations. #LastSOTU
687109855627325441,2016-01-13 03:12:10,,2,2,TweetDeck,"I share President’s concerns, but not his solutions. #LastSOTU"
687108839305523200,2016-01-13 03:08:07,,5,3,TweetDeck,Wish #President would offer to return constitutional power to #Congress as way to fix political process. #ArticleI #LastSOTU
687107167929929729,2016-01-13 03:01:29,,1,2,TweetDeck,What about the 10 American sailors that #Iran detained today? #LastSOTU
687105877946535936,2016-01-13 02:56:21,,0,1,TweetDeck,(2/2) The #HealthCareCompact returns decision making to the states and gives power back to patients #RepealObamacare #LastSOTU
687105764536750080,2016-01-13 02:55:54,,1,1,TweetDeck,Our healthcare system is a bureaucratic mess and needs a complete overhaul. #Obamacare #LastSOTU
687105258938601472,2016-01-13 02:53:54,,0,1,TweetDeck,I will do everything in my power to stop terrorists from setting foot on American soil #Gitmo #LastSOTU #ArticleI
687104191437910016,2016-01-13 02:49:39,,1,1,TweetDeck,"The nuclear deal with Iran gives them the money they need to build nukes.
https://t.co/vbGwrWZYyf"
687102959113617408,2016-01-13 02:44:45,,1,1,TweetDeck,#ISIS has declared war on the world. We need to stay strong at home to defeat them abroad. #LastSOTU https://t.co/o37stjS56v
687102644150734848,2016-01-13 02:43:30,,1,0,TweetDeck,We need a real plan for tackling ISIS: https://t.co/ipg5YDpUys
687102303153844224,2016-01-13 02:42:09,,2,1,TweetDeck,#Factcheck: VA care has not gotten better. Veterans are still facing harmful delays in care. #LastSOTU
687102204856143873,2016-01-13 02:41:46,,13,0,Twitter Web Client,"RT @SenOrrinHatch: Actually, the number of Americans who believe ""climate change is a serious threat"" is actually dropping. #SOTU https://t…"
687101466104991744,2016-01-13 02:38:49,,1,0,TweetDeck,The Clean Power Plan hurts schools who have to pay more for energy and less for text books. #LastSOTU
687101405371494401,2016-01-13 02:38:35,,2,2,TweetDeck,The Clean Power Plan hurts farmers who rely on energy to grow their food. #LastSOTU
687101331828506624,2016-01-13 02:38:17,,0,2,TweetDeck,"The War on Coal is real. American families are hurt by higher energy prices. #SOTU
https://t.co/sCHqN7H8td"
687101210902577152,2016-01-13 02:37:49,,8,0,Twitter Web Client,"RT @HouseCommerce: Instead of a burdensome climate agenda we need policies that promote 
✓affordable energy 
✓economic growth  
✓jobs #SOTU…"
687099541573758976,2016-01-13 02:31:11,,0,0,TweetDeck,We need to cut our spending and our debt if we want real prosperity for our grandkids #LastSOTU
687098926613266432,2016-01-13 02:28:44,,4,1,TweetDeck,"Remember when the #President said ""if you like your doctor, you can keep your doctor""? Not true. #LastSOTU"
687098612648656897,2016-01-13 02:27:29,,19,18,TweetDeck,"Remember when the #President said ""if you like your healthcare plan you can keep your healthcare plan""? Not true #LastSOTU"
687086390757191680,2016-01-13 01:38:55,,0,1,TweetDeck,What would you like to hear the President say tonight? #LastSOTU
687086234980737024,2016-01-13 01:38:18,,0,0,TweetDeck,I hope the President’s proposals involve lifting costly regulations and a commitment to not attack the #SecondAmendment #LastSOTU
687085978012512257,2016-01-13 01:37:17,,0,0,TweetDeck,"#POTUS will add a few thousand words tonight onto the 47,625 words he’s already spoken in #SOTU addresses"
687084609142697984,2016-01-13 01:31:50,,0,0,TweetDeck,My staff will be tweeting from my account during the address so you can continue to receive updates throughout #POTUS' #lastSOTU.
687014350914252801,2016-01-12 20:52:40,,2,3,TweetDeck,.@HouseJudiciary Looking forward to joining this task force and reining in executive overreach #ArticleI
687008769876848644,2016-01-12 20:30:29,,0,0,TweetDeck,"To all the #SmallBusiness owners out there: keep up the hard work. Don’t let the naysayers, corporations or federal government hold you back"
687008626456793089,2016-01-12 20:29:55,,0,1,TweetDeck,#SmallBusiness plays a crucial role in the success of communities around our nation
686951387356336128,2016-01-12 16:42:28,,3,0,Twitter Web Client,RT @GOPoversight: .@RepKenBuck on H.R. 3023  https://t.co/ItDYgAeoR6
686622312595124224,2016-01-11 18:54:50,,2,3,TweetDeck,.@notkimco Thanks for sharing your story and speaking about the importance of the #SecondAmendment https://t.co/BPxlgaFW5D
685889284348354560,2016-01-09 18:22:03,,4,3,TweetDeck,Remembering Officer Garrett Swasey today. Glad to have people like him defending our communities: https://t.co/B44NkR66bP
685888277027532800,2016-01-09 18:18:03,,1,4,TweetDeck,Thanks to everyone who puts their lives on the line to keep our communities safe. #LawEnforcementAppreciationDay
685873021937139713,2016-01-09 17:17:25,,4,2,TweetDeck,"It’s Law Enforcement Appreciation Day. When you see a member of law enforcement, thank them for their service."
685554754500583425,2016-01-08 20:12:45,,4,1,TweetDeck,"After all the website error pages, forced doctor changes, premium spikes and higher taxes, Americans are ready for an #Obamacare alternative"
685554426803793920,2016-01-08 20:11:26,,14,8,TweetDeck,We promised to send #Obamacare repeal to the President’s desk. We did. He vetoed. Now we must #override the veto. https://t.co/DHSkyzOuDl
685287821943398400,2016-01-08 02:32:03,,4,3,Twitter for iPhone,#SCRUBAct could put regulations like the Clean Power Plan and the Waters of the U.S. rule on the chopping block
685287543391268865,2016-01-08 02:30:57,,6,3,Twitter for iPhone,#SCRUBAct helps us clean up costly red tape and regulations. https://t.co/cJRL1dwPuL
684912092403531776,2016-01-07 01:39:02,,2,2,TweetDeck,We voted today to defund #PlannedParenthood. Your tax dollars shouldn’t be used to subsidize abortion.
684901281543016448,2016-01-07 00:56:05,,0,1,TweetDeck,"#Obamacare hurts families, farmers, and small businesses. It’s time to repeal this law once and for all."
684899617503363072,2016-01-07 00:49:28,,0,0,TweetDeck,The reconciliation bill defunds elective abortion providers. Protecting #unborn life is one of my top priorities.
684899359478157313,2016-01-07 00:48:26,,0,0,TweetDeck,Congress fulfilled its promise to defund #Obamacare. Now it’s the President’s job to sign it. https://t.co/9Modnsu5c2
684755554250653696,2016-01-06 15:17:00,,0,0,TweetDeck,#2015 was busy and productive. https://t.co/7HzBmkwkxt
684755336528527361,2016-01-06 15:16:09,,0,0,TweetDeck,Read my end-of-year newsletter for a full update on 2015: https://t.co/WhA2VOYMA1
684495097002475520,2016-01-05 22:02:03,,5,6,TweetDeck,"We need to address the real problems behind gun violence: gang issues, mental health, and an unarmed populace. #SecondAmendment"
684484789626257408,2016-01-05 21:21:05,,3,0,TweetDeck,Under current law it's already a felony for any individual to transfer a gun to someone who they reasonably believe can't legally possess it
684484541717676032,2016-01-05 21:20:06,,6,2,TweetDeck,"Executive action bypasses Congress, tossing 2nd Amendment rights by the wayside and setting a precedent for future gun grabs.#2ndAmendment"
684482900587360256,2016-01-05 21:13:35,,3,2,TweetDeck,"The Constitution is clear: Congress writes the laws, and the President enforces them. #gunrights #SecondAmendment"
680444792053063681,2015-12-25 17:47:35,,3,4,TweetDeck,I'm especially thankful for the freedom to worship a God who would send his Son to save us from hopelessness.
680444651699073024,2015-12-25 17:47:01,,1,3,TweetDeck,#Christmas is a time to reflect on the ways our nation is blessed.
679339504302444545,2015-12-22 16:35:34,,7,3,TweetDeck,#EPA is an unaccountable agency with a radical environmental agenda that hurts all Americans. #WarOnCoal #Yes2Energy
679339202258018304,2015-12-22 16:34:21,,9,3,TweetDeck,#EPA caught allowing environmental lobbyists to help write the Clean Power Plan: https://t.co/LKQCTkjUsR #WarOnCoal
677249777441103876,2015-12-16 22:11:44,,3,2,TweetDeck,#EPA “covert propaganda” on WOTUS is an unacceptable use of taxpayer dollars. https://t.co/zIahQjwlST
677249543713501184,2015-12-16 22:10:48,,4,2,TweetDeck,New GAO report says #EPA used “covert propaganda” to promote its Waters of the U.S. rule illegally on social media. https://t.co/pCNePNeVbY
676879015580422145,2015-12-15 21:38:27,,4,4,TweetDeck,Let’s defend these rights today with as much passion as we had when fighting for them over two centuries ago.
676878859275509760,2015-12-15 21:37:50,,5,6,TweetDeck,Today is the 224th anniversary of the ratification of the Bill of Rights. https://t.co/oSY2U1sceX
675087110236479488,2015-12-10 22:58:04,,1,7,TweetDeck,I will fight against actions that exceed executive branch constitutional authority and that violate the #2ndAmendment. #righttobeararms
675086819147587584,2015-12-10 22:56:54,,2,1,TweetDeck,We’ve just learned that President Obama will soon use executive action to expand background checks on gun purchases: https://t.co/3Tlbh13rl9
674959770013462528,2015-12-10 14:32:03,,1,4,TweetDeck,I enjoyed stopping by the Army Holiday Party yesterday. I haven’t seen so many stars since I was boxing! https://t.co/mxKcFcE8ft
674761719902670849,2015-12-10 01:25:05,,19,10,TweetDeck,New email shows DoD had forces ready to send to Benghazi on night of attack. Why weren’t they sent? https://t.co/poQGQhkr52
