id,created_at,coordinates,retweets,favorite_count,source,text
820121750239379456,2017-01-14 04:13:57,,4,7,Twitter Web Client,TAX ALERT: The IRS Free File program is available TODAY at https://t.co/pLaVXGDrmZ. Learn more here: https://t.co/ZEVeHWn749
819965645815214080,2017-01-13 17:53:38,,41,85,Twitter Web Client,"Happy to be cosponsor this bill, which would sanction anyone that meddled with elections and freeze all U.S.-based… https://t.co/4dg1Pcx0CE"
819939820692766722,2017-01-13 16:11:01,,13,22,TweetDeck,"204,180 California small business owners got health coverage through #ACA marketplace. That's 204,180 reasons to vote against ACA repeal."
819933526225104896,2017-01-13 15:46:00,,12,18,TweetDeck,"House GOP is voting to repeal #ACA w/o a replacement, taking health care away from millions of American families. #ProtectOurCare"
819914885723209732,2017-01-13 14:31:56,,6,15,Twitter Web Client,"46 years ago, the Supreme Court determined in Schultz v Wheaton that if a job is substantially equal, it is protected by the #EqualPayAct."
819702494733500417,2017-01-13 00:27:58,,2,5,Twitter Web Client,Come learn about changes in FAA flight paths occurring in March and April 2017. More info here:… https://t.co/9jkNaLJphI
819669124343275520,2017-01-12 22:15:22,,8,24,Twitter for iPhone,Catch my FB live video discussing questions swirling around @realDonaldTrump + Russian involvement in the election… https://t.co/MCR0dBQFUT
819573654019149824,2017-01-12 15:56:00,,14,16,TweetDeck,82k experience homelessness on any given night in LA. This issue is too grave to hand over to someone w/ 0 exp with housing. #BenIsBadforHUD
819559812966948864,2017-01-12 15:01:00,,33,43,TweetDeck,254k people exp. homelessness in LA per year. We can't place their futures in the hands of someone with 0 housing k… https://t.co/zQ3KM3DS0w
819556744582090754,2017-01-12 14:48:49,,8,17,Twitter Web Client,Happy to cosponsor this important piece of legislation. Thanks @RepCummings &amp; @RepSwalwell for leading this. More:… https://t.co/MDdoow7tzG
819248210229260288,2017-01-11 18:22:48,,82,123,Twitter Web Client,Climate change deniers have no place leading our foreign policy. Too much is at stake. #ExxonKnew https://t.co/mC44j8qOtY
819224760118874112,2017-01-11 16:49:37,,102,168,Twitter Web Client,No amnt of paperwork can show that having your sons take care of your business is absolving yourself of its interests. #TrumpPressConference
819224170248699904,2017-01-11 16:47:17,,274,552,Twitter Web Client,"The #TrumpPressConference is unmistakably Trump: unskilled, unplanned, and unintelligible."
819220034333659136,2017-01-11 16:30:51,,39,99,Twitter Web Client,"Trump's claim he “will be the greatest jobs producer that God ever created,"" is nothing short of delusional #TrumpPressConference"
819219055089451009,2017-01-11 16:26:57,,6,16,Twitter Web Client,"Will Donald #Trump put the Presidency first, or will he put his businesses first? #ConflictsClause https://t.co/jPgh6PUbwS"
819176056238342144,2017-01-11 13:36:06,,27,26,TweetDeck,"Rex Tillerson was awarded the ""Order of Friendship"" by Vladimir Putin. Today he's up to lead our country's foreign… https://t.co/scSzuH16YT"
818975310435729408,2017-01-11 00:18:24,,7,28,Twitter Web Client,I can’t think of a better place for George Lucas’ new museum than the 37th! https://t.co/BCHhoR3aNO
818845357534683138,2017-01-10 15:42:01,,421,381,TweetDeck,Sessions’ response to Trump’s comments on women: “I don’t characterize that as sexual assault.” He won't protect women. #StopSessions
818825475875278848,2017-01-10 14:23:01,,59,76,TweetDeck,"Sen. Sessions’ unwillingness to protect voting rights, women from violence &amp; reform immigration make him #unfit to lead DOJ. #StopSessions"
818620551883358208,2017-01-10 00:48:43,,69,92,Twitter for iPhone,"Sen. Sessions’ unwillingness to protect voting rights, women from violence &amp; reform immigration make him #unfit to… https://t.co/Y2neAlPtmX"
818545691786145792,2017-01-09 19:51:15,,29,52,Twitter Web Client,This move demonstrates a blatant disregard for conflict of interest and nepotism. https://t.co/VRGD5kWAEO
817863486093008897,2017-01-07 22:40:24,,16,55,Twitter Web Client,"Today, President Obama invited me to be a part of a delegation to Ghana to attend the Inauguration of His Excellenc… https://t.co/RchSmRbMnV"
817501837830082560,2017-01-06 22:43:21,,32,59,Twitter Web Client,Help me prove Republicans wrong. Use #CoverageMattersLA and share your personal #Obamacare story with me. More:… https://t.co/TYmANkifa8
817476369886171136,2017-01-06 21:02:09,,70,181,Twitter Web Client,Proud to cosponsor the bill that will create an independent commission to investigate Russian hacks. More: https://t.co/KXxaKsKknI
817375894192922624,2017-01-06 14:22:53,,15,9,Twitter Web Client,"1.6 mil taxpayer $ later, a Repub House panel has recommended stripping all fed funding from @PPFA W/O EVIDENCE. https://t.co/ry0wvPbrtj"
817178119987757057,2017-01-06 01:17:00,,44,64,TweetDeck,"It's not just the racist past of Sen. Sessions that makes him unfit to be AG, it's his stance on current issues.… https://t.co/NzoF92OLTH"
817086015441604609,2017-01-05 19:11:01,,10,21,TweetDeck,"Over the last six years, 3.8 million Californians have gained health coverage thanks to the Affordable Care Act. #ACAWorks"
817068402762055680,2017-01-05 18:01:02,,22,23,TweetDeck,GOP #ACA repeal will take us back to days when insurance companies discriminated against those with pre-ex conditio… https://t.co/eL8gX5xI6M
817062403393339392,2017-01-05 17:37:11,,14,26,Twitter Web Client,I'll be on @MSNBC today at 10:45 AM PST to discuss how the Cong. Black Caucus plans to take on Trump and Repub attempts to destroy Obamacare
817024627285389313,2017-01-05 15:07:05,,791,0,Twitter Web Client,RT @RepDianaDeGette: #ACA means ~85 million women now have access to preventive care like mammograms and flu shots. That's worth protecting…
817022930018308097,2017-01-05 15:00:20,,16,26,Twitter Web Client,"Obamacare isn't just a health plan, it's also a jobs plan. Watch my interview from last night here:… https://t.co/h9gtenRp8C"
816812993904263169,2017-01-05 01:06:08,,24,0,Twitter for iPhone,RT @allinwithchris: Joining All In tonight with @JoyAnnReid: @RepKarenBass @AntonJGunn @jess_mc @kdeleon @RepAdamSchiff @nancygilesnyc @ran…
816723877262815232,2017-01-04 19:12:00,,9,34,TweetDeck,"When Repubs attempt to elim healthcare for millions, Dems will stand our ground &amp; fight w/ every ounce of our stren… https://t.co/vhwBV1Ic4s"
816723625172725760,2017-01-04 19:11:00,,5,29,TweetDeck,"Today, I met with @POTUS &amp; House Dems to discuss Republican efforts to destroy the ACA."
816655759337472000,2017-01-04 14:41:20,,3,5,Twitter Web Client,Join Leader @NancyPelosi &amp; @SenSchumer live @ 10:30EST to discuss Republican attempts to destroy the ACA https://t.co/1KNz1wz9mt
816454857909407744,2017-01-04 01:23:01,,10,30,TweetDeck,"As this Congress moves fwd, I will work w/ Dems to implement an agenda that works for all instead of the select few. https://t.co/qTvIzMmYDH"
816421184912900096,2017-01-03 23:09:13,,4037,0,Twitter for iPhone,RT @RepAdamSchiff: .@SpeakerRyan wants to fine Democrats for photos like these to stifle any dissent. We will keep fighting. https://t.co/a…
816343120912805888,2017-01-03 17:59:01,,26,45,Twitter Web Client,Happy to see House Republicans reverse their controversial move to weaken to the Office of Congressional Ethics. https://t.co/TnMmK09KYB
816340086514188288,2017-01-03 17:46:58,,4,1,Twitter Web Client,U.S. House: Opening session of the #115thCongress – LIVE on C-SPAN https://t.co/eoMtv0dWSq
816297046844051456,2017-01-03 14:55:56,,22,25,Twitter Web Client,Republicans have started 2017 off by destroying the only independent ethics oversight of Congress. https://t.co/b1l4r0kQag
816283342773637121,2017-01-03 14:01:29,,4,8,Twitter Web Client,Join me for the official swearing in of the Congressional Black Caucus in the 115th Congress at 9 AM EST! #CBC115 https://t.co/5jbY63qZc4
813127429787156480,2016-12-25 21:01:01,,4,8,TweetDeck,Merry Christmas! https://t.co/RbyaezJQES
812818398933438465,2016-12-25 00:33:02,,7,32,Twitter Web Client,"As the sun sets and the first night of Hanukkah begins, I wish everyone celebrating tonight a joyous Festival of Lights. Happy Hanukkah!"
811986347825176576,2016-12-22 17:26:45,,24,47,Twitter Web Client,"I commend @POTUS on his decision to dismantle NSEERS, a program rooted in discrimination. https://t.co/L5mjZ3DLDy"
810888574052761600,2016-12-19 16:44:36,,4,6,TweetDeck,A decision by Pres. Kabila to not step down is guaranteed to result in violence and extra-judicial killings. More: https://t.co/7cf1qYSchw
809512254731407360,2016-12-15 21:35:36,,25,54,Twitter Web Client,.@SecKerry - Resist the Trump transition witch hunt at the State Department! Happy to join my House ForAff colleagu… https://t.co/oEyHRoMq0T
808760682996973568,2016-12-13 19:49:07,,7,8,Twitter Web Client,https://t.co/8kXcVONynd
808712229927481344,2016-12-13 16:36:35,,22,35,Twitter Web Client,Say #NoToTillerson https://t.co/kMLOjTzxlg
808487606136631297,2016-12-13 01:44:00,,37,60,TweetDeck,Trump declining intel briefing with ZERO background is frightening. See my full interview from yesterday: https://t.co/qkIrItHeH4
808448853800316930,2016-12-12 23:10:01,,7,16,TweetDeck,"Muslims around the world will mark the Prophet Mohammed’s birthday this week, w/ prayer, charity, &amp; celebration. Happy Eid!"
808421672436965376,2016-12-12 21:22:01,,4,20,TweetDeck,Thanks to the over 275 constituents who attended my event in Palms yesterday!! I look forward to taking your concer… https://t.co/MxMJmGS5Gw
808391723894378502,2016-12-12 19:23:00,,7,8,TweetDeck,"On the heels of what was a peaceful process, Pres. Jammeh now seeks to overturn the electoral process in The Gambia… https://t.co/aifyo6acum"
808360834887991296,2016-12-12 17:20:16,,151,121,Twitter Web Client,"Tillerson has $233mil worth of inherent, direct financial conflict of interest w/ Russia. See my full interview: https://t.co/GPyhLRFO6x"
807665440231215104,2016-12-10 19:17:01,,14,24,TweetDeck,Today is #HumanRightsDay -- step forward and defend the rights of those at risk of discrimination or violence. More… https://t.co/QAJp9j4ygm
807415792023248896,2016-12-10 02:45:00,,11,19,TweetDeck,Congratulations to President-elect Nana Akufo-Addo and the people of Ghana for their successful &amp; peaceful election. https://t.co/wWuj1yZiP7
807274227191709696,2016-12-09 17:22:28,,45,78,Twitter Web Client,Happy to hear that @POTUS and Homeland Sec are taking a serious look at pre-election hacking-activity. More: https://t.co/21Xk2O3KjZ
807259770050793472,2016-12-09 16:25:01,,6,7,Twitter Web Client,"There are over 120,000 foster youth living in relative foster family homes. #FosterYouthVoices https://t.co/gFLev3qfIc"
806939221491494913,2016-12-08 19:11:17,,1,2,Twitter Web Client,I'm glad the Senate chose the wellbeing of those that have sacrificed 4 us over the system that took adv of heroes. https://t.co/wge3lpG01I
806701335567626244,2016-12-08 03:26:00,,3,10,TweetDeck,"I was sad to learn yesterday of the death of Charles Reed, who worked to open #CSU campuses to more people of color… https://t.co/eJlhvkknqG"
806684483697184768,2016-12-08 02:19:03,,5,9,Twitter Web Client,"Today, the House passed leg. that will require a regional strat to address Boko Haram. Thanks @RepWilson! More: https://t.co/y473fqNakL"
806534999835115521,2016-12-07 16:25:03,,9,13,Twitter Web Client,Today we honor the bravery of those that protected our country and we remember the courage of those that fought bac… https://t.co/CDMByLPxiI
805957181656821760,2016-12-06 02:09:00,,38,53,TweetDeck,"61 years ago, the Montgomery bus boycott began, which led to segregated buses being declared unconstitutional.… https://t.co/24QSPvV0nq"
805880071483523072,2016-12-05 21:02:36,,2,4,Twitter Web Client,"Today, Sec. Foxx announced $300 million in grants to 32 University Transportation Centers. Congrats to @USC! https://t.co/Phz2wOOMrN"
805861690034286596,2016-12-05 19:49:33,,6,0,Twitter Web Client,RT @HouseForeign: .@RepEdRoyce @RepEliotEngel @RepKarenBass urge transparency for Ghana’s election https://t.co/wIvFt3BhE6 #ghanaelections
805827328190205952,2016-12-05 17:33:01,,15,38,TweetDeck,"3 years ago, our world lost a true leader. Pres Mandela taught the world the meaning of social justice. May he rest… https://t.co/Vf91GtDmkA"
805814292259962881,2016-12-05 16:41:13,,5,14,Twitter Web Client,#BuyAmerica requires US construction projects to use US steel &amp; Iron. @realdonaldtrump promised to support this. Why won’t @SpeakerRyan?
805475511975682048,2016-12-04 18:15:01,,14,24,TweetDeck,"Today in 1881, the @latimes published its 1st paper. Since then, LAT has grown to be the largest metrodaily paper i… https://t.co/TnJHW189Do"
805086020622544896,2016-12-03 16:27:19,,1,10,Twitter Web Client,Congratulations to the Gambian people on their hallmark electoral victory. https://t.co/K1gRVFHKE7
804877250864750592,2016-12-03 02:37:45,,91,190,Twitter for iPhone,"My heart is w/ @USC during this terrible tragedy. As more details emerge, its important, now &amp; always, to support &amp; provide for each other."
804357897157230592,2016-12-01 16:14:01,,20,32,TweetDeck,"Today is World AIDS Day. How will you be a leader, show commitment, and make an impact? https://t.co/4Xa0aYbPVb… https://t.co/vZqRWrEZc1"
804119980442877952,2016-12-01 00:28:37,,8,0,Twitter for iPhone,RT @WhipHoyer: I join in congratulating newly-elected leaders of @OfficialCBC for the 115th Congress. https://t.co/dnnBqdEoqV https://t.co/…
804001799476748288,2016-11-30 16:39:01,,10,12,TweetDeck,"Today is the deadline for college-bound high school students to apply for a full scholarship a military academy!
https://t.co/m6n45zGwf5"
803728509000622080,2016-11-29 22:33:03,,38,72,Twitter Web Client,"If Trump's infrastructure plan comes @ the cost of enviro degradation and tax cuts for the wealthiest, count me out… https://t.co/kVwyFSSn5W"
803653992446205953,2016-11-29 17:36:57,,17,34,Twitter Web Client,I #StandWithNancy because she fights for all hard-working families across our country. https://t.co/ALoz54QU0y
803646768021811200,2016-11-29 17:08:15,,1,3,Twitter Web Client,Join the movement and give - whether it’s time or the power of your voice in your community. Happy #GivingTuesday! https://t.co/0mQPNfJ1oz
803342342514241537,2016-11-28 20:58:34,,32,27,TweetDeck,Simply a bad choice for this country. https://t.co/ySG3rjBtop
801863961364688896,2016-11-24 19:04:00,,1,17,TweetDeck,Happy Thanksgiving! https://t.co/yQT4c5vrmW
801578831878307840,2016-11-24 00:11:00,,27,64,TweetDeck,"11 years ago today, Liberian President Ellen Johnson Sirleaf became the first elected female president in an Africa… https://t.co/vxF4CRxwA0"
801503086493761538,2016-11-23 19:10:01,,2,14,TweetDeck,"Yesterday, I had the honor of cutting the ribbon for the @OIforC's Pediatric Scoliosis Center, which gives speciali… https://t.co/D6vvgdl15x"
800798446458466304,2016-11-21 20:30:02,,3,9,TweetDeck,I think it’s only fair that the small business owners from #CA37 benefit from gov't contracting. More here:… https://t.co/bBtuUwoWcY
800754400759164929,2016-11-21 17:35:01,,15,31,TweetDeck,"Last week, I joined @HouseJudDems urging Trump to select an AG who will defend the rights of all Americans.  
More:… https://t.co/B31isB9IYl"
800175084308598784,2016-11-20 03:13:01,,11,28,Twitter for iPhone,"There's no argument, @jeffsessions is the wrong choice for AG https://t.co/dq8JCntSgh"
800041202875711488,2016-11-19 18:21:01,,7,7,TweetDeck,Nov 30 is the deadline to apply to my office for scholarship nominations to the nation’s service academies here: https://t.co/m6n45zoUQv
799371232978333696,2016-11-17 21:58:48,,4,12,Twitter Web Client,"Last night, the @NFYInstitute and the Caucus on Foster Youth hosted a dinner on mental health and its effects on th… https://t.co/TSR79xQk8y"
799359285876715520,2016-11-17 21:11:19,,27,38,Twitter Web Client,Just elections are the cornerstone of our democracy. We must examine attempts by foreign gov'ts to influence them.… https://t.co/bRJYKvsr9r
799304094435319808,2016-11-17 17:32:01,,2,4,TweetDeck,Join me TOMORROW for a workshop on doing business with the government. RSVP here: https://t.co/Z3c4KH720R https://t.co/H7FKL6Xngo
799279938322841600,2016-11-17 15:56:01,,9,18,TweetDeck,Over 70% of #pancreaticcancer patients will die within one year of diagnosis. It's time to change these stats. Let'… https://t.co/aA417rMteL
798999087886442498,2016-11-16 21:20:01,,13,16,TweetDeck,"Now more than ever, we have to work together. The deadline to apply to intern in my DC office is FRIDAY. Apply here… https://t.co/D83TdIdWwD"
798955297922498560,2016-11-16 18:26:01,,3,8,TweetDeck,"Last night, the House passed a resolution urging respect for the constitution of the Dem. Rep. of Congo. More here: https://t.co/c4mytorw1j"
798711943431393280,2016-11-16 02:19:01,,12,12,TweetDeck,I'll be holding a tele-townhall  TOMORROW at 7PM PST to hear your thoughts on priorities for 2017. Sign up here: https://t.co/FI4iJv4mjK
798668407327649792,2016-11-15 23:26:01,,6,9,TweetDeck,Learn how to make the government YOUR next customer THIS Friday morning at Holman UMC. More here:… https://t.co/nuAjGhMg5f
798659458763100164,2016-11-15 22:50:28,,98,243,Twitter Web Client,"Today, I joined over 100 of my colleagues urging Trump to rescind his appointment of Bannon. Thanks @RepCicilline f… https://t.co/P5ZJaJlEMP"
798618573409316864,2016-11-15 20:08:00,,56,108,Twitter Web Client,"Click here to watch my full discussion of Trump's ""policies"" &amp; his planned assault on the American people:… https://t.co/15BavZn8bw"
798588336923406337,2016-11-15 18:07:51,,6,14,Twitter Web Client,Join me NOW to discuss the recent appointment of a supporter of white supremacy AT BEST: https://t.co/vxYPKEzRkd
798344078823981056,2016-11-15 01:57:15,,6,16,Twitter Web Client,Gwen Ifill was a role model for many. To have known her was an honor. More here: https://t.co/rgMCeOOng1 https://t.co/JB9HW2iDeO
798319069820653569,2016-11-15 00:17:52,,44,58,Twitter Web Client,The appointment of Steve Bannon brings a supporter of white supremacy to the WH. See my full statement here: https://t.co/8mcUsxr7jW
798318347880460288,2016-11-15 00:15:00,,24,25,Twitter Web Client,"Join me TOMORROW to discuss Pres-elect Trump's ""New Deal for Black America"" and his appointment of a supporter of w… https://t.co/4WJ3rsiwwy"
798264365296353285,2016-11-14 20:40:30,,13,26,Twitter Web Client,Every student deserves a quality public #education. Join me in celebrating the 95th American Education Week!… https://t.co/7gEEJvREs3
797134297065029632,2016-11-11 17:50:01,,3,11,TweetDeck,It is my commitment to continue to advocate for our veterans. Thank you all for your service.
797134043825442816,2016-11-11 17:49:00,,2,10,TweetDeck,"Last week I was privileged to assist Command Sergeant Major William Arthur Segee, Jr. in receiving the Legion of Me… https://t.co/UP8nvBA7FL"
797133792632774656,2016-11-11 17:48:00,,4,10,TweetDeck,"This #VeteransDay, join me in honoring and thanking all of the brave individuals who have risked their lives to defend our country."
796804106337845248,2016-11-10 19:57:57,,8,8,Twitter Web Client,The gov’t spent $90 billion last year buying products from small businesses. Why shouldn't your business benefit?… https://t.co/vs8aid5A5v
796065336130936833,2016-11-08 19:02:20,,11,30,Twitter Web Client,The U.S. elected the 1st woman to Congress 100 years ago today. Celebrate by turning out to #vote. Find where here:… https://t.co/55Kg9UMdqo
795995040761909248,2016-11-08 14:23:01,,1772,0,Twitter Web Client,RT @NancyPelosi: It's been a long time coming. Time to #vote. https://t.co/nKLAsx1f7b
795798495596662784,2016-11-08 01:22:01,,3,11,TweetDeck,Planning a trip to DC? Be sure to sign up for tours during your visit here! https://t.co/94mRP4PnpS https://t.co/F4DmzQaPuN
795677659648901120,2016-11-07 17:21:51,,3,6,Twitter Web Client,Don't forget! Tomorrow is the 2016 election. Click here to find out where and how to vote: https://t.co/5PEw8Xyv5K https://t.co/eMVQ7RAkGv
795389551044886528,2016-11-06 22:17:01,,10,12,TweetDeck,Nov is #FamilyCaregiversMonth! The work caregivers do to ensure the safety of our loved ones deserves to be recogni… https://t.co/YeORXfva9H
794966511433748480,2016-11-05 18:16:00,,8,13,TweetDeck,It’s always a pleasure to sit down with the interns in my LA office. Interested in applying for Jan? Click here:… https://t.co/PUVTeokmrO
794644360763731969,2016-11-04 20:55:54,,14,35,Twitter Web Client,November is #NationalAdoptionMonth! Thank you to the families who open their hearts to those who needed love most. https://t.co/nVKdNan0nt
794575435996667904,2016-11-04 16:22:01,,2,13,TweetDeck,Last night I was happy to join Temple Isaiah and First A.M.E. Church of LA congregations for a timely convo about e… https://t.co/NMUI1KIZAA
794308426142810113,2016-11-03 22:41:00,,7,8,TweetDeck,It was a pleasure to chat with the inaugural Master’s PA class at @cdrewu! Thank you for your dedication to erasing… https://t.co/AsjGmdR1nQ
794264134879739908,2016-11-03 19:45:01,,5,9,TweetDeck,.@Simone_Biles is a perfect example of #kinshipcare helping a child develop to her highest potential. More here: https://t.co/nNktBaFzxv
793902964717064193,2016-11-02 19:49:51,,121,0,Twitter Web Client,RT @HFACDemocrats: RM @RepEliotEngel: Glad to sign this letter w/@RepEdRoyce @RepChrisSmith @RepKarenBass to support democratic transition…
793881080990429184,2016-11-02 18:22:53,,6,20,Twitter Web Client,"Today, I join South L.A. in mourning the unbelievable loss of local philanthropist and true community hero E.J. Jac… https://t.co/Xh49b30Vv4"
793864360129069056,2016-11-02 17:16:27,,7,6,Twitter Web Client,Today celebrates life and brings together friends and family for remembrance of loved ones who have passed. Feliz D… https://t.co/BhnMssjPzL
793513442766237697,2016-11-01 18:02:02,,14,14,TweetDeck,The #paygap has barely budged in a decade: Latinas are paid 54% of what white men are paid. #LatinaEqualPay… https://t.co/YzHtAgFLM4
793470376403697665,2016-11-01 15:10:54,,338,0,Twitter Web Client,"RT @RepLujanGrisham: For every year we don't have #EqualPay, a Hispanic woman will lose over $25K. Close the #WageGap &amp; fight for #trabajad…"
792834429144051712,2016-10-30 21:03:52,,24,46,TweetDeck,"Diwali is the Hindu festival of lights, which spiritually signifies the victory of light over darkness and hope ove… https://t.co/LjmwnWRqCe"
792031924860493824,2016-10-28 15:55:00,,1,5,TweetDeck,We must find a permanent solution and #paythemback. Thank you @RepMarkTakano for your leadership on this issue.… https://t.co/9hK52mJlq2
792014710942134272,2016-10-28 14:46:36,,3,9,Twitter Web Client,This morning I’ll be on @MSNBC with @tamronhall discussing the latest breaking news. Tune in @ 8am PST!
791750369755992064,2016-10-27 21:16:12,,9,13,Twitter Web Client,"I was happy to participate in #MyDistrictDay, which rallies musicians to engage w/ their Reps. Artists must be able… https://t.co/HAUznx2Ju3"
791674349107412992,2016-10-27 16:14:08,,4,7,Twitter Web Client,Yesterday's action marks another step towards ending years of US hostility towards #Cuba. See more on the vote here: https://t.co/Q2Q5u5wh7T
791419389933387776,2016-10-26 23:21:01,,35,41,TweetDeck,"HBCUs educate, empower and excel; yet in 1998 they were listed among 11 endangered historic places. Join me in figh… https://t.co/nJO64JRWXm"
791343401962708993,2016-10-26 18:19:04,,6,13,Twitter Web Client,It was my pleasure to join @ToFosterChange in the discussion on @PBSSoCal on how best to raise #FosterYouthVoices.… https://t.co/Rjr9c3Dz92
791339989137235968,2016-10-26 18:05:30,,2,5,Twitter Web Client,"To create a movement, we must raise #FosterYouthVoices and #FosterChange. https://t.co/DHLnAfCyVG"
791319388473401344,2016-10-26 16:43:38,,5,7,Twitter Web Client,"Good news from the Pentagon this morning, but it’s important we continue to work to stop these clawback efforts. https://t.co/e7oOn80LoY"
791287438333403136,2016-10-26 14:36:41,,3,5,Twitter Web Client,"There will be an #FAA forum tonight, 6-9p at Palms Middle School about changing flight paths in Nov. More info:… https://t.co/F2hgm7zFkD"
790913545286328321,2016-10-25 13:50:58,,208,0,Twitter Web Client,"RT @RepMarciaFudge: Exercising your right to vote isn't partisan, it's personal. Join thousands of your fellow Americans and #VoteEarly. ht…"
790579438555725825,2016-10-24 15:43:21,,367,0,Twitter Web Client,RT @RepLoisCapps: A gun in the house makes domestic violence situations 5x more deadly. Abusers should not have access to firearms — it's t…
790556452742201344,2016-10-24 14:12:00,,6,8,TweetDeck,"TODAY is the last day to register to vote online! Californians, register here: https://t.co/WchdxTgZmE"
789579186440642560,2016-10-21 21:28:42,,3,9,Twitter Web Client,This country was built on the backs of Blacks and the @NMAAHC makes no efforts to hide #OurStory. https://t.co/QfA7UpGxY4 #APeoplesJourney
789514589964800000,2016-10-21 17:12:01,,3,4,TweetDeck,Just became a student at @USC? Be sure to register to vote by MONDAY! Register here: https://t.co/WchdxTgZmE
788482312770027520,2016-10-18 20:50:07,,2,9,Twitter Web Client,"Yesterday, I joined @RepTerriSewell in #Birmingham for a tour of the child welfare system there &amp; 2 discuss ways 2… https://t.co/ckYAYQIh47"
788094478498222080,2016-10-17 19:09:00,,7,7,TweetDeck,"You have ONE WEEK to register to vote online! Californians, register here: https://t.co/WchdxSZnY4"
788078159564537857,2016-10-17 18:04:09,,0,3,Twitter Web Client,https://t.co/XoDwymaobi
