id,created_at,coordinates,retweets,favorite_count,source,text
674726819053109249,2015-12-09 23:06:24,,1,2,TweetDeck,150 yrs ago we ended slavery with the 13th Amendment. Let’s remember today the importance of protecting the freedom of all Americans.
674337675902627840,2015-12-08 21:20:05,,1,0,TweetDeck,We have important work we should be doing: a budget bill to negotiate and a visa waiver reform bill to pass.
674337471681966080,2015-12-08 21:19:16,,0,0,TweetDeck,Every second of delay with these motions to adjourn brings us closer to a shutdown.
674337305738481664,2015-12-08 21:18:36,,1,0,TweetDeck,"My Democratic colleagues have been filing motions to adjourn all day, and each motion requires another needless vote period."
674248850643664900,2015-12-08 15:27:07,,0,0,TweetDeck,I wrote a letter calling for several riders that rein in Executive Branch overreach. Give it a read: https://t.co/Ju4XbzPLdn
674248683853111298,2015-12-08 15:26:27,,1,0,TweetDeck,The upcoming omnibus funding bill gives #Congress the chance to reassert its constitutional Power of the Purse.
673938721197137920,2015-12-07 18:54:46,,0,0,TweetDeck,Let us remember the Greatest Generation’s courage when we face the threats of the present. #PearlHarbor
673938476019134464,2015-12-07 18:53:48,,1,1,TweetDeck,The Greatest Generation responded to the attack on #PearlHarbor with an incredible courage.
673937948862189568,2015-12-07 18:51:42,,2,0,TweetDeck,"Today, we remember the horrific attack on #PearlHarbor and the many Americans who lost their lives 74 years ago. https://t.co/Ihbb40YzYp"
672548629178003457,2015-12-03 22:51:03,,0,3,TweetDeck,"I trust the commissioners in the 4th CD to build a better, cheaper road than bureaucrats in Washington, D.C. https://t.co/W1EDQH82tk"
672547639947210752,2015-12-03 22:47:07,,2,2,TweetDeck,The FAST Act blows past the expected revenue of the Highway Trust Fund and pays for itself through budget gimmicks.
672515382616412160,2015-12-03 20:38:56,,1,3,TweetDeck,"After many months of calling for legislation to lift the crude oil export ban, I’m thankful the House passed H.R. 8 today. #Yes2Energy"
672515230619017216,2015-12-03 20:38:20,,1,0,TweetDeck,The North American Energy Security and Infrastructure Act of 2015 greatly impacts energy production in our nation. #Yes2Energy
672179442563883014,2015-12-02 22:24:02,,26,26,TweetDeck,I'm praying for the victims in San Bernardino as well as the safety of law enforcement officers as they pursue these evildoers.
671835824770686977,2015-12-01 23:38:37,,1,0,Twitter for iPhone,For example: Schools will spend millions on electric bills instead of textbooks.
671835406040735745,2015-12-01 23:36:57,,2,3,Twitter for iPhone,"Higher energy prices hurt everyone, especially working families, farmers, and schools districts."
671834980625063938,2015-12-01 23:35:16,,2,0,Twitter for iPhone,These new #EPA rules continue the war on affordable electricity.
671834697123692544,2015-12-01 23:34:08,,3,5,Twitter for iPhone,"Today, I voted to stop the President’s power plant rules."
671777101847142401,2015-12-01 19:45:16,,2,1,TweetDeck,Thankful for the heroes who balance out the evil doers in this world: https://t.co/B44NkRnHAp
671776911752863744,2015-12-01 19:44:31,,3,0,TweetDeck,We just held a moment of silence on the House floor to reflect on the lives of those lost in Colorado Springs last Friday.
670654922321494016,2015-11-28 17:26:08,,2,3,TweetDeck,"Today is #SmallBusinessSaturday, an opportunity for us to #ShopSmall and support our local small business owners. https://t.co/dYbdCfLu92"
670437275528921088,2015-11-28 03:01:17,,1,3,TweetDeck,Our prayers are with the injured and the families of those murdered in Colorado Springs today. The Colorado Springs Police did a good job.
669929276515475456,2015-11-26 17:22:40,,2,3,TweetDeck,"Today is a time for thanks, when we remember all the ways God has blessed our families and our country. https://t.co/tZNSm4gfXy"
669574669520003073,2015-11-25 17:53:35,,2,1,TweetDeck,"Nov 28 is Small Business Saturday, a chance to support small business owners in your community by shopping at their stores. #ShopSmall"
669222682450403329,2015-11-24 18:34:55,,0,2,TweetDeck,I’m so proud of all of the students who have chosen to go through the academy nomination process.
669222423749881856,2015-11-24 18:33:54,,0,1,TweetDeck,Thanks to everyone who helped interview students applying for an academy nomination from my office. https://t.co/W3O8pC7Sgk
667815974280663041,2015-11-20 21:25:10,,5,6,TweetDeck,Why are Americans worried about the administration’s ability to vet Syrian refugees? Watch my answer: https://t.co/sdXjuPnPJI
667472458019008512,2015-11-19 22:40:09,,4,4,TweetDeck,"Today, UnitedHealth Group warned that it might leave #obamacare further limiting insurance choices: https://t.co/JUcVmJFSU3"
667469663731712000,2015-11-19 22:29:03,,2,2,TweetDeck,I hear from my constituents in Eastern Colorado that their health insurance choices are becoming more limited under #Obamacare
667468412474359808,2015-11-19 22:24:05,,1,1,TweetDeck,"On National Rural Health Day, I’m reminded of the ways Obamacare hurts rural residents. Let’s change that. #powerofrural"
667422996810870784,2015-11-19 19:23:37,,3,8,TweetDeck,"I voted today for a bill that pauses Syrian refugee settlement into the US, until we can determine how to ensure Americans’ safety."
667422738823409664,2015-11-19 19:22:35,,1,4,TweetDeck,ISIS has declared war. We can’t take the risk that they will do to us what they did in #Paris. https://t.co/6GfwlyjKvf
667123143014674433,2015-11-18 23:32:06,,0,3,TweetDeck,Let’s be a people who care about every child. #NationalAdoptionMonth
667109422804660224,2015-11-18 22:37:35,,1,2,TweetDeck,Every child deserves a home and a chance to thrive. #NationalAdoptionMonth https://t.co/pQ5DEKkVhl
666737344964268032,2015-11-17 21:59:05,,1,1,TweetDeck,Consumers should be able to buy the energy of their choice. https://t.co/BVVu8laNcN
666728273062199296,2015-11-17 21:23:02,,0,1,TweetDeck,Important that the #EPA understands the real costs of the Clean Power Plan.
666726534992953346,2015-11-17 21:16:07,,0,1,TweetDeck,"Laurie Bratten, my District Director, testified at an #EPA hearing yesterday. https://t.co/seDWHuMJvq"
666651893725270016,2015-11-17 16:19:31,,1,1,TweetDeck,No amount of delaying the Guantanamo detainee report will make the decision to bring terrorists here acceptable. https://t.co/g1NngdUs0C
666326132032012290,2015-11-16 18:45:04,,3,4,TweetDeck,"Thanks to our attorney general, Colorado won't buckle under to oppressive government. https://t.co/BVVu8laNcN"
666280593018109954,2015-11-16 15:44:06,,1,2,TweetDeck,Gov Hickenlooper wants to take @COAttnyGeneral to court over EPA lawsuit. My take: https://t.co/BVVu8laNcN
666070187158859777,2015-11-16 01:48:02,,2,0,TweetDeck,Congress has ceded by willful indifference too much of its own constitutional power to the executive branch. https://t.co/BVVu8laNcN
665986411259019264,2015-11-15 20:15:08,,1,1,TweetDeck,.@COAttnyGeneral has responsibility to defend the public interest in legal matters: https://t.co/BVVu8laNcN
665979086892699648,2015-11-15 19:46:02,,3,2,TweetDeck,CO Constitution grants citizens the right to elect an attorney general independently of the governor. https://t.co/BVVu8laNcN
665975584091013120,2015-11-15 19:32:07,,1,0,TweetDeck,Coloradans deserve to choose the type of fuel they want to buy. Commercial freedom is a basic right in this country. https://t.co/BVVu8laNcN
665968245573345280,2015-11-15 19:02:57,,1,0,TweetDeck,The untold story of many EPA mandates is that the least fortunate in society are hurt the most. https://t.co/BVVu8lsoBn
665960304078168064,2015-11-15 18:31:24,,16,9,TweetDeck,I support Attorney General Cynthia Coffman's decision to sue the #EPA over its burdensome new power plant regulations.
665335654310539264,2015-11-14 01:09:15,,2,2,TweetDeck,Devastated to hear about the attacks in Paris. My thoughts and prayers are with all those affected and their families.
664453811012964353,2015-11-11 14:45:08,,3,4,TweetDeck,"To everyone who has sacrificed their youth, their family, and their lives in defense of our nation, thank you. #VeteransDay"
664097762493886464,2015-11-10 15:10:19,,0,0,TweetDeck,Happy Birthday to the U.S. Marine Corps. Thank you to all who have served.
663772047319920640,2015-11-09 17:36:03,,2,1,TweetDeck,Florence Sabin was born on this day in 1871: https://t.co/EHyMQIisf6
662725959406059520,2015-11-06 20:19:16,,2,5,TweetDeck,I believe the Keystone XL Pipeline should have been authorized: https://t.co/HzVodrtSRe
662049757293096960,2015-11-04 23:32:17,,2,5,TweetDeck,Regular order is hard work. Here at work past 10 PM tonight. That's how it should be. Thank you @SpeakerRyan
661648070514348032,2015-11-03 20:56:07,,1,2,TweetDeck,Free on Saturday? Come to my town hall in Fort Morgan: https://t.co/vziFnIPw7Q
661208042210533376,2015-11-02 15:47:36,,3,1,TweetDeck,I spoke to the Intermountain Rural Electric Association about the government’s overregulation of American energy https://t.co/TRhqMCDw8m
660531722979663872,2015-10-31 19:00:09,,4,1,TweetDeck,Join me a week from today for a town hall in Fort Morgan: https://t.co/vziFnIPw7Q
660194868753379328,2015-10-30 20:41:37,,3,1,TweetDeck,October is breast cancer awareness month. https://t.co/FLOiofssd1
659816037177827328,2015-10-29 19:36:16,,6,8,TweetDeck,"I voted against the debt limit-busting budget deal. Read my press release about it: 
https://t.co/OleZOcODJl"
659462204350164992,2015-10-28 20:10:16,,3,3,TweetDeck,We must end the era of crisis-driven spending bills. Read my op-ed on the recent budget deal: https://t.co/moJoPEmy4F
659197430706151425,2015-10-28 02:38:09,,23,34,TweetDeck,I voted against reauthorizing the Export-Import Bank today. Crony capitalists won the day. I’m disappointed but still fighting. #EndExIm
659125995228823552,2015-10-27 21:54:17,,34,0,Twitter Web Client,RT @paulwinfree: Chart showing total spending under Boehner-Obama deal. Data from CBO; including debt service calculations by me. https://t…
659008491487653888,2015-10-27 14:07:22,,2,3,TweetDeck,Now we must #OverrideTheVeto.
659008428929654784,2015-10-27 14:07:07,,7,3,TweetDeck,"Presidents have signed the #NDAA for 53 years, funding our troops and their equipment. President Obama vetoed the NDAA."
657670344115908608,2015-10-23 21:30:03,,3,5,TweetDeck,"Report says EPA rushed their work and could have prevented Animas River spill 
https://t.co/hnzh281EOJ"
657651658973933569,2015-10-23 20:15:48,,3,7,TweetDeck,I voted against the reconciliation bill today because I want a FULL repeal of #Obamacare. https://t.co/oAmFMOBuRj
657275150967156736,2015-10-22 19:19:42,,2,2,TweetDeck,"A veto on #NDAA withholds resources our troops need. Mr. President, it's up to you to #SignTheBill"
657245025168924672,2015-10-22 17:19:59,,2,4,TweetDeck,Watch my clip from a hearing today where I made a point about “gotcha” censorship: https://t.co/zLFyiEEwGk
657214251535310849,2015-10-22 15:17:42,,2,1,TweetDeck,President Obama will veto the National Defense Authorization Act today. I don’t think we should play politics with our military #SignTheBill
657203869638905856,2015-10-22 14:36:27,,2,7,TweetDeck,Hope we finally get to the truth today about why we lost 4 heroes. #Benghazi
657200857814081537,2015-10-22 14:24:29,,0,0,TweetDeck,Watch former Secretary of State Hillary Clinton testify about #Benghazi today: https://t.co/53kMPMONk1
656508285604884480,2015-10-20 16:32:27,,25,31,TweetDeck,"I encourage President Obama to sign the NDAA, rather than veto it. Failing to pay our military personnel would be shameful. #SignTheBill"
656198248500101120,2015-10-19 20:00:28,,5,0,TweetDeck,The federal government may never recover the millions it loaned to the co-ops: https://t.co/xOUwaU6VCx
656194376696094720,2015-10-19 19:45:05,,2,1,TweetDeck,"Colorado’s Health CO-OP, created by Obamacare and reliant on federal funds, announced that it will shut down: https://t.co/sEL6GPGeK9"
656190669292081153,2015-10-19 19:30:21,,4,5,TweetDeck,We need to repeal Obamacare in its entirety and replace with a system that will work.
656190411791175680,2015-10-19 19:29:20,,2,0,TweetDeck,Obamacare is collapsing at a sickening pace: https://t.co/FzOgqjhER4
654784000720941056,2015-10-15 22:20:45,,0,1,TweetDeck,"I presented a flag yesterday to Claude Gordon “PeeWee” Shaffer, a true hero. http://t.co/ikexdkuQq4"
654404564410585088,2015-10-14 21:13:01,,1,2,TweetDeck,Had a great town hall in Elbert County yesterday. Thanks to all who came out! http://t.co/5DlQnNpfsj
654003329161261056,2015-10-13 18:38:39,,3,0,Twitter for iPhone,RT @bennmik11: At Weld Energy Proud meeting listening to @RepKenBuck.
653985735469613057,2015-10-13 17:28:44,,0,1,TweetDeck,I have a town hall today in Elizabeth. Details here: https://t.co/hWQONAqHD7
653642560468992000,2015-10-12 18:45:05,,0,0,TweetDeck,Don’t forget about my town hall in Elizabeth tomorrow: https://t.co/28gqpuktWw
653299799991545856,2015-10-11 20:03:04,,2,1,TweetDeck,You should know what I’m up to in D.C. Come to my town hall on Oct. 13 in Elizabeth. Details here: https://t.co/28gqpuktWw
652905440733360128,2015-10-10 17:56:02,,0,0,TweetDeck,I want to hear your thoughts and feedback at my town hall on October 13. Find details here: https://t.co/28gqpuktWw
652537919438233600,2015-10-09 17:35:38,,6,5,TweetDeck,"Glad to hear a court has blocked the EPA’s overreaching #WOTUS rule for the entire nation 
http://t.co/cAig7o3iNJ"
652517146866548738,2015-10-09 16:13:05,,0,0,TweetDeck,"On Tuesday, Oct. 13, I’m holding a town hall in Elizabeth. Find more details here: https://t.co/28gqpuktWw"
652483184521678849,2015-10-09 13:58:08,,1,2,TweetDeck,Still not convinced about lifting the crude oil export ban? Listen to this: https://t.co/8j49bxUbjl
652477396176670720,2015-10-09 13:35:08,,1,2,TweetDeck,Ending the crude oil export ban means lower gas prices in Colorado. #LiftTheBan
652471787557621760,2015-10-09 13:12:51,,1,1,TweetDeck,"Lifting the decades old crude oil export ban would add 394,000 U.S. jobs over 14 years. #LiftTheBan"
652301719972352000,2015-10-09 01:57:03,,1,4,TweetDeck,I'll be on Hannity in a few minutes to discuss my thoughts on the next Speaker of the House. http://t.co/0vDWB4BQm2
652257356747829249,2015-10-08 23:00:46,,12,26,TweetDeck,I'll be on Hannity tonight at 8:00 PM MT. Tune in to Fox News to hear my thoughts on what we need in our next Speaker of the House.
651899730457399296,2015-10-07 23:19:42,,0,0,TweetDeck,"Today I voted for the Homebuyer’s Assistance Act, a common sense delay in new #CFPB regulations"
651095053717368832,2015-10-05 18:02:12,,0,1,TweetDeck,My staff participated in the Walk to End Alzheimer’s this weekend in Greeley http://t.co/GcC4pKBPtt
649998957742039040,2015-10-02 17:26:42,,0,0,TweetDeck,"I held a tele-town hall last week to discuss energy and other issues. If you missed it, listen to this recap: https://t.co/8j49bybMHV"
649665602345299968,2015-10-01 19:22:04,,5,5,TweetDeck,Iran must be held accountable for its terrorist acts against American citizens. #NotOneCent
649665118469386240,2015-10-01 19:20:09,,12,7,TweetDeck,I voted today for a bill that prohibits the lifting of sanctions on Iran until the country pays the victims of its terrorism #NotOneCent
649663873260257280,2015-10-01 19:15:12,,1,1,TweetDeck,"Sutherland spent 2,354 days in captivity: https://t.co/WTZ6cvqCGj"
649662791780048897,2015-10-01 19:10:54,,1,1,TweetDeck,Iran owes former CSU professor Thomas Sutherland millions of dollars for helping Hezbollah kidnap him: https://t.co/O82FtfJsV9
649618447865901056,2015-10-01 16:14:41,,2,1,TweetDeck,"The President will allow Iran to export oil but not us.
http://t.co/3FcWG6NBH1"
649592806084902912,2015-10-01 14:32:48,,3,5,TweetDeck,I voted to redirect Planned Parenthood funding to alternative health centers that provide comprehensive healthcare to women. #defundPP
649347820928040962,2015-09-30 22:19:19,,2,5,TweetDeck,I support the man who oversaw the Republican Party’s incredible 2010 gains in the House. I support Rep. @PeteSessions for House whip.
648973289742692352,2015-09-29 21:31:04,,11,6,TweetDeck,"Turns out the video evidence of Planned Parenthood’s atrocious acts wasn’t dishonestly edited, as PP defenders claim: http://t.co/LbTqza7Q2M"
648958044278272001,2015-09-29 20:30:29,,5,4,TweetDeck,Today the OGR committee heard testimony from Planned Parenthood President Cecile Richards. Let’s hold PP accountable. #DefundPP
647794068056092672,2015-09-26 15:25:15,,5,3,TweetDeck,I look forward to nominating some of the best and brightest young men and women in the 4th CD to military academies: https://t.co/CrtnB8zwUY
647031806475259904,2015-09-24 12:56:18,,2,4,TweetDeck,Today we welcome Pope Francis to the US to address a joint session of Congress for the first time ever. #PopeInUS http://t.co/3n4o7bWM6E
646123206001098753,2015-09-22 00:45:51,,1,2,TweetDeck,I'm hosting a tele-town hall right now. Follow this link to join the live stream: http://t.co/pOKfGpvil6
644864846329200640,2015-09-18 13:25:35,,2,1,TweetDeck,"Have thoughts or questions on energy and the crude oil export ban? I want to hear them. Sign-up here: 
https://t.co/iwEtPlfHit"
644552977739579392,2015-09-17 16:46:19,,6,7,TweetDeck,Happy Constitution Day! Article I lists the powers of Congress. It’s not a long list! #ConstitutionDay http://t.co/R5KqbKpmKz
643867232737591296,2015-09-15 19:21:25,,2,1,TweetDeck,Have thoughts on energy and the crude oil export ban? I want to hear them. Sign-up here for my tele-town hall: https://t.co/iwEtPlfHit
643542964380270592,2015-09-14 21:52:53,,4,5,TweetDeck,Let’s redirect Planned Parenthood dollars to better alternatives. #DefundPP http://t.co/wdYCcBfHKX
642399677791514624,2015-09-11 18:09:53,,2,2,TweetDeck,"I spoke this morning on 850 KOA about President Obama’s Iran deal. #NoNuclearIran
https://t.co/2RhzIn5nar"
642352567322812416,2015-09-11 15:02:41,,2,2,TweetDeck,"14 years ago, terrorists mercilessly attacked our nation. Today we remember those we lost. #NeverForget"
642162354671722496,2015-09-11 02:26:50,,6,1,TweetDeck,"Every day, 22 veterans commit suicide. 17 of those 22 never seek out treatment. #StopSuicide"
642065073549131776,2015-09-10 20:00:17,,2,4,TweetDeck,"The President’s Iran deal is at best delusional, and at worst despicable. See my speech #NoNuclearIran
https://t.co/7n9QO9T2rD"
641696479116177410,2015-09-09 19:35:37,,2,2,TweetDeck,"If you're interested in watching Pope Francis' speech on Sept. 24 from outside the Capitol, fill out this form: https://t.co/hxZyIxEkWi"
639549790930337792,2015-09-03 21:25:27,,2,4,iOS,"Great Qs from staff at Stapp Interstate Toyota-Scion - fracking, CFPB, cost of college, nat debt, Presidential race http://t.co/bZ8augQ8QM"
639549328302866432,2015-09-03 21:23:36,,1,1,Twitter for iPhone,"Stapp staff Q: can you help us with the CFPB? I think the CFPB is unconstitutional and oppose it, will do all I can to help."
637302493609725952,2015-08-28 16:35:29,,3,0,Twitter for iPhone,RT @IJN_Colorado: Check out these photos of @RepKenBuck getting a glimpse at some of our nostalgia. https://t.co/PHYOlGYoYi
637302413263671296,2015-08-28 16:35:10,,6,0,Twitter for iPhone,"RT @BrandonRittiman: The family credits @RepKenBuck for pushing through the application.
I credit @Thru9sViewfindr with making it shine on …"
637302234590478336,2015-08-28 16:34:27,,9,0,Twitter for iPhone,RT @BrandonRittiman: Watch: CO family receives posthumous medal for Merritt Eddy's time as POW in WWII. http://t.co/M97b1VRyN8 #9NEWS http:…
637132569117523968,2015-08-28 05:20:16,,10,0,Twitter for iPhone,RT @BrandonRittiman: Only on #9NEWS at 10: a navy sailor who survived the sinking of the USS Houston gets a posthumous POW medal. http://t.…
637034305844195328,2015-08-27 22:49:48,,2,0,Twitter for iPhone,"Courts deal Obama admin another defeat. WOTUS rules blocked, economy shielded from another blow #copolitics"
636948040209711104,2015-08-27 17:07:01,,1,0,Twitter Web Client,"Sat down for an interview on the #IranDeal with Intermountain Jewish News this week, article coming 9/4 https://t.co/5vx9yHOiBE #copolitics"
636593002694074368,2015-08-26 17:36:13,,0,0,Twitter for iPhone,I presented Mary Chandler with an American Fighter Aces Bronze Medal in honor of her husband Van http://t.co/fdQCIJqutW #veterans #military
636273732760145920,2015-08-25 20:27:33,,4,0,Twitter for iPhone,"More secret email accounts. What happened to ""the most transparent administration ever?"" http://t.co/n4IRLvdZAI #copolitics"
635883783363821569,2015-08-24 18:38:02,,2,0,Twitter for iPhone,#EPA reportedly knew of this risk well in advance; they must be held accountable if they failed to take precautions http://t.co/QL84vo1m38
634109347610689536,2015-08-19 21:07:04,,2,3,TweetDeck,This is the very definition of the fox guarding the hen house #IranDeal #copolitics https://t.co/nB7tIyRbSF
633667457589358592,2015-08-18 15:51:09,,0,1,TweetDeck,"Friends, if you need constituent services,my staff will be hosting office hours next Tuesday in Longmont https://t.co/t5X9ZwRZnh #copolitics"
633386182009856001,2015-08-17 21:13:28,,7,10,Twitter for iPhone,"The American people are calling for answers from #PlannedParenthood, and they deserve the truth #prolife #copolitics https://t.co/WThPOQLTne"
633356396466081793,2015-08-17 19:15:06,,1,3,TweetDeck,I will present Mary Chandler w/ the American Fighter Aces Bronze Medal in recognition of her husband's achievements https://t.co/R0R4DuRfjF
633352711761584128,2015-08-17 19:00:28,,2,1,TweetDeck,#Greeley World War II fighter pilot receives congressional medal posthumously https://t.co/R0R4DuRfjF #copolitics #veterans #military
633337573058854912,2015-08-17 18:00:18,,2,1,TweetDeck,"Iran has been deceptive &amp; secretive about the #IranDeal, but one thing is clear: they will use it to threaten Israel http://t.co/jOjViG4tGd"
633303529076224000,2015-08-17 15:45:02,,3,0,TweetDeck,"Iran’s lead negotiator Zarif allegedly said #IranDeal &amp; $100 B in sanctions relief, will empower Iran to fight Israel http://t.co/jOjViFMSOF"
632298201538818049,2015-08-14 21:10:13,,2,3,Twitter for iPhone,Step in the right direction #copolitics #crudeoil #energy  https://t.co/rX56JIIK97
632255702778687489,2015-08-14 18:21:20,,2,0,TweetDeck,Congrats to Rod Weimer of CO CD4 for being awarded the 2015 Precision Agriculture Farmer of the Year Award!  http://t.co/QS5pN76bx5 #ag
632220798401556480,2015-08-14 16:02:39,,3,0,TweetDeck,The implementation of Obama’s #IranDeal is far more dangerous than its failure http://t.co/0FAIViEG6R #copolitics
632206301435703296,2015-08-14 15:05:02,,17,0,Twitter for iPhone,"RT @SpeakerBoehner: Two House Dems oppose #IranDeal, say it “allows #Iran to remain a ‘threshold nuclear state’” http://t.co/7uGnbz3UzB"
632205135641317376,2015-08-14 15:00:24,,2,0,TweetDeck,"In his #IranDeal, President Obama capitulated to Iran's demands &amp; it all but guarantees a nuclear Iran. https://t.co/dD7imjW6tA #copolitics"
632191967104008192,2015-08-14 14:08:05,,0,0,TweetDeck,"If you haven't signed up for my eNewsletter and want to follow my work in Congress, you can do so here https://t.co/VZrISNbrJ4 #copolitics"
631897742747541504,2015-08-13 18:38:56,,2,0,Twitter for iPhone,Americans across the country want answers from the #EPA after the #AnimasRiverSpill @GOPoversight will investigate https://t.co/5SpkAIas8w
631172547694960644,2015-08-11 18:37:16,,12,3,TweetDeck,The EPA should be held to the same standards they have for the private sector https://t.co/2WXFpfDuQ6 #copolitics #AnimasRiver
630857998345351168,2015-08-10 21:47:22,,4,4,Twitter for iPhone,"Obama's war on coal hurts poor people the most, read this... http://t.co/pFy4UqgMI7 #copolitics #energy"
630778958364176385,2015-08-10 16:33:17,,1,0,TweetDeck,"""Buck fights for transportation needs of Coloradans"" http://t.co/zMxUJ66GVf Thank you, Lori! #copolitics #transportation"
629385847519907841,2015-08-06 20:17:34,,2,0,TweetDeck,RT @jennybethm: Must read: Lift export ban on crude oil by @RepKenBuck: http://t.co/WOIruktzGc #teaparty
629382669822889989,2015-08-06 20:04:56,,6,0,TweetDeck,"RT @TPPatriots: .@RepKenBuck: By lifting the export ban on crude oil, Congress has an opportunity to encourage job creation --&gt; http://t.co…"
629373365044793344,2015-08-06 19:27:58,,0,0,Twitter for iPhone,(2/2) Weld County is an important part of those lower gas prices http://t.co/M6Pf4ZLYIW #copolitics
629373119803867139,2015-08-06 19:26:59,,1,0,Twitter for iPhone,(1/2) 57% of Americans say lower #gasprices are making noticeable difference in their household finances http://t.co/M6Pf4ZLYIW #copolitics
629083720553619456,2015-08-06 00:17:01,,3,0,TweetDeck,Obama admits lifting Iran sanctions will result in more funds for terrorism. This deal also guarantees a nuclear Iran http://t.co/lub57Qw2ti
629038481109553152,2015-08-05 21:17:15,,5,1,TweetDeck,Obama admits lifting Iran sanctions will result in more funds for terrorism. They'll fund terror and get a nuke. http://t.co/lub57QerBK
629013572375474176,2015-08-05 19:38:16,,2,0,TweetDeck,"RT @EnergyBrief: OP-ED @denverpost: ""Lift export ban on crude oil,"" by @RepKenBuck http://t.co/ZrgUAYB8Ld #CrudeOil"
629006388442890241,2015-08-05 19:09:44,,10,0,TweetDeck,"RT @CR: Reclaiming congressional authority with Article I Caucus
http://t.co/0X0x4O02PB

by: @RepKenBuck 
. http://t.co/I4zLtkBNPJ"
628989863677808644,2015-08-05 18:04:04,,1,0,TweetDeck,RT @DougcoEnergy: @RepKenBuck @denverpost Thank You Congressman for your efforts on this! We appreciate it!
628969595982974976,2015-08-05 16:43:32,,2,0,TweetDeck,Lift the export ban on #crudeoil: My latest in the @denverpost http://t.co/IwLh2LXvhX #copolitics #energy http://t.co/4Sa3ykkmA9
