id,created_at,coordinates,retweets,favorite_count,source,text
299961555154522112,2013-02-08 19:23:02,,3,1,Twitter for Websites,Uplifting African-American foster youth http://t.co/H2gPFNyU  via @theGrio
299941514027614208,2013-02-08 18:03:24,,1,1,Twitter Web Client,"Right after the #SOTU, I'm holding a town hall to discuss your thoughts on the President's speech. Sign up to join us: http://t.co/G4YeBhON"
299632574395994112,2013-02-07 21:35:47,,9,2,Twitter Web Client,Every attempt must be made to avoid having children ripped away from homes unnecessarily and placed into foster care http://t.co/5CmiRFbu
299632354471858176,2013-02-07 21:34:54,,5,1,Twitter for Websites,These allegations are very concerning Via @nprnews: South Dakota Tribes Accuse State Of Violating Indian Welfare Act http://t.co/i6lDgxes
299217621381955585,2013-02-06 18:06:54,,2,0,Twitter for iPhone,RT @Lindz4VT: @repkarenbass speaking at #forum2012 on the importance of funding community based drug prevention http://t.co/GSjZIJ8d
299212125040152577,2013-02-06 17:45:04,,3,1,Hootsuite,"It’s especially disappointing to see that because of fiscal burdens imposed by Congress, @USPS has to stop Saturday service"
299210954632224770,2013-02-06 17:40:25,,4,1,Hootsuite,"My Father worked many Saturdays @ the post office, sad to see this MT @usps: We are rolling out a new delivery schedule http://t.co/V5YwMTjY"
299199484561354753,2013-02-06 16:54:50,,2,3,Twitter Web Client,We cannot reduce the deficit through cuts alone... I don't know how many times we have to say this! http://t.co/HWTeldrU
299173964834541568,2013-02-06 15:13:26,,0,0,Twitter for Websites,Californians find agreement on immigration http://t.co/6BcF9ZUU via @kpcc
298906122285363200,2013-02-05 21:29:07,,1,1,Hootsuite,Tune into @GranholmTWR on @Current TV today at 3:20pm PT. I'll be on to talk about POTUS urging Congress to reach a sequestration deal
298832586397073409,2013-02-05 16:36:55,,3,0,Twitter Web Client,Watch the @HouseJudDems hearing on #ImmigrationReform that's happening live right now: http://t.co/h2UXPPRs
298823153487077377,2013-02-05 15:59:26,,1,3,Twitter Web Client,Taking my seat at the first hearing of the @HouseJudDems. Today's focus is very important: #ImmigrationReform http://t.co/MBlT4VmE
298810485191614464,2013-02-05 15:09:05,,5,0,Twitter for BlackBerry®,Long lines to see immigration hearing on Cap Hill. Lots of interest for comprehensive reforms. http://t.co/LhUTDPRC
297142654712569856,2013-02-01 00:41:44,,4,0,Hootsuite,Going door to door in Manchester Square this afternoon with an issue survey for residents of the new 37th CD http://t.co/LPNUDmww
296611294944043009,2013-01-30 13:30:18,,6,0,Twitter for BlackBerry®,Tune in to KTLA 5 morning news at 830am PDT. I'll be on to discuss changing foster care in America. If in LA hope you can tune in!
296268538853867520,2013-01-29 14:48:18,,4,0,Twitter for BlackBerry®,See my new op-ed in CQ Roll Call. Time for decisive action to help alleviate the suffering in the DRC. http://t.co/jYAcHLkx
295972297095921664,2013-01-28 19:11:09,,8,4,Twitter for BlackBerry®,Enjoyed attending Inauguration with these foster youth. Proof that foster youth can succeed if given our support. http://t.co/ZFhmWNSv
295912115573776384,2013-01-28 15:12:00,,1,2,Twitter for BlackBerry®,Interesting article from NY Times about some challenges in foster care system. http://t.co/yPwEchDF
295554670993235968,2013-01-27 15:31:39,,11,2,Twitter for BlackBerry®,Today is International Holocaust Remembrance Day. Let's honor and remember millions of lives lost during the Holocaust 60 years ago.
295244733817700352,2013-01-26 19:00:04,,3,0,Twitter for BlackBerry®,Great turnout at Hope and Help Resource Fair where we're helping with underwater mortgages and accessing federal resources to improve lives
294487690198532096,2013-01-24 16:51:51,,3,0,Twitter Web Client,Don't forget! Join me this Saturday for a mortgage relief and tax fair. We'll have counselors on hand to give you help  http://t.co/Bp4CDydk
294170674484879360,2013-01-23 19:52:09,,2,1,Twitter Web Client,Listening to Secretary Clinton’s testimony about the Benghazi attacks. Watch live: http://t.co/JWPxVc9H http://t.co/4UsZhX3m
294158984661835777,2013-01-23 19:05:41,,3,2,Twitter Web Client,Proud to join my colleagues in taking up this fight again in the 113th Congress. #VAWA
294158844559519745,2013-01-23 19:05:08,,223,0,Twitter Web Client,RT @VP: The need for a strong #VAWA bill could not be more clear or urgent. All victims should be protected. Congress should pass VAWA.  ...
294095138182012928,2013-01-23 14:51:59,,1,0,Twitter Web Client,About to appear on @MSNBC to discuss Secretary Clinton’s upcoming testimony about the #Benghazi attacks. Tune in now!
293782783199952896,2013-01-22 18:10:48,,14,0,Twitter Web Client,"With historic number of women in Congress, there's no better time to ensure women’s rights are respected &amp; protected for the future #RoeAt40"
293782000748359680,2013-01-22 18:07:41,,15,1,Twitter Web Client,"On the 40th anniversary of Roe v. Wade, we must remain vigilant in protecting a woman’s right to choose https://t.co/ZUWKkZLr #RoeAt40"
293724915914403840,2013-01-22 14:20:51,,3,0,Twitter Web Client,"RT @kkennedyAP: Congressional  Caucus on Foster Youth quietly growing in strength led by Reps. Bass, Bachmann
http://t.co/epwTJko7
#chil ..."
293438834170003456,2013-01-21 19:24:04,,5,2,Twitter Web Client,Today we celebrate the life and legacy of a great man -  the Rev. Dr. Martin Luther King Jr http://t.co/dq093xW8
293435714438311936,2013-01-21 19:11:40,,2,0,Twitter Web Client,"RT @fosterclub: In line for the Inauguration with Elbert Belcher, Sixto M. Cancel, Daniesha Richards http://t.co/SQI0crUb"
293433342148354049,2013-01-21 19:02:15,,10,6,Twitter Web Client,"So happy that foster youth Elbert, @Sixtocancel &amp; Daniesha attended President Barack Obama's second inauguration http://t.co/6ALAmWGs"
293432107429150720,2013-01-21 18:57:20,,7,0,Twitter Web Client,RT @ChildWelfareHub: 3 former foster youths from Florida to attend inauguration at @RepKarenBass invite http://t.co/xpGaI5fn #Champion4C ...
292720251680989185,2013-01-19 19:48:41,,3,1,Twitter Web Client,Really enjoyed this morning's talk around the importance of having women be at the table in discussing policy decisions http://t.co/TiPfHa9n
292371511401132033,2013-01-18 20:42:54,,1,2,Twitter Web Client,Just had lunch with Ms. Wanda Sanders who won tickets to President Obama’s Inauguration through my office https://t.co/J2TSUNRM
291914057508847616,2013-01-17 14:25:10,,8,4,Twitter Web Client,Wishing First Lady @MichelleObama a happy birthday today! She's an amazing example for women &amp; young girls everywhere. http://t.co/hSgcZeGW
291626211187253248,2013-01-16 19:21:22,,4,0,Twitter Web Client,At the @TheWilsonCenter to hear remarks from @AFAsstSecy reflecting on the last 4 years of the US-Africa partnership http://t.co/SnCP0Awb
291624399927398402,2013-01-16 19:14:09,,102,0,Twitter Web Client,RT @NancyPelosi: House Democrats are holding a hearing right now on how Congress can #PreventGunViolence. Watch the webcast: http://t.co ...
291609745968746496,2013-01-16 18:15:55,,1624,0,Twitter Web Client,RT @whitehouse: #NowIsTheTime to protect our children &amp; our communities by reducing gun violence. Read the President's plan: http:// ...
291609662049099776,2013-01-16 18:15:35,,22,4,Twitter Web Client,I commend the President and @VP for their bold leadership in compiling these recommendations to reduce gun violence #NowIsTheTime
291320061581467648,2013-01-15 23:04:49,,1,1,Twitter Web Client,Join me for Help and Hope Town Hall &amp; Resource Fair w/ help to remain in your home and buy your first home. RSVP here: http://t.co/3LQhSm7a
291273953090084865,2013-01-15 20:01:36,,1,0,Twitter Web Client,Thanks to @SenLandrieu and HHS Assistant Sec. George Sheldon for joining me today to celebrate the Uninterrupted Scholars Act becoming law
290968964555735040,2013-01-14 23:49:41,,13,7,Twitter Web Client,Uninterrupted Scholars Act was signed into law! Now foster youth have more resources so they can succeed academically http://t.co/1pGxD4qW
290223939437871105,2013-01-12 22:29:13,,0,0,Twitter Web Client,ICYMI: I joined @MSNBC's Weekends with @AlexWitt to discuss the upcoming debate over debt ceiling. Watch it here: http://t.co/tJPCIBZn
289867523921432576,2013-01-11 22:52:57,,6,1,Twitter Web Client,"Tune into @MSNBC tomorrow, I'll be on at 10am PT/1pm ET to discuss what we can do to reduce gun violence"
289431077045559298,2013-01-10 17:58:42,,12,1,Twitter Web Client,Briefing for congressional staff to better understand crisis in DRC &amp; how Congress can #ACTonDRC now http://t.co/6vCsHF7w
289192379452362752,2013-01-10 02:10:10,,6,2,Hootsuite,UN reports the M23 rebels get logistical &amp; political support from foreign govs. Congress must use its influence to #ACTonDRC
289159780185030656,2013-01-10 00:00:38,,9,2,Hootsuite,Both M23 &amp; armed groups have committed sexual violence against women &amp; girls. I call on  Congress to #ACTonDRC http://t.co/oI4XKBlg
289129465148227585,2013-01-09 22:00:10,,20,2,Hootsuite,"Since Nov 2012, 2.4 million ppl have been displaced &amp; half million have fled DRC. Congress needs to #ACTonDRC to end this crisis"
289120176165765121,2013-01-09 21:23:16,,11,0,Twitter Web Client,"RT @zeenat: Africa has the potential 2 create betwn 54 mil+72 mil wage-paying jobs in manufacturing, agr, retail + hospitality.  http:// ..."
289110665199775744,2013-01-09 20:45:28,,10,0,Twitter Web Client,RT @kambale: Join @RepKarenBass in calling on Members of Congress to co-sponsor her resolution to #ACTonDRC &amp; end the cycle of terro ...
289099151323578368,2013-01-09 19:59:43,,25,5,Hootsuite,"2+ million men, women and children have been displaced in 20 yrs of conflicts in the DRC. I call on Congress to #ACTonDRC to end violence"
289075415505575936,2013-01-09 18:25:24,,13,3,Twitter Web Client,"Since 1990s, 5 mil people have died due to conflict in the DRC. Congress needs to #ACTonDRC to end cycle of violence http://t.co/5RydbqKj"
288757914171215873,2013-01-08 21:23:46,,0,1,Twitter Web Client,"@IWashington Great suggestions. Thanks, Isaiah"
288684823193743360,2013-01-08 16:33:20,,2,0,Twitter Web Client,What would you like to see included in @VP Biden's taskforce on gun violence?
288684640380809216,2013-01-08 16:32:36,,24,3,Twitter Web Client,Today let's honor @GabbyGiffords &amp; all those who have survived gun violence. Time for a comprehensive approach to decreasing gun violence.
288300621356994560,2013-01-07 15:06:39,,7,2,Twitter for Websites,New law to help foster kids stay in school http://t.co/QELGsXu4 via @kpcc
287330754348847104,2013-01-04 22:52:44,,0,0,Twitter Web Client,Watch @VP count the official Electoral College votes electing him &amp; President Obama to a second term in office http://t.co/v7QnOzB4
287208951848779776,2013-01-04 14:48:44,,5,0,Twitter Web Client,"Thanks to @RepDaveCamp, @RepErikPaulsen, @RepLloydDoggett for their work to pass the Protect our Kids Act to prevent child death from abuse"
287203228184109059,2013-01-04 14:26:00,,8,2,Twitter Web Client,Bill to Help Foster Youths With School Records Passes House and Senate: http://t.co/xubGteFv via @AP
287030170743881729,2013-01-04 02:58:20,,2,0,Twitter Web Client,RT @knightcali: Watch  @RepKarenBass live Town Hall meeting  from DC http://t.co/xgKhsHr6 …
287029355471851521,2013-01-04 02:55:05,,2,0,Twitter Web Client,RT @LAlupusLady: Tweet @RepKarenBass http://t.co/3UlFQxXE she reaches out and connects w/ her constituents.  Representing the 37th District!
287027340737929216,2013-01-04 02:47:05,,2,1,Twitter Web Client,"Fiscal cliff deal raised taxes on ppl making more than 400K, no cuts to medicare, social security, or medicaid http://t.co/sGEqB2Cs"
287024273430827008,2013-01-04 02:34:54,,2,1,Twitter Web Client,Emergency unemployment insurance has been extended as part of the fiscal cliff deal. Got a question? Ask me live now: http://t.co/sGEqB2Cs
287021930081570816,2013-01-04 02:25:35,,3,0,Twitter Web Client,"I'm answering your questions live right now, ask me a question http://t.co/Ad5qosrI #p2 #fiscalcliff"
287019008920788992,2013-01-04 02:13:58,,6,0,Twitter Web Client,Have a question about the fiscal cliff deal? Join me live right now on a virtual town hall to learn more http://t.co/sGEqB2Cs #p2
287018282136002560,2013-01-04 02:11:05,,1,0,Twitter Web Client,Tune in now to my LIVE virtual town hall to give an update on the fiscal cliff deal http://t.co/sGEqB2Cs #p2
286912500442730496,2013-01-03 19:10:45,,2,0,Twitter Web Client,If the fiscal cliff debate told us anything it should be that Grover Norquist’s tax pledge is dead – now &amp; forever more http://t.co/noTmwoAK
286883095171448832,2013-01-03 17:13:54,,3,1,Twitter Web Client,Officially sworn in as a member of the 113th Congress moments ago. Hoping this Congress is a more bipartisan and productive one.
286862106572255232,2013-01-03 15:50:31,,24,8,Twitter Web Client,What an honor to be sworn-in with such great heroes &amp; leaders in the African American community @OfficialCBC http://t.co/3y7orJJM
286629550820040704,2013-01-03 00:26:24,,3,0,Twitter Web Client,Join me tomorrow for a Virtual Town Hall at 6pm PT to discuss the fiscal cliff deal and ask any questions. RSVP: http://t.co/ldYeZTjU
286518723509121024,2013-01-02 17:06:01,,3,0,Twitter Web Client,"Uninterrupted Scholars Act is an example--even in divided times, we can come together to do what’s right for children http://t.co/fZnBNhNa"
286302433011986432,2013-01-02 02:46:33,,10,1,Twitter Web Client,It’s disappointing Rs have decided to start off the New Year by asking even more of those who have already made the greatest sacrifices
286302195538878464,2013-01-02 02:45:37,,4,1,Twitter Web Client,Federal workers made sacrifices to reduce our nation’s debt incl. $90 billion thru reduced pay &amp; pension benefits https://t.co/LfcJWWBF
286287017011204096,2013-01-02 01:45:18,,20,6,Twitter Web Client,Finally GOP getting the message. Up or down vote on bi-partisan fiscal cliff deal happening tonight.
286262393204535296,2013-01-02 00:07:27,,1011,0,Twitter Web Client,RT @NancyPelosi: Strong majority of House Ds support bipartisan Senate bill that passed 89-8. Confident it will pass if @SpeakerBoehner  ...
286171325423316993,2013-01-01 18:05:35,,17,3,Twitter Web Client,In caucus listening to @VP Biden about the deal to prevent us from going over the fiscal cliff http://t.co/HcnPgv0G
285938105041690624,2013-01-01 02:38:51,,17,4,Twitter for iPhone,Praying for @RepJohnLewis and family over the loss of his beloved wife Lillian
285869576179294208,2012-12-31 22:06:32,,8,0,Twitter for iPhone,Congress must keep working to do what's right for the American people #fiscalcliff
285869443194707970,2012-12-31 22:06:01,,6,0,Twitter for iPhone,"Unfortunate we may go into recess without a fiscal cliff deal. But as POTUS said, a deal could be insight but clearly our work is not done"
285539090324127744,2012-12-31 00:13:18,,8,1,Twitter Web Client,I do believe we will have a deal to prevent us from going over the fiscal cliff... http://t.co/lIdXozJg
285498916147953664,2012-12-30 21:33:40,,8,0,Twitter Web Client,Tune into MSNBC at 2:30pm PT and CNN at 3pm PT. I'll be on to talk about the recent developments to avert the fiscal cliff.
285175003882848257,2012-12-30 00:06:33,,3,1,Twitter Web Client,Boehner's principle is that his caucus all has to act in lockstep fashion. That's the problem. #fiscalcliff http://t.co/p8TdQy6W
285086615544672257,2012-12-29 18:15:20,,4,0,Twitter Web Client,"RT @MARKHEDLUND: Avoid fiscal cliff? All it takes is political guts like Steinberg, Bass, Cogdill &amp; Villines showed in 2009 CA budge ..."
285086245019844609,2012-12-29 18:13:52,,13,3,Twitter Web Client,Not getting 100% of what u want is no excuse to do nothing. See how we came 2gether in CA 2 avoid our own #fiscalcliff. http://t.co/8NgGB2FB
285082982186885120,2012-12-29 18:00:54,,3,1,Twitter Web Client,I'll be on @MSNBC at 10:30PT talking #fiscalcliff. Still confident we can come together and come up with a common sense solution.
284723898338123776,2012-12-28 18:14:01,,3,2,Twitter Web Client,"ICYMI: Last night, I appeared on @CBSLA to give my take on the fiscal cliff negotiations. Watch it here: http://t.co/IRNK3dls"
284495552002011139,2012-12-28 03:06:39,,2,0,Twitter Web Client,"On @CBSLA tonight, I be on to discuss the ongoing negotiations to avert the fiscal cliff with Dave Bryan. Hope you can tune in!"
284407939140292609,2012-12-27 21:18:31,,17,7,Twitter Web Client,Looking forward to Congress getting back to work in DC. Eager to see if Republicans are ready to come together and make a deal.
282917667961204736,2012-12-23 18:36:43,,2,0,Twitter Web Client,"Tune into @MSNBC at 12pm PT today, I'll be on to discuss the ongoing negotiations to avert the fiscal cliff."
282227556743262208,2012-12-21 20:54:28,,2,0,Twitter for iPhone,Joining @TeamCavuto on FOX in a moment to talk about the fiscal cliff. Tune in! http://t.co/R9egZ19s
282205510504165376,2012-12-21 19:26:51,,5,2,Twitter Web Client,Congrats to Sen @JohnKerry on his selection to be Sec. of State. He has a long history of dedication to our nation https://t.co/XXIhsEfu
282178725427179520,2012-12-21 17:40:25,,1,0,Twitter Web Client,"ICYMI, I joined Current TV's The Bill Press Show to discuss Speaker Boehner's pulled ""Plan B"" bill. Watch it here: http://t.co/4Nz3Mtsl"
281948918986731520,2012-12-21 02:27:15,,1,0,Twitter Web Client,The time is now to lead on this issue and work across the aisle to do what’s best for the American people
281948810878545920,2012-12-21 02:26:49,,4,1,Twitter Web Client,My Republican colleagues seem intent on continuing to play Russian roulette with the fiscal cliff deadline.
281866558739972099,2012-12-20 21:00:00,,0,0,Twitter Web Client,Today’s testimony gives us an opportunity to hit reset on Benghazi and put politics aside https://t.co/E7G3LU1b http://t.co/UF12Y10r
281830952915841025,2012-12-20 18:38:29,,1394,0,Twitter Web Client,"RT @whitehouse: The facts about Republicans' ""Plan B"": The wealthy get tax cuts, while the middle class foots the bill: http://t.co/9YtKXwU7"
281793974035951616,2012-12-20 16:11:33,,4,2,Twitter Web Client,Senator @Daniel_Inouye was a hero of my father--also a WWII Veteran. The United States has lost a great statesman and hero.
281768466082578433,2012-12-20 14:30:11,,3,0,Twitter Web Client,Joining @SMShow shortly to talk about the fiscal cliff. Listen live here: http://t.co/zynzXPsL
281766311808335872,2012-12-20 14:21:38,,1,0,Twitter Web Client,When politics become a national security threat http://t.co/zO9DUvCw
281528512794472450,2012-12-19 22:36:42,,1,0,Twitter Web Client,@mridleythomas It was my pleasure. Thank you for all the work you do for our community.
281503555037327360,2012-12-19 20:57:32,,3,0,Twitter Web Client,"Thank you @RepCleaver for your service, friendship &amp; leadership. I look fwd to working with you in the years to come http://t.co/XxIrdylz"
281468088304693248,2012-12-19 18:36:37,,5,1,Twitter Web Client,"Listened to @BenAffleck's testimony on the #DRC crisis where 5 million dead, 2 million raped, displaced or brutalized http://t.co/LDtMniym"
281464262461902849,2012-12-19 18:21:24,,12,0,Twitter Web Client,RT @USAID: LIVE Happening Now: @WhiteHouse launch of USG Action Plan on #ChildreninAdversity http://t.co/7cHxJPVX
281091139585589248,2012-12-18 17:38:44,,8,0,Twitter Web Client,Retweet if you saw the president's first inauguration and enter to win tickets to his second! http://t.co/rTa1P5ql #p2
280886426055360512,2012-12-18 04:05:17,,1,0,Twitter Web Client,It's not every day our president is inaugurated--don't miss @BarackObama's last. Enter to win 2 seated tickets http://t.co/1IEcTvRJ #p2
280735785047715840,2012-12-17 18:06:41,,8,2,Twitter Web Client,My heart goes out to the families affected by this tragedy. I look fwd to a debate for sensible gun laws &amp; resources to treat mental illness
280510962845483008,2012-12-17 03:13:20,,7,0,Twitter Web Client,At #YearInReview Town Hall--pesenting a Congressional Record to Supervisor @MRidleyThomas for his many accomplishments http://t.co/YJiCuW2P
280496473009971200,2012-12-17 02:15:45,,3,0,Twitter Web Client,"RT @M_Sahli_Wells: @RepKarenBass Legislative Yr in Review in #CulverCity, introducing InnerCityYouthOrchestraLA http://t.co/3omDrcfI htt ..."
280466008806916096,2012-12-17 00:14:42,,2,0,Twitter Web Client,Wonderful performance by Inner City Youth Orchestra at tonight's town hall. Tks to all who were involved this past yr http://t.co/3cbwg82b
279337175575851009,2012-12-13 21:29:07,,9,1,Twitter Web Client,"I respect @AmbassadorRice's decision. If judged fairly on her qualifications for the job, she would've made an extraordinary Sec. of State."
279318526722973696,2012-12-13 20:15:00,,1,0,Twitter Web Client,RT @CulverCityPatch: @RepKarenBass  announces lottery and essay contest for free Obama inauguration tix. http://t.co/lZYsnEZ4
279299867258535937,2012-12-13 19:00:52,,3,1,Twitter Web Client,Win 2 tickets to the presidential inauguration! Tell me how you’d like to see @BarackObama move the country forward http://t.co/1IEcTvRJ
279223419969601536,2012-12-13 13:57:06,,1,0,Twitter for iPhone,Foster Youth Caucus meeting today. Commissioner Samuels is here providing a update for Caucus members http://t.co/FRGubvgV
278919062745145344,2012-12-12 17:47:41,,0,0,Twitter Web Client,@TylerKathy That's right!
278916048638599169,2012-12-12 17:35:42,,12,0,Twitter Web Client,RT if you agree: House Republicans should #DoTheRightThing &amp; vote to prevent a tax increase on middle-class families #my2k
278915270561640450,2012-12-12 17:32:37,,16,0,Twitter Web Client,RT @RepBecerra: When was the last time members of both parties in Congress agreed on 98% of anything? Let's #DoTheRightThing &amp; pass  ...
278915069402812417,2012-12-12 17:31:49,,23,0,Twitter Web Client,RT @HouseDemocrats: Time for the GOP to get to work and stop holding the middle class hostage to protect the rich. #DoTheRightThing
278914779756773376,2012-12-12 17:30:40,,11,2,Twitter Web Client,Republicans in Congress should #DoTheRightThing: protect middle-class families &amp; small biz from a tax increase. RT if you agree!
278581835175452673,2012-12-11 19:27:40,,0,0,Twitter for iPhone,Receiving an update from @AFAsstSecy Ambassador Carson on the current crisis in the Democratic Republic of Congo http://t.co/47M0R8dN
278238434227793920,2012-12-10 20:43:06,,4,0,Twitter Web Client,House needs to take up Senate bill that will maintain tax breaks for 98% of Americans http://t.co/daW4l1Ck #my2k #p2 #fiscalcliff
278231830577156098,2012-12-10 20:16:52,,5,1,Twitter Web Client,A #FiscalCliff deal possible if GOP loosens Norquist's grip. If he wants to run gov't then he should run for office http://t.co/enSunyqM
278231117008629762,2012-12-10 20:14:02,,1,0,Twitter Web Client,"RT @congressblog: The Hill Deal possible if GOP loosens Norquist's grip: Any good negotiation has three parts. First, each side ma... ht ..."
278218542330040320,2012-12-10 19:24:04,,3,0,Twitter Web Client,Joining @tamronhall on @newsnation shortly to give an update on the negotiations on the fiscal cliff. Hope you can tune in!
278216825643347968,2012-12-10 19:17:15,,26,6,Twitter Web Client,Many constituents stopped by today to share their support for extending tax cuts for middle-class Americans #my2k http://t.co/GwtZSGwY
278149585090777088,2012-12-10 14:50:03,,1,0,Twitter Web Client,On @newsnation w/ @tamronhall at 11:30am PT/2:30pm ET to discuss how Congress will deal with the impending fiscal cliff. Tune in!
276829373682814978,2012-12-06 23:24:00,,3,0,Twitter Web Client,Spoke with local media today about the fiscal cliff and how a deal can be reached if GOP rejects @GroverNorquist #my2k http://t.co/fXLnTm6y
276719705979510785,2012-12-06 16:08:13,,4,1,Twitter Web Client,I signed the discharge petition to bring a vote on tax cuts for 98% of Americans and 97% of small biz: http://t.co/ga48dZkm
276459834277236736,2012-12-05 22:55:35,,4,0,Twitter Web Client,Just spoke w/ @FoxBusiness about the fiscal cliff and the need for Rs to join Ds in extending tax cuts for middle class http://t.co/zCVbQ0HD
276094186221101056,2012-12-04 22:42:38,,16,0,Twitter Web Client,Congrats to @NitaLowey and @MaxineWaters on their appointments to Ranking Member positions. First women to serve in these roles!
276016025101824001,2012-12-04 17:32:03,,387,0,Twitter Web Client,RT @NancyPelosi: House Dems just filed a discharge petition to bring the middle class tax cuts to the floor for a vote. Keep track here: ...
275990030240067584,2012-12-04 15:48:45,,2,0,Twitter Web Client,"In case you missed it, listen to this morning's interview on @SIRIUSXM POTUS Politics: http://t.co/e1UQImFT"
275963808491651072,2012-12-04 14:04:33,,1,0,Twitter Web Client,Tune into @kgoradio http://t.co/JdFneQo9 I'll be on shortly talking about the 'fiscal cliff' negotiations
275742080062603264,2012-12-03 23:23:29,,2,1,Twitter Web Client,BET: A Fiscal Cliff Fall Could Crush African-American Communities http://t.co/qLKcMQ7E
275723290050453504,2012-12-03 22:08:49,,2,0,Twitter Web Client,"Democrats are willing to compromise on the fiscal cliff, but Republicans have to come to the table on revenue http://t.co/4zy8AHMe"
275677967118647296,2012-12-03 19:08:43,,2,0,Twitter for iPhone,29 days is an eternity in politics. There's plenty of time to make a deal. #NewsNation
275677458257289216,2012-12-03 19:06:42,,2,0,Twitter for iPhone,There are ways to find savings in Medicare without breaking the guarantee to the American people #newsnation
275675270642556928,2012-12-03 18:58:01,,0,0,Twitter for iPhone,Getting ready to join @tamronhall on @msnbc in a few minutes. Tune in! http://t.co/p858rup0
