id,created_at,coordinates,retweets,favorite_count,source,text
470014448120233985,2014-05-24 01:32:31,,17,9,Twitter for Websites,From Hardship to Hope @HuffPostBlog http://t.co/txdeLtHVrF via @HuffPostPol #ShadowDay2014 #fosteryouth #FosterCareMonth
469949235996397568,2014-05-23 21:13:23,,34,0,Twitter Web Client,"RT @cierraramirez: Excited to participate in #ShadowDay2014 in DC to create awareness of the challenges, dreams &amp; potential of youth in fos…"
469842372743168000,2014-05-23 14:08:45,,7,2,Twitter Web Client,Outdated #NDAA fails to protect human rights &amp; taxpayer money. Check out my statement about why we need to #StopNDAA: http://t.co/kZBlCnwyc8
468895256948539392,2014-05-20 23:25:15,,11,6,Twitter Web Client,"Congress stood up for victims &amp; came together on key bills to #endtrafficking today, but we must keep up the fight: http://t.co/3E9ikiaQ78"
468870172489814017,2014-05-20 21:45:34,,9,2,Twitter Web Client,Very glad #HR4058 &amp; #HR3610 passed today! This is big step forward in the fight to #stophumantrafficking &amp; help trafficked #fosteryouth
468815038946770944,2014-05-20 18:06:30,,2,0,Twitter Web Client,"Thank you @CaseyPrograms #FosterChat! Always so glad to hear directly from #fosteryouth, families &amp; advocates."
468813048216825856,2014-05-20 17:58:35,,10,7,Twitter Web Client,Join the Foster Youth Caucus &amp; become a citizen co-sponsor of our #NationalFosterCareMonth resolution: http://t.co/s5fJhCToMy #FosterChat
468812873268224000,2014-05-20 17:57:53,,3,1,Twitter Web Client,.@CaseyPrograms Foster Youth Caucus is wearing ribbons to raise awareness of #NationalFosterCareMonth: http://t.co/spqu0ViYfC #FosterChat
468810951857553409,2014-05-20 17:50:15,,1,0,Twitter Web Client,@CaseyPrograms Foster Youth Caucus also shares positive #fosteryouth stories in floor speeches &amp; on http://t.co/GX51RmTehC #FosterChat
468810268605440000,2014-05-20 17:47:32,,6,9,Twitter Web Client,.@CaseyPrograms Foster Youth Caucus is bringing 60+ amazing #fosteryouth for #ShadowDay2014 to share their stories with Congress #FosterChat
468806536262066176,2014-05-20 17:32:42,,5,6,Twitter Web Client,States need flexibility to help foster youth &amp; families succeed MT @CaseyPrograms Q3:What are important issues for #fosteryouth? #FosterChat
468803992093753344,2014-05-20 17:22:36,,13,11,Twitter Web Client,The Foster Youth Caucus bill #HR3205 encourages adoption of older #fosteryouth to prevent youth from aging out without families #FosterChat
468803110392332288,2014-05-20 17:19:06,,2,3,Twitter Web Client,"@CaseyPrograms Thanks to CA Youth Connection, many CA #fosteryouth are benefitting from #AB12 which extended foster care til 21 #FosterChat"
468801937065148417,2014-05-20 17:14:26,,5,3,Twitter Web Client,"A strong family is safe, loving, nurturing &amp; permanent RT @CaseyPrograms Q1: What does “strong family” mean to you? #FosterChat"
468798960573120512,2014-05-20 17:02:36,,1,0,Twitter Web Client,Excited to participate today! RT @CaseyPrograms The #FosterChat Tweet-Up is about to begin!
468749115879219201,2014-05-20 13:44:32,,6,2,Twitter for Websites,Read the latest op-ed that I wrote with @JudgeTedPoe: Both parties agree: Time to end #humantrafficking http://t.co/63LK439Mmg
467058221350273024,2014-05-15 21:45:32,,5,5,Twitter for Websites,Please take a moment to read my op-ed on #fosteryouth in @LosAngelesWave and what we must do to protect our children. http://t.co/x0NDRxlUk2
466376680903548929,2014-05-14 00:37:20,,5,2,Twitter Web Client,ICYMI: Joined @PoliticsNation with @TheRevAl &amp; @MariaTeresa1 to give my take on what must be done to fight #poverty: http://t.co/LHhXUEfIkD
466333168636002304,2014-05-13 21:44:26,,4,0,Twitter Web Client,Joining @PoliticsNation with @TheRevAl &amp; @MariaTeresa1 today at 3 PM PT to debunk GOP frontrunners' latest comments on #poverty
466216011772227584,2014-05-13 13:58:53,,11,2,Twitter Web Client,"@andersoncooper, the way @MagicJohnson handled his HIV diagnosis, educated the public, brought millions out from the shadows, &amp; saved lives."
466021268882325506,2014-05-13 01:05:03,,124,95,Twitter Web Client,"What has @MagicJohnson done for Black people? Let me count the ways, 1000's of jobs, millions of $'s, iconic role model. He is loved."
465675158523768833,2014-05-12 02:09:44,,3,2,Twitter for iPad,Glad to join Elder Pastor Pierson &amp; his congregation at New Greater Hope Baptist's luncheon celebrating parents http://t.co/YdTJRMTS7W
465666924685582336,2014-05-12 01:37:01,,8,4,Twitter Web Client,ICYMI: @conanNBCLA invited me to discuss what the US can do to help #BringBackOurGirls. Watch here: http://t.co/mArE1NiD83
464884204669775872,2014-05-09 21:46:46,,27,14,Twitter Web Client,Today Congress took action to condemn #BokoHaram &amp; we won't stop pushing until we #BringBackOurGirls http://t.co/J2psFOqwIw
464545743580438528,2014-05-08 23:21:50,,6,5,TweetDeck,Proud to join the #FosterYouth Caucus in introducing a House resolution to recognize May as #FosterCareMonth: http://t.co/DNsfgbgxsy
464514747527069697,2014-05-08 21:18:40,,10,5,Twitter Web Client,ICYMI: Discussed what the intl community is doing to #BringBackOurGirls &amp; fight #BokoHaram with @TheReidReport: http://t.co/idhG4r6uSh
464501018605391872,2014-05-08 20:24:07,,4,7,Twitter Web Client,BREAKING: #ElectrifyAfrica passes the House! Proud to work with @RepEdRoyce @RepEliotEngel @RepChrisSmith &amp; @ONECampaign on this vital bill
464460752737538048,2014-05-08 17:44:07,,9,6,Twitter Web Client,Joined @RepWilson @RepEliotEngel @RepChrisSmith on HRes 573 to condemn #BokoHaram &amp; urge action to #BringBackOurGirls http://t.co/EtTPv9PJe6
464446082433708032,2014-05-08 16:45:49,,4,2,Twitter Web Client,Tune in to @msnbc's @TheReidReport at 2pm ET to hear me chat with @JoyAnnReid about the latest efforts to #BringBackOurGirls
464229908529831937,2014-05-08 02:26:49,,7,4,Twitter Web Client,ICYMI: Joined @AriseTV to discuss the global social media outcry to #BringBackOurGirls &amp; what the US can do to help: http://t.co/DfcK6FXxY7
464225192450203648,2014-05-08 02:08:05,,26,14,Twitter Web Client,"Proud to support the bipartisan #ElectrifyAfrica Act, a bill to expand electricity access &amp; save lives. Watch here: http://t.co/Ans5MmXYhp"
464169397268250626,2014-05-07 22:26:22,,79640,0,Twitter Web Client,RT @FLOTUS: Our prayers are with the missing Nigerian girls and their families. It's time to #BringBackOurGirls. -mo http://t.co/glDKDotJRt
464145847090159617,2014-05-07 20:52:48,,3,2,Twitter Web Client,Thanks @Marystrawberry @rescueourgirls for bringing attention to the missing Nigerian girls with #BringBackOurGirls http://t.co/vAT5ZYk8qC
464119740131475456,2014-05-07 19:09:03,,4,8,Twitter Web Client,Grateful for @DidiHirsch @VistaDelMarOrg @SouthCoastPsych &amp; #WestAngelesChurch's efforts to improve LA #mentalhealth http://t.co/XL6YkTlRiW
464100033257029632,2014-05-07 17:50:45,,25,5,Twitter Web Client,.@RepMarciaFudge @RepBarbaraLee @Rep_JaniceHahn @JacksonLeeTX18 &amp; I met w Nigerian embassy to help #bringbackourgirls http://t.co/vJA1MkSB0T
463694966028767233,2014-05-06 15:01:09,,4,1,Twitter Web Client,ICYMI: Just joined @JansingCo to give my take on what should be done to #BringBackOurGirls in Nigeria: http://t.co/8Wi3o8ryuE
463673226263277568,2014-05-06 13:34:46,,6,1,Twitter Web Client,Joining @JansingCo in 30 minutes to discuss Benghazi &amp; the latest efforts to #BringBackOurGirls. Hope you can tune in!
463313953066450944,2014-05-05 13:47:09,,5,4,Twitter for Websites,"#Obamacare is working. According to Gallup, the number of uninsured is lowest since it began polling in '08. via @tnr http://t.co/YYzGXOiV6W"
462941605855784960,2014-05-04 13:07:34,,16,6,Twitter Web Client,"Don't miss @JohnKerry's op-ed in @washingtonpost ""Africa is on the rise, and we need to help make sure it continues"" http://t.co/sgFb0KTfv8"
462327419878506497,2014-05-02 20:27:01,,27,13,Twitter Web Client,Children's rights are human rights. My heart goes out to the kidnapped girls &amp; their families. #BringBackOurGirls http://t.co/OJvdhyUjDX
462264649560625152,2014-05-02 16:17:35,,4,2,Twitter Web Client,1 in 8 ppl will go to bed hungry tonight. @WFPUSA &amp; @LBLUS work to change that &amp; help ppl #Belowtheline. Learn more: http://t.co/vxR8cCj9G5
462033022439919616,2014-05-02 00:57:11,,3,2,Twitter for Android,ICYMI: Joined @Crossfire with @VanJones68 &amp; @newtgingrich to discuss #Ukraine &amp; #POTUS foreign policy. Watch: http://t.co/owXglz7GwP
461993878577770496,2014-05-01 22:21:38,,4,2,Twitter Web Client,Joining @Crossfire in 10 mins to discuss #Ukraine &amp; why we need to #raisethewage with @newtgingrich @VanJones68 &amp; @SenRonJohnson. #Crossfire
461880314886119424,2014-05-01 14:50:23,,1,2,Twitter Web Client,Happening now: Africa Subcommittee #CARcrisis hearing featuring guests from the @StateDept. Watch live here: http://t.co/GzUQffWoPt
461642170848784384,2014-04-30 23:04:05,,1,2,Twitter Web Client,ICYMI: @OfficialCBC &amp; I met with @RepPaulRyan today to discuss #poverty. Hear my thoughts on the meeting here: http://t.co/iH0TNbL9qx.
461508831714222080,2014-04-30 14:14:14,,5,2,Twitter Web Client,Joining House Judiciary to markup 3 bills to combat #humantrafficking &amp; protect victims. Watch live here: http://t.co/wxlW9OMmzG
461259025947320321,2014-04-29 21:41:36,,19,25,Twitter Web Client,Commissioner Silver took a strong stand against racism today. Very glad to hear Donald Sterling is #bannedforlife: http://t.co/NqQS8IaDB2
461158109533450240,2014-04-29 15:00:35,,4,2,Twitter Web Client,Enjoyed meeting with the LA chapter of @ADL_national about protecting #votingrights. Thanks for your work on this critical issue! #VRAnow
460979694662189056,2014-04-29 03:11:38,,5,2,TweetDeck,High school art competition ends TOMORROW! Don't miss this chance to have your art seen by thousands in DC. Apply: https://t.co/0tcmXHHZRz
460964343245328385,2014-04-29 02:10:38,,10,1,TweetDeck,Did you know: the #highschool artist who wins our #Art Competition gets a free roundtrip flight to DC? Apply today: https://t.co/0tcmXHHZRz
460948736676749312,2014-04-29 01:08:37,,6,4,Twitter Web Client,Make sure to encourage #highschool artists in your life to apply for the Congressional #Art Competition today! https://t.co/0tcmXHHZRz
460444236165697536,2014-04-27 15:43:55,,13,4,Twitter Web Client,ICYMI: Joined @CapehartJ on @MHPshow to discuss #poverty &amp; Rep. Ryan's upcoming meeting with @OfficialCBC. Watch: http://t.co/cz0Bbh1WdY.
460410682861580288,2014-04-27 13:30:35,,2,4,TweetDeck,Looking forward to talking about problems with the #RyanBudget with @CapehartJ as he hosts the @MHPshow on @msnbc today at 10AM ET #nerdland
460123784972738560,2014-04-26 18:30:33,,7,3,TweetDeck,Will be joining @earlhutchinson on @KPFK today at noon to discuss how South LA can successfully be designated as a #PromiseZone
459752730853003267,2014-04-25 17:56:07,,7,6,Twitter Web Client,Glad to have advocates @ywca_gla @NCYL_CSEC  @LACProbation @Brantley_SPEAKS in the fight against CA #trafficking http://t.co/cL33Mk2Fed
459408465165701120,2014-04-24 19:08:08,,1,1,Twitter for Websites,Congress Needs to Reauthorize the Export-Import Bank Without Delay  http://t.co/lwpjyvzTo9
459353369774411776,2014-04-24 15:29:12,,7,5,Twitter Web Client,Congrats T for being named to #TIME100! You're a great voice for #fosteryouth &amp; #childtrafficking victims everywhere http://t.co/DlgRTrHJrO
459074348247031808,2014-04-23 21:00:28,,2,0,TweetDeck,Will be joining @TheRevAl on @PoliticsNation at 6PM ET to discuss how Democrats are working for #economicfairness for all Americans.
458726006774198272,2014-04-22 21:56:17,,3,4,Twitter Web Client,"Happy Earth Day everyone! What do you do to appreciate &amp; protect our air, water &amp; open space? #EarthDay2014 http://t.co/BRbegwvd7Q"
457158251876868097,2014-04-18 14:06:35,,0,1,Twitter for BlackBerry®,@TeamWilshere trying
456601802884915201,2014-04-17 01:15:27,,52,29,Twitter for Websites,Gallup finds because of #Obamacare 12 million previously uninsured Americans have gained health insurance http://t.co/P0eeiBsXf8
454306996343570432,2014-04-10 17:16:43,,136,0,Twitter Web Client,RT @WhiteHouse: Happening now: President Obama speaks on the 50th anniversary of the Civil Rights Act. Watch → http://t.co/U1xJW8x6ka
454290334730948608,2014-04-10 16:10:30,,45,13,Twitter Web Client,"Today, I voted against the Republican #RyanBudget proposal because it will hurt working families. http://t.co/jMkEvTdHHY"
453851595948949504,2014-04-09 11:07:07,,5,5,Camera on iOS,Troops from several African nations in CAR to prevent genocide-lesson from Rwanda http://t.co/uobIySm52D
453846310337388544,2014-04-09 10:46:07,,2,2,Twitter for iPhone,Christians and Muslims in CAR had always lived together in peace
453845935463100416,2014-04-09 10:44:37,,2,0,Twitter for iPhone,A year ago a coup in the Central African Republic lead to violence between Christians and Muslims--
453813559328530433,2014-04-09 08:35:58,,2,3,Camera on iOS,Arriving in CAR refugee camp next to the airport http://t.co/ZbGwgAWMIP
453774193365385216,2014-04-09 05:59:33,,5,3,Camera on iOS,These planes are massive http://t.co/jD57fiO9Rx
453773747896729600,2014-04-09 05:57:46,,2,1,Camera on iOS,Boarding the plane http://t.co/TwRywVjR1P
453773608285114368,2014-04-09 05:57:13,,4,5,Camera on iOS,On the way to the Central African Republic have to tra el in a C130 plane due to ongoing conflict http://t.co/bVyXL2MXAm
453654407343636481,2014-04-08 22:03:33,,1,1,Twitter Web Client,Many congrats to @CASTLA for the Presidential Award for Extraordinary Efforts to Combat Trafficking in Persons: http://t.co/ahWB2DOGeY
453561733513101312,2014-04-08 15:55:18,,4,1,Twitter for Websites,"This just is not right. California women make 84 cents for every $1 men do, report says http://t.co/IPOencR7pn"
453197204115972096,2014-04-07 15:46:48,,1,2,Camera on iOS,Street scene in Rwanda http://t.co/14XDxcOnBf
453191955846295552,2014-04-07 15:25:56,,2,1,Camera on iOS,Contingent of young people preparing to walk#neverforget http://t.co/1Tdp0yRAkC
453190302397120512,2014-04-07 15:19:22,,4,1,Camera on iOS,Correction thousands here to remember #Neverforget http://t.co/34MEZgirRq
453189744797949953,2014-04-07 15:17:09,,5,3,Camera on iOS,Preparing to go on the Walk to Remember the genocide hundreds here from around the world #Neverforget http://t.co/0k3FTDsOo1
453181077755281408,2014-04-07 14:42:43,,6,4,Twitter Web Client,The next generation is being taught the history at @mcwglobal #Rwanda so it won't be repeated http://t.co/6cMti2WhLp #NeverForget #Kwibuka20
453180153225830400,2014-04-07 14:39:02,,7,1,Twitter Web Client,10k were killed here. Their clothes were preserved and left in the church pews http://t.co/kGiHzAO5yg #NeverForget #Kwibuka20
453179905589919744,2014-04-07 14:38:03,,15,3,Twitter Web Client,1000s of Rwandans told they would be safe at Nyamata church only to be trapped &amp; slaughtered http://t.co/cIPpxgIUzx #NeverForget #Kwibuka20
453176913276985345,2014-04-07 14:26:10,,5,4,Twitter for iPhone,The next generation is being taught the history so it won't be repeated http://t.co/6cMti2WhLp
453176734213750784,2014-04-07 14:25:27,,7,2,Twitter for iPhone,The sadness is overwhelming close to 1 million killed in 100 days http://t.co/QQ83YYeCQt
453176705277231104,2014-04-07 14:25:20,,5,2,Twitter for iPhone,10k were killed here their clothes were preserved and left in the church pews http://t.co/kGiHzAO5yg
453170865648443392,2014-04-07 14:02:08,,8,0,Twitter for iPhone,Thousands of Rwandans were told they would be safe at this church only to be trapped and slaughtered http://t.co/cIPpxgIUzx
453149251988914176,2014-04-07 12:36:15,,1,0,Twitter for iPhone,Leaving the memorial service at the stadium in Kigali
451863980055986176,2014-04-03 23:29:02,,3,6,Twitter Web Client,ICYMI: Joined @TheRevAl &amp; @KrystalBall to discuss how the #GOPbudget would destroy the social safety net. Watch here: http://t.co/0VCBKLddrf
451837276172324864,2014-04-03 21:42:56,,8,3,Twitter Web Client,"In 20 mins, I’ll be joining  @PoliticsNation with @TheRevAl to discuss how the #GOPBudget would be a major setback for struggling Americans"
451479284243124224,2014-04-02 22:00:24,,3,0,TweetDeck,"In 30 mins, I’ll be joining @JimmysPolitics on @PoliticsNation with @TheRevAl to discuss the success of #Obamacare #7millionandcounting"
451445661389840384,2014-04-02 19:46:47,,9,9,Twitter Web Client,"This World Autism Awareness Day, let us offer our support &amp; respect to all those on the autism spectrum &amp; the families who love them."
450742625751281664,2014-03-31 21:13:11,,1,1,Twitter Web Client,ICYMI: Joined @mitchellreports to discuss today's #Obamacare deadline &amp; the many benefits of the #ACA. Watch here: http://t.co/xW1n6fyRum
450656264297930752,2014-03-31 15:30:00,,3,1,Twitter Web Client,Joining @mitchellreports on @msnbc in 30 mins to discuss today’s #ACA deadline &amp; why the uninsured should #GetCoveredNow
450322607569915904,2014-03-30 17:24:10,,3,0,Twitter Web Client,Tomorrow is the @CoveredCA sign up deadline. Joined community orgs to help Angelenos #GetCoveredNow: http://t.co/c8D1erA0Q0 #HealthySouthLA
450052609315844096,2014-03-29 23:31:18,,5,0,Twitter for BlackBerry®,RT @Rep_JaniceHahn: .@RepKarenBass and I are urging #CCA to properly compensate their former employees who are owed months of backpay. http…
449276023901679616,2014-03-27 20:05:25,,8,8,Twitter for Websites,"More than 6 million Americans now have health insurance thanks to #ObamaCare. Congress should implement, not repeal. http://t.co/x6OKtLv7MN"
448955711083806720,2014-03-26 22:52:37,,1,2,Twitter Web Client,@YALNetwork participants at tomorrow's Africa Policy Breakfast represent 21 countries. What questions do you have for them? #YALI #YALN
448912598034292736,2014-03-26 20:01:18,,4,2,Twitter Web Client,Do you have questions about #YALI? Ask &amp; we'll get answers at tomorrow's Africa Policy Breakfast feat. @YALNetwork! http://t.co/HXzniF26hD
448840150031028224,2014-03-26 15:13:25,,10,8,Twitter Web Client,I kills me to hear them called Johns and customers. They are child molesters. And calling them Johns humanizes them. #sextrafficking
448823485704732672,2014-03-26 14:07:12,,7,4,Twitter Web Client,"Bought &amp; sold children are the victims of crime, yet many jurisdictions treat victims of #sextrafficking as offenders http://t.co/JPT2sLP9A9"
448822879640387585,2014-03-26 14:04:47,,7,2,Twitter Web Client,"#Childsextrafficking victims live in our communities, but most people are completely unaware: http://t.co/ybAzmn0p38"
448822333290328064,2014-03-26 14:02:37,,2,1,Twitter Web Client,"Over 290,000 youth are at risk of becoming victims of #childsextrafficking. Watch live:  http://t.co/JPT2sLP9A9"
448821834382077952,2014-03-26 14:00:38,,6,2,Twitter Web Client,Watch the Judiciary Subcommittee on Crime hearing “Innocence for Sale: Domestic Minor #SexTrafficking” live: http://t.co/JPT2sLP9A9
448534787465441281,2014-03-25 19:00:01,,5,2,Twitter Web Client,Will you join the convo to raise African American men’s health insurance enrollment rate? Health is too important to risk #BlackMenEnroll
448232838173691904,2014-03-24 23:00:11,,9,3,TweetDeck,ICYMI: Joined @TheRevAl &amp; @KrystalBall to discuss why we need to come together to make sure Americans #getcoverednow http://t.co/GS6UEvu5m8
448203502566002690,2014-03-24 21:03:36,,19,5,Twitter Web Client,Tune into @msnbc at 6 PM ET 3 PM PT. I will join @TheRevAl  on @PoliticsNation to discuss the March 31 deadline to sign up for #Obamacare
447534181414092802,2014-03-23 00:43:58,,6,0,Twitter Web Client,I am deeply concerned the Ebola virus has killed dozens of people in Guinea and has spread to Sierra Leone. http://t.co/x4Hc8yPqnU
447174274311155712,2014-03-22 00:53:49,,4,2,Twitter Web Client,Welcoming @SecretaryFoxx to LA as we discuss bringing vital transportation to the region and creating jobs. http://t.co/22utH4ipA8
447120020640784384,2014-03-21 21:18:14,,1,0,Twitter for Websites,@usedgov study concludes Black students are more likely to be suspended and less likely to have access to AP classes. http://t.co/k0VtSqqHFK
446746755095605248,2014-03-20 20:35:01,,5,3,Twitter Web Client,Thank you @rgaut999 @LATimes for telling the stories of brave &amp; resilient LA #fosteryouth aging out of care http://t.co/FAtKr88J8A
445994164485115906,2014-03-18 18:44:29,,0,0,Twitter Web Client,@CoveredCA reaches 1 million people who have enrolled. March 31 is the final day for open enrollment. http://t.co/6eeoNiy4iC
445664016267214849,2014-03-17 20:52:36,,15,5,Twitter Web Client,"5 Million Americans now have health insurance because of #Obamacare marketplace, via @hhsgov http://t.co/knYADPHBQe"
445252199099035648,2014-03-16 17:36:11,,3,5,Twitter for Websites,"I do not agree with my GOP colleagues much, but together are are committed to reforming our criminal justice system. http://t.co/AOqK17cslD"
444961371302539265,2014-03-15 22:20:32,,14,8,Twitter for BlackBerry®,"If you have done your time, you deserve to be re-incorporated into society without roadblocks that send you back to prison."
444959089831845888,2014-03-15 22:11:28,,3,1,Twitter for BlackBerry®,"Sen @HollyJMitchell, let's make sure our training programs provided by Dept. Of Corrections are both relevant and timely. Absolutely!"
444954789009297408,2014-03-15 21:54:23,,4,1,Twitter for BlackBerry®,Thank you to Asm @JonesSawyer and Sen @HollyJMitchell for joining to discuss reforming our criminal justice system. http://t.co/jGLpMxMGwD
444954136308498432,2014-03-15 21:51:47,,3,1,Twitter for BlackBerry®,"Asm. @jonessawyer, if we continue to incarcerate we will go bankrupt."
444953154170273792,2014-03-15 21:47:53,,10,6,Twitter for BlackBerry®,"Every dollar we spend on drug prevention we save seven on incarceration. Prevention helps people, and it just sense."
444492248433328128,2014-03-14 15:16:24,,3,1,Twitter Web Client,Tune in today to @mitchellreports at 9:20am PT to hear my thoughts on #incomeinequality &amp; @RepPaulRyan’s comments on inner city #poverty
444209139221536768,2014-03-13 20:31:26,,9,4,Twitter Web Client,"This Sat, join @HollyJMitchell, @JonesSawyer &amp; I at ""Welcome Home: A Community Discussion on Re-Entry Services"". RSVP http://t.co/Ds4id8gezF"
443808860847886336,2014-03-12 18:00:52,,19,9,TweetDeck,"Extending UI is critical for families, essential for workers, &amp; good for our economy. Time to #RenewUI for #2million Americans in need."
443468326338326528,2014-03-11 19:27:42,,1,0,TweetDeck,I will join @TheRevAl &amp; @mcottle on @msnbc tonight at 6 PM ET to discuss the latest false #Obamacare attacks. Let's #GetCovered America!
443464263525761024,2014-03-11 19:11:34,,1,1,Twitter Web Client,Great to see #LA represent in the Capitol today! Enjoyed discussing city priorities with Councilmembers @CurrenDPriceJr &amp; @martinez_nury.
443125137232396289,2014-03-10 20:44:00,,7,7,Twitter Web Client,"LA is in the House! Enjoyed meeting today with Councilmembers @MitchOFarrell, @Mitch_Englander and @JoeBuscaino. Working for Angelenos."
443021838185398272,2014-03-10 13:53:31,,7,3,Twitter Web Client,"Headlines speak for themselves: Uninsured Rate Drops, Thanks To Obamacare http://t.co/SMmXt8oqph"
442660194674155520,2014-03-09 13:56:29,,11,4,Twitter for BlackBerry®,Democrats are fighting poverty by increasing minimum wage and extending unemployment insurance. Where is the GOP? #meetthepress
442659276096434176,2014-03-09 13:52:50,,7,5,Twitter for BlackBerry®,Neither the progressive nor conservative movement will succeed unless they reflect the diversity of America. #meetthepress
442653798784196608,2014-03-09 13:31:04,,6,5,Twitter for BlackBerry®,Listening to Cardinal Dolan on #meetthepress. I admire Pope Francis' focus on income inequality. We all have an obligation to end poverty.
442651084998197248,2014-03-09 13:20:17,,4,1,Twitter for BlackBerry®,"Following US sanctions against Russia, Russian stock market dropped and dollar rose to all time high against rouble. #meetthepress"
442644507704569857,2014-03-09 12:54:09,,8,5,Twitter for BlackBerry®,Getting mic'ed up for my #meetthepress appearance. Be tune in this morning on NBC. http://t.co/AhPZgbDRUO
442642787997986816,2014-03-09 12:47:19,,4,4,Twitter for BlackBerry®,"In the green room at #meetthepress. Tune in for the discussion of Ukraine, Obamacare, and other critical issues facing the US and the world."
442005503892131840,2014-03-07 18:34:58,,5,1,Twitter for Websites,Following  #Obamacare U.S. employers experiencing smallest increases in healthcare costs in 15 years @TowersWatson http://t.co/bP5ZSAUy6l
441689840716103681,2014-03-06 21:40:38,,8,4,Twitter Web Client,Glad to talk to @southlareport about the President’s budget &amp; why South LA would be a great #PromiseZone: http://t.co/9bvaUzQkWt
441574908821536768,2014-03-06 14:03:56,,2,1,Twitter Web Client,Attending today's House Foreign Affairs hearing on U.S. foreign policy toward #Ukraine. Watch live: http://t.co/o0t0Ooomqu.
441323569490849792,2014-03-05 21:25:13,,4,1,Twitter Web Client,Great work at @CalEndow supporting men of color by actively supporting POTUS's #brotherskeeper  http://t.co/XJ22NJRQGS via @blackvoicenews
440355328157167617,2014-03-03 05:17:46,,60,42,Twitter Web Client,Congratulations 12 Years a Slave! It may take Hollywood to get us to acknowledge what America has denied for over 200 years. #TheOscars2014
439157841652236288,2014-02-27 21:59:23,,9,1,Twitter Web Client,It's about people. @YG_Chicago #BAM student Christian introduced President Obama &amp; hugged him afterwards http://t.co/K9t6gHVbj4
439149336543641600,2014-02-27 21:25:35,,4,6,Twitter Web Client,Looking forward to working with #POTUS to address how to help boys of color who are #fosteryouth #MyBrothersKeeper http://t.co/qrmE52M5aF
