id,created_at,coordinates,retweets,favorite_count,source,text
819983821416333312,2017-01-13 19:05:52,,4,15,TweetDeck,"Today I re-introduced the #WATERAct, a bill that makes water more affordable for farmers, ranchers, and anyone who lives in rural #Colorado"
819975578442985472,2017-01-13 18:33:06,,0,4,TweetDeck,I'm praying for the family and Rep. Cumming's office as they cope with this loss
819975509534765056,2017-01-13 18:32:50,,1,7,TweetDeck,My heart goes out to the office of Rep. Elijah Cummings after the tragedy suffered by one of his staff members due to a house fire this week
818857435716841472,2017-01-10 16:30:00,,4,5,TweetDeck,"The Iran Deal has always been a mess, but now Iran is actually being rewarded for breaking terms of the agreement! https://t.co/O77fqNK8b3"
818644257602990084,2017-01-10 02:22:55,,14,0,Twitter for iPhone,RT @TeamCavuto: .@RepKenBuck on the GOP's plan to repeal and replace Obamacare  on @FoxBusiness. https://t.co/3JCX9qmwUn
818590799466233857,2017-01-09 22:50:29,,2,15,TweetDeck,"For Law Enforcement Appreciation Day, I put blue candles in my windowsill to send a message to officers: ""We stand… https://t.co/EdvvlsqiGY"
817484826689368065,2017-01-06 21:35:45,,3,11,TweetDeck,I sent a letter to Gov. Hickenlooper asking him to illuminate the Capitol in blue in honor of law enforcement: https://t.co/YrSAo3jdP3
817170822670348288,2017-01-06 00:48:01,,21,36,TweetDeck,"Proudly voted for the #REINSAct tonight, allowing Congress to weigh in on executive branch rules costing the economy more than $100 million."
817006581191757824,2017-01-05 13:55:22,,12,22,TweetDeck,I urge President Obama not to place bureaucrats in control of millions of acres of America's heartland. https://t.co/I3Rz0dN853!
816421130340880384,2017-01-03 23:09:00,,1,24,TweetDeck,I voted against the proposed changes to the Office of Congressional Ethics: https://t.co/6bqXfA4Vng
816373639591424001,2017-01-03 20:00:17,,2,7,TweetDeck,Congratulations @SpeakerRyan on being reelected as Speaker of the House.
816373074643841024,2017-01-03 19:58:03,,113,0,TweetDeck,RT @SpeakerRyan: I want to say to the American people: We hear you. We will do right by you. And we will deliver.
816108333505646592,2017-01-03 02:26:03,,5,16,Twitter for iPhone,Honored to be joining the Rules Committee in the 115th Congress.
816100728251056128,2017-01-03 01:55:50,,17,0,Twitter for iPhone,RT @RulesReps: Chairman @PeteSessions welcomes @RepKenBuck and @Liz_Cheney to the Rules Committe. Read more here --&gt; https://t.co/lZ7UL2U5uA
815649660194820096,2017-01-01 20:03:27,,1,7,Twitter for iPhone,"I'm excited for another year to serve Coloradans in Washington, DC. We have a lot of work to do! #2017"
813051683966107649,2016-12-25 16:00:01,,3,14,TweetDeck,"Today we celebrate the many ways God has blessed us: family, friends, freedom, and a Savior who was born on this da… https://t.co/4IJA4z3p5c"
810997033834311680,2016-12-19 23:55:35,,1,7,Twitter for iPhone,I'm saddened by the news out of Berlin and praying for all those affected.
810855208024678400,2016-12-19 14:32:01,,1,4,TweetDeck,I've moved offices! https://t.co/mjIfkJsQ0n
809779872037937152,2016-12-16 15:19:01,,0,2,TweetDeck,Hwy 34 is vital to N. Colorado's economy. I'm thankful the federal gov't will contribute to flood repair efforts. https://t.co/wlt85PHzNW
807276186292387843,2016-12-09 17:30:15,,0,3,TweetDeck,Voted for #WRDA to update our inland waterways and ports. We can grow as many crops as we want but we need a way to get them to market.
807230554152255488,2016-12-09 14:28:56,,2,0,TweetDeck,"RT @nate_nmiller: .@RepKenBuck cast a vote today he says will improve the country's ports, waterways and water storage. #copolitics  https:…"
806514702104797192,2016-12-07 15:04:23,,3,8,TweetDeck,"Today we remember #PearlHarbor, that we may have the same resolve today as our countrymen and women did after that… https://t.co/7T6oCItDaY"
806236572597227520,2016-12-06 20:39:12,,1,5,TweetDeck,Looking forward to seeing #HR4352 pass the House today. Vets deserve the best care available. #FasterCareforVetsAct
806139888093560832,2016-12-06 14:15:01,,1,3,TweetDeck,.@realDonaldTrump could teach Europe a thing or two. https://t.co/gllganhJ9F
806139256053911552,2016-12-06 14:12:30,,3,6,TweetDeck,.@realDonaldTrump What Pres. Juncker said was unacceptable. Europe doesn’t work. America will with #PEOTUS Trump. https://t.co/gllganhJ9F
805932770702671872,2016-12-06 00:32:00,,2,4,TweetDeck,"For a district like ours, soil health matters. We need to take care of our soil so that our farmers can continue to grow. #WorldSoilDay"
805878566164504576,2016-12-05 20:56:37,,3,6,TweetDeck,EU Commission President Juncker said #PEOTUS will need to be taught about Europe. Here's my response: https://t.co/gllganhJ9F
802585310039158788,2016-11-26 18:50:23,,4,8,TweetDeck,"Supporting small business is important, today and every day. #SmallBusinessSaturday https://t.co/Cav3nM4kob"
801885880277434368,2016-11-24 20:31:06,,3,6,Twitter for iPhone,"If you need something to do between turkey and football, here are my thoughts on #thanksgiving: https://t.co/BOm6r2xQ4V"
801885353363783680,2016-11-24 20:29:01,,2,8,Twitter for iPhone,"Today I'm thankful for so much, including my family, my country, and my faith. #thanksgiving"
801058874652397569,2016-11-22 13:44:53,,9,13,Twitter for iPhone,We need to send a message to the nation that it's not OK to harm a police officer. #BlueLivesMatterAct https://t.co/axlDOfJJAI
800538259373879296,2016-11-21 03:16:08,,12,30,Twitter for iPhone,Hard day for the law enforcement community. Will be keeping them in my prayers. https://t.co/l2J69yFuAt
799263786544861185,2016-11-17 14:51:50,,2,13,TweetDeck,Thank you to those individuals who have committed their lives to serving the health needs of rural Coloradans. #NationalRuralHealthDay
797197341874913281,2016-11-11 22:00:32,,6,0,Twitter for iPhone,"RT @BrandonRittiman: Read more here: https://t.co/CdG2A2YdD5
Shot last year w/ @Thru9sViewfindr. Thx also to @RepKenBuck for telling us abo…"
797184342703407105,2016-11-11 21:08:52,,3,10,Twitter for iPhone,Thank you to all those who have served our country in the armed forces and all those who are currently serving #VeteransDay
796379990753480705,2016-11-09 15:52:40,,17,32,TweetDeck,"I'm eager to work with President-elect Trump on policies that will limit the reach of gov't, create job growth, and protect our nation"
795697500598439936,2016-11-07 18:40:42,,4,8,TweetDeck,Visited several small businesses in Sterling on Friday. In Washington I'm focused on limiting red tape so… https://t.co/HcrpiqzKr5
793818789234282496,2016-11-02 14:15:22,,7,9,TweetDeck,We need to send a message that violence against police is unacceptable in America. #BlueLivesMatterAct #DesMoines
793818626247778304,2016-11-02 14:14:43,,6,14,TweetDeck,"Praying for the law enforcement officers and the people of Des Moines and Urbandale. 
https://t.co/KfFYVdyubr"
793190124435759104,2016-10-31 20:37:17,,4,4,TweetDeck,"I signed on to a letter urging the administration to make sure China plays fair on agriculture biotechnology trade.
https://t.co/NkBaqf9pdi"
793163972975464448,2016-10-31 18:53:22,,0,0,TweetDeck,"The #CongressionalAppChallenge deadline is this Wednesday. Good luck coding!
https://t.co/dLD0H8z4y8"
792075874367569920,2016-10-28 18:49:39,,15,21,TweetDeck,Former Secretary of State Clinton put our national security at risk with her private email set-up. https://t.co/z2ycHfk8Xh
792026568071733248,2016-10-28 15:33:43,,14,37,Twitter Web Client,House Republicans have a better way to do taxes. Watch this video to learn more: https://t.co/RNr1cwoBwf
791661071794864129,2016-10-27 15:21:22,,2,6,TweetDeck,Visited Rice’s Honey in Greeley to discuss issues faced by #SmallBusinesses in our state. https://t.co/bZibjlydN2
790967553740959745,2016-10-25 17:25:34,,10,12,TweetDeck,"Obamacare is a national disaster. It must be replaced to provide affordable healthcare to the citizens of our state.
https://t.co/kYGcQSlTS5"
790652991388913664,2016-10-24 20:35:37,,2,6,TweetDeck,Thanks to Mr. Shaeffer and Mr. Fulton at Northridge HS for the chance to speak with their social studies classes ab… https://t.co/et2pdrGMrt
788852168576995328,2016-10-19 21:19:47,,0,8,Twitter for iPhone,Had a chance to sit down this morning with business owners in Douglas County to discuss the issues impacting them. https://t.co/xIZ6XHfyzH
788517963221446656,2016-10-18 23:11:47,,0,4,TweetDeck,"Do you love coding? Do you have the next great app idea? We’ve got a challenge for you.
https://t.co/giRb47m6KF"
788517907395321856,2016-10-18 23:11:33,,2,7,TweetDeck,Thanks @brad_cooley for sharing about your Congressional App Challenge experience @CongressionalAC https://t.co/giRb47m6KF
788478663671119874,2016-10-18 20:35:37,,1,4,TweetDeck,Do you love coding? Do you have the next great app idea? We’ve got a challenge for you. https://t.co/3Nwy2FjmYz
787341603639746561,2016-10-15 17:17:21,,2,11,Twitter for iPhone,Enjoyed some tetherball after learning how @greeleyschools approach student nutrition. https://t.co/NtHWNdvmuQ
787341456457371649,2016-10-15 17:16:45,,5,9,Twitter for iPhone,"Our kids’ nutrition is vital to their success at school, which is why this is such an important policy issue.… https://t.co/ndpQnB1vdr"
787341236743000064,2016-10-15 17:15:53,,4,5,Twitter for iPhone,Thanks @greeleyschools and @DeirdrePilch for sharing about the District 6 meal program at Bella Romero this week. #NationalSchoolLunchWeek
786408215864971264,2016-10-13 03:28:24,,3,5,Twitter for iPhone,"Thankful the court found that the structure of the CFPB is unconstitutional. 
https://t.co/OAeW4D6Tib"
786353034192363520,2016-10-12 23:49:07,,0,4,TweetDeck,Farmers feed not only our food economy but also our nation’s soul. #NationalFarmersDay
784493752496885760,2016-10-07 20:41:00,,4,10,TweetDeck,"I'm thankful that Det. Brite is making progress in his recovery. Our law enforcement deserve our gratitude &amp; support
https://t.co/1wqcW2HOgo"
784441014975098880,2016-10-07 17:11:26,,3,7,TweetDeck,I’m fighting government overreach so that small businesses can continue contributing to the economy and creating jobs #ManufacturingDay
784440889292754944,2016-10-07 17:10:56,,0,4,TweetDeck,"This week I visited Phoenix Weaponry, one of the many manufacturers in our district. #ManufacturingDay"
781952415532736512,2016-09-30 20:22:38,,9,10,TweetDeck,Thankful for the unborn lives saved by the #HydeAmendment over the past 40 years. https://t.co/A1QGIFw3c6
781530911632490496,2016-09-29 16:27:44,,0,2,TweetDeck,What is PILT? It’s very important. https://t.co/iQjYABEyts
781151720130969600,2016-09-28 15:20:57,,13,16,TweetDeck,"Tune in to the live Judiciary Committee hearing with FBI Director James Comey here: 
https://t.co/L8IORkTPgj"
780914083088531456,2016-09-27 23:36:40,,0,1,TweetDeck,"After a year of extensive repairs, the Capitol Rotunda is final back open and on full display! Request a tour here: https://t.co/snH4GvpQAs"
780816388093018112,2016-09-27 17:08:28,,17,22,TweetDeck,#DOJ represents the people of the United States and should enforce all of the laws on our books. @HouseJudiciary
780816272766431232,2016-09-27 17:08:00,,3,2,TweetDeck,The federal government shouldn’t decide which parts of the law to prosecute and which parts to toss aside. https://t.co/AxtjXoGMdJ
780814732014022658,2016-09-27 17:01:53,,284,0,TweetDeck,RT @HouseJudiciary: .@TGowdySC: DOJ is actually requiring New Orleans police officers to break the law in an effort to further their politi…
779855714789449730,2016-09-25 01:31:06,,9,14,TweetDeck,"Before the government can issue major new regulations, let’s make sure they’re constitutional. #REVIEWAct #HR3438 https://t.co/NXCmU44Ahi"
779394535424131072,2016-09-23 18:58:32,,0,0,TweetDeck,Call my office (202-225-4676) if you're a CD-04 resident interested in White House garden tour tickets for Oct. 8!
779371255212412928,2016-09-23 17:26:01,,3,3,TweetDeck,"Every dollar we give to Iran has the chance to fall into the hands of their terrorist proxies, Hezbollah. #HR5931"
779371143392362497,2016-09-23 17:25:35,,1,2,TweetDeck,America does not negotiate with terrorists. #HR5931
779371095908581376,2016-09-23 17:25:23,,6,8,TweetDeck,Yesterday the House passed a bill to prohibit the Obama administration from paying out any future ransom payments to Iran #HR5931
779013391469973504,2016-09-22 17:44:00,,0,0,TweetDeck,Thankful no Americans were hurt in #ISIS chemical weapons attack. More reason to take this threat seriously. https://t.co/HGVjr8C5fL
778735080009183232,2016-09-21 23:18:05,,0,0,TweetDeck,Looking through the Colorado VA hospital IG report. Here's a list of a few of the most infuriating issues: https://t.co/GDERZkOWdk
778734822818586624,2016-09-21 23:17:04,,1,1,TweetDeck,Time and cost overruns on veterans' hospitals only hurt America's #veterans and taxpayers.
778734567687454721,2016-09-21 23:16:03,,0,1,TweetDeck,We need to make sure we hold the VA accountable. #veterans
778734353035603968,2016-09-21 23:15:12,,0,0,TweetDeck,Just got my copy of the Inspector General's report on the VA hospital project in Denver. #Accountability #ArticleI #veterans
778711699117314050,2016-09-21 21:45:11,,0,1,TweetDeck,"#WATERAct passed Ways and Means Committee today, now on to House floor. #HR4220"
778694327174242305,2016-09-21 20:36:09,,0,5,TweetDeck,.@WaysandMeansGOP thanks for marking up the WATER Act today. We need to keep water prices low for farmers and ranchers. #HR4220
778691546354814976,2016-09-21 20:25:06,,0,1,TweetDeck,#HR4220 allows mutual water storage companies to maintain their non-profit status even if more than 15% of their revenue is from non-members
778691351000920065,2016-09-21 20:24:20,,0,0,TweetDeck,Visit my website for more information on the WATER Act. https://t.co/BWUjTM3E1W
778691222252564480,2016-09-21 20:23:49,,0,0,TweetDeck,Markup on #HR4220 starting right now.
778680275198816256,2016-09-21 19:40:19,,1,2,TweetDeck,"The WATER Act, which I sponsored, lowers the cost of water for farmers, ranchers, and rural communities. #HR4220
https://t.co/BWUjTM3E1W"
778679581901361152,2016-09-21 19:37:34,,0,4,TweetDeck,"I sponsored the WATER Act, #HR4220, which gives farmers and ranchers a greater stake in their water resources."
778679287033372673,2016-09-21 19:36:23,,0,2,TweetDeck,Thankful the WATER Act is back before Ways and Means Committee today for its markup #HR4220 https://t.co/h0ufrvOaxz
778595975518617600,2016-09-21 14:05:20,,43,0,TweetDeck,RT @HouseJudiciary: 🚨 Congress has a duty to serve as a check on corruption &amp; abuse in government. Today we're exercising that power: https…
778594648356978688,2016-09-21 14:00:04,,1,0,TweetDeck,The @HouseJudiciary hearing on impeachment articles for Commissioner John Koskinen can be streamed live here: https://t.co/siab1KJtk6
778370305131704320,2016-09-20 23:08:36,,4,1,TweetDeck,I co-sponsored H.R. 4773 to completely repeal the President’s new #OvertimeRule.
778370207651860480,2016-09-20 23:08:13,,0,2,TweetDeck,I’m encouraged by the legal challenge to the President’s #OvertimeRule and hope the courts rule against this executive overreach. #HR4773
778369953917468672,2016-09-20 23:07:13,,4,4,TweetDeck,The President’s new #OvertimeRule will only force demotions and part-time work instead of promotions and full time work. #HR4773
777954579728203778,2016-09-19 19:36:40,,3,5,Twitter for iPhone,"Thank you to the first responders who bravely answered the call this weekend in Minneapolis, New Jersey, and New York."
777926432915873792,2016-09-19 17:44:49,,4,3,Twitter Web Client,This can’t happen again https://t.co/RLPJRvPW1c
777258855663140865,2016-09-17 21:32:06,,2,12,TweetDeck,#ConstitutionDay gives us a chance to reflect on the rights and freedoms afforded us as Americans https://t.co/MdqMkCvkU9
777258391559245824,2016-09-17 21:30:15,,3,11,TweetDeck,"When I became a Congressman, I took an oath to defend the Constitution. I think about this oath every day, especially today #ConstitutionDay"
777198349397073921,2016-09-17 17:31:40,,3,3,Twitter for iPhone,"Woke up to this news. I'm praying for those impacted by this evil and for Congress to act. #BlueLivesMatterAct
https://t.co/247tnk2xQ9"
776796314076143616,2016-09-16 14:54:08,,5,6,TweetDeck,Today we recognize the sacrifice made by those who have been held as prisoners of war or who are missing in action. https://t.co/joXbkF2uYG
776534863721668608,2016-09-15 21:35:13,,1,2,TweetDeck,We must protect those who protect us. That's why I introduced the Blue Lives Matter Act. https://t.co/iGBx1EbrPp
776502355005153284,2016-09-15 19:26:02,,1,1,TweetDeck,#HR3590 is another important step toward repealing Obamacare!
776502217968873472,2016-09-15 19:25:30,,0,0,TweetDeck,The Halt Tax Increases on the Middle Class and Seniors Act reduces the tax burden imposed by Obamacare on middle class families. #3590
776444608335192066,2016-09-15 15:36:34,,6,14,TweetDeck,"I voted for #HR5351, a bill that sends a strong message to the President: No terrorists will be transferred from Guantanamo to Colorado."
776188930093936642,2016-09-14 22:40:36,,1,4,TweetDeck,"I had the honor to see off a group of America’s veterans taking an Honor Flight back to Washington, D.C. https://t.co/A2cUVEw6hG"
776188825714429952,2016-09-14 22:40:11,,2,3,TweetDeck,"After all the sacrifices made by our vets, it’s time we ensure they receive timely treatment and care! #SupportOurVets #HR5620"
776188731745263617,2016-09-14 22:39:49,,1,3,TweetDeck,Glad H.R. 5620 passed the House. It will hold the VA accountable for proper veteran care. #VAAccountability #HR5620
776144837804494848,2016-09-14 19:45:24,,1,3,Twitter for iPhone,"I sponsored the #WATERAct, which keeps water affordable for farmers, ranchers, and rural communities"
776143617119379456,2016-09-14 19:40:33,,3,4,Twitter for iPhone,Here in Ways and Means Committee room for markup of the WATER Act #HR4220 https://t.co/7oFunkpgMG
776141539684806656,2016-09-14 19:32:17,,0,3,Twitter for iPhone,"Excited to have my bill, #HR4220, marked up by @WaysandMeansGOP today."
775407659658850304,2016-09-12 18:56:07,,1,4,TweetDeck,To block #Zika over Planned Parenthood is to sacrifice our children “on the altar of a hyper-partisan pet project” https://t.co/csZedbgOvU
775399908882911232,2016-09-12 18:25:19,,13,0,TweetDeck,"RT @ColoStatesman: OPINION: @RepKenBuck: Democrats need to set aside partisan bluster, fund fight against… https://t.co/8yx179jgV8 https://…"
775399626140712960,2016-09-12 18:24:11,,3,4,TweetDeck,Democrats would rather fund one Planned Parenthood affiliate in Puerto Rico than save future generations from the #Zika virus.
775399471639306241,2016-09-12 18:23:34,,5,3,TweetDeck,Zika is on the move in our country but Democrats in the House and Senate refuse to act. https://t.co/csZedbypUu
774979494255951872,2016-09-11 14:34:44,,8,20,Twitter for iPhone,Today and every day we remember because we must #NeverForget https://t.co/NOHtQzvvcp
774979266115211264,2016-09-11 14:33:50,,2,2,Twitter for iPhone,Our nation was changed that day--many loved ones lost and many heroes made. #NeverForget
774979169725841409,2016-09-11 14:33:27,,6,8,Twitter for iPhone,"It's been 15 years, but still the surreal images from that September day in 2001 are more painful than ever. #NeverForget"
774348002727235584,2016-09-09 20:45:25,,2,2,TweetDeck,A lot has changed since 1940. Our private capital and equity laws need to as well. #HR5424
774237419256315904,2016-09-09 13:26:00,,4,4,TweetDeck,"It’s National Suicide Prevention Week, a chance for us to raise awareness and support those affected by it. #StopSuicide"
773628619482595328,2016-09-07 21:06:50,,3,5,TweetDeck,"Voted for HR 5063. It's the duty of Congress to decide where funds should be allocated, not the executive branch. https://t.co/XjhSSAC98V"
773301486767910912,2016-09-06 23:26:56,,2,4,Twitter for iPhone,The DOD's activity is unacceptable and unfair to the men and women who serve our country.
773301346824888320,2016-09-06 23:26:22,,1,1,Twitter for iPhone,The President’s Department of Defense is playing politics with our national security. https://t.co/sTS0kDKOkH
772440850970374149,2016-09-04 14:27:04,,4,5,Twitter for iPhone,"Thanks largely to government regulations, Colorado is losing jobs and cost-effective energy solutions. https://t.co/Nm8x4VCqNP"
772110609030717440,2016-09-03 16:34:48,,2,5,Twitter for iPhone,Praying for Detective Brite and his family  https://t.co/oq38YXtvyJ
771452687636398080,2016-09-01 21:00:28,,2,3,TweetDeck,"Proud to co-sponsor the Stop Settlement Slush Funds Act of 2016. 
https://t.co/efoeLsfy8a"
771092896481157121,2016-08-31 21:10:47,,2,1,TweetDeck,Molly from my Greeley office participated in the Alzheimer’s Walk. We must continue to fight to end this disease. https://t.co/px5FUr6040
770988068035825664,2016-08-31 14:14:14,,0,1,TweetDeck,The security of Americans serving abroad is of utmost importance and calls for continued investigation into SoS Clinton's email practices.
770987745091133441,2016-08-31 14:12:57,,1,0,TweetDeck,"If former SoS Clinton failed to disclose 30 Benghazi emails, we can only imagine what else she failed to disclose. https://t.co/gFEShbYi7J"
770680968436912128,2016-08-30 17:53:56,,1,0,TweetDeck,I sponsored H.R. 3765 to allow both Americans with disabilities and small businesses to thrive in our country. https://t.co/xFvXjXvXFK
769189532675735552,2016-08-26 15:07:30,,19,39,Twitter for iPhone,At my Lamar town hall we discussed a #BetterWay to organize healthcare in this country. https://t.co/HYHM7h85IF https://t.co/DkBzmDc2C8
769188256571207681,2016-08-26 15:02:25,,14,30,Twitter for iPhone,"Had a great town hall in Lamar. We discussed a #BetterWay proposed by @SpeakerRyan, from healthcare to job creation. https://t.co/cSv2RFA21s"
767145437039964160,2016-08-20 23:44:59,,17,15,Twitter for iPhone,We need to keep these guys in Guantanamo and not bring them to American soil.  https://t.co/6PR03URbJO
766341580814946305,2016-08-18 18:30:45,,0,0,TweetDeck,I'm holding a town hall in Lamar tomorrow: https://t.co/Zfq7P5cZjU
763426452285059072,2016-08-10 17:27:04,,3,5,TweetDeck,Had a great visit to Salud Family Health Centers where we discussed issues faced by family health clinics. #Sterling https://t.co/pCmsVUy373
763122308710096898,2016-08-09 21:18:31,,0,2,TweetDeck,Thanks to the Longmont Police for responding to and de-escalating this situation: https://t.co/AFIeCsvW1X
763122163528400898,2016-08-09 21:17:56,,2,1,TweetDeck,Here’s my recent op-ed on second amendment rights: https://t.co/8bLSNhRMC2
762749538432016385,2016-08-08 20:37:15,,1,6,TweetDeck,Met Miss Rodeo CO other Miss Rodeo winners to discuss educational opportunity for young women. https://t.co/IxvR8MgdVH
761230927087431680,2016-08-04 16:02:50,,9,6,TweetDeck,"There was a time when America didn’t negotiate with terrorists. 
https://t.co/yYJB9VEhoi"
759404205471703046,2016-07-30 15:04:06,,13,22,TweetDeck,"60 yrs ago today ""in God We Trust"" became our national motto. Faith is an important part of our nation's heritage. https://t.co/7BeuVZN031"
758410214932701184,2016-07-27 21:14:20,,1,2,TweetDeck,"Thanks to the 9,366 people who participated in my telephone town hall last night and shared their thoughts and questions. We covered a lot!"
758324907851780096,2016-07-27 15:35:21,,3,7,TweetDeck,I’m very glad Northern Colorado received these funds from the Dept. of Transportation to expand I-25: https://t.co/XyKKlvsbEK
758027270896381952,2016-07-26 19:52:39,,2,3,TweetDeck,"What are you up to tonight at 7 PM? If you're free, join my telephone town hall! Sign-up here: https://t.co/U5r0q27nKw"
757571761647083520,2016-07-25 13:42:37,,5,5,TweetDeck,I co-sponsored the #HEARDAct to make sure we’re using federal lands effectively.  @RepGosar
757293295429050369,2016-07-24 19:16:06,,6,5,TweetDeck,Let's remember the heroes who have died protecting others and stand by those who continue to protect us today. #BlueLivesMatterAct
757292776513871872,2016-07-24 19:14:02,,7,6,TweetDeck,Special Agent John Gibson &amp; Capitol Police officer Jacob Chestnut were shot and killed at the Capitol 18 years ago https://t.co/2Kwwd3i3jv
755855782130966528,2016-07-20 20:03:56,,2,4,TweetDeck,"My prayers are with the family of my former colleague, Rep. Mark Takai, who lost his battle with cancer today."
755787624028200964,2016-07-20 15:33:06,,6,4,TweetDeck,"I trust Coloradans to steward our land and animals, not bureaucrats in Washington, D.C. #LesserPrairieChicken https://t.co/yPbuvkDem2"
755513545069039616,2016-07-19 21:24:00,,3,2,TweetDeck,A week from today I’ll be holding a telephone town hall to hear from people around the district. Sign up here: https://t.co/U5r0q27nKw
755114715823607808,2016-07-18 18:59:12,,3,4,Twitter Web Client,Think you have a great idea for an app? Today kicks off the 2016 Congressional App Challenge.https://t.co/dLD0H8z4y8 https://t.co/YBQn7S5cL7
754712688253476864,2016-07-17 16:21:41,,13,19,Twitter for iPhone,We need to send a strong message to America: if you target a police officer you will be brought to justice. Let's pass #BlueLivesMatterAct
754712497592995840,2016-07-17 16:20:55,,6,10,Twitter for iPhone,Multiple officers in #BatonRouge have been shot and some have died. Let's pray for the city and the law enforcement community there.
754039941236162560,2016-07-15 19:48:26,,10,13,Twitter Web Client,No one should be forced to participate in an abortion against their beliefs &amp; conscience #ConscienceProtectionAct
754030003629748224,2016-07-15 19:08:56,,3,5,TweetDeck,What does a lack of water mean for a family farmer in Northern Colorado? Check it out: https://t.co/CrMCpf22vE
