id,created_at,coordinates,retweets,favorite_count,source,text
702232048984002561,2016-02-23 20:42:21,,1,1,Twitter for iPhone,"A great pleasure meeting Mrs. Do Alvaro &amp; spending time with her&gt;&gt;&gt;NJ woman, 106, given flag flown over U.S. Capitol https://t.co/h8Qqk20AHn"
702226732577722368,2016-02-23 20:21:14,,0,0,Twitter for iPhone,Congressman combats 'silent killer' in Liberty Corner https://t.co/5K6cJvg6Hi via @Bville_News
701803426670374912,2016-02-22 16:19:10,,5,0,Twitter for Mac,RT @WWFH_NJ: Thanks for your leadership @RepLanceNJ7 on the Rare Disease Caucus #rarediseaseday2016 https://t.co/LmuOKbYUep
700780559015014401,2016-02-19 20:34:39,,2,4,Twitter for iPad,"Paying my respects and bidding farewell to Justice Scalia on a tradition-laden, solemn day at the US Supreme Court. https://t.co/JzVLOyCvUi"
700722439970488320,2016-02-19 16:43:43,,5,4,Twitter for iPad,Justice Scalia lies in repose on the same catafalque used for the body of President Abraham Lincoln in 1865. https://t.co/YdbfZZ5KAt
700719953494855681,2016-02-19 16:33:50,,0,1,Twitter for iPad,"Justice Scalia will rest in repose on Lincoln's catafalque in the grand, columned hall that leads to the courtroom. https://t.co/9MflnAAAZv"
700718470632239108,2016-02-19 16:27:56,,1,1,Twitter for iPad,"His intellect, wisdom and strict defense of our U.S. Constitution will be his lasting legacy. https://t.co/ecYMuYvDhZ"
700718088346423297,2016-02-19 16:26:25,,2,7,Twitter for iPad,I am in Washington today to pay my respects and honor the late Justice Scalia. https://t.co/At7RYJb3cV
699691873531752449,2016-02-16 20:28:36,,1,3,Twitter Web Client,"Lance sponsors bill to enhance, expand community mental health services https://t.co/VMWrHXXBEO"
698204186912153605,2016-02-12 17:57:04,,1,1,Twitter Web Client,Was proud to have worked with municipal &amp; county officials in 2010 to address this tremendous public safety concern. https://t.co/JXcoNHPB0A
698167578485780480,2016-02-12 15:31:36,,1,3,Twitter for Mac,Was proud to have worked with municipal &amp; county officials in 2010 to address this tremendous public safety concern. https://t.co/uzDLd9EGZU
697904553904234497,2016-02-11 22:06:26,,6,6,Twitter Web Client,"Proud of our first responders from Hillsborough, Manville, Raritan Township, Somerville &amp; Montgomery. Stay safe. https://t.co/aOK099o2u1"
697860160442728448,2016-02-11 19:10:02,,1,3,Twitter Web Client,Congressman Lance sees how N.J. students put computers to work https://t.co/k8UjGOZlrR
697810730071019520,2016-02-11 15:53:37,,2,4,OS X,Thank you @JewishWarVets of NJ for meeting with me this morning &amp; discussing issues important to our Veterans. https://t.co/wNrTp97r3O
695713564338884608,2016-02-05 21:00:14,,3,0,Twitter for Mac,RT @DrBobGoldberg: .@LeonardLanceNJ7 calls on presidential contenders to take a stand on boosting cures https://t.co/QoDKDGNQNb
695423921168867328,2016-02-05 01:49:17,,3,0,Twitter for iPhone,RT @WWFH_NJ: Great job Max .@RASopathiesnet presenting the innovation awards with .@RepLanceNJ7 @BioNJ_Org https://t.co/xmpZ6XcOwq
694906975579160576,2016-02-03 15:35:08,,2,0,Twitter for Mac,RT @MsCangie: @RepLanceNJ7 We are so honored and excited to have you visit our Computer Science and Software Engineering Academy on Monday!…
694704103944015874,2016-02-03 02:09:00,,1,2,Twitter Web Client,Congratulations to my friend John King on being named president of the New Jersey Association of Counties. https://t.co/q4JIRFwkk6
694703090742747136,2016-02-03 02:04:58,,0,2,Twitter Web Client,Chris is an exceptional young man.  I was honored to be in Lebanon for his Eagle Court of Honor ceremony. https://t.co/jxrQMbvuGR
692850276584165376,2016-01-28 23:22:33,,3,0,Twitter for iPhone,RT @donblackwell4: @RepLanceNJ7 TU 4 supporting the #AnnaWestinAct. It is critically important 2 those battling #EatingDisorders &amp; their lo…
692813639741526020,2016-01-28 20:56:58,,2,1,OS X,Great visit with @KMPhair &amp; the Summit Volunteer First Aid Squad in its new state-of-the-art headquarters building. https://t.co/T3MWEMwtGw
692749365807562752,2016-01-28 16:41:34,,9,4,Twitter for iPad,"Great turnout at today's town hall &amp; claims clinic @UCCweb to help assist our Vets, servicemembers &amp; their families. https://t.co/VhLDKh8xEY"
692541108593790976,2016-01-28 02:54:01,,1,1,Mobile Web,Congressman Lance announces Congressional Art Contest https://t.co/VcBEQGZGq1
692541000770830337,2016-01-28 02:53:36,,1,2,Mobile Web,Lance invites teen artists to compete https://t.co/5PYu2CZnQp
691985631212392448,2016-01-26 14:06:45,,1,0,Twitter Web Client,Health center in Dover gains $1.5 million federal grant https://t.co/ucYSc5p2Wu
691985557380034560,2016-01-26 14:06:28,,0,0,Twitter Web Client,Lance visits eighth grade class at Immaculate Conception School in Annandale https://t.co/oL9kgUiwqV
691716479474077697,2016-01-25 20:17:14,,2,0,Twitter for Mac,RT @JeannieCastells: @RepLanceNJ7  I thank you for supporting SkillsUSA students who look to you to continue to work to end Alzheimer's. ht…
690334878051733504,2016-01-22 00:47:15,,2,4,Twitter for iPhone,Another great crowd at my 37th town hall meeting. I'm proud to represent such an interested and engaged electorate. https://t.co/MCWkffVpSw
690289782191161344,2016-01-21 21:48:03,,0,0,Twitter Web Client,I hope to see you at my 37th town hall meeting.  Tonight's gathering is in Kenilworth beginning at 6:00pm.  https://t.co/jQzI0Y5KA2
689473098450472960,2016-01-19 15:42:51,,0,1,Twitter Web Client,I'm only NJ Rep. to sign legal brief stating these actions were unconstitutional &amp; contrary to Congressional intent. https://t.co/fb3R2rSW3b
687742061890678785,2016-01-14 21:04:19,,4,2,Twitter Web Client,Congressman Lance to Host Veterans Affairs Town Hall and Claims Clinic in Cranford  https://t.co/8oZvdc5Jl0
687726485008977920,2016-01-14 20:02:26,,0,1,Twitter Web Client,Watching Lance: No Sanction Relief In Response to Long List of Iranian Provocation @CSPANVL https://t.co/Z2ZB89tzYe
687270442567102465,2016-01-13 13:50:17,,0,1,Twitter Web Client,Rep. Lance said changing the tax code could be another issue that Obama and Congress could work together as one. https://t.co/fQpNfrHrVI
687269946540298240,2016-01-13 13:48:18,,0,2,Twitter Web Client,We can end preventable deaths if Congress acts now https://t.co/m1sjqLcr3N via @BurlcoTimes
687049712189452288,2016-01-12 23:13:10,,21,12,Twitter for Mac,"Hiding nuke technology, testing missiles &amp; now detaining US sailors &amp; seizing boats. We must stop sanctions relief &amp; hold Iran accountable."
687008517295833088,2016-01-12 20:29:29,,13,24,OS X,I’ve got my wristband on &amp; I’m ready to stand with #TeamJonny in the fight against pediatric cancer. #SOTU https://t.co/sJCnvvNxcu
686717152259358721,2016-01-12 01:11:42,,2,1,Twitter for iPhone,Lance Offers Prebuttal Ahead of State of the Union Address https://t.co/qwUYr9MF3w
685195667661307906,2016-01-07 20:25:52,,5,1,Twitter for Mac,"I will be hosting my 37th in-person town hall meeting on Thursday, January 21 at 6pm in Kenilworth.  https://t.co/U2RxwUvqbH"
684896647583821824,2016-01-07 00:37:40,,8,4,Twitter for Mac,BREAKING NEWS: Congress sends ObamaCare repeal bill to Obama's desk for first time.  My floor statement:  https://t.co/DNNP7kDy05
684449768962011136,2016-01-05 19:01:56,,2,1,Twitter for Mac,My statement on the President’s executive actions on gun rights:  https://t.co/iY80JMYe4g
680081172341387264,2015-12-24 17:42:41,,0,5,Twitter for iPhone,Merry Christmas and Happy New Year.  Read my Christmas message for this holiday season. https://t.co/GGuRBdYDYf
679105773478289409,2015-12-22 01:06:48,,4,0,Twitter for iPhone,RT @MyCentralJersey: Lance recognized for cancer work https://t.co/jIDInTM7KH
677872581588836353,2015-12-18 15:26:32,,1,3,Twitter for Mac,Read my statement on why I opposed the year-end spending agreement passed by the House today.  https://t.co/168bOXLxRx
677568754847522816,2015-12-17 19:19:14,,1,2,Twitter for Mac,House-passed tax bill delivers two key victories for New Jersey’s vibrant life sciences sector. Read about it here:  https://t.co/v5at58usdq
677230454014124034,2015-12-16 20:54:57,,2,0,Twitter for Mac,RT @LeonardLanceNJ7: .@scottschnipper Tax agreement make permanent a maximum transit commuter pre-tax benefit of $255/month. House vote on …
677210995920658433,2015-12-16 19:37:38,,0,1,Twitter for Mac,I am pleased the year-end funding bill to be voted on Friday includes my request to end Obamacare's insurer bailout. https://t.co/QsZIB1CESH
676887780484599808,2015-12-15 22:13:17,,2,0,Twitter Web Client,"A very touching ceremony that I was honored to be a part of. 

Wreaths laid on vets' graves in Roxbury 

https://t.co/RnNwzPIe0A"
676484170944790528,2015-12-14 19:29:29,,2,2,Twitter Web Client,Lance urges extending sanctions after Iran claims it tested missile | NJJN https://t.co/AxkcUB35jE
676484007882711041,2015-12-14 19:28:50,,0,1,Twitter Web Client,Rep. Leonard Lance Opposes Bailout of Insurers Under Obamacare https://t.co/WJjRtTZ3ZY via @YouTube
674337096698609665,2015-12-08 21:17:47,,1,0,Twitter for Mac,RT @MainStreetGOP: .@RepLanceNJ7 on @HouseFloor now in support of Visa Waiver Program Improvement Act https://t.co/ZaeG9Hbzoi
674236940561063937,2015-12-08 14:39:48,,0,0,Twitter Web Client,CONGRESSMAN LANCE: House eyes strong refugee measures - New Jersey Hills: Bernardsville News Opinion Columns https://t.co/tb34jMiisw
674236848651243520,2015-12-08 14:39:26,,0,0,Twitter Web Client,Lance offers service member holiday mail drop-off locations - New Jersey Hills: Hunterdon Review News https://t.co/wvLK2BmPzy
674236719449956355,2015-12-08 14:38:55,,2,1,Twitter Web Client,Lance Votes to Repeal ‘No Child Left Behind’  https://t.co/SJwqW7FPox
674233731582959616,2015-12-08 14:27:02,,2,0,Twitter for Mac,"RT @justinpaulbaker: @RepLanceNJ7 as a constituent, I'm proud that you support the renewal of the Zadroga Act. Thank you for honoring our b…"
673915917072494592,2015-12-07 17:24:10,,1,0,OS X,The Holiday Mail for Heroes Program is underway. These just arrived in my Westfield office. https://t.co/At6u8ZaQmj https://t.co/lBWM4CO3G4
673869058421473281,2015-12-07 14:17:58,,1,1,Twitter for Mac,.@lorenraye we are working hard to renew the Zadroga Act.  You can read about my recent effort here:  https://t.co/ieukv4lRFH
673867580575232001,2015-12-07 14:12:05,,0,0,Twitter for Mac,Victory cannot be achieved with more of the same.  My take on the President's Oval Office speech last evening.  https://t.co/ZoWy6buHTD
673653904110968832,2015-12-07 00:03:01,,1,2,Twitter for Mac,"Heidi and I want to wish our friends in the Jewish community a very happy and joyous Hanukkah!   

Chag Sameach!"
673294026699862016,2015-12-06 00:12:59,,3,5,Twitter for iPhone,"Congrats to Cranford H.S. on their big win over Chatham in the final of the NJSIAA North Jersey, Section 2, Group 3 playoffs Friday evening!"
672784458202923008,2015-12-04 14:28:09,,1,1,Twitter Web Client,"UPDATED: See what NJ Transit, N.J. highways will get from $305B bill https://t.co/aEihqQnJV9 via @njdotcom"
672783997647327233,2015-12-04 14:26:19,,5,1,Twitter Web Client,Drop-off locations announced for 'Holiday Mail for Heroes' due by Dec. 18 https://t.co/Mpy0gV4QJl via @njdotcom
672619912926502913,2015-12-04 03:34:18,,2,3,Twitter for Mac,Congratulations to Westfield HS football team on winning the state championship! And kudos to Bridgewater-Raritan for a great game &amp; season.
672202431112085504,2015-12-02 23:55:23,,2,5,Twitter for iPhone,Prayers for the victims of the senseless violence in CO Springs &amp; San Bernardino. We must make #HR2646 a priority. https://t.co/VU5vAb5237
672164521037971458,2015-12-02 21:24:44,,1,2,Twitter for Mac,".@marcorubio We've got your back over here in the House, Senator:  https://t.co/QsZIB1CESH"
672162200526696448,2015-12-02 21:15:31,,0,0,Twitter Web Client,Lance: Taxpayers should get to see what they’re paying for! | The Save Jersey Blog - https://t.co/33THTxU1M6 via @Shareaholic
672161952710414337,2015-12-02 21:14:32,,0,0,Twitter Web Client,Lance Introduces Congressional Life Science Caucus  https://t.co/72KCHgRNi8
672161872041373696,2015-12-02 21:14:13,,0,1,Twitter Web Client,Lance Office Marks 4000th Successful Constituent Case  https://t.co/7ZQC6NeIV6
670545753144733696,2015-11-28 10:12:20,,2,0,Twitter for iPhone,The Daily 202: Backlash brews against erasing Woodrow Wilson's name from Princeton https://t.co/a07qWu3AYU
670545576673570816,2015-11-28 10:11:38,,1,0,Twitter for iPhone,The Daily 202: Backlash brews against erasing Woodrow Wilson's name from Princeton https://t.co/eknIO4xrSG
670545285622448130,2015-11-28 10:10:28,,1,3,Twitter for iPhone,Lance announces Congressional Life Science Caucus https://t.co/x1luEGCeyC via sharethis
670545194757046272,2015-11-28 10:10:07,,4,1,Twitter for iPhone,N.J.'s Lance: Why can't taxpayers see reports they paid $100M for? https://t.co/3qlAn98Ea7
668157301455495169,2015-11-21 20:01:29,,3,0,Twitter Web Client,Congressman Leonard Lance Highlights ATR Support for CRS Transparency https://t.co/rjiAnUl9u1
668105412785389568,2015-11-21 16:35:17,,1,2,Twitter for iPhone,Heidi &amp; I send our heartfelt prayers to Anita Ashok Datar's family &amp; all the victims of the Mali terrorist attack. https://t.co/QLzNf1gtnB
667359951753502721,2015-11-19 15:13:06,,1,0,Twitter for Mac,"RT @nathan_leamer: Great to see @RepLanceNJ7 speaking out for CRS transparency, citing @taxreformer's support"
666981792575000576,2015-11-18 14:10:25,,4,1,Twitter Web Client,Americans for Tax Reform (ATR) Supports Lance Legislation to Make CRS Available to the Public https://t.co/X8AmA0kQQq
666957047263535104,2015-11-18 12:32:06,,2,1,Twitter Web Client,Rep. Lance accepts public service award - New Jersey Hills: Bernardsville News News https://t.co/CjUouNUFwv
666956814924148736,2015-11-18 12:31:10,,2,0,Twitter Web Client,Americans for Tax Reform (ATR) Supports Lance Legislation to Make CRS Avaliable to the Public https://t.co/TIoA55Ob2Y
666740214430359552,2015-11-17 22:10:29,,4,3,Twitter Web Client,Lance To Vote To Halt President Obama’s Syrian Refugee Program  https://t.co/kYVs6Tr7Tt
665333291050926080,2015-11-14 00:59:52,,8,10,Twitter for iPhone,Heidi &amp; I send our heartfelt prayers to all those who lost loved ones in Paris this evening. America stands firmly beside our French allies.
664565746392018944,2015-11-11 22:09:55,,0,2,Twitter Web Client,Rep. Leonard Lance Speaks at Deerfield School Veterans Day Event in Mountainside  https://t.co/c7qUkPd22J
664448045073977344,2015-11-11 14:22:13,,0,2,Twitter Web Client,"In grand ceremony, Mine Hill unveils six monuments celebrating veterans and first responders.  https://t.co/6cBe1u2NF9"
664446524525559808,2015-11-11 14:16:10,,0,1,Twitter for Mac,Honoring and helping vets should be focus year-round.  https://t.co/JpgTiT7hjI
664428898818609153,2015-11-11 13:06:08,,23,0,Twitter for Mac,"RT @USATODAY: Rep. Leonard Lance, R-N.J., missed two votes in 7 years. Bobby Rush, D-Ill., missed 1,549: https://t.co/1Ae9dZLBMi https://t.…"
662708576327192576,2015-11-06 19:10:11,,1,1,Twitter for Mac,Today's Keystone decision hurts U.S. consumers &amp; workers &amp; our ally Canada while helping our adversary China. https://t.co/pXK1eqM47p
662706299302473728,2015-11-06 19:01:08,,1,1,Twitter for Mac,"Catch me on @News12NJ Power and Politics this weekend 10am, 12:30pm and 4:30pm both Saturday and Sunday."
661901887864758272,2015-11-04 13:44:42,,1,0,Twitter for iPad,I will be speaking on the House floor this morning on my efforts to bring more openness to Congress' research arm https://t.co/g8bYog2afm
659745147345833984,2015-10-29 14:54:35,,1,1,Twitter for Mac,Congratulations to my friend @RepPaulRyan. I was proud to support Speaker Ryan today &amp; look forward to working with him in the days ahead.
659396457708040194,2015-10-28 15:49:01,,1,2,Twitter for Mac,@voncleterry I’ll be opposing the budget deal later today and will urge my colleagues to do the same. — L.L.
657514608794730496,2015-10-23 11:11:13,,6,6,Twitter Web Client,Lance: Obama’s veto “threatens our men and women in uniform” | The Save Jersey Blog - https://t.co/5QXla4eEMB
657222195287076864,2015-10-22 15:49:16,,1,1,Twitter Web Client,COMMENTARY: Rep. Leonard Lance: Time to end the filibuster - New Jersey Hills: Bernardsville News Opinion Columns https://t.co/CNwYvIHcIW
656929546978131972,2015-10-21 20:26:23,,1,0,Twitter for Mac,RT @novonordiskus: Thanks to @RepLanceNJ7 for meeting with our team during #AdvocacyDay https://t.co/4gHTEaD9Kz
654387151422009344,2015-10-14 20:03:49,,0,3,OS X,I had a wonderful visit at the Auten Road Intermediate School in Hillsborough.  Lots of great questions! http://t.co/pw9qrrkyDl
654084119215931392,2015-10-13 23:59:40,,0,2,iOS,New weapon proposed in war against phone scams http://t.co/lSmYxA9nZg
654045411775279104,2015-10-13 21:25:52,,1,0,iOS,Proud that my legislation protecting residents from telephone scammers has the support of Sheriff Frank Provenzano. http://t.co/8bRcyloY3g
653933881071136768,2015-10-13 14:02:41,,0,0,Twitter Web Client,"LANCE: ""It makes no sense that Iranian oil will soon be permitted to flow but American-made energy is left untapped"" http://t.co/pFTw8XnxL4"
653933274373484544,2015-10-13 14:00:16,,0,0,Twitter Web Client,Rep. Lance on Why He Supports Paul Ryan for Speaker of the House http://t.co/sWROPptLLt via @NJTVNews
652489605451808769,2015-10-09 14:23:39,,0,2,Twitter for Mac,Speaking on the floor soon in support of bill to end the ban on U.S. oil exports. Ending the ban is good for jobs &amp; national security.
651788479408508928,2015-10-07 15:57:37,,0,0,Twitter Web Client,NJ lawmakers back bills targeting Iran | NJJN http://t.co/Xv3br64BgP
650004610787221504,2015-10-02 17:49:10,,0,0,Twitter for iPhone,@krstreicher I'm focusing my efforts on fixing our mental health system to better identify &amp; treat those at risk of violent behavior #HR2646
649644837059301376,2015-10-01 17:59:33,,3,2,Twitter for Mac,Iran must pay back the victims of their terrorism before they get a dime of sanctions relief from us.  https://t.co/M6TRcarqzc
649290403691261957,2015-09-30 18:31:10,,5,0,Twitter for Mac,RT @Franchising411: The NJ delegation thanks @replancenj7 for supporting the Protecting Local Business Opportunity Act! #franchiseforward h…
649016203831312385,2015-09-30 00:21:35,,2,0,Twitter for iPhone,RT @JudyTutela: Thank you @RepLanceNJ7 for your support and for taking time to meet with us today #CancerLobbyDay  #OneDegree #acscan http:…
648797586107797505,2015-09-29 09:52:53,,3,0,Twitter for Mac,RT @joeagabiti2013: .@RepLanceNJ7 Thank you for your support of @SpencerAgabiti earning Eagle Scout @AutismSpeaksSNJ @boyscouts http://t.co…
648119868039012352,2015-09-27 12:59:52,,1,0,Twitter for iPhone,RT @christytighe: Thank you @RepLanceNJ7 for this incredible experience! #popeindc http://t.co/FneWSVDE4A
647472068854947840,2015-09-25 18:05:45,,0,0,iOS,Lance Statement on Speaker John Boehner's Retirement | Congressman Leonard Lance http://t.co/3gJTjrcYG6
647378363200479232,2015-09-25 11:53:24,,1,0,Twitter for Mac,RT @dmeehan08: @RepLanceNJ7 with gratitude for the awesome opportunity to see the Pope. http://t.co/jb3BuRiBDF
647203499458068481,2015-09-25 00:18:33,,1,1,Twitter Web Client,Pope Francis cheered by N.J. residents in Washington http://t.co/x4NetkrSeW via @njdotcom
647142105450684416,2015-09-24 20:14:35,,0,1,Twitter Web Client,Westfield Patch: Congressman Lance Celebrates Pope Francis's Address to Congress http://t.co/JwAxqdKggB
647073853441708033,2015-09-24 15:43:23,,2,2,OS X,Following a historic address to Congress we gather on the East Front of the US Capitol to say farewell to @Pontifex. http://t.co/heM4jeSh2L
647059053668122624,2015-09-24 14:44:34,,0,0,Twitter Web Client,Lance obtained tickets from other lawmakers enabling more than 150 of his constituents to attend Pope address in DC. http://t.co/OsZi6uUNsZ
646703420120899584,2015-09-23 15:11:25,,2,2,OS X,I was among those at the White House this beautiful morning to welcome His Holiness @Pontifex to our great Nation. http://t.co/z1piEUD4MA
646074624397176832,2015-09-21 21:32:48,,2,2,iOS,The tickets for the @Pontifex address before Congress have arrived. More than 80 NJ7 families will be there Thursday. http://t.co/QLMkGxd8wp
645360433545785344,2015-09-19 22:14:52,,5,3,iOS,"PennEast pipeline path presents 'significant concerns,' N.J. congressman says | http://t.co/Rhh4P1d67R http://t.co/O2mKzUkdQ1"
645232621853786112,2015-09-19 13:46:59,,1,0,Twitter for iPhone,RT @Ctarletsky: Thank You @RepLanceNJ7 for your strong position today at the Energy/commerce meeting and HR209  #CysticFibrosis
645232559052484608,2015-09-19 13:46:44,,1,0,Twitter for iPhone,RT @Nortar1163: @RepLanceNJ7 MT for your amazing support at today's Energy/Commerce Health meeting &amp; 4 highlighting Alex's struggles w/CF. …
644605943003615232,2015-09-17 20:16:47,,3,0,Twitter for Mac,RT @childrenscause: .@RepLanceNJ7 Thank you for co-sponsoring the Childhood Cancer STAR Act. You're a champion for our kids!
644592543829762050,2015-09-17 19:23:33,,0,0,Twitter for Mac,"@jodeecola @gokzarah Here's @washingtonpost editorial board calling the legislation, ""a boon to the U.S. economy"" https://t.co/MslPdCmzQ2"
644590350779174912,2015-09-17 19:14:50,,0,0,Twitter for Mac,@gokzarah nothing misleading about it.  It is an opinion piece expressing another side of the arguments against lifting the ban. — L.L.
644579037470420992,2015-09-17 18:29:52,,0,0,Twitter for Mac,@gokzarah an informative article on my exporting oil makes sense:  http://t.co/nB0MtBX3mT
644567006856015873,2015-09-17 17:42:04,,0,0,Twitter for Mac,As a member of @HouseCommerce I'm proud to have helped pass out of committee HR 702 to lift the ban on US oil exports.http://t.co/e9VGfEDE8i
644264733571465216,2015-09-16 21:40:57,,2,0,Twitter for Mac,RT @wendyselig: Great event at @lymphoma dinner with US Reps Leonard Lance and Brian Higgins http://t.co/FZRv9EnJAS
644264675316756480,2015-09-16 21:40:43,,1,0,Twitter for Mac,RT @JeannieCastells: Alzheimer's Ambassador Jeannie Castells with Congressman Leonard Lance. Pohatcong Town Hall Meeting. 9/14/15 http://t.…
644198755336630272,2015-09-16 17:18:46,,3,0,Twitter for Mac,RT @NYCOSH: #Zadroga lobbying day with @RepLanceNJ7 @FDNY #Renew911Health http://t.co/2Xr6ynGeuv
643933847596494852,2015-09-15 23:46:07,,1,0,iOS,Rep. Lance visits Clinton Fire with news of federal grant | http://t.co/7vaZB1H0SG http://t.co/NVxQaj3ZgA
643932752786653184,2015-09-15 23:41:46,,1,0,iOS,The President wants to expand Iranian access to global oil markets but opposes a giving US companies the same access. http://t.co/f0OfI3NfJQ
643925383797186561,2015-09-15 23:12:29,,1,0,Twitter for iPhone,RT @theaward: .@RepLanceNJ7 presents the Bronze to John Rutledge of Whitehouse Station. He #EarnedIt w/ Children's First Academy. http://t.…
643606690391306240,2015-09-15 02:06:07,,2,0,Twitter for Mac,"RT @NickBraughton: @RepLanceNJ7 at his in-person townhall mtg in Pohatcong tonight, where he states his concerns for the #BadIranDeal http:…"
643572118769283072,2015-09-14 23:48:44,,1,1,Twitter Web Client,"Lance, fresh off a train from Washington, DC, speaks during 9/11 ceremony at Woods Road firehouse in Hillsborough.  http://t.co/JORow8GyDn"
643551318385274880,2015-09-14 22:26:05,,0,0,Twitter for iPhone,I am hosting my 36th town hall meeting. A great crowd and great questions tonight in Pohatcong Township. http://t.co/5Yigh3EuvI
643479180106199040,2015-09-14 17:39:26,,0,2,Twitter Web Client,7TH DISTRICT: Congressman Lance votes against Iran nuclear deal http://t.co/X8r27BWBdn
643464288569565184,2015-09-14 16:40:16,,1,0,Twitter for Mac,RT @njbusiness: Pleased to have @RepLanceNJ7 speak at today's Morris #BIAELC addressing issues in NJ and throughout the U.S. -AM http://t.c…
643163825315954692,2015-09-13 20:46:20,,4,2,Twitter for iPhone,Heidi and I send our best wishes to all those beginning the celebration of the High Holy Days of Rosh Hashanah. L’Shana Tovah U’Metukah!
642387734586376193,2015-09-11 17:22:25,,1,2,Twitter for iPhone,"“This is the one of the most consequential votes I have taken.""  My full statement against the Iran nuclear agreement http://t.co/p1Y07XmPTk"
642387002474807298,2015-09-11 17:19:31,,2,0,Twitter for iPhone,"“Today will forever be a solemn day in America."" Read my full statement on today's anniversary of the 9/11 attacks: http://t.co/Z1wXtVbVPo"
641925139878256640,2015-09-10 10:44:14,,4,0,Twitter Web Client,Congressman to hold town hall meeting in Pohatcong http://t.co/kReiUszPNg via @lehighvalley
641312223332298752,2015-09-08 18:08:43,,1,0,Twitter for Mac,@luv2pwd I'm a cosponsor of H.R. 2646 and one of Congress' leading advocates for improving our mental health system.  http://t.co/rTW9eX9zYf
631986278888808448,2015-08-14 00:30:45,,1,0,Twitter for iPhone,Wonderful news. Heidi and I send our congratulations and best wishes to you and your family.  https://t.co/v4h9nvZEub
631878698975776768,2015-08-13 17:23:16,,3,0,Twitter for Mac,RT @SomersetCntyNJ: RT@scnj4h: A fantastic group of NJ &amp; Somerset County leaders with outstanding 4-Her's! @SomersetCntyNJ @RepLanceNJ7 htt…
631863587062054913,2015-08-13 16:23:13,,2,0,Twitter for Mac,RT @scnj4h: Thank you @RepLanceNJ7 for helping us honor Abner Mathews for 40 years of service to 4-H! #scnj4h http://t.co/Z2SGPiJnCT
631189932397199361,2015-08-11 19:46:21,,4,4,Twitter Web Client,Phillipsburg fire department gets $447K for new equipment http://t.co/lUORLQ5Vkj via @lehighvalley
631189757691887616,2015-08-11 19:45:39,,0,2,Twitter Web Client,Congressman Lance tours downtown Westfield http://t.co/V3H9NEryyA via @njdotcom
