id,created_at,coordinates,retweets,favorite_count,source,text
571015413506711552,2015-02-26 18:34:18,,3,1,Twitter for Mac,"The FCC’s proposal to regulate the Internet is an overstep that threatens to stifle an important economic engine. ""http://t.co/Mrz9yOOt96"
571011424765517824,2015-02-26 18:18:27,,1,1,Twitter for Mac,My statement on passage of legislation in the House to strengthen 529 college-savings plans. http://t.co/xJeE2p0mOu
571010448239304705,2015-02-26 18:14:34,,4,0,Twitter for Mac,"RT @JonathanTamari: NJs @RepLanceNJ7 says net neutrality plan ""is a blatant overstep of authority that threatens to stifle"" an important ec…"
570794927464030208,2015-02-26 03:58:10,,1,2,Twitter for Mac,@beth_obrien I'm in DC for congressional votes this week but have made my views known to FERC.  My staff will be on-hand tomorrow evening.
570792606277509120,2015-02-26 03:48:56,,2,0,Twitter Web Client,Congressman Leonard Lance welcomes New Jersey American Legion leaders to Washington http://t.co/tyFT4OS3mT via @njdotcom
570755713577967616,2015-02-26 01:22:20,,5,4,Twitter for Mac,Great chatting with @JeffGordonWeb at the @AARPadvocates Welcome Reception at the @Newseum on Capitol Hill. #Team24 http://t.co/hzyy7DEzlr
570714804266127360,2015-02-25 22:39:47,,6,4,Twitter Web Client,"Congressman Leonard Lance, a Republican who represents most of Hunterdon, asked FERC to schedule a local hearing. http://t.co/Y9Z86YBDw7"
570652682849030145,2015-02-25 18:32:56,,2,0,Twitter for Mac,RT @calhealthcare: Thanks @RepAnnaEshoo &amp; @RepLanceNJ7 for leading the way to protect @US_FDA user fees from #sequestration http://t.co/995…
570649671665909760,2015-02-25 18:20:58,,0,0,Twitter for Mac,BIO Strongly Supports Rep. Lance's FDA Safety over Sequestration Act; Urges Swift Consideration and Passage http://t.co/hHRxVdUqWL
570649210774794240,2015-02-25 18:19:08,,5,5,Twitter Web Client,Victoria Gural of Phillipsburg appointed to U.S. Naval Academy http://t.co/8hxGDsNy1C via @njdotcom
570580295621210112,2015-02-25 13:45:18,,3,1,OS X,An honor to visit w/ NJ American Legion leaders Bob Lobby &amp; John Baker on issues important to our Nation's veterans. http://t.co/W3dHe0ANMV
570340218705809410,2015-02-24 21:51:19,,4,0,Twitter for Mac,The President has vetoed one of the first bipartisan jobs bills passed by the new 114th Congress.  http://t.co/vyPh5lf5wP
570277849225166848,2015-02-24 17:43:29,,3,0,Twitter for Mac,RT @OakKnollSHC: Thanks to @replancenj7 for stopping by and chatting with our 8th grade history students yesterday! @WinthropsCity http://t…
570277759869693953,2015-02-24 17:43:07,,1,0,Twitter for Mac,RT @HINJ_ORG: Kudos to Rep Leonard Lance! @RepLanceNJ7 &amp; Rep Frank LoBiondo (R-2) Among Hill Lawmakers with Longest Vote Streaks.  http://t…
570197966360875008,2015-02-24 12:26:03,,0,0,Twitter Web Client,Congressman Leonard Lance announces 2015 Congressional Art Contest http://t.co/Y3wzkjIIRL via @njdotcom
570012869523324928,2015-02-24 00:10:33,,3,0,Twitter for Mac,RT @WinthropsCity: Thank you to @RepLanceNJ7 for visiting my students today and discussing the US government + the Capitol Hill Challenge f…
570008332334997505,2015-02-23 23:52:31,,0,0,Twitter Web Client,"In Exclusive Interview, Congressman Lance Addresses Issues Affecting http://t.co/qKTYA9VycC Readers http://t.co/k9a8F9JPr7"
570008234922287105,2015-02-23 23:52:08,,2,0,Twitter Web Client,Two New Jersey congressmen among those federal lawmakers with longest vote streaks http://t.co/wgf3ds508x via @PolitickerNJ
570008013106495489,2015-02-23 23:51:15,,1,0,Twitter Web Client,Congressman Lance visits Oak Knoll School in Summit (PHOTOS) http://t.co/5JD6j7je34 via @njdotcom
568803180185825280,2015-02-20 16:03:40,,4,0,Twitter for Mac,RT @kentplaceschool: Sending a HUGE Kent Place thank you to @RepLanceNJ7 for visiting with our fifth graders today! http://t.co/BOY9zixqxu
568435546663612418,2015-02-19 15:42:50,,5,0,Twitter Web Client,Residents at Congressman Leonard Lance's town hall in Lopatcong urge swift action on ISIS http://t.co/gMHSnQgLxy via @lehighvalley
567852080645447680,2015-02-18 01:04:20,,10,0,Twitter for iPhone,RT @NickBraughton: Townhall meeting with @RepLanceNJ7 in Lopatcong! http://t.co/PHEZI0fB6F
567798180172288001,2015-02-17 21:30:09,,2,1,Twitter for Mac,My statement on Judge Hanen's preliminary injunction blocking the President's executive actions on immigration.  http://t.co/31OHSlSKKY
567750178057519104,2015-02-17 18:19:25,,2,0,Twitter for Mac,RT @Nortar1163: @RepLanceNJ7 looking forward to your Town Hall meeting tonight in Lopatcong.
565908900189601792,2015-02-12 16:22:50,,3,0,Twitter for Mac,Proud to once again join my friend @repgracemeng in introducing legislation to bring greater accountability to the VA http://t.co/7b6aDZPy1i
565658429491273728,2015-02-11 23:47:33,,1,2,Twitter Web Client,Lance gets look at LIVESTRONG at the YMCA program http://t.co/fgMwDhg9VV via @MyCentralJersey
565650835389296643,2015-02-11 23:17:23,,0,0,Twitter for Mac,Proud to announce that I'll be joining @repjohnlewis @repmartharoby @senatortimscott &amp; others at next month's pilgrimage to Alabama. #Selma
565647671063740416,2015-02-11 23:04:48,,0,0,Twitter for Mac,I believe any authorization of military force must lay out a comprehensive military strategy to defeat ISIS. http://t.co/MIz3qIeVx0
565646934602678273,2015-02-11 23:01:53,,0,0,Twitter for Mac,"Obama’s war draft to receive ‘rigorous oversight’, Lance says http://t.co/JtGotE7spy"
563867466141827072,2015-02-07 01:10:54,,4,1,Mobile Web,Feds schedule Feb. 26 pipeline hearing in Hunterdon http://t.co/C5ryTrzCC1
563383981060931585,2015-02-05 17:09:42,,4,1,Twitter Web Client,$500K allocated for long-awaited Rahway River flood study http://t.co/HZ43tig9th via @njdotcom
563083228136103936,2015-02-04 21:14:37,,15,0,Twitter for Mac,RT @BillCassidy: Joined @RepLanceNJ7 to talk about our bill to stop Obamacare insurance company bailout. http://t.co/rMjOPEakfe
562989139298369538,2015-02-04 15:00:45,,1,2,Twitter for Mac,Today on #WorldCancerDay I pledge to continue my efforts in Congress to improve the lives of cancer patients &amp; their families. #NotBeyondUs
562927789926801408,2015-02-04 10:56:58,,4,0,Twitter for Mac,House Passes Bill To Repeal and Replace Obamacare  http://t.co/B1TJ7V9YCC
562927566525595648,2015-02-04 10:56:05,,1,0,Twitter Web Client,Lance views Hunterdon YMCA LIVESTRONG program for cancer survivors http://t.co/6xRlMnICZ2 via @njdotcom
561206444578844672,2015-01-30 16:56:57,,4,1,Twitter Web Client,U.S. Rep. Leonard Lance to hold town hall meeting in Lopatcong Township http://t.co/w7D8myT56M via @lehighvalley
561141135222251520,2015-01-30 12:37:26,,3,0,Twitter Web Client,Federal commission not ruling out PennEast pipeline meeting in Hunterdon County http://t.co/OGVBPiGP6e via @lehighvalley
560907244137881600,2015-01-29 21:08:02,,4,2,Twitter for Mac,Lance to co-chair House Republican Israel Caucus http://t.co/HRBuqQYUSF
560843993463136256,2015-01-29 16:56:42,,1,0,Twitter Web Client,"Lance: End human trafficking, adopt House measures into law   http://t.co/sA4sM073vr via @njdotcom"
558035993832718337,2015-01-21 22:58:43,,3,3,iOS,Holding my 33th telephone town hall from my desk in Washington DC. Great questions so far. Keep them coming! http://t.co/FHCuH1IgqS
557759199581859842,2015-01-21 04:38:50,,5,0,Twitter for Mac,While I disagreed with many of the President's proposals this evening there are issues where we can work together: http://t.co/OkIsDVwKua
557196432630095872,2015-01-19 15:22:36,,5,3,Twitter for iPad,Today we honor the life &amp; the legacy of Dr. Martin Luther King Jr. #MLKDay2015 http://t.co/DV6eaahfnB
555472974858702848,2015-01-14 21:14:12,,5,2,Twitter Web Client,"Working w/@RepMikeQuigley on a bill creating a free, public electronic database for non-public congressional reports. http://t.co/5PZJWCQxbg"
555466740696883201,2015-01-14 20:49:25,,1,1,Twitter Web Client,Lance: FERC should hold PennEast pipeline meeting in Hunterdon http://t.co/18R5Zwa65P via @njdotcom
555436594216599553,2015-01-14 18:49:38,,2,0,Twitter for Mac,.@beth_obrien  I have sent a letter to @ferc requesting a scoping meeting in Hunterdon County. — L.L. http://t.co/uPQevb3Yn8
555436454659510272,2015-01-14 18:49:04,,0,0,Twitter for Mac,.@wilsonrdavid I have sent a letter to @ferc requesting a scoping meeting in Hunterdon County. — L.L. http://t.co/uPQevb3Yn8
555144904557727744,2015-01-13 23:30:33,,2,0,Twitter for Mac,I voted for H.R. 185 today aimed at reducing red tape &amp; making the regulatory process less costly and more transparent for small businesses.
555013452545421312,2015-01-13 14:48:13,,2,0,Twitter Web Client,House Moves to Protect Emergency Responders http://t.co/XUuMIGwzNP
554997764917325824,2015-01-13 13:45:53,,0,0,Twitter for iPhone,As Vice-Chair of the CMT Subcommittee overseeing data security issues I welcome the President's focus on the topic. http://t.co/Pjd28P7Eo7
553942833900437504,2015-01-10 15:53:58,,5,1,Twitter for Websites,"Congress 'off to a great start,' Rep. Leonard Lance says in video http://t.co/KCEG71w6pY via @lehighvalley"
553555438059683840,2015-01-09 14:14:35,,1,1,Twitter for Mac,I am heading to the floor of the House to participate in the reading of the U.S. Constitution.  Watch live now at http://t.co/Mz1L9JjzK6
552977539904581633,2015-01-07 23:58:13,,1,0,Twitter for iPhone,The killing of several French journalists as well as two police officers was a criminal act of terrorism. My prayers to the families.
552927168209362944,2015-01-07 20:38:04,,1,1,Twitter for Mac,Even I'm on Twitter .@jaywebbernj.  Good to have you with us. — L.L.
552925386523553792,2015-01-07 20:30:59,,1,2,Twitter for Mac,The House just passed the Terrorism Risk Insurance (TRIA) bill that reduces taxpayer liability &amp; protects our economy from acts of terror.
552827644526747648,2015-01-07 14:02:36,,0,0,Twitter for Mac,On the first day of the 114th Congress I introduced a constitutional amendment to balance the federal budget. http://t.co/EC0lvJHWyy
552610705929961472,2015-01-06 23:40:33,,1,2,Twitter for Mac,"I voted YES on H.R. 22, the Hire More Heroes Act to encourage small businesses to hire veterans without facing higher costs under ObamaCare."
552581530883993601,2015-01-06 21:44:38,,3,3,OS X,Grateful to have my wife Heidi with me today &amp; honored to continue to represent the people of NJ-7 in the US House. http://t.co/F5Oo4e21wh
549558341320454146,2014-12-29 13:31:33,,0,1,Twitter for Websites,Congressman Leonard Lance visits Readington Middle School http://t.co/YCGr6xRDGR via @njdotcom
549558247460306944,2014-12-29 13:31:11,,1,1,Twitter for Websites,Lance honored for ‘Keeping the Promise’ to senior citizens http://t.co/Oi9XbXMZDN via @MyCentralJersey
545705999298863104,2014-12-18 22:23:43,,3,1,Twitter for Websites,Lance: U.S. must work to get escaped murderer Joanne Chesimard back from Cuba  http://t.co/qWEJCknABV via @njdotcom
545694348596482048,2014-12-18 21:37:25,,1,2,Twitter for Mac,Lance to chair Congressional Rare Disease Caucus again http://t.co/ofxgofYtrZ
545694101639688194,2014-12-18 21:36:26,,0,0,Twitter for Websites,"Congress acts on Israel, aid for disabled | NJJN http://t.co/m7Kgtchdg8"
545693979312783360,2014-12-18 21:35:57,,0,0,Twitter for Websites,Congressman Lance thanks fall interns for public service http://t.co/EBRytkdeoL via @njdotcom
545691687889436672,2014-12-18 21:26:51,,3,1,Twitter for Mac,I ask that you read my letter to John Kerry insisting on the extradition of fugitive Joanne Chesimard from Cuba.  https://t.co/twKCmAZDsp
544962237790978048,2014-12-16 21:08:17,,0,2,Twitter for iPad,As we mark the start of Hanukkah this evening I want to wish everyone celebrating the Festival of Lights a joyful time with family &amp; friends
543505430471639040,2014-12-12 20:39:27,,1,1,Twitter for Websites,Lance's perfect attendance record leads N.J. lawmakers http://t.co/dcj0vZiGee via @njdotcom
543433866930032641,2014-12-12 15:55:05,,0,0,Twitter for Mac,Lance Statement on Passage of Federal Government Spending Bill  http://t.co/WJo4ieHg4E
543421645302820864,2014-12-12 15:06:31,,0,1,Twitter Web Client,@khoagie8 I knew your Dad &amp; am so very saddened to hear of his passing. Just a great guy who ALWAYS talked about how proud he was of you.
543029051720339456,2014-12-11 13:06:29,,2,3,Twitter for Websites,Congressman Leonard Lance will continue as Republican Chair of Congressional Rare Disease Caucus http://t.co/rEFAOilzQU via @njdotcom
541665342725304320,2014-12-07 18:47:36,,4,3,Twitter for Mac,"We remember and pay tribute to all those who lost their lives at #PearlHarbor 73 years ago today — ""a day which will live in infamy."""
540919210109829120,2014-12-05 17:22:44,,2,0,Twitter for iPhone,RT @HunterdonHealth: Thank you @RepLanceNJ7 for visiting Hunterdon Cardiovascular Associates &amp; touring our new #cardiovascular center http:…
540267886120824832,2014-12-03 22:14:36,,1,0,Twitter for Mac,@judyg808 @sjmherrick The House is expected to pass HR 5771 overwhelmingly this evening. — L.L.
540265985195118592,2014-12-03 22:07:03,,0,0,Twitter for Mac,"Keeping drivers safe from faulty airbags was today's focus in the Subcommittee on Commerce, Manufacturing, &amp; Trade.  http://t.co/kmAgNH7nso"
540220723147849728,2014-12-03 19:07:11,,1,0,Twitter for Mac,RT @MichelleDavisKC: TY @RepLanceNJ7 for supporting rare diseases like ARPKD! Hopeful that MODDERN Cures &amp; 21st Century Cures bring breakth…
539899093225832448,2014-12-02 21:49:09,,2,1,Twitter for Mac,The House has unanimously approved legislation to end payments of Social Security benefits to former Nazis.  http://t.co/nksmd5EEiw
539859456356798467,2014-12-02 19:11:39,,2,1,Twitter for Mac,Nat'l debt has topped $18 trillion.  It's time to enact serious spending reforms including a balanced budget amendment to U.S. Constitution.
539840646086144000,2014-12-02 17:56:54,,1,0,Twitter for Mac,"RT @jfedgmw: We are excited that @USRepRodney,@RepLanceNJ7 and @SenatorLesniak are supporting the Greater MetroWest community on #SuperSund…"
539840581913296896,2014-12-02 17:56:39,,1,0,Twitter for Mac,RT @tapnpgb: Congressman @RepLanceNJ7 writes the Post Office requesting a new zip code for the Borough of North Plainfield. http://t.co/WWh…
536131692835008513,2014-11-22 12:18:51,,2,1,Twitter for Websites,"Please support Operation Jersey Cares, an organization that sends much needed items to our troops overseas. http://t.co/VY8f4reVZB"
536131085403295745,2014-11-22 12:16:26,,1,0,Twitter for Websites,"Obama immigration action illegal, divisive, say two N.J. congressmen   http://t.co/q1KF1oR9Et"
535884061462392833,2014-11-21 19:54:51,,1,0,Twitter for Websites,Will Republican leadership in Congress harm small but significant NEA budget? http://t.co/EY7wftQnav
535883707903901696,2014-11-21 19:53:26,,0,1,Twitter for Mac,Legislators denounce terrorist attack in Jerusalem http://t.co/qlxut5Io8z
535883489267052544,2014-11-21 19:52:34,,0,1,Twitter for Websites,Rep. Leonard Lance (R-7th Dist.) said Obama had no power to act unilaterally. http://t.co/l5MgHwxgxM via @njdotcom
535883260673286145,2014-11-21 19:51:40,,0,2,Twitter for Websites,Lance reacts to Obama's immigration order http://t.co/kIresv5eCD via @PolitickerNJ
535883129215811584,2014-11-21 19:51:08,,2,4,Twitter for Mac,LANCE REAPPOINTED AS VICE CHAIR OF KEY SUBCOMMITTEE  http://t.co/Q0e7hABJRA
534842016010878976,2014-11-18 22:54:08,,0,0,Twitter for Mac,@ivicente06 My apologies. I take great pride in my constituent service. Let me check with my staff &amp; make sure we get back to you. — L.L.
532168405382885376,2014-11-11 13:50:09,,1,2,Twitter for Mac,Today we honor and remember all who bravely stepped forward in service to our Nation. My full statement is here:  http://t.co/lpWiE0HWjA
531845185123385345,2014-11-10 16:25:48,,1,0,Twitter for Mac,Happy 239th birthday to our @USMarineCorps. I thank those past &amp; present for your unselfish commitment to protecting our Nation.  #SemperFi
529252451858526208,2014-11-03 12:43:12,,1,2,Twitter for Mac,Proud to join @RepLoBiondo among the 18 House Republicans &amp; 8 Dems to have not missed a roll call vote this year. http://t.co/yZGmVJstk7
528563540429651969,2014-11-01 15:05:42,,3,0,Twitter for iPhone,RT @HunterdonHealth: @RepLanceNJ7 &amp; @DonnaMSimon get a look at the #davinci robot @daVinciSurgery http://t.co/soErDIobR0
528535995126665216,2014-11-01 13:16:15,,4,4,Twitter for iPhone,Happy to finally see Sgt. Tahmooressi back on American soil.  Let's hope he gets the immediate medical attention he deserves.
527989862041784320,2014-10-31 01:06:07,,3,1,Twitter for Websites,Lance Honored As Champion for Manufacturing Jobs http://t.co/pi1Yk1yeuV
527127799828848640,2014-10-28 16:00:35,,1,0,Twitter for Mac,"RT @artpridenj: @RepLanceNJ7, our eloquent arts advocate, speaking at @NJArtsCouncil meeting at Flemington Court House"
527127736511655937,2014-10-28 16:00:20,,0,0,Twitter for Mac,"Lance touts work on commerce, energy bills  http://t.co/pnBqciS8eE"
527087914128134144,2014-10-28 13:22:06,,0,0,Twitter for Websites,Lawmakers call for passage of bill to end benefits to Nazis in lame-duck session http://t.co/eOMYCfucg1
526473057636872192,2014-10-26 20:38:53,,1,1,Twitter for Websites,"Reps. Maloney, Lance Call For Passage Of Nazi Benefits Termination Act http://t.co/e0jEKHCYL5"
526448769651728384,2014-10-26 19:02:22,,2,0,Twitter for iPhone,RT @RepMaloney: @RepLanceNJ7 Jewish community leaders &amp; I calling 4 passage of Nazi Benefits Termination Act  http://t.co/gsl2nDqbmM http:/…
525435790814224384,2014-10-23 23:57:09,,1,0,Twitter for Websites,I'm proud of my record of supporting policies that help small biz like Peter Dorfman Creative Services in Lebanon. http://t.co/zzSwW9IXsq
525422799683207168,2014-10-23 23:05:31,,0,0,Twitter for Websites,".@housecommerce, check out this company located in #NJ07 helping military, health agencies &amp; hospitals fight Ebola. http://t.co/9kYbFuPT7W"
525419304112504832,2014-10-23 22:51:38,,0,0,Twitter for Websites,ClorDiSys is on the frontlines in the fight against Ebola both in the US &amp; abroad &amp; it's located right here in #NJ07. http://t.co/eOzddggWFY
525363337807536129,2014-10-23 19:09:15,,2,0,Twitter for Mac,RT @ShopFloorNAM: Congrats @RepLanceNJ7 on receiving the NAM Award for Manufacturing Legislative Excellence. http://t.co/QD4VSAVFkx http://…
525005955075821568,2014-10-22 19:29:08,,0,0,Twitter for Websites,Lance to visit Clinton Township company on the frontlines of the Ebola outbreak http://t.co/81NIQfO991 via @njdotcom
524585581746356225,2014-10-21 15:38:43,,0,0,Twitter for Mac,"@mzdameanor I ask for your support because I have a record &amp; reputation of bipartisanship, ethical integrity &amp; getting things done. — L.L."
524314389415862272,2014-10-20 21:41:06,,1,0,Twitter for Websites,US Congressman Brings Government Lesson into Mount Prospect Classrooms http://t.co/s27HrgaKvD
522776957638172672,2014-10-16 15:51:54,,1,0,Twitter for Mac,RT @RepKevinBrady: RT @HouseCommerce: TODAY's #SubOversight hearing on #Ebola starts at 12pm ET —&gt; http://t.co/FT1YWX1YKV http://t.co/2TwoL…
522360245285580800,2014-10-15 12:16:02,,2,0,Twitter for Mac,RT @Gateway_Chamber: Eager to hear what @RepLanceNJ7 has to say at #ELC this morning!
521389593275277312,2014-10-12 19:59:00,,1,0,Twitter for Websites,Lance opposes pipeline route in Hunterdon http://t.co/GQrt9Xa7in
520646414263914496,2014-10-10 18:45:52,,1,0,Twitter for Mac,RT @LeaderTimes: Rep Leonard Lance opposes allowing terrorists into United States from Guantanamo Bay http://t.co/kzU6dbnpqq
520344305786175488,2014-10-09 22:45:24,,1,0,Twitter for Mac,RT @Qualcomm_GA: Thank you @RepLanceNJ7 for visiting @Qualcomm Bridgewater office and  supporting growing more tech jobs in the U.S. https:…
520343491654586371,2014-10-09 22:42:10,,4,5,Twitter for Websites,Congressman Leonard Lance tours Qualcomm in Bridgewater http://t.co/lwSCjYaYrx via @njdotcom
520297241601253376,2014-10-09 19:38:23,,0,0,Twitter for Websites,Lance Applauds Enhanced Screening Efforts: Newark and JFK Two of Five U.S Airports Slated For Enh... http://t.co/BsAvIVLetm
518329420944515072,2014-10-04 09:18:58,,2317,108,Twitter for iPhone,.@usmc_family I have proudly been a cosponsor of HRes620 since July. #MarineHeldInMexico #BringBackOurMarine
518171115286298624,2014-10-03 22:49:55,,3,1,Twitter for Websites,Ebola in the United States: Leonard Lance calls on Obama administration to do more http://t.co/8XXveW6cVi
518138825819058176,2014-10-03 20:41:37,,0,0,Twitter for Mac,@fenolj I am a cosponsor of H.Res. 620. — L.L.
518113306104438784,2014-10-03 19:00:12,,2,0,Twitter for Websites,"HILLSBOROUGH: Rescue squad receives $55,350 grant | http://t.co/MZKEsWcCh7 http://t.co/FpDIT8ufMT"
518107936678109184,2014-10-03 18:38:52,,2,1,Twitter for Websites,Lance Calls On President To Develop Comprehensive Plan To Contain Deadly Ebola Virus Here At Home | Politicker NJ http://t.co/1FjM0xEZfM
518105150930837504,2014-10-03 18:27:48,,2,3,shareaholic,Lance Calls for Ebola Screening Program | The Save Jersey Blog - http://t.co/6wsduyeiUi via @Shareaholic
518104189562798081,2014-10-03 18:23:59,,5,7,Twitter for Mac,"At sundown begins Yom Kippur, a time of reflection, prayer &amp; atonement. Heidi &amp; I wish those of a Jewish faith a peaceful &amp; blessed fast."
517708295076069376,2014-10-02 16:10:50,,1,0,Twitter for Mac,RT @JSawyer330: Thank you @RepLanceNJ7 for your leadership on behalf of #FQHCs and their 23M patients. http://t.co/sA90BmF50T  #Accessisthe…
517707466738384899,2014-10-02 16:07:33,,1,0,Twitter for Websites,Kudos to Mt. Prospect Elementary School in Basking Ridge for being named one of NJ's 11 national Blue Ribbon schools. http://t.co/cB5EzMV4Ya
517354273009446912,2014-10-01 16:44:05,,0,0,Twitter for Websites,@BillCassidy and I have authored legislation that would protect taxpayers from the risk corridor program. http://t.co/SDHDXvqCUL
517257396662456320,2014-10-01 10:19:08,,2,0,Twitter for Websites,Lance Joins Rep. Payne in Fight Against Colorectal Cancer http://t.co/9axzsEY73b
517257185726693377,2014-10-01 10:18:17,,1,0,Twitter for Websites,Congressman Leonard Lance helps secure grant for Hampton Fire Company http://t.co/hQWRa02qjB via @njdotcom
517255437414969344,2014-10-01 10:11:21,,3,1,Twitter for Websites,Local retail &amp; restaurants like @dominos are vital to our communities &amp; a driving force in our Nation’s economy. http://t.co/tDQ1v0SqAE
515913305618010112,2014-09-27 17:18:11,,0,0,Twitter for Websites,Congressman Lance Joins 5th Annual NJ Walks for TS at Mendham Honorary Committee http://t.co/aAfhXpz113
515913152588816384,2014-09-27 17:17:35,,1,1,Twitter for Websites,Hillsborough Rescue Squad earns federal grant http://t.co/Ca0fZLvr2c via @njdotcom
515208856222576640,2014-09-25 18:38:58,,0,0,Twitter for iPhone,"Congratulations to my friends at @AGARNJ in Pittstown for being recognized as one of CNN's Heroes.

http://t.co/X6ZNw1WcHE"
514866762257809410,2014-09-24 19:59:36,,4,4,Twitter for iPhone,"My wife Heidi and I wish those families celebrating #RoshHashanah a very happy, healthy and prosperous New Year.  L'Shanah Tovah!"
514763492155326464,2014-09-24 13:09:15,,0,0,Twitter for Websites,"Lance Visits Westfield Rotary Club - Around Town | Westfield, New Jersey Patch http://t.co/PQLEaPOYXo"
512689365743452161,2014-09-18 19:47:24,,7,0,Twitter for iPad,RT @HydroAssoc: .@RepLanceNJ7 opens our congressional briefing on #Hydrocephalus http://t.co/hzvtPemMDj
512689315046883328,2014-09-18 19:47:12,,7,0,Twitter for iPad,RT @TeddyRuffsevelt: @RepLanceNJ7 is the coolest #repuglican from Jersey I know. It was a please snuggling with you today! http://t.co/1Shh…
512689218976378880,2014-09-18 19:46:49,,5,0,Twitter for iPad,RT @HydroAssoc: The entire #Hydrocephalus community thanks @RepLanceNJ7 and @RepAndreCarson for their leadership of the Congressional Hydro…
512310763076460546,2014-09-17 18:42:58,,2,1,Twitter for Mac,The House just passed legislation to #AuditTheFed (HR 24). Americans deserve to know how their money is being lent and spent by the Fed.
512309477660704768,2014-09-17 18:37:52,,1,0,Twitter for Mac,"RT @SimplifyEstTax: @LeonardLanceNJ7 joined lawmakers to ask the House to vote on H.R. 2429, a repeal of the federal #estatetax #progress #…"
512308871676047360,2014-09-17 18:35:27,,1,0,Twitter for Mac,RT @ALSPublicPolicy: Great to have the co-chair of the Rare Disease Congressional Caucus @RepLanceNJ7 start the briefing today! http://t.co…
512292881772466176,2014-09-17 17:31:55,,0,0,Twitter for Websites,Lance Calls for Estate Tax Repeal http://t.co/LKdveZqLx1
510539620707467264,2014-09-12 21:25:05,,2,0,Twitter for iPhone,Congressman Lance and Westfield Leaders Speak at 9/11 Ceremony http://t.co/IJ1gD2Xlb5
510033618526564352,2014-09-11 11:54:25,,1,1,Twitter for Mac,On this anniversary let us never forget the lives lost 13 years ago today and pray for those who protect us from the dangers we still face.
509836812974452737,2014-09-10 22:52:23,,1,0,OS X,Proud to have participated in today’s USO Care Package Service Project in support of our troops &amp; their families. http://t.co/9DUR36QDUJ
509331386730573824,2014-09-09 13:24:00,,2,2,Twitter for Mac,House will vote on my bill co-authored with @RepJoeBarton &amp; @RepGraceMeng to protect consumers against fraudulent &amp; deceptive text messages.
509330152593977344,2014-09-09 13:19:05,,0,0,Twitter for Websites,Committee to Build on #RecordOfSuccess with Nine Bills on the House Floor This Week http://t.co/7wIL4B48nl
508682011179892736,2014-09-07 18:23:36,,1,0,Twitter for Websites,Letter:  An appreciative constituent   http://t.co/QcUytD9gUm via @njdotcom
