id,created_at,coordinates,retweets,favorite_count,source,text
380698647349841920,2013-09-19 14:23:25,,1,0,Twitter Web Client,See the results of my most recent Insta-Poll on Syria: https://t.co/3APuaMW8DU
380696979505819648,2013-09-19 14:16:47,,1,1,Twitter Web Client,@HouseCommerce is holding an oversight hearing today to examine the Administration's 5-year delay on approval of the Keystone XL pipeline.
380668214079795200,2013-09-19 12:22:29,,1,0,Twitter Web Client,"@VonCleterry It is members of Congress, those who cast the votes &amp; appear on the ballot, who should be held accountable for ObamaCare."
380481713257725952,2013-09-19 00:01:24,,0,0,Twitter Web Client,@tmorbs As do I.  Look for a vote in the House this Friday.
380381712888250370,2013-09-18 17:24:02,,0,0,Twitter for Websites,"Congressman Lance congratulates Musconetcong River Restoration Partnership

http://t.co/FlOZZVkXxS"
380350876797255682,2013-09-18 15:21:30,,0,1,Twitter for Websites,"National Mental Health Council Names Lance a 'Legislator of the Year' - Government - Bridgewater, NJ Patch http://t.co/6b0GZMoySW"
380349596796338177,2013-09-18 15:16:25,,0,0,Twitter for Websites,"REP. LANCE:  DELAY OBAMACARE UNTIL PRIVACY CAN BE PROTECTED - Town Square - Westfield, NJ Patch http://t.co/nTlGv1ABex"
380343644915396608,2013-09-18 14:52:46,,0,1,Twitter Web Client,@ASPS_News I look forward to continuing our efforts to help educate women about breast reconstruction &amp; options following cancer care.
380327889452802048,2013-09-18 13:50:09,,0,0,Twitter for Websites,Lance Recognized as Legislator of the Year | http://t.co/7vaZB1ppu6 http://t.co/jjuO51GvtB
380276803610607616,2013-09-18 10:27:09,,1,0,Twitter for iPhone,@VonCleterry I am an original sponsor of the “No ObamaCare Subsidies for Members of Congress Act” (H.R. 3067) that would end the exemption.
379972033070641152,2013-09-17 14:16:06,,0,0,Twitter for Websites,Lance Legislation Designed to Help Patients  with Chronic Diseases and Disabilities http://t.co/NW46QeezEi
379968451999039488,2013-09-17 14:01:53,,0,0,Twitter for Websites,Lance Accepts Accept Award from American Society of Plastic Surgeons http://t.co/3ogQ8xZkEI
379968166421475328,2013-09-17 14:00:45,,0,0,Twitter for Websites,Lance Awards Posthumous Service Medals http://t.co/cRCPkth0a9
379654504523640832,2013-09-16 17:14:22,,0,0,Twitter for Websites,Congressman Leonard Lance Hosts Tax Reform Forum in New Providence http://t.co/mtjjvOPqRD
379630883420250112,2013-09-16 15:40:30,,1,1,Twitter for iPhone,Please keep your thoughts and prayers with those affected by the #NavyYardShooting shooting this morning and their families.
378612554899415040,2013-09-13 20:14:02,,8,0,Twitter for iPhone,RT @ALSPublicPolicy: @RepLanceNJ7 reintroduced the #MODDERN Cures Act today! Thank you for supporting people with #ALS! http://t.co/ILONL7E…
378612515519078400,2013-09-13 20:13:52,,4,0,Twitter for iPhone,"RT @NHCouncil: Today @RepLanceNJ7 introduced the #MODDERN Cures Act, which will encourage new therapies for people w rare diseases http://t…"
378612429535870976,2013-09-13 20:13:32,,4,0,Twitter for iPhone,RT @Modernmeds: .@RepLanceNJ7 reintroduced #MODDERN Cures Act in Congress! Great news for #raredisease patients: http://t.co/Qf8XCtRdmL
378612397252288512,2013-09-13 20:13:24,,1,0,Twitter for iPhone,RT @ALS_YA: Thanks @RepLanceNJ7 for refiling #MODDERNCures! @alspublicpolicy #FightALS
378611983547133952,2013-09-13 20:11:45,,7,1,Twitter for iPhone,Heidi and I wish Jewish families across New Jersey a blessed Yom Kippur. G'mar Hatimah Tovah!
378212994145988608,2013-09-12 17:46:19,,0,0,Twitter for Websites,MODDERN Cures Act To Be Reintroduced http://t.co/4kNwDfMqGG via @dddmag #MODDERN
377773149909032960,2013-09-11 12:38:32,,2,0,Twitter Web Client,On this day we must also remember Amb. Chris Stevens and his brave colleagues killed one year ago in the #Benghazi terrorist attack. #HRes36
377771426788290560,2013-09-11 12:31:41,,2,0,Twitter Web Client,My statement on the 12th Anniversary of 9/11: https://t.co/NjkIumVjS9
377607570405720064,2013-09-11 01:40:35,,0,1,Twitter for iPhone,"2. I do, however, agree that an international proposal to address the Syrian situation through diplomatic negotiations should be pursued."
377607497898790912,2013-09-11 01:40:17,,0,1,Twitter for iPhone,1.  The President's remarks this evening did not change my position against authorizing military force in Syria.
377122089976623104,2013-09-09 17:31:27,,1,0,Twitter for Websites,I had a wonderful time @ Olde Suckasunny Day Saturday in Roxbury. Great interaction w/ constituents. Great food too! http://t.co/KuZYPanA2c
377119391202021376,2013-09-09 17:20:44,,0,0,Twitter for Websites,Congressman Leonard Lance to Hold Tax Reform Forum in New Providence http://t.co/dXbEjhTO34
375407082234589184,2013-09-04 23:56:37,,3,1,Twitter Web Client,"Headline from @RobJenningsNJ &amp; @NJHerald: Rep. Lance on Syria: “If I had to vote today, I would vote no.” http://t.co/V5ZVwgoVRQ"
375338548586483712,2013-09-04 19:24:18,,0,0,Twitter Web Client,"As many NJ families begin to celebrate Rosh Hashanah at sundown today, Heidi &amp; I wish them a very happy &amp; blessed New Year. L’shanah tovah!"
375237777735950336,2013-09-04 12:43:52,,0,0,Twitter for Websites,"New Jersey lawmakers split, undecided over Syria vote http://t.co/DHsMnXRJ67 via @DailyRecord"
375035270774525952,2013-09-03 23:19:11,,3,0,Twitter for Websites,"U.S. Rep. Leonard Lance (R-7) told Patch that this is not America’s battle.
http://t.co/yKpr623gTs"
375028366362943489,2013-09-03 22:51:44,,3,1,Twitter for Websites,Rep. Lance Says Constituents Oppose Military Action in Syria http://t.co/FzIgAL4lm8 via @NJTVonline
374993350799003648,2013-09-03 20:32:36,,1,1,Twitter for Websites,NJ Congressman asking residents: Should we strike Syria? http://t.co/q3dAl9Pabb
374951391808065536,2013-09-03 17:45:52,,3,1,Twitter for Websites,"Military Action in Syria Won't Get Rep. Lance Approval - Long Valley, NJ Patch http://t.co/yz83okrwve"
374586415478480896,2013-09-02 17:35:35,,0,0,Twitter for iPhone,Today we honor the American worker. My wife Heidi &amp; I wish you all a happy and safe Labor Day.
374486787344711680,2013-09-02 10:59:42,,0,0,Twitter for Websites,"Headline in this morning's @starledger by @stevestrunsky:  Lance not convinced U.S. should strike
http://t.co/k8rEzhViX5"
374289856777564161,2013-09-01 21:57:10,,0,1,Twitter Web Client,"@cathymcmorris &amp; I head to a classified members-only briefing on Syria, Sunday, Sept. 1 in Washington. http://t.co/FuceCdReUI"
373890908212969472,2013-08-31 19:31:53,,0,0,Twitter for iPhone,LANCE STATEMENT REGARDING PRESIDENT'S DECISION TO ASK CONGRESS TO AUTHORIZE FORCE AGAINST SYRIA. https://t.co/6ZRw4MCSum
373848858398183425,2013-08-31 16:44:48,,0,0,Twitter Web Client,My most recent statement on the #Syria situation: https://t.co/sCvLjqd4Li
372726959597682688,2013-08-28 14:26:46,,1,0,Twitter for iPhone,@VonCleterry I will be cosponsoring legislation to repeal  this exemption for members of Congress when I return to Washington in September.
372718642456444929,2013-08-28 13:53:43,,1,0,Twitter for iPhone,"Today we honor Dr. King &amp; all those who marched for equality 50 years ago, including my friend &amp; colleague @repjohnlewis #MarchOnWashington"
372711711209304064,2013-08-28 13:26:11,,0,1,Twitter for Websites,I am proud to support and promote NJ's small domestic beer producers and their employees.  http://t.co/plUt7wq5s0
372710430579228673,2013-08-28 13:21:05,,0,0,Twitter for Websites,"Repealing ObamaCare's medical device tax has been one of my top legislative priorities. @LehighValley Ed board agrees
http://t.co/8iQr4vSSxM"
372129364785504256,2013-08-26 22:52:09,,0,0,Twitter for iPhone,My statement on the events in Syria:  https://t.co/MhVtPfZb3x
370674079860146176,2013-08-22 22:29:22,,1,0,Twitter for Websites,Standing room only crowd greets Lance at Town Hall Meeting in Long Hill Township: Echoes Sentinel News http://t.co/AEYbKvK8CN
370634546246475776,2013-08-22 19:52:16,,2,0,OS X,I recently toured @ConvaTecWound in Skillman where I pledged to continue my push to repeal the medical device tax. http://t.co/wNb5bMLmGV
370537830696505346,2013-08-22 13:27:57,,0,0,Twitter for Websites,Rep. Lance Discusses Affordable Care Act; Immigration Reform with @SchneiderNJTV http://t.co/nAqnhq9qYI
370281211676999681,2013-08-21 20:28:15,,1,0,Twitter for Websites,New Providence Students Conclude Lance Summer Internship http://t.co/1ltnYgaZTp
370277153134227456,2013-08-21 20:12:07,,7,1,Twitter for Websites,"UPS to drop 15,000 spouses from insurance, cites Obamacare http://t.co/8O90gLeifD"
370275035287523328,2013-08-21 20:03:42,,0,0,Twitter for Websites,"Immigration reform: Citizenship possible for kids brought to U.S., Lance says http://t.co/3r9hngcgzG"
369982729070206976,2013-08-21 00:42:11,,0,0,Twitter for Websites,I first want to strengthen the border to reduce the flow of illegal immigration before turning to other provisions. http://t.co/0zyUoncV55
369980833022492672,2013-08-21 00:34:39,,0,0,Twitter for Websites,"Congressman Leonard Lance visits Rotary Club of Summit and New Providence.

 http://t.co/IjmKQZ8QoU"
369964924367556608,2013-08-20 23:31:26,"{u'type': u'Point', u'coordinates': [-74.47734066, 40.66924803]}",2,2,Twitter for iPhone,"Packed house @LHTownship for my 28th public townhall meeting. Lively, passionate crowd with great questions. http://t.co/SBtpA303gJ"
369889774493896704,2013-08-20 18:32:49,,0,0,Twitter for Websites,Cranford pizza shop owner pushes for pathway to citizenship for immigrants | NJBIZ http://t.co/ynbldssE3H
369832981776449536,2013-08-20 14:47:08,,2,0,Twitter for Websites,"Obamacare to end health plan used by 100,000 New Jerseyans | http://t.co/7vaZB1ppu6 http://t.co/ZN0OU1AZwp"
369579412087652352,2013-08-19 21:59:32,,0,0,Twitter for iPhone,@ReidOines I agree 100% &amp; voted for the REINS Act to protect individuals &amp; @NFIB from burdensome executive orders that harm our economy.
368411809952186368,2013-08-16 16:39:54,,1,0,Twitter for Websites,"Immigration reform: Lance sees dead body, says border fence not nearly enough | http://t.co/7vaZB1ppu6 http://t.co/4szvBOrmfJ"
368411068596363265,2013-08-16 16:36:58,,0,0,iOS,"Just finished tour and talk @stonekingpt in Lambertville where we discussed Medicare, PT &amp; wellness issues. http://t.co/Ey9KNPMgDp"
368383805322575873,2013-08-16 14:48:38,,0,0,Twitter Web Client,@JanetteKoneski but our young people would have better opportunities for employment if more companies were creating jobs like @SiemensHealth
368383685097037824,2013-08-16 14:48:09,,0,0,Twitter Web Client,@JanetteKoneski I'm not suggesting that these jobs will solve our Nation's employment problems...
368374441530494976,2013-08-16 14:11:25,,0,0,Twitter Web Client,I learned @SiemensHealth manufacturing facility in Flanders is expanding &amp; expected to add 500 jobs over next 10 yrs. http://t.co/S8z5JtPmT4
368372414565990402,2013-08-16 14:03:22,,0,0,Twitter Web Client,"I toured @SiemensHealth in Flanders yesterday, a world leader in developing and building high-tech medical equipment. http://t.co/u9aR30IPH3"
367722021179781120,2013-08-14 18:58:57,,1,0,Twitter for iPhone,I sat down w/ @LeaderTimes editorial board today where we discussed the economy &amp; other important issues of the day. http://t.co/SfR8J808FB
367626556673245184,2013-08-14 12:39:36,,0,0,Twitter Web Client,Great coffee and conversation with constituents this morning at the Oldwick General Store. http://t.co/wayhGMBo7G
367589836959387649,2013-08-14 10:13:41,,0,0,Twitter for Websites,Dead body and drones greet visiting officials to Mexican border - New Jersey Hills Newspaper: Randolph Reporter News http://t.co/ufkqu6BBSf
367589686023188481,2013-08-14 10:13:05,,1,0,Twitter for Websites,Coffee with the Congressman set for Aug. 14 in Oldwick | http://t.co/7vaZB1ppu6 http://t.co/psc0q2Kg6c
367385029301002240,2013-08-13 20:39:51,,0,0,Twitter for iPhone,"Another day, another delay for ObamaCare.  To read the latest from my committee @HouseCommerce, click here: http://t.co/paE8iNCfe9"
367382959944253440,2013-08-13 20:31:37,,0,0,Twitter for Websites,Lance to hold Town Hall meeting in Long Hill Township Tuesday http://t.co/h2ItYraUEw via @njhills
367003391861325824,2013-08-12 19:23:21,,2,0,Twitter Web Client,Congratulations to Berkeley Heights (#6) &amp; Hillsborough (#16) for being named @MONEY 2013 Top 50 Best Places To Live. http://t.co/npUkE0Gqxb
366875393006911488,2013-08-12 10:54:44,,1,0,Twitter for Websites,Congressmen tour ‘ground zero’ of illegal immigration - The Hill's Blog Briefing Room http://t.co/41JMaI8S5v
366875284470898688,2013-08-12 10:54:18,,0,0,Twitter for Websites,"U.S. Rep. Leonard Lance visits U.S.-Mexico border, addresses concerns | http://t.co/Rhh4P0VuJh http://t.co/aSUZ1f0E0q"
365544276328841217,2013-08-08 18:45:21,,1,0,Twitter Web Client,I spent more than an hour this morning with @LindeGases_NA employees discussing issues important to their industry. http://t.co/ALw0hmx0YF
365542758284410880,2013-08-08 18:39:19,,1,0,Twitter Web Client,Gave interviews with @WRNJNEWSJOYCE @lehighvalley &amp; @ObserverTribune on my tour of the southwest border region. http://t.co/NgRWO3sHrE
365154869927088129,2013-08-07 16:57:59,,0,0,Twitter for Websites,Congressman Lance returns from border mission | http://t.co/7vaZB1ppu6 http://t.co/RqB64yZd71
364877575559983104,2013-08-06 22:36:07,,0,0,Twitter for iPhone,"@tmorbs I added my name as a cosponsor of HR 24 on Jan. 14, 2013. And I voted for its passage last Congress. -L.L."
363400448364904450,2013-08-02 20:46:33,,0,0,Twitter Web Client,@tmorbs 3. That debate should be lengthy not just the 15 minutes given to the Amash amendment during Defense spending bill debate.
363400005513519105,2013-08-02 20:44:47,,0,0,Twitter Web Client,@tmorbs 2. and protects both our national security &amp; our civil liberties. This debate will occur in the autumn during Intel reauthorization.
363399801603239938,2013-08-02 20:43:59,,0,0,Twitter Web Client,@tmorbs 1. These programs must be carried out in a manner that is consistent w/congressional intent....
363398696831946752,2013-08-02 20:39:35,,2,1,Twitter Web Client,Returned constituent calls today then heading to southwest border tomorrow for 3-day immigration fact-finding trip. http://t.co/DlQSczSPBD
363035536631398402,2013-08-01 20:36:31,,0,1,Twitter for Websites,Congressional delegation seeks answers on smart grids | NJBIZ http://t.co/ML10ZhNxXi
363034386234482688,2013-08-01 20:31:57,,0,1,Twitter for Websites,Support @RepDonaldPayne bill to study Smart Grid technology &amp; protect our grid from natural disasters &amp; cyber attacks http://t.co/nBMDmwx6rU
362709436881567744,2013-07-31 23:00:43,,0,0,Twitter for Websites,This bill gives student borrowers &amp; their families the financial certainty to plan for the costs of higher education. http://t.co/FhaQsaYYy3
362707212155625472,2013-07-31 22:51:53,,1,0,Twitter Web Client,Visited with new @Princeton President Christopher Eisgruber. He cares passionately about its students &amp; faculty. http://t.co/Zt9PDGyCuh
362688936226734080,2013-07-31 21:39:15,,0,0,Twitter for Websites,@HouseCommerce passes doc fix 51-0 showing once again how Dems &amp; GOP can work together for the greater good http://t.co/7hRCDD9Wki
362345309227069441,2013-07-30 22:53:48,,2,0,Twitter for iPhone,RT @dmintz13: 2 of America's 50 smartest towns are in @RepLanceNJ7's district? That's not a coincidence. Smart people=Smart voters http://t…
362344959082369025,2013-07-30 22:52:25,,1,1,iOS,I just finished hosting a telephone town hall meeting from my office in Washington.  Great Q&amp;A w/callers. http://t.co/BwXDOy6vzq
360496788282683392,2013-07-25 20:28:26,,1,0,Twitter for Websites,Sequestration should not slow American access to new medications - The Hill's Congress Blog http://t.co/Bi2DVYeHc6
360403558228701184,2013-07-25 14:17:58,,0,0,Twitter Web Client,@ctmommy having spent hours @ classifed briefings &amp; reviewing documents about the program I felt I was best informed on how to cast my vote.
360396705864232960,2013-07-25 13:50:45,,0,0,Twitter Web Client,@sjlombardo Congress is right 2b concerned about NSA program but we should strengthen protections &amp; improve it not eliminate it altogether.
360396615753793536,2013-07-25 13:50:23,,0,0,Twitter Web Client,@billymeltdown Congress is right 2b concerned about NSA program but we should strengthen protections/improve it not eliminate it altogether.
360396443846049792,2013-07-25 13:49:42,,0,0,Twitter Web Client,@brendantroy424 Congress is right 2b concerned about NSA program but we should strengthen protections/improve it not eliminate it altogether
360396318725783552,2013-07-25 13:49:12,,0,0,Twitter Web Client,@tmorbs Congress is right to be concerned about NSA program but we should strengthen protections &amp; improve it not eliminate it altogether.
360396253382717440,2013-07-25 13:48:57,,1,0,Twitter Web Client,@SDeysher Congress is right to be concerned about NSA program but we should strengthen protections &amp; improve it not eliminate it altogether.
360396123992629249,2013-07-25 13:48:26,,0,0,Twitter Web Client,@Nunya_Biznas Congress is right 2b concerned about NSA program but we should strengthen protections &amp; improve it not eliminate it altogether
360395848254898177,2013-07-25 13:47:20,,0,0,Twitter Web Client,@NeededPrivacy Congress is right 2b concerned about NSA program but we should strengthen protections &amp; improve not eliminate it altogether
360395444280492032,2013-07-25 13:45:44,,0,0,Twitter Web Client,@ctmommy Congress is right to be concerned about NSA program but we should strengthen protections &amp; improve it not eliminate it altogether.
360037979491807232,2013-07-24 14:05:18,,0,0,Twitter for Websites,I agree w/ WSJ editorial &amp; instead support a carefully vetted alternative prohibiting NSA from targeting Americans. http://t.co/k8kfWOIf9H
360037046695374849,2013-07-24 14:01:35,,0,0,Twitter Web Client,@KirkM0rris  I agree w/ today's WSJ editorial &amp; instead support a carefully vetted alternative prohibiting NSA from targeting U.S. citizens.
360037000629334020,2013-07-24 14:01:24,,0,0,Twitter Web Client,@sjlombardo  I agree w/ today's WSJ editorial &amp; instead support a carefully vetted alternative prohibiting NSA from targeting U.S. citizens.
360036887240511488,2013-07-24 14:00:57,,1,1,Twitter Web Client,.@tmorbs I agree w/ today's WSJ editorial &amp; instead support a carefully vetted alternative prohibiting NSA from targeting U.S. citizens.
360034776226340864,2013-07-24 13:52:34,,3,0,Twitter Web Client,.@Nunya_Biznas I will vote later this afternoon to prohibit the NSA from targeting U.S. citizens or acquiring/storing data on U.S. citizens.
359972010316668928,2013-07-24 09:43:09,,0,0,Twitter for Websites,Berkeley Heights Fire Co. Receives $100K Grant http://t.co/HcKWnWSet9 via @CranfordPatch
359661226562818050,2013-07-23 13:08:13,,1,0,Twitter for Websites,Berkeley Heights Assistance to Firefighters Grant Will Enable Unprecedented Communication http://t.co/uf2ZrNFQ0A
359434456681029635,2013-07-22 22:07:07,,0,1,Twitter for Websites,Greater Westfield Area Chamber of Commerce Hosts Women Business Owners Forum http://t.co/4i3DlMrULS
359410379736088576,2013-07-22 20:31:26,,0,0,Twitter for Websites,Congressman Leonard Lance Tours @OticonMedical Headquarters http://t.co/SlNR3xcD8Z via @sharethis
359409521321459713,2013-07-22 20:28:02,,0,0,Twitter Web Client,Thanks @GWACC_NJ for hosting this AM's forum where I learned about the many challenges facing women business owners. http://t.co/heffPr3ECX
358553737872158721,2013-07-20 11:47:27,,2,1,Twitter for Websites,@HouseCommerce is working in a bipartisan capacity to repeal the unsustainable physician payment system.http://t.co/K5yjKkd5Ec via @PSBJ
358549787722792961,2013-07-20 11:31:45,,0,0,Twitter for Websites,"The FDA user fee program is critical in ensuring timely patient access to life-saving medicines and medical devices.
http://t.co/a1GYextLNQ"
357934255952756736,2013-07-18 18:45:51,,0,0,Twitter for Websites,"Pascrell, Lance: Don’t Cut Cancer Patients’ Access to Care http://t.co/NxoJtEN2aV"
357310430047248385,2013-07-17 01:26:59,,3,5,Twitter for iPhone,I cosponsored HR 647 the ABLE Act to help ease financial strains faced by individuals with disabilities. Thx you @valmg for your advocacy.
355303909830561792,2013-07-11 12:33:47,,0,0,Twitter Web Client,House passed @USRepRodney fiscally responsible bill that invests in infrastructure projects &amp; energy solutions critical to our economy.
355057579434577922,2013-07-10 20:14:58,,0,1,Twitter Web Client,Pass the Senate immigration bill or pursue a step-by-step approach that secures our borders first? Share your views @ http://t.co/2yLkU2jDQe
355043983648497665,2013-07-10 19:20:56,,1,0,Twitter Web Client,"Obamacare: Unworkable, unaffordable, and not what the American people were promised. http://t.co/XFo4b7p7Qu"
355042844756570112,2013-07-10 19:16:25,,0,2,Twitter Web Client,Great meeting w/ those participating in this week's Bank of America Student Leadership Summit #BofAStudentLeaders http://t.co/CqCD0kzyYa
355039474369064960,2013-07-10 19:03:01,,0,0,Twitter Web Client,I had the pleasure of meeting with students of the NJ @4H. We had a great dialogue about leadership &amp; public service. http://t.co/H2zzZ9linv
354720686855565312,2013-07-09 21:56:16,,0,0,Twitter for Websites,"Rep. Leonard Lance, R-7, ‘mobile office’ to be in Watchung July 16 

http://t.co/iAFDz1UqA3"
354720463404007427,2013-07-09 21:55:23,,0,0,Twitter for Websites,"Congressman's Staff to Address Residents' Concerns in Basking Ridge, Bernardsville http://t.co/Axh4SYlgXe via @WatchungGBPatch"
351704697746370562,2013-07-01 14:11:48,,0,0,Twitter Web Client,Heidi and I send our thoughts and prayers to the families of the 19 brave firefighters who lost their lives battling wildfires in Arizona.
350640150134521856,2013-06-28 15:41:41,,0,1,Twitter for Websites,"Student Borrowers Deserve Certainty from Washington, Says Congressman Lance http://t.co/QCo01ycBKy via @WestfieldPatch"
350309952134463488,2013-06-27 17:49:35,,0,0,Twitter Web Client,Just finished speaking with @WRNJNEWSJOYCE about my efforts to stop student loan rates from doubling on July 1st. http://t.co/Lki0ydbRiR
349996413557567488,2013-06-26 21:03:42,,1,1,Twitter Web Client,Congrats to Annie Zhao of Belle Mead for representing NJ-7 at this year's Congressional Art Competition ceremony. http://t.co/7e40gSiPv4
349926708054458369,2013-06-26 16:26:43,,2,0,Twitter for Websites,I applaud the successful efforts of my friend @tonybucco to properly close the Fenimore landfill in Roxbury.  http://t.co/46hP6lGCyq
349908639491960833,2013-06-26 15:14:55,,0,0,Twitter for Websites,Congressman Lance wins award from Cancer Support Community | http://t.co/7vaZB1ppu6 http://t.co/ykzbB2TZHk
349652082212605952,2013-06-25 22:15:27,,0,0,Twitter for Websites,Congressman: N.J. to streamline economic development policies | Lehigh Valley Business http://t.co/vf19KInbF4
349237942096629760,2013-06-24 18:49:48,,1,0,Twitter Web Client,Honored to accept their Public Policy Award for Research &amp; applaud the important work they do on behalf of cancer patients &amp; their families.
349237584058257408,2013-06-24 18:48:23,,1,0,Twitter Web Client,1. What a great event with my friends at the @CancerSupportCm as they launched their Cancer Policy Institute.
349216711821627392,2013-06-24 17:25:26,,0,0,Twitter for Websites,Congratulations to my good friend &amp; colleague @USRepRodney for being awarded the Navy’s highest civilian honor.   http://t.co/WfXNNmgJuz
347458450084732929,2013-06-19 20:58:44,,0,1,Twitter for Websites,NJ pol urges ‘strong’ Israel-Turkey ties | NJJN http://t.co/EefdeMWVei
347430450987405314,2013-06-19 19:07:29,,1,0,Twitter Web Client,RT @TommyForHealth: Thank you to @RepLanceNJ7 @RepBenRayLujan @RepErikPaulsen for introducing Treat and Reduce #Obesity Act! (3/3)
347430393873575937,2013-06-19 19:07:15,,5,0,Twitter Web Client,"RT @calhealthcare: @RepLanceNJ7 ""Fighting cancer is not a partisan issue."" #cancersupport @CancerSupportCm"
347430372302270464,2013-06-19 19:07:10,,4,0,Twitter Web Client,RT @CancerSprtCNJ: Congrats to @RepLanceNJ7 for receiving the Public Policy Award for Research for his commitment to health care issues fro…
345551745667194880,2013-06-14 14:42:10,,0,0,Twitter for Websites,Service academy fair sponsored by Lance’s office June 22 at RVCC - New Jersey Hills Newspaper: Echoes Sentinel News http://t.co/usVUQC6UeR
342710798952570880,2013-06-06 18:33:16,,1,0,Twitter Web Client,I applaud @GovChristie selection of Jeff Chiesa to the U.S. Senate. Extremely well-qualified.  I look forward to working w/ Sen. Chiesa.
342629478545096706,2013-06-06 13:10:08,,2,0,Twitter Web Client,"Let us remember the courage, heroism &amp; sacrifice of all those who risked or gave their lives in the Allied invasion of Normandy 69 years ago"
342485739268886528,2013-06-06 03:38:57,,13,5,Twitter for iPhone,Moments ago I voted to stop DHS from buying millions of rounds of ammo pending a report to Congress on the need&amp;cost. http://t.co/q8sjUNValP
342394761539362818,2013-06-05 21:37:27,,1,0,Twitter Web Client,@Cl80womack @RodneyforNJ @RepStevePearce @RepPeterKing @RepNanHayworth I am a cosponsor already. -- L.L.
341605137569169409,2013-06-03 17:19:46,,1,2,Twitter Web Client,Sen. Lautenberg will always be remembered as a dedicated public servant and a tenacious fighter for New Jersey.  http://t.co/lvwdSpCa73
341143302525026305,2013-06-02 10:44:36,,0,0,Twitter for Websites,HILLSBOROUGH: Lance's pro-jobs votes recognized by U.S. Chamber of Commerce http://t.co/MIA5EyvfPu
