id,created_at,coordinates,retweets,favorite_count,source,text
820012262324862976,2017-01-13 20:58:53,,97,506,Twitter Web Client,Today we passed a resolution that gives Congress the necessary tools to repeal &amp; replace Obamacare. The American people deserve a #BetterWay
819938658019057664,2017-01-13 16:06:24,,2,4,Twitter Web Client,Looking forward to working with all the members of @HouseCommerce on our nation's most pressing #energy issues. https://t.co/WS9lSEAOMZ
819910818724769793,2017-01-13 14:15:47,,4,0,Twitter for iPhone,RT @HouseCommerce: 21 graphics showcasing states with #premium increases greater than 25%&gt;&gt; https://t.co/7EF4JdDEQF
819559758789300224,2017-01-12 15:00:47,,5,11,Twitter Web Client,America needs @AGScottPruitt to lead the EPA. Check out my op-ed about his nomination in today's @wvgazettemail https://t.co/TRbXG5zpRu #EPA
819234223735406596,2017-01-11 17:27:14,,0,3,Twitter Web Client,Please read this piece in the @WVRecord about our bill to protect the benefits of miners and their families! https://t.co/JAVAB3l9Cq #WV
819175236071518208,2017-01-11 13:32:50,,1708,0,Twitter Web Client,"RT @WVUSports: Take Me Home, Country Roads! #HailWV https://t.co/9JJGeisxOb"
819172856961650690,2017-01-11 13:23:23,,0,3,Twitter Web Client,"The @WVUhoops team upsets Baylor!!!!!!! Great job Mountaineers! #WVU #HailWVU

https://t.co/GqVNzSjSe3"
818941936593760256,2017-01-10 22:05:47,,147,0,Twitter Web Client,RT @HouseCommerce: Only 5 of 23 #Obamacare CO-OPs remain in business. There is a #BetterWay on #healthcare &gt;&gt; https://t.co/V9DCHC7DY2 https…
818822220956975106,2017-01-10 14:10:05,,0,4,Twitter Web Client,Honored to once again serve on @HouseCommerce with @repgregwalden for the 115th Congress. Let's get to work! https://t.co/4eDkEmaxTT #Energy
818617007226634240,2017-01-10 00:34:38,,4,0,Twitter for iPhone,"RT @HouseCommerce: House passes impt #publichealth bills by @reppeteolson, @michaelcburgess, @repguthrie &amp; @reprichhudson &gt;&gt; https://t.co/5…"
818544764232617985,2017-01-09 19:47:34,,1,7,Twitter Web Client,"Today, please remember to thank all the men &amp; women who fight to keep our neighborhoods &amp; communities safe. #LawEnforcementAppreciationDay"
818183476797145090,2017-01-08 19:51:56,,5,29,Twitter for iPhone,Steelers are getting it done.  Wind chill makes it 2 degrees....OMG where are my toes? https://t.co/OAjJPrJLpa
818154105461997570,2017-01-08 17:55:13,,1,0,Twitter for iPhone,"RT @RepMcKinley: Our son hosting us at the Steeler playoff game . 14 degrees; Mary, our grandson and I are bundled up.....w/ terrible towel…"
818150044708773888,2017-01-08 17:39:05,,1,12,Twitter for iPhone,"Our son hosting us at the Steeler playoff game . 14 degrees; Mary, our grandson and I are bundled up.....w/ terrible towels.  ""Here we go.."""
817884343112699907,2017-01-08 00:03:17,,0,12,Twitter for iPhone,Mary and I are celebrating Serbian Christmas with our friends in Wheeling.  Great food and laughter.
817800687643926529,2017-01-07 18:30:52,,0,1,Twitter Web Client,Let's go Mountaineers! https://t.co/tHOo7p0Hh4
817720695794843648,2017-01-07 13:13:01,,4,6,Twitter Web Client,Read today's @IntelligencerWV piece about my plan to ensure our miners keep their hard earned benefits! #Miners #WV https://t.co/itOvisL52P
817478335047618563,2017-01-06 21:09:57,,0,8,Twitter Web Client,Very sorry to hear the news in Florida. My thoughts &amp; prayers are with the victims &amp; their families. This violence must stop. #FtLauderdale
817475896206589953,2017-01-06 21:00:16,,2,5,Twitter Web Client,Thank you! Looking forward to working with @RepShimkus and the rest of @HouseCommerce for the 115th Congress.… https://t.co/XcLyJauXB7
817149721324220416,2017-01-05 23:24:10,,12,40,Twitter Web Client,"I proudly support a resolution reaffirming our longstanding friendship with Israel, a strong partner for freedom and peace. #Israel #Peace"
817098577516392449,2017-01-05 20:00:56,,1,5,Twitter Web Client,The #REINSAct guarantees approval by the people's representatives for costly regulations coming from the federal gov't. #accountability
817019565112786946,2017-01-05 14:46:58,,0,3,Twitter Web Client,Our miners should keep the benefits they've earned! Let's get our bill passed so they have the peace of mind they d… https://t.co/5ndriHjb8c
816792550291996672,2017-01-04 23:44:53,,929,0,Twitter for iPhone,RT @SpeakerRyan: BREAKING NEWS→ The House just moved to block President Obama from issuing ANY new regulations before leaving office. https…
816720040636596224,2017-01-04 18:56:46,,2,7,Twitter Web Client,Read @DylanBrown26 - Our coal miners helped build this country! Let's get this bill to the floor &amp; signed into law!  https://t.co/mWmLabT1LN
816707059626475525,2017-01-04 18:05:11,,69,269,Twitter Web Client,We must always support America's veterans! https://t.co/w5d8qh7cq7
816653491187908609,2017-01-04 14:32:19,,2,6,Twitter Web Client,"In the 115th Congress, we will continue to offer the American people a #BetterWay on Healthcare. #healthcare https://t.co/sa4bqgYhL0"
816415467699052544,2017-01-03 22:46:30,,1,6,Twitter Web Client,Let’s not kick this can down the road any longer. We need to come together &amp; pass this bill to protect our hardwork… https://t.co/XNFJu1QUVi
816408950602158080,2017-01-03 22:20:36,,2,4,Twitter Web Client,Our miners deserve the benefits they earned! Read about our bill to protect miner pensions and healthcare. https://t.co/XDiWVviqMO #Coal #WV
816407270288461826,2017-01-03 22:13:56,,2,6,Twitter Web Client,Our miners deserve the benefits they earned! Read about our bill to protect miner pensions &amp; healthcare. https://t.co/XDiWVviqMO #Coal #WV
816365569373044737,2017-01-03 19:28:13,,9,27,Twitter Web Client,"Congrats to new members of Congress. Let's work together to grow jobs, lower healthcare costs, fight poverty, &amp; strengthen nat'l security."
815284327063949312,2016-12-31 19:51:45,,1,9,Twitter for iPhone,Wishing everyone a happy and healthy new year!  Best of luck in 2017! #NewYear #2017
814917634579955712,2016-12-30 19:34:39,,1,11,Twitter Web Client,Congratulations to the Frankfort High School Band for being chosen to perform at the Presidential Inauguration! They will make WV proud! #WV
814819984530673665,2016-12-30 13:06:37,,1,6,Twitter Web Client,ICYMI: A @WVRecord piece about our work on coal ash legislation. We helped protect thousands of jobs! https://t.co/YM5dtDuvXv #Coal #CoalAsh
814508619177803776,2016-12-29 16:29:22,,266,0,Twitter for iPhone,"RT @SpeakerRyan: #GoodNews travels slow, especially coming out of Washington, so here’s a quick look back at things you may have missed. #Y…"
814237127080902656,2016-12-28 22:30:33,,185,0,Twitter for iPhone,RT @WVUfootball: The @WVUMarchingBand in the state formation here in Orlando! #HailWV https://t.co/pAYayJDhPQ
814113707970199552,2016-12-28 14:20:08,,1,3,Twitter Web Client,Let's go @WVUfootball!!!! #HailWV #WVU #WVUfootball #WVU125 https://t.co/79itoKhdxp
814100850566107136,2016-12-28 13:29:02,,0,7,Twitter Web Client,Big day today for @WVUfootball !!! Good luck! Beat those Hurricanes! Let's go Mountaineers! https://t.co/qAzR57amjr #WVU #Football
813516612221497344,2016-12-26 22:47:29,,0,8,Twitter Web Client,Fired my grandfather's vintage shotgun at the range. It hadn't been fired in nearly 100 years.  Still got its punch! https://t.co/LhSqukeQR2
813508649700233220,2016-12-26 22:15:51,,2,22,Twitter for iPhone,Started the day after Christmas splitting a half cord of logs then off to the shooting club with my son and grandson.  Families are great...
813100240442183680,2016-12-25 19:12:58,,3,13,Mobile Web (M5),"Merry Christmas, everyone! Enjoy the holiday! #Christmas"
812685556580761601,2016-12-24 15:45:10,,5,9,Twitter Web Client,Happy Hanukkah to everyone who celebrates! #Hanukkah
812478841230913537,2016-12-24 02:03:45,,7,14,Twitter Web Client,Very disappointed with Obama admin. Israel is one of our strongest partners for peace and freedom. https://t.co/4S9o8nABYM #Israel #Peace
812338025074225152,2016-12-23 16:44:12,,0,3,Twitter Web Client,#CuresNow https://t.co/YSQMjIkwVi
812022564251992064,2016-12-22 19:50:40,,0,3,Twitter Web Client,"Glad to see that a vote on a draft UN Security Council resolution, critical of Israel, has been postponed. https://t.co/6O2hKhBMfC #Israel"
811941986009804800,2016-12-22 14:30:29,,0,1,Twitter Web Client,Read this op-ed by the @IntelligencerWV about the Stream Protection Rule. It's simply an attack on working families! https://t.co/5NuJ2aGiAB
811689324844462080,2016-12-21 21:46:30,,1,12,Twitter Web Client,Mary and I visited the Children's Home of Wheeling earlier. We are so grateful for all of their work on behalf of W… https://t.co/0WWhuJL1WI
811636011054809088,2016-12-21 18:14:39,,3,3,Twitter Web Client,"@AGScottPruitt will be very strong at the EPA. To learn more about him, visit https://t.co/pyGjmFIFLP #ConfirmPruitt"
811605945386237956,2016-12-21 16:15:10,,3325,0,Twitter for iPhone,"RT @SpeakerRyan: President Obama is in office for only 1 more month, and he’s already rolling out his last-ditch regulations. So here’s a f…"
811325442733068288,2016-12-20 21:40:33,,0,2,Twitter Web Client,Thank you @NASAIVV for hosting today. Grateful for all your hard work! https://t.co/Xrfi1gP3KZ
811314415689678849,2016-12-20 20:56:44,,2,2,Twitter Web Client,Visited @NASAIVV in Fairmont today &amp; met with several top officials. We must continue to support the program's pres… https://t.co/BtERYoGSso
811219536934539264,2016-12-20 14:39:43,,2,5,Twitter Web Client,Great editorial in @NewsandSentinel about the Admin's outrageous attack on coal miners &amp; their families with SPR. https://t.co/7J4DrUERsY
810987498675535872,2016-12-19 23:17:41,,1,4,Twitter for iPhone,Terrible news out of Germany. The world must unite to defeat terrorism. Praying for all the victims of this horrible attack. #peace
810968692481781765,2016-12-19 22:02:58,,5,0,Twitter Web Client,"RT @HouseCommerce: On the #Path2Cures, there was one young advocate who was there every step of the way &gt;&gt; https://t.co/fMQYVOwCa3 #CuresNow"
810873211613224960,2016-12-19 15:43:33,,2,6,Twitter Web Client,The SPR is an outrageous attack on coal miner families by a lame duck Obama Administration and we will fight to stop it. #Coal #SPR #WV
810559960543272960,2016-12-18 18:58:48,,0,6,Twitter Web Client,"Congrats to @CoachHuggs on his 800th win! Great job, Coach! Let's go Mountaineers! https://t.co/7lIDDWsABJ #basketball #WVU"
809907769646215168,2016-12-16 23:47:14,,17,0,Twitter for iPhone,"RT @HouseCommerce: #Obamacare: runaway premiums, collapsing CO-OPs &amp; everything in between. @HouseGOP has a #BetterWay &gt;&gt; https://t.co/wooO…"
809886198533685253,2016-12-16 22:21:31,,2,4,Twitter Web Client,The WIIN Act was signed into law! Read about an important provision that will protect jobs &amp; keep energy prices low. https://t.co/eK1roUzqpu
809877395272597508,2016-12-16 21:46:32,,0,2,Twitter Web Client,Best of luck to @CoachHuggs and @WVUhoops tomorrow! Go get that 800th win Coach! https://t.co/K3So6zBm7t #WVU #Basketball #NCAA
809760755486703616,2016-12-16 14:03:03,,0,1,Twitter Web Client,Will be joining @radiomonroe in just a few minutes! Tune in! https://t.co/MxSUFnG6BJ
809426802552827904,2016-12-15 15:56:02,,4,1,Twitter Web Client,Read about the Coal Caucus priorities &amp; opportunities in the next Congress. https://t.co/4x5Tgp5u2O  @CoalCoats #Coal #WestVirginia #Reform
809197665338724352,2016-12-15 00:45:32,,35,0,Twitter for iPhone,"RT @HouseGOP: Millions of Americans have suffered under #Obamacare. It's time to put patients &amp; doctors at the center of health care, not D…"
809150889923608576,2016-12-14 21:39:40,,6,0,Twitter Web Client,RT @HouseCommerce: .@NIH ldrs on #CuresNow: Congress has provided an enormous gift to science in the form of the #CuresAct &gt;&gt; https://t.co/…
809104499218518016,2016-12-14 18:35:19,,0,3,Twitter Web Client,I will always fight on behalf of our coal miners &amp; their families. They deserve to get the benefits they earned! https://t.co/GPn1g9jQuM
809046549602926593,2016-12-14 14:45:03,,1,0,Twitter Web Client,"Joining Mike Queen, guest host of ""Talkine"" this morning at 10:33 AM! Tune in!  https://t.co/6PRIJdec50"
808773311031312384,2016-12-13 20:39:18,,8,11,Twitter Web Client,"The 21st Century Cures Act has been signed! Congrats to @RepFredUpton, @HouseCommerce &amp; everyone else who worked so… https://t.co/npzSpo8Sdm"
808707761383084036,2016-12-13 16:18:50,,31,0,Twitter for iPhone,RT @HouseCommerce: #CuresIn4Words: Today is the day! WATCH @POTUS sign #CuresNow into law at 2:30pm EST &gt;&gt; https://t.co/2Egj3U4rl0
808408364954816512,2016-12-12 20:29:08,,1,0,Twitter for iPhone,"RT @HouseCommerce: Via the @IntelligencerWV on #CoalAsh, “…@repmckinley deserves high commendation for taking a stand on the issue.” &gt;&gt; htt…"
808387558812094468,2016-12-12 19:06:27,,0,2,Twitter Web Client,Read about our efforts to protect jobs and allow states to implement their own coal ash permit program. https://t.co/eK1roUzqpu #CoalAsh #WV
808365408122179584,2016-12-12 17:38:26,,165,0,Twitter for iPhone,RT @WVUhoops: WVU up to No. 12 in this week's Associated Press poll. https://t.co/tKvVRbIx99
808335448091328514,2016-12-12 15:39:23,,0,4,Twitter Web Client,"Congressman Hechler was a veteran, public servant, and proud Mountaineer. He will be sorely missed. #WestVirginia

https://t.co/nWlKKpRSqS"
807640574706663424,2016-12-10 17:38:12,,0,4,Twitter Web Client,ICYMI: The House passed the WIIN Act! The bill will protect thousands of jobs &amp; allow states to implement their own… https://t.co/UQdH0JXtTo
807026703906328577,2016-12-09 00:58:54,,6,12,Twitter Web Client,Met with members of @MineWorkers today. We must commit ourselves to a long-term solution to protect their benefits. https://t.co/V5VOSkcOW6
806981074312118272,2016-12-08 21:57:35,,2,8,Twitter Web Client,Very sorry to hear about Senator John Glenn. He was a great American and will be sorely missed. My thoughts and prayers are with his family.
806979212003438592,2016-12-08 21:50:11,,0,3,Twitter Web Client,"Thank you for your leadership, @NRECAJim !"
806970700426842112,2016-12-08 21:16:22,,0,3,Twitter Web Client,Thank you @NRECANews for all of your hard work! #WIIN https://t.co/YKYvU7rqvj
806959333703565313,2016-12-08 20:31:12,,1,5,Twitter Web Client,We can't turn our backs on coal miners. We need a long-term solution to prevent them from losing their healthcare. https://t.co/JUM0VNqcnf
806899902617972736,2016-12-08 16:35:02,,0,3,Twitter for iPhone,Speaking to @TAUCbuilt this morning about regulatory relief and economic growth. Let's unleash our workforce. #jobs… https://t.co/MGxZO7MY2o
806586811753459714,2016-12-07 19:50:56,,4,4,Twitter Web Client,#21stcenturycures is now on its way to the President's desk! #CuresNow #healthcare https://t.co/xjaw2KrTx6
806487345444880384,2016-12-07 13:15:41,,4,8,Twitter Web Client,"It is #PearlHarborRemembranceDay, a time to salute the brave Americans we lost 75 years ago. May we never forget th… https://t.co/lGGx7oX8kY"
806473433928318976,2016-12-07 12:20:24,,186,0,Twitter for iPhone,"RT @SpeakerRyan: Thanks to this bill, President-elect Trump will have the opportunity to reevaluate our #Iran policy. https://t.co/eNTpK5fH…"
806167185752199168,2016-12-06 16:03:29,,27,92,Twitter for iPhone,This photo hangs in my office as a reminder of all the hard work put in by America's coal miners. #NationalMinersDay https://t.co/HCoNswrunj
806138702929993728,2016-12-06 14:10:18,,5,4,Twitter Web Client,Today we remember the 361 brave souls who lost their lives in the Monongah coal mine disaster. https://t.co/W2vjLPZHuV #WestVirginia #Coal
805898157859237889,2016-12-05 22:14:28,,1,3,Twitter Web Client,Read @editor_wvtel from @WVTelegram. I am proud to stand up for coal miners and their families! https://t.co/RafATmlW7q #WV #Coal
805877105603080192,2016-12-05 20:50:49,,2,3,Twitter Web Client,Good luck tonight to @GSCpioneers!!!! https://t.co/U6Q1KyuUmf
805857854167089152,2016-12-05 19:34:19,,4,3,Twitter Web Client,It is important that our state and federal leaders build a bridge that will allow us to work together and achieve o… https://t.co/AxGnhm0ceb
805581837422784512,2016-12-05 01:17:31,,1,4,Twitter Web Client,What an incredible year! So proud of @wvuwomenssoccer !!!! #HailWV https://t.co/bBMR4E9Nr9
805579030300950529,2016-12-05 01:06:22,,4,14,Twitter for iPhone,Thanks WVU's women soccer team.....you made us proud.
805571825514188800,2016-12-05 00:37:44,,3,10,Twitter Web Client,It's all tied up!!!! 1-1! https://t.co/hPZa5Dqk0N
805529170075914240,2016-12-04 21:48:14,,478,0,Twitter Web Client,RT @SpeakerRyan: RT to agree → It's time our troops got a well-deserved raise. https://t.co/ws4OTCDRzR https://t.co/ptBuZmJKtq
805478261706915840,2016-12-04 18:25:57,,190,0,Twitter for iPhone,RT @wvuwomenssoccer: Tonight....we play for the trophy! #HailWV  https://t.co/MyqJgg4nO5
805244526071808000,2016-12-04 02:57:10,,2,12,Twitter for iPhone,"Great day to be a Mountaineer: wins in football, basketball and women's soccer.  Go 'Eers...."
805133600349966337,2016-12-03 19:36:23,,2,4,Twitter Web Client,Let's go Mountaineers! @WVUfootball #HailWV https://t.co/pwgrfbbR72
805133245994168320,2016-12-03 19:34:59,,27,87,Twitter Web Client,We are committed to offering a #BetterWay for the American people. https://t.co/sD3R5sriAP
804844758740963330,2016-12-03 00:28:38,,2262,0,Twitter for iPhone,"RT @wvuwomenssoccer: MOUNTAINEERS WIN!!! For the first time in program history, WVU will play for a national title!! 1-0 the final over UNC…"
804844346273099776,2016-12-03 00:27:00,,7,0,Twitter for iPhone,RT @RepMcKinley: Has it sunk in?  Our women's soccer team just defeated perennial powerhouse North Carolina and will be playing for a NATIO…
804843045053153281,2016-12-03 00:21:49,,7,26,Twitter for iPhone,Has it sunk in?  Our women's soccer team just defeated perennial powerhouse North Carolina and will be playing for a NATIONAL CHAMPIONSHIP
804839455307788289,2016-12-03 00:07:33,,5,9,Twitter for iPhone,First time since 1958 (basketball) WVU plays for a national championship other than our rifle team's trophies.
804837911170531328,2016-12-03 00:01:25,,2,2,Twitter for iPhone,Can our women Mountaineers hold for these final 2 minutes?  They are incredible...soccer rules
804733697895366657,2016-12-02 17:07:19,,3,3,Twitter Web Client,Let's go Mountaineers!!!! Good luck! @wvuwomenssoccer https://t.co/Ox1Eh3OTxU
804728295447269376,2016-12-02 16:45:51,,28,97,Twitter Web Client,We just passed #2017NDAA. Strengthening our national defense is a key part of the @HouseGOP #BetterWay agenda.… https://t.co/GIieupgUtz
804694492389511168,2016-12-02 14:31:32,,2,7,Twitter Web Client,"Our brave troops deserve a pay raise! Today, the House will pass #FY17NDAA and do just that! https://t.co/sqB6SKZmzq"
804367509570879488,2016-12-01 16:52:13,,18,0,Twitter Web Client,RT @USAgov: Today is #WorldAIDSDay. Find information and resources with @AIDSgov: https://t.co/OCD4bXW88G https://t.co/7ILgPNfs1L
804331629095297026,2016-12-01 14:29:38,,4,3,Twitter Web Client,"Over 36 million people around the world live with #HIV/#AIDS. On #WAD2016, let’s renew our commitment to quality care &amp; treatment."
804112384512192513,2016-11-30 23:58:26,,0,7,Twitter Web Client,We did it! Thank you @RepFredUpton for your leadership on this issue! #CuresNow #mentalhealth #opioids #cures… https://t.co/I2Fps6g4c6
804062945776992258,2016-11-30 20:41:59,,6,6,Twitter Web Client,Let's personalize medicine to identify the best treatments. #CuresNow #21stCenturyCures #RecordofSuccess… https://t.co/ipQBcacMsE
804038764662321153,2016-11-30 19:05:54,,1,5,Twitter Web Client,ICYMI  #GivingTuesday - WV was ranked one of the most charitable states in the U.S. #8 for volunteering &amp; service! https://t.co/fsOB5k9RPi
803962443135414272,2016-11-30 14:02:38,,14,10,Twitter Web Client,"Today, we will pass #21stcenturycures - a landmark bill that will increase funding for medical research and fight… https://t.co/RMrDqy7J9X"
803962079971602432,2016-11-30 14:01:11,,1,3,Twitter Web Client,Go Mountaineers! @wvuwomenssoccer https://t.co/rdWxqk5MTO
803742833706467329,2016-11-29 23:29:59,,2,4,Twitter Web Client,Investing in medical research will allow America to remain a world leader in scientific discoveries. #CuresNow https://t.co/KKBTEygR0d
803721117202522113,2016-11-29 22:03:41,,6,0,Twitter Web Client,RT @HouseCommerce: #CuresNow ensures US has tools to remain a global leader in #medical #innovation &gt;&gt; https://t.co/RCXgXEvljq https://t.co…
802634045469257728,2016-11-26 22:04:03,,1,8,Twitter for iPhone,"OK, the WVU women soccer team wins and moves on to the Final Four.  Congratulations..."
802590428981760000,2016-11-26 19:10:44,,0,6,Twitter for iPhone,Come to Dlesk and watch #1 WVU women beat #5 Duke in soccer but bring your cell phone to track WVU over Iowa State in football
802558582025654273,2016-11-26 17:04:11,,339,0,Twitter Web Client,RT @WVUfootball: Today's uniform combo at Iowa State. #HailWV https://t.co/3d0DWDOPLr
802558225782636544,2016-11-26 17:02:46,,117,0,Twitter Web Client,RT @wvuwomenssoccer: IT'S GAME DAY!! No. 1 WVU vs. No. 5 Duke in the NCAA Tournament quarterfinal! Come out to DDSS and cheer on your Mount…
802553922204434433,2016-11-26 16:45:40,,0,12,Twitter Web Client,The people of Cuba have suffered under the oppressive Castro regime. I'm hopeful they can one day live in freedom. #Cuba
802519943652618241,2016-11-26 14:30:39,,1,2,Twitter Web Client,Today is #SmallBizSat. Please consider supporting a small business in your community as you start your holiday shop… https://t.co/5RsCbl79So
801783961110409216,2016-11-24 13:46:07,,1,13,Twitter Web Client,"Mary &amp; I want to wish everyone a happy #Thanksgiving! As Americans, we should all be thankful to live in the greatest country on earth."
801450788627288064,2016-11-23 15:42:12,,3,8,Twitter Web Client,"Remember to check out the Pride of West Virginia, the @WVUMarchingBand in tomorrow's Macy's Thanksgiving Day Parade! https://t.co/iwwAdevWMv"
801176487181197312,2016-11-22 21:32:14,,57,0,Twitter Web Client,"RT @HouseForeign: .@SpeakerRyan, @GOPLeader, @RepEdRoyce ask POTUS to halt any plans for new concessions to Iran https://t.co/xKdsmpymEP"
801122883384774656,2016-11-22 17:59:14,,0,2,Twitter Web Client,@WheelingJesuit Thanks for having me! Hope to see you again soon!
801076216388263937,2016-11-22 14:53:47,,2,2,Twitter Web Client,Read the @IntelligencerWV about our work with the Ohio Valley Research Consortium. #Opioids #jobs #CyberSecurity https://t.co/HVJJNqGPOt
800787167794626560,2016-11-21 19:45:13,,2,9,Twitter Web Client,Had a great time speaking with a group of political science students from @WheelingJesuit today! Thanks for being s… https://t.co/PdT4OtpIYj
800757066558218241,2016-11-21 17:45:36,,0,3,Twitter Web Client,The @wvuwomenssoccer team keeps on rolling! Great job! #soccer #WVU !!! https://t.co/MCtUSO6phZ
800006989300502528,2016-11-19 16:05:04,,1,6,Twitter Web Client,Big game tonight! Let's go Mountaineers!!!! @WVUfootball #WVU125 #WestVirginia https://t.co/AHuTwctsWn
800006471924781056,2016-11-19 16:03:00,,0,5,Twitter Web Client,Big win last night for @wvuwomenssoccer !!!! #soccer https://t.co/4TYmHQljGK
799653771051696128,2016-11-18 16:41:30,,2,4,Twitter Web Client,The U.S. Surgeon General's report details what we've been emphasizing for months - we need to fight substance abuse! https://t.co/Lh7yAJWQXq
799623952859418628,2016-11-18 14:43:01,,2,4,Twitter Web Client,Will be joining @HoppyKercheval at 10:30 AM to discuss the election &amp; our priorities in Congress. Listen in! https://t.co/KjimQF6bR9
799365117087346688,2016-11-17 21:34:30,,5,5,Twitter Web Client,We can win this battle if we fight it together. #CuresNow #PancreaticCancer https://t.co/pnSwO4QnA5
799288085142007808,2016-11-17 16:28:24,,5,10,Twitter Web Client,It is National Rural Health Day. Let's work together to bring quality #healthcare services to small towns &amp; rural c… https://t.co/fWAkuqGvP7
799267253351022592,2016-11-17 15:05:37,,1,4,Twitter Web Client,Great to hear from @mike_pence this morning. The Trump admin &amp; @HouseGOP will work together &amp; produce a #BetterWay… https://t.co/OU4Vi3WSCC
798960435202494464,2016-11-16 18:46:26,,34,105,Twitter Web Client,We will continue to present a positive vision for our nation &amp; advocate ideas that will allow more people to achiev… https://t.co/RiQj4EH0IW
798902674410340352,2016-11-16 14:56:55,,351,0,Twitter Web Client,"RT @WestVirginiaU: The @WVUMarchingBand is performing in the Macy's Thanksgiving Day Parade next week, and @gordongee wants to go, too! htt…"
798630359244087296,2016-11-15 20:54:50,,23,0,Twitter Web Client,RT @HouseForeign: The Iran Sanctions Act is central to protecting America from Iran’s threatening behavior https://t.co/0MPPu8ZMal
798591541522694144,2016-11-15 18:20:35,,0,7,Twitter Web Client,Fighting pancreatic cancer is a battle we need to fight together. #path2cures #TurnItPurple #Cures https://t.co/bu74SlaYaI
798544407695757312,2016-11-15 15:13:17,,20,0,Twitter Web Client,RT @fsufalcons: Falcons Climb To No. 18 In AFCA Poll https://t.co/HsyevHGMw7
798538155297308672,2016-11-15 14:48:27,,0,2,Twitter Web Client,Excited to see @_FalconFootball in the DII playoffs! Go Falcons! https://t.co/X6Irz53nCL #Football #CollegeFootball #Relentless
798251347401469952,2016-11-14 19:48:46,,46,114,Twitter Web Client,We will continue to offer the American people a #BetterWay to peace and prosperity. https://t.co/S04Q90T1BM
798241139623006208,2016-11-14 19:08:12,,2,4,Twitter Web Client,Today we remember the 75 men and women from @marshallu who tragically lost their lives 46 years ago. #WeAreMarshall
