id,created_at,coordinates,retweets,favorite_count,source,text
420989876348006400,2014-01-08 18:46:22,,1,0,Twitter Web Client,"Rep. McKinley meets with Matthew Ridgway, a recent graduate of the WVU College of Engineering, in his D.C. office. http://t.co/P43JaFl6AI"
420979190330957824,2014-01-08 18:03:55,,0,0,Twitter Web Client,Rep. McKinley is an original co-sponsor of the Health Exchange Security and Transparency Act.  http://t.co/kFkwjEjRMM
420977170295443456,2014-01-08 17:55:53,,1,0,Twitter Web Client,Obama Administration has been painfully short on #transparency when it comes to #Obamacare implementation. House demanding answers.
420964491719766017,2014-01-08 17:05:30,,1,0,Twitter Web Client,"A record 47M Americans receive food stamps, about 13M more than when the President took office. http://t.co/HFjwiqL5bQ"
420930135294898177,2014-01-08 14:48:59,,1,0,Twitter Web Client,Report: more production in western states may mean a better year for the coal industry.  http://t.co/7g4yHk2wdQ
420928301746515968,2014-01-08 14:41:42,,1,0,Twitter Web Client,"A Triadelphia, W.Va. farmer is set to compete in a national contest.  Good luck Kacey Orr!  http://t.co/dUJVVc9XpH"
420608209267617792,2014-01-07 17:29:46,,9,0,Twitter Web Client,Looking for #BipartisanSuccess in Congress? Look no further than @HouseCommerce last year: http://t.co/mTvNsN7fY1
420585519609692160,2014-01-07 15:59:36,,1,0,Twitter Web Client,The Obama admin claimed user information on http://t.co/Z0YsxQtT5x would be secure http://t.co/FkOBp8eK8V #BrokenPromises
420583627454283777,2014-01-07 15:52:05,,0,0,Twitter Web Client,The WV Air National Guard's first commanding officer is being honored with the guard's air base bearing his name. http://t.co/zujEsmlubE
420578996623925248,2014-01-07 15:33:41,,4,0,Twitter Web Client,"In 5 states alone, http://t.co/Z0YsxQtT5x has about 104k people still waiting to be enrolled in public programs. http://t.co/N18XbacDC1"
420563786144051200,2014-01-07 14:33:14,,1,1,Twitter Web Client,The jobs bills on .@SenatoReid's desk continue to pile up http://t.co/cEA3YggRtQ #VoteNow
420299098877476865,2014-01-06 21:01:28,,1,0,Twitter Web Client,Extremely cold temperatures are on the way. Here's some helpful information to keep your pipes from freezing.  http://t.co/PFUM0lldPB
420297500096864256,2014-01-06 20:55:07,,1,0,Twitter Web Client,"A big honor for Alderson-Broaddus University.  Congratulations!  To learn more, click here: 
http://t.co/qoWMxzdwuC"
418801504858820608,2014-01-02 17:50:34,,3,0,Twitter Web Client,Buck Harless was an icon and a self-made man who became a towering figure in business and philanthropy in WV. http://t.co/CrLX7IrnnP
415667219402465280,2013-12-25 02:16:02,,2,1,Twitter Web Client,"From the McKinley family to yours, we wish all of you a very Merry Christmas and a healthy and prosperous New Year! http://t.co/8qlGkVF9ty"
414880424146796544,2013-12-22 22:09:35,"{u'type': u'Point', u'coordinates': [-76.94158151, 38.95338193]}",3,5,Twitter for iPhone,Mary and Rep. McKinley cheer on their Mountaineers in Morgantown as WVU takes on Purdue at the Coliseum. http://t.co/5bGYFVHFzB
414857406825639936,2013-12-22 20:38:08,"{u'type': u'Point', u'coordinates': [-79.98528779, 39.65436801]}",3,0,Twitter for iPhone,Great to be in Morgantown-disappointing end to WVU game.
414147705888178176,2013-12-20 21:38:02,,5,1,Twitter Web Client,"To Jon Stewart @DailyShowJon and the staff of the Daily Show, have a very ""mustache"" Christmas from Team McKinley! http://t.co/mghi2WkKCV"
414090112952041472,2013-12-20 17:49:11,,2,0,Twitter Web Client,The Obama Administration announces yet another exemption on the failing Affordable Care Act. http://t.co/tPC6M5xClW
413756357628547072,2013-12-19 19:42:57,,1,0,Twitter Web Client,Operation Welcome Home in WV  provides temporary employment and support for veterans.  Here's how you can help.  http://t.co/8dEkTlWOJN
413752273836052480,2013-12-19 19:26:44,,1,0,Twitter Web Client,Rep. McKinley conducts this veteran's roundtable at the Clarksburg American Legion in Clarksburg on Thursday. http://t.co/e5YE76IhCl
413722892971413504,2013-12-19 17:29:59,,1,0,Twitter Web Client,Rep. McKinley meets with members of the Pleasant Valley Volunteer Fire Department for a roundtable on Thursday. http://t.co/EtJfHNiBSp
413711331770892290,2013-12-19 16:44:02,,1,0,Twitter Web Client,"Rep. McKinley tours the new FBI Center in Clarksburg, WV. Here, he learns about new methods in logging fingerprints. http://t.co/uFtAvJH2aS"
413710795168423937,2013-12-19 16:41:54,,0,0,Twitter Web Client,"Rep. McKinley tours the new Federal Bureau of Investigation (FBI) Center in Clarksburg, WV."
413693121004707840,2013-12-19 15:31:40,,1,1,Twitter Web Client,"Rep. McKinley talks with Fred Marsh, owner of Marsh's Supply Store in Weirton, about harmful EPA regulations. http://t.co/zSkvopli5s"
413333333376905216,2013-12-18 15:42:00,,2,0,Twitter Web Client,"Our thoughts and prayers go out to the family of Jim Smith, a wonderful person and a great journalist.   http://t.co/zLMx4q4wMw"
413062048105238528,2013-12-17 21:44:01,,0,0,Twitter Web Client,Neurologists with the American Academy of Neurology at WVU Hospital pose with Rep. McKinley after a tour. http://t.co/GLvDuaUnAu
413054028486934528,2013-12-17 21:12:09,,0,0,Twitter Web Client,"Rep. McKinley meets with Dr. David Watson, a New Martinsville native, at the WVU Headache Center in Morgantown. http://t.co/imdgxYoceT"
413030596378513408,2013-12-17 19:39:02,,1,0,Twitter Web Client,"45 states still haven’t hit 10% of enrollment goals for Obamacare. In West Virginia, it’s 775. The goal is 24,000.http://t.co/5C9iwjUbYi"
413029016606498817,2013-12-17 19:32:46,,0,0,Twitter Web Client,Rep. McKinley listens to veteran's concerns at this roundtable at the Gen. Daniel Morgan VFW Post 548 in Morgantown. http://t.co/nPkHzOOLke
413022088195104768,2013-12-17 19:05:14,,1,0,Twitter Web Client,A 9-year-old in the Big Brothers program shows off the gift he received from one of Rep. McKinley's staff members. http://t.co/RljeIj63b6
412984352671162368,2013-12-17 16:35:17,,5,1,Twitter Web Client,"#Obamacare’s #BrokenPromises are leaving more Americans without health care on Jan. 1, 2014 than who had coverage a year ago."
412979823414226944,2013-12-17 16:17:17,,2,0,Twitter Web Client,Rep. McKinley joins employees with Mapleshire Nursing Home and Rehab Center in WV to break ground for new expansion. http://t.co/G3l7wuKitf
412941503745372160,2013-12-17 13:45:01,,1,0,Twitter Web Client,Rep. McKinley talks with Wheeling area physicians after they are named to serve in the Ohio Co. Medical Society. http://t.co/YJuGFVIs61
412936793676201984,2013-12-17 13:26:18,,1,0,Twitter Web Client,Rep. McKinley meets with children with juvenile diabetes Monday to hear their personal stories at Wheeling Hospital. http://t.co/YnMh92yoYD
412577880854388738,2013-12-16 13:40:06,,3,0,Twitter Web Client,"Join Rep. McKinley ""live"" on the Howard Monroe Show this morning beginning at 9:05 on WKKX AM 1600 in Wheeling. http://t.co/5U66uUmMU2"
411289053577748480,2013-12-13 00:18:46,,3,0,Twitter Web Client,This deal reverses some of the progress we’ve made. It increases spending for the next two years but promises to save money in the future.
411288866998321152,2013-12-13 00:18:01,,2,1,Twitter Web Client,"Rep. McKinley: Don’t Reverse Progress on Cutting Spending.  To read more on tonight's budget vote, click here: http://t.co/pRzIp2gwQR"
411142219500748800,2013-12-12 14:35:18,,1,2,Twitter Web Client,57% of millennials disapprove of Obamacare http://t.co/rVDzsP7eeJ #BrokenPromises
410866272105017344,2013-12-11 20:18:47,,4,0,Twitter Web Client,"Rep. McKinley meets with Teewende Sandwidi, a refugee from Burkina Faso, who now lives in Morgantown. http://t.co/YR2qPjV5Vu"
410822558443765761,2013-12-11 17:25:05,,4,1,Twitter Web Client,-#Obamacare adding stress and financial strain on college students. #BrokenPromises http://t.co/jlG75WU5qc
410816058484719616,2013-12-11 16:59:15,,1,0,Twitter Web Client,The Administration is still well behind its original enrollment goal #WhatsNext http://t.co/biGHbCLCnZ
410782483043475456,2013-12-11 14:45:50,,0,0,Twitter Web Client,What would you ask Secy Sebelius about Obamacare? http://t.co/XvQZjR6Dep Tweet us using #AskSebelius
410551252871688192,2013-12-10 23:27:01,,1,0,Twitter Web Client,Two-year budget agreement would avoid government shutdown in January.  Here are some details: http://t.co/T2UMS3IpHE
410551032456826880,2013-12-10 23:26:08,,1,0,Twitter Web Client,House and Senate negotiators have reached agreement on an $85 billion package to fund the government past Jan. 15th. http://t.co/SeTgfJLKiu
410455243734806528,2013-12-10 17:05:30,,0,0,Twitter Web Client,Rep. McKinley meets with members of the Lung Cancer Alliance at WVU to discuss life-saving lung cancer screenings. http://t.co/Smqu3f0Kxp
410446267987152897,2013-12-10 16:29:50,,2,0,Twitter Web Client,"Another successful Energy Forum at WVU on Monday.  To read more, click here. http://t.co/ElFSVP64th"
410445106974441472,2013-12-10 16:25:13,,1,1,Twitter Web Client,"You can’t keep your health care, your doctor, and now, your prescription, under #Obamacare. #BrokenPromises http://t.co/5WiOIS0ZWQ"
410097617448611840,2013-12-09 17:24:26,,1,1,Twitter Web Client,WBOY TV in Clarksburg interviews Rep. McKinley following Monday's second annual Energy Summit at WVU. http://t.co/RdtpVG6O3M
410082752856211456,2013-12-09 16:25:22,,1,1,Twitter Web Client,"""WVU is on the cutting edge of energy, not only with its own work, but also in proximity with NETL,” Rep. McKinley. http://t.co/3RGbRaNsJz"
410081292328255489,2013-12-09 16:19:33,,1,1,Twitter Web Client,Rep. McKinley conducts his 2nd Energy Summit at WVU on how current and proposed policies affect the economic climate. http://t.co/55T0nK2PJe
410078431221530624,2013-12-09 16:08:11,,2,0,Twitter Web Client,"The average individual deductible for the bronze plan on #Obamacare is $5,081 per year. http://t.co/by9Cb8stwI"
410061517111844864,2013-12-09 15:00:58,,1,0,Twitter Web Client,Rep. McKinley conducting second Energy Summit at West Virginia University today.  http://t.co/VATbq3kIl7
408976711980564480,2013-12-06 15:10:21,,5,0,Twitter Web Client,National Miners Day is today. Please show your appreciation for all that American Mine Workers do and have done.  https://t.co/8NEHignF3A
408722261835649026,2013-12-05 22:19:15,,0,0,Twitter Web Client,An icon of the civil rights movement is dead at age 95. Our thoughts and prayers to the family of Nelson Mandella. http://t.co/DDKExbLRw0
408665480946122752,2013-12-05 18:33:37,,1,1,Twitter Web Client,WVU Awarded a $2M grant from the Department of Energy's National Energy Technology Laboratory.  http://t.co/HsKRqhGjsk
408663605656420352,2013-12-05 18:26:10,,1,0,Google,"Rep. McKinley questions panelists on ""Evaluating the Role of FERC in a Changing Energy Landscape."": http://t.co/Lsi8w4qppg via"
408632604091351040,2013-12-05 16:22:59,,1,0,Twitter Web Client,57% of millennials disapprove of Obamacare http://t.co/rVDzsP7eeJ #BrokenPromises
408605778853912576,2013-12-05 14:36:23,,9,3,Twitter Web Client,Even Obama's most loyal demographic is abandoning him http://t.co/cc7fbCEMHU #BrokenPromises
408357355273744384,2013-12-04 22:09:15,,10,1,Twitter Web Client,81% favor repealing or changing #Obamacare. http://t.co/zzkvBpPfsi
408357029539889152,2013-12-04 22:07:57,,1,2,Twitter Web Client,"A great weekend for ""Papa"" McKinley during the annual family holiday. They ""stached"" away a nice surprise for him! http://t.co/1Kb9LnbhK1"
408317005175857152,2013-12-04 19:28:55,,0,1,Twitter Web Client,Rep. McKinley meets with members representing W.Va. in National Conference of State Legislatures. http://t.co/9tb8RIWq37
408284374028021760,2013-12-04 17:19:14,"{u'type': u'Point', u'coordinates': [-77.00797297, 38.88732854]}",0,0,Twitter for iPhone,Rep. McKinley records a holiday greeting for all men and women serving in the US Military in 170 countries. http://t.co/OS1obDxfOR
408242406916505600,2013-12-04 14:32:29,,1,0,Twitter Web Client,#BrokenPromises and a broken law are not things that are fixable through a campaign. http://t.co/fRAxN302A8
408235582851010560,2013-12-04 14:05:22,,1,0,Twitter Web Client,Rep. McKinley talks with Talkline host Hoppy Kercheval at 10:06am today on the upcoming Energy Summit in Morgantown. http://t.co/6V3Wshmuwe
408028172559863808,2013-12-04 00:21:11,"{u'type': u'Point', u'coordinates': [-77.01166838, 38.88998151]}",3,0,Twitter for iPhone,A beautiful night to light our Capitol Christmas tree on the West lawn. http://t.co/fjxLEJ6GmT
408008811622842368,2013-12-03 23:04:15,,4,0,Twitter Web Client,Insurers warn of problems with Obamacare enrollment surge.  Read more here: http://t.co/90tNCfw7bP
407946996977123329,2013-12-03 18:58:38,,3,0,Twitter Web Client,VIDEO: #Obamacare is kicking Americans off their plans http://t.co/R8ETHl1Pbx #BrokenPromises What's your story? http://t.co/8VnQXYq7DE
407945410963968000,2013-12-03 18:52:19,,2,0,Twitter Web Client,"""It's not secure."" says a computer security CEO referring to the Obamacare website http://t.co/XJENp65D86"
407937405551771649,2013-12-03 18:20:31,,1,0,Twitter Web Client,VIDEO: Broken promises continue to pile up for the President #RateShock http://t.co/FEyKg0nYeY
407936611855237120,2013-12-03 18:17:22,,1,0,Twitter Web Client,"#Obamacare much more than a broken website, it's a broken law. HHS Sec. @Sebelius to testify again next week: http://t.co/QXU8yiNCCk"
407889319982936064,2013-12-03 15:09:26,,4,0,Twitter Web Client,More and more families are seeing their premiums increase under Obamacare #RateShock http://t.co/FEyKg0nYeY
407647323422867456,2013-12-02 23:07:50,,0,0,Twitter Web Client,Young Americans under the age of 30 remain the least familiar age group when asked about Obamacare.  Read more.   http://t.co/QBhX4Dn3Rl
407592680995041281,2013-12-02 19:30:42,,3,1,Twitter Web Client,UPS CFO Kurt Kuehn says #Obamacare mandates forced company to drop coverage for employee spouses. http://t.co/7PRT8Iwxbo
407591213580046336,2013-12-02 19:24:52,,2,0,Twitter Web Client,http://t.co/HXW4oI8ONi
407591074761166848,2013-12-02 19:24:19,,3,0,Twitter Web Client,"Although the Obama Administration is saying the problems are fixed with the  website, insurance companies are telling a different story."
405759051331403776,2013-11-27 18:04:31,,1,0,Twitter Web Client,"Another setback for the President's failed health care law.
http://t.co/QGmbpQ2iBf"
405744920331169792,2013-11-27 17:08:22,,0,0,Twitter Web Client,"This Thanksgiving, we wish you safe travels and hope you enjoy this time with your friends and loved ones! http://t.co/RXmemskpuW"
405735795782217728,2013-11-27 16:32:06,,0,0,Twitter Web Client,"Presidents Abraham Lincoln and FDR forged the Thanksgiving holiday as we know it today.  Read more, here: http://t.co/bwRzNhBpuq"
405731551029121024,2013-11-27 16:15:14,,3,0,Twitter Web Client,Here are some Thanksgiving safety tips for you and your family before tomorrow's big day.  http://t.co/LcwBZp2q9W
405731106843930624,2013-11-27 16:13:28,,5,0,Twitter Web Client,Rep. McKinley talks with Delegate Randy Smith (R-Preston) at this Town Hall meeting in Davis on Tuesday night. http://t.co/lSsdUNu9ob
405446490442579968,2013-11-26 21:22:30,,2,1,Twitter Web Client,Congratulations to Wesley Davis for being named Eastern Regional VP for the National FFA organization! http://t.co/jymx2KPwYD
405388630614900736,2013-11-26 17:32:35,,2,0,Twitter for iPhone,"Rep. McKinley tours DaVita Dialysis in Vienna, W.Va. http://t.co/w2ZaWfeKCx"
405386220119027712,2013-11-26 17:23:01,,1,2,Twitter for iPhone,Rep. McKinley meets with members of the Williamstown City Council on Monday. http://t.co/ecVF6l9lBu
405381520547786752,2013-11-26 17:04:20,,1,0,Twitter Web Client,"Rep. McKinley to conduct Town Hall meeting in Davis tonight. Doors open at 6:30, meeting begins at 7 at Davis Town Hall, 505 William Av."
405140170007003138,2013-11-26 01:05:18,,3,2,Twitter for iPhone,Rep. McKinley listens to constituents in Williamstown at this town hall meeting on Monday. http://t.co/lLAYdLDhCE
405022952795566081,2013-11-25 17:19:31,,1,0,Twitter Web Client,Doors open at 6:30 p.m. Town hall meeting begins at 7:00 p.m. at the Williamstown Town Hall on 100 West Fifth Street.
405022682053242880,2013-11-25 17:18:27,,1,0,Twitter Web Client,"Rep. McKinley to conduct another in a series of town hall meetings tonight.  This one at the Williamstown Town Hall, 100 West Fifth Street."
405022180624171008,2013-11-25 17:16:27,,2,0,Twitter Web Client,"To learn more about West Virginia's buck season, click here: http://t.co/OwgY3f2zts"
405021905062596608,2013-11-25 17:15:21,,2,0,Twitter Web Client,"More than 300,000 hunters will be in the woods to open the 2013 buck hunting season in WV. The 2 week period is by far the most popular."
403983938105786368,2013-11-22 20:30:51,,0,1,Twitter Web Client,A Marion County school is celebrating a big award. Monongah Middle School was named a National Blue Ribbon School by the Dept. of Education.
403888827430756352,2013-11-22 14:12:55,,5,0,Twitter Web Client,Listen to Rep. McKinley on the Metro News Talkline radio show with @HoppyKercheval this morning beginning at 10:06.  http://t.co/6V3Wshmuwe
403560646735716352,2013-11-21 16:28:50,,0,0,Twitter Web Client,What follows a canceled insurance plan? Typically higher premiums #KeepYourHealthPlan http://t.co/4twdTfEiwS
403540320983330816,2013-11-21 15:08:04,,1,0,Twitter Web Client,Broken promises and a broken law are not things that are fixable through a campaign. #KeepYourHealthPlan http://t.co/fRAxN302A8
403528152800301056,2013-11-21 14:19:43,,1,2,Twitter for iPhone,Rep. McKinley talks with WTAP in Parkersburg and WTRF in Wheeling about issues facing the First District. http://t.co/B7nn5EP82U
403318148226502656,2013-11-21 00:25:14,,2,1,Twitter for iPhone,Rep. McKinley conducts a conference call with several constituents in the 1st First District concerning Obamacare. http://t.co/48c5utNTqy
403274136308699136,2013-11-20 21:30:21,,0,1,Twitter for iPhone,"Rep. McKinley addressing Alliance to Save Energy Conference on energy productivity in Washington, DC. http://t.co/mqThh9JEVY"
403269790514827264,2013-11-20 21:13:05,,0,1,Twitter for iPhone,Getting ready to address the Alliance to Save Energy Conference on energy productivity in Cannon Caucus Room. http://t.co/Qa0Z7YUlJx
403168594764120064,2013-11-20 14:30:58,,2,0,Twitter Web Client,Broken Obamacare promises and a broken law are not things that are fixable through a campaign. #KeepYourHealthPlan http://t.co/fRAxN302A8
403165117334171648,2013-11-20 14:17:09,,6,0,Twitter Web Client,"RT @HoppyKercheval: Bonnie Stewart, author of ""No.9.  The Farmington Mine Disaster"" joins me on Talkline at 11:40.  Today is the 45th anniv…"
403147105151115264,2013-11-20 13:05:34,,7,0,Twitter Web Client,"Today marks 45 years since an explosion at Consolidation Coal’s No. 9 Mine in Marion County, WV, that claimed the lives of 78 coal miners."
402956262603644928,2013-11-20 00:27:14,,8,2,Twitter Web Client,"Rep. McKinley and the Alliance to Save Energy present McKinley staffer Cory Toth with the ""Unsung Hero"" award."
402861491994361856,2013-11-19 18:10:39,,1,0,Twitter Web Client,"Congratulations to the Louis A. Johnson VA Medical Center in Clarksburg, WV for receiving a national ""top performance"" award."
402841801809092608,2013-11-19 16:52:24,,5,1,Twitter Web Client,Coal fact of the week: coal is used to generate electricity in 48 states and it supplies at least one-quarter of electricity in 29 states.
402816235747803136,2013-11-19 15:10:49,,1,0,Twitter Web Client,11% of voters say they have been helped by Obamacare. 30% say they have been hurt by it. #KeepYourHealthPlan http://t.co/C1hMaRTUNv
402811863328489472,2013-11-19 14:53:26,,1,0,Twitter Web Client,The Obama Administration knew http://t.co/Z0YsxQtT5x could face serioustroubles as early as March of 2013. http://t.co/SBfPTZhRnV
402804098493214721,2013-11-19 14:22:35,,1,0,Twitter Web Client,"150 years ago today, President Abraham Lincoln gave the Gettysburg Address, a speech that symbolized his presidency.  http://t.co/30ymGUsYsq"
402577020493627392,2013-11-18 23:20:15,,3,1,Twitter Web Client,So many families and individuals continue to be negatively impacting by Obamacare http://t.co/71N4pFC3Ws #KeepYourHealthPlan
402462684068605952,2013-11-18 15:45:55,,1,0,Twitter Web Client,Obamacare continues to hit home for Americans all across the country http://t.co/71N4pFC3Ws #KeepYourHealthPlan
402460486362759168,2013-11-18 15:37:11,,30,0,Twitter Web Client,RT @HouseCommerce: ReTweet if you think you should be able to #KeepYourHealthPlan if you like it. #KeepYourPlan http://t.co/2CChvYIsgA
401423243354972160,2013-11-15 18:55:33,,0,1,Twitter Web Client,"Rep. McKinley voted for the ""Keep Your Health Plan Act"" of 2013.  McKinley was an original co-sponsor of the legislation."
401397461765599232,2013-11-15 17:13:07,,2,1,Google,"Rep. McKinley addresses his colleagues in the House on the ""Keep Your Health Plan Act"": http://t.co/ZAlyMVkd2c via @YouTube"
401389763552235521,2013-11-15 16:42:31,,0,0,Twitter Web Client,"@RepMcKinley about to address his House colleagues on the ""Keep Your Health Plan Act,"" in which he's a co-sponsor. http://t.co/jW1NMiJifT"
401365127208779776,2013-11-15 15:04:38,,1,0,Twitter Web Client,Even President Clinton thinks President Obama should #KeepThePromise and allow Americans to keep their insurance http://t.co/fTs6PsTCzv
401359863508267008,2013-11-15 14:43:43,,0,0,Twitter Web Client,Obamacare continues to hit home for Americans all across the country http://t.co/71N4pFC3Ws #KeepYourPlan
401081837004406784,2013-11-14 20:18:56,,1,0,Twitter Web Client,People are still paying much higher premiums under Obamacare http://t.co/j7odvagnF2 #KeepYourPlan
401074758969589760,2013-11-14 19:50:48,,0,0,Twitter Web Client,"The WV Delegation is excited over the company opting for WV. Now that it's public, we can talk about the role of the delegation over 2 yrs."
401067797297373184,2013-11-14 19:23:09,,0,1,Twitter Web Client,"""After discussions with Odebrecht and Braskem over the past two years, it's exciting to see this project come to fruition,” said McKinley."
401066685542576128,2013-11-14 19:18:43,,1,2,Twitter Web Client,"""Thousands of jobs and billions in investment will result from this project and transform our state’s economy for decades to come.”"
401066464553103360,2013-11-14 19:17:51,,2,2,Twitter Web Client,"Wood Co. will get cracker plant.  “Today’s announcement is great news for Wood County and the entire state of West Virginia,” Rep. McKinley."
401064180175757312,2013-11-14 19:08:46,,1,1,Twitter Web Client,A major announcement is coming to Wood Co. concerning a land purchase for a major WV economic project.  http://t.co/fkeB1lD9J6
401059955786395648,2013-11-14 18:51:59,,1,0,Google,Rep. McKinley addresses proposed increases in electricity if new EPA regulations take place.: http://t.co/9Tj2pwSQx4 via @YouTube
401029386645696512,2013-11-14 16:50:31,,1,0,Twitter Web Client,"Rep. McKinley questions EPA in Energy and Power hearing on more proposed coal regulations. Watch the video, here: http://t.co/V7j6DUr0Mm"
401026051394248704,2013-11-14 16:37:16,,3,1,Google,Rep. McKinley challenges EPA on new job-killing coal-fired plant regulations in hearing.: http://t.co/rdenp66CDi via @YouTube
401019425458896896,2013-11-14 16:10:56,,0,2,Twitter Web Client,McKinley is attending Energy and Power Subcommittee on the EPA's oversight of regulations targeting the use of coal. http://t.co/SC4npVATR3
401005418257731585,2013-11-14 15:15:16,,1,0,Twitter Web Client,Another way to help typhoon victims in the Philippines. #Pray4Philippines http://t.co/sw8HEedGdY
400998862061465600,2013-11-14 14:49:13,,1,0,Twitter Web Client,"Rep. McKinley attending hearing on EPA’s numerous regulations targeting the use of coal and greenhouse gas standards for new power plants,"
400996975719358464,2013-11-14 14:41:43,,2,0,Twitter Web Client,"Only 26,794 people selected a plan on http://t.co/Z0YsxQtT5x during the month of October http://t.co/oDi2gUIcjg"
400995504294592512,2013-11-14 14:35:53,,1,0,Twitter Web Client,The numbers of people in W.Va. enrolled in Obamacare are out and they're not good. #keepyourplan  http://t.co/xZpimPLtyz
400994466766417920,2013-11-14 14:31:45,,0,0,Twitter Web Client,3.5 millions Americans have lost their insurance. Less than 107k have chosen an Obamacare plan. #KeepYourPlan http://t.co/xloQOxw6b4
400764671579271168,2013-11-13 23:18:38,,4,0,Twitter Web Client,The @RepublicanStudy plan to replace #Obamacare. #HR3121 is 100+ cosponsors strong and is #ABetterWay to health care. http://t.co/ZOnblHttlx
400747754005086208,2013-11-13 22:11:24,,6,0,Twitter for Websites,"RT @CWAUnion: .@SenBobCasey, @RepMcKinley, @TimBishopNY &amp; 2 CWAers: It's time to pass the Call Center Bill. #PressOneforAmerica http://t.co…"
400746975248662528,2013-11-13 22:08:19,,1,1,Twitter Web Client,Rep. McKinley joins Rep. Tim Bishop and Sen. Bob Casey to prevent companies from outsourcing U.S. call center jobs. http://t.co/rIH12yfjWe
400713101898964993,2013-11-13 19:53:43,,0,0,Google,Rep. McKinley questions witnesses during the Chemical Safety Improvement Act hearing.: http://t.co/23AjlMzZ9v via @YouTube
400665095350804480,2013-11-13 16:42:57,,0,0,Google,"Rep. McKinley questions witnesses during a hearing on The Chemical Safety Improvement Act"": http://t.co/1eccDtnKgL via @YouTube"
400656478144446464,2013-11-13 16:08:42,,4,1,Twitter Web Client,Bipartisan support for the #KeepYourHealthPlan Act is growing. Learn more about the bill here: http://t.co/cVekQp7ruQ #FairnessForAll
