id,created_at,coordinates,retweets,favorite_count,source,text
525719036240592897,2014-10-24 18:42:40,,0,0,Twitter Web Client,Bridgeport Farmers Market is a great place to spend a Sunday! http://t.co/IbKmMnThkM
525700108659482624,2014-10-24 17:27:27,,7,0,Twitter Web Client,"RT @HouseCommerce: Committee members press the admin on #Ebola response. Learn more here: 
http://t.co/90BTCZmmzc http://t.co/JOwJmEtgfs"
525700007769686016,2014-10-24 17:27:03,,0,1,Twitter Web Client,"Obamacare continues to put citizens, and their personal information, at risk http://t.co/ramfK0NAvZ"
525697455535718401,2014-10-24 17:16:55,,1,0,Twitter Web Client,WVU is leading the way in medical research http://t.co/7lo6cypegd
525656854069014528,2014-10-24 14:35:34,,4,5,Twitter Web Client,"Congratulations to Christopher Morlock, Intern in our Morgantown Office, for being chosen as a Finalist for Mr. Mountaineer at WVU!"
525289308044132352,2014-10-23 14:15:05,,1,2,Twitter Web Client,We are proud of the service of Follansbee and all of our communities provide to West Virginians! http://t.co/Ci1E7YI3uf
525012860460875777,2014-10-22 19:56:34,,3,3,Twitter Web Client,"Q: How many bills are #StuckInTheSenate? 

A: 387. http://t.co/eW5jXweuFh"
524973545504645120,2014-10-22 17:20:21,,1,0,Twitter Web Client,"Horrible news from Ottawa this morning. My thoughts and prayers are with our Canadian friends.

http://t.co/vmp1Aym75g"
523215898942136320,2014-10-17 20:56:05,,0,1,Twitter Web Client,The Energy and Commerce Committee has made great strides in passing bipartisan legislation this year. http://t.co/1TINNRSN2a
523206157411037184,2014-10-17 20:17:23,,2,0,Twitter Web Client,Washington continues to raise taxes to support its spending habit on the backs of hard working Americans. http://t.co/R5CiDHm3Bw
523101031732113408,2014-10-17 13:19:39,,1,0,Twitter Web Client,President's mandates are killing jobs and running local businesses out of town. http://t.co/K9unQOEvlX
522764833142628352,2014-10-16 15:03:43,,0,0,Twitter Web Client,"Ritchie County has just received over $500,000 in grants from the U.S. Department of Health and Human Services! https://t.co/6o7Lteqjk3"
522424653164605440,2014-10-15 16:31:58,,2,0,Twitter Web Client,Rep. McKinley speaks at the Penn State Natural Gas Utilization Conference http://t.co/VqMmQQEyWV
522126149712084992,2014-10-14 20:45:49,,0,0,Twitter Web Client,Tougher sentencing is one way we can combat West Virginia's drug issues. http://t.co/Bc5zSLK1Eg
522082850800410624,2014-10-14 17:53:46,,0,0,Twitter Web Client,Rep. McKinley meets with local Volunteer Fire Departments in Moundsville. http://t.co/fvcQjygVCR
522026835224576002,2014-10-14 14:11:10,,1,0,Twitter Web Client,We must get our economy back on track. http://t.co/iPZpOO8Yhh
520621449389043712,2014-10-10 17:06:40,,0,0,Twitter Web Client,Programs like this do a great deal of good for veterans who are struggling. http://t.co/XzBErbKBfZ
520566955414396929,2014-10-10 13:30:08,,1,0,Twitter Web Client,Wages are stagnant while the cost of living rises. Which cost in every day life is causing you the most concern? http://t.co/beROcfacBU
520311109677748224,2014-10-09 20:33:30,,1,0,Twitter Web Client,Rep. McKinley visits a Carpenters Training Facility in Parkersburg. http://t.co/G4vMaj4Oqx
520283993770852353,2014-10-09 18:45:45,,1,1,Twitter Web Client,Rep. McKinley visits a Sheet Metal Workers training facility in Parkersburg http://t.co/mKoJoSLZLF
520255935387033601,2014-10-09 16:54:15,,2,2,Twitter Web Client,Congratulations to Gail Adams of Wheeling Park High School for being named WV Teacher of the Year! http://t.co/AUyBGSPP8s
520232343043575808,2014-10-09 15:20:30,,2,1,Twitter Web Client,Rep. McKinley visits the West Virginia Laborers Training Facility in Mineral Wells. http://t.co/NwRlavGnTV
519935639580844032,2014-10-08 19:41:31,,3,0,Twitter Web Client,The EPA's excessive regulations have thrown so many families into financial uncertainty. http://t.co/nh2aKvqVZg
519870827068915712,2014-10-08 15:23:58,,0,1,Twitter Web Client,Rep. McKinley meets with senior services representatives in New Cumberland. http://t.co/wAaRgbHlZ1
519840295857704960,2014-10-08 13:22:39,,6,2,Twitter Web Client,Obamacare continues to underachieve in the eyes of most of the country. http://t.co/suh9MyFy46
519824122742726656,2014-10-08 12:18:23,,1,0,Twitter Web Client,Rep. McKinley speaks at a meeting with Leonardo Technologies in Wheeling http://t.co/p7rVP9A8el
519563336623480832,2014-10-07 19:02:07,,1,0,Twitter Web Client,Blame continues to flow downstream at the VA. http://t.co/GC8D9nE1FG
519516782428966912,2014-10-07 15:57:07,,3,2,Twitter Web Client,Rep. McKinley meets with local business leaders in Weirton to discuss revitalizing manufacturing in the area. http://t.co/VsgDvTd4LS
519478088959541248,2014-10-07 13:23:22,,0,1,Twitter Web Client,This grant will invigorate the fight against drugs in West Virginia and help make our communities safer. http://t.co/WfgnKXu7hg
519215045256163328,2014-10-06 19:58:07,,1,2,Twitter Web Client,"Rep. McKinley meets with local officials and business leaders in Reedsville, Preston County. http://t.co/teDSigEuWp"
519182090051796992,2014-10-06 17:47:10,,0,0,Twitter Web Client,We must work to reduce truancy in our schools. Our children's education is key.  http://t.co/wBe9ZRYNdg
518141306116505600,2014-10-03 20:51:28,,0,1,Twitter Web Client,"In honor of National Manufacturing Day, take a look at the contribution automakers have made to West Virginia! http://t.co/L87MYbmCVu"
518111198827790337,2014-10-03 18:51:50,,3,2,Twitter Web Client,Wishing a peaceful and meaningful fast to those observing Yom Kippur today.
518078404156211201,2014-10-03 16:41:31,,1,1,Twitter Web Client,Some of those who got to keep their plans could have them threatened yet again #brokenpromises http://t.co/dPmFt74ZRQ
518040287764307968,2014-10-03 14:10:03,,1,1,Twitter Web Client,October is #breastcancerawarenessmonth. We must remember to keep looking for a cure. http://t.co/jRdFhzLhce
517740437847941120,2014-10-02 18:18:34,,0,0,Twitter Web Client,Rep. McKinley speaks at an Energy Policy Panel put on by the World Energy Engineering Congress http://t.co/uH4aV9SbHb
517385965846155264,2014-10-01 18:50:01,,0,1,Twitter Web Client,Rep. McKinley receives an award from the National Association of Manufacturers for Legislative Excellence http://t.co/QL1d6ncX7y
517359256056524800,2014-10-01 17:03:53,,1,0,Twitter Web Client,Today marks the not-so-happy anniversary of http://t.co/5mj1zwlIgm. https://t.co/9chHTMNYw9
517322527052668928,2014-10-01 14:37:56,,0,0,Twitter Web Client,The lack of competence within the Secret Service is worrisome to say the least. http://t.co/pDHq7rrBul
517054355598352384,2014-09-30 20:52:19,,0,1,Twitter Web Client,This terrific program helps our veterans adapt to civilian life when they return stateside. http://t.co/hWpQwy90Bo
517037609894547457,2014-09-30 19:45:46,,0,1,Twitter Web Client,Congratulations to Woodsdale Elementary School in Wheeling for being recognized as a National Blue Ribbon School! http://t.co/XDPV74YdXL
516654739942305793,2014-09-29 18:24:23,,32,0,Twitter Web Client,RT @PeterRoskam: 1 in 4 Americans ages 25-54 are out of work. That's why @HouseGOP is focused on making it easier 4 businesses to hire http…
516617484003463168,2014-09-29 15:56:21,,2,0,Twitter Web Client,Obamacare concerns continue to be the focus of discussion. http://t.co/bDeNmGR6XY
515607218348376065,2014-09-26 21:01:55,,1,1,Twitter Web Client,This is very welcome news for all those in West Virginia who suffer from these illnesses. http://t.co/o0NliGW2UH
515567479935234049,2014-09-26 18:24:00,,1,1,Twitter Web Client,We must invest in our future and allow our children to succeed. http://t.co/b7Z0sFFGgA
515517865907478528,2014-09-26 15:06:51,,1,0,Twitter Web Client,The work of the IV&amp;V program in Fairmont was critical in this NASA mission. http://t.co/I9YK4hoSdP
515243988677586944,2014-09-25 20:58:34,,0,0,Twitter Web Client,It was great to be a part of raising awareness of just how important the plastics industry is to our local economy. http://t.co/ndSdDmcy9N
515202548991795201,2014-09-25 18:13:54,,1,0,Twitter Web Client,Rep. McKinley spoke on behalf of home health at an event in Parkersburg Wednesday. http://t.co/b21DM1gJGW
515165169539096576,2014-09-25 15:45:22,,1,1,Twitter Web Client,Rep. McKinley gives a statement on the fight against ISIS http://t.co/6cb0uhnXIG
515139222790217728,2014-09-25 14:02:16,,0,0,Twitter Web Client,"Rep. McKinley speaks at the Ohio Valley Plastics Summit in Vienna on Wednesday, September 24. http://t.co/qTrFJgAIX2"
515132169526984704,2014-09-25 13:34:14,,2,0,Twitter Web Client,Obamacare has cost a staggering sum on the backs of our taxpayers. http://t.co/YMbKYcd22A
514870382952972288,2014-09-24 20:13:59,,0,0,Twitter Web Client,Rep. McKinley meets with students at Parkersburg High School http://t.co/GUSdrGk2PV
514833766448394240,2014-09-24 17:48:29,,1,2,Twitter Web Client,Hoping everyone is having a wonderful Rosh Hashanah! http://t.co/qsKpcsbtAS
514814979565187072,2014-09-24 16:33:50,,2,2,Twitter Web Client,Rep. McKinley speaks at the Save Home Health Rally today. #savehomehealth http://t.co/b0Elg6kbKD
514788209570877440,2014-09-24 14:47:28,,0,0,Twitter Web Client,Today we talked with families and home health providers before the Save Home Health Rally. http://t.co/xMIRDagrJO
514777463654993920,2014-09-24 14:04:46,,2,1,Twitter Web Client,Yesterday we had a great conversation with educators in Bridgeport. http://t.co/R9Zx580yIv
514473235694759937,2014-09-23 17:55:52,,1,1,Twitter Web Client,This common sense law needs to stay on the books. http://t.co/oJoEfTTnuL
514421432487800832,2014-09-23 14:30:01,,1,1,Twitter Web Client,What a great way to help local businesses. http://t.co/yNSJn04vzO
514149198225092610,2014-09-22 20:28:15,,1,2,Twitter Web Client,Anything that helps our students avoid debt is an investment in our future. http://t.co/bOLm3eMfg5
514097318950625280,2014-09-22 17:02:06,,0,1,Twitter Web Client,Last Friday the EPA dropped an appeal case against a WV farmer that was based on flimsy logic and unjust fines http://t.co/KRTgjIl03F
514057815393329154,2014-09-22 14:25:08,,3,2,Twitter Web Client,We need the facts to make good policy. http://t.co/JwXss2FMWY
513045698343096321,2014-09-19 19:23:21,,3,2,Twitter Web Client,Today on #POWMIAday we honor those taken or lost in times of war and let their families know they are not forgotten. http://t.co/n1B9NVXsik
513044598491713537,2014-09-19 19:18:58,,1,0,Twitter Web Client,Two good jobs bills passed yesterday aiming at getting America back to work. Now we need the Senate to act. http://t.co/xd9k2LoIaX
513037367855550465,2014-09-19 18:50:14,,6,0,Twitter Web Client,RT @HouseGOP: .@FiveThirtyEight: Most Of The U.S. Saw Little Recovery In 2013 http://t.co/cOhJcVazMr #WhereAreTheJobs?
512989423307620353,2014-09-19 15:39:44,,3,1,Twitter Web Client,Six years later and still the President refuses to act on #KeystoneXL http://t.co/Fyz9T1v9dQ
512950524543762432,2014-09-19 13:05:09,,1,2,Twitter Web Client,The power of the EPA needs to stay in check. http://t.co/xzQ944A0BN
512691741850230784,2014-09-18 19:56:51,,3,1,Twitter Web Client,Happy Birthday to the United States Air Force! Thank you for all that you do for our country. http://t.co/69QDf7Mgl2
512689915822215168,2014-09-18 19:49:35,,3,0,Twitter Web Client,RT @wvpublicnews: Funeral Services for Former First Lady Shelley Moore Begin Friday: http://t.co/b57PeN6NH8 http://t.co/HSjSCLj4XS
512645247017291776,2014-09-18 16:52:06,,3,4,Twitter Web Client,Rep. McKinley receives an award from the AACR for exceptional commitment to NIH and cancer research. http://t.co/XSkMgqFtKL
512623265781514240,2014-09-18 15:24:45,,0,1,Twitter Web Client,The American Energy Solutions for Lower Costs and More American Jobs Act would create good jobs for Americans. http://t.co/arDH4qoUPl
512321114237071361,2014-09-17 19:24:06,,0,2,Twitter Web Client,"People are speaking out across the 1st district against the EPA's excessive, job-killing agenda. http://t.co/AxOLhXjEaQ"
512267300968615937,2014-09-17 15:50:16,,0,0,Twitter Web Client,The War on Coal continues. http://t.co/RhBYLBS9BA
512246588753076224,2014-09-17 14:27:58,,0,1,Twitter Web Client,Senator Robert Byrd gives a speech on the importance of the Constitution. #constitutionday2014 http://t.co/T3kNaqv0DH
511983189968310272,2014-09-16 21:01:19,,1,0,Twitter Web Client,These destructive regulations are hurting our families. http://t.co/bILmqMxkN6
511954070966243328,2014-09-16 19:05:36,,0,1,Twitter Web Client,Today Rabbi Urecki from Charleston stopped by our Washington office. http://t.co/H3demH9cDt
511916811403952129,2014-09-16 16:37:33,,0,0,Twitter Web Client,Today we met with the National Mining Association and had a great discussion. http://t.co/n1MI6Txpai
511636765682438144,2014-09-15 22:04:45,,0,2,Twitter Web Client,A big thank you to @megabus for their help with the #MegabusMcKinleyTH today. It turned out to be a great conversation with the students!
511629260017377280,2014-09-15 21:34:55,,2,0,Twitter Web Client,We’ll continue to fight these drastic cuts to home health that will hurt seniors and punish West Virginia families. http://t.co/qBiELYSuYo
511571037071609857,2014-09-15 17:43:34,,3,0,Twitter Web Client,RT @megabus: Thank you to all the students who participated in our #MegabusMcKinleyTH today. Enjoy your afternoon in D.C.! http://t.co/5foQ…
511540931645165568,2014-09-15 15:43:56,,1,2,Twitter Web Client,A quick pitstop gave us the chance for a group photo! Then back on the road. #MegabusMcKinleyTH http://t.co/eIT4Hq3BaD
511537408895352832,2014-09-15 15:29:56,,1,0,Twitter Web Client,"RT @megabus: Hey, @WestVirginiaU &amp; @FairmontState - We're chatting with @RepMcKinley on the bus this morning. Ask him questions with #Megab…"
511531713856815104,2014-09-15 15:07:19,,0,0,Twitter Web Client,It's going to be a busy work week. http://t.co/HiW4QMDeHg
511524155037351936,2014-09-15 14:37:16,,1,1,Twitter Web Client,Remember: You can ask questions while we are on the road this morning using #MegabusMcKinleyTH. Join the conversation!
511522805922672641,2014-09-15 14:31:55,,4,0,Twitter Web Client,Here is some more info on our Mobile Town Hall Today #MegabusMcKinleyTH http://t.co/4Mli5Wyj3n
511520156325912576,2014-09-15 14:21:23,,2,0,Twitter Web Client,RT @WVUGinger: #MegaBusMcKinleyTH is underway! http://t.co/FE51sofi1Z
511519072409100288,2014-09-15 14:17:05,,3,0,Twitter Web Client,We stopped to talk to Allegheny Radio and WV MetroNews about our trip today with WV students! #MegabusMcKinleyTH http://t.co/L3ysrGCvjM
511504614722908161,2014-09-15 13:19:38,,2,1,Twitter Web Client,We will be answering questions during our Mobile Town Hall this morning - just use the hashtag #megabusmckinleyTH
511500251250036736,2014-09-15 13:02:17,,3,2,Twitter Web Client,We're on the road this morning to Washington for the Mobile Town Hall! #megabusmckinleyTH http://t.co/Gu1G7mHrZx
510535401686441984,2014-09-12 21:08:19,,2,1,Twitter Web Client,Today I met with student veterans at Potomac State College and with volunteer firefighters in Fort Ashby. http://t.co/4NquPVy2Uu
510518943430508544,2014-09-12 20:02:55,,0,0,Twitter Web Client,@MissWV2014 Paige Cameron is competing for Miss America this Sunday. Good luck Paige!
510487816732938241,2014-09-12 17:59:14,,0,0,Twitter Web Client,It is good to see the President finally realizes the extent of this threat. http://t.co/GQWv6uf3vB
510424115032096768,2014-09-12 13:46:06,,0,0,Twitter Web Client,Congratulations! http://t.co/meBwkDyzNN
510147977403727872,2014-09-11 19:28:50,,11,0,Twitter Web Client,"RT @RepublicanStudy: Today, we remember the American lives lost on the 13th anniversary of the Sept. 11, 2001 terror attacks #NeverForget h…"
510072540401004544,2014-09-11 14:29:04,,0,0,Twitter Web Client,A great way to honor our veterans. http://t.co/gDxkCQOZGX
509815407679930369,2014-09-10 21:27:19,,1,1,Twitter Web Client,Here's an idea of what the workforce looks like in West Virginia. http://t.co/j5jpssMaWK
509775687226765313,2014-09-10 18:49:29,,1,1,Twitter Web Client,Today we met with the WV Automobile and Truck Dealers Association in our Washington office. http://t.co/g2JVG9qYYC
509729262602309632,2014-09-10 15:45:01,,6,0,Twitter Web Client,RT @wvpublicnews: West Virginia's #craftbeer industry is hoping to grow (with a bit of help from @wvlegislature) http://t.co/v2fwDxASBF htt…
509729167198683136,2014-09-10 15:44:38,,0,0,Twitter Web Client,H.R. 3522 is on the floor today. What is your greatest frustration with Obamacare? #brokenpromises http://t.co/gBUqxaPFVc
509715392370343936,2014-09-10 14:49:54,,1,1,Twitter Web Client,Rep. McKinley listens to Secretary Burwell and Chairman Upton during a health roundtable on 21st Century Cures http://t.co/sfWBaEdEzi
509409127521857536,2014-09-09 18:32:55,,1,1,Twitter Web Client,This is only worsening the problem. http://t.co/ags7bjPRXQ
509366268139687936,2014-09-09 15:42:36,,2,0,Twitter Web Client,Today the House will vote on condemning President's failure to notify Congress before releasing 5 Taliban prisoners.http://t.co/QhFG8fjOWW
509361224279425024,2014-09-09 15:22:34,,0,0,Twitter Web Client,Today the House votes on the Waters of the U.S. rule. Looking forward to solving this issue. http://t.co/7siz1kLSe2
509346454302097408,2014-09-09 14:23:52,,0,1,Twitter Web Client,Rep. McKinley receives an award this morning for public leadership from the College of Rheumatology. http://t.co/tGWJqAEX9R
509073370001199105,2014-09-08 20:18:44,,3,1,Twitter Web Client,"Of the hundreds of bills #stuckinthesenate, 43 are jobs bills which would create good paying jobs for Americans. https://t.co/R29Bl7HH4S"
509070416024203264,2014-09-08 20:06:59,,0,0,Twitter Web Client,"Good win, Mountaineers !http://t.co/Wa7hXMV48a"
509017614266695681,2014-09-08 16:37:10,,1,0,Twitter Web Client,"While Washington keeps growing its reach, our local economy struggles to create good jobs. https://t.co/Y1DViQegV5"
507978376582541312,2014-09-05 19:47:37,,2,2,Twitter Web Client,for 49 of the last 50 months more unemployed workers left the workforce than found jobs.The status quo isn't working  http://t.co/aMl64YJtrg
507906348135493632,2014-09-05 15:01:24,,5,0,Twitter Web Client,Yesterday we spent the day at Camp Dawson with the WV National Guard and the Youth ChalleNGe program. http://t.co/BREVh5DSYd
507879024710787072,2014-09-05 13:12:50,,0,1,Twitter Web Client,This is alarming news. Do they really expect us to believe there was no personal information taken? http://t.co/I9lskZt209
507626344625106945,2014-09-04 20:28:46,,1,0,Twitter Web Client,This is a prime example of big government intruding in our lives… http://t.co/MyfmCKo0Y7
507596939525754880,2014-09-04 18:31:55,,0,0,Twitter Web Client,A significant milestone in service to our veterans. http://t.co/ZUNAwcuzCg
507574095467118592,2014-09-04 17:01:09,,0,0,Twitter Web Client,Had meetings yesterday in Follansbee and met with students in Wellsburg. http://t.co/m8GQmwaZqJ
507242075910582272,2014-09-03 19:01:49,,1,2,Twitter Web Client,Traveled to Taylor and Monongalia Counties over the past few days. On the road again today in Brooke County. http://t.co/nqhUx1QYMX
507176063051771904,2014-09-03 14:39:30,,2,0,Twitter Web Client,Looking forward to this discussion. http://t.co/GAdScIDOHN
506872923198865409,2014-09-02 18:34:56,,0,0,Twitter Web Client,This means jobs for West Virginia. http://t.co/2xW9AtFZZk
506820271639379968,2014-09-02 15:05:43,,1,0,Twitter Web Client,This year was a great success. http://t.co/rkPn5IjCCc
505420915300376577,2014-08-29 18:25:11,,0,0,Twitter Web Client,A clear and concise strategy should be the priority on this. http://t.co/5yn757udWF
505402297825099777,2014-08-29 17:11:12,,1,1,Twitter Web Client,This grant will be a tremendous help to our families. http://t.co/vwkESqzwwS
505350905949339649,2014-08-29 13:46:59,,0,0,Twitter Web Client,Trust not yet regained. http://t.co/ts5A6Tr4po
505066941682548737,2014-08-28 18:58:37,,1,0,Twitter Web Client,Certainly a lot of work to be done. http://t.co/jPshmOU3rM
505027021584760832,2014-08-28 16:19:59,,0,0,Twitter Web Client,An interesting idea. http://t.co/3XEjPUSABM
504682967193878528,2014-08-27 17:32:50,,1,1,Twitter Web Client,Yesterday we met with the Wheeling Rotary Club and Change Inc. in Weirton. http://t.co/DEK1ka3KAe
504667234959360000,2014-08-27 16:30:19,,0,1,Twitter Web Client,Glad some of our veterans can share this with their communities. http://t.co/efDGKw8hzA
504640013699919873,2014-08-27 14:42:09,,2,0,Twitter Web Client,More news of success coming out of the Clarksburg FBI facility. http://t.co/Yrc4hcyGCl
504009853774594048,2014-08-25 20:58:07,,1,0,Twitter Web Client,http://t.co/X01r0neoDx
503940862158835712,2014-08-25 16:23:58,,0,0,Twitter Web Client,Happy 98th Birthday to the National Park Service! http://t.co/bUJck7Ws2y
503930351446933504,2014-08-25 15:42:13,,2,0,Twitter Web Client,How important is your local US Post Office to you? USPS is holding hearings to get your input http://t.co/y4cVn5tJ8M
503921860929912832,2014-08-25 15:08:28,,0,0,Twitter Web Client,Good to see our roads getting some attention. http://t.co/0To8oo2sr1
503909771792351232,2014-08-25 14:20:26,,0,0,Twitter Web Client,http://t.co/8rNcHMTrSq
502919111060758529,2014-08-22 20:43:54,,2,1,Twitter Web Client,Some of our firefighters traveled clear across the country to lend a hand. Now that is bravery. http://t.co/vQNgCl9oNB
502890477277151232,2014-08-22 18:50:07,,0,0,Twitter Web Client,http://t.co/d17Zv0BuIh
502858716195356675,2014-08-22 16:43:55,,0,0,Twitter Web Client,Congratulations! What a great opportunity. http://t.co/xRfK4rgY0D
502856098639278080,2014-08-22 16:33:31,,1,1,Twitter Web Client,Welcome home. http://t.co/1PAhIZqwSE
502540877169164288,2014-08-21 19:40:56,,1,1,Twitter Web Client,Fantastic news for the students of West Virginia. http://t.co/euiPSM449C
502503213439139841,2014-08-21 17:11:16,,1,0,Twitter Web Client,Rep. McKinley meets with student veterans at WVU and student reporters from the Daily Athenaeum. http://t.co/wl25b8imjp
502451572027437056,2014-08-21 13:46:04,,0,0,Twitter Web Client,http://t.co/vz8voqw6fo
502177779291783168,2014-08-20 19:38:07,,0,0,Twitter Web Client,Troubles continue with Obamacare. http://t.co/GszC7Bxasy
502149193293914112,2014-08-20 17:44:31,,4,3,Twitter Web Client,Also sat down with the Rotary Club in Cameron yesterday. http://t.co/Ba1Dntgw4n
502132642058629120,2014-08-20 16:38:45,,3,4,Twitter Web Client,Good roundtable discussion yesterday in Moundsville. http://t.co/PoCbIyxOlU
502111230124105728,2014-08-20 15:13:40,,0,0,Twitter Web Client,How important is your local US Post Office to you? USPS is holding hearings to get your input http://t.co/y4cVn5cG6M
502104679019724801,2014-08-20 14:47:38,,6,6,Twitter Web Client,Met with law enforcement yesterday in Marshall County. http://t.co/FdVihD1dw1
501808598977359873,2014-08-19 19:11:07,,3,3,Twitter Web Client,http://t.co/S9XxOKI6LO
501807031414980610,2014-08-19 19:04:54,,1,0,Twitter Web Client,How important is your local US Post Office to you? USPS is holding hearings to get your input http://t.co/y4cVn5cG6M http://t.co/5wm8fXtlAQ
501799452764803072,2014-08-19 18:34:47,,1,0,Twitter Web Client,Met with Army Corps and city officials yesterday on Wheeling Island. http://t.co/IdzBP0qZAS
501788515659960320,2014-08-19 17:51:19,,1,1,Twitter Web Client,"Have a great semester, WVU! http://t.co/0A968YzXO6"
501729660729040896,2014-08-19 13:57:27,,0,0,Twitter Web Client,http://t.co/68Z45pu2DF
501462740888981504,2014-08-18 20:16:48,,4,2,Twitter Web Client,The debate continues on Common Core. http://t.co/d6haHCbwQX
501437164090310657,2014-08-18 18:35:10,,1,0,Twitter Web Client,A reminder of how our veterans need our help connecting with jobs. http://t.co/tiJ6yDaER7
501426490429689856,2014-08-18 17:52:46,,3,0,Twitter Web Client,Investigating yet another HHS blunder. http://t.co/QLQgzfYkPm
501409681815113728,2014-08-18 16:45:58,,2,0,Twitter Web Client,Obama returns to Washington just after midnight Monday for a two-day break from a summer vacation http://t.co/ls9MlJ0RK8
499629282214166529,2014-08-13 18:51:18,,2,1,Twitter Web Client,"Yes to energy, yes to jobs http://t.co/5e8ZyVqRhx"
499615100677152768,2014-08-13 17:54:57,,1,0,Twitter Web Client,A step in the right direction. http://t.co/s91LRiUdzy
499575928910249984,2014-08-13 15:19:17,,3,2,Twitter Web Client,Obama Administration acts behind the scenes yet again: http://t.co/gwppNai8WB
499185844784467968,2014-08-12 13:29:14,,3,1,Twitter Web Client,The IRS debacle continues: http://t.co/s6YJ2dRRtG
497844982825648128,2014-08-08 20:41:08,,3,2,Twitter Web Client,"Rep. &amp; Amy McKinley meet with reps. of The ARC, dedicated to helping people with intellectual and dev. disabilities. http://t.co/v3zISqGpx7"
497767723116806144,2014-08-08 15:34:07,,2,0,Twitter Web Client,"After conducting a Philanthropy Roundtable in Ohio Co., Rep. McKinley tours the Grow Ohio Valley site on the Island. http://t.co/kqFsJaspW8"
497729473505423360,2014-08-08 13:02:08,,1,1,Twitter Web Client,Rep. McKinley tours the Kesterson Farm in Parkersburg. He was the keynote speaker at the Wood Co. Farm Bureau banquet http://t.co/Gj6EqJYYzh
497501593835941888,2014-08-07 21:56:37,,1,0,Twitter Web Client,Rep. McKinley speaks to members of the Kiwanis Club of Wheeling. He addressed issues including the economy. http://t.co/wH9B6DlTOa
497499874963644417,2014-08-07 21:49:47,,5,5,Twitter Web Client,Rep. McKinley conducts a Philanthropy Roundtable in Wheeling for area organizations in Ohio County. http://t.co/aNvsxaM4ex
