id,created_at,coordinates,retweets,favorite_count,source,text
816429886986485760,2017-01-03 23:43:48,,97,394,Twitter Web Client,It was an honor to be sworn into the #115thCongress.  I'm excited to continue to represent Kansas' 4th congressiona… https://t.co/2C4n9jFPfJ
812779959035056130,2016-12-24 22:00:17,,115,379,Hootsuite,"From my family to yours, I wish you a very Merry Christmas &amp; a Happy New Year.  Read my full Christmas message here… https://t.co/RHiJBewZ4l"
811724460743081984,2016-12-22 00:06:07,,25,76,Twitter Web Client,"True humility, solid character, class act. Edgar Poe is already well on his way to becoming a fine leader. https://t.co/bIO1BTsHqX"
810557391859253248,2016-12-18 18:48:36,,31,79,Twitter Web Client,The FAA's new small airplane rule is a huge win for South Central Kansas &amp; the entire general aviation community. https://t.co/uyYKCE2gQh
809129479931129857,2016-12-14 20:14:35,,12,40,Twitter Web Client,Daishon Smith’s dunk on Saturday is definitely one to add to this list. @GoShockers #watchus https://t.co/cfKeHp4tei
808038877495750656,2016-12-11 20:00:55,,88,204,Hootsuite,"“Santa’s Village” has returned to Wichita this year. Looks great, @kirstiealley! Thank you for sharing it. #Kansas https://t.co/pRj6ZlkIMI"
807772628048089088,2016-12-11 02:22:56,,44,207,Twitter for iPhone,What a game!  An incredible team effort that had me on the edge of my seat the whole game.  The drought is over - #GoArmy!
807626961237540864,2016-12-10 16:44:07,,77,152,Twitter for iPhone,"Great to see @WestPoint_USMA Cadet, First Captain, and Newton, KS native Hugh McConnell on @CollegeGameDay! #GoArmy https://t.co/QiSa0bCVLw"
807384165117259776,2016-12-10 00:39:20,,32,129,Twitter Web Client,"Our staff is ready for a pretty important game tomorrow, and they clearly know which side of the line to be on!… https://t.co/nM3QAfmFfy"
806978646456016897,2016-12-08 21:47:56,,22,59,Twitter Web Client,Can't wait until Saturday... Go Army! https://t.co/QFE7qZRrhG
806542041672978432,2016-12-07 16:53:02,,86,164,Twitter Web Client,"75 years ago, a day that will live in infamy. I reflect on the Pearl Harbor attack here: https://t.co/KXZ7SHUMu3 #PearlHarborRemembranceDay"
806144708812636160,2016-12-06 14:34:10,,63,115,Twitter Web Client,I'm excited for what the future of medicine holds w/ the passage of the 21st Century Cures Act. Read more: https://t.co/C90eDfisaT #CuresNow
805144162442117120,2016-12-03 20:18:21,,38,163,Twitter Web Client,Susan and I had a wonderful time today at @KCSL's Red Stocking Breakfast. It was an honor to serve such a worthy ca… https://t.co/nebmQXYnPN
804846023625609216,2016-12-03 00:33:40,,28,63,Twitter Web Client,Congratulations to Newton artist Phil Epp on being inducted into the @CowboyArtists! https://t.co/O1xCfLlMRZ
803728487248961536,2016-11-29 22:32:58,,44,99,Twitter Web Client,"During the holiday season, shelters like the Harvey County Homeless Shelter are doing amazing work. Read more: https://t.co/o92ULLZsoE"
803044805269803008,2016-11-28 01:16:16,,20,61,Twitter Web Client,Congrats to @JamieCruce &amp; Pratt H.S. on their first state title in over 20 years. 403 rushing yards - Amazing! https://t.co/83rWxzFL3l
802965251952115712,2016-11-27 20:00:09,,12,59,Twitter Web Client,Congratulations to Derby H.S. on back-to-back state championships!  What a thrilling finish to an amazing year. https://t.co/7kvsd5jtx8
801836184595009536,2016-11-24 17:13:38,,114,484,Twitter Web Client,Happy Thanksgiving to you and yours! I am thankful for the faith you have placed in me to represent you.  Read more: https://t.co/Q90zNULGH9
801440291584638976,2016-11-23 15:00:30,,9,75,Hootsuite,The Shockers take on LSU down in the Bahamas today and you can bet I'll be watching. Go Shox! #WatchUs
800476381284945920,2016-11-20 23:10:16,,16,79,Twitter for iPhone,4-0!  The Shockers are off to another hot start.  Bring on LSU!  #WatchUs
800398528132632576,2016-11-20 18:00:54,,16,104,Hootsuite,The Shockers look to make it a 4-0 start this afternoon at Koch Arena - I hope the crowd brings the energy &amp; noise! Go Shox! #WatchUs
799775492610134018,2016-11-19 00:45:11,,4811,8616,Twitter Web Client,I am honored and humbled to accept the President-elect’s nomination to lead the @CIA . Read my full statement: https://t.co/AFTr80dTds
799266269853863937,2016-11-17 15:01:43,,5951,6210,Hootsuite,I look forward to rolling back this disastrous deal with the world’s largest state sponsor of terrorism. https://t.co/bifC97jWpY
798903571618131969,2016-11-16 15:00:29,,71,206,Hootsuite,"Congrats to Gen. Richard Myers, President of @KState! I'm glad Gen. Myers' leadership will continue to serve #Kansas https://t.co/3SQ9w8gRmU"
798659933705105409,2016-11-15 22:52:21,,466,532,Twitter Web Client,Extending sanctions on Iran’s weapons programs is vital to protect America. Read my statement on House bill passage: https://t.co/LCHOISPWYC
798340645807067144,2016-11-15 01:43:37,,97,179,Twitter Web Client,The stories of our veterans’ service are of tremendous value to the next generation. Read more: https://t.co/ZCOq2GOgrn
797907021886619652,2016-11-13 21:00:33,,70,151,Hootsuite,It was wonderful to visit @AndoverMS on Veterans Day. Thanks to all the veterans in your families who've helped kee… https://t.co/whFdwFVROs
797846802724691968,2016-11-13 17:01:15,,190,260,Hootsuite,ICYMI: I was interviewed by @BretBaier for his documentary “How We Fight” on the Iran deal &amp; how it was sold to us. https://t.co/gKTK0W2Mtw
797595267629547524,2016-11-13 00:21:45,,34,64,Twitter Web Client,Thanks to American Legion Post 81 &amp; El Dorado High School for inviting me to be a part of your veterans celebration. https://t.co/tKCRVygZru
797484414259367936,2016-11-12 17:01:15,,193,278,Hootsuite,It’s my hope that President-elect Trump will make the undemocratic practice of executive orders a thing of the past. https://t.co/q3AeTc9B1v
797176563930308608,2016-11-11 20:37:58,,19,53,Twitter Web Client,It was wonderful to be in El Dorado today with the American Legion. Please join me in thanking our nation's veteran… https://t.co/ZLwnqv2JXr
796896688564817920,2016-11-11 02:05:50,,61,109,Twitter Web Client,"As a veteran, I know the skills that armed service gives you. I'm proud to have a great team of vets serving Kansas: https://t.co/FlL3TYJlD3"
796836677440458752,2016-11-10 22:07:23,,43,91,Twitter Web Client,Thank you to the brave men and women of the United States Marine Corps. Happy 241st Birthday! https://t.co/Nq9MFtqafl
796397568695603202,2016-11-09 17:02:31,,18,35,Hootsuite,Check out this new video of Doc landing at @FlyICT! A testament to the longevity of the Air Capital of the World. https://t.co/Gs57ONOMri
796064972778442752,2016-11-08 19:00:54,,31,38,Hootsuite,"In the final act of @BretBaier's, ""How We Fight,"" I explain the adverse effects of the Iran Deal on America. https://t.co/gKTK0W2Mtw"
796019832705650695,2016-11-08 16:01:32,,11,33,Hootsuite,Our government works best when we're all involved &amp; the US works best when as many Kansans as possible are involved. https://t.co/ckkMNz9Sbr
795777508650156032,2016-11-07 23:58:37,,8,16,Hootsuite,Miss @SpecialReport Saturday? @BretBaier debuted a special segment from his documentary “How We Fight.” Watch: https://t.co/vx86zm8C1z
795340211186257920,2016-11-06 19:00:57,,6,21,Hootsuite,"After this election, we'll all be ready for some pizza &amp; beer. Luckily a new restaurant is opening just in time! https://t.co/2T2gU3YFTR"
795023060109758464,2016-11-05 22:00:43,,37,42,Hootsuite,Wonder what an #Iran hostage survivor thinks about US policy? Ready in @TIME from @UANI affiliate Barry Rosen https://t.co/L20rnKwKUy
794985734427938816,2016-11-05 19:32:23,"{u'type': u'Point', u'coordinates': [-97.29721469, 37.72168298]}",2,7,Instagram,First Wichita State basketball game of the year with Susan and Nick! #goshox #watchus @ Wichita… https://t.co/6VPRCjSrzT
794978765411586049,2016-11-05 19:04:42,,3,14,Twitter for iPhone,Getting ready to enjoy the first Wichita State basketball game of the year with Susan and Nick! #goshox #watchus https://t.co/7d6Ug7Iyll
794962818801995776,2016-11-05 18:01:20,,2,4,Hootsuite,Congrats to Coco Anguiano from Wellington for being recognized as the Professional of the Year by the KHCA/KCAL! https://t.co/xDwuswi8QH
794600550339846149,2016-11-04 18:01:48,,3,9,Hootsuite,Congrats to the St. John High School boys cross country team for capturing the 2A state title. Hard work pays off! https://t.co/9ilmASvClj
794573957001347080,2016-11-04 16:16:08,,14,38,Twitter for iPhone,It's great to see so many people come out to @FlyICT &amp; greet America's heroes returning from Kansas Honor Flight! https://t.co/wShdnKIEOV
794222975738376192,2016-11-03 17:01:28,,1,7,Hootsuite,Many Kansans are at #NBAA2016 right now working to sell planes and create more jobs here in the Air Capital of the World!  Good luck!
793966026555871234,2016-11-03 00:00:26,,2,11,Hootsuite,"Yesterday I was back at @WichitaState, this time visiting with Dr. Ken Ciboski’s class.  It was great to meet our f… https://t.co/1EpqI4TIf0"
793860460407848960,2016-11-02 17:00:57,,3,7,Hootsuite,The Air Capital of the World continues to thrive - Congrats @SpiritAero! https://t.co/W5yL6fLdgp
793573709399359488,2016-11-01 22:01:30,,263,277,Twitter Web Client,I’ve read Top Secret emails from Hillary's server. She got preferential treatment. I hope that never happens again. https://t.co/tK9RQ4DHlJ
793180912448045056,2016-10-31 20:00:40,,6,15,Hootsuite,"Sherman is practicing his ""trick or treat"" skills.  To all our south central Kansas trick-or-treaters: be safe, hav… https://t.co/Zz7eUXbPyL"
793161895427526657,2016-10-31 18:45:06,,3,14,Twitter for iPhone,Great Kansas people built it and have made dozens of customers around the world more efficient and productive.… https://t.co/GRCZwmU16z
792883692410589184,2016-10-31 00:19:37,,9,0,Twitter for iPhone,RT @Danger6_1ID: .@FightingFirst #Soldiers are ready to support the Coalition as the #IraqiArmy moves forward to #defeatDaesh. https://t.co…
792848802550079488,2016-10-30 22:00:59,,3,5,Hootsuite,Check out my Washington Legal Foundation piece on the GE food-labeling law @WashLglFndt: https://t.co/5OUAf91yk5
792758177993547777,2016-10-30 16:00:53,,10,22,Hootsuite,I joined 200+ Reps in defending CA soldiers &amp; demanding halt of recoupment of bonuses. Glad @DeptofDefense acted. https://t.co/XSh5xoKKZG
792440996579700736,2016-10-29 19:00:31,,33,62,Hootsuite,I regret the FBI closed this case initially. @HillaryClinton mishandled classified info that put our troops at risk. https://t.co/QTKsaTpoEI
792117599454818304,2016-10-28 21:35:27,,76,104,Twitter Web Client,.@HillaryClinton should no longer be given classified briefings. We can’t run the risk. My full statement: https://t.co/dejqUYwdp7
792070117421088769,2016-10-28 18:26:46,,61,40,Twitter Web Client,.@POTUS denying answers to Congress &amp; Americans on #Iran. Read my letter to @LorettaLynch w. @SenRubioPress. https://t.co/3jYkwdlaHV
791992022118887424,2016-10-28 13:16:27,,5,0,Twitter Web Client,RT @AmericaNewsroom: Joining us today... @KellyannePolls @Reince @TuckerCarlson @FoxNewsSunday @RepMikePompeo @kkondik @MelissaAFrancis and…
791670536732639233,2016-10-27 15:58:59,,2,10,Twitter Web Client,I had a great time speaking to Kingman High School's senior class this morning. Best of luck to you all - Go Eagles! https://t.co/zx0jhgbzLK
791293816942854144,2016-10-26 15:02:02,,36,37,Hootsuite,So what is the truth Mr. President? https://t.co/Tvb5uA4RbY
791050773568204800,2016-10-25 22:56:16,,6,20,Twitter for iPhone,It was wonderful to be with you all.  @SouthwesternCRs are ready. Let's go crush this election in Cowley County and… https://t.co/41XW6NxOQK
790998777263947780,2016-10-25 19:29:39,,4,9,Twitter Web Client,"I enjoyed visiting with @KUSM_Wichita students, faculty and staff. They are doing incredible work to deliver stella… https://t.co/6BECJamz9x"
790673374859128832,2016-10-24 21:56:37,,6,8,Twitter Web Client,"“#Iran's for-profit imprisonment of US Citizens"" @washingtonpost Ed Board on ridiculous 10yr sentences for Namazis https://t.co/sXiXZ0p22Q"
790241470334787588,2016-10-23 17:20:23,,5,15,Hootsuite,Native Wichitan &amp; former US Army Captain Alex Holladay stopped by the office for a tour w/ his father. Thanks for y… https://t.co/cMD8ezfOQ0
789983475369639937,2016-10-23 00:15:12,,38,27,Hootsuite,"Iran takes Americans hostage &amp; their proxies fire on US ships, yet our leads work hard to gin up business for them. https://t.co/QM5Az9sWtx"
789980623200935936,2016-10-23 00:03:52,,18,112,Twitter for iPhone,Congratulations Fred.  Much deserved.  Go @Raptors.   You made a great bet on yourself. We are all so proud.… https://t.co/fiCQhNwlKw
789912334676307968,2016-10-22 19:32:31,,2,7,Twitter Web Client,.@POTUS has issued a Major Disaster Declaration for counties impacted by the September flooding in #Kansas. https://t.co/PeZNADBIOK
789844173293756416,2016-10-22 15:01:40,,2,5,Hootsuite,.@GoShockers basketball is right around the corner! Check out this video explaining basketball’s original rules: https://t.co/LH9mdJ8UGg
789516733598068736,2016-10-21 17:20:32,,1,10,Hootsuite,"It was a perfect day for a visit to the Speaker’s Balcony! Thank you for stopping by your office, Gary Rivers and f… https://t.co/FLyE7OdCGt"
789222036178632704,2016-10-20 21:49:31,,66,62,Twitter Web Client,"Thanks to Obamacare, Kansans have seen a 36.6% increase in average healthcare prices since last year. Unacceptable. https://t.co/k1bGjdued5"
789106551986409472,2016-10-20 14:10:37,,16,0,Twitter Web Client,"RT @HouseForeign: Chairman @RepEdRoyce on unjust conviction of Iranian-Americans: ""a complete and total sham"" https://t.co/0sFRWT4mqf"
788794453985071105,2016-10-19 17:30:27,,5,14,Hootsuite,"I’m a WSU Shocker at heart, but Eric Glendinning &amp; @KUSM_Wichita grads are making a big difference in medicine. Tha… https://t.co/USRYmHFHzm"
788530440089010176,2016-10-19 00:01:21,,14,19,Hootsuite,Pat Kennedy is the quintessential bureaucrat. It’s clear he was protecting himself and Hillary from responsibility. https://t.co/2sOsEcKRtk
788379573624897536,2016-10-18 14:01:52,,6,9,Hootsuite,Today is the last day to register to vote before the November election!  Check if you’re registered here: https://t.co/ut27f3p21y
788137612393545728,2016-10-17 22:00:24,,47,49,Hootsuite,I demand an investigation into alleged ‘quid pro quo’ arrangements between the State Dept &amp; FBI. Read more: https://t.co/Zhv3Y5bkx7
788033315496456192,2016-10-17 15:05:58,,4,13,Twitter Web Client,My trip to @WpsBrooks was outstanding. Read my weekly newsletter to learn why: https://t.co/hh7dWiMtlD
787337503904763904,2016-10-15 17:01:03,,2,4,Hootsuite,"Are you registered to vote this November?  If you’re not sure, read this article on how to find out: https://t.co/FeLsWFkyZL"
787081310573621248,2016-10-15 00:03:02,,9,19,Twitter Web Client,Many thanks to local and federal law enforcement for their quick actions to stop this hateful act before it began. https://t.co/witNDe1tvS
786673080387170306,2016-10-13 21:00:52,,12,26,Hootsuite,"Happy #241NavyBday! With recent reports of missile attacks against our ships, it's as important as ever to keep our… https://t.co/dfoWMNzlWa"
786420610150731776,2016-10-13 04:17:39,,29,24,Twitter for iPad,Iranian backed rebels fire at U.S. Navy. President responds by approving sale of planes to the Ayatollah. Genius. https://t.co/rEmoGxbcCS
786354551062310913,2016-10-12 23:55:09,,15,30,Twitter Web Client,Happy #NationalFarmersDay to all the men &amp; women across South Central Kansas and America that work hard every day t… https://t.co/yvFe2Nu8hw
786294984487993344,2016-10-12 19:58:27,,3,15,Twitter Web Client,Congrats to @SpiritAero on their 500th Boeing 787 Dreamliner! Wichita truly is the Air Capital of the World. https://t.co/iRFkHRs53w
785844673730449408,2016-10-11 14:09:05,,21,26,Twitter Web Client,"Read my thoughts on @POTUS's latest legal changes for #Iran. ""Green lights business w. terrorists"" 
https://t.co/y2JFU3ncEV"
785510917379330052,2016-10-10 16:02:51,,18,63,Hootsuite,"Happy Columbus Day!  Did you know, just a short walk from my Washington D.C. office, a statue of Columbus stands in… https://t.co/RU4TxAGsaZ"
784906358936203264,2016-10-09 00:00:33,,3,8,Hootsuite,Miss my op-ed in the @DerbyInformer on reforming the VA?  Read it here: https://t.co/7rEQ8AumDH
784792356289650688,2016-10-08 16:27:33,,47,0,Twitter Web Client,RT @SenRubioPress: .@RepMikePompeo &amp; I requested more info on @TheJusticeDept's role in approving ransom payments to #Iran. https://t.co/vX…
784402679846109184,2016-10-07 14:39:07,,55,48,Twitter Web Client,.@SenRubioPress &amp; I asked @LorettaLynch why she approved sending #Iran $1.3 billion in cash. Read more here: https://t.co/eWo04zv4bX
784207977146220544,2016-10-07 01:45:26,,5,13,Twitter for iPhone,Way to go Conor!  Go Shox. Ex-Shocker Conor Gillaspie’s home run lifts Giants in NL wild-card game  https://t.co/qqnRzkbww7
784141389785333764,2016-10-06 21:20:50,,7,23,Twitter Web Client,".@SenatorDole, thanks for taking the time to meet Kansas Honor Flight vets today, including Loren Tracey &amp; his gran… https://t.co/GrdRZ2iawr"
783780190170255360,2016-10-05 21:25:33,,5,9,Twitter Web Client,As an Army vet I take the caring for our military seriously. Please read my @DerbyInformer op-ed on VA reform here: https://t.co/7rEQ8AumDH
783336582229159936,2016-10-04 16:02:49,,7,16,Hootsuite,Great video of “Doc” taking to the Kansas skies for the second time.  What a sight! https://t.co/G4K7oDn26Y
783103123694858240,2016-10-04 00:35:08,,66,56,Hootsuite,I am proud to stand with my colleagues in condemning this illegal action to bring GTMO detainees to Kansas. https://t.co/aLlNsJJ2Jj
783052719355490304,2016-10-03 21:14:51,,4,11,Twitter Web Client,L’Shanah Tovah! https://t.co/cjN2r3n4FF
782566118963736577,2016-10-02 13:01:16,,2,13,Hootsuite,"Thank you fellow Wichitans, Ross &amp; Lindsey Hellwig, for stopping by the office. It was great to be able to visit wi… https://t.co/iqVstxnY52"
782369723543584769,2016-10-02 00:00:52,,6,16,Hootsuite,Congrats to @Cessna for winning $23m contract for 6 Caravan aircraft. #Wichita continues to be a great aviation city https://t.co/wnSQHmP0lZ
782333268112707584,2016-10-01 21:36:00,,14,26,Twitter for iPhone,No surprise. Obamacare was destined to fail. Progressives demand more of your $ to double down to avoid collapse. https://t.co/Sl1foKhaqh
782218830844162050,2016-10-01 14:01:16,,2,12,Hootsuite,Thank you Carolyn Winn for stopping by the office!  Looks like you settled in pretty well.  Thank you for bringing… https://t.co/wBOFJqiE3v
781971034148855810,2016-09-30 21:36:37,,4,6,Twitter Web Client,"Lynn &amp; David Gilkey represent the best of Kansas &amp; America. Read my statement on Lynn's recognition from @POTUS: 
https://t.co/G3yx6l5BRn"
781863941664280579,2016-09-30 14:31:04,,7,6,Hootsuite,Kansan @rogernoriegaUSA on peace process in #Colombia. FARC can be defeated. Colombians will decide &amp; US can support https://t.co/ooWQLAcv1K
781652366533812225,2016-09-30 00:30:21,,4,14,Hootsuite,"Wichitan and Air Force veteran, Glenn Bindley, dropped by my office.  Hope you had a great visit and thank you for… https://t.co/sGl7PfMZTd"
781610792261132288,2016-09-29 21:45:09,,2,3,Hootsuite,".@TomWheelerFCC delays set-top box vote, needs issue fixes.  @Rep_DevinNunes &amp; I talk privacy/security in a letter: https://t.co/wZ89Hnr3PK"
781591834380398593,2016-09-29 20:29:49,,11,11,Twitter Web Client,Welcome to Wichita @MAXaero_ICT. Thanks for continuing to invest &amp; grow in the Air Capital of the World!  https://t.co/qlP1IORJZF #Kansas
781298270870142976,2016-09-29 01:03:18,,5,19,Twitter Web Client,"My friend Joseph Elmore, along with some friends and family, visited my Washington office last week. I hope you all… https://t.co/HGSaaef6RH"
781175934879686656,2016-09-28 16:57:11,,989,0,Twitter Web Client,RT @PresidentPeres: https://t.co/9Kh0ZGz1bh
781156912696025088,2016-09-28 15:41:35,,17,0,Twitter Web Client,RT @WSJopinion: Sweden failed. Norway succeeded—in part because it did what Trump does: Listen:  https://t.co/clczTD8LPT @SenTomCotton and…
780895219923423232,2016-09-27 22:21:43,,8,10,Twitter Web Client,"Today, I joined @RadioGaffney to discuss some pressing national security issues.  Listen here: https://t.co/IJmjJZCl5g"
780839210903334913,2016-09-27 18:39:09,,9,11,Twitter Web Client,We must put the interests of Kansans &amp; Americans 1st in the immigration debate. Read my op-ed w/ @SenTomCotton here: https://t.co/1NXLkQmkbf
780594627141304322,2016-09-27 02:27:16,,25,34,Twitter for iPhone,Ridiculous. Iran is a major power today because Barack Obama handed them keys to castle in 2009 speech and in Iran… https://t.co/9M6gFgY5Ca
780560147844325376,2016-09-27 00:10:16,,2,5,Hootsuite,"If your land or business has been impacted by recent flooding, please click here for important info from @SBAgov: https://t.co/taLDXDSqWU"
780556715276300288,2016-09-26 23:56:37,,12,0,Twitter for iPhone,RT @PeterRoskam: Excellent read from my good friend @RepMikePompeo: Friends Don't Let Friends Do Business With #Iran https://t.co/ZeLFK0UKwA
780501469170700288,2016-09-26 20:17:05,,13,35,Twitter Web Client,Yesterday the world lost a golfer-pilot w/ long standing ties to Kansas aviation. Here's Palmer w/ Cessna Chairman… https://t.co/Ls8i7qWEmR
780436720844144641,2016-09-26 15:59:48,,2,9,Twitter Web Client,Flooding continues to affect South Central #Kansas. A special thanks to all brave first responders doing great work. https://t.co/iynQwpuPcQ
780051857297313792,2016-09-25 14:30:30,,11,12,Hootsuite,ICYMI: This week I penned an op-ed explaining why friends don't let friends do business with #Iran. https://t.co/BH2haqg0KL
779821151740493824,2016-09-24 23:13:45,,3,13,Twitter Web Client,Wichita's aviation industry to serve our nation yet again. This time in Africa &amp; Pacific counterterrorism roles. https://t.co/BfgwfFpzCw
779743808145596416,2016-09-24 18:06:25,,32,27,Twitter for iPhone,"This move by @POTUS is dangerous, reckless and wholly unnecessary. https://t.co/CWT8Ucr6K3"
779392667465703424,2016-09-23 18:51:06,,18,19,Twitter Web Client,".@HillaryClinton cronies are getting immunity in home-brewed server, email scandal.  What are they hiding? https://t.co/ew2kvsuzMs"
779354503615217665,2016-09-23 16:19:28,,5,12,Twitter Web Client,I took to the House floor last night to offer my amendments that will help keep Americans safe abroad.  Watch: https://t.co/9QrodIVIs1
779319947658924033,2016-09-23 14:02:09,,13,16,Hootsuite,"If ISIS used mustard gas, it would mark a disturbing shift in tactics. We must get serious &amp; eliminate ISIS. https://t.co/oqtJf4VYpb"
779116885132664832,2016-09-23 00:35:15,,7,26,Hootsuite,"It was a great honor to meet one of the 2015 @usairforce Airmen of the Year, Master Sergeant Faith McNelley, of Cle… https://t.co/wF4kC5f8y7"
779040222675890177,2016-09-22 19:30:37,,3,7,Hootsuite,Happy first day of fall! https://t.co/Vr13YHDJ1z
778997999028633601,2016-09-22 16:42:50,,1,5,Twitter Web Client,I'll be joining @wolfblitzer on @CNN at 12:20pmCT/1:20pmET today to discuss the latest in the NY/NJ bombing investigation. Tune in!
778979739256127488,2016-09-22 15:30:17,,16,13,Hootsuite,I’m saddened &amp; angered that #Iran has imprisoned &amp; fined an American after a secret tribunal. https://t.co/JHbjGmXtqB
778725532544270336,2016-09-21 22:40:09,,16,9,Twitter Web Client,.@POTUS today announced he is essentially helping build the Iranian Air Force. This is reckless &amp; unnecessary. Read: https://t.co/BLPWy9Ba6f
778662863669960704,2016-09-21 18:31:08,,12,28,Hootsuite,"Finally, Eisenhower will get his own memorial in Washington DC.  May this memorial inspire generations of Americans! https://t.co/R5OPXEw5hR"
778588668101615616,2016-09-21 13:36:18,,8,12,Twitter Web Client,Friends don't let friends do business with #Iran. Read my op-ed on the connection between Iranian biz &amp; terror here: https://t.co/Dkxx0XomQq
778392122739286018,2016-09-21 00:35:18,,27,51,Hootsuite,"After 75 years, Sedgwick Co. native Lewis Wagoner's remains have been ID'ed at Pearl Harbor &amp; coming home. Godspeed. https://t.co/YIJD59cJRj"
778377191491010560,2016-09-20 23:35:58,,37,0,Twitter for iPhone,"RT @ForeignPolicy: To avoid funding the Islamic Revolutionary Guards Corps, don't do business in Iran, writes @RepMikePompeo. https://t.co/…"
778360829335011328,2016-09-20 22:30:57,,2,3,Twitter Web Client,The @SBAgov has opened a Disaster Loan Outreach Center in Mulvane for those affected by recent flooding. More info: https://t.co/taLDXDSqWU
778332984919330817,2016-09-20 20:40:18,,149,158,Twitter Web Client,A “cessation of hostilities” in Syria is a joke - helps the Ayatollah &amp; Putin. Let's condemn Assad &amp; pass this bill https://t.co/ZdOPIhqfnJ
778241134116085760,2016-09-20 14:35:20,,10,12,Hootsuite,"Snowden is not a whistleblower by any definition. He is, however, a liar and a criminal. https://t.co/g6aKsDTmRI"
778093140918038528,2016-09-20 04:47:15,,1,11,Twitter for iPhone,We love you.  Thanks for coming out tonight. @SouthwesternCRs rock.
778021065998163968,2016-09-20 00:00:51,,2,7,Hootsuite,The USS Wichita just hit an exciting milestone with its christening! Check it out: https://t.co/0oxnCffthI
777914983376125952,2016-09-19 16:59:19,,19,24,Twitter Web Client,This attack is a reminder that we must stay on the offensive against radical Islam until it's fully eradicated. https://t.co/Ed6B2ApZ2Y
