id,created_at,coordinates,retweets,favorite_count,source,text
659408089398034432,2015-10-28 16:35:14,,0,2,Twitter Web Client,Great news for @northropgrumman &amp; Southern California: https://t.co/vh5xLShbdY @latimes
658780604016795652,2015-10-26 23:01:50,,1,2,Twitter Web Client,It was an honor to join our WW2 veterans on Saturday. Thank you Honor Flight Southland for making it possible. https://t.co/RER4k2ZMgX
658725726313689088,2015-10-26 19:23:46,,2,0,Twitter Web Client,RT @RepMarkTakano: Must Read Monday: How @RepPeteAguilar and I are working to help low-income families in the Inland Empire. https://t.co/I…
657682163874320384,2015-10-23 22:17:01,,4,0,Twitter Web Client,Join me on 11/6 for my Holiday Jobs Fair. We'll connect job seekers w/ #InlandEmpire employers. Spread the word: https://t.co/Tn2KxoF5PY
656869154537021444,2015-10-21 16:26:25,,0,2,Twitter Web Client,Investing in public safety is critical for #InlandEmpire community- great to see important funds going to SB County https://t.co/w2tJe9MPdh
656232394194886656,2015-10-19 22:16:09,,0,3,Twitter Web Client,Had a blast reading with our best &amp; brightest at Los Amigos today. Thanks for sharing story time w/ me! https://t.co/lgeVchlbvp
655000490648825856,2015-10-16 12:41:00,,82,54,Twitter Web Client,".@HouseGOP, we must pass a clean bill to honor the full faith &amp; credit of the US immediately! #PeopleOverPolitics http://t.co/mfyO4SA8VL"
654776353292574721,2015-10-15 21:50:22,,0,0,Twitter Web Client,"TY to Josefina, Blanca &amp; Ernesto for sharing your stories w me during #HHM. This week I spoke w Francisco. Read more:http://t.co/G6flar3OIS"
654758414715781120,2015-10-15 20:39:05,,4,9,iOS,Great talking w Chaffey College students about making higher education more accessible &amp; affordable for IE students http://t.co/c7WgTu4x4W
654365057401360384,2015-10-14 18:36:01,,0,3,Twitter Web Client,We need to protect &amp; preserve our desert lands so Inland Empire residents can enjoy them for generations to come. http://t.co/iRobvNn1BD
654350331585908736,2015-10-14 17:37:30,,0,3,Twitter Web Client,Glad to join @SenFeinstein yesterday to talk about the need to protect our desert lands. http://t.co/Dzej0WK1Ee
653318000574078976,2015-10-11 21:15:24,,28,77,Twitter for iPhone,Proud to stand up for lgbt equality &amp; celebrate love. All love is equal. #NationalComingOutDay
651461858478702592,2015-10-06 18:19:45,,6,0,Twitter for iPhone,RT @NormaJTorres: Talking leadership &amp; fighting for our communities @CHCI w/ @RepPeteAguilar @RepRubenGallego &amp; @RepLujanGrisham http://t.c…
651461400653656068,2015-10-06 18:17:56,,2,2,iOS,Glad to join @NormaJTorres &amp; @RepRubenGallego to talk priorities in Congress @CHCI #HHM #collegeaffordability #CIR http://t.co/CC1LJr7TeC
651455385946193920,2015-10-06 17:54:02,,1,0,Twitter for iPhone,RT @StevenColon1: Honored to be part of a great @CHCI panel on education with @JohnKingatED and @RepPeteAguilar #breakingbarriers http://t.…
651455022526504964,2015-10-06 17:52:35,,10,0,Twitter for iPhone,RT @CHCI: .@RepPeteAguilar @RepRubenGallego @NormaJTorres @RepLujanGrisham at #CHCI #2015HHM Leadership Luncheon http://t.co/lUXdQnz1Bx
650358900772995073,2015-10-03 17:16:59,,0,4,Twitter Web Client,Great to see so many Inland Empire students looking to serve our nation at Academy Day this morning! http://t.co/KkjyrmhBoQ
650028016861609988,2015-10-02 19:22:10,,2,3,Twitter Web Client,Hearing Blanca’s story reaffirms my commitment to fighting for comprehensive immigration reform. http://t.co/xq0H8dLht8 #CIR #HHM
649679108595691520,2015-10-01 20:15:44,,3,2,Twitter Web Client,Interested in attending a U.S. Service Academy?Join me this Saturday in Redlands for Fall Academy Day to learn more! https://t.co/bDIAX18xZh
649344163679465476,2015-09-30 22:04:47,,0,2,Twitter Web Client,.@LLUHealth is a top medical facility &amp; an important economic driver for the #InlandEmpire. This is great news: http://t.co/noAy57ecTx
648619209702907904,2015-09-28 22:04:05,,2,4,Twitter Web Client,Necessary funds for Redlands Airport headed our way. Great to see this investment in the Inland Empire economy. http://t.co/d6f5DEwYd8
647403227542065153,2015-09-25 13:32:12,,0,2,Twitter Web Client,The Loma Linda VA center is now holding their Veteran Town Hall from 2:30PM to 4:00PM. http://t.co/XW1FeJaMyh https://t.co/JxNHlNFFnV
647165276769939460,2015-09-24 21:46:40,,1,1,Twitter Web Client,I’m glad the FAA made a critical investment in San Bernardino International Airport. Read more here: http://t.co/De4g4boak6
647089741725347841,2015-09-24 16:46:31,,7,10,Twitter Web Client,I share w/ @Pontifex message of showing humanity &amp; kindness to those seeking a better life in a new world. #PopeInDC http://t.co/9wHWKTyDOG
647029779988901888,2015-09-24 12:48:15,,3,0,Twitter Web Client,RT @NormaJTorres: Ran into @RepPeteAguilar while waiting for @Pontifex mass to begin! #PopeInDC http://t.co/4XIAoj8Sw2
646779400092909569,2015-09-23 20:13:20,,2,2,Twitter Web Client,Grateful to hear Josefina’s story – I’ll fight to keep families like hers together. http://t.co/Xz8rRmEIBH #ImmigrationReform
646441372040347648,2015-09-22 21:50:08,,1,4,Twitter Web Client,Honored to present Det. Musella and Dep. Ramirez w/ the Congressional Badge of Bravery--our very own hometown heroes http://t.co/JsAkT3VMfA
646380012418023424,2015-09-22 17:46:18,,11,0,Twitter Web Client,RT @sbcountysheriff: Congressmen Pete Aguilar honors Detective Justin Musella and Deputy Arturo Ramirez http://t.co/PqwYT7oE9s
646373240126996480,2015-09-22 17:19:24,,36,0,Twitter Web Client,"RT @sbcountysheriff: Dep Ramirez,Sgt Lopez,Det Rosa&amp;Det Musella honored today w/the Congressional Badge of Bravery https://t.co/vTlnf0ze2B …"
646366506490707968,2015-09-22 16:52:38,,6,3,Twitter Web Client,It's #NationalVoterRegistrationDay -- Spread the word to friends &amp; family and make your voices heard. #getregistered http://t.co/86ca9AKQ1r
644932216276025344,2015-09-18 17:53:17,,8,8,Twitter Web Client,Proud to stand up to Republican attempts that limit access to health care for women &amp; threaten reproductive rights. #StandWithPP
644631490467393536,2015-09-17 21:58:18,,2,3,Twitter Web Client,The Latino Dream is the American Dream. Let's invest in education as we celebrate #HispanicHeritageMonth http://t.co/wbf6EXKdsW
643980991569244160,2015-09-16 02:53:27,,2,0,Twitter Web Client,RT @SANBAGnews: @RepPeteAguilar addressing Rail to Redlands Working Group in San Bernardino. #RPRP http://t.co/9Gzeis5Nyg
643845923035054081,2015-09-15 17:56:44,,5,11,Twitter Web Client,"Time to celebrate our roots &amp; #Latinos who've shaped our cultural, social &amp; political world! http://t.co/3oDni1XD7H  #HispanicHeritageMonth"
643525098608164864,2015-09-14 20:41:54,,4,3,Twitter Web Client,Glad I could join @feedingie @CAPSanbernardin @tysonfoods to highlight #HungerActionMonth &amp; food insecurity in #CA31 http://t.co/YpBE1qSN1W
643519278143152128,2015-09-14 20:18:46,,2,0,Twitter Web Client,RT @feedingie: Our friends from @CAPSanBernardin @TysonFoods and @RepPeteAguilar celebrating #Spoontember w/us! #HungerActionMonth http://t…
643519228906221568,2015-09-14 20:18:34,,2,0,Twitter Web Client,"RT @feedingie: Our friends from Community Action Partnership of San Bernardino County, @tysonfoods and U.… http://t.co/f5CiTi3AAJ http://t.…"
643242148121440256,2015-09-14 01:57:33,,4,0,Twitter Web Client,To all who are celebrating: L'shana tovah u'metukah!
642405698681327616,2015-09-11 18:33:48,,1,2,Twitter Web Client,I'll be at Corky's Kitchen &amp; Bakery in Rialto tomorrow at 9AM for Coffee w your Congressman-- stop by to say hello! http://t.co/Avk5tGXz2w
642331606959714305,2015-09-11 13:39:23,,2,0,Twitter Web Client,RT @ivdailybulletin: Remembering victims of Sept. 11 attacks: Editorial http://t.co/eTrkMmvh71
642330843759906816,2015-09-11 13:36:21,,22,0,Twitter Web Client,RT @JoaquinCastrotx: Remembering those we lost and the heroism of first responders 14 years ago today. We will never forget.
642328321070604288,2015-09-11 13:26:20,,0,3,Twitter Web Client,Today--and every day--we remember those lost on 9/11 &amp; those who risk their lives to keep us safe #NeverForget http://t.co/k7GaXPuBg7
641317074195869696,2015-09-08 18:28:00,,1,2,Twitter Web Client,Connecting people w/ federal agencies so we can support middle-class families &amp; grow our economy is my top priority. http://t.co/nzWZn2a9z8
640979379535892480,2015-09-07 20:06:07,,83,0,Twitter for iPhone,"RT @USDOL: The first #LaborDay parade was held on Sept. 5, 1882 in New York City. Get the facts at http://t.co/zLun86CWUe http://t.co/4CtoD…"
640909237632245760,2015-09-07 15:27:24,,0,1,Twitter Web Client,"As we celebrate #LaborDay2015 , let us remember the hard working Americans who got us here. http://t.co/aRpEMd1Kpy"
639562087253979136,2015-09-03 22:14:18,,1,0,Twitter Web Client,"#ICYMI ""Aguilar Continues Tour of Inland Empire Healthcare and Assistance Facilities"" http://t.co/1fOhUIAYP2"
639199608875413505,2015-09-02 22:13:57,,1,3,Twitter Web Client,"As we mark the 70th anniversary of #VJday, we remember those who fought and gave their lives to keep our country safe and free."
639161047451062273,2015-09-02 19:40:43,,2,1,Twitter Web Client,Great sitting down w @joelwaldmanFOX to talk about my journey to Congress &amp; reflect on the first few months. http://t.co/Se4PiTqvzI
637356202545037314,2015-08-28 20:08:54,,0,1,Twitter Web Client,"""Aguilar hosts discussion to highlight opportunities for county businesses"" Read here: http://t.co/plfJMg1XDm @HeraldNews1 #CA31 #smallbiz"
637027896792600576,2015-08-27 22:24:20,,0,0,Twitter Web Client,"#ICYMI: ""Hundreds of seniors are assisted during event at Victoria Gardens"" http://t.co/ZWVl3kqziG @HeraldNews1 #CA31 #InlandEmpire"
636656571439816704,2015-08-26 21:48:49,,1,3,Twitter Web Client,Loved touring Gate City yesterday. Great local biz &amp; job creator for the #InlandEmpire We must support small business http://t.co/nk99tyINkE
636556787110551552,2015-08-26 15:12:19,,1,3,Twitter for iPhone,Happy #nationaldogday from the Aguilar office! #molly #lucius #phin #jake http://t.co/Y1tU15iOLw
636295780739993601,2015-08-25 21:55:10,,0,2,Twitter Web Client,Great meeting with @MCS4Biz yesterday to discuss small biz growth in the #InlandEmpire. Read more here: http://t.co/4n1LUAcKyI
635964970472239109,2015-08-25 00:00:39,,9,0,Twitter Web Client,RT @MCS4Biz: At @IE_EconPtnrship w/ @RepPeteAguilar to learn how @SBAgov can grow more #SmallBiz in the #InlandEmpire http://t.co/kLdW0zhxBt
635949278079401984,2015-08-24 22:58:17,,3,1,Twitter Web Client,Glad to host @SBAgov and local lenders today. Improving access to credit &amp; capital helps #IE small biz grow. http://t.co/ClJuV6IwFV
635857567412015104,2015-08-24 16:53:52,,6,0,Twitter Web Client,RT @SANBAGnews: @RepPeteAguilar speaks about infrastructure and investment at #sbtc2015 event. @Omnitrans @FTA_DOT @cityofsbdo http://t.co/…
634793464970895360,2015-08-21 18:25:30,,5,0,iOS,What an incredible turnout at today's Senior Fair. TY to everyone who joined us -- looking forward to the next one! http://t.co/gelZIrqB6j
634524666074374144,2015-08-21 00:37:23,,5,0,iOS,Congrats to the Inland Empire Job Corps class of 2015! Your work and perseverance strengthens the fabric of our city. http://t.co/X5cRAWHCuy
634521510401732608,2015-08-21 00:24:51,,2,17,Twitter Web Client,Thanks again to everyone who stopped by last night. Please swing by our new office in San Bernardino to say hello! http://t.co/isGi2JsmuZ
634219123438809089,2015-08-20 04:23:16,,2,1,iOS,An office opening isn't complete unless you have at least one selfie stick photo. Thanks to everyone who stopped by! http://t.co/P0rDbRnYcl
634070069501382656,2015-08-19 18:30:59,,5,1,Twitter Web Client,Supporting Inland Empire small biz is crucial as we work to get our local economy back on track.#StartupDay http://t.co/JCPdSjkAPJ
633730116187590656,2015-08-18 20:00:08,,2,2,iOS,"TY Gentex &amp; Lockheed Martin for letting me ""test drive"" an F-35. Great to see local manufacturers like Gentex @ work. http://t.co/mFMSOjzBJI"
633681619048615936,2015-08-18 16:47:25,,1,1,Twitter Web Client,"I look forward to working w our community hospitals to provide IE residents w affordable, quality healthcare. http://t.co/xU9uw5VSKa @sbsun"
632234010752753668,2015-08-14 16:55:09,,0,2,Twitter Web Client,We recommit to protecting &amp; strengthening #SocialSecurity so every American can retire w/ dignity. #SocialSecurity80 http://t.co/Kx2qo9bkFY
631858690514100224,2015-08-13 16:03:45,,5,0,Twitter Web Client,Please join us next Wednesday as we open our new San Bernardino Office -- doors open at 5PM. Hope to see you there! http://t.co/RNvUG1B1yo
630857981828145152,2015-08-10 21:47:18,,2,1,Twitter Web Client,"These bills will reduce pollution, combat harmful effects of climate change &amp; hold energy companies more accountable. http://t.co/Z02tFQg2yy"
629362507535228929,2015-08-06 18:44:49,,3,2,Twitter Web Client,#VRA50 #RestoreTheVRA http://t.co/5wMyWeeDfG
629038640186925056,2015-08-05 21:17:53,,0,3,Twitter Web Client,#ICYMI: My bill to help #InlandEmpire small biz expand their workforce &amp; reduce our unemployment rate: http://t.co/PzECZ5WO9t @sbsun
628691620490280961,2015-08-04 22:18:57,,2,0,Twitter Web Client,Judge Gee made an important ruling last month &amp; I stand w my colleagues in Congress &amp; urge DHS to heed this decision. http://t.co/I6Fq10uOeI
628182643507654656,2015-08-03 12:36:27,,207,94,Twitter Web Client,There are too many places across America where citizens are denied the right to be heard at the ballot box. RT if you agree: #RestoretheVRA!
626875396676558848,2015-07-30 22:01:56,,9,4,Twitter Web Client,"The time is long overdue to improve the roads, bridges and rails that millions of Americans rely on every day. http://t.co/qs1WCogCa8"
626760879799865344,2015-07-30 14:26:53,,6,3,Twitter Web Client,Here's to another 50 years of Medicare and Medicaid! #MedicareMedicaid50 http://t.co/c62urMI9wo
626493892561641472,2015-07-29 20:45:58,,7,12,iOS,Happy to see 1st Latino Poet Laureate Juan Felipe Herrera &amp; congratulate him on accomplishments in Latino community. http://t.co/ovceNgX4nk
625860844304396288,2015-07-28 02:50:27,,4,0,Twitter Web Client,"RT @LBY3: .@RepPeteAguilar introduced his second bill last week, which would offer small businesses tax credits for new hires: http://t.co/…"
624639547155083264,2015-07-24 17:57:27,,5,0,Twitter Web Client,"""Aguilar introduces legislation which would offer small businesses a tax credit"" Read it here! : http://t.co/OCbgpAxfvK @HeraldNews1"
624305348057239556,2015-07-23 19:49:28,,3,2,Twitter Web Client,Please share your personal stories of what makes #SanBernardino a city worth fighting for &amp; encourage @LAtimes to share w/ their readers.
624301013802033153,2015-07-23 19:32:15,,3,0,Twitter Web Client,#SanBernardino is home to the Inland Empire Job Corps—1 of the best workforce training programs in the nation. #whataboutthatstory @LAtimes?
624292997698596864,2015-07-23 19:00:24,,3,0,Twitter Web Client,.@MarsdenDale and @SB_CitySchools doing incredible work decreasing dropout rates &amp; improving ed attainment #whataboutthatstory @latimes ?
624280432234885120,2015-07-23 18:10:28,,2,2,Twitter Web Client,#SanBernardino ‘s story isn’t just about poverty and despair. It’s also a story of resilience and grit. cc: @LAtimes
624279027277266944,2015-07-23 18:04:53,,4,2,Twitter Web Client,Disappointing that @LATimes refuses to show #SanBernardino success stories or profile local organizations dedicated to improving community.
624270724304347136,2015-07-23 17:31:53,,4,0,Twitter Web Client,Time to get the #InlandEmpire economy back on track &amp; put residents back to work—this bill will help us do just that. http://t.co/5BJ5nPSaje
623228313784446976,2015-07-20 20:29:43,,3,0,Twitter Web Client,#ICYMI : Read Francine's personal story about how our workshop last weekend helped her and her family. http://t.co/wBNZmulAur
623228161292140544,2015-07-20 20:29:07,,4,0,Twitter Web Client,RT @HighlandNews1: Aguilar to the rescue for victims of for-profit schools http://t.co/cXJZajCEv7
623188638147452928,2015-07-20 17:52:04,,7,2,Twitter Web Client,We need more training programs &amp; resources to equip residents w/ the skills they need to thrive in the 21st century. http://t.co/LJa8aLovwL
623139646638292992,2015-07-20 14:37:23,,6,1,Twitter Web Client,Thanks to everyone who joined me this weekend in Grand Terrace for Coffee with your Congressman! See you next time! http://t.co/J0l6sH1AHg
622161526863081472,2015-07-17 21:50:41,,0,2,Twitter Web Client,Wishing all those who are celebrating tonight a happy and healthy holiday-- Eid Mubarak!
622087299430486016,2015-07-17 16:55:44,,4,4,Twitter Web Client,Great to stop by Mr. Baca's classroom in Redlands to chat history and civics-- thanks for having me! http://t.co/tV0ivGXvZG
622046369440776192,2015-07-17 14:13:06,,1,1,Twitter Web Client,"Don't forget to join me tomorrow for 'Coffee with your Congressman"" at Food Connection in Grand Terrace @ 9AM! http://t.co/yv9YGgtDMd"
621447402227134464,2015-07-15 22:33:01,,3,1,Twitter Web Client,"It’s time for R Leadership to start governing &amp; bring us a long-term extension that is measured in years, not months. http://t.co/NaAxZ3IZO6"
620999566729592832,2015-07-14 16:53:28,,2,2,Twitter Web Client,Join me on Saturday in Grand Terrace for 'Coffee with your Congressman' at Food Connection @ 9AM. See you there! http://t.co/yv9YGgtDMd
620619493992210433,2015-07-13 15:43:12,,2,0,Twitter Web Client,Take a look: “Rep. Aguilar holds workshop for Everest students who are in financial limbo” http://t.co/HeRUGBNwKr @sbsun
620619040806043648,2015-07-13 15:41:24,,1,0,Twitter Web Client,Glad we were able to organize this event. I relied on student loans &amp; grants &amp; know how stressful the process can be. http://t.co/0NLwLMG7lR
619539098097819648,2015-07-10 16:10:06,,2,0,Twitter Web Client,Allowing this policy to move forward will move women’s healthcare backward–we cannot allow these attacks to continue. http://t.co/Ipu37a3Ep6
618870241557352448,2015-07-08 19:52:18,,7,2,Twitter Web Client,We need to get dark money out of elections &amp; ensure that the people's voice is the loudest. Read more here: http://t.co/qY5j0DzZuh
618517802329198592,2015-07-07 20:31:50,,2,0,Twitter Web Client,I’m proud of the work we've done in the first 6 mo. &amp; look forward to continuing it on behalf of the #InlandEmpire http://t.co/mYm6s9VzaK
618113747383681024,2015-07-06 17:46:16,,3,0,Twitter Web Client,"Those of us who know San Bernardino know that it has never given up or surrendered, no matter the circumstance. http://t.co/JsaZ2irhDZ"
617860964076101632,2015-07-06 01:01:47,,1,1,Twitter Web Client,Congrats @ussoccer_wnt on an amazing victory! We are so proud of you. You've inspired us all. #SheBelieves #USWNT #USA
617716078622429184,2015-07-05 15:26:04,,3903,0,Twitter Web Client,"RT @ussoccer_wnt: GAMEDAY! 23 have inspired a Nation. #OneMore to make a Nation go crazy!
7ET/4PT @FOXTV #OneNationOneTeam #Believe http://…"
617715846228639744,2015-07-05 15:25:09,,2,1,Twitter Web Client,Big game today-- make sure you tune in at 7PM to watch USA vs. Japan in the #WorldCup Final. Go #USA!! #USWNT
617302035919163392,2015-07-04 12:00:48,,16,18,Twitter Web Client,Happy 4th of July! http://t.co/ej5n69q9sT
616667401220964352,2015-07-02 17:59:00,,1,2,Twitter Web Client,"We are forever indebted to those brave souls for their courage &amp; relentless pursuit of liberty and freedom, which pushed our nation forward."
616667258916634624,2015-07-02 17:58:26,,2,2,Twitter Web Client,Today we remember &amp; honor those who risked &amp; gave their lives in the name of equality. #CivilRightsAct http://t.co/drKx8VqMeL
615998384311287808,2015-06-30 21:40:34,,2,0,Twitter Web Client,RT @JHWreporter: VIDEO: Congressman Pete Aguilar throws out the first pitch at the 26th annual Australian Baseball Tour of Redlands http://…
615998032987992064,2015-06-30 21:39:10,,1,0,Twitter Web Client,RT @GirlScoutsSGC: #GenCyber #GirlScoutsRock  @Hardy4countyschools @SupervisorJosie @RepPeteAguilar @girlscouts http://t.co/UFuoGJ6Bqs
615942922580684800,2015-06-30 18:00:11,,2,0,Twitter Web Client,Read my statement about the @ExImBankUS expiration here. http://t.co/ka9aiCQSC1  #ExIm4Jobs
615942778036596736,2015-06-30 17:59:36,,8,8,Twitter Web Client,"Despite bipartisan support for the @ExImBankUS, Republican leadership chose politics over policies that create jobs &amp; grow the economy."
615882882335272961,2015-06-30 14:01:36,,160,0,Twitter Web Client,RT @MaxineWaters: #ExIm4Jobs' charter expires at midnight because of @HouseGOP inaction. Latest #GOPshutdown will cost American jobs &amp; hurt…
614435604185653248,2015-06-26 14:10:38,,29,41,Twitter Web Client,#SCOTUS has spoken: #AllLoveIsEqual #LoveIsLove http://t.co/6jQUZX8FKk
614200796234797057,2015-06-25 22:37:35,,1,0,Twitter Web Client,"RT @MattGuilhem: Saw National Archives &amp; Supreme Court, then spent a few min. w/ @RepPeteAguilar before touring the Capitol. Bit of the #In…"
614200363143557120,2015-06-25 22:35:52,,3,2,Twitter Web Client,It’s so important that young women have access to advanced and changing technology – they are our future. #STEM http://t.co/0DYPvNX4Bo
613813540785360901,2015-06-24 20:58:46,,1,1,Twitter Web Client,We’ve seen the differences that Head Start has made in the lives of children across the Inland Empire and our nation. http://t.co/GcqfYP5M8I
613813298048450560,2015-06-24 20:57:49,,2,2,Twitter Web Client,I’m happy to announce over $42 million for San Bernardino County Head Start programs. #CA31 #InlandEmpire Read more: http://t.co/GcqfYP5M8I
612979414528339968,2015-06-22 13:44:15,,54,27,Twitter Web Client,Is the @HouseGOP really going to allow the job creating Export-Import Bank to shut down? Let's pass #ExIm4jobs now! http://t.co/yCutq2GXHn
611961573066862592,2015-06-19 18:19:43,,4,5,Twitter Web Client,Proud to stand up for Inland Empire business owners -- it's time to reauthorize the @ExImBankUS My statement here: http://t.co/etS0ddmTIw
611644801738481664,2015-06-18 21:20:59,,3,0,Twitter Web Client,I’m proud to have been a part of the bi-partisan effort to see this succeed in the House. http://t.co/GNYY4Kc4OH
611643445690671107,2015-06-18 21:15:35,,3,0,Twitter Web Client,"The medical device tax hurts innovation, has slowed research &amp; development &amp; has cost US jobs. Read my statement here:http://t.co/GNYY4Kc4OH"
611249574242553858,2015-06-17 19:10:29,,1,1,Twitter Web Client,I’m happy to announce this grant for Upland Library &amp; to share in the excitement for our community. http://t.co/RJTRYTh6Dy #InlandEmpire
610917403275489281,2015-06-16 21:10:33,,1,0,Twitter Web Client,"Pleased to stand w Mayor Carey Davis to ensure that our fathers, brothers &amp; sons have access to proper healthcare &amp; take care of themselves."
610916972331671554,2015-06-16 21:08:51,,1,0,Twitter Web Client,This week we recognize Men's Health Week. Read my statement here: http://t.co/PD4ch28lRL
610496552365391873,2015-06-15 17:18:15,,16,14,Twitter Web Client,#DACA is 3 years old today. It's time to finish what we started-- the time is long overdue to repair our broken immigration system.
609459708253110273,2015-06-12 20:38:12,,1,0,Twitter Web Client,RT @CahnEmily: Freshman Dem @RepPeteAguilar rocks one to left field! Dem ace @RepRichmond up now. Dun dun dunnnnn #cbg2015
609080984718426112,2015-06-11 19:33:17,,2,2,Twitter Web Client,Read about my amendment to help curb the suicide rate among female veterans. We can't wait as they suffer in silence. http://t.co/n3mOP80dqd
608761099329134592,2015-06-10 22:22:10,,1,3,Twitter Web Client,Congrats to Juan Felipe Herrera who's been named the 21st Poet Laureate &amp; FIRST Latino Poet Laureate! Felicitaciones! http://t.co/BNQcTQWpA4
608745322848890882,2015-06-10 21:19:29,,3,1,Twitter Web Client,"Today we celebrate the 52nd Anniversary of the #EqualPay Act. We've come a long way, but we have further to go. http://t.co/bv7UJRL8gW"
607960849257492480,2015-06-08 17:22:16,,3,1,Twitter Web Client,"#ICYMI ""Pete Aguilar reflects on SNAP challenge, lists facts and myths""
Read more @RedlandsNews http://t.co/ovELTploIt"
607941294556626944,2015-06-08 16:04:34,,2,6,Twitter Web Client,"Congrats @CSUSBNews grads &amp; thank you Assoc.of Latino Faculty, Staff &amp; Students for having me at Saturday's ceremony! http://t.co/IqWdFnUEsI"
606571414301372416,2015-06-04 21:21:09,,5,3,Twitter Web Client,During #LGBTPrideMonth we celebrate the heroic men &amp; women who've fought for equality &amp; human rights across the world.http://t.co/YZzAEqW6Yi
606137019467726848,2015-06-03 16:35:01,,3,0,Twitter Web Client,Don't forget to sign up! http://t.co/RelOrAc5rg
604263813106548737,2015-05-29 12:31:34,,4,4,Twitter Web Client,Proud to stand w/ veterans in our community &amp; local business owners who prioritize hiring our hometown heroes. http://t.co/PAT4uFCvJw
603989468056580097,2015-05-28 18:21:25,,1,0,Twitter Web Client,Read more about my visit to the Baker Family Learning Center here: http://t.co/GuUdRnTCAl
603989353388449793,2015-05-28 18:20:58,,3,2,Twitter Web Client,Head Start empowers children across the nation to succeed &amp; thrive. TY Baker Family Learning Center for inviting me to visit yesterday.
603699223134117888,2015-05-27 23:08:05,,2,3,Twitter Web Client,Happy to join my former mayor crew for I-215 Bi-County Project ribbon-cutting today. #transportation #infrastructure http://t.co/9ZdHzSfEqb
603690250209202176,2015-05-27 22:32:26,,0,2,Twitter Web Client,This project will help protect our region’s groundwater supply and will reduce our reliance on imported water. http://t.co/0Jy96z30uj
