id,created_at,coordinates,retweets,favorite_count,source,text
819978763790389248,2017-01-13 18:45:46,,4,8,Twitter Web Client,"Great news for job seekers in our country, state and region! https://t.co/E3gWkaZls0"
819978000926146561,2017-01-13 18:42:44,,1,5,Twitter Web Client,These @AppropsDems subcommittees will allow me to be a stronger advocate for SB County. Now let's get to work. https://t.co/dnUGAvgeOk
819291686732001280,2017-01-11 21:15:34,,10,28,Twitter Web Client,Today I joined my @HispanicCaucus colleagues to warn @HouseGOP of the consequences of repealing the #ACA. More here… https://t.co/Fp3F88B0Fs
819290080376487936,2017-01-11 21:09:11,,9,39,Twitter Web Client,TY @RepGutierrez for joining my Immigration Advisory Board (via teleconference!) to talk about how we'll fight to k… https://t.co/3SHRFrGX6p
818529065921548288,2017-01-09 18:45:11,,7,0,Twitter Web Client,RT @JeffHorseman: New roles for @RepPeteAguilar and @CongressmanRuiz stand to give the IE a louder voice in Congress https://t.co/U0WclmXew…
817405745612328961,2017-01-06 16:21:31,,1,4,Twitter Web Client,This grant will allow us to give students time and attention to receive the quality education they deserve. https://t.co/Bvu0il1huQ
817149086814076928,2017-01-05 23:21:38,,4,17,Twitter Web Client,I look forward to joining my colleagues on the House Appropriations Committee and getting to work. https://t.co/F1gVlNNPh9
817078376817115136,2017-01-05 18:40:40,,10,21,Twitter for iPhone,Proud to stand w/ @HouseDemocrats &amp; remind @HouseGOP how #ACA has improved women's health &amp; what's at stake.… https://t.co/kXWd1to28V
816737434159501315,2017-01-04 20:05:53,,7,12,Twitter Web Client,"Because of the #ACA, 129 million Americans with pre-existing conditions can no longer be denied healthcare.… https://t.co/PYADHDHMoo"
816676885237211136,2017-01-04 16:05:17,,3,16,Twitter Web Client,Grateful to @WhipHoyer for the responsibility to serve as an Assistant Whip in @HouseDemocrats for #115thCongress. https://t.co/awZg7bJUCY
816416339682328577,2017-01-03 22:49:58,,1,12,Twitter Web Client,Thank you - Always grateful for the support and honor in this responsibility now &amp; as we move forward. #CA31… https://t.co/bKRpZhSjAI
813457814467252224,2016-12-26 18:53:50,,4,0,Twitter Web Client,"RT @sbsun: $4 million in funding announced for San Bernardino terror attack survivors, family of victims https://t.co/Mvw5HeuuUC"
813059431026008064,2016-12-25 16:30:48,,0,15,Twitter for iPhone,A very merry Christmas and happy Hanukkah to all those celebrating this holiday season!
811291589586849792,2016-12-20 19:26:02,,0,6,Twitter Web Client,A look back at the 114th Congress in #CA31. https://t.co/OLa9YATY9P
810968934409179136,2016-12-19 22:03:55,,7,2,Twitter Web Client,#CA31 residents interested in attending the 58th Presidential Inauguration should visit my website to request tix: https://t.co/XzoDIjuLmZ
809806619550908416,2016-12-16 17:05:18,,2,1,Twitter Web Client,"Attention: After 12/23/2016, immigration application fees will increase. Please visit https://t.co/qy8czvFa64 for more information."
809526729328955392,2016-12-15 22:33:07,,3,5,Twitter Web Client,"If you were affected by the closure of a for-profit college but couldn't attend my workshop, call my office at 909-890-4445 for assistance."
809524613050994688,2016-12-15 22:24:42,,0,3,Twitter Web Client,.@usedgov TY for joining me to help #IE residents at my for-profit college student loan relief &amp; transfer workshop.… https://t.co/3ynQx5ViIe
809078126131183620,2016-12-14 16:50:31,,88,0,Twitter Web Client,"RT @RepEsty: The pain in #SandyHook was unimaginable. But every day, more families experience the agony of losing a child to gun violence.…"
809057352292986884,2016-12-14 15:27:59,,0,16,Twitter Web Client,Big thanks to #CA31 schools &amp; students who participated in our Holiday Card Drive for our troops! Nearly 500 cards… https://t.co/HFCezOYvQ2
808350004817592320,2016-12-12 16:37:14,,6,0,Twitter Web Client,"If you were affected by a for-profit college closure, stop by my student loan relief &amp; transfer workshop today @ 3PM:https://t.co/ufQ4DFXPhQ"
806982538065494016,2016-12-08 22:03:24,,2,10,Twitter Web Client,I stand with my fellow California leaders and remain committed to protecting the freedom and futures of #Dreamers. https://t.co/nfXBtHV41i
806630730969321472,2016-12-07 22:45:27,,0,5,Twitter Web Client,"Today was about learning how this occurred, but more importantly, how we fix it &amp; prevent it from happening again. https://t.co/XLtQmfeq3f"
806624066773913600,2016-12-07 22:18:58,,4,9,Twitter Web Client,"Reminder! If you or someone you know was affected by a for-profit college closure, my office is here to help. https://t.co/F3VHHIDaPW"
806533725886496768,2016-12-07 16:19:59,,9956,0,Twitter Web Client,"RT @USNavy: On this #PearlHarborRemembranceDay, retweet to salute our #USNavy #PearlHarbor75 Sailors' toughness, accountability, integrity…"
806533620441686016,2016-12-07 16:19:34,,1,4,Twitter Web Client,"On #PearlHarborRemembranceDay, we pay tribute to the brave souls lost 75 years ago. We will never forget their service or sacrifice."
806206783106719745,2016-12-06 18:40:50,,1,0,Twitter Web Client,RT @SoCalOpinion: San Bernardino did not let tragedy define or divide it. #RememberSB Guest commentary by @RepPeteAguilar: https://t.co/0zW…
805838733912272896,2016-12-05 18:18:20,,2,8,Twitter Web Client,Decision to reroute #DAPL is a victory for #StandingRock Sioux and for a cleaner and more sustainable future. #WaterIsLife
805814725640617984,2016-12-05 16:42:56,,3,0,Twitter Web Client,RT @HouseNewDems: Congratulations #NewDem @RepPeteAguilar on being elected Whip of @HispanicCaucus! https://t.co/wPOnwsP6xP
804722309147852800,2016-12-02 16:22:04,,150,0,Twitter Web Client,RT @sheriffmcmahon: Join us as we take a moment to remember all those affected by the events that occurred one year ago today. https://t.co…
804722185373937666,2016-12-02 16:21:34,,24,0,Twitter Web Client,"RT @SanBernardinoPD: December 2nd Night of Remembrance. Held at Coussoulis Arena at CSUSB, at 6:30 pm. Open to the public. Please share. #S…"
804710681538949121,2016-12-02 15:35:51,,9,13,Twitter Web Client,I have no doubt we will continue to recover and rebuild with that same spirit in our hearts. #SBStrong https://t.co/8uLGdcZ1gQ
804710581525770240,2016-12-02 15:35:28,,6,13,Twitter Web Client,"1 year ago, #SanBernardino emerged from the shadows of adversity and fear and pushed forward."
804710519483629572,2016-12-02 15:35:13,,2,8,Twitter Web Client,I will also continue to work w/ Congress to return federal funds to offset costs incurred from our law enforcement’s heroic response. (3/3)
804710458695544832,2016-12-02 15:34:58,,2,9,Twitter Web Client,And I pledge to them that I will not stop fighting until they receive the treatment they deserve. (2/3)
804710419600379904,2016-12-02 15:34:49,,2,7,Twitter Web Client,Our community still has a lot of healing to do. The survivors and their families need our support and access to care to recuperate. (1/3)
804710332300230656,2016-12-02 15:34:28,,2,8,Twitter Web Client,"As we reflect on that terrible day, we should hold ourselves to the same standard. https://t.co/C0MLQtaSB3"
804710257196933120,2016-12-02 15:34:10,,6,16,Twitter Web Client,#SanBernardino refused to give into hate or to let this senseless act of violence define us or divide us.
804710180994879488,2016-12-02 15:33:52,,0,6,Twitter Web Client,"Since the tragedy, we've seen the strength &amp; determination of our community. We've stayed strong by standing together. #SBStrong"
804710028271882240,2016-12-02 15:33:16,,6,8,Twitter Web Client,"On 12/2 anniversary, my heart goes out to the victims’ families &amp; to survivors who are fighting every day to heal &amp; move forward."
804477129232617472,2016-12-02 00:07:48,,10,16,Twitter Web Client,Read my full statement on being selected to serve as Whip of @HispanicCaucus here: https://t.co/6Mi3U700F7 https://t.co/ZyFuDBvHzx
804476797723308034,2016-12-02 00:06:29,,8,30,Twitter Web Client,Grateful to be chosen to serve as Whip of @HispanicCaucus &amp; to have the opportunity to push forward policies that will benefit my community.
804392519274467330,2016-12-01 18:31:36,,2,3,Twitter Web Client,Glad to have partners @MayorDRobertson &amp; @CityofRialto working to ensure every family can access safe drinking water.https://t.co/MqEf06xH9G
803747617989656576,2016-11-29 23:48:59,,16,17,Twitter Web Client,"If you or someone you know was affected by a for-profit college closure, stop by my workshop on student loan relief… https://t.co/nyhJAruYId"
801945313082740736,2016-11-25 00:27:16,,0,14,Twitter for iPhone,I hope you'll join me in keeping our brave service members in your thoughts this #Thanksgiving.
801944937650601984,2016-11-25 00:25:47,,0,13,Twitter for iPhone,"From my family to yours, wishing you all a happy and safe Thanksgiving."
800811912590196737,2016-11-21 21:23:32,,1,5,Twitter Web Client,At my Veterans Advisory Board meeting we addressed the responsiveness of federal agencies to IE veterans. Details:… https://t.co/iZlmLJ3IHa
798954103560929281,2016-11-16 18:21:16,,20,37,Twitter Web Client,"Racist, anti-Semitic, xenophobic, and any other discriminatory influences should not be anywhere near the White Hou… https://t.co/5c3fQHiVvJ"
798953023917522945,2016-11-16 18:16:59,,14,30,Twitter Web Client,I stand with my colleagues and ask @realDonaldTrump to rescind Steve Bannon's White House appointment. https://t.co/U0IwiY8dfA
798639523290746880,2016-11-15 21:31:15,,2,7,Twitter Web Client,Glad to join #NewDems on #EntrepreneurDay to celebrate those fighting to make our economy stronger &amp; more innovativ… https://t.co/B6o1il5B5E
798637045820190721,2016-11-15 21:21:24,,2,9,Twitter Web Client,Grateful to have been able to help congratulate &amp; honor @SanBernardinoPD's Lt. Madden w/ @ADL_National for his hero… https://t.co/RWuLaGE3tn
798282711647551488,2016-11-14 21:53:24,,0,2,Twitter Web Client,".@CSUSBNews Big congrats to #CSUSB physics major Manuel Paul. For you, not even the sky is the limit. https://t.co/uJH8RPyex9."
798269967678443520,2016-11-14 21:02:46,,1,2,Twitter Web Client,"... as both a kind and charitable man, and as a bold entrepreneur who helped lift our region and the working families who call it home.(3/3)"
798269848606347265,2016-11-14 21:02:17,,0,2,Twitter Web Client,"As we keep him and his family in our thoughts and prayers, I hope you'll join me in remembering his legacy ... (2/3)"
798269707178692612,2016-11-14 21:01:43,,5,12,Twitter Web Client,The loss of Stater Bros. Chairman Jack Brown will be felt throughout the Inland Empire. (1/3)
798266346467446784,2016-11-14 20:48:22,,1,1,Twitter Web Client,"Reminder: Colton mobile office hours are coming up. If you need help w/ a federal agency, please stop by on 11/17. https://t.co/9U4le9Qoey."
797121300435058688,2016-11-11 16:58:22,,3,16,Twitter for iPhone,Today - and every day - we remember and honor the sacrifices our veterans made for our freedom. #VeteransDay
794241325667414018,2016-11-03 18:14:22,,53307,0,Twitter Web Client,"RT @repjohnlewis: I’ve marched, protested, been beaten and arrested--all for the right to vote. Friends of mine gave their lives. Honor the…"
793979582915481600,2016-11-03 00:54:18,,6,0,Twitter Web Client,RT @NormaJTorres: It’s official! The signing of the resolution b/w @FAANews &amp; @OntarioOIAA for local control of @flyONTairport https://t.co…
793978334543773696,2016-11-03 00:49:21,,4,16,Twitter Web Client,It's important for SB County to have local control &amp; autonomy over its transportation system.Glad to be w/ our comm… https://t.co/QB0XyNANEc
793976913664634880,2016-11-03 00:43:42,,1,7,Twitter Web Client,The Ontario Int'l Airport transfer is critical for our region &amp; a significant step forward for IE transportation &amp; infrastructure networks.
793497232003764225,2016-11-01 16:57:37,,338,0,Twitter Web Client,"RT @RepLujanGrisham: For every year we don't have #EqualPay, a Hispanic woman will lose over $25K. Close the #WageGap &amp; fight for #trabajad…"
791743085491396608,2016-10-27 20:47:16,,2,4,Twitter Web Client,Great meeting w/ my Immigration Advisory Board to discuss my new bill &amp; issues affecting the immigrant community. https://t.co/iKmnIF4mq1
791080950310449152,2016-10-26 00:56:10,,3,9,Twitter Web Client,Thank you @ASI_CSUSB and @RepSwalwell for the opportunity to discuss critical issues facing young Americans today. #FutureForum
791059306841972736,2016-10-25 23:30:10,,3,1,Twitter Web Client,"And you can watch on Facebook Live, starting in 10 minutes -- check it out: https://t.co/2fmAWsl4ew. https://t.co/7Cftebu841"
791023751467065344,2016-10-25 21:08:53,,0,10,Twitter Web Client,Thank you @chaffeycollege for showing me around the InTech Center and for your continued investments in Inland Empi… https://t.co/3Jr2ZIGFGp
788790934725165056,2016-10-19 17:16:28,,4,0,Twitter Web Client,RT @SANBAGnews: Welcoming @SecretaryFoxx to our region talking opportunities &amp; collaboration @RCTC @IE_EconPtnrship @RepPeteAguilar @AsmChe…
788120934544703489,2016-10-17 20:54:08,,0,3,Twitter Web Client,It's #BreastCancerAwarenessMonth. Learn about screenings and early detection @theNCI that can help save lives. https://t.co/DJErm3DMHl
788086269003833345,2016-10-17 18:36:23,,2,3,Twitter Web Client,Are you ready for the #GreatCaliforniaShakeout earthquake drill on Thursday? Find out how to prep here: https://t.co/BhVXo70rHd
788069873226248196,2016-10-17 17:31:14,,3,5,Twitter Web Client,The 2017-2018 FAFSA is available 3 months early! Start your application here: https://t.co/suAWgriLYi #FAFSA #collegeaffordability
786619312601571329,2016-10-13 17:27:13,,3,5,Twitter Web Client,Are you having difficulty dealing w/ a federal agency? Join my staff members at mobile office hours throughout the… https://t.co/drO6kCQhZj
786599201597628416,2016-10-13 16:07:18,,1,4,Twitter Web Client,"Thank you to all the brave men and women of the @USNavy for 241 years of sacrifice, courage and service to your country. #241NavyBday"
786037764382863360,2016-10-12 02:56:21,,2,7,Twitter for iPhone,Wishing all those observing Yom Kippur a meaningful holiday and easy fast. G'mar Chatimah Tovah.
785967070626189312,2016-10-11 22:15:26,,2,4,Twitter Web Client,.@GoodwillSoCal Thanks for showing me around &amp; for your continued efforts to empower Inland Empire working families… https://t.co/h6TIsDEtO6
785918994121314304,2016-10-11 19:04:24,,305,0,Twitter Web Client,"RT @repmarkpocan: Today we celebrate #NationalComingOutDay. Everyone needs support, no matter where they are in their journey. We're here f…"
785918899917238272,2016-10-11 19:04:02,,6,16,Twitter Web Client,Proud to reaffirm my commitment to securing #equality for all Americans as we celebrate #NationalComingOutDay #LGBT https://t.co/dCjWpiWhaJ
784926205157847040,2016-10-09 01:19:25,,5,8,Twitter for iPhone,Keeping @PalmSpringsPOA &amp; those affected by these horrific acts in my thoughts tonight. My heart is with those touched by this violence.
784495581368578048,2016-10-07 20:48:16,,3,12,Twitter Web Client,Grateful for the chance to tour the new Ambulatory Care Center &amp; happy to see increased services for Inland Empire… https://t.co/8BPnupj3Kt
784471706576515076,2016-10-07 19:13:24,,1,1,Twitter Web Client,#Dreamers face a specific set of challenges in getting a quality education. It’s time to make it a little easier: https://t.co/iaFB0quKk6
784465089948684288,2016-10-07 18:47:06,,0,3,Twitter Web Client,On #MFGDay16 a quick #flashbackfriday to highlight Rancho manufacturer @Gentex_Corp &amp; their contract w/ the @USArmy: https://t.co/0VArZZT0RO
784463161512628225,2016-10-07 18:39:26,,0,2,Twitter Web Client,Thanks for having me! https://t.co/wsx5CPP8If
784134850487939073,2016-10-06 20:54:51,,0,1,Twitter Web Client,"Remember: if you need help with a federal agency, my office is here to help! Upcoming mobile office hour dates here: https://t.co/ouHCfJGYen"
784132741222850561,2016-10-06 20:46:28,,1,0,Twitter Web Client,RT @shannonebraun: Great meeting w/@RepPeteAguilar and JDRF youth ambassadors. TY for supporting JDRF and funding research. #jdrfpromise ht…
784132034801373184,2016-10-06 20:43:40,,0,0,Twitter Web Client,"Terrific! For additional ticketing information to help plan your trip, visit https://t.co/ED1kL9H566. https://t.co/1mSlioaM46"
784130234601865216,2016-10-06 20:36:31,,0,0,Twitter Web Client,That's great -- glad you were able to visit! https://t.co/LxmAavblwb
783760213186838532,2016-10-05 20:06:11,,0,10,Twitter Web Client,Glad I was able to attend @NMAAHC opening w/ Hardy &amp; Sonietta. I hope more IE residents travel to our nation’s capi… https://t.co/AQOtyOE8iy
783683642623160322,2016-10-05 15:01:55,,0,10,Twitter Web Client,Great news. This will allow @SanBernardinoPD to have the resources they need to keep neighborhoods safe &amp; foster co… https://t.co/7PPF7mLUye
783058221347008512,2016-10-03 21:36:43,,0,3,Twitter Web Client,The VALOR Act is one of many steps we can take to increase accountability at the VA. Read more about it in my edito… https://t.co/YaXVLGTnYP
783051982500204547,2016-10-03 21:11:55,,0,1,Twitter Web Client,Displaced @AshleyHomeStore workers can apply for TAA benefits at a local AJC. Find your local AJC here: https://t.co/Z1r3GCk7Nm. (2/2)
783051413085646850,2016-10-03 21:09:39,,0,6,Twitter Web Client,Great to see our community come together at the Ashley Employees Emergency Resource Fair. And remember: federal hel… https://t.co/CB20IhVTCD
781572763102371840,2016-09-29 19:14:02,,2,3,Twitter Web Client,Head over to @HighlandNews1 for more on $500k in federal funds for SB County response to 12/2 terror attack. https://t.co/JmwToUxjmL
781571654677823488,2016-09-29 19:09:38,,321,0,Twitter Web Client,"RT @RepBarbaraLee: .@HouseGOP Calendar: 

⇾ Longest summer recess in modern history: 53 days
⇾ Work: 14 days
⇾ Fall recess: 46 days

Get to…"
781239708282224640,2016-09-28 21:10:35,,3,4,Twitter Web Client,Glad to see federal funds are on the way to help recoup costs suffered in response to 12/2 terror attack. Details: https://t.co/RjLBBuWjHl
780872499743653888,2016-09-27 20:51:26,,1,1,Twitter Web Client,Reminder: Mobile office hours are at 3PM in Grand Terrace today. Stop by if you need help with a federal agency: https://t.co/ykNrWDqEWD.
780863192218099712,2016-09-27 20:14:27,,0,1,Twitter Web Client,"TAA benefits can include income support, on-the-job training and more. Find your local AJC here to apply: https://t.co/Z1r3GCk7Nm."
780862892967129088,2016-09-27 20:13:16,,0,0,Twitter Web Client,"Workers affected by @AshleyHomeStore closure can apply for TAA benefits at a local AJC, which you can find here: https://t.co/Z1r3GCk7Nm."
780856181187284992,2016-09-27 19:46:35,,1,1,Twitter Web Client,Glad to announce that federal help is on the way for workers affected by the @AshleyHomeStore closure. Details here: https://t.co/5Z9cyDBBQQ
780524162754502656,2016-09-26 21:47:16,,1,6,Twitter Web Client,.@Gentex_Corp plays an important role in #IE economy &amp; US national security. Their contract w/ @USArmy is great news.https://t.co/GPGn8eb8Mh
779024855056445441,2016-09-22 18:29:33,,0,1,Twitter Web Client,"If you were laid off in @AshleyHomeStore closure, contact SB County Workforce Dev. Board for employment resources. https://t.co/FGHgf1XH3I"
779024575489343488,2016-09-22 18:28:27,,0,1,Twitter Web Client,Read @sbsun to learn more about how we are working to support workers affected by @AshleyHomeStore closure. https://t.co/FGHgf1XH3I
778700110930677761,2016-09-21 20:59:08,,1,6,Twitter Web Client,We must do better serving our veterans. Details on my new bill to do that here: https://t.co/SOxdh9TL4L
778282619607842816,2016-09-20 17:20:10,,5,15,Twitter Web Client,"As we mark 5 years since discriminatory policy #DADT ended &amp; honor all who serve openly, our work to ensure full #lgbt #equality continues."
778274533044318208,2016-09-20 16:48:02,,4,5,Twitter Web Client,The new rule from @HUDgov is an important step for #lgbt #equality &amp; will help ensure equal access to services for… https://t.co/ja9eUvI6eU
776843858185482240,2016-09-16 18:03:03,,6,12,Twitter Web Client,It's been 6 months since the first case of #Zika was reported in San Bernardino County. It's time for @HouseGOP to act. #DoYourJob
776513174141071361,2016-09-15 20:09:02,,3,2,Twitter Web Client,"Invirtiendo en educación, procurar por los negocios Latinos y financiar universidades económicas es primordial para nuestros Latinos. #HHM"
776494693538471936,2016-09-15 18:55:36,,4,9,Twitter Web Client,"Investing in quality education, making college affordable &amp; empowering Latino business owners are critical to the #Latino community #HHM"
776458272589090817,2016-09-15 16:30:52,,4,2,Twitter Web Client,"If your home or property was damaged by the Blue Cut Fire, you may be eligible for financial assistance. More here: https://t.co/OAlfsb3AD7"
776099125259563008,2016-09-14 16:43:45,,32,35,Twitter Web Client,Moments of silence won't reduce #gunviolence. But keeping guns away from suspected terrorists &amp; criminals will help. #GunVote
776096927851175936,2016-09-14 16:35:01,,4,8,Twitter Web Client,".@SpeakerRyan -- We have the bills, now give us a vote. #NoFlyNoBuy  #CloseTheLoophole #GunVote"
776096569187790848,2016-09-14 16:33:35,,3,7,Twitter Web Client,"If you’re too dangerous to fly, you’re too dangerous to buy a gun. #NoFlyNoBuy #GunVote"
776096283224408097,2016-09-14 16:32:27,,5,5,Twitter Web Client,Thousands were lost to #gunviolence during the August recess. @SpeakerRyan – we cannot wait any longer #GunVote #DoYourJob
775759100449787904,2016-09-13 18:12:37,,1,4,Twitter Web Client,.@CHCI TY for hosting this important discussion &amp; big thanks to our panelists who made this event possible. #2016HHM https://t.co/PwiHu7siS4
775714764421001216,2016-09-13 15:16:26,,3,12,Twitter for iPhone,Glad to join @CHCI for a panel on homeland security and community readiness strategies for the Latino community. https://t.co/8FrDiyM6De
775415077033869312,2016-09-12 19:25:35,,1,2,Twitter Web Client,.@SBAgov: SB County residents affected by Blue Cut Fire are eligible for low-interest federal disaster loans. https://t.co/fHskHCoAQV
775392034668613634,2016-09-12 17:54:01,,4,2,Twitter Web Client,"Details for info sessions to help students affected by @ITTTech closure, hosted by SB Community College District: https://t.co/5DzkgQw3Au"
775028418240978944,2016-09-11 17:49:08,,2,11,Twitter for iPhone,...and honor our service members who gave their lives in the years that followed to keep Americans safe and free. #NeverForget (2/2)
775028216453033984,2016-09-11 17:48:20,,2,8,Twitter for iPhone,Today we remember the thousands of innocent lives lost on #September11 ...(1/2)
774278522827309056,2016-09-09 16:09:19,,2,3,Twitter Web Client,September is #HungerActionMonth. #FF @feedingie to learn about how you can help end food insecurity in the #InlandEmpire.
774270261571022849,2016-09-09 15:36:30,,7,13,Twitter Web Client,"As we mark 15 years since #September11, we honor those lost &amp; the families that keep their memories alive every day. https://t.co/ggFg24go2p"
773989080950513664,2016-09-08 20:59:11,,28,0,Twitter Web Client,"RT @nasfaa: More information from @usedgov on #ITTTech's closure, including webinars starting today, is posted here: https://t.co/sDm8DBdDQ…"
773988989875486720,2016-09-08 20:58:49,,61,0,Twitter Web Client,RT @usedgov: #ITTTech Students: Applying for loan discharge is FREE. Don’t be fooled by scammers asking for $. Learn more: https://t.co/FAC…
773963925310373888,2016-09-08 19:19:14,,3,2,Twitter Web Client,"And if you have additional questions about the @ITTTech closure, please call my office at 909-890-4445. We’re here to help."
773963729583112196,2016-09-08 19:18:27,,5,2,Twitter Web Client,"If you or someone you know was affected by the @ITTTech closure, please visit https://t.co/5odJDsapNT to learn about options &amp; next steps."
773636175529738241,2016-09-07 21:36:52,,162,0,Twitter Web Client,"RT @rosadelauro: .@HouseGOP is back in town, but they're still dragging their feet on #Zika funding! Why can't you #DoYourJob? https://t.co…"
773538671618301952,2016-09-07 15:09:25,,1,9,Twitter Web Client,#DearSpeakerIWant @HouseGOP to concentrate on combating #Zika instead of attacking women's reproductive rights. https://t.co/5yfF0XiOcT
773260263458009088,2016-09-06 20:43:07,,7,6,Twitter Web Client,.@HouseGOP inaction on #gunviolence &amp; #Zika is unforgivable. We cannot wait any longer—there are lives at stake. https://t.co/R0T6UgTNiX
772834418801119233,2016-09-05 16:30:58,,2,4,Twitter Web Client,On #LaborDay2016 we pay tribute to generations of workers who fought to make this nation stronger &amp; fairer for all. https://t.co/eRCbr7UvgU
771366632929292288,2016-09-01 15:18:31,,2,0,Twitter Web Client,"If you or someone you know was affected by @AshleyHomeStore closure, please see here for details on 9/8 jobs fair: https://t.co/hNpbudoi0q."
771366463504605185,2016-09-01 15:17:50,,1,0,Twitter Web Client,The City of Colton &amp; SB County Workforce Development Board will hold a jobs fair on Sept 8th for those affected by @AshleyHomeStore closure.
770672621927235584,2016-08-30 17:20:46,,0,2,Twitter Web Client,Mark your calendar for September mobile office hours if you or someone you know needs help w/ a federal agency:https://t.co/ouHCfJGYen #CA31
769238737935007744,2016-08-26 18:23:01,,5,9,Twitter Web Client,It's been nearly 100 years since women fought &amp; won the right to vote. But we have more work to do. #EqualPayforEqualWork #WomensEqualityDay
