id,created_at,coordinates,retweets,favorite_count,source,text
735891877833150466,2016-05-26 17:54:30,,6,7,Twitter Web Client,"If you’re a veteran or senior citizen who needs help collecting benefits, my office is here to help. https://t.co/rbzdBDfTvZ"
735556429931651072,2016-05-25 19:41:33,,5,13,Twitter Web Client,Excited to have San Bernardino’s own Pastor Joshua Beckley give today's opening prayer on the House floor. https://t.co/A3Zu5vfGQM
735539445840105472,2016-05-25 18:34:04,,2,0,Twitter Web Client,RT @reppittenger: Our nation’s veterans have fought to protect our freedoms. @RepPeteAguilar joins me in thanking them by supporting PTSD s…
735236394507898880,2016-05-24 22:29:51,,5,11,Twitter Web Client,Great sharing advice and talking public policy with my fellow @UofRedlands #Bulldogs. You all have bright futures! https://t.co/T54J8bHcqU
735218235298058240,2016-05-24 21:17:41,,2,5,Twitter Web Client,The @HouseGOP must end their panel attacking women’s health &amp; threatening medical providers. #disbandit https://t.co/MAY41GmFKP
735209992215633921,2016-05-24 20:44:56,,1,1,Twitter Web Client,Join us today at 3:00PM in Grand Terrace for Mobile Office Hours! https://t.co/iaSfWyK4Mm
734818815960289280,2016-05-23 18:50:32,,2,6,Twitter Web Client,Congrats @LLUHealth! RT @RedlandsNews: Loma Linda University Health holds groundbreaking for new hospital https://t.co/g2Gg5CneCy
734800498948247552,2016-05-23 17:37:45,,3,2,Twitter Web Client,Reminder – we’re in Grand Terrace tomorrow at 3:00PM for Mobile Office Hours. Hope to see you there! https://t.co/iaSfWz1GaW
733708291457622016,2016-05-20 17:17:42,,7,6,Twitter Web Client,Glad to join @SANBAGnews &amp; @Caltrans8 for the Cajon Pass &amp; Devore Interchange ribbon cutting. #MovingThroughThePass https://t.co/SxMIpRAwnP
733366499566604288,2016-05-19 18:39:33,,1,1,Twitter Web Client,…so for @HouseGOP to hold that hostage over a vile provision rooted in bigotry is reprehensible. https://t.co/3wP5hUpqwj  (2/2)
733366402552369152,2016-05-19 18:39:10,,0,0,Twitter Web Client,Funding our nation’s defense programs is essential to maintaining our national security structure … (1/2)
733332482137935872,2016-05-19 16:24:23,,55,0,Twitter Web Client,RT @RepBarbaraLee: Extremely disappointed in my colleagues that just voted to enshrine #LGBT discrimination in law. History will remember t…
733332221336113153,2016-05-19 16:23:20,,15,0,Twitter Web Client,RT @RepJoeKennedy: It's 2016 and House Republicans are voting to codify bigotry. American people deserve better from this body. #MilConVA
733331685358592000,2016-05-19 16:21:13,,3,2,Twitter Web Client,.@HouseGOP's decision to side with discrimination over equality &amp; to use underhanded tricks to carry it out is disgraceful. #shame
733330866374610945,2016-05-19 16:17:57,,18,28,Twitter Web Client,.@HouseGOP ‘s shameful act of cowardice this morning to strip #LGBT Americans of human &amp; workers rights is simply un-American
733326255802753024,2016-05-19 15:59:38,,28,0,Twitter Web Client,RT @RepJaredPolis: Republicans just voted against @RepSeanMaloney amendment. Voted in favor of discrimination and against #LGBT Americans.…
733326239784697856,2016-05-19 15:59:34,,132,0,Twitter Web Client,"RT @LGBTEqCaucus: Members from both parties were voting for #LGBT rights, but House leadership used tricks to prevent fair vote #SHAME http…"
733058657999556609,2016-05-18 22:16:18,,3,13,Twitter Web Client,Thank you to these brave little ones who stopped by to remind me of the urgency to solve our immigration crisis now. https://t.co/xWotlQ22e9
733035780491345920,2016-05-18 20:45:23,,1,1,Twitter Web Client,Reminder – join us in Colton tomorrow at 3:00PM for Mobile Office Hours. https://t.co/l0nGCcofOq
733021667778297856,2016-05-18 19:49:19,,1,1,Twitter Web Client,#InfrastructureMatters MT @RedlandsNews: Access to the 10 Freeway from Tippecanoe Avenue in SB got easier today https://t.co/lDUVbjHoIi
732990556935184384,2016-05-18 17:45:41,,1,2,Twitter Web Client,My #FY17NDAA amendment will help combat cyberattacks by cultivating young talent &amp; training them to be cyberwarriors.https://t.co/cStuGrkMQU
732625741033005056,2016-05-17 17:36:02,,7,10,Twitter Web Client,"This @Infraweek, we recommit to investing in roads, rails &amp; bridges that drive our economy. #InfrastructureMatters https://t.co/8UYXx7IKGV"
732314479434858500,2016-05-16 20:59:12,,1,6,Twitter Web Client,.@feedingie TY for inviting me to join you for your 1st March Against Hunger walk. Together we will fight to end food insecurity in the #IE
732243243312816128,2016-05-16 16:16:08,,2,1,Twitter Web Client,Don’t forget – we’re in Colton this Thursday at 3:00PM for Mobile Office Hours. Hope to see you there! https://t.co/l0nGCcofOq
731227174234128385,2016-05-13 20:58:38,,3,5,Twitter Web Client,"Glad to join my colleagues on both sides of the aisle to help combat the opioid crisis, but we can &amp; should do more. https://t.co/pR942LUsEu"
731202148692807680,2016-05-13 19:19:11,,4,5,Twitter Web Client,...and tearing apart families seeking safety goes against our values as a nation. https://t.co/lpMGsxeA1Z (2/2)
731201406523314176,2016-05-13 19:16:15,,8,5,Twitter Web Client,I disagree w/ the Administration's decision on the new series of deportations. These women &amp; children were not guaranteed due process… (1/2)
730839696419504129,2016-05-12 19:18:56,,0,0,Twitter Web Client,#TBT Read about my bill to help #InlandEmpire biz access capital to grow &amp; create jobs. https://t.co/XZPYsq7AAZ
730458097651744768,2016-05-11 18:02:36,,0,1,Twitter Web Client,"Congratulations, Joe – you’ve made the #InlandEmpire &amp; our nation very proud. https://t.co/aHI7a358NE"
730430377370726404,2016-05-11 16:12:27,,4,4,Twitter Web Client,During #AAPIHeritageMonth we recognize the extraordinary contributions made by the #AAPI community. https://t.co/L2jgmcVjfT
730109902920781825,2016-05-10 18:59:00,,1,2,Twitter Web Client,Are you a senior citizen or a veteran having trouble collecting benefits you’ve earned? My office is here to help. https://t.co/rbzdBDfTvZ
730049112918253568,2016-05-10 14:57:26,,0,1,Twitter Web Client,Reminder – my office is holding Mobile Office Hours in Colton next Thursday at 3:00PM. Hope to see you there! https://t.co/l0nGCc6EpQ
729772812957790210,2016-05-09 20:39:31,,1,0,Twitter Web Client,TY to all the students who attended Spring Academy Day. I look forward to seeing what your futures hold. https://t.co/fjyUGhedj7
729721424622067712,2016-05-09 17:15:19,,3,4,Twitter Web Client,"During #NWHW, let’s help women lead healthier &amp; happier lives by connecting them w/ the resources they need. https://t.co/udYrjO4m9R"
729310979633369089,2016-05-08 14:04:22,,0,5,Twitter Web Client,Happy Mother's Day!
729014674038108160,2016-05-07 18:26:57,,2,5,Twitter Web Client,Proud to see our region's best &amp; brightest at Spring Academy Day. You are our future leaders. https://t.co/qPf1BcLVFb
728639013150658560,2016-05-06 17:34:12,,1,1,Twitter Web Client,Tomorrow is Spring Academy Day! Stop by if you or someone you know is interested in attending a US Service Academy. https://t.co/OyCiCB7GUz
728330404973973506,2016-05-05 21:07:54,,1,0,Twitter Web Client,Are you or someone you know interested in attending a US Service Academy? Stop by my Spring Academy Day on Saturday! https://t.co/OyCiCB7GUz
728314044189446144,2016-05-05 20:02:54,,3,4,Twitter Web Client,Amazon has facilities throughout the #InlandEmpire. This is great news for veterans &amp; their families. https://t.co/na7Ux3oJaq
728280265748041728,2016-05-05 17:48:40,,0,1,Twitter Web Client,My office is conducting Mobile Office Hours across #CA31. Check out where we’ll be throughout May. https://t.co/qKYD5LK1bv
728236683917922304,2016-05-05 14:55:30,,0,2,Twitter Web Client,We will never forget. #HolocaustRemembranceDay https://t.co/ADVhRqlF6B
727939454476890117,2016-05-04 19:14:25,,4,2,Twitter Web Client,Great resource for veterans: https://t.co/O2BCIVoNbj
727899175405404160,2016-05-04 16:34:21,,4,2,Twitter Web Client,Don’t forget: Join us on Saturday if you or someone you know would like to attend a US Service Academy! https://t.co/OyCiCB7GUz
727549539981352961,2016-05-03 17:25:02,,4,7,Twitter Web Client,It’s #TeacherAppreciationWeek! Let a teacher in your life know how much he or she means to you. #ThankATeacher https://t.co/9RFPISDp1N
727504651562680320,2016-05-03 14:26:39,,2,5,Twitter Web Client,We’re in Rancho Cucamonga at 9:00am today for Mobile Office Hours. See you there! https://t.co/yC3eLwhqtM
727255760888025088,2016-05-02 21:57:39,,4,4,Twitter Web Client,We can &amp; should do more to empower SB County biz to help get the #InlandEmpire economy back on track. #DreamSmallBiz https://t.co/IGhB4fK8Be
727241406855692288,2016-05-02 21:00:37,,2,2,Twitter Web Client,We need to make sure that small businesses have the tools they need to expand &amp; create good-paying jobs in the #InlandEmpire. #DreamSmallBiz
727226837726814210,2016-05-02 20:02:43,,1,5,Twitter Web Client,It’s National Small Business Week! Take a moment and go shopping at your favorite #IE small business to show your support. #DreamSmallBiz
727201347804782592,2016-05-02 18:21:26,,1,1,Twitter Web Client,Reminder: Spring Academy Day is this Saturday for #CA31 students interested in attending US Service Academies. https://t.co/OyCiCB7GUz
725788558523547649,2016-04-28 20:47:31,,0,1,Twitter Web Client,Read about my amendments to the #FY17NDAA here: https://t.co/FHlUzVFDaB. (3/3)
725788351824039937,2016-04-28 20:46:42,,1,2,Twitter Web Client,"My amendments to the #FY17NDAA will help us preserve &amp; enhance our national security, while supporting #IE students &amp; veterans. (2/3)"
725788243816517633,2016-04-28 20:46:16,,0,1,Twitter Web Client,Strengthening our national security &amp; our defense program is paramount. #FY17NDAA (1/3)
725495375537274881,2016-04-28 01:22:31,,8,0,Twitter for iPhone,"RT @HASCDemocrats: .@RepPeteAguilar: ""A proper accounting of the costs of our nuclear modernization effort must be made...this is not an un…"
725396187709317121,2016-04-27 18:48:23,,2,0,Twitter Web Client,RT @IE_EconPtnrship: @RepPeteAguilar Introduces Bill to Help #InlandEmpire Small Businesses Expand - https://t.co/4YP9hOziGk
725357305190072320,2016-04-27 16:13:52,,1,0,Twitter Web Client,Spring Academy Day is just around the corner. Join us May 7th to learn more about attending a U.S. Service Academy. https://t.co/OyCiCB7GUz
725084171643793408,2016-04-26 22:08:32,,0,2,Twitter Web Client,I congratulate all of the participants in this year’s #CongressionalArtCompetition on their hard work and dedication.
725078759708217345,2016-04-26 21:47:02,,2,2,Twitter Web Client,Giving our kids the freedom to explore their creativity &amp; express themselves is an opportunity every child should be able to enjoy. #CAC2016
725072703472951296,2016-04-26 21:22:58,,0,0,Twitter Web Client,"Congrats, Faith! What an incredible piece of art &amp; a wonderful representation of “CommUNITY” in the #IE. #CAC2016 https://t.co/1sB6bzxt6i"
725063365077401601,2016-04-26 20:45:51,,1,0,Twitter Web Client,Don’t forget – we’ll be in Grand Terrace today at 3:00PM for Mobile Office Hours. Hope to see you there! https://t.co/1difsvAA3A
724659931668992000,2016-04-25 18:02:45,,1,2,Twitter Web Client,Need help with a federal agency? My office is here to lend a hand. https://t.co/rbzdBDfTvZ
724632920116346880,2016-04-25 16:15:25,,0,1,Twitter Web Client,Congrats to my fellow Bulldog alums! https://t.co/Jw4cqNGOJM
723595939752120320,2016-04-22 19:34:50,,1,2,Twitter Web Client,I’m committed to working with local businesses to make sure they have the tools they need to grow and create jobs in the #InlandEmpire.
723590191504568321,2016-04-22 19:11:59,,0,3,Twitter Web Client,Thank you to local business reps who attended my Large Employer Roundtable discussion today. https://t.co/9o6tFlQDA1
723550946400321536,2016-04-22 16:36:03,,3,1,Twitter Web Client,"Breathable air, clean drinking water and a beautiful planet are not just goals. They are a responsibility we all share. #EarthDay"
723540625174499329,2016-04-22 15:55:02,,0,1,Twitter Web Client,Wishing everyone in our Jewish community a Happy Passover.
723258856336441344,2016-04-21 21:15:23,,3,1,Twitter Web Client,My new bill will help #InlandEmpire small biz access capital to grow their businesses &amp; help create jobs: https://t.co/XZPYsq7AAZ
723254037689339905,2016-04-21 20:56:14,,1,0,Twitter Web Client,We’re in Colton today at 3:00PM for Mobile Office Hours. Please stop by! https://t.co/X8FR4YC5RH
722835243900674051,2016-04-20 17:12:06,,2,1,Twitter Web Client,Interested in attending a U.S. Service Academy? Join us for Spring Academy Day on May 7th. See you there! https://t.co/OyCiCBphM7
722173060741263360,2016-04-18 21:20:49,,0,0,Twitter Web Client,Remember – Mobile Office Hours are this Thursday in Colton at 3:00PM. Hope to see you there! https://t.co/X8FR4YC5RH
722121269408309248,2016-04-18 17:55:01,,10,10,Twitter Web Client,"These are mothers, fathers, sons &amp; daughters. It’s about keeping families together. #UnfreezeDAPA #FightForFamilies https://t.co/QxQ4qVvFMj"
722106070882193409,2016-04-18 16:54:38,,8,12,Twitter Web Client,I urge #SCOTUS to #UnfreezeDAPA! We should keep Latino &amp; other immigrant families together instead of tearing them apart. #FightForFamilies
720817523172777984,2016-04-15 03:34:24,,4,8,Twitter Web Client,Getting the #InlandEmpire economy back on track &amp; putting people back to work has been &amp; remains my top priority. https://t.co/BJEcHCr79c
719985186964946944,2016-04-12 20:26:59,,5,9,Twitter Web Client,Today we recommit to standing together to close the wage gap once and for all. #EqualPayDay https://t.co/puzAUsPdRj
719958460054519808,2016-04-12 18:40:47,,6,5,Twitter Web Client,Families and communities are being torn apart by gun violence every day. This must stop. It’s time to #HonorWithAction
719947462094544896,2016-04-12 17:57:05,,1,1,Twitter Web Client,My staff holds Mobile Office Hours across #CA31 each month. We’ll be in Colton on April 21st. Hope to see you there! https://t.co/X8FR4YC5RH
719940783693041664,2016-04-12 17:30:33,,1,0,Twitter Web Client,"RT @LBY3: .@RepPeteAguilar calls for closing gun purchase ‘terrorist loophole,' by @JeffHorseman: https://t.co/28yokRLMEb https://t.co/uiOk…"
719932733657640960,2016-04-12 16:58:34,,285,0,Twitter Web Client,"RT @DorisMatsui: This #EqualPayDay, @HouseDemocrats renew commitment to helping #WomenSucceed. Let's pass the Paycheck Fairness Act! https:…"
719654486872985608,2016-04-11 22:32:54,,4,10,Twitter Web Client,We need to do more to empower small biz owners so they can expand their workforce &amp; help lift the #IE as we work to get our economy moving.
719649413652738049,2016-04-11 22:12:45,,1,5,Twitter Web Client,TY to our #InlandEmpire small biz owners who joined me for my inaugural Small Biz Advisory Board meeting today. https://t.co/gHVkoq8TLF
718199702907461632,2016-04-07 22:12:07,,1,4,Twitter Web Client,Immigration reform is a bipartisan issue—Ronald Reagan taught us that. https://t.co/PRt46vVn62
717101421448052737,2016-04-04 21:27:56,,9343,0,Twitter Web Client,"RT @repjohnlewis: 48 yrs ago today, my friend, my brother, Dr. Martin Luther King, Jr. was shot and killed in Memphis, TN. The light of his…"
717034525595975680,2016-04-04 17:02:07,,2,0,Twitter Web Client,"Attention #CA31 art students: This Wednesday, April 6th is the deadline for the Congressional Art Competition! https://t.co/irDapuJUmX"
715890546120777728,2016-04-01 13:16:21,,1,0,Twitter Web Client,RT @eastvalleywater: Thank you @RepPeteAguilar for today’s discussion about water issues facing our communities. #leadership #partnership h…
715632358280585217,2016-03-31 20:10:24,,2,2,Twitter Web Client,Grateful that reps from #IE water community joined me today to discuss what we can do to safeguard our water supply. https://t.co/7ghYW1SzXu
715595792774533121,2016-03-31 17:45:06,,13,12,Twitter Web Client,#CesarChavez laid the groundwork for generations of Americans to stand up and fight back in the face of injustice. https://t.co/llA8cqHe4Q
715312624326615040,2016-03-30 22:59:54,,5,2,Twitter Web Client,TY to all who joined me today for an important discussion on making higher ed available &amp; affordable to #IE students https://t.co/YjgrrHxZEK
715296450608017410,2016-03-30 21:55:38,,3,9,Twitter Web Client,"Education isn’t 1 size fits all. 4 yr colleges may not work for everyone,which is why we need community colleges &amp; other higher ed programs."
715257046787100672,2016-03-30 19:19:03,,1,2,Twitter Web Client,My Community College Roundtable is underway. Glad to have reps from the #IE education community here for such an important discussion.
715235621271420929,2016-03-30 17:53:55,,92,0,Twitter Web Client,"RT @repbobbyscott: This Student Aid &amp; Fiscal Responsibility Act anniversary, @HouseDemocrats continue fight for yr round Pell Grants &amp; stud…"
714849961691783168,2016-03-29 16:21:26,,2,3,Twitter Web Client,We’ll be in Rancho Cucamonga next Tuesday for Mobile Office Hours. Hope to see you there! https://t.co/lChDJoWXnX
714832829734076416,2016-03-29 15:13:22,,0,0,Twitter Web Client,The Congressional Art Competition deadline is almost 1 week away! Get your submission in by Wed. April 6th: https://t.co/irDapuJUmX
714570213874864128,2016-03-28 21:49:49,,2,5,Twitter Web Client,.@CapitolPolice Thank you for your heroic actions today &amp; for what you do every day to keep visitors &amp; staff safe.
714489205062242305,2016-03-28 16:27:55,,1,1,Twitter Web Client,Need help with a federal agency? My office is here to help. https://t.co/rbzdBDfTvZ
714129793629990912,2016-03-27 16:39:45,,2,5,Twitter Web Client,"From my family to yours, wishing you all a Happy Easter."
713553550090043392,2016-03-26 02:29:58,,6,0,Twitter for iPhone,RT @LBY3: .@RepPeteAguilar asks for federal funds to reimburse San Bernardino for Dec. 2 expenses: https://t.co/l6yosA87pq https://t.co/avt…
712699760520650753,2016-03-23 17:57:18,,0,5,Twitter Web Client,Six years after passing #ACA we recommit to improving the law so our health care system works for all Americans.
712691838587641861,2016-03-23 17:25:50,,3,3,Twitter Web Client,"A woman's health decision should be btw her &amp; her doctor, not her &amp; her employer. #SCOTUS should uphold that basic right. #ZubikvBurwell"
712648701894860801,2016-03-23 14:34:25,,4,0,Twitter Web Client,RT @SBCo_Supt_Ted: Excellent mtgs w/@NormaJTorres &amp; @RepPeteAguilar! We spoke about key educational issues &amp; priorities in SB County. https…
712283206649827328,2016-03-22 14:22:04,,4,7,Twitter Web Client,My heart goes out to victims &amp; their loved ones in #Brussels. We stand w/ you in the fight against terror &amp; seeking justice for those lost.
711982823369007104,2016-03-21 18:28:27,,2,1,Twitter Web Client,Don’t forget – submissions for the Congressional Art Competition are due by April 6th! https://t.co/irDapuJUmX
711931936328040448,2016-03-21 15:06:15,,0,0,Twitter Web Client,Reminder – Mobile Office Hours are in Grand Terrace tomorrow at 3:00pm. https://t.co/qP4p6XiEEZ
710516046793457668,2016-03-17 17:20:00,,3,0,Twitter Web Client,RT @HispanicCaucus: HAPPENING NOW: @RepPeteAguilar speaking out against Republican attacks on immigrants.
710513167521193985,2016-03-17 17:08:34,,1,0,Twitter Web Client,RT @RedlandsNews: Redlands: Blessing Center will hold job fair March 19 https://t.co/2lavz9a0AO https://t.co/OIdjbLQVcc
710490275412647936,2016-03-17 15:37:36,,2,8,Twitter Web Client,I had a blast meeting w/ the Romo family from San Bernardino on their trip to DC. Thanks for stopping by! https://t.co/jVmDRxJ0By
710475961704312832,2016-03-17 14:40:43,,0,0,Twitter Web Client,Make sure you fill out your bracket -- #MarchMadness is here!
710470062164078592,2016-03-17 14:17:17,,0,1,Twitter Web Client,Wishing everyone a happy #StPatricksDay!
710213599281717248,2016-03-16 21:18:11,,1,0,Twitter Web Client,Please note that we will not hold Colton Mobile Offices Hours tomorrow. We’ll be back in Colton on April 21st. https://t.co/X8FR4YC5RH
710172879925682177,2016-03-16 18:36:23,,1,3,Twitter Web Client,.@HouseNewDems report includes bills such as my On-the-Job Training Tax Credit Act to help invest in 21st C. economy https://t.co/vd8Vcon7UU
710165393122443264,2016-03-16 18:06:38,,0,0,Twitter Web Client,Read about my Small Business Jobs Act in the @HouseNewDems Prosperity Agenda released today #NDProsperity https://t.co/vd8Vcon7UU
710154877444431872,2016-03-16 17:24:51,,0,6,Twitter Web Client,Happy to check in w/ the Workforce Investment Board to discuss expanding job opportunities in the #InlandEmpire. https://t.co/zUX9n7uL8i
710131030204751872,2016-03-16 15:50:05,,1,7,Twitter Web Client,Honored to meet w/ @theCaGuard this morning. We are forever indebted to you for your service &amp; sacrifice. https://t.co/hNlXonVWj5
710121683538067456,2016-03-16 15:12:57,,5,2,Twitter Web Client,Reminder – submissions for the Congressional Art Competition are due April 6th! https://t.co/irDapuJUmX
709828234737799168,2016-03-15 19:46:53,,1,0,Twitter Web Client,RT @shannonebraun: Thank you @RepPeteAguilar for your continued support of funding for diabetes research! #JDRFGovDay #Type1D https://t.co/…
709802764545695744,2016-03-15 18:05:41,,5,5,Twitter Web Client,"TY @SANBAGnews for stopping by. Your commitment to investing in roads, rails &amp; bridges strengthens the #IE economy. https://t.co/Oyv5hEZ1uo"
709785702687444993,2016-03-15 16:57:53,,5,10,Twitter Web Client,Great to visit w/ Inland Action about supporting local biz &amp; how we can continue to grow the #InlandEmpire economy. https://t.co/xm6QvlDPSZ
709511478932611073,2016-03-14 22:48:13,,1,0,Twitter Web Client,Show off your skills! Deadline is April 6th. #CA31 https://t.co/jMUwR0CqPG
709508965143584768,2016-03-14 22:38:13,,1,0,Twitter Web Client,"RT @CityNewsGroup: Happy Pi Day! For the record, we want some. #PiDay https://t.co/oo4apR4Z32"
709433102125416449,2016-03-14 17:36:46,,0,3,Twitter Web Client,#NationalNutritionMonth  https://t.co/1mjLLDAis4
708412202684968962,2016-03-11 22:00:05,,1,0,Twitter Web Client,The I-10 Pepper Ave Interchange is an important investment for our region. https://t.co/N1ctPw6NQx
708407864415690752,2016-03-11 21:42:51,,0,4,Twitter Web Client,Glad to join #SBCounty leaders at the I-10 Pepper Ave Interchange groundbreaking this morning! https://t.co/jjbVFQA5sh
708334304695345153,2016-03-11 16:50:33,,2,0,Twitter Web Client,RT @RedlandsNews: Opportunities for community service hours in Redlands https://t.co/1Idg1JpkVV https://t.co/b3PiKGhK3P
708054628118753280,2016-03-10 22:19:13,,1,2,Twitter Web Client,Need help with Social Security or veterans benefits? My office is here to help: https://t.co/qKYD5LK1bv
708010051991183362,2016-03-10 19:22:05,,252,0,Twitter Web Client,RT @GinaEPA: Proud to carry out @POTUS commitment to reduce #methane emissions &amp; join our Canadian colleagues to #ActOnClimate. https://t.c…
707999892166336512,2016-03-10 18:41:42,,2,7,Twitter Web Client,.@POTUS strategy w/ Canada to reduce methane emissions is an important step in our global commitment to combat climate change. #ActOnClimate
707993231288573952,2016-03-10 18:15:14,,1,2,Twitter Web Client,We cannot be silent while the assault on women’s rights continues. https://t.co/BpAtnFoSge #WomensHistoryMonth
707672234400342016,2016-03-09 20:59:43,,0,2,Twitter Web Client,Glad to join Under Secretary Concannon &amp; congratulate Upland students on their HealthierUS School Challenge Awards! https://t.co/iFu3tvk6Xp
707667083534966784,2016-03-09 20:39:15,,2,1,Twitter Web Client,Reminder – the Congressional Art Competition is underway for #CA31 high school students. Deadline is April 6th: https://t.co/irDapuJUmX
707340605769322496,2016-03-08 23:01:56,,2,7,Twitter Web Client,#InternationalWomensDay https://t.co/jcrkWkgCgJ
707231030575505410,2016-03-08 15:46:32,,2,0,Twitter Web Client,Read my @TIME editorial with @SenFeinstein on the Apple encryption case here: https://t.co/0CRF9HILRD
706966109484945408,2016-03-07 22:13:49,,4,0,Twitter Web Client,"RT @RepDelBene: #otd, Congress passed #VAWA to help protect 1 in 4 women who become victims of #domesticviolence. Let's keep working to sto…"
706962449900163072,2016-03-07 21:59:17,,0,3,Twitter Web Client,"For a full day of learning, our kids need to start every morning with a healthy breakfast. #NationalSchoolBreakfastWeek"
706544667278577665,2016-03-06 18:19:10,,1,5,Twitter Web Client,Thanks to everyone who joined me at Cuca's for Coffee with your Congressman. See you next time! https://t.co/cc0gWkOGFP
705892763137662978,2016-03-04 23:08:44,,0,1,Twitter Web Client,Thank you to the 2nd graders at Vermont Elementary for celebrating #ReadAcrossAmerica Day w/ me a few days late! https://t.co/itngSC6b8D
705859871158226944,2016-03-04 20:58:02,,3,0,Twitter Web Client,RT @ColtonJUSD: Congressman Pete Aguilar visited Wilson ES today! @Wilson_CJUSD https://t.co/GnVgxngZJh
705858023890272258,2016-03-04 20:50:41,,2,7,Twitter Web Client,Had a blast reading &amp; spending time w/ 1st &amp; 4th graders at Woodrow Wilson Elementary. Thanks for having me! https://t.co/hZ9hLenfTO
705835288275369984,2016-03-04 19:20:21,,1,10,Twitter Web Client,Thank you to Mrs. Figgins &amp; her 2nd grade class for inviting me to spend my afternoon at Crafton Elementary. https://t.co/pyBx4ORjNt
705824786446946304,2016-03-04 18:38:37,,1,5,Twitter Web Client,Excited to check in w/ students and teachers at elementary schools across our community today &amp; celebrate a belated #ReadAcrossAmerica Day!
