id,created_at,user,retweets,favorite_count,source,text
722098259368484864,2016-04-18 16:23:35,RepTerriSewell,37,32,Hootsuite,My condolences go out to all those who have been affected by the tragic earthquake in Ecuador #PrayForEcuador https://t.co/3kUvhUlPCl
721018680151261184,2016-04-15 16:53:43,RepTerriSewell,11,0,Twitter for iPhone,RT @MurielBowser: Thank you to the distinguished panel who spoke abt the history &amp; future of civil rights. #DCEmancipationDay https://t.co/…
720992111139692544,2016-04-15 15:08:09,RepTerriSewell,4,8,Twitter for iPhone,Our vote is our voice. All must be heard! #EmancipationDay #RestoreTheVote https://t.co/qqxhfexdIQ
720980178361520130,2016-04-15 14:20:44,RepTerriSewell,2,0,Twitter for iPhone,"RT @thombowen: ""Legislation never starts at the top. It starts at the bottom."" @RepTerriSewell #EmancipationDay #RestoreTheVote"
720735923680514048,2016-04-14 22:10:09,RepTerriSewell,4,9,Hootsuite,A leading lady in STEM from Tuskeegee University! Hayley Hightower and her father were a delight. #PROJECTSTEM2016 https://t.co/gpoZd3McID
720734289600638976,2016-04-14 22:03:39,RepTerriSewell,7,18,Hootsuite,I had a great time meeting with members of the Education Policy Fellowship Program! Education is so important! https://t.co/mlx3QmX77a
720344706924679168,2016-04-13 20:15:36,RepTerriSewell,7,11,Twitter Web Client,It was a pleasure to meet with the #MOAA today in our D.C. office. https://t.co/d9oYYai89X
720343848879153152,2016-04-13 20:12:11,RepTerriSewell,2,8,Twitter Web Client,It was great meeting with the group from Toyota Fly In from  Alabama today! @ToyotaMotorCorp https://t.co/tUw1F01gwy
720263616486862848,2016-04-13 14:53:22,RepTerriSewell,17,85,Twitter for iPhone,@JenniferNettles supporting the #RestoreTheVote campaign! #votingrights #TrueLeaders @4H 🍀 https://t.co/eapsntJHAA
720213040684232704,2016-04-13 11:32:24,RepTerriSewell,13,21,Twitter for iPhone,So glad to talk about equal pay for women with @rolandsmartin on News One Now #EqualPayForEqualWork https://t.co/TNE2Z44Hqf
720055408673570816,2016-04-13 01:06:02,RepTerriSewell,3,19,Twitter for iPhone,OMG! Jennifer Nettles is a 4H alumni too! I knew I liked her:-) #TrueLeaders https://t.co/HSg9ujNXSM
720054839078731777,2016-04-13 01:03:46,RepTerriSewell,1,10,Twitter for iPhone,In good company with Craig Melvin receiving 4H Alumni Award. Thanks4H! #TrueLeaders https://t.co/HVP9aV3sga
720049433577144320,2016-04-13 00:42:17,RepTerriSewell,2,22,Twitter for iPhone,Great to be among another great @4H alum @craigmelvin at the 4-H Legacy Awards tonight!🍀 @TODAYshow #TrueLeaders https://t.co/xUIsJuJCl0
720047358608863233,2016-04-13 00:34:02,RepTerriSewell,3,11,Twitter for iPhone,"With fellow 4-H'er, the amazing @JenniferNettles at the National 4-H Council Legacy Awards! #TrueLeaders https://t.co/ZacrDJRtbL"
720006126713073664,2016-04-12 21:50:12,RepTerriSewell,9,22,Twitter Web Client,Celebrating hard working women like @Lilly_Ledbetter as we push for fairness and equality for women. #EqualPayDay https://t.co/sw9oIREvu8
719975926117896193,2016-04-12 19:50:11,RepTerriSewell,7,8,Hootsuite,Congress must follow the example set by the Supreme Court and unify America by striking down restrictive voter ID laws #RestoreTheVote
719970948624084993,2016-04-12 19:30:25,RepTerriSewell,0,2,Hootsuite,Let's not forget to #RestoreTheVote ! https://t.co/8xIBX8p4u6
719963389607460866,2016-04-12 19:00:23,RepTerriSewell,7,5,Hootsuite,The time is NOW ! Congress must #RestoreTheVote or this will be the first presidential election without full voter protection under the law
719943689749987328,2016-04-12 17:42:06,RepTerriSewell,11,0,Twitter for iPhone,RT @4H: Tonight we're awarding #4H alums @CraigMelvin &amp; @RepTerriSewell w/ the Distinguished Alumni Medallion at #4HLegacy! https://t.co/Rq…
719928342892384258,2016-04-12 16:41:07,RepTerriSewell,18,30,Hootsuite,"In 2016, women still only make 79 cents to every male dollar. It's time to close the gender wage gap. #EqualPayDay https://t.co/09crN2PbIJ"
719882361333276672,2016-04-12 13:38:24,RepTerriSewell,7,2,Twitter Web Client,Equal Pay for Equal Work! It's time to close the gap. #EqualPayDay https://t.co/rSplx0RYK8
719586026101059584,2016-04-11 18:00:52,RepTerriSewell,2,5,Hootsuite,This is not just a Democratic issue. View Republican Rep. Jim Sensenbrenner @nytimes op-ed https://t.co/YPiPQC8c3t https://t.co/enydPWNbyH
719516586923700224,2016-04-11 13:24:56,RepTerriSewell,7,5,Twitter Web Client,Suppress Votes? I’d Rather Lose My Job https://t.co/pKFPe7arDU #RestoreTheVote https://t.co/RMAeP8VHxu
717437959310598145,2016-04-05 19:45:13,RepTerriSewell,7,9,Hootsuite,Every man must decide...  #RestoreTheVote https://t.co/CGcpbfTurR
717435424361353216,2016-04-05 19:35:09,RepTerriSewell,2,8,Hootsuite,Injustice anywhere is a threat to justice everywhere - MLK #RestoreTheVote
717431662628487168,2016-04-05 19:20:12,RepTerriSewell,1,4,Hootsuite,We must remain united in our efforts toward securing voting rights for all #RestoreTheVote
717430407285891072,2016-04-05 19:15:12,RepTerriSewell,0,5,Hootsuite,Congress must make a unanimous decision to unify our voters across the nation by eliminating restrictive voter ID laws #RestoreTheVote
717429257337745408,2016-04-05 19:10:38,RepTerriSewell,1,2,Twitter Web Client,A fair chance at democracy can only exist with a fair path to the ballot. #RestoreTheVote  https://t.co/xufpaV56XD https://t.co/2j6gXTIluH
717426703472201728,2016-04-05 19:00:29,RepTerriSewell,8,15,Hootsuite,Give us the ballot and we will no longer have to worry the federal government about our basic rights #RestoreTheVote https://t.co/1u4moL0rJ9
717371802759073792,2016-04-05 15:22:20,RepTerriSewell,5,5,Twitter Web Client,"A unanimous decision unifying the people; yes, this still is the United States of America. #SCOTUS #EveryoneCounts https://t.co/RvDHyAEwJ4"
716990386527465472,2016-04-04 14:06:43,RepTerriSewell,30,22,Twitter Web Client,"48 yrs ago today, we lost a civil rights hero. Let his sacrifice not be in vain.#MLK #CivilRights #votingrights https://t.co/R96B7tuIWZ"
716003541668769792,2016-04-01 20:45:21,RepTerriSewell,6,14,Hootsuite,It was great chatting with @essencemag ! Read my full interview here: https://t.co/XAymLGHidv #WHM2016 https://t.co/LpztJLgRFP
715294273298702336,2016-03-30 21:46:58,RepTerriSewell,5,0,Twitter for iPhone,RT @ChildrensAL: Thanks to @RepTerriSewell for visiting Children's today! https://t.co/OwGiuzo430 https://t.co/o3TtoHNQ50
715280058647244800,2016-03-30 20:50:29,RepTerriSewell,1,9,Twitter Web Client,"""It was a pleasure to meet with staff and patients at @ChildrensAL in Birmingham today.""@RepTerriSewell https://t.co/qlIxkudEHf"
715251412607844356,2016-03-30 18:56:40,RepTerriSewell,5,7,Twitter for iPhone,Honored to present Congressional Gold Medal to Mr. Eddie Bibb as a WW II Montford Point Marine. Thank you!! https://t.co/SXzSEHggni
715183274247733248,2016-03-30 14:25:54,RepTerriSewell,3,8,Twitter Web Client,"""Today I am in Bhm for district work period. My first stop visiting UPS main facility in Bhm."" https://t.co/x4XDsuoT2r"
714954182910951424,2016-03-29 23:15:35,RepTerriSewell,9,4,Twitter for iPhone,Calling high school artists in Alabama's 7th district-deadline is April 4th. Request submissions @RepTerriSewell https://t.co/FUKqDAMUpn
714946168581701632,2016-03-29 22:43:44,RepTerriSewell,6,15,Twitter for iPhone,"On #VietnamVeteransDay , so proud to stand with #AL07 veterans at Pickens County Town Hall meeting. https://t.co/Ayh7H5l9R5"
714943211785945088,2016-03-29 22:31:59,RepTerriSewell,2,0,Twitter for iPhone,RT @NatlJumpStart: Please join us! #FLHillDay2016 Free Lunch and #finlit networking TY @FSIwashington https://t.co/ix7eHzgO85 https://t.co/…
714914616745279488,2016-03-29 20:38:21,RepTerriSewell,9,34,Twitter for iPhone,Today I am visiting with the HS students at Pickens County Career Center. Awesome work in biomedical field! #STEM https://t.co/rVxHp4An8S
714854785858609152,2016-03-29 16:40:36,RepTerriSewell,23,0,Twitter for iPhone,"RT @essencemag: Congresswoman @RepTerriSewell talks Selma, the Senate and the influence of #ShirleyChisholm: https://t.co/XNphyBE0wi https:…"
714567048286900230,2016-03-28 21:37:14,RepTerriSewell,6,28,Twitter Web Client,All office DC staff are safe and accounted for.  We are thankful for the service of the Capitol Police.
714543585417379840,2016-03-28 20:04:00,RepTerriSewell,4,4,Twitter Web Client,"AL loses $781,000,000 in GDP, $481,000,000 in wages, $7,035,000 in taxes, harms 32,000 citizens #unfreezeDAPA https://t.co/hdw7HVWOMi"
714543395839016962,2016-03-28 20:03:15,RepTerriSewell,2,4,Twitter Web Client,"32,000 of U.S. citizens in AL are counting on #SCOTUS to follow law &amp; keep families together https://t.co/hdw7HVWOMi #unfreezeDAPA"
713449308134182912,2016-03-25 19:35:44,RepTerriSewell,11,0,Twitter for iPhone,RT @NPCA: PM READ: @RepTerriSewell champions bill to create #NatlParkForBham: https://t.co/HFnZAFRi1r via @aldotcom https://t.co/f4VdzJzCA8
713449273300488192,2016-03-25 19:35:36,RepTerriSewell,2,0,Twitter for iPhone,"RT @dberrygannett: ! @RepTerriSewell says Birmingham should have its ""rightful place"" in civil rights history by becoming part of NPS https…"
713449225296748544,2016-03-25 19:35:25,RepTerriSewell,2,0,Twitter for iPhone,"RT @NPCA: Yesterday, @NPCA was honored to join @SavingPlaces, @RepTerriSewell and @cityofbhamal to support #NatlParkForBham! https://t.co/V…"
713449195332571136,2016-03-25 19:35:18,RepTerriSewell,2,0,Twitter for iPhone,"RT @ALReporter: .@RepTerriSewell proposes a National Park for Civil Rights Movement in downtown Birmingham, Ala. https://t.co/rQgDXs7RuN #a…"
713088134905462784,2016-03-24 19:40:34,RepTerriSewell,14,28,Twitter for iPhone,When Women Succeeds America Succeeds! With Facebook hosting Birmingham women own businesses! #SheMeansBusiness https://t.co/2Fr6h4MoPA
712651467560194048,2016-03-23 14:45:24,RepTerriSewell,2,5,Twitter for iPhone,Rep. Sewell discussing infrastructure and funding options with industry experts #SIFMA https://t.co/DK3PzgrLzh
712396281038151680,2016-03-22 21:51:23,RepTerriSewell,6,8,Hootsuite,Birmingham Historic Civil Rights District! You can watch the entire press conference on my YouTube channel https://t.co/qNGPc5ptXK
712365561385242624,2016-03-22 19:49:19,RepTerriSewell,0,8,Hootsuite,It was amazing to meet with the Alabama AIPAC delegation today! Always a joy to have them visit Washington! #Alabama https://t.co/k7dJai0XMI
712360964302180352,2016-03-22 19:31:03,RepTerriSewell,2,3,Hootsuite,It’s time to preserve Civil Rights history with a National Park in Birmingham. Add your voice in support #NPforBham
712323448509501440,2016-03-22 17:01:59,RepTerriSewell,2,9,Hootsuite,"Add your support for the creation of a Nat'l Park in Birmingham, the heart of the Civil Rights Movement #NPforBham"
712308369109999620,2016-03-22 16:02:03,RepTerriSewell,4,8,Hootsuite,Preserve Civil Rights history by voicing your support for the creation of a national park for Birmingham #NPforBham
712304774469787648,2016-03-22 15:47:46,RepTerriSewell,2,10,Twitter Web Client,@RepTerriSewell introduces H.R. 4817 to designate Birmingham's Historic Civil Rights District as a National Park. https://t.co/LoUICWJgvF
712304220439969792,2016-03-22 15:45:34,RepTerriSewell,4,17,Hootsuite,Birmingham was the heart of the Civil Rights Movement. Let’s preserve this history with a National Park. #NPforBham
712293203039412224,2016-03-22 15:01:48,RepTerriSewell,3,7,Hootsuite,Help keep Civil Rights history alive and support the creation of a national park for Birmingham. #NPforBham
710583268614213632,2016-03-17 21:47:07,RepTerriSewell,9,31,Twitter Web Client,Today I dropped a bill to name the Selma post office after voting rights pioneer Amelia Boynton Robinson. RIP https://t.co/nmhXMPqHp9
709798924379361281,2016-03-15 17:50:25,RepTerriSewell,2,6,Hootsuite,"This Restoration Tuesday, we honor women who championed the cause of protection of our fundamental right to the polls #RestoreTheVote"
709797686715817988,2016-03-15 17:45:30,RepTerriSewell,5,10,Hootsuite,We cannot let modern day barriers such as restrictive photo ID laws silence our political voice. We must #RestoreTheVote
709795126529400833,2016-03-15 17:35:20,RepTerriSewell,3,7,Hootsuite,Women have long played a vital role in the movement for voting rights in America's history #RestoreTheVote #WHM2016
709791393955319808,2016-03-15 17:20:30,RepTerriSewell,1,2,Hootsuite,The 3 women of the Supreme Court wrote dissenting opinions following the tragic Section 4 strike down. #RestoreTheVote #WHM2016
709786694330007553,2016-03-15 17:01:49,RepTerriSewell,5,5,Hootsuite,"We cannot let the sacrifices of Fannie Lou Hamer, Rosa Parks, and Coretta Scott King go in vain. We must #RestoreTheVote"
707996246724706305,2016-03-10 18:27:13,RepTerriSewell,18,20,Hootsuite,"Congresswoman Terri Sewell called a ""history-making lawmaker"" #WHM2016 #RestoreTheVote https://t.co/lSjt5vQohw https://t.co/ghk8jHiUG6"
706687143821905925,2016-03-07 03:45:19,RepTerriSewell,5,17,Hootsuite,There is just something special about being in your home church…
706685515534196738,2016-03-07 03:38:51,RepTerriSewell,1,0,Twitter for iPhone,RT @SpencerOverton: .@RepTerriSewell @SteveScalise &amp; @Clyburn speaking at historic Brown Chapel after service https://t.co/C23QkSq9rU
706595321766346752,2016-03-06 21:40:27,RepTerriSewell,10,11,Hootsuite,It’s time to break down the barriers hindering our right to vote #RestoreTheVote
706578920511041540,2016-03-06 20:35:16,RepTerriSewell,14,23,Hootsuite,We cannot let the sacrifices of those who marched 51 years ago be in vain #BloodySunday #RestoreTheVote
706525067237314561,2016-03-06 17:01:17,RepTerriSewell,1,8,Twitter for iPhone,Standing with @SteveScalise as @Clyburn brings forth his remarks in the Historic Brown Chapel https://t.co/UEM9eev3Ns
706500333577576448,2016-03-06 15:23:00,RepTerriSewell,4,0,Twitter for iPhone,"RT @JointCenter: @RepTerriSewell speaks at this morning's Unity Breakfast in Selma, Alabama #JCinSelma https://t.co/Gi7G63JBvd"
706268666652987393,2016-03-06 00:02:26,RepTerriSewell,12,24,Twitter for iPhone,Great forum on Voting Rights in Birmingham today! #RestoreTheVRA https://t.co/JpfIoVoORQ
706268124220362752,2016-03-06 00:00:17,RepTerriSewell,7,14,Twitter for iPhone,Hosting Voting Rights Forum in Birmingham with Members of Congress! Excellent testimony of  barriers to voting! https://t.co/XmbKZdUVqs
706192899034259461,2016-03-05 19:01:22,RepTerriSewell,3,6,Hootsuite,We’ve come a long way but there’s still work to be done #RestoreTheVote
706175028417667072,2016-03-05 17:50:21,RepTerriSewell,3,5,Hootsuite,Starting in ten minutes! #CongressionalForum #RestoreTheVote
706139897992712192,2016-03-05 15:30:45,RepTerriSewell,7,8,Hootsuite,Don’t forget to join us at 1. Birmingham City Hall. OPEN TO ALL #CongressionalForum #RestoreTheVote
705895815156465664,2016-03-04 23:20:51,RepTerriSewell,2,11,Twitter for iPhone,Join us tomorrow at 1pm for Voting Rights Forum at Birmingham City Hall! #RestoreTheVote https://t.co/VYLCN1kFAD
705881807758233600,2016-03-04 22:25:12,RepTerriSewell,1,4,Hootsuite,So excited to welcome members of Congress to my district this weekend! #RestoreTheVote
705834064822059010,2016-03-04 19:15:29,RepTerriSewell,14,15,Hootsuite,Join us tomorrow 1pm @ Birmingham City Hall! Congressional Forum--Open to the public! See you there! #RestoreTheVote https://t.co/83c28fx6KU
705826533399732224,2016-03-04 18:45:33,RepTerriSewell,2,0,Hootsuite,RT @JointCenter: Excited to have @RepTerriSewell stop by our meeting with the Alabama Conference of Black Mayors #JCinSelma https://t.co/8e…
705521232410714112,2016-03-03 22:32:24,RepTerriSewell,7,7,Twitter Web Client,The President intends to do his job and the Republican Senators need to do their job. #DoYourJob https://t.co/uOkMSFKphi
705500563803398144,2016-03-03 21:10:16,RepTerriSewell,2,6,Hootsuite,Rep Sewell Calls on Senate Republicans to Do Their Job and Consider the President’s Supreme Court Nominee #DoYourJob https://t.co/Tlgqs22k6c
705490504184631296,2016-03-03 20:30:18,RepTerriSewell,7,11,Hootsuite,The Constitution of the United States of America can never be ignored for political preference #DoYourJob https://t.co/T30zl70Kgt
705487423120261120,2016-03-03 20:18:03,RepTerriSewell,10,17,Hootsuite,"""Tremendous amounts of talent are lost to our society simply because that talent wears a skirt"" #WHM2016 https://t.co/dMjEFSe1h2"
705485786397937664,2016-03-03 20:11:33,RepTerriSewell,4,0,Hootsuite,RT @AlabamaToday: .@RepTerriSewell to host Congressional forum on the current state of voting rights in America https://t.co/2EojfRMjVK #AL…
705121071410909184,2016-03-02 20:02:18,RepTerriSewell,9,22,Twitter for iPhone,At White House with National Champs Alabama Football Team #RollTide https://t.co/cBluVb9Ipz
705120106267975681,2016-03-02 19:58:28,RepTerriSewell,4,6,Hootsuite,Our Alabama Football Team is at the White House today! Click the link to watch #RollTide https://t.co/7eW3lHwfQq https://t.co/o3DabUjoNB
705053895605796868,2016-03-02 15:35:22,RepTerriSewell,10,14,Hootsuite,Today President Obama welcomes the University of Alabama's National Championship Football team to the White House! #RollTide #BamaFootball
704808843163934725,2016-03-01 23:21:37,RepTerriSewell,19,22,Hootsuite,"It is not only our privilege, but our duty to exercise our right to vote. #RestoreTheVote"
704743551603757056,2016-03-01 19:02:10,RepTerriSewell,6,5,Hootsuite,"Selma’s marchers now have a Congressional Gold Medal, but the Voting Rights Act is still devastated. #RestoretheVote https://t.co/Kq1z4PVVMX"
704739370989981696,2016-03-01 18:45:34,RepTerriSewell,7,9,Hootsuite,This year will be the first election in in 50 years without voting protection ensured by the VRA if we don’t #RestoreTheVOTE
704733141869715456,2016-03-01 18:20:48,RepTerriSewell,1,3,Hootsuite,It is wrong – deadly wrong – to deny any of your fellow Americans the right to vote in this country – LBJ #RestoreTheVOTE
704730576486592512,2016-03-01 18:10:37,RepTerriSewell,8,8,Hootsuite,The right to vote is an essential pillar of the American democracy! We cannot afford to let go of these rights. We MUST #RestoretheVote
704728500708757505,2016-03-01 18:02:22,RepTerriSewell,8,8,Hootsuite,Congress presented Selma's marchers with a Gold Medal last week. Now we need to take action and #RestoreTheVote https://t.co/Kq1z4PVVMX
704651802071994369,2016-03-01 12:57:36,RepTerriSewell,13,15,Twitter for iPhone,Alabama Primary Election TODAY!!! Polls open 7am-7pm Don't forget to VOTE! #SuperTuesday #restorationtuesday https://t.co/b5BQnA6MSC
703181894062505984,2016-02-26 11:36:42,RepTerriSewell,3,4,Twitter for iPhone,FootSolider Gold Medal Ceremony. ICYMI  https://t.co/QGiPQ46E2V https://t.co/hCY1gO5D6B
703006700882829312,2016-02-26 00:00:33,RepTerriSewell,2,3,Hootsuite,"""Thank God for having brought me through many dangers, seen and unseen, to see today"" - Rev. F. D. Reese https://t.co/yqrFbaH9D0"
702994025540931585,2016-02-25 23:10:11,RepTerriSewell,0,3,Hootsuite,Standing with the guest of honor and some of our honorees before the Congressional Gold Medal event. What an honor! https://t.co/Hjwof3jxtR
702972433993695239,2016-02-25 21:44:23,RepTerriSewell,3,3,Hootsuite,"""We were determined to make sure that every person would be accepted in this great country of ours"" Rev. F. D. Reese https://t.co/RNUsI36sJs"
702575196658655232,2016-02-24 19:25:54,RepTerriSewell,4,6,Twitter for iPhone,"How awesome is it, that in moments...hundreds of Foot Soldiers will be recognized for their bravery and strength"
702538447001489408,2016-02-24 16:59:52,RepTerriSewell,2,5,Twitter for iPhone,""" I was a child prisoned for 4 nights. I made the walk on Bloody Sunday. It means everything to be apart of this"" M. Howard-Foot Soldier"
702235296663019520,2016-02-23 20:55:16,RepTerriSewell,21,0,Twitter Web Client,"RT @JacksonLeeTX18: In many places in this country, men and women are kept from voting simply because they are Negroes – LBJ #RestoreTheVOTE"
702235278333911042,2016-02-23 20:55:11,RepTerriSewell,13,0,Twitter Web Client,RT @JacksonLeeTX18: It is the duty of Congress to ensure that all citizens have equal opportunity to vote! #RestoreTheVOTE
702211508307107841,2016-02-23 19:20:44,RepTerriSewell,6,8,Twitter Web Client,It is wrong – deadly wrong – to deny any of your fellow Americans the right to vote in this country – LBJ #RestoreTheVOTE
702209235845779456,2016-02-23 19:11:42,RepTerriSewell,23,0,Twitter Web Client,RT @RepGutierrez: #RestoreTheVRA #RestoreTheVOTE #twill #p2 https://t.co/OEbRJ4OBaw
702207988812095488,2016-02-23 19:06:45,RepTerriSewell,55,0,Twitter Web Client,"RT @RepMarciaFudge: Our vote is our voice. Our voices must be heard! If you agree that we need to #RestoreTheVOTE, RETWEET! https://t.co/iy…"
702207885019914240,2016-02-23 19:06:20,RepTerriSewell,4,7,Twitter Web Client,It is the duty of Congress to ensure that all citizens have equal opportunity to vote! #RestoreTheVOTE
702178182309527552,2016-02-23 17:08:19,RepTerriSewell,11,12,Twitter Web Client,"Over 50 years ago, hundreds of Foot Soldiers made the historic march to ensure the right to vote. We must #RestoreTheVOTE"
698927448944152577,2016-02-14 17:51:03,RepTerriSewell,11,17,Twitter for iPhone,"My prayers to #JusticeScalia family. May the Constitution reign,  #Obama nominates and senate confirms a new Justice"
698001674950946820,2016-02-12 04:32:22,RepTerriSewell,9,16,Twitter for iPhone,Obama appoints Judge Abdul Kallon to 11th Circuit https://t.co/41sAhC8wbA
697179992711520256,2016-02-09 22:07:17,RepTerriSewell,4,1,Twitter Web Client,"Check out this piece in @thenation on NH's new voter-ID law, which will be in full effect for the 1st time today: https://t.co/Jk7QMU2Rxd"
697137941106311168,2016-02-09 19:20:12,RepTerriSewell,56,41,Twitter Web Client,Today's primary will be the 1st in 50 yrs where Americans will not have the full protections of the VRA. It's time to #RestoretheVote!
695266602598690817,2016-02-04 15:24:10,RepTerriSewell,6,16,Twitter for iPhone,Derrick made us proud again at the National Prayer Breakfast in DC!#RollTide #sweet16 https://t.co/Ln8x36FFKD
695004070684291073,2016-02-03 22:00:57,RepTerriSewell,3,23,Twitter Web Client,Thank you @RepJeffDuncan for graciously honoring our wager and being such a great sport today! #RollTide https://t.co/mxLliU4J3X
694999308861575169,2016-02-03 21:42:02,RepTerriSewell,11,11,Twitter Web Client,Today I stood with my colleagues to urge immediate action on the #FlintWaterCrisis. https://t.co/lWUmHjNOmY
694905853397307393,2016-02-03 15:30:40,RepTerriSewell,31,0,Twitter Web Client,RT @RepDanKildee: My hope is that the outrage of the #FlintWaterCrisis translates into help for the Flint families and children who are the…
694901683411927045,2016-02-03 15:14:06,RepTerriSewell,9,11,Twitter Web Client,Proud to be the lead Dem on legislation to improve the flawed medicare reimbursement formula for rural hospitals. https://t.co/huwiJHi23a
694593172303929345,2016-02-02 18:48:11,RepTerriSewell,8,7,Twitter Web Client,State laws barring those w/ crim records from voting date back before Jim Crow -lawmakrs were wking tirelessly to invalidate the black vote.
694588676328792064,2016-02-02 18:30:19,RepTerriSewell,20,23,Hootsuite,Every election matters. Every vote matters #RestoreTheVOTE
694587274051338241,2016-02-02 18:24:45,RepTerriSewell,61,0,Twitter Web Client,"RT @civilrightsorg: This #BlackHistoryMonth, Congress must #RestoreTheVRA to honor Dr. King and Selma's foot soldiers. #RestoreTheVOTE http…"
694584873462415360,2016-02-02 18:15:13,RepTerriSewell,19,18,Hootsuite,"Voting is a right, not a privilege. #RestoreTheVOTE"
694583170897973248,2016-02-02 18:08:27,RepTerriSewell,14,0,Twitter Web Client,RT @SenatorLeahy: Republicans should bring up &amp; pass bill I introduced with @repjohnlewis @RepTerriSewell @RepLindaSanchez @RepJudyChu http…
694581147846754304,2016-02-02 18:00:24,RepTerriSewell,10,6,Twitter Web Client,The voices of the excluded shall not go unheard! Share your story using #RestorationTuesday or #RestoreTheVOTE
694574116515495936,2016-02-02 17:32:28,RepTerriSewell,10,6,Twitter Web Client,Alabama has one of the nation’s highest disenfranchisement rates.Nearly 1/3 of black men in AL have permanently lost their right to vote.
694573826278031361,2016-02-02 17:31:19,RepTerriSewell,14,5,Twitter Web Client,"4.4 million of those who are banned from the ballot box are out of prison, living in our communities, paying taxes, &amp; raising families."
694573396173144065,2016-02-02 17:29:36,RepTerriSewell,10,7,Twitter Web Client,I support @RepJohnConyers Democracy Restoration Act of 2015-a bill designed to restore voting rights to those released from prison.
694572132743913472,2016-02-02 17:24:35,RepTerriSewell,14,9,Twitter Web Client,"Today, on the 1st #RestorationTuesday of February, we are focusing on felony disenfranchisement."
694238914899501056,2016-02-01 19:20:30,RepTerriSewell,8,6,Twitter Web Client,"Met with Mayor Bell, @JRobersonDist7, Councilor Parker to discuss preservation of Birmingham's civil rights sites. https://t.co/4AF2DxeAoi"
694228962445299713,2016-02-01 18:40:57,RepTerriSewell,9,8,Twitter Web Client,".@POTUS: ""We recommit to reaching for a day when no person is judged by anything but the content of their character."" #BlackHistoryMonth2016"
694189446682509312,2016-02-01 16:03:56,RepTerriSewell,235,0,Twitter for iPhone,RT @RepKarenBass: This #BlackHistoryMonth we celebrate heroes for civil rights &amp; voting rights. We recommit to defending the victories of A…
