id,created_at,user,retweets,favorite_count,source,text
384830032364834816,2013-10-01 00:00:04,RepTerriSewell,4,2,TweetDeck,"As the old saying goes, ""If you can't beat 'em, kick the ball into the woods."" #GOPShutdown http://t.co/fCw37adH69"
384822980921921536,2013-09-30 23:32:02,RepTerriSewell,11,1,TweetDeck,RT if you agree. Speaker Boehner should pass a clean bill today &amp; avoid a #GOPShutdown. #EnoughAlready
384818703100940289,2013-09-30 23:15:03,RepTerriSewell,6,0,TweetDeck,"House R's have America on course for #GOPShutdown. Tomorrow, hundreds of thousands of Fed employees face furloughs &amp; many will work w/o pay."
384812410898374657,2013-09-30 22:50:02,RepTerriSewell,19,5,TweetDeck,"National Institute of Health researches medical cures for life-threatening illnesses, #GOPShutdown means life-saving research is stops."
384806119962460161,2013-09-30 22:25:03,RepTerriSewell,12,2,TweetDeck,The #GOPShutdown means we rely more on foreign energy as the issuance of permits for energy production on federal lands stop.
384801337948397568,2013-09-30 22:06:02,RepTerriSewell,15,5,TweetDeck,"#GOPShutdown means National Park facilities and services will be closed, a huge loss to local economies that rely on travel &amp; tourism."
384796054111010817,2013-09-30 21:45:03,RepTerriSewell,5,0,TweetDeck,#GOPShutdown means housing loans for low/mid income fams in rural communities &amp; start-up business loans for farmers &amp; ranchers put on hold.
384793374575710208,2013-09-30 21:34:24,RepTerriSewell,3,1,TweetDeck,"Thanks to #GOPShutdown, the Small Business Admin will stop approving applications for small biz loans, an important driver of our recovery."
384774270573740032,2013-09-30 20:18:29,RepTerriSewell,3,0,TweetDeck,"Interested in attending a service academy? Join us tomorrow in Marion, AL for our next Academy Night 2013! http://t.co/tz5pCN9BCP"
384763762663645184,2013-09-30 19:36:44,RepTerriSewell,0,0,TweetDeck,@BachusAL06 &amp; I have found common ground on many economic development issues stemming from our shared love for B'ham &amp; the State of Alabama.
384760178844770304,2013-09-30 19:22:29,RepTerriSewell,3,1,TweetDeck,"Been a tremendous honor to serve with @BachusAL06 . While we have not agreed on many policy issues, I have the utmost respect for Spencer."
384729362051784705,2013-09-30 17:20:02,RepTerriSewell,3,0,TweetDeck,Debunk the myths. Learn the facts. Let's provide quality healthcare at an affordable price for all Americans! http://t.co/CP2U9vqZzZ
384716655831433216,2013-09-30 16:29:33,RepTerriSewell,6,3,TweetDeck,What if just half the effort that has been put into selling lies about #ACA had been utilized to inform people of the benefits? #GetCovered
384701566277517312,2013-09-30 15:29:35,RepTerriSewell,7,0,TweetDeck,"Government Shutdown Is Bad News For Women, Infants and Children (WIC) Program  http://t.co/f5gaSQkmZ3"
383773298070261760,2013-09-28 02:00:59,RepTerriSewell,18,3,TweetDeck,GOP spent $40 million on negative #ACA ads. What if they had used a fraction of that money to better explain the enrollment process?
383753936353517568,2013-09-28 00:44:02,RepTerriSewell,10,4,TweetDeck,"Biggest fear my Republican colleagues have is that #ACA will succeed, not that it will fail. If it succeeds, will it still be #Obamacare?"
383651237234614273,2013-09-27 17:55:57,RepTerriSewell,1,0,TweetDeck,@RepTerriSewell Discusses #ACA Implementation on the @edshow  http://t.co/PqyccttLRY
383595872686055424,2013-09-27 14:15:57,RepTerriSewell,1,0,TweetDeck,"A BIG Happy Birthday to the best colleague, friend, and roommate I could ever ask for, @RepDWStweets !"
383347868985069568,2013-09-26 21:50:28,RepTerriSewell,6,0,TweetDeck,RT @haskinstheodore: @RepTerriSewell @edshow @msnbc  Thank you Rep. Sewell. I agree the Affordable Care Act should be a right &amp; not a fight.
383346449020223488,2013-09-26 21:44:50,RepTerriSewell,2,0,TweetDeck,"RT @Smith83K: @edshow ""Health care should be a right, not a fight."" ~ @RepTerriSewell #edshow"
383327939346956288,2013-09-26 20:31:17,RepTerriSewell,7,0,TweetDeck,RT @edshow: Just 30 min to #edshow @SenSherrodBrown @NicholsUprising @BobShrum @RepTerriSewell @jimwallis 5pET after @BashirLive! http://t.…
383309830523330560,2013-09-26 19:19:19,RepTerriSewell,14,2,TweetDeck,Tune in to the @edshow on @msnbc at 5:30 EST! We will be discussing the #ACA and President Obama's remarks from earlier today.
383285870163673090,2013-09-26 17:44:07,RepTerriSewell,1,1,Instagram,"#tbt My 4th grade class at Cedar Park Elementary in Selma, AL http://t.co/D0qFf0ygoC"
383259869408526336,2013-09-26 16:00:48,RepTerriSewell,0,0,TweetDeck,"And for the 16% without insurance, or AL families and small businesses who buy their coverage but aren’t happy with it, a new day is coming"
383259609563009024,2013-09-26 15:59:46,RepTerriSewell,3,1,TweetDeck,"Because of the Affordable Care Act, the 84% of Alabamians who have insurance have more choices and stronger coverage than ever before. #ACA"
383231685107544064,2013-09-26 14:08:48,RepTerriSewell,6,1,TweetDeck,Sending our most heartfelt condolences to the Lowery family. Civil rights activist Evelyn Lowery passed away today. http://t.co/otUskK47Xg
383222337346097153,2013-09-26 13:31:39,RepTerriSewell,2,0,TweetDeck,Interested in attending a military service academy? Come out to Academy Night 2013 to learn more! http://t.co/QCmSFnMxiw
382956899156500480,2013-09-25 19:56:54,RepTerriSewell,1,0,TweetDeck,RT @MarieLeech_news: .@RepTerriSewell to host military service academy interest meeting Thursday | http://t.co/etsotVFaTA http://t.co/ExJyB…
382927668267581441,2013-09-25 18:00:45,RepTerriSewell,3,0,TweetDeck,4 steps to #GetCovered in the Health Insurance Marketplace http://t.co/4fN828JULB
382918352101851137,2013-09-25 17:23:44,RepTerriSewell,5,2,TweetDeck,How does the health care law protect me? #GetCovered http://t.co/YQ6LK0eAlQ
382912575618301952,2013-09-25 17:00:46,RepTerriSewell,3,1,TweetDeck,What is the Health Insurance Marketplace? Learn more here: http://t.co/CaBCjLmbMx
382905018426216448,2013-09-25 16:30:45,RepTerriSewell,1,0,TweetDeck,Want to know what your premiums will look like under #ACA? Even lower than expected: http://t.co/qM64PY6isa #GetCovered
382893691355951104,2013-09-25 15:45:44,RepTerriSewell,1,0,TweetDeck,NEW REPORT: 95% of uninsured will see lower than expected health care premiums with #ACA http://t.co/qM64PY6isa #GetCovered
382882370887499776,2013-09-25 15:00:45,RepTerriSewell,2,1,TweetDeck,Get the Facts Straight on Health Reform. There's a lot of misinformation out there. #ACA http://t.co/I02lewMcNu
382874819429011457,2013-09-25 14:30:45,RepTerriSewell,3,2,TweetDeck,Check out this map to see how affordable #ACA will be in your state! #GetCovered http://t.co/d1UvO977xV
382869782166372352,2013-09-25 14:10:44,RepTerriSewell,17,3,TweetDeck,"The #GOP wants to deny healthcare to millions, and they're willing to shut down the government to do it. #EnoughAlready"
382629711811067904,2013-09-24 22:16:46,RepTerriSewell,4,0,TweetDeck,Tell the GOP #EnoughAlready ! http://t.co/sQwjGq2RLQ
382604274791751680,2013-09-24 20:35:42,RepTerriSewell,6,2,TweetDeck,The idea is to have Congress &amp; staff buy insurance the same way their uninsured constituents do. #LearnTheFacts
382603016173408256,2013-09-24 20:30:42,RepTerriSewell,10,1,TweetDeck,Congress &amp; staff will use new healthcare marketplaces alongside the uninsured and small businesses #ACA #Facts http://t.co/WcNqUR17Qn
382567783260622848,2013-09-24 18:10:41,RepTerriSewell,3,0,TweetDeck,"Fill in the blank: I think a government shutdown _________________

Reply with your answer."
382561491632660480,2013-09-24 17:45:41,RepTerriSewell,7,0,TweetDeck,"""How many Republicans in the House really would consider a shutdown as some kind of victory?"" http://t.co/OhP2EZO9id"
382545299136200706,2013-09-24 16:41:21,RepTerriSewell,0,0,TweetDeck,"Come join me at the ASU Bridge Builder's Breakfast on Oct. 16 in Montgomery!
http://t.co/XjDURd2jI1"
382521741257367552,2013-09-24 15:07:44,RepTerriSewell,0,0,TweetDeck,"Demopolis, Alabama wins America in Bloom National 2013 Awards http://t.co/3l25YW2HjB"
382176444836630528,2013-09-23 16:15:39,RepTerriSewell,5,3,TweetDeck,"Denying healthcare to over 300,000 people should not be a campaign platform. #ExpandMedicaidNow http://t.co/GTuD9cIcLR"
382159126517657600,2013-09-23 15:06:50,RepTerriSewell,2,1,TweetDeck,"#Jobs4AL ""Auto supplier to create more than 350 jobs, invest $39.5 million in Tuscaloosa"" http://t.co/nOlIvZHMaw"
382121676474834945,2013-09-23 12:38:01,RepTerriSewell,1,0,TweetDeck,"Yes, @Thisfireguyhere . The AG's office would be the appropriate first point of contact."
381136619073314816,2013-09-20 19:23:45,RepTerriSewell,15,5,TweetDeck,Alabama sororities break racial barrier: Black women accept bids #makinghistory http://t.co/7LgdiPnur4
381088581969657856,2013-09-20 16:12:52,RepTerriSewell,0,1,TweetDeck,Watch this video and see exactly who hurts when we cut #SNAP benefits.  http://t.co/sZhwMInVp4 #EndHungerNow
381067413476753408,2013-09-20 14:48:46,RepTerriSewell,0,0,Twitter for iPhone,#CBCFALC13 Economic Empowerment Panel http://t.co/siirBwg4TE
381055403930308608,2013-09-20 14:01:02,RepTerriSewell,1,1,TweetDeck,About to get started with our Black Economic Empowerment panel! @CBCFinc http://t.co/9ehOQpEpAw
381053553772474368,2013-09-20 13:53:41,RepTerriSewell,0,0,TweetDeck,"On this day in 1878, Pulitzer Prize-winning writer and reformer Upton Sinclair was born. #TheJungle"
381037661881778176,2013-09-20 12:50:32,RepTerriSewell,6,1,TweetDeck,Statement from Congresswoman Terri Sewell on Her Opposition to H.R. 3102 which Cuts $40 billion from the SNAP Program http://t.co/YOxB5cZbbh
380832268035452928,2013-09-19 23:14:22,RepTerriSewell,1,0,iOS,Honored to receive the Lifetime Achievement Award from the American Bar Association! http://t.co/FZzr5DNk05
380733146846613504,2013-09-19 16:40:30,RepTerriSewell,4,1,TweetDeck,CBC Today: Ray Baker Talks with Rep. Terri Sewell on Major Civil Rights Milestone http://t.co/8EkBRZqDON
380721318234046464,2013-09-19 15:53:30,RepTerriSewell,3,0,TweetDeck,16 million Americans who struggled with hunger in 2012 were children. #SNAP #FACTS http://t.co/KufDRoC5jL
380715531860316161,2013-09-19 15:30:30,RepTerriSewell,3,0,TweetDeck,"#SNAP kept more than 2 million kids out of poverty in 2011. Instead of working to #EndHungerNow, House R's voted to cut nearly $40 billion."
380665924967096320,2013-09-19 12:13:23,RepTerriSewell,1,0,Twitter for iPhone,"Great meeting with Dr. Dan Carden, Headmaster of @ACATuscaloosa ! http://t.co/k9i2X2HHuS"
380360227289174016,2013-09-18 15:58:39,RepTerriSewell,4,1,Twitter for iPhone,Enjoyed speaking to the wonderful students of the #Avoice Workshop this morning! #VRA http://t.co/MuQdHreiPG
380355298206040064,2013-09-18 15:39:04,RepTerriSewell,5,0,TweetDeck,RT @OU_DC: TY @RepTerriSewell for speaking to OUDC students and staff @ the #AVOICE Student workshop. @CBCFInc #CBCFALC13 #OUDC http://t.co…
380322937577828353,2013-09-18 13:30:29,RepTerriSewell,0,1,TweetDeck,"On this day in 1793, George Washington lays the cornerstone to the US Capitol building, the home of the legislative branch of our government"
380058963154173952,2013-09-17 20:01:32,RepTerriSewell,9,7,TweetDeck,"Alabama has come a long way, but when we still have fraternities and sororities that block bids because of race, we still have work to do."
380051136234790912,2013-09-17 19:30:26,RepTerriSewell,3,1,TweetDeck,"""As a nation blessed with a bounty of food, we are a nation with a duty to fight hunger."" http://t.co/7seR2bbLdQ #SNAP #FarmBill"
380019676194959360,2013-09-17 17:25:25,RepTerriSewell,3,1,TweetDeck,23.6% of these households have one or more people 60 years or over. #SNAP #Facts
380019423819476993,2013-09-17 17:24:25,RepTerriSewell,5,2,TweetDeck,53.6 percent of the households in the 7th Congressional District of Alabama that receive #SNAP benefits have children under the age of 18.
379990738366263296,2013-09-17 15:30:26,RepTerriSewell,3,0,TweetDeck,"Avg. monthly benefit= 133.19/individual, 275.42/household. Payment error rate is 3.80 making #SNAP one of the most efficient programs. #Fact"
379979410335485952,2013-09-17 14:45:25,RepTerriSewell,10,1,TweetDeck,"Median household income for #SNAP recipients in my district is $13,682. Let it sink in. Thirteen thousand six hundred and eighty two dollars"
379961792971030529,2013-09-17 13:35:25,RepTerriSewell,10,1,TweetDeck,"Happy #ConstitutionDay , America! It was on this day in 1787 that our nation's most sacred governing document was signed."
379649477654478848,2013-09-16 16:54:23,RepTerriSewell,3,1,TweetDeck,"Christian Leaders Ask House to Say 'No"" to $40 Billion in New #SNAP Cuts http://t.co/GDwIyZpzVR"
379622381448224768,2013-09-16 15:06:43,RepTerriSewell,8,1,TweetDeck,"Praying for everyone at the US #NavyYard this morning. As always, the courage shown by our first responders is unrivaled."
379588071739490305,2013-09-16 12:50:23,RepTerriSewell,4,1,TweetDeck,"In Alabama, 'a love that forgives' http://t.co/RdOgfTR9dk"
379416939338018817,2013-09-16 01:30:22,RepTerriSewell,11,2,TweetDeck,Today marks the beginning of National Hispanic Heritage Month. Let's celebrate the culture and contributions of Hispanic &amp; Latino Americans!
379360035669028864,2013-09-15 21:44:15,RepTerriSewell,1,0,Twitter for iPhone,"RT @AJCProject: @RepTerriSewell: ""There is still work to be done."" Speech touches on incarceration, voting rights, U of A sororities"
379340180655570944,2013-09-15 20:25:21,RepTerriSewell,1,0,Twitter Web Client,RT @myfoxal: @RepTerriSewell also streaming at http://t.co/8cI5zeMyY5 #50yearsforward
379337829647519745,2013-09-15 20:16:01,RepTerriSewell,5,2,Twitter Web Client,Tune in to CSPAN3 for the 50th Anniv of the 16th St Church Bombing. Will be giving remarks &amp; introducing AG Holder. http://t.co/Zxdx2UBeVX
379289149640953856,2013-09-15 17:02:34,RepTerriSewell,6,2,Twitter for iPhone,Happy to be with Mayor Bell &amp; Spike Lee at today's film screening of #FourLittleGirls. #50yearsforward http://t.co/R53s2Nr3GB
379250840294285312,2013-09-15 14:30:21,RepTerriSewell,14,2,TweetDeck,"Events of Sept 15, 1963 forever changed our nation. We also lost Johnny Robinson &amp; Virgil Ware just hrs after the Birmingham church bombing."
379225674378010624,2013-09-15 12:50:21,RepTerriSewell,27,7,TweetDeck,"Remembering Addie Mae, Carole, Cynthia, and Denise today. #4LittleGirls gone, but never forgotten."
379050767086145536,2013-09-15 01:15:19,RepTerriSewell,3,3,TweetDeck,"We are closing in on 5,000 followers! Be sure to share @RepTerriSewell with your friends and help us reach our goal! #SpreadTheWord"
378896000594628608,2013-09-14 15:00:20,RepTerriSewell,6,1,TweetDeck,Good luck to the Alabama Crimson Tide and all other football teams who call District 7 home! Make us proud today! #RollTide #BeatTheAggies
378625895453302784,2013-09-13 21:07:02,RepTerriSewell,2,1,Twitter Web Client,"@rolandsmartin District 7 is #Bama Nation, my friend! #RollTideRoll"
378606500769718272,2013-09-13 19:49:58,RepTerriSewell,4,0,Storify,Congressional Gold Medal Ceremony http://t.co/iExykb1H8f #storify #4littlegirls #bham
378587776104423424,2013-09-13 18:35:34,RepTerriSewell,1,0,TweetDeck,Program aims to help veterans get their diplomas. http://t.co/tcIr5oapnv via @selmatjournal
378552732715872256,2013-09-13 16:16:19,RepTerriSewell,7,1,TweetDeck,@OfficialCBC Members joining @RepTerriSewell in Birmingham for the Congressional Gold Medal Ceremony. #4LittleGirls http://t.co/R6HF9YdfWB
378549520579461121,2013-09-13 16:03:33,RepTerriSewell,3,2,Twitter for iPhone,"""If you don't believe change has come, come to Birmingham. Come walk in my shoes."" -my friend &amp; colleague John Lewis @ 16th St today"
378538304024891393,2013-09-13 15:18:59,RepTerriSewell,6,0,Twitter for iPhone,RT @RepBeatty: .@RepTerriSewell showing the Gold Medal being presented in honor of Birmingham's 4 little girls http://t.co/vwHbUvpwZo
378533604256538624,2013-09-13 15:00:18,RepTerriSewell,1,0,TweetDeck,Getting started with the Congressional Perspective event at the 16th Street Baptist Church in Birmingham!
378528569103622144,2013-09-13 14:40:18,RepTerriSewell,6,0,TweetDeck,"On this 19th anniversary of the authorization of the #VAWA , I would like to say thank you to all who have continued the fight for women."
378503398355517440,2013-09-13 13:00:17,RepTerriSewell,8,2,TweetDeck,"199 years ago today, Francis Scott Key penned the beautiful poem that would become known as our national anthem #HomeOfTheBrave"
378147292735225857,2013-09-12 13:25:14,RepTerriSewell,5,2,TweetDeck,The Congressional Gold Medal that will be on display at the @BCRIorg . #4LittleGirls http://t.co/jMmLEGkCO7
378120603695214592,2013-09-12 11:39:11,RepTerriSewell,5,1,Twitter Web Client,We owe a debt of gratitude to Rep. Demetrius Newton for paving the way for many black Alabamians.  http://t.co/Pu0ZD48rvf
377944711161712641,2013-09-12 00:00:15,RepTerriSewell,1,0,TweetDeck,#ICYMI Watch yesterday's full Congressional Gold Medal Ceremony here http://t.co/2aEKaLBcPB #4LittleGirls
377849322177830912,2013-09-11 17:41:13,RepTerriSewell,6,2,TweetDeck,Girls killed in 1963 bombing given congressional medal http://t.co/OSidN8bZXF via @USATODAY #4littlegirls
377801257102364672,2013-09-11 14:30:13,RepTerriSewell,2,1,TweetDeck,"12 years ago today, this country was dealt a blow. As a nation we came together to grieve, rebuild, and remain a beacon of freedom. #Sept11"
377778608649289729,2013-09-11 13:00:13,RepTerriSewell,13,3,TweetDeck,Take a moment today to honor the memory of those victims of the attacks that brought our world to a halt 12 years ago today. #Sept11
377637670756696066,2013-09-11 03:40:11,RepTerriSewell,2,1,TweetDeck,Check out the pictures from today's Congressional Gold Medal Ceremony on Facebook: http://t.co/FtTQ8zv1HF
377608972502458368,2013-09-11 01:46:09,RepTerriSewell,45,5,TweetDeck,"As part of National Suicide Prevention Week, let's all spread the message so we might live in a  #WorldWithoutSuicide http://t.co/SGrETpR8N6"
377490447637024768,2013-09-10 17:55:10,RepTerriSewell,6,3,TweetDeck,"""Reflecting on our past, moving 50 years forward."" http://t.co/qtI8X2R6F0 #4LittleGirls"
377451440731455488,2013-09-10 15:20:10,RepTerriSewell,7,1,TweetDeck,Use the hashtag #4LittleGirls to join our conversation about progress in civil rights and remember those who we have lost in the fight.
377428247346028544,2013-09-10 13:48:01,RepTerriSewell,12,4,TweetDeck,Today I will join my colleagues in the US Capitol in honoring the #4LittleGirls killed in the 16th St. Baptist Church bombing in 1963.
377231231860998144,2013-09-10 00:45:08,RepTerriSewell,2,1,TweetDeck,"Tune in tomorrow, Tuesday, September 10th to watch the Congressional Gold Medal ceremony live. http://t.co/nBXgZOpfEm"
377204141249945600,2013-09-09 22:57:30,RepTerriSewell,10,3,TweetDeck,Congressional Gold Medal ceremony for 'Four Little Girls' in Washington tomorrow http://t.co/5ZOcCiizpJ
375975424200675328,2013-09-06 13:35:01,RepTerriSewell,5,1,TweetDeck,I'm continuing to evaluate the intel reports and constituent concerns before making my decision on #Syria . As of today I am still undecided
375661165533085697,2013-09-05 16:46:15,RepTerriSewell,2,0,TweetDeck,My interview with lifelong friend and civil rights activist Sheyann Webb-Christburg about #CivilRights and the #MOW http://t.co/yMrFQitTsw
375623392017149952,2013-09-05 14:16:10,RepTerriSewell,4,2,TweetDeck,The facts about the #ACA in Alabama's 7th Congressional District. http://t.co/UrlaKJJNV2
375291962049318912,2013-09-04 16:19:11,RepTerriSewell,3,0,TweetDeck,Tune in now to watch the House Foreign Affairs Committee hearing on #Syria http://t.co/4aKFEhoF98
374963591226466304,2013-09-03 18:34:21,RepTerriSewell,2,0,TweetDeck,Tune in now to watch the Senate Foreign Relations Committee hearing and learn more about #Syria http://t.co/4aKFEhoF98
374961723876204544,2013-09-03 18:26:56,RepTerriSewell,1,0,TweetDeck,RT @CBCFInc: Bring ur students 2 #CBCFALC13 Avoice Student Workshop 9/18 at @USNatArchives w/guest speaker @RepTerriSewell! dbernard@cbcfin…
374536666255347712,2013-09-02 14:17:54,RepTerriSewell,13,3,Twitter Web Client,"Happy Labor Day! Thank you to our hardworking men &amp; women! ""We all owe a debt of gratitude to the American worker."" 
http://t.co/IrnfGYDXyE"
373091678120181760,2013-08-29 14:36:02,RepTerriSewell,2,3,TweetDeck,#tbt My 2nd day at Harvard Law. Can you find me? What about President Barack Obama? #LawSchoolBuddies http://t.co/IA8fwcZvg5
372838669419171840,2013-08-28 21:50:40,RepTerriSewell,2,2,TweetDeck,Tune in at 5:20CT/6:20ET to @HuffPostLive where I will be discussing the #MarchOnWashington http://t.co/v66uHxR3hr
372809006148235264,2013-08-28 19:52:48,RepTerriSewell,15,9,Instagram,"President Obama with the bell from 16th St Baptist Church in Birmingham, AL @ Lincoln National Memorial http://t.co/dZEAp38WWc"
372803472745177088,2013-08-28 19:30:48,RepTerriSewell,3,0,TweetDeck,"While I celebrate how far we've come, I reflect on how Dr. King's words apply to my duties as a Member of Congress. #MOW"
372796862279200768,2013-08-28 19:04:32,RepTerriSewell,3,1,Twitter for iPhone,Rev. Bernice King at the podium #MOW50 #DreamDay http://t.co/Ly6qTHEO10
372796505851461632,2013-08-28 19:03:07,RepTerriSewell,2,1,Twitter for iPhone,@billclinton addresses the crowd at the Lincoln Memorial. #MarchDC50 #MOW50 http://t.co/PvcicaNR4s
372770721593716737,2013-08-28 17:20:40,RepTerriSewell,9,2,TweetDeck,"50 yrs after this event, we celebrate the 2nd term of our nation's 1st African American president. A lot of progress to celebrate #MOW"
372755624032878592,2013-08-28 16:20:40,RepTerriSewell,14,3,TweetDeck,"As we celebrate 50 yrs since the #MOW  let us also remember those who we've lost. 58 yrs go today, Emmett Till was murdered. #Injustice"
372741275520233472,2013-08-28 15:23:39,RepTerriSewell,12,1,TweetDeck,I am so blessed to serve in Congress today in the shadows of Dr. King's vision laid out in his message at the #MarchOnWashington @mlk50mow
372724162436952064,2013-08-28 14:15:39,RepTerriSewell,6,0,TweetDeck,Today’s ceremony on the National Mall will be streamed live at http://t.co/oWZpeFs9Z0 @mlk50mow #mlkdream50 #MarchOnWashington
372720395985514496,2013-08-28 14:00:41,RepTerriSewell,1,0,TweetDeck,"We owe it to the legacy of those freedom fighters to continue to make strides forward, not just politically, but economically as well."
372701575120056320,2013-08-28 12:45:54,RepTerriSewell,45,10,TweetDeck,"50 yrs ago today, Martin Luther King Jr. spoke of a dream. A dream that we must continue to stride towards #Equality http://t.co/h7TGmrs6d4"
372104982520020992,2013-08-26 21:15:16,RepTerriSewell,1,1,TweetDeck,I spent my #WomensEqualityDay with the wonderful ladies of Parker High School! http://t.co/6TyXVxMzsP
372025800087699456,2013-08-26 16:00:37,RepTerriSewell,4,3,TweetDeck,"As we celebrate the anniversary of the passage of the #19thAmendment , let us not forgot we must still fight for total voting equality. #VRA"
371997180954832897,2013-08-26 14:06:53,RepTerriSewell,182,27,TweetDeck,"93 years ago today, the 19th amendment was adopted. Giving women the right to vote and make their voices heard! #WomensEqualityDay"
371993176036220928,2013-08-26 13:50:59,RepTerriSewell,2,2,TweetDeck,"""I can't imagine my dad drinking from colored-only water fountains. But it happened"" http://t.co/xbKrOgYvjh"
371250918517661696,2013-08-24 12:41:31,RepTerriSewell,3,1,Twitter for iPhone,#MarchOnWashington: as important today as in '63! AL story cant be told w/o the influence it had on progress of the past 50 yrs &amp; work ahead
371241696929255424,2013-08-24 12:04:52,RepTerriSewell,3,2,Twitter for iPhone,We are ready for the National Action to Realize the Dream March! #Equality http://t.co/MO1n1F9VO8
371016615086678016,2013-08-23 21:10:28,RepTerriSewell,3,3,TweetDeck,"I think it is important that we never forget the price of our freedoms, because they are never free. #Sacrifice http://t.co/tYnozcQrow"
370975592583135233,2013-08-23 18:27:28,RepTerriSewell,3,2,TweetDeck,Congress set to honor 1963 Birmingham church bombing victims. http://t.co/whiZnCGKyr
370908401347198976,2013-08-23 14:00:28,RepTerriSewell,1,1,TweetDeck,In my interview with the @nationaljournal I discuss how we can continue to make strides politically and economically http://t.co/chalpu4Vfl
370617728169570307,2013-08-22 18:45:26,RepTerriSewell,2,0,TweetDeck,"Food Stamps: Facts, Myths and Realities http://t.co/1gYxc1Uk5x @FeedingAmerica #SNAP #FightHunger"
370601366529392640,2013-08-22 17:40:25,RepTerriSewell,8,2,TweetDeck,"""And as we walk, we must make the pledge that we shall march ahead. We cannot turn back."" -Martin Luther King Jr. #MarchOnWashington"
370566636807266304,2013-08-22 15:22:25,RepTerriSewell,2,0,TweetDeck,"Looking forward to the National Action to Realize the Dream March, a continuation of the efforts 50 yrs ago in the March on Washington."
370536437248053248,2013-08-22 13:22:25,RepTerriSewell,4,1,TweetDeck,"On Saturday I will take part in the National Action to Realize the Dream March. Great progress has been made, but our work is not over. #VRA"
369851269269037056,2013-08-20 15:59:48,RepTerriSewell,1,0,TweetDeck,Football season is a little over a week away. Best of luck to all collegiate and high school teams in AL District 7! Go make us proud!
369830129469370371,2013-08-20 14:35:48,RepTerriSewell,2,0,TweetDeck,Wishing a Happy Birthday to my dear colleague @USRepRHinojosa !
369534019223842817,2013-08-19 18:59:10,RepTerriSewell,5,0,Twitter Web Client,RT @ALcomHuntsville: Alabama Congresswoman Terri Sewell taking lead role in reviewing candidates for Huntsville-based federal judgeship. ht…
