id,created_at,user,retweets,favorite_count,source,text
585164548610641920,2015-04-06 19:37:54,RepTerriSewell,1,1,Twitter Web Client,Took a moment to pose for a picture with Superintendents and school administrators from Sumter and Pickens counties. http://t.co/HoDHD632x9
585163659351044097,2015-04-06 19:34:22,RepTerriSewell,1,0,Twitter Web Client,"Next stop on our CIYC tour was a round table discussion with Superintendents, school administrators from Sumter and Pickens counties!"
585143139008172032,2015-04-06 18:12:50,RepTerriSewell,0,0,Twitter Web Client,"We kicked off the final portion of our town hall tour this morning in Reform, Alabama! Thanks to all who joined us! http://t.co/sI0nHyHFhV"
583697468220669952,2015-04-02 18:28:15,RepTerriSewell,4,0,Twitter Web Client,"UPDATED: New dates for our upcoming ""Congress in Your Community"" town hall tour are listed below! http://t.co/OK1TjPhAbD"
583640708864675840,2015-04-02 14:42:43,RepTerriSewell,2,0,Twitter Web Client,"Please join me in Pickens, Marengo, and Greene Counties for the next segment of my Congress in Your Community tours! http://t.co/WVdaOQ2qbG"
583294846498131968,2015-04-01 15:48:23,RepTerriSewell,96,0,Twitter Web Client,RT @PeterWelch: .@HouseDemocrats are fighting for bigger paychecks &amp; better infrastructure for hardworking families -- the true engine of e…
582980694034538496,2015-03-31 19:00:03,RepTerriSewell,3,0,Twitter Web Client,RT @RepAdams: Thanks for cosponsoring H.Res. 176! @RepJuanVargas @rosadelauro @RepTerriSewell @RepCorrineBrown @EleanorNorton  #WomensHisto…
582647923097407488,2015-03-30 20:57:44,RepTerriSewell,6,3,Twitter Web Client,Any effort that restricts one registered voter from voting is a threat to all of us. We cannot relinquish our voices.https://t.co/P7HklwZC22
581484966162337792,2015-03-27 15:56:34,RepTerriSewell,31,27,Twitter Web Client,Women of the #CBC114 featured in April issue of @EssenceMag. Honored to a part of this amazing group of trailblazers! http://t.co/hRZklGsG0I
581481512811524096,2015-03-27 15:42:50,RepTerriSewell,16,18,Twitter Web Client,"Loretta Lynch has worked tirelessly to protect the civil and human rights of all persons under the law – now, the Senate must #ConfirmLynch!"
581481311866617857,2015-03-27 15:42:02,RepTerriSewell,4,8,Twitter Web Client,Loretta Lynch has a powerful record as a proven leader within @TheJusticeDept. It's time for the Senate to finally #ConfirmLynch.
581481001957908481,2015-03-27 15:40:48,RepTerriSewell,20,0,Twitter Web Client,RT @RepBarbaraLee: Senate needs to stop partisan games &amp; #ConfirmLynch. She has now been waiting longer than last 7 AGs COMBINED.
581180141461721089,2015-03-26 19:45:18,RepTerriSewell,31,0,Twitter Web Client,RT @ALcomBirmingham: Mayor Bell and @GovernorBentley greet @BarackObama and @RepTerriSewell -- live updates here: http://t.co/aSycHCM6sv ht…
581176508380803072,2015-03-26 19:30:51,RepTerriSewell,6,0,Twitter Web Client,RT @MarissaMtchll: Few minutes ago @BarackObama and @RepTerriSewell arrive in @cityofbhamal #liveon3340 http://t.co/tfVe3OP1RB
581145597224345600,2015-03-26 17:28:02,RepTerriSewell,32,63,Twitter Web Client,Heading down to Birmingham with the President for his speech at @LawsonStateCC. http://t.co/jGOXzCy6jJ
581110223760420865,2015-03-26 15:07:28,RepTerriSewell,8,0,Twitter Web Client,"RT @aldotcom: ""I'm obviously very excited to welcome the president to the Magic City."" - @RepTerriSewell http://t.co/9doVwphlfm http://t.co…"
580837708643377154,2015-03-25 21:04:35,RepTerriSewell,6,6,Twitter Web Client,Today’s #SCOTUS ruling honors King’s legacy by rejecting a discriminatory redistricting plan that denied black voters equal representation.
580837469404413953,2015-03-25 21:03:38,RepTerriSewell,3,5,Twitter Web Client,"Fifty years ago today, Dr. Martin Luther King, Jr. spoke from the steps of the Alabama Capitol to appeal to the conscience of our nation."
580837153090998272,2015-03-25 21:02:23,RepTerriSewell,8,0,Twitter Web Client,RT @USATWashington: Breaking: #SCOTUS blocks Alabama redistricting plan that 'packed' black voters http://t.co/4VzxGma1lw via @richardjwolf
580070304170545152,2015-03-23 18:15:12,RepTerriSewell,3,5,Twitter Web Client,"The nation's uninsured rate is at the lowest level ever recorded. That's because the #ACAisWorking! Happy 5th bday, Affordable Care Act!"
578970623340359680,2015-03-20 17:25:28,RepTerriSewell,270,0,Twitter Web Client,"RT @janschakowsky: I oppose the #GOPbudget that would take away quality, affordable health insurance coverage for millions of Americans. ht…"
578264386655121408,2015-03-18 18:39:08,RepTerriSewell,8,0,Twitter Web Client,"RT @MemFoundation: It was an honor to visit with Their Royal Highnesses today at the #MLKMemorial! #RoyalVisitUSA (1/2)

@ClarenceHouse htt…"
578233862377115648,2015-03-18 16:37:50,RepTerriSewell,8,8,Twitter Web Client,Stopped in front of one of my favorite inscriptions in the Memorial. MLK's words still resonate today. #RoyalVisitUSA http://t.co/72IzM2Zer5
578232585257635840,2015-03-18 16:32:46,RepTerriSewell,9,9,Twitter Web Client,Honored to meet The Prince of Wales and The Duchess of Cornwall with @RevJJackson and  @repjohnlewis  #RoyalVisitUSA http://t.co/PYwquRScPM
578229210474520576,2015-03-18 16:19:21,RepTerriSewell,45,0,Twitter Web Client,"RT @UKinUSA: The Prince of Wales and The Duchess of Cornwall visit the Martin Luther King, Jr. Memorial in DC #RoyalVisitUSA http://t.co/rX…"
578228799260770304,2015-03-18 16:17:43,RepTerriSewell,26,0,Twitter Web Client,RT @UKinUSA: Their Royal Highnesses are greeted at MLK Memorial by @RevJJackson @repjohnlewis &amp; @RepTerriSewell #RoyalVisitUSA http://t.co/…
577907789827325953,2015-03-17 19:02:08,RepTerriSewell,4,8,Twitter Web Client,TRIO has helped hundreds of students from low-income families in AL attend college. Keep up the good work! #TRIOWorks http://t.co/huW0gl9zAO
577547640306606081,2015-03-16 19:11:02,RepTerriSewell,3,0,Twitter Web Client,RT @NDIcitizens: This is worth a watch: words from two inspiring women @RepTerriSewell &amp; @HackneyAbbott https://t.co/aJ6ktbTHJd
577518407643443200,2015-03-16 17:14:52,RepTerriSewell,2,0,Twitter Web Client,RT @pawprinceton: Q&amp;A: @RepTerriSewell on the legacy of Selma http://t.co/7WMwlJqLZS
577468611096391680,2015-03-16 13:57:00,RepTerriSewell,194,0,Twitter Web Client,RT @ChrisVanHollen: Americans want &amp; deserve a budget that puts the #MiddleClassFirst. Time for better infrastructure &amp; bigger paychecks fo…
576394133004263424,2015-03-13 14:47:24,RepTerriSewell,7,0,Twitter for iPhone,"RT @RepMarthaRoby: Late #TBT w/ @repjohnlewis, @RepTerriSewell,@SenatorSessions, @SenatorTimScott, @GOPLeader &amp; more in Selma last Sat http…"
576382858153082880,2015-03-13 14:02:36,RepTerriSewell,2,6,Twitter for iPhone,It was an honor speaking at the Alabama Women's Hall of Fame banquet yesterday. Thanks @JudsonCollege for hosting me! http://t.co/v5IzhlmY6Q
575788238406840320,2015-03-11 22:39:48,RepTerriSewell,8,8,Twitter for iPhone,.@HackneyAbbott is a dear friend and mentor. I had the pleasure of participating in a panel with her hosted by @NDI. http://t.co/SSCLoSxMvi
575749665469132800,2015-03-11 20:06:31,RepTerriSewell,7,0,Twitter for iPhone,RT @AliceOllstein: .@RepTerriSewell hopes #Selma50 shines light on the needs of her impoverished hometown http://t.co/6w3anPIuTx http://t.c…
575674772509626368,2015-03-11 15:08:55,RepTerriSewell,5,0,Twitter Web Client,RT @NDIWomen: Come to our discussion with @HackneyAbbott &amp; @RepTerriSewell on #womeninpolitics &amp; civil rights today at 4 pm at @NDI http://…
575308385647730688,2015-03-10 14:53:02,RepTerriSewell,552,0,Twitter Web Client,RT @repjohnlewis: We commemorated the 50th annv of Bloody Sunday. Now it's our responsibility to fix SCOTUS decision that put a dagger in t…
575301016381485057,2015-03-10 14:23:45,RepTerriSewell,1,3,Twitter Web Client,ICYMI: I was a guest on Hardball with Chris Matthews on Monday night! https://t.co/l1HafZTtno
575298954985869312,2015-03-10 14:15:34,RepTerriSewell,11,0,Twitter Web Client,RT @RepWilson: #ChibokGirlsClock: It's been 329 days since our girls were kidnapped. #BringBackOurGirls #JoinRepWilson http://t.co/GPtpLOPa…
575063509937037312,2015-03-09 22:39:59,RepTerriSewell,12,0,Twitter for iPhone,RT @hardball: Tonight on Hardball: @Eugene_Robinson @MichaelCrowley @KevinSpacey @RepTerriSewell @ron_fournier @Phil_Mattingly @JFKucinich
574936386521931776,2015-03-09 14:14:51,RepTerriSewell,157,99,Twitter Web Client,Selma is now! The fight for voting equality must continue so long as there are barriers that limit access to the ballot box. #Selma50
574387718085607424,2015-03-08 01:54:38,RepTerriSewell,29,0,Twitter for iPhone,"RT @WhipHoyer: 50 yrs after #BloodySunday, I joined my friends @RepTerriSewell @RepBeatty on the Edmund Pettus Bridge #FPI15 http://t.co/eq…"
573964290849390592,2015-03-06 21:52:05,RepTerriSewell,18,22,Twitter for iPhone,"Sweet home Alabama! There is so much history here, and I am pleased to share it with my colleagues. #FPI15 #Selma50 http://t.co/bs6jrY4rEr"
573963464865157120,2015-03-06 21:48:48,RepTerriSewell,9,9,Twitter for iPhone,I had the pleasure of welcoming the Faith and Politics Congressional Delegation to my district. #FPI15 #Selma50
573869554155196416,2015-03-06 15:35:38,RepTerriSewell,7,9,Twitter Web Client,"I spoke with the the Today Show earlier this week for their story Selma, then and now. http://t.co/b8aOEez1q3"
573707071561932800,2015-03-06 04:49:59,RepTerriSewell,20,0,Twitter Web Client,RT @SpeakerBoehner: Many thanks to @RepTerriSewell &amp; @RepMarthaRoby for making the #Selma Gold Medal possible. http://t.co/eTNtfakq6g #Selm…
573523043672276992,2015-03-05 16:38:43,RepTerriSewell,24,12,Twitter Web Client,President Obama will be speaking on Sat at the Edmund Pettus Bridge in #Selma. More info can be found here: http://t.co/opZW7QShZu
573271324690415616,2015-03-04 23:58:29,RepTerriSewell,7,0,Twitter Web Client,"RT @RepByrne: Proud to join @RepBeatty, @RepTerriSewell, &amp; @HurdOnTheHill to co-sponsor bipartisan legislation commemorating the #SelmaToMo…"
573218608698028032,2015-03-04 20:29:00,RepTerriSewell,3,4,Twitter for iPhone,Enjoyed meeting w/ 9-time Olympic Medal winner &amp; AL born @Carl_Lewis to discuss the importance of physical edu today. http://t.co/2IueTYZ58X
572788774662512641,2015-03-03 16:01:00,RepTerriSewell,7,0,Twitter Web Client,RT @orndorfftroyan: Saw @RepTerriSewell and @repjohnlewis walking arm-in-arm through Capitol basement just now. Big week for them. #selma50
572457223588335616,2015-03-02 18:03:32,RepTerriSewell,7,8,Twitter Web Client,"Selma is my soul. I would not have become who I am today, without the support I received from my community. http://t.co/ovBHKjevZ9"
572456331396976640,2015-03-02 17:59:59,RepTerriSewell,1,2,Twitter Web Client,"via @washingtonpost @Krissah30 Rep. Terri Sewell, a daughter of Selma, rues her city’s lost promise http://t.co/ovBHKjevZ9"
572392960744157184,2015-03-02 13:48:11,RepTerriSewell,1,0,Twitter for iPhone,"RT @rollcall: Ahead of the 50th anniversary of #BloodySunday, this is today’s Selma:  http://t.co/zQh2rO78Lb via @jasonjdick cc: @RepTerriS…"
572392795761213440,2015-03-02 13:47:31,RepTerriSewell,2,0,Twitter for iPhone,"RT @rollcall: When @RepTerriSewell makes decisions for #Selma, she turns to this very special constituent for advice: http://t.co/3ZJno7qp2…"
572119230591733762,2015-03-01 19:40:28,RepTerriSewell,6,0,Twitter Web Client,"RT @RepAdams: We need to realize our power, get off the sidelines and get engaged, and then unify in order to amplify and effect change! #B…"
572117175579901952,2015-03-01 19:32:18,RepTerriSewell,12,5,Twitter Web Client,"Women must be asked 6 times before they run for office. Consider yourself asked by @YvetteClarke, @RepAdams, @HigherHeights4 #BlackWomenLead"
572115176415211520,2015-03-01 19:24:22,RepTerriSewell,21,22,Twitter Web Client,"But the best way to honor those Foot Soldiers is to vote in every election -- local, state and federal. #Selma50 #BlackWomenLead"
572115072111288320,2015-03-01 19:23:57,RepTerriSewell,4,6,Twitter Web Client,"House, Senate passed Congressional Gold Medal bill I sponsored to honor Foot Soldiers of the Voting Rights Movement #Selma50 #BlackWomenLead"
572114103034118144,2015-03-01 19:20:06,RepTerriSewell,3,2,Twitter Web Client,We still need federal protections to ensure that every ballot matters #Selma50 #BlackWomenLead
572113914344939520,2015-03-01 19:19:21,RepTerriSewell,5,7,Twitter Web Client,"There is no right that is more fundamental or sacred than the right to vote #Selma50
 #BlackWomenLead"
572111710519222272,2015-03-01 19:10:35,RepTerriSewell,1,1,Twitter Web Client,. @missygirl32 You must see yourself as an elected official to believe that you can do it. @HigherHeights4 #BlackWomenLead
572111602524299264,2015-03-01 19:10:10,RepTerriSewell,1,1,Twitter Web Client,.@missygirl32 First decide which office you want to run for. @HigherHeights4 #BlackWomenLead
572110826670321664,2015-03-01 19:07:05,RepTerriSewell,5,5,Twitter Web Client,We need stronger equal pay protections. It's also time to #raisethewage! #BlackWomenLead
572110743979597824,2015-03-01 19:06:45,RepTerriSewell,4,6,Twitter Web Client,It is a shame that women still earn less than men in 2015!  #BlackWomenLead
572110276222435328,2015-03-01 19:04:53,RepTerriSewell,3,3,Twitter Web Client,The injustices suffered on the Edmund Pettus Bridge have not been full vindicated #BlackWomenLead #Selma50
572110217313431552,2015-03-01 19:04:39,RepTerriSewell,1,1,Twitter Web Client,Congress must also do more to protect the right to vote.  #BlackWomenLead #Selma50
572109127964614656,2015-03-01 19:00:20,RepTerriSewell,2,0,Twitter Web Client,Investing in our future means helping our children and young adults achieve their full potential #BlackWomenLead
572108764029054976,2015-03-01 18:58:53,RepTerriSewell,1,0,Twitter Web Client,Many of our disagreements in Congress stem from how to best use our limited resources. I believe in investing in our future. #BlackWomenLead
572107657110269952,2015-03-01 18:54:29,RepTerriSewell,3,1,Twitter Web Client,"Congress must help working individuals, families. Let's start by protecting Title I funding for  vulnerable communities. #BlackWomenLead"
572106673684389889,2015-03-01 18:50:34,RepTerriSewell,7,2,Twitter Web Client,We need more diverse voices in leadership roles. #BlackWomenLead
572106359770095616,2015-03-01 18:49:20,RepTerriSewell,9,10,Twitter Web Client,"Black women are often leaders in our churches and communities, yet we don't see ourselves as candidates. That must change. #BlackWomenLead"
572105260157829120,2015-03-01 18:44:57,RepTerriSewell,1,2,Twitter Web Client,Start by viewing yourself as a leader. Take action! Give back to your communities whenever you can and however you can. #BlackWomenLead
572102651040694272,2015-03-01 18:34:35,RepTerriSewell,6,7,Twitter Web Client,"""You must be the change you wish to see in the world."" - Mahatma Gandhi  #BlackWomenLead"
572102320126894080,2015-03-01 18:33:16,RepTerriSewell,4,0,Twitter Web Client,"RT @HigherHeights4: Black women are 21.4 percent of all women in the U.S. House in 2015, up from 17.7 percent of women in the fall of 2014 …"
572099565450620928,2015-03-01 18:22:20,RepTerriSewell,4,1,Twitter Web Client,"Join me for today's Twitter Town hall with @YvetteClarke, @RepAdams and @HigherHeights4 to discuss #BlackWomenLead!"
571457401024618496,2015-02-27 23:50:36,RepTerriSewell,148,0,Twitter Web Client,RT @HouseDemocrats: With less than 6 hours to go #DontShutDownOurSecurity http://t.co/XI1AEjnwWM
571446618597265408,2015-02-27 23:07:45,RepTerriSewell,7,2,Twitter Web Client,Our national security must always take precedence over partisan politics. #DontShutDownOurSecurity
571446567967850496,2015-02-27 23:07:33,RepTerriSewell,5,1,Twitter Web Client,The Senate has passed a clean long term funding bill. There is no reason why the House cannot do the same. #DontShutDownOurSecurity
571439872415801344,2015-02-27 22:40:57,RepTerriSewell,7,0,Twitter Web Client,RT @HigherHeights4: Join us this Sunday 1:30 pm EST http://t.co/UwKYrP3bGn
571400632470519808,2015-02-27 20:05:01,RepTerriSewell,103,0,Twitter Web Client,"RT @thenation: 50 Years After Bloody Sunday in Selma, Everything and Nothing Has Changed: http://t.co/puMJDF8jtr http://t.co/CcCfGolUbm"
571334191968874496,2015-02-27 15:41:00,RepTerriSewell,8,5,Twitter Web Client,"Let's hold vote on clean, long-term bill to fund DHS, @SpeakerBoehner! Every House Dem has signed their support! #DontShutDownOurSecurity"
570598662633598976,2015-02-25 14:58:17,RepTerriSewell,282,0,Twitter Web Client,"RT @RepVeasey: The clock is ticking. I urge my GOP colleagues, stop holding our national security hostage. #DontShutDownOurSecurity http://…"
570241021939990528,2015-02-24 15:17:08,RepTerriSewell,4,0,Twitter Web Client,RT @rollcall: .@RepTerriSewell Proves You Can Come Home Again http://t.co/iUkQzgdHmr via @jasonjdick reporting from Selma
569920499641421824,2015-02-23 18:03:30,RepTerriSewell,5,3,Twitter Web Client,"I am so happy @johnlegend and @common won an Oscar for Glory, but @AVAETC should not have left empty handed! #Oscars2015"
569920299942211584,2015-02-23 18:02:42,RepTerriSewell,1,3,Twitter Web Client,Selma is an moving tribute to Dr. King and the Foot Soldiers of the Voting Rights Movement. #Oscars2015
569890373184712704,2015-02-23 16:03:47,RepTerriSewell,6,4,Twitter Web Client,#Selma50 is a significant part of American history that is embedded in the fabric of our great nation. http://t.co/L4z5QTDr8z via @aldotcom
569889356422500352,2015-02-23 15:59:45,RepTerriSewell,6,0,Twitter Web Client,The legacy of the Voting Rights Movement belongs to every American. #Selma50
569888614898917376,2015-02-23 15:56:48,RepTerriSewell,1,0,Twitter Web Client,"As long as there are modern day barriers to voting, this sacred right must still be protected. #Selma50"
569888525610557440,2015-02-23 15:56:27,RepTerriSewell,8,8,Twitter Web Client,"During this jubilee year of the historic Selma March, we must ensure the Voting Rights Act, and its protections are restored. #Selma50"
569886297902460928,2015-02-23 15:47:36,RepTerriSewell,5,2,Twitter Web Client,The Edmund Pettus Bridge was the portal through which America left the dark days of its past and marched into a brighter future. #Selma50
569886133125058560,2015-02-23 15:46:56,RepTerriSewell,2,1,Twitter Web Client,Preserving the movement for civil and voting rights is a responsibility that no one in the 7th District should take lightly. #Selma50
568456583593775105,2015-02-19 17:06:25,RepTerriSewell,469,0,Twitter for iPhone,"RT @AriBerman: 50 years ago today, Jimmie Lee Jackson shot by Alabama state trooper in Marion. First martyr of Selma movement http://t.co/G…"
568096897300365312,2015-02-18 17:17:09,RepTerriSewell,8,0,Twitter for iPhone,"RT @tuscaloosacity: Mayor @WalterMaddox, City Council and staff meet with @RepTerriSewell to go over projects in the area. http://t.co/Y6cP…"
567075583553990656,2015-02-15 21:38:49,RepTerriSewell,6,5,iOS,Rev F.D. Reese is one of the unsung heroes of the Voting Rights Movement. Proud to share this moment with him. http://t.co/pIMYBnDh8V
567075124034428928,2015-02-15 21:36:59,RepTerriSewell,2,1,Twitter for iPhone,It is an honor to recognize some the Foot Soldiers of the Voting Rights Movement at the Brown Chapel Founders' Day ceremony. #Selma50
567037971787173888,2015-02-15 19:09:22,RepTerriSewell,10,7,iOS,I was in my hometown on Sunday for Founders' Day at Brown Chapel. Took a few pictures on the Bridge for @RollCall http://t.co/VML1Bc3dg3
566372353966620673,2015-02-13 23:04:26,RepTerriSewell,9,1,Twitter Web Client,FACT: Nearly 8 in 10 people can get health coverage for less than $100/month. #GetCovered @ http://t.co/FMBw0GURPF before the 2/15 deadline!
566297060497166336,2015-02-13 18:05:15,RepTerriSewell,2,2,Twitter Web Client,We can't hold our national security hostage. I am calling on @HouseGOP to pass a clean bill. #DontShutDownOurSecurity
566270001330814976,2015-02-13 16:17:43,RepTerriSewell,22,0,Twitter Web Client,"RT @StudentsUnified: What an amazing opportunity we had to meet @RepTerriSewell, born and raised in #Selma! You are an inspiration! http://…"
565908857671917568,2015-02-12 16:22:40,RepTerriSewell,5,5,Twitter Web Client,This morning I honored the legacy of Jimmie Lee Jackson on the House floor. He was a catalyst for change. http://t.co/13xEczn5HF
565659922374086656,2015-02-11 23:53:29,RepTerriSewell,7,0,Twitter Web Client,RT @angela_rye: Why do we LOVE @WhipHoyer? I direct your attention to the FIRST sentence!! Kudos to @RepTerriSewell for introducing! http:/…
565639744101838848,2015-02-11 22:33:18,RepTerriSewell,12,16,Twitter Web Client,"Very proud moment for me. #HR431, bill to award Gold Medal to #Selma marchers, passed House w/ unanimous vote! http://t.co/LbUuQuniyZ"
565638536939204608,2015-02-11 22:28:30,RepTerriSewell,11,0,Twitter Web Client,"RT @orndorfftroyan: House passes @RepTerriSewell's Cong. Gold Medal for voting rights marchers, 420-0. Now goes to Senate. #alpolitics"
565621556928577536,2015-02-11 21:21:02,RepTerriSewell,1,0,Twitter Web Client,RT @RepByrne: I applaud my colleagues @RepTerriSewell and @RepMarthaRoby for their work on the much-deserved #CongressionalGoldMedal legisl…
565589468082876416,2015-02-11 19:13:31,RepTerriSewell,1,2,Twitter Web Client,No one should be denied equal protection. From @usatoday Alabama judge puts himself above law: http://t.co/8UOJ5BPRC5
565570419751931904,2015-02-11 17:57:50,RepTerriSewell,3,0,Twitter Web Client,RT @CraigCaplan: .@RepTerriSewell -Price of freedom is never free. Foot soldiers paid ultimate price. Nation should never forget them. http…
565264486228312070,2015-02-10 21:42:10,RepTerriSewell,5,1,Twitter Web Client,I'll continue to work w @HouseJudiciary to uphold the integrity of the Court if Judge Fuller refuses to resign. http://t.co/l2Sc4lqehh
565263353975963648,2015-02-10 21:37:40,RepTerriSewell,1,0,Twitter Web Client,@HouseJudiciary has moved a step closer to holding Judge Fuller accountable for his inexusable actions. http://t.co/l2Sc4lqehh
564904961495298048,2015-02-09 21:53:32,RepTerriSewell,6,0,Twitter Web Client,"RT @NC9: #UTEP Black History Month to Welcome Alabama Congresswoman @RepTerriSewell

http://t.co/wrTw9tcxDT http://t.co/bfeceCkP5g"
564889696351047682,2015-02-09 20:52:53,RepTerriSewell,9,0,Twitter Web Client,"RT @CBCFInc: #MotivationalMonday! #WordsOfWisdom from @RepJohnLewis​ (GA), @OfficialCBC ​ member. #ILeadIServe #QuoteOftheDay http://t.co/F…"
563704311398817792,2015-02-06 14:22:35,RepTerriSewell,4,0,Twitter Web Client,"RT @HeartAlabama: .@RepTerriSewell Thank you for helping us fight the #1 killer, Representative Sewell!"
563704283657699328,2015-02-06 14:22:29,RepTerriSewell,2,7,Twitter Web Client,My D.C. staff and I wore read to highlight National Wear Red Day! #GoRed http://t.co/4uW1h59gtA
563698674342305793,2015-02-06 14:00:11,RepTerriSewell,8,7,Twitter Web Client,Heart disease is not just a man’s disease. 1 in 3 women die of heart disease and stroke. Let’s make a change. #GoRed http://t.co/7keE6HjVBe
563005416968572928,2015-02-04 16:05:26,RepTerriSewell,28,15,Twitter Web Client,Rosa Parks would have been 102 years old today. Let’s honor her legacy by continuing to push for justice. #RosaParks http://t.co/LR2AW4SecH
562659966897909760,2015-02-03 17:12:44,RepTerriSewell,4,2,Twitter for iPhone,So thankful for the great work our superintendents are doing for OUR children. @AlaSchoolBoards http://t.co/1EKfxJEMxa
562607013101072384,2015-02-03 13:42:19,RepTerriSewell,182,0,Twitter Web Client,RT @HouseDemocrats: .@HouseGOP will vote for 56th time to repeal/undermine health care for Americans today. Time for #PeopleOverPolitics! h…
561189940110061568,2015-01-30 15:51:22,RepTerriSewell,31,0,Twitter Web Client,RT @repjoecrowley: Closing up #HouseDemsInPhilly today feeling excited about moving fwd &amp; working to grow America's economy &amp; American payc…
560966481119567872,2015-01-30 01:03:26,RepTerriSewell,19,28,Twitter for iPhone,Our President is on fire addressing the House Democratic caucus in Philly. http://t.co/Nja6AG9P1Z
560901462298206208,2015-01-29 20:45:04,RepTerriSewell,2,5,Twitter Web Client,Proud to join @HouseDemocrats &amp; @the_USO as #DemsGiveBack to #SupportOurTroops #usomoments http://t.co/q50ruZG98V
560855702743556096,2015-01-29 17:43:14,RepTerriSewell,12,4,Twitter Web Client,As we celebrate the 6th Anniv. of the #LillyLedbetter Fair Pay Act we must focus on making #EqualPay OUR reality. http://t.co/vHbRO0iCnP
560807154853363712,2015-01-29 14:30:19,RepTerriSewell,12,0,Twitter Web Client,"RT @LeslieProll: Sharing WH pic on 6th Anniversary of #LillyLedbetter #FairPay Act: Lilly, @RepTerriSewell @LeslieProll @NAACP_LDF #AL http…"
560506794678964224,2015-01-28 18:36:48,RepTerriSewell,4,7,Twitter Web Client,Proud to stand with Alabama’s Congressional delegation. We greeted @GovernorBentley when he visited Capitol Hill. http://t.co/YgovzkIVpe
560295404533981185,2015-01-28 04:36:48,RepTerriSewell,30,29,Twitter Web Client,"Bipartisan movie night at the Capitol! With @repjohnlewis, @GOPLeader and @RepMarthaRoby. http://t.co/KL9tYxLfA4"
560183058872430594,2015-01-27 21:10:23,RepTerriSewell,3,0,Twitter for iPhone,RT @UPS: @RepTerriSewell We love logistics and the Registered Apprenticeship program. Happy to be a part! @LaborSec @USDOL
560182087266099200,2015-01-27 21:06:31,RepTerriSewell,4,1,Twitter for iPhone,"Join in on @LaborSec, @USDOL, @UPS &amp; others conversation on how apprenticeships work happening now. #ApprenticeshipWorks."
