id,created_at,user,retweets,favorite_count,source,text
849023647620706305,2017-04-03 22:19:46,RepTerriSewell,40,75,Twitter Web Client,"Trump suffers another defeat in court - a judge just ruled in favor of voter protections, against discrimination https://t.co/1CI9BMimSl"
848893291705839619,2017-04-03 13:41:47,RepTerriSewell,27,61,Twitter Web Client,Gorsuch won't give substantive answers on big-money politics or #CitizensUnited - where do you think he stands?
848891193798918144,2017-04-03 13:33:26,RepTerriSewell,11,16,Twitter Web Client,"Following #CitizensUnited, big political spenders have worked to increase their influence in both parties https://t.co/clncDXzLrU"
848278999197511681,2017-04-01 21:00:48,RepTerriSewell,28,82,Twitter for iPhone,"Special thanks to Dr. Butt &amp; Islamic Foundation of Selma, AL for a great community forum today promoting religious… https://t.co/7rx14dCMri"
848213701660487683,2017-04-01 16:41:20,RepTerriSewell,10,33,Twitter for iPhone,Honored to join @BishopSeawright to accept the Richard Allen Legacy Award from the 9th Episcopal District of the AM… https://t.co/KOfEpzSvCN
847853059610947584,2017-03-31 16:48:16,RepTerriSewell,17,32,Twitter Web Client,"We know Russia tried to influence elections. If political hackery overshadows our investigation, they'll do it again https://t.co/EYNPH9ugQf"
847799310792216576,2017-03-31 13:14:41,RepTerriSewell,26,36,Twitter Web Client,Transparency is the hallmark of a healthy democracy- but secret spending has permeated every branch of government https://t.co/7VakYlucaj
847568995691659264,2017-03-30 21:59:30,RepTerriSewell,25,50,Twitter for iPhone,Introduced bipartisan bill today improving access to quality cancer treatment. Strengthening healthcare should alwa… https://t.co/OFqbBsGR30
847482473386696704,2017-03-30 16:15:41,RepTerriSewell,4,3,Twitter Web Client,"After healthcare, Congress is interested in taking up tax reform. What kind of reforms would you like to see Congress pass?"
847443959345557504,2017-03-30 13:42:39,RepTerriSewell,6,42,Twitter for iPhone,"Meeting this morning with HBCU presidents, chancellors, administrators. Great talk on higher ed priorities! https://t.co/3iIfmHqkCc"
847117600303861760,2017-03-29 16:05:49,RepTerriSewell,60,137,Twitter Web Client,Russia investigation is too important to keep the public in the dark. I'm speaking out: https://t.co/4EE0uPFlP9 https://t.co/sRGOv9uCZM
847048529122078720,2017-03-29 11:31:21,RepTerriSewell,22,98,Twitter for iPhone,Great panel this morning with @rolandsmartin and @SpencerOverton. These folks are ready to #FollowTheFacts! https://t.co/OiNzs1gL4r
847041840549429248,2017-03-29 11:04:46,RepTerriSewell,74,175,Twitter for iPhone,Live on @tvonetv with @rolandsmartin to talk about the Russia investigation and my call for Chairman Nunes to recus… https://t.co/43YK9N6gQX
846858743421784065,2017-03-28 22:57:12,RepTerriSewell,334,605,Twitter Web Client,"I've  worked w/ Intel Chairman Nunes for four years, so my decision to call for his recusal was not made lightly: https://t.co/kgbaomyTdv"
846850286362726400,2017-03-28 22:23:36,RepTerriSewell,9,0,Twitter for iPhone,RT @SpencerOverton: Watch @rolandsmartin @tvonetv Wed 7 am! @RepTerriSewell on House Intel credibility &amp; @SueZoldak @AfricanaCarr @AllieMcG…
846849764566204417,2017-03-28 22:21:32,RepTerriSewell,950,2089,Twitter Web Client,.@PressSec says everyone briefed on #Russia has the same conclusion. Here's mine: we need an independent commission… https://t.co/iWJJcaSoDZ
846835787442393088,2017-03-28 21:25:59,RepTerriSewell,64,166,Twitter for iPhone,Disclosing Trump's tax returns shouldn't be partisan. Transparency is necessary to holding Exec Branch accountable. https://t.co/52kW0R4HRn
846828193600491523,2017-03-28 20:55:49,RepTerriSewell,83,149,Twitter for iPhone,"Since Pres. Carter, all presidents, R's and D's, have released tax returns. Trump's secrecy breaks precedent. https://t.co/z1FLvVx2zH"
846826426707984385,2017-03-28 20:48:48,RepTerriSewell,159,0,Twitter for iPhone,"RT @BillPascrell: Over 1,085,000 Americans signed the petition. #NoMoreHiding

#CongressMustRequest https://t.co/GZJZECObtk"
846823829829771264,2017-03-28 20:38:28,RepTerriSewell,235,468,Twitter for iPhone,Petition to release Trump's tax returns is #1 for signatures on White House site! Now my committee is considering bill requiring disclosure.
846818790235103236,2017-03-28 20:18:27,RepTerriSewell,297,522,Twitter for iPhone,Committee hearing on bill to turn over Trump's tax returns kicking off now. We must disclose conflicts of interest. https://t.co/hH6Tw7W1fA
846814602755297282,2017-03-28 20:01:49,RepTerriSewell,233,276,Twitter for iPhone,"House Intel was supposed to hold an open hearing on Russia inquiry today, chose instead to keep public in the dark. https://t.co/1sVW1FQ2gH"
846689584255832064,2017-03-28 11:45:02,RepTerriSewell,7,0,Twitter for iPhone,RT @ALReporter: The Alabama Manufactured Housing Association thanked @RepTerriSewell for introducing legislation #alpolitics https://t.co/F…
846560302003093507,2017-03-28 03:11:18,RepTerriSewell,30877,0,Twitter for iPhone,RT @RepAdamSchiff: After much consideration I believe Chairman should recuse himself from involvement in investigation/oversight of Trump c…
846423973885829121,2017-03-27 18:09:35,RepTerriSewell,17,23,Twitter Web Client,"Today's anniversary is a reminder that #MoneyInPolitics isn't a wedge issue, it's an all-of-us issue. https://t.co/Xwjup99BWr"
846399984287264768,2017-03-27 16:34:16,RepTerriSewell,18,47,Twitter Web Client,"This weekend, another reminder of Russia's failure to support free speech. Interference in our election was an atta… https://t.co/LFrpci09ax"
845360392071237632,2017-03-24 19:43:18,RepTerriSewell,101,276,Twitter Web Client,"BIG NEWS: House leadership just pulled #TrumpCare off the floor, victory for millions who get to keep their coverage #ProtectOurCare"
845335784752328704,2017-03-24 18:05:31,RepTerriSewell,29,74,Twitter Web Client,"Healthcare should be about people, not politics. Eliminating more coverage just to pass #TrumpCare isn't a winning… https://t.co/Onrgc12Lq3"
845297867191435264,2017-03-24 15:34:51,RepTerriSewell,109,184,Twitter for iPhone,OMG! Chair Nunes cancels next week public hearing!! American people deserve transparency!Can we still work together? https://t.co/CfKKRJQOhz
845271635099815937,2017-03-24 13:50:36,RepTerriSewell,13,41,Twitter Web Client,Investigation into Russian attack is too important to play politics. What I had to say on MSNBC's For the Record:… https://t.co/U2iPezEtsV
845191961149550592,2017-03-24 08:34:01,RepTerriSewell,0,22,Twitter for iPhone,Great day with #spelman student Elyse London from Birmingham! #spelmanshadowday https://t.co/hUKDJid55S
845003776314540032,2017-03-23 20:06:14,RepTerriSewell,26,56,Twitter Web Client,The GOP's Freedom Caucus isn't alone in opposing the healthcare repeal bill. Voters know it's bad policy.… https://t.co/wpmODlhEEV
844965376450609154,2017-03-23 17:33:39,RepTerriSewell,34,47,Twitter Web Client,Anniston Star: Alabama and its Southern neighbors stand to lose far more than gain should the repeal become law.… https://t.co/eyrczEom0w
844930963985649664,2017-03-23 15:16:54,RepTerriSewell,30,35,Twitter Web Client,"Today is the 7th anniversary of the #ACA. Before GOP force a vote on a repeal bill Americans dislike, here's a few… https://t.co/AYsK8OuRjF"
844682019137355777,2017-03-22 22:47:41,RepTerriSewell,79,169,Twitter Web Client,"Rep. Nunes should have provided info to his committee. Instead, he gave it to the WH, while FBI is conducting an active investigation."
844681133082193920,2017-03-22 22:44:10,RepTerriSewell,23,55,Twitter Web Client,"If info was lawfully gathered on foreign officials, U.S. persons weren't the subject of surveillance. Trump and associates included."
844680871353442305,2017-03-22 22:43:07,RepTerriSewell,27,93,Twitter Web Client,Nunes' statement today does not suggest in any way that President Obama wiretapped Trump Tower. Not even close.
844679549837348864,2017-03-22 22:37:52,RepTerriSewell,56,0,Twitter for iPhone,"RT @WaysMeansCmte: Here's another idea: don't kick tens of millions of Americans off their insurance, raise health care costs, or impose an…"
844677711507394560,2017-03-22 22:30:34,RepTerriSewell,453,0,Twitter for iPhone,"RT @CBSNews: Nunes' actions are ""deeply troubling along many levels,"" Schiff says; ""it impedes our ability to do this investigation the way…"
844673585683845121,2017-03-22 22:14:10,RepTerriSewell,107,0,Twitter for iPhone,"RT @dncpress: Nunes ""will have to decide whether he is chairman of independent investigation ... or he is surrogate of the White House"" htt…"
844642707171659776,2017-03-22 20:11:28,RepTerriSewell,4,11,Twitter for iPhone,"Join me on Facebook now! Live town hall on budgeting, taxes, and more https://t.co/aYuTtGGHEU https://t.co/co9cXbEHQT"
844618708395999239,2017-03-22 18:36:06,RepTerriSewell,7,18,Twitter Web Client,Tune in to my Facebook at 4:00pm for a FB Live Townhall! I'll be joined by Rep. @GKButterfield. Reply with Q's.… https://t.co/wPgmm6NYbD
844576444969836544,2017-03-22 15:48:10,RepTerriSewell,27,94,Twitter for iPhone,"In senior whip meeting now. Inspiring words by Biden, who's led the fight for affordable care #ProtectOurCare https://t.co/1BjVmRg5MV"
844558739189518337,2017-03-22 14:37:49,RepTerriSewell,19,41,Twitter for iPhone,"Former VP Biden has it right - ""Eliminating the #ACA means eliminating support that people need."" #ProtectOurCare https://t.co/hVpo7VYZ0n"
844553062006054912,2017-03-22 14:15:15,RepTerriSewell,180,359,Twitter for iPhone,I'm speaking out because TrumpCare would leave more than 100k Alabamians w/o coverage. #ProtectOurCare https://t.co/xJCO4G12Q2
844552300676964353,2017-03-22 14:12:14,RepTerriSewell,14,36,Twitter for iPhone,Members from across the country now speaking in opposition. Families can't afford to #PayMoreForLess.… https://t.co/hdxRHPLTt7
844551368216104960,2017-03-22 14:08:31,RepTerriSewell,8,31,Twitter for iPhone,"Doctors, patients speaking out on Capitol steps to oppose TrumpCare. #ProtectOurCare https://t.co/z5eGvDCVq8"
844322084641755136,2017-03-21 22:57:26,RepTerriSewell,30,86,Twitter for iPhone,About to go live on Hardball to talk about the Russia investigation. Catch my interview on MSNBC. #FollowTheFacts https://t.co/27AgmLJAp8
844308820557991936,2017-03-21 22:04:43,RepTerriSewell,17,0,Twitter for iPhone,"RT @hardball: Coming up on #Hardball: @RepTerriSewell, @mschlapp &amp; @DLeonhardt on the fallout of the #ComeyHearing"
844302809184972800,2017-03-21 21:40:50,RepTerriSewell,8,28,Twitter Web Client,"TOMORROW, I join @GKButterfield for a FB Live Townhall, we'll talk tax credits &amp; other topics. Email Qs to Butterfi… https://t.co/fpsVw6tCbn"
844254199357591552,2017-03-21 18:27:41,RepTerriSewell,5,19,Twitter for iPhone,Speaking #LiveAtUrban on housing challenges in Alabama's 7th. We must expand access to credit for working families. https://t.co/yZn0UjBDTh
844217464946868225,2017-03-21 16:01:43,RepTerriSewell,17,41,Twitter for iPhone,Excited to welcome the Montgomery Kappa League to our nation's Capitol. https://t.co/hxYHwjLHIF
844216004695810048,2017-03-21 15:55:54,RepTerriSewell,15,47,Twitter Web Client,Met today with Montgomery's Guide Right youth program. It's up to us to make sure these young men have the tools th… https://t.co/mw0jLk5q9W
844177359540539392,2017-03-21 13:22:21,RepTerriSewell,29,34,Twitter Web Client,Trump's budget would be devastating for AL. Here's a list of areas impacted by cuts to just one grant program:… https://t.co/Li8L8vGCLs
844147936699338752,2017-03-21 11:25:26,RepTerriSewell,19,0,Twitter for iPhone,RT @ALReporter: .@RepTerriSewell was fierce in yesterday's hearing involving FBI Director James Comey #alpolitics https://t.co/ttcdwppfTd
844147796626341888,2017-03-21 11:24:52,RepTerriSewell,29,96,Twitter for iPhone,We will continue to be vigilant in getting to the truth of Trump's campaign coordination with the Russians. https://t.co/wHJSCL6GkK
843901804169646080,2017-03-20 19:07:23,RepTerriSewell,204,490,Twitter Web Client,"""This behavior is not likely to stop"" says NSA Dir. Rogers, unless there's a change. We cannot let Russia attack our democracy again."
843879748212330500,2017-03-20 17:39:45,RepTerriSewell,173,277,Twitter Web Client,"General Flynn's undisclosed meetings with Russian officials weren't just inappropriate, they opened him up to secur… https://t.co/ouBUen4upM"
843854256419622913,2017-03-20 15:58:27,RepTerriSewell,279,578,Twitter Web Client,"Dir. Comey says he would be very concerned if FBI staff met Russia officials, didn't report back. Why would top-level WH staff not disclose?"
843843457579991040,2017-03-20 15:15:32,RepTerriSewell,190,432,Twitter for iPhone,"Trump's wiretapping claims not just baseless, also damaging. Facing real threats, our nation needs its credibility."
843841696777584640,2017-03-20 15:08:32,RepTerriSewell,319,846,Twitter for iPhone,"There you have it. Dir Comey confirms ""no evidence to support President Trump's tweets!""Can we move on from this distraction #FollowtheFacts"
843840541938896901,2017-03-20 15:03:57,RepTerriSewell,61,120,Twitter for iPhone,#Comey announces that neither the FBI nor the DOJ have any information supporting Pres. Trump's claims of wiretapping
843833398045147137,2017-03-20 14:35:34,RepTerriSewell,89,146,Twitter for iPhone,"#Comey publicly confirms that FBI is investigating Russian election interference, any US persons with ties. Promise… https://t.co/M2V6JNOL44"
843831176058081282,2017-03-20 14:26:44,RepTerriSewell,75,161,Twitter for iPhone,Ranking Member @RepAdamSchiff is right: only by understanding what Russians did can we protect against another atta… https://t.co/LPdc6t7wVq
843827304409305088,2017-03-20 14:11:21,RepTerriSewell,39,72,Twitter for iPhone,"Rep Nunes speaking, highlights   Russian history of election interference, cyberattacks. Now they targeted the US. https://t.co/zCqG6hsghG"
843825517757382661,2017-03-20 14:04:15,RepTerriSewell,10,29,Twitter for iPhone,Open hearing today on Russia investigation. FBI Dir. Comey just entered the room. We'll be asking the hard question… https://t.co/tT9AXJYrLX
842755832714543106,2017-03-17 15:13:42,RepTerriSewell,18,57,Twitter Web Client,"House just passed my amendment to strengthen rural VA hiring. Rural VA staff doing all they can to help veterans, t… https://t.co/lQWebhvbyx"
842744835383541760,2017-03-17 14:30:00,RepTerriSewell,5,25,TweetDeck,Fired up for @TroyAthletics today! We're rooting for you. #OneTROY #MarchMadness
842417311730524160,2017-03-16 16:48:33,RepTerriSewell,21,27,Twitter Web Client,The GOP repeal bill would endanger access to affordable care for working families &amp; seniors. My speech in the House: https://t.co/bzpUgCsiRq
842388620145229825,2017-03-16 14:54:32,RepTerriSewell,11,23,Twitter Web Client,Facts are facts. #TrumpCuts put Alabama last and endanger working families.
842388572535705602,2017-03-16 14:54:21,RepTerriSewell,8,11,Twitter Web Client,"Fact 5: #TrumpCuts scrap MBDA, only fed agency focused solely on creating jobs through growth, competitiveness of minority-owned businesses"
842388510724247552,2017-03-16 14:54:06,RepTerriSewell,8,11,Twitter Web Client,"Fact 4: #TrumpCuts eliminate Community Development Block Grants. CDBGs have funded 4,000 projects across Alabama."
842388445603463168,2017-03-16 14:53:50,RepTerriSewell,19,21,Twitter Web Client,"Fact 3: #TrumpCuts Dept. of Agriculture by $4.7 billion. They've invested $3.8 billion since 2009 in rural Alabama housing, jobs, economy"
842388395489914881,2017-03-16 14:53:38,RepTerriSewell,12,17,Twitter Web Client,"Fact 2: #TrumpCuts slash Coast Guard, FEMA, and NOAA, putting Alabama coast at risk. https://t.co/1tJ67A0w4A"
842388344482988033,2017-03-16 14:53:26,RepTerriSewell,154,175,Twitter Web Client,"Fact 1: #TrumpCuts NIH med. research by $6 billion. Alabama is home to 20 NIH-funded institutions. Devastating for AL students, researchers"
842388269597896704,2017-03-16 14:53:08,RepTerriSewell,3,18,Twitter Web Client,#TrumpCuts are going to be crippling for Alabama families. Let's talk facts:
842148239109443585,2017-03-15 22:59:21,RepTerriSewell,11,43,Twitter Web Client,Pres. Trump's #TravelBan was more focused on discrimination than national security. Glad to see our courts siding with the Constitution.
842095003652521996,2017-03-15 19:27:48,RepTerriSewell,13,21,Twitter Web Client,Americans want answers: to what extent is Russia interfering in our democracy? https://t.co/flUirtTP5x
842086189087760384,2017-03-15 18:52:47,RepTerriSewell,2,4,Twitter for iPhone,Honored to welcome Bessemer Council President Jesse Matthews to our office today! https://t.co/SLlGQH1rpm
842085746618073089,2017-03-15 18:51:01,RepTerriSewell,2,4,Twitter for iPhone,Great to welcome @BJCTAMAX to Washington DC today! Thanks for all you do!! https://t.co/tAYpOws8m8
842062735949103104,2017-03-15 17:19:35,RepTerriSewell,8,34,Twitter for iPhone,Preparing to speak live on CNN. Catch my interview now with Wolf Blitzer. Discussing the Russia investigation. https://t.co/N70JkuweXl
842034973490180096,2017-03-15 15:29:16,RepTerriSewell,8,15,Twitter Web Client,"At a hearing on renewing #MIECHV - by investing in home visiting, we can help children grow into successful adults. https://t.co/chG2ixEkY7"
841864279116681217,2017-03-15 04:10:59,RepTerriSewell,32,35,Twitter for iPhone,Trumpcare is bad for Alabama and bad for Alabamians! https://t.co/hhj7ldIlTa
841829472286441472,2017-03-15 01:52:41,RepTerriSewell,75,151,Twitter Web Client,It shouldn't take a leak to reveal Trump's tax returns; 4 decades of GOP nominees disclosed because it was the right thing to do
841417391837978625,2017-03-13 22:35:13,RepTerriSewell,15,25,Twitter Web Client,"TrumpCare asks working families to go broke, bankrupt, or do without healthcare. CBO estimate is shocking:… https://t.co/IrXVLJ71ZJ"
841406194245853185,2017-03-13 21:50:43,RepTerriSewell,8,16,Twitter for iPhone,"CBO report is in and @SenSchumer said it best ""TrumpCare is a nightmare for most Americans!"" 14millions uninsured n… https://t.co/V7GGNSLuGV"
841383205047529472,2017-03-13 20:19:22,RepTerriSewell,14,13,Twitter Web Client,CBO analysis of GOP repeal bill released: more than 20 million will lose insurance by 2020. This bill will cost liv… https://t.co/ZyXnNhzBF3
841372573669703680,2017-03-13 19:37:08,RepTerriSewell,7,14,Twitter Web Client,This past week's decision striking down Texas' gerrymandering did not mince words. Discrimination against minority… https://t.co/Dfeg4TwZdR
841371033127002113,2017-03-13 19:31:00,RepTerriSewell,18,24,Twitter Web Client,"Election laws targeting minority voters for discrimination aren't unique to Texas. Last spring, Judge Motz struck a… https://t.co/dYaN3MhVfZ"
841342857466241025,2017-03-13 17:39:03,RepTerriSewell,3,8,Twitter Web Client,Yet another court finds state election laws target minority voters. We need voter protections back NOW. https://t.co/ybJdaWHi7Y
841308312738095104,2017-03-13 15:21:47,RepTerriSewell,105,73,Twitter Web Client,"Ten AL hospitals have closed over the past 6 years. By gutting Medicaid, decreasing coverage, GOP health bill could… https://t.co/KJlTZqoK7h"
840245730627444736,2017-03-10 16:59:27,RepTerriSewell,10,10,Twitter Web Client,"Flash-forward seven years later. Mr. Speaker - @WaysMeansCmte deserved time for review, CBO score before markup… https://t.co/uIOxcs164z"
840245228913213442,2017-03-10 16:57:28,RepTerriSewell,7,11,Twitter for iPhone,Bad way to legislate. Healthcare debate shouldn't be about playing politics. It's our chance to take on big issues.… https://t.co/OAEaGUQtRy
840244887995981825,2017-03-10 16:56:06,RepTerriSewell,5,5,Twitter for iPhone,This week's repeal bill made public less than 48 hours before markup. Still no CBO score. American people deserve b… https://t.co/hBqvxe42lb
840206260809134082,2017-03-10 14:22:37,RepTerriSewell,6,14,Twitter for iPhone,"First the media, then the judiciary, now a non-partisan budget office. When do we stop attacking institutions of ou… https://t.co/WYFGaJOpg4"
839966528955117568,2017-03-09 22:30:00,RepTerriSewell,6,26,TweetDeck,"Yesterday, I led a letter to VP Pence urging him to end ""investigation"" of voter fraud myth, take on real issues li… https://t.co/5hMnw854Kr"
839932206906757120,2017-03-09 20:13:37,RepTerriSewell,227,158,Twitter Web Client,BREAKING: Experts now estimating at least 15 million would lose insurance under GOP repeal plan #ProtectOurCare https://t.co/Lh7cDDA9vw
839919791355936773,2017-03-09 19:24:17,RepTerriSewell,7,15,Twitter Web Client,Still no pricetag on the GOP repeal plan. Here's my remarks at the committee markup last night:… https://t.co/4wfCQneUyV
839859157117317120,2017-03-09 15:23:21,RepTerriSewell,2,9,Twitter for iPhone,Welcoming ALFA to D.C. Great to see the folks from Alabama's 7th district!! https://t.co/TAeHHj73iq
839859156425277440,2017-03-09 15:23:21,RepTerriSewell,3,7,Twitter for iPhone,Welcoming ALFA to D.C. Great to see the folks from Alabama's 7th district!! https://t.co/Z6g3pk3ndd
839779548979937280,2017-03-09 10:07:01,RepTerriSewell,49,69,Twitter for iPhone,"Adjourned. Trumpcare passed along party lines! Irresponsible to vote w/o CBO cost estimate Pay more, get less! Gut Medicaid &amp; Medicare! Bad!"
839769017602691073,2017-03-09 09:25:10,RepTerriSewell,4,21,Twitter for iPhone,"At 4:15, new chicks of @WaysMeansCmte -@RepDelBene &amp; @RepJudyChu -still going strong! #ProtectOurCare https://t.co/9RKTjEPZe3"
839764029467947012,2017-03-09 09:05:21,RepTerriSewell,31,48,Twitter for iPhone,"It's 4am, still debating ill-advised GOP repeal bill. @repjohnlewis is closing us out by reminding us of the Golden Rule. #ProtectOurCare"
839762575885742081,2017-03-09 08:59:34,RepTerriSewell,15,0,Twitter for iPhone,RT @RepLindaSanchez: Thank you @RepTerriSewell @RepDelBene @RepJudyChu &amp; @WaysMeansCmte #dems for voting to protect women from insurance di…
839728365129121792,2017-03-09 06:43:38,RepTerriSewell,14,77,Twitter for iPhone,Thanks to my constituents for sharing your stories and concerns about Healthcare with me. I invoked your voices during this 15hr markup!
839722159417217024,2017-03-09 06:18:58,RepTerriSewell,37,0,Twitter for iPhone,"RT @WaysMeansCmte: ""So we're supposed to vote for this bill without knowing how the coverage will affect our particular district?"" - @RepTe…"
839713032116776960,2017-03-09 05:42:42,RepTerriSewell,65,125,Twitter for iPhone,Go @RepDannyDavis! His amendment requires Millionaires to pass drug test to get the GOP tax break of $157.6Bil! What's good for the goose...
839659803664388096,2017-03-09 02:11:11,RepTerriSewell,386,577,Twitter for iPhone,OMG! Debating the GOP Bill repeal of tax on tanning. $600Mil tax break to them! Not fair! Some of us don't need a tan! We need Healthcare!
839658976446906371,2017-03-09 02:07:54,RepTerriSewell,24,20,Twitter Web Client,"GOP so far refusing to discuss Medicaid cuts, destabilization of Medicare, elimination of preventative care coverag… https://t.co/XZTujEMLUL"
839638533467951104,2017-03-09 00:46:40,RepTerriSewell,22,11,Twitter for iPhone,Committee just confirmed this health bill will spend $600 mil. in tax breaks for tanning salons... unpaid for. #PayMoreForLess
839635231892205568,2017-03-09 00:33:33,RepTerriSewell,69,73,Twitter for iPhone,"Now in hour 8 of debate, GOP rejecting amndts to safeguard working families, keeping measures with tax cuts for wealthy. #PayMoreForLess"
839616321985855488,2017-03-08 23:18:25,RepTerriSewell,48,58,Twitter for iPhone,Rural communities can't afford to #PayMoreForLess https://t.co/afOFCvBJQs
839613766656475141,2017-03-08 23:08:15,RepTerriSewell,5,21,Twitter for iPhone,Just offered amendment to GOP health bill to stop the bill if rural hospitals are put at risk #ProtectOurCare https://t.co/yH2rKCZWtv
839577803582484480,2017-03-08 20:45:21,RepTerriSewell,14,61,Twitter for iPhone,Standing up for women's health at today's health bill markup. #InternationalWomensDay #DayWithoutAWoman https://t.co/Ls7wawpO2Z
839554293099343873,2017-03-08 19:11:56,RepTerriSewell,227,245,Twitter Web Client,Ways &amp; Means just blocked amendment requiring GOP health bill be fully paid for &amp; not increase number of uninsured. Taxpayers deserve better
839524943117312001,2017-03-08 17:15:18,RepTerriSewell,15,18,Twitter Web Client,"With just hours until vote, Ways &amp; Means members getting 0 answers to Q's on windfall profits for insurance execs, increased deductibles"
839519532003778560,2017-03-08 16:53:48,RepTerriSewell,12,16,Twitter Web Client,Experts are speaking out. #PayMoreForLess #ProtectOurCare https://t.co/p9YV1fF5Vg
839512584017543172,2017-03-08 16:26:12,RepTerriSewell,9,27,Twitter Web Client,This #InternationalWomensDay I'm wearing red in recognition of the powerful difference American women make every da… https://t.co/jidgb5fZ1s
839503808342421504,2017-03-08 15:51:19,RepTerriSewell,38,53,Twitter Web Client,"Access to care is a fundamental right, not a privilege. The health bill we're considering today puts families at ri… https://t.co/hip9Q1AuCm"
839468503363104768,2017-03-08 13:31:02,RepTerriSewell,46,36,Twitter Web Client,Today the Ways and Means Committee marks up the GOP health bill. My thoughts: https://t.co/qB2jmuAvtz… https://t.co/qvRbJcTesk
839231284660617221,2017-03-07 21:48:25,RepTerriSewell,3,6,Twitter Web Client,Big congrats to @ConcordiaAL men and women for their basketball championships! You make our state proud. https://t.co/QqkuOCCcpA
839186207435259907,2017-03-07 18:49:17,RepTerriSewell,4,14,Twitter for iPhone,"Great to welcome Alabama members of Delta Sigma Theta Sorority to Captiol Hill for ""Delta Day""! #DeltaSigmaTheta https://t.co/ZaXwkrPgUf"
