id,created_at,user,retweets,favorite_count,source,text
543175769506451456,2014-12-11 22:49:29,SenatorBegich,12,30,Twitter Web Client,It's been an honor to serve Alaska &amp; make life a little better every day for Alaskans. Watch my farewell speech here http://t.co/DjBKMMkuM0
543071489566973954,2014-12-11 15:55:07,SenatorBegich,10,7,Hootsuite,"Today, I will be delivering my farewell address to the U.S. Senate at 12PM EST/8 AM AKT. Watch it live here: http://t.co/TXlWH1WgwI"
542715671042588672,2014-12-10 16:21:13,SenatorBegich,4,2,Hootsuite,"Great news for AK veterans, appropriations deal includes my measure to provide advance funding for veterans' programs http://t.co/Cpvi5gXfqU"
542422115941507073,2014-12-09 20:54:44,SenatorBegich,8,9,Hootsuite,"My bill repealing harmful VAWA 'Alaska Exemption' passed Senate/heads to House, will improve AK village public safety http://t.co/jkXmBgJTRF"
539893025980551169,2014-12-02 21:25:02,SenatorBegich,3,3,Hootsuite,A win for hunters across the nation – including AK subsistence hunters – my Duck Stamp bill will now become law http://t.co/jsEnfxow9i
539864126533943296,2014-12-02 19:30:12,SenatorBegich,3,5,Hootsuite,"I'm on the floor of the Senate now discussing need to pass Duck Stamp Act of 2014, which will be a win for subsistence hunters/conservation."
535844982729736193,2014-11-21 17:19:34,SenatorBegich,5,7,Hootsuite,My Do Not Disturb bill protects Alaskans privacy by expanding Do Not Call Registry to political calls from Super Pacs http://t.co/VTKSkM4eIp
535501897692872704,2014-11-20 18:36:16,SenatorBegich,7,6,Hootsuite,"Now that the dust has settled from the Senate election, it is time to move Alaska forward -- my OpEd on @adndotcom http://t.co/t1J0BFG43v"
532618001410179072,2014-11-12 19:36:41,SenatorBegich,1,3,Hootsuite,Thanks for sharing MT @CUterryB: Thanks @SenatorBegich for meeting AK @CloseUp_DC today to discuss issues in Congress http://t.co/Rlldn8QMLV
532284031011143681,2014-11-11 21:29:37,SenatorBegich,3,4,Hootsuite,"On this Veterans Day, my deepest gratitude goes to the hard working members of our military for their commitment http://t.co/T7lA8qImws"
525854062974337024,2014-10-25 03:39:13,SenatorBegich,11,7,Hootsuite,One of the best videos you'll see all day -- from #AFN http://t.co/zaTL3aJz7L
525389865593344001,2014-10-23 20:54:39,SenatorBegich,9,8,Twitter for iPhone,Honored to receive Charles Dick Medal of Merit from National Guard Assoc. Thanks for all you do &amp; for recognition. http://t.co/m3K0MgvBKJ
525368905658011648,2014-10-23 19:31:22,SenatorBegich,5,3,Hootsuite,Welcome news - AK rural communities will receive $12 million in federal funding to improve water &amp; wastewater systems http://t.co/8P6xA3Qy1n
525058797887574016,2014-10-22 22:59:07,SenatorBegich,7,3,Hootsuite,"Monday, I toured Providence Hospital to see how they go above &amp; beyond to prepare for any kind of outbreak like Ebola http://t.co/JKnkbuXe9t"
524677880228630528,2014-10-21 21:45:29,SenatorBegich,6,3,Hootsuite,ICYMI: @GuardMagazine article on preventing misconduct in the Natl. Guard notes @NGAUS1878 support for my bill http://t.co/yOa8lHBbKF
523688286091747329,2014-10-19 04:13:11,SenatorBegich,11,6,Twitter for iPhone,Visited @KUACFMTV in FBX last night during their fall fundraiser. Couldn't resist the opportunity to take some calls http://t.co/mGjKzb1slT
523613460245274624,2014-10-18 23:15:51,SenatorBegich,14,14,Twitter for iPhone,Happy Alaska Day! Today in 1867 Russia transferred territory of AK to U.S. Enjoy a pic of my favorite map of the U.S. http://t.co/2KgkhoDdfv
522922268293627904,2014-10-17 01:29:18,SenatorBegich,8,3,Twitter for iPhone,AK pilots: Aviation Weather Camera website is open for testing at http://209.165.164.193 More: http://t.co/d9TTG64WYA http://t.co/iDlhBh80xL
522840133356486656,2014-10-16 20:02:56,SenatorBegich,11,3,Hootsuite,#TBT - Great photo from 2011 w/ Harrison Ford discussing the importance of General Aviation to Alaska and the U.S. http://t.co/PvKUnrAzb5
522480930821533697,2014-10-15 20:15:35,SenatorBegich,3,1,Hootsuite,ICYMI: @rollcall article on AK Delegation support for approval of export license for AK liquefied natural gas project http://t.co/FEyllO3tBh
522475147941666816,2014-10-15 19:52:37,SenatorBegich,1,2,Hootsuite,.@AK_DMB_fan If you have questions on how US is fighting Ebola please visit CDC at http://t.co/DjVK7D0e4h or call my ANC office 907-271-5915
522462688442871809,2014-10-15 19:03:06,SenatorBegich,5,3,Hootsuite,Get the facts: AK is low-risk for an Ebola outbreak &amp; I'm working w/ CDC to ensure AK is prepared/has proper testing http://t.co/RVmXhT0weV
521860909430751232,2014-10-14 03:11:51,SenatorBegich,7,0,Hootsuite,"Congrats to Alix McKee, teacher of the week. And thanks to you and teachers across AK for all you do for our students http://t.co/nVe6w1hkRw"
520688175090778112,2014-10-10 21:31:49,SenatorBegich,9,6,Hootsuite,"Great news for Juneau -- which earned the title of ""Best State Capitals to Live In."" Congrats on being #1! http://t.co/bHtxqCaHNU"
520303506604175362,2014-10-09 20:03:17,SenatorBegich,9,4,Hootsuite,"Happy to announce $37 million more in settlements to AK tribes, I'll fight to ensure Feds pay what tribes are owed http://t.co/IdIXVDOR00"
520269634424287232,2014-10-09 17:48:41,SenatorBegich,3,1,Hootsuite,@PASSNational Always happy to meet with Alaskans to discuss improving safety and our unique relationship with aviation.
519934486302453760,2014-10-08 19:36:56,SenatorBegich,5,4,Hootsuite,"It is time for thorough/impartial review of ""Fairbanks Four"" case - I've made a formal request to US Dept. of Justice http://t.co/8d4Bao8CSX"
519219595111325697,2014-10-06 20:16:12,SenatorBegich,6,3,Hootsuite,$7 mill. in Federal funds to be used to boost local AK economies/improve living conditions for thousands of Alaskans http://t.co/NSOs9SJi54
519213970000203776,2014-10-06 19:53:51,SenatorBegich,7,6,Twitter for iPhone,Pleased to announce w/ @SecretaryCastro - $7 million in funds for AK to improve housing &amp; spur community development http://t.co/4QxxwSy8Pc
519199044074479616,2014-10-06 18:54:33,SenatorBegich,1,4,Hootsuite,RT @AnchChamber: Join us for lunch today w/ US Sec. of Housing &amp; Urban Development @SecretaryCastro &amp; @SenatorBegich http://t.co/r5x0Sazcym
519191737974407168,2014-10-06 18:25:31,SenatorBegich,0,0,Hootsuite,Today at t 11 AM at Mountain View Service Center in ANC there will be a special announcement w/ HUD @SecretaryCastro http://t.co/hOJqRk4Ebq
518847025673023488,2014-10-05 19:35:45,SenatorBegich,2,0,Twitter for iPhone,"Congrats to KFAR, celebrating 75th anniversary this week. Hope everyone had fun at the Big I http://t.co/6HbBQYQoyZ http://t.co/sIO9wWA1j4"
518196872625025026,2014-10-04 00:32:16,SenatorBegich,2,2,Twitter for iPhone,Good questions about how I can help cut red tape and generally help coordinate Federal agencies to boost tourism. http://t.co/llA2umAjWE
518194227680149507,2014-10-04 00:21:46,SenatorBegich,5,7,Twitter for iPhone,Talking to business &amp; community leaders w/ Explore Fairbanks about boosting tourism and creating jobs in Interior AK http://t.co/jZeGeS8U42
518111218788474881,2014-10-03 18:51:55,SenatorBegich,3,5,Twitter for iPhone,"Leading Fairbanks town hall, listening to concerns &amp; discussing how to expand access to vital mental health services http://t.co/dAvUre1Uql"
518101629862957057,2014-10-03 18:13:49,SenatorBegich,1,3,Twitter for iPhone,Good speaking w/ education leaders from across Alaska at AK Superintendents Fall meeting in Fairbanks. http://t.co/Q056HuHveb
517813825127874560,2014-10-02 23:10:11,SenatorBegich,3,1,Hootsuite,ICYMI: My bills aimed at helping service members and their families noted in Military Times &amp; Military Officer http://t.co/uNsKnIJuX6
517790262593355776,2014-10-02 21:36:33,SenatorBegich,2,3,Hootsuite,"I'm in Fairbanks on Friday to talk w/ AK Superintendents Assoc, hold Mental Health Town Hall &amp; lead a Tourism Forum http://t.co/AyurFmZcI8"
517483257882218497,2014-10-02 01:16:37,SenatorBegich,3,2,Twitter for iPhone,I was honored to speak at Covenant House in ANC earlier today for the start of Domestic Violence Action Month http://t.co/ZpeXCDcR5g
517452684539232256,2014-10-01 23:15:08,SenatorBegich,1,0,Hootsuite,"Big Thorne timber sale is welcome news after frustrating delays, I've fought hard to keep Viking open/protect SE jobs http://t.co/UTQLS2XUF8"
517428644520927232,2014-10-01 21:39:36,SenatorBegich,2,0,Hootsuite,This is a win/win - expansion of Ft. Knox mine could mean more work and potential production in Alaska http://t.co/Hwhyy4zjD6
517392577440792576,2014-10-01 19:16:17,SenatorBegich,10,4,Hootsuite,My OpEd on Putting Veterans Funding First Act - ensures that veterans are never again caught in political gridlock http://t.co/8tbYnYS95F
517026429868204032,2014-09-30 19:01:21,SenatorBegich,2,2,Hootsuite,I'm honored to receive high marks from @AAUW &amp; proud of my record on issues helping #AK women http://t.co/SBquxUgCMK http://t.co/a5Nl7REZSD
516794498530443264,2014-09-30 03:39:44,SenatorBegich,8,1,Hootsuite,Glad we put politics aside &amp; my Veterans COLA bill is now law. Raises compensation for disabled vets &amp; their families http://t.co/DW4N4feymE
515273355768115200,2014-09-25 22:55:15,SenatorBegich,2,2,Hootsuite,"Proposed USFS 'photo fee' defies commonsense, I'll work to ensure final rule respects Alaskans &amp; 1st Amendment http://t.co/bl10gTFL5l"
515262955265753089,2014-09-25 22:13:56,SenatorBegich,1,1,Hootsuite,Romig/West students knew just what to do during this morning's 6.24 earthquake. Great job!  http://t.co/JwGWyvtGKj http://t.co/pazKJuLF22
515184757320478721,2014-09-25 17:03:12,SenatorBegich,1,2,Hootsuite,"Good news, at my urging USFS is keeping fisheries biologist job in Juneau - critical to have fishery research in AK http://t.co/oETadLjHdo"
514914746643267584,2014-09-24 23:10:16,SenatorBegich,2,4,Hootsuite,AK Delegation is working together to ensure consumers get the real deal. Russians shouldnt label their fish “Alaskan” http://t.co/i3pZwcEguU
514864424818319360,2014-09-24 19:50:19,SenatorBegich,6,2,Hootsuite,"#AK wrote the book on safe, sustainable fisheries, our wild salmon stocks shouldn't be put at risk b/c of GMO salmon http://t.co/ViRBiisv9B"
514827175758139392,2014-09-24 17:22:18,SenatorBegich,0,0,Hootsuite,".@nomechick Good first step, see my remarks supporting cont. airstrikes &amp; need to bring more nations into coalition http://t.co/PZ9CVCq3rK"
514822022455902208,2014-09-24 17:01:49,SenatorBegich,1,0,Hootsuite,"Just bc you create something in a lab doesnt mean its safe for the public, claims that GMO salmon are safe - not true http://t.co/qkrSfXlVyb"
514455516442263553,2014-09-23 16:45:27,SenatorBegich,2,1,Hootsuite,My @newsminer OpEd: President's plan to arm Syrian rebels is flawed - we need sustained airstrikes/regional coalition http://t.co/4kJ7H6qAhJ
514186200396337153,2014-09-22 22:55:17,SenatorBegich,0,1,Hootsuite,"I know first hand the hardship endured when a loved one goes missing, why I sponsored the Help Find the Missing Act http://t.co/S0ekOuq5YF"
514143409121284096,2014-09-22 20:05:15,SenatorBegich,2,0,Hootsuite,.@MelissadArabian stopped by for a Begich Minute to share her story/raise awareness around #SuicidePreventionMonth http://t.co/5R2QHWQ4SY
513013455465750530,2014-09-19 17:15:13,SenatorBegich,5,0,Hootsuite,Senate passed Tribal Welfare Exclusion Act yesterday - ensures #AK Native tribes are treated fairly under tax code http://t.co/PUgxsFXoig
512685748470812673,2014-09-18 19:33:02,SenatorBegich,3,4,Hootsuite,"Need to deal w/ 2 issues separately. Though I oppose President's plan to arm Syrian rebels, I support funding govt &amp; avoiding govt shutdown"
512683799441076224,2014-09-18 19:25:17,SenatorBegich,4,2,Hootsuite,WATCH NOW: Speaking on Senate floor on why I do not support arming rebels in Syria http://t.co/iTsTiUav6d
512379355709071361,2014-09-17 23:15:32,SenatorBegich,3,1,Hootsuite,Appreciate Target's commitment to wild AK salmon - supports AK fishing families/strengthens economy #nofrankenfish http://t.co/I635n0bUfs
512367762967371776,2014-09-17 22:29:28,SenatorBegich,2,2,Hootsuite,"Its #ConstitutionDay, I urge Alaskans to honor &amp; learn about the U.S. Constitution which was signed by Founding Fathers 227 years ago today."
512337643888472064,2014-09-17 20:29:47,SenatorBegich,3,0,Hootsuite,.@CarberryMatthew See my Juneau Empire oped on Supreme Court's Hobby Lobby decision &amp; implications for Alaska women http://t.co/T5pJwzpq03
512335017394323456,2014-09-17 20:19:21,SenatorBegich,1,3,Twitter Web Client,#CorpsArentPeople - So why should they be able to prevent #AK women from getting access to reproductive healthcare? http://t.co/IIphnZfx4z
512294404523311104,2014-09-17 17:37:58,SenatorBegich,5,1,Hootsuite,Refinance bill wld make college cheaper for #AK families. Senate needs to quit playing politics w student loan reform http://t.co/ZszWVZ1N9x
512271338606977024,2014-09-17 16:06:19,SenatorBegich,5,2,Twitter for iPhone,"Spoke @NCAI1944 Tribal Unity Impact Day. Discussed how we work together for voting rights,land restoration, education http://t.co/RIFecV5VH7"
512262765806108673,2014-09-17 15:32:15,SenatorBegich,43,21,Twitter Web Client,"#CorpsArentPeople so we cant let them buy elections, we need reform. Join me &amp; @SenatorTester using #CorpsArentPeople http://t.co/Wl9T1w4tlo"
512246095955918850,2014-09-17 14:26:01,SenatorBegich,3,2,Twitter for iPhone,"Met yesterday w/ dedicated folks @ACSCAN, gives me confidence we're making great strides in battle against cancer http://t.co/SZF8ROnsSF"
512013473711415296,2014-09-16 23:01:39,SenatorBegich,1,2,Hootsuite,Good news - $5.3 million in Federal grants awarded to 27 #AK health centers to improve healthcare services/access http://t.co/6PW1T6pcZR
511646929772883968,2014-09-15 22:45:08,SenatorBegich,4,5,Hootsuite,"Its unacceptable Senate voted down Paycheck Fairness, I'll keep working to ensure women get equal pay for equal work http://t.co/h7OQW6zNgL"
510518499513729024,2014-09-12 20:01:09,SenatorBegich,1,2,Hootsuite,Working to strengthen AK Natl Guard’s response to sexual assault/misconduct - determined to see action &amp; transparency http://t.co/fF8c1kGp6r
510471744180977664,2014-09-12 16:55:22,SenatorBegich,1,1,Hootsuite,"I'm honored to work for #AK veterans, my Veterans' COLA Act passed Senate yesterday - will benefit 4.5 mill vets http://t.co/5ieprw5C4t"
510090600264507392,2014-09-11 15:40:50,SenatorBegich,4,3,Twitter for iPhone,"Its Hunger Action Month, 1 in 7 Alaskans go hungry &amp; we must do more 2 help neighbors in need http://t.co/LGJFtxEdz6 http://t.co/XAGibJxTqR"
509777115294990336,2014-09-10 18:55:10,SenatorBegich,3,1,Hootsuite,"If Gov Parnell wont work for better health care access for Alaskans, I will. My Copper Plan could cut premiums by 18% http://t.co/i1BJPEWuxz"
509706622781112321,2014-09-10 14:15:03,SenatorBegich,3,2,Twitter for iPhone,Was great to meet AK High School &amp; Middle School Principals of the Year yesterday from Fairbanks &amp; Wasilla #poy14 http://t.co/7Akc82tcTW
509477624276852736,2014-09-09 23:05:05,SenatorBegich,2,0,Hootsuite,Sec. Foxx's trip delivered results for AK - $2.5 million for Seward to complete plan for expansion of marine terminal http://t.co/ibZZu7zpEg
509383345206464512,2014-09-09 16:50:28,SenatorBegich,0,0,Hootsuite,"We're seeing real progress for aviation in #AK w/ transition to unleaded fuels, safety &amp; access to FAA flight surgeon http://t.co/IQ8m7TcFq3"
509346931966218240,2014-09-09 14:25:46,SenatorBegich,4,1,Hootsuite,#AK is fed up w outsiders trying to buy elections - I support Const. amendment to rein in unlimited campaign spending http://t.co/kARzWtvEJz
507935251763847168,2014-09-05 16:56:15,SenatorBegich,7,2,Hootsuite,Yesterday I called on Gov. Parnell to act ASAP &amp; hold those accused of wrong doing in AK National Guard accountable http://t.co/0BtEfECLmo
507661952727138304,2014-09-04 22:50:16,SenatorBegich,8,4,Hootsuite,A win for voting rights. Judge rules State of AK can't deny #AKNatives at ballot box and must use Native languages http://t.co/1HEv3roaqF
507573926369955840,2014-09-04 17:00:28,SenatorBegich,3,0,Hootsuite,Glad Pentagon has a plan to fix problems processing vets paperwork. Will keep working to ensure DoD fixes this ASAP http://t.co/KTVKsd0JG3
507549133348274176,2014-09-04 15:21:57,SenatorBegich,2,1,Twitter for iPhone,Great visit to Juneau on Tues. - spoke w/ Rotary about growing economy and Juneau Douglas HS abt affordable higher ed http://t.co/5aqWJHGESL
507208917265694721,2014-09-03 16:50:04,SenatorBegich,3,0,Hootsuite,"At my urging, USPS working to reopen post office in Wainwright. This is unacceptable &amp; I'll keep pushing for solution http://t.co/94ksA0i1q4"
505476522397159426,2014-08-29 22:06:08,SenatorBegich,9,5,Twitter for iPhone,"Congrats to Togiak on opening of new library, complete w/ Yupik art. Great news for community http://t.co/NlpFxWrzJb http://t.co/rA95Ssw8y0"
505455655151755264,2014-08-29 20:43:13,SenatorBegich,3,8,Twitter for iPhone,I joined some proud #AK families today to celebrate and congratulate 144 graduates of Alaska Military Youth Academy http://t.co/XoCQiU0Xa4
505129012021428224,2014-08-28 23:05:15,SenatorBegich,7,1,Hootsuite,Great editorial from @JuneauEmpire - Supports #AK Delegation efforts to protect #AK fisheries from Russian sanctions http://t.co/L7yzWV1L9U
505111777001340928,2014-08-28 21:56:46,SenatorBegich,4,2,Hootsuite,I invited @TomWheelerFCC to #AK to hear from Alaskans about the challenges of bringing broadband to rural areas http://t.co/29Qa0tYt2F
504766608624328705,2014-08-27 23:05:12,SenatorBegich,4,4,Hootsuite,Tourist season is in high gear. TSA needs to fix any fee issues and prevent overcharging Alaskans on airline tickets http://t.co/RYVJ9SUjH3
504745446037004288,2014-08-27 21:41:06,SenatorBegich,6,5,Twitter Web Client,".@corybooker &amp; I enjoyed Town Hall today w/ Bartlett students in ANC. Students were engaged, asked tough questions. http://t.co/GXUfSIEymh"
504353188154462208,2014-08-26 19:42:25,SenatorBegich,6,0,Hootsuite,Glad #AK Delegation is united in urging White House to use strong &amp; immediate action against Russia's seafood boycott http://t.co/J2OlFxRkme
504320551704600577,2014-08-26 17:32:44,SenatorBegich,2,1,Hootsuite,Problems w/ transfer of military records are unacceptable. Will fight to ensure #AK vets get benefits w/ out delay http://t.co/iYcAMDKgiR
504040559993163779,2014-08-25 23:00:08,SenatorBegich,2,1,Hootsuite,Last week my staff had a good meeting w/ Alyeska Pipeline Service Co. Received update on TAPS/toured the facility https://t.co/SP1xhp3V7i
504009960704196609,2014-08-25 20:58:33,SenatorBegich,2,0,Twitter Web Client,"Invited @SecretaryFoxx to AK, we took the train to Wasilla &amp; listened to Alaskans discuss their unique transpo. needs http://t.co/imWxZDaMbI"
503995718378745857,2014-08-25 20:01:57,SenatorBegich,9,3,Hootsuite,"Honored to accept award for protecting Social Security, my bill prevents office closures in AK http://t.co/7YrIu2FOTo http://t.co/UwEJ16EsnG"
503964068542435328,2014-08-25 17:56:11,SenatorBegich,2,1,Hootsuite,Looking fwd to roundtable discussion w/ Alaska women veterans and combat vet Rep. Tulsi Gabbard at 2PM today at Alaska Veterans Museum.
503951333083602945,2014-08-25 17:05:35,SenatorBegich,2,1,Hootsuite,Oped w @kellyayotte on Mental Health First Aid. Bill helps identify/understand/respond to signs of mental illness http://t.co/OcK0BL2u6K #ak
503918896609783808,2014-08-25 14:56:41,SenatorBegich,5,0,Hootsuite,My post on Korean Ambassador Ahn Ho-Young's recent Alaska visit and AK's unique partnership w/ Korea http://t.co/w6q9adqqrK @uskoreaconnect
500047999989731328,2014-08-14 22:35:08,SenatorBegich,9,2,Twitter for iPhone,On AK Railroad w/ DOT @SecretaryFoxx - Having a good discussion w/ Alaskans on our unique transportation needs. http://t.co/dSKxA2yi3H
499998811943874560,2014-08-14 19:19:40,SenatorBegich,10,5,Twitter for iPhone,"Happy bday Soc. Security, lets build on success &amp; improve system for future. Thx to Senior Center for the great work http://t.co/9fE5v0Qgws"
499995600470163457,2014-08-14 19:06:55,SenatorBegich,1,1,Twitter for iPhone,Social Security is so important bc there needs to be something there to care for Alaska's elderly when they retire. http://t.co/ywx87hvYGU
499978814722932737,2014-08-14 18:00:13,SenatorBegich,9,2,Hootsuite,"Today is Social Security's 79th b-day, headed to ANC Senior Activity Center @ 10:30AM to discuss importance of Soc. Security w/ #AK seniors."
499726902782095360,2014-08-14 01:19:12,SenatorBegich,5,2,Hootsuite,"After years working w/ #AK tribes to pressure federal govt to pay, pleased to report $449 million in settlements http://t.co/FzZxIclKpp"
499360384084885505,2014-08-13 01:02:47,SenatorBegich,5,1,Hootsuite,Military families using car transport should not have to worry abt delays/damages. Current situation is unacceptable http://t.co/O5uoD9BWyV
498993618150240257,2014-08-12 00:45:24,SenatorBegich,13,2,Hootsuite,"#AK fishermen know we must protect oceans/fisheries, which is why I announced a bill to make this a national priority http://t.co/FfGX6yBAJv"
497475718008549376,2014-08-07 20:13:48,SenatorBegich,8,0,Twitter for iPhone,F-35s in Eielson means 100s of new jobs in Fairbanks area and millions in economic activity http://t.co/SVOVDZpTdw http://t.co/TihI1VMPao
497473526157570048,2014-08-07 20:05:05,SenatorBegich,1,0,Hootsuite,Worked for years w/ #AK Delegation &amp; community to bring F-35s to Eielson - a lot of Alaskans worked together on this http://t.co/mEu0C44QiD
497466457853526017,2014-08-07 19:37:00,SenatorBegich,3,3,Hootsuite,Eielson AFB selected as preferred home for F-35s. This is a huge win for Fairbanks and Alaska’s military importance. http://t.co/wp8VsMwLHp
497156427329572864,2014-08-06 23:05:03,SenatorBegich,8,0,Hootsuite,"Monday, I attended event honoring Korean War vets in #AK - we should never forget these vets' contribution to freedom http://t.co/LsIlZuJPmb"
495279242406821888,2014-08-01 18:45:47,SenatorBegich,10,6,Hootsuite,Military women should never worry abt how to pay for birth control. My bill ensures they get fair treatment/best care http://t.co/BMIbvIliF3
495254770387783680,2014-08-01 17:08:33,SenatorBegich,5,2,Hootsuite,Much needed veterans' reform bill will become law. Good step for vets in #AK - built on reforms right here in Alaska http://t.co/1XtBYfLIxQ
495231796301529088,2014-08-01 15:37:15,SenatorBegich,2,0,Hootsuite,Congrats to village corps. in North Slope - AIO partnership allows local communities stake in Chukchi Sea development http://t.co/T16nkaMwHB
494603617442471936,2014-07-30 22:01:06,SenatorBegich,5,3,Hootsuite,.@indiancountry OpEd: Feds must honor contracts w #AK Natives/Am Indians. My bills will make that law of the land http://t.co/tSxOErL7PQ
494530215574773760,2014-07-30 17:09:25,SenatorBegich,1,0,Hootsuite,(2/2) I stood up to Harry Reid and voted against proceeding b/c we should allow floor amendments and get things done around here.
494529988209954816,2014-07-30 17:08:31,SenatorBegich,1,0,Hootsuite,"(1/2) Disappointed process got in way of good policy today. We need the Bring Jobs Home Act, but…"
494208791257169920,2014-07-29 19:52:12,SenatorBegich,5,3,Hootsuite,"Vets Conf. Report is good step in getting veterans care they have earned, includes key VA reforms I championed in AK http://t.co/VFiyYYExFe"
493799402545610753,2014-07-28 16:45:26,SenatorBegich,3,2,Hootsuite,"Bring Jobs Home Act will close wasteful tax loopholes/help protect 44,500 #AK jobs. Senate needs to vote yes to strengthen #AK economy."
492854343574749184,2014-07-26 02:10:06,SenatorBegich,14,4,Hootsuite,Introduced bill that allows our most needy families/children in #AK vital access to federal homelessness assistance http://t.co/wueDtt1htk
492807791049179136,2014-07-25 23:05:07,SenatorBegich,8,5,Hootsuite,Can never do enough to help survivors of domestic abuse. Glad Admin. listened/fixed rule to allow access to benefits http://t.co/QKAG7osSLo
492427780366557184,2014-07-24 21:55:06,SenatorBegich,2,1,Hootsuite,ICYMI Sponsored Mental Health First Aid Bill - helps police officers/educators assist those facing mental illness http://t.co/iOaFo5Yf3J #ak
492401462882746368,2014-07-24 20:10:31,SenatorBegich,4,0,Hootsuite,"Hobby Lobby case is not about birth control; this is about personal choice, my piece in today’s @JuneauEmpire http://t.co/CXT0pXtolV #ak"
492331179111370753,2014-07-24 15:31:14,SenatorBegich,9,7,Hootsuite,"Our veterans deserve care, they earned it.  You're either for veterans or against them, it is that simple."
492331022496059392,2014-07-24 15:30:37,SenatorBegich,4,2,Hootsuite,"On the Senate floor now speaking on need to pass veterans bill. This is an emergency, we can't nickel &amp; dime our veterans."
492318381484175360,2014-07-24 14:40:23,SenatorBegich,0,1,Hootsuite,Chairing Emergency Management Cmte. today. Will detail $1.4 billion in taxpayer savings to FEMA - more info at http://t.co/sUvYGBo7pm #ak
492124543952355328,2014-07-24 01:50:09,SenatorBegich,1,0,Hootsuite,Honored to receive award w/ @RepDonYoung Thanks to members of National Guard for all the work you do for our country http://t.co/N8ouNfWq67
491718113763663872,2014-07-22 22:55:08,SenatorBegich,4,1,Hootsuite,"At VA hearing I told VA Sec Nominee McDonald to fix broken system, urged him to be bold/get right to work for vets http://t.co/yKjyaAzZkY"
491351327432536066,2014-07-21 22:37:39,SenatorBegich,3,0,Hootsuite,"Big milestone 4 @AlyeskaPipeline - 17 billion barrels/oil since 1977. Congrats, lets work on more development in #AK http://t.co/84mo6FsSVa"
490235293006454784,2014-07-18 20:42:56,SenatorBegich,0,0,Hootsuite,".@sdpryde No timeline now, but @lisamurkowski and I will keep working to get this done in the Senate."
