id,created_at,user,retweets,favorite_count,source,text
233584590462279680,2012-08-09 15:24:40,SenatorBegich,0,0,Hootsuite,I will be on @KFATMorning from 8-8:30 this a.m. Listen live here http://t.co/ybwjoOX4
233384260738899968,2012-08-09 02:08:39,SenatorBegich,1,0,Twitter for BlackBerry®,Thx to @AKNewsAndViews for a good conversation. Great stop on the #GrowingAK tour http://t.co/xJH5MSKM
233347926875848706,2012-08-08 23:44:15,SenatorBegich,0,0,Twitter for BlackBerry®,Going on the Dave Stieren show at 4pm today.Tune in here http://t.co/Lh4u60a3
233325148520980480,2012-08-08 22:13:45,SenatorBegich,1,0,Hootsuite,Kicked off my office's Growing Alaska tour yesterday.Check out our first posts from #Tok and Delta Junction  #GrowingAK http://t.co/QHrOH1vA
233281158341869568,2012-08-08 19:18:56,SenatorBegich,1,0,Hootsuite,Good luck to @JanayDeLoach who is competing right now in the long jump final in the @Olympics. Let's go #TeamUSA @USOlympic
232619328502112256,2012-08-06 23:29:04,SenatorBegich,4,0,Twitter for BlackBerry®,Securing Alaska's #Alaska energy future is the topic at our roundtable w/ #Alaska #energy companies and@ASD_SharonBurke http://t.co/jWe98vnB
232559713110351872,2012-08-06 19:32:11,SenatorBegich,1,1,Hootsuite,"Looking forward to it, too! RT @vtaylo: Looking forward to @SenatorBegich coming on @AKNewsAndViews THIS WEDNESDAY! Tune in live at 5pm!"
232532379024101376,2012-08-06 17:43:34,SenatorBegich,3,0,Hootsuite,Talking energy innovation w/@ASD_SharonBurke &amp; Chancellor Rogers in the energy labs @UAFairbanks http://t.co/xOjXx3K3
231507271308414977,2012-08-03 21:50:09,SenatorBegich,3,0,Hootsuite,"#Tanana Valley State Fair starts today.Word is that ""Age of Asparagus"" is this year's theme, and there's an extra day!"
231458551258832899,2012-08-03 18:36:33,SenatorBegich,4,0,Hootsuite,"Good luck to U.S. Olympic shooter and Alaskan, Corey Cogdell, of Eagle River who competes in the trapshooting competition tomorrow in London"
231188897625939969,2012-08-03 00:45:03,SenatorBegich,1,0,Hootsuite,Wrapped up in the Senate til Sept.Headed to #AK for all of August now to see my family &amp; gear up for a month of meetings hearing your ideas.
231162482620760064,2012-08-02 23:00:05,SenatorBegich,1,0,Hootsuite,"Spoke w/our #AK scholar in the Congressional Youth Leadership Council program,Zachary Stanley of Ketchikan today http://t.co/DgrRc40n"
231140760785940481,2012-08-02 21:33:46,SenatorBegich,2,0,Hootsuite,Thx to a great class of summer interns who have been working in my DC office.I wish them the best this school year http://t.co/h29qKG1T
230834738225614848,2012-08-02 01:17:46,SenatorBegich,3,0,Twitter for BlackBerry®,Congrats to Southcentral Foundation on the new clinic in Wasilla.More access to great health care in the Mat-Su Valley http://t.co/tuO9bKYz
229687136817913857,2012-07-29 21:17:36,SenatorBegich,3,0,Twitter for BlackBerry®,Met w/ @USCG today at Sector Anchorage Command Center on #tsunamidebris response for #Alaska Coastline. http://t.co/l67nt1e6
229685706199552001,2012-07-29 21:11:54,SenatorBegich,6,0,Twitter for BlackBerry®,Check out this tank rolling around by Homer.Its 40 ft by 16 ft.One big hunk of junk that can cause navigational hazards http://t.co/tpXu2EiO
228601955398852609,2012-07-26 21:25:28,SenatorBegich,2,0,Hootsuite,Skies over downtown Anchorage buzzing as the aircraft get ready for wknd'2012 Arctic Thunder air show. #getmetoAK @JBER_Official
228564471944187904,2012-07-26 18:56:31,SenatorBegich,1,0,Hootsuite,"Met Brett Lindsay,a cellist from East Anc HS who's in the Nat’l Symphony Orchestra's Summer Music Institute @kencen http://t.co/1pu3q377"
228504686293041153,2012-07-26 14:58:57,SenatorBegich,0,0,Twitter for BlackBerry®,Skyping in to Dan Fagan's show on Channel 4 in a few minutes
228253888745197568,2012-07-25 22:22:22,SenatorBegich,1,0,Hootsuite,Found a little piece of home I can watch from DC  http://t.co/d316oobD
228191710549774336,2012-07-25 18:15:18,SenatorBegich,7,1,Hootsuite,"Senate needs to compromise to extend #middleclasstaxcuts or 300,000 Alaskans will see a tax hike Jan. 1."
228181511118143489,2012-07-25 17:34:46,SenatorBegich,3,0,Hootsuite,Thanks to Hugh Short from Alaska Growth Capital for adding an #AK perspective to #Native issues today
227495803294466049,2012-07-23 20:10:00,SenatorBegich,3,0,Twitter Web Client,"RT @AlaskaComm: Summer of Heroes nominations are due today at 5 p.m. Don’t miss out, nominate that special youngster today: http://t.co/ ..."
227475131939819520,2012-07-23 18:47:52,SenatorBegich,5,0,Hootsuite,1-877-WAR-VETS RT@deptvetaffairs:Combat Vet?You can receive a broad range of counseling &amp; referral services at Vet Ctrs http://t.co/WcaayxR4
226473838127480832,2012-07-21 00:29:05,SenatorBegich,2,1,Twitter for BlackBerry®,Touring @BloodBankofAK and learning about their exciting expansion plans http://t.co/eiTX0vN9
226363867226320896,2012-07-20 17:12:06,SenatorBegich,3,0,Hootsuite,"My deepest sympathies and thoughts are with the victims,their families,&amp; the entire community impacted by this horrific tragedy in Colorado"
226168399594655744,2012-07-20 04:15:23,SenatorBegich,6,0,Hootsuite,"I hear @Pitbull is headed to #Kodiak,but what’s this talk of being ""exiled""? Confident the residents of #Kodiak will show him a great time"
226069006895968256,2012-07-19 21:40:26,SenatorBegich,3,0,Hootsuite,Met w/ @NOAA Sec. Lubchenco to reiterate need to work w/@WhiteHouse to secure funds for #marine #debris cleanup.Tons of trash on #AK beaches
225343806676008960,2012-07-17 21:38:44,SenatorBegich,1,0,Hootsuite,"Good to meet Thomas Sowers,nominee to be Ast Secretary@DeptVetAffairs.Looking forward to his nomination hearing tmrw http://t.co/Gh18jL2Z"
225326249025880064,2012-07-17 20:28:58,SenatorBegich,5,0,Hootsuite,Alaska was named an “All Star State” by @HeroesVote for being a leader ensuring voting rights for our service members http://t.co/wkLv0Ggc
225273307958738946,2012-07-17 16:58:36,SenatorBegich,1,0,Hootsuite,@brookingsgs Thanks for having me. Great panel.
225273160667381760,2012-07-17 16:58:01,SenatorBegich,2,0,Hootsuite,"RT @brookingsgs: I believe that if we do this right, we will empower teachers to maximize their abilities. #TechCTI - @SenatorBegich"
224971238311858177,2012-07-16 20:58:17,SenatorBegich,7,1,Hootsuite,"Congrats to Alaskans Corey Cogdell,Kelsey Campbell,&amp;Janay DeLoach who will represent the USA at the @Olympics this summer.Go USA! @USOlympic"
220961903575441411,2012-07-05 19:26:38,SenatorBegich,2,0,Twitter Web Client,Talking to locals in #Seward about the need for a port expansion and other infrastructure improvements. http://t.co/kIU8Q6qT
220651578032529409,2012-07-04 22:53:31,SenatorBegich,3,0,Twitter Web Client,Honoring the last living woman homesteader in America along with the Bureau of Land Management. http://t.co/BhxhphuC
220636534066524160,2012-07-04 21:53:44,SenatorBegich,3,0,Twitter Web Client,A wonderful time in the July 4 parade in Anchorage.  Happy Independence Day! http://t.co/ZJI6IVPS
220262712406577154,2012-07-03 21:08:18,SenatorBegich,0,0,Twitter for BlackBerry®,Giving an update on #Eielson and other Alaska highlights from DC to the Fairbanks Chamber. http://t.co/gGW8NMaj
220210545222107138,2012-07-03 17:40:59,SenatorBegich,1,0,Twitter for BlackBerry®,Looking forward to my day in Fairbanks where we’ll get the chance to talk more about the good news for #Eielson
219973891030921216,2012-07-03 02:00:37,SenatorBegich,0,0,Hootsuite,Headed to #Quinhagak for my community meeting. Looking forward to great discussion and questions.
219851299334787073,2012-07-02 17:53:29,SenatorBegich,3,0,Hootsuite,Glad to be in #Bethel to get the chance to hear first-hand about the fishery crisis impacting the Y-K region. http://t.co/1GjLULH1
218140430636818432,2012-06-28 00:35:06,SenatorBegich,1,0,Hootsuite,"Always good to see @CloseUp_DC participants.Thx to Jeff Thompson, Haley Cunningham, and Maryflo Horan for coming by http://t.co/UzC995jC"
218106744713379841,2012-06-27 22:21:14,SenatorBegich,2,0,Hootsuite,Today is Nat’l #PTSD awareness day. Need to raise awareness and support our vets @DeptVAAffairs http://t.co/F8dIpLa0
218031338056458243,2012-06-27 17:21:36,SenatorBegich,0,0,Twitter for BlackBerry®,Calling into the Bob and Mark show on KWHL in ANC.Want to give an update on the good news we got on F-16 transfer and other #AK highlights
217779341000581120,2012-06-27 00:40:15,SenatorBegich,5,2,Twitter for BlackBerry®,Got word today from the @usairforce that the move of the F-16s from #Eielson AFB is on hold. Huge win for the interior and all of #Alaska.
217688071301378048,2012-06-26 18:37:35,SenatorBegich,0,1,Twitter for BlackBerry®,Interviewing our stellar summer DC interns for July's  #Alaska Report. http://t.co/d3Q61rph
215933767850795010,2012-06-21 22:26:36,SenatorBegich,1,1,Hootsuite,Good luck @Goldpanners in the 107th Midnight Sun #Baseball Game in #Fairbanks. Wish I were there for #Solstice in #Alaska
215483454945636355,2012-06-20 16:37:13,SenatorBegich,1,0,Hootsuite,The Trans Alaska Pipeline celebrates 35 years of oil movement today! Offshore Arctic drilling this summer will put 800 mbd into TAPS
215163744853045248,2012-06-19 19:26:48,SenatorBegich,1,0,Hootsuite,Congrats to Brigit Noon who stopped by my office today. She is one of two 2012 Presidential scholars from #Alaska  http://t.co/En8vf2ce
213381460361625602,2012-06-14 21:24:39,SenatorBegich,3,0,Hootsuite,Happy 237th birthday to the United States Army!  @USArmy
213044527068479488,2012-06-13 23:05:48,SenatorBegich,1,0,Hootsuite,"Met w/Big Brother,Big Sister of #AK today.These guys do great work w/our youth in #AK.Look forward to working w/them @BBBSAlaska"
212946369483251712,2012-06-13 16:35:45,SenatorBegich,3,0,Hootsuite,"Just spoke on Senate floor re.the need to pass the Transportation bill.House must stop dragging their feet,pass the bill,&amp;let us create jobs"
212640017628151808,2012-06-12 20:18:25,SenatorBegich,1,0,Hootsuite,Thx to AK OWL Project for letting me read to kids at the Kenai Library.Glad to take time out of the day to read Alaska’s own Blueberry Shoe
211152382770417668,2012-06-08 17:47:05,SenatorBegich,2,0,Hootsuite,Glad to see Alaskans Lisa Marotti &amp; Rowena Paolmar @NNEDV congressional breakfast Wed. to combat domestic violence http://t.co/iuPZGSf2
211130274992496640,2012-06-08 16:19:14,SenatorBegich,3,0,Hootsuite,Apparently Anchorage listed as worst dressed city in US-but also listed as #3 brainiest city.Brains over beauty in #AK! http://t.co/WTWMCRMQ
210816840077815808,2012-06-07 19:33:46,SenatorBegich,2,0,Hootsuite,Red Flag exercise underway.  Interior AK is one of the best training playgrounds for some of the world's best pilots. America needs Eielson!
210552949687062528,2012-06-07 02:05:09,SenatorBegich,0,0,Hootsuite,Ready for tonight’s @NOAA fish fry and some Bering Sea crab straight from Alaska
210528414053044224,2012-06-07 00:27:39,SenatorBegich,1,0,Twitter for BlackBerry®,Crab sliders at the Bering sea crabbers booth! http://t.co/gAfYWoV0
210505452046393346,2012-06-06 22:56:25,SenatorBegich,0,0,Twitter for BlackBerry®,Chatting w/Commerce Sec. Bryson and @NOAA Admin Lubchenco at fish fry.Great crab bisque and sliders http://t.co/bUtPXUwU
210483960038424577,2012-06-06 21:31:01,SenatorBegich,1,1,Hootsuite,Thx to Diane Barrans of the AKStudent Loan Corps who visited DC to provide ideas to simplify college costs &amp; student loans #DontDoubleMyRate
210154064846143489,2012-06-05 23:40:08,SenatorBegich,1,0,Hootsuite,It’s Capitol Hill Oceans Week-should be a solid few days of awareness &amp; discussions on oceans issues important to AK. @NMSFocean  #CHOW2012
210138549016735745,2012-06-05 22:38:28,SenatorBegich,0,0,Hootsuite,Meeting w/ Alaska Children’s Alliance.Wonderful advocates for protecting AK's youth.Glad we could meet here in DC http://t.co/mdmIUyVN
210105988257284096,2012-06-05 20:29:05,SenatorBegich,27,0,Hootsuite,Working moms in #AK contribute avg of 39.9% of family income &amp; deserve #EqualPay to provide for their families.Disappointed this bill failed
210051770561474561,2012-06-05 16:53:39,SenatorBegich,2,0,Hootsuite,Voting on #PaycheckFairnessAct this afternoon.We need #EqualPay Now http://t.co/rxXJZw3h
209746712829501442,2012-06-04 20:41:27,SenatorBegich,0,0,Hootsuite,RT @shell_alaska: Read about @SenatorBegich’s tour of @Shell_Alaska’s oil rig Kulluk: http://t.co/XW7qpRcy
208638879958433793,2012-06-01 19:19:19,SenatorBegich,1,0,Hootsuite,Vietnam Vets Memorial Moving Wall is touring #AK.My staff sent me this photo from Fairbanks. Reminds us to never forget http://t.co/eGJeSabs
208454101569257472,2012-06-01 07:05:05,SenatorBegich,0,0,Hootsuite,Back in #Anchorage to celebrate Carol Comeau’s outstanding 12 years as ANC Superintendent at her retirement party
208347445858549760,2012-06-01 00:01:16,SenatorBegich,1,0,Hootsuite,Headed to the Palmer Moose Club for the Rotary Lunch.Chatting w/Rotarians always a good reminder of the importance of service &amp; volunteerism
207979791796797440,2012-05-30 23:40:21,SenatorBegich,1,0,Hootsuite,Congratulations to Judge Morgan Christen on her investiture ceremony. She will be the first AK woman to serve on the 9th Circuit
207959738162487297,2012-05-30 22:20:39,SenatorBegich,2,0,Hootsuite,"Discussing the need for anti-bullying efforts across our state w/several organizations including school districts,youth orgs and others"
207949995893211137,2012-05-30 21:41:57,SenatorBegich,0,0,Twitter for BlackBerry®,Shooting Alaska's View from the Hill now w/Sean Doogan.Watch tmrw on @KTVA
207904225466916866,2012-05-30 18:40:04,SenatorBegich,0,0,Twitter Web Client,"The ""Winning and Managing Funding"" panel discussion has begun.  Watch the event streamed live here: http://t.co/BhtEHHuO #grants #Alaska"
207870935062155266,2012-05-30 16:27:47,SenatorBegich,2,0,Twitter Web Client,Join us now as we stream live the 2012 Alaska Delegation Grants Symposium: http://t.co/BhtEHHuO #grants #alaska
207536772744351745,2012-05-29 18:19:57,SenatorBegich,0,0,Hootsuite,Taking calls for the next 45 minutes on talk of Alaska. Call in with your questions. @kska http://t.co/Lmjf2wFk
207513457061412864,2012-05-29 16:47:18,SenatorBegich,1,0,Hootsuite,I'll be taking calls and answering questions on Talk of Alaska today at 10am @KSKA
207212640945188865,2012-05-28 20:51:58,SenatorBegich,2,0,Twitter for BlackBerry®,Remembering our fallen heroes at Memorial Day service in Fairbanks. http://t.co/3LKYrKBl
207177088434839554,2012-05-28 18:30:41,SenatorBegich,1,0,Twitter Web Client,In Fairbanks for Memorial Day services. Thank you to our veterans and those serving. We are forever grateful.
206540250586157057,2012-05-27 00:20:07,SenatorBegich,0,0,Twitter for BlackBerry®,Fishermen are coming back with their catch to the dock in Petersburg. Success at the salmon derby. http://t.co/EXCV02M9
206503885693652992,2012-05-26 21:55:37,SenatorBegich,0,0,Twitter for BlackBerry®,Having a great day in Petersburg where the salmon derby is underway. http://t.co/tVb6f8Ax
206394762171912193,2012-05-26 14:42:00,SenatorBegich,0,0,Twitter for BlackBerry®,Finally back in #AK and had a town hall meeting in Ketchikan last night-good to be back http://t.co/DKyjdAkb
206109390971998208,2012-05-25 19:48:02,SenatorBegich,4,1,Hootsuite,Touring Shell's ice class drilling rig in Seattle getting ready for work this summer in the Beaufort Sea http://t.co/Jt0MQyAb
205805525986852864,2012-05-24 23:40:35,SenatorBegich,3,1,Hootsuite,Join my tele-town town hall tonight @5:30 AK time where I'll answer questions on issues that are  important to Alaska  http://t.co/dQPtGx7l
205415383006593026,2012-05-23 21:50:18,SenatorBegich,4,0,Hootsuite,"Hearing today in Foreign Relations Committee on Law of the Sea.Need to sign it ASAP to stake claim in Arctic,Gulf of AK &amp; the Bering Sea"
205299252434436098,2012-05-23 14:08:50,SenatorBegich,0,0,Hootsuite,George&amp;Flor of ANC came by before heading out w/ @PeaceCorps for 27 mo's in Armenia.Great couple representing US abroad http://t.co/yPJRd4Wd
205009136218411008,2012-05-22 18:56:01,SenatorBegich,0,0,Hootsuite,Met with Air Force CoS General Schwartz this morning to press for more info on Eielson.Should be seeing some answers but end of May
204978560962789376,2012-05-22 16:54:31,SenatorBegich,6,0,Hootsuite,Happy Birthday to @lisamurkowski!
204628724375748608,2012-05-21 17:44:24,SenatorBegich,0,0,Hootsuite,My staff in Ketchikan joined to break the the World Record for #of people at an event in rubber boots.Fell 359 short http://t.co/86PgEBWv
203589292822503424,2012-05-18 20:54:04,SenatorBegich,0,0,Hootsuite,"The Begich Minute on the @GotYour6 campaign-meaning ""I've got your back"" in military speak.To our vets:We got your 6 http://t.co/ane8y9kJ"
203561936540016641,2012-05-18 19:05:22,SenatorBegich,1,0,Hootsuite,"Chef Al, chef Patrick Hoogerhyde and chef James Dare were there to welcome it and open the season...then cook it http://t.co/VcqpG9BP"
203559375154065409,2012-05-18 18:55:11,SenatorBegich,2,0,Hootsuite,First Copper River salmon has arrived!Thx to my staff for sending these shots.Good catch for opening of Bridge Seafood  http://t.co/nTY6Vh2K
203241615194726402,2012-05-17 21:52:31,SenatorBegich,0,0,Hootsuite,@johnboozman Great piece of bipartisan legislation.
203230659991437312,2012-05-17 21:08:59,SenatorBegich,0,0,Hootsuite,The cutter...right side up this time. http://t.co/QAUGb7lI
203222885366640641,2012-05-17 20:38:06,SenatorBegich,0,0,Hootsuite,The USCGC Bernard C Webber cutter was in DC today. Got to make take a morning visit. Not a bad way to start the day http://t.co/xoAPC8iX
203147088744292353,2012-05-17 15:36:54,SenatorBegich,1,1,Hootsuite,"Chairing Subcommittee on Oceans,Atmosphere,Fisheries,&amp;Coast Guard to discuss the U.S.  response to tsuanmi debris washing up on AK's shores"
202876139306360833,2012-05-16 21:40:15,SenatorBegich,0,0,Hootsuite,Continuing to push the @usairforce for legitimate answers on an Eielson move.Read more here http://t.co/FYQiL5Dy
202832462391414784,2012-05-16 18:46:42,SenatorBegich,8,1,Hootsuite,Celebrating National Women’s Health Week by urging the House of Reps to  pass #VAWA &amp; protect women and families from domestic abuse #NWHW
202812486691454977,2012-05-16 17:27:19,SenatorBegich,38,0,Twitter Web Client,RT @womenshealth: Have you encouraged all of the women in your life to follow us on Twitter in honor of National Women's Health Week? @w ...
202799405508726785,2012-05-16 16:35:20,SenatorBegich,0,0,Hootsuite,Hey Alaskans- did you guys feel the earthquake this morning? #thingsimisswhenindc
202523797235048448,2012-05-15 22:20:10,SenatorBegich,0,1,Hootsuite,Nice to see Mayor Pat Branson and City Manager Aimee Kniaziowiski today who were in town with the City of Kodiak http://t.co/FVZDwhRd
202515071774109697,2012-05-15 21:45:30,SenatorBegich,1,0,Hootsuite,Was at a hearing w/ the Canadian House of Commons today to discuss law of the sea and fishing issues http://t.co/qyw8pHg3
202501136966623232,2012-05-15 20:50:07,SenatorBegich,0,0,Hootsuite,"Aryeh Lax of ANC,#AK winner of @PoetryOutLoud visited after competing in nat'l competition.Great example of arts in ed. http://t.co/lvA1NZDF"
202182926539046912,2012-05-14 23:45:40,SenatorBegich,5,0,Hootsuite,Congrats @AlaskanBrewing in #Juneau on 3 medals @ the World Beer Cup.Next time I'll bring some back to DC for my office http://t.co/CgebdHpq
202157914927009792,2012-05-14 22:06:17,SenatorBegich,3,1,Hootsuite,"Met w/@Oceana &amp; @AngelaKinsey of The Office to talk #seafood fraud.Thanks for wearing shoes to my office, Angela!   http://t.co/3Bs2APbA"
202138058311737345,2012-05-14 20:47:23,SenatorBegich,2,0,Hootsuite,Stopping by meeting with Oceana to discuss seafood fraud. Did you know that 25-70% of fish is mislabeled? @Oceana
202102081853734913,2012-05-14 18:24:25,SenatorBegich,2,0,Hootsuite,"Huge news for @AlaskaAir: DOT announced that they were selected to provide service from DCA  to Portland, OR"
202085941240799234,2012-05-14 17:20:17,SenatorBegich,0,0,Hootsuite,"Back in DC after a busy weekend in #AK.Honored Military Members,Out of Darkness Suicide Prevention Walk, &amp; Tanana Valley Farmers Market."
201773022007394304,2012-05-13 20:36:51,SenatorBegich,2,0,Hootsuite,"Here's my Mother's Day greeting to mom's everywhere, especially my mom and my wonderful wife Deborah http://t.co/k7S337WV"
201446646385606656,2012-05-12 22:59:57,SenatorBegich,0,0,Hootsuite,Great event today. Glad to be a part of this statewide effort to honor our military. http://t.co/AuyJ60NN
201444490358169601,2012-05-12 22:51:23,SenatorBegich,1,0,Hootsuite,Had the chance to get signatures for my Eielson petition at the STOMP parade in Fairbanks today http://t.co/jgPLS81x
201132107890835459,2012-05-12 02:10:06,SenatorBegich,2,0,Hootsuite,Looking forward to sharing my appreciation at the annual Alaska Police Memorial Day ceremony in Anchorage.
201118704308731904,2012-05-12 01:16:50,SenatorBegich,0,0,Twitter for BlackBerry®,"Taking calls on the Mike Porcaro show, 650 AM http://t.co/MfOQYR8m"
201091993680609280,2012-05-11 23:30:42,SenatorBegich,0,0,Hootsuite,I'll be taking calls on AM 650 on the Mike Porcaro Show in Anchorage from 4:30 to 5:30 tonight.
201040152603279362,2012-05-11 20:04:42,SenatorBegich,1,0,Hootsuite,This week’s Begich Minute: #DontDoubleMyRate http://t.co/jzLmGxtq
201021638014275584,2012-05-11 18:51:07,SenatorBegich,3,0,Hootsuite,It’s Military Spouse Appreciation Day. Thxto AK's military spouses for their sacrifice &amp; support of our servicemembers http://t.co/fhhWATWQ
200729723385548800,2012-05-10 23:31:10,SenatorBegich,4,1,Hootsuite,"Congratulations to Ahmad Nasir, West Point cadet from Anchorage, for being named a distinguished 2012 Truman Scholar."
200718234482262016,2012-05-10 22:45:30,SenatorBegich,1,0,Hootsuite,Looking forward to having our summer interns start. Congrats and welcome aboard! http://t.co/glZRysGK
200688995322171392,2012-05-10 20:49:19,SenatorBegich,2,0,Hootsuite,Thank you for your support @gotyour6. Looking forward to working with you. Did you know AK has more vets than any other state?
200670384729763840,2012-05-10 19:35:22,SenatorBegich,0,0,Hootsuite,We need answers for the Fairbanks community immediately. Still keeping my hold on @airforce general until we see the analysis.
200667486805442560,2012-05-10 19:23:51,SenatorBegich,1,0,Hootsuite,Had a meeting in my office with Sec.of Defense Leon Panetta this morning to discuss Eielson proposal and need for analysis
200269364556070912,2012-05-09 17:01:51,SenatorBegich,0,0,Twitter for BlackBerry®,On now with KBBI listen in here http://t.co/0fmQBSzB
200259818538287104,2012-05-09 16:23:56,SenatorBegich,1,0,Hootsuite,"I’ll be on KBBI/KDLL at 9AM Alaska time to give Kenai, Soldotna, and Homer an update from the U.S. Senate @KBBINews @Pickle_Hill"
200246346601594880,2012-05-09 15:30:24,SenatorBegich,0,0,Hootsuite,Thx for sharing your stories.Keep 'em coming help me tell Congress not to double rates. Baffling how this is even a fight #DontDoubleMyRate
200237719253815297,2012-05-09 14:56:07,SenatorBegich,9,2,Hootsuite,Heading to the Senate floor around 11 am EST to urge Senate to pass the student loan fix. #DontDoubleMyRate
199983340747632640,2012-05-08 22:05:18,SenatorBegich,1,0,Hootsuite,Signed a Mother's Day card for @_MealsonWheels who are delivering to seniors in Alaska who can't leave their home http://t.co/mVg6uuJg
199963281312591873,2012-05-08 20:45:36,SenatorBegich,0,0,Hootsuite,Met w/ Captain Havlik of the @USCG Icebreaker Healy-last meeting was on the cutter itself.My office = way less cool http://t.co/nkmK5ecl
199901438481137664,2012-05-08 16:39:51,SenatorBegich,2,0,Hootsuite,Do you have a student loan story to share?How would doubling the rate affect you?Share your story here http://t.co/vvDD9AUp...
199900908719583233,2012-05-08 16:37:45,SenatorBegich,2,0,Hootsuite,Senate is voting now on a student loan fix so interest rates don't double July 1.The minority is filibustering this common sense bill.
199622199085244416,2012-05-07 22:10:15,SenatorBegich,2,0,Hootsuite,Mark your calendars- my office and @LisaMurkowski and @RepDonYoung are hosting a grant symposium on May 30 in Anchorage http://t.co/foAullc1
199541366391447552,2012-05-07 16:49:03,SenatorBegich,2,0,Hootsuite,Happy Teacher Appreciation Week. A big thank you to all the teachers in #AK and the inspiration they give students everyday  #thankateacher
198193005927202817,2012-05-03 23:31:09,SenatorBegich,1,0,Hootsuite,I'll be live tonight @7PM AK time on Channel 2 to discuss the impact of the Air Force’s proposal to move the F16’s from Eielson @KTUU
198155034305904640,2012-05-03 21:00:16,SenatorBegich,0,0,Hootsuite,Had a great meeting with our up and coming medical providers at the WAMI program in Anchorage. http://t.co/CApjRMGr
198126147446382592,2012-05-03 19:05:29,SenatorBegich,1,0,Hootsuite,Good luck to Alexa B. from North Pole who is the finalist in Google's Doodle contest. You can see her doodle here http://t.co/767kmSPR
198098858276962304,2012-05-03 17:17:02,SenatorBegich,0,0,Hootsuite,"Great NewsRT @shell_alaska: “After years of hard work &amp; investment, Alaskans will now see a new era of development starting in the Arctic."""
197845601440899073,2012-05-03 00:30:41,SenatorBegich,1,0,Hootsuite,Great to catch up on Alaska's issues with Sean Doogan on KTVA's Alaska's View from the Hill. @KTVA http://t.co/9BgX1i39
197805592818094080,2012-05-02 21:51:43,SenatorBegich,1,0,Hootsuite,I'll be on the Dave Stieren Show on KFQD 750 this afternoon at 3:45pm AK time @DaveStierenShow @KFQD
197801491543756800,2012-05-02 21:35:25,SenatorBegich,1,0,Hootsuite,I'll be on the Dave Stieren Show on KFQD 750  this afternoon at 3:35pm AK time @DaveStierenShow @KFQD
