id,created_at,coordinates,retweets,favorite_count,source,text
687003699185582084,2016-01-12 20:10:20,,1,3,Twitter Web Client,Our vets are paying price for VA mismanagement. Hope a new IG will provide accountability for VA policies &amp; mgmt. https://t.co/lJPnUMlFNy
686966795903827974,2016-01-12 17:43:42,,17,19,Twitter Web Client,"Tonight is the president's last #StateOfTheUnion speech. Americans want results, not the same failed rhetoric. #SOTU https://t.co/e8gET8Bwid"
686652815817715712,2016-01-11 20:56:03,,1,0,Twitter Web Client,A look ahead at my 2016 legislative priorities: https://t.co/w2iy1O8x03
686600265718468608,2016-01-11 17:27:14,,2,2,Twitter Web Client,My staff will be in Watertown tomorrow between 10am-1pm at the public library. Please stop by if you need help dealing w/ a fed. agency.
685198838945177604,2016-01-07 20:38:28,,8,8,Twitter for iPhone,Great turnout at my Rapid City coffee today. Thanks to everyone who attended! https://t.co/3CqLnldRGo
685184499160903680,2016-01-07 19:41:29,,4,0,Twitter for iPhone,RT @CharlesSDPB: A packed house in Rapid City where @SenatorRounds is hearing from the public. More later on @SDPBNews https://t.co/3VUvKsb…
685157200646508544,2016-01-07 17:53:00,,4,7,Twitter for iPhone,Stopped in for breakfast with Rick at Wall Drug this morning. Great food &amp; conversation! https://t.co/v122ozS1h8
685143328980103168,2016-01-07 16:57:53,,3,3,Twitter for iPhone,If you're in the Rapid City area today please stop by my coffee at the University Center between 11:30-12:30. Look fwd to hearing from you!
685139201944338432,2016-01-07 16:41:29,,4,2,Twitter for iPhone,"Quick ""pit stop"" at the Pit Stop on our way to Rapid City today. https://t.co/lbL2ziaC9P"
685096023597907969,2016-01-07 13:49:55,,6,4,Twitter for iPhone,Happy birthday to my friend and colleague @SenJohnThune!
684867756941012993,2016-01-06 22:42:52,,2,3,Twitter for iPhone,Talking with @RickKnobe this afternoon on @ViewpointU: https://t.co/dHYe1kT0qP
684843126075293697,2016-01-06 21:04:59,,4,0,Twitter Web Client,I'll be in-studio today on @KSOO1140 @ViewpointU at 4pm CT talking with @RickKnobe. Tune in! https://t.co/iG4LKRXzGx
684821696004665345,2016-01-06 19:39:50,,4,4,Twitter Web Client,Thanks to everyone who came to coffee in Sioux Falls today! https://t.co/6CYUunC7LT
684784435250761728,2016-01-06 17:11:46,,1,1,Twitter for iPhone,"If you are in Sioux Falls today, pls stop by my coffee event at the main branch of SF public library between 12:30-1:30. See you there!"
684757371068018688,2016-01-06 15:24:14,,7,5,Twitter Web Client,Today marks my 1-year anniversary working as your senator. It's been a great year and I'm looking forward to 2016! https://t.co/ttqKSLdbc1
684524044297891842,2016-01-05 23:57:04,,10,0,Twitter for iPhone,RT @USChamber: Americans now spend more than 3 billion hours every year filing #tax returns https://t.co/h891aI2JUs
684449437901545472,2016-01-05 19:00:37,,5,5,Twitter Web Client,My statement on President Obama's gun control executive actions: https://t.co/sZTWnjJMZC
684430983073001472,2016-01-05 17:47:17,,4,7,Twitter Web Client,"We had a great turnout at our Pierre ""Coffee &amp; Conversation"" event this morning. Thanks to everyone who stopped by! https://t.co/Akvin0B8kl"
684398390914998272,2016-01-05 15:37:46,,6,5,Twitter Web Client,"I'm holding coffee events across the state this week. If you're in the area, please stop by! https://t.co/gEFQIDCPzs"
684023037730144256,2016-01-04 14:46:15,,3,1,Twitter Web Client,Our outreach event in Brookings tmrw has been postponed. Pls call my SD offices if you need help w/ a fed. agency. https://t.co/EZ4XimLjj7
682670154388520960,2015-12-31 21:10:22,,4,10,Twitter for iPhone,Wishing all South Dakotans a healthy and happy 2016. https://t.co/wBkXnUajNj
681928183680077824,2015-12-29 20:02:03,,3,0,Twitter for iPhone,"RT @DavisonCo_VSO: Jan 6, 2015 ""Coffee and Conversation with Mike Rounds"" @SenatorRounds 
12:30-1:30pm @ Sioux Falls Public Library Main Br…"
681927797707673600,2015-12-29 20:00:31,,3,3,Twitter for iPhone,Join us now on @todayskccr! https://t.co/nSzCyKAPNW
681910906478051328,2015-12-29 18:53:24,,3,1,Twitter Web Client,I'll be live on @todayskccr at 2pm CT. Tune in or listen online at https://t.co/ebNAowmQ5H
681515525625655296,2015-12-28 16:42:17,,5,2,Twitter for iPhone,Read my weekly column: New Year's resolutions for the Senate: https://t.co/9WtcyxAuAO
680403635772112901,2015-12-25 15:04:02,,5,10,TweetDeck,Special thanks to all service men &amp; women who are unable to spend the holiday w/ loved ones. Merry Christmas to all. https://t.co/Bu3ZTEerJb
679415280951365633,2015-12-22 21:36:40,,1,0,Twitter for iPhone,RT @argusleader: .@SenatorRounds My Voice column: My first year as your senator https://t.co/a7GzqgrFev
678969885922336769,2015-12-21 16:06:50,,4,5,Twitter Web Client,"We have so many #Christmas traditions, but here are a few of my favorites. https://t.co/iu28n5DFlm"
677871078182535174,2015-12-18 15:20:33,,3,3,Twitter Web Client,We have a lot to be thankful for this #Christmas. Jean and I wish you a merry Christmas &amp; happy new year. https://t.co/XRjLeHAnN2
677609305164619777,2015-12-17 22:00:22,,5,0,Twitter Web Client,RT @SenJohnThune: Joined @SenatorRounds in introducing legislation ensuring tribal veterans get the care they have earned and deserve. http…
677583251549065217,2015-12-17 20:16:50,,2,5,Twitter Web Client,#TBT Grandpa Don &amp; Rosemary sharing the #christmas story w/ the kids https://t.co/n1AkCtIyyk
677548863914422274,2015-12-17 18:00:12,,6,10,Twitter Web Client,We now have the flags from all 9 tribal nations in SD in my DC office. https://t.co/lDnqdK8Bj9
677529727393992712,2015-12-17 16:44:09,,3,0,Twitter for iPhone,RT @RepKristiNoem: Grateful to join @SenatorRounds @SenJohnThune in writing the 155th Engineering Company this Christmas. #thankyou 🇺🇸 http…
677239788542513152,2015-12-16 21:32:02,,0,0,Twitter Web Client,I'll be on @ViewpointU with @RickKnobe today around 4:10 p.m. CT. Tune in! You can also listen online https://t.co/Meypz1Wz01
677155413767405568,2015-12-16 15:56:46,,6,4,Twitter Web Client,Wishing you all a very merry Christmas! #CapitolChristmasTree #tistheseason https://t.co/IBmJ7uS6CQ
677127900181749760,2015-12-16 14:07:26,,3,1,Twitter Web Client,"Due to the weather, my Aberdeen office will be closed today."
676891193301594113,2015-12-15 22:26:51,,3,0,Twitter for iPhone,I'll be live on @WNAX today around 5:10 pm CT. Tune in or listen online at  https://t.co/pDpaaAf0wg
676782026356338690,2015-12-15 15:13:03,,4,0,Twitter Web Client,I'll be asking questions shortly at our Senate Armed Services hearing. Watch live here: https://t.co/4w4eyr8aIx
676580371450888195,2015-12-15 01:51:45,,6,10,Twitter for iPhone,The Rounds home is ready for #Christmas! Jean has been cross stitching for 30+ yrs &amp; made these decorations https://t.co/FfdwEBiVsl
676499691295649792,2015-12-14 20:31:09,,9,1,Twitter Web Client,"A GAO report found that the @EPA engaged in ""covert propaganda,"" a violation of federal law, to push #WOTUS:   https://t.co/Jr2VSw3hOz"
675068369440231424,2015-12-10 21:43:36,,4,3,Twitter Web Client,A healthy economy is dependent on a strong and reliable transportation system. https://t.co/DIGhaFEKNy
675054798132133888,2015-12-10 20:49:40,,6,11,Twitter Web Client,"#TBT Celebrating Christmas with Jean, Chris, Carrie &amp; Brian  #tistheseason https://t.co/pcGFXVoGrx"
675009297550561280,2015-12-10 17:48:52,,3,2,Twitter Web Client,"Thanks to @belfrageshow for having me on this A.M. If you missed it, you can listen to our convo online @keloradio https://t.co/53Y0hSbGUe"
674980171192115200,2015-12-10 15:53:07,,6,12,Twitter Web Client,Proud to live in a state that consistently ranks in the top 10  for volunteering #SouthDakota #givingback https://t.co/6AfKP800LQ
674681945624834048,2015-12-09 20:08:05,,6,11,Twitter Web Client,My DC staff and I collected toys for the Senate Veterans’ Affairs Committee’s #ToysForTots drive today #christmasjoy https://t.co/MyYjynzjOz
674625545569705985,2015-12-09 16:23:58,,7,2,Twitter Web Client,"Senate just passed bipartisan #education bill, #ESSA. Sent to POTUS to sign into law. https://t.co/SFXeyEzzvH https://t.co/wAm7k9LAh1"
674618056753201154,2015-12-09 15:54:13,,3,2,Twitter Web Client,Our #SASC hearing with @DeptofDefense Sec. Ash Carter on ISIL strategy is being streamed live here: https://t.co/sh9LW2DlpN
674583124488101888,2015-12-09 13:35:24,,11,34,Twitter for iPhone,Congrats @SDState men's basketball team on your win last night! #gojacks
674332964453502976,2015-12-08 21:01:21,,4,5,Twitter Web Client,"Joined @SenJohnThune, @RepKristiNoem, @SDGovDaugaard &amp; @TimReisch in a letter urging USAF to base new fighter in SF: https://t.co/4gVAPMaZoJ"
674308816893292546,2015-12-08 19:25:24,,12,6,Twitter Web Client,Today @SenJohnThune and I joined @JohnCornyn's letter to POTUS insisting he use add'l military options to fight ISIS https://t.co/XbQePyjdHu
674234624399249408,2015-12-08 14:30:35,,8,0,Twitter Web Client,"RT @SenJohnMcCain: Heading to #SASC hearing on improving #Pentagon policy, strategy &amp; plans - watch live: https://t.co/lYdcSfpabI"
674011329796132865,2015-12-07 23:43:18,,3,1,Twitter Web Client,The nonpartisan Congressional Budget Office projects 2 million fewer jobs under #Obamacare: https://t.co/6VqoP5jUu6
673931512534929408,2015-12-07 18:26:08,,3,4,TweetDeck,Happy #Hanukkah to everyone who is celebrating! https://t.co/pVSePvRQVc
673877355304218624,2015-12-07 14:50:56,,11,8,TweetDeck,"Dec. 7, 1941, ""a date which will live in infamy."" Today we honor those who lost their lives at #PearlHarbor https://t.co/BparfRdRfW"
672797921809707008,2015-12-04 15:21:39,,2,1,Twitter Web Client,Worked hard to fix the misguided crop insurance cut and am very pleased it was fixed in the #FASTAct last night.
672792881044848640,2015-12-04 15:01:37,,3,1,Twitter Web Client,"Last pm, the Senate passed National Bison Legacy Act, which I cosponsored, to adopt the North American bison as national mammal of the U.S."
672782386610982912,2015-12-04 14:19:55,,3,2,Twitter Web Client,"The American people deserve a healthcare system that works for them, not against them, and is actually affordable. https://t.co/ioy8xL8PDW"
672598699026030592,2015-12-04 02:10:00,,2,2,Twitter Web Client,Great news for rural South Dakota.  https://t.co/IYAggNc4qk
672597762668634113,2015-12-04 02:06:17,,4,3,Twitter Web Client,Long-term highway bill heads to the president's desk: https://t.co/y01lzNHRuF
672596338274619392,2015-12-04 02:00:37,,0,0,Twitter Web Client,Legislation to repeal #Obamacare passes Senate: https://t.co/slGND8WVo2
672520680290807808,2015-12-03 20:59:59,,3,6,Twitter Web Client,The Senate just voted 90-10 to stop Obamacare’s #CadillacTax on high-cost health care plans
672181355694854144,2015-12-02 22:31:38,,10,9,Twitter Web Client,My heart goes out to the families and friends of the victims of today’s horrific attack in California.
672117806767427584,2015-12-02 18:19:07,,4,7,Twitter Web Client,Sent cards to men &amp; women in uniform who are far away from their families this holiday season @RedCross #HolidayMail https://t.co/cXjTlE6AWV
671837630871568385,2015-12-01 23:45:47,,1,0,Twitter Web Client,I'll be live on @KOTARadio momentarily. Tune into 1380AM or listen live here: https://t.co/yXcWzx1Fg9
671834450968358913,2015-12-01 23:33:09,,1,3,Twitter Web Client,"Congratulations, @SenJoniErnst, on your retirement from the National Guard after 20+ years of service. Thank you for serving our country!"
671832443092140032,2015-12-01 23:25:11,,1,0,Twitter Web Client,I'll be live on @KOTARadio this evening at 4:45 p.m. MT. Be sure to tune in! You can listen online at https://t.co/yXcWzx1Fg9
671825585035939840,2015-12-01 22:57:56,,4,4,Twitter Web Client,Two resolutions I cosponsored to stop the #EPA's harmful climate regs are headed to @POTUS' desk after passing the House today.
671723208404529152,2015-12-01 16:11:07,,4,3,Twitter Web Client,South Dakota is a beautiful place to live! Great video by 605 Studios: https://t.co/mgKxtCothQ
671426965291859972,2015-11-30 20:33:57,,4,11,Twitter Web Client,View outside my office in downtown Sioux Falls today. Stay safe out there! https://t.co/KUEuYvpCwb
671420895152443392,2015-11-30 20:09:50,,3,0,Twitter Web Client,The @DeptVetAffairs extended public comment period on changes to Black Hills Health Care System after our request https://t.co/MB3L3hRNYc
669625716527472640,2015-11-25 21:16:26,,5,9,TweetDeck,Wishing all South Dakotans a Happy Thanksgiving. https://t.co/0DHBPwBZ4j
669299481423253504,2015-11-24 23:40:06,,7,0,Twitter for iPhone,"RT @southdakota: The #RushmoreMascots are in NYC, look out for them at the @Macys Thanksgiving Day Parade! #Thanksgiving #TravelTuesday #Ma…"
669282504604545024,2015-11-24 22:32:38,,1,2,Twitter Web Client,"In a few moments, I will talk to @KSOO1140's @RickKnobe. Listen live here: https://t.co/qr4MnT5FLX"
669274381802037249,2015-11-24 22:00:21,,1,2,TweetDeck,"I'll be live on @ViewpointU with @RickKnobe today at 4:30pm CT to talk about ISIS, refugees &amp; more. Listen here: https://t.co/xXMtibstJl"
669236644172574720,2015-11-24 19:30:24,,2,0,TweetDeck,I'll be on @todayskccr radio around 2 p.m. CT today. Tune in! You can also listen online at https://t.co/7zYYM6QTo0
669212910950998016,2015-11-24 17:56:06,,4,0,TweetDeck,RT @SDAgriculture: New SD Dept. of Ag #SDAgChat programs with @SenatorRounds and VP at @USMEF are available. https://t.co/4fFfK5p3cW https:…
669161937180172288,2015-11-24 14:33:32,,4,2,Twitter Web Client,My office in Aberdeen is open today &amp; my staff there is happy to assist if you need any help dealing w/ a federal agency.
668092025686790144,2015-11-21 15:42:06,,6,5,TweetDeck,"Today’s #NatAdoptionDay! Let’s raise awareness for the 108,000 + kids in the US needing to find safe, loving homes. https://t.co/x9jRAusP4m"
667729803261444096,2015-11-20 15:42:45,,3,3,Twitter for iPhone,Enjoy the opportunity to address @SDFarmBureau at their annual convention this morning. https://t.co/az3Wx2qXVz
667729525657239552,2015-11-20 15:41:39,,2,0,Twitter for iPhone,RT @SDFarmBureau: @SenatorRounds says he opposed cuts to crop insurance in President's budget &amp; he opposes them now #SDFB15
667729500172587008,2015-11-20 15:41:33,,1,0,Twitter for iPhone,RT @SDFarmBureau: @SenatorRounds is right: crop insurance is a safety net that allows for ongoing &amp; steady food production in U.S. #SDFB15 …
667715002778939392,2015-11-20 14:43:56,,0,1,Twitter for iPhone,I'm live on @keloradio right now. Tune in!
667457849522593793,2015-11-19 21:42:06,,1,0,Twitter Web Client,South Dakotans – and all Americans – stand united with France after last week’s terror attacks in Paris. https://t.co/tgYFE72gCb
667384334706417665,2015-11-19 16:49:59,,2,3,Twitter Web Client,Today is #RuralHealthDay! I'd like to take a moment to thank the rural health care providers all across South Dakota. #powerofrural
667340643656728578,2015-11-19 13:56:22,,9,9,Twitter Web Client,"On this day in 1863, Abraham Lincoln delivered his famous #Gettysburg Address. #OTD https://t.co/KOwW5hzzYM"
667097647245864960,2015-11-18 21:50:47,,5,0,Twitter for iPhone,"RT @FederalTimes: ""As our enemy threats grow, we must be even more diligent in our defense."" @SenatorRounds #CyberCon2015"
667091970746163200,2015-11-18 21:28:14,,5,3,Twitter for iPhone,Enjoyed speaking about the future of cyber security at #CyberCon2015 today. https://t.co/6zfRNRgvso
667024575746674688,2015-11-18 17:00:26,,6,3,Twitter Web Client,Got to meet w/ students from McIntosh High School today during their trip to D.C. https://t.co/QaL4EuBIbW
666994688180752385,2015-11-18 15:01:40,,7,5,Twitter Web Client,Thanks to @AirForceAssoc @MitchellStudies for inviting me to speak this AM about the Long Range Strike Bombers #LRSB https://t.co/IXMdfCF0e0
666767877265993728,2015-11-18 00:00:24,,1,2,TweetDeck,Had the opportunity to question VA Inspector General nominee Michael Missal today. Click link to watch video: https://t.co/wBrnFe14Xq
666762060877979648,2015-11-17 23:37:17,,3,3,Twitter Web Client,Voted today to put a stop to this administration's costly energy regulations. https://t.co/znjY7SLBMv
666753465021038593,2015-11-17 23:03:08,,1,0,Twitter Web Client,I'll be on @WNAX this evening around 5:15 p.m. CT. Tune in or listen online at https://t.co/vsrKFJSJeo
666726978775588864,2015-11-17 21:17:53,,4,3,Twitter Web Client,Obama’s AG confirms that transferring #GTMO detainees to U.S. is against the law: https://t.co/pbfk8xIrjj
666706615240957952,2015-11-17 19:56:58,,3,4,Twitter Web Client,"Happy birthday, Chairman!  https://t.co/HFhu908DDf"
666701903754108928,2015-11-17 19:38:15,,4,2,Twitter Web Client,Sent letter to @POTUS requesting Admin be 100% sure that no refugees coming to US are members or supporters of ISIS https://t.co/OwgcY3g5QP
666682852625502209,2015-11-17 18:22:33,,5,1,Twitter Web Client,"A member of my Rapid City staff, Adam, and his wife Hayley share their #adoption adventure w/ @kotatweets. https://t.co/nEiUJqQkZg"
666392235953508353,2015-11-16 23:07:44,,2,0,Twitter Web Client,RT @KSOO1140: SD's congressional delegation is asking #VA to extend comment period on study on closing Hot Springs VA. https://t.co/K3VOENo…
665540321950896128,2015-11-14 14:42:32,,5,17,Twitter for iPhone,Big day in South Dakota as the @usd       @GoJacksFB football teams prepare to face off. Are you doing anything special for the game?
665308975055962112,2015-11-13 23:23:15,,11,12,Twitter for iPhone,Sending prayers to Paris.
665257921425580036,2015-11-13 20:00:23,,2,0,Twitter Web Client,Joined @KellyAyotte in a letter to @POTUS urging for more transparency on Guantanamo detainees: https://t.co/3Y4d8Rowjw
665176512858075137,2015-11-13 14:36:53,,1,2,Twitter Web Client,"On Wednesday, we said ""thank you"" to our vets. Now it's time to make sure we keep the promises we made to them. https://t.co/d5ZkYiep3f"
664894796696322048,2015-11-12 19:57:27,,4,0,Twitter Web Client,RT @SenatorEnzi: #Wyo Delegation sent letter w/ @SenatorRounds to extend comment time on Black Hills Health Care System redesign. https://t…
664846062482563075,2015-11-12 16:43:48,,2,10,Twitter Web Client,Fall weekends in South Dakota are for hunting #TBT https://t.co/G4VIYx56TU
664842253039439872,2015-11-12 16:28:39,,10,0,Twitter Web Client,RT @SDHighwayPatrol: On Tuesday the national Christmas Tree came through South Dakota. It originated from Chugach National Forest. https://…
664809072529666048,2015-11-12 14:16:49,,2,1,Twitter Web Client,My Aberdeen office will be open from 10-2 today. Please stop in if you need any help dealing w/ federal agencies. https://t.co/4A20SiqOpO
664461617761923072,2015-11-11 15:16:09,,5,9,Twitter for iPhone,Every freedom we have is because of our #veterans &amp; current service men and women. #ThankAVet #VeteransDay https://t.co/Yiakyq15Ku
664207674943414272,2015-11-10 22:27:04,,1,1,Twitter Web Client,Sent letter to #VA Sec requesting extended comment period on reconfiguration of Black Hills Health Care System https://t.co/eE6EwxmR78
664168811877281792,2015-11-10 19:52:39,,3,4,Twitter Web Client,Happy 240th Birthday to the @USMC! Thank you to those who serve. #SemperFi https://t.co/0BlUNSeT4b
664157999733342212,2015-11-10 19:09:41,,2,0,Twitter Web Client,"Senate is finally doing its job to pass approps bills. MilCon/VA supports vets, service members and their families https://t.co/JZphlZfPg5"
664148658863153152,2015-11-10 18:32:34,,16,0,Twitter for iPhone,RT @SenJeffMerkley: TODAY—Joined @SenatorRounds @MarkWarner @SenThomTillis to introduce bipartisan bill that would improve veterans care ht…
664132330559287296,2015-11-10 17:27:41,,3,5,Twitter Web Client,"Pleased the Senate just passed #NDAA w/ bipartisan support, 91-3. Important bill for our current troops &amp; vets. https://t.co/3RQOhBl0LT"
664130543630557185,2015-11-10 17:20:35,,11,0,Twitter Web Client,RT @MarkWarner: Pleased to join @SenJeffMerkley @SenatorRounds @SenThomTillis to intro commonsense @DeptVetAffairs hiring bill https://t.co…
664127726823960576,2015-11-10 17:09:23,,5,5,Twitter for iPhone,"With @SenJeffMerkley, @SenThomTillis and @MarkWarner to introduce our Veterans Health Care Staffing Improvement Act https://t.co/XO41btnorx"
664121421040349184,2015-11-10 16:44:20,,6,4,Twitter for iPhone,Our bill will cut bureaucratic barriers for VA health care providers so they can provide better care to our vets.  https://t.co/yOBoGg3c8Z
663744906578522112,2015-11-09 15:48:12,,4,3,Twitter Web Client,I was on @FoxNews this weekend to talk about the President's rejection of #KeystoneXL https://t.co/3XS5wFVcWn
663732099271294977,2015-11-09 14:57:18,,2,0,Twitter Web Client,I'll join @OnPointRadio to discuss @POTUS' rejection of #KeystoneXL pipeline at the top of the hour. Listen live: https://t.co/AE0A8Y61wQ
663052414010830848,2015-11-07 17:56:29,,5,1,Twitter for iPhone,Tune in: at the top of the hour I'll be live on @FoxNews to discuss #KeystoneXL
662680769287073792,2015-11-06 17:19:42,,7,5,Twitter Web Client,. @POTUS' rejection of #KeystoneXL is disappointing. Read my full statement here: https://t.co/PgRNT1uWkR
662636045276749824,2015-11-06 14:21:59,,6,2,Twitter Web Client,Please take a moment to say 'thank you' to a veteran next week #veteransday https://t.co/wOtyskFRRe
662408463306383361,2015-11-05 23:17:39,,5,1,Twitter Web Client,"Today, a resolution I sponsored recognizing Nov. as ""National Native American Heritage Month"" passed the Senate: https://t.co/sGjttQwyTj"
662350065533628416,2015-11-05 19:25:36,,2,1,Twitter Web Client,South Dakotans can read the #TPP trade agreement on my website &amp; send me thoughts/concerns. https://t.co/TxkgxqENzR
662323339353001984,2015-11-05 17:39:24,,2,0,Twitter Web Client,"Senate Dems blocked another approps bill today, this time to fund our troops. https://t.co/NIAuT2KLud #SupportOurTroops"
662268907080851457,2015-11-05 14:03:06,,4,2,Twitter for iPhone,Thanks to @TheHillEvents for hosting @SenGaryPeters and me this morning to discuss #NextGenPay https://t.co/ZtZIu8aXhv
662263642407194624,2015-11-05 13:42:11,,5,4,Twitter for iPhone,With @SenGaryPeters and @TheHillEvents this morning to discuss payments technology. https://t.co/94Wpc97qtl
662262903500906496,2015-11-05 13:39:15,,12,0,Twitter for iPhone,RT @TheHillEvents: WATCH: @BobCusack sits down w. Co-Chairs of the Payments Innovation Caucus @SenatorRounds @SenGaryPeters https://t.co/Wo…
661946772995096577,2015-11-04 16:43:03,,2,2,Twitter Web Client,Thank you to @ACCFmedia for your support of our bipartisan #SenateRegsCaucus! https://t.co/Qkvo30159b
661642467440242689,2015-11-03 20:33:51,,2,0,Twitter Web Client,"RT @KDLTNews: Rounds Reacts To TransCanada’s Effort To Stop Pipeline Permit
@SenatorRounds 
https://t.co/zBCXMkCkWZ https://t.co/2FxkreFUHx"
661587046763483136,2015-11-03 16:53:38,,6,0,Twitter Web Client,RT @SenJoniErnst: Joined @SenatorRounds in calling for renewed and strengthened support of Kurdish Peshmerga forces: https://t.co/H43JCDwRSb
661586097189818368,2015-11-03 16:49:51,,9,9,Twitter Web Client,#WOTUS is one of the largest land grabs in U.S. history. Proud cosponsor of bill to stop it. #DitchTheRule https://t.co/w4oc4q9o1B
661553270482161664,2015-11-03 14:39:25,,3,2,Twitter Web Client,"Thanks to @HealthInFocus for naming me a ""Champion of Healthcare Innovation"" this year! #HLCexpo"
661316053994196993,2015-11-02 22:56:48,,4,3,Twitter Web Client,Today I joined @SenJoniErnst in a letter calling for strengthened support of Kurdish Peshmerga forces in Iraq: https://t.co/06MjYrx4Nv
661191868609335297,2015-11-02 14:43:20,,52,39,Twitter Web Client,Happy Birthday South Dakota! https://t.co/SRxnej4ple
659799199958044672,2015-10-29 18:29:22,,2,1,Twitter Web Client,Perkins loans help many SD students thrive. I joined bipartisan group of sens to extend the program. #saveperkinsnow https://t.co/mmC5No9Wf1
659438751391858689,2015-10-28 18:37:04,,6,3,Twitter Web Client,"Thanks to Roger Porch, VP of First National Bank in Philip, SD, for testifying today on issues facing rural banks https://t.co/i0Wb8n1un6"
659368499769417728,2015-10-28 13:57:55,,2,2,Twitter Web Client,Heading to a @BankingGOP hearing where I will introduce SD banker Roger Porch as a witness. Watch live here: https://t.co/zVr3FRDSZF
659107088161984517,2015-10-27 20:39:10,,2,2,Twitter Web Client,Thx to Sec. Moniz for meeting today to discuss the research being done at @SanfordLab. https://t.co/4ZsJ4lKRpY https://t.co/toPBhNjsZU
659084147164651520,2015-10-27 19:08:00,,2,0,Twitter for iPhone,"RT @todayskccr: Make sure to tune into AM 1240 @todayskccr and online at https://t.co/zR0NAtTR8K at 2:00 P.M. for ""Ask The Senator"" with @S…"
659080440075198468,2015-10-27 18:53:16,,1,0,Twitter Web Client,I'll be live on @todayskccr today at 2 p.m. CT. Tune in or listen online at https://t.co/m4Q4zfMbak
659061818690809856,2015-10-27 17:39:17,,3,0,Twitter Web Client,RT @TheHillEvents: Look fwd to hearing from @SenatorRounds on future of tech &amp; keeping consumer data safe. Register now: https://t.co/G6LP8…
659035817571196928,2015-10-27 15:55:57,,6,4,Twitter Web Client,"Looking fwd to co-chairing the new Senate Regulations Caucus with @SenRonJohnson, @SenAngusKing &amp; @Sen_JoeManchin. https://t.co/TqOrlqdYVj"
659024735792156672,2015-10-27 15:11:55,,9,5,Twitter Web Client,Pleased to join @SenCapito &amp; @SenatorHeitkamp on resolution to overturn #CleanPowerPlan rules. https://t.co/DALatSQayh
658992563064586240,2015-10-27 13:04:05,,1,0,Twitter Web Client,My staff will hold office hours at the Mitchell City Hall today from 10am-2pm. Please stop in if you need help dealing w/ a fed. agency
