id,created_at,coordinates,retweets,favorite_count,source,text
820015752338149379,2017-01-13 21:12:45,,2,8,Twitter Web Client,House just passed first step toward repealing #Obamacare
819659927354535936,2017-01-12 21:38:49,,1,5,Twitter Web Client,Questioned Gen. Mattis on #sequestration and military readiness during today's confirmation hearing.… https://t.co/U3Y8pC8RDm
819652399736430594,2017-01-12 21:08:55,,2,0,Twitter Web Client,"RT @KSOO1140: Take a look at the thoughtful discussion at the HUD hearings with Dr. Ben Carson and @SenatorRounds . 

https://t.co/i5tJnX9x…"
819631993839386626,2017-01-12 19:47:50,,3,8,Twitter Web Client,I was pleased to hear Dr. Carson's commitment to addressing housing concerns on tribal lands during today's hearing. https://t.co/9r4yJfRhGL
819585001662521345,2017-01-12 16:41:06,,3,10,Twitter Web Client,Look forward to supporting Dr. Carson today. #CarsonHearing
819584732329545733,2017-01-12 16:40:01,,18,48,Twitter Web Client,"Dr. Carson and I talked about housing priorities in SD, especially in our tribal communities.I thank Dr. Carson for taking on this role."
819584568261017602,2017-01-12 16:39:22,,3,9,Twitter Web Client,Had the chance to meet w/ Dr. Carson recently to talk about his vision for #HUD going forward. https://t.co/wU9MwNkcDl
819584449092481024,2017-01-12 16:38:54,,2,3,Twitter Web Client,Just started my questioning at Dr. Ben Carson’s confirmation hearing to be #HUD Secretary
819550857062715392,2017-01-12 14:25:25,,3,6,Twitter Web Client,Gen. Mattis served 44 years in the @USMC. Most recently was commander of the U.S. Central Command.
819550529755955201,2017-01-12 14:24:07,,285,894,Twitter Web Client,"During Gen. Mattis’ meeting in my office, he showed keen geostrategic awareness that is crucial to rebuilding our armed forces."
819550417432563712,2017-01-12 14:23:40,,2,2,Twitter Web Client,"Met w/ Gen. Mattis last week to talk #CyberSecurity, F-35, B-21 and more. He understands need to wisely invest in our defense."
819550168639033345,2017-01-12 14:22:41,,4,4,Twitter Web Client,On my way to @SASCmajority confirmation hearing for General James Mattis. You can stream it here: https://t.co/BnPK3bwogt
819546562066006016,2017-01-12 14:08:21,,2,1,Twitter Web Client,Thanks for having me on! https://t.co/OrpPtPLWCt
819538986918178817,2017-01-12 13:38:15,,2,0,Twitter for iPhone,RT @keloradio: NOW @belfrageshow US Sen Mike Rounds @SenatorRounds Lots and lots to talk about with a busy day in DC!
819529362517139456,2017-01-12 13:00:00,,2,1,TweetDeck,"Tune into @keloradio around 7:40CT! I'll be talking w/ @belfrageshow about #obamacare, #HotSpringsVA &amp; more. https://t.co/29dqRFsNWK"
819289947828011018,2017-01-11 21:08:39,,1,12,Twitter Web Client,.@SenatorSessions will reinstate the rule of law at DOJ. I look forward to supporting his nomination in the full Senate.
819243242474635266,2017-01-11 18:03:04,,0,1,Twitter for iPhone,I'll be live with @TeamCavuto on @FoxBusiness around 12:15 CT. Tune in!
819192991147507712,2017-01-11 14:43:23,,0,3,Twitter Web Client,Honored to be presented with the 2017 Fueling Growth Award from @GrowthEnergy this morning! https://t.co/e3pEpbUCSl
819184631849373696,2017-01-11 14:10:10,,2,2,Twitter Web Client,We're holding staff office hours in Miller today from 11am-12:30pm in the council chamber at City Hall. Stop by to meet w/ Josh!
818948367598452736,2017-01-10 22:31:20,,2,4,Twitter Web Client,Met w/ Army Corps of Engineers for update on snowpack levels along Missouri River. We'll continue to monitor runoff https://t.co/VwGKNEA8w2
818908720814059521,2017-01-10 19:53:48,,2,0,Twitter Web Client,RT @RiponAdvance: .@SenatorRounds and @RepKristiNoem reintroduce bill to expand Black Hills National Cemetery in South Dakota https://t.co/…
818828969080287232,2017-01-10 14:36:53,,4,9,Twitter Web Client,"I’ve had the privilege to work w/ @SenatorSessions the past 2 years – find him to be smart, principled &amp; hardworking."
818828783687868419,2017-01-10 14:36:09,,3,4,Twitter Web Client,.@SenatorSessions confirmation hearing with @senjudiciary is underway to be our nation’s next Attorney General. https://t.co/v51w08mXJs
818648939423469570,2017-01-10 02:41:31,,3,6,Twitter for iPhone,ICYMI: Democrat Gov says #Obamacare ‘is no longer affordable.’ #RealCare #RepealObamacare https://t.co/cFWtSBzX82
818648475554418688,2017-01-10 02:39:40,,2,9,Twitter for iPhone,Even former president Bill Clinton says #Obamacare is the ‘craziest thing in the world.’ Time for patient-centered health care #RealCare
818647352835764229,2017-01-10 02:35:13,,2,4,Twitter for iPhone,Pay for housing or pay for healthcare? Some families face that difficult question under #Obamacare: https://t.co/vlS9WCx6xK
818646668904202240,2017-01-10 02:32:30,,13,6,Twitter for iPhone,"According to CBO, #Obamacare costs taxpayers $116B/yr. Meanwhile, nearly 5 mill Americans lost the coverage they enjoyed."
818645911307976708,2017-01-10 02:29:29,,4,3,Twitter for iPhone,"While #SenateDems hold a talk-a-thon to defend #Obamacare, SDans on the exchange are facing 37% premium increases for '17."
818645307240181760,2017-01-10 02:27:05,,3,1,Twitter for iPhone,"Under #Obamacare, Americans face costly premiums &amp; deductibles-need more affordable health care choices. We need #RealCare"
818568259637112838,2017-01-09 21:20:56,,5,7,Twitter Web Client,I was on @NPR @1a this morning talking about cyber security. You can listen to the podcast here: https://t.co/vDC3Bmf3sH
818565446475640833,2017-01-09 21:09:45,,5,12,Twitter Web Client,Today is #LawEnforcementAppreciation Day. Thank you to the men and women who keep us safe every day!
818564352206917636,2017-01-09 21:05:24,,52,0,Twitter Web Client,RT @SenateGOP: The average deductible for a mid-level Obamacare plan increased more than $500 in one year. #RepealObamacare https://t.co/RQ…
818534033240051712,2017-01-09 19:04:55,,2,3,Twitter Web Client,We're accepting internship applications for this summer! Apply online by Feb. 17th. https://t.co/zjfbAtSSWe
818493788381446145,2017-01-09 16:25:00,,1,4,Twitter Web Client,SD vets interested in competing in the National Veterans Golden Age Games can submit applications until March 1st https://t.co/JfU70FZe28
817396564884738054,2017-01-06 15:45:02,,4,6,TweetDeck,I joined @SenRubioPress and @SenatorCardin in a resolution objecting to the #UN resolution that condemned Israeli settlement construction.
817385062232682496,2017-01-06 14:59:19,,5,5,Twitter Web Client,Joined @SquawkCNBC this morning to talk about need for a clear strategy to defend ourselves against hostile cyber-a… https://t.co/HbdFG2Wmjp
817367328488910848,2017-01-06 13:48:51,,2,0,Twitter Web Client,RT @tartantroozers: US needs a clear definition of when a #cyber attack 'constitutes an act of war @SenatorRounds https://t.co/x2qK9rgK4z
817360970309898241,2017-01-06 13:23:35,,3,5,Twitter Web Client,ICYMI: The Obamacare ship is sinking. Americans deserve #RealCare https://t.co/PLBALiGmpP via @dailyrepublic
817345999056281601,2017-01-06 12:24:06,,4,3,Twitter for iPhone,I'm on @SquawkCNBC around 6:30 CT this morning. Hope you can tune in!
817341114978107392,2017-01-06 12:04:41,,11,62,Twitter for iPhone,I'll be on @foxandfriends this morning to talk #CyberSecurity. Tune in around 6:15 CT.
817151462878965762,2017-01-05 23:31:05,,0,5,Twitter Web Client,Happy birthday today to @charlierose! @CBSThisMorning is lucky to have you on their team.
817064025632768000,2017-01-05 17:43:38,,1,3,Twitter Web Client,SD delegation &amp; @SenatorEnzi reintroduced bill to expand boundary of the Black Hills National Cemetery today. https://t.co/4akbpJJTsv
817036007749062656,2017-01-05 15:52:18,,1,3,Twitter Web Client,"South Dakota was named the nation's ""Top Moving Destination"" this year! #GreatFacesGreatPlaces #HiFromSD https://t.co/Dsp89yXpr8"
817022311677231104,2017-01-05 14:57:53,,4,7,Twitter Web Client,"Met w/ Defense Secretary nom General James Mattis today to discuss wide range of topics, including #CyberSecurity.… https://t.co/WQgK7dWC4v"
816794033737650176,2017-01-04 23:50:47,,3,10,Twitter Web Client,Great meeting w/ @ScottPruittOK today to discuss our shared goal of reining in an overly-expansive EPA. Looking for… https://t.co/2wKFLgenP4
816763861906944000,2017-01-04 21:50:54,,12,37,Twitter Web Client,Thanks to @Linda_McMahon for taking the time to meet with me today to discuss the importance of small businesses in… https://t.co/rFGMvnZ8PZ
816410505095114753,2017-01-03 22:26:47,,2,0,Twitter Web Client,"RT @keloradio: Thune, Rounds, Noem: back to work in new world https://t.co/1Za5gngYGp"
816381689404354560,2017-01-03 20:32:17,,2,11,Twitter Web Client,It's a privilege to serve with @SenJohnThune in the Senate. Honored to join him as he was sworn in today. https://t.co/Ztbq3TQrvj
816357248402419712,2017-01-03 18:55:09,,3,3,Twitter Web Client,Congratulations to @SpeakerRyan on being reelected Speaker of the House today. Looking forward to a productive #115thcongress
816345758488203264,2017-01-03 18:09:30,,1,0,Twitter for iPhone,"RT @ChrisSDPB: @SenatorRounds is in the moment...on SDPB radio @SDPBNews @SDPB 
Listen: https://t.co/GlJ2RkRTiZ"
816342997159870469,2017-01-03 17:58:32,,0,2,Twitter Web Client,Congratulations to my #Senate colleagues who were sworn in today. Looking forward to working with you during the #115thcongress
816338085520625665,2017-01-03 17:39:01,,1,0,TweetDeck,I'll be on @SDPB today around noon CT to talk cyber security &amp; what we're hoping to get done in the 115th Congress. https://t.co/NJrr6XOJ3i
816325267555811328,2017-01-03 16:48:05,,3,0,Twitter for iPhone,"RT @SoDakPB: We're IN THE MOMENT with  Senator Mike Rounds, historian Jon Lauck  &amp; author John Nixon. @SenatorRounds @jlauck1941 @johnnixon…"
816277836868841475,2017-01-03 13:39:36,,7,2,Twitter Web Client,ICYMI: My @FoxNews op-ed on the urgent need to develop a strategy to protect Americans from cyber threats: https://t.co/94aqNEabrt
814164135122501632,2016-12-28 17:40:30,,9,0,Twitter Web Client,RT @danlederman: Great moment with my daughter @StellaLederman as @SenatorRounds places the candles with @Chabad Rabbi Mendel Alperowitz at…
813799089917874176,2016-12-27 17:29:57,,0,0,Twitter Web Client,"As a member of the Senate Vets' Committee, I will continue working to help families like the Dymocks of Rapid City. https://t.co/tkGJkkz1s8"
813765823026364417,2016-12-27 15:17:45,,2,6,Twitter Web Client,Yesterday I wrote President-elect Trump's @EPA nominee Scott Pruitt to urge him to restore order at EPA. https://t.co/R8acjctwFG
812793729933344768,2016-12-24 22:55:00,,3,12,TweetDeck,Wishing you and yours a very merry #Christmas and a happy #Hanukkah! https://t.co/rp3N5qGfeY
812345379685548032,2016-12-23 17:13:25,,1,1,Twitter Web Client,One of our favorite Christmas traditions is having Grandpa Don read the story of #Christmas to all the kids. Watch: https://t.co/JprA2NiyQp
811693505735196672,2016-12-21 22:03:06,,1,1,Twitter Web Client,I'll be talking with @RickKnobe on @ViewpointU today around 4:10 CT. Tune in or listen online at https://t.co/L3n4rpyNpo
811230682298990592,2016-12-20 15:24:01,,0,1,TweetDeck,Mobile office hours in Woonsocket today from 10-11:30 am at the Woonsocket Community Center. Stop by to meet w/ Josh!
809782987420303360,2016-12-16 15:31:23,,2,2,Twitter Web Client,My weekly column: Investing in infrastructure is an investment in the future.  https://t.co/oas1IIu3ui
809465240735748096,2016-12-15 18:28:47,,2,6,Twitter Web Client,Had a great time catching up with members of the Winner Rotary Club this afternoon! https://t.co/CP3Eic4PKX
809153625721282560,2016-12-14 21:50:32,,8,24,Twitter for iPhone,The SD Army National Guard 196th Maneuver Enhancement Brigade returned home after a 10 month deployment to Kuwait.… https://t.co/lwjqZnVg9d
808694972698464256,2016-12-13 15:28:00,,1,1,TweetDeck,We're holding mobile office hours in #BelleFourche today from 2-4. Stop by City Hall to meet w/ Adam.
808688729728675841,2016-12-13 15:03:12,,0,5,Twitter Web Client,The @NationalGuard celebrates 380 years today! We're grateful to all who serve #AlwaysReady #AlwaysThere
807264318748233729,2016-12-09 16:43:06,,34,0,Twitter Web Client,RT @amyklobuchar: Led group of 23 senators with @SenatorRounds calling on @DeptVetAffairs to follow the law &amp; ensure all vets get covered f…
807232587290869760,2016-12-09 14:37:01,,0,0,TweetDeck,Staff are holding office hours in #Custer today from 11-1 at the Veterans Service Office in Custer Court House. Stop by!
807214750220357633,2016-12-09 13:26:08,,2,4,Twitter Web Client,.@amyklobuchar and I led a bipartisan effort urging the #VA to protect vets from exorbitant emergency room bills: https://t.co/LtJEwkdG4M
806961794522685440,2016-12-08 20:40:59,,11,53,Twitter Web Client,"Saddened to hear of the passing of John Glenn, a space frontiersman and dedicated public servant. Sending his family our thoughts &amp; prayers."
806923093134295040,2016-12-08 18:07:11,,1,1,Twitter Web Client,Senate just passed #NDAA w/ strong bipartisan support. NDAA is one of the most important bills we pass each year. https://t.co/nPP3nzfCFr
806920230198874112,2016-12-08 17:55:49,,1,0,Twitter Web Client,"RT @belfrageshow: PODCAST: @SenatorRounds on spending bill, praise for Trump's cabinet picks and Dakota Access Pipeline!  https://t.co/5vYu…"
806906251376545792,2016-12-08 17:00:16,,1,4,Twitter for iPhone,"Thanks, @SenatorHeitkamp for the #SecretSanta gift! It will fit in well with my office decor. https://t.co/vt8yTcTqbg"
806862283133583360,2016-12-08 14:05:33,,2,1,Twitter Web Client,I'll be live on @keloradio @belfrageshow in about 25 minutes. Hope you can tune in! Listen online at https://t.co/29dqRFsNWK
806646075213942785,2016-12-07 23:46:25,,1,1,Twitter Web Client,ICYMI: Earlier today I spoke on the #Senate floor to discuss my work as @EPWMaj Oversight Subcommittee Chairman: https://t.co/9c7hv9THDt
806639364965101569,2016-12-07 23:19:45,,2,1,Twitter Web Client,I'm speaking on the #Senate floor right now about my time spent chairing #EPW Oversight Subcommittee. Tune in @cspan https://t.co/8m1xr7ZExh
806559712586113024,2016-12-07 18:03:15,,3,7,Twitter for iPhone,Today we commemorate the brave men and women who lost their lives at #PearlHarbor 75 years ago.… https://t.co/QuBMRSbGl0
806541767625555968,2016-12-07 16:51:56,,21,112,Twitter Web Client,Had a good meeting w/ Dr. Ben Carson today to talk about his ideas for making the Dept. of Housing &amp; Urban Developm… https://t.co/xoZASQiasI
806501663896965120,2016-12-07 14:12:35,,2,2,Twitter Web Client,ICYMI: SD delegation battles to keep #HotSpringsVA open via @dailyrepublic https://t.co/uDjXQYfecH
806176727949000705,2016-12-06 16:41:24,,0,3,Twitter Web Client,".@SenJohnThune, @RepKristiNoem &amp; I met w/ VA Sec. McDonald this AM to hear about his recent visit to #HotSpringsVA https://t.co/7Lhw1bCOaO"
804750660470185988,2016-12-02 18:14:43,,3,7,Twitter for iPad,Thank you to our first responders. Praying for those trapped. https://t.co/kDx4MtCGll
804727338671996928,2016-12-02 16:42:03,,0,1,Twitter Web Client,Check out my column this week on the Electoral College. https://t.co/oYHCpngznt https://t.co/A7ateZjXP5
804704303747334144,2016-12-02 15:10:31,,21,70,Twitter Web Client,It's been a privilege to serve with this great group of freshmen senators for the past 2 years. Looking forward to… https://t.co/EceLxNge9T
804690336685654016,2016-12-02 14:15:01,,1,2,TweetDeck,Adam from my Rapid City office will be in #Lemmon today from 10-noon to meet w/ residents. He'll be at City Hall in the City Council Chamber
804406055728009217,2016-12-01 19:25:23,,3,5,Twitter Web Client,The Senate just passed an extension of the Iran Sanctions Act. We will continue to put pressure on the largest state sponsor of terror.
804088185303289862,2016-11-30 22:22:17,,2,6,Twitter Web Client,The #VA has a legal obligation to comply w/ Veterans' Emergency Care Fairness Act. Spoke on the floor today to urge… https://t.co/ESdCF5ohBl
804065378611712000,2016-11-30 20:51:39,,11,48,Twitter Web Client,Congrats! #GoJacks https://t.co/zrAwNz2rpu
804060063136698370,2016-11-30 20:30:32,,0,0,Twitter Web Client,Heading to the #Senate floor now to urge the VA to comply w/ the law when it comes to veterans' ER payments. Tune into C-SPAN II to watch.
804056286405021699,2016-11-30 20:15:31,,18,62,Twitter Web Client,Writing cards to our troops serving overseas this holiday season. Thank you for your service! #HolidayMailForHeroes… https://t.co/8qBw3ufcAr
803726827021828101,2016-11-29 22:26:22,,0,0,Twitter Web Client,I'll be on @WNAX this evening around 5:10 CT. Hope you can tune in! https://t.co/pDpaazXpEI
803680204753371140,2016-11-29 19:21:07,,0,2,Twitter Web Client,I'll be live on @todayskccr at 2 p.m. CT today. Listen online at https://t.co/7zYYM78uMA
803625177355427841,2016-11-29 15:42:27,,3,0,Twitter Web Client,RT @HeardontheHill: .@SenatorRounds' office is decorating for the holidays! Are you? https://t.co/ud9Kcnrq3S
803564404876972032,2016-11-29 11:40:58,,1,1,Twitter for iPhone,I'll be live momentarily on @SquawkCNBC for any early risers who wish to tune in.
802611375210196992,2016-11-26 20:33:58,,11,0,Twitter for iPhone,RT @SenJohnThune: You never know who you'll run into on the SD prairie in late November @SenatorRounds @SDGovDaugaard @pheasants4ever https…
802530101975883776,2016-11-26 15:11:01,,2,6,TweetDeck,"Today is #SmallBizSat. You can support local businesses in your communities by shopping small today, and every day! #ShopSmall"
802170229350481920,2016-11-25 15:21:00,,2,1,TweetDeck,We need to change our #budget process to make programs like #SocialSecurity more efficient. Read more: https://t.co/6Gylek1KHA
801795510281453568,2016-11-24 14:32:00,,9,43,TweetDeck,Jean and I wish all South Dakotans a very happy Thanksgiving! https://t.co/2qL6kTvWn7
801577073433264128,2016-11-24 00:04:01,,1,4,TweetDeck,#Thanksgiving is a special time for us to show gratitude for all the blessings in our lives. Read my column here: https://t.co/rFwOvRsTWb
800706918511677440,2016-11-21 14:26:20,,2,3,Twitter Web Client,We're holding constituent outreach hours at the #Huron Library from 10 a.m.-noon today. Stop by to meet with Josh!
799975528505569280,2016-11-19 14:00:03,,3,8,TweetDeck,"On #NationalAdoptionDay, let's spread the word about the 100k+ kids in the U.S. waiting to find their forever famil… https://t.co/RXhAAln5ba"
799616755794591744,2016-11-18 14:14:25,,1,2,Twitter Web Client,Our #Aberdeen office will be closed today due to the storm. Pls contact one of our other #SD offices for assistance. https://t.co/4A20SiqOpO
799615750893957120,2016-11-18 14:10:25,,15,0,Twitter Web Client,RT @shawncable: Travel conditions continue to deteriorate quickly. Here are some SD DOT cams from around the region. . #sdwx https://t.co/G…
799613772977569792,2016-11-18 14:02:34,,2,3,Twitter Web Client,Hoping everyone is staying safe and warm today. Please be careful on the roads. #WinterStormArgos https://t.co/NM6ICxcR93
799307096684687360,2016-11-17 17:43:56,,5,13,Twitter for iPhone,Wearing #purple today to show my  support for #WorldPancreaticCancerDay. #InItTogether https://t.co/jjbwq1kCiD
799262320274776067,2016-11-17 14:46:01,,0,0,TweetDeck,Good morning! Staff are holding mobile office hours in #Miller today from 10-noon in the Council Room at City Hall.
799014335821598720,2016-11-16 22:20:37,,1,0,Twitter for iPhone,RT @KSOO1140: Time to get back to business as @SenatorRounds breaks down the agenda through year's end.
799006844006125569,2016-11-16 21:50:51,,0,0,Twitter Web Client,I'll be calling into @ViewpointU with @RickKnobe today around 4:10 CT. Tune in at https://t.co/Meypz1Wz01
798993904330768384,2016-11-16 20:59:26,,2,0,Twitter Web Client,"RT @ACCFmedia: ACCF roundtable ""Improving the Federal Regulatory System"" w/@SenatorLankford @SenatorRounds &amp; @SenAngusKing https://t.co/1Ju…"
798986118452506624,2016-11-16 20:28:29,,1,5,Twitter Web Client,We had a great conversation. Thanks for stopping by our office today! https://t.co/RZFxTkttdy
798923827677921283,2016-11-16 16:20:58,,5,11,Twitter Web Client,Look fwd to working w/ @SenateMajLdr @SenJohnThune @SenCoryGardner @SenJohnBarrasso @RoyBlunt @JohnCornyn as they lead our #GOP caucus!
798628543718682624,2016-11-15 20:47:37,,7,18,Twitter Web Client,Proud to be from a state that values the importance of giving back to our communities. South Dakota ranks #4 in… https://t.co/YyqUcMdcnA
798614346108731393,2016-11-15 19:51:12,,1,5,Twitter Web Client,Congrats to @SpeakerRyan on being unanimously chosen to be #speaker. Look forward to working with you again in the next Congress!
798611645064945664,2016-11-15 19:40:28,,0,1,Twitter Web Client,South Dakotans can request tickets to the 58th Presidential #Inauguration on my website https://t.co/3VCwB79KCJ. Deadline is Dec. 16th.
798541088558645248,2016-11-15 15:00:06,,3,2,TweetDeck,"We're holding mobile office hours at Rosholt Community Center from 11-1 today. Open to the public, so please stop by!"
798517278954364928,2016-11-15 13:25:29,,3,1,Twitter Web Client,I'll be on the @belfrageshow this morning around 8:35 CT. Tune in on @keloradio https://t.co/29dqRFsNWK
796824734768001024,2016-11-10 21:19:55,,2,3,Twitter Web Client,"This morning, the VA issued its final environmental impact statement on the veterans facility in Hot Springs https://t.co/QG49pHX87k"
796741092599275520,2016-11-10 15:47:33,,2,2,Twitter Web Client,Happy 241st birthday @USMC!
796739363522674688,2016-11-10 15:40:41,,2,5,Twitter Web Client,"During the month of November, we shine a light on men’s health issues. #Movember2016 #TBT https://t.co/39tUoRe1Bm"
796702955521134592,2016-11-10 13:16:01,,1,2,TweetDeck,My staff will be in #Highmore today from 8-10am to meet w/ residents. Stop by D&amp;K Outpost to speak with Rebecca!
795652280355880960,2016-11-07 15:41:00,,0,0,TweetDeck,My staff member Josh is holding office hours at the Watertown Public Library from 10:30 am-noon today. Stop by!
794903095213953024,2016-11-05 14:04:01,,19,43,TweetDeck,"Our new #nationalmammal, the #bison, is a symbol of America's strength &amp; resilience. Happy National Bison Day! https://t.co/vf8E6t6VfB"
794234654643589120,2016-11-03 17:47:52,,11,16,Twitter Web Client,"The last time the @Cubs won the #WorldSeries, Teddy Roosevelt was president. #TBT https://t.co/KMVk9fpwfL"
794181338287009792,2016-11-03 14:16:00,,0,3,TweetDeck,Erin from my Pierre office is holding office hours at the #Faulkton Economic Development Office today from 10-noon. Stop by!
793866881505628160,2016-11-02 17:26:28,,8,14,Twitter Web Client,Today is #SouthDakota statehood day! https://t.co/xZrOQbNAas
793827004747354112,2016-11-02 14:48:01,,1,1,TweetDeck,"My staff is holding office hours in #Brookings today from 11am-1pm at the City/County Gov't Center, Rm 211. Stop by!"
793579370275188736,2016-11-01 22:24:00,,0,0,TweetDeck,I'll be live on @KOTARadio around 4:45 MT today. Tune in at https://t.co/BnThal2uEH!
793146232541700096,2016-10-31 17:42:52,,1,4,Twitter Web Client,Wishing all South Dakotans a safe and happy Halloween! https://t.co/gDgR6aBVkX
792182249970028544,2016-10-29 01:52:21,,16,0,Twitter for iPhone,"RT @SenateGOP: Must read by @SenatorRounds: ""The (Un)Affordable Care Act"" via @bhpioneer #ObamacareFail #TruthTeam https://t.co/4Uk7RmlTAo"
791661124206915584,2016-10-27 15:21:35,,7,3,Twitter Web Client,#ACA premiums expected to increase 37% for South Dakotans in '17. Need a better plan that all Americans can afford. https://t.co/CLoY45STQO
791641099731435520,2016-10-27 14:02:00,,1,2,TweetDeck,"If you're around #LakePreston today, stop by the community room at City Hall from 10-noon to meet with my staff member, Josh."
791276447444922368,2016-10-26 13:53:00,,0,2,TweetDeck,My staff is holding office hours at the #Milbank City Hall today from 10 am-noon.
791030578007121920,2016-10-25 21:36:01,,0,1,TweetDeck,I'll be live on @WNAX today around 5:10 CT. Tune in at https://t.co/kP3POMuGP4
790538586298912769,2016-10-24 13:01:01,,2,2,TweetDeck,My staff will be in De Smet today from 10-noon to meet with residents. Stop by the Event and Wellness Center!
789462898968031232,2016-10-21 13:46:37,,3,3,Twitter Web Client,The month of October is #CyberSecurityAwarenessMonth https://t.co/mFR5EGI4XD
789097306918424577,2016-10-20 13:33:53,,2,8,Twitter Web Client,What a great group of students at @usd! Spoke with them during their political science class yesterday in… https://t.co/YJ1lIY2Kts
788850713149394944,2016-10-19 21:14:00,,2,1,TweetDeck,I'll be live on @ViewpointU on @KSOO1140 today at 4:40 CT. Tune in at https://t.co/L3n4rphc0O
788808030049726464,2016-10-19 18:24:24,,4,8,Twitter Web Client,Enjoyed meeting with students &amp; faculty at #Wagner Community School today! It is the largest Prek-12th grade school… https://t.co/XsafEOk5js
787769130162225152,2016-10-16 21:36:11,,3,14,Twitter for iPhone,Today's crew with Grandpa Don. Hutch's Cafe in Presho afterward is a tradition. #openingweekend #HuntinSD… https://t.co/Sec8CdGbE6
787660545948323840,2016-10-16 14:24:42,,4,17,Twitter for iPhone,Opening weekend with all four of our kids - all hunters! https://t.co/3RxWzSkULi
787002456584687616,2016-10-14 18:49:42,,5,7,Twitter Web Client,Hope SD #hunters have a safe &amp; successful weekend! #SDinthefield #HifromSD #pheasantseason https://t.co/qbc4vZTS7O https://t.co/jNVqiu0Nc8
786952272110579712,2016-10-14 15:30:17,,12,0,Twitter for iPhone,"RT @RSkjonsberg: Happy 69th Birthday Jimmy Soyer. A GREAT public servant, mentor and one of my favorite humans. https://t.co/r644Kn79Ke"
786645034871521281,2016-10-13 19:09:26,,0,2,Twitter Web Client,Wishing the @USNavy a happy birthday today. Thanks to all who serve. #241NavyBday https://t.co/iboD4M26Xd
