id,created_at,user,retweets,favorite_count,source,text
82231714780413952,2011-06-18 23:42:23,SenatorBegich,2,0,Hootsuite,RT @sewardcitynews: Begich's Mobile Office Coming http://cli.gs/wLW2J
82223805870780416,2011-06-18 23:10:57,SenatorBegich,5,0,Hootsuite,Kenai has been awarded the title of All-American City. They won it before in 1992. Congrats! #Kenai #Alaska
81840578605748224,2011-06-17 21:48:09,SenatorBegich,0,0,Hootsuite,@adndotcom got it wrong in today's paper. I voted against ethanol subsidies. They aren’t needed anymore.
81822503210729472,2011-06-17 20:36:19,SenatorBegich,1,0,Hootsuite,"I'm speaking at #NN11 right now. The panel is on broadband: ""Connecting Everybody"" Photo: http://ow.ly/i/d65j"
81787696258891776,2011-06-17 18:18:00,SenatorBegich,1,0,Hootsuite,#FF @AlaskaStateFair 68 Days until the State Fair kicks off
81744413851783168,2011-06-17 15:26:01,SenatorBegich,2,0,TweetDeck,RT @ChildrensMN: @SenatorBegich : We need to make sure patients have access to life-saving treatments
81739552632483840,2011-06-17 15:06:42,SenatorBegich,1,0,TweetDeck,RT @ChildrensMN: Sen. Klobuchar and @SenatorBegich have arrived at @ChildrensMN for this morning's press conference about a shortage of  ...
81495797287489536,2011-06-16 22:58:06,SenatorBegich,0,0,Hootsuite,My staff and @LisaMurkowski's staff participated in Kenai's Camp K. It recognizes kids of deployed military families http://ow.ly/i/d3f4
81470646856597504,2011-06-16 21:18:10,SenatorBegich,3,2,Hootsuite,Prepare yourself for future earthquakes with tips from the Alaska Division of Homeland Security: http://owl.li/5jGh8
81470281260089344,2011-06-16 21:16:43,SenatorBegich,1,1,Hootsuite,Track earthquakes in Alaska through the Alaska Earthquake Information Center: http://owl.li/5jGcQ
81444572135301120,2011-06-16 19:34:33,SenatorBegich,19,0,Twitter Web Client,"RT @Ch2KTUU: According to NOAA, that was a 5.2 magnitude earthquake centered 50 miles southwest of Anchorage at 11:06 a.m. Tsunami not e ..."
81428899053060097,2011-06-16 18:32:17,SenatorBegich,0,0,Hootsuite,Check out the new addition to the walls in @RepDonYoung's office. Our photo from the State of the Union: http://owl.li/5jxNc
81406176922836992,2011-06-16 17:01:59,SenatorBegich,2,1,Hootsuite,@MarkUdall Thanks for letting me join the Colorado Conference this morning #COCapConf
81405825901543424,2011-06-16 17:00:35,SenatorBegich,0,0,Hootsuite,"I started today by meeting with CEOs from some of our nation's largest companies. We talked jobs, jobs and #jobs. #Alaska"
81166623997833216,2011-06-16 01:10:05,SenatorBegich,2,0,Hootsuite,The Anchorage International Film Festival @ANCFF is officially accepting submissions for the 2011 festival: http://owl.li/5iQj6
81151606653059072,2011-06-16 00:10:25,SenatorBegich,1,0,Hootsuite,Today I hosted Unalaska's mayor and city manager. Photo: http://owl.li/5iQ1N
81137101378297856,2011-06-15 23:12:47,SenatorBegich,2,0,Hootsuite,Students spent time with @LisaMurkowski & me as part of @NationalHistory Photos: http://owl.li/5iPYD http://owl.li/5iPZi
81085712732135424,2011-06-15 19:48:35,SenatorBegich,0,0,Hootsuite,Unalaska's mayor and city manager dropped by for a meeting today Photo: http://owl.li/5iH4c #Alaska
81034301394788352,2011-06-15 16:24:17,SenatorBegich,0,0,Hootsuite,"RT @glaciernps: Looks like a spectacular start to the day. Many roads to drive, trails to hike, flowers to sniff & pictures to take. (dr)"
81033698794942466,2011-06-15 16:21:53,SenatorBegich,1,0,Hootsuite,"Sharon Leon retired from the Anchorage Youth Court. Thanks for all you've done, Sharon Photo: http://ow.ly/i/cZ5F"
80791643875315713,2011-06-15 00:20:03,SenatorBegich,1,0,Hootsuite,"Students from Palmer, King Cove & Eagle River visited as part of the Conference of the America Water Works Association: http://owl.li/5hRSr"
80766480672751616,2011-06-14 22:40:04,SenatorBegich,0,0,Hootsuite,Craig's Mayor Millie Schoonover visited me in D.C. today Photo: http://owl.li/5hRQp
80728050211364864,2011-06-14 20:07:21,SenatorBegich,0,0,Hootsuite,Bethel hosted its first Run for Women over the weekend. Thanks to all the runners across #Alaska: http://owl.li/5hLnf
80689748766752768,2011-06-14 17:35:09,SenatorBegich,2,0,Hootsuite,Today is Flag Day. Celebrate by flying your American flag proudly. Learn the history here: http://owl.li/5hCxf
80625365646716928,2011-06-14 13:19:19,SenatorBegich,0,0,Hootsuite,@USArmy Happy 236th Birthday!
80402827226251265,2011-06-13 22:35:02,SenatorBegich,1,0,Hootsuite,Congrats: Jordan Clarke is the first Alaskan to become an NCAA Division I track and field champion (Shot Put): http://owl.li/5gILh
80398035330400256,2011-06-13 22:16:00,SenatorBegich,1,0,Hootsuite,Alaska’s “athletes” are hitting the softball field in DC as my office plays @LisaMurkowski’s office on the National Mall.
80385212189650944,2011-06-13 21:25:02,SenatorBegich,1,0,Hootsuite,The Alaska Botanical Garden in Anchorage is in bloom. Here’s information about visiting: http://owl.li/5gIIp
80365095733035008,2011-06-13 20:05:06,SenatorBegich,1,0,Hootsuite,Folks told me @ANHC had Alaska Native dancers featured on the Weather Channel today. Good media day for Alaska.
80346903635697665,2011-06-13 18:52:49,SenatorBegich,1,0,Hootsuite,The Bethel 4-H Youth Center goes the extra mile by providing meals to hungry kids: http://owl.li/5gI0x #Alaska #AK
80270041014222848,2011-06-13 13:47:23,SenatorBegich,3,0,Hootsuite,Ma'o Tosi & AK Pride were featured by @TodayShow @AlRoker for #LendaHand Thanks for inspiring AK youth: http://owl.li/5goe1
79721336490049536,2011-06-12 01:27:02,SenatorBegich,1,0,Hootsuite,Congratulations to those who ran the #Alaska Run for Women. Thanks for running for such a great cause.
79611365119098880,2011-06-11 18:10:03,SenatorBegich,0,0,Hootsuite,If you plan to hit the road in AK find road conditions w/ Alaska Road Weather Information System: http://owl.li/5fao6
79595011263578112,2011-06-11 17:05:04,SenatorBegich,1,0,Hootsuite,You can report a wildland fire to the Alaska Fire Service here: http://owl.li/5fx7m
79593752909447168,2011-06-11 17:00:04,SenatorBegich,0,0,Hootsuite,Don't forget. You can find updated wildfire reports at the @AK_Forestry website: http://ow.ly/2brZvb
79590625166626816,2011-06-11 16:47:38,SenatorBegich,0,0,Hootsuite,My Fairbanks director Tom Moyer is getting regular briefings on the fire situation in the Interior Photo: http://ow.ly/i/cOsB
79313146191425537,2011-06-10 22:25:02,SenatorBegich,0,0,Hootsuite,@360North will remember Dr. Walter Soboleff tonight with special programming: http://owl.li/5fapr
79280022703185920,2011-06-10 20:13:25,SenatorBegich,0,0,Hootsuite,My Anchorage Office helped out at Fort Rich's Military Appreciation Picnic. Here's Katie & Alex at the grill: http://ow.ly/i/cLWO
79261629090512896,2011-06-10 19:00:19,SenatorBegich,1,0,Hootsuite,I filmed a behind the scenes video for The Alaska App with @AlaskaTravel Watch it here: http://owl.li/5f7vw
79247425050644480,2011-06-10 18:03:53,SenatorBegich,0,0,Hootsuite,Dillingham High School is getting a new computer lab. Technology is a necessary part of education: http://owl.li/5f4gl
79237379038248960,2011-06-10 17:23:57,SenatorBegich,0,0,Hootsuite,"Tazo, the otter from the Alaska Sea Life Center, is now on exhibit in NYC. Remember his YouTube debut?: http://owl.li/5f1VF"
78977126640001024,2011-06-10 00:09:48,SenatorBegich,2,0,Hootsuite,My business card got a shout out in a news story: http://owl.li/5eqVV Here's a photo of my card: http://owl.li/5eqWf
78973069510713345,2011-06-09 23:53:41,SenatorBegich,0,0,Hootsuite,Want more details on the Alaska Heroes Card? Watch this video from yesterday's committee hearing: http://owl.li/5eqA2
78956780708823040,2011-06-09 22:48:58,SenatorBegich,0,0,Hootsuite,Jenny Gomez Strickler of Juneau has been nominated to be Alaska’s Honorary Filipino Consul General: http://owl.li/5eoLp
78928301741187072,2011-06-09 20:55:48,SenatorBegich,2,0,Hootsuite,Let’s get the Tanana bridge project underway: http://owl.li/5ekuq #Alaska #AK
78907979944034304,2011-06-09 19:35:03,SenatorBegich,0,0,Hootsuite,@usnoaagov hosted their Fish Fry yesterday. It didn't take long for me to find some Alaska salmon Photo: http://owl.li/5e9tv
78889112161103872,2011-06-09 18:20:04,SenatorBegich,1,0,Hootsuite,Guardsmen from the @aknationalguard deserve thanks for the 107 lives saved during their time in Afghanistan: http://owl.li/5e5CI
78872752089612288,2011-06-09 17:15:04,SenatorBegich,2,0,Hootsuite,If you visit Washington DC my website has resources for your visit: http://owl.li/5e5zZ
78871490484912128,2011-06-09 17:10:03,SenatorBegich,0,0,Hootsuite,27 Alaska students are heading my way to compete in National History Day: http://owl.li/5e5uq
78857756324540416,2011-06-09 16:15:28,SenatorBegich,2,0,Hootsuite,Happy Birthday to Congressman for All Alaska @RepDonYoung
78582111338106880,2011-06-08 22:00:09,SenatorBegich,1,0,Hootsuite,Speaking to the #OceansWeek conference was a great experience today
78558721860575232,2011-06-08 20:27:13,SenatorBegich,0,0,Hootsuite,I delivered remarks at a round table discussion on the Arctic Photo:  http://ow.ly/i/cFYn
78550635154374656,2011-06-08 19:55:05,SenatorBegich,0,0,Hootsuite,Congrats: More lady basketball all stars from across the state: http://ow.ly/2brZyp
78533006809239552,2011-06-08 18:45:02,SenatorBegich,0,0,Hootsuite,the park road lottery will accept entries by mail and phone: http://ow.ly/2brZy5 @DenaliNPS
78520381639634944,2011-06-08 17:54:52,SenatorBegich,0,0,Hootsuite,Congrats: Meg & Chelsey from #Seward will be lacing up their basketball shoes on a high school all star tour http://ow.ly/2brZy3
78234886519005184,2011-06-07 23:00:25,SenatorBegich,1,0,Hootsuite,Photo with the Alaska Children's Alliance: http://ow.ly/2brZvc
78222209642004481,2011-06-07 22:10:02,SenatorBegich,1,0,Hootsuite,"Visit the @AK_Forestry Website for updated wildfire reports by region:
http://ow.ly/2brZvb"
78197054744174592,2011-06-07 20:30:05,SenatorBegich,0,0,Hootsuite,Today the Tanana Chiefs Conference visited my office Photo: http://ow.ly/2brZv9
78185720531005441,2011-06-07 19:45:03,SenatorBegich,1,0,Hootsuite,"If you need to report a wildland fire, visit the Alaska Fire Service at: http://ow.ly/2brZv7"
78177364642766848,2011-06-07 19:11:50,SenatorBegich,0,0,Hootsuite,View an interactive Alaska Fire Hazard map. Check for wildfire hazards in your area: http://ow.ly/2brZv5 @alaska_weather
78131165395038208,2011-06-07 16:08:16,SenatorBegich,0,0,Hootsuite,The @USCG Cutter Munro is hosting a change of command on Friday in Kodiak: http://ow.ly/2brZuD
77876181332008960,2011-06-06 23:15:03,SenatorBegich,0,0,Hootsuite,See photos from this weekend’s dance recital in Bethel: http://owl.li/5bqml #Alaska #AK
77821678863921153,2011-06-06 19:38:28,SenatorBegich,1,0,Hootsuite,#Alaska101 Fishing Ship Creek with Jim Lavrakas from @AlaskaDispatch Video: http://owl.li/5bnlS
77776396574932993,2011-06-06 16:38:32,SenatorBegich,0,0,Hootsuite,"Sally, from my office in Juneau, visited Angoon over the weekend Photo: http://owl.li/5bali"
77773429662691328,2011-06-06 16:26:45,SenatorBegich,0,0,Hootsuite,Today is the 67th anniversary of D-Day. You can find interactive features from @USArmy http://owl.li/5b9kv
77573449937207297,2011-06-06 03:12:06,SenatorBegich,0,0,Hootsuite,Fred Becker & grandson Anthony spoke w/ me about academy nominations today Photo: http://ow.ly/i/cycI Find details: http://owl.li/5aEwp
77469299819810817,2011-06-05 20:18:15,SenatorBegich,0,0,Hootsuite,I visited K2 aviation in Talkeetna where I spoke w/ Suzanne Rust Photo: http://ow.ly/i/cxws
77432371598737408,2011-06-05 17:51:30,SenatorBegich,0,0,Hootsuite,This morning I'm listening to the concerns of aviators near the Talkeetna airport #Alaska #AK
77184744189730816,2011-06-05 01:27:31,SenatorBegich,0,0,Hootsuite,I spent the day in Talkeetna. I had a town hall at the Flying Squirrel Photo:  http://ow.ly/i/cvqC
76785317826412545,2011-06-03 23:00:21,SenatorBegich,1,0,Hootsuite,"Next up, promoting Alaska salmon by filming a PSA. There are no #Frankenfish on set."
76766392615047168,2011-06-03 21:45:08,SenatorBegich,1,0,Hootsuite,On to the groundbreaking of the Anchorage Neighborhood Health Center.
76761349123866624,2011-06-03 21:25:06,SenatorBegich,2,0,Hootsuite,Today I'm announcing legislation to create a Heroes Health Card for Alaska's veterans at the annual VFW meeting.
76746245414207488,2011-06-03 20:25:05,SenatorBegich,0,0,Hootsuite,Heroes Health Card announcement w/ Alaska VFW Photo: http://ow.ly/i/crzt
76741226795245568,2011-06-03 20:05:08,SenatorBegich,1,0,Hootsuite,Naturalization ceremonies are an uplifting experience. The American Dream starts here #Alaska
76727380042981376,2011-06-03 19:10:07,SenatorBegich,1,0,Hootsuite,I'm attending a naturalization ceremony for new Alaskans at the federal courthouse. #Alaska #Anchorage
76722336866373632,2011-06-03 18:50:05,SenatorBegich,0,0,Hootsuite,Thanks to the annual Alaska VFW Convention for allowing me to recognize the contributions of our veterans.
76692921130291200,2011-06-03 16:53:11,SenatorBegich,1,0,Hootsuite,View photos from my day in Fairbanks on Flickr: http://owl.li/59AxI
76690868827996160,2011-06-03 16:45:02,SenatorBegich,0,0,Hootsuite,High School students in #Seward are working to keep Alaska's oceans clean: http://owl.li/59zYD
76442996048019456,2011-06-03 00:20:05,SenatorBegich,2,0,Hootsuite,"Read about Homer's ""first big weekend"" for visitors: http://owl.li/58RdN"
76429142995906560,2011-06-02 23:25:02,SenatorBegich,2,0,Hootsuite,Trail guides will be leading a hike in @DenaliNPS on Saturday. Details: http://owl.li/58R7K @newsminer
76407899836006401,2011-06-02 22:00:37,SenatorBegich,1,0,Hootsuite,Bethel Little League is back after five years. Play ball. http://owl.li/58Nyl
76407237995802624,2011-06-02 21:57:59,SenatorBegich,0,0,Hootsuite,This is my second consecutive year speaking to Rural Alaska Honors Institute Photo: http://ow.ly/i/coCy @UAFairbanks
76404887788859392,2011-06-02 21:48:39,SenatorBegich,0,0,Hootsuite,Students from over 40 villages greeted me @UAFairbanks Photo: http://ow.ly/i/coB4
76376897080143872,2011-06-02 19:57:25,SenatorBegich,1,0,Hootsuite,"Watch my newest ""Across Alaska"" web-video from Memorial Day. YouTube: http://owl.li/58RuZ"
76366414503624705,2011-06-02 19:15:46,SenatorBegich,1,0,Hootsuite,I attended the memorial service for fallen members of the 125th Stryker Brigade. Our thoughts are with their families http://ow.ly/i/cofm
76345071938703360,2011-06-02 17:50:58,SenatorBegich,1,0,Hootsuite,The Alaska Fire Service in Fairbanks gave me a briefing on efforts to fight wildfires at the dispatch board Photo: http://ow.ly/i/co1Y
76333146240581632,2011-06-02 17:03:34,SenatorBegich,1,0,Hootsuite,Congrats to Hunter from ANC & David from FBX in making it to round 3 of the National Spelling Bee @ScrippsBee
76326903509811201,2011-06-02 16:38:46,SenatorBegich,0,0,Hootsuite,On the ground in #Fairbanks. First stop is @UAFairbanks to meet with the regents.
76302816037175297,2011-06-02 15:03:03,SenatorBegich,0,0,Hootsuite,Fairbanks here I come. Wheels up from Anchorage in a few minutes. #Alaska #AK
76122627361603584,2011-06-02 03:07:03,SenatorBegich,0,0,Hootsuite,Thanks to everyone who came out to my town hall at Dimond High School Photo:  http://ow.ly/i/cmoH
76096186905399296,2011-06-02 01:21:59,SenatorBegich,0,0,Hootsuite,Getting ready for my town hall at Dimond High School
76093698055745537,2011-06-02 01:12:06,SenatorBegich,0,0,Hootsuite,I'm participating in a video about the importance of the Port of Anchorage to the Alaska economy Photo: http://owl.li/589eo
76039037550460929,2011-06-01 21:34:53,SenatorBegich,0,0,Hootsuite,Don't forget about today's town hall meeting at Dimond High School. 5:30 pm. Details on Facebook: http://owl.li/582tv
76038330302734336,2011-06-01 21:32:05,SenatorBegich,1,0,Hootsuite,I'm at the Summer Food Program Kickoff at the Fairview Recreation Center. Details about the program are here: http://owl.li/582mG
76013920728530944,2011-06-01 19:55:05,SenatorBegich,0,0,Hootsuite,If you missed it... @APRN did a great story on Sec. Shinseki's visit to Bethel and Kwig on #MemorialDay http://owl.li/57XLQ
76013688242450432,2011-06-01 19:54:10,SenatorBegich,1,0,Hootsuite,To all the Alaskans visiting today's Congressional Delegation Grants Symposium... Thanks for your interest. I hope it was helpful.
75966725497159681,2011-06-01 16:47:33,SenatorBegich,0,0,Hootsuite,The Alaska Delegation is hosting a symposium on federal grants today in Anchorage. Dena'ina Center 11 am @LisaMurkowski @RepDonYoung
75962094364790784,2011-06-01 16:29:09,SenatorBegich,0,0,Hootsuite,"I got to hoist the @AlaskaAces championship trophy, the Kelly Cup, last night. Photo: http://owl.li/57LIN"
75941105434230784,2011-06-01 15:05:45,SenatorBegich,0,0,Hootsuite,I'm on the radio with Rick Rydell. @650KENI Listen live online: http://owl.li/57G7S It's 650AM on the radio in Anchorage
75926786558537728,2011-06-01 14:08:51,SenatorBegich,1,0,TweetDeck,RT @UAAVeterans: VA Secretary Shinseki flanked by Senators Murkowski and Begich. Showing support for our veterans... http://fb.me/Sd2Y1kq8
75924242293731328,2011-06-01 13:58:44,SenatorBegich,0,0,Hootsuite,I'll be calling into @650KENI to talk with Rick Rydell at 7 a.m. Listen live here: http://owl.li/57Bdf
75745891809636353,2011-06-01 02:10:02,SenatorBegich,1,0,Hootsuite,Congrats to the Army Rangers who summited Denali in time for #MemorialDay Their climb was for fallen Rangers: http://owl.li/577tO
75728301611696128,2011-06-01 01:00:08,SenatorBegich,0,0,Hootsuite,Fairbanks' Kirt Hartshorn will compete at the National Truck Driving Championship. Hope he can haul an award home: http://owl.li/576HQ
75711996380708864,2011-05-31 23:55:21,SenatorBegich,0,0,Hootsuite,"Mistweet Earlier: Look for Alaska's View from the Hill on Thursday, not today @KTVA"
75708144017346561,2011-05-31 23:40:02,SenatorBegich,0,0,Hootsuite,I’m taping Alaska’s View from the Hill with Sean Doogan in the @KTVA studio. Look for it tonight.
75679406496038913,2011-05-31 21:45:51,SenatorBegich,1,0,Hootsuite,At the Loussac Library for today's Veterans Listening Session with @DeptVAAffairs Sec. Shinseki & @LisaMurkowski
75678839065423873,2011-05-31 21:43:35,SenatorBegich,1,0,Hootsuite,You can RSVP for tomorrow's Anchorage Town Hall on Facebook: http://owl.li/576oU It's at 5:30 at Dimond High School
75660114777997312,2011-05-31 20:29:11,SenatorBegich,0,0,Hootsuite,On to a tour of the @DeptVetAffairs Domiciliary in Anchorage with Sec. Shinseki and @LisaMurkowski
75643491505545216,2011-05-31 19:23:08,SenatorBegich,1,0,Hootsuite,Here's a good story about Sitka Coast Guard Air Station's first commanding officer returned for a visit: http://owl.li/56Z1b
75643068602261504,2011-05-31 19:21:27,SenatorBegich,3,0,Hootsuite,Heading to a lunch meeting with the @DeptVetAffairs and ANTHC about health care for rural Alaska veterans. #Alaska
75632078468816896,2011-05-31 18:37:47,SenatorBegich,0,0,Hootsuite,You'll be able to watch Talk of Alaska on @360North. There's a live studio audience. Photo: http://ow.ly/i/ciJm
75626609511632896,2011-05-31 18:16:03,SenatorBegich,2,0,Hootsuite,I'm live on Talk of Alaska. Call in with your questions: 550-8422 in Anchorage or 1-800-478-8255 Statewide @APRN #Alaska #AK
75623204433039361,2011-05-31 18:02:31,SenatorBegich,0,0,Hootsuite,I’m live on @APRN Talk of Alaska. Call in at 550-8422. Listen live here: http://owl.li/56TuI
75617212542615552,2011-05-31 17:38:43,SenatorBegich,0,0,Hootsuite,"At 1:30 pm Sec. Shinseki, @LisaMurkowski and I are hosting a Veterans Listening Session at the Loussac Library. Come join us."
75604489742196737,2011-05-31 16:48:09,SenatorBegich,0,0,Hootsuite,I’ll be live on @APRN Talk of Alaska at 10 am. Listen live online here: http://owl.li/56OUm @KSKA
75604133662556160,2011-05-31 16:46:44,SenatorBegich,0,0,Hootsuite,I joined @ANHC for breakfast this morning. Their great work continues #Alaska #AK
75382226392580096,2011-05-31 02:04:57,SenatorBegich,0,0,Hootsuite,After Kwig... it's back to Bethel. Sec. Shinseki and I are hosting a listening session for veterans.
75319329356398592,2011-05-30 21:55:02,SenatorBegich,1,0,Hootsuite,We’re heading to Kwigillingok to meet with members of the Alaska Territorial Guard #MemorialDay
75316816418840576,2011-05-30 21:45:03,SenatorBegich,0,0,Hootsuite,"Sec. Shinseki and I are jumping on a plane for Bethel and Kwigillingok. Thanks for a great #MemorialDay, Anchorage."
75306750542217216,2011-05-30 21:05:03,SenatorBegich,0,0,Hootsuite,Fort Rich was proud to have Sec. Shinseki from @DeptVAAffairs deliver remarks on #MemorialDay
75301715036999680,2011-05-30 20:45:02,SenatorBegich,1,0,Hootsuite,#MemorialDay at Fort Richardson is always something special. It’s powerful to see so many military members and their families.
75287796323069952,2011-05-30 19:49:44,SenatorBegich,1,0,Hootsuite,Secretary Shinseki speaks about #MemorialDay before the ceremony at Fort Rich. Photo: http://ow.ly/i/cgqg @DeptVetAffairs
75269001764278274,2011-05-30 18:35:03,SenatorBegich,1,0,Hootsuite,Sec. Shinseki and I are heading to Fort Rich for their #MemorialDay ceremony.
75266486666670080,2011-05-30 18:25:03,SenatorBegich,0,0,Hootsuite,Thanks to all who participated in the moving #MemorialDay ceremony on the Park Strip.
75265912894271488,2011-05-30 18:22:46,SenatorBegich,0,0,Hootsuite,Share a message with a military family using this online tool from @the_USO: http://owl.li/564SJ
75250174137614336,2011-05-30 17:20:14,SenatorBegich,0,0,Hootsuite,"Today we remember all those Americans, including our fellow Alaskans, who gave their lives to protect our own #MemorialDay"
75227477672337408,2011-05-30 15:50:02,SenatorBegich,0,0,Hootsuite,"If you are in Anchorage, come join us at the Park Strip for today’s #MemorialDay service at 9 am"
75222468935159809,2011-05-30 15:30:08,SenatorBegich,0,0,Hootsuite,@DeptVetAffairs Secretary Eric Shinseki is in Alaska today for #MemorialDay.
74912975609278464,2011-05-29 19:00:19,SenatorBegich,1,0,Hootsuite,Thanks to employees at the Anchorage @BestBuy & @GeekSquad for the warm welcome http://ow.ly/i/ce6q
74875474068774912,2011-05-29 16:31:18,SenatorBegich,2,0,Hootsuite,Anchorage Federation of Community Councils did a great job on the national Neighborhoods USA conference. Photo: http://ow.ly/i/cdQq
74574170368909312,2011-05-28 20:34:02,SenatorBegich,2,0,Hootsuite,It's great to be back in Anchorage. #Alaska #AK
74539206373937153,2011-05-28 18:15:06,SenatorBegich,1,0,Hootsuite,"Also, commercial fishermen can sign up for press releases and notifications from ADFG here: http://owl.li/54Mpl"
74537941468319745,2011-05-28 18:10:04,SenatorBegich,2,1,Hootsuite,Don't forget. The #Alaska Department of Fish and Game has daily fishing reports: http://owl.li/54MnA
74273658889183233,2011-05-28 00:39:54,SenatorBegich,1,0,TweetDeck,I created a Facebook event for Wednesday's Anchorage town hall: http://on.fb.me/mQOlwK
74273516853268482,2011-05-28 00:39:21,SenatorBegich,2,0,TweetDeck,I'm hosting a town hall meeting in Anchorage on Wed. June 1. 5:30 pm at Dimond High School. Hope you can join me. #Alaska
74217071789088768,2011-05-27 20:55:03,SenatorBegich,1,0,Hootsuite,Saturday is Fairbanks Museum Day. Take advantage of it: http://owl.li/54MmG #Alaska
74202097402384384,2011-05-27 19:55:33,SenatorBegich,0,0,Hootsuite,Two Alaskans from Unalaska will be running in the Paris Marathon. Best of luck in the race: http://owl.li/54Mmb
73943472717045760,2011-05-27 02:47:52,SenatorBegich,9,1,Hootsuite,"I support a strong national defense, but I voted against the Patriot Act because it invades on our constitutional rights to privacy."
73903763802427392,2011-05-27 00:10:05,SenatorBegich,0,0,Hootsuite,The 2011 @USCG Enlisted Person of the Year Troy Brevik brought his family to DC from Sitka. Photo: http://owl.li/540RL
73877748443136000,2011-05-26 22:26:42,SenatorBegich,0,0,Hootsuite,Sec. of Defense nominee and CIA Director Leon Panetta spoke with me about Alaska issues and concerns today: http://owl.li/540LX
73865804898254848,2011-05-26 21:39:14,SenatorBegich,0,0,Hootsuite,The success of Alaska’s breweries: http://owl.li/53Yxk Led me to cosponsor S.3339 which cuts taxes and promotes growth @AlaskanBrewing
73850529725427712,2011-05-26 20:38:33,SenatorBegich,0,0,Hootsuite,Students from Sitka and Delta Junction are also competing in this weekend's debate tournament. We're rooting for #Alaska!
73850209150582785,2011-05-26 20:37:16,SenatorBegich,1,0,Hootsuite,The South Anchorage High School Debate Team is competing in DC this weekend. Photo: http://owl.li/53W0m #Alaska
73831465921679360,2011-05-26 19:22:47,SenatorBegich,3,0,Hootsuite,This morning I presented 'Alaska 101' to 40 foreign ambassadors who are touring #Alaska this Summer. Photo: http://owl.li/53QNw
73542626648928256,2011-05-26 00:15:03,SenatorBegich,0,0,Hootsuite,Today I visited with Alaska @AFLCIO President Vince Beltrami. Photo: http://owl.li/536m0
73532563033042944,2011-05-25 23:35:03,SenatorBegich,0,0,Hootsuite,Here's the story board that hangs in the front of my DC office: http://owl.li/536eO
73531310957789184,2011-05-25 23:30:05,SenatorBegich,0,0,Hootsuite,Sealaska presented my office with a plaque to accompany the story board hanging in the front of my DC office: http://owl.li/536c0
73509675081007104,2011-05-25 22:04:06,SenatorBegich,2,0,Hootsuite,Last night the Senate passed a resolution from @LisaMurkowski and me recognizing the @AlaskaAces. 2011 @ECHL champs
73490093251366912,2011-05-25 20:46:18,SenatorBegich,2,0,Hootsuite,I'm heading to the Senate floor to speak about the need to protect our seniors. Watch live on C-SPAN2 here: http://owl.li/532BD
