id,created_at,user,retweets,favorite_count,source,text
131774955061903361,2011-11-02 16:49:32,SenatorBegich,3,0,Hootsuite,"See my floor speech on the need to invest in our roads, bridges, ports and runways #jobs #RebuildAmerica: http://t.co/1g2itN2F"
131729894114738176,2011-11-02 13:50:28,SenatorBegich,1,0,Hootsuite,"Turn on C-SPAN2 at 10 am (EST). We need to create jobs by investing in our nation’s roads, bridges, ports and airports: http://t.co/09yIhtta"
131490671172386818,2011-11-01 21:59:53,SenatorBegich,2,0,Hootsuite,Information on the annual Lighting of the National Christmas Tree is here: http://t.co/gf2roIek The ticket lottery opens on Thursday.
131447268611067904,2011-11-01 19:07:25,SenatorBegich,1,0,Hootsuite,"I hand delivered a ""No Frankenfish"" button to @RepDonYoung today. Find out how to make your own buttons at home here: http://t.co/ZFFF2hii"
131407142841352193,2011-11-01 16:27:58,SenatorBegich,1,0,Twitter for BlackBerry®,The Alaska Delegation meets w/ @UAASeawolves Women's Basketball @LisaMurkowski @repdonyoung photo: http://t.co/rniUlDAX
131381297523326977,2011-11-01 14:45:16,SenatorBegich,2,0,Hootsuite,"Here's my #Halloween video of my ""trick-or-treating"" to deliver ""No Frankenfish"" buttons: http://t.co/fgVFL08G"
131135479440613378,2011-10-31 22:28:29,SenatorBegich,1,0,Hootsuite,"I caught Senator @JohnBoozman in his office today and hand delivered his ""No Frankenfish"" button. Photo: http://t.co/oUpbvAQY"
131131118727610368,2011-10-31 22:11:09,SenatorBegich,1,0,Hootsuite,My button campaign is working. @SenJeffMerkley just joined my current bill to fight #Frankenfish.
131129284734631936,2011-10-31 22:03:52,SenatorBegich,1,0,Hootsuite,"Want to make your own ""No Frankenfish"" buttons? Download a button template from my website: http://t.co/7CfucO6g"
131122451064172545,2011-10-31 21:36:43,SenatorBegich,1,0,Hootsuite,"Want a ""Say No To Frankenfish"" bumper sticker to display on Halloween? Download one here: http://t.co/oQODZc2D"
131112327872380928,2011-10-31 20:56:29,SenatorBegich,4,0,TweetDeck,"RT @lisamurkowski: I'm wearing my ""No Frankenfish"" buttons for Halloween. Thanks to @SenatorBegich for dropping them off. #AK #Alaska ht ..."
131100059952627713,2011-10-31 20:07:44,SenatorBegich,3,0,Hootsuite,I’m celebrating Halloween by delivering “No Frankenfish” buttons to all my Senate colleagues. Here's the button: http://t.co/SLcZ6MTF
130058776773529600,2011-10-28 23:10:03,SenatorBegich,1,0,TweetDeck,"RT @aprn: @SenatorBegich Thanks for the follow, Senator Begich."
130058547676450816,2011-10-28 23:09:08,SenatorBegich,1,0,Hootsuite,If you weren't able to attend #AFN last weekend you can watch my speech on YouTube here: http://t.co/6unki5r6 #RuralAlaska
130045013638922240,2011-10-28 22:15:22,SenatorBegich,1,1,Hootsuite,I've received a number of questions of how family members can get a DD214 military record. Here's a link to help: http://t.co/gN3m7JJt
130028739944919040,2011-10-28 21:10:42,SenatorBegich,0,0,Hootsuite,See all my photos from AFN 2011 on Facebook here: http://t.co/3foPJ4e1
129746016864960513,2011-10-28 02:27:15,SenatorBegich,0,0,Twitter for BlackBerry®,"Saddened by loss of elder Mary Ann Sundown, a treasured Alaska Native elder."
129701857542156288,2011-10-27 23:31:47,SenatorBegich,3,0,Twitter for BlackBerry®,Look for this bus as part of new SCF suicide prevention campaign. We're all part of the solution. http://t.co/MabifKkr
129254059076100096,2011-10-26 17:52:23,SenatorBegich,1,0,Hootsuite,"Deborah, Jacob and I had a great time preparing for Halloween at the pumpkin patch. Photo: http://t.co/7FrSTZbW"
128987206634311680,2011-10-26 00:12:01,SenatorBegich,2,0,Twitter for BlackBerry®,I'm visiting the Kulluk drill ship in Washington as it gets ready for development in the Arctic: http://t.co/3W2xovev
128962827330396160,2011-10-25 22:35:08,SenatorBegich,4,0,Hootsuite,Congratulations to Ms. Mary Lee Tung. It's an honor to have quality teachers like her working in our state: http://t.co/MY1RQKJy
128938301095813120,2011-10-25 20:57:41,SenatorBegich,0,0,Hootsuite,First day of APD training for new recruits: http://t.co/6ot7YHVo #jobs #1stresponsders
128930889127297026,2011-10-25 20:28:14,SenatorBegich,0,0,Hootsuite,Mat-Su hosted a great drug free message for teens through the You Choose Project: http://t.co/bZBDyoSM
128915105474813952,2011-10-25 19:25:30,SenatorBegich,2,0,Hootsuite,Thanks to the Indian Health Service for hosting today’s summit on suicide prevention. Find resources: http://t.co/GQMrBwUv
128599570019123200,2011-10-24 22:31:41,SenatorBegich,2,0,Hootsuite,"Young Alaskans, the deadline to apply for an internship in my offices in Alaska and Washington is Oct. 28. Apply here: http://t.co/C6Df8uZw"
128589069168029696,2011-10-24 21:49:57,SenatorBegich,5,0,TweetDeck,"RT @nationaljournal: The best congressional websites belong to Paul Ryan and Mark Begich, according to a recent report: http://t.co/2kKZa2MU"
128548830156300289,2011-10-24 19:10:04,SenatorBegich,0,0,Hootsuite,Talking to small business owners in Anchorage about what it takes to thrive and survive. Photo: http://t.co/j89tCiP8
128530396123119616,2011-10-24 17:56:49,SenatorBegich,4,0,Hootsuite,I just won the Platinum Mouse award for having the Senate's best website #humblebrag Visit it here: http://t.co/JoUnfQkF
128241613116936192,2011-10-23 22:49:17,SenatorBegich,0,0,Twitter for BlackBerry®,I just presented Nunaka Valley Little League with a copy of their Senate resolution http://t.co/oXdqjSOs
128187769825669120,2011-10-23 19:15:20,SenatorBegich,2,0,Twitter for BlackBerry®,I'm touring Glacier Valley farms in the Valley. This has to be Alaska's tallest pile of carrots http://t.co/ZpxACKcm
128146830298054657,2011-10-23 16:32:39,SenatorBegich,2,0,Hootsuite,I had an early morning meeting with longshoremen at the Port of Anchorage. Photo: http://t.co/TeIHCHrQ
127849089940471808,2011-10-22 20:49:33,SenatorBegich,1,0,Hootsuite,Here's a photo of me speaking to the AFN Convention. I'm having a great day seeing many friends. http://t.co/OWeEgmu4
127543632352911360,2011-10-22 00:35:46,SenatorBegich,1,0,Hootsuite,I'm hosting an Alaska Native Youth Reception at the A Street Event Hall. Doors just opened. The event goes from 5 - 6:30 p.m. Come join.
127124979350388737,2011-10-20 20:52:11,SenatorBegich,2,1,Hootsuite,See photos of Fort Yukon's Clarence Lee Alexander accepting his award from the President here: http://t.co/J6WWDLw4 @WhiteHouse
127102152647774208,2011-10-20 19:21:29,SenatorBegich,1,1,Hootsuite,Fort Yukon's Clarence Alexander watching President Obama speak before receiving the Presidential Citizens Medal http://t.co/3lPt8rCT
127050042937839617,2011-10-20 15:54:25,SenatorBegich,1,0,Hootsuite,Stop by my AFN booth today and say hi to my staff! Photo: http://t.co/qSbUHj2k
126802157814022145,2011-10-19 23:29:24,SenatorBegich,2,0,Hootsuite,"The star of #FlyingWildAlaska, Unalakleet’s @ArielTweto, joined me to talk about the importance of aviation: http://t.co/JpyV2kCO"
126801080444129281,2011-10-19 23:25:08,SenatorBegich,2,0,Hootsuite,@ArielTweto from #FlyingWildAlaska and @Discovery have a great PSA on safe flying here: http://t.co/c5Qs19Oz #DiscoverYourSkills
126782652903718913,2011-10-19 22:11:54,SenatorBegich,3,1,Hootsuite,#FlyingWildAlaska's @ArielTweto is with me in the Capitol @Discovery
126768858672529409,2011-10-19 21:17:05,SenatorBegich,1,0,Hootsuite,"This morning, women leaders from across the country joined me to talk #jobs for #teachers and #1st responders @SenateDems"
126758648125980672,2011-10-19 20:36:31,SenatorBegich,1,0,TweetDeck,RT @Amy_NJ: @SenatorBegich responds to @nationaljournal #energy & #environment experts blog discussing changes in Arctic: http://t.co/Ri ...
126738302446477312,2011-10-19 19:15:40,SenatorBegich,3,0,Hootsuite,Ketchikan went viral on YouTube! All it took was a bear cub wandering into Tatsuda’s Market. Watch the video: http://t.co/u5lre72W
126716487430975489,2011-10-19 17:48:59,SenatorBegich,0,0,Hootsuite,Interested in what Harrison Ford had to say about general aviation? View his remarks here: http://t.co/7kVLw5Ia @AOPA
126715604693549056,2011-10-19 17:45:29,SenatorBegich,1,0,Hootsuite,Still getting great feedback after Harrison Ford visited yesterday. View @CH2KTUU’s story on it here: http://t.co/8jeBlYJa
126676112746102784,2011-10-19 15:08:33,SenatorBegich,0,0,Hootsuite,I'm waiting to go live on @FoxNews. Turn it on now to watch me talk jobs with Jenna Lee @HappeningNow
126672494143873024,2011-10-19 14:54:10,SenatorBegich,0,0,Hootsuite,In 20 minutes I’ll be talking jobs for teachers and first responders on FoxNews’ @HappeningNow. Tune in: 7:10 (Alaska).
126446452200316928,2011-10-18 23:55:58,SenatorBegich,1,0,Hootsuite,Photos from today's Senate General Aviation Caucus meeting with Harrison Ford: http://t.co/FNZgaMt0
126390753776762881,2011-10-18 20:14:38,SenatorBegich,1,0,Hootsuite,I'll also be wishing all Alaskans a happy Alaska Day. Watch me live on the Senate floor: http://t.co/mnOvZlTJ
126390510653947904,2011-10-18 20:13:40,SenatorBegich,4,0,Hootsuite,I'm on my way to the Senate floor to speak about transportation enhancement funds & their benefits to Alaska: http://t.co/sysIqPpB
126375400111738880,2011-10-18 19:13:37,SenatorBegich,4,0,Twitter for BlackBerry®,Photo of Harrison Ford at a Senate General Aviation Caucus meeting w/ @mike_johanns and me http://t.co/5NTuL1Xj
126367444091674624,2011-10-18 18:42:01,SenatorBegich,2,0,Hootsuite,Pilot and actor Harrison Ford is joining @MikeJohanns and me for a meeting with a dozen Senators to talk General Aviation.
126357900187795458,2011-10-18 18:04:05,SenatorBegich,0,0,Hootsuite,I'd like to wish all Alaskans a happy Alaska Day. I've already been asked about the meaning of our holiday in the Capitol.
126333037465186304,2011-10-18 16:25:17,SenatorBegich,3,0,Hootsuite,This week I’m participating in @NationalJournal’s Expert Blog on Energy. Is America ready for a changing Arctic? http://t.co/CwjjUBFc
126076297746198529,2011-10-17 23:25:06,SenatorBegich,1,0,Hootsuite,I’m excited to be joining AFN on Friday and Saturday. Read my article on the special conference here: http://t.co/vI0IMYuM
126063716537077760,2011-10-17 22:35:06,SenatorBegich,1,0,Hootsuite,Also Congrats to Barrow on making their first small-school championship football game: http://t.co/uDGccjmw
126063183696896000,2011-10-17 22:32:59,SenatorBegich,3,0,TweetDeck,RT @ChadPergram: Han Solo/Indiana Jones visits Capitol Hill Tuesday. Harrison Ford meets with the Senate General Aviation Caucus hosted  ...
126062494451118082,2011-10-17 22:30:15,SenatorBegich,0,0,Hootsuite,Congrats to the Nikiski Bulldogs on their state small-school football championship http://t.co/DJC6VrAT
126051641475600384,2011-10-17 21:47:07,SenatorBegich,0,0,Hootsuite,Pitkas Point in SW Alaska welcomed running water. This is why I say Alaska has “Extreme-Rural Communities” http://t.co/pU4EDlpi
126026551002284033,2011-10-17 20:07:25,SenatorBegich,0,0,Hootsuite,Thanks to all the volunteers who helped clean up Campbell Creek Estuary this weekend. I’ve proudly donated half my PFD to the cause.
124968298021535744,2011-10-14 22:02:18,SenatorBegich,3,0,Hootsuite,I filed legislation with @LisaMurkowski & @RepDonYoung to rename the federal courthouse in Anchorage after Judge James Fitzgerald.
124629264325804032,2011-10-13 23:35:06,SenatorBegich,0,0,Hootsuite,Weekend: Check out the Alaska Native Film Festival in Anchorage on Sunday from 1 – 6 p.m. http://t.co/BqDOkn4G
124596393900908544,2011-10-13 21:24:29,SenatorBegich,0,0,Hootsuite,Barrow’s Debby Dahl Edwardson is up for a National Book Award. We’ve all got our fingers crossed: http://t.co/0OjWhBun
124576548941611008,2011-10-13 20:05:38,SenatorBegich,1,0,Hootsuite,A day after passing the South Korea Free Trade agreement we’re having a Joint Session of Congress to hear from their President.
124556912019783680,2011-10-13 18:47:36,SenatorBegich,2,0,Hootsuite,"Alaskans, @Target is going sustainable with their seafood. This = More Alaska fish in stores across the country: http://t.co/pXa3lwxo"
124546722063056896,2011-10-13 18:07:07,SenatorBegich,1,0,Hootsuite,Jim Pickett is Alaska’s Firefighter of the Year. In his own time he installed 900 smoke detectors around town in Kodiak http://t.co/Mkzmkd4x
124266894139211776,2011-10-12 23:35:10,SenatorBegich,2,1,Hootsuite,"Kudos to the 19,000 Alaskans who chose to Pick.Click.Give. this year. It’s inspiring to see Alaskans helping each other."
124247014916624386,2011-10-12 22:16:11,SenatorBegich,2,0,Hootsuite,The Fire Island wind project has a green light. I’m proud to have played a role in the project in Anchorage and DC: http://t.co/q2UkOyPv
124218503837388800,2011-10-12 20:22:53,SenatorBegich,5,0,Hootsuite,Rep. Issa is calling Alaska bypass mail “cronyism”:  http://t.co/Krp2IaUi I know rural Alaska communities would join me in disagreeing.
124209425199267840,2011-10-12 19:46:49,SenatorBegich,2,0,Hootsuite,We’ve got to build the foundation for Alaska’s role in a 21st Century Arctic. We can’t stall: http://t.co/pp1DFvbT #IceBreakers
124201008296505344,2011-10-12 19:13:22,SenatorBegich,0,0,Hootsuite,Thanks to @NationalJournal for hosting #njceo. It was a good way to bring together CEOs and legislators to talk jobs.
124147829466873856,2011-10-12 15:42:03,SenatorBegich,1,0,TweetDeck,RT @SueZoldak: Washington is a fantasy land. Disconnected from reality. - @SenatorBegich #njceo
124138892134842368,2011-10-12 15:06:32,SenatorBegich,2,0,TweetDeck,RT @COmtnClimr: Have to look at local communities to spur innovation. We have to get out of their way. @SenatorBegich #njceo
124127282330730497,2011-10-12 14:20:24,SenatorBegich,1,0,Hootsuite,I'm sitting down with CEOs to talk about how to create jobs and grow the economy. Watch the discussion live: http://t.co/n5v4rLbw #njceo
123736276091420672,2011-10-11 12:26:41,SenatorBegich,6,0,TweetDeck,"RT @SenJohnnyEllis: Sen. Begich on right track w icebreaker. Because of AK, US is an Arctic nation. We should start acting like it."
122385865359106048,2011-10-07 19:00:38,SenatorBegich,3,0,TweetDeck,RT @SenJeffMerkley: #FF my partners in a bill to support #STEM education in schools @alfranken   @SenatorBegich @SenGillibrand @SenBobCasey
122069246007185408,2011-10-06 22:02:30,SenatorBegich,0,0,Hootsuite,Today I joined @jumpstartkids in their bid to set a world record by reading Llama Llama Red Pajama. Photo: http://t.co/3CpmIQxH
122049379757600771,2011-10-06 20:43:34,SenatorBegich,1,0,Hootsuite,Watch a video recap of @HHSGov Secretary Sebelius' recent visit to Alaska: http://t.co/nH1oxnPg
121969922673885185,2011-10-06 15:27:50,SenatorBegich,0,0,Hootsuite,Live on the Senate floor. Watch C-SPAN2 http://t.co/xmPJq59R
121725429479522304,2011-10-05 23:16:18,SenatorBegich,3,0,Hootsuite,Find a listing of upcoming Rage City Roller Girl bouts and their charity work here: http://t.co/qbCudCG0 @Rage_CityRG
121695605511823360,2011-10-05 21:17:48,SenatorBegich,0,0,Hootsuite,The Top Cross Cultural Ambassadors from the Rose Rural Urban Exchange taped the Alaska Report with me today Photo: http://t.co/gWqS1UrO
121686389430562816,2011-10-05 20:41:10,SenatorBegich,0,0,Hootsuite,Orso’s former chef is making his mark by introducing new audiences to Alaska Native foods: http://t.co/9yydewcI
121664822097096704,2011-10-05 19:15:28,SenatorBegich,0,0,Hootsuite,"I told my son about the pirate fishing boat infested with rats and he said ""It's Pi-Rats!"""
121664537152856064,2011-10-05 19:14:20,SenatorBegich,0,0,Hootsuite,@edatpost B – 2. Hit or miss? #battleship
121385387720585216,2011-10-05 00:45:06,SenatorBegich,1,0,Hootsuite,@AlaskanBrewing Congrats on your most recent awards at the Great American Beer Festival. Making Alaska proud.
121365257838010368,2011-10-04 23:25:06,SenatorBegich,0,0,Hootsuite,@AlaskaAces kick off the preseason tonight in Anchorage on the pink ice. Will you be there?
121352671889334274,2011-10-04 22:35:06,SenatorBegich,0,0,Hootsuite,Don’t forget to vote in Alaska’s municipal and borough elections today. Have questions? Search here: http://t.co/Q6OoiHfG
121340270397755392,2011-10-04 21:45:49,SenatorBegich,0,0,TweetDeck,What do you think we should do with the pirate fishing ship? Share your thoughts on Facebook: http://t.co/OaKi1Vej
121337278374227969,2011-10-04 21:33:56,SenatorBegich,7,1,TweetDeck,"For those asking questions on Twitter. Yes, I just asked the Coast Guard to sink a rat infested ship off the Aleutians http://t.co/gIt8vsxX"
121276619410247680,2011-10-04 17:32:53,SenatorBegich,8,0,Twitter for BlackBerry®,RT @adndotcom: Bartlett High grad is one of three winners of Nobel physics prize. http://t.co/pj5zp9KF
120999104351453185,2011-10-03 23:10:09,SenatorBegich,1,0,Hootsuite,I’m glad to see the residents of Crooked Creek rebuilding after this year’s devastating flooding: http://t.co/H7kQDyo3
120981479953137664,2011-10-03 22:00:07,SenatorBegich,0,0,Hootsuite,Strong work by the USCG boarding a vessel over the weekend. There’s no place for pirate fishing in the 21st century: http://t.co/gEfNPj09
120968785086783488,2011-10-03 21:09:40,SenatorBegich,0,0,Hootsuite,The city of Unalaska stopped by. They got to brag about Unalaska City School’s recent 2011 Blue Ribbon award. Photo: http://t.co/2fZNF6p9
120953382201589760,2011-10-03 20:08:28,SenatorBegich,1,1,Hootsuite,As Chairman of the Oceans Subcommittee I brought an Alaska perspective to a field hearing on Massachusetts fisheries: http://t.co/zaMxZLBR
119857213631250432,2011-09-30 19:32:41,SenatorBegich,0,0,TweetDeck,I wish Michelle Hoffman a happy retirement from the Kenai USDA Rural Development office: http://t.co/SmgvFUzE
119797246442225664,2011-09-30 15:34:23,SenatorBegich,1,0,Hootsuite,Watch @CH2KTUU coverage of Transportation Secretary @RayLaHood in Alaska: http://t.co/M00SXtRA
119763384668393472,2011-09-30 13:19:50,SenatorBegich,1,0,TweetDeck,RT @portugaltheman: @SenatorBegich @conanobrien that was so cool! That's for the tweet. Doing our best to represent the Alaskans.
119578479028211712,2011-09-30 01:05:05,SenatorBegich,0,0,Hootsuite,I’m live on 650 KENI for the next hour with Porcaro. Call in with your questions.
119565904622256129,2011-09-30 00:15:07,SenatorBegich,0,0,Hootsuite,I’ll be spending an hour on the radio with Mike Porcaro from 5 – 6. It’s 650 KENI on the radio in Anchorage.
119550817488482304,2011-09-29 23:15:10,SenatorBegich,2,0,Hootsuite,Mat-Su rockers Portugal.The Man will be on the Conan O’Brien show tonight #AlaskaOnTV @portugaltheman @ConanOBrien
119540746478026752,2011-09-29 22:35:09,SenatorBegich,0,0,Hootsuite,After visiting three schools in the Mat-Su I’m heading back to Anchorage to visit the Alaska Engineering Academy.
119537639341826048,2011-09-29 22:22:48,SenatorBegich,0,0,Twitter for BlackBerry®,Here's a photo from the Colony High School assembly: http://t.co/qGFSuE2u
119533189445332992,2011-09-29 22:05:07,SenatorBegich,0,0,Hootsuite,Thanks to Colony High School for hosting me at their student assembly. Were any Twitter followers in the audience?
119518438476611585,2011-09-29 21:06:30,SenatorBegich,1,0,Hootsuite,I just fielded great questions at Mat-Su College. Students like these show Alaska's bright future Photo: http://t.co/3ynpohE8
119193447834976256,2011-09-28 23:35:07,SenatorBegich,3,0,Hootsuite,Just met w/ AK FAA employees. In past months these hardworking Alaskans have been wrongly used in political games. They don’t deserve it.
119170805568503808,2011-09-28 22:05:08,SenatorBegich,2,0,Hootsuite,Alaska is home to more pilots per capita than any state. We made sure @RayLaHood got the message during a round table on aviation in AK.
119155713934241792,2011-09-28 21:05:10,SenatorBegich,0,0,Hootsuite,@UAAnchorage’s Aviation Center hosted @RayLaHood for a tour of their great facilities.
119131275788419072,2011-09-28 19:28:04,SenatorBegich,3,0,Hootsuite,I just finished a lunch meeting with Transportation Secretary @RayLaHood and Alaska Native leaders on travel in rural Alaska
119053425492238336,2011-09-28 14:18:43,SenatorBegich,3,0,Hootsuite,Check out a YouTube video of yesterday's satellite launch from Alaska's Kodiak Launch Complex: http://t.co/bpgh37gj
118875108680015873,2011-09-28 02:30:09,SenatorBegich,1,0,Hootsuite,"I’m back in Alaska. I’m looking forward to hosting @RayLaHood, the Department of Transportatin Secretary."
118869684224409601,2011-09-28 02:08:35,SenatorBegich,6,0,Twitter for BlackBerry®,I was proud to stop by today's rally for Alaska's postal workers Photo: http://t.co/Wf0HpHbn
118853611827642368,2011-09-28 01:04:43,SenatorBegich,0,0,Twitter for BlackBerry®,@RayLahood and I visited the Anchorage Mobility Coalition to talk transit issues http://t.co/tFN0t45d
118828534834798592,2011-09-27 23:25:05,SenatorBegich,0,0,Hootsuite,@newsminer Fairbanks will host free kidney screenings on October 8th. Find full details here: http://t.co/t5kSCijo
118809678485520384,2011-09-27 22:10:09,SenatorBegich,1,0,Hootsuite,Learn about or share your thoughts on the Seward Highway rehabilitation project online: http://t.co/y98Q5lJe
118773224887693312,2011-09-27 19:45:18,SenatorBegich,4,1,Hootsuite,Transportation Secretary @RayLaHood is visiting Alaska. Here he is riding the Alaska railroad: http://t.co/xHMbym57 @akrr
118769444012044288,2011-09-27 19:30:16,SenatorBegich,0,0,Hootsuite,Alaska just hosted a successful satellite launch at the Kodiak Launch Complex. Photos: http://t.co/6uxi21yV
118751167210729472,2011-09-27 18:17:39,SenatorBegich,1,0,Twitter Web Client,It’s time for the Obama administration to make “go or no go” decisions on development in AK. I think it’s “go” time: http://t.co/zhwLQRzh
118462392681234432,2011-09-26 23:10:10,SenatorBegich,1,0,Hootsuite,Amazing work by the Midnight Sun Council Boy Scouts. They cleaned up a local park after vandals struck: http://t.co/p1Cmyr3t
118444678038294529,2011-09-26 21:59:46,SenatorBegich,2,0,Hootsuite,"Efforts to repair the Washington Monument will include an Alaska assist @DenaliNPS rope-rigging ranger, Brandon Latham: http://t.co/7fqRNQ8K"
118401418636967936,2011-09-26 19:07:52,SenatorBegich,0,0,Hootsuite,I'll be joining Senator Bill @Wielechowski on KOAN talk radio. Tune in at 1020 AM in Anchorage.
117701843353735168,2011-09-24 20:48:00,SenatorBegich,3,0,Hootsuite,Thanks to @AOPA for hosting me for a summit on aviation issues. Alaska has 16 times more aircraft per capita than the rest of the US.
117613026324123649,2011-09-24 14:55:05,SenatorBegich,5,0,Hootsuite,Today is National Hunting and Fishing Day. Good look to our hunters and anglers.
117344968225460224,2011-09-23 21:09:55,SenatorBegich,4,0,Hootsuite,"In rural Alaska mail isn’t just about @eBay or @Amazon, it’s a vital lifeline for medicine and goods. #BypassMail"
117344746279682048,2011-09-23 21:09:02,SenatorBegich,3,0,Hootsuite,I will fight Sen. McCain’s new bill to eliminate bypass mail.
117338983968681985,2011-09-23 20:46:08,SenatorBegich,2,0,Hootsuite,The No Child Left Behind Act is a broken and burdensome law. We need to return control of Alaska's classrooms to our communities.
117044033095868416,2011-09-23 01:14:06,SenatorBegich,0,0,Hootsuite,This is great news! RT @newsminer: Japan Airlines plans 18 charter flights this winter http://t.co/zo6Vtvhq
116997725198880768,2011-09-22 22:10:06,SenatorBegich,0,1,Hootsuite,Today is education themed. @NEAAlaska visited my office Photo: http://t.co/KbCeKCnW
116992315616272384,2011-09-22 21:48:36,SenatorBegich,1,0,TweetDeck,"RT @ChugachForestAK: Is a Fee Free Day! Begich, Boggs Visitor Center. Saturday, 9/24/11. Nat’l Public Lands Day, For info call visitor c ..."
116975754260127744,2011-09-22 20:42:47,SenatorBegich,0,0,Hootsuite,Today is the 50th anniversary of @PeaceCorps and some of Alaska’s Peace Corps alums visited me to celebrate Photo: http://t.co/GRBRLztZ
116960423907033088,2011-09-22 19:41:52,SenatorBegich,0,0,Hootsuite,The Alaska-based movie “Everybody Loves Whales” is now “Big Miracle.” I see plenty of Alaskans in the cast. Trailer: http://t.co/KJRhqrPG
116953589703913472,2011-09-22 19:14:43,SenatorBegich,0,0,Hootsuite,Weekend: Check out the 48-hour film challenge in Anchorage. I wish the Senate could make decisions that quick: http://t.co/KIPPaxP5
116931403098243072,2011-09-22 17:46:33,SenatorBegich,0,0,Hootsuite,Mistweet: These are Alaska's High School and Middle School Principals of the Year. Photo: owl.li/6C3Ae Our students are lucky
116924859556167680,2011-09-22 17:20:33,SenatorBegich,0,0,Hootsuite,Congrats to Alaska's High School and Middle School Teachers of the Year. Photo: http://t.co/xk3aqg7q
116866180400164864,2011-09-22 13:27:23,SenatorBegich,0,0,Hootsuite,This week is National Employer Support of the Guard and Reserve Week. Find more details here: http://t.co/Xk7qcLa3 #JobsforVets
116665568043606016,2011-09-22 00:10:13,SenatorBegich,4,0,Hootsuite,I joined @RepDonYoung for a video conference with the @AKStateChamber. We made it through the “lightening round” Photo: http://t.co/TVfbMrJ1
116647856097603584,2011-09-21 22:59:50,SenatorBegich,3,0,Hootsuite,Glad to see F-22s will be flying over Alaska again. Alaskans love the sound of freedom.
116641511164231681,2011-09-21 22:34:38,SenatorBegich,1,0,Hootsuite,Thanks to the @AmericanLegion for coming to share the needs of America’s veterans with the Senate this morning Photo: http://t.co/vHkOr63l
116611481453334528,2011-09-21 20:35:18,SenatorBegich,4,0,Hootsuite,You can welcome @BLMAlaska to Twitter by following them and asking questions. They'll be answering questions until 2 pm #Alaska #Tweetup
116574777409421312,2011-09-21 18:09:27,SenatorBegich,1,0,Hootsuite,"I'm getting ready to join the Alaska Chamber of Commerce meeting by video. If you're at the meeting, I'll see you soon."
