id,created_at,user,retweets,favorite_count,source,text
447091957853335552,2014-03-21 19:26:43,SenJohnThune,6,1,Twitter for BlackBerry,".@AjitPaiFCC asking the right question: ""Why should the FCC saddle rural Americans with rate increases... ?"" http://t.co/Xtv2iDOX9F"
446758794681651200,2014-03-20 21:22:51,SenJohnThune,8,15,Twitter for BlackBerry,Guest lecturing @UniversitySD Political Science class. Everyone gets an A today! http://t.co/goTjSRkDEs
446740156394266624,2014-03-20 20:08:47,SenJohnThune,4,5,Twitter for BlackBerry,Thanks to @masabamining President Jerad Higman for the tour. http://t.co/fDatxjrARs
446702727419011073,2014-03-20 17:40:04,SenJohnThune,2,12,Twitter Web Client,Sending off the @SDCoyotesWBB in Vermillion. Wishing them the best of luck in the @NCAAWomensBKB tourney! #goyotes http://t.co/3jRQ9UAF83
446695316046090241,2014-03-20 17:10:37,SenJohnThune,12,25,Twitter Web Client,Parker High School basketball team sharing their @marchmadness insights w/ me as we fill out a last minute bracket. http://t.co/CPF348svIp
446687326916603904,2014-03-20 16:38:52,SenJohnThune,13,11,Twitter Web Client,"VIDEO: Parker High Student President Michael Olson challenged me to a free throw contest. Congrats, Michael! http://t.co/XMQeYMiXGx"
446675522651947008,2014-03-20 15:51:58,SenJohnThune,10,4,Twitter Web Client,"VIDEO: ""50 States, 50 Stories: Why does Harry Reid call these #ObamaCare victims liars?"" @FreeBeacon: http://t.co/bFgfs9YY5F"
446406668494966785,2014-03-19 22:03:38,SenJohnThune,3,7,Twitter for BlackBerry®,Received some great insight from these South Dakota small biz owners at a roundtable this afternoon. http://t.co/pBqQF4lihP
446370054733438976,2014-03-19 19:38:08,SenJohnThune,4,3,Twitter Web Client,"""O-Care premiums to skyrocket"" @thehill: http://t.co/re4w5RkwEm #stickershock"
446328696454934528,2014-03-19 16:53:48,SenJohnThune,3,3,Twitter Web Client,Enjoyed the opportunity to visit w/ folks at the Precision Ag Conference today in Sioux Falls. http://t.co/FTKtfpMzqu
446314607972716544,2014-03-19 15:57:49,SenJohnThune,10,4,Twitter Web Client,SD named top agri-business state in new study by @ColoradoStateU: http://t.co/8KT6DwTgSy
446004076547821568,2014-03-18 19:23:53,SenJohnThune,0,0,Twitter Web Client,Enjoyed meeting w/ the SD Home Builders today in Sioux Falls. cc: @NAHBhome http://t.co/89MeQLuXdd
445984653111853056,2014-03-18 18:06:42,SenJohnThune,7,6,Twitter Web Client,Thanks to the Downtown Sioux Falls @lionsclubs for inviting me to give them a Washington update today. http://t.co/4jDmUIRpl0
445715450404409345,2014-03-18 00:16:59,SenJohnThune,5,8,Twitter for BlackBerry®,"Best wishes, Savannah! RT @SavannahGuthrie We did! http://t.co/RNLFciROV1"
445648749478424577,2014-03-17 19:51:56,SenJohnThune,6,3,Twitter for BlackBerry®,The Internet doesn't need a nanny state trying to stifle it. My statement on @NTIAgov's announcement: http://t.co/o5bBWFx6ak
444502690039885824,2014-03-14 15:57:54,SenJohnThune,3,4,Twitter for BlackBerry,Congratulations to @BlackHillsState on being named one of @MilitaryTimes best business schools for veterans: http://t.co/F1J9mtia1i
444242997879009282,2014-03-13 22:45:58,SenJohnThune,6,2,Twitter for BlackBerry,"""E.P.A.’s Proposed Rules on Water Worry Farmers"" @nytimes: http://t.co/YEFN79lORP"
444220880453775361,2014-03-13 21:18:05,SenJohnThune,6,2,Twitter Web Client,"Thanks Seth &amp; Shelly (@RepublicInsider), Charley &amp; Norma (@CusterChronicle) &amp; Dave (@SD_Newspapers) for dropping by. http://t.co/ZMZVpDg2ga"
444206069540470785,2014-03-13 20:19:14,SenJohnThune,1,1,Twitter for BlackBerry,Senate passes Child Care and Development Block Grant Reauthorization bill including my amendment: http://t.co/Z9IkHix5D0
444123438975025153,2014-03-13 14:50:53,SenJohnThune,0,1,Twitter for BlackBerry,".@argusleader: ""S.D. health care exchange signups low but not surprising"" http://t.co/64UdkUJ5iS"
443874808476868608,2014-03-12 22:22:55,SenJohnThune,5,8,Twitter for BlackBerry®,Great seeing Gina Elmore from Hot Springs &amp; Lane Haskell from Rapid City w/ the US Senate Youth Program. http://t.co/PpzUBcuzi4
443854189618155521,2014-03-12 21:01:00,SenJohnThune,2,4,Twitter Web Client,Enjoyed mtg w/ @USCG VADM Paul Zukunft &amp; look forward his confirmation hearing at @CommerceGOP next month. http://t.co/VTbzc6EmdM
443838697952116736,2014-03-12 19:59:26,SenJohnThune,4,2,Twitter Web Client,Enjoyed meeting w/ Jon Englund from Spearfish w/ the @mssociety in my D.C. office. http://t.co/Au0qmyLD9m
443832282508713984,2014-03-12 19:33:56,SenJohnThune,1,1,Twitter Web Client,"SD, ND, &amp; Mont. Missouri River Delegations Call on @USACEHQ to Prepare for Potential Flooding http://t.co/ANKSYrKM7K"
443828013432451072,2014-03-12 19:16:59,SenJohnThune,6,12,Twitter Web Client,Congrats to Zarin Rahman of Brookings who won 7th place at the #IntelSTS. http://t.co/VMr661y9RT
443821392254230529,2014-03-12 18:50:40,SenJohnThune,2,1,Twitter Web Client,".@fema, @USGS &amp; @NWS to hold flood outlook mtgs in Huron, Aberdeen, Watertown, Sioux Falls, &amp; Spearfish Mar 17-21. @USACEHQ Pierre mtg Apr 9"
443811882261295104,2014-03-12 18:12:53,SenJohnThune,5,3,Twitter Web Client,Happy B-Day #web25. I’m working to ensure the Internet can’t be taxed for the next 25 years! http://t.co/1UcWMm3ewD
443809733368356864,2014-03-12 18:04:20,SenJohnThune,6,6,Twitter Web Client,The web and Internet has flourished for 25 yrs w/o government meddling--let's keep it free &amp; open from govt control for another 25 #web25?
443801158638125056,2014-03-12 17:30:16,SenJohnThune,5,0,Twitter Web Client,.@nytimes says EPA shuttering coal plants hurts consumers: http://t.co/lrZk4zN0HW
443516990654009344,2014-03-11 22:41:05,SenJohnThune,13,4,Twitter Web Client,"When has that ever stopped them? ""HHS: We Lack 'Statutory Authority' to Extend Deadline to Sign Up for #Obamacare"" http://t.co/N5mohQqd4q"
443503151266545665,2014-03-11 21:46:05,SenJohnThune,5,2,Twitter Web Client,"Enjoyed meeting w/ @HCPD today in my D.C. office, thanks for stopping by. (cc: @HCPD_Olson) http://t.co/rgrir76IE5"
443480239780290560,2014-03-11 20:15:03,SenJohnThune,18,25,Twitter Web Client,Congrats to @gussowilliams5 &amp; the @USDCoyotesWBB team on their #SummitTourney championship!
443476750815600640,2014-03-11 20:01:11,SenJohnThune,3,4,Twitter Web Client,"Good to see Brookings @MayorTimReed &amp; his wife Mary in my Washington, D.C. office today. http://t.co/uZ9hl8WNjp"
443413128005427200,2014-03-11 15:48:22,SenJohnThune,2,2,Twitter Web Client,"Thanks to @sdsoybean for stopping by my Washington, D.C. office today. http://t.co/7FjZ4Fw9FQ"
443405879916756992,2014-03-11 15:19:34,SenJohnThune,4,4,Twitter Web Client,Enjoyed meeting w/ the SD @APA group today. http://t.co/BxdeH0Vz3O
443398669958909952,2014-03-11 14:50:55,SenJohnThune,6,3,Twitter Web Client,Heading to the Senate floor at 10:55amET to discuss why the Senate should be #Up4Jobs rather than talkathons. WATCH: http://t.co/l5QvZXWkJ6
443389811513393152,2014-03-11 14:15:43,SenJohnThune,22,0,Twitter Web Client,RT @FreeBeacon: VIDEO: @SenJohnThune: 'Every American ought to be outraged' at Obamacare carveout for unions http://t.co/y9cEOxJYmu
443180157017538560,2014-03-11 00:22:37,SenJohnThune,23,22,Twitter Web Client,"Tune in to @FoxNews' ""The Kelly File"" w/ @megynkelly @ 9:10pmET for my interview on the #ObamaCare union carveout."
443150600352444416,2014-03-10 22:25:11,SenJohnThune,3,9,Twitter Web Client,"Great to see the @USDCollegeRepub today in my Washington, D.C. office. http://t.co/FU7pHMDB67"
443060738983493633,2014-03-10 16:28:06,SenJohnThune,2,1,Twitter Web Client,Heading back to DC. Please send @JackrabbitWBB vs. @SDCoyotesWBB #SummitTourney updates.
442857063840874496,2014-03-10 02:58:46,SenJohnThune,5,14,Twitter for BlackBerry®,Jake Eckert and I are enjoying the #SummitLeague tournament! http://t.co/bPBlJQOMOd
442769771365285888,2014-03-09 21:11:54,SenJohnThune,4,4,Twitter for BlackBerry®,Congrats to @SDCoyotesWBB on a great win in the #SummitTourney! Looking forward to watching @SDCoyotes and @SDSU_Jacks tonight!
442377852084711425,2014-03-08 19:14:33,SenJohnThune,6,1,Twitter for BlackBerry®,"The same union research on #ObamaCare said it will ""hit the average, hard-working American where it hurts: in the wallet."""
442377575038332928,2014-03-08 19:13:27,SenJohnThune,6,2,Twitter for BlackBerry®,"According to new union research on #ObamaCare it ""...threatens the middle class w/ higher premiums..."" http://t.co/s6B6DnagtN"
442118313531826176,2014-03-08 02:03:14,SenJohnThune,4,5,Twitter for BlackBerry®,"I'll be joining @FoxNews' ""The Kelly File"" w/ @megynkelly shortly to discuss Obama's decision to grant unions an #ObamaCare carveout."
441949505718865921,2014-03-07 14:52:27,SenJohnThune,7,3,Twitter Web Client,"""New Post-ABC News poll: #KeystoneXL project overwhelmingly favored by Americans"" by 3 to 1 margin @washingtonpost: http://t.co/6Tdxem9TRx"
441721076234874880,2014-03-06 23:44:46,SenJohnThune,3,2,Twitter Web Client,Tune in to @CNBC tonight at 7:30pmET for my interview w/ @larry_kudlow on @TheKudlowReport regarding #ObamaCare delays &amp; union carveouts.
441694987227369472,2014-03-06 22:01:06,SenJohnThune,3,7,Twitter Web Client,"Enjoyed meeting Erin Marsh &amp; Ann Anderson, SD recipients of the Presidential Award for Math &amp; Science. http://t.co/WIVnUCiNBG"
441689438218096640,2014-03-06 21:39:02,SenJohnThune,12,7,Twitter Web Client,Today I introduced a bill w/ @amyklobuchar to better prepare &amp; respond to propane &amp; heating fuel shortages: http://t.co/gRAwPfbKyw
441639175050104832,2014-03-06 18:19:19,SenJohnThune,1,0,Twitter Web Client,Thanks to Andrew Schleuning from Rapid City w/ the American Osteopathic Association for stopping by my DC office. http://t.co/mdqvsPUSV8
441347757119258624,2014-03-05 23:01:19,SenJohnThune,1,4,Twitter Web Client,Enjoyed meeting today w/ Ken &amp; Nancy Kirk of Rapid City &amp; Doug Nohava of Garretson w/ the SD Funeral Directors. http://t.co/Rx9acri7vM
441329081234104320,2014-03-05 21:47:07,SenJohnThune,10,3,Twitter Web Client,New #ObamaCare delay is an obvious attempt to save vulnerable democrats’ jobs: http://t.co/2F6OUGam5v
441321962623602688,2014-03-05 21:18:49,SenJohnThune,5,3,Twitter Web Client,"""Senate Rejects Controversial Justice Dept. Pick"" @keloland: http://t.co/PZWFBFeVJp"
441306659336380416,2014-03-05 20:18:01,SenJohnThune,8,1,Twitter Web Client,Watch my exchange w/ Sec. Lew. MT @FreeBeacon: VIDEO: Treasury Sec Defends Bonuses for IRS Employees http://t.co/dbYDqzyuvg
440947751048970240,2014-03-04 20:31:50,SenJohnThune,5,0,Twitter Web Client,RT @SXMPOTUS: One place you can find bipartisanship on Capitol Hill? The Senate Gym. @SenJohnThune tells @chucktodd: https://t.co/vfLFZ0Qo0…
440932863186182144,2014-03-04 19:32:41,SenJohnThune,6,3,Twitter Web Client,Obama’s much delayed lame-duck budget will grow government while middle class shrinks: http://t.co/cJwNyQz3po
439897095856586752,2014-03-01 22:56:55,SenJohnThune,2,10,Twitter for BlackBerry®,Enjoying the @SDCoyotesMBB vs. @JackrabbitHoops game! Great day for basketball!
439445177326133248,2014-02-28 17:01:09,SenJohnThune,10,5,Twitter Web Client,Proud to be named a 2013 @ACUConservative for my votes supporting core conservative principles in the Senate. http://t.co/WeH4n7bs6D
439120056149368832,2014-02-27 19:29:14,SenJohnThune,2,2,Twitter Web Client,Do Senate Dems agree w/ Reid that their constituents aren't telling the truth about their #ObamaCare horror stories? http://t.co/KLiwseO3kQ
439028505427193857,2014-02-27 13:25:27,SenJohnThune,11,6,Twitter for BlackBerry®,Joining @AmericaNewsroom at 9:25am ET to discuss Harry Reid’s absurd comments that all #ObamaCare horror stories are “untrue.”
438817882139787264,2014-02-26 23:28:30,SenJohnThune,5,4,Twitter Web Client,.@StateDept IG says contractor that prepared environmental analysis on #KeystoneXL doesn't have a conflict-of-interest. Approve the pipeline
438802217689427968,2014-02-26 22:26:15,SenJohnThune,74,0,Twitter Web Client,RT @SenJohnBarrasso: .@SenatorReid if bad #Obamacare stories are all lies—why has #POTUS unilaterally delayed many parts of his own law? ht…
438785765896884224,2014-02-26 21:20:53,SenJohnThune,227,91,Twitter Web Client,"Sen. Reid owes an apology to Americans suffering under #ObamaCare whose personal stories he dismissed as ""untrue."" http://t.co/dIQ7M4VrDY"
438729480891547648,2014-02-26 17:37:14,SenJohnThune,32,13,Twitter Web Client,Tell that to my constituents / NRO: Reid: ‘All of’ the #ObamaCare Horror Stories ‘Are Untrue’ http://t.co/7ytORtZ4cR
438710669886894080,2014-02-26 16:22:29,SenJohnThune,12,1,Twitter Web Client,"""Company that makes medical equipment for kids hit hard by #ObamaCare"" @DailyCaller: http://t.co/7K45XsELoK"
438703444397137920,2014-02-26 15:53:46,SenJohnThune,4,1,Twitter Web Client,Joining @HappeningNow w/ @Jennafnc at 11:40amET to discuss Obama's MN visit &amp; why he should support repeal of #ObamaCare med device tax.
438420690249977858,2014-02-25 21:10:12,SenJohnThune,8,5,Twitter Web Client,"Jobs are the key to a future of opportunity, prosperity, &amp; security. My bill to create jobs for long-term unemployed: http://t.co/RafHENSQuI"
438393545112973312,2014-02-25 19:22:20,SenJohnThune,10,7,Twitter Web Client,"""President Obama is out of excuses on #KeystoneXL"" my op-ed in @thehill:  http://t.co/Ew2yQYyySI"
438345300462542849,2014-02-25 16:10:38,SenJohnThune,2,1,Twitter Web Client,"Obama Admin Changes to MA, Prescription Drug Program Harmful to America’s Seniors, read GOP leadership letter: http://t.co/NHkgzbYwqp"
438338803775074304,2014-02-25 15:44:49,SenJohnThune,4,6,Twitter Web Client,Headed to the Senate floor at 10:50amET to discuss the pain #ObamaCare continues to inflict on Americans. WATCH: http://t.co/l5QvZXEbuY
438332483655184384,2014-02-25 15:19:42,SenJohnThune,5,1,Twitter Web Client,65% of small biz will see their health-insurance premiums increase under #ObamaCare. @WSJ: http://t.co/3W34kRCOEx
438325857749577728,2014-02-25 14:53:22,SenJohnThune,10,3,Twitter Web Client,Obama &amp; Democrats need to step up on Trade Promotion Authority. My @Reuters op-ed: http://t.co/LcbGqqc25d #TPA
438092799515570176,2014-02-24 23:27:17,SenJohnThune,111,13,Twitter Web Client,"Join me in voting for @SDSU_Jacks for the #6thFan, go on &amp; cast your vote to support the #Jacks! http://t.co/j1fBsA6pAW #SDAKST"
438027029657944064,2014-02-24 19:05:56,SenJohnThune,5,2,Twitter Web Client,"In case you missed my interview w/ @EricShawnonFox yesterday on #ObamaCare's Medicare cuts, watch on @foxnewsvideo: http://t.co/5PV0X2BJ6K"
438016567121805312,2014-02-24 18:24:22,SenJohnThune,5,0,Twitter Web Client,RT @MikeEmanuelFox: #Sochi2014: @SenJohnThune pushing bill to keep US Olympic winners from being taxed on prizes-&gt; http://t.co/elvUtunEjz #…
437965000599031808,2014-02-24 14:59:27,SenJohnThune,50,9,Twitter Web Client,WaPo 4 Pinocchios: Obama’s claim that 7M got ‘access to health care for the 1st time’ because of Medicaid expansion http://t.co/wYLbOIbPwY
437595887145975808,2014-02-23 14:32:44,SenJohnThune,5,0,Twitter for BlackBerry®,Tune in to @FoxNews at 12:10pmET today for my interview w/ @EricShawnonFox on @ANHQDC to discuss #ObamaCare's impact on jobs &amp; the economy.
437389294571773952,2014-02-23 00:51:48,SenJohnThune,4,0,Twitter for BlackBerry®,Tune in to @FoxNews tomorrow at 12pmET for my interview w/ @EricShawnonFox on @ANHQDC to discuss #ObamaCare's impact on jobs &amp; the economy.
437046726805819392,2014-02-22 02:10:34,SenJohnThune,11,5,Twitter for BlackBerry®,Seniors are the latest victims of ObamaCare. My statement on the law’s new Medicare cuts: http://t.co/wKF6r0l03M
436981305834614785,2014-02-21 21:50:36,SenJohnThune,11,28,Twitter Web Client,"Thanks to Roncalli for hosting me today in Aberdeen, appreciated all the good questions. http://t.co/K4vpNQ8jTe"
436923604291567616,2014-02-21 18:01:19,SenJohnThune,5,5,Twitter Web Client,It's great to be a SDan! @keloland: SD is second in the nation for well-being: http://t.co/yXok0l0ijq
436906195622707200,2014-02-21 16:52:09,SenJohnThune,15,21,Twitter Web Client,"Good questions from students from Groton, Ipswich, Redfield, &amp; Langford Schools. Thanks for having me. http://t.co/sjAXJIm4NT"
436664057102217216,2014-02-21 00:49:58,SenJohnThune,2,4,Twitter for BlackBerry®,Thanks to the SD Federation of Labor for having me at their annual conference today. http://t.co/ZollA02mXX
436646574446219265,2014-02-20 23:40:30,SenJohnThune,4,10,Twitter for BlackBerry®,Great to see an enthusiastic bunch of Madison 4th graders in the Capitol in Pierre today.  http://t.co/gvfpPKwmha
436627508285673474,2014-02-20 22:24:44,SenJohnThune,2,1,Twitter Web Client,"Thanks for having me. MT @todayskccr: Sen. Thune on KCCR today talking Farm Bill, economy, Mo. River, &amp; politics. http://t.co/sCu2S0mRZl"
436621448770105344,2014-02-20 22:00:40,SenJohnThune,5,5,Twitter Web Client,Thanks to the SD House GOP caucus for meeting with me today--productive conversation. http://t.co/9eSLwz6k8G
436615379729649664,2014-02-20 21:36:33,SenJohnThune,3,7,Twitter Web Client,"Great Business Day luncheon put on by today by the State Chamber, thanks for having me. http://t.co/q2VKszJIoB"
436602738181292032,2014-02-20 20:46:19,SenJohnThune,3,5,Twitter Web Client,Enjoyed meeting w/ the @SDSenateGOP today in Pierre. Thanks for having me. http://t.co/ZEgOZWz2EC
436586056658341888,2014-02-20 19:40:02,SenJohnThune,4,4,Twitter Web Client,"Tune in to @cspan tonight at 10pmET for my interview w/ @SteveScully on ""American Profile"" http://t.co/UWnLxOHc6K http://t.co/BCKfTUXS0m"
436239851189706753,2014-02-19 20:44:20,SenJohnThune,12,8,Twitter Web Client,Interested in interning in my DC or state offices this summer? My office is currently accepting applications: http://t.co/eg8Vd0Ierm
436180728246980608,2014-02-19 16:49:24,SenJohnThune,7,11,Twitter Web Client,"Here’s my @MorningJoe interview from this morning w/ @JoeNBC, @MichaelSteele, @HFord2: http://t.co/F7zym6XQuo"
435888964021403648,2014-02-18 21:30:02,SenJohnThune,8,3,Twitter Web Client,New CBO Report: Democrats’ Proposed Minimum Wage Hike Could Result in up to 1 Million Fewer Jobs http://t.co/43l63EHCvW
435831724358897664,2014-02-18 17:42:35,SenJohnThune,4,3,Twitter Web Client,I'll be joining @FoxNews' @HappeningNow w/ @JonScottFNC at 12:50pmET to discuss #ObamaCare’s impact on jobs and the economy.
435563473536180224,2014-02-17 23:56:39,SenJohnThune,7,6,Twitter for BlackBerry®,(2/2) May we not drop the torch of freedom they've handed us. #PresidentsDay
435563369236410368,2014-02-17 23:56:14,SenJohnThune,6,4,Twitter for BlackBerry®,"(1/2) Like those whose faces are carved on Mt. Rushmore, American Presidents throughout our history have seized the moment to do big things."
435488096486842368,2014-02-17 18:57:07,SenJohnThune,31,21,Twitter for BlackBerry®,America continues to pay tribute to four of our greatest presidents in the Black Hills of SD. #PresidentsDay http://t.co/HvJInLyvLB
435461593116065792,2014-02-17 17:11:48,SenJohnThune,9,7,Twitter for BlackBerry®,Today we remember the men whose leadership &amp; strength made America a beacon of freedom &amp; democracy throughout the world. #PresidentsDay
435443618187210755,2014-02-17 16:00:23,SenJohnThune,18,7,Twitter Web Client,"5 yrs later, millions are still waiting for the relief promised when Dems jammed the #stimulus bill through Congress: http://t.co/QnbdQ3JXDR"
434819835043016704,2014-02-15 22:41:41,SenJohnThune,14,45,Twitter for BlackBerry,A wonderful day for our family as our beautiful oldest daughter Brittany marries Luke. http://t.co/Ea11hZAHio
434463147898830848,2014-02-14 23:04:21,SenJohnThune,8,7,Twitter Web Client,Graphic: Editorial boards across the country express support for #KeystoneXL approval. http://t.co/jbXOR92Ua8
434359074281365506,2014-02-14 16:10:47,SenJohnThune,1,0,Twitter Web Client,"""For Many, Few Health-Plan Choices, High Premiums on Online Exchanges"" @WSJ: http://t.co/IQvlI0p7i7"
434338185426907136,2014-02-14 14:47:47,SenJohnThune,6,3,Twitter Web Client,.@USOlympic athletes have won 12 medals at #Sochi2014. Will we welcome them home with a tax bill? http://t.co/pQDKcskmIt
434055469230215168,2014-02-13 20:04:22,SenJohnThune,10,0,Twitter Web Client,"RT @rollcall: .@SenJohnThune says in US, Olympians ""welcomed home from winning on world stage w/ a tax bill."" http://t.co/gCqurM97OX via @n…"
434024421691383808,2014-02-13 18:01:00,SenJohnThune,3,3,Twitter Web Client,"Today’s Omaha World Herald editorial: ""Time for a decision from Obama on #KeystoneXL pipeline"" @OWHnews: http://t.co/hVlXYI3sXL"
434007007398739968,2014-02-13 16:51:48,SenJohnThune,32,0,Twitter Web Client,RT @foxnewsvideo: Anatomy of the #ObamaCare changes | @gretawire @SenJohnThune http://t.co/A1w3nHU7q6
433759841798979584,2014-02-13 00:29:39,SenJohnThune,2,4,Twitter for BlackBerry®,"I'll be going ""On the Record"" w/ @gretawire @ 7:30pmET tonight to discuss Obama's latest delay of #ObamaCare for some businesses until 2016."
433735652450918400,2014-02-12 22:53:32,SenJohnThune,19,10,Twitter Web Client,Stop taxing @USOlympic medalists for their success! U.S. #Sochi2014 medalists shouldn't be punished for winning: http://t.co/pQDKcskmIt
433718161787981824,2014-02-12 21:44:02,SenJohnThune,11,9,Twitter Web Client,"""Always bear in mind that your own resolution to succeed, is more important than any other one thing."" - #Lincoln"
433708031931863040,2014-02-12 21:03:47,SenJohnThune,3,2,Twitter Web Client,"""Understanding the spirit of our institutions to aim at the elevation of men, I am opposed to whatever tends to degrade them."" - #Lincoln"
433685488969728000,2014-02-12 19:34:12,SenJohnThune,12,9,Twitter Web Client,"""Let us then turn this government back into the channel in which the framers of the Constitution originally placed it."" - #Lincoln"
433671044105109504,2014-02-12 18:36:48,SenJohnThune,22,16,Twitter Web Client,"""Nearly all men can stand adversity, but if you want to test a man's character, give him power."" - #Lincoln"
433660551994953728,2014-02-12 17:55:07,SenJohnThune,21,13,Twitter Web Client,"We celebrate the 205th birthday of our 16th pres, Abe #Lincoln, whose strength &amp; leadership preserved the union, ensuring freedom for all."
433284813244469249,2014-02-11 17:02:04,SenJohnThune,11,2,Twitter Web Client,Headed to Senate floor to discuss how #ObamaCare is making things worse. WATCH: http://t.co/bP52vU6mC1
431951271658921984,2014-02-08 00:43:03,SenJohnThune,5,5,Twitter for BlackBerry®,Enjoyed visiting w/ Myron Williams w/ @SDCattlemen at the @BHStockShow. http://t.co/yCvQrzdBsr
431920573728296960,2014-02-07 22:41:04,SenJohnThune,3,6,Twitter Web Client,Met with President Bob Fortune and the Stockgrowers to discuss #FarmBill @BHStockShow. http://t.co/Gq1OvwkD3X
431806067581157376,2014-02-07 15:06:03,SenJohnThune,5,4,Twitter Web Client,"We can't wait any longer on bipart jobs ideas: #KeystoneXL, #TPA @politico: ""Another disappointing jobs report"" http://t.co/m1cZQhO11v"
431576572240625664,2014-02-06 23:54:07,SenJohnThune,23,18,Twitter for BlackBerry,"""The answer to a government that's too big is to stop feeding its growth."" #Reagan"
431563765944172544,2014-02-06 23:03:14,SenJohnThune,31,23,Twitter for BlackBerry,"""We don't have deficits because people are taxed too little. We have deficits because big government spends too much."" #Reagan"
431547604657524736,2014-02-06 21:59:01,SenJohnThune,22,14,Twitter for BlackBerry,"""The nine most terrifying words in the English language are: I'm from the Government, and I'm here to help."" #Reagan"
431532215462539264,2014-02-06 20:57:52,SenJohnThune,9,3,Twitter for BlackBerry,"""The fact is, our deficits come from the uncontrolled growth of the budget for domestic spending."" #Reagan"
431520020653699072,2014-02-06 20:09:24,SenJohnThune,40,29,Twitter for BlackBerry,"""Well, one of the worst mistakes anybody can make is to bet against Americans."" #Reagan"
431502464555450368,2014-02-06 18:59:39,SenJohnThune,14,8,Twitter for BlackBerry,"""In a world wracked by hatred, economic crisis, and political tension, America remains mankind's best hope."" #Reagan "
431488217146466305,2014-02-06 18:03:02,SenJohnThune,36,32,Twitter for BlackBerry,"""We cannot reduce the deficit by raising taxes."" #Reagan The Gipper would have been 103 today. Happy birthday, Mr. President!"
431178096260030464,2014-02-05 21:30:43,SenJohnThune,9,4,Twitter Web Client,".@businessinsider: ""A Republican Senator Has A Smart Plan To Help The Long-Term Unemployed"" http://t.co/EVV5Ulho1u"
431092009840181248,2014-02-05 15:48:39,SenJohnThune,6,0,Twitter Web Client,RT @KellyAyotte: Read my op-ed w @DeanHeller  and @SenRonJohnson on updating our telecom laws 2 encourage free market &amp; competition http://…
430808638383738880,2014-02-04 21:02:38,SenJohnThune,157,0,Twitter Web Client,"RT @EricCantor: Remember this crowd? Because of ObamaCare, nearly 3x as many will no longer be working. http://t.co/Jj914i49jl"
430745901963816960,2014-02-04 16:53:20,SenJohnThune,2,1,Twitter Web Client,Heading to the Senate floor to discuss #ObamaCare &amp; the importance of passing bipartisan job-creating bills. WATCH: http://t.co/bP52vU6mC1
430734519914610688,2014-02-04 16:08:06,SenJohnThune,12,1,Twitter Web Client,"""#ObamaCare will push 2 million workers out of labor market: CBO"" @WashTimes http://t.co/M3aQvdoRhC"
430715570783137792,2014-02-04 14:52:49,SenJohnThune,7,2,Twitter Web Client,"VIDEO: Pres. Obama's #GotAPhone, he should use it to help pass the bipartisan #TPA bill. http://t.co/DaL3aZrw7a"
