id,created_at,user,retweets,favorite_count,source,text
95554649125421056,2011-07-25 18:02:58,senjonkyl,37,7,Facebook,"""The only thing we haven't said 'yes' to is job-killing tax increases."" -Senator Kyl on CBS' Face the Nation http://fb.me/11H3dGuh7"
93008073047805952,2011-07-18 17:23:47,senjonkyl,20,4,Facebook,"""Unless the president gets off of his absolute obsession with raising taxes, Republicans are not going to agree to... http://fb.me/QgPBBce5"
91634495685541888,2011-07-14 22:25:40,senjonkyl,21,4,Facebook,"""We’re just not going to do that” –Senator Kyl on Democrats' insistence on higher taxes and more spending http://fb.me/WmmC33Wi"
88757394817024000,2011-07-06 23:53:06,senjonkyl,7,4,Facebook,GretaWire report: Sen. Kyl comes out swinging against false White House spin on debt talks http://fb.me/OkYUzP0A
85388274239148032,2011-06-27 16:45:25,senjonkyl,2,0,Facebook,Fire recovery tips and resources for residents in Arizona communities affected by the recent wildfires. Please... http://fb.me/12hTP4i26
85382764936962048,2011-06-27 16:23:32,senjonkyl,11,1,Facebook,"“If you want to kill the economy, raise taxes. Are we going to vote to absolutely put another anchor around the... http://fb.me/IcaAC2nM"
84365777574166529,2011-06-24 21:02:23,senjonkyl,1,0,Facebook,Tune into FOX News Sunday this weekend to see Senator Kyl discuss the breakdown of the deficit reduction talks and... http://fb.me/AQ0reiyz
83947297783820288,2011-06-23 17:19:30,senjonkyl,2,0,Facebook,Jon Kyl and Leader McConnell on the deficit reduction meetings and the White House and Democrats’ insistence on... http://fb.me/14thB67o1
81755106609074176,2011-06-17 16:08:31,senjonkyl,3,0,Facebook,Jon Kyl talks with FOX 10 about the massive fires currently burning in Arizona and what should be done to limit... http://fb.me/M2x6Ick1
80790113705148417,2011-06-15 00:13:58,senjonkyl,3,0,Facebook,"""Although the need to suppress fires is not going to go away, it is widely recognized that active forest... http://fb.me/vAiDwhe0"
80786695863287808,2011-06-15 00:00:23,senjonkyl,2,0,Facebook,Jon Kyl on the Arizona fires and forest management policy: “The current federal system continues to give funding... http://fb.me/SO7b60SG
70518288890867712,2011-05-17 15:57:24,senjonkyl,3,1,Facebook,Video of Senator Kyl appearing on FOX News Sunday to say that we must dramatically reduce spending -- not raise... http://fb.me/NDIyONxn
67728089483972608,2011-05-09 23:10:09,senjonkyl,3,0,Facebook,The Future of American Prosperity http://fb.me/UYpknWNN
60084731835973632,2011-04-18 20:58:11,senjonkyl,10,2,Facebook,Senator Kyl discusses the enhanced 10-point border security plan that he introduced with Sen. McCain to combat... http://fb.me/SzmpRUur
58299396353302528,2011-04-13 22:43:53,senjonkyl,9,2,Facebook,Sens. Kyl and McCain on the introduction of their enhanced 10-point border security action plan http://fb.me/PiOtibKZ
56515114039382016,2011-04-09 00:33:47,senjonkyl,8,0,Facebook,Senator Kyl examines reality vs. rhetoric when it comes to reducing spending and a potential government shutdown http://fb.me/TonxDXV6
52819312741851138,2011-03-29 19:48:00,senjonkyl,17,1,Facebook,“Political correctness cannot stand in the way of identifying those who would do us harm.” http://fb.me/DkkVVaIb
52486273641873408,2011-03-28 21:44:37,senjonkyl,10,2,Facebook,"Jon Kyl introducing the PATIENTS Act, a bill aimed at prohibiting health-care rationing under ObamaCare http://fb.me/XO2FWE3W"
47421402961293312,2011-03-14 22:18:38,senjonkyl,4,0,Facebook,On CNN Sunday discussing Democrats' failure to seriously reduce government spending http://fb.me/FTDHnvn7
42381575014457344,2011-03-01 00:32:09,senjonkyl,1,0,Facebook,http://fb.me/S8YfJ1ul
38639424954826753,2011-02-18 16:42:11,senjonkyl,4,1,Facebook,"""Democrats just can’t stand the thought of spending less taxpayer dollars."" http://fb.me/GXNFZ6n2"
37942889661214720,2011-02-16 18:34:24,senjonkyl,2,0,Facebook,Interview on President Obama's massive new budget (nearly $4 trillion) and how it fails Americans’ demand for... http://fb.me/HpwBKRTx
37914837757591552,2011-02-16 16:42:56,senjonkyl,3,1,Facebook,"Candid, in-depth interview with Senator Kyl about his decision to not seek re-election in 2012, and the work that... http://fb.me/VAoQFaiA"
36048056642183168,2011-02-11 13:05:01,senjonkyl,4,0,Facebook,"""I really can't explain it any better than to just say, 'My heart says it's time.'"" http://fb.me/OFI61Ed5"
35857655209803776,2011-02-11 00:28:25,senjonkyl,5,0,Facebook,Video: Senator Kyl announces that he will not seek reelection in 2012 http://fb.me/Op6vj8MT
30393279921000448,2011-01-26 22:34:57,senjonkyl,0,0,Facebook,"Insightful, far-ranging interview with Senator Kyl by WashPo's Jennifer Rubin http://fb.me/SJ80nRDO"
30353279951048704,2011-01-26 19:56:00,senjonkyl,3,0,Facebook,Senator Kyl on the Senate floor honoring the heroes and victims of the heinous shooting in Tucson http://fb.me/BdzllJMS
30340924886224896,2011-01-26 19:06:54,senjonkyl,0,0,Facebook,More from Senator Kyl on the State of the Union Address on National Review Online http://fb.me/LDo2JwTv
30319839818031104,2011-01-26 17:43:07,senjonkyl,1,0,Facebook,Senator Kyl on the hefty spending agenda outlined by President Obama in last night's SOTU address http://fb.me/GEQRUljT
24481237036965888,2011-01-10 15:02:36,senjonkyl,0,0,Facebook,Senator Kyl remembering the victims of the shooting attack in Tucson http://fb.me/LDlIAgdS
23907744452968448,2011-01-09 01:03:45,senjonkyl,4,2,Facebook,Senator Kyl on the heinous shooting attack in Tucson today http://fb.me/Nx1CkcJE
23528529274605568,2011-01-07 23:56:53,senjonkyl,1,0,Facebook,Senator Kyl tells Greta that the Democrats’ effort to raise the debt ceiling must be met with serious spending... http://fb.me/Q05D81Jw
23473054977892352,2011-01-07 20:16:27,senjonkyl,0,0,Facebook,Watch Senator Kyl this Sunday on CBS' Face The Nation
15893850543362048,2010-12-17 22:19:23,senjonkyl,3,0,Facebook,Watch Senator Kyl this Sunday on FOX News Sunday http://fb.me/A2UDxFpq
15174563881029632,2010-12-15 22:41:12,senjonkyl,3,0,Facebook,Video of Senator Kyl speaking out today on Democrats' irresponsible year-end effort to jam through the new START... http://fb.me/CXVXpgYi
13371086846562304,2010-12-10 23:14:50,senjonkyl,3,0,Facebook,FNC's Megyn Kelly and pollster Frank Luntz discuss that Senator Kyl makes the best case for keeping current tax... http://fb.me/w5q6AHNk
11501011340365825,2010-12-05 19:23:49,senjonkyl,6,0,Facebook,"Video of Senator Kyl debating the Democrats' tax hike plan and the new START treaty on ""Face The Nation"" http://fb.me/Av5VwRkP"
10780997234728960,2010-12-03 19:42:44,senjonkyl,4,0,Facebook,Video of Senator Kyl talking with FNC's Greta Van Susteren about the Democrats' year-end tax hike and... http://fb.me/PzUioVQs
10745392601767936,2010-12-03 17:21:15,senjonkyl,3,0,Facebook,"In case you missed it...Arizona Republic editorial on White Mountain Apache Water Rights Settlement: ""Kyl's... http://fb.me/Nn1h3zhD"
10711518442160128,2010-12-03 15:06:39,senjonkyl,4,0,Facebook,Watch Senator Kyl this Sunday on CBS' Face The Nation
8913979300646913,2010-11-28 16:03:52,senjonkyl,2,0,Facebook,"Senator Kyl discussing the new START treaty, TSA “pat-downs” and the Democrats' push for a massive year-end tax... http://fb.me/KPmDlrJq"
8600210439667712,2010-11-27 19:17:04,senjonkyl,6,0,Facebook,Watch Senator Kyl this Sunday on NBC's Meet The Press
6794509060935680,2010-11-22 19:41:51,senjonkyl,3,0,Facebook,Column on whether Congress will heed the voters' call to cut spending and end the practice of earmarking http://fb.me/EOw1AbIz
4678938752188417,2010-11-16 23:35:20,senjonkyl,5,2,Facebook,Column looking at President Obama’s foreign policy results thus far http://fb.me/E6oU9wDK
4659700230529025,2010-11-16 22:18:53,senjonkyl,1,0,Facebook,Statement on the Senate GOP's proposed moratorium on earmarks... http://fb.me/JgL1e7dG
2112057939857408,2010-11-09 21:35:28,senjonkyl,1,0,Facebook,Reviewing the midterm election results with a look ahead to the next session on Friday’s Arizona Illustrated... http://fb.me/xlvMOi31
1761835149688832,2010-11-08 22:23:48,senjonkyl,3,1,Facebook,New column on the 30th anniversary of President Reagan's election and how the lessons of his presidency can guide... http://fb.me/MRQeGtoE
27256841333,2010-10-13 16:28:55,senjonkyl,1,2,Facebook,New Column: Congress's Unfinished Business http://fb.me/IXWrEnEQ
25435680332,2010-09-24 20:19:44,senjonkyl,5,1,Facebook,Judiciary Republicans Demand Answers From Napolitano over “Backdoor Amnesty” Memos http://fb.me/Ih2xx2tU
24200829904,2010-09-11 15:01:21,senjonkyl,3,0,Facebook,on the Ninth Anniversary of the September 11th Attacks http://fb.me/HbdoT65F
22298230827,2010-08-27 21:06:33,senjonkyl,0,0,Facebook,"Talking terrorism, the economy and politics with the Nearly Famous Barry Young http://fb.me/IcB8I0vS"
20743341328,2010-08-09 22:52:12,senjonkyl,0,1,Facebook,Interview with Mike Gallagher on the Ground Zero mosque controversy and the legal challenge of AZ's immigration... http://fb.me/EiYrHHVg
20731898389,2010-08-09 19:38:38,senjonkyl,0,0,Facebook,New column:  A Mosque at Ground Zero? http://fb.me/CqKo880U
20252255500,2010-08-03 21:44:09,senjonkyl,2,0,Facebook,"""A compelling case for opposing Elena Kagan’s confirmation to the Supreme Court"" http://fb.me/CSPVUTDV"
20252018949,2010-08-03 21:40:05,senjonkyl,0,0,Facebook,Remarks outlining the reasons for his opposition of Elena Kagan's nomination to serve on the Supreme Court http://fb.me/C1GjSKPJ
20154813081,2010-08-02 17:23:16,senjonkyl,1,0,Facebook,"Discussing immigration enforcement and the DHS amnesty memo on CBS' ""Face the Nation"" http://fb.me/GnK9YAYG"
19841161438,2010-07-29 17:09:52,senjonkyl,3,0,Facebook,On the temporary ruling against AZ’s immigration enforcement law: “The decision was not sound...we hope that we... http://fb.me/E7Mkenqq
19006116400,2010-07-20 16:27:59,senjonkyl,7,1,Facebook,Announcing that he will oppose the nomination of Elena Kagan to serve on the Supreme Court http://fb.me/DVt54Qh1
18450513952,2010-07-13 16:44:14,senjonkyl,1,0,Facebook,Senator Kyl on the Senate floor: The recess appointment of Donald Berwick http://fb.me/t1qigsvU
18366811634,2010-07-12 16:38:03,senjonkyl,0,0,Facebook,"Interview with Chris Wallace on AZ's immigration law, border security, Obama's controversial recess appointment of... http://fb.me/EfvQS9j5"
17970845433,2010-07-07 18:46:09,senjonkyl,6,0,Facebook,On the Obama Administration's lawsuit against the State of Arizona and its immigration law http://fb.me/EjwcsMs2
17528152412,2010-07-01 23:27:16,senjonkyl,4,0,Facebook,Kyl responds to Obama's immigration speech http://fb.me/C8A573s3
17277689869,2010-06-28 20:26:02,senjonkyl,0,0,Facebook,Kagan confirmation hearings - day one - analysis from National Review Online http://fb.me/B8fnRGdF
17271609620,2010-06-28 18:48:40,senjonkyl,0,0,Facebook,Opening remarks at the confirmation hearings for Elena Kagan http://fb.me/BnIDyxH9
17253574533,2010-06-28 14:06:26,senjonkyl,6,1,Facebook,Breaking news: Arizona IS a border state http://fb.me/xWXItKIW
16870243014,2010-06-23 19:04:22,senjonkyl,3,0,Facebook,"Appearing ""On the Record"" with Sen. McCain to talk about our recent border tour & the growing violence that area... http://fb.me/AaCKcHBR"
16862890214,2010-06-23 17:02:46,senjonkyl,2,0,Facebook,ABC 15 news report looks at who is actually crossing illegally into the U.S. http://fb.me/BNV8faMP
16797779855,2010-06-22 20:50:43,senjonkyl,5,0,Facebook,Senators Kyl and McCain share the pleas and concerns expressed by Southern Arizona residents during their recent... http://fb.me/A1LBcxJO
16792778552,2010-06-22 19:23:53,senjonkyl,8,0,Facebook,Kyl responds to White House officials' denial of Oval Office conversation http://fb.me/AHU2yfqk
16780659546,2010-06-22 15:59:13,senjonkyl,3,0,Facebook,New column: Medicare and the new Health Care Law: Separating Fact from Fiction http://fb.me/A3ss8tzs
16732420464,2010-06-22 00:23:23,senjonkyl,6,0,Facebook,Fox News all-stars discuss Kyl's town hall remarks and whether or not Obama is using border security as a... http://fb.me/A3zxNOV0
16732135201,2010-06-22 00:18:34,senjonkyl,5,0,Facebook,FNC report on whether Obama is using border security as a bargaining chip to get comprehensive immigration reform. http://fb.me/uqGrNzJc
16726367977,2010-06-21 22:37:16,senjonkyl,1,0,Facebook,"News report of Kyl's recent border tour and town hall meeting in Douglas, Arizona http://fb.me/Da4uSPSt"
16718417168,2010-06-21 20:09:08,senjonkyl,33,1,Facebook,Kyl response to White House denials of its immigration strategy:  “What I said occurred did occur” http://fb.me/BU6KTphb
14779192996,2010-05-26 18:03:52,senjonkyl,3,0,Facebook,FNC interview on the White House's new border security plan http://bit.ly/ahMfVa
14727866306,2010-05-26 00:30:39,senjonkyl,4,0,Facebook,"On Obama's plan to send 1,200 National Guard troops to the border: ""A weak start"" http://bit.ly/dlhx1K"
14717688301,2010-05-25 21:11:30,senjonkyl,2,0,Facebook,"Obama attends Senate GOP policy meeting, Kyl raises comments made by the administration about the new Arizona... http://bit.ly/9M6zEr"
14716878998,2010-05-25 20:54:17,senjonkyl,2,0,Facebook,"FNC reports on Senator Kyl's letter asking DHS to clarify some troubling comments made Obama's Immigration chief,... http://bit.ly/a423nY"
14254406242,2010-05-18 22:35:26,senjonkyl,5,0,Facebook,"Kyl, McCain call on Posner to Retract Comments Likening Arizona’s Immigration Statute to China’s Human Rights Abuses http://bit.ly/dwKEyG"
14253578496,2010-05-18 22:19:00,senjonkyl,1,0,Facebook,FNC's Griff Jenkins caught up with Senator Kyl to ask about his call for the National Guard to help secure the... http://bit.ly/ceUZuW
14183888671,2010-05-17 21:17:24,senjonkyl,2,0,Facebook,"Another visit on the Jon Justice Show to discuss the Kagan nomination, border security and the divisive ethnic... http://bit.ly/9EAU4I"
14180473403,2010-05-17 20:02:05,senjonkyl,1,0,Facebook,"Discussing the Kagan nomination on Sunday's ""Face The Nation"" http://bit.ly/8ZNMrA"
13805548481,2010-05-11 19:38:37,senjonkyl,2,0,Facebook,"Talking with Greta about the new Supreme Court nominee, Elena Kagan http://bit.ly/9bkzRU"
13331400080,2010-05-03 23:06:57,senjonkyl,3,0,Facebook,"On the Mike Gallagher Show discussing leadership, and the lack of it, on border security and immigration enforcement http://bit.ly/aU1EsP"
13072960182,2010-04-29 14:57:25,senjonkyl,3,0,Facebook,Named one of the 100 world's most influential people by Time magazine http://bit.ly/apH9In
13035767135,2010-04-28 23:49:18,senjonkyl,0,0,Facebook,"Interview with Dennis Prager on Arizona's ""Support Our Law Enforcement and Safe Neighborhoods"" law aimed at... http://bit.ly/8ZbyEL"
12663373613,2010-04-22 21:57:31,senjonkyl,3,0,Facebook,Telling FNC's Greta Van Susteren about Arizona's escalating border violence and the need for immediate federal action. http://bit.ly/9sLoHK
12603021455,2010-04-21 22:56:24,senjonkyl,1,0,Facebook,3TV news report on the 10-point border security plan by Sens. Kyl and McCain. Read the entire plan at... http://bit.ly/8YBxqE
12185608089,2010-04-14 21:42:38,senjonkyl,2,0,Facebook,Remarks from Senator Kyl on what Arizonans told him during the recent congressional recess http://bit.ly/b7MU4K
12106112709,2010-04-13 14:21:11,senjonkyl,0,0,Facebook,"Discussing the next Supreme Court vacancy on ABC's ""This Week"" http://bit.ly/aohz4K"
12068612775,2010-04-12 22:11:18,senjonkyl,4,0,Facebook,Video of Senator Kyl delivering the GOP's weekly address http://bit.ly/cqcDTn
11256220976,2010-03-29 16:01:39,senjonkyl,7,0,Facebook,Here's another ugly surprise hidden inside the ObamaCare law... http://bit.ly/c5yYam
11104942228,2010-03-26 19:05:22,senjonkyl,7,1,Facebook,Jon Kyl on the GOP strategy to repeal ObamaCare and replace with better ideas and targeted solutions http://bit.ly/dm8ZNT
11041271045,2010-03-25 16:12:38,senjonkyl,4,0,Facebook,Responding to Democrats' false claims about ObamaCare http://bit.ly/auU65F
11041129625,2010-03-25 16:09:30,senjonkyl,0,0,Facebook,"Updating the Hugh Hewitt Show on the ObamaCare ""reconciliation"" bill http://bit.ly/aatVvD"
10981025663,2010-03-24 14:17:26,senjonkyl,0,0,Facebook,On CNN discussing what happens next with ObamaCare. http://bit.ly/930qgy
10935146755,2010-03-23 17:21:12,senjonkyl,1,0,Facebook,On ObamaCare's passage and how Democrats are already trying to change it with a reconciliation bill. http://bit.ly/caLmmI
10934914431,2010-03-23 17:15:31,senjonkyl,0,0,Facebook,Deconstructing ObamaCare on the Dennis Miller Show. http://bit.ly/aTuUGh
10675412708,2010-03-18 15:13:16,senjonkyl,1,0,Facebook,"FNC interview on the ""deem-and-pass"" strategy that Democrats may use to pass ObamaCare without a vote. http://bit.ly/cG413I"
10623357302,2010-03-17 14:18:45,senjonkyl,0,0,Facebook,"On the Hugh Hewitt Show discussing the Democrats' new plan to ""deem"" ObamaCare as passed, rather than take an... http://bit.ly/bzbb0J"
10374432542,2010-03-12 14:39:18,senjonkyl,0,0,Facebook,Letter from Jon Kyl in today's NY Times responding to Paul Krugman on unemployment benefits and job creation http://bit.ly/9QamUV
10334062958,2010-03-11 18:30:53,senjonkyl,1,0,Facebook,On FNC discussing what is likely to happen should the House of Representatives pass the Senate version of ObamaCare... http://bit.ly/a79eAy
10286998997,2010-03-10 20:17:13,senjonkyl,1,0,Facebook,"On the Jon Justice Show talking about the Democrats' final push for ObamaCare, whether government unemployment... http://bit.ly/d05Wql"
9896968966,2010-03-02 23:31:59,senjonkyl,1,0,Facebook,Jon Kyl talks with Greta about Democrats' plan to use reconciliation maneuver to pass ObamaCare http://bit.ly/9VuR9C
9151019844,2010-02-15 18:38:57,senjonkyl,1,0,Facebook,"Video of interview on CNN's ""State of the Union"" http://bit.ly/dzOy19"
8963224407,2010-02-11 14:42:30,senjonkyl,2,0,Facebook,New interview on President Obama's planned televised White House meeting aimed at reviving ObamaCare and the... http://bit.ly/dgWcsQ
8824604916,2010-02-08 21:06:12,senjonkyl,3,0,Facebook,Weekly column on nuclear energy and the President's call during his State of the Union address for new nuclear... http://bit.ly/aONVkn
8238847081,2010-01-26 15:25:22,senjonkyl,1,0,Facebook,"On the Dennis Prager Show, discussing what could still happen with the health care bill http://bit.ly/51U2kx"
8047129961,2010-01-21 23:55:20,senjonkyl,1,0,Facebook,How the election of Scott Brown to the US Senate will impact the Democrats' agenda on health care http://bit.ly/5O5sty
8031557730,2010-01-21 15:53:09,senjonkyl,1,0,Facebook,"Talking politics, health care and national security with FOX 10's John Hook http://bit.ly/5pkK0C"
8028861821,2010-01-21 14:32:22,senjonkyl,1,0,Facebook,"Reviewing Obama's first year: ""Taking stock now a year later, it is apparent the President has not delivered the... http://bit.ly/4neXb4"
7996548578,2010-01-20 19:23:43,senjonkyl,0,0,Facebook,Weekly column on Democrats' special deals to pass ObamaCare http://bit.ly/6Me1NC
7948410545,2010-01-19 15:12:52,senjonkyl,0,0,Facebook,"Video of a townhall meeting with Jon Kyl recently held in Oro Valley, AZ http://bit.ly/7yraRh"
7948328086,2010-01-19 15:10:19,senjonkyl,0,0,Facebook,"News report of a recent townhall with Jon Kyl in Oro Valley, AZ http://bit.ly/4B3vMR"
7788395229,2010-01-15 14:06:32,senjonkyl,1,0,Facebook,"Interview on on Arizona Illustrated talking health care, national security and the so-called ""virtual"" border fence http://bit.ly/6e16e3"
7630149865,2010-01-11 14:01:32,senjonkyl,0,0,Facebook,Jon Kyl appearing on FOX News Sunday debates the Obama administration's poor handling of the Christmas Day terror... http://bit.ly/8wjOJb
7199743275,2009-12-30 16:04:01,senjonkyl,2,0,Facebook,Senators Kyl & McCain react to the Obama administration's handling of the Christmas Day terrorist attack http://bit.ly/7YbeMo
7161647140,2009-12-29 15:19:17,senjonkyl,4,0,Facebook,Remarks on the Democrats' desire to borrow even more money than we already owe to pay for their spending spree http://bit.ly/5r1sRN
6976438127,2009-12-23 21:00:08,senjonkyl,4,0,Facebook,Jon Kyl tells listeners of the Dennis Prager Show to keep up the fight against ObamaCare http://bit.ly/7h4WpI
6966019803,2009-12-23 14:43:43,senjonkyl,3,0,Facebook,Jon Kyl pointing out the real cost and dangers of the Senate ObamaCare bill http://bit.ly/6V3ltg
6897213978,2009-12-21 16:06:08,senjonkyl,1,0,Facebook,"Video of Jon Kyl on ABC's ""This Week"" debating ObamaCare and the sweetheart deals Democrats cut to get 60 votes http://bit.ly/5z7JIR"
6897091642,2009-12-21 16:01:59,senjonkyl,3,0,Facebook,Jon Kyl at press conference on Democrats' sweetheart deals in ObamaCare http://bit.ly/66n9MI
6819916545,2009-12-19 04:32:58,senjonkyl,0,0,Facebook,http://bit.ly/7srQVe
6811811664,2009-12-18 23:19:20,senjonkyl,0,0,Facebook,"Tune in Sunday morning to ABC ""This Week"" http://bit.ly/5bRvBM"
6805450269,2009-12-18 19:15:10,senjonkyl,0,0,Facebook,Interview on the Mark Levin Show about the GOP's strategy on the Senate ObamaCare bill http://bit.ly/6VCpet
6703486725,2009-12-15 18:19:39,senjonkyl,0,0,Facebook,"The Hill: Kyl pledges GOP still won't vote for health bill, despite compromise http://bit.ly/8pMKUW"
6675222663,2009-12-14 22:16:12,senjonkyl,3,0,Facebook,New column on the Senate effort to defeat ObamaCare http://bit.ly/4yovuC
6567982477,2009-12-11 14:36:29,senjonkyl,1,0,Facebook,"On the massive omnibus spending bill, runaway unemployment and debt... http://bit.ly/4VFgfq"
6535042905,2009-12-10 15:56:32,senjonkyl,0,0,Facebook,"On the Hugh Hewitt Show, answering concern and criticism that Senate Republicans may not be doing everything they... http://bit.ly/4uZgjP"
6532919920,2009-12-10 14:41:52,senjonkyl,0,0,Facebook,Key interview on the grave consequences for Americans if ObamaCare passes and what Senate Republicans are doing to... http://bit.ly/60ylaM
6497109577,2009-12-09 14:11:26,senjonkyl,0,0,Facebook,New remarks on deals Democrats make to roundup votes for ObamaCare http://bit.ly/61qfhJ
6466499756,2009-12-08 15:40:29,senjonkyl,0,0,Facebook,"Telephone townhall with Jon Kyl, hosted by the Tucson Tea Party http://bit.ly/772MOj"
6432732125,2009-12-07 15:05:17,senjonkyl,0,0,Facebook,"""State of the Union"" discussion on Afghanistan timelines and ObamaCare http://bit.ly/6bQTop"
6339689562,2009-12-04 15:25:18,senjonkyl,0,0,Facebook,Interview on the Hugh Hewitt Show regarding ObamaCare http://bit.ly/6HiEP3
6307553352,2009-12-03 16:20:58,senjonkyl,0,0,Facebook,New remarks on Democrat-proposed Medicare cuts to pay for ObamaCare http://bit.ly/5ar1mf
6281839131,2009-12-02 21:35:40,senjonkyl,0,0,Facebook,Analysis of President Obama's plan for the war in Afghanistan http://bit.ly/7OyDvn
6246067973,2009-12-01 20:35:42,senjonkyl,0,0,Facebook,Kyl talks with radio host Dennis Prager about the start of the Senate's debate of ObamaCare http://bit.ly/4K5j38
6245014122,2009-12-01 19:55:41,senjonkyl,0,0,Facebook,Sen. Kyl on the Senate floor relaying concerns heard from Arizonans about cuts in Medicare under the Democrats'... http://bit.ly/6sATar
6237957318,2009-12-01 15:31:51,senjonkyl,1,0,Facebook,New column on the fictional success of the Democrats' economic stimulus bill http://bit.ly/6rFWio
6201839693,2009-11-30 13:59:36,senjonkyl,0,0,Facebook,FOX News Sunday interview on the way to win in Afghanistan http://bit.ly/83nJtn
6053626387,2009-11-25 16:16:36,senjonkyl,1,0,Facebook,"Interview on the Barry Young Show on health care, Afghanistan, more... http://bit.ly/4Czj7O"
5985860434,2009-11-23 20:00:26,senjonkyl,0,0,Facebook,New column on civilian trials for terrorists http://bit.ly/08P9ouI
5957744650,2009-11-22 22:32:57,senjonkyl,0,0,Facebook,"""Face the Nation"" debate on the Senate ObamaCare bill http://bit.ly/5qOrwU"
5948059287,2009-11-22 15:40:02,senjonkyl,1,0,Facebook,Post-vote statement on measure to advance Senate ObamaCare bill http://bit.ly/59bJbr
5947900977,2009-11-22 15:32:12,senjonkyl,1,0,Facebook,Interview with CNBC's Larry Kudlow on the price paid to get all 60 Democrats to support Senate ObamaCare vote http://bit.ly/4LLVXJ
5903675432,2009-11-20 23:20:49,senjonkyl,2,0,Facebook,FNC interview previewing Saturday's vote on Senate ObamaCare bill http://bit.ly/084Yv7Q
