id,created_at,user,retweets,favorite_count,source,text
722467156546490368,2016-04-19 16:49:27,SenJohnThune,8,8,TweetDeck,"Important reforms that would protect consumers + enhance airline security pass the Senate, head to the House. https://t.co/wPzC64ZdF6 #FAA"
722446876121935873,2016-04-19 15:28:52,SenJohnThune,5,0,Twitter Web Client,RT @ArgusSports: .@argusmattz: #BostonMarathon doesn't disappoint for South Dakota runners. https://t.co/6szTvQbTJf https://t.co/L0ZleLwOWt
722431010428817408,2016-04-19 14:25:49,SenJohnThune,10,12,TweetDeck,The Senate is less than two hours away from voting on my bipartisan #FAA bill. You can learn more about it here: https://t.co/dT4Rjyq8kV
722177030410878976,2016-04-18 21:36:36,SenJohnThune,27,0,Twitter Web Client,"RT @SenateGOP: This year the average American will spend an entire workday, 8 hours, completing an individual tax return. #TaxDay https://t…"
721087122988523521,2016-04-15 21:25:41,SenJohnThune,7,20,Twitter Web Client,Dropped by the Coffee Cup in @HartfordSD. Always the best way to hear from South Dakotans about real issues. https://t.co/uTkDYy1XBB
721055240666136578,2016-04-15 19:19:00,SenJohnThune,1,3,Twitter Web Client,"Thanks for having me today, Brad. https://t.co/hzHpHvIcUO"
721026220729745409,2016-04-15 17:23:41,SenJohnThune,1,9,TweetDeck,My promise to you is to continue treating every dollar in Washington w/ the respect a hard-earned dollar deserves. https://t.co/IFhvIejh5k
721014638935150597,2016-04-15 16:37:40,SenJohnThune,4,16,Twitter Web Client,Warm welcome from @McCookCentral this morning! Toured the new construction and spoke to the students in Salem. https://t.co/06Ei7y4efN
720993438586384384,2016-04-15 15:13:25,SenJohnThune,6,9,Twitter for iPhone,Thanks Craig @MidcoSN  Katie's a rock star @GoJacksSDSU  https://t.co/rNJxRMPTJy
720710405669187585,2016-04-14 20:28:45,SenJohnThune,1,4,Twitter Web Client,"There’s a familiar face on this tourney program. Great #TBT photo, @SDHSBBHOF. https://t.co/5YY85254Jf"
720635078095859712,2016-04-14 15:29:26,SenJohnThune,1,5,TweetDeck,See my op-ed in @CNN explaining how the Republican-led Senate is working to make airports more secure. https://t.co/LIwClhZNmR #FAA
720597559333400576,2016-04-14 13:00:20,SenJohnThune,2,3,TweetDeck,"Today at 10 a.m. CT, I’ll have staff at Higher Grounds Coffee Co. in Howard for an ‘Outreach Hour.’ Feel free to drop by and chat."
720365728012980225,2016-04-13 21:39:07,SenJohnThune,19,17,TweetDeck,President Obama should not be playing politics with the security of the American people. https://t.co/lvpCnVui9H #Gitmo
720354574918246400,2016-04-13 20:54:48,SenJohnThune,3,9,TweetDeck,Great to see so many familiar faces at the #SunriseCoffee this morning. Sign up here: https://t.co/pbztEw2SnV https://t.co/6UhGLnETHt
720263418150658048,2016-04-13 14:52:35,SenJohnThune,15,0,Twitter Web Client,"RT @SenateCommerce: The #FAA reauthorization includes bipartisan security provisions to protect travelers from terrorism.
https://t.co/yGjq…"
720020491319320576,2016-04-12 22:47:17,SenJohnThune,5,21,Twitter Web Client,Honored to receive @narprail’s Golden Spike Award. Strengthening our transportation system will always be priority. https://t.co/XHJqmLLeaB
720003949886107648,2016-04-12 21:41:33,SenJohnThune,2,24,TweetDeck,"Meeting with South Dakotans helps me endure the long, busy days on Capitol Hill. Several productive meetings today. https://t.co/tMP56lV0uj"
719989635774951424,2016-04-12 20:44:40,SenJohnThune,28,35,Twitter Web Client,"We must keep Americans safe from future terrorist attacks. https://t.co/rRVVWZwnmG
https://t.co/gEOORzHN4O"
719895703523352577,2016-04-12 14:31:25,SenJohnThune,4,7,Twitter Web Client,"Powerful message. Thanks for sharing your story, @SenatorFischer. #EqualPayDay https://t.co/ZZNswz19pp"
719607185370693632,2016-04-11 19:24:57,SenJohnThune,23,0,TweetDeck,"RT @SenateCommerce: The future of aviation needs a plan - and we have one in the U.S. Senate that keeps airline passengers safe.
https://t.…"
718428128733962240,2016-04-08 13:19:48,SenJohnThune,24,33,TweetDeck,We can all learn a little something from the on- and off-court #GRITT demonstrated by @SDCoyotesWBB this season. https://t.co/ovZ10Wcmm3
718176940386041857,2016-04-07 20:41:40,SenJohnThune,6,8,TweetDeck,"Everyone knows @ovi8 loves breaking records, but did you know he’s breaking chairs now too? https://t.co/oDR4TwrP8d #tbt #NHL @MonSportsNet"
718171761636950020,2016-04-07 20:21:05,SenJohnThune,7,0,Twitter Web Client,RT @SenateCommerce: Exciting week in the Senate. @SenJohnThune moving forward on largest airport security upgrade in over a decade. https:/…
718159387609669632,2016-04-07 19:31:55,SenJohnThune,1,6,TweetDeck,Good discussion on working to #StopDiabetes with Gala from @AmDiabetesNESD today in D.C. https://t.co/MVM7f13G4X
718128527435042816,2016-04-07 17:29:17,SenJohnThune,8,22,TweetDeck,I’m glad the Senate adopted my amendment that will add important security enhancements to the bipartisan #FAA bill. https://t.co/Z1FQt4Ldrp
717821150605230080,2016-04-06 21:07:53,SenJohnThune,15,56,Twitter Web Client,How many Govs can you fit in one photo? Great meeting students from @TFRiggs today on the Hill w/ @CloseUp_DC. https://t.co/cKO535A81i
717796905519030273,2016-04-06 19:31:32,SenJohnThune,16,13,TweetDeck,New #FiduciaryRule is another example of Obama admin's top-down approach to governing that hurts the middle class. https://t.co/UuDA2yx6LK
717775688279961602,2016-04-06 18:07:14,SenJohnThune,9,14,TweetDeck,Introduced CHARITY Act with @RonWyden to encourage more Americans to give to charitable causes throughout the year. https://t.co/D0jFEhPAKW
717717782599753728,2016-04-06 14:17:08,SenJohnThune,1,0,Twitter Web Client,RT @SenateCommerce: WATCH LIVE: @TSA Administrator Peter Neffenger testifying at our hearing on transportation security https://t.co/Kv2Zrd…
717507050830323712,2016-04-06 00:19:46,SenJohnThune,3,6,Instagram,Getting ready for the bipartisan FAA reauthorization bill coming to the floor this week. Our… https://t.co/hDBrwjG3Ex
717439081186201600,2016-04-05 19:49:40,SenJohnThune,5,15,TweetDeck,Enjoyed meeting with the South Dakota Association of Nurse Anesthetists earlier today. https://t.co/bCq4RWp5dL
717409977946734593,2016-04-05 17:54:02,SenJohnThune,1,7,TweetDeck,Incremental progress in our fight against #ISIS is not enough. More can and should be done to defeat them. https://t.co/Wj4n8ebxcV
717383257063559168,2016-04-05 16:07:51,SenJohnThune,8,0,Twitter Web Client,"RT @SenateMajLdr: The #FAA bill wouldn't have gotten where it is w/o @SenJohnThune &amp; @SenBillNelson, who know what’s possible when the Sena…"
716786666963398656,2016-04-04 00:37:13,SenJohnThune,4,0,Twitter Web Client,RT @argusleader: Jake Aning’s first Purple Heart was pinned to his fatigues in Vietnam. It took 46 years to get his second. https://t.co/Jv…
716433696757145602,2016-04-03 01:14:38,SenJohnThune,4,8,Twitter for iPad,"Team Erickson, thanks for the hospitality! https://t.co/aY2NTOycUN"
716373165820104704,2016-04-02 21:14:06,SenJohnThune,68,196,Twitter for iPhone,History! National WNIT Champs!! Let that soak in. @SDCoyotesWBB  closes in style. Long live the DakotaDome. #GoYotes https://t.co/GF0TlSiHVn
716339534200332289,2016-04-02 19:00:28,SenJohnThune,5,27,Twitter for iPhone,It's go time! Unbelievable crowd here for  @SDCoyotesWBB Title Game. https://t.co/gE6XJYkbFr
716065176106053632,2016-04-02 00:50:16,SenJohnThune,4,26,Twitter for iPhone,With Maury Haugland @SDCoyotes '58 and Hal Thune(dad) @GopherSports '42. Two Murdo legends in the SDBB Hall of Fame. https://t.co/cBd9gYFNYZ
715998247488200705,2016-04-01 20:24:19,SenJohnThune,9,0,Twitter Web Client,RT @EmilySpartz: .@SenJohnThune presents Purple Heart award to Jake Aning #VietnamWar #veterans #American #UnitedStates @argusleader https:…
715998209835970561,2016-04-01 20:24:10,SenJohnThune,13,20,Twitter Web Client,"Honored to present Vietnam veteran Jake Aning with his second Purple Heart and NAM with Combat ""V"". #veterans https://t.co/9OlfENnrLE"
715989134599438344,2016-04-01 19:48:06,SenJohnThune,2,9,Twitter Web Client,Great lunch from Pappy's in @dtsiouxfalls today. Always a treat. https://t.co/JvwS0O6p1J
715960173601406978,2016-04-01 17:53:01,SenJohnThune,0,4,Twitter Web Client,Met with representatives from @sfairport &amp; local law enforcement agencies this morning to discuss airport security. https://t.co/TDboyD5yyn
715654607347834880,2016-03-31 21:38:49,SenJohnThune,3,23,Twitter Web Client,Thanks to members of the @RapidCityPD and @PENNCOSO for the ride along this afternoon. We appreciate your service. https://t.co/Mu1osmJGuC
715636496724848644,2016-03-31 20:26:51,SenJohnThune,5,17,Twitter Web Client,Joined Ellsworth AFB airmen this morning to view the second large force exercise to take place at the PRTC. https://t.co/QKr1U4tq17
715365493918400512,2016-03-31 02:29:59,SenJohnThune,24,96,Twitter for iPhone,"Congrats to @SDCoyotesWBB on a monster win! Way to shoot it. 5 down, 1 to go. Saturday. The Dome. For all the marbles. #WNIT #TitleTime"
715295030030823424,2016-03-30 21:49:59,SenJohnThune,1,9,Twitter Web Client,Stopped by the SD Technology Business Center to check out the updated space. Doing great work for SD entrepreneurs. https://t.co/leANUGsp2n
715283389163642883,2016-03-30 21:03:43,SenJohnThune,3,0,Twitter Web Client,"RT @SFNewTechHigh: We were HONORED to have US Senator John Thune speak to our Government students today about leadership,... https://t.co/D…"
715213453829541888,2016-03-30 16:25:50,SenJohnThune,5,0,Twitter Web Client,"RT @KealeySDPB: At @SFSchools New Tech high school, @SenJohnThune talks to government students. https://t.co/xayd634YuK"
714946276786176000,2016-03-29 22:44:10,SenJohnThune,19,125,Twitter for iPhone,Stopped by the @GoAugie celebration this afternoon to congratulate the team on a job well done. #AugieMadness https://t.co/cH1LjeCcaB
714925299134304257,2016-03-29 21:20:48,SenJohnThune,4,28,Twitter Web Client,Passed through Beresford this afternoon and visited with Mayor Fedderson and folks at city hall. https://t.co/zmY1Dm1I6B
714863921396469760,2016-03-29 17:16:55,SenJohnThune,4,0,Twitter for iPhone,RT @mariaa_lewiss: @jlauck1941 @emilydreeszen great day to be a yote! ❤️🐾 https://t.co/Zn7jVQoe1R
714860968396865537,2016-03-29 17:05:10,SenJohnThune,12,53,Twitter Web Client,Good to be back at @usd. Coffee in the student center and talking government process with a political theory class. https://t.co/b3fgetGUvu
714577967893098500,2016-03-28 22:20:38,SenJohnThune,8,16,Twitter Web Client,Spent some time checking out some of the ag technology that @RavenIndustries offers to our producers here in SD. https://t.co/uhQfwjwIVq
714279923284725760,2016-03-28 02:36:19,SenJohnThune,42,131,Twitter for iPhone,.@SDCoyotesWBB crushes it! Record DakotaDome crowd. This team brings it every night. 2 to go. #WNIT #FinalFour https://t.co/LF0m8QWAXK
714086999263682560,2016-03-27 13:49:42,SenJohnThune,29,138,Twitter Web Client,"Today we celebrate the good news: Christ died to save us, but now He is risen. Happy Easter from our family to yours!"
713840985243975680,2016-03-26 21:32:08,SenJohnThune,27,130,Twitter for iPhone,"National Champs!!! Another @AugieMensBball classic, they earned it. Bring that heat back to SD. #historymade https://t.co/KOPUxzSZwZ"
713741551705333760,2016-03-26 14:57:01,SenJohnThune,40,123,Twitter for iPhone,Good luck to @AugieMensBball in 1st ever @NCAADII Title Game on @CBSSports! Special Team. Historic Season. Bring it home. #layitontheline
713189787939635200,2016-03-25 02:24:30,SenJohnThune,11,35,Twitter for iPad,LOCKDOWN D. Game. Set. Match. @SDCoyotesWBB headed to Elite Eight! #WNIT #GoYotes
712118298318483460,2016-03-22 03:26:47,SenJohnThune,22,83,Twitter for iPhone,Soooo close. Gutsy effort by @GoJacksWBB. Played hard. Left it all on the court. Nothing to feel bad about when you do that. #SDProud
712014745507856387,2016-03-21 20:35:18,SenJohnThune,6,13,Twitter Web Client,Visited with Miller Elementary students this afternoon and ran into Mayor Blanchford while I was there. https://t.co/n97odYDQFB
711995838244003840,2016-03-21 19:20:10,SenJohnThune,6,0,Twitter Web Client,RT @agripulse: Agri-Pulse Open Mic:@SenJohnThune https://t.co/yWeVfHi7rK @SenPatRoberts @SenStabenow @POTUS #CropInsurance https://t.co/68m…
711985271357743104,2016-03-21 18:38:11,SenJohnThune,8,20,Twitter Web Client,Thanks to Redfield Energy for the tour of their plant and new Fiber Separation Technology this afternoon. #ethanol https://t.co/Lp0h65oPBp
711963259461640192,2016-03-21 17:10:43,SenJohnThune,12,20,Twitter Web Client,Always enjoy encouraging our future leaders. Visiting with students @HitchcockTulare this morning. https://t.co/4LDjFwCIWh
711683144294895616,2016-03-20 22:37:38,SenJohnThune,16,46,Twitter for iPhone,SD WBB teams keep rockin' it! Congrats to @SDCoyotesWBB on getting it done at Minnesota. Next up UNI. DakotaDome not done yet. #WNIT #Team
711355173503762432,2016-03-20 00:54:24,SenJohnThune,31,101,Twitter for iPhone,.@GoJacksWBB!! That's all. #MarchMadness
711223384579907585,2016-03-19 16:10:43,SenJohnThune,18,60,Twitter for iPhone,Would love to see a @GoJacksWBB rematch with Notre Dame in the #SweetSixteen. Let’s go Jacks! https://t.co/KjPRzpTJar
710996490831810560,2016-03-19 01:09:07,SenJohnThune,9,37,Twitter Web Client,Stopped by the @SDPBSports booth at the State Bs to talk basketball and other news of the day. https://t.co/yd4MXc1pyo
710977967967481856,2016-03-18 23:55:31,SenJohnThune,29,54,Twitter Web Client,Ran into some of the greats. A few former @NorthernStateU players taking in the State B tournament in Aberdeen. https://t.co/Wayb2EbooN
710965549874872320,2016-03-18 23:06:10,SenJohnThune,9,12,Twitter Web Client,Stopped by @HubCity_News and visited with my friend Don Briscoe. https://t.co/6QvPRjNOrr
710861674459303936,2016-03-18 16:13:25,SenJohnThune,8,40,TweetDeck,"My bracket’s already a little busted, but a @GoJacksMBB win could help me out. Good luck today, Jacks! #LetsDance https://t.co/zlya6BIUDQ"
710847394531971072,2016-03-18 15:16:40,SenJohnThune,1,4,TweetDeck,My bill would help stabilize access to important medical equipment like wheelchairs &amp; hospital beds in rural America https://t.co/MeWnGXmaFE
710519233470451713,2016-03-17 17:32:40,SenJohnThune,3,13,TweetDeck,"Helping me celebrate #NationalAgricultureWeek this year were farmers, ranchers &amp; agri-business reps from across SD. https://t.co/4vNjHCmhFH"
710458802303176705,2016-03-17 13:32:32,SenJohnThune,7,22,Twitter Web Client,"Need a little help with my bracket. Iowa or Temple? #MarchMadness #LetsDance @GoJacksMBB @GoJacksSDSU
https://t.co/9eSVJjvUjE"
710228273909919744,2016-03-16 22:16:30,SenJohnThune,11,13,Twitter Web Client,"Had a gr8 discussion with @ovi8 about my bill, the #PHITAct. Learn more about it here: https://t.co/WqDKd1zOpn https://t.co/O3NXMheJ5o"
710206581166772224,2016-03-16 20:50:18,SenJohnThune,5,0,Twitter Web Client,"RT @AgweekMagazine: In South Dakota, National Ag Day passes quietly https://t.co/2x5iZu1PGE https://t.co/f7LuUVtnnv"
710149363734024192,2016-03-16 17:02:56,SenJohnThune,7,18,TweetDeck,The American people deserve to have their voices heard on the nomination of the next U.S. Supreme Court justice. https://t.co/nHzR0bt2sW
709936543864061952,2016-03-16 02:57:16,SenJohnThune,19,60,Twitter for iPhone,Congrats to @GoAugie MBB on winning a trip to the Elite Eight! Monster season rolls on.
709856086610808836,2016-03-15 21:37:34,SenJohnThune,3,7,Twitter Web Client,"Following the demo, I led a @SenateCommerce hearing during which we examined this technology and what it means for consumers. (2/2)"
709855526167904256,2016-03-15 21:35:20,SenJohnThune,14,33,Twitter Web Client,Today I had the chance to see firsthand how self-driving vehicle technology can improve safety on our roads. (1/2) https://t.co/HtIORqQDnt
709839455469871104,2016-03-15 20:31:29,SenJohnThune,6,18,Twitter Web Client,What better way to celebrate #NationalAgDay than with a @NationalFFA member? https://t.co/CDZpeOf8ZU
709759446428336128,2016-03-15 15:13:33,SenJohnThune,21,27,TweetDeck,Happy #NationalAgricultureDay to all of our farmers and ranchers. Thank you for feeding the world. https://t.co/YuhVDnv0hJ
709492936787025923,2016-03-14 21:34:32,SenJohnThune,2,10,TweetDeck,I hope Congress will consider my bill to protect @mcfierce2012 and all our Olympic athletes from the IRS. https://t.co/mQtVAQMHix
709492606498185216,2016-03-14 21:33:13,SenJohnThune,6,12,TweetDeck,Congrats to Sturgis native @mcfierce2012 on qualifying for the 2016 Olympic Games! We know you will make SD proud. #RioBound
708425237340106752,2016-03-11 22:51:53,SenJohnThune,2,35,Twitter for iPhone,Winter/Spring? Boats?Love the view of the Missouri River near Chamberlain. Beautiful in every season. @SDOutdoors https://t.co/OralWhT31w
707986308778565633,2016-03-10 17:47:44,SenJohnThune,4,5,Twitter Web Client,"Bipartisan #CARA will help tackle the drug epidemic from all sides, which
is the only way we’re going to succeed. https://t.co/TwZALyIhnb"
707684210446897154,2016-03-09 21:47:18,SenJohnThune,9,9,Twitter Web Client,"Proud to work alongside @SenBillNelson to introduce bill to improve safety and
protect airline passengers. https://t.co/V0OsgpcHwJ"
707625259583713280,2016-03-09 17:53:03,SenJohnThune,9,7,Twitter Web Client,"The #MOBILENOW Act would take leaps forward in areas like technology, entertainment, public safety, &amp; health care.
https://t.co/F97CmT3AVH"
707420103298654208,2016-03-09 04:17:50,SenJohnThune,36,130,Twitter for iPhone,Ticket punched. That's what I'm talkin' about. GoJacksMBB @GoJacksWBB @SummitHoops
707389908923650049,2016-03-09 02:17:51,SenJohnThune,16,92,Twitter for iPhone,"Alright, let's do this. Stuck in DC, but it's still time for @GoJacksMBB @SummitHoops. https://t.co/J2OBmMVzqq"
707355328594116608,2016-03-09 00:00:27,SenJohnThune,20,58,TweetDeck,Big game for @GoJacksMBB tonight. Wish I could be there in person to cheer with the rest of the @GoJacksSDSU crowd. Good luck! #GoJacks
707251815176347648,2016-03-08 17:09:07,SenJohnThune,8,14,TweetDeck,"Appreciated getting the opportunity to chat with Wiyaka Little Spotted Horse, a strong advocate for @NIHB1. https://t.co/BJwG9M5uwH"
707228879350587393,2016-03-08 15:37:59,SenJohnThune,5,10,TweetDeck,"We should extend a warm welcome, not an #IRS tax bill, to returning #TeamUSA Olympic &amp; Paralympic medalists. https://t.co/mQtVAQMHix"
706532166218457088,2016-03-06 17:29:29,SenJohnThune,82,166,Twitter Web Client,"Nancy Reagan, who was admired by the nation, will be sorely missed. Condolences to the entire Reagan family."
706351416512684032,2016-03-06 05:31:15,SenJohnThune,8,30,Twitter for iPhone,Record crowd on hand at the Denny for big @GoJacksMBB come from behind win @thesummitleague tourney.  #MarchMadness https://t.co/3gjrcmHs3d
705826930843590656,2016-03-04 18:47:08,SenJohnThune,5,8,Twitter Web Client,Need help planning certain parts of your family vacation to D.C.? Let us help. More info in today’s column: https://t.co/LqOAA9cKoa
705808949770100737,2016-03-04 17:35:41,SenJohnThune,8,27,Twitter Web Client,Had the chance to catch up with the @AugieCRs this week in D.C. before they headed over to #CPAC. Great group! https://t.co/F503sIC78U
705448967170035713,2016-03-03 17:45:15,SenJohnThune,3,3,TweetDeck,My #MOBILENOW Act cleared an important @SenateCommerce hurdle today. It’s on to the Senate floor from here. https://t.co/ziS6OZgvg2
705431104300388355,2016-03-03 16:34:16,SenJohnThune,5,17,TweetDeck,Leading the nation in economic growth with some of the hardest-working people in America. https://t.co/bocHg2zvVT https://t.co/PKm0JyZ1PC
705108467602878467,2016-03-02 19:12:13,SenJohnThune,18,33,TweetDeck,"SD led the nation in economic growth thanks to agriculture, our state's top industry. https://t.co/PKm0JyZ1PC https://t.co/TMIn4XRhVP"
704820178949832704,2016-03-02 00:06:40,SenJohnThune,10,14,Twitter Web Client,"Republicans remain committed to combating illegal drug use &amp; supporting communities that are fighting this epidemic.
https://t.co/WKQEXrLlNz"
704795948875018240,2016-03-01 22:30:23,SenJohnThune,2,8,TweetDeck,Discussed veterans’ issues with the folks from South Dakota @VFWHQ – America’s true heroes. https://t.co/Io3p1a1PY0
704785591527940096,2016-03-01 21:49:13,SenJohnThune,5,9,TweetDeck,Productive meeting with @SanfordLab’s Mike Headley on progress toward cutting-edge neutrino science research in SD. https://t.co/nYnTr7a3ar
704378581758164992,2016-02-29 18:51:55,SenJohnThune,15,0,Twitter Web Client,RT @SenateCommerce: .@SenateCommerce is on Instagram! Learn why @SenJohnThune is proud to serve as chairman: https://t.co/ZCsZCASRn1 https:…
703775786906456065,2016-02-28 02:56:37,SenJohnThune,5,11,Twitter for iPhone,.@NSUWolves in NSIC Tourney action @SanfordPentagon after great @GoAugie @USF_Athletics shootout. Love tourney time. https://t.co/wktJBoTK8k
703630684217327616,2016-02-27 17:20:02,SenJohnThune,10,26,Twitter Web Client,Humbled to attend activation ceremony for the 196th Maneuver Enhancement Brigade. So proud of these heroes. #USA https://t.co/XWDuCIu5RD
703323301494575104,2016-02-26 20:58:36,SenJohnThune,2,9,TweetDeck,"Just finished chatting with students at Harrisburg North Middle School, including these student government leaders. https://t.co/B7Ws56DKq8"
703316728172957696,2016-02-26 20:32:29,SenJohnThune,1,6,TweetDeck,Had a great visit w/ @SFRotaryWest members today. Good discussion about all the big things happening in Washington. https://t.co/30iyCcxWvx
703283371036831744,2016-02-26 18:19:56,SenJohnThune,3,2,TweetDeck,"Check out today’s column to learn more about a new law that's a big win for consumers, producers, and innovators. https://t.co/oyZWiyiyZN"
702636348461686784,2016-02-24 23:28:54,SenJohnThune,2,11,TweetDeck,"Congrats to my fellow die-hard @packers fan on 3,500 shows – what an accomplishment, @greta. Here’s to 3,500 more! #Greta3500 #GoPackGo"
702633342005551105,2016-02-24 23:16:57,SenJohnThune,0,4,TweetDeck,"Good news: The trade enforcement bill, including several provisions I fought to include, was just signed into law. https://t.co/yD7nn0uirq"
702619112984412160,2016-02-24 22:20:25,SenJohnThune,2,2,TweetDeck,"To learn more about how you can attend the next #SunriseCoffee, check out my website: https://t.co/pbztEwktMv"
702618976103370753,2016-02-24 22:19:52,SenJohnThune,4,5,TweetDeck,Great turnout for today’s #SunriseCoffee. One of the perks of my job is connecting w/ South Dakotans visiting D.C. https://t.co/f3cZVf5oD9
702594833030975488,2016-02-24 20:43:56,SenJohnThune,4,11,TweetDeck,Nice to see my friends from @SDFarmBureau on the Hill this morning. #FBAdvocacy https://t.co/h3bNZJL4nR
702585433486663680,2016-02-24 20:06:35,SenJohnThune,38,0,Twitter Web Client,"RT @Senate_GOPs: The Obama economy continues to stall.
https://t.co/Kd8QAaB3A1"
702547419154784256,2016-02-24 17:35:32,SenJohnThune,4,7,TweetDeck,Congrats @LibraryCongress Veterans History Project on preserving 100k stories of American heroes. See my dad's story https://t.co/VRYbDrfvt0
702304499843485696,2016-02-24 01:30:15,SenJohnThune,5,15,TweetDeck,Nice to see folks from South Dakota @AmericanLegion this afternoon in D.C. https://t.co/lN0hbSVsIi
702278938157047808,2016-02-23 23:48:41,SenJohnThune,11,13,TweetDeck,"Discussed veterans issues with Joseph, Carol, Gaylord, and Loretta who are in D.C. with @DAVHQ. https://t.co/7BizL8aDBn"
702229999303180288,2016-02-23 20:34:13,SenJohnThune,8,24,TweetDeck,"Great meeting w/ Beresford Principal Kevin Nelson, @sydneycnelson, and @PatrickBinder12 on child nutrition issues. https://t.co/hfkP1XXa8r"
702199714389876736,2016-02-23 18:33:52,SenJohnThune,5,8,TweetDeck,Joined more than 200 members of Congress urging D.C. Circuit Court of Appeals to block EPA’s national energy tax. https://t.co/oZwWbfMYQt
702181492722704385,2016-02-23 17:21:28,SenJohnThune,45,40,TweetDeck,President Obama is putting American communities at risk with his plan to close #Gitmo &amp; move terrorists stateside. https://t.co/IUbf3RMNOl
700798811686326273,2016-02-19 21:47:11,SenJohnThune,8,14,Twitter Web Client,"Spoke to Simmons Elementary students about character, committing to excellence and being difference makers. https://t.co/X2myJ73nwz"
700792182454616064,2016-02-19 21:20:51,SenJohnThune,8,11,Twitter Web Client,"Talking rail issues, STB and transportation challenges with stakeholders from the region in Aberdeen this afternoon. https://t.co/yabum3B32o"
700779230779453440,2016-02-19 20:29:23,SenJohnThune,9,13,Twitter Web Client,Joined a few @NorthernStateU students and professors for lunch. Great discussion with future leaders. @NSUPoliSci https://t.co/0jhwj4ehfU
700760954393522178,2016-02-19 19:16:45,SenJohnThune,3,7,TweetDeck,Imagine a world in which things like the roads &amp; bridges we drive on become Internet-connected. More in my column: https://t.co/p2LznihMxN
700747832093839360,2016-02-19 18:24:37,SenJohnThune,5,18,Twitter for iPhone,Toured the Don and Carmen Meyer Center for Excellence in Aberdeen. Great to see Coach's legacy being carried on. https://t.co/7KEpsiUL6P
700433576676999168,2016-02-18 21:35:52,SenJohnThune,6,11,TweetDeck,"Interesting #TBT pic (circa 1925) predicts rise of #telehealth, which is critical to folks in rural America today. https://t.co/8bJVyv729B"
700359803579854850,2016-02-18 16:42:43,SenJohnThune,5,10,TweetDeck,Working hard w/ @CommerceGOP on bill to help deploy 5G network across America. Win for consumers &amp; businesses alike. https://t.co/7jw8eAq4UL
699246360978137092,2016-02-15 14:58:18,SenJohnThune,45,95,Twitter Web Client,"#PresidentsDay ""rocks"" in South Dakota. https://t.co/UbSvACQVuf"
