id,created_at,user,retweets,favorite_count,source,text
848947630252150784,2017-04-03 17:17:42,SenJohnThune,1,7,TweetDeck,"Congratulations to @RapidCityPD, named @ESGR #SecDefFreedomAward finalist. Thanks for your service and support of @SD_Guard."
848666123042267136,2017-04-02 22:39:05,SenJohnThune,8,46,Twitter Web Client,"Well beyond my playing days, but it was good to catch up with a fellow tubist and the rest of the band at today's… https://t.co/AAS6FZ4n88"
848622412413501440,2017-04-02 19:45:24,SenJohnThune,18,77,Twitter Web Client,It’s always a humbling experience to wish our troops good luck as they leave home. Thanks to @SD_Guard for all you… https://t.co/mKid92VKJ8
847981130124939264,2017-04-01 01:17:10,SenJohnThune,9,74,Twitter for iPhone,"Introduced Henley to her roots at Schmeckfest in Freeman, SD.  Great great grandpa Smokey Joe Mendel would be proud. https://t.co/d2gqgZmzMv"
847938180905127936,2017-03-31 22:26:30,SenJohnThune,10,23,Twitter Web Client,"Thanks to Steve Hohn, owner of @mdsmfg in Parkston, and Donny Zirpel, a 30-yr MDS employee, for the tour. Great com… https://t.co/EmK6KqjIeR"
847893765696008192,2017-03-31 19:30:01,SenJohnThune,9,15,TweetDeck,Reintroduced a bill with @MarkWarner that allows employers to assist employees with student loan debts. https://t.co/EKjCJGBiU9
847886146768183297,2017-03-31 18:59:45,SenJohnThune,1,9,TweetDeck,Supported a bill that would boost SD's tourism economy by helping seasonal workers better navigate the visa program. https://t.co/OZRK0pQkbS
847861203602997248,2017-03-31 17:20:38,SenJohnThune,20,70,TweetDeck,Neil Gorsuch's experience &amp; judicial philosophy make him the kind of judge I think most Americans want on the bench. https://t.co/dVtoozuTNI
847486018584313856,2017-03-30 16:29:47,SenJohnThune,12,37,Media Studio,Today I had the pleasure of introducing @sdsmt President Dr. Heather Wilson at her confirmation hearing for secreta… https://t.co/FQfRa6M3AE
847475857673158658,2017-03-30 15:49:24,SenJohnThune,8,10,TweetDeck,Glad my colleagues on the Agriculture Committee approved Gov. Perdue's nomination for @USDA secretary. Ag needs his… https://t.co/439JQLiW1c
847206600230273024,2017-03-29 21:59:28,SenJohnThune,3,16,TweetDeck,I had a great day meeting with South Dakotans who represent a wide range of groups and organizations in our state. https://t.co/dYgb5W3pDV
847184221068296192,2017-03-29 20:30:32,SenJohnThune,20,82,Twitter Web Client,Met with @CloseUp_DC students from Hartford and Pierre in the U.S. Capitol rotunda. https://t.co/MJvs3EmPMD
847172810816606208,2017-03-29 19:45:12,SenJohnThune,4,17,TweetDeck,Introduced a bill with @SenateCommerce colleagues that would improve cybersecurity resources for small businesses. https://t.co/7ofrTcWNjW
847158864395034624,2017-03-29 18:49:47,SenJohnThune,11,30,Media Studio,Glad to have @LakeAreaTech President Cartney testify before @SenateCommerce. I asked him how LATI prepares their st… https://t.co/nMBvnRFzJ6
847091579261214721,2017-03-29 14:22:25,SenJohnThune,2,0,Twitter Web Client,RT @LakeAreaTech: The @SenateCommerce hearing is underway now led by @SenJohnThune . Hear from @LakeAreaTech Pres @mikecartney soon! Link b…
846836229740118016,2017-03-28 21:27:45,SenJohnThune,5,14,TweetDeck,Discussed the urgent need for more predator control with the South Dakota Sheep Growers today. https://t.co/gBgtnT92np
846824453229219840,2017-03-28 20:40:57,SenJohnThune,4,28,TweetDeck,Caught up with the South Dakota Telecommunications Association this afternoon in D.C. https://t.co/a3zUlDuSjz
846795160482729984,2017-03-28 18:44:33,SenJohnThune,17,71,Twitter Web Client,I’m glad @POTUS is continuing to roll back burdensome Obama-era regs like the backdoor nat'l energy tax. Good news for consumers &amp; economy.
846751724731863044,2017-03-28 15:51:57,SenJohnThune,8,19,TweetDeck,Thanks for stopping by to talk about the importance of passing  the PHIT Act to encourage healthy lifestyles for al… https://t.co/g973sv7OTx
845366000690384896,2017-03-24 20:05:35,SenJohnThune,9,0,Twitter Web Client,RT @VASiouxFalls: Another South Dakota Veteran was remembered today when Senator John Thune presented VA volunteer Otto Logan with... https…
845353372190490626,2017-03-24 19:15:24,SenJohnThune,5,13,TweetDeck,"#AgWeek may be coming to an end, but my work on the next #farmbill is not. Check out my #ThuneFarmBill site here: https://t.co/yRSwX6zyOH"
845315767512043520,2017-03-24 16:45:58,SenJohnThune,9,65,Twitter Web Client,"Edward Logan made the ultimate sacrifice during the Korean War. Today his brother, Otto, accepted the Purple Heart… https://t.co/merjmjeWS7"
845309119351439364,2017-03-24 16:19:33,SenJohnThune,3,11,TweetDeck,"Read why I believe SD's top industry, agriculture, will be in good hands with Gov. Perdue at the helm of @USDA: https://t.co/GJlMxExazi"
845274695922601984,2017-03-24 14:02:46,SenJohnThune,34,81,TweetDeck,"I'm pleased @POTUS took quick action to authorize construction of the #KeystoneXL pipeline, which is good news for… https://t.co/EmeJqy79x5"
844975320100950016,2017-03-23 18:13:09,SenJohnThune,16,54,Media Studio,"After Gov Perdue's confirmation hearing, I know he's the right person to lead @USDA. I look forward to working w/ h… https://t.co/GHhcOSa6vi"
844651716528259073,2017-03-22 20:47:16,SenJohnThune,14,69,TweetDeck,Congrats to @ChrisBono and @GoJacksWrestle on an incredible season. https://t.co/zUJTjnnkzH
844649235559694336,2017-03-22 20:37:25,SenJohnThune,5,28,Media Studio,"We want to give people more choices so they can have greater access to quality care and see their premiums go down,… https://t.co/zT5fwWEubQ"
844569454382104576,2017-03-22 15:20:23,SenJohnThune,3,22,Media Studio,Joined @AmericaNewsroom to discuss the American Health Care Act and the confirmation of Judge Neil Gorsuch for SCOT… https://t.co/IEXnBXiTPf
844313229253918721,2017-03-21 22:22:15,SenJohnThune,39,88,TweetDeck,Congrats to South Dakotan Justin Elliot for winning gold at the @SpecialOlympics! Way to represent SD and #TeamUSA. https://t.co/Tcb7jJ3Y2F
844306830243319808,2017-03-21 21:56:49,SenJohnThune,51,0,Twitter Web Client,RT @SenateGOP: #GorsuchHearing Day 2: @SenJohnThune on why the Senate should #ConfirmGorsuch. https://t.co/JXsil7w6yW
844290400407969796,2017-03-21 20:51:32,SenJohnThune,13,40,TweetDeck,Congress has given the Trump administration a green light to proceed with space exploration and scientific discover… https://t.co/yjYa1T6S1k
844275198157295618,2017-03-21 19:51:07,SenJohnThune,1,11,TweetDeck,"On #AgDay, it's only fitting that I met w/ Dana, president of Outstanding Farmers of America, and his wife Julie (b… https://t.co/kyEMzNmlTy"
844256763255971840,2017-03-21 18:37:52,SenJohnThune,2,11,TweetDeck,Great meeting with South Dakota @ASCLS earlier today. https://t.co/OuxgxGNVep
844210035211362310,2017-03-21 15:32:11,SenJohnThune,16,41,TweetDeck,I'm proud to serve on @SenateAgGOP and represent South Dakota’s farmers and ranchers who work tirelessly to feed th… https://t.co/rZNoqI1sPS
843863092756930560,2017-03-20 16:33:34,SenJohnThune,13,29,TweetDeck,Kicking off #NationalAgWeek by thanking farmers and ranchers for providing safe and affordable food to families around the country.
843288699106484226,2017-03-19 02:31:08,SenJohnThune,23,92,Twitter for iPhone,Honored to help present the Spirit of Su Award to Devin Rihanek of Mt. Vernon/Plankinton tonight. Keep up the great… https://t.co/lBBX4L3AoW
842774522600312832,2017-03-17 16:27:58,SenJohnThune,8,24,Twitter Web Client,I'm working on a proposal that would make the American Health Care Act even stronger. Read more here --&gt; https://t.co/NADHUWzALr
842743858920390656,2017-03-17 14:26:08,SenJohnThune,95,0,Twitter Web Client,"RT @WSJ: As many Midwest cities slump, Sioux Falls soars https://t.co/OEI58fa6Vf"
842422643970191361,2017-03-16 17:09:44,SenJohnThune,14,34,Twitter Web Client,"""Thune wants more help for low income people in health care bill"" https://t.co/MrMpq3SZio via @RCJournal"
842411986080153600,2017-03-16 16:27:23,SenJohnThune,30,143,Twitter Web Client,"There’s no reason 2017 can’t be the year for a 16 vs. 1 upset – and if any team can deliver, it’s @GoJacksMBB.… https://t.co/yioMJQANPZ"
842106700597452800,2017-03-15 20:14:17,SenJohnThune,6,15,TweetDeck,Reintroduced a bill to create an independent oversight position for the Veterans Choice Act within @DeptVetAffairs. https://t.co/oK37LuPRhn
842081419673382916,2017-03-15 18:33:50,SenJohnThune,5,16,TweetDeck,"Glad @SenDanCoats has been confirmed as our DNI. Having served with him in the Senate, I know he is the right perso… https://t.co/u4oV61L0zs"
842062900281892865,2017-03-15 17:20:14,SenJohnThune,8,19,Media Studio,Joined @SquawkCNBC to discuss my #AHCA proposal that would provide relief to Americans who need it the most. https://t.co/F3MaDKC8YV
842058428436602882,2017-03-15 17:02:28,SenJohnThune,6,21,TweetDeck,"The grass is greener in Sioux Falls, S.D. – named one of America's happiest towns. https://t.co/YxVO29rxSZ"
841765926810877952,2017-03-14 21:40:10,SenJohnThune,5,30,TweetDeck,The nation’s best community college is in South Dakota. Big congrats to @LakeAreaTech! https://t.co/UvYnGVAR6t
841760901636206593,2017-03-14 21:20:12,SenJohnThune,13,24,TweetDeck,Productive meeting with South Dakota's @NAFISschools – a program that is very important to many schools across our… https://t.co/DiDw1Mokjp
841744921749000193,2017-03-14 20:16:42,SenJohnThune,7,16,Twitter Web Client,"""Thune proposal would means-test tax credits in House bill"" https://t.co/2PiYtL8Fon via @axios @caitlinnowens"
841701586195906568,2017-03-14 17:24:30,SenJohnThune,2,17,TweetDeck,"Glad @POTUS's EO aligns w/ my Freedom From Govt Competition Act. Jobs are created on Main Street, not in the govt. https://t.co/na00cgh34H"
840707378584682499,2017-03-11 23:33:53,SenJohnThune,9,65,Twitter for iPhone,Fellow Murdo native Frank Brost and wife Martha at his 80th bday party. Frank helped me get my start in politics. https://t.co/oQAyjadM2O
840684767251177473,2017-03-11 22:04:02,SenJohnThune,6,27,Twitter Web Client,Great crowd at the Sioux Empire Sportsmen's Show today in Sioux Falls. Something for everyone to enjoy. https://t.co/saAytNA5ko
840317792624738304,2017-03-10 21:45:48,SenJohnThune,7,14,Twitter Web Client,I received an update from USACE project managers on current conditions along the Missouri River in SD. https://t.co/xmxb5xLwml
840295512947490820,2017-03-10 20:17:16,SenJohnThune,10,29,TweetDeck,Unnecessary red tape prevents our economy from thriving. Read more about how these roadblocks slow economic growth: https://t.co/y2k9vELK0G
839897424625823744,2017-03-09 17:55:25,SenJohnThune,12,74,TweetDeck,These students road tripped to our nation's capital for spring break this year. I think that deserves some extra cr… https://t.co/uyTmXthiX7
839883348596121600,2017-03-09 16:59:29,SenJohnThune,19,52,Twitter Web Client,Lowering costs is my top priority in repealing &amp; replacing #Obamacare. Glad that our partners in the admin are comm… https://t.co/dxkCJxmqpi
839603089325899777,2017-03-08 22:25:50,SenJohnThune,7,27,TweetDeck,Great meeting with Terry from Paralyzed Veterans of America in D.C. today. @PVA1946 #VeteransMatter https://t.co/q9QZcdhVK2
839577717167255559,2017-03-08 20:45:01,SenJohnThune,7,23,TweetDeck,"Meeting with South Dakotans at the #SunriseCoffee is one of the highlights of my week. Today, even @SenJohnMcCain w… https://t.co/gxEQM876Du"
839536136980742149,2017-03-08 17:59:47,SenJohnThune,11,88,TweetDeck,Congrats @GoJacksMBB &amp; @coachotz on hard-fought Summit Champ! Great story of earned success. We know you'll make us proud in the Big Dance.
839231711162462209,2017-03-07 21:50:06,SenJohnThune,221,573,Media Studio,Looking forward to supporting Judge Neil Gorsuch’s nomination in the Senate. He’s the right person for the job.… https://t.co/GbukFUDxTs
839226607529263104,2017-03-07 21:29:49,SenJohnThune,16,21,TweetDeck,Reintroduced a bill with @SenSherrodBrown to simplify state income taxes for individuals working in multiple states. https://t.co/3LxSC8rpjE
838814486412865536,2017-03-06 18:12:12,SenJohnThune,4,53,Twitter Web Client,"S.D.’s @chadgreenway52 is a stand-up guy, both on and off the field. Wish him all the best in the next and exciting… https://t.co/GVneEMJBJg"
838573383809970176,2017-03-06 02:14:09,SenJohnThune,6,44,Twitter Web Client,Joined Jeff in the @MidcoSN booth during half time of the @GoJacksMBB game @thesummitleague this evening. Great hoo… https://t.co/Giyh5y1c3m
837784615268024320,2017-03-03 21:59:52,SenJohnThune,2,10,Twitter Web Client,Wouldn't miss a chance to stop @KORNNewsRadio and catch up with my friend @JPtheNewsguy. https://t.co/8y85ZnQ9mF
837773862079193089,2017-03-03 21:17:08,SenJohnThune,11,54,Twitter Web Client,The DWU/Avera Sports and Wellness Complex is a great asset for @DakotaWesleyan and Mitchell. Thanks for showing me… https://t.co/8fMFXvmyvx
837770511220371457,2017-03-03 21:03:49,SenJohnThune,5,0,Twitter Web Client,RT @SenateCommerce: .@SenJohnThune and @JerryMoran press @TeamUSA on protecting athletes after allegations of sex abuse https://t.co/r4b5L7…
837765558389080066,2017-03-03 20:44:08,SenJohnThune,7,22,Twitter Web Client,Toured the @AveraHealth Grassland Health Campus in Mitchell. Thanks to Ryan and everyone else for showing me the ne… https://t.co/46QDyHj1Ma
837757051354898435,2017-03-03 20:10:20,SenJohnThune,16,54,Twitter Web Client,Ran into the @rcstevensraider debate team @culvers in @Mitchell_SD over lunch today. Good luck at the State Debate… https://t.co/m0Lz3rVGLq
837733954912317440,2017-03-03 18:38:33,SenJohnThune,8,27,Twitter Web Client,My new and innovative #farmbill program would help family-owned farms in S.D. and around the country. https://t.co/BlTKBKQf7O #ThuneFarmBill
837677272177979392,2017-03-03 14:53:19,SenJohnThune,8,13,Twitter Web Client,“New proposal announced as work begins on 2018 farm bill” https://t.co/CRosYj0IdI via @dailyrepublic #ThuneFarmBill #FarmBill
837416392634810369,2017-03-02 21:36:41,SenJohnThune,7,25,TweetDeck,Reintroduced a bill to eliminate government competition with private industry and boost economic growth. https://t.co/na00cgh34H
837342128367882240,2017-03-02 16:41:35,SenJohnThune,11,33,Media Studio,"Unveiled a new income &amp; soil protection program for farmers, the first of many #farmbill proposals I'll introduce t… https://t.co/w8F4osTAKo"
837073753964171265,2017-03-01 22:55:09,SenJohnThune,14,39,Media Studio,Good to have @SDGovDaugaard in D.C. today testifying at our @SenateCommerce hearing on infrastructure access. https://t.co/OVPXPfgyzU
837063111513419778,2017-03-01 22:12:52,SenJohnThune,5,17,TweetDeck,Discussed some upcoming farm bill initiatives and ideas with the folks from @SDFarmBureau. #ThuneFarmBill https://t.co/LPGbWlkLI1
837047062407573506,2017-03-01 21:09:05,SenJohnThune,3,17,TweetDeck,Great meeting with the @SDBroadcasters in the Capitol today. https://t.co/9bKZ51Dff8
836989759868321795,2017-03-01 17:21:23,SenJohnThune,4,14,TweetDeck,Honored to receive @IAmBiotech's Industrial &amp; Environmental Legislator of the Year Award. #Biofuels https://t.co/6afmNriC62
836981874727792642,2017-03-01 16:50:03,SenJohnThune,6,15,TweetDeck,Reintro'd the PHIT Act – a bill that expands purchasing power using pre-tax dollars on qualified fitness expenses. https://t.co/F4CoqKgL7h
836971359112679424,2017-03-01 16:08:16,SenJohnThune,160,0,TweetDeck,RT @SenateGOP: The Senate has confirmed @RepRyanZinke as secretary of the @Interior. https://t.co/IIsYVxXGoo
836778522215649280,2017-03-01 03:22:00,SenJohnThune,507,2087,Media Studio,Tonight @POTUS highlighted his continued focus on tackling the issues that matter most to Americans. #JointSession https://t.co/NLZJBstC8L
836715329959112704,2017-02-28 23:10:54,SenJohnThune,11,31,Twitter Web Client,Busy day – had a lot of productive meetings with South Dakotans on a wide range of issues that are important to the… https://t.co/PIsiA7RicA
836702072900845568,2017-02-28 22:18:14,SenJohnThune,10,55,TweetDeck,Happy to hear @POTUS took an important first step in ditching WOTUS and keeping the federal government out of South Dakotans' backyards.
836609780559003648,2017-02-28 16:11:29,SenJohnThune,22,47,Media Studio,"Joined @AmericaNewsroom to discuss the need for an affordable, patient-centered, personalized health care system. https://t.co/EMkNdkwJlg"
836415416905908229,2017-02-28 03:19:09,SenJohnThune,10,163,Twitter for Android,Got some freestyle tips from @MichaelPhelps tonight. https://t.co/gXFOp0teBx
836375429376274432,2017-02-28 00:40:16,SenJohnThune,13,35,TweetDeck,Looking forward to working with Wilbur Ross as our next secretary of @CommerceGov. https://t.co/ICB7VNHuR2
836370003117092864,2017-02-28 00:18:42,SenJohnThune,24,87,Media Studio,"Our health care system wasn’t perfect before Obamacare, but Obamacare has just made things worse. https://t.co/x83G8s8wTF"
836068901742080000,2017-02-27 04:22:14,SenJohnThune,11,78,Twitter for iPhone,Not often I get to talk to @SDCoyotesWBB coach about how to beat a 1-3-1 zone. Thanks to Coach P and Jay for listen… https://t.co/yeasHvoAlR
835674923788091392,2017-02-26 02:16:42,SenJohnThune,7,35,Twitter Web Client,Some great college hoop action at the @SanfordPentagon today. Enjoyed some of the @NorthernSunConf tournament this… https://t.co/nKDLZXYNRK
835616960335470594,2017-02-25 22:26:23,SenJohnThune,10,40,Twitter Web Client,Wishing Winston some luck in the finals tonight at the South Dakota High School State Wrestling Tournament in Sioux… https://t.co/BNjrCmLXfc
835250768223567875,2017-02-24 22:11:16,SenJohnThune,13,51,TweetDeck,Read my op-ed in @argusleader explaining why Judge Neil Gorsuch is a good pick to serve on the Supreme Court. https://t.co/Uky7zBDeIs
835232443850448896,2017-02-24 20:58:27,SenJohnThune,5,24,TweetDeck,I won’t let unnecessary delays and obstruction get in the way of delivering for South Dakota. https://t.co/tueXHLgkMd
835181562182385664,2017-02-24 17:36:16,SenJohnThune,6,29,TweetDeck,"Congrats, and thank you for your commitment to closing the achievement gap and serving English learners in South Da… https://t.co/AjvTOoW8Sk"
833688914900578304,2017-02-20 14:45:01,SenJohnThune,12,120,TweetDeck,With the family (in warmer weather) at Mt. Rushmore – always a good way to remember &amp; honor some of our greatest pr… https://t.co/sSv2Wom2yv
833296058709053445,2017-02-19 12:43:56,SenJohnThune,2,29,Twitter for iPhone,And he has Murdo roots. Congrats to @dauminator24 and @GoJacksMBB https://t.co/GatuXcSsYe
832682028973711360,2017-02-17 20:04:00,SenJohnThune,4,41,TweetDeck,"For me, every day revolves around what’s most important to South Dakota, and I wouldn't have it any other way. https://t.co/g2FDBlycsQ"
832661943538315264,2017-02-17 18:44:12,SenJohnThune,12,48,TweetDeck,"My ag subcommittee slots approved today: Commodities, Livestock, and Rural Dev. Will position me well as we write the 2018 farm bill."
832240121554563072,2017-02-16 14:48:01,SenJohnThune,8,25,TweetDeck,Visited with South Dakota Ag and Rural Leadership this week on the Hill. Looking forward to receiving their farm bi… https://t.co/VGhK5RlG3W
832005365214674944,2017-02-15 23:15:11,SenJohnThune,4,42,TweetDeck,Good catching up with members of the Great Plains Tribes in the Capitol earlier today. https://t.co/IJtUzsNYaX
831990858547417088,2017-02-15 22:17:32,SenJohnThune,14,47,TweetDeck,"Met w/ @sdsmt Pres. Heather Wilson, nominee for secretary of the @usairforce. She understands issues that are impor… https://t.co/oETaUiXMii"
831984051242283009,2017-02-15 21:50:29,SenJohnThune,7,27,TweetDeck,Joined @SenatorRounds in reintroducing a bill to strengthen military families’ right to self-protection. https://t.co/2bdDUXutfX
831968071346769921,2017-02-15 20:47:00,SenJohnThune,5,39,TweetDeck,It was a pleasure meeting Glen Marshall today in D.C. His passion for youth development is an asset to the Boys &amp; G… https://t.co/kzeuaQOSE2
831940357906657280,2017-02-15 18:56:52,SenJohnThune,168,902,Media Studio,It's time for Senate Democrats to move beyond the 2016 election so we can get back to working for the American peop… https://t.co/nb4AVbACso
831629934959480832,2017-02-14 22:23:22,SenJohnThune,85,207,Media Studio,Democrats are not helping anyone by preventing the president from having a fully functioning administration. https://t.co/vm91ZGAX6C
831546498194227200,2017-02-14 16:51:49,SenJohnThune,4,24,TweetDeck,Met with @tfanative this morning in D.C. to hear about their great work in Bureau of Indian Education and tribal sc… https://t.co/DCS1KpdTeD
831322402667761664,2017-02-14 02:01:20,SenJohnThune,124,0,Twitter for Android,RT @SenateGOP: David Shulkin has been confirmed as secretary of veterans affairs. https://t.co/VpCklFT6RG
831302612532215808,2017-02-14 00:42:42,SenJohnThune,19,55,TweetDeck,Looking forward to working with Steve Mnuchin as our next @USTreasury secretary. https://t.co/7JCenZNM0w
831194499909025792,2017-02-13 17:33:06,SenJohnThune,6,49,TweetDeck,South Dakota lost one of its favorite cowboys. Sending my prayers to the family of former U.S. Rep. Clint Roberts.
830530006145187841,2017-02-11 21:32:38,SenJohnThune,14,108,Twitter Web Client,"My dad, a @GopherMBB alum, sharing some wisdom with @dauminator24. Great South Dakota showdown today. @GoJacksMBB… https://t.co/8YG26Mj7Ah"
830510537364631552,2017-02-11 20:15:16,SenJohnThune,6,52,Twitter Web Client,Stopped by the @MidcoSN booth to visit with my friend Jay during half time of a close @SDCoyotesMBB and @GoJacksMBB… https://t.co/IcX2tUhSSr
830481673007476736,2017-02-11 18:20:35,SenJohnThune,8,32,Twitter for iPhone,Huge crowd on hand this morning for the DTGCA Trophy Show in SF.  Chatted with lots of @NRA and 2A supporters. https://t.co/nd070HBfzv
830095080212008960,2017-02-10 16:44:24,SenJohnThune,6,37,Twitter Web Client,South Dakotans know the huge role ag plays in our daily lives – that's why my work on the next farm bill starts now. https://t.co/LX441uPbrE
830036923313963008,2017-02-10 12:53:18,SenJohnThune,14,47,TweetDeck,"Confirming Tom Price is an important step toward repealing &amp; replacing #Obamacare w/ personalized, patient-centered… https://t.co/9EtOy463Uk"
829792342546796547,2017-02-09 20:41:25,SenJohnThune,106,0,TweetDeck,"RT @SenateGOP: Congratulations to @AGLutherStrange, who was just sworn in as the new senator from Alabama. https://t.co/q7m77E5nZk"
829742420510330880,2017-02-09 17:23:03,SenJohnThune,16,59,Media Studio,Judge Gorsuch has proven to be independent and mainstream. He has the ability to judge with impartiality by calling… https://t.co/1w8rKAkZzC
829489781193244672,2017-02-09 00:39:09,SenJohnThune,43,156,TweetDeck,"With the confirmation of Jeff Sessions as U.S attorney general, the nation is gaining an ardent defender of ‘we the… https://t.co/8bp7plli1T"
829365997614354436,2017-02-08 16:27:17,SenJohnThune,16,54,Media Studio,Joined @Morning_Joe to discuss my meeting with Judge Gorsuch – an excellent judicial mind and superb nominee to ser… https://t.co/uc1h9cwmip
829350247625265153,2017-02-08 15:24:42,SenJohnThune,13,47,TweetDeck,"Met with secretary of @USDA nominee, Gov. Perdue. The Senate must act quickly to confirm him – many challenges ahea… https://t.co/DZ9yxhmtpv"
829109623349248000,2017-02-07 23:28:32,SenJohnThune,4,26,TweetDeck,No better time to meet with presidents from SD tribal colleges than National Tribal Colleges &amp; Universities Week. T… https://t.co/5tUStok79j
829092366275473409,2017-02-07 22:19:58,SenJohnThune,36,134,TweetDeck,"After meeting with Judge Gorsuch today, I have no doubt that he is outstandingly well-qualified to serve on the Sup… https://t.co/HiuJD9gKHA"
829080119616614404,2017-02-07 21:31:18,SenJohnThune,3,23,TweetDeck,Always a pleasure. https://t.co/6eHJ3gLqnU
829003100501528578,2017-02-07 16:25:15,SenJohnThune,10,32,TweetDeck,"You can also visit Wilder’s homestead in De Smet, South Dakota. https://t.co/p6ULlz4MJ7 https://t.co/8xuEw2T1Ot"
828702426471526401,2017-02-06 20:30:29,SenJohnThune,12,30,TweetDeck,"This week is National Tribal Colleges &amp; Universities Week, which recognizes the good work they do to help Native American students succeed."
827638702025408512,2017-02-03 22:03:38,SenJohnThune,10,93,Twitter for iPhone,Looks like a couple of future Senators. Sorry I missed @LincolnStuCo but glad DC is getting a little dose of Patrio… https://t.co/jgVTtWRhGX
827595987942252545,2017-02-03 19:13:54,SenJohnThune,9,32,Twitter Web Client,Reintroduced legislation with @SenatorRounds that would improve tribal veterans’ access to health care. https://t.co/P8IRrujpzO
827546218704281604,2017-02-03 15:56:08,SenJohnThune,12,53,Twitter Web Client,"I believe that if anyone can fill Justice Scalia’s shoes, Judge Neil Gorsuch can.
Read more in this week’s column: https://t.co/j1ZsDAlJpd"
827288988755050496,2017-02-02 22:53:59,SenJohnThune,8,32,Twitter Web Client,.@SenateMajLdr is exactly right when it comes to Judge Gorsuch’s qualifications to serve on the #SupremeCourt --&gt; https://t.co/8SDGv9ASbx
826921712990175238,2017-02-01 22:34:34,SenJohnThune,24,78,Media Studio,"Judge Gorsuch is a qualified, respected nominee and was confirmed unanimously by the Senate in 2006 when he was up… https://t.co/t3Hc4cr3gd"
826907135049158657,2017-02-01 21:36:38,SenJohnThune,4,18,TweetDeck,South Dakotans who are planning a visit to DC should check my website to learn how they can attend a #SunriseCoffee… https://t.co/mImVCJC0eN
826894824980742145,2017-02-01 20:47:43,SenJohnThune,18,82,Media Studio,"The Senate should act quickly to confirm Neil Gorsuch to the Supreme Court, and I hope Senate Democrats join us in… https://t.co/1liUCgt3Z7"
